"play_id","half","time_remaining_half","secs_remaining","description","home_score","away_score","away","home","home_favored_by","game_id"
41,1,"12:13",1933,"Henrik Jadersten missed Three Point Jumper.",7,12,"Santa Clara","Loyola Marymount",3,"400915821"
42,1,"12:13",1933,"Trevor Manuel Defensive Rebound.",7,12,"Santa Clara","Loyola Marymount",3,"400915821"
43,1,"11:57",1917,"Kelvin Amayo missed Jumper.",7,12,"Santa Clara","Loyola Marymount",3,"400915821"
44,1,"11:57",1917,"Kelvin Amayo Offensive Rebound.",7,12,"Santa Clara","Loyola Marymount",3,"400915821"
45,1,"11:54",1914,"Kelvin Amayo missed Two Point Tip Shot.",7,12,"Santa Clara","Loyola Marymount",3,"400915821"
46,1,"11:54",1914,"Nate Kratch Defensive Rebound.",7,12,"Santa Clara","Loyola Marymount",3,"400915821"
47,1,"11:40",1900,"Henrik Jadersten made Jumper.",7,14,"Santa Clara","Loyola Marymount",3,"400915821"
48,1,"11:20",1880,"Kelvin Amayo made Three Point Jumper. Assisted by Munis Tutu.",10,14,"Santa Clara","Loyola Marymount",3,"400915821"
49,1,"11:04",1864,"Nate Kratch Turnover.",10,14,"Santa Clara","Loyola Marymount",3,"400915821"
50,1,"11:04",1864,"Foul on Nate Kratch.",10,14,"Santa Clara","Loyola Marymount",3,"400915821"
51,1,"11:04",1864,"Official TV Timeout",10,14,"Santa Clara","Loyola Marymount",3,"400915821"
52,1,"10:41",1841,"Kelvin Amayo missed Layup.",10,14,"Santa Clara","Loyola Marymount",3,"400915821"
53,1,"10:41",1841,"Kai Healy Defensive Rebound.",10,14,"Santa Clara","Loyola Marymount",3,"400915821"
54,1,"10:24",1824,"KJ Feagin missed Jumper.",10,14,"Santa Clara","Loyola Marymount",3,"400915821"
55,1,"10:24",1824,"Kelvin Amayo Defensive Rebound.",10,14,"Santa Clara","Loyola Marymount",3,"400915821"
56,1,"10:17",1817,"Foul on KJ Feagin.",10,14,"Santa Clara","Loyola Marymount",3,"400915821"
57,1,"10:16",1816,"Stefan Jovanovic made Jumper. Assisted by Munis Tutu.",12,14,"Santa Clara","Loyola Marymount",3,"400915821"
58,1,"9:46",1786,"Jared Brownridge missed Layup.",12,14,"Santa Clara","Loyola Marymount",3,"400915821"
59,1,"9:46",1786,"Trevor Manuel Block.",12,14,"Santa Clara","Loyola Marymount",3,"400915821"
60,1,"9:46",1786,"Santa Clara Offensive Rebound.",12,14,"Santa Clara","Loyola Marymount",3,"400915821"
61,1,"9:45",1785,"Nate Kratch Turnover.",12,14,"Santa Clara","Loyola Marymount",3,"400915821"
62,1,"9:32",1772,"Kelvin Amayo missed Three Point Jumper.",12,14,"Santa Clara","Loyola Marymount",3,"400915821"
63,1,"9:32",1772,"KJ Feagin Defensive Rebound.",12,14,"Santa Clara","Loyola Marymount",3,"400915821"
64,1,"9:25",1765,"KJ Feagin Turnover.",12,14,"Santa Clara","Loyola Marymount",3,"400915821"
65,1,"9:25",1765,"Foul on KJ Feagin.",12,14,"Santa Clara","Loyola Marymount",3,"400915821"
66,1,"9:23",1763,"Steven Haney made Three Point Jumper. Assisted by Brandon Brown.",15,14,"Santa Clara","Loyola Marymount",3,"400915821"
67,1,"9:03",1743,"Jared Brownridge missed Jumper.",15,14,"Santa Clara","Loyola Marymount",3,"400915821"
68,1,"9:03",1743,"Brandon Brown Defensive Rebound.",15,14,"Santa Clara","Loyola Marymount",3,"400915821"
69,1,"8:46",1726,"Stefan Jovanovic Turnover.",15,14,"Santa Clara","Loyola Marymount",3,"400915821"
70,1,"8:45",1725,"KJ Feagin Steal.",15,14,"Santa Clara","Loyola Marymount",3,"400915821"
71,1,"8:43",1723,"KJ Feagin made Layup.",15,16,"Santa Clara","Loyola Marymount",3,"400915821"
72,1,"8:22",1702,"Steven Haney missed Three Point Jumper.",15,16,"Santa Clara","Loyola Marymount",3,"400915821"
73,1,"8:22",1702,"Kai Healy Defensive Rebound.",15,16,"Santa Clara","Loyola Marymount",3,"400915821"
74,1,"8:16",1696,"Nate Kratch Turnover.",15,16,"Santa Clara","Loyola Marymount",3,"400915821"
75,1,"8:11",1691,"Brandon Brown Steal.",15,16,"Santa Clara","Loyola Marymount",3,"400915821"
76,1,"7:57",1677,"Brandon Brown made Three Point Jumper. Assisted by Shamar Johnson.",18,16,"Santa Clara","Loyola Marymount",3,"400915821"
77,1,"7:46",1666,"Foul on Brandon Brown.",18,16,"Santa Clara","Loyola Marymount",3,"400915821"
78,1,"7:46",1666,"Official TV Timeout",18,16,"Santa Clara","Loyola Marymount",3,"400915821"
79,1,"7:31",1651,"Nate Kratch made Layup.",18,18,"Santa Clara","Loyola Marymount",3,"400915821"
80,1,"7:09",1629,"Shamar Johnson Turnover.",18,18,"Santa Clara","Loyola Marymount",3,"400915821"
81,1,"7:09",1629,"Foul on Shamar Johnson.",18,18,"Santa Clara","Loyola Marymount",3,"400915821"
82,1,"7:01",1621,"KJ Feagin missed Layup.",18,18,"Santa Clara","Loyola Marymount",3,"400915821"
83,1,"7:01",1621,"Erik Johansson Defensive Rebound.",18,18,"Santa Clara","Loyola Marymount",3,"400915821"
84,1,"6:50",1610,"Foul on Emmanuel Ndumanya.",18,18,"Santa Clara","Loyola Marymount",3,"400915821"
85,1,"6:29",1589,"Munis Tutu made Layup. Assisted by Kelvin Amayo.",20,18,"Santa Clara","Loyola Marymount",3,"400915821"
86,1,"6:14",1574,"KJ Feagin made Jumper.",20,20,"Santa Clara","Loyola Marymount",3,"400915821"
87,1,"5:55",1555,"Kelvin Amayo made Layup. Assisted by Shamar Johnson.",22,20,"Santa Clara","Loyola Marymount",3,"400915821"
88,1,"5:55",1555,"Foul on Kai Healy.",22,20,"Santa Clara","Loyola Marymount",3,"400915821"
89,1,"5:55",1555,"Kelvin Amayo missed Free Throw.",22,20,"Santa Clara","Loyola Marymount",3,"400915821"
90,1,"5:55",1555,"Nate Kratch Defensive Rebound.",22,20,"Santa Clara","Loyola Marymount",3,"400915821"
91,1,"5:38",1538,"Kai Healy missed Three Point Jumper.",22,20,"Santa Clara","Loyola Marymount",3,"400915821"
92,1,"5:38",1538,"Kelvin Amayo Defensive Rebound.",22,20,"Santa Clara","Loyola Marymount",3,"400915821"
93,1,"5:27",1527,"Shamar Johnson missed Layup.",22,20,"Santa Clara","Loyola Marymount",3,"400915821"
94,1,"5:27",1527,"Nate Kratch Defensive Rebound.",22,20,"Santa Clara","Loyola Marymount",3,"400915821"
95,1,"5:18",1518,"Jared Brownridge missed Three Point Jumper.",22,20,"Santa Clara","Loyola Marymount",3,"400915821"
96,1,"5:18",1518,"Kelvin Amayo Defensive Rebound.",22,20,"Santa Clara","Loyola Marymount",3,"400915821"
97,1,"4:54",1494,"Munis Tutu missed Three Point Jumper.",22,20,"Santa Clara","Loyola Marymount",3,"400915821"
98,1,"4:54",1494,"KJ Feagin Defensive Rebound.",22,20,"Santa Clara","Loyola Marymount",3,"400915821"
99,1,"4:46",1486,"Foul on Brandon Brown.",22,20,"Santa Clara","Loyola Marymount",3,"400915821"
100,1,"4:37",1477,"KJ Feagin missed Three Point Jumper.",22,20,"Santa Clara","Loyola Marymount",3,"400915821"
101,1,"4:37",1477,"Stefan Jovanovic Defensive Rebound.",22,20,"Santa Clara","Loyola Marymount",3,"400915821"
102,1,"4:19",1459,"Trevor Manuel missed Jumper.",22,20,"Santa Clara","Loyola Marymount",3,"400915821"
103,1,"4:19",1459,"Nate Kratch Defensive Rebound.",22,20,"Santa Clara","Loyola Marymount",3,"400915821"
104,1,"4:10",1450,"Nate Kratch made Three Point Jumper. Assisted by KJ Feagin.",22,23,"Santa Clara","Loyola Marymount",3,"400915821"
105,1,"3:47",1427,"Stefan Jovanovic made Layup. Assisted by Brandon Brown.",24,23,"Santa Clara","Loyola Marymount",3,"400915821"
106,1,"3:25",1405,"Jared Brownridge made Three Point Jumper. Assisted by Nate Kratch.",24,26,"Santa Clara","Loyola Marymount",3,"400915821"
107,1,"3:08",1388,"Brandon Brown missed Three Point Jumper.",24,26,"Santa Clara","Loyola Marymount",3,"400915821"
108,1,"3:08",1388,"Santa Clara Defensive Rebound.",24,26,"Santa Clara","Loyola Marymount",3,"400915821"
109,1,"3:02",1382,"Official TV Timeout",24,26,"Santa Clara","Loyola Marymount",3,"400915821"
110,1,"2:39",1359,"Nate Kratch made Layup.",24,28,"Santa Clara","Loyola Marymount",3,"400915821"
111,1,"2:11",1331,"Jeffery McClendon made Layup. Assisted by Trevor Manuel.",26,28,"Santa Clara","Loyola Marymount",3,"400915821"
112,1,"1:40",1300,"KJ Feagin missed Jumper.",26,28,"Santa Clara","Loyola Marymount",3,"400915821"
113,1,"1:40",1300,"Shamar Johnson Defensive Rebound.",26,28,"Santa Clara","Loyola Marymount",3,"400915821"
114,1,"1:27",1287,"Trevor Manuel missed Jumper.",26,28,"Santa Clara","Loyola Marymount",3,"400915821"
115,1,"1:27",1287,"Henrik Jadersten Defensive Rebound.",26,28,"Santa Clara","Loyola Marymount",3,"400915821"
116,1,"1:12",1272,"Kai Healy missed Jumper.",26,28,"Santa Clara","Loyola Marymount",3,"400915821"
117,1,"1:12",1272,"Trevor Manuel Defensive Rebound.",26,28,"Santa Clara","Loyola Marymount",3,"400915821"
118,1,"0:48",1248,"Shamar Johnson missed Jumper.",26,28,"Santa Clara","Loyola Marymount",3,"400915821"
119,1,"0:48",1248,"Shamar Johnson Offensive Rebound.",26,28,"Santa Clara","Loyola Marymount",3,"400915821"
120,1,"0:45",1245,"Shamar Johnson made Layup.",28,28,"Santa Clara","Loyola Marymount",3,"400915821"
121,1,"0:36",1236,"Henrik Jadersten missed Three Point Jumper.",28,28,"Santa Clara","Loyola Marymount",3,"400915821"
122,1,"0:36",1236,"Kai Healy Offensive Rebound.",28,28,"Santa Clara","Loyola Marymount",3,"400915821"
123,1,"0:32",1232,"Jared Brownridge missed Three Point Jumper.",28,28,"Santa Clara","Loyola Marymount",3,"400915821"
124,1,"0:32",1232,"Steven Haney Defensive Rebound.",28,28,"Santa Clara","Loyola Marymount",3,"400915821"
125,1,"0:08",1208,"Shamar Johnson Turnover.",28,28,"Santa Clara","Loyola Marymount",3,"400915821"
126,1,"0:08",1208,"Foul on Shamar Johnson.",28,28,"Santa Clara","Loyola Marymount",3,"400915821"
127,1,"0:08",1208,"Santa Clara  Timeout",28,28,"Santa Clara","Loyola Marymount",3,"400915821"
128,1,"0:02",1202,"KJ Feagin missed Layup.",28,28,"Santa Clara","Loyola Marymount",3,"400915821"
129,1,"0:02",1202,"Petr Herman Block.",28,28,"Santa Clara","Loyola Marymount",3,"400915821"
130,1,"0:01",1201,"Petr Herman Defensive Rebound.",28,28,"Santa Clara","Loyola Marymount",3,"400915821"
131,1,"0:00",1200,"End of 1st half",28,28,"Santa Clara","Loyola Marymount",3,"400915821"
132,2,"20:00",1200,"PLAY",28,28,"Santa Clara","Loyola Marymount",3,"400915821"
133,2,"19:43",1183,"Stefan Jovanovic missed Layup.",28,28,"Santa Clara","Loyola Marymount",3,"400915821"
134,2,"19:43",1183,"Stefan Jovanovic Offensive Rebound.",28,28,"Santa Clara","Loyola Marymount",3,"400915821"
135,2,"19:32",1172,"Shamar Johnson missed Jumper.",28,28,"Santa Clara","Loyola Marymount",3,"400915821"
136,2,"19:32",1172,"Nate Kratch Defensive Rebound.",28,28,"Santa Clara","Loyola Marymount",3,"400915821"
137,2,"19:17",1157,"Nate Kratch Turnover.",28,28,"Santa Clara","Loyola Marymount",3,"400915821"
138,2,"18:52",1132,"Brandon Brown missed Jumper.",28,28,"Santa Clara","Loyola Marymount",3,"400915821"
139,2,"18:52",1132,"Shamar Johnson Offensive Rebound.",28,28,"Santa Clara","Loyola Marymount",3,"400915821"
140,2,"18:49",1129,"Shamar Johnson made Layup.",30,28,"Santa Clara","Loyola Marymount",3,"400915821"
141,2,"18:33",1113,"Nate Kratch missed Jumper.",30,28,"Santa Clara","Loyola Marymount",3,"400915821"
142,2,"18:33",1113,"Brandon Brown Defensive Rebound.",30,28,"Santa Clara","Loyola Marymount",3,"400915821"
143,2,"18:19",1099,"Stefan Jovanovic made Jumper. Assisted by Brandon Brown.",32,28,"Santa Clara","Loyola Marymount",3,"400915821"
144,2,"17:58",1078,"Nate Kratch missed Three Point Jumper.",32,28,"Santa Clara","Loyola Marymount",3,"400915821"
145,2,"17:58",1078,"Emmanuel Ndumanya Offensive Rebound.",32,28,"Santa Clara","Loyola Marymount",3,"400915821"
146,2,"17:47",1067,"Foul on Stefan Jovanovic.",32,28,"Santa Clara","Loyola Marymount",3,"400915821"
147,2,"17:47",1067,"Nate Kratch missed Free Throw.",32,28,"Santa Clara","Loyola Marymount",3,"400915821"
148,2,"17:47",1067,"Santa Clara Deadball Team Rebound.",32,28,"Santa Clara","Loyola Marymount",3,"400915821"
149,2,"17:47",1067,"Nate Kratch made Free Throw.",32,29,"Santa Clara","Loyola Marymount",3,"400915821"
150,2,"17:26",1046,"Shamar Johnson made Layup. Assisted by Brandon Brown.",34,29,"Santa Clara","Loyola Marymount",3,"400915821"
151,2,"17:26",1046,"Foul on Emmanuel Ndumanya.",34,29,"Santa Clara","Loyola Marymount",3,"400915821"
152,2,"17:26",1046,"Shamar Johnson made Free Throw.",35,29,"Santa Clara","Loyola Marymount",3,"400915821"
153,2,"16:58",1018,"Nate Kratch missed Three Point Jumper.",35,29,"Santa Clara","Loyola Marymount",3,"400915821"
154,2,"16:58",1018,"Kelvin Amayo Defensive Rebound.",35,29,"Santa Clara","Loyola Marymount",3,"400915821"
155,2,"16:45",1005,"Erik Johansson Turnover.",35,29,"Santa Clara","Loyola Marymount",3,"400915821"
156,2,"16:28",988,"Jared Brownridge missed Three Point Jumper.",35,29,"Santa Clara","Loyola Marymount",3,"400915821"
157,2,"16:28",988,"Shamar Johnson Defensive Rebound.",35,29,"Santa Clara","Loyola Marymount",3,"400915821"
158,2,"16:21",981,"Foul on KJ Feagin.",35,29,"Santa Clara","Loyola Marymount",3,"400915821"
159,2,"16:03",963,"Shamar Johnson missed Layup.",35,29,"Santa Clara","Loyola Marymount",3,"400915821"
160,2,"16:03",963,"Nate Kratch Defensive Rebound.",35,29,"Santa Clara","Loyola Marymount",3,"400915821"
161,2,"15:56",956,"KJ Feagin missed Three Point Jumper.",35,29,"Santa Clara","Loyola Marymount",3,"400915821"
162,2,"15:56",956,"Emmanuel Ndumanya Offensive Rebound.",35,29,"Santa Clara","Loyola Marymount",3,"400915821"
163,2,"15:50",950,"Foul on Stefan Jovanovic.",35,29,"Santa Clara","Loyola Marymount",3,"400915821"
164,2,"15:50",950,"Official TV Timeout",35,29,"Santa Clara","Loyola Marymount",3,"400915821"
165,2,"15:50",950,"Emmanuel Ndumanya made Free Throw.",35,30,"Santa Clara","Loyola Marymount",3,"400915821"
166,2,"15:50",950,"Emmanuel Ndumanya made Free Throw.",35,31,"Santa Clara","Loyola Marymount",3,"400915821"
167,2,"15:34",934,"Trevor Manuel missed Layup.",35,31,"Santa Clara","Loyola Marymount",3,"400915821"
168,2,"15:34",934,"Nate Kratch Defensive Rebound.",35,31,"Santa Clara","Loyola Marymount",3,"400915821"
169,2,"15:07",907,"Foul on Mattias Markusson.",35,31,"Santa Clara","Loyola Marymount",3,"400915821"
170,2,"15:07",907,"Emmanuel Ndumanya missed Free Throw.",35,31,"Santa Clara","Loyola Marymount",3,"400915821"
171,2,"15:07",907,"Santa Clara Deadball Team Rebound.",35,31,"Santa Clara","Loyola Marymount",3,"400915821"
172,2,"15:07",907,"Emmanuel Ndumanya made Free Throw.",35,32,"Santa Clara","Loyola Marymount",3,"400915821"
173,2,"14:44",884,"Mattias Markusson missed Layup.",35,32,"Santa Clara","Loyola Marymount",3,"400915821"
174,2,"14:44",884,"Nate Kratch Defensive Rebound.",35,32,"Santa Clara","Loyola Marymount",3,"400915821"
175,2,"14:28",868,"Emmanuel Ndumanya made Layup. Assisted by Nate Kratch.",35,34,"Santa Clara","Loyola Marymount",3,"400915821"
176,2,"14:10",850,"Mattias Markusson made Layup. Assisted by Kelvin Amayo.",37,34,"Santa Clara","Loyola Marymount",3,"400915821"
177,2,"13:46",826,"Nate Kratch made Jumper.",37,36,"Santa Clara","Loyola Marymount",3,"400915821"
178,2,"13:30",810,"Foul on Jared Brownridge.",37,36,"Santa Clara","Loyola Marymount",3,"400915821"
179,2,"13:21",801,"Brandon Brown made Layup.",39,36,"Santa Clara","Loyola Marymount",3,"400915821"
180,2,"13:03",783,"Kai Healy Turnover.",39,36,"Santa Clara","Loyola Marymount",3,"400915821"
181,2,"13:01",781,"Brandon Brown Steal.",39,36,"Santa Clara","Loyola Marymount",3,"400915821"
182,2,"12:54",774,"Brandon Brown missed Layup.",39,36,"Santa Clara","Loyola Marymount",3,"400915821"
183,2,"12:54",774,"Emmanuel Ndumanya Block.",39,36,"Santa Clara","Loyola Marymount",3,"400915821"
184,2,"12:52",772,"Kai Healy Defensive Rebound.",39,36,"Santa Clara","Loyola Marymount",3,"400915821"
185,2,"12:43",763,"KJ Feagin made Layup.",39,38,"Santa Clara","Loyola Marymount",3,"400915821"
186,2,"12:22",742,"Kelvin Amayo made Jumper.",41,38,"Santa Clara","Loyola Marymount",3,"400915821"
187,2,"12:02",722,"Nate Kratch made Jumper. Assisted by KJ Feagin.",41,40,"Santa Clara","Loyola Marymount",3,"400915821"
188,2,"11:51",711,"Stefan Jovanovic made Jumper. Assisted by Brandon Brown.",43,40,"Santa Clara","Loyola Marymount",3,"400915821"
189,2,"11:36",696,"Emmanuel Ndumanya made Layup. Assisted by KJ Feagin.",43,42,"Santa Clara","Loyola Marymount",3,"400915821"
190,2,"11:13",673,"Steven Haney missed Jumper.",43,42,"Santa Clara","Loyola Marymount",3,"400915821"
191,2,"11:13",673,"KJ Feagin Defensive Rebound.",43,42,"Santa Clara","Loyola Marymount",3,"400915821"
192,2,"11:02",662,"Foul on Brandon Brown.",43,42,"Santa Clara","Loyola Marymount",3,"400915821"
193,2,"11:02",662,"Official TV Timeout",43,42,"Santa Clara","Loyola Marymount",3,"400915821"
194,2,"10:52",652,"Jared Brownridge missed Three Point Jumper.",43,42,"Santa Clara","Loyola Marymount",3,"400915821"
195,2,"10:52",652,"Munis Tutu Defensive Rebound.",43,42,"Santa Clara","Loyola Marymount",3,"400915821"
196,2,"10:37",637,"Stefan Jovanovic made Jumper.",45,42,"Santa Clara","Loyola Marymount",3,"400915821"
197,2,"10:29",629,"Foul on Jeffery McClendon.",45,42,"Santa Clara","Loyola Marymount",3,"400915821"
198,2,"10:18",618,"KJ Feagin Turnover.",45,42,"Santa Clara","Loyola Marymount",3,"400915821"
199,2,"10:18",618,"Jeffery McClendon Steal.",45,42,"Santa Clara","Loyola Marymount",3,"400915821"
200,2,"10:18",618,"Foul on Nate Kratch.",45,42,"Santa Clara","Loyola Marymount",3,"400915821"
201,2,"9:59",599,"Stefan Jovanovic made Layup. Assisted by Munis Tutu.",47,42,"Santa Clara","Loyola Marymount",3,"400915821"
202,2,"9:50",590,"Foul on Jeffery McClendon.",47,42,"Santa Clara","Loyola Marymount",3,"400915821"
203,2,"9:29",569,"KJ Feagin missed Three Point Jumper.",47,42,"Santa Clara","Loyola Marymount",3,"400915821"
204,2,"9:29",569,"Shamar Johnson Defensive Rebound.",47,42,"Santa Clara","Loyola Marymount",3,"400915821"
205,2,"9:10",550,"Stefan Jovanovic Turnover.",47,42,"Santa Clara","Loyola Marymount",3,"400915821"
206,2,"9:09",549,"Kai Healy Steal.",47,42,"Santa Clara","Loyola Marymount",3,"400915821"
207,2,"9:06",546,"KJ Feagin missed Layup.",47,42,"Santa Clara","Loyola Marymount",3,"400915821"
208,2,"9:06",546,"Kelvin Amayo Block.",47,42,"Santa Clara","Loyola Marymount",3,"400915821"
209,2,"9:04",544,"Kai Healy Offensive Rebound.",47,42,"Santa Clara","Loyola Marymount",3,"400915821"
210,2,"9:02",542,"Kai Healy made Layup.",47,44,"Santa Clara","Loyola Marymount",3,"400915821"
211,2,"8:52",532,"Munis Tutu missed Jumper.",47,44,"Santa Clara","Loyola Marymount",3,"400915821"
212,2,"8:52",532,"Emmanuel Ndumanya Defensive Rebound.",47,44,"Santa Clara","Loyola Marymount",3,"400915821"
213,2,"8:46",526,"Nate Kratch made Dunk. Assisted by KJ Feagin.",47,46,"Santa Clara","Loyola Marymount",3,"400915821"
214,2,"8:44",524,"Loyola Marymount  Timeout",47,46,"Santa Clara","Loyola Marymount",3,"400915821"
215,2,"8:17",497,"Kelvin Amayo missed Three Point Jumper.",47,46,"Santa Clara","Loyola Marymount",3,"400915821"
216,2,"8:17",497,"Jared Brownridge Defensive Rebound.",47,46,"Santa Clara","Loyola Marymount",3,"400915821"
217,2,"8:02",482,"Jared Brownridge Turnover.",47,46,"Santa Clara","Loyola Marymount",3,"400915821"
218,2,"8:02",482,"Foul on Jared Brownridge.",47,46,"Santa Clara","Loyola Marymount",3,"400915821"
219,2,"7:37",457,"Munis Tutu made Layup.",49,46,"Santa Clara","Loyola Marymount",3,"400915821"
220,2,"7:10",430,"Nate Kratch made Jumper.",49,48,"Santa Clara","Loyola Marymount",3,"400915821"
221,2,"6:40",400,"Foul on Emmanuel Ndumanya.",49,48,"Santa Clara","Loyola Marymount",3,"400915821"
222,2,"6:40",400,"Official TV Timeout",49,48,"Santa Clara","Loyola Marymount",3,"400915821"
223,2,"6:28",388,"Shamar Johnson made Layup.",51,48,"Santa Clara","Loyola Marymount",3,"400915821"
224,2,"6:28",388,"Foul on Emmanuel Ndumanya.",51,48,"Santa Clara","Loyola Marymount",3,"400915821"
225,2,"6:28",388,"Shamar Johnson made Free Throw.",52,48,"Santa Clara","Loyola Marymount",3,"400915821"
226,2,"6:13",373,"Foul on Brandon Brown.",52,48,"Santa Clara","Loyola Marymount",3,"400915821"
227,2,"6:13",373,"Jared Brownridge made Free Throw.",52,49,"Santa Clara","Loyola Marymount",3,"400915821"
228,2,"6:13",373,"Jared Brownridge made Free Throw.",52,50,"Santa Clara","Loyola Marymount",3,"400915821"
229,2,"5:48",348,"Shamar Johnson missed Layup.",52,50,"Santa Clara","Loyola Marymount",3,"400915821"
230,2,"5:48",348,"Jeffery McClendon Offensive Rebound.",52,50,"Santa Clara","Loyola Marymount",3,"400915821"
231,2,"5:45",345,"Jeffery McClendon missed Layup.",52,50,"Santa Clara","Loyola Marymount",3,"400915821"
232,2,"5:45",345,"Shamar Johnson Offensive Rebound.",52,50,"Santa Clara","Loyola Marymount",3,"400915821"
233,2,"5:37",337,"Jeffery McClendon Turnover.",52,50,"Santa Clara","Loyola Marymount",3,"400915821"
234,2,"5:35",335,"KJ Feagin Steal.",52,50,"Santa Clara","Loyola Marymount",3,"400915821"
235,2,"5:30",330,"Henrik Jadersten missed Three Point Jumper.",52,50,"Santa Clara","Loyola Marymount",3,"400915821"
236,2,"5:30",330,"Jeffery McClendon Defensive Rebound.",52,50,"Santa Clara","Loyola Marymount",3,"400915821"
237,2,"5:05",305,"Shamar Johnson missed Layup.",52,50,"Santa Clara","Loyola Marymount",3,"400915821"
238,2,"5:05",305,"Jeffery McClendon Offensive Rebound.",52,50,"Santa Clara","Loyola Marymount",3,"400915821"
239,2,"5:03",303,"Jeffery McClendon made Layup.",54,50,"Santa Clara","Loyola Marymount",3,"400915821"
240,2,"4:44",284,"KJ Feagin made Three Point Jumper.",54,53,"Santa Clara","Loyola Marymount",3,"400915821"
241,2,"4:20",260,"Stefan Jovanovic missed Jumper.",54,53,"Santa Clara","Loyola Marymount",3,"400915821"
242,2,"4:20",260,"Loyola Marymount Offensive Rebound.",54,53,"Santa Clara","Loyola Marymount",3,"400915821"
243,2,"4:18",258,"Foul on KJ Feagin.",54,53,"Santa Clara","Loyola Marymount",3,"400915821"
244,2,"4:18",258,"Jeffery McClendon made Free Throw.",55,53,"Santa Clara","Loyola Marymount",3,"400915821"
245,2,"4:18",258,"Jeffery McClendon missed Free Throw.",55,53,"Santa Clara","Loyola Marymount",3,"400915821"
246,2,"4:18",258,"Nate Kratch Defensive Rebound.",55,53,"Santa Clara","Loyola Marymount",3,"400915821"
247,2,"3:58",238,"Jared Brownridge missed Three Point Jumper.",55,53,"Santa Clara","Loyola Marymount",3,"400915821"
248,2,"3:58",238,"Jeffery McClendon Defensive Rebound.",55,53,"Santa Clara","Loyola Marymount",3,"400915821"
249,2,"3:28",208,"Shamar Johnson made Jumper.",57,53,"Santa Clara","Loyola Marymount",3,"400915821"
250,2,"3:19",199,"Santa Clara  Timeout",57,53,"Santa Clara","Loyola Marymount",3,"400915821"
251,2,"3:08",188,"KJ Feagin Turnover.",57,53,"Santa Clara","Loyola Marymount",3,"400915821"
252,2,"3:05",185,"Kelvin Amayo Steal.",57,53,"Santa Clara","Loyola Marymount",3,"400915821"
253,2,"3:05",185,"Kelvin Amayo made Dunk.",59,53,"Santa Clara","Loyola Marymount",3,"400915821"
254,2,"2:56",176,"KJ Feagin missed Three Point Jumper.",59,53,"Santa Clara","Loyola Marymount",3,"400915821"
255,2,"2:56",176,"Kelvin Amayo Defensive Rebound.",59,53,"Santa Clara","Loyola Marymount",3,"400915821"
256,2,"2:30",150,"Shamar Johnson missed Layup.",59,53,"Santa Clara","Loyola Marymount",3,"400915821"
257,2,"2:30",150,"Nate Kratch Block.",59,53,"Santa Clara","Loyola Marymount",3,"400915821"
258,2,"2:30",150,"Loyola Marymount Offensive Rebound.",59,53,"Santa Clara","Loyola Marymount",3,"400915821"
259,2,"2:25",145,"Stefan Jovanovic missed Layup.",59,53,"Santa Clara","Loyola Marymount",3,"400915821"
260,2,"2:25",145,"Nate Kratch Block.",59,53,"Santa Clara","Loyola Marymount",3,"400915821"
261,2,"2:25",145,"Santa Clara Defensive Rebound.",59,53,"Santa Clara","Loyola Marymount",3,"400915821"
262,2,"1:56",116,"Henrik Jadersten missed Jumper.",59,53,"Santa Clara","Loyola Marymount",3,"400915821"
263,2,"1:56",116,"Shamar Johnson Defensive Rebound.",59,53,"Santa Clara","Loyola Marymount",3,"400915821"
264,2,"1:33",93,"Jeffery McClendon Turnover.",59,53,"Santa Clara","Loyola Marymount",3,"400915821"
265,2,"1:27",87,"KJ Feagin missed Layup.",59,53,"Santa Clara","Loyola Marymount",3,"400915821"
266,2,"1:27",87,"Jeffery McClendon Defensive Rebound.",59,53,"Santa Clara","Loyola Marymount",3,"400915821"
267,2,"1:22",82,"Foul on Henrik Jadersten.",59,53,"Santa Clara","Loyola Marymount",3,"400915821"
268,2,"1:22",82,"Jeffery McClendon missed Free Throw.",59,53,"Santa Clara","Loyola Marymount",3,"400915821"
269,2,"1:22",82,"Henrik Jadersten Defensive Rebound.",59,53,"Santa Clara","Loyola Marymount",3,"400915821"
270,2,"1:04",64,"KJ Feagin missed Three Point Jumper.",59,53,"Santa Clara","Loyola Marymount",3,"400915821"
271,2,"1:04",64,"Stefan Jovanovic Defensive Rebound.",59,53,"Santa Clara","Loyola Marymount",3,"400915821"
272,2,"0:54",54,"Loyola Marymount  Timeout",59,53,"Santa Clara","Loyola Marymount",3,"400915821"
273,2,"0:48",48,"Foul on Kai Healy.",59,53,"Santa Clara","Loyola Marymount",3,"400915821"
274,2,"0:48",48,"Brandon Brown made Free Throw.",60,53,"Santa Clara","Loyola Marymount",3,"400915821"
275,2,"0:48",48,"Brandon Brown made Free Throw.",61,53,"Santa Clara","Loyola Marymount",3,"400915821"
276,2,"0:34",34,"KJ Feagin made Three Point Jumper. Assisted by Kai Healy.",61,56,"Santa Clara","Loyola Marymount",3,"400915821"
277,2,"0:33",33,"Santa Clara  Timeout",61,56,"Santa Clara","Loyola Marymount",3,"400915821"
278,2,"0:32",32,"Foul on Nate Kratch.",61,56,"Santa Clara","Loyola Marymount",3,"400915821"
279,2,"0:32",32,"Erik Johansson made Free Throw.",62,56,"Santa Clara","Loyola Marymount",3,"400915821"
280,2,"0:32",32,"Erik Johansson made Free Throw.",63,56,"Santa Clara","Loyola Marymount",3,"400915821"
281,2,"0:24",24,"KJ Feagin Turnover.",63,56,"Santa Clara","Loyola Marymount",3,"400915821"
282,2,"0:23",23,"Jeffery McClendon Steal.",63,56,"Santa Clara","Loyola Marymount",3,"400915821"
283,2,"0:23",23,"Foul on KJ Feagin.",63,56,"Santa Clara","Loyola Marymount",3,"400915821"
284,2,"0:23",23,"Jeffery McClendon made Free Throw.",64,56,"Santa Clara","Loyola Marymount",3,"400915821"
285,2,"0:23",23,"Jeffery McClendon made Free Throw.",65,56,"Santa Clara","Loyola Marymount",3,"400915821"
286,2,"0:18",18,"Santa Clara  Timeout",65,56,"Santa Clara","Loyola Marymount",3,"400915821"
287,2,"0:15",15,"Henrik Jadersten missed Three Point Jumper.",65,56,"Santa Clara","Loyola Marymount",3,"400915821"
288,2,"0:15",15,"Mattias Markusson Defensive Rebound.",65,56,"Santa Clara","Loyola Marymount",3,"400915821"
289,2,"0:14",14,"Foul on Nate Kratch.",65,56,"Santa Clara","Loyola Marymount",3,"400915821"
