"play_id","half","time_remaining_half","secs_remaining","description","home_score","away_score","away","home","home_favored_by","game_id"
382,2,"2:00",120,"Shamar Johnson Defensive Rebound.",82,72,"Loyola Marymount","BYU",11,"400915849"
383,2,"1:53",113,"Steven Haney made Three Point Jumper. Assisted by Trevor Manuel.",82,75,"Loyola Marymount","BYU",11,"400915849"
384,2,"1:45",105,"BYU  Timeout",82,75,"Loyola Marymount","BYU",11,"400915849"
385,2,"1:23",83,"Foul on Shamar Johnson.",82,75,"Loyola Marymount","BYU",11,"400915849"
386,2,"1:23",83,"Yoeli Childs made Free Throw.",83,75,"Loyola Marymount","BYU",11,"400915849"
387,2,"1:23",83,"Yoeli Childs missed Free Throw.",83,75,"Loyola Marymount","BYU",11,"400915849"
388,2,"1:23",83,"Petr Herman Defensive Rebound.",83,75,"Loyola Marymount","BYU",11,"400915849"
389,2,"1:01",61,"Petr Herman missed Jumper.",83,75,"Loyola Marymount","BYU",11,"400915849"
390,2,"1:01",61,"Yoeli Childs Block.",83,75,"Loyola Marymount","BYU",11,"400915849"
391,2,"1:00",60,"TJ Haws Defensive Rebound.",83,75,"Loyola Marymount","BYU",11,"400915849"
392,2,"0:31",31,"Elijah Bryant missed Three Point Jumper.",83,75,"Loyola Marymount","BYU",11,"400915849"
393,2,"0:31",31,"Eric Mika Offensive Rebound.",83,75,"Loyola Marymount","BYU",11,"400915849"
394,2,"0:28",28,"Eric Mika made Jumper.",85,75,"Loyola Marymount","BYU",11,"400915849"
395,2,"0:18",18,"Foul on Eric Mika.",85,75,"Loyola Marymount","BYU",11,"400915849"
396,2,"0:18",18,"Buay Tuach made Free Throw.",85,76,"Loyola Marymount","BYU",11,"400915849"
397,2,"0:18",18,"Buay Tuach made Free Throw.",85,77,"Loyola Marymount","BYU",11,"400915849"
398,2,"0:00",0,"End of Game",85,77,"Loyola Marymount","BYU",11,"400915849"
1,1,"20:00",2400,"PLAY",0,0,"Loyola Marymount","San Diego",1,"400915854"
2,1,"19:39",2379,"Tyler Williams missed Jumper.",0,0,"Loyola Marymount","San Diego",1,"400915854"
3,1,"19:39",2379,"Tyler Williams Offensive Rebound.",0,0,"Loyola Marymount","San Diego",1,"400915854"
4,1,"19:34",2374,"Olin Carter III missed Three Point Jumper.",0,0,"Loyola Marymount","San Diego",1,"400915854"
5,1,"19:34",2374,"Stefan Jovanovic Defensive Rebound.",0,0,"Loyola Marymount","San Diego",1,"400915854"
6,1,"19:21",2361,"Shamar Johnson made Jumper.",0,2,"Loyola Marymount","San Diego",1,"400915854"
7,1,"18:44",2324,"Cameron Neubauer missed Three Point Jumper.",0,2,"Loyola Marymount","San Diego",1,"400915854"
8,1,"18:44",2324,"Olin Carter III Offensive Rebound.",0,2,"Loyola Marymount","San Diego",1,"400915854"
9,1,"18:29",2309,"Cameron Neubauer made Three Point Jumper. Assisted by Tyler Williams.",3,2,"Loyola Marymount","San Diego",1,"400915854"
10,1,"18:09",2289,"Steven Haney made Jumper.",3,4,"Loyola Marymount","San Diego",1,"400915854"
11,1,"18:09",2289,"Foul on Brett Bailey.",3,4,"Loyola Marymount","San Diego",1,"400915854"
12,1,"18:09",2289,"Steven Haney made Free Throw.",3,5,"Loyola Marymount","San Diego",1,"400915854"
13,1,"17:56",2276,"Cameron Neubauer Turnover.",3,5,"Loyola Marymount","San Diego",1,"400915854"
14,1,"17:56",2276,"Shamar Johnson Steal.",3,5,"Loyola Marymount","San Diego",1,"400915854"
15,1,"17:25",2245,"Brandon Brown missed Three Point Jumper.",3,5,"Loyola Marymount","San Diego",1,"400915854"
16,1,"17:25",2245,"Cameron Neubauer Defensive Rebound.",3,5,"Loyola Marymount","San Diego",1,"400915854"
17,1,"17:15",2235,"Tyler Williams Turnover.",3,5,"Loyola Marymount","San Diego",1,"400915854"
18,1,"17:14",2234,"Brandon Brown Steal.",3,5,"Loyola Marymount","San Diego",1,"400915854"
19,1,"17:11",2231,"Buay Tuach made Dunk. Assisted by Brandon Brown.",3,7,"Loyola Marymount","San Diego",1,"400915854"
20,1,"16:49",2209,"Brett Bailey made Layup. Assisted by Tyler Williams.",5,7,"Loyola Marymount","San Diego",1,"400915854"
21,1,"16:34",2194,"Brandon Brown made Three Point Jumper. Assisted by Steven Haney.",5,10,"Loyola Marymount","San Diego",1,"400915854"
22,1,"16:04",2164,"Cameron Neubauer missed Jumper.",5,10,"Loyola Marymount","San Diego",1,"400915854"
23,1,"16:04",2164,"Juwan Gray Offensive Rebound.",5,10,"Loyola Marymount","San Diego",1,"400915854"
24,1,"15:46",2146,"Juwan Gray missed Three Point Jumper.",5,10,"Loyola Marymount","San Diego",1,"400915854"
25,1,"15:46",2146,"Shamar Johnson Defensive Rebound.",5,10,"Loyola Marymount","San Diego",1,"400915854"
26,1,"15:37",2137,"Steven Haney missed Three Point Jumper.",5,10,"Loyola Marymount","San Diego",1,"400915854"
27,1,"15:37",2137,"Stefan Jovanovic Offensive Rebound.",5,10,"Loyola Marymount","San Diego",1,"400915854"
28,1,"15:36",2136,"Foul on Cameron Neubauer.",5,10,"Loyola Marymount","San Diego",1,"400915854"
29,1,"15:36",2136,"Official TV Timeout",5,10,"Loyola Marymount","San Diego",1,"400915854"
30,1,"15:28",2128,"Brandon Brown made Three Point Jumper.",5,13,"Loyola Marymount","San Diego",1,"400915854"
31,1,"14:55",2095,"Cameron Neubauer missed Three Point Jumper.",5,13,"Loyola Marymount","San Diego",1,"400915854"
32,1,"14:55",2095,"Brandon Brown Defensive Rebound.",5,13,"Loyola Marymount","San Diego",1,"400915854"
33,1,"14:33",2073,"Trevor Manuel missed Three Point Jumper.",5,13,"Loyola Marymount","San Diego",1,"400915854"
34,1,"14:33",2073,"Juwan Gray Defensive Rebound.",5,13,"Loyola Marymount","San Diego",1,"400915854"
35,1,"14:23",2063,"Foul on Trevor Manuel.",5,13,"Loyola Marymount","San Diego",1,"400915854"
36,1,"14:19",2059,"Olin Carter III missed Three Point Jumper.",5,13,"Loyola Marymount","San Diego",1,"400915854"
37,1,"14:19",2059,"Steven Haney Defensive Rebound.",5,13,"Loyola Marymount","San Diego",1,"400915854"
38,1,"14:15",2055,"Buay Tuach made Dunk. Assisted by Steven Haney.",5,15,"Loyola Marymount","San Diego",1,"400915854"
39,1,"13:56",2036,"Foul on Trevor Manuel.",5,15,"Loyola Marymount","San Diego",1,"400915854"
40,1,"13:56",2036,"Frank Ryder made Free Throw.",6,15,"Loyola Marymount","San Diego",1,"400915854"
41,1,"13:56",2036,"Frank Ryder made Free Throw.",7,15,"Loyola Marymount","San Diego",1,"400915854"
42,1,"13:41",2021,"Foul on Frank Ryder.",7,15,"Loyola Marymount","San Diego",1,"400915854"
43,1,"13:41",2021,"Buay Tuach made Free Throw.",7,16,"Loyola Marymount","San Diego",1,"400915854"
44,1,"13:41",2021,"Buay Tuach made Free Throw.",7,17,"Loyola Marymount","San Diego",1,"400915854"
45,1,"13:24",2004,"Brett Bailey Turnover.",7,17,"Loyola Marymount","San Diego",1,"400915854"
46,1,"13:23",2003,"Munis Tutu Steal.",7,17,"Loyola Marymount","San Diego",1,"400915854"
47,1,"13:18",1998,"Jeffery McClendon made Three Point Jumper. Assisted by Brandon Brown.",7,20,"Loyola Marymount","San Diego",1,"400915854"
48,1,"13:17",1997,"San Diego  Timeout",7,20,"Loyola Marymount","San Diego",1,"400915854"
49,1,"13:16",1996,"Foul on Buay Tuach.",7,20,"Loyola Marymount","San Diego",1,"400915854"
50,1,"13:00",1980,"Foul on Buay Tuach.",7,20,"Loyola Marymount","San Diego",1,"400915854"
51,1,"12:42",1962,"Olin Carter III missed Jumper.",7,20,"Loyola Marymount","San Diego",1,"400915854"
52,1,"12:42",1962,"Brandon Brown Defensive Rebound.",7,20,"Loyola Marymount","San Diego",1,"400915854"
53,1,"12:37",1957,"Foul on Nassir Barrino.",7,20,"Loyola Marymount","San Diego",1,"400915854"
54,1,"12:08",1928,"Jeffery McClendon missed Three Point Jumper.",7,20,"Loyola Marymount","San Diego",1,"400915854"
55,1,"12:08",1928,"Juwan Gray Defensive Rebound.",7,20,"Loyola Marymount","San Diego",1,"400915854"
56,1,"11:42",1902,"Cameron Neubauer made Three Point Jumper. Assisted by Tyler Williams.",10,20,"Loyola Marymount","San Diego",1,"400915854"
57,1,"11:16",1876,"Mattias Markusson missed Jumper.",10,20,"Loyola Marymount","San Diego",1,"400915854"
58,1,"11:16",1876,"Tyler Williams Defensive Rebound.",10,20,"Loyola Marymount","San Diego",1,"400915854"
59,1,"10:47",1847,"Juwan Gray made Layup. Assisted by Cameron Neubauer.",12,20,"Loyola Marymount","San Diego",1,"400915854"
60,1,"10:38",1838,"Loyola Marymount  Timeout",12,20,"Loyola Marymount","San Diego",1,"400915854"
61,1,"10:27",1827,"Kelvin Amayo made Three Point Jumper. Assisted by Erik Johansson.",12,23,"Loyola Marymount","San Diego",1,"400915854"
62,1,"9:55",1795,"Tyler Williams Turnover.",12,23,"Loyola Marymount","San Diego",1,"400915854"
63,1,"9:54",1794,"Kelvin Amayo Steal.",12,23,"Loyola Marymount","San Diego",1,"400915854"
64,1,"9:49",1789,"Stefan Jovanovic Turnover.",12,23,"Loyola Marymount","San Diego",1,"400915854"
65,1,"9:49",1789,"Foul on Stefan Jovanovic.",12,23,"Loyola Marymount","San Diego",1,"400915854"
66,1,"9:44",1784,"Foul on Erik Johansson.",12,23,"Loyola Marymount","San Diego",1,"400915854"
67,1,"9:23",1763,"Nassir Barrino missed Jumper.",12,23,"Loyola Marymount","San Diego",1,"400915854"
68,1,"9:23",1763,"Stefan Jovanovic Defensive Rebound.",12,23,"Loyola Marymount","San Diego",1,"400915854"
69,1,"9:09",1749,"Steven Haney made Three Point Jumper. Assisted by Kelvin Amayo.",12,26,"Loyola Marymount","San Diego",1,"400915854"
70,1,"8:40",1720,"Brett Bailey made Three Point Jumper. Assisted by Cameron Neubauer.",15,26,"Loyola Marymount","San Diego",1,"400915854"
71,1,"8:16",1696,"Shamar Johnson made Jumper.",15,28,"Loyola Marymount","San Diego",1,"400915854"
72,1,"7:55",1675,"Foul on Stefan Jovanovic.",15,28,"Loyola Marymount","San Diego",1,"400915854"
73,1,"7:55",1675,"Official TV Timeout",15,28,"Loyola Marymount","San Diego",1,"400915854"
74,1,"7:55",1675,"Brett Bailey made Free Throw.",16,28,"Loyola Marymount","San Diego",1,"400915854"
75,1,"7:55",1675,"Brett Bailey made Free Throw.",17,28,"Loyola Marymount","San Diego",1,"400915854"
76,1,"7:41",1661,"Foul on Brett Bailey.",17,28,"Loyola Marymount","San Diego",1,"400915854"
77,1,"7:25",1645,"Steven Haney made Jumper.",17,30,"Loyola Marymount","San Diego",1,"400915854"
78,1,"7:12",1632,"Foul on Steven Haney.",17,30,"Loyola Marymount","San Diego",1,"400915854"
79,1,"7:12",1632,"Brett Bailey missed Free Throw.",17,30,"Loyola Marymount","San Diego",1,"400915854"
80,1,"7:12",1632,"Shamar Johnson Defensive Rebound.",17,30,"Loyola Marymount","San Diego",1,"400915854"
81,1,"7:04",1624,"Brandon Brown missed Three Point Jumper.",17,30,"Loyola Marymount","San Diego",1,"400915854"
82,1,"7:04",1624,"Nassir Barrino Defensive Rebound.",17,30,"Loyola Marymount","San Diego",1,"400915854"
83,1,"6:38",1598,"Juwan Gray missed Jumper.",17,30,"Loyola Marymount","San Diego",1,"400915854"
84,1,"6:38",1598,"Steven Haney Defensive Rebound.",17,30,"Loyola Marymount","San Diego",1,"400915854"
85,1,"6:21",1581,"Petr Herman made Jumper. Assisted by Steven Haney.",17,32,"Loyola Marymount","San Diego",1,"400915854"
86,1,"5:59",1559,"Brett Bailey missed Jumper.",17,32,"Loyola Marymount","San Diego",1,"400915854"
87,1,"5:59",1559,"Petr Herman Defensive Rebound.",17,32,"Loyola Marymount","San Diego",1,"400915854"
88,1,"5:44",1544,"Steven Haney made Jumper. Assisted by Shamar Johnson.",17,34,"Loyola Marymount","San Diego",1,"400915854"
89,1,"5:44",1544,"San Diego  Timeout",17,34,"Loyola Marymount","San Diego",1,"400915854"
90,1,"5:25",1525,"Cameron Neubauer missed Three Point Jumper.",17,34,"Loyola Marymount","San Diego",1,"400915854"
91,1,"5:25",1525,"Shamar Johnson Defensive Rebound.",17,34,"Loyola Marymount","San Diego",1,"400915854"
92,1,"5:06",1506,"Shamar Johnson missed Jumper.",17,34,"Loyola Marymount","San Diego",1,"400915854"
93,1,"5:06",1506,"Olin Carter III Defensive Rebound.",17,34,"Loyola Marymount","San Diego",1,"400915854"
94,1,"4:54",1494,"Brett Bailey made Three Point Jumper. Assisted by Tyler Williams.",20,34,"Loyola Marymount","San Diego",1,"400915854"
95,1,"4:32",1472,"Brandon Brown made Jumper.",20,36,"Loyola Marymount","San Diego",1,"400915854"
96,1,"4:07",1447,"Olin Carter III missed Three Point Jumper.",20,36,"Loyola Marymount","San Diego",1,"400915854"
97,1,"4:07",1447,"Petr Herman Defensive Rebound.",20,36,"Loyola Marymount","San Diego",1,"400915854"
98,1,"3:56",1436,"Steven Haney Turnover.",20,36,"Loyola Marymount","San Diego",1,"400915854"
99,1,"3:55",1435,"Nassir Barrino Steal.",20,36,"Loyola Marymount","San Diego",1,"400915854"
100,1,"3:52",1432,"Nassir Barrino missed Layup.",20,36,"Loyola Marymount","San Diego",1,"400915854"
101,1,"3:52",1432,"Petr Herman Block.",20,36,"Loyola Marymount","San Diego",1,"400915854"
102,1,"3:50",1430,"Brett Bailey Offensive Rebound.",20,36,"Loyola Marymount","San Diego",1,"400915854"
103,1,"3:48",1428,"Brett Bailey made Jumper.",22,36,"Loyola Marymount","San Diego",1,"400915854"
104,1,"3:27",1407,"Brandon Brown missed Jumper.",22,36,"Loyola Marymount","San Diego",1,"400915854"
105,1,"3:27",1407,"Brandon Brown Offensive Rebound.",22,36,"Loyola Marymount","San Diego",1,"400915854"
106,1,"3:22",1402,"Munis Tutu made Three Point Jumper. Assisted by Brandon Brown.",22,39,"Loyola Marymount","San Diego",1,"400915854"
107,1,"3:00",1380,"Tyler Williams made Three Point Jumper.",25,39,"Loyola Marymount","San Diego",1,"400915854"
108,1,"2:40",1360,"Petr Herman missed Jumper.",25,39,"Loyola Marymount","San Diego",1,"400915854"
109,1,"2:40",1360,"Brett Bailey Defensive Rebound.",25,39,"Loyola Marymount","San Diego",1,"400915854"
110,1,"2:18",1338,"Brett Bailey missed Three Point Jumper.",25,39,"Loyola Marymount","San Diego",1,"400915854"
111,1,"2:18",1338,"Munis Tutu Defensive Rebound.",25,39,"Loyola Marymount","San Diego",1,"400915854"
112,1,"1:49",1309,"Munis Tutu missed Three Point Jumper.",25,39,"Loyola Marymount","San Diego",1,"400915854"
113,1,"1:49",1309,"Tyler Williams Defensive Rebound.",25,39,"Loyola Marymount","San Diego",1,"400915854"
114,1,"1:21",1281,"Brett Bailey missed Three Point Jumper.",25,39,"Loyola Marymount","San Diego",1,"400915854"
115,1,"1:21",1281,"Steven Haney Defensive Rebound.",25,39,"Loyola Marymount","San Diego",1,"400915854"
116,1,"1:13",1273,"Foul on Nassir Barrino.",25,39,"Loyola Marymount","San Diego",1,"400915854"
117,1,"1:13",1273,"Official TV Timeout",25,39,"Loyola Marymount","San Diego",1,"400915854"
118,1,"1:11",1271,"Brandon Brown missed Free Throw.",25,39,"Loyola Marymount","San Diego",1,"400915854"
119,1,"1:11",1271,"Loyola Marymount Deadball Team Rebound.",25,39,"Loyola Marymount","San Diego",1,"400915854"
120,1,"1:11",1271,"Brandon Brown made Free Throw.",25,40,"Loyola Marymount","San Diego",1,"400915854"
121,1,"0:52",1252,"Foul on Munis Tutu.",25,40,"Loyola Marymount","San Diego",1,"400915854"
122,1,"0:52",1252,"Juwan Gray missed Free Throw.",25,40,"Loyola Marymount","San Diego",1,"400915854"
123,1,"0:52",1252,"San Diego Deadball Team Rebound.",25,40,"Loyola Marymount","San Diego",1,"400915854"
124,1,"0:52",1252,"Juwan Gray missed Free Throw.",25,40,"Loyola Marymount","San Diego",1,"400915854"
125,1,"0:52",1252,"Kelvin Amayo Defensive Rebound.",25,40,"Loyola Marymount","San Diego",1,"400915854"
126,1,"0:30",1230,"Brandon Brown missed Jumper.",25,40,"Loyola Marymount","San Diego",1,"400915854"
127,1,"0:30",1230,"Mattias Markusson Offensive Rebound.",25,40,"Loyola Marymount","San Diego",1,"400915854"
128,1,"0:25",1225,"Mattias Markusson made Dunk.",25,42,"Loyola Marymount","San Diego",1,"400915854"
129,1,"0:21",1221,"Nassir Barrino Turnover.",25,42,"Loyola Marymount","San Diego",1,"400915854"
130,1,"0:19",1219,"Brandon Brown Steal.",25,42,"Loyola Marymount","San Diego",1,"400915854"
131,1,"0:00",1200,"Brandon Brown made Three Point Jumper.",25,45,"Loyola Marymount","San Diego",1,"400915854"
132,1,"0:00",1200,"End of 1st half",25,45,"Loyola Marymount","San Diego",1,"400915854"
133,2,"20:00",1200,"PLAY",25,45,"Loyola Marymount","San Diego",1,"400915854"
134,2,"19:53",1193,"Nassir Barrino missed Jumper.",25,45,"Loyola Marymount","San Diego",1,"400915854"
135,2,"19:53",1193,"Juwan Gray Offensive Rebound.",25,45,"Loyola Marymount","San Diego",1,"400915854"
136,2,"19:53",1193,"Foul on Stefan Jovanovic.",25,45,"Loyola Marymount","San Diego",1,"400915854"
137,2,"19:53",1193,"Juwan Gray missed Free Throw.",25,45,"Loyola Marymount","San Diego",1,"400915854"
138,2,"19:53",1193,"San Diego Deadball Team Rebound.",25,45,"Loyola Marymount","San Diego",1,"400915854"
139,2,"19:53",1193,"Juwan Gray made Free Throw.",26,45,"Loyola Marymount","San Diego",1,"400915854"
140,2,"19:24",1164,"Foul on Cameron Neubauer.",26,45,"Loyola Marymount","San Diego",1,"400915854"
141,2,"19:11",1151,"Stefan Jovanovic made Jumper.",26,47,"Loyola Marymount","San Diego",1,"400915854"
142,2,"18:48",1128,"Mark Carbone made Three Point Jumper. Assisted by Brett Bailey.",29,47,"Loyola Marymount","San Diego",1,"400915854"
143,2,"18:29",1109,"Shamar Johnson missed Jumper.",29,47,"Loyola Marymount","San Diego",1,"400915854"
144,2,"18:29",1109,"Cameron Neubauer Defensive Rebound.",29,47,"Loyola Marymount","San Diego",1,"400915854"
145,2,"18:06",1086,"Nassir Barrino made Jumper. Assisted by Cameron Neubauer.",31,47,"Loyola Marymount","San Diego",1,"400915854"
146,2,"17:45",1065,"Steven Haney made Three Point Jumper. Assisted by Brandon Brown.",31,50,"Loyola Marymount","San Diego",1,"400915854"
147,2,"17:14",1034,"Foul on Buay Tuach.",31,50,"Loyola Marymount","San Diego",1,"400915854"
148,2,"17:00",1020,"Brett Bailey made Dunk. Assisted by Cameron Neubauer.",33,50,"Loyola Marymount","San Diego",1,"400915854"
149,2,"16:40",1000,"Buay Tuach Turnover.",33,50,"Loyola Marymount","San Diego",1,"400915854"
150,2,"16:38",998,"Juwan Gray Steal.",33,50,"Loyola Marymount","San Diego",1,"400915854"
151,2,"16:36",996,"Foul on Brandon Brown.",33,50,"Loyola Marymount","San Diego",1,"400915854"
152,2,"16:36",996,"Brett Bailey made Free Throw.",34,50,"Loyola Marymount","San Diego",1,"400915854"
153,2,"16:36",996,"Brett Bailey made Free Throw.",35,50,"Loyola Marymount","San Diego",1,"400915854"
154,2,"16:30",990,"Foul on Cameron Neubauer.",35,50,"Loyola Marymount","San Diego",1,"400915854"
155,2,"16:22",982,"Brandon Brown made Free Throw.",35,51,"Loyola Marymount","San Diego",1,"400915854"
156,2,"16:22",982,"Brandon Brown made Free Throw.",35,52,"Loyola Marymount","San Diego",1,"400915854"
157,2,"15:54",954,"Frank Ryder made Jumper. Assisted by Nassir Barrino.",37,52,"Loyola Marymount","San Diego",1,"400915854"
158,2,"15:43",943,"Steven Haney missed Three Point Jumper.",37,52,"Loyola Marymount","San Diego",1,"400915854"
159,2,"15:43",943,"Tyler Williams Defensive Rebound.",37,52,"Loyola Marymount","San Diego",1,"400915854"
160,2,"15:35",935,"Olin Carter III missed Three Point Jumper.",37,52,"Loyola Marymount","San Diego",1,"400915854"
161,2,"15:35",935,"Trevor Manuel Defensive Rebound.",37,52,"Loyola Marymount","San Diego",1,"400915854"
162,2,"15:29",929,"Foul on Olin Carter III.",37,52,"Loyola Marymount","San Diego",1,"400915854"
163,2,"15:29",929,"Official TV Timeout",37,52,"Loyola Marymount","San Diego",1,"400915854"
164,2,"15:29",929,"Brandon Brown missed Free Throw.",37,52,"Loyola Marymount","San Diego",1,"400915854"
165,2,"15:29",929,"Loyola Marymount Deadball Team Rebound.",37,52,"Loyola Marymount","San Diego",1,"400915854"
166,2,"15:29",929,"Brandon Brown made Free Throw.",37,53,"Loyola Marymount","San Diego",1,"400915854"
167,2,"15:08",908,"Nassir Barrino Turnover.",37,53,"Loyola Marymount","San Diego",1,"400915854"
168,2,"14:49",889,"Foul on Frank Ryder.",37,53,"Loyola Marymount","San Diego",1,"400915854"
169,2,"14:34",874,"Shamar Johnson missed Jumper.",37,53,"Loyola Marymount","San Diego",1,"400915854"
170,2,"14:34",874,"Munis Tutu Offensive Rebound.",37,53,"Loyola Marymount","San Diego",1,"400915854"
171,2,"14:07",847,"Munis Tutu Turnover.",37,53,"Loyola Marymount","San Diego",1,"400915854"
172,2,"13:44",824,"Frank Ryder made Jumper.",39,53,"Loyola Marymount","San Diego",1,"400915854"
173,2,"13:26",806,"Shamar Johnson made Layup.",39,55,"Loyola Marymount","San Diego",1,"400915854"
174,2,"12:57",777,"Foul on Trevor Manuel.",39,55,"Loyola Marymount","San Diego",1,"400915854"
175,2,"12:57",777,"San Diego  Turnover.",39,55,"Loyola Marymount","San Diego",1,"400915854"
176,2,"12:43",763,"Foul on Mark Carbone.",39,55,"Loyola Marymount","San Diego",1,"400915854"
177,2,"12:25",745,"Foul on Stefan Jovanovic.",39,55,"Loyola Marymount","San Diego",1,"400915854"
178,2,"12:25",745,"Stefan Jovanovic Turnover.",39,55,"Loyola Marymount","San Diego",1,"400915854"
179,2,"12:14",734,"Brett Bailey made Three Point Jumper. Assisted by Olin Carter III.",42,55,"Loyola Marymount","San Diego",1,"400915854"
180,2,"11:57",717,"Brandon Brown missed Jumper.",42,55,"Loyola Marymount","San Diego",1,"400915854"
181,2,"11:57",717,"Olin Carter III Defensive Rebound.",42,55,"Loyola Marymount","San Diego",1,"400915854"
182,2,"11:28",688,"Brett Bailey missed Jumper.",42,55,"Loyola Marymount","San Diego",1,"400915854"
183,2,"11:28",688,"Trevor Manuel Defensive Rebound.",42,55,"Loyola Marymount","San Diego",1,"400915854"
184,2,"11:09",669,"Brandon Brown made Three Point Jumper. Assisted by Munis Tutu.",42,58,"Loyola Marymount","San Diego",1,"400915854"
185,2,"10:48",648,"Olin Carter III missed Three Point Jumper.",42,58,"Loyola Marymount","San Diego",1,"400915854"
186,2,"10:48",648,"Trevor Manuel Defensive Rebound.",42,58,"Loyola Marymount","San Diego",1,"400915854"
187,2,"10:34",634,"Trevor Manuel made Dunk. Assisted by Brandon Brown.",42,60,"Loyola Marymount","San Diego",1,"400915854"
188,2,"10:21",621,"San Diego  Timeout",42,60,"Loyola Marymount","San Diego",1,"400915854"
189,2,"10:07",607,"Brett Bailey missed Jumper.",42,60,"Loyola Marymount","San Diego",1,"400915854"
190,2,"10:07",607,"Trevor Manuel Block.",42,60,"Loyola Marymount","San Diego",1,"400915854"
191,2,"10:07",607,"San Diego Offensive Rebound.",42,60,"Loyola Marymount","San Diego",1,"400915854"
192,2,"10:07",607,"San Diego  Turnover.",42,60,"Loyola Marymount","San Diego",1,"400915854"
193,2,"10:07",607,"Official TV Timeout",42,60,"Loyola Marymount","San Diego",1,"400915854"
194,2,"9:45",585,"Shamar Johnson made Jumper.",42,62,"Loyola Marymount","San Diego",1,"400915854"
195,2,"9:39",579,"San Diego  Timeout",42,62,"Loyola Marymount","San Diego",1,"400915854"
196,2,"9:12",552,"Juwan Gray missed Three Point Jumper.",42,62,"Loyola Marymount","San Diego",1,"400915854"
197,2,"9:12",552,"San Diego Offensive Rebound.",42,62,"Loyola Marymount","San Diego",1,"400915854"
198,2,"8:54",534,"Foul on Trevor Manuel.",42,62,"Loyola Marymount","San Diego",1,"400915854"
199,2,"8:54",534,"Nassir Barrino made Free Throw.",43,62,"Loyola Marymount","San Diego",1,"400915854"
200,2,"8:54",534,"Nassir Barrino missed Free Throw.",43,62,"Loyola Marymount","San Diego",1,"400915854"
201,2,"8:54",534,"Trevor Manuel Defensive Rebound.",43,62,"Loyola Marymount","San Diego",1,"400915854"
202,2,"8:52",532,"Buay Tuach Turnover.",43,62,"Loyola Marymount","San Diego",1,"400915854"
203,2,"8:52",532,"Nassir Barrino Steal.",43,62,"Loyola Marymount","San Diego",1,"400915854"
204,2,"8:09",489,"Olin Carter III missed Jumper.",43,62,"Loyola Marymount","San Diego",1,"400915854"
205,2,"8:09",489,"Shamar Johnson Defensive Rebound.",43,62,"Loyola Marymount","San Diego",1,"400915854"
206,2,"8:02",482,"Foul on Nassir Barrino.",43,62,"Loyola Marymount","San Diego",1,"400915854"
207,2,"7:42",462,"Trevor Manuel made Dunk. Assisted by Shamar Johnson.",43,64,"Loyola Marymount","San Diego",1,"400915854"
208,2,"7:22",442,"Olin Carter III Turnover.",43,64,"Loyola Marymount","San Diego",1,"400915854"
209,2,"7:22",442,"Official TV Timeout",43,64,"Loyola Marymount","San Diego",1,"400915854"
210,2,"6:59",419,"Steven Haney missed Three Point Jumper.",43,64,"Loyola Marymount","San Diego",1,"400915854"
211,2,"6:59",419,"Juwan Gray Defensive Rebound.",43,64,"Loyola Marymount","San Diego",1,"400915854"
212,2,"6:40",400,"Cameron Neubauer missed Three Point Jumper.",43,64,"Loyola Marymount","San Diego",1,"400915854"
213,2,"6:40",400,"Juwan Gray Offensive Rebound.",43,64,"Loyola Marymount","San Diego",1,"400915854"
214,2,"6:37",397,"Juwan Gray made Layup.",45,64,"Loyola Marymount","San Diego",1,"400915854"
215,2,"6:05",365,"Brandon Brown missed Three Point Jumper.",45,64,"Loyola Marymount","San Diego",1,"400915854"
216,2,"6:05",365,"Cameron Neubauer Defensive Rebound.",45,64,"Loyola Marymount","San Diego",1,"400915854"
217,2,"5:56",356,"Juwan Gray missed Three Point Jumper.",45,64,"Loyola Marymount","San Diego",1,"400915854"
218,2,"5:56",356,"Trevor Manuel Defensive Rebound.",45,64,"Loyola Marymount","San Diego",1,"400915854"
219,2,"5:33",333,"Foul on Cameron Neubauer.",45,64,"Loyola Marymount","San Diego",1,"400915854"
220,2,"5:33",333,"Trevor Manuel made Free Throw.",45,65,"Loyola Marymount","San Diego",1,"400915854"
221,2,"5:33",333,"Trevor Manuel missed Free Throw.",45,65,"Loyola Marymount","San Diego",1,"400915854"
222,2,"5:33",333,"Cameron Neubauer Defensive Rebound.",45,65,"Loyola Marymount","San Diego",1,"400915854"
223,2,"5:07",307,"Juwan Gray missed Three Point Jumper.",45,65,"Loyola Marymount","San Diego",1,"400915854"
224,2,"5:07",307,"Brett Bailey Offensive Rebound.",45,65,"Loyola Marymount","San Diego",1,"400915854"
225,2,"5:04",304,"Brett Bailey made Layup.",47,65,"Loyola Marymount","San Diego",1,"400915854"
226,2,"4:39",279,"Buay Tuach made Three Point Jumper. Assisted by Steven Haney.",47,68,"Loyola Marymount","San Diego",1,"400915854"
227,2,"4:23",263,"Olin Carter III Turnover.",47,68,"Loyola Marymount","San Diego",1,"400915854"
228,2,"4:22",262,"Steven Haney Steal.",47,68,"Loyola Marymount","San Diego",1,"400915854"
229,2,"3:55",235,"Brandon Brown missed Three Point Jumper.",47,68,"Loyola Marymount","San Diego",1,"400915854"
230,2,"3:55",235,"Juwan Gray Defensive Rebound.",47,68,"Loyola Marymount","San Diego",1,"400915854"
231,2,"3:44",224,"Juwan Gray missed Layup.",47,68,"Loyola Marymount","San Diego",1,"400915854"
232,2,"3:44",224,"Brandon Brown Defensive Rebound.",47,68,"Loyola Marymount","San Diego",1,"400915854"
233,2,"3:33",213,"Foul on Mark Carbone.",47,68,"Loyola Marymount","San Diego",1,"400915854"
234,2,"3:33",213,"Official TV Timeout",47,68,"Loyola Marymount","San Diego",1,"400915854"
235,2,"3:33",213,"Trevor Manuel made Free Throw.",47,69,"Loyola Marymount","San Diego",1,"400915854"
