"play_id","half","time_remaining_half","secs_remaining","description","home_score","away_score","away","home","home_favored_by","game_id"
1,1,"20:00",2400,"PLAY",0,0,"Vanguard","Loyola Marymount",NA,"400915707"
2,1,"19:56",2396,"Buay Tuach made Three Point Jumper. Assisted by Brandon Brown.",3,0,"Vanguard","Loyola Marymount",NA,"400915707"
3,1,"19:30",2370,"Malachi Hoosein missed Three Point Jumper.",3,0,"Vanguard","Loyola Marymount",NA,"400915707"
4,1,"19:30",2370,"Zach Allmon Offensive Rebound.",3,0,"Vanguard","Loyola Marymount",NA,"400915707"
5,1,"19:24",2364,"Shacquille Dawkins missed Three Point Jumper.",3,0,"Vanguard","Loyola Marymount",NA,"400915707"
6,1,"19:24",2364,"Victor Evans Offensive Rebound.",3,0,"Vanguard","Loyola Marymount",NA,"400915707"
7,1,"19:03",2343,"Victor Evans missed Three Point Jumper.",3,0,"Vanguard","Loyola Marymount",NA,"400915707"
8,1,"19:03",2343,"Loyola Marymount Defensive Rebound.",3,0,"Vanguard","Loyola Marymount",NA,"400915707"
9,1,"19:01",2341,"Foul on Jamaal Lee.",3,0,"Vanguard","Loyola Marymount",NA,"400915707"
10,1,"18:49",2329,"Brandon Brown made Jumper.",5,0,"Vanguard","Loyola Marymount",NA,"400915707"
11,1,"18:32",2312,"Victor Evans Turnover.",5,0,"Vanguard","Loyola Marymount",NA,"400915707"
12,1,"18:32",2312,"Foul on Victor Evans.",5,0,"Vanguard","Loyola Marymount",NA,"400915707"
13,1,"18:20",2300,"Foul on Zach Allmon.",5,0,"Vanguard","Loyola Marymount",NA,"400915707"
14,1,"18:16",2296,"Stefan Jovanovic missed Free Throw.",5,0,"Vanguard","Loyola Marymount",NA,"400915707"
15,1,"18:16",2296,"Loyola Marymount Deadball Team Rebound.",5,0,"Vanguard","Loyola Marymount",NA,"400915707"
16,1,"18:16",2296,"Stefan Jovanovic made Free Throw.",6,0,"Vanguard","Loyola Marymount",NA,"400915707"
17,1,"18:15",2295,"Jamaal Lee Turnover.",6,0,"Vanguard","Loyola Marymount",NA,"400915707"
18,1,"17:55",2275,"Buay Tuach made Jumper.",8,0,"Vanguard","Loyola Marymount",NA,"400915707"
19,1,"17:49",2269,"Shacquille Dawkins Turnover.",8,0,"Vanguard","Loyola Marymount",NA,"400915707"
20,1,"17:37",2257,"Buay Tuach missed Three Point Jumper.",8,0,"Vanguard","Loyola Marymount",NA,"400915707"
21,1,"17:37",2257,"Jamaal Lee Defensive Rebound.",8,0,"Vanguard","Loyola Marymount",NA,"400915707"
22,1,"17:30",2250,"Zach Allmon missed Jumper.",8,0,"Vanguard","Loyola Marymount",NA,"400915707"
23,1,"17:30",2250,"Zach Allmon Offensive Rebound.",8,0,"Vanguard","Loyola Marymount",NA,"400915707"
24,1,"17:25",2245,"Brandon Brothers made Layup. Assisted by Zach Allmon.",8,2,"Vanguard","Loyola Marymount",NA,"400915707"
25,1,"17:10",2230,"Buay Tuach made Three Point Jumper. Assisted by Shamar Johnson.",11,2,"Vanguard","Loyola Marymount",NA,"400915707"
26,1,"16:52",2212,"Brandon Brothers missed Three Point Jumper.",11,2,"Vanguard","Loyola Marymount",NA,"400915707"
27,1,"16:52",2212,"Mattias Markusson Defensive Rebound.",11,2,"Vanguard","Loyola Marymount",NA,"400915707"
28,1,"16:46",2206,"Foul on Billy Keller.",11,2,"Vanguard","Loyola Marymount",NA,"400915707"
29,1,"16:34",2194,"Steven Haney missed Layup.",11,2,"Vanguard","Loyola Marymount",NA,"400915707"
30,1,"16:34",2194,"Mattias Markusson Offensive Rebound.",11,2,"Vanguard","Loyola Marymount",NA,"400915707"
31,1,"16:29",2189,"Steven Haney made Three Point Jumper. Assisted by Munis Tutu.",14,2,"Vanguard","Loyola Marymount",NA,"400915707"
32,1,"16:02",2162,"Brandon Brothers missed Three Point Jumper.",14,2,"Vanguard","Loyola Marymount",NA,"400915707"
33,1,"16:02",2162,"Shamar Johnson Defensive Rebound.",14,2,"Vanguard","Loyola Marymount",NA,"400915707"
34,1,"15:47",2147,"Official TV Timeout",14,2,"Vanguard","Loyola Marymount",NA,"400915707"
35,1,"15:44",2144,"Foul on Zach Allmon.",14,2,"Vanguard","Loyola Marymount",NA,"400915707"
36,1,"15:44",2144,"Mattias Markusson made Free Throw.",15,2,"Vanguard","Loyola Marymount",NA,"400915707"
37,1,"15:44",2144,"Mattias Markusson made Free Throw.",16,2,"Vanguard","Loyola Marymount",NA,"400915707"
38,1,"15:29",2129,"Zach Allmon missed Jumper.",16,2,"Vanguard","Loyola Marymount",NA,"400915707"
39,1,"15:29",2129,"Brandon Brothers Offensive Rebound.",16,2,"Vanguard","Loyola Marymount",NA,"400915707"
40,1,"15:17",2117,"Brandon Brothers missed Jumper.",16,2,"Vanguard","Loyola Marymount",NA,"400915707"
41,1,"15:17",2117,"Shamar Johnson Defensive Rebound.",16,2,"Vanguard","Loyola Marymount",NA,"400915707"
42,1,"15:01",2101,"Jeffery McClendon made Layup. Assisted by Munis Tutu.",18,2,"Vanguard","Loyola Marymount",NA,"400915707"
43,1,"14:47",2087,"Billy Keller missed Layup.",18,2,"Vanguard","Loyola Marymount",NA,"400915707"
44,1,"14:47",2087,"Loyola Marymount Defensive Rebound.",18,2,"Vanguard","Loyola Marymount",NA,"400915707"
45,1,"14:27",2067,"Steven Haney made Dunk. Assisted by Shamar Johnson.",20,2,"Vanguard","Loyola Marymount",NA,"400915707"
46,1,"14:12",2052,"Foul on Munis Tutu.",20,2,"Vanguard","Loyola Marymount",NA,"400915707"
47,1,"14:12",2052,"Teslim Idris missed Free Throw.",20,2,"Vanguard","Loyola Marymount",NA,"400915707"
48,1,"14:12",2052,"Vanguard Deadball Team Rebound.",20,2,"Vanguard","Loyola Marymount",NA,"400915707"
49,1,"14:12",2052,"Teslim Idris made Free Throw.",20,3,"Vanguard","Loyola Marymount",NA,"400915707"
50,1,"13:47",2027,"Foul on Teslim Idris.",20,3,"Vanguard","Loyola Marymount",NA,"400915707"
51,1,"13:44",2024,"Steven Haney missed Three Point Jumper.",20,3,"Vanguard","Loyola Marymount",NA,"400915707"
52,1,"13:44",2024,"Loyola Marymount Offensive Rebound.",20,3,"Vanguard","Loyola Marymount",NA,"400915707"
53,1,"13:41",2021,"Foul on Mattias Markusson.",20,3,"Vanguard","Loyola Marymount",NA,"400915707"
54,1,"13:38",2018,"Foul on Steven Haney.",20,3,"Vanguard","Loyola Marymount",NA,"400915707"
55,1,"13:31",2011,"Jamaal Lee made Layup. Assisted by Billy Keller.",20,5,"Vanguard","Loyola Marymount",NA,"400915707"
56,1,"13:12",1992,"Mattias Markusson made Jumper. Assisted by Kelvin Amayo.",22,5,"Vanguard","Loyola Marymount",NA,"400915707"
57,1,"12:59",1979,"Malachi Hoosein missed Three Point Jumper.",22,5,"Vanguard","Loyola Marymount",NA,"400915707"
58,1,"12:59",1979,"Munis Tutu Defensive Rebound.",22,5,"Vanguard","Loyola Marymount",NA,"400915707"
59,1,"12:52",1972,"Kelvin Amayo made Layup. Assisted by Munis Tutu.",24,5,"Vanguard","Loyola Marymount",NA,"400915707"
60,1,"12:48",1968,"Vanguard  Timeout",24,5,"Vanguard","Loyola Marymount",NA,"400915707"
61,1,"12:27",1947,"Jamaal Lee made Layup. Assisted by Victor Evans.",24,7,"Vanguard","Loyola Marymount",NA,"400915707"
62,1,"12:20",1940,"Kelvin Amayo missed Layup.",24,7,"Vanguard","Loyola Marymount",NA,"400915707"
63,1,"12:20",1940,"Malachi Hoosein Defensive Rebound.",24,7,"Vanguard","Loyola Marymount",NA,"400915707"
64,1,"12:09",1929,"Shacquille Dawkins made Three Point Jumper. Assisted by Malachi Hoosein.",24,10,"Vanguard","Loyola Marymount",NA,"400915707"
65,1,"11:40",1900,"Petr Herman made Layup. Assisted by Kelvin Amayo.",26,10,"Vanguard","Loyola Marymount",NA,"400915707"
66,1,"11:40",1900,"Foul on Shacquille Dawkins.",26,10,"Vanguard","Loyola Marymount",NA,"400915707"
67,1,"11:40",1900,"Official TV Timeout",26,10,"Vanguard","Loyola Marymount",NA,"400915707"
68,1,"11:40",1900,"Petr Herman missed Free Throw.",26,10,"Vanguard","Loyola Marymount",NA,"400915707"
69,1,"11:40",1900,"Petr Herman Offensive Rebound.",26,10,"Vanguard","Loyola Marymount",NA,"400915707"
70,1,"11:28",1888,"Foul on Jamaal Lee.",26,10,"Vanguard","Loyola Marymount",NA,"400915707"
71,1,"11:28",1888,"Mattias Markusson made Free Throw.",27,10,"Vanguard","Loyola Marymount",NA,"400915707"
72,1,"11:28",1888,"Mattias Markusson made Free Throw.",28,10,"Vanguard","Loyola Marymount",NA,"400915707"
73,1,"11:17",1877,"Malachi Hoosein missed Three Point Jumper.",28,10,"Vanguard","Loyola Marymount",NA,"400915707"
74,1,"11:17",1877,"Brandon Brown Defensive Rebound.",28,10,"Vanguard","Loyola Marymount",NA,"400915707"
75,1,"11:10",1870,"Brandon Brown Turnover.",28,10,"Vanguard","Loyola Marymount",NA,"400915707"
76,1,"11:08",1868,"Malachi Hoosein Steal.",28,10,"Vanguard","Loyola Marymount",NA,"400915707"
77,1,"11:03",1863,"Jamaal Lee missed Layup.",28,10,"Vanguard","Loyola Marymount",NA,"400915707"
78,1,"11:03",1863,"Stefan Jovanovic Defensive Rebound.",28,10,"Vanguard","Loyola Marymount",NA,"400915707"
79,1,"10:44",1844,"Brandon Brown Turnover.",28,10,"Vanguard","Loyola Marymount",NA,"400915707"
80,1,"10:43",1843,"Malachi Hoosein Steal.",28,10,"Vanguard","Loyola Marymount",NA,"400915707"
81,1,"10:41",1841,"Malachi Hoosein Turnover.",28,10,"Vanguard","Loyola Marymount",NA,"400915707"
82,1,"10:40",1840,"Munis Tutu Steal.",28,10,"Vanguard","Loyola Marymount",NA,"400915707"
83,1,"10:38",1838,"Kelvin Amayo made Layup.",30,10,"Vanguard","Loyola Marymount",NA,"400915707"
84,1,"10:33",1833,"Jamaal Lee Turnover.",30,10,"Vanguard","Loyola Marymount",NA,"400915707"
85,1,"10:33",1833,"Jeffery McClendon Steal.",30,10,"Vanguard","Loyola Marymount",NA,"400915707"
86,1,"10:33",1833,"Jeffery McClendon made Layup.",32,10,"Vanguard","Loyola Marymount",NA,"400915707"
87,1,"10:33",1833,"Vanguard  Timeout",32,10,"Vanguard","Loyola Marymount",NA,"400915707"
88,1,"10:25",1825,"Shacquille Dawkins made Jumper.",32,12,"Vanguard","Loyola Marymount",NA,"400915707"
89,1,"10:06",1806,"Buay Tuach Turnover.",32,12,"Vanguard","Loyola Marymount",NA,"400915707"
90,1,"10:06",1806,"Foul on Buay Tuach.",32,12,"Vanguard","Loyola Marymount",NA,"400915707"
91,1,"9:52",1792,"Brandon Hood Turnover.",32,12,"Vanguard","Loyola Marymount",NA,"400915707"
92,1,"9:51",1791,"Brandon Brown missed Layup.",32,12,"Vanguard","Loyola Marymount",NA,"400915707"
93,1,"9:51",1791,"Zach Allmon Defensive Rebound.",32,12,"Vanguard","Loyola Marymount",NA,"400915707"
94,1,"9:34",1774,"Malachi Hoosein missed Jumper.",32,12,"Vanguard","Loyola Marymount",NA,"400915707"
95,1,"9:34",1774,"Steven Haney Defensive Rebound.",32,12,"Vanguard","Loyola Marymount",NA,"400915707"
96,1,"9:25",1765,"Stefan Jovanovic missed Layup.",32,12,"Vanguard","Loyola Marymount",NA,"400915707"
97,1,"9:25",1765,"Zach Allmon Block.",32,12,"Vanguard","Loyola Marymount",NA,"400915707"
98,1,"9:23",1763,"Loyola Marymount Offensive Rebound.",32,12,"Vanguard","Loyola Marymount",NA,"400915707"
99,1,"9:04",1744,"Stefan Jovanovic made Dunk. Assisted by Brandon Brown.",34,12,"Vanguard","Loyola Marymount",NA,"400915707"
100,1,"9:04",1744,"Foul on Victor Evans.",34,12,"Vanguard","Loyola Marymount",NA,"400915707"
101,1,"9:04",1744,"Stefan Jovanovic made Free Throw.",35,12,"Vanguard","Loyola Marymount",NA,"400915707"
102,1,"8:53",1733,"Zach Allmon missed Dunk.",35,12,"Vanguard","Loyola Marymount",NA,"400915707"
103,1,"8:53",1733,"Stefan Jovanovic Block.",35,12,"Vanguard","Loyola Marymount",NA,"400915707"
104,1,"8:53",1733,"Loyola Marymount Defensive Rebound.",35,12,"Vanguard","Loyola Marymount",NA,"400915707"
105,1,"8:41",1721,"Brandon Brown missed Jumper.",35,12,"Vanguard","Loyola Marymount",NA,"400915707"
106,1,"8:41",1721,"Victor Evans Defensive Rebound.",35,12,"Vanguard","Loyola Marymount",NA,"400915707"
107,1,"8:35",1715,"Brandon Brothers made Three Point Jumper. Assisted by Victor Evans.",35,15,"Vanguard","Loyola Marymount",NA,"400915707"
108,1,"8:21",1701,"Buay Tuach Turnover.",35,15,"Vanguard","Loyola Marymount",NA,"400915707"
109,1,"8:15",1695,"Foul on Steven Haney.",35,15,"Vanguard","Loyola Marymount",NA,"400915707"
110,1,"8:11",1691,"Zach Allmon made Dunk. Assisted by Brandon Hood.",35,17,"Vanguard","Loyola Marymount",NA,"400915707"
111,1,"8:01",1681,"Official TV Timeout",35,17,"Vanguard","Loyola Marymount",NA,"400915707"
112,1,"7:45",1665,"Jeffery McClendon missed Three Point Jumper.",35,17,"Vanguard","Loyola Marymount",NA,"400915707"
113,1,"7:45",1665,"Loyola Marymount Offensive Rebound.",35,17,"Vanguard","Loyola Marymount",NA,"400915707"
114,1,"7:37",1657,"Foul on Brandon Brothers.",35,17,"Vanguard","Loyola Marymount",NA,"400915707"
115,1,"7:28",1648,"Stefan Jovanovic missed Free Throw.",35,17,"Vanguard","Loyola Marymount",NA,"400915707"
116,1,"7:28",1648,"Loyola Marymount Deadball Team Rebound.",35,17,"Vanguard","Loyola Marymount",NA,"400915707"
117,1,"7:12",1632,"Stefan Jovanovic made Free Throw.",36,17,"Vanguard","Loyola Marymount",NA,"400915707"
118,1,"7:01",1621,"Victor Evans missed Jumper.",36,17,"Vanguard","Loyola Marymount",NA,"400915707"
119,1,"7:01",1621,"Jeffery McClendon Defensive Rebound.",36,17,"Vanguard","Loyola Marymount",NA,"400915707"
120,1,"7:01",1621,"Foul on Brandon Brothers.",36,17,"Vanguard","Loyola Marymount",NA,"400915707"
121,1,"7:01",1621,"Brandon Brown missed Free Throw.",36,17,"Vanguard","Loyola Marymount",NA,"400915707"
122,1,"7:01",1621,"Loyola Marymount Deadball Team Rebound.",36,17,"Vanguard","Loyola Marymount",NA,"400915707"
123,1,"7:01",1621,"Brandon Brown missed Free Throw.",36,17,"Vanguard","Loyola Marymount",NA,"400915707"
124,1,"7:01",1621,"Victor Evans Defensive Rebound.",36,17,"Vanguard","Loyola Marymount",NA,"400915707"
125,1,"6:59",1619,"Foul on Jeffery McClendon.",36,17,"Vanguard","Loyola Marymount",NA,"400915707"
126,1,"6:59",1619,"Zach Allmon missed Free Throw.",36,17,"Vanguard","Loyola Marymount",NA,"400915707"
127,1,"6:59",1619,"Vanguard Deadball Team Rebound.",36,17,"Vanguard","Loyola Marymount",NA,"400915707"
128,1,"6:59",1619,"Zach Allmon made Free Throw.",36,18,"Vanguard","Loyola Marymount",NA,"400915707"
129,1,"6:55",1615,"Jeffery McClendon made Layup. Assisted by Munis Tutu.",38,18,"Vanguard","Loyola Marymount",NA,"400915707"
130,1,"6:53",1613,"Shacquille Dawkins Turnover.",38,18,"Vanguard","Loyola Marymount",NA,"400915707"
131,1,"6:52",1612,"Munis Tutu Steal.",38,18,"Vanguard","Loyola Marymount",NA,"400915707"
132,1,"6:34",1594,"Mattias Markusson Turnover.",38,18,"Vanguard","Loyola Marymount",NA,"400915707"
133,1,"6:32",1592,"Shacquille Dawkins Steal.",38,18,"Vanguard","Loyola Marymount",NA,"400915707"
134,1,"6:28",1588,"Malachi Hoosein missed Three Point Jumper.",38,18,"Vanguard","Loyola Marymount",NA,"400915707"
135,1,"6:28",1588,"Zach Allmon Offensive Rebound.",38,18,"Vanguard","Loyola Marymount",NA,"400915707"
136,1,"6:23",1583,"Zach Allmon Turnover.",38,18,"Vanguard","Loyola Marymount",NA,"400915707"
137,1,"6:22",1582,"Shamar Johnson Steal.",38,18,"Vanguard","Loyola Marymount",NA,"400915707"
138,1,"6:18",1578,"Erik Johansson missed Layup.",38,18,"Vanguard","Loyola Marymount",NA,"400915707"
139,1,"6:18",1578,"Zach Allmon Defensive Rebound.",38,18,"Vanguard","Loyola Marymount",NA,"400915707"
140,1,"6:10",1570,"Foul on Shamar Johnson.",38,18,"Vanguard","Loyola Marymount",NA,"400915707"
141,1,"6:10",1570,"Victor Evans missed Free Throw.",38,18,"Vanguard","Loyola Marymount",NA,"400915707"
142,1,"6:10",1570,"Mattias Markusson Defensive Rebound.",38,18,"Vanguard","Loyola Marymount",NA,"400915707"
143,1,"5:58",1558,"Shamar Johnson made Jumper. Assisted by Steven Haney.",40,18,"Vanguard","Loyola Marymount",NA,"400915707"
144,1,"5:48",1548,"Shacquille Dawkins Turnover.",40,18,"Vanguard","Loyola Marymount",NA,"400915707"
145,1,"5:47",1547,"Shamar Johnson Steal.",40,18,"Vanguard","Loyola Marymount",NA,"400915707"
146,1,"5:32",1532,"Stefan Jovanovic made Jumper. Assisted by Buay Tuach.",42,18,"Vanguard","Loyola Marymount",NA,"400915707"
147,1,"5:14",1514,"Jamaal Lee missed Jumper.",42,18,"Vanguard","Loyola Marymount",NA,"400915707"
148,1,"5:14",1514,"Victor Evans Offensive Rebound.",42,18,"Vanguard","Loyola Marymount",NA,"400915707"
149,1,"5:10",1510,"Victor Evans made Layup.",42,20,"Vanguard","Loyola Marymount",NA,"400915707"
150,1,"5:03",1503,"Buay Tuach made Three Point Jumper. Assisted by Munis Tutu.",45,20,"Vanguard","Loyola Marymount",NA,"400915707"
151,1,"4:29",1469,"Foul on Munis Tutu.",45,20,"Vanguard","Loyola Marymount",NA,"400915707"
152,1,"4:29",1469,"Victor Evans made Free Throw.",45,21,"Vanguard","Loyola Marymount",NA,"400915707"
153,1,"4:29",1469,"Victor Evans made Free Throw.",45,22,"Vanguard","Loyola Marymount",NA,"400915707"
154,1,"4:29",1469,"Victor Evans made Free Throw.",45,23,"Vanguard","Loyola Marymount",NA,"400915707"
155,1,"4:24",1464,"Buay Tuach Turnover.",45,23,"Vanguard","Loyola Marymount",NA,"400915707"
156,1,"4:24",1464,"Foul on Buay Tuach.",45,23,"Vanguard","Loyola Marymount",NA,"400915707"
157,1,"4:18",1458,"Foul on Munis Tutu.",45,23,"Vanguard","Loyola Marymount",NA,"400915707"
158,1,"4:18",1458,"Christian Ware-Berry missed Free Throw.",45,23,"Vanguard","Loyola Marymount",NA,"400915707"
159,1,"4:18",1458,"Vanguard Deadball Team Rebound.",45,23,"Vanguard","Loyola Marymount",NA,"400915707"
160,1,"4:18",1458,"Christian Ware-Berry missed Free Throw.",45,23,"Vanguard","Loyola Marymount",NA,"400915707"
161,1,"4:18",1458,"Loyola Marymount Defensive Rebound.",45,23,"Vanguard","Loyola Marymount",NA,"400915707"
162,1,"3:55",1435,"Buay Tuach missed Three Point Jumper.",45,23,"Vanguard","Loyola Marymount",NA,"400915707"
163,1,"3:55",1435,"Stefan Jovanovic Offensive Rebound.",45,23,"Vanguard","Loyola Marymount",NA,"400915707"
164,1,"3:50",1430,"Steven Haney missed Three Point Jumper.",45,23,"Vanguard","Loyola Marymount",NA,"400915707"
165,1,"3:50",1430,"Jamaal Lee Defensive Rebound.",45,23,"Vanguard","Loyola Marymount",NA,"400915707"
166,1,"3:39",1419,"Jamaal Lee made Layup.",45,25,"Vanguard","Loyola Marymount",NA,"400915707"
167,1,"3:39",1419,"Foul on Stefan Jovanovic.",45,25,"Vanguard","Loyola Marymount",NA,"400915707"
168,1,"3:39",1419,"Official TV Timeout",45,25,"Vanguard","Loyola Marymount",NA,"400915707"
169,1,"3:39",1419,"Jamaal Lee made Free Throw.",45,26,"Vanguard","Loyola Marymount",NA,"400915707"
170,1,"3:17",1397,"Buay Tuach made Jumper. Assisted by Petr Herman.",47,26,"Vanguard","Loyola Marymount",NA,"400915707"
171,1,"3:04",1384,"Connor Kennedy Turnover.",47,26,"Vanguard","Loyola Marymount",NA,"400915707"
172,1,"3:03",1383,"Stefan Jovanovic Steal.",47,26,"Vanguard","Loyola Marymount",NA,"400915707"
173,1,"2:48",1368,"Brandon Brown missed Jumper.",47,26,"Vanguard","Loyola Marymount",NA,"400915707"
174,1,"2:48",1368,"Petr Herman Offensive Rebound.",47,26,"Vanguard","Loyola Marymount",NA,"400915707"
175,1,"2:42",1362,"Foul on Teslim Idris.",47,26,"Vanguard","Loyola Marymount",NA,"400915707"
176,1,"2:42",1362,"Petr Herman made Free Throw.",48,26,"Vanguard","Loyola Marymount",NA,"400915707"
177,1,"2:42",1362,"Petr Herman made Free Throw.",49,26,"Vanguard","Loyola Marymount",NA,"400915707"
178,1,"2:31",1351,"Zach Allmon missed Three Point Jumper.",49,26,"Vanguard","Loyola Marymount",NA,"400915707"
179,1,"2:31",1351,"Christian Ware-Berry Offensive Rebound.",49,26,"Vanguard","Loyola Marymount",NA,"400915707"
180,1,"2:27",1347,"Christian Ware-Berry missed Layup.",49,26,"Vanguard","Loyola Marymount",NA,"400915707"
181,1,"2:27",1347,"Jamaal Lee Offensive Rebound.",49,26,"Vanguard","Loyola Marymount",NA,"400915707"
182,1,"2:25",1345,"Jamaal Lee made Layup.",49,28,"Vanguard","Loyola Marymount",NA,"400915707"
183,1,"2:25",1345,"Foul on Mattias Markusson.",49,28,"Vanguard","Loyola Marymount",NA,"400915707"
184,1,"2:25",1345,"Jamaal Lee made Free Throw.",49,29,"Vanguard","Loyola Marymount",NA,"400915707"
185,1,"2:12",1332,"Jeffery McClendon made Layup. Assisted by Kelvin Amayo.",51,29,"Vanguard","Loyola Marymount",NA,"400915707"
186,1,"1:57",1317,"Shacquille Dawkins made Three Point Jumper. Assisted by Brandon Hood.",51,32,"Vanguard","Loyola Marymount",NA,"400915707"
187,1,"1:49",1309,"Kelvin Amayo missed Jumper.",51,32,"Vanguard","Loyola Marymount",NA,"400915707"
188,1,"1:49",1309,"Petr Herman Offensive Rebound.",51,32,"Vanguard","Loyola Marymount",NA,"400915707"
189,1,"1:49",1309,"Foul on Kaleb Wilborn.",51,32,"Vanguard","Loyola Marymount",NA,"400915707"
190,1,"1:49",1309,"Petr Herman made Free Throw.",52,32,"Vanguard","Loyola Marymount",NA,"400915707"
191,1,"1:49",1309,"Petr Herman made Free Throw.",53,32,"Vanguard","Loyola Marymount",NA,"400915707"
192,1,"1:26",1286,"Kaleb Wilborn missed Jumper.",53,32,"Vanguard","Loyola Marymount",NA,"400915707"
193,1,"1:26",1286,"Vanguard Offensive Rebound.",53,32,"Vanguard","Loyola Marymount",NA,"400915707"
194,1,"1:22",1282,"Christian Ware-Berry missed Three Point Jumper.",53,32,"Vanguard","Loyola Marymount",NA,"400915707"
195,1,"1:22",1282,"Brandon Brown Defensive Rebound.",53,32,"Vanguard","Loyola Marymount",NA,"400915707"
196,1,"1:15",1275,"Jeffery McClendon missed Three Point Jumper.",53,32,"Vanguard","Loyola Marymount",NA,"400915707"
197,1,"1:15",1275,"Jamaal Lee Defensive Rebound.",53,32,"Vanguard","Loyola Marymount",NA,"400915707"
198,1,"1:12",1272,"Foul on Petr Herman.",53,32,"Vanguard","Loyola Marymount",NA,"400915707"
199,1,"1:12",1272,"Jamaal Lee made Free Throw.",53,33,"Vanguard","Loyola Marymount",NA,"400915707"
200,1,"1:12",1272,"Jamaal Lee made Free Throw.",53,34,"Vanguard","Loyola Marymount",NA,"400915707"
201,1,"0:58",1258,"Jeffery McClendon made Layup. Assisted by Petr Herman.",55,34,"Vanguard","Loyola Marymount",NA,"400915707"
202,1,"0:39",1239,"Shacquille Dawkins missed Three Point Jumper.",55,34,"Vanguard","Loyola Marymount",NA,"400915707"
203,1,"0:39",1239,"Stefan Jovanovic Defensive Rebound.",55,34,"Vanguard","Loyola Marymount",NA,"400915707"
204,1,"0:18",1218,"Kelvin Amayo missed Layup.",55,34,"Vanguard","Loyola Marymount",NA,"400915707"
205,1,"0:18",1218,"Zach Allmon Block.",55,34,"Vanguard","Loyola Marymount",NA,"400915707"
206,1,"0:16",1216,"Jeffery McClendon Offensive Rebound.",55,34,"Vanguard","Loyola Marymount",NA,"400915707"
207,1,"0:11",1211,"Brandon Brown missed Three Point Jumper.",55,34,"Vanguard","Loyola Marymount",NA,"400915707"
208,1,"0:11",1211,"Petr Herman Offensive Rebound.",55,34,"Vanguard","Loyola Marymount",NA,"400915707"
209,1,"0:01",1201,"Foul on Kaleb Wilborn.",55,34,"Vanguard","Loyola Marymount",NA,"400915707"
210,1,"0:01",1201,"Brandon Brown made Free Throw.",56,34,"Vanguard","Loyola Marymount",NA,"400915707"
211,1,"0:01",1201,"Brandon Brown made Free Throw.",57,34,"Vanguard","Loyola Marymount",NA,"400915707"
212,1,"0:01",1201,"Jamaal Lee missed Jumper.",57,34,"Vanguard","Loyola Marymount",NA,"400915707"
213,1,"0:01",1201,"Jeffery McClendon Defensive Rebound.",57,34,"Vanguard","Loyola Marymount",NA,"400915707"
214,1,"0:00",1200,"End of 1st half",57,34,"Vanguard","Loyola Marymount",NA,"400915707"
215,2,"20:00",1200,"PLAY",57,34,"Vanguard","Loyola Marymount",NA,"400915707"
216,2,"19:46",1186,"Zach Allmon missed Layup.",57,34,"Vanguard","Loyola Marymount",NA,"400915707"
217,2,"19:46",1186,"Zach Allmon Offensive Rebound.",57,34,"Vanguard","Loyola Marymount",NA,"400915707"
218,2,"19:44",1184,"Zach Allmon made Layup.",57,36,"Vanguard","Loyola Marymount",NA,"400915707"
219,2,"19:21",1161,"Buay Tuach missed Jumper.",57,36,"Vanguard","Loyola Marymount",NA,"400915707"
220,2,"19:21",1161,"Victor Evans Block.",57,36,"Vanguard","Loyola Marymount",NA,"400915707"
221,2,"19:21",1161,"Loyola Marymount Offensive Rebound.",57,36,"Vanguard","Loyola Marymount",NA,"400915707"
222,2,"19:15",1155,"Brandon Brown missed Jumper.",57,36,"Vanguard","Loyola Marymount",NA,"400915707"
223,2,"19:15",1155,"Buay Tuach Offensive Rebound.",57,36,"Vanguard","Loyola Marymount",NA,"400915707"
224,2,"19:11",1151,"Buay Tuach missed Two Point Tip Shot.",57,36,"Vanguard","Loyola Marymount",NA,"400915707"
225,2,"19:11",1151,"Stefan Jovanovic Offensive Rebound.",57,36,"Vanguard","Loyola Marymount",NA,"400915707"
226,2,"19:07",1147,"Steven Haney missed Three Point Jumper.",57,36,"Vanguard","Loyola Marymount",NA,"400915707"
227,2,"19:07",1147,"Buay Tuach Offensive Rebound.",57,36,"Vanguard","Loyola Marymount",NA,"400915707"
228,2,"19:01",1141,"Foul on Zach Allmon.",57,36,"Vanguard","Loyola Marymount",NA,"400915707"
229,2,"19:01",1141,"Stefan Jovanovic made Free Throw.",58,36,"Vanguard","Loyola Marymount",NA,"400915707"
230,2,"19:01",1141,"Stefan Jovanovic made Free Throw.",59,36,"Vanguard","Loyola Marymount",NA,"400915707"
231,2,"18:57",1137,"Foul on Buay Tuach.",59,36,"Vanguard","Loyola Marymount",NA,"400915707"
232,2,"18:48",1128,"Malachi Hoosein missed Three Point Jumper.",59,36,"Vanguard","Loyola Marymount",NA,"400915707"
233,2,"18:48",1128,"Brandon Brown Defensive Rebound.",59,36,"Vanguard","Loyola Marymount",NA,"400915707"
234,2,"18:36",1116,"Stefan Jovanovic missed Layup.",59,36,"Vanguard","Loyola Marymount",NA,"400915707"
235,2,"18:36",1116,"Victor Evans Defensive Rebound.",59,36,"Vanguard","Loyola Marymount",NA,"400915707"
236,2,"18:10",1090,"Zach Allmon missed Layup.",59,36,"Vanguard","Loyola Marymount",NA,"400915707"
237,2,"18:10",1090,"Shamar Johnson Defensive Rebound.",59,36,"Vanguard","Loyola Marymount",NA,"400915707"
238,2,"18:01",1081,"Shamar Johnson made Layup. Assisted by Brandon Brown.",61,36,"Vanguard","Loyola Marymount",NA,"400915707"
239,2,"17:49",1069,"Malachi Hoosein missed Three Point Jumper.",61,36,"Vanguard","Loyola Marymount",NA,"400915707"
240,2,"17:49",1069,"Stefan Jovanovic Defensive Rebound.",61,36,"Vanguard","Loyola Marymount",NA,"400915707"
241,2,"17:37",1057,"Shamar Johnson made Layup. Assisted by Buay Tuach.",63,36,"Vanguard","Loyola Marymount",NA,"400915707"
242,2,"17:27",1047,"Victor Evans Turnover.",63,36,"Vanguard","Loyola Marymount",NA,"400915707"
243,2,"17:25",1045,"Steven Haney Steal.",63,36,"Vanguard","Loyola Marymount",NA,"400915707"
244,2,"17:23",1043,"Shamar Johnson Turnover.",63,36,"Vanguard","Loyola Marymount",NA,"400915707"
245,2,"17:23",1043,"Foul on Shamar Johnson.",63,36,"Vanguard","Loyola Marymount",NA,"400915707"
246,2,"17:09",1029,"Victor Evans missed Three Point Jumper.",63,36,"Vanguard","Loyola Marymount",NA,"400915707"
247,2,"17:09",1029,"Stefan Jovanovic Defensive Rebound.",63,36,"Vanguard","Loyola Marymount",NA,"400915707"
248,2,"17:01",1021,"Buay Tuach made Dunk. Assisted by Brandon Brown.",65,36,"Vanguard","Loyola Marymount",NA,"400915707"
249,2,"16:57",1017,"Vanguard  Timeout",65,36,"Vanguard","Loyola Marymount",NA,"400915707"
250,2,"16:38",998,"Shacquille Dawkins missed Jumper.",65,36,"Vanguard","Loyola Marymount",NA,"400915707"
