"play_id","half","time_remaining_half","secs_remaining","description","home_score","away_score","away","home","home_favored_by","game_id"
71,1,"9:32",2072,"Tyler Singleton missed Layup.",18,17,"Incarnate Word","Loyola Marymount",NA,"400915786"
72,1,"9:32",2072,"Shamar Johnson Block.",18,17,"Incarnate Word","Loyola Marymount",NA,"400915786"
73,1,"9:31",2071,"Tyler Singleton Offensive Rebound.",18,17,"Incarnate Word","Loyola Marymount",NA,"400915786"
74,1,"9:29",2069,"Sam Burmeister made Three Point Jumper. Assisted by Tyler Singleton.",18,20,"Incarnate Word","Loyola Marymount",NA,"400915786"
75,1,"9:20",2060,"Trevor Manuel missed Three Point Jumper.",18,20,"Incarnate Word","Loyola Marymount",NA,"400915786"
76,1,"9:20",2060,"Sam Burmeister Defensive Rebound.",18,20,"Incarnate Word","Loyola Marymount",NA,"400915786"
77,1,"9:10",2050,"Devin Wyatt missed Layup.",18,20,"Incarnate Word","Loyola Marymount",NA,"400915786"
78,1,"9:10",2050,"Stefan Jovanovic Defensive Rebound.",18,20,"Incarnate Word","Loyola Marymount",NA,"400915786"
79,1,"9:01",2041,"Brandon Brown made Layup.",20,20,"Incarnate Word","Loyola Marymount",NA,"400915786"
80,1,"8:43",2023,"Foul on Jeffery McClendon.",20,20,"Incarnate Word","Loyola Marymount",NA,"400915786"
81,1,"8:43",2023,"Devin Wyatt made Free Throw.",20,21,"Incarnate Word","Loyola Marymount",NA,"400915786"
82,1,"8:43",2023,"Devin Wyatt missed Free Throw.",20,21,"Incarnate Word","Loyola Marymount",NA,"400915786"
83,1,"8:43",2023,"Stefan Jovanovic Defensive Rebound.",20,21,"Incarnate Word","Loyola Marymount",NA,"400915786"
84,1,"8:23",2003,"Stefan Jovanovic made Jumper. Assisted by Brandon Brown.",22,21,"Incarnate Word","Loyola Marymount",NA,"400915786"
85,1,"8:02",1982,"Foul on Jeffery McClendon.",22,21,"Incarnate Word","Loyola Marymount",NA,"400915786"
86,1,"7:54",1974,"Sam Burmeister Turnover.",22,21,"Incarnate Word","Loyola Marymount",NA,"400915786"
87,1,"7:54",1974,"Official TV Timeout",22,21,"Incarnate Word","Loyola Marymount",NA,"400915786"
88,1,"7:37",1957,"Steven Haney missed Jumper.",22,21,"Incarnate Word","Loyola Marymount",NA,"400915786"
89,1,"7:37",1957,"Shamar Johnson Offensive Rebound.",22,21,"Incarnate Word","Loyola Marymount",NA,"400915786"
90,1,"7:34",1954,"Shamar Johnson made Layup.",24,21,"Incarnate Word","Loyola Marymount",NA,"400915786"
91,1,"7:12",1932,"Tyler Singleton made Jumper. Assisted by Jalin Hart.",24,23,"Incarnate Word","Loyola Marymount",NA,"400915786"
92,1,"6:49",1909,"Steven Haney missed Three Point Jumper.",24,23,"Incarnate Word","Loyola Marymount",NA,"400915786"
93,1,"6:49",1909,"Devin Wyatt Defensive Rebound.",24,23,"Incarnate Word","Loyola Marymount",NA,"400915786"
94,1,"6:40",1900,"Jalin Hart Turnover.",24,23,"Incarnate Word","Loyola Marymount",NA,"400915786"
95,1,"6:39",1899,"Stefan Jovanovic Steal.",24,23,"Incarnate Word","Loyola Marymount",NA,"400915786"
96,1,"6:25",1885,"Foul on Jalin Hart.",24,23,"Incarnate Word","Loyola Marymount",NA,"400915786"
97,1,"6:13",1873,"Kelvin Amayo made Layup. Assisted by Stefan Jovanovic.",26,23,"Incarnate Word","Loyola Marymount",NA,"400915786"
98,1,"5:48",1848,"Foul on Kelvin Amayo.",26,23,"Incarnate Word","Loyola Marymount",NA,"400915786"
99,1,"5:48",1848,"Simi Socks made Free Throw.",26,24,"Incarnate Word","Loyola Marymount",NA,"400915786"
100,1,"5:48",1848,"Simi Socks made Free Throw.",26,25,"Incarnate Word","Loyola Marymount",NA,"400915786"
101,1,"5:38",1838,"Brandon Brown made Layup.",28,25,"Incarnate Word","Loyola Marymount",NA,"400915786"
102,1,"5:06",1806,"Tyler Singleton made Jumper.",28,27,"Incarnate Word","Loyola Marymount",NA,"400915786"
103,1,"4:46",1786,"Foul on Tyler Singleton.",28,27,"Incarnate Word","Loyola Marymount",NA,"400915786"
104,1,"4:28",1768,"Foul on Jalin Hart.",28,27,"Incarnate Word","Loyola Marymount",NA,"400915786"
105,1,"4:18",1758,"Stefan Jovanovic made Layup.",30,27,"Incarnate Word","Loyola Marymount",NA,"400915786"
106,1,"4:03",1743,"Devin Wyatt made Dunk. Assisted by Tyler Singleton.",30,29,"Incarnate Word","Loyola Marymount",NA,"400915786"
107,1,"3:55",1735,"Kelvin Amayo Turnover.",30,29,"Incarnate Word","Loyola Marymount",NA,"400915786"
108,1,"3:55",1735,"Official TV Timeout",30,29,"Incarnate Word","Loyola Marymount",NA,"400915786"
109,1,"3:38",1718,"Jorden Kite made Three Point Jumper. Assisted by Tyler Singleton.",30,32,"Incarnate Word","Loyola Marymount",NA,"400915786"
110,1,"3:09",1689,"Trevor Manuel Turnover.",30,32,"Incarnate Word","Loyola Marymount",NA,"400915786"
111,1,"3:08",1688,"Jorden Kite Steal.",30,32,"Incarnate Word","Loyola Marymount",NA,"400915786"
112,1,"2:57",1677,"Shawn Johnson missed Jumper.",30,32,"Incarnate Word","Loyola Marymount",NA,"400915786"
113,1,"2:57",1677,"Shamar Johnson Defensive Rebound.",30,32,"Incarnate Word","Loyola Marymount",NA,"400915786"
114,1,"2:46",1666,"Stefan Jovanovic missed Jumper.",30,32,"Incarnate Word","Loyola Marymount",NA,"400915786"
115,1,"2:46",1666,"Miles Banks Defensive Rebound.",30,32,"Incarnate Word","Loyola Marymount",NA,"400915786"
116,1,"2:31",1651,"Miles Banks Turnover.",30,32,"Incarnate Word","Loyola Marymount",NA,"400915786"
117,1,"2:29",1649,"Trevor Manuel Steal.",30,32,"Incarnate Word","Loyola Marymount",NA,"400915786"
118,1,"2:20",1640,"Munis Tutu Turnover.",30,32,"Incarnate Word","Loyola Marymount",NA,"400915786"
119,1,"2:20",1640,"Jorden Kite Steal.",30,32,"Incarnate Word","Loyola Marymount",NA,"400915786"
120,1,"2:20",1640,"Incarnate Word  Timeout",30,32,"Incarnate Word","Loyola Marymount",NA,"400915786"
121,1,"2:02",1622,"Foul on Munis Tutu.",30,32,"Incarnate Word","Loyola Marymount",NA,"400915786"
122,1,"2:02",1622,"Tyler Singleton made Free Throw.",30,33,"Incarnate Word","Loyola Marymount",NA,"400915786"
123,1,"2:02",1622,"Tyler Singleton made Free Throw.",30,34,"Incarnate Word","Loyola Marymount",NA,"400915786"
124,1,"1:44",1604,"Trevor Manuel Turnover.",30,34,"Incarnate Word","Loyola Marymount",NA,"400915786"
125,1,"1:43",1603,"Jorden Kite Steal.",30,34,"Incarnate Word","Loyola Marymount",NA,"400915786"
126,1,"1:36",1596,"Simi Socks Turnover.",30,34,"Incarnate Word","Loyola Marymount",NA,"400915786"
127,1,"1:12",1572,"Kelvin Amayo missed Layup.",30,34,"Incarnate Word","Loyola Marymount",NA,"400915786"
128,1,"1:12",1572,"Mattias Markusson Offensive Rebound.",30,34,"Incarnate Word","Loyola Marymount",NA,"400915786"
129,1,"1:09",1569,"Mattias Markusson made Two Point Tip Shot.",32,34,"Incarnate Word","Loyola Marymount",NA,"400915786"
130,1,"0:53",1553,"Simi Socks missed Jumper.",32,34,"Incarnate Word","Loyola Marymount",NA,"400915786"
131,1,"0:53",1553,"Mattias Markusson Defensive Rebound.",32,34,"Incarnate Word","Loyola Marymount",NA,"400915786"
132,1,"0:45",1545,"Buay Tuach made Layup. Assisted by Kelvin Amayo.",34,34,"Incarnate Word","Loyola Marymount",NA,"400915786"
133,1,"0:32",1532,"Simi Socks Turnover.",34,34,"Incarnate Word","Loyola Marymount",NA,"400915786"
134,1,"0:32",1532,"Buay Tuach Steal.",34,34,"Incarnate Word","Loyola Marymount",NA,"400915786"
135,1,"0:32",1532,"Foul on Simi Socks.",34,34,"Incarnate Word","Loyola Marymount",NA,"400915786"
136,1,"0:14",1514,"Brandon Brown made Three Point Jumper.",37,34,"Incarnate Word","Loyola Marymount",NA,"400915786"
137,1,"0:00",1500,"End of 1st half",37,34,"Incarnate Word","Loyola Marymount",NA,"400915786"
138,2,"20:00",1500,"PLAY",37,34,"Incarnate Word","Loyola Marymount",NA,"400915786"
139,2,"19:40",1480,"Devin Wyatt missed Layup.",37,34,"Incarnate Word","Loyola Marymount",NA,"400915786"
140,2,"19:40",1480,"Simi Socks Offensive Rebound.",37,34,"Incarnate Word","Loyola Marymount",NA,"400915786"
141,2,"19:37",1477,"Simi Socks made Two Point Tip Shot.",37,36,"Incarnate Word","Loyola Marymount",NA,"400915786"
142,2,"19:21",1461,"Steven Haney missed Layup.",37,36,"Incarnate Word","Loyola Marymount",NA,"400915786"
143,2,"19:21",1461,"Jorden Kite Defensive Rebound.",37,36,"Incarnate Word","Loyola Marymount",NA,"400915786"
144,2,"19:10",1450,"Simi Socks missed Jumper.",37,36,"Incarnate Word","Loyola Marymount",NA,"400915786"
145,2,"19:10",1450,"Buay Tuach Defensive Rebound.",37,36,"Incarnate Word","Loyola Marymount",NA,"400915786"
146,2,"19:01",1441,"Buay Tuach made Layup.",39,36,"Incarnate Word","Loyola Marymount",NA,"400915786"
147,2,"18:27",1407,"Simi Socks made Jumper. Assisted by Shawn Johnson.",39,38,"Incarnate Word","Loyola Marymount",NA,"400915786"
148,2,"18:15",1395,"Shamar Johnson missed Layup.",39,38,"Incarnate Word","Loyola Marymount",NA,"400915786"
149,2,"18:15",1395,"Buay Tuach Offensive Rebound.",39,38,"Incarnate Word","Loyola Marymount",NA,"400915786"
150,2,"18:09",1389,"Buay Tuach Turnover.",39,38,"Incarnate Word","Loyola Marymount",NA,"400915786"
151,2,"18:08",1388,"Shawn Johnson Steal.",39,38,"Incarnate Word","Loyola Marymount",NA,"400915786"
152,2,"18:03",1383,"Shawn Johnson made Three Point Jumper. Assisted by Jorden Kite.",39,41,"Incarnate Word","Loyola Marymount",NA,"400915786"
153,2,"17:45",1365,"Steven Haney missed Three Point Jumper.",39,41,"Incarnate Word","Loyola Marymount",NA,"400915786"
154,2,"17:45",1365,"Shawn Johnson Defensive Rebound.",39,41,"Incarnate Word","Loyola Marymount",NA,"400915786"
155,2,"17:28",1348,"Foul on Buay Tuach.",39,41,"Incarnate Word","Loyola Marymount",NA,"400915786"
156,2,"17:28",1348,"Jalin Hart missed Free Throw.",39,41,"Incarnate Word","Loyola Marymount",NA,"400915786"
157,2,"17:28",1348,"Incarnate Word Deadball Team Rebound.",39,41,"Incarnate Word","Loyola Marymount",NA,"400915786"
158,2,"17:28",1348,"Jalin Hart missed Free Throw.",39,41,"Incarnate Word","Loyola Marymount",NA,"400915786"
159,2,"17:28",1348,"Shamar Johnson Defensive Rebound.",39,41,"Incarnate Word","Loyola Marymount",NA,"400915786"
160,2,"17:06",1326,"Stefan Jovanovic made Layup. Assisted by Brandon Brown.",41,41,"Incarnate Word","Loyola Marymount",NA,"400915786"
161,2,"17:06",1326,"Foul on Devin Wyatt.",41,41,"Incarnate Word","Loyola Marymount",NA,"400915786"
162,2,"17:06",1326,"Stefan Jovanovic made Free Throw.",42,41,"Incarnate Word","Loyola Marymount",NA,"400915786"
163,2,"16:55",1315,"Simi Socks made Jumper.",42,43,"Incarnate Word","Loyola Marymount",NA,"400915786"
164,2,"16:32",1292,"Brandon Brown missed Jumper.",42,43,"Incarnate Word","Loyola Marymount",NA,"400915786"
165,2,"16:32",1292,"Brandon Brown Offensive Rebound.",42,43,"Incarnate Word","Loyola Marymount",NA,"400915786"
166,2,"16:25",1285,"Erik Johansson made Three Point Jumper.",45,43,"Incarnate Word","Loyola Marymount",NA,"400915786"
167,2,"16:16",1276,"Jalin Hart made Layup. Assisted by Sam Burmeister.",45,45,"Incarnate Word","Loyola Marymount",NA,"400915786"
168,2,"16:08",1268,"Buay Tuach missed Three Point Jumper.",45,45,"Incarnate Word","Loyola Marymount",NA,"400915786"
169,2,"16:08",1268,"Stefan Jovanovic Offensive Rebound.",45,45,"Incarnate Word","Loyola Marymount",NA,"400915786"
170,2,"16:04",1264,"Stefan Jovanovic made Layup.",47,45,"Incarnate Word","Loyola Marymount",NA,"400915786"
171,2,"15:44",1244,"Simi Socks made Jumper. Assisted by Jalin Hart.",47,47,"Incarnate Word","Loyola Marymount",NA,"400915786"
172,2,"15:22",1222,"Buay Tuach made Layup. Assisted by Stefan Jovanovic.",49,47,"Incarnate Word","Loyola Marymount",NA,"400915786"
173,2,"15:10",1210,"Foul on Shamar Johnson.",49,47,"Incarnate Word","Loyola Marymount",NA,"400915786"
174,2,"15:10",1210,"Official TV Timeout",49,47,"Incarnate Word","Loyola Marymount",NA,"400915786"
175,2,"15:10",1210,"Sam Burmeister made Free Throw.",49,48,"Incarnate Word","Loyola Marymount",NA,"400915786"
176,2,"15:10",1210,"Sam Burmeister made Free Throw.",49,49,"Incarnate Word","Loyola Marymount",NA,"400915786"
177,2,"14:48",1188,"Brandon Brown missed Jumper.",49,49,"Incarnate Word","Loyola Marymount",NA,"400915786"
178,2,"14:48",1188,"Trevor Manuel Offensive Rebound.",49,49,"Incarnate Word","Loyola Marymount",NA,"400915786"
179,2,"14:46",1186,"Trevor Manuel made Layup.",51,49,"Incarnate Word","Loyola Marymount",NA,"400915786"
180,2,"14:29",1169,"Simi Socks made Three Point Jumper. Assisted by Shawn Johnson.",51,52,"Incarnate Word","Loyola Marymount",NA,"400915786"
181,2,"14:17",1157,"Brandon Brown Turnover.",51,52,"Incarnate Word","Loyola Marymount",NA,"400915786"
182,2,"14:16",1156,"Sam Burmeister Steal.",51,52,"Incarnate Word","Loyola Marymount",NA,"400915786"
183,2,"13:59",1139,"Miles Banks missed Layup.",51,52,"Incarnate Word","Loyola Marymount",NA,"400915786"
184,2,"13:59",1139,"Trevor Manuel Block.",51,52,"Incarnate Word","Loyola Marymount",NA,"400915786"
185,2,"13:58",1138,"Miles Banks Offensive Rebound.",51,52,"Incarnate Word","Loyola Marymount",NA,"400915786"
186,2,"13:56",1136,"Miles Banks missed Layup.",51,52,"Incarnate Word","Loyola Marymount",NA,"400915786"
187,2,"13:56",1136,"Trevor Manuel Block.",51,52,"Incarnate Word","Loyola Marymount",NA,"400915786"
188,2,"13:55",1135,"Trevor Manuel Defensive Rebound.",51,52,"Incarnate Word","Loyola Marymount",NA,"400915786"
189,2,"13:40",1120,"Foul on Miles Banks.",51,52,"Incarnate Word","Loyola Marymount",NA,"400915786"
190,2,"13:40",1120,"Trevor Manuel made Free Throw.",52,52,"Incarnate Word","Loyola Marymount",NA,"400915786"
191,2,"13:40",1120,"Trevor Manuel made Free Throw.",53,52,"Incarnate Word","Loyola Marymount",NA,"400915786"
192,2,"13:33",1113,"Shawn Johnson made Layup. Assisted by Tyler Singleton.",53,54,"Incarnate Word","Loyola Marymount",NA,"400915786"
193,2,"13:08",1088,"Kelvin Amayo missed Three Point Jumper.",53,54,"Incarnate Word","Loyola Marymount",NA,"400915786"
194,2,"13:08",1088,"Tyler Singleton Defensive Rebound.",53,54,"Incarnate Word","Loyola Marymount",NA,"400915786"
195,2,"12:59",1079,"Simi Socks Turnover.",53,54,"Incarnate Word","Loyola Marymount",NA,"400915786"
196,2,"12:47",1067,"Foul on Miles Banks.",53,54,"Incarnate Word","Loyola Marymount",NA,"400915786"
197,2,"12:47",1067,"Stefan Jovanovic Turnover.",53,54,"Incarnate Word","Loyola Marymount",NA,"400915786"
198,2,"12:47",1067,"Foul on Stefan Jovanovic.",53,54,"Incarnate Word","Loyola Marymount",NA,"400915786"
199,2,"12:34",1054,"Sam Burmeister Turnover.",53,54,"Incarnate Word","Loyola Marymount",NA,"400915786"
200,2,"12:33",1053,"Erik Johansson Steal.",53,54,"Incarnate Word","Loyola Marymount",NA,"400915786"
201,2,"12:30",1050,"Erik Johansson missed Layup.",53,54,"Incarnate Word","Loyola Marymount",NA,"400915786"
202,2,"12:30",1050,"Shawn Johnson Block.",53,54,"Incarnate Word","Loyola Marymount",NA,"400915786"
203,2,"12:29",1049,"Incarnate Word Defensive Rebound.",53,54,"Incarnate Word","Loyola Marymount",NA,"400915786"
204,2,"12:08",1028,"Shawn Johnson missed Three Point Jumper.",53,54,"Incarnate Word","Loyola Marymount",NA,"400915786"
205,2,"12:08",1028,"Stefan Jovanovic Defensive Rebound.",53,54,"Incarnate Word","Loyola Marymount",NA,"400915786"
206,2,"11:56",1016,"Trevor Manuel missed Three Point Jumper.",53,54,"Incarnate Word","Loyola Marymount",NA,"400915786"
207,2,"11:56",1016,"Shawn Johnson Defensive Rebound.",53,54,"Incarnate Word","Loyola Marymount",NA,"400915786"
208,2,"11:44",1004,"Foul on Stefan Jovanovic.",53,54,"Incarnate Word","Loyola Marymount",NA,"400915786"
209,2,"11:44",1004,"Official TV Timeout",53,54,"Incarnate Word","Loyola Marymount",NA,"400915786"
210,2,"11:44",1004,"Simi Socks made Free Throw.",53,55,"Incarnate Word","Loyola Marymount",NA,"400915786"
211,2,"11:44",1004,"Simi Socks made Free Throw.",53,56,"Incarnate Word","Loyola Marymount",NA,"400915786"
212,2,"11:29",989,"Brandon Brown Turnover.",53,56,"Incarnate Word","Loyola Marymount",NA,"400915786"
213,2,"11:27",987,"Tyler Singleton Steal.",53,56,"Incarnate Word","Loyola Marymount",NA,"400915786"
214,2,"11:26",986,"Tyler Singleton missed Layup.",53,56,"Incarnate Word","Loyola Marymount",NA,"400915786"
215,2,"11:26",986,"Jeffery McClendon Block.",53,56,"Incarnate Word","Loyola Marymount",NA,"400915786"
216,2,"11:23",983,"Jalin Hart Offensive Rebound.",53,56,"Incarnate Word","Loyola Marymount",NA,"400915786"
217,2,"11:11",971,"Jalin Hart Turnover.",53,56,"Incarnate Word","Loyola Marymount",NA,"400915786"
218,2,"11:11",971,"Kelvin Amayo Steal.",53,56,"Incarnate Word","Loyola Marymount",NA,"400915786"
219,2,"11:11",971,"Foul on Devin Wyatt.",53,56,"Incarnate Word","Loyola Marymount",NA,"400915786"
220,2,"11:11",971,"Kelvin Amayo missed Free Throw.",53,56,"Incarnate Word","Loyola Marymount",NA,"400915786"
221,2,"11:11",971,"Loyola Marymount Deadball Team Rebound.",53,56,"Incarnate Word","Loyola Marymount",NA,"400915786"
222,2,"11:11",971,"Kelvin Amayo missed Free Throw.",53,56,"Incarnate Word","Loyola Marymount",NA,"400915786"
223,2,"11:11",971,"Simi Socks Defensive Rebound.",53,56,"Incarnate Word","Loyola Marymount",NA,"400915786"
224,2,"11:11",971,"Foul on Trevor Manuel.",53,56,"Incarnate Word","Loyola Marymount",NA,"400915786"
225,2,"11:07",967,"Tyler Singleton missed Jumper.",53,56,"Incarnate Word","Loyola Marymount",NA,"400915786"
226,2,"11:07",967,"Brandon Brown Defensive Rebound.",53,56,"Incarnate Word","Loyola Marymount",NA,"400915786"
227,2,"11:03",963,"Kelvin Amayo made Layup. Assisted by Brandon Brown.",55,56,"Incarnate Word","Loyola Marymount",NA,"400915786"
228,2,"10:55",955,"Foul on Jeffery McClendon.",55,56,"Incarnate Word","Loyola Marymount",NA,"400915786"
229,2,"10:35",935,"Jalin Hart missed Layup.",55,56,"Incarnate Word","Loyola Marymount",NA,"400915786"
230,2,"10:35",935,"Trevor Manuel Block.",55,56,"Incarnate Word","Loyola Marymount",NA,"400915786"
231,2,"10:35",935,"Loyola Marymount Defensive Rebound.",55,56,"Incarnate Word","Loyola Marymount",NA,"400915786"
232,2,"10:21",921,"Brandon Brown made Layup.",57,56,"Incarnate Word","Loyola Marymount",NA,"400915786"
233,2,"10:02",902,"Devin Wyatt missed Jumper.",57,56,"Incarnate Word","Loyola Marymount",NA,"400915786"
234,2,"10:02",902,"Loyola Marymount Defensive Rebound.",57,56,"Incarnate Word","Loyola Marymount",NA,"400915786"
235,2,"9:49",889,"Brandon Brown made Jumper.",59,56,"Incarnate Word","Loyola Marymount",NA,"400915786"
236,2,"9:25",865,"Foul on Brandon Brown.",59,56,"Incarnate Word","Loyola Marymount",NA,"400915786"
237,2,"9:25",865,"Shawn Johnson made Free Throw.",59,57,"Incarnate Word","Loyola Marymount",NA,"400915786"
238,2,"9:25",865,"Shawn Johnson missed Free Throw.",59,57,"Incarnate Word","Loyola Marymount",NA,"400915786"
239,2,"9:25",865,"Stefan Jovanovic Defensive Rebound.",59,57,"Incarnate Word","Loyola Marymount",NA,"400915786"
240,2,"9:11",851,"Foul on Simi Socks.",59,57,"Incarnate Word","Loyola Marymount",NA,"400915786"
241,2,"9:11",851,"Stefan Jovanovic missed Free Throw.",59,57,"Incarnate Word","Loyola Marymount",NA,"400915786"
242,2,"9:11",851,"Loyola Marymount Deadball Team Rebound.",59,57,"Incarnate Word","Loyola Marymount",NA,"400915786"
243,2,"9:11",851,"Stefan Jovanovic missed Free Throw.",59,57,"Incarnate Word","Loyola Marymount",NA,"400915786"
244,2,"9:11",851,"Shawn Johnson Defensive Rebound.",59,57,"Incarnate Word","Loyola Marymount",NA,"400915786"
245,2,"8:57",837,"Jorden Kite made Three Point Jumper. Assisted by Jalin Hart.",59,60,"Incarnate Word","Loyola Marymount",NA,"400915786"
246,2,"8:46",826,"Trevor Manuel Turnover.",59,60,"Incarnate Word","Loyola Marymount",NA,"400915786"
247,2,"8:45",825,"Loyola Marymount  Timeout",59,60,"Incarnate Word","Loyola Marymount",NA,"400915786"
248,2,"8:29",809,"Foul on Shamar Johnson.",59,60,"Incarnate Word","Loyola Marymount",NA,"400915786"
249,2,"8:29",809,"Simi Socks made Free Throw.",59,61,"Incarnate Word","Loyola Marymount",NA,"400915786"
250,2,"8:29",809,"Simi Socks made Free Throw.",59,62,"Incarnate Word","Loyola Marymount",NA,"400915786"
251,2,"8:23",803,"Foul on Simi Socks.",59,62,"Incarnate Word","Loyola Marymount",NA,"400915786"
252,2,"8:09",789,"Trevor Manuel missed Jumper.",59,62,"Incarnate Word","Loyola Marymount",NA,"400915786"
253,2,"8:09",789,"Devin Wyatt Defensive Rebound.",59,62,"Incarnate Word","Loyola Marymount",NA,"400915786"
254,2,"7:51",771,"Simi Socks made Three Point Jumper. Assisted by Shawn Johnson.",59,65,"Incarnate Word","Loyola Marymount",NA,"400915786"
255,2,"7:27",747,"Brandon Brown made Layup.",61,65,"Incarnate Word","Loyola Marymount",NA,"400915786"
256,2,"7:27",747,"Foul on Devin Wyatt.",61,65,"Incarnate Word","Loyola Marymount",NA,"400915786"
257,2,"7:27",747,"Official TV Timeout",61,65,"Incarnate Word","Loyola Marymount",NA,"400915786"
258,2,"7:27",747,"Brandon Brown made Free Throw.",62,65,"Incarnate Word","Loyola Marymount",NA,"400915786"
259,2,"7:04",724,"Simi Socks missed Jumper.",62,65,"Incarnate Word","Loyola Marymount",NA,"400915786"
260,2,"7:04",724,"Devin Wyatt Offensive Rebound.",62,65,"Incarnate Word","Loyola Marymount",NA,"400915786"
261,2,"6:50",710,"Foul on Buay Tuach.",62,65,"Incarnate Word","Loyola Marymount",NA,"400915786"
262,2,"6:50",710,"Jorden Kite made Free Throw.",62,66,"Incarnate Word","Loyola Marymount",NA,"400915786"
263,2,"6:50",710,"Jorden Kite made Free Throw.",62,67,"Incarnate Word","Loyola Marymount",NA,"400915786"
264,2,"6:32",692,"Shamar Johnson made Layup. Assisted by Buay Tuach.",64,67,"Incarnate Word","Loyola Marymount",NA,"400915786"
265,2,"6:15",675,"Simi Socks missed Jumper.",64,67,"Incarnate Word","Loyola Marymount",NA,"400915786"
266,2,"6:15",675,"Brandon Brown Defensive Rebound.",64,67,"Incarnate Word","Loyola Marymount",NA,"400915786"
267,2,"6:00",660,"Stefan Jovanovic made Layup. Assisted by Buay Tuach.",66,67,"Incarnate Word","Loyola Marymount",NA,"400915786"
268,2,"5:39",639,"Devin Wyatt missed Jumper.",66,67,"Incarnate Word","Loyola Marymount",NA,"400915786"
269,2,"5:39",639,"Brandon Brown Defensive Rebound.",66,67,"Incarnate Word","Loyola Marymount",NA,"400915786"
270,2,"5:34",634,"Brandon Brown Turnover.",66,67,"Incarnate Word","Loyola Marymount",NA,"400915786"
271,2,"5:33",633,"Simi Socks Steal.",66,67,"Incarnate Word","Loyola Marymount",NA,"400915786"
272,2,"5:15",615,"Jalin Hart missed Jumper.",66,67,"Incarnate Word","Loyola Marymount",NA,"400915786"
273,2,"5:15",615,"Shamar Johnson Defensive Rebound.",66,67,"Incarnate Word","Loyola Marymount",NA,"400915786"
274,2,"4:59",599,"Shamar Johnson Turnover.",66,67,"Incarnate Word","Loyola Marymount",NA,"400915786"
275,2,"4:59",599,"Foul on Shamar Johnson.",66,67,"Incarnate Word","Loyola Marymount",NA,"400915786"
276,2,"4:59",599,"Simi Socks made Free Throw.",66,68,"Incarnate Word","Loyola Marymount",NA,"400915786"
277,2,"4:59",599,"Simi Socks made Free Throw.",66,69,"Incarnate Word","Loyola Marymount",NA,"400915786"
278,2,"4:37",577,"Foul on Devin Wyatt.",66,69,"Incarnate Word","Loyola Marymount",NA,"400915786"
279,2,"4:34",574,"Shamar Johnson made Free Throw.",67,69,"Incarnate Word","Loyola Marymount",NA,"400915786"
280,2,"4:34",574,"Shamar Johnson made Free Throw.",68,69,"Incarnate Word","Loyola Marymount",NA,"400915786"
281,2,"4:07",547,"Foul on Shamar Johnson.",68,69,"Incarnate Word","Loyola Marymount",NA,"400915786"
282,2,"4:07",547,"Jalin Hart made Free Throw.",68,70,"Incarnate Word","Loyola Marymount",NA,"400915786"
283,2,"4:07",547,"Jalin Hart made Free Throw.",68,71,"Incarnate Word","Loyola Marymount",NA,"400915786"
284,2,"3:55",535,"Brandon Brown missed Layup.",68,71,"Incarnate Word","Loyola Marymount",NA,"400915786"
285,2,"3:55",535,"Simi Socks Block.",68,71,"Incarnate Word","Loyola Marymount",NA,"400915786"
286,2,"3:53",533,"Brandon Brown Offensive Rebound.",68,71,"Incarnate Word","Loyola Marymount",NA,"400915786"
287,2,"3:51",531,"Buay Tuach missed Three Point Jumper.",68,71,"Incarnate Word","Loyola Marymount",NA,"400915786"
288,2,"3:51",531,"Brandon Brown Offensive Rebound.",68,71,"Incarnate Word","Loyola Marymount",NA,"400915786"
289,2,"3:29",509,"Stefan Jovanovic missed Jumper.",68,71,"Incarnate Word","Loyola Marymount",NA,"400915786"
290,2,"3:29",509,"Devin Wyatt Defensive Rebound.",68,71,"Incarnate Word","Loyola Marymount",NA,"400915786"
291,2,"3:17",497,"Incarnate Word  Timeout",68,71,"Incarnate Word","Loyola Marymount",NA,"400915786"
292,2,"3:17",497,"Official TV Timeout",68,71,"Incarnate Word","Loyola Marymount",NA,"400915786"
293,2,"3:03",483,"Jorden Kite made Three Point Jumper.",68,74,"Incarnate Word","Loyola Marymount",NA,"400915786"
294,2,"2:44",464,"Steven Haney missed Three Point Jumper.",68,74,"Incarnate Word","Loyola Marymount",NA,"400915786"
295,2,"2:44",464,"Jalin Hart Defensive Rebound.",68,74,"Incarnate Word","Loyola Marymount",NA,"400915786"
296,2,"2:28",448,"Foul on Trevor Manuel.",68,74,"Incarnate Word","Loyola Marymount",NA,"400915786"
297,2,"2:28",448,"Devin Wyatt made Free Throw.",68,75,"Incarnate Word","Loyola Marymount",NA,"400915786"
298,2,"2:28",448,"Devin Wyatt made Free Throw.",68,76,"Incarnate Word","Loyola Marymount",NA,"400915786"
299,2,"2:20",440,"Brandon Brown made Jumper.",70,76,"Incarnate Word","Loyola Marymount",NA,"400915786"
300,2,"2:00",420,"Shawn Johnson Turnover.",70,76,"Incarnate Word","Loyola Marymount",NA,"400915786"
301,2,"1:59",419,"Trevor Manuel Steal.",70,76,"Incarnate Word","Loyola Marymount",NA,"400915786"
302,2,"1:57",417,"Trevor Manuel made Dunk. Assisted by Brandon Brown.",72,76,"Incarnate Word","Loyola Marymount",NA,"400915786"
303,2,"1:24",384,"Devin Wyatt missed Layup.",72,76,"Incarnate Word","Loyola Marymount",NA,"400915786"
304,2,"1:24",384,"Trevor Manuel Block.",72,76,"Incarnate Word","Loyola Marymount",NA,"400915786"
305,2,"1:22",382,"Trevor Manuel Defensive Rebound.",72,76,"Incarnate Word","Loyola Marymount",NA,"400915786"
306,2,"1:17",377,"Foul on Shawn Johnson.",72,76,"Incarnate Word","Loyola Marymount",NA,"400915786"
307,2,"1:17",377,"Trevor Manuel made Free Throw.",73,76,"Incarnate Word","Loyola Marymount",NA,"400915786"
308,2,"1:17",377,"Trevor Manuel made Free Throw.",74,76,"Incarnate Word","Loyola Marymount",NA,"400915786"
309,2,"0:48",348,"Jorden Kite missed Three Point Jumper.",74,76,"Incarnate Word","Loyola Marymount",NA,"400915786"
310,2,"0:48",348,"Incarnate Word Offensive Rebound.",74,76,"Incarnate Word","Loyola Marymount",NA,"400915786"
311,2,"0:46",346,"Incarnate Word  Turnover.",74,76,"Incarnate Word","Loyola Marymount",NA,"400915786"
