"play_id","half","time_remaining_half","secs_remaining","description","home_score","away_score","away","home","home_favored_by","game_id"
300,2,"0:07",307,"Charles Jackson missed Free Throw.",55,55,"Prairie View A&M","Arkansas-Pine Bluff",NA,"400922260"
301,2,"0:07",307,"Yusef Yakubu Defensive Rebound.",55,55,"Prairie View A&M","Arkansas-Pine Bluff",NA,"400922260"
302,2,"0:02",302,"Kennedy McKinney missed Jumper.",55,55,"Prairie View A&M","Arkansas-Pine Bluff",NA,"400922260"
303,2,"0:02",302,"Prairie View Defensive Rebound.",55,55,"Prairie View A&M","Arkansas-Pine Bluff",NA,"400922260"
304,2,"0:00",300,"End of 2nd half",55,55,"Prairie View A&M","Arkansas-Pine Bluff",NA,"400922260"
305,3,"5:00",300,"PLAY",55,55,"Prairie View A&M","Arkansas-Pine Bluff",NA,"400922260"
306,3,"4:57",297,"Zachary Hamilton Turnover.",55,55,"Prairie View A&M","Arkansas-Pine Bluff",NA,"400922260"
307,3,"4:43",283,"Kennedy McKinney missed Layup.",55,55,"Prairie View A&M","Arkansas-Pine Bluff",NA,"400922260"
308,3,"4:43",283,"Kennedy McKinney Offensive Rebound.",55,55,"Prairie View A&M","Arkansas-Pine Bluff",NA,"400922260"
309,3,"4:40",280,"Kennedy McKinney made Two Point Tip Shot.",57,55,"Prairie View A&M","Arkansas-Pine Bluff",NA,"400922260"
310,3,"4:22",262,"Zachary Hamilton made Three Point Jumper. Assisted by Tevin Bellinger.",57,58,"Prairie View A&M","Arkansas-Pine Bluff",NA,"400922260"
311,3,"4:03",243,"Deshon Bayless Turnover.",57,58,"Prairie View A&M","Arkansas-Pine Bluff",NA,"400922260"
312,3,"4:01",241,"Tevin Bellinger Steal.",57,58,"Prairie View A&M","Arkansas-Pine Bluff",NA,"400922260"
313,3,"4:01",241,"Foul on Charles Jackson.",57,58,"Prairie View A&M","Arkansas-Pine Bluff",NA,"400922260"
314,3,"4:01",241,"Tevin Bellinger made Free Throw.",57,59,"Prairie View A&M","Arkansas-Pine Bluff",NA,"400922260"
315,3,"4:01",241,"Tevin Bellinger missed Free Throw.",57,59,"Prairie View A&M","Arkansas-Pine Bluff",NA,"400922260"
316,3,"4:01",241,"Ghiavonni Robinson Defensive Rebound.",57,59,"Prairie View A&M","Arkansas-Pine Bluff",NA,"400922260"
317,3,"3:40",220,"Trent Steen missed Jumper.",57,59,"Prairie View A&M","Arkansas-Pine Bluff",NA,"400922260"
318,3,"3:40",220,"Shay'rone Jett Defensive Rebound.",57,59,"Prairie View A&M","Arkansas-Pine Bluff",NA,"400922260"
319,3,"3:12",192,"Tevin Bellinger missed Three Point Jumper.",57,59,"Prairie View A&M","Arkansas-Pine Bluff",NA,"400922260"
320,3,"3:12",192,"Ghiavonni Robinson Defensive Rebound.",57,59,"Prairie View A&M","Arkansas-Pine Bluff",NA,"400922260"
321,3,"2:49",169,"Charles Jackson missed Layup.",57,59,"Prairie View A&M","Arkansas-Pine Bluff",NA,"400922260"
322,3,"2:49",169,"Shay'rone Jett Block.",57,59,"Prairie View A&M","Arkansas-Pine Bluff",NA,"400922260"
323,3,"2:46",166,"Shay'rone Jett Defensive Rebound.",57,59,"Prairie View A&M","Arkansas-Pine Bluff",NA,"400922260"
324,3,"2:28",148,"Zachary Hamilton missed Three Point Jumper.",57,59,"Prairie View A&M","Arkansas-Pine Bluff",NA,"400922260"
325,3,"2:28",148,"Trent Steen Defensive Rebound.",57,59,"Prairie View A&M","Arkansas-Pine Bluff",NA,"400922260"
326,3,"2:19",139,"Foul on Zachary Hamilton.",57,59,"Prairie View A&M","Arkansas-Pine Bluff",NA,"400922260"
327,3,"2:19",139,"Trent Steen made Free Throw.",58,59,"Prairie View A&M","Arkansas-Pine Bluff",NA,"400922260"
328,3,"2:19",139,"Trent Steen made Free Throw.",59,59,"Prairie View A&M","Arkansas-Pine Bluff",NA,"400922260"
329,3,"1:57",117,"Troy Thompson made Three Point Jumper. Assisted by Ja'Donta Blakley.",59,62,"Prairie View A&M","Arkansas-Pine Bluff",NA,"400922260"
330,3,"1:43",103,"Joe'Randle Toliver missed Three Point Jumper.",59,62,"Prairie View A&M","Arkansas-Pine Bluff",NA,"400922260"
331,3,"1:43",103,"Shay'rone Jett Defensive Rebound.",59,62,"Prairie View A&M","Arkansas-Pine Bluff",NA,"400922260"
332,3,"1:17",77,"Troy Thompson missed Three Point Jumper.",59,62,"Prairie View A&M","Arkansas-Pine Bluff",NA,"400922260"
333,3,"1:17",77,"Zachary Hamilton Offensive Rebound.",59,62,"Prairie View A&M","Arkansas-Pine Bluff",NA,"400922260"
334,3,"0:53",53,"Troy Thompson Turnover.",59,62,"Prairie View A&M","Arkansas-Pine Bluff",NA,"400922260"
335,3,"0:32",32,"Ghiavonni Robinson missed Three Point Jumper.",59,62,"Prairie View A&M","Arkansas-Pine Bluff",NA,"400922260"
336,3,"0:32",32,"Troy Thompson Defensive Rebound.",59,62,"Prairie View A&M","Arkansas-Pine Bluff",NA,"400922260"
337,3,"0:32",32,"Foul on Charles Jackson.",59,62,"Prairie View A&M","Arkansas-Pine Bluff",NA,"400922260"
338,3,"0:32",32,"Troy Thompson made Free Throw.",59,63,"Prairie View A&M","Arkansas-Pine Bluff",NA,"400922260"
339,3,"0:32",32,"Troy Thompson missed Free Throw.",59,63,"Prairie View A&M","Arkansas-Pine Bluff",NA,"400922260"
340,3,"0:32",32,"Ghiavonni Robinson Defensive Rebound.",59,63,"Prairie View A&M","Arkansas-Pine Bluff",NA,"400922260"
341,3,"0:22",22,"Joe'Randle Toliver missed Three Point Jumper.",59,63,"Prairie View A&M","Arkansas-Pine Bluff",NA,"400922260"
342,3,"0:22",22,"Trent Steen Offensive Rebound.",59,63,"Prairie View A&M","Arkansas-Pine Bluff",NA,"400922260"
343,3,"0:22",22,"Foul on Zachary Hamilton.",59,63,"Prairie View A&M","Arkansas-Pine Bluff",NA,"400922260"
344,3,"0:22",22,"Trent Steen made Free Throw.",60,63,"Prairie View A&M","Arkansas-Pine Bluff",NA,"400922260"
345,3,"0:22",22,"Trent Steen made Free Throw.",61,63,"Prairie View A&M","Arkansas-Pine Bluff",NA,"400922260"
346,3,"0:21",21,"Tevin Bellinger Turnover.",61,63,"Prairie View A&M","Arkansas-Pine Bluff",NA,"400922260"
347,3,"0:17",17,"Kennedy McKinney made Layup.",63,63,"Prairie View A&M","Arkansas-Pine Bluff",NA,"400922260"
348,3,"0:17",17,"Kennedy McKinney missed Free Throw.",63,63,"Prairie View A&M","Arkansas-Pine Bluff",NA,"400922260"
349,3,"0:13",13,"Prairie View Defensive Rebound.",63,63,"Prairie View A&M","Arkansas-Pine Bluff",NA,"400922260"
350,3,"0:03",3,"Tevin Bellinger Turnover.",63,63,"Prairie View A&M","Arkansas-Pine Bluff",NA,"400922260"
351,3,"0:03",3,"Arkansas-Pine Bluff  Timeout",63,63,"Prairie View A&M","Arkansas-Pine Bluff",NA,"400922260"
352,3,"0:00",0,"Ghiavonni Robinson missed Three Point Jumper.",63,63,"Prairie View A&M","Arkansas-Pine Bluff",NA,"400922260"
353,3,"0:00",0,"Prairie View Defensive Rebound.",63,63,"Prairie View A&M","Arkansas-Pine Bluff",NA,"400922260"
354,3,"0:00",0,"End of 1st overtime",63,63,"Prairie View A&M","Arkansas-Pine Bluff",NA,"400922260"
1,1,"20:00",2400,"PLAY",0,0,"Alabama State","Prairie View A&M",7,"400919982"
2,1,"20:00",2400,"Jump Ball won by Prairie View",0,0,"Alabama State","Prairie View A&M",7,"400919982"
3,1,"19:35",2375,"Zachary Hamilton made Three Point Jumper. Assisted by Tevin Bellinger.",3,0,"Alabama State","Prairie View A&M",7,"400919982"
4,1,"19:35",2375,"Alabama State  Turnover.",3,0,"Alabama State","Prairie View A&M",7,"400919982"
5,1,"19:35",2375,"Troy Thompson Turnover.",3,0,"Alabama State","Prairie View A&M",7,"400919982"
6,1,"18:59",2339,"Torloft Thomas missed Jumper.",3,0,"Alabama State","Prairie View A&M",7,"400919982"
7,1,"18:59",2339,"Prairie View Defensive Rebound.",3,0,"Alabama State","Prairie View A&M",7,"400919982"
8,1,"18:59",2339,"Foul on Amir Warnock.",3,0,"Alabama State","Prairie View A&M",7,"400919982"
9,1,"18:59",2339,"Tevin Bellinger missed Jumper.",3,0,"Alabama State","Prairie View A&M",7,"400919982"
10,1,"18:59",2339,"Troy Thompson missed Three Point Jumper.",3,0,"Alabama State","Prairie View A&M",7,"400919982"
11,1,"18:14",2294,"Tony Armstrong Defensive Rebound.",3,0,"Alabama State","Prairie View A&M",7,"400919982"
12,1,"17:23",2243,"Rodney Simeon Turnover.",3,0,"Alabama State","Prairie View A&M",7,"400919982"
13,1,"17:03",2223,"Troy Thompson made Three Point Jumper. Assisted by Zachary Hamilton.",6,0,"Alabama State","Prairie View A&M",7,"400919982"
14,1,"16:50",2210,"Tony Armstrong made Jumper. Assisted by Terrance LeFlore.",6,2,"Alabama State","Prairie View A&M",7,"400919982"
15,1,"16:38",2198,"Troy Thompson Turnover.",6,2,"Alabama State","Prairie View A&M",7,"400919982"
16,1,"16:26",2186,"Glenn Hollaway missed Three Point Jumper.",6,2,"Alabama State","Prairie View A&M",7,"400919982"
17,1,"16:26",2186,"Steve Rogers Offensive Rebound.",6,2,"Alabama State","Prairie View A&M",7,"400919982"
18,1,"16:21",2181,"Steve Rogers Turnover.",6,2,"Alabama State","Prairie View A&M",7,"400919982"
19,1,"16:21",2181,"Ja'Donta Blakley Steal.",6,2,"Alabama State","Prairie View A&M",7,"400919982"
20,1,"16:21",2181,"Tony Armstrong Offensive Rebound.",6,2,"Alabama State","Prairie View A&M",7,"400919982"
21,1,"16:17",2177,"Ja'Donta Blakley made Layup.",8,2,"Alabama State","Prairie View A&M",7,"400919982"
22,1,"15:54",2154,"Ja'Donta Blakley Steal.",8,2,"Alabama State","Prairie View A&M",7,"400919982"
23,1,"15:54",2154,"Troy Thompson Offensive Rebound.",8,2,"Alabama State","Prairie View A&M",7,"400919982"
24,1,"15:54",2154,"Terrance LeFlore Turnover.",8,2,"Alabama State","Prairie View A&M",7,"400919982"
25,1,"15:50",2150,"Troy Thompson missed Layup.",8,2,"Alabama State","Prairie View A&M",7,"400919982"
26,1,"15:50",2150,"Terrance LeFlore Defensive Rebound.",8,2,"Alabama State","Prairie View A&M",7,"400919982"
27,1,"15:35",2135,"Foul on Ja'Donta Blakley.",8,2,"Alabama State","Prairie View A&M",7,"400919982"
28,1,"15:35",2135,"Official TV Timeout",8,2,"Alabama State","Prairie View A&M",7,"400919982"
29,1,"15:35",2135,"Rodney Simeon missed Free Throw.",8,2,"Alabama State","Prairie View A&M",7,"400919982"
30,1,"15:35",2135,"Alabama State Deadball Team Rebound.",8,2,"Alabama State","Prairie View A&M",7,"400919982"
31,1,"15:35",2135,"Rodney Simeon missed Free Throw.",8,2,"Alabama State","Prairie View A&M",7,"400919982"
32,1,"15:35",2135,"Shay'rone Jett Defensive Rebound.",8,2,"Alabama State","Prairie View A&M",7,"400919982"
33,1,"15:30",2130,"Zachary Hamilton missed Three Point Jumper.",8,2,"Alabama State","Prairie View A&M",7,"400919982"
34,1,"15:30",2130,"Terrance LeFlore Defensive Rebound.",8,2,"Alabama State","Prairie View A&M",7,"400919982"
35,1,"15:09",2109,"Rodney Simeon Turnover.",8,2,"Alabama State","Prairie View A&M",7,"400919982"
36,1,"14:50",2090,"Ja'Donta Blakley Turnover.",8,2,"Alabama State","Prairie View A&M",7,"400919982"
37,1,"14:50",2090,"Jump Ball won by Alabama State",8,2,"Alabama State","Prairie View A&M",7,"400919982"
38,1,"14:35",2075,"Terrance LeFlore missed Three Point Jumper.",8,2,"Alabama State","Prairie View A&M",7,"400919982"
39,1,"14:22",2062,"Tony Armstrong missed Layup.",8,2,"Alabama State","Prairie View A&M",7,"400919982"
40,1,"14:22",2062,"Shay'rone Jett Block.",8,2,"Alabama State","Prairie View A&M",7,"400919982"
41,1,"14:22",2062,"Alabama State Offensive Rebound.",8,2,"Alabama State","Prairie View A&M",7,"400919982"
42,1,"14:18",2058,"Steve Rogers missed Three Point Jumper.",8,2,"Alabama State","Prairie View A&M",7,"400919982"
43,1,"14:18",2058,"Zachary Hamilton Defensive Rebound.",8,2,"Alabama State","Prairie View A&M",7,"400919982"
44,1,"14:03",2043,"Tevin Bellinger made Jumper.",10,2,"Alabama State","Prairie View A&M",7,"400919982"
45,1,"13:33",2013,"Tony Armstrong missed Jumper.",10,2,"Alabama State","Prairie View A&M",7,"400919982"
46,1,"13:33",2013,"Zachary Hamilton Defensive Rebound.",10,2,"Alabama State","Prairie View A&M",7,"400919982"
47,1,"13:13",1993,"Nolan Wilson Turnover.",10,2,"Alabama State","Prairie View A&M",7,"400919982"
48,1,"13:13",1993,"Tony Armstrong Steal.",10,2,"Alabama State","Prairie View A&M",7,"400919982"
49,1,"12:46",1966,"Jump Ball won by Prairie View",10,2,"Alabama State","Prairie View A&M",7,"400919982"
50,1,"12:46",1966,"Glenn Hollaway Turnover.",10,2,"Alabama State","Prairie View A&M",7,"400919982"
51,1,"12:24",1944,"Zachary Hamilton Turnover.",10,2,"Alabama State","Prairie View A&M",7,"400919982"
52,1,"12:14",1934,"Rodney Simeon made Jumper.",10,4,"Alabama State","Prairie View A&M",7,"400919982"
53,1,"11:52",1912,"Jordan Giddings missed Jumper.",10,4,"Alabama State","Prairie View A&M",7,"400919982"
54,1,"11:52",1912,"Amir Warnock Block.",10,4,"Alabama State","Prairie View A&M",7,"400919982"
55,1,"11:52",1912,"Corvon Butler Defensive Rebound.",10,4,"Alabama State","Prairie View A&M",7,"400919982"
56,1,"11:41",1901,"Steve Rogers Turnover.",10,4,"Alabama State","Prairie View A&M",7,"400919982"
57,1,"11:41",1901,"Official TV Timeout",10,4,"Alabama State","Prairie View A&M",7,"400919982"
58,1,"11:31",1891,"Avery Lomax missed Layup.",10,4,"Alabama State","Prairie View A&M",7,"400919982"
59,1,"11:31",1891,"Amir Warnock Defensive Rebound.",10,4,"Alabama State","Prairie View A&M",7,"400919982"
60,1,"11:13",1873,"Torloft Thomas missed Three Point Jumper.",10,4,"Alabama State","Prairie View A&M",7,"400919982"
61,1,"11:13",1873,"Rodney Simeon Offensive Rebound.",10,4,"Alabama State","Prairie View A&M",7,"400919982"
62,1,"11:07",1867,"Rodney Simeon made Layup.",10,6,"Alabama State","Prairie View A&M",7,"400919982"
63,1,"10:59",1859,"Foul on Amir Warnock.",10,6,"Alabama State","Prairie View A&M",7,"400919982"
64,1,"10:59",1859,"Tevin Bellinger made Free Throw.",11,6,"Alabama State","Prairie View A&M",7,"400919982"
65,1,"10:59",1859,"Tevin Bellinger made Free Throw.",12,6,"Alabama State","Prairie View A&M",7,"400919982"
66,1,"10:49",1849,"Foul on Yusef Yakubu.",12,6,"Alabama State","Prairie View A&M",7,"400919982"
67,1,"10:47",1847,"Steve Rogers missed Three Point Jumper.",12,6,"Alabama State","Prairie View A&M",7,"400919982"
68,1,"10:47",1847,"Jordan Lumpkins Defensive Rebound.",12,6,"Alabama State","Prairie View A&M",7,"400919982"
69,1,"10:20",1820,"Tevin Bellinger made Three Point Jumper.",15,6,"Alabama State","Prairie View A&M",7,"400919982"
70,1,"10:20",1820,"Zachary Hamilton Turnover.",15,6,"Alabama State","Prairie View A&M",7,"400919982"
71,1,"10:07",1807,"Yusef Yakubu Steal.",15,6,"Alabama State","Prairie View A&M",7,"400919982"
72,1,"9:59",1799,"Yusef Yakubu missed Three Point Jumper.",15,6,"Alabama State","Prairie View A&M",7,"400919982"
73,1,"9:43",1783,"Foul on Corvon Butler.",15,6,"Alabama State","Prairie View A&M",7,"400919982"
74,1,"9:40",1780,"Zachary Hamilton missed Jumper.",15,6,"Alabama State","Prairie View A&M",7,"400919982"
75,1,"9:40",1780,"Steve Rogers Defensive Rebound.",15,6,"Alabama State","Prairie View A&M",7,"400919982"
76,1,"9:29",1769,"Terrance LeFlore made Three Point Jumper. Assisted by Rodney Simeon.",15,9,"Alabama State","Prairie View A&M",7,"400919982"
77,1,"9:08",1748,"Zachary Hamilton missed Jumper.",15,9,"Alabama State","Prairie View A&M",7,"400919982"
78,1,"9:08",1748,"Corvon Butler Defensive Rebound.",15,9,"Alabama State","Prairie View A&M",7,"400919982"
79,1,"9:00",1740,"Steve Rogers missed Three Point Jumper.",15,9,"Alabama State","Prairie View A&M",7,"400919982"
80,1,"9:00",1740,"Zachary Hamilton Defensive Rebound.",15,9,"Alabama State","Prairie View A&M",7,"400919982"
81,1,"8:35",1715,"Ja'Donta Blakley Turnover.",15,9,"Alabama State","Prairie View A&M",7,"400919982"
82,1,"8:16",1696,"Tony Armstrong Turnover.",15,9,"Alabama State","Prairie View A&M",7,"400919982"
83,1,"8:16",1696,"Tevin Bellinger Steal.",15,9,"Alabama State","Prairie View A&M",7,"400919982"
84,1,"8:09",1689,"Zachary Hamilton missed Layup.",15,9,"Alabama State","Prairie View A&M",7,"400919982"
85,1,"8:09",1689,"Yusef Yakubu Offensive Rebound.",15,9,"Alabama State","Prairie View A&M",7,"400919982"
86,1,"8:09",1689,"Reginald Gee missed Jumper.",15,9,"Alabama State","Prairie View A&M",7,"400919982"
87,1,"7:53",1673,"Zachary Hamilton missed Jumper.",15,9,"Alabama State","Prairie View A&M",7,"400919982"
88,1,"7:53",1673,"Alabama State Defensive Rebound.",15,9,"Alabama State","Prairie View A&M",7,"400919982"
89,1,"7:50",1670,"Official TV Timeout",15,9,"Alabama State","Prairie View A&M",7,"400919982"
90,1,"7:42",1662,"Rodney Simeon missed Three Point Jumper.",15,9,"Alabama State","Prairie View A&M",7,"400919982"
91,1,"7:42",1662,"Jordan Giddings Defensive Rebound.",15,9,"Alabama State","Prairie View A&M",7,"400919982"
92,1,"7:29",1649,"Zachary Hamilton made Three Point Jumper. Assisted by Jordan Giddings.",18,9,"Alabama State","Prairie View A&M",7,"400919982"
93,1,"7:11",1631,"Reginald Gee made Three Point Jumper. Assisted by Terrance LeFlore.",18,12,"Alabama State","Prairie View A&M",7,"400919982"
94,1,"6:52",1612,"Tevin Bellinger made Three Point Jumper. Assisted by Ja'Donta Blakley.",21,12,"Alabama State","Prairie View A&M",7,"400919982"
95,1,"6:43",1603,"Reginald Gee missed Three Point Jumper.",21,12,"Alabama State","Prairie View A&M",7,"400919982"
96,1,"6:43",1603,"Jordan Giddings Defensive Rebound.",21,12,"Alabama State","Prairie View A&M",7,"400919982"
97,1,"6:26",1586,"Zachary Hamilton missed Jumper.",21,12,"Alabama State","Prairie View A&M",7,"400919982"
98,1,"6:26",1586,"Corvon Butler Block.",21,12,"Alabama State","Prairie View A&M",7,"400919982"
99,1,"6:26",1586,"Prairie View Offensive Rebound.",21,12,"Alabama State","Prairie View A&M",7,"400919982"
100,1,"6:25",1585,"Jordan Giddings Turnover.",21,12,"Alabama State","Prairie View A&M",7,"400919982"
101,1,"6:12",1572,"Reginald Gee Turnover.",21,12,"Alabama State","Prairie View A&M",7,"400919982"
102,1,"5:45",1545,"Shay'rone Jett missed Jumper.",21,12,"Alabama State","Prairie View A&M",7,"400919982"
103,1,"5:45",1545,"Shay'rone Jett Offensive Rebound.",21,12,"Alabama State","Prairie View A&M",7,"400919982"
104,1,"5:37",1537,"Foul on Tony Armstrong.",21,12,"Alabama State","Prairie View A&M",7,"400919982"
105,1,"5:37",1537,"Shay'rone Jett made Free Throw.",22,12,"Alabama State","Prairie View A&M",7,"400919982"
106,1,"5:37",1537,"Shay'rone Jett missed Free Throw.",22,12,"Alabama State","Prairie View A&M",7,"400919982"
107,1,"5:37",1537,"Tony Armstrong Defensive Rebound.",22,12,"Alabama State","Prairie View A&M",7,"400919982"
108,1,"5:23",1523,"Reginald Gee missed Layup.",22,12,"Alabama State","Prairie View A&M",7,"400919982"
109,1,"5:23",1523,"Shay'rone Jett Block.",22,12,"Alabama State","Prairie View A&M",7,"400919982"
110,1,"5:23",1523,"Reginald Gee Offensive Rebound.",22,12,"Alabama State","Prairie View A&M",7,"400919982"
111,1,"5:22",1522,"Reginald Gee made Jumper.",22,14,"Alabama State","Prairie View A&M",7,"400919982"
112,1,"5:22",1522,"Foul on Jordan Lumpkins.",22,14,"Alabama State","Prairie View A&M",7,"400919982"
113,1,"5:22",1522,"Reginald Gee made Free Throw.",22,15,"Alabama State","Prairie View A&M",7,"400919982"
114,1,"5:04",1504,"Zachary Hamilton missed Three Point Jumper.",22,15,"Alabama State","Prairie View A&M",7,"400919982"
115,1,"5:04",1504,"Shay'rone Jett Offensive Rebound.",22,15,"Alabama State","Prairie View A&M",7,"400919982"
116,1,"4:54",1494,"Tevin Bellinger made Layup.",24,15,"Alabama State","Prairie View A&M",7,"400919982"
117,1,"4:42",1482,"Terrance LeFlore made Three Point Jumper. Assisted by Tony Armstrong.",24,18,"Alabama State","Prairie View A&M",7,"400919982"
118,1,"4:24",1464,"Shay'rone Jett made Jumper. Assisted by Zachary Hamilton.",26,18,"Alabama State","Prairie View A&M",7,"400919982"
119,1,"4:14",1454,"Terrance LeFlore Turnover.",26,18,"Alabama State","Prairie View A&M",7,"400919982"
120,1,"4:14",1454,"Ja'Donta Blakley Steal.",26,18,"Alabama State","Prairie View A&M",7,"400919982"
121,1,"4:08",1448,"Tevin Bellinger made Layup. Assisted by Ja'Donta Blakley.",28,18,"Alabama State","Prairie View A&M",7,"400919982"
122,1,"3:38",1418,"Foul on Shay'rone Jett.",28,18,"Alabama State","Prairie View A&M",7,"400919982"
123,1,"3:38",1418,"Official TV Timeout",28,18,"Alabama State","Prairie View A&M",7,"400919982"
124,1,"3:26",1406,"Tony Armstrong missed Layup.",28,18,"Alabama State","Prairie View A&M",7,"400919982"
125,1,"3:26",1406,"Rodney Simeon Offensive Rebound.",28,18,"Alabama State","Prairie View A&M",7,"400919982"
126,1,"3:16",1396,"Rodney Simeon made Layup.",28,20,"Alabama State","Prairie View A&M",7,"400919982"
127,1,"3:09",1389,"Avery Lomax missed Jumper.",28,20,"Alabama State","Prairie View A&M",7,"400919982"
128,1,"3:09",1389,"Reginald Gee Defensive Rebound.",28,20,"Alabama State","Prairie View A&M",7,"400919982"
129,1,"3:09",1389,"Tony Armstrong Offensive Rebound.",28,20,"Alabama State","Prairie View A&M",7,"400919982"
130,1,"2:55",1375,"Tony Armstrong missed Jumper.",28,20,"Alabama State","Prairie View A&M",7,"400919982"
131,1,"2:55",1375,"Zachary Hamilton Defensive Rebound.",28,20,"Alabama State","Prairie View A&M",7,"400919982"
132,1,"2:32",1352,"Jordan Giddings missed Jumper.",28,20,"Alabama State","Prairie View A&M",7,"400919982"
133,1,"2:17",1337,"Foul on Nolan Wilson.",28,20,"Alabama State","Prairie View A&M",7,"400919982"
134,1,"2:16",1336,"Jordan Giddings made Jumper.",30,20,"Alabama State","Prairie View A&M",7,"400919982"
135,1,"2:16",1336,"Rodney Simeon made Layup. Assisted by Tony Armstrong.",30,22,"Alabama State","Prairie View A&M",7,"400919982"
136,1,"2:02",1322,"Nolan Wilson Offensive Rebound.",30,22,"Alabama State","Prairie View A&M",7,"400919982"
137,1,"1:57",1317,"Terrance LeFlore Defensive Rebound.",30,22,"Alabama State","Prairie View A&M",7,"400919982"
138,1,"1:29",1289,"Tony Armstrong made Jumper.",30,24,"Alabama State","Prairie View A&M",7,"400919982"
139,1,"1:29",1289,"Foul on Nolan Wilson.",30,24,"Alabama State","Prairie View A&M",7,"400919982"
140,1,"1:29",1289,"Tony Armstrong made Free Throw.",30,25,"Alabama State","Prairie View A&M",7,"400919982"
141,1,"1:17",1277,"Avery Lomax made Jumper.",32,25,"Alabama State","Prairie View A&M",7,"400919982"
142,1,"0:55",1255,"Terrance LeFlore missed Layup.",32,25,"Alabama State","Prairie View A&M",7,"400919982"
143,1,"0:55",1255,"Tony Armstrong Offensive Rebound.",32,25,"Alabama State","Prairie View A&M",7,"400919982"
144,1,"0:47",1247,"Rodney Simeon missed Three Point Jumper.",32,25,"Alabama State","Prairie View A&M",7,"400919982"
145,1,"0:47",1247,"Jordan Giddings Defensive Rebound.",32,25,"Alabama State","Prairie View A&M",7,"400919982"
146,1,"0:32",1232,"Prairie View  Timeout",32,25,"Alabama State","Prairie View A&M",7,"400919982"
147,1,"0:28",1228,"Avery Lomax Turnover.",32,25,"Alabama State","Prairie View A&M",7,"400919982"
148,1,"0:18",1218,"Alabama State  Timeout",32,25,"Alabama State","Prairie View A&M",7,"400919982"
149,1,"0:05",1205,"Foul on Tevin Bellinger.",32,25,"Alabama State","Prairie View A&M",7,"400919982"
150,1,"0:05",1205,"Reginald Gee made Free Throw.",32,26,"Alabama State","Prairie View A&M",7,"400919982"
151,1,"0:05",1205,"Reginald Gee made Free Throw.",32,27,"Alabama State","Prairie View A&M",7,"400919982"
152,1,"0:03",1203,"Tevin Bellinger missed Jumper.",32,27,"Alabama State","Prairie View A&M",7,"400919982"
153,1,"0:03",1203,"Prairie View Offensive Rebound.",32,27,"Alabama State","Prairie View A&M",7,"400919982"
154,1,"0:00",1200,"End of 1st half",32,27,"Alabama State","Prairie View A&M",7,"400919982"
155,2,"20:00",1200,"PLAY",32,27,"Alabama State","Prairie View A&M",7,"400919982"
156,2,"20:00",1200,"Jump Ball won by Alabama State",32,27,"Alabama State","Prairie View A&M",7,"400919982"
157,2,"19:54",1194,"Terrance LeFlore made Three Point Jumper. Assisted by Torloft Thomas.",32,30,"Alabama State","Prairie View A&M",7,"400919982"
158,2,"19:35",1175,"Troy Thompson Turnover.",32,30,"Alabama State","Prairie View A&M",7,"400919982"
159,2,"19:35",1175,"Foul on Troy Thompson.",32,30,"Alabama State","Prairie View A&M",7,"400919982"
160,2,"19:25",1165,"Reginald Gee made Three Point Jumper.",32,33,"Alabama State","Prairie View A&M",7,"400919982"
161,2,"18:58",1138,"Ja'Donta Blakley missed Jumper.",32,33,"Alabama State","Prairie View A&M",7,"400919982"
162,2,"18:58",1138,"Tony Armstrong Defensive Rebound.",32,33,"Alabama State","Prairie View A&M",7,"400919982"
163,2,"18:34",1114,"Foul on Prairie View.",32,33,"Alabama State","Prairie View A&M",7,"400919982"
164,2,"18:34",1114,"Terrance LeFlore missed Free Throw.",32,33,"Alabama State","Prairie View A&M",7,"400919982"
165,2,"18:34",1114,"Foul on Tevin Bellinger.",32,33,"Alabama State","Prairie View A&M",7,"400919982"
166,2,"18:34",1114,"Alabama State Deadball Team Rebound.",32,33,"Alabama State","Prairie View A&M",7,"400919982"
167,2,"18:34",1114,"Terrance LeFlore made Free Throw.",32,34,"Alabama State","Prairie View A&M",7,"400919982"
168,2,"18:26",1106,"Foul on Terrance LeFlore.",32,34,"Alabama State","Prairie View A&M",7,"400919982"
169,2,"18:08",1088,"Foul on Tony Armstrong.",32,34,"Alabama State","Prairie View A&M",7,"400919982"
170,2,"18:08",1088,"Tevin Bellinger made Free Throw.",33,34,"Alabama State","Prairie View A&M",7,"400919982"
171,2,"18:08",1088,"Tevin Bellinger made Free Throw.",34,34,"Alabama State","Prairie View A&M",7,"400919982"
172,2,"17:50",1070,"Foul on Tony Armstrong.",34,34,"Alabama State","Prairie View A&M",7,"400919982"
173,2,"17:50",1070,"Tony Armstrong Turnover.",34,34,"Alabama State","Prairie View A&M",7,"400919982"
174,2,"17:42",1062,"Shay'rone Jett made Jumper. Assisted by Tevin Bellinger.",36,34,"Alabama State","Prairie View A&M",7,"400919982"
175,2,"17:27",1047,"Rodney Simeon missed Jumper.",36,34,"Alabama State","Prairie View A&M",7,"400919982"
176,2,"17:27",1047,"Ja'Donta Blakley Defensive Rebound.",36,34,"Alabama State","Prairie View A&M",7,"400919982"
177,2,"17:20",1040,"Ja'Donta Blakley made Layup. Assisted by Troy Thompson.",38,34,"Alabama State","Prairie View A&M",7,"400919982"
178,2,"17:20",1040,"Foul on Amir Warnock.",38,34,"Alabama State","Prairie View A&M",7,"400919982"
179,2,"17:20",1040,"Shay'rone Jett made Free Throw.",39,34,"Alabama State","Prairie View A&M",7,"400919982"
180,2,"16:55",1015,"Reginald Gee missed Three Point Jumper.",39,34,"Alabama State","Prairie View A&M",7,"400919982"
181,2,"16:55",1015,"Tevin Bellinger Defensive Rebound.",39,34,"Alabama State","Prairie View A&M",7,"400919982"
182,2,"16:55",1015,"Terrance LeFlore Offensive Rebound.",39,34,"Alabama State","Prairie View A&M",7,"400919982"
183,2,"16:47",1007,"Troy Thompson missed Three Point Jumper.",39,34,"Alabama State","Prairie View A&M",7,"400919982"
184,2,"16:47",1007,"Zachary Hamilton Offensive Rebound.",39,34,"Alabama State","Prairie View A&M",7,"400919982"
