"play_id","half","time_remaining_half","secs_remaining","description","home_score","away_score","away","home","home_favored_by","game_id"
106,1,"7:13",1633,"Zachary Hamilton made Free Throw.",29,19,"Prairie View A&M","Houston",NA,"400916520"
107,1,"7:13",1633,"Zachary Hamilton made Free Throw.",29,20,"Prairie View A&M","Houston",NA,"400916520"
108,1,"6:46",1606,"Damyean Dotson made Jumper. Assisted by Rob Gray Jr..",31,20,"Prairie View A&M","Houston",NA,"400916520"
109,1,"6:39",1599,"Zachary Hamilton Turnover.",31,20,"Prairie View A&M","Houston",NA,"400916520"
110,1,"6:26",1586,"Rob Gray Jr. made Three Point Jumper. Assisted by Damyean Dotson.",34,20,"Prairie View A&M","Houston",NA,"400916520"
111,1,"6:15",1575,"Foul on Armoni Brooks.",34,20,"Prairie View A&M","Houston",NA,"400916520"
112,1,"6:15",1575,"Shaquille Preston missed Free Throw.",34,20,"Prairie View A&M","Houston",NA,"400916520"
113,1,"6:15",1575,"Prairie View Deadball Team Rebound.",34,20,"Prairie View A&M","Houston",NA,"400916520"
114,1,"6:15",1575,"Shaquille Preston made Free Throw.",34,21,"Prairie View A&M","Houston",NA,"400916520"
115,1,"6:02",1562,"Armoni Brooks missed Three Point Jumper.",34,21,"Prairie View A&M","Houston",NA,"400916520"
116,1,"6:02",1562,"Damyean Dotson Offensive Rebound.",34,21,"Prairie View A&M","Houston",NA,"400916520"
117,1,"5:56",1556,"Rob Gray Jr. missed Jumper.",34,21,"Prairie View A&M","Houston",NA,"400916520"
118,1,"5:56",1556,"Armoni Brooks Offensive Rebound.",34,21,"Prairie View A&M","Houston",NA,"400916520"
119,1,"5:45",1545,"Wes VanBeck Turnover.",34,21,"Prairie View A&M","Houston",NA,"400916520"
120,1,"5:44",1544,"L.J. Westbrook Steal.",34,21,"Prairie View A&M","Houston",NA,"400916520"
121,1,"5:41",1541,"L.J. Westbrook missed Layup.",34,21,"Prairie View A&M","Houston",NA,"400916520"
122,1,"5:41",1541,"Wes VanBeck Block.",34,21,"Prairie View A&M","Houston",NA,"400916520"
123,1,"5:39",1539,"Wes VanBeck Defensive Rebound.",34,21,"Prairie View A&M","Houston",NA,"400916520"
124,1,"5:27",1527,"Damyean Dotson made Layup.",36,21,"Prairie View A&M","Houston",NA,"400916520"
125,1,"5:27",1527,"Foul on Zachary Hamilton.",36,21,"Prairie View A&M","Houston",NA,"400916520"
126,1,"5:27",1527,"Damyean Dotson missed Free Throw.",36,21,"Prairie View A&M","Houston",NA,"400916520"
127,1,"5:27",1527,"Damyean Dotson Offensive Rebound.",36,21,"Prairie View A&M","Houston",NA,"400916520"
128,1,"5:24",1524,"Damyean Dotson missed Jumper.",36,21,"Prairie View A&M","Houston",NA,"400916520"
129,1,"5:24",1524,"Damyean Dotson Offensive Rebound.",36,21,"Prairie View A&M","Houston",NA,"400916520"
130,1,"5:20",1520,"Damyean Dotson missed Two Point Tip Shot.",36,21,"Prairie View A&M","Houston",NA,"400916520"
131,1,"5:20",1520,"Shaquille Preston Defensive Rebound.",36,21,"Prairie View A&M","Houston",NA,"400916520"
132,1,"5:14",1514,"Tevin Bellinger made Layup. Assisted by Shaquille Preston.",36,23,"Prairie View A&M","Houston",NA,"400916520"
133,1,"4:54",1494,"Damyean Dotson missed Layup.",36,23,"Prairie View A&M","Houston",NA,"400916520"
134,1,"4:54",1494,"Lavonne Davis Defensive Rebound.",36,23,"Prairie View A&M","Houston",NA,"400916520"
135,1,"4:45",1485,"L.J. Westbrook missed Layup.",36,23,"Prairie View A&M","Houston",NA,"400916520"
136,1,"4:45",1485,"Wes VanBeck Defensive Rebound.",36,23,"Prairie View A&M","Houston",NA,"400916520"
137,1,"4:44",1484,"Foul on Lavonne Davis.",36,23,"Prairie View A&M","Houston",NA,"400916520"
138,1,"4:44",1484,"Wes VanBeck missed Free Throw.",36,23,"Prairie View A&M","Houston",NA,"400916520"
139,1,"4:44",1484,"Rob Gray Jr. Offensive Rebound.",36,23,"Prairie View A&M","Houston",NA,"400916520"
140,1,"4:22",1462,"Galen Robinson Jr. missed Jumper.",36,23,"Prairie View A&M","Houston",NA,"400916520"
141,1,"4:22",1462,"Lavonne Davis Defensive Rebound.",36,23,"Prairie View A&M","Houston",NA,"400916520"
142,1,"4:15",1455,"Tevin Bellinger missed Three Point Jumper.",36,23,"Prairie View A&M","Houston",NA,"400916520"
143,1,"4:15",1455,"Armoni Brooks Defensive Rebound.",36,23,"Prairie View A&M","Houston",NA,"400916520"
144,1,"4:02",1442,"Foul on Nolan Wilson.",36,23,"Prairie View A&M","Houston",NA,"400916520"
145,1,"4:02",1442,"Rob Gray Jr. made Free Throw.",37,23,"Prairie View A&M","Houston",NA,"400916520"
146,1,"4:02",1442,"Rob Gray Jr. made Free Throw.",38,23,"Prairie View A&M","Houston",NA,"400916520"
147,1,"3:44",1424,"Troy Thompson missed Three Point Jumper.",38,23,"Prairie View A&M","Houston",NA,"400916520"
148,1,"3:44",1424,"Rob Gray Jr. Defensive Rebound.",38,23,"Prairie View A&M","Houston",NA,"400916520"
149,1,"3:33",1413,"Devin Davis missed Layup.",38,23,"Prairie View A&M","Houston",NA,"400916520"
150,1,"3:33",1413,"Zachary Hamilton Block.",38,23,"Prairie View A&M","Houston",NA,"400916520"
151,1,"3:32",1412,"Zachary Hamilton Defensive Rebound.",38,23,"Prairie View A&M","Houston",NA,"400916520"
152,1,"3:30",1410,"Foul on Galen Robinson Jr..",38,23,"Prairie View A&M","Houston",NA,"400916520"
153,1,"3:30",1410,"Official TV Timeout",38,23,"Prairie View A&M","Houston",NA,"400916520"
154,1,"3:30",1410,"Shaquille Preston made Free Throw.",38,24,"Prairie View A&M","Houston",NA,"400916520"
155,1,"3:30",1410,"Shaquille Preston made Free Throw.",38,25,"Prairie View A&M","Houston",NA,"400916520"
156,1,"3:12",1392,"Foul on Lavonne Davis.",38,25,"Prairie View A&M","Houston",NA,"400916520"
157,1,"3:12",1392,"Wes VanBeck made Free Throw.",39,25,"Prairie View A&M","Houston",NA,"400916520"
158,1,"3:12",1392,"Wes VanBeck made Free Throw.",40,25,"Prairie View A&M","Houston",NA,"400916520"
159,1,"2:54",1374,"Daquan Cook made Jumper. Assisted by L.J. Westbrook.",40,27,"Prairie View A&M","Houston",NA,"400916520"
160,1,"2:27",1347,"Wes VanBeck missed Jumper.",40,27,"Prairie View A&M","Houston",NA,"400916520"
161,1,"2:27",1347,"Lavonne Davis Defensive Rebound.",40,27,"Prairie View A&M","Houston",NA,"400916520"
162,1,"2:08",1328,"Lavonne Davis Turnover.",40,27,"Prairie View A&M","Houston",NA,"400916520"
163,1,"1:58",1318,"Foul on Jordan Giddings.",40,27,"Prairie View A&M","Houston",NA,"400916520"
164,1,"1:58",1318,"Devin Davis missed Free Throw.",40,27,"Prairie View A&M","Houston",NA,"400916520"
165,1,"1:58",1318,"Houston Deadball Team Rebound.",40,27,"Prairie View A&M","Houston",NA,"400916520"
166,1,"1:58",1318,"Devin Davis made Free Throw.",41,27,"Prairie View A&M","Houston",NA,"400916520"
167,1,"1:29",1289,"Foul on Devin Davis.",41,27,"Prairie View A&M","Houston",NA,"400916520"
168,1,"1:29",1289,"Shay'rone Jett missed Free Throw.",41,27,"Prairie View A&M","Houston",NA,"400916520"
169,1,"1:29",1289,"Danrad Knowles Defensive Rebound.",41,27,"Prairie View A&M","Houston",NA,"400916520"
170,1,"1:19",1279,"Rob Gray Jr. made Three Point Jumper. Assisted by Damyean Dotson.",44,27,"Prairie View A&M","Houston",NA,"400916520"
171,1,"1:02",1262,"Foul on Danrad Knowles.",44,27,"Prairie View A&M","Houston",NA,"400916520"
172,1,"1:02",1262,"Shay'rone Jett made Free Throw.",44,28,"Prairie View A&M","Houston",NA,"400916520"
173,1,"1:02",1262,"Shay'rone Jett made Free Throw.",44,29,"Prairie View A&M","Houston",NA,"400916520"
174,1,"0:55",1255,"Damyean Dotson made Jumper. Assisted by Rob Gray Jr..",46,29,"Prairie View A&M","Houston",NA,"400916520"
175,1,"0:23",1223,"Avery Lomax missed Jumper.",46,29,"Prairie View A&M","Houston",NA,"400916520"
176,1,"0:23",1223,"Morris Dunnigan Defensive Rebound.",46,29,"Prairie View A&M","Houston",NA,"400916520"
177,1,"0:14",1214,"Houston  Timeout",46,29,"Prairie View A&M","Houston",NA,"400916520"
178,1,"0:04",1204,"Foul on Daquan Cook.",46,29,"Prairie View A&M","Houston",NA,"400916520"
179,1,"0:04",1204,"Rob Gray Jr. missed Free Throw.",46,29,"Prairie View A&M","Houston",NA,"400916520"
180,1,"0:04",1204,"Houston Deadball Team Rebound.",46,29,"Prairie View A&M","Houston",NA,"400916520"
181,1,"0:04",1204,"Rob Gray Jr. made Free Throw.",47,29,"Prairie View A&M","Houston",NA,"400916520"
182,1,"0:00",1200,"Tevin Bellinger missed Jumper.",47,29,"Prairie View A&M","Houston",NA,"400916520"
183,1,"0:00",1200,"Damyean Dotson Defensive Rebound.",47,29,"Prairie View A&M","Houston",NA,"400916520"
184,1,"0:00",1200,"End of 1st half",47,29,"Prairie View A&M","Houston",NA,"400916520"
185,2,"20:00",1200,"PLAY",47,29,"Prairie View A&M","Houston",NA,"400916520"
186,2,"19:48",1188,"Daquan Cook missed Jumper.",47,29,"Prairie View A&M","Houston",NA,"400916520"
187,2,"19:48",1188,"Kyle Meyer Block.",47,29,"Prairie View A&M","Houston",NA,"400916520"
188,2,"19:46",1186,"Shaquille Preston Offensive Rebound.",47,29,"Prairie View A&M","Houston",NA,"400916520"
189,2,"19:43",1183,"Shaquille Preston Turnover.",47,29,"Prairie View A&M","Houston",NA,"400916520"
190,2,"19:16",1156,"Devin Davis made Jumper. Assisted by Galen Robinson Jr..",49,29,"Prairie View A&M","Houston",NA,"400916520"
191,2,"19:06",1146,"Shaquille Preston Turnover.",49,29,"Prairie View A&M","Houston",NA,"400916520"
192,2,"18:48",1128,"Galen Robinson Jr. made Layup.",51,29,"Prairie View A&M","Houston",NA,"400916520"
193,2,"18:23",1103,"Ja'Donta Blakley Turnover.",51,29,"Prairie View A&M","Houston",NA,"400916520"
194,2,"18:21",1101,"Damyean Dotson Steal.",51,29,"Prairie View A&M","Houston",NA,"400916520"
195,2,"18:17",1097,"Devin Davis made Layup. Assisted by Galen Robinson Jr..",53,29,"Prairie View A&M","Houston",NA,"400916520"
196,2,"18:15",1095,"Prairie View  Timeout",53,29,"Prairie View A&M","Houston",NA,"400916520"
197,2,"17:51",1071,"Foul on Kyle Meyer.",53,29,"Prairie View A&M","Houston",NA,"400916520"
198,2,"17:51",1071,"Lavonne Davis missed Free Throw.",53,29,"Prairie View A&M","Houston",NA,"400916520"
199,2,"17:51",1071,"Prairie View Deadball Team Rebound.",53,29,"Prairie View A&M","Houston",NA,"400916520"
200,2,"17:51",1071,"Lavonne Davis made Free Throw.",53,30,"Prairie View A&M","Houston",NA,"400916520"
201,2,"17:32",1052,"Foul on Ja'Donta Blakley.",53,30,"Prairie View A&M","Houston",NA,"400916520"
202,2,"17:32",1052,"Devin Davis missed Free Throw.",53,30,"Prairie View A&M","Houston",NA,"400916520"
203,2,"17:32",1052,"Houston Deadball Team Rebound.",53,30,"Prairie View A&M","Houston",NA,"400916520"
204,2,"17:32",1052,"Devin Davis missed Free Throw.",53,30,"Prairie View A&M","Houston",NA,"400916520"
205,2,"17:32",1052,"Lavonne Davis Defensive Rebound.",53,30,"Prairie View A&M","Houston",NA,"400916520"
206,2,"17:31",1051,"Foul on Kyle Meyer.",53,30,"Prairie View A&M","Houston",NA,"400916520"
207,2,"17:05",1025,"Shaquille Preston Turnover.",53,30,"Prairie View A&M","Houston",NA,"400916520"
208,2,"16:37",997,"Rob Gray Jr. Turnover.",53,30,"Prairie View A&M","Houston",NA,"400916520"
209,2,"16:36",996,"Lavonne Davis Steal.",53,30,"Prairie View A&M","Houston",NA,"400916520"
210,2,"16:33",993,"L.J. Westbrook Turnover.",53,30,"Prairie View A&M","Houston",NA,"400916520"
211,2,"16:31",991,"Rob Gray Jr. Steal.",53,30,"Prairie View A&M","Houston",NA,"400916520"
212,2,"16:28",988,"Damyean Dotson made Three Point Jumper. Assisted by Galen Robinson Jr..",56,30,"Prairie View A&M","Houston",NA,"400916520"
213,2,"16:09",969,"Daquan Cook missed Three Point Jumper.",56,30,"Prairie View A&M","Houston",NA,"400916520"
214,2,"16:09",969,"Damyean Dotson Defensive Rebound.",56,30,"Prairie View A&M","Houston",NA,"400916520"
215,2,"16:00",960,"Devin Davis made Dunk. Assisted by Damyean Dotson.",58,30,"Prairie View A&M","Houston",NA,"400916520"
216,2,"15:52",952,"Foul on Galen Robinson Jr..",58,30,"Prairie View A&M","Houston",NA,"400916520"
217,2,"15:52",952,"Official TV Timeout",58,30,"Prairie View A&M","Houston",NA,"400916520"
218,2,"15:52",952,"L.J. Westbrook made Free Throw.",58,31,"Prairie View A&M","Houston",NA,"400916520"
219,2,"15:52",952,"L.J. Westbrook made Free Throw.",58,32,"Prairie View A&M","Houston",NA,"400916520"
220,2,"15:40",940,"Kyle Meyer Turnover.",58,32,"Prairie View A&M","Houston",NA,"400916520"
221,2,"15:38",938,"Shaquille Preston Steal.",58,32,"Prairie View A&M","Houston",NA,"400916520"
222,2,"15:35",935,"Foul on Wes VanBeck.",58,32,"Prairie View A&M","Houston",NA,"400916520"
223,2,"15:35",935,"Lavonne Davis made Free Throw.",58,33,"Prairie View A&M","Houston",NA,"400916520"
224,2,"15:35",935,"Lavonne Davis missed Free Throw.",58,33,"Prairie View A&M","Houston",NA,"400916520"
225,2,"15:35",935,"Danrad Knowles Defensive Rebound.",58,33,"Prairie View A&M","Houston",NA,"400916520"
226,2,"15:13",913,"Danrad Knowles missed Jumper.",58,33,"Prairie View A&M","Houston",NA,"400916520"
227,2,"15:13",913,"L.J. Westbrook Defensive Rebound.",58,33,"Prairie View A&M","Houston",NA,"400916520"
228,2,"15:06",906,"Foul on Lavonne Davis.",58,33,"Prairie View A&M","Houston",NA,"400916520"
229,2,"15:06",906,"Lavonne Davis Turnover.",58,33,"Prairie View A&M","Houston",NA,"400916520"
230,2,"14:49",889,"Danrad Knowles made Layup. Assisted by Galen Robinson Jr..",60,33,"Prairie View A&M","Houston",NA,"400916520"
231,2,"14:42",882,"Foul on Devin Davis.",60,33,"Prairie View A&M","Houston",NA,"400916520"
232,2,"14:39",879,"Zachary Hamilton missed Jumper.",60,33,"Prairie View A&M","Houston",NA,"400916520"
233,2,"14:39",879,"Danrad Knowles Block.",60,33,"Prairie View A&M","Houston",NA,"400916520"
234,2,"14:38",878,"Galen Robinson Jr. Defensive Rebound.",60,33,"Prairie View A&M","Houston",NA,"400916520"
235,2,"14:22",862,"Devin Davis made Jumper. Assisted by Rob Gray Jr..",62,33,"Prairie View A&M","Houston",NA,"400916520"
236,2,"14:02",842,"Tevin Bellinger Turnover.",62,33,"Prairie View A&M","Houston",NA,"400916520"
237,2,"13:49",829,"Galen Robinson Jr. made Jumper.",64,33,"Prairie View A&M","Houston",NA,"400916520"
238,2,"13:39",819,"Foul on Shaquille Preston.",64,33,"Prairie View A&M","Houston",NA,"400916520"
239,2,"13:39",819,"Shaquille Preston Turnover.",64,33,"Prairie View A&M","Houston",NA,"400916520"
240,2,"13:27",807,"Rob Gray Jr. missed Jumper.",64,33,"Prairie View A&M","Houston",NA,"400916520"
241,2,"13:27",807,"Zachary Hamilton Defensive Rebound.",64,33,"Prairie View A&M","Houston",NA,"400916520"
242,2,"13:21",801,"Foul on Wes VanBeck.",64,33,"Prairie View A&M","Houston",NA,"400916520"
243,2,"13:16",796,"Zachary Hamilton missed Three Point Jumper.",64,33,"Prairie View A&M","Houston",NA,"400916520"
244,2,"13:16",796,"Rob Gray Jr. Defensive Rebound.",64,33,"Prairie View A&M","Houston",NA,"400916520"
245,2,"13:09",789,"Rob Gray Jr. made Jumper.",66,33,"Prairie View A&M","Houston",NA,"400916520"
246,2,"12:43",763,"Tevin Bellinger missed Three Point Jumper.",66,33,"Prairie View A&M","Houston",NA,"400916520"
247,2,"12:43",763,"Galen Robinson Jr. Defensive Rebound.",66,33,"Prairie View A&M","Houston",NA,"400916520"
248,2,"12:35",755,"Wes VanBeck made Three Point Jumper. Assisted by Galen Robinson Jr..",69,33,"Prairie View A&M","Houston",NA,"400916520"
249,2,"12:16",736,"Daquan Cook made Three Point Jumper. Assisted by Tevin Bellinger.",69,36,"Prairie View A&M","Houston",NA,"400916520"
250,2,"11:57",717,"Armoni Brooks missed Jumper.",69,36,"Prairie View A&M","Houston",NA,"400916520"
251,2,"11:57",717,"Damyean Dotson Offensive Rebound.",69,36,"Prairie View A&M","Houston",NA,"400916520"
252,2,"11:53",713,"Damyean Dotson made Two Point Tip Shot.",71,36,"Prairie View A&M","Houston",NA,"400916520"
253,2,"11:43",703,"Foul on Wes VanBeck.",71,36,"Prairie View A&M","Houston",NA,"400916520"
254,2,"11:43",703,"Official TV Timeout",71,36,"Prairie View A&M","Houston",NA,"400916520"
255,2,"11:43",703,"Troy Thompson missed Free Throw.",71,36,"Prairie View A&M","Houston",NA,"400916520"
256,2,"11:43",703,"Damyean Dotson Defensive Rebound.",71,36,"Prairie View A&M","Houston",NA,"400916520"
257,2,"11:27",687,"Foul on Jordan Giddings.",71,36,"Prairie View A&M","Houston",NA,"400916520"
258,2,"11:13",673,"Armoni Brooks made Three Point Jumper. Assisted by Galen Robinson Jr..",74,36,"Prairie View A&M","Houston",NA,"400916520"
259,2,"11:07",667,"Troy Thompson Turnover.",74,36,"Prairie View A&M","Houston",NA,"400916520"
260,2,"10:55",655,"Wes VanBeck made Layup.",76,36,"Prairie View A&M","Houston",NA,"400916520"
261,2,"10:55",655,"Foul on Daquan Cook.",76,36,"Prairie View A&M","Houston",NA,"400916520"
262,2,"10:55",655,"Wes VanBeck missed Free Throw.",76,36,"Prairie View A&M","Houston",NA,"400916520"
263,2,"10:55",655,"JD Wallace Defensive Rebound.",76,36,"Prairie View A&M","Houston",NA,"400916520"
264,2,"10:54",654,"Foul on Devin Davis.",76,36,"Prairie View A&M","Houston",NA,"400916520"
265,2,"10:54",654,"Zachary Hamilton made Free Throw.",76,37,"Prairie View A&M","Houston",NA,"400916520"
266,2,"10:54",654,"Zachary Hamilton missed Free Throw.",76,37,"Prairie View A&M","Houston",NA,"400916520"
267,2,"10:54",654,"JD Wallace Offensive Rebound.",76,37,"Prairie View A&M","Houston",NA,"400916520"
268,2,"10:53",653,"Foul on Wes VanBeck.",76,37,"Prairie View A&M","Houston",NA,"400916520"
269,2,"10:53",653,"JD Wallace missed Free Throw.",76,37,"Prairie View A&M","Houston",NA,"400916520"
270,2,"10:53",653,"Rob Gray Jr. Defensive Rebound.",76,37,"Prairie View A&M","Houston",NA,"400916520"
271,2,"10:43",643,"Rob Gray Jr. Turnover.",76,37,"Prairie View A&M","Houston",NA,"400916520"
272,2,"10:42",642,"Zachary Hamilton Steal.",76,37,"Prairie View A&M","Houston",NA,"400916520"
273,2,"10:39",639,"Foul on Morris Dunnigan.",76,37,"Prairie View A&M","Houston",NA,"400916520"
274,2,"10:39",639,"Zachary Hamilton made Free Throw.",76,38,"Prairie View A&M","Houston",NA,"400916520"
275,2,"10:39",639,"Zachary Hamilton made Free Throw.",76,39,"Prairie View A&M","Houston",NA,"400916520"
276,2,"10:21",621,"Morris Dunnigan made Jumper.",78,39,"Prairie View A&M","Houston",NA,"400916520"
277,2,"10:02",602,"Ja'Donta Blakley made Jumper.",78,41,"Prairie View A&M","Houston",NA,"400916520"
278,2,"9:43",583,"Rob Gray Jr. missed Layup.",78,41,"Prairie View A&M","Houston",NA,"400916520"
279,2,"9:43",583,"Rob Gray Jr. Offensive Rebound.",78,41,"Prairie View A&M","Houston",NA,"400916520"
280,2,"9:39",579,"Foul on Ja'Donta Blakley.",78,41,"Prairie View A&M","Houston",NA,"400916520"
281,2,"9:38",578,"Armoni Brooks missed Three Point Jumper.",78,41,"Prairie View A&M","Houston",NA,"400916520"
282,2,"9:38",578,"Devin Davis Offensive Rebound.",78,41,"Prairie View A&M","Houston",NA,"400916520"
283,2,"9:34",574,"Foul on Lavonne Davis.",78,41,"Prairie View A&M","Houston",NA,"400916520"
284,2,"9:34",574,"Devin Davis made Free Throw.",79,41,"Prairie View A&M","Houston",NA,"400916520"
285,2,"9:34",574,"Devin Davis missed Free Throw.",79,41,"Prairie View A&M","Houston",NA,"400916520"
286,2,"9:34",574,"Armoni Brooks Offensive Rebound.",79,41,"Prairie View A&M","Houston",NA,"400916520"
287,2,"9:25",565,"Foul on Zachary Hamilton.",79,41,"Prairie View A&M","Houston",NA,"400916520"
288,2,"9:25",565,"Galen Robinson Jr. made Free Throw.",80,41,"Prairie View A&M","Houston",NA,"400916520"
289,2,"9:25",565,"Galen Robinson Jr. missed Free Throw.",80,41,"Prairie View A&M","Houston",NA,"400916520"
290,2,"9:25",565,"Devin Davis Offensive Rebound.",80,41,"Prairie View A&M","Houston",NA,"400916520"
291,2,"9:24",564,"Foul on Daquan Cook.",80,41,"Prairie View A&M","Houston",NA,"400916520"
292,2,"9:24",564,"Devin Davis made Free Throw.",81,41,"Prairie View A&M","Houston",NA,"400916520"
293,2,"9:24",564,"Devin Davis missed Free Throw.",81,41,"Prairie View A&M","Houston",NA,"400916520"
294,2,"9:24",564,"Armoni Brooks Offensive Rebound.",81,41,"Prairie View A&M","Houston",NA,"400916520"
295,2,"9:16",556,"Morris Dunnigan made Layup.",83,41,"Prairie View A&M","Houston",NA,"400916520"
296,2,"9:16",556,"Foul on Tevin Bellinger.",83,41,"Prairie View A&M","Houston",NA,"400916520"
297,2,"9:16",556,"Morris Dunnigan made Free Throw.",84,41,"Prairie View A&M","Houston",NA,"400916520"
298,2,"8:59",539,"Zachary Hamilton missed Three Point Jumper.",84,41,"Prairie View A&M","Houston",NA,"400916520"
299,2,"8:59",539,"Morris Dunnigan Defensive Rebound.",84,41,"Prairie View A&M","Houston",NA,"400916520"
300,2,"8:43",523,"Rob Gray Jr. missed Jumper.",84,41,"Prairie View A&M","Houston",NA,"400916520"
301,2,"8:43",523,"Zachary Hamilton Defensive Rebound.",84,41,"Prairie View A&M","Houston",NA,"400916520"
302,2,"8:33",513,"Foul on Morris Dunnigan.",84,41,"Prairie View A&M","Houston",NA,"400916520"
303,2,"8:33",513,"Jordan Giddings missed Free Throw.",84,41,"Prairie View A&M","Houston",NA,"400916520"
304,2,"8:33",513,"Prairie View Deadball Team Rebound.",84,41,"Prairie View A&M","Houston",NA,"400916520"
305,2,"8:33",513,"Jordan Giddings made Free Throw.",84,42,"Prairie View A&M","Houston",NA,"400916520"
306,2,"8:22",502,"Rob Gray Jr. missed Layup.",84,42,"Prairie View A&M","Houston",NA,"400916520"
307,2,"8:22",502,"Danrad Knowles Offensive Rebound.",84,42,"Prairie View A&M","Houston",NA,"400916520"
308,2,"8:09",489,"Morris Dunnigan missed Jumper.",84,42,"Prairie View A&M","Houston",NA,"400916520"
309,2,"8:09",489,"Jordan Giddings Defensive Rebound.",84,42,"Prairie View A&M","Houston",NA,"400916520"
310,2,"8:01",481,"Jordan Giddings made Jumper.",84,44,"Prairie View A&M","Houston",NA,"400916520"
311,2,"7:38",458,"Armoni Brooks missed Jumper.",84,44,"Prairie View A&M","Houston",NA,"400916520"
312,2,"7:38",458,"Danrad Knowles Offensive Rebound.",84,44,"Prairie View A&M","Houston",NA,"400916520"
313,2,"7:35",455,"Danrad Knowles made Two Point Tip Shot.",86,44,"Prairie View A&M","Houston",NA,"400916520"
314,2,"7:17",437,"Avery Lomax made Layup.",86,46,"Prairie View A&M","Houston",NA,"400916520"
315,2,"7:01",421,"Wes VanBeck missed Three Point Jumper.",86,46,"Prairie View A&M","Houston",NA,"400916520"
316,2,"7:01",421,"Avery Lomax Defensive Rebound.",86,46,"Prairie View A&M","Houston",NA,"400916520"
317,2,"6:52",412,"Avery Lomax made Layup.",86,48,"Prairie View A&M","Houston",NA,"400916520"
318,2,"6:45",405,"Houston  Timeout",86,48,"Prairie View A&M","Houston",NA,"400916520"
319,2,"6:24",384,"Xavier Dupree made Jumper. Assisted by Wes VanBeck.",88,48,"Prairie View A&M","Houston",NA,"400916520"
320,2,"6:14",374,"Jordan Giddings missed Jumper.",88,48,"Prairie View A&M","Houston",NA,"400916520"
321,2,"6:14",374,"Xavier Dupree Block.",88,48,"Prairie View A&M","Houston",NA,"400916520"
322,2,"6:13",373,"Jordan Giddings Offensive Rebound.",88,48,"Prairie View A&M","Houston",NA,"400916520"
323,2,"6:08",368,"Zachary Hamilton made Three Point Jumper. Assisted by Avery Lomax.",88,51,"Prairie View A&M","Houston",NA,"400916520"
324,2,"5:51",351,"Foul on L.J. Westbrook.",88,51,"Prairie View A&M","Houston",NA,"400916520"
325,2,"5:51",351,"Morris Dunnigan made Free Throw.",89,51,"Prairie View A&M","Houston",NA,"400916520"
326,2,"5:51",351,"Morris Dunnigan made Free Throw.",90,51,"Prairie View A&M","Houston",NA,"400916520"
327,2,"5:40",340,"Jordan Giddings Turnover.",90,51,"Prairie View A&M","Houston",NA,"400916520"
328,2,"5:30",330,"Armoni Brooks missed Three Point Jumper.",90,51,"Prairie View A&M","Houston",NA,"400916520"
329,2,"5:30",330,"Danrad Knowles Offensive Rebound.",90,51,"Prairie View A&M","Houston",NA,"400916520"
330,2,"5:28",328,"Foul on L.J. Westbrook.",90,51,"Prairie View A&M","Houston",NA,"400916520"
331,2,"5:28",328,"Danrad Knowles made Free Throw.",91,51,"Prairie View A&M","Houston",NA,"400916520"
332,2,"5:28",328,"Danrad Knowles made Free Throw.",92,51,"Prairie View A&M","Houston",NA,"400916520"
333,2,"5:14",314,"Avery Lomax made Jumper.",92,53,"Prairie View A&M","Houston",NA,"400916520"
334,2,"4:53",293,"Morris Dunnigan missed Three Point Jumper.",92,53,"Prairie View A&M","Houston",NA,"400916520"
335,2,"4:53",293,"Zachary Hamilton Defensive Rebound.",92,53,"Prairie View A&M","Houston",NA,"400916520"
336,2,"4:51",291,"Foul on Danrad Knowles.",92,53,"Prairie View A&M","Houston",NA,"400916520"
337,2,"4:51",291,"Zachary Hamilton made Free Throw.",92,54,"Prairie View A&M","Houston",NA,"400916520"
338,2,"4:51",291,"Zachary Hamilton made Free Throw.",92,55,"Prairie View A&M","Houston",NA,"400916520"
339,2,"4:27",267,"Morris Dunnigan missed Layup.",92,55,"Prairie View A&M","Houston",NA,"400916520"
340,2,"4:27",267,"Zachary Hamilton Block.",92,55,"Prairie View A&M","Houston",NA,"400916520"
341,2,"4:27",267,"Houston Offensive Rebound.",92,55,"Prairie View A&M","Houston",NA,"400916520"
342,2,"4:25",265,"Danrad Knowles Turnover.",92,55,"Prairie View A&M","Houston",NA,"400916520"
343,2,"4:24",264,"Tevin Bellinger Steal.",92,55,"Prairie View A&M","Houston",NA,"400916520"
344,2,"4:20",260,"L.J. Westbrook missed Three Point Jumper.",92,55,"Prairie View A&M","Houston",NA,"400916520"
345,2,"4:20",260,"Armoni Brooks Defensive Rebound.",92,55,"Prairie View A&M","Houston",NA,"400916520"
346,2,"3:56",236,"Wes VanBeck made Jumper.",94,55,"Prairie View A&M","Houston",NA,"400916520"
347,2,"3:42",222,"Zachary Hamilton missed Three Point Jumper.",94,55,"Prairie View A&M","Houston",NA,"400916520"
348,2,"3:42",222,"Xavier Dupree Defensive Rebound.",94,55,"Prairie View A&M","Houston",NA,"400916520"
349,2,"3:35",215,"Foul on Avery Lomax.",94,55,"Prairie View A&M","Houston",NA,"400916520"
350,2,"3:35",215,"Official TV Timeout",94,55,"Prairie View A&M","Houston",NA,"400916520"
351,2,"3:35",215,"Wes VanBeck missed Free Throw.",94,55,"Prairie View A&M","Houston",NA,"400916520"
352,2,"3:35",215,"Houston Deadball Team Rebound.",94,55,"Prairie View A&M","Houston",NA,"400916520"
353,2,"3:35",215,"Wes VanBeck made Free Throw.",95,55,"Prairie View A&M","Houston",NA,"400916520"
354,2,"3:26",206,"Daquan Cook missed Three Point Jumper.",95,55,"Prairie View A&M","Houston",NA,"400916520"
355,2,"3:26",206,"Xavier Dupree Defensive Rebound.",95,55,"Prairie View A&M","Houston",NA,"400916520"
356,2,"3:03",183,"Foul on Jordan Giddings.",97,55,"Prairie View A&M","Houston",NA,"400916520"
357,2,"3:03",183,"Danrad Knowles missed Free Throw.",97,55,"Prairie View A&M","Houston",NA,"400916520"
358,2,"3:03",183,"Jordan Giddings Defensive Rebound.",97,55,"Prairie View A&M","Houston",NA,"400916520"
359,2,"3:03",183,"Danrad Knowles made Layup. Assisted by Xavier Dupree.",97,55,"Prairie View A&M","Houston",NA,"400916520"
