"play_id","half","time_remaining_half","secs_remaining","description","home_score","away_score","away","home","home_favored_by","game_id"
14,1,"18:06",2286,"Rashad Andrews Turnover.",1,3,"Prairie View A&M","Baton Rouge",NA,"400922257"
15,1,"17:54",2274,"Zachary Hamilton made Three Point Jumper. Assisted by Ja'Donta Blakley.",1,6,"Prairie View A&M","Baton Rouge",NA,"400922257"
16,1,"17:27",2247,"Shawn Prudhomme made Three Point Jumper. Assisted by Tre'lun Banks.",4,6,"Prairie View A&M","Baton Rouge",NA,"400922257"
17,1,"16:59",2219,"Foul on Emanual Shepherd.",4,6,"Prairie View A&M","Baton Rouge",NA,"400922257"
18,1,"16:59",2219,"Daquan Cook missed Free Throw.",4,6,"Prairie View A&M","Baton Rouge",NA,"400922257"
19,1,"16:59",2219,"Prairie View Deadball Team Rebound.",4,6,"Prairie View A&M","Baton Rouge",NA,"400922257"
20,1,"16:59",2219,"Daquan Cook made Free Throw.",4,7,"Prairie View A&M","Baton Rouge",NA,"400922257"
21,1,"16:40",2200,"Jared Sam missed Layup.",4,7,"Prairie View A&M","Baton Rouge",NA,"400922257"
22,1,"16:40",2200,"JD Wallace Defensive Rebound.",4,7,"Prairie View A&M","Baton Rouge",NA,"400922257"
23,1,"16:25",2185,"Shay'rone Jett Turnover.",4,7,"Prairie View A&M","Baton Rouge",NA,"400922257"
24,1,"16:20",2180,"Shawn Prudhomme Steal.",4,7,"Prairie View A&M","Baton Rouge",NA,"400922257"
25,1,"16:05",2165,"Tre'lun Banks made Three Point Jumper. Assisted by Shawn Prudhomme.",7,7,"Prairie View A&M","Baton Rouge",NA,"400922257"
26,1,"15:41",2141,"Shay'rone Jett missed Three Point Jumper.",7,7,"Prairie View A&M","Baton Rouge",NA,"400922257"
27,1,"15:41",2141,"Jared Sam Defensive Rebound.",7,7,"Prairie View A&M","Baton Rouge",NA,"400922257"
28,1,"15:29",2129,"Emanual Shepherd made Layup. Assisted by Shawn Prudhomme.",9,7,"Prairie View A&M","Baton Rouge",NA,"400922257"
29,1,"15:04",2104,"Shay'rone Jett made Jumper. Assisted by Ja'Donta Blakley.",9,9,"Prairie View A&M","Baton Rouge",NA,"400922257"
30,1,"14:46",2086,"Emanual Shepherd Turnover.",9,9,"Prairie View A&M","Baton Rouge",NA,"400922257"
31,1,"14:44",2084,"JD Wallace Steal.",9,9,"Prairie View A&M","Baton Rouge",NA,"400922257"
32,1,"14:43",2083,"JD Wallace made Dunk.",9,11,"Prairie View A&M","Baton Rouge",NA,"400922257"
33,1,"14:16",2056,"Shawn Prudhomme made Three Point Jumper. Assisted by Tre'lun Banks.",12,11,"Prairie View A&M","Baton Rouge",NA,"400922257"
34,1,"13:57",2037,"Zachary Hamilton missed Three Point Jumper.",12,11,"Prairie View A&M","Baton Rouge",NA,"400922257"
35,1,"13:57",2037,"Rashad Andrews Defensive Rebound.",12,11,"Prairie View A&M","Baton Rouge",NA,"400922257"
36,1,"13:41",2021,"Jared Sam made Layup.",14,11,"Prairie View A&M","Baton Rouge",NA,"400922257"
37,1,"13:13",1993,"Zachary Hamilton missed Jumper.",14,11,"Prairie View A&M","Baton Rouge",NA,"400922257"
38,1,"13:13",1993,"Shawn Prudhomme Block.",14,11,"Prairie View A&M","Baton Rouge",NA,"400922257"
39,1,"13:13",1993,"Prairie View Offensive Rebound.",14,11,"Prairie View A&M","Baton Rouge",NA,"400922257"
40,1,"13:13",1993,"Official TV Timeout",14,11,"Prairie View A&M","Baton Rouge",NA,"400922257"
41,1,"12:46",1966,"L.J. Westbrook made Layup. Assisted by Tevin Bellinger.",14,13,"Prairie View A&M","Baton Rouge",NA,"400922257"
42,1,"12:32",1952,"Jared Sam made Layup. Assisted by Tre'lun Banks.",16,13,"Prairie View A&M","Baton Rouge",NA,"400922257"
43,1,"12:32",1952,"Foul on Yusef Yakubu.",16,13,"Prairie View A&M","Baton Rouge",NA,"400922257"
44,1,"12:32",1952,"Jared Sam missed Free Throw.",16,13,"Prairie View A&M","Baton Rouge",NA,"400922257"
45,1,"12:32",1952,"Zachary Hamilton Defensive Rebound.",16,13,"Prairie View A&M","Baton Rouge",NA,"400922257"
46,1,"12:04",1924,"L.J. Westbrook made Three Point Jumper. Assisted by Zachary Hamilton.",16,16,"Prairie View A&M","Baton Rouge",NA,"400922257"
47,1,"11:44",1904,"Shawn Prudhomme made Jumper.",18,16,"Prairie View A&M","Baton Rouge",NA,"400922257"
48,1,"11:11",1871,"Tevin Bellinger missed Three Point Jumper.",18,16,"Prairie View A&M","Baton Rouge",NA,"400922257"
49,1,"11:11",1871,"Tre'lun Banks Defensive Rebound.",18,16,"Prairie View A&M","Baton Rouge",NA,"400922257"
50,1,"10:57",1857,"Jared Sam made Jumper. Assisted by Tre'lun Banks.",20,16,"Prairie View A&M","Baton Rouge",NA,"400922257"
51,1,"10:40",1840,"Avery Lomax missed Jumper.",20,16,"Prairie View A&M","Baton Rouge",NA,"400922257"
52,1,"10:40",1840,"Chris Thomas Defensive Rebound.",20,16,"Prairie View A&M","Baton Rouge",NA,"400922257"
53,1,"10:32",1832,"Tre'lun Banks missed Three Point Jumper.",20,16,"Prairie View A&M","Baton Rouge",NA,"400922257"
54,1,"10:32",1832,"L.J. Westbrook Defensive Rebound.",20,16,"Prairie View A&M","Baton Rouge",NA,"400922257"
55,1,"10:06",1806,"Avery Lomax Turnover.",20,16,"Prairie View A&M","Baton Rouge",NA,"400922257"
56,1,"10:06",1806,"Official TV Timeout",20,16,"Prairie View A&M","Baton Rouge",NA,"400922257"
57,1,"9:48",1788,"Brendon Ganaway missed Layup.",20,16,"Prairie View A&M","Baton Rouge",NA,"400922257"
58,1,"9:48",1788,"JD Wallace Block.",20,16,"Prairie View A&M","Baton Rouge",NA,"400922257"
59,1,"9:48",1788,"Southern Offensive Rebound.",20,16,"Prairie View A&M","Baton Rouge",NA,"400922257"
60,1,"9:45",1785,"Shawn Prudhomme missed Three Point Jumper.",20,16,"Prairie View A&M","Baton Rouge",NA,"400922257"
61,1,"9:45",1785,"Brendon Ganaway Offensive Rebound.",20,16,"Prairie View A&M","Baton Rouge",NA,"400922257"
62,1,"9:29",1769,"Tre'lun Banks missed Jumper.",20,16,"Prairie View A&M","Baton Rouge",NA,"400922257"
63,1,"9:29",1769,"Ja'Donta Blakley Defensive Rebound.",20,16,"Prairie View A&M","Baton Rouge",NA,"400922257"
64,1,"9:22",1762,"Foul on Tre'lun Banks.",20,16,"Prairie View A&M","Baton Rouge",NA,"400922257"
65,1,"9:22",1762,"JD Wallace made Free Throw.",20,17,"Prairie View A&M","Baton Rouge",NA,"400922257"
66,1,"9:22",1762,"JD Wallace missed Free Throw.",20,17,"Prairie View A&M","Baton Rouge",NA,"400922257"
67,1,"9:22",1762,"Shawn Prudhomme Defensive Rebound.",20,17,"Prairie View A&M","Baton Rouge",NA,"400922257"
68,1,"9:03",1743,"Brendon Ganaway Turnover.",20,17,"Prairie View A&M","Baton Rouge",NA,"400922257"
69,1,"9:01",1741,"Ja'Donta Blakley Steal.",20,17,"Prairie View A&M","Baton Rouge",NA,"400922257"
70,1,"9:01",1741,"Foul on Chris Thomas.",20,17,"Prairie View A&M","Baton Rouge",NA,"400922257"
71,1,"9:01",1741,"L.J. Westbrook made Free Throw.",20,18,"Prairie View A&M","Baton Rouge",NA,"400922257"
72,1,"9:01",1741,"L.J. Westbrook made Free Throw.",20,19,"Prairie View A&M","Baton Rouge",NA,"400922257"
73,1,"8:40",1720,"Chris Thomas missed Jumper.",20,19,"Prairie View A&M","Baton Rouge",NA,"400922257"
74,1,"8:40",1720,"Shaquille Preston Defensive Rebound.",20,19,"Prairie View A&M","Baton Rouge",NA,"400922257"
75,1,"8:17",1697,"Ja'Donta Blakley Turnover.",20,19,"Prairie View A&M","Baton Rouge",NA,"400922257"
76,1,"8:15",1695,"Jared Sam Steal.",20,19,"Prairie View A&M","Baton Rouge",NA,"400922257"
77,1,"8:13",1693,"Shawn Prudhomme made Layup. Assisted by Jared Sam.",22,19,"Prairie View A&M","Baton Rouge",NA,"400922257"
78,1,"7:39",1659,"L.J. Westbrook made Three Point Jumper. Assisted by JD Wallace.",22,22,"Prairie View A&M","Baton Rouge",NA,"400922257"
79,1,"7:33",1653,"Foul on Daquan Cook.",22,22,"Prairie View A&M","Baton Rouge",NA,"400922257"
80,1,"7:33",1653,"Official TV Timeout",22,22,"Prairie View A&M","Baton Rouge",NA,"400922257"
81,1,"7:33",1653,"JaMarcus Weatherspoon made Free Throw.",23,22,"Prairie View A&M","Baton Rouge",NA,"400922257"
82,1,"7:33",1653,"JaMarcus Weatherspoon made Free Throw.",24,22,"Prairie View A&M","Baton Rouge",NA,"400922257"
83,1,"7:05",1625,"Troy Thompson missed Three Point Jumper.",24,22,"Prairie View A&M","Baton Rouge",NA,"400922257"
84,1,"7:05",1625,"Chris Thomas Defensive Rebound.",24,22,"Prairie View A&M","Baton Rouge",NA,"400922257"
85,1,"6:42",1602,"Patrick Smith Turnover.",24,22,"Prairie View A&M","Baton Rouge",NA,"400922257"
86,1,"6:41",1601,"Ja'Donta Blakley Steal.",24,22,"Prairie View A&M","Baton Rouge",NA,"400922257"
87,1,"6:37",1597,"L.J. Westbrook made Layup.",24,24,"Prairie View A&M","Baton Rouge",NA,"400922257"
88,1,"6:22",1582,"Brendon Ganaway Turnover.",24,24,"Prairie View A&M","Baton Rouge",NA,"400922257"
89,1,"6:02",1562,"L.J. Westbrook missed Jumper.",24,24,"Prairie View A&M","Baton Rouge",NA,"400922257"
90,1,"6:02",1562,"Southern Defensive Rebound.",24,24,"Prairie View A&M","Baton Rouge",NA,"400922257"
91,1,"6:02",1562,"Foul on L.J. Westbrook.",24,24,"Prairie View A&M","Baton Rouge",NA,"400922257"
92,1,"5:43",1543,"Emanual Shepherd Turnover.",24,24,"Prairie View A&M","Baton Rouge",NA,"400922257"
93,1,"5:12",1512,"Ja'Donta Blakley missed Three Point Jumper.",24,24,"Prairie View A&M","Baton Rouge",NA,"400922257"
94,1,"5:12",1512,"Rashad Andrews Defensive Rebound.",24,24,"Prairie View A&M","Baton Rouge",NA,"400922257"
95,1,"4:44",1484,"Shawn Prudhomme missed Three Point Jumper.",24,24,"Prairie View A&M","Baton Rouge",NA,"400922257"
96,1,"4:44",1484,"Zachary Hamilton Defensive Rebound.",24,24,"Prairie View A&M","Baton Rouge",NA,"400922257"
97,1,"4:35",1475,"Ja'Donta Blakley missed Layup.",24,24,"Prairie View A&M","Baton Rouge",NA,"400922257"
98,1,"4:35",1475,"Jared Sam Defensive Rebound.",24,24,"Prairie View A&M","Baton Rouge",NA,"400922257"
99,1,"4:20",1460,"Jared Sam missed Layup.",24,24,"Prairie View A&M","Baton Rouge",NA,"400922257"
100,1,"4:20",1460,"Jared Sam Offensive Rebound.",24,24,"Prairie View A&M","Baton Rouge",NA,"400922257"
101,1,"4:20",1460,"Jared Sam missed Layup.",24,24,"Prairie View A&M","Baton Rouge",NA,"400922257"
102,1,"4:20",1460,"Jared Sam made Two Point Tip Shot.",26,24,"Prairie View A&M","Baton Rouge",NA,"400922257"
103,1,"4:20",1460,"Foul on Ja'Donta Blakley.",26,24,"Prairie View A&M","Baton Rouge",NA,"400922257"
104,1,"4:20",1460,"Jared Sam missed Free Throw.",26,24,"Prairie View A&M","Baton Rouge",NA,"400922257"
105,1,"4:20",1460,"Zachary Hamilton Defensive Rebound.",26,24,"Prairie View A&M","Baton Rouge",NA,"400922257"
106,1,"4:20",1460,"Jared Sam Offensive Rebound.",26,24,"Prairie View A&M","Baton Rouge",NA,"400922257"
107,1,"3:53",1433,"L.J. Westbrook missed Three Point Jumper.",26,24,"Prairie View A&M","Baton Rouge",NA,"400922257"
108,1,"3:53",1433,"Shawn Prudhomme Defensive Rebound.",26,24,"Prairie View A&M","Baton Rouge",NA,"400922257"
109,1,"3:31",1411,"Rashad Andrews missed Three Point Jumper.",26,24,"Prairie View A&M","Baton Rouge",NA,"400922257"
110,1,"3:31",1411,"Prairie View Defensive Rebound.",26,24,"Prairie View A&M","Baton Rouge",NA,"400922257"
111,1,"3:30",1410,"Foul on Emanual Shepherd.",26,24,"Prairie View A&M","Baton Rouge",NA,"400922257"
112,1,"3:30",1410,"Official TV Timeout",26,24,"Prairie View A&M","Baton Rouge",NA,"400922257"
113,1,"3:09",1389,"Daquan Cook missed Layup.",26,24,"Prairie View A&M","Baton Rouge",NA,"400922257"
114,1,"3:09",1389,"Shawn Prudhomme Block.",26,24,"Prairie View A&M","Baton Rouge",NA,"400922257"
115,1,"3:09",1389,"Emanual Shepherd Defensive Rebound.",26,24,"Prairie View A&M","Baton Rouge",NA,"400922257"
116,1,"2:53",1373,"Shawn Prudhomme missed Three Point Jumper.",26,24,"Prairie View A&M","Baton Rouge",NA,"400922257"
117,1,"2:53",1373,"Zachary Hamilton Defensive Rebound.",26,24,"Prairie View A&M","Baton Rouge",NA,"400922257"
118,1,"2:21",1341,"L.J. Westbrook missed Three Point Jumper.",26,24,"Prairie View A&M","Baton Rouge",NA,"400922257"
119,1,"2:21",1341,"Shawn Prudhomme Defensive Rebound.",26,24,"Prairie View A&M","Baton Rouge",NA,"400922257"
120,1,"2:07",1327,"Tre'lun Banks Turnover.",26,24,"Prairie View A&M","Baton Rouge",NA,"400922257"
121,1,"1:47",1307,"Foul on Rashad Andrews.",26,24,"Prairie View A&M","Baton Rouge",NA,"400922257"
122,1,"1:47",1307,"Zachary Hamilton made Free Throw.",26,25,"Prairie View A&M","Baton Rouge",NA,"400922257"
123,1,"1:47",1307,"Zachary Hamilton made Free Throw.",26,26,"Prairie View A&M","Baton Rouge",NA,"400922257"
124,1,"1:36",1296,"Foul on JD Wallace.",26,26,"Prairie View A&M","Baton Rouge",NA,"400922257"
125,1,"1:21",1281,"Jared Sam made Layup. Assisted by Emanual Shepherd.",28,26,"Prairie View A&M","Baton Rouge",NA,"400922257"
126,1,"1:07",1267,"Tevin Bellinger missed Jumper.",28,26,"Prairie View A&M","Baton Rouge",NA,"400922257"
127,1,"1:07",1267,"Emanual Shepherd Defensive Rebound.",28,26,"Prairie View A&M","Baton Rouge",NA,"400922257"
128,1,"0:57",1257,"Foul on Ja'Donta Blakley.",28,26,"Prairie View A&M","Baton Rouge",NA,"400922257"
129,1,"0:57",1257,"Tre'lun Banks missed Free Throw.",28,26,"Prairie View A&M","Baton Rouge",NA,"400922257"
130,1,"0:57",1257,"L.J. Westbrook Defensive Rebound.",28,26,"Prairie View A&M","Baton Rouge",NA,"400922257"
131,1,"0:30",1230,"L.J. Westbrook made Layup.",28,28,"Prairie View A&M","Baton Rouge",NA,"400922257"
132,1,"0:30",1230,"Foul on Rashad Andrews.",28,28,"Prairie View A&M","Baton Rouge",NA,"400922257"
133,1,"0:30",1230,"L.J. Westbrook made Free Throw.",28,29,"Prairie View A&M","Baton Rouge",NA,"400922257"
134,1,"0:01",1201,"Tre'lun Banks missed Jumper.",28,29,"Prairie View A&M","Baton Rouge",NA,"400922257"
135,1,"0:01",1201,"Emanual Shepherd Offensive Rebound.",28,29,"Prairie View A&M","Baton Rouge",NA,"400922257"
136,1,"0:00",1200,"Emanual Shepherd missed Two Point Tip Shot.",28,29,"Prairie View A&M","Baton Rouge",NA,"400922257"
137,1,"0:00",1200,"Prairie View Defensive Rebound.",28,29,"Prairie View A&M","Baton Rouge",NA,"400922257"
138,1,"0:00",1200,"End of 1st half",28,29,"Prairie View A&M","Baton Rouge",NA,"400922257"
139,2,"20:00",1200,"PLAY",28,29,"Prairie View A&M","Baton Rouge",NA,"400922257"
140,2,"19:44",1184,"Foul on Shay'rone Jett.",28,29,"Prairie View A&M","Baton Rouge",NA,"400922257"
141,2,"19:44",1184,"Rashad Andrews made Free Throw.",29,29,"Prairie View A&M","Baton Rouge",NA,"400922257"
142,2,"19:44",1184,"Rashad Andrews made Free Throw.",30,29,"Prairie View A&M","Baton Rouge",NA,"400922257"
143,2,"19:14",1154,"JD Wallace missed Three Point Jumper.",30,29,"Prairie View A&M","Baton Rouge",NA,"400922257"
144,2,"19:14",1154,"Tre'lun Banks Defensive Rebound.",30,29,"Prairie View A&M","Baton Rouge",NA,"400922257"
145,2,"19:07",1147,"Shawn Prudhomme made Layup. Assisted by Tre'lun Banks.",32,29,"Prairie View A&M","Baton Rouge",NA,"400922257"
146,2,"18:44",1124,"Foul on Emanual Shepherd.",32,29,"Prairie View A&M","Baton Rouge",NA,"400922257"
147,2,"18:44",1124,"Zachary Hamilton made Free Throw.",32,30,"Prairie View A&M","Baton Rouge",NA,"400922257"
148,2,"18:44",1124,"Zachary Hamilton missed Free Throw.",32,30,"Prairie View A&M","Baton Rouge",NA,"400922257"
149,2,"18:44",1124,"Jared Sam Defensive Rebound.",32,30,"Prairie View A&M","Baton Rouge",NA,"400922257"
150,2,"18:29",1109,"Tre'lun Banks missed Jumper.",32,30,"Prairie View A&M","Baton Rouge",NA,"400922257"
151,2,"18:29",1109,"Zachary Hamilton Defensive Rebound.",32,30,"Prairie View A&M","Baton Rouge",NA,"400922257"
152,2,"18:21",1101,"L.J. Westbrook Turnover.",32,30,"Prairie View A&M","Baton Rouge",NA,"400922257"
153,2,"18:20",1100,"Rashad Andrews Steal.",32,30,"Prairie View A&M","Baton Rouge",NA,"400922257"
154,2,"18:18",1098,"Shawn Prudhomme made Layup. Assisted by Rashad Andrews.",34,30,"Prairie View A&M","Baton Rouge",NA,"400922257"
155,2,"17:53",1073,"Zachary Hamilton missed Three Point Jumper.",34,30,"Prairie View A&M","Baton Rouge",NA,"400922257"
156,2,"17:53",1073,"Emanual Shepherd Defensive Rebound.",34,30,"Prairie View A&M","Baton Rouge",NA,"400922257"
157,2,"17:24",1044,"Tre'lun Banks Turnover.",34,30,"Prairie View A&M","Baton Rouge",NA,"400922257"
158,2,"17:22",1042,"JD Wallace Steal.",34,30,"Prairie View A&M","Baton Rouge",NA,"400922257"
159,2,"17:15",1035,"Zachary Hamilton made Layup.",34,32,"Prairie View A&M","Baton Rouge",NA,"400922257"
160,2,"16:57",1017,"Shawn Prudhomme missed Jumper.",34,32,"Prairie View A&M","Baton Rouge",NA,"400922257"
161,2,"16:57",1017,"Shaquille Preston Defensive Rebound.",34,32,"Prairie View A&M","Baton Rouge",NA,"400922257"
162,2,"16:34",994,"Shaquille Preston missed Jumper.",34,32,"Prairie View A&M","Baton Rouge",NA,"400922257"
163,2,"16:34",994,"Emanual Shepherd Block.",34,32,"Prairie View A&M","Baton Rouge",NA,"400922257"
164,2,"16:34",994,"Jared Sam Defensive Rebound.",34,32,"Prairie View A&M","Baton Rouge",NA,"400922257"
165,2,"16:20",980,"Foul on JD Wallace.",34,32,"Prairie View A&M","Baton Rouge",NA,"400922257"
166,2,"16:13",973,"Tre'lun Banks missed Three Point Jumper.",34,32,"Prairie View A&M","Baton Rouge",NA,"400922257"
167,2,"16:13",973,"JD Wallace Defensive Rebound.",34,32,"Prairie View A&M","Baton Rouge",NA,"400922257"
168,2,"15:50",950,"Official TV Timeout",34,32,"Prairie View A&M","Baton Rouge",NA,"400922257"
169,2,"15:49",949,"Shaquille Preston Turnover.",34,32,"Prairie View A&M","Baton Rouge",NA,"400922257"
170,2,"15:37",937,"Foul on Troy Thompson.",34,32,"Prairie View A&M","Baton Rouge",NA,"400922257"
171,2,"15:37",937,"Tre'lun Banks made Free Throw.",35,32,"Prairie View A&M","Baton Rouge",NA,"400922257"
172,2,"15:37",937,"Tre'lun Banks missed Free Throw.",35,32,"Prairie View A&M","Baton Rouge",NA,"400922257"
173,2,"15:37",937,"Tre'lun Banks Offensive Rebound.",35,32,"Prairie View A&M","Baton Rouge",NA,"400922257"
174,2,"15:34",934,"Tre'lun Banks made Layup.",37,32,"Prairie View A&M","Baton Rouge",NA,"400922257"
175,2,"15:02",902,"Troy Thompson missed Jumper.",37,32,"Prairie View A&M","Baton Rouge",NA,"400922257"
176,2,"15:02",902,"Southern Defensive Rebound.",37,32,"Prairie View A&M","Baton Rouge",NA,"400922257"
177,2,"14:44",884,"Rashad Andrews made Jumper. Assisted by Tre'lun Banks.",39,32,"Prairie View A&M","Baton Rouge",NA,"400922257"
178,2,"14:35",875,"Foul on Tre'lun Banks.",39,32,"Prairie View A&M","Baton Rouge",NA,"400922257"
179,2,"14:35",875,"Tevin Bellinger missed Layup.",39,32,"Prairie View A&M","Baton Rouge",NA,"400922257"
180,2,"14:35",875,"Tevin Bellinger Offensive Rebound.",39,32,"Prairie View A&M","Baton Rouge",NA,"400922257"
181,2,"14:35",875,"L.J. Westbrook missed Jumper.",39,32,"Prairie View A&M","Baton Rouge",NA,"400922257"
182,2,"14:35",875,"Shawn Prudhomme Defensive Rebound.",39,32,"Prairie View A&M","Baton Rouge",NA,"400922257"
183,2,"13:49",829,"Emanual Shepherd missed Jumper.",39,32,"Prairie View A&M","Baton Rouge",NA,"400922257"
184,2,"13:49",829,"Shaquille Preston Defensive Rebound.",39,32,"Prairie View A&M","Baton Rouge",NA,"400922257"
185,2,"13:45",825,"Foul on Emanual Shepherd.",39,32,"Prairie View A&M","Baton Rouge",NA,"400922257"
186,2,"13:45",825,"Shaquille Preston made Free Throw.",39,33,"Prairie View A&M","Baton Rouge",NA,"400922257"
187,2,"13:45",825,"Shaquille Preston missed Free Throw.",39,33,"Prairie View A&M","Baton Rouge",NA,"400922257"
188,2,"13:45",825,"Shawn Prudhomme Defensive Rebound.",39,33,"Prairie View A&M","Baton Rouge",NA,"400922257"
189,2,"13:32",812,"Tre'lun Banks Turnover.",39,33,"Prairie View A&M","Baton Rouge",NA,"400922257"
190,2,"13:09",789,"Zachary Hamilton made Layup.",39,35,"Prairie View A&M","Baton Rouge",NA,"400922257"
191,2,"13:03",783,"Southern  Timeout",39,35,"Prairie View A&M","Baton Rouge",NA,"400922257"
192,2,"12:47",767,"Foul on JD Wallace.",39,35,"Prairie View A&M","Baton Rouge",NA,"400922257"
193,2,"12:47",767,"Chris Thomas missed Free Throw.",39,35,"Prairie View A&M","Baton Rouge",NA,"400922257"
194,2,"12:47",767,"Southern Deadball Team Rebound.",39,35,"Prairie View A&M","Baton Rouge",NA,"400922257"
195,2,"12:47",767,"Chris Thomas missed Free Throw.",39,35,"Prairie View A&M","Baton Rouge",NA,"400922257"
196,2,"12:47",767,"Daquan Cook Defensive Rebound.",39,35,"Prairie View A&M","Baton Rouge",NA,"400922257"
197,2,"12:37",757,"Zachary Hamilton missed Jumper.",39,35,"Prairie View A&M","Baton Rouge",NA,"400922257"
198,2,"12:37",757,"Zachary Hamilton Offensive Rebound.",39,35,"Prairie View A&M","Baton Rouge",NA,"400922257"
199,2,"12:18",738,"Avery Lomax missed Jumper.",39,35,"Prairie View A&M","Baton Rouge",NA,"400922257"
200,2,"12:18",738,"Jared Sam Block.",39,35,"Prairie View A&M","Baton Rouge",NA,"400922257"
201,2,"12:18",738,"Daquan Cook Offensive Rebound.",39,35,"Prairie View A&M","Baton Rouge",NA,"400922257"
202,2,"12:17",737,"Daquan Cook Turnover.",39,35,"Prairie View A&M","Baton Rouge",NA,"400922257"
203,2,"11:52",712,"Rashad Andrews missed Jumper.",39,35,"Prairie View A&M","Baton Rouge",NA,"400922257"
204,2,"11:52",712,"Chris Thomas Offensive Rebound.",39,35,"Prairie View A&M","Baton Rouge",NA,"400922257"
205,2,"11:49",709,"Foul on JD Wallace.",39,35,"Prairie View A&M","Baton Rouge",NA,"400922257"
206,2,"11:49",709,"Official TV Timeout",39,35,"Prairie View A&M","Baton Rouge",NA,"400922257"
207,2,"11:49",709,"Chris Thomas missed Free Throw.",39,35,"Prairie View A&M","Baton Rouge",NA,"400922257"
208,2,"11:49",709,"Southern Deadball Team Rebound.",39,35,"Prairie View A&M","Baton Rouge",NA,"400922257"
209,2,"11:49",709,"Chris Thomas missed Free Throw.",39,35,"Prairie View A&M","Baton Rouge",NA,"400922257"
210,2,"11:49",709,"Zachary Hamilton Defensive Rebound.",39,35,"Prairie View A&M","Baton Rouge",NA,"400922257"
211,2,"11:38",698,"Zachary Hamilton made Layup.",39,37,"Prairie View A&M","Baton Rouge",NA,"400922257"
212,2,"11:17",677,"Tre'lun Banks made Three Point Jumper.",42,37,"Prairie View A&M","Baton Rouge",NA,"400922257"
213,2,"11:04",664,"Daquan Cook missed Three Point Jumper.",42,37,"Prairie View A&M","Baton Rouge",NA,"400922257"
214,2,"11:04",664,"Tre'lun Banks Defensive Rebound.",42,37,"Prairie View A&M","Baton Rouge",NA,"400922257"
215,2,"10:53",653,"Shawn Prudhomme made Jumper.",44,37,"Prairie View A&M","Baton Rouge",NA,"400922257"
216,2,"10:44",644,"Zachary Hamilton missed Three Point Jumper.",44,37,"Prairie View A&M","Baton Rouge",NA,"400922257"
217,2,"10:44",644,"Chris Thomas Defensive Rebound.",44,37,"Prairie View A&M","Baton Rouge",NA,"400922257"
218,2,"10:18",618,"JaMarcus Weatherspoon Turnover.",44,37,"Prairie View A&M","Baton Rouge",NA,"400922257"
219,2,"10:17",617,"L.J. Westbrook Steal.",44,37,"Prairie View A&M","Baton Rouge",NA,"400922257"
220,2,"10:05",605,"Zachary Hamilton missed Jumper.",44,37,"Prairie View A&M","Baton Rouge",NA,"400922257"
221,2,"10:05",605,"Shawn Prudhomme Defensive Rebound.",44,37,"Prairie View A&M","Baton Rouge",NA,"400922257"
222,2,"9:56",596,"Jared Sam missed Jumper.",44,37,"Prairie View A&M","Baton Rouge",NA,"400922257"
223,2,"9:56",596,"Tevin Bellinger Defensive Rebound.",44,37,"Prairie View A&M","Baton Rouge",NA,"400922257"
224,2,"9:49",589,"Daquan Cook made Jumper. Assisted by Tevin Bellinger.",44,39,"Prairie View A&M","Baton Rouge",NA,"400922257"
225,2,"9:32",572,"Foul on Zachary Hamilton.",44,39,"Prairie View A&M","Baton Rouge",NA,"400922257"
226,2,"9:32",572,"Jared Sam made Free Throw.",45,39,"Prairie View A&M","Baton Rouge",NA,"400922257"
227,2,"9:32",572,"Jared Sam made Free Throw.",46,39,"Prairie View A&M","Baton Rouge",NA,"400922257"
228,2,"9:13",553,"Ja'Donta Blakley missed Layup.",46,39,"Prairie View A&M","Baton Rouge",NA,"400922257"
229,2,"9:13",553,"Tre'lun Banks Block.",46,39,"Prairie View A&M","Baton Rouge",NA,"400922257"
230,2,"9:13",553,"Tevin Bellinger Offensive Rebound.",46,39,"Prairie View A&M","Baton Rouge",NA,"400922257"
231,2,"9:04",544,"Foul on Chris Thomas.",46,39,"Prairie View A&M","Baton Rouge",NA,"400922257"
232,2,"8:52",532,"Tevin Bellinger missed Jumper.",46,39,"Prairie View A&M","Baton Rouge",NA,"400922257"
233,2,"8:52",532,"Tre'lun Banks Defensive Rebound.",46,39,"Prairie View A&M","Baton Rouge",NA,"400922257"
234,2,"8:30",510,"JaMarcus Weatherspoon missed Jumper.",46,39,"Prairie View A&M","Baton Rouge",NA,"400922257"
235,2,"8:30",510,"Prairie View Defensive Rebound.",46,39,"Prairie View A&M","Baton Rouge",NA,"400922257"
236,2,"8:29",509,"Foul on Jared Sam.",46,39,"Prairie View A&M","Baton Rouge",NA,"400922257"
237,2,"8:10",490,"Tevin Bellinger missed Three Point Jumper.",46,39,"Prairie View A&M","Baton Rouge",NA,"400922257"
238,2,"8:10",490,"Chris Thomas Defensive Rebound.",46,39,"Prairie View A&M","Baton Rouge",NA,"400922257"
239,2,"7:51",471,"Tre'lun Banks Turnover.",46,39,"Prairie View A&M","Baton Rouge",NA,"400922257"
240,2,"7:48",468,"JD Wallace Steal.",46,39,"Prairie View A&M","Baton Rouge",NA,"400922257"
241,2,"7:43",463,"Zachary Hamilton missed Jumper.",46,39,"Prairie View A&M","Baton Rouge",NA,"400922257"
242,2,"7:43",463,"Ja'Donta Blakley Offensive Rebound.",46,39,"Prairie View A&M","Baton Rouge",NA,"400922257"
243,2,"7:37",457,"Prairie View  Timeout",46,39,"Prairie View A&M","Baton Rouge",NA,"400922257"
244,2,"7:26",446,"Tevin Bellinger made Layup.",46,41,"Prairie View A&M","Baton Rouge",NA,"400922257"
245,2,"7:08",428,"Jared Sam missed Layup.",46,41,"Prairie View A&M","Baton Rouge",NA,"400922257"
246,2,"7:08",428,"Zachary Hamilton Defensive Rebound.",46,41,"Prairie View A&M","Baton Rouge",NA,"400922257"
247,2,"6:59",419,"Tevin Bellinger made Jumper.",46,43,"Prairie View A&M","Baton Rouge",NA,"400922257"
248,2,"6:50",410,"JaMarcus Weatherspoon made Layup.",48,43,"Prairie View A&M","Baton Rouge",NA,"400922257"
249,2,"6:50",410,"Foul on JD Wallace.",48,43,"Prairie View A&M","Baton Rouge",NA,"400922257"
250,2,"6:50",410,"JaMarcus Weatherspoon made Free Throw.",49,43,"Prairie View A&M","Baton Rouge",NA,"400922257"
251,2,"6:24",384,"Zachary Hamilton made Jumper.",49,45,"Prairie View A&M","Baton Rouge",NA,"400922257"
252,2,"6:01",361,"Jared Sam made Jumper. Assisted by Chris Thomas.",51,45,"Prairie View A&M","Baton Rouge",NA,"400922257"
253,2,"5:38",338,"Foul on Tevin Bellinger.",51,45,"Prairie View A&M","Baton Rouge",NA,"400922257"
254,2,"5:29",329,"JaMarcus Weatherspoon missed Jumper.",51,45,"Prairie View A&M","Baton Rouge",NA,"400922257"
255,2,"5:29",329,"Zachary Hamilton Block.",51,45,"Prairie View A&M","Baton Rouge",NA,"400922257"
256,2,"5:29",329,"L.J. Westbrook Defensive Rebound.",51,45,"Prairie View A&M","Baton Rouge",NA,"400922257"
257,2,"5:27",327,"Foul on Shawn Prudhomme.",51,45,"Prairie View A&M","Baton Rouge",NA,"400922257"
