"play_id","half","time_remaining_half","secs_remaining","description","home_score","away_score","away","home","home_favored_by","game_id"
1,1,"20:00",2400,"PLAY",0,0,"Harvard","Stanford",3.5,"400915489"
2,1,"20:00",2400,"Jump Ball won by Harvard",0,0,"Harvard","Stanford",3.5,"400915489"
3,1,"19:44",2384,"Zena Edosomwan Turnover.",0,0,"Harvard","Stanford",3.5,"400915489"
4,1,"19:25",2365,"Reid Travis missed Layup.",0,0,"Harvard","Stanford",3.5,"400915489"
5,1,"19:25",2365,"Reid Travis Offensive Rebound.",0,0,"Harvard","Stanford",3.5,"400915489"
6,1,"19:21",2361,"Reid Travis made Layup.",2,0,"Harvard","Stanford",3.5,"400915489"
7,1,"18:56",2336,"Siyani Chambers missed Three Point Jumper.",2,0,"Harvard","Stanford",3.5,"400915489"
8,1,"18:56",2336,"Marcus Allen Defensive Rebound.",2,0,"Harvard","Stanford",3.5,"400915489"
9,1,"18:49",2329,"Michael Humphrey made Layup. Assisted by Dorian Pickens.",4,0,"Harvard","Stanford",3.5,"400915489"
10,1,"18:31",2311,"Chris Egi missed Layup.",4,0,"Harvard","Stanford",3.5,"400915489"
11,1,"18:31",2311,"Reid Travis Defensive Rebound.",4,0,"Harvard","Stanford",3.5,"400915489"
12,1,"18:22",2302,"Foul on Corey Johnson.",4,0,"Harvard","Stanford",3.5,"400915489"
13,1,"18:22",2302,"Dorian Pickens made Free Throw.",5,0,"Harvard","Stanford",3.5,"400915489"
14,1,"18:22",2302,"Dorian Pickens missed Free Throw.",5,0,"Harvard","Stanford",3.5,"400915489"
15,1,"18:22",2302,"Zena Edosomwan Defensive Rebound.",5,0,"Harvard","Stanford",3.5,"400915489"
16,1,"18:08",2288,"Zena Edosomwan made Layup. Assisted by Siyani Chambers.",5,2,"Harvard","Stanford",3.5,"400915489"
17,1,"17:45",2265,"Reid Travis Turnover.",5,2,"Harvard","Stanford",3.5,"400915489"
18,1,"17:20",2240,"Bryce Aiken missed Three Point Jumper.",5,2,"Harvard","Stanford",3.5,"400915489"
19,1,"17:20",2240,"Marcus Allen Defensive Rebound.",5,2,"Harvard","Stanford",3.5,"400915489"
20,1,"17:06",2226,"Michael Humphrey made Jumper. Assisted by Marcus Allen.",7,2,"Harvard","Stanford",3.5,"400915489"
21,1,"16:43",2203,"Zena Edosomwan missed Layup.",7,2,"Harvard","Stanford",3.5,"400915489"
22,1,"16:43",2203,"Michael Humphrey Defensive Rebound.",7,2,"Harvard","Stanford",3.5,"400915489"
23,1,"16:35",2195,"Dorian Pickens missed Layup.",7,2,"Harvard","Stanford",3.5,"400915489"
24,1,"16:35",2195,"Zena Edosomwan Defensive Rebound.",7,2,"Harvard","Stanford",3.5,"400915489"
25,1,"16:30",2190,"Seth Towns made Jumper. Assisted by Bryce Aiken.",7,4,"Harvard","Stanford",3.5,"400915489"
26,1,"16:18",2178,"Christian Sanders Turnover.",7,4,"Harvard","Stanford",3.5,"400915489"
27,1,"16:18",2178,"Seth Towns Steal.",7,4,"Harvard","Stanford",3.5,"400915489"
28,1,"16:18",2178,"Foul on Michael Humphrey.",7,4,"Harvard","Stanford",3.5,"400915489"
29,1,"15:57",2157,"Foul on Michael Humphrey.",7,4,"Harvard","Stanford",3.5,"400915489"
30,1,"15:57",2157,"Official TV Timeout",7,4,"Harvard","Stanford",3.5,"400915489"
31,1,"15:45",2145,"Seth Towns Turnover.",7,4,"Harvard","Stanford",3.5,"400915489"
32,1,"15:33",2133,"Foul on Bryce Aiken.",7,4,"Harvard","Stanford",3.5,"400915489"
33,1,"15:19",2119,"Josh Sharma missed Jumper.",7,4,"Harvard","Stanford",3.5,"400915489"
34,1,"15:19",2119,"Chris Lewis Block.",7,4,"Harvard","Stanford",3.5,"400915489"
35,1,"15:19",2119,"Reid Travis Offensive Rebound.",7,4,"Harvard","Stanford",3.5,"400915489"
36,1,"15:19",2119,"Grant Verhoeven missed Layup.",7,4,"Harvard","Stanford",3.5,"400915489"
37,1,"15:19",2119,"Chris Lewis Block.",7,4,"Harvard","Stanford",3.5,"400915489"
38,1,"15:19",2119,"Seth Towns Defensive Rebound.",7,4,"Harvard","Stanford",3.5,"400915489"
39,1,"15:00",2100,"Chris Lewis made Jumper. Assisted by Seth Towns.",7,6,"Harvard","Stanford",3.5,"400915489"
40,1,"14:30",2070,"Foul on Siyani Chambers.",7,6,"Harvard","Stanford",3.5,"400915489"
41,1,"14:20",2060,"Josh Sharma missed Three Point Jumper.",7,6,"Harvard","Stanford",3.5,"400915489"
42,1,"14:20",2060,"Chris Egi Defensive Rebound.",7,6,"Harvard","Stanford",3.5,"400915489"
43,1,"14:10",2050,"Bryce Aiken missed Jumper.",7,6,"Harvard","Stanford",3.5,"400915489"
44,1,"14:10",2050,"Chris Egi Offensive Rebound.",7,6,"Harvard","Stanford",3.5,"400915489"
45,1,"14:07",2047,"Foul on Grant Verhoeven.",7,6,"Harvard","Stanford",3.5,"400915489"
46,1,"14:05",2045,"Chris Lewis Turnover.",7,6,"Harvard","Stanford",3.5,"400915489"
47,1,"14:05",2045,"Robert Cartwright Steal.",7,6,"Harvard","Stanford",3.5,"400915489"
48,1,"13:58",2038,"Robert Cartwright made Layup.",9,6,"Harvard","Stanford",3.5,"400915489"
49,1,"13:35",2015,"Chris Egi missed Jumper.",9,6,"Harvard","Stanford",3.5,"400915489"
50,1,"13:35",2015,"Chris Lewis Offensive Rebound.",9,6,"Harvard","Stanford",3.5,"400915489"
51,1,"13:31",2011,"Chris Lewis made Dunk.",9,8,"Harvard","Stanford",3.5,"400915489"
52,1,"13:09",1989,"Foul on Chris Egi.",9,8,"Harvard","Stanford",3.5,"400915489"
53,1,"13:09",1989,"Reid Travis made Free Throw.",10,8,"Harvard","Stanford",3.5,"400915489"
54,1,"13:09",1989,"Reid Travis missed Free Throw.",10,8,"Harvard","Stanford",3.5,"400915489"
55,1,"13:09",1989,"Corey Johnson Defensive Rebound.",10,8,"Harvard","Stanford",3.5,"400915489"
56,1,"13:05",1985,"Christian Juzang missed Layup.",10,8,"Harvard","Stanford",3.5,"400915489"
57,1,"13:05",1985,"Marcus Sheffield Defensive Rebound.",10,8,"Harvard","Stanford",3.5,"400915489"
58,1,"12:59",1979,"Marcus Sheffield missed Layup.",10,8,"Harvard","Stanford",3.5,"400915489"
59,1,"12:59",1979,"Harvard Defensive Rebound.",10,8,"Harvard","Stanford",3.5,"400915489"
60,1,"12:33",1953,"Bryce Aiken missed Layup.",10,8,"Harvard","Stanford",3.5,"400915489"
61,1,"12:33",1953,"Reid Travis Defensive Rebound.",10,8,"Harvard","Stanford",3.5,"400915489"
62,1,"12:02",1922,"Robert Cartwright missed Three Point Jumper.",10,8,"Harvard","Stanford",3.5,"400915489"
63,1,"12:02",1922,"Chris Egi Defensive Rebound.",10,8,"Harvard","Stanford",3.5,"400915489"
64,1,"11:41",1901,"Christian Juzang missed Three Point Jumper.",10,8,"Harvard","Stanford",3.5,"400915489"
65,1,"11:41",1901,"Reid Travis Defensive Rebound.",10,8,"Harvard","Stanford",3.5,"400915489"
66,1,"11:27",1887,"Foul on Corey Johnson.",10,8,"Harvard","Stanford",3.5,"400915489"
67,1,"11:27",1887,"Official TV Timeout",10,8,"Harvard","Stanford",3.5,"400915489"
68,1,"11:18",1878,"Trevor Stanback Turnover.",10,8,"Harvard","Stanford",3.5,"400915489"
69,1,"11:18",1878,"Chris Egi Steal.",10,8,"Harvard","Stanford",3.5,"400915489"
70,1,"11:00",1860,"Foul on Robert Cartwright.",10,8,"Harvard","Stanford",3.5,"400915489"
71,1,"11:00",1860,"Zena Edosomwan missed Free Throw.",10,8,"Harvard","Stanford",3.5,"400915489"
72,1,"11:00",1860,"Harvard Deadball Team Rebound.",10,8,"Harvard","Stanford",3.5,"400915489"
73,1,"11:00",1860,"Zena Edosomwan missed Free Throw.",10,8,"Harvard","Stanford",3.5,"400915489"
74,1,"11:00",1860,"Josh Sharma Defensive Rebound.",10,8,"Harvard","Stanford",3.5,"400915489"
75,1,"10:49",1849,"Foul on Zena Edosomwan.",10,8,"Harvard","Stanford",3.5,"400915489"
76,1,"10:49",1849,"Marcus Sheffield missed Free Throw.",10,8,"Harvard","Stanford",3.5,"400915489"
77,1,"10:49",1849,"Stanford Deadball Team Rebound.",10,8,"Harvard","Stanford",3.5,"400915489"
78,1,"10:49",1849,"Marcus Sheffield made Free Throw.",11,8,"Harvard","Stanford",3.5,"400915489"
79,1,"10:43",1843,"Foul on Marcus Sheffield.",11,8,"Harvard","Stanford",3.5,"400915489"
80,1,"10:41",1841,"Seth Towns missed Jumper.",11,8,"Harvard","Stanford",3.5,"400915489"
81,1,"10:41",1841,"Reid Travis Defensive Rebound.",11,8,"Harvard","Stanford",3.5,"400915489"
82,1,"10:26",1826,"Christian Sanders missed Layup.",11,8,"Harvard","Stanford",3.5,"400915489"
83,1,"10:26",1826,"Zena Edosomwan Defensive Rebound.",11,8,"Harvard","Stanford",3.5,"400915489"
84,1,"10:07",1807,"Foul on Reid Travis.",11,8,"Harvard","Stanford",3.5,"400915489"
85,1,"10:07",1807,"Zena Edosomwan made Free Throw.",11,9,"Harvard","Stanford",3.5,"400915489"
86,1,"10:07",1807,"Zena Edosomwan missed Free Throw.",11,9,"Harvard","Stanford",3.5,"400915489"
87,1,"10:07",1807,"Reid Travis Defensive Rebound.",11,9,"Harvard","Stanford",3.5,"400915489"
88,1,"9:47",1787,"Foul on Zena Edosomwan.",11,9,"Harvard","Stanford",3.5,"400915489"
89,1,"9:47",1787,"Reid Travis missed Free Throw.",11,9,"Harvard","Stanford",3.5,"400915489"
90,1,"9:47",1787,"Chris Lewis Defensive Rebound.",11,9,"Harvard","Stanford",3.5,"400915489"
91,1,"9:47",1787,"Foul on Josh Sharma.",11,9,"Harvard","Stanford",3.5,"400915489"
92,1,"9:47",1787,"Henry Welsh made Free Throw.",11,10,"Harvard","Stanford",3.5,"400915489"
93,1,"9:47",1787,"Henry Welsh made Free Throw.",11,11,"Harvard","Stanford",3.5,"400915489"
94,1,"9:32",1772,"Foul on Dorian Pickens.",11,11,"Harvard","Stanford",3.5,"400915489"
95,1,"9:32",1772,"Dorian Pickens Turnover.",11,11,"Harvard","Stanford",3.5,"400915489"
96,1,"9:20",1760,"Henry Welsh made Jumper.",11,13,"Harvard","Stanford",3.5,"400915489"
97,1,"9:04",1744,"Marcus Allen missed Jumper.",11,13,"Harvard","Stanford",3.5,"400915489"
98,1,"9:04",1744,"Henry Welsh Defensive Rebound.",11,13,"Harvard","Stanford",3.5,"400915489"
99,1,"8:53",1733,"Christian Juzang missed Three Point Jumper.",11,13,"Harvard","Stanford",3.5,"400915489"
100,1,"8:53",1733,"Reid Travis Defensive Rebound.",11,13,"Harvard","Stanford",3.5,"400915489"
101,1,"8:32",1712,"Foul on Chris Lewis.",11,13,"Harvard","Stanford",3.5,"400915489"
102,1,"8:32",1712,"Reid Travis made Free Throw.",12,13,"Harvard","Stanford",3.5,"400915489"
103,1,"8:32",1712,"Reid Travis missed Free Throw.",12,13,"Harvard","Stanford",3.5,"400915489"
104,1,"8:32",1712,"Christian Juzang Defensive Rebound.",12,13,"Harvard","Stanford",3.5,"400915489"
105,1,"8:15",1695,"Henry Welsh Turnover.",12,13,"Harvard","Stanford",3.5,"400915489"
106,1,"8:15",1695,"Marcus Sheffield Steal.",12,13,"Harvard","Stanford",3.5,"400915489"
107,1,"8:09",1689,"Dorian Pickens missed Three Point Jumper.",12,13,"Harvard","Stanford",3.5,"400915489"
108,1,"8:09",1689,"Reid Travis Offensive Rebound.",12,13,"Harvard","Stanford",3.5,"400915489"
109,1,"8:05",1685,"Reid Travis missed Jumper.",12,13,"Harvard","Stanford",3.5,"400915489"
110,1,"8:05",1685,"Grant Verhoeven Offensive Rebound.",12,13,"Harvard","Stanford",3.5,"400915489"
111,1,"7:59",1679,"Foul on Tommy McCarthy.",12,13,"Harvard","Stanford",3.5,"400915489"
112,1,"7:59",1679,"Official TV Timeout",12,13,"Harvard","Stanford",3.5,"400915489"
113,1,"7:59",1679,"Grant Verhoeven made Free Throw.",13,13,"Harvard","Stanford",3.5,"400915489"
114,1,"7:59",1679,"Grant Verhoeven made Free Throw.",14,13,"Harvard","Stanford",3.5,"400915489"
115,1,"7:42",1662,"Henry Welsh made Layup. Assisted by Chris Lewis.",14,15,"Harvard","Stanford",3.5,"400915489"
116,1,"7:25",1645,"Robert Cartwright missed Jumper.",14,15,"Harvard","Stanford",3.5,"400915489"
117,1,"7:25",1645,"Grant Verhoeven Offensive Rebound.",14,15,"Harvard","Stanford",3.5,"400915489"
118,1,"7:19",1639,"Foul on Henry Welsh.",14,15,"Harvard","Stanford",3.5,"400915489"
119,1,"7:19",1639,"Grant Verhoeven made Free Throw.",15,15,"Harvard","Stanford",3.5,"400915489"
120,1,"7:19",1639,"Grant Verhoeven made Free Throw.",16,15,"Harvard","Stanford",3.5,"400915489"
121,1,"7:02",1622,"Bryce Aiken missed Jumper.",16,15,"Harvard","Stanford",3.5,"400915489"
122,1,"7:02",1622,"Reid Travis Defensive Rebound.",16,15,"Harvard","Stanford",3.5,"400915489"
123,1,"6:39",1599,"Marcus Sheffield made Jumper.",18,15,"Harvard","Stanford",3.5,"400915489"
124,1,"6:14",1574,"Henry Welsh Turnover.",18,15,"Harvard","Stanford",3.5,"400915489"
125,1,"6:14",1574,"Grant Verhoeven Steal.",18,15,"Harvard","Stanford",3.5,"400915489"
126,1,"6:05",1565,"Reid Travis missed Layup.",18,15,"Harvard","Stanford",3.5,"400915489"
127,1,"6:05",1565,"Reid Travis Offensive Rebound.",18,15,"Harvard","Stanford",3.5,"400915489"
128,1,"6:00",1560,"Foul on Christian Juzang.",18,15,"Harvard","Stanford",3.5,"400915489"
129,1,"6:00",1560,"Reid Travis made Free Throw.",19,15,"Harvard","Stanford",3.5,"400915489"
130,1,"6:00",1560,"Reid Travis missed Free Throw.",19,15,"Harvard","Stanford",3.5,"400915489"
131,1,"6:00",1560,"Grant Verhoeven Offensive Rebound.",19,15,"Harvard","Stanford",3.5,"400915489"
132,1,"5:58",1558,"Foul on Reid Travis.",19,15,"Harvard","Stanford",3.5,"400915489"
133,1,"5:58",1558,"Reid Travis Turnover.",19,15,"Harvard","Stanford",3.5,"400915489"
134,1,"5:49",1549,"Bryce Aiken missed Three Point Jumper.",19,15,"Harvard","Stanford",3.5,"400915489"
135,1,"5:49",1549,"Seth Towns Offensive Rebound.",19,15,"Harvard","Stanford",3.5,"400915489"
136,1,"5:43",1543,"Foul on Marcus Sheffield.",19,15,"Harvard","Stanford",3.5,"400915489"
137,1,"5:43",1543,"Seth Towns missed Free Throw.",19,15,"Harvard","Stanford",3.5,"400915489"
138,1,"5:43",1543,"Harvard Deadball Team Rebound.",19,15,"Harvard","Stanford",3.5,"400915489"
139,1,"5:43",1543,"Seth Towns missed Free Throw.",19,15,"Harvard","Stanford",3.5,"400915489"
140,1,"5:43",1543,"Robert Cartwright Defensive Rebound.",19,15,"Harvard","Stanford",3.5,"400915489"
141,1,"5:40",1540,"Marcus Allen made Layup. Assisted by Robert Cartwright.",21,15,"Harvard","Stanford",3.5,"400915489"
142,1,"5:23",1523,"Zena Edosomwan missed Layup.",21,15,"Harvard","Stanford",3.5,"400915489"
143,1,"5:23",1523,"Zena Edosomwan Offensive Rebound.",21,15,"Harvard","Stanford",3.5,"400915489"
144,1,"5:16",1516,"Zena Edosomwan missed Layup.",21,15,"Harvard","Stanford",3.5,"400915489"
145,1,"5:16",1516,"Marcus Allen Defensive Rebound.",21,15,"Harvard","Stanford",3.5,"400915489"
146,1,"5:13",1513,"Foul on Marcus Allen.",21,15,"Harvard","Stanford",3.5,"400915489"
147,1,"5:13",1513,"Marcus Allen Turnover.",21,15,"Harvard","Stanford",3.5,"400915489"
148,1,"4:58",1498,"Chris Lewis missed Jumper.",21,15,"Harvard","Stanford",3.5,"400915489"
149,1,"4:58",1498,"Harvard Offensive Rebound.",21,15,"Harvard","Stanford",3.5,"400915489"
150,1,"4:54",1494,"Foul on Josh Sharma.",21,15,"Harvard","Stanford",3.5,"400915489"
151,1,"4:54",1494,"Chris Egi made Free Throw.",21,16,"Harvard","Stanford",3.5,"400915489"
152,1,"4:54",1494,"Chris Egi made Free Throw.",21,17,"Harvard","Stanford",3.5,"400915489"
153,1,"4:42",1482,"Grant Verhoeven made Jumper. Assisted by Marcus Allen.",23,17,"Harvard","Stanford",3.5,"400915489"
154,1,"4:30",1470,"Bryce Aiken made Three Point Jumper.",23,20,"Harvard","Stanford",3.5,"400915489"
155,1,"4:20",1460,"Foul on Bryce Aiken.",23,20,"Harvard","Stanford",3.5,"400915489"
156,1,"4:20",1460,"Robert Cartwright made Free Throw.",24,20,"Harvard","Stanford",3.5,"400915489"
157,1,"4:20",1460,"Robert Cartwright made Free Throw.",25,20,"Harvard","Stanford",3.5,"400915489"
158,1,"3:51",1431,"Christian Juzang missed Jumper.",25,20,"Harvard","Stanford",3.5,"400915489"
159,1,"3:51",1431,"Grant Verhoeven Defensive Rebound.",25,20,"Harvard","Stanford",3.5,"400915489"
160,1,"3:42",1422,"Grant Verhoeven made Layup. Assisted by Robert Cartwright.",27,20,"Harvard","Stanford",3.5,"400915489"
161,1,"3:37",1417,"Harvard  Timeout",27,20,"Harvard","Stanford",3.5,"400915489"
162,1,"3:26",1406,"Bryce Aiken made Three Point Jumper. Assisted by Chris Lewis.",27,23,"Harvard","Stanford",3.5,"400915489"
163,1,"3:06",1386,"Foul on Chris Lewis.",27,23,"Harvard","Stanford",3.5,"400915489"
164,1,"3:06",1386,"Robert Cartwright missed Free Throw.",27,23,"Harvard","Stanford",3.5,"400915489"
165,1,"3:06",1386,"Stanford Deadball Team Rebound.",27,23,"Harvard","Stanford",3.5,"400915489"
166,1,"3:06",1386,"Robert Cartwright made Free Throw.",28,23,"Harvard","Stanford",3.5,"400915489"
167,1,"2:54",1374,"Bryce Aiken missed Jumper.",28,23,"Harvard","Stanford",3.5,"400915489"
168,1,"2:54",1374,"Grant Verhoeven Defensive Rebound.",28,23,"Harvard","Stanford",3.5,"400915489"
169,1,"2:45",1365,"Trevor Stanback missed Layup.",28,23,"Harvard","Stanford",3.5,"400915489"
170,1,"2:45",1365,"Chris Egi Defensive Rebound.",28,23,"Harvard","Stanford",3.5,"400915489"
171,1,"2:31",1351,"Seth Towns missed Jumper.",28,23,"Harvard","Stanford",3.5,"400915489"
172,1,"2:31",1351,"Dorian Pickens Defensive Rebound.",28,23,"Harvard","Stanford",3.5,"400915489"
173,1,"1:59",1319,"Marcus Allen Turnover.",28,23,"Harvard","Stanford",3.5,"400915489"
174,1,"1:59",1319,"Bryce Aiken Steal.",28,23,"Harvard","Stanford",3.5,"400915489"
175,1,"1:58",1318,"Seth Towns missed Jumper.",28,23,"Harvard","Stanford",3.5,"400915489"
176,1,"1:58",1318,"Grant Verhoeven Defensive Rebound.",28,23,"Harvard","Stanford",3.5,"400915489"
177,1,"1:40",1300,"Dorian Pickens missed Jumper.",28,23,"Harvard","Stanford",3.5,"400915489"
178,1,"1:40",1300,"Henry Welsh Defensive Rebound.",28,23,"Harvard","Stanford",3.5,"400915489"
179,1,"1:27",1287,"Henry Welsh missed Jumper.",28,23,"Harvard","Stanford",3.5,"400915489"
180,1,"1:27",1287,"Seth Towns Offensive Rebound.",28,23,"Harvard","Stanford",3.5,"400915489"
181,1,"1:23",1283,"Seth Towns made Layup.",28,25,"Harvard","Stanford",3.5,"400915489"
182,1,"1:04",1264,"Robert Cartwright missed Layup.",28,25,"Harvard","Stanford",3.5,"400915489"
183,1,"1:04",1264,"Chris Egi Block.",28,25,"Harvard","Stanford",3.5,"400915489"
184,1,"1:04",1264,"Harvard Defensive Rebound.",28,25,"Harvard","Stanford",3.5,"400915489"
185,1,"0:43",1243,"Foul on Trevor Stanback.",28,25,"Harvard","Stanford",3.5,"400915489"
186,1,"0:43",1243,"Henry Welsh missed Free Throw.",28,25,"Harvard","Stanford",3.5,"400915489"
187,1,"0:43",1243,"Harvard Deadball Team Rebound.",28,25,"Harvard","Stanford",3.5,"400915489"
188,1,"0:43",1243,"Henry Welsh made Free Throw.",28,26,"Harvard","Stanford",3.5,"400915489"
189,1,"0:32",1232,"Dorian Pickens made Layup. Assisted by Grant Verhoeven.",30,26,"Harvard","Stanford",3.5,"400915489"
190,1,"0:04",1204,"Foul on Trevor Stanback.",30,26,"Harvard","Stanford",3.5,"400915489"
191,1,"0:04",1204,"Siyani Chambers made Free Throw.",30,27,"Harvard","Stanford",3.5,"400915489"
192,1,"0:04",1204,"Stanford  Timeout",30,27,"Harvard","Stanford",3.5,"400915489"
193,1,"0:04",1204,"Siyani Chambers made Free Throw.",30,28,"Harvard","Stanford",3.5,"400915489"
194,1,"0:00",1200,"End of 1st half",30,28,"Harvard","Stanford",3.5,"400915489"
195,2,"20:00",1200,"PLAY",30,28,"Harvard","Stanford",3.5,"400915489"
196,2,"20:00",1200,"Jump Ball won by Stanford",30,28,"Harvard","Stanford",3.5,"400915489"
197,2,"19:44",1184,"Michael Humphrey made Three Point Jumper. Assisted by Christian Sanders.",33,28,"Harvard","Stanford",3.5,"400915489"
198,2,"19:20",1160,"Corey Johnson missed Three Point Jumper.",33,28,"Harvard","Stanford",3.5,"400915489"
199,2,"19:20",1160,"Christian Sanders Defensive Rebound.",33,28,"Harvard","Stanford",3.5,"400915489"
200,2,"19:04",1144,"Dorian Pickens missed Jumper.",33,28,"Harvard","Stanford",3.5,"400915489"
201,2,"19:04",1144,"Seth Towns Block.",33,28,"Harvard","Stanford",3.5,"400915489"
202,2,"19:04",1144,"Zena Edosomwan Defensive Rebound.",33,28,"Harvard","Stanford",3.5,"400915489"
203,2,"18:56",1136,"Seth Towns missed Jumper.",33,28,"Harvard","Stanford",3.5,"400915489"
204,2,"18:56",1136,"Reid Travis Defensive Rebound.",33,28,"Harvard","Stanford",3.5,"400915489"
205,2,"18:45",1125,"Michael Humphrey Turnover.",33,28,"Harvard","Stanford",3.5,"400915489"
206,2,"18:45",1125,"Corey Johnson Steal.",33,28,"Harvard","Stanford",3.5,"400915489"
207,2,"18:38",1118,"Foul on Christian Sanders.",33,28,"Harvard","Stanford",3.5,"400915489"
208,2,"18:35",1115,"Foul on Christian Sanders.",33,28,"Harvard","Stanford",3.5,"400915489"
209,2,"18:35",1115,"Siyani Chambers made Free Throw.",33,29,"Harvard","Stanford",3.5,"400915489"
210,2,"18:35",1115,"Siyani Chambers made Free Throw.",33,30,"Harvard","Stanford",3.5,"400915489"
211,2,"18:24",1104,"Foul on Corey Johnson.",33,30,"Harvard","Stanford",3.5,"400915489"
212,2,"18:24",1104,"Dorian Pickens made Free Throw.",34,30,"Harvard","Stanford",3.5,"400915489"
213,2,"18:24",1104,"Dorian Pickens made Free Throw.",35,30,"Harvard","Stanford",3.5,"400915489"
214,2,"18:15",1095,"Zena Edosomwan Turnover.",35,30,"Harvard","Stanford",3.5,"400915489"
215,2,"18:02",1082,"Foul on Chris Egi.",35,30,"Harvard","Stanford",3.5,"400915489"
216,2,"18:01",1081,"Michael Humphrey missed Jumper.",35,30,"Harvard","Stanford",3.5,"400915489"
217,2,"18:01",1081,"Zena Edosomwan Defensive Rebound.",35,30,"Harvard","Stanford",3.5,"400915489"
218,2,"17:44",1064,"Bryce Aiken missed Three Point Jumper.",35,30,"Harvard","Stanford",3.5,"400915489"
219,2,"17:44",1064,"Dorian Pickens Defensive Rebound.",35,30,"Harvard","Stanford",3.5,"400915489"
220,2,"17:32",1052,"Reid Travis made Layup. Assisted by Christian Sanders.",37,30,"Harvard","Stanford",3.5,"400915489"
221,2,"17:32",1052,"Foul on Bryce Aiken.",37,30,"Harvard","Stanford",3.5,"400915489"
222,2,"17:32",1052,"Reid Travis missed Free Throw.",37,30,"Harvard","Stanford",3.5,"400915489"
223,2,"17:32",1052,"Henry Welsh Defensive Rebound.",37,30,"Harvard","Stanford",3.5,"400915489"
224,2,"17:20",1040,"Bryce Aiken Turnover.",37,30,"Harvard","Stanford",3.5,"400915489"
225,2,"17:14",1034,"Reid Travis made Dunk. Assisted by Christian Sanders.",39,30,"Harvard","Stanford",3.5,"400915489"
226,2,"16:51",1011,"Henry Welsh missed Jumper.",39,30,"Harvard","Stanford",3.5,"400915489"
227,2,"16:51",1011,"Henry Welsh Offensive Rebound.",39,30,"Harvard","Stanford",3.5,"400915489"
228,2,"16:44",1004,"Siyani Chambers made Jumper.",39,32,"Harvard","Stanford",3.5,"400915489"
229,2,"16:26",986,"Dorian Pickens Turnover.",39,32,"Harvard","Stanford",3.5,"400915489"
230,2,"16:26",986,"Christian Juzang Steal.",39,32,"Harvard","Stanford",3.5,"400915489"
231,2,"16:16",976,"Henry Welsh made Jumper. Assisted by Siyani Chambers.",39,34,"Harvard","Stanford",3.5,"400915489"
232,2,"16:01",961,"Foul on Henry Welsh.",39,34,"Harvard","Stanford",3.5,"400915489"
233,2,"15:53",953,"Grant Verhoeven made Layup. Assisted by Marcus Allen.",41,34,"Harvard","Stanford",3.5,"400915489"
234,2,"15:41",941,"Chris Lewis made Layup. Assisted by Henry Welsh.",41,36,"Harvard","Stanford",3.5,"400915489"
235,2,"15:32",932,"Reid Travis made Jumper. Assisted by Dorian Pickens.",43,36,"Harvard","Stanford",3.5,"400915489"
236,2,"15:21",921,"Foul on Grant Verhoeven.",43,36,"Harvard","Stanford",3.5,"400915489"
237,2,"15:20",920,"Official TV Timeout",43,36,"Harvard","Stanford",3.5,"400915489"
238,2,"14:56",896,"Foul on Grant Verhoeven.",43,36,"Harvard","Stanford",3.5,"400915489"
239,2,"14:33",873,"Siyani Chambers made Three Point Jumper.",43,39,"Harvard","Stanford",3.5,"400915489"
240,2,"14:14",854,"Reid Travis made Dunk. Assisted by Marcus Sheffield.",45,39,"Harvard","Stanford",3.5,"400915489"
241,2,"13:53",833,"Corey Johnson Turnover.",45,39,"Harvard","Stanford",3.5,"400915489"
242,2,"13:53",833,"Marcus Allen Steal.",45,39,"Harvard","Stanford",3.5,"400915489"
243,2,"13:47",827,"Marcus Allen made Layup.",47,39,"Harvard","Stanford",3.5,"400915489"
244,2,"13:32",812,"Chris Lewis Turnover.",47,39,"Harvard","Stanford",3.5,"400915489"
245,2,"13:32",812,"Michael Humphrey Steal.",47,39,"Harvard","Stanford",3.5,"400915489"
246,2,"13:16",796,"Reid Travis missed Jumper.",47,39,"Harvard","Stanford",3.5,"400915489"
247,2,"13:16",796,"Corey Johnson Defensive Rebound.",47,39,"Harvard","Stanford",3.5,"400915489"
248,2,"13:03",783,"Bryce Aiken missed Three Point Jumper.",47,39,"Harvard","Stanford",3.5,"400915489"
249,2,"13:03",783,"Reid Travis Defensive Rebound.",47,39,"Harvard","Stanford",3.5,"400915489"
250,2,"12:53",773,"Robert Cartwright missed Layup.",47,39,"Harvard","Stanford",3.5,"400915489"
251,2,"12:53",773,"Bryce Aiken Defensive Rebound.",47,39,"Harvard","Stanford",3.5,"400915489"
252,2,"12:40",760,"Chris Lewis Turnover.",47,39,"Harvard","Stanford",3.5,"400915489"
253,2,"12:40",760,"Michael Humphrey Steal.",47,39,"Harvard","Stanford",3.5,"400915489"
254,2,"12:32",752,"Foul on Michael Humphrey.",47,39,"Harvard","Stanford",3.5,"400915489"
255,2,"12:32",752,"Michael Humphrey Turnover.",47,39,"Harvard","Stanford",3.5,"400915489"
256,2,"12:18",738,"Chris Egi made Layup. Assisted by Bryce Aiken.",47,41,"Harvard","Stanford",3.5,"400915489"
257,2,"12:07",727,"Marcus Sheffield missed Jumper.",47,41,"Harvard","Stanford",3.5,"400915489"
258,2,"12:07",727,"Harvard Deadball Team Rebound.",47,41,"Harvard","Stanford",3.5,"400915489"
259,2,"12:03",723,"Foul on Josh Sharma.",47,41,"Harvard","Stanford",3.5,"400915489"
260,2,"11:48",708,"Seth Towns made Dunk.",47,43,"Harvard","Stanford",3.5,"400915489"
261,2,"11:48",708,"Foul on Josh Sharma.",47,43,"Harvard","Stanford",3.5,"400915489"
262,2,"11:48",708,"Official TV Timeout",47,43,"Harvard","Stanford",3.5,"400915489"
263,2,"11:48",708,"Seth Towns made Free Throw.",47,44,"Harvard","Stanford",3.5,"400915489"
264,2,"11:27",687,"Reid Travis missed Jumper.",47,44,"Harvard","Stanford",3.5,"400915489"
265,2,"11:27",687,"Christian Juzang Defensive Rebound.",47,44,"Harvard","Stanford",3.5,"400915489"
266,2,"11:02",662,"Bryce Aiken missed Layup.",47,44,"Harvard","Stanford",3.5,"400915489"
267,2,"11:02",662,"Reid Travis Defensive Rebound.",47,44,"Harvard","Stanford",3.5,"400915489"
268,2,"10:53",653,"Marcus Allen missed Jumper.",47,44,"Harvard","Stanford",3.5,"400915489"
269,2,"10:53",653,"Corey Johnson Defensive Rebound.",47,44,"Harvard","Stanford",3.5,"400915489"
270,2,"10:41",641,"Seth Towns missed Three Point Jumper.",47,44,"Harvard","Stanford",3.5,"400915489"
271,2,"10:41",641,"Marcus Sheffield Defensive Rebound.",47,44,"Harvard","Stanford",3.5,"400915489"
272,2,"10:26",626,"Marcus Sheffield made Jumper.",49,44,"Harvard","Stanford",3.5,"400915489"
273,2,"10:02",602,"Foul on Marcus Sheffield.",49,44,"Harvard","Stanford",3.5,"400915489"
274,2,"10:02",602,"Christian Juzang made Free Throw.",49,45,"Harvard","Stanford",3.5,"400915489"
275,2,"10:02",602,"Christian Juzang made Free Throw.",49,46,"Harvard","Stanford",3.5,"400915489"
276,2,"9:41",581,"Foul on Seth Towns.",49,46,"Harvard","Stanford",3.5,"400915489"
277,2,"9:41",581,"Reid Travis made Free Throw.",50,46,"Harvard","Stanford",3.5,"400915489"
278,2,"9:41",581,"Reid Travis made Free Throw.",51,46,"Harvard","Stanford",3.5,"400915489"
