"play_id","half","time_remaining_half","secs_remaining","description","home_score","away_score","away","home","home_favored_by","game_id"
23,1,"17:32",2252,"Udoka Azubuike Steal.",8,6,"Stanford","Kansas",17.5,"400915544"
24,1,"17:27",2247,"Josh Jackson Turnover.",8,6,"Stanford","Kansas",17.5,"400915544"
25,1,"17:27",2247,"Marcus Allen Steal.",8,6,"Stanford","Kansas",17.5,"400915544"
26,1,"17:12",2232,"Foul on Lagerald Vick.",8,6,"Stanford","Kansas",17.5,"400915544"
27,1,"17:12",2232,"Marcus Allen missed Free Throw.",8,6,"Stanford","Kansas",17.5,"400915544"
28,1,"17:12",2232,"Stanford Deadball Team Rebound.",8,6,"Stanford","Kansas",17.5,"400915544"
29,1,"17:12",2232,"Marcus Allen made Free Throw.",8,7,"Stanford","Kansas",17.5,"400915544"
30,1,"16:55",2215,"Frank Mason III missed Jumper.",8,7,"Stanford","Kansas",17.5,"400915544"
31,1,"16:55",2215,"Grant Verhoeven Defensive Rebound.",8,7,"Stanford","Kansas",17.5,"400915544"
32,1,"16:22",2182,"Reid Travis made Jumper.",8,9,"Stanford","Kansas",17.5,"400915544"
33,1,"15:58",2158,"Carlton Bragg Jr. Turnover.",8,9,"Stanford","Kansas",17.5,"400915544"
34,1,"15:58",2158,"Dorian Pickens Steal.",8,9,"Stanford","Kansas",17.5,"400915544"
35,1,"15:54",2154,"Grant Verhoeven Turnover.",8,9,"Stanford","Kansas",17.5,"400915544"
36,1,"15:54",2154,"Carlton Bragg Jr. Steal.",8,9,"Stanford","Kansas",17.5,"400915544"
37,1,"15:51",2151,"Devonte' Graham made Three Point Jumper. Assisted by Carlton Bragg Jr..",11,9,"Stanford","Kansas",17.5,"400915544"
38,1,"15:28",2128,"Foul on Sviatoslav Mykhailiuk.",11,9,"Stanford","Kansas",17.5,"400915544"
39,1,"15:28",2128,"Official TV Timeout",11,9,"Stanford","Kansas",17.5,"400915544"
40,1,"15:12",2112,"Foul on Carlton Bragg Jr..",11,9,"Stanford","Kansas",17.5,"400915544"
41,1,"15:12",2112,"Reid Travis missed Free Throw.",11,9,"Stanford","Kansas",17.5,"400915544"
42,1,"15:12",2112,"Stanford Deadball Team Rebound.",11,9,"Stanford","Kansas",17.5,"400915544"
43,1,"15:12",2112,"Reid Travis made Free Throw.",11,10,"Stanford","Kansas",17.5,"400915544"
44,1,"14:59",2099,"Devonte' Graham missed Three Point Jumper.",11,10,"Stanford","Kansas",17.5,"400915544"
45,1,"14:59",2099,"Marcus Sheffield Defensive Rebound.",11,10,"Stanford","Kansas",17.5,"400915544"
46,1,"14:41",2081,"Michael Humphrey made Jumper.",11,12,"Stanford","Kansas",17.5,"400915544"
47,1,"14:27",2067,"Foul on Michael Humphrey.",11,12,"Stanford","Kansas",17.5,"400915544"
48,1,"14:23",2063,"Carlton Bragg Jr. missed Jumper.",11,12,"Stanford","Kansas",17.5,"400915544"
49,1,"14:23",2063,"Josh Sharma Block.",11,12,"Stanford","Kansas",17.5,"400915544"
50,1,"14:23",2063,"Josh Sharma Defensive Rebound.",11,12,"Stanford","Kansas",17.5,"400915544"
51,1,"14:08",2048,"Foul on Frank Mason III.",11,12,"Stanford","Kansas",17.5,"400915544"
52,1,"13:56",2036,"Dorian Pickens made Layup. Assisted by Marcus Sheffield.",11,14,"Stanford","Kansas",17.5,"400915544"
53,1,"13:39",2019,"Foul on Josh Sharma.",11,14,"Stanford","Kansas",17.5,"400915544"
54,1,"13:34",2014,"Foul on Landen Lucas.",11,14,"Stanford","Kansas",17.5,"400915544"
55,1,"13:34",2014,"Landen Lucas Turnover.",11,14,"Stanford","Kansas",17.5,"400915544"
56,1,"13:24",2004,"Robert Cartwright made Three Point Jumper.",11,17,"Stanford","Kansas",17.5,"400915544"
57,1,"13:14",1994,"Kansas  Timeout",11,17,"Stanford","Kansas",17.5,"400915544"
58,1,"13:02",1982,"Lagerald Vick Turnover.",11,17,"Stanford","Kansas",17.5,"400915544"
59,1,"13:02",1982,"Marcus Sheffield Steal.",11,17,"Stanford","Kansas",17.5,"400915544"
60,1,"12:54",1974,"Marcus Sheffield missed Layup.",11,17,"Stanford","Kansas",17.5,"400915544"
61,1,"12:54",1974,"Landen Lucas Block.",11,17,"Stanford","Kansas",17.5,"400915544"
62,1,"12:54",1974,"Stanford Offensive Rebound.",11,17,"Stanford","Kansas",17.5,"400915544"
63,1,"12:52",1972,"Foul on Dorian Pickens.",11,17,"Stanford","Kansas",17.5,"400915544"
64,1,"12:52",1972,"Dorian Pickens Turnover.",11,17,"Stanford","Kansas",17.5,"400915544"
65,1,"12:34",1954,"Foul on Reid Travis.",11,17,"Stanford","Kansas",17.5,"400915544"
66,1,"12:34",1954,"Landen Lucas made Free Throw.",12,17,"Stanford","Kansas",17.5,"400915544"
67,1,"12:34",1954,"Landen Lucas missed Free Throw.",12,17,"Stanford","Kansas",17.5,"400915544"
68,1,"12:34",1954,"Reid Travis Defensive Rebound.",12,17,"Stanford","Kansas",17.5,"400915544"
69,1,"12:10",1930,"Josh Sharma missed Jumper.",12,17,"Stanford","Kansas",17.5,"400915544"
70,1,"12:10",1930,"Udoka Azubuike Block.",12,17,"Stanford","Kansas",17.5,"400915544"
71,1,"12:10",1930,"Udoka Azubuike Defensive Rebound.",12,17,"Stanford","Kansas",17.5,"400915544"
72,1,"11:57",1917,"Josh Jackson made Jumper. Assisted by Devonte' Graham.",14,17,"Stanford","Kansas",17.5,"400915544"
73,1,"11:30",1890,"Robert Cartwright missed Three Point Jumper.",14,17,"Stanford","Kansas",17.5,"400915544"
74,1,"11:30",1890,"Landen Lucas Block.",14,17,"Stanford","Kansas",17.5,"400915544"
75,1,"11:30",1890,"Reid Travis Offensive Rebound.",14,17,"Stanford","Kansas",17.5,"400915544"
76,1,"11:27",1887,"Reid Travis missed Jumper.",14,17,"Stanford","Kansas",17.5,"400915544"
77,1,"11:27",1887,"Landen Lucas Defensive Rebound.",14,17,"Stanford","Kansas",17.5,"400915544"
78,1,"11:18",1878,"Devonte' Graham missed Three Point Jumper.",14,17,"Stanford","Kansas",17.5,"400915544"
79,1,"11:18",1878,"Udoka Azubuike Offensive Rebound.",14,17,"Stanford","Kansas",17.5,"400915544"
80,1,"11:10",1870,"Landen Lucas made Layup. Assisted by Udoka Azubuike.",16,17,"Stanford","Kansas",17.5,"400915544"
81,1,"10:53",1853,"Marcus Sheffield missed Jumper.",16,17,"Stanford","Kansas",17.5,"400915544"
82,1,"10:53",1853,"Josh Jackson Defensive Rebound.",16,17,"Stanford","Kansas",17.5,"400915544"
83,1,"10:43",1843,"Lagerald Vick missed Three Point Jumper.",16,17,"Stanford","Kansas",17.5,"400915544"
84,1,"10:43",1843,"Marcus Sheffield Defensive Rebound.",16,17,"Stanford","Kansas",17.5,"400915544"
85,1,"10:31",1831,"Dorian Pickens Turnover.",16,17,"Stanford","Kansas",17.5,"400915544"
86,1,"10:31",1831,"Official TV Timeout",16,17,"Stanford","Kansas",17.5,"400915544"
87,1,"10:09",1809,"Landen Lucas missed Jumper.",16,17,"Stanford","Kansas",17.5,"400915544"
88,1,"10:09",1809,"Josh Sharma Block.",16,17,"Stanford","Kansas",17.5,"400915544"
89,1,"10:09",1809,"Landen Lucas Offensive Rebound.",16,17,"Stanford","Kansas",17.5,"400915544"
90,1,"10:05",1805,"Foul on Marcus Allen.",16,17,"Stanford","Kansas",17.5,"400915544"
91,1,"10:05",1805,"Landen Lucas missed Free Throw.",16,17,"Stanford","Kansas",17.5,"400915544"
92,1,"10:05",1805,"Kansas Deadball Team Rebound.",16,17,"Stanford","Kansas",17.5,"400915544"
93,1,"10:05",1805,"Landen Lucas made Free Throw.",17,17,"Stanford","Kansas",17.5,"400915544"
94,1,"9:48",1788,"Grant Verhoeven made Jumper. Assisted by Marcus Sheffield.",17,19,"Stanford","Kansas",17.5,"400915544"
95,1,"9:24",1764,"Devonte' Graham made Three Point Jumper. Assisted by Frank Mason III.",20,19,"Stanford","Kansas",17.5,"400915544"
96,1,"9:02",1742,"Marcus Allen missed Jumper.",20,19,"Stanford","Kansas",17.5,"400915544"
97,1,"9:02",1742,"Kansas Defensive Rebound.",20,19,"Stanford","Kansas",17.5,"400915544"
98,1,"8:42",1722,"Frank Mason III made Three Point Jumper. Assisted by Carlton Bragg Jr..",23,19,"Stanford","Kansas",17.5,"400915544"
99,1,"8:20",1700,"Foul on Udoka Azubuike.",23,19,"Stanford","Kansas",17.5,"400915544"
100,1,"8:20",1700,"Christian Sanders made Free Throw.",23,20,"Stanford","Kansas",17.5,"400915544"
101,1,"8:20",1700,"Christian Sanders made Free Throw.",23,21,"Stanford","Kansas",17.5,"400915544"
102,1,"8:03",1683,"Carlton Bragg Jr. made Dunk. Assisted by Landen Lucas.",25,21,"Stanford","Kansas",17.5,"400915544"
103,1,"7:38",1658,"Grant Verhoeven made Layup.",25,23,"Stanford","Kansas",17.5,"400915544"
104,1,"7:24",1644,"Carlton Bragg Jr. made Jumper. Assisted by Frank Mason III.",27,23,"Stanford","Kansas",17.5,"400915544"
105,1,"7:02",1622,"Grant Verhoeven missed Three Point Jumper.",27,23,"Stanford","Kansas",17.5,"400915544"
106,1,"7:02",1622,"Frank Mason III Defensive Rebound.",27,23,"Stanford","Kansas",17.5,"400915544"
107,1,"6:55",1615,"Devonte' Graham made Three Point Jumper. Assisted by Frank Mason III.",30,23,"Stanford","Kansas",17.5,"400915544"
108,1,"6:39",1599,"Stanford  Timeout",30,23,"Stanford","Kansas",17.5,"400915544"
109,1,"6:30",1590,"Reid Travis missed Layup.",30,23,"Stanford","Kansas",17.5,"400915544"
110,1,"6:30",1590,"Carlton Bragg Jr. Defensive Rebound.",30,23,"Stanford","Kansas",17.5,"400915544"
111,1,"6:08",1568,"Sviatoslav Mykhailiuk missed Layup.",30,23,"Stanford","Kansas",17.5,"400915544"
112,1,"6:08",1568,"Stanford Defensive Rebound.",30,23,"Stanford","Kansas",17.5,"400915544"
113,1,"5:49",1549,"Dorian Pickens missed Jumper.",30,23,"Stanford","Kansas",17.5,"400915544"
114,1,"5:49",1549,"Landen Lucas Block.",30,23,"Stanford","Kansas",17.5,"400915544"
115,1,"5:49",1549,"Carlton Bragg Jr. Defensive Rebound.",30,23,"Stanford","Kansas",17.5,"400915544"
116,1,"5:43",1543,"Devonte' Graham made Three Point Jumper. Assisted by Sviatoslav Mykhailiuk.",33,23,"Stanford","Kansas",17.5,"400915544"
117,1,"5:16",1516,"Michael Humphrey Turnover.",33,23,"Stanford","Kansas",17.5,"400915544"
118,1,"4:52",1492,"Devonte' Graham missed Three Point Jumper.",33,23,"Stanford","Kansas",17.5,"400915544"
119,1,"4:52",1492,"Dorian Pickens Defensive Rebound.",33,23,"Stanford","Kansas",17.5,"400915544"
120,1,"4:36",1476,"Robert Cartwright Turnover.",33,23,"Stanford","Kansas",17.5,"400915544"
121,1,"4:15",1455,"Frank Mason III Turnover.",33,23,"Stanford","Kansas",17.5,"400915544"
122,1,"4:15",1455,"Dorian Pickens missed Jumper.",33,23,"Stanford","Kansas",17.5,"400915544"
123,1,"4:15",1455,"Michael Humphrey Offensive Rebound.",33,23,"Stanford","Kansas",17.5,"400915544"
124,1,"4:03",1443,"Michael Humphrey missed Jumper.",33,23,"Stanford","Kansas",17.5,"400915544"
125,1,"4:03",1443,"Michael Humphrey Offensive Rebound.",33,23,"Stanford","Kansas",17.5,"400915544"
126,1,"3:57",1437,"Michael Humphrey made Dunk.",33,25,"Stanford","Kansas",17.5,"400915544"
127,1,"3:42",1422,"Josh Jackson made Jumper.",35,25,"Stanford","Kansas",17.5,"400915544"
128,1,"3:22",1402,"Foul on Carlton Bragg Jr..",35,25,"Stanford","Kansas",17.5,"400915544"
129,1,"3:22",1402,"Official TV Timeout",35,25,"Stanford","Kansas",17.5,"400915544"
130,1,"3:22",1402,"Reid Travis made Free Throw.",35,26,"Stanford","Kansas",17.5,"400915544"
131,1,"3:22",1402,"Reid Travis made Free Throw.",35,27,"Stanford","Kansas",17.5,"400915544"
132,1,"3:10",1390,"Foul on Landen Lucas.",35,27,"Stanford","Kansas",17.5,"400915544"
133,1,"3:10",1390,"Landen Lucas Turnover.",35,27,"Stanford","Kansas",17.5,"400915544"
134,1,"3:00",1380,"Reid Travis made Jumper.",35,29,"Stanford","Kansas",17.5,"400915544"
135,1,"2:36",1356,"Foul on Michael Humphrey.",35,29,"Stanford","Kansas",17.5,"400915544"
136,1,"2:36",1356,"Dwight Coleby made Free Throw.",36,29,"Stanford","Kansas",17.5,"400915544"
137,1,"2:36",1356,"Dwight Coleby missed Free Throw.",36,29,"Stanford","Kansas",17.5,"400915544"
138,1,"2:36",1356,"Grant Verhoeven Defensive Rebound.",36,29,"Stanford","Kansas",17.5,"400915544"
139,1,"2:16",1336,"Christian Sanders Turnover.",36,29,"Stanford","Kansas",17.5,"400915544"
140,1,"2:16",1336,"Josh Jackson Steal.",36,29,"Stanford","Kansas",17.5,"400915544"
141,1,"2:07",1327,"Foul on Marcus Sheffield.",36,29,"Stanford","Kansas",17.5,"400915544"
142,1,"2:07",1327,"Frank Mason III made Free Throw.",37,29,"Stanford","Kansas",17.5,"400915544"
143,1,"2:07",1327,"Frank Mason III made Free Throw.",38,29,"Stanford","Kansas",17.5,"400915544"
144,1,"1:52",1312,"Dorian Pickens made Three Point Jumper. Assisted by Christian Sanders.",38,32,"Stanford","Kansas",17.5,"400915544"
145,1,"1:36",1296,"Josh Jackson missed Jumper.",38,32,"Stanford","Kansas",17.5,"400915544"
146,1,"1:36",1296,"Reid Travis Defensive Rebound.",38,32,"Stanford","Kansas",17.5,"400915544"
147,1,"1:29",1289,"Foul on Dwight Coleby.",38,32,"Stanford","Kansas",17.5,"400915544"
148,1,"1:29",1289,"Reid Travis missed Free Throw.",38,32,"Stanford","Kansas",17.5,"400915544"
149,1,"1:29",1289,"Stanford Deadball Team Rebound.",38,32,"Stanford","Kansas",17.5,"400915544"
150,1,"1:29",1289,"Reid Travis made Free Throw.",38,33,"Stanford","Kansas",17.5,"400915544"
151,1,"1:15",1275,"Lagerald Vick made Three Point Jumper. Assisted by Josh Jackson.",41,33,"Stanford","Kansas",17.5,"400915544"
152,1,"0:45",1245,"Christian Sanders Turnover.",41,33,"Stanford","Kansas",17.5,"400915544"
153,1,"0:45",1245,"Devonte' Graham Steal.",41,33,"Stanford","Kansas",17.5,"400915544"
154,1,"0:45",1245,"Foul on Christian Sanders.",41,33,"Stanford","Kansas",17.5,"400915544"
155,1,"0:38",1238,"Foul on Grant Verhoeven.",41,33,"Stanford","Kansas",17.5,"400915544"
156,1,"0:38",1238,"Josh Jackson made Free Throw.",42,33,"Stanford","Kansas",17.5,"400915544"
157,1,"0:38",1238,"Josh Jackson made Free Throw.",43,33,"Stanford","Kansas",17.5,"400915544"
158,1,"0:19",1219,"Dorian Pickens made Jumper.",43,35,"Stanford","Kansas",17.5,"400915544"
159,1,"0:08",1208,"Frank Mason III missed Three Point Jumper.",43,35,"Stanford","Kansas",17.5,"400915544"
160,1,"0:08",1208,"Dorian Pickens Defensive Rebound.",43,35,"Stanford","Kansas",17.5,"400915544"
161,1,"0:00",1200,"End of 1st half",43,35,"Stanford","Kansas",17.5,"400915544"
162,2,"20:00",1200,"PLAY",43,35,"Stanford","Kansas",17.5,"400915544"
163,2,"20:00",1200,"Jump Ball won by Kansas",43,35,"Stanford","Kansas",17.5,"400915544"
164,2,"19:52",1192,"Josh Jackson made Layup.",45,35,"Stanford","Kansas",17.5,"400915544"
165,2,"19:41",1181,"Michael Humphrey Turnover.",45,35,"Stanford","Kansas",17.5,"400915544"
166,2,"19:41",1181,"Josh Jackson Steal.",45,35,"Stanford","Kansas",17.5,"400915544"
167,2,"19:36",1176,"Udoka Azubuike made Dunk. Assisted by Josh Jackson.",47,35,"Stanford","Kansas",17.5,"400915544"
168,2,"19:05",1145,"Reid Travis missed Jumper.",47,35,"Stanford","Kansas",17.5,"400915544"
169,2,"19:05",1145,"Udoka Azubuike Block.",47,35,"Stanford","Kansas",17.5,"400915544"
170,2,"19:05",1145,"Udoka Azubuike Defensive Rebound.",47,35,"Stanford","Kansas",17.5,"400915544"
171,2,"18:54",1134,"Josh Jackson missed Three Point Jumper.",47,35,"Stanford","Kansas",17.5,"400915544"
172,2,"18:54",1134,"Michael Humphrey Defensive Rebound.",47,35,"Stanford","Kansas",17.5,"400915544"
173,2,"18:39",1119,"Michael Humphrey missed Dunk.",47,35,"Stanford","Kansas",17.5,"400915544"
174,2,"18:39",1119,"Kansas Defensive Rebound.",47,35,"Stanford","Kansas",17.5,"400915544"
175,2,"18:34",1114,"Josh Jackson missed Jumper.",47,35,"Stanford","Kansas",17.5,"400915544"
176,2,"18:34",1114,"Christian Sanders Defensive Rebound.",47,35,"Stanford","Kansas",17.5,"400915544"
177,2,"18:28",1108,"Marcus Allen made Layup.",47,37,"Stanford","Kansas",17.5,"400915544"
178,2,"18:14",1094,"Devonte' Graham missed Jumper.",47,37,"Stanford","Kansas",17.5,"400915544"
179,2,"18:14",1094,"Michael Humphrey Defensive Rebound.",47,37,"Stanford","Kansas",17.5,"400915544"
180,2,"18:14",1094,"Marcus Allen missed Jumper.",47,37,"Stanford","Kansas",17.5,"400915544"
181,2,"18:14",1094,"Udoka Azubuike Block.",47,37,"Stanford","Kansas",17.5,"400915544"
182,2,"18:14",1094,"Reid Travis Offensive Rebound.",47,37,"Stanford","Kansas",17.5,"400915544"
183,2,"17:55",1075,"Foul on Udoka Azubuike.",47,37,"Stanford","Kansas",17.5,"400915544"
184,2,"17:55",1075,"Reid Travis made Free Throw.",47,38,"Stanford","Kansas",17.5,"400915544"
185,2,"17:55",1075,"Reid Travis made Free Throw.",47,39,"Stanford","Kansas",17.5,"400915544"
186,2,"17:45",1065,"Frank Mason III made Three Point Jumper. Assisted by Devonte' Graham.",50,39,"Stanford","Kansas",17.5,"400915544"
187,2,"17:28",1048,"Reid Travis missed Layup.",50,39,"Stanford","Kansas",17.5,"400915544"
188,2,"17:28",1048,"Reid Travis Offensive Rebound.",50,39,"Stanford","Kansas",17.5,"400915544"
189,2,"17:22",1042,"Reid Travis made Layup.",50,41,"Stanford","Kansas",17.5,"400915544"
190,2,"17:11",1031,"Foul on Marcus Allen.",50,41,"Stanford","Kansas",17.5,"400915544"
191,2,"17:11",1031,"Frank Mason III made Free Throw.",51,41,"Stanford","Kansas",17.5,"400915544"
192,2,"17:11",1031,"Frank Mason III missed Free Throw.",51,41,"Stanford","Kansas",17.5,"400915544"
193,2,"17:11",1031,"Reid Travis Defensive Rebound.",51,41,"Stanford","Kansas",17.5,"400915544"
194,2,"16:58",1018,"Reid Travis made Layup. Assisted by Christian Sanders.",51,43,"Stanford","Kansas",17.5,"400915544"
195,2,"16:43",1003,"Landen Lucas missed Layup.",51,43,"Stanford","Kansas",17.5,"400915544"
196,2,"16:43",1003,"Landen Lucas Offensive Rebound.",51,43,"Stanford","Kansas",17.5,"400915544"
197,2,"16:39",999,"Foul on Reid Travis.",51,43,"Stanford","Kansas",17.5,"400915544"
198,2,"16:39",999,"Landen Lucas missed Free Throw.",51,43,"Stanford","Kansas",17.5,"400915544"
199,2,"16:39",999,"Kansas Deadball Team Rebound.",51,43,"Stanford","Kansas",17.5,"400915544"
200,2,"16:39",999,"Landen Lucas made Free Throw.",52,43,"Stanford","Kansas",17.5,"400915544"
201,2,"16:32",992,"Foul on Lagerald Vick.",52,43,"Stanford","Kansas",17.5,"400915544"
202,2,"16:19",979,"Reid Travis Turnover.",52,43,"Stanford","Kansas",17.5,"400915544"
203,2,"16:19",979,"Josh Jackson Steal.",52,43,"Stanford","Kansas",17.5,"400915544"
204,2,"16:09",969,"Lagerald Vick made Three Point Jumper.",55,43,"Stanford","Kansas",17.5,"400915544"
205,2,"15:54",954,"Foul on Landen Lucas.",55,43,"Stanford","Kansas",17.5,"400915544"
206,2,"15:54",954,"Official TV Timeout",55,43,"Stanford","Kansas",17.5,"400915544"
207,2,"15:54",954,"Michael Humphrey missed Free Throw.",55,43,"Stanford","Kansas",17.5,"400915544"
208,2,"15:54",954,"Stanford Deadball Team Rebound.",55,43,"Stanford","Kansas",17.5,"400915544"
209,2,"15:54",954,"Michael Humphrey made Free Throw.",55,44,"Stanford","Kansas",17.5,"400915544"
210,2,"15:39",939,"Foul on Grant Verhoeven.",55,44,"Stanford","Kansas",17.5,"400915544"
211,2,"15:39",939,"Carlton Bragg Jr. made Free Throw.",56,44,"Stanford","Kansas",17.5,"400915544"
212,2,"15:39",939,"Carlton Bragg Jr. missed Free Throw.",56,44,"Stanford","Kansas",17.5,"400915544"
213,2,"15:39",939,"Marcus Allen Defensive Rebound.",56,44,"Stanford","Kansas",17.5,"400915544"
214,2,"15:26",926,"Robert Cartwright made Layup.",56,46,"Stanford","Kansas",17.5,"400915544"
215,2,"15:07",907,"Carlton Bragg Jr. made Layup.",58,46,"Stanford","Kansas",17.5,"400915544"
216,2,"14:42",882,"Reid Travis missed Jumper.",58,46,"Stanford","Kansas",17.5,"400915544"
217,2,"14:42",882,"Josh Jackson Defensive Rebound.",58,46,"Stanford","Kansas",17.5,"400915544"
218,2,"14:25",865,"Josh Jackson missed Jumper.",58,46,"Stanford","Kansas",17.5,"400915544"
219,2,"14:25",865,"Marcus Sheffield Defensive Rebound.",58,46,"Stanford","Kansas",17.5,"400915544"
220,2,"14:14",854,"Foul on Josh Jackson.",58,46,"Stanford","Kansas",17.5,"400915544"
221,2,"14:11",851,"Foul on Carlton Bragg Jr..",58,46,"Stanford","Kansas",17.5,"400915544"
222,2,"14:11",851,"Reid Travis made Free Throw.",58,47,"Stanford","Kansas",17.5,"400915544"
223,2,"14:11",851,"Reid Travis made Free Throw.",58,48,"Stanford","Kansas",17.5,"400915544"
224,2,"14:03",843,"Lagerald Vick missed Jumper.",58,48,"Stanford","Kansas",17.5,"400915544"
225,2,"14:03",843,"Lagerald Vick Offensive Rebound.",58,48,"Stanford","Kansas",17.5,"400915544"
226,2,"13:59",839,"Lagerald Vick made Layup.",60,48,"Stanford","Kansas",17.5,"400915544"
227,2,"13:38",818,"Foul on Dwight Coleby.",60,48,"Stanford","Kansas",17.5,"400915544"
228,2,"13:38",818,"Reid Travis made Free Throw.",60,49,"Stanford","Kansas",17.5,"400915544"
229,2,"13:38",818,"Reid Travis made Free Throw.",60,50,"Stanford","Kansas",17.5,"400915544"
230,2,"13:28",808,"Frank Mason III made Jumper.",62,50,"Stanford","Kansas",17.5,"400915544"
231,2,"13:13",793,"Robert Cartwright missed Three Point Jumper.",62,50,"Stanford","Kansas",17.5,"400915544"
232,2,"13:13",793,"Frank Mason III Defensive Rebound.",62,50,"Stanford","Kansas",17.5,"400915544"
233,2,"13:00",780,"Lagerald Vick missed Jumper.",62,50,"Stanford","Kansas",17.5,"400915544"
234,2,"13:00",780,"Dwight Coleby Offensive Rebound.",62,50,"Stanford","Kansas",17.5,"400915544"
235,2,"12:55",775,"Foul on Michael Humphrey.",62,50,"Stanford","Kansas",17.5,"400915544"
236,2,"12:35",755,"Josh Jackson Turnover.",62,50,"Stanford","Kansas",17.5,"400915544"
237,2,"12:25",745,"Dorian Pickens missed Three Point Jumper.",62,50,"Stanford","Kansas",17.5,"400915544"
238,2,"12:25",745,"Devonte' Graham Defensive Rebound.",62,50,"Stanford","Kansas",17.5,"400915544"
239,2,"12:15",735,"Frank Mason III made Layup.",64,50,"Stanford","Kansas",17.5,"400915544"
240,2,"12:15",735,"Foul on Josh Sharma.",64,50,"Stanford","Kansas",17.5,"400915544"
241,2,"12:15",735,"Frank Mason III missed Free Throw.",64,50,"Stanford","Kansas",17.5,"400915544"
242,2,"12:15",735,"Josh Sharma Defensive Rebound.",64,50,"Stanford","Kansas",17.5,"400915544"
243,2,"12:07",727,"Foul on Sviatoslav Mykhailiuk.",64,50,"Stanford","Kansas",17.5,"400915544"
244,2,"12:07",727,"Marcus Sheffield made Free Throw.",64,51,"Stanford","Kansas",17.5,"400915544"
245,2,"12:07",727,"Marcus Sheffield made Free Throw.",64,52,"Stanford","Kansas",17.5,"400915544"
246,2,"11:50",710,"Josh Jackson made Layup.",66,52,"Stanford","Kansas",17.5,"400915544"
247,2,"11:50",710,"Official TV Timeout",66,52,"Stanford","Kansas",17.5,"400915544"
248,2,"11:34",694,"Marcus Sheffield missed Jumper.",66,52,"Stanford","Kansas",17.5,"400915544"
249,2,"11:34",694,"Landen Lucas Defensive Rebound.",66,52,"Stanford","Kansas",17.5,"400915544"
250,2,"11:10",670,"Landen Lucas missed Layup.",66,52,"Stanford","Kansas",17.5,"400915544"
251,2,"11:10",670,"Josh Sharma Defensive Rebound.",66,52,"Stanford","Kansas",17.5,"400915544"
252,2,"10:50",650,"Reid Travis missed Jumper.",66,52,"Stanford","Kansas",17.5,"400915544"
253,2,"10:50",650,"Devonte' Graham Defensive Rebound.",66,52,"Stanford","Kansas",17.5,"400915544"
254,2,"10:31",631,"Devonte' Graham missed Jumper.",66,52,"Stanford","Kansas",17.5,"400915544"
255,2,"10:31",631,"Reid Travis Defensive Rebound.",66,52,"Stanford","Kansas",17.5,"400915544"
256,2,"10:22",622,"Robert Cartwright made Jumper.",66,54,"Stanford","Kansas",17.5,"400915544"
257,2,"10:05",605,"Josh Jackson made Dunk. Assisted by Devonte' Graham.",68,54,"Stanford","Kansas",17.5,"400915544"
258,2,"9:54",594,"Foul on Landen Lucas.",68,54,"Stanford","Kansas",17.5,"400915544"
259,2,"9:54",594,"Reid Travis missed Free Throw.",68,54,"Stanford","Kansas",17.5,"400915544"
260,2,"9:54",594,"Stanford Deadball Team Rebound.",68,54,"Stanford","Kansas",17.5,"400915544"
261,2,"9:54",594,"Reid Travis made Free Throw.",68,55,"Stanford","Kansas",17.5,"400915544"
262,2,"9:37",577,"Foul on Marcus Allen.",68,55,"Stanford","Kansas",17.5,"400915544"
263,2,"9:30",570,"Frank Mason III made Layup.",70,55,"Stanford","Kansas",17.5,"400915544"
264,2,"9:30",570,"Foul on Cameron Walker.",70,55,"Stanford","Kansas",17.5,"400915544"
265,2,"9:30",570,"Frank Mason III missed Free Throw.",70,55,"Stanford","Kansas",17.5,"400915544"
266,2,"9:30",570,"Michael Humphrey Defensive Rebound.",70,55,"Stanford","Kansas",17.5,"400915544"
267,2,"9:15",555,"Foul on Udoka Azubuike.",70,55,"Stanford","Kansas",17.5,"400915544"
268,2,"9:15",555,"Reid Travis made Free Throw.",70,56,"Stanford","Kansas",17.5,"400915544"
269,2,"9:15",555,"Reid Travis made Free Throw.",70,57,"Stanford","Kansas",17.5,"400915544"
270,2,"8:59",539,"Devonte' Graham missed Three Point Jumper.",70,57,"Stanford","Kansas",17.5,"400915544"
271,2,"8:59",539,"Marcus Allen Defensive Rebound.",70,57,"Stanford","Kansas",17.5,"400915544"
272,2,"8:56",536,"Foul on Dwight Coleby.",70,57,"Stanford","Kansas",17.5,"400915544"
273,2,"8:56",536,"Marcus Allen made Free Throw.",70,58,"Stanford","Kansas",17.5,"400915544"
274,2,"8:56",536,"Marcus Allen made Free Throw.",70,59,"Stanford","Kansas",17.5,"400915544"
275,2,"8:40",520,"Sviatoslav Mykhailiuk made Three Point Jumper. Assisted by Lagerald Vick.",73,59,"Stanford","Kansas",17.5,"400915544"
276,2,"8:14",494,"Foul on Dwight Coleby.",73,59,"Stanford","Kansas",17.5,"400915544"
277,2,"8:14",494,"Reid Travis made Free Throw.",73,60,"Stanford","Kansas",17.5,"400915544"
278,2,"8:14",494,"Reid Travis made Free Throw.",73,61,"Stanford","Kansas",17.5,"400915544"
279,2,"8:03",483,"Sviatoslav Mykhailiuk missed Three Point Jumper.",73,61,"Stanford","Kansas",17.5,"400915544"
280,2,"8:03",483,"Reid Travis Defensive Rebound.",73,61,"Stanford","Kansas",17.5,"400915544"
281,2,"7:51",471,"Reid Travis missed Jumper.",73,61,"Stanford","Kansas",17.5,"400915544"
282,2,"7:51",471,"Michael Humphrey Offensive Rebound.",73,61,"Stanford","Kansas",17.5,"400915544"
283,2,"7:51",471,"Michael Humphrey made Two Point Tip Shot.",73,63,"Stanford","Kansas",17.5,"400915544"
284,2,"7:24",444,"Sviatoslav Mykhailiuk made Three Point Jumper. Assisted by Frank Mason III.",76,63,"Stanford","Kansas",17.5,"400915544"
285,2,"6:53",413,"Cameron Walker made Layup. Assisted by Christian Sanders.",76,65,"Stanford","Kansas",17.5,"400915544"
286,2,"6:53",413,"Foul on Lagerald Vick.",76,65,"Stanford","Kansas",17.5,"400915544"
287,2,"6:53",413,"Official TV Timeout",76,65,"Stanford","Kansas",17.5,"400915544"
288,2,"6:53",413,"Cameron Walker missed Free Throw.",76,65,"Stanford","Kansas",17.5,"400915544"
289,2,"6:53",413,"Carlton Bragg Jr. Defensive Rebound.",76,65,"Stanford","Kansas",17.5,"400915544"
290,2,"6:34",394,"Sviatoslav Mykhailiuk missed Three Point Jumper.",76,65,"Stanford","Kansas",17.5,"400915544"
291,2,"6:34",394,"Christian Sanders Defensive Rebound.",76,65,"Stanford","Kansas",17.5,"400915544"
292,2,"6:17",377,"Reid Travis missed Layup.",76,65,"Stanford","Kansas",17.5,"400915544"
293,2,"6:17",377,"Carlton Bragg Jr. Defensive Rebound.",76,65,"Stanford","Kansas",17.5,"400915544"
294,2,"6:05",365,"Sviatoslav Mykhailiuk made Jumper.",78,65,"Stanford","Kansas",17.5,"400915544"
295,2,"5:50",350,"Marcus Allen missed Jumper.",78,65,"Stanford","Kansas",17.5,"400915544"
