"play_id","half","time_remaining_half","secs_remaining","description","home_score","away_score","away","home","home_favored_by","game_id"
240,2,"10:56",656,"Sedrick Barefield made Three Point Jumper. Assisted by David Collette.",51,51,"Utah","Stanford",NA,"400915656"
241,2,"10:40",640,"Michael Humphrey made Jumper. Assisted by Marcus Sheffield.",53,51,"Utah","Stanford",NA,"400915656"
242,2,"10:22",622,"Tyler Rawson Turnover.",53,51,"Utah","Stanford",NA,"400915656"
243,2,"10:05",605,"Dorian Pickens Turnover.",53,51,"Utah","Stanford",NA,"400915656"
244,2,"10:03",603,"David Collette Steal.",53,51,"Utah","Stanford",NA,"400915656"
245,2,"9:47",587,"Foul on Michael Humphrey.",53,51,"Utah","Stanford",NA,"400915656"
246,2,"9:47",587,"Tyler Rawson made Free Throw.",53,52,"Utah","Stanford",NA,"400915656"
247,2,"9:47",587,"Tyler Rawson made Free Throw.",53,53,"Utah","Stanford",NA,"400915656"
248,2,"9:37",577,"Foul on Sedrick Barefield.",53,53,"Utah","Stanford",NA,"400915656"
249,2,"9:33",573,"Foul on Tyler Rawson.",53,53,"Utah","Stanford",NA,"400915656"
250,2,"9:33",573,"Marcus Sheffield made Free Throw.",54,53,"Utah","Stanford",NA,"400915656"
251,2,"9:33",573,"Marcus Sheffield missed Free Throw.",54,53,"Utah","Stanford",NA,"400915656"
252,2,"9:33",573,"Kyle Kuzma Defensive Rebound.",54,53,"Utah","Stanford",NA,"400915656"
253,2,"9:19",559,"Parker Van Dyke made Three Point Jumper. Assisted by Sedrick Barefield.",54,56,"Utah","Stanford",NA,"400915656"
254,2,"8:59",539,"Robert Cartwright Turnover.",54,56,"Utah","Stanford",NA,"400915656"
255,2,"8:57",537,"Sedrick Barefield Steal.",54,56,"Utah","Stanford",NA,"400915656"
256,2,"8:41",521,"Kyle Kuzma made Layup. Assisted by Sedrick Barefield.",54,58,"Utah","Stanford",NA,"400915656"
257,2,"8:34",514,"Stanford  Timeout",54,58,"Utah","Stanford",NA,"400915656"
258,2,"8:34",514,"Official TV Timeout",54,58,"Utah","Stanford",NA,"400915656"
259,2,"8:13",493,"Reid Travis made Layup.",56,58,"Utah","Stanford",NA,"400915656"
260,2,"7:52",472,"Kyle Kuzma missed Layup.",56,58,"Utah","Stanford",NA,"400915656"
261,2,"7:52",472,"Reid Travis Defensive Rebound.",56,58,"Utah","Stanford",NA,"400915656"
262,2,"7:44",464,"Reid Travis made Layup.",58,58,"Utah","Stanford",NA,"400915656"
263,2,"7:29",449,"Sedrick Barefield made Jumper.",58,60,"Utah","Stanford",NA,"400915656"
264,2,"7:19",439,"Marcus Sheffield made Layup. Assisted by Robert Cartwright.",60,60,"Utah","Stanford",NA,"400915656"
265,2,"6:49",409,"Foul on Kyle Kuzma.",60,60,"Utah","Stanford",NA,"400915656"
266,2,"6:49",409,"Kyle Kuzma Turnover.",60,60,"Utah","Stanford",NA,"400915656"
267,2,"6:49",409,"Official TV Timeout",60,60,"Utah","Stanford",NA,"400915656"
268,2,"6:39",399,"Dorian Pickens made Three Point Jumper. Assisted by Marcus Allen.",63,60,"Utah","Stanford",NA,"400915656"
269,2,"6:25",385,"Parker Van Dyke missed Three Point Jumper.",63,60,"Utah","Stanford",NA,"400915656"
270,2,"6:25",385,"Stanford Defensive Rebound.",63,60,"Utah","Stanford",NA,"400915656"
271,2,"6:06",366,"Reid Travis missed Layup.",63,60,"Utah","Stanford",NA,"400915656"
272,2,"6:02",362,"David Collette Defensive Rebound.",63,60,"Utah","Stanford",NA,"400915656"
273,2,"5:58",358,"Sedrick Barefield missed Layup.",63,60,"Utah","Stanford",NA,"400915656"
274,2,"5:58",358,"Utah Offensive Rebound.",63,60,"Utah","Stanford",NA,"400915656"
275,2,"5:54",354,"Parker Van Dyke missed Jumper.",63,60,"Utah","Stanford",NA,"400915656"
276,2,"5:54",354,"Marcus Allen Defensive Rebound.",63,60,"Utah","Stanford",NA,"400915656"
277,2,"5:44",344,"Dorian Pickens missed Layup.",63,60,"Utah","Stanford",NA,"400915656"
278,2,"5:44",344,"Reid Travis Offensive Rebound.",63,60,"Utah","Stanford",NA,"400915656"
279,2,"5:23",323,"Reid Travis missed Jumper.",63,60,"Utah","Stanford",NA,"400915656"
280,2,"5:23",323,"Reid Travis Offensive Rebound.",63,60,"Utah","Stanford",NA,"400915656"
281,2,"5:21",321,"Reid Travis made Jumper.",65,60,"Utah","Stanford",NA,"400915656"
282,2,"5:01",301,"Foul on Marcus Allen.",65,60,"Utah","Stanford",NA,"400915656"
283,2,"5:01",301,"Tyler Rawson made Free Throw.",65,61,"Utah","Stanford",NA,"400915656"
284,2,"5:01",301,"Tyler Rawson made Free Throw.",65,62,"Utah","Stanford",NA,"400915656"
285,2,"4:47",287,"Dorian Pickens made Three Point Jumper. Assisted by Robert Cartwright.",68,62,"Utah","Stanford",NA,"400915656"
286,2,"4:24",264,"Tyler Rawson missed Three Point Jumper.",68,62,"Utah","Stanford",NA,"400915656"
287,2,"4:24",264,"Robert Cartwright Defensive Rebound.",68,62,"Utah","Stanford",NA,"400915656"
288,2,"3:56",236,"Reid Travis made Jumper.",70,62,"Utah","Stanford",NA,"400915656"
289,2,"3:50",230,"Utah  Timeout",70,62,"Utah","Stanford",NA,"400915656"
290,2,"3:50",230,"Official TV Timeout",70,62,"Utah","Stanford",NA,"400915656"
291,2,"3:30",210,"Kyle Kuzma made Three Point Jumper. Assisted by Devon Daniels.",70,65,"Utah","Stanford",NA,"400915656"
292,2,"3:11",191,"Foul on David Collette.",70,65,"Utah","Stanford",NA,"400915656"
293,2,"3:11",191,"Reid Travis made Free Throw.",71,65,"Utah","Stanford",NA,"400915656"
294,2,"3:11",191,"Reid Travis made Free Throw.",72,65,"Utah","Stanford",NA,"400915656"
295,2,"3:05",185,"Foul on Marcus Allen.",72,65,"Utah","Stanford",NA,"400915656"
296,2,"3:04",184,"Sedrick Barefield made Free Throw.",72,66,"Utah","Stanford",NA,"400915656"
297,2,"3:04",184,"Sedrick Barefield made Free Throw.",72,67,"Utah","Stanford",NA,"400915656"
298,2,"2:41",161,"Marcus Allen made Jumper.",74,67,"Utah","Stanford",NA,"400915656"
299,2,"2:28",148,"Devon Daniels Turnover.",74,67,"Utah","Stanford",NA,"400915656"
300,2,"2:26",146,"Dorian Pickens Steal.",74,67,"Utah","Stanford",NA,"400915656"
301,2,"2:23",143,"Foul on Kyle Kuzma.",74,67,"Utah","Stanford",NA,"400915656"
302,2,"2:23",143,"Reid Travis made Free Throw.",75,67,"Utah","Stanford",NA,"400915656"
303,2,"2:23",143,"Reid Travis missed Free Throw.",75,67,"Utah","Stanford",NA,"400915656"
304,2,"2:23",143,"Kyle Kuzma Defensive Rebound.",75,67,"Utah","Stanford",NA,"400915656"
305,2,"2:15",135,"Sedrick Barefield missed Layup.",75,67,"Utah","Stanford",NA,"400915656"
306,2,"2:15",135,"Michael Humphrey Block.",75,67,"Utah","Stanford",NA,"400915656"
307,2,"2:15",135,"Utah Offensive Rebound.",75,67,"Utah","Stanford",NA,"400915656"
308,2,"2:04",124,"David Collette missed Layup.",75,67,"Utah","Stanford",NA,"400915656"
309,2,"2:04",124,"Utah Deadball Team Rebound.",75,67,"Utah","Stanford",NA,"400915656"
310,2,"2:03",123,"Foul on Michael Humphrey.",75,67,"Utah","Stanford",NA,"400915656"
311,2,"2:03",123,"Kyle Kuzma missed Free Throw.",75,67,"Utah","Stanford",NA,"400915656"
312,2,"2:03",123,"David Collette Offensive Rebound.",75,67,"Utah","Stanford",NA,"400915656"
313,2,"1:59",119,"David Collette made Jumper.",75,69,"Utah","Stanford",NA,"400915656"
314,2,"1:33",93,"Reid Travis made Jumper.",77,69,"Utah","Stanford",NA,"400915656"
315,2,"1:23",83,"Sedrick Barefield Turnover.",77,69,"Utah","Stanford",NA,"400915656"
316,2,"1:22",82,"Marcus Allen Steal.",77,69,"Utah","Stanford",NA,"400915656"
317,2,"1:18",78,"Foul on Kyle Kuzma.",77,69,"Utah","Stanford",NA,"400915656"
318,2,"1:18",78,"Marcus Allen missed Free Throw.",77,69,"Utah","Stanford",NA,"400915656"
319,2,"1:18",78,"Stanford Deadball Team Rebound.",77,69,"Utah","Stanford",NA,"400915656"
320,2,"1:18",78,"Marcus Allen made Free Throw.",78,69,"Utah","Stanford",NA,"400915656"
321,2,"1:10",70,"Devon Daniels missed Jumper.",78,69,"Utah","Stanford",NA,"400915656"
322,2,"1:10",70,"Robert Cartwright Defensive Rebound.",78,69,"Utah","Stanford",NA,"400915656"
323,2,"0:55",55,"Foul on Lorenzo Bonam.",78,69,"Utah","Stanford",NA,"400915656"
324,2,"0:55",55,"Robert Cartwright missed Free Throw.",78,69,"Utah","Stanford",NA,"400915656"
325,2,"0:55",55,"Kyle Kuzma Defensive Rebound.",78,69,"Utah","Stanford",NA,"400915656"
326,2,"0:45",45,"Lorenzo Bonam made Three Point Jumper.",78,72,"Utah","Stanford",NA,"400915656"
327,2,"0:39",39,"Foul on Kyle Kuzma.",78,72,"Utah","Stanford",NA,"400915656"
328,2,"0:39",39,"Robert Cartwright made Free Throw.",79,72,"Utah","Stanford",NA,"400915656"
329,2,"0:39",39,"Robert Cartwright missed Free Throw.",79,72,"Utah","Stanford",NA,"400915656"
330,2,"0:39",39,"Tyler Rawson Defensive Rebound.",79,72,"Utah","Stanford",NA,"400915656"
331,2,"0:31",31,"Tyler Rawson made Three Point Jumper.",79,75,"Utah","Stanford",NA,"400915656"
332,2,"0:29",29,"Utah  Timeout",79,75,"Utah","Stanford",NA,"400915656"
333,2,"0:28",28,"Foul on Lorenzo Bonam.",79,75,"Utah","Stanford",NA,"400915656"
334,2,"0:28",28,"Robert Cartwright made Free Throw.",80,75,"Utah","Stanford",NA,"400915656"
335,2,"0:28",28,"Robert Cartwright made Free Throw.",81,75,"Utah","Stanford",NA,"400915656"
336,2,"0:20",20,"Parker Van Dyke missed Three Point Jumper.",81,75,"Utah","Stanford",NA,"400915656"
337,2,"0:20",20,"Utah Offensive Rebound.",81,75,"Utah","Stanford",NA,"400915656"
338,2,"0:18",18,"Stanford  Timeout",81,75,"Utah","Stanford",NA,"400915656"
339,2,"0:16",16,"Tyler Rawson missed Three Point Jumper.",81,75,"Utah","Stanford",NA,"400915656"
340,2,"0:16",16,"Marcus Allen Defensive Rebound.",81,75,"Utah","Stanford",NA,"400915656"
341,2,"0:12",12,"Foul on Tyler Rawson.",81,75,"Utah","Stanford",NA,"400915656"
342,2,"0:12",12,"Marcus Allen missed Free Throw.",81,75,"Utah","Stanford",NA,"400915656"
343,2,"0:12",12,"Stanford Deadball Team Rebound.",81,75,"Utah","Stanford",NA,"400915656"
344,2,"0:12",12,"Marcus Allen missed Free Throw.",81,75,"Utah","Stanford",NA,"400915656"
345,2,"0:12",12,"Kyle Kuzma Defensive Rebound.",81,75,"Utah","Stanford",NA,"400915656"
346,2,"0:05",5,"Kyle Kuzma missed Jumper.",81,75,"Utah","Stanford",NA,"400915656"
347,2,"0:05",5,"Michael Humphrey Defensive Rebound.",81,75,"Utah","Stanford",NA,"400915656"
348,2,"0:00",0,"End of Game",81,75,"Utah","Stanford",NA,"400915656"
1,1,"20:00",2400,"PLAY",0,0,"Stanford","Arizona",13,"400915663"
2,1,"20:00",2400,"Jump Ball won by Stanford",0,0,"Stanford","Arizona",13,"400915663"
3,1,"19:49",2389,"Reid Travis missed Jumper.",0,0,"Stanford","Arizona",13,"400915663"
4,1,"19:48",2388,"Reid Travis Offensive Rebound.",0,0,"Stanford","Arizona",13,"400915663"
5,1,"19:45",2385,"Reid Travis made Layup.",0,2,"Stanford","Arizona",13,"400915663"
6,1,"19:19",2359,"Lauri Markkanen missed Three Point Jumper.",0,2,"Stanford","Arizona",13,"400915663"
7,1,"19:19",2359,"Michael Humphrey Defensive Rebound.",0,2,"Stanford","Arizona",13,"400915663"
8,1,"19:06",2346,"Marcus Allen missed Jumper.",0,2,"Stanford","Arizona",13,"400915663"
9,1,"19:06",2346,"Allonzo Trier Defensive Rebound.",0,2,"Stanford","Arizona",13,"400915663"
10,1,"18:55",2335,"Allonzo Trier Turnover.",0,2,"Stanford","Arizona",13,"400915663"
11,1,"18:55",2335,"Marcus Allen Steal.",0,2,"Stanford","Arizona",13,"400915663"
12,1,"18:47",2327,"Dorian Pickens made Three Point Jumper. Assisted by Robert Cartwright.",0,5,"Stanford","Arizona",13,"400915663"
13,1,"18:28",2308,"Allonzo Trier missed Three Point Jumper.",0,5,"Stanford","Arizona",13,"400915663"
14,1,"18:28",2308,"Arizona Offensive Rebound.",0,5,"Stanford","Arizona",13,"400915663"
15,1,"18:01",2281,"Dusan Ristic missed Jumper.",0,5,"Stanford","Arizona",13,"400915663"
16,1,"18:01",2281,"Rawle Alkins Offensive Rebound.",0,5,"Stanford","Arizona",13,"400915663"
17,1,"17:58",2278,"Foul on Dorian Pickens.",0,5,"Stanford","Arizona",13,"400915663"
18,1,"17:51",2271,"Dusan Ristic missed Jumper.",0,5,"Stanford","Arizona",13,"400915663"
19,1,"17:51",2271,"Reid Travis Defensive Rebound.",0,5,"Stanford","Arizona",13,"400915663"
20,1,"17:26",2246,"Reid Travis missed Jumper.",0,5,"Stanford","Arizona",13,"400915663"
21,1,"17:26",2246,"Lauri Markkanen Defensive Rebound.",0,5,"Stanford","Arizona",13,"400915663"
22,1,"17:06",2226,"Kadeem Allen missed Layup.",0,5,"Stanford","Arizona",13,"400915663"
23,1,"17:06",2226,"Marcus Allen Defensive Rebound.",0,5,"Stanford","Arizona",13,"400915663"
24,1,"16:51",2211,"Reid Travis missed Layup.",0,5,"Stanford","Arizona",13,"400915663"
25,1,"16:51",2211,"Michael Humphrey Offensive Rebound.",0,5,"Stanford","Arizona",13,"400915663"
26,1,"16:51",2211,"Michael Humphrey made Two Point Tip Shot.",0,7,"Stanford","Arizona",13,"400915663"
27,1,"16:36",2196,"Allonzo Trier made Jumper.",2,7,"Stanford","Arizona",13,"400915663"
28,1,"16:14",2174,"Reid Travis made Layup. Assisted by Robert Cartwright.",2,9,"Stanford","Arizona",13,"400915663"
29,1,"15:57",2157,"Allonzo Trier made Three Point Jumper. Assisted by Kadeem Allen.",5,9,"Stanford","Arizona",13,"400915663"
30,1,"15:32",2132,"Dorian Pickens made Layup. Assisted by Robert Cartwright.",5,11,"Stanford","Arizona",13,"400915663"
31,1,"15:32",2132,"Foul on Allonzo Trier.",5,11,"Stanford","Arizona",13,"400915663"
32,1,"15:30",2130,"Official TV Timeout",5,11,"Stanford","Arizona",13,"400915663"
33,1,"15:07",2107,"Kobi Simmons made Three Point Jumper. Assisted by Kadeem Allen.",8,11,"Stanford","Arizona",13,"400915663"
34,1,"14:41",2081,"Reid Travis Turnover.",8,11,"Stanford","Arizona",13,"400915663"
35,1,"14:41",2081,"Chance Comanche Steal.",8,11,"Stanford","Arizona",13,"400915663"
36,1,"14:28",2068,"Lauri Markkanen missed Three Point Jumper.",8,11,"Stanford","Arizona",13,"400915663"
37,1,"14:28",2068,"Robert Cartwright Defensive Rebound.",8,11,"Stanford","Arizona",13,"400915663"
38,1,"14:20",2060,"Reid Travis Turnover.",8,11,"Stanford","Arizona",13,"400915663"
39,1,"14:20",2060,"Parker Jackson-Cartwright Steal.",8,11,"Stanford","Arizona",13,"400915663"
40,1,"14:02",2042,"Lauri Markkanen missed Three Point Jumper.",8,11,"Stanford","Arizona",13,"400915663"
41,1,"14:02",2042,"Reid Travis Defensive Rebound.",8,11,"Stanford","Arizona",13,"400915663"
42,1,"13:50",2030,"Marcus Allen made Layup.",8,13,"Stanford","Arizona",13,"400915663"
43,1,"13:37",2017,"Kobi Simmons missed Three Point Jumper.",8,13,"Stanford","Arizona",13,"400915663"
44,1,"13:37",2017,"Stanford Defensive Rebound.",8,13,"Stanford","Arizona",13,"400915663"
45,1,"13:15",1995,"Dorian Pickens missed Jumper.",8,13,"Stanford","Arizona",13,"400915663"
46,1,"13:15",1995,"Arizona Defensive Rebound.",8,13,"Stanford","Arizona",13,"400915663"
47,1,"12:41",1961,"Allonzo Trier made Three Point Jumper. Assisted by Parker Jackson-Cartwright.",11,13,"Stanford","Arizona",13,"400915663"
48,1,"12:21",1941,"Dorian Pickens Turnover.",11,13,"Stanford","Arizona",13,"400915663"
49,1,"12:21",1941,"Allonzo Trier Steal.",11,13,"Stanford","Arizona",13,"400915663"
50,1,"12:12",1932,"Kobi Simmons made Jumper. Assisted by Chance Comanche.",13,13,"Stanford","Arizona",13,"400915663"
51,1,"11:48",1908,"Grant Verhoeven missed Three Point Jumper.",13,13,"Stanford","Arizona",13,"400915663"
52,1,"11:48",1908,"Michael Humphrey Offensive Rebound.",13,13,"Stanford","Arizona",13,"400915663"
53,1,"11:37",1897,"Marcus Sheffield missed Layup.",13,13,"Stanford","Arizona",13,"400915663"
54,1,"11:37",1897,"Dusan Ristic Defensive Rebound.",13,13,"Stanford","Arizona",13,"400915663"
55,1,"11:28",1888,"Foul on Grant Verhoeven.",13,13,"Stanford","Arizona",13,"400915663"
56,1,"11:28",1888,"Official TV Timeout",13,13,"Stanford","Arizona",13,"400915663"
57,1,"11:28",1888,"Allonzo Trier made Free Throw.",14,13,"Stanford","Arizona",13,"400915663"
58,1,"11:28",1888,"Allonzo Trier made Free Throw.",15,13,"Stanford","Arizona",13,"400915663"
59,1,"11:07",1867,"Michael Humphrey made Jumper. Assisted by Christian Sanders.",15,15,"Stanford","Arizona",13,"400915663"
60,1,"10:37",1837,"Rawle Alkins made Three Point Jumper. Assisted by Kadeem Allen.",18,15,"Stanford","Arizona",13,"400915663"
61,1,"10:13",1813,"Marcus Sheffield missed Three Point Jumper.",18,15,"Stanford","Arizona",13,"400915663"
62,1,"10:13",1813,"Michael Humphrey Offensive Rebound.",18,15,"Stanford","Arizona",13,"400915663"
63,1,"10:13",1813,"Michael Humphrey made Two Point Tip Shot.",18,17,"Stanford","Arizona",13,"400915663"
64,1,"9:55",1795,"Rawle Alkins missed Three Point Jumper.",18,17,"Stanford","Arizona",13,"400915663"
65,1,"9:55",1795,"Michael Humphrey Defensive Rebound.",18,17,"Stanford","Arizona",13,"400915663"
66,1,"9:43",1783,"Foul on Marcus Sheffield.",18,17,"Stanford","Arizona",13,"400915663"
67,1,"9:43",1783,"Marcus Sheffield Turnover.",18,17,"Stanford","Arizona",13,"400915663"
68,1,"9:27",1767,"Foul on Marcus Allen.",18,17,"Stanford","Arizona",13,"400915663"
69,1,"9:26",1766,"Lauri Markkanen made Three Point Jumper. Assisted by Kobi Simmons.",21,17,"Stanford","Arizona",13,"400915663"
70,1,"9:10",1750,"Marcus Allen missed Layup.",21,17,"Stanford","Arizona",13,"400915663"
71,1,"9:10",1750,"Chance Comanche Defensive Rebound.",21,17,"Stanford","Arizona",13,"400915663"
72,1,"8:56",1736,"Lauri Markkanen Turnover.",21,17,"Stanford","Arizona",13,"400915663"
73,1,"8:56",1736,"Marcus Allen Steal.",21,17,"Stanford","Arizona",13,"400915663"
74,1,"8:37",1717,"Dorian Pickens missed Three Point Jumper.",21,17,"Stanford","Arizona",13,"400915663"
75,1,"8:37",1717,"Kobi Simmons Defensive Rebound.",21,17,"Stanford","Arizona",13,"400915663"
76,1,"8:31",1711,"Kobi Simmons Turnover.",21,17,"Stanford","Arizona",13,"400915663"
77,1,"8:31",1711,"Dorian Pickens Steal.",21,17,"Stanford","Arizona",13,"400915663"
78,1,"8:24",1704,"Foul on Lauri Markkanen.",21,17,"Stanford","Arizona",13,"400915663"
79,1,"8:24",1704,"Dorian Pickens missed Free Throw.",21,17,"Stanford","Arizona",13,"400915663"
80,1,"8:24",1704,"Stanford Deadball Team Rebound.",21,17,"Stanford","Arizona",13,"400915663"
81,1,"8:24",1704,"Dorian Pickens made Free Throw.",21,18,"Stanford","Arizona",13,"400915663"
82,1,"8:06",1686,"Chance Comanche made Layup. Assisted by Allonzo Trier.",23,18,"Stanford","Arizona",13,"400915663"
83,1,"7:38",1658,"Robert Cartwright missed Jumper.",23,18,"Stanford","Arizona",13,"400915663"
84,1,"7:38",1658,"Allonzo Trier Defensive Rebound.",23,18,"Stanford","Arizona",13,"400915663"
85,1,"7:21",1641,"Official TV Timeout",23,18,"Stanford","Arizona",13,"400915663"
86,1,"7:08",1628,"Kobi Simmons missed Three Point Jumper.",23,18,"Stanford","Arizona",13,"400915663"
87,1,"7:08",1628,"Keanu Pinder Offensive Rebound.",23,18,"Stanford","Arizona",13,"400915663"
88,1,"7:04",1624,"Foul on Michael Humphrey.",23,18,"Stanford","Arizona",13,"400915663"
89,1,"7:01",1621,"Parker Jackson-Cartwright made Three Point Jumper. Assisted by Allonzo Trier.",26,18,"Stanford","Arizona",13,"400915663"
90,1,"6:28",1588,"Robert Cartwright missed Three Point Jumper.",26,18,"Stanford","Arizona",13,"400915663"
91,1,"6:28",1588,"Allonzo Trier Defensive Rebound.",26,18,"Stanford","Arizona",13,"400915663"
92,1,"6:15",1575,"Keanu Pinder missed Layup.",26,18,"Stanford","Arizona",13,"400915663"
93,1,"6:15",1575,"Parker Jackson-Cartwright Offensive Rebound.",26,18,"Stanford","Arizona",13,"400915663"
94,1,"5:57",1557,"Chance Comanche missed Jumper.",26,18,"Stanford","Arizona",13,"400915663"
95,1,"5:57",1557,"Reid Travis Defensive Rebound.",26,18,"Stanford","Arizona",13,"400915663"
96,1,"5:28",1528,"Dorian Pickens missed Three Point Jumper.",26,18,"Stanford","Arizona",13,"400915663"
97,1,"5:28",1528,"Chance Comanche Defensive Rebound.",26,18,"Stanford","Arizona",13,"400915663"
98,1,"5:20",1520,"Kobi Simmons made Jumper. Assisted by Parker Jackson-Cartwright.",28,18,"Stanford","Arizona",13,"400915663"
99,1,"5:20",1520,"Foul on Marcus Allen.",28,18,"Stanford","Arizona",13,"400915663"
100,1,"5:20",1520,"Kobi Simmons made Free Throw.",29,18,"Stanford","Arizona",13,"400915663"
101,1,"5:00",1500,"Reid Travis made Layup. Assisted by Christian Sanders.",29,20,"Stanford","Arizona",13,"400915663"
102,1,"4:39",1479,"Parker Jackson-Cartwright missed Three Point Jumper.",29,20,"Stanford","Arizona",13,"400915663"
103,1,"4:39",1479,"Marcus Sheffield Defensive Rebound.",29,20,"Stanford","Arizona",13,"400915663"
104,1,"4:25",1465,"Reid Travis made Dunk. Assisted by Michael Humphrey.",29,22,"Stanford","Arizona",13,"400915663"
105,1,"4:25",1465,"Arizona  Timeout",29,22,"Stanford","Arizona",13,"400915663"
106,1,"4:25",1465,"Official TV Timeout",29,22,"Stanford","Arizona",13,"400915663"
107,1,"4:14",1454,"Jump Ball won by Arizona",29,22,"Stanford","Arizona",13,"400915663"
108,1,"4:06",1446,"Rawle Alkins Turnover.",29,22,"Stanford","Arizona",13,"400915663"
109,1,"3:56",1436,"Reid Travis missed Layup.",29,22,"Stanford","Arizona",13,"400915663"
110,1,"3:56",1436,"Rawle Alkins Defensive Rebound.",29,22,"Stanford","Arizona",13,"400915663"
111,1,"3:47",1427,"Rawle Alkins missed Layup.",29,22,"Stanford","Arizona",13,"400915663"
112,1,"3:47",1427,"Reid Travis Block.",29,22,"Stanford","Arizona",13,"400915663"
113,1,"3:47",1427,"Arizona Offensive Rebound.",29,22,"Stanford","Arizona",13,"400915663"
114,1,"3:38",1418,"Rawle Alkins made Layup. Assisted by Kadeem Allen.",31,22,"Stanford","Arizona",13,"400915663"
115,1,"3:29",1409,"Foul on Rawle Alkins.",31,22,"Stanford","Arizona",13,"400915663"
116,1,"3:23",1403,"Christian Sanders made Layup.",31,24,"Stanford","Arizona",13,"400915663"
117,1,"3:11",1391,"Kobi Simmons missed Jumper.",31,24,"Stanford","Arizona",13,"400915663"
118,1,"3:11",1391,"Kobi Simmons Offensive Rebound.",31,24,"Stanford","Arizona",13,"400915663"
119,1,"3:05",1385,"Rawle Alkins made Layup. Assisted by Kobi Simmons.",33,24,"Stanford","Arizona",13,"400915663"
120,1,"2:33",1353,"Dorian Pickens made Three Point Jumper. Assisted by Christian Sanders.",33,27,"Stanford","Arizona",13,"400915663"
121,1,"2:14",1334,"Foul on Michael Humphrey.",33,27,"Stanford","Arizona",13,"400915663"
122,1,"2:14",1334,"Dusan Ristic made Free Throw.",34,27,"Stanford","Arizona",13,"400915663"
123,1,"2:14",1334,"Dusan Ristic made Free Throw.",35,27,"Stanford","Arizona",13,"400915663"
124,1,"2:03",1323,"Marcus Sheffield missed Three Point Jumper.",35,27,"Stanford","Arizona",13,"400915663"
125,1,"2:03",1323,"Reid Travis Offensive Rebound.",35,27,"Stanford","Arizona",13,"400915663"
126,1,"2:03",1323,"Reid Travis made Two Point Tip Shot.",35,29,"Stanford","Arizona",13,"400915663"
127,1,"2:03",1323,"Foul on Dusan Ristic.",35,29,"Stanford","Arizona",13,"400915663"
128,1,"2:03",1323,"Reid Travis missed Free Throw.",35,29,"Stanford","Arizona",13,"400915663"
129,1,"2:03",1323,"Dusan Ristic Defensive Rebound.",35,29,"Stanford","Arizona",13,"400915663"
130,1,"1:27",1287,"Kobi Simmons Turnover.",35,29,"Stanford","Arizona",13,"400915663"
131,1,"1:17",1277,"Marcus Allen missed Three Point Jumper.",35,29,"Stanford","Arizona",13,"400915663"
132,1,"1:17",1277,"Kadeem Allen Block.",35,29,"Stanford","Arizona",13,"400915663"
133,1,"1:17",1277,"Stanford Offensive Rebound.",35,29,"Stanford","Arizona",13,"400915663"
134,1,"1:01",1261,"Reid Travis missed Jumper.",35,29,"Stanford","Arizona",13,"400915663"
135,1,"1:01",1261,"Chance Comanche Defensive Rebound.",35,29,"Stanford","Arizona",13,"400915663"
136,1,"0:45",1245,"Allonzo Trier Turnover.",35,29,"Stanford","Arizona",13,"400915663"
137,1,"0:45",1245,"Stanford  Timeout",35,29,"Stanford","Arizona",13,"400915663"
138,1,"0:26",1226,"Marcus Allen made Three Point Jumper. Assisted by Reid Travis.",35,32,"Stanford","Arizona",13,"400915663"
139,1,"0:02",1202,"Lauri Markkanen missed Three Point Jumper.",35,32,"Stanford","Arizona",13,"400915663"
140,1,"0:02",1202,"Reid Travis Defensive Rebound.",35,32,"Stanford","Arizona",13,"400915663"
141,1,"0:00",1200,"End of 1st half",35,32,"Stanford","Arizona",13,"400915663"
142,2,"20:00",1200,"PLAY",35,32,"Stanford","Arizona",13,"400915663"
143,2,"20:00",1200,"Jump Ball won by Stanford",35,32,"Stanford","Arizona",13,"400915663"
144,2,"19:38",1178,"Foul on Rawle Alkins.",35,32,"Stanford","Arizona",13,"400915663"
145,2,"19:38",1178,"Marcus Allen made Free Throw.",35,33,"Stanford","Arizona",13,"400915663"
146,2,"19:38",1178,"Marcus Allen made Free Throw.",35,34,"Stanford","Arizona",13,"400915663"
147,2,"19:22",1162,"Rawle Alkins made Three Point Jumper. Assisted by Kadeem Allen.",38,34,"Stanford","Arizona",13,"400915663"
148,2,"19:02",1142,"Marcus Allen Turnover.",38,34,"Stanford","Arizona",13,"400915663"
149,2,"18:49",1129,"Dusan Ristic missed Jumper.",38,34,"Stanford","Arizona",13,"400915663"
150,2,"18:49",1129,"Michael Humphrey Defensive Rebound.",38,34,"Stanford","Arizona",13,"400915663"
151,2,"18:36",1116,"Dorian Pickens missed Three Point Jumper.",38,34,"Stanford","Arizona",13,"400915663"
152,2,"18:36",1116,"Stanford Offensive Rebound.",38,34,"Stanford","Arizona",13,"400915663"
153,2,"18:27",1107,"Michael Humphrey missed Three Point Jumper.",38,34,"Stanford","Arizona",13,"400915663"
154,2,"18:27",1107,"Kadeem Allen Defensive Rebound.",38,34,"Stanford","Arizona",13,"400915663"
155,2,"17:55",1075,"Foul on Dorian Pickens.",38,34,"Stanford","Arizona",13,"400915663"
156,2,"17:44",1064,"Rawle Alkins made Layup.",40,34,"Stanford","Arizona",13,"400915663"
157,2,"17:16",1036,"Reid Travis Turnover.",40,34,"Stanford","Arizona",13,"400915663"
158,2,"17:16",1036,"Lauri Markkanen Steal.",40,34,"Stanford","Arizona",13,"400915663"
159,2,"17:11",1031,"Kadeem Allen made Three Point Jumper. Assisted by Rawle Alkins.",43,34,"Stanford","Arizona",13,"400915663"
160,2,"16:41",1001,"Robert Cartwright Turnover.",43,34,"Stanford","Arizona",13,"400915663"
161,2,"16:37",997,"Foul on Robert Cartwright.",43,34,"Stanford","Arizona",13,"400915663"
162,2,"16:37",997,"Stanford  Timeout",43,34,"Stanford","Arizona",13,"400915663"
163,2,"16:20",980,"Kadeem Allen Turnover.",43,34,"Stanford","Arizona",13,"400915663"
164,2,"16:06",966,"Reid Travis made Layup. Assisted by Christian Sanders.",43,36,"Stanford","Arizona",13,"400915663"
165,2,"15:45",945,"Lauri Markkanen missed Layup.",43,36,"Stanford","Arizona",13,"400915663"
166,2,"15:45",945,"Lauri Markkanen Offensive Rebound.",43,36,"Stanford","Arizona",13,"400915663"
167,2,"15:41",941,"Foul on Christian Sanders.",43,36,"Stanford","Arizona",13,"400915663"
168,2,"15:41",941,"Official TV Timeout",43,36,"Stanford","Arizona",13,"400915663"
169,2,"15:41",941,"Lauri Markkanen missed Free Throw.",43,36,"Stanford","Arizona",13,"400915663"
170,2,"15:41",941,"Arizona Deadball Team Rebound.",43,36,"Stanford","Arizona",13,"400915663"
