"play_id","half","time_remaining_half","secs_remaining","description","home_score","away_score","away","home","home_favored_by","game_id"
125,1,"3:15",1395,"Zion Morgan missed Jumper.",26,28,"UNLV","Utah State",7.5,"400919859"
126,1,"3:15",1395,"Ngor Barnaba Defensive Rebound.",26,28,"UNLV","Utah State",7.5,"400919859"
127,1,"2:54",1374,"Koby McEwen made Three Point Jumper. Assisted by Julion Pearre.",29,28,"UNLV","Utah State",7.5,"400919859"
128,1,"2:42",1362,"Zion Morgan Turnover.",29,28,"UNLV","Utah State",7.5,"400919859"
129,1,"2:42",1362,"Sam Merrill Steal.",29,28,"UNLV","Utah State",7.5,"400919859"
130,1,"2:42",1362,"Foul on Zion Morgan.",29,28,"UNLV","Utah State",7.5,"400919859"
131,1,"2:22",1342,"Julion Pearre made Three Point Jumper. Assisted by Sam Merrill.",32,28,"UNLV","Utah State",7.5,"400919859"
132,1,"2:04",1324,"Jovan Mooring made Three Point Jumper. Assisted by Christian Jones.",32,31,"UNLV","Utah State",7.5,"400919859"
133,1,"1:48",1308,"Ngor Barnaba missed Jumper.",32,31,"UNLV","Utah State",7.5,"400919859"
134,1,"1:48",1308,"Christian Jones Defensive Rebound.",32,31,"UNLV","Utah State",7.5,"400919859"
135,1,"1:33",1293,"Kris Clyburn missed Layup.",32,31,"UNLV","Utah State",7.5,"400919859"
136,1,"1:33",1293,"Cheickna Dembele Offensive Rebound.",32,31,"UNLV","Utah State",7.5,"400919859"
137,1,"1:28",1288,"Cheickna Dembele missed Two Point Tip Shot.",32,31,"UNLV","Utah State",7.5,"400919859"
138,1,"1:28",1288,"Koby McEwen Defensive Rebound.",32,31,"UNLV","Utah State",7.5,"400919859"
139,1,"1:23",1283,"Ngor Barnaba made Layup. Assisted by Jalen Moore.",34,31,"UNLV","Utah State",7.5,"400919859"
140,1,"0:52",1252,"Jovan Mooring missed Three Point Jumper.",34,31,"UNLV","Utah State",7.5,"400919859"
141,1,"0:52",1252,"Sam Merrill Defensive Rebound.",34,31,"UNLV","Utah State",7.5,"400919859"
142,1,"0:42",1242,"Jalen Moore made Three Point Jumper. Assisted by Koby McEwen.",37,31,"UNLV","Utah State",7.5,"400919859"
143,1,"0:02",1202,"Christian Jones missed Jumper.",37,31,"UNLV","Utah State",7.5,"400919859"
144,1,"0:02",1202,"Julion Pearre Defensive Rebound.",37,31,"UNLV","Utah State",7.5,"400919859"
145,1,"0:00",1200,"End of 1st half",37,31,"UNLV","Utah State",7.5,"400919859"
146,2,"20:00",1200,"PLAY",37,31,"UNLV","Utah State",7.5,"400919859"
147,2,"19:51",1191,"Koby McEwen Turnover.",37,31,"UNLV","Utah State",7.5,"400919859"
148,2,"19:50",1190,"Tyrell Green Steal.",37,31,"UNLV","Utah State",7.5,"400919859"
149,2,"19:47",1187,"Tyrell Green missed Layup.",37,31,"UNLV","Utah State",7.5,"400919859"
150,2,"19:47",1187,"Koby McEwen Block.",37,31,"UNLV","Utah State",7.5,"400919859"
151,2,"19:46",1186,"Quinn Taylor Defensive Rebound.",37,31,"UNLV","Utah State",7.5,"400919859"
152,2,"19:41",1181,"Koby McEwen made Layup.",39,31,"UNLV","Utah State",7.5,"400919859"
153,2,"19:20",1160,"Jalen Poyser missed Three Point Jumper.",39,31,"UNLV","Utah State",7.5,"400919859"
154,2,"19:20",1160,"Sam Merrill Defensive Rebound.",39,31,"UNLV","Utah State",7.5,"400919859"
155,2,"19:10",1150,"Quinn Taylor missed Layup.",39,31,"UNLV","Utah State",7.5,"400919859"
156,2,"19:10",1150,"Kris Clyburn Defensive Rebound.",39,31,"UNLV","Utah State",7.5,"400919859"
157,2,"18:43",1123,"Uche Ofoegbu made Jumper.",39,33,"UNLV","Utah State",7.5,"400919859"
158,2,"18:24",1104,"Quinn Taylor missed Jumper.",39,33,"UNLV","Utah State",7.5,"400919859"
159,2,"18:24",1104,"Christian Jones Defensive Rebound.",39,33,"UNLV","Utah State",7.5,"400919859"
160,2,"18:14",1094,"Jalen Poyser missed Layup.",39,33,"UNLV","Utah State",7.5,"400919859"
161,2,"18:14",1094,"Alexis Dargenton Block.",39,33,"UNLV","Utah State",7.5,"400919859"
162,2,"18:14",1094,"UNLV Offensive Rebound.",39,33,"UNLV","Utah State",7.5,"400919859"
163,2,"18:02",1082,"Foul on Alexis Dargenton.",39,33,"UNLV","Utah State",7.5,"400919859"
164,2,"17:32",1052,"Christian Jones missed Jumper.",39,33,"UNLV","Utah State",7.5,"400919859"
165,2,"17:32",1052,"Jalen Moore Defensive Rebound.",39,33,"UNLV","Utah State",7.5,"400919859"
166,2,"17:21",1041,"Norbert Janicek missed Jumper.",39,33,"UNLV","Utah State",7.5,"400919859"
167,2,"17:21",1041,"Troy Baxter Jr. Block.",39,33,"UNLV","Utah State",7.5,"400919859"
168,2,"17:21",1041,"Utah State Offensive Rebound.",39,33,"UNLV","Utah State",7.5,"400919859"
169,2,"17:19",1039,"Sam Merrill missed Layup.",39,33,"UNLV","Utah State",7.5,"400919859"
170,2,"17:19",1039,"Sam Merrill Offensive Rebound.",39,33,"UNLV","Utah State",7.5,"400919859"
171,2,"17:18",1038,"Sam Merrill made Two Point Tip Shot.",41,33,"UNLV","Utah State",7.5,"400919859"
172,2,"17:18",1038,"Foul on Jalen Poyser.",41,33,"UNLV","Utah State",7.5,"400919859"
173,2,"17:18",1038,"Sam Merrill missed Free Throw.",41,33,"UNLV","Utah State",7.5,"400919859"
174,2,"17:18",1038,"Christian Jones Defensive Rebound.",41,33,"UNLV","Utah State",7.5,"400919859"
175,2,"17:14",1034,"Foul on Alexis Dargenton.",41,33,"UNLV","Utah State",7.5,"400919859"
176,2,"17:02",1022,"Foul on Norbert Janicek.",41,33,"UNLV","Utah State",7.5,"400919859"
177,2,"17:02",1022,"Christian Jones made Free Throw.",41,34,"UNLV","Utah State",7.5,"400919859"
178,2,"17:02",1022,"Christian Jones made Free Throw.",41,35,"UNLV","Utah State",7.5,"400919859"
179,2,"16:41",1001,"Quinn Taylor Turnover.",41,35,"UNLV","Utah State",7.5,"400919859"
180,2,"16:40",1000,"Uche Ofoegbu Steal.",41,35,"UNLV","Utah State",7.5,"400919859"
181,2,"16:35",995,"Foul on Koby McEwen.",41,35,"UNLV","Utah State",7.5,"400919859"
182,2,"16:31",991,"Troy Baxter Jr. made Dunk. Assisted by Christian Jones.",41,37,"UNLV","Utah State",7.5,"400919859"
183,2,"16:09",969,"Foul on Uche Ofoegbu.",41,37,"UNLV","Utah State",7.5,"400919859"
184,2,"15:55",955,"Koby McEwen Turnover.",41,37,"UNLV","Utah State",7.5,"400919859"
185,2,"15:54",954,"Troy Baxter Jr. Steal.",41,37,"UNLV","Utah State",7.5,"400919859"
186,2,"15:34",934,"Jovan Mooring missed Jumper.",41,37,"UNLV","Utah State",7.5,"400919859"
187,2,"15:34",934,"Julion Pearre Defensive Rebound.",41,37,"UNLV","Utah State",7.5,"400919859"
188,2,"15:20",920,"Official TV Timeout",41,37,"UNLV","Utah State",7.5,"400919859"
189,2,"15:07",907,"Julion Pearre missed Layup.",41,37,"UNLV","Utah State",7.5,"400919859"
190,2,"15:07",907,"Jovan Mooring Defensive Rebound.",41,37,"UNLV","Utah State",7.5,"400919859"
191,2,"15:01",901,"Troy Baxter Jr. made Dunk. Assisted by Zion Morgan.",41,39,"UNLV","Utah State",7.5,"400919859"
192,2,"14:44",884,"Sam Merrill missed Jumper.",41,39,"UNLV","Utah State",7.5,"400919859"
193,2,"14:44",884,"Troy Baxter Jr. Defensive Rebound.",41,39,"UNLV","Utah State",7.5,"400919859"
194,2,"14:38",878,"Uche Ofoegbu made Layup.",41,41,"UNLV","Utah State",7.5,"400919859"
195,2,"14:19",859,"Koby McEwen made Layup.",43,41,"UNLV","Utah State",7.5,"400919859"
196,2,"14:02",842,"Troy Baxter Jr. missed Jumper.",43,41,"UNLV","Utah State",7.5,"400919859"
197,2,"14:02",842,"Koby McEwen Defensive Rebound.",43,41,"UNLV","Utah State",7.5,"400919859"
198,2,"13:53",833,"Koby McEwen made Layup.",45,41,"UNLV","Utah State",7.5,"400919859"
199,2,"13:44",824,"Foul on Sam Merrill.",45,41,"UNLV","Utah State",7.5,"400919859"
200,2,"13:42",822,"Jalen Poyser made Layup. Assisted by Jovan Mooring.",45,43,"UNLV","Utah State",7.5,"400919859"
201,2,"13:24",804,"Sam Merrill missed Layup.",45,43,"UNLV","Utah State",7.5,"400919859"
202,2,"13:24",804,"Tyrell Green Defensive Rebound.",45,43,"UNLV","Utah State",7.5,"400919859"
203,2,"13:14",794,"Cheickna Dembele made Layup. Assisted by Jovan Mooring.",45,45,"UNLV","Utah State",7.5,"400919859"
204,2,"13:14",794,"Foul on Sam Merrill.",45,45,"UNLV","Utah State",7.5,"400919859"
205,2,"13:14",794,"Utah State  Timeout",45,45,"UNLV","Utah State",7.5,"400919859"
206,2,"13:14",794,"Cheickna Dembele made Free Throw.",45,46,"UNLV","Utah State",7.5,"400919859"
207,2,"12:52",772,"Julion Pearre made Layup. Assisted by Ngor Barnaba.",47,46,"UNLV","Utah State",7.5,"400919859"
208,2,"12:37",757,"Tyrell Green missed Three Point Jumper.",47,46,"UNLV","Utah State",7.5,"400919859"
209,2,"12:37",757,"Cheickna Dembele Offensive Rebound.",47,46,"UNLV","Utah State",7.5,"400919859"
210,2,"12:15",735,"Foul on Julion Pearre.",47,46,"UNLV","Utah State",7.5,"400919859"
211,2,"12:15",735,"Cheickna Dembele missed Free Throw.",47,46,"UNLV","Utah State",7.5,"400919859"
212,2,"12:15",735,"Jalen Moore Defensive Rebound.",47,46,"UNLV","Utah State",7.5,"400919859"
213,2,"12:14",734,"Foul on Jalen Poyser.",47,46,"UNLV","Utah State",7.5,"400919859"
214,2,"11:57",717,"Jalen Moore Turnover.",47,46,"UNLV","Utah State",7.5,"400919859"
215,2,"11:57",717,"Official TV Timeout",47,46,"UNLV","Utah State",7.5,"400919859"
216,2,"11:41",701,"Troy Baxter Jr. missed Layup.",47,46,"UNLV","Utah State",7.5,"400919859"
217,2,"11:41",701,"Troy Baxter Jr. Offensive Rebound.",47,46,"UNLV","Utah State",7.5,"400919859"
218,2,"11:38",698,"Troy Baxter Jr. made Two Point Tip Shot.",47,48,"UNLV","Utah State",7.5,"400919859"
219,2,"11:15",675,"Shane Rector missed Three Point Jumper.",47,48,"UNLV","Utah State",7.5,"400919859"
220,2,"11:15",675,"Jalen Moore Offensive Rebound.",47,48,"UNLV","Utah State",7.5,"400919859"
221,2,"11:08",668,"Foul on Uche Ofoegbu.",47,48,"UNLV","Utah State",7.5,"400919859"
222,2,"11:08",668,"Alexis Dargenton made Free Throw.",48,48,"UNLV","Utah State",7.5,"400919859"
223,2,"11:08",668,"Alexis Dargenton missed Free Throw.",48,48,"UNLV","Utah State",7.5,"400919859"
224,2,"11:08",668,"Cheickna Dembele Defensive Rebound.",48,48,"UNLV","Utah State",7.5,"400919859"
225,2,"10:52",652,"Jovan Mooring missed Layup.",48,48,"UNLV","Utah State",7.5,"400919859"
226,2,"10:52",652,"Koby McEwen Defensive Rebound.",48,48,"UNLV","Utah State",7.5,"400919859"
227,2,"10:43",643,"Koby McEwen made Layup.",50,48,"UNLV","Utah State",7.5,"400919859"
228,2,"10:22",622,"Cheickna Dembele missed Jumper.",50,48,"UNLV","Utah State",7.5,"400919859"
229,2,"10:22",622,"Jalen Moore Defensive Rebound.",50,48,"UNLV","Utah State",7.5,"400919859"
230,2,"10:14",614,"Koby McEwen made Three Point Jumper. Assisted by Sam Merrill.",53,48,"UNLV","Utah State",7.5,"400919859"
231,2,"10:03",603,"UNLV  Timeout",53,48,"UNLV","Utah State",7.5,"400919859"
232,2,"9:46",586,"Christian Jones Turnover.",53,48,"UNLV","Utah State",7.5,"400919859"
233,2,"9:45",585,"Sam Merrill Steal.",53,48,"UNLV","Utah State",7.5,"400919859"
234,2,"9:32",572,"Jalen Moore made Jumper. Assisted by Koby McEwen.",55,48,"UNLV","Utah State",7.5,"400919859"
235,2,"9:10",550,"Tyrell Green missed Three Point Jumper.",55,48,"UNLV","Utah State",7.5,"400919859"
236,2,"9:10",550,"Shane Rector Defensive Rebound.",55,48,"UNLV","Utah State",7.5,"400919859"
237,2,"8:56",536,"Jalen Moore missed Layup.",55,48,"UNLV","Utah State",7.5,"400919859"
238,2,"8:56",536,"UNLV Defensive Rebound.",55,48,"UNLV","Utah State",7.5,"400919859"
239,2,"8:29",509,"Foul on Quinn Taylor.",55,48,"UNLV","Utah State",7.5,"400919859"
240,2,"8:29",509,"Christian Jones made Free Throw.",55,49,"UNLV","Utah State",7.5,"400919859"
241,2,"8:29",509,"Christian Jones made Free Throw.",55,50,"UNLV","Utah State",7.5,"400919859"
242,2,"8:11",491,"Quinn Taylor missed Layup.",55,50,"UNLV","Utah State",7.5,"400919859"
243,2,"8:11",491,"Koby McEwen Offensive Rebound.",55,50,"UNLV","Utah State",7.5,"400919859"
244,2,"8:08",488,"Foul on Troy Baxter Jr..",55,50,"UNLV","Utah State",7.5,"400919859"
245,2,"8:08",488,"Koby McEwen made Free Throw.",56,50,"UNLV","Utah State",7.5,"400919859"
246,2,"8:08",488,"Koby McEwen made Free Throw.",57,50,"UNLV","Utah State",7.5,"400919859"
247,2,"7:49",469,"Foul on Sam Merrill.",57,50,"UNLV","Utah State",7.5,"400919859"
248,2,"7:49",469,"Official TV Timeout",57,50,"UNLV","Utah State",7.5,"400919859"
249,2,"7:49",469,"Christian Jones made Free Throw.",57,51,"UNLV","Utah State",7.5,"400919859"
250,2,"7:49",469,"Christian Jones made Free Throw.",57,52,"UNLV","Utah State",7.5,"400919859"
251,2,"7:26",446,"Koby McEwen made Three Point Jumper. Assisted by Alexis Dargenton.",60,52,"UNLV","Utah State",7.5,"400919859"
252,2,"7:05",425,"Jalen Poyser missed Three Point Jumper.",60,52,"UNLV","Utah State",7.5,"400919859"
253,2,"7:05",425,"Alexis Dargenton Defensive Rebound.",60,52,"UNLV","Utah State",7.5,"400919859"
254,2,"6:57",417,"Koby McEwen Turnover.",60,52,"UNLV","Utah State",7.5,"400919859"
255,2,"6:57",417,"Foul on Koby McEwen.",60,52,"UNLV","Utah State",7.5,"400919859"
256,2,"6:47",407,"Troy Baxter Jr. missed Three Point Jumper.",60,52,"UNLV","Utah State",7.5,"400919859"
257,2,"6:47",407,"Shane Rector Defensive Rebound.",60,52,"UNLV","Utah State",7.5,"400919859"
258,2,"6:35",395,"Koby McEwen made Three Point Jumper. Assisted by Jalen Moore.",63,52,"UNLV","Utah State",7.5,"400919859"
259,2,"6:19",379,"Zion Morgan missed Three Point Jumper.",63,52,"UNLV","Utah State",7.5,"400919859"
260,2,"6:19",379,"Christian Jones Offensive Rebound.",63,52,"UNLV","Utah State",7.5,"400919859"
261,2,"6:13",373,"Christian Jones made Layup.",63,54,"UNLV","Utah State",7.5,"400919859"
262,2,"6:13",373,"Foul on Alexis Dargenton.",63,54,"UNLV","Utah State",7.5,"400919859"
263,2,"6:13",373,"Christian Jones made Free Throw.",63,55,"UNLV","Utah State",7.5,"400919859"
264,2,"5:51",351,"Koby McEwen made Three Point Jumper. Assisted by Jalen Moore.",66,55,"UNLV","Utah State",7.5,"400919859"
265,2,"5:33",333,"Christian Jones missed Jumper.",66,55,"UNLV","Utah State",7.5,"400919859"
266,2,"5:33",333,"Alexis Dargenton Defensive Rebound.",66,55,"UNLV","Utah State",7.5,"400919859"
267,2,"5:04",304,"Shane Rector made Three Point Jumper. Assisted by Alexis Dargenton.",69,55,"UNLV","Utah State",7.5,"400919859"
268,2,"4:52",292,"Jovan Mooring made Layup.",69,57,"UNLV","Utah State",7.5,"400919859"
269,2,"4:48",288,"UNLV  Timeout",69,57,"UNLV","Utah State",7.5,"400919859"
270,2,"4:47",287,"Foul on Jovan Mooring.",69,57,"UNLV","Utah State",7.5,"400919859"
271,2,"4:37",277,"Julion Pearre made Three Point Jumper. Assisted by Koby McEwen.",72,57,"UNLV","Utah State",7.5,"400919859"
272,2,"4:29",269,"Uche Ofoegbu made Layup.",72,59,"UNLV","Utah State",7.5,"400919859"
273,2,"4:05",245,"Koby McEwen missed Jumper.",72,59,"UNLV","Utah State",7.5,"400919859"
274,2,"4:05",245,"Tyrell Green Defensive Rebound.",72,59,"UNLV","Utah State",7.5,"400919859"
275,2,"3:45",225,"Christian Jones Turnover.",72,59,"UNLV","Utah State",7.5,"400919859"
276,2,"3:43",223,"Julion Pearre Steal.",72,59,"UNLV","Utah State",7.5,"400919859"
277,2,"3:42",222,"Julion Pearre Turnover.",72,59,"UNLV","Utah State",7.5,"400919859"
278,2,"3:42",222,"Official TV Timeout",72,59,"UNLV","Utah State",7.5,"400919859"
279,2,"3:34",214,"Kris Clyburn missed Three Point Jumper.",72,59,"UNLV","Utah State",7.5,"400919859"
280,2,"3:34",214,"Tyrell Green Offensive Rebound.",72,59,"UNLV","Utah State",7.5,"400919859"
281,2,"3:29",209,"Tyrell Green missed Layup.",72,59,"UNLV","Utah State",7.5,"400919859"
282,2,"3:29",209,"Alexis Dargenton Defensive Rebound.",72,59,"UNLV","Utah State",7.5,"400919859"
283,2,"3:11",191,"Alexis Dargenton missed Layup.",72,59,"UNLV","Utah State",7.5,"400919859"
284,2,"3:11",191,"Cheickna Dembele Block.",72,59,"UNLV","Utah State",7.5,"400919859"
285,2,"3:11",191,"Utah State Offensive Rebound.",72,59,"UNLV","Utah State",7.5,"400919859"
286,2,"3:05",185,"Quinn Taylor made Three Point Jumper. Assisted by Sam Merrill.",75,59,"UNLV","Utah State",7.5,"400919859"
287,2,"2:50",170,"Jovan Mooring Turnover.",75,59,"UNLV","Utah State",7.5,"400919859"
288,2,"2:33",153,"Quinn Taylor missed Layup.",75,59,"UNLV","Utah State",7.5,"400919859"
289,2,"2:33",153,"Cheickna Dembele Block.",75,59,"UNLV","Utah State",7.5,"400919859"
290,2,"2:32",152,"Jalen Poyser Defensive Rebound.",75,59,"UNLV","Utah State",7.5,"400919859"
291,2,"2:25",145,"Jalen Poyser missed Layup.",75,59,"UNLV","Utah State",7.5,"400919859"
292,2,"2:25",145,"Alexis Dargenton Block.",75,59,"UNLV","Utah State",7.5,"400919859"
293,2,"2:25",145,"UNLV Offensive Rebound.",75,59,"UNLV","Utah State",7.5,"400919859"
294,2,"2:10",130,"Uche Ofoegbu Turnover.",75,59,"UNLV","Utah State",7.5,"400919859"
295,2,"2:01",121,"Foul on Kris Clyburn.",75,59,"UNLV","Utah State",7.5,"400919859"
296,2,"2:01",121,"Jalen Moore made Free Throw.",76,59,"UNLV","Utah State",7.5,"400919859"
297,2,"2:01",121,"Jalen Moore made Free Throw.",77,59,"UNLV","Utah State",7.5,"400919859"
298,2,"1:47",107,"Foul on Quinn Taylor.",77,59,"UNLV","Utah State",7.5,"400919859"
299,2,"1:47",107,"Jalen Poyser made Free Throw.",77,60,"UNLV","Utah State",7.5,"400919859"
300,2,"1:47",107,"Jalen Poyser missed Free Throw.",77,60,"UNLV","Utah State",7.5,"400919859"
301,2,"1:47",107,"Koby McEwen Defensive Rebound.",77,60,"UNLV","Utah State",7.5,"400919859"
302,2,"1:27",87,"Koby McEwen made Layup. Assisted by Jalen Moore.",79,60,"UNLV","Utah State",7.5,"400919859"
303,2,"1:15",75,"Uche Ofoegbu missed Layup.",79,60,"UNLV","Utah State",7.5,"400919859"
304,2,"1:15",75,"Utah State Defensive Rebound.",79,60,"UNLV","Utah State",7.5,"400919859"
305,2,"1:02",62,"Shane Rector Turnover.",79,60,"UNLV","Utah State",7.5,"400919859"
306,2,"1:01",61,"Tyrell Green Steal.",79,60,"UNLV","Utah State",7.5,"400919859"
307,2,"0:58",58,"Zion Morgan made Layup. Assisted by Ben Coupet Jr..",79,62,"UNLV","Utah State",7.5,"400919859"
308,2,"0:57",57,"Foul on Sam Merrill.",79,62,"UNLV","Utah State",7.5,"400919859"
309,2,"0:57",57,"Zion Morgan missed Free Throw.",79,62,"UNLV","Utah State",7.5,"400919859"
310,2,"0:57",57,"Julion Pearre Defensive Rebound.",79,62,"UNLV","Utah State",7.5,"400919859"
311,2,"0:36",36,"Diogo Brito missed Jumper.",79,62,"UNLV","Utah State",7.5,"400919859"
312,2,"0:36",36,"Ben Coupet Jr. Defensive Rebound.",79,62,"UNLV","Utah State",7.5,"400919859"
313,2,"0:25",25,"Foul on Julion Pearre.",79,62,"UNLV","Utah State",7.5,"400919859"
314,2,"0:25",25,"Larry Bush missed Free Throw.",79,62,"UNLV","Utah State",7.5,"400919859"
315,2,"0:25",25,"UNLV Deadball Team Rebound.",79,62,"UNLV","Utah State",7.5,"400919859"
316,2,"0:25",25,"Larry Bush made Free Throw.",79,63,"UNLV","Utah State",7.5,"400919859"
317,2,"0:00",0,"End of Game",79,63,"UNLV","Utah State",7.5,"400919859"
1,1,"20:00",2400,"PLAY",0,0,"Utah State","Wyoming",4.5,"400919940"
2,1,"19:44",2384,"Alexis Dargenton missed Jumper.",0,0,"Utah State","Wyoming",4.5,"400919940"
3,1,"19:44",2384,"Cody Kelley Defensive Rebound.",0,0,"Utah State","Wyoming",4.5,"400919940"
4,1,"19:16",2356,"Alan Herndon made Three Point Jumper. Assisted by Jason McManamen.",3,0,"Utah State","Wyoming",4.5,"400919940"
5,1,"19:01",2341,"Foul on Jordan Naughton.",3,0,"Utah State","Wyoming",4.5,"400919940"
6,1,"18:52",2332,"Norbert Janicek made Jumper.",3,2,"Utah State","Wyoming",4.5,"400919940"
7,1,"18:34",2314,"Jordan Naughton made Layup. Assisted by Cody Kelley.",5,2,"Utah State","Wyoming",4.5,"400919940"
8,1,"18:21",2301,"Jalen Moore made Jumper. Assisted by Koby McEwen.",5,4,"Utah State","Wyoming",4.5,"400919940"
9,1,"18:04",2284,"Alexander Aka Gorski made Three Point Jumper. Assisted by Cody Kelley.",8,4,"Utah State","Wyoming",4.5,"400919940"
10,1,"17:47",2267,"Koby McEwen Turnover.",8,4,"Utah State","Wyoming",4.5,"400919940"
11,1,"17:30",2250,"Cody Kelley made Jumper.",10,4,"Utah State","Wyoming",4.5,"400919940"
12,1,"17:09",2229,"Norbert Janicek made Jumper.",10,6,"Utah State","Wyoming",4.5,"400919940"
13,1,"16:57",2217,"Alexander Aka Gorski missed Jumper.",10,6,"Utah State","Wyoming",4.5,"400919940"
14,1,"16:57",2217,"Sam Merrill Defensive Rebound.",10,6,"Utah State","Wyoming",4.5,"400919940"
15,1,"16:48",2208,"Sam Merrill missed Jumper.",10,6,"Utah State","Wyoming",4.5,"400919940"
16,1,"16:48",2208,"Alexander Aka Gorski Defensive Rebound.",10,6,"Utah State","Wyoming",4.5,"400919940"
17,1,"16:32",2192,"Jordan Naughton made Jumper. Assisted by Jason McManamen.",12,6,"Utah State","Wyoming",4.5,"400919940"
18,1,"16:12",2172,"Sam Merrill made Jumper.",12,8,"Utah State","Wyoming",4.5,"400919940"
19,1,"15:51",2151,"Alexander Aka Gorski made Three Point Jumper. Assisted by Cody Kelley.",15,8,"Utah State","Wyoming",4.5,"400919940"
20,1,"15:25",2125,"Koby McEwen made Three Point Jumper.",15,11,"Utah State","Wyoming",4.5,"400919940"
21,1,"14:59",2099,"Cody Kelley missed Three Point Jumper.",15,11,"Utah State","Wyoming",4.5,"400919940"
22,1,"14:59",2099,"Jalen Moore Defensive Rebound.",15,11,"Utah State","Wyoming",4.5,"400919940"
23,1,"14:46",2086,"Koby McEwen made Layup.",15,13,"Utah State","Wyoming",4.5,"400919940"
24,1,"14:41",2081,"Wyoming  Timeout",15,13,"Utah State","Wyoming",4.5,"400919940"
25,1,"14:30",2070,"Jason McManamen made Three Point Jumper. Assisted by Hayden Dalton.",18,13,"Utah State","Wyoming",4.5,"400919940"
26,1,"14:03",2043,"Jalen Moore missed Three Point Jumper.",18,13,"Utah State","Wyoming",4.5,"400919940"
27,1,"14:03",2043,"Jalen Moore Offensive Rebound.",18,13,"Utah State","Wyoming",4.5,"400919940"
28,1,"13:59",2039,"Jalen Moore made Three Point Jumper.",18,16,"Utah State","Wyoming",4.5,"400919940"
29,1,"13:51",2031,"Justin James missed Layup.",18,16,"Utah State","Wyoming",4.5,"400919940"
30,1,"13:51",2031,"Shane Rector Defensive Rebound.",18,16,"Utah State","Wyoming",4.5,"400919940"
31,1,"13:41",2021,"Quinn Taylor missed Layup.",18,16,"Utah State","Wyoming",4.5,"400919940"
32,1,"13:41",2021,"Alan Herndon Defensive Rebound.",18,16,"Utah State","Wyoming",4.5,"400919940"
33,1,"13:36",2016,"Foul on Julion Pearre.",18,16,"Utah State","Wyoming",4.5,"400919940"
34,1,"13:36",2016,"Jason McManamen missed Free Throw.",18,16,"Utah State","Wyoming",4.5,"400919940"
35,1,"13:36",2016,"Wyoming Deadball Team Rebound.",18,16,"Utah State","Wyoming",4.5,"400919940"
36,1,"13:36",2016,"Jason McManamen made Free Throw.",19,16,"Utah State","Wyoming",4.5,"400919940"
37,1,"13:21",2001,"Jalen Moore Turnover.",19,16,"Utah State","Wyoming",4.5,"400919940"
38,1,"13:20",2000,"Justin James Steal.",19,16,"Utah State","Wyoming",4.5,"400919940"
39,1,"13:17",1997,"Justin James missed Layup.",19,16,"Utah State","Wyoming",4.5,"400919940"
40,1,"13:17",1997,"Justin James Offensive Rebound.",19,16,"Utah State","Wyoming",4.5,"400919940"
41,1,"13:10",1990,"Hayden Dalton made Dunk. Assisted by Jason McManamen.",21,16,"Utah State","Wyoming",4.5,"400919940"
42,1,"12:54",1974,"Ngor Barnaba missed Layup.",21,16,"Utah State","Wyoming",4.5,"400919940"
43,1,"12:54",1974,"Alan Herndon Block.",21,16,"Utah State","Wyoming",4.5,"400919940"
44,1,"12:52",1972,"Quinn Taylor Offensive Rebound.",21,16,"Utah State","Wyoming",4.5,"400919940"
45,1,"12:49",1969,"Shane Rector made Three Point Jumper. Assisted by Quinn Taylor.",21,19,"Utah State","Wyoming",4.5,"400919940"
46,1,"12:27",1947,"Justin James missed Jumper.",21,19,"Utah State","Wyoming",4.5,"400919940"
47,1,"12:27",1947,"Ngor Barnaba Defensive Rebound.",21,19,"Utah State","Wyoming",4.5,"400919940"
48,1,"12:17",1937,"Ngor Barnaba made Three Point Jumper. Assisted by Quinn Taylor.",21,22,"Utah State","Wyoming",4.5,"400919940"
49,1,"11:59",1919,"Alan Herndon missed Jumper.",21,22,"Utah State","Wyoming",4.5,"400919940"
50,1,"11:59",1919,"Ngor Barnaba Defensive Rebound.",21,22,"Utah State","Wyoming",4.5,"400919940"
51,1,"11:50",1910,"Jalen Moore missed Three Point Jumper.",21,22,"Utah State","Wyoming",4.5,"400919940"
52,1,"11:50",1910,"Alexander Aka Gorski Defensive Rebound.",21,22,"Utah State","Wyoming",4.5,"400919940"
53,1,"11:38",1898,"Alexander Aka Gorski missed Three Point Jumper.",21,22,"Utah State","Wyoming",4.5,"400919940"
54,1,"11:38",1898,"Hayden Dalton Offensive Rebound.",21,22,"Utah State","Wyoming",4.5,"400919940"
55,1,"11:27",1887,"Wyoming  Timeout",21,22,"Utah State","Wyoming",4.5,"400919940"
56,1,"11:19",1879,"Alexander Aka Gorski missed Three Point Jumper.",21,22,"Utah State","Wyoming",4.5,"400919940"
57,1,"11:19",1879,"Justin James Offensive Rebound.",21,22,"Utah State","Wyoming",4.5,"400919940"
58,1,"11:15",1875,"Foul on Sam Merrill.",21,22,"Utah State","Wyoming",4.5,"400919940"
59,1,"11:10",1870,"Foul on Alexis Dargenton.",21,22,"Utah State","Wyoming",4.5,"400919940"
60,1,"11:05",1865,"Hayden Dalton made Three Point Jumper. Assisted by Jordan Naughton.",24,22,"Utah State","Wyoming",4.5,"400919940"
61,1,"10:41",1841,"Koby McEwen missed Jumper.",24,22,"Utah State","Wyoming",4.5,"400919940"
62,1,"10:41",1841,"Jordan Naughton Block.",24,22,"Utah State","Wyoming",4.5,"400919940"
63,1,"10:40",1840,"Utah State Offensive Rebound.",24,22,"Utah State","Wyoming",4.5,"400919940"
64,1,"10:35",1835,"Sam Merrill missed Three Point Jumper.",24,22,"Utah State","Wyoming",4.5,"400919940"
65,1,"10:35",1835,"Jordan Naughton Defensive Rebound.",24,22,"Utah State","Wyoming",4.5,"400919940"
66,1,"10:25",1825,"Louis Adams made Layup.",26,22,"Utah State","Wyoming",4.5,"400919940"
67,1,"10:03",1803,"Foul on Jordan Naughton.",26,22,"Utah State","Wyoming",4.5,"400919940"
68,1,"10:03",1803,"Norbert Janicek made Free Throw.",26,23,"Utah State","Wyoming",4.5,"400919940"
69,1,"10:03",1803,"Norbert Janicek made Free Throw.",26,24,"Utah State","Wyoming",4.5,"400919940"
70,1,"9:53",1793,"Alexander Aka Gorski made Three Point Jumper. Assisted by Hayden Dalton.",29,24,"Utah State","Wyoming",4.5,"400919940"
71,1,"9:31",1771,"Alexis Dargenton Turnover.",29,24,"Utah State","Wyoming",4.5,"400919940"
72,1,"9:30",1770,"Hayden Dalton Steal.",29,24,"Utah State","Wyoming",4.5,"400919940"
73,1,"9:25",1765,"Justin James made Three Point Jumper. Assisted by Hayden Dalton.",32,24,"Utah State","Wyoming",4.5,"400919940"
74,1,"9:07",1747,"Sam Merrill made Three Point Jumper. Assisted by Koby McEwen.",32,27,"Utah State","Wyoming",4.5,"400919940"
75,1,"8:53",1733,"Alexander Aka Gorski made Three Point Jumper. Assisted by Hayden Dalton.",35,27,"Utah State","Wyoming",4.5,"400919940"
76,1,"8:34",1714,"Sam Merrill missed Three Point Jumper.",35,27,"Utah State","Wyoming",4.5,"400919940"
77,1,"8:34",1714,"Alan Herndon Defensive Rebound.",35,27,"Utah State","Wyoming",4.5,"400919940"
78,1,"8:30",1710,"Foul on Alexis Dargenton.",35,27,"Utah State","Wyoming",4.5,"400919940"
