"play_id","half","time_remaining_half","secs_remaining","description","home_score","away_score","away","home","home_favored_by","game_id"
210,2,"12:12",732,"Nico Carvacho missed Layup.",43,34,"Utah State","Colorado State",5.5,"400919849"
211,2,"12:12",732,"Sam Merrill Defensive Rebound.",43,34,"Utah State","Colorado State",5.5,"400919849"
212,2,"12:04",724,"Jalen Moore missed Three Point Jumper.",43,34,"Utah State","Colorado State",5.5,"400919849"
213,2,"12:04",724,"Prentiss Nixon Defensive Rebound.",43,34,"Utah State","Colorado State",5.5,"400919849"
214,2,"11:42",702,"Braden Koelliker made Three Point Jumper. Assisted by Prentiss Nixon.",46,34,"Utah State","Colorado State",5.5,"400919849"
215,2,"11:27",687,"Koby McEwen missed Three Point Jumper.",46,34,"Utah State","Colorado State",5.5,"400919849"
216,2,"11:27",687,"Nico Carvacho Defensive Rebound.",46,34,"Utah State","Colorado State",5.5,"400919849"
217,2,"10:58",658,"Nico Carvacho made Dunk. Assisted by Prentiss Nixon.",48,34,"Utah State","Colorado State",5.5,"400919849"
218,2,"10:37",637,"Foul on Nico Carvacho.",48,34,"Utah State","Colorado State",5.5,"400919849"
219,2,"10:37",637,"Official TV Timeout",48,34,"Utah State","Colorado State",5.5,"400919849"
220,2,"10:37",637,"Sam Merrill made Free Throw.",48,35,"Utah State","Colorado State",5.5,"400919849"
221,2,"10:37",637,"Sam Merrill made Free Throw.",48,36,"Utah State","Colorado State",5.5,"400919849"
222,2,"10:17",617,"J.D. Paige missed Jumper.",48,36,"Utah State","Colorado State",5.5,"400919849"
223,2,"10:17",617,"Emmanuel Omogbo Offensive Rebound.",48,36,"Utah State","Colorado State",5.5,"400919849"
224,2,"10:02",602,"Emmanuel Omogbo Turnover.",48,36,"Utah State","Colorado State",5.5,"400919849"
225,2,"10:00",600,"Sam Merrill Steal.",48,36,"Utah State","Colorado State",5.5,"400919849"
226,2,"9:54",594,"Jalen Moore missed Layup.",48,36,"Utah State","Colorado State",5.5,"400919849"
227,2,"9:54",594,"Emmanuel Omogbo Block.",48,36,"Utah State","Colorado State",5.5,"400919849"
228,2,"9:52",592,"Emmanuel Omogbo Defensive Rebound.",48,36,"Utah State","Colorado State",5.5,"400919849"
229,2,"9:34",574,"J.D. Paige missed Jumper.",48,36,"Utah State","Colorado State",5.5,"400919849"
230,2,"9:34",574,"Quinn Taylor Defensive Rebound.",48,36,"Utah State","Colorado State",5.5,"400919849"
231,2,"9:18",558,"Quinn Taylor made Layup. Assisted by Julion Pearre.",48,38,"Utah State","Colorado State",5.5,"400919849"
232,2,"8:56",536,"Gian Clavell missed Three Point Jumper.",48,38,"Utah State","Colorado State",5.5,"400919849"
233,2,"8:56",536,"Braden Koelliker Offensive Rebound.",48,38,"Utah State","Colorado State",5.5,"400919849"
234,2,"8:51",531,"Foul on Sam Merrill.",48,38,"Utah State","Colorado State",5.5,"400919849"
235,2,"8:51",531,"Braden Koelliker made Free Throw.",49,38,"Utah State","Colorado State",5.5,"400919849"
236,2,"8:51",531,"Braden Koelliker made Free Throw.",50,38,"Utah State","Colorado State",5.5,"400919849"
237,2,"8:39",519,"Foul on Jalen Moore.",50,38,"Utah State","Colorado State",5.5,"400919849"
238,2,"8:39",519,"Jalen Moore Turnover.",50,38,"Utah State","Colorado State",5.5,"400919849"
239,2,"8:22",502,"Emmanuel Omogbo Turnover.",50,38,"Utah State","Colorado State",5.5,"400919849"
240,2,"8:04",484,"Diogo Brito missed Three Point Jumper.",50,38,"Utah State","Colorado State",5.5,"400919849"
241,2,"8:04",484,"Julion Pearre Offensive Rebound.",50,38,"Utah State","Colorado State",5.5,"400919849"
242,2,"7:56",476,"Diogo Brito missed Three Point Jumper.",50,38,"Utah State","Colorado State",5.5,"400919849"
243,2,"7:56",476,"Prentiss Nixon Defensive Rebound.",50,38,"Utah State","Colorado State",5.5,"400919849"
244,2,"7:34",454,"Nico Carvacho made Layup. Assisted by Prentiss Nixon.",52,38,"Utah State","Colorado State",5.5,"400919849"
245,2,"7:20",440,"Julion Pearre made Jumper.",52,40,"Utah State","Colorado State",5.5,"400919849"
246,2,"6:54",414,"Gian Clavell made Jumper.",54,40,"Utah State","Colorado State",5.5,"400919849"
247,2,"6:37",397,"Quinn Taylor missed Layup.",54,40,"Utah State","Colorado State",5.5,"400919849"
248,2,"6:37",397,"Quinn Taylor Offensive Rebound.",54,40,"Utah State","Colorado State",5.5,"400919849"
249,2,"6:34",394,"Julion Pearre made Three Point Jumper. Assisted by Quinn Taylor.",54,43,"Utah State","Colorado State",5.5,"400919849"
250,2,"6:16",376,"Gian Clavell made Three Point Jumper.",57,43,"Utah State","Colorado State",5.5,"400919849"
251,2,"5:56",356,"Quinn Taylor made Layup. Assisted by Koby McEwen.",57,45,"Utah State","Colorado State",5.5,"400919849"
252,2,"5:35",335,"Nico Carvacho missed Layup.",57,45,"Utah State","Colorado State",5.5,"400919849"
253,2,"5:35",335,"Koby McEwen Defensive Rebound.",57,45,"Utah State","Colorado State",5.5,"400919849"
254,2,"5:31",331,"Foul on Prentiss Nixon.",57,45,"Utah State","Colorado State",5.5,"400919849"
255,2,"5:31",331,"Official TV Timeout",57,45,"Utah State","Colorado State",5.5,"400919849"
256,2,"5:15",315,"Quinn Taylor missed Layup.",57,45,"Utah State","Colorado State",5.5,"400919849"
257,2,"5:15",315,"Emmanuel Omogbo Defensive Rebound.",57,45,"Utah State","Colorado State",5.5,"400919849"
258,2,"4:56",296,"Gian Clavell made Three Point Jumper.",60,45,"Utah State","Colorado State",5.5,"400919849"
259,2,"4:35",275,"Koby McEwen made Three Point Jumper. Assisted by Julion Pearre.",60,48,"Utah State","Colorado State",5.5,"400919849"
260,2,"4:17",257,"Gian Clavell made Three Point Jumper. Assisted by Prentiss Nixon.",63,48,"Utah State","Colorado State",5.5,"400919849"
261,2,"4:03",243,"Jalen Moore missed Jumper.",63,48,"Utah State","Colorado State",5.5,"400919849"
262,2,"4:03",243,"Gian Clavell Defensive Rebound.",63,48,"Utah State","Colorado State",5.5,"400919849"
263,2,"3:56",236,"Colorado State  Timeout",63,48,"Utah State","Colorado State",5.5,"400919849"
264,2,"3:56",236,"Official TV Timeout",63,48,"Utah State","Colorado State",5.5,"400919849"
265,2,"3:43",223,"Gian Clavell made Three Point Jumper.",66,48,"Utah State","Colorado State",5.5,"400919849"
266,2,"3:26",206,"Sam Merrill Turnover.",66,48,"Utah State","Colorado State",5.5,"400919849"
267,2,"3:25",205,"Emmanuel Omogbo Steal.",66,48,"Utah State","Colorado State",5.5,"400919849"
268,2,"3:07",187,"Gian Clavell missed Three Point Jumper.",66,48,"Utah State","Colorado State",5.5,"400919849"
269,2,"3:07",187,"Emmanuel Omogbo Offensive Rebound.",66,48,"Utah State","Colorado State",5.5,"400919849"
270,2,"3:03",183,"Foul on Sam Merrill.",66,48,"Utah State","Colorado State",5.5,"400919849"
271,2,"2:57",177,"J.D. Paige missed Three Point Jumper.",66,48,"Utah State","Colorado State",5.5,"400919849"
272,2,"2:57",177,"Jalen Moore Defensive Rebound.",66,48,"Utah State","Colorado State",5.5,"400919849"
273,2,"2:47",167,"Koby McEwen missed Three Point Jumper.",66,48,"Utah State","Colorado State",5.5,"400919849"
274,2,"2:47",167,"Alexis Dargenton Offensive Rebound.",66,48,"Utah State","Colorado State",5.5,"400919849"
275,2,"2:42",162,"Foul on Prentiss Nixon.",66,48,"Utah State","Colorado State",5.5,"400919849"
276,2,"2:30",150,"Jalen Moore missed Jumper.",66,48,"Utah State","Colorado State",5.5,"400919849"
277,2,"2:30",150,"Gian Clavell Defensive Rebound.",66,48,"Utah State","Colorado State",5.5,"400919849"
278,2,"2:02",122,"Foul on Julion Pearre.",66,48,"Utah State","Colorado State",5.5,"400919849"
279,2,"2:02",122,"Prentiss Nixon missed Free Throw.",66,48,"Utah State","Colorado State",5.5,"400919849"
280,2,"2:02",122,"Alexis Dargenton Defensive Rebound.",66,48,"Utah State","Colorado State",5.5,"400919849"
281,2,"1:52",112,"Alexis Dargenton made Dunk.",66,50,"Utah State","Colorado State",5.5,"400919849"
282,2,"1:18",78,"Foul on Diogo Brito.",66,50,"Utah State","Colorado State",5.5,"400919849"
283,2,"1:18",78,"Gian Clavell missed Free Throw.",66,50,"Utah State","Colorado State",5.5,"400919849"
284,2,"1:18",78,"Jalen Moore Defensive Rebound.",66,50,"Utah State","Colorado State",5.5,"400919849"
285,2,"1:12",72,"Diogo Brito missed Three Point Jumper.",66,50,"Utah State","Colorado State",5.5,"400919849"
286,2,"1:12",72,"Alexis Dargenton Offensive Rebound.",66,50,"Utah State","Colorado State",5.5,"400919849"
287,2,"1:10",70,"Alexis Dargenton made Layup.",66,52,"Utah State","Colorado State",5.5,"400919849"
288,2,"0:35",35,"J.D. Paige made Three Point Jumper. Assisted by Gian Clavell.",69,52,"Utah State","Colorado State",5.5,"400919849"
289,2,"0:27",27,"Koby McEwen missed Three Point Jumper.",69,52,"Utah State","Colorado State",5.5,"400919849"
290,2,"0:27",27,"Emmanuel Omogbo Defensive Rebound.",69,52,"Utah State","Colorado State",5.5,"400919849"
291,2,"0:00",0,"End of Game",69,52,"Utah State","Colorado State",5.5,"400919849"
1,1,"20:00",2400,"PLAY",0,0,"Wyoming","Utah State",2.5,"400919942"
2,1,"19:52",2392,"Sam Merrill missed Three Point Jumper.",0,0,"Wyoming","Utah State",2.5,"400919942"
3,1,"19:52",2392,"Norbert Janicek Offensive Rebound.",0,0,"Wyoming","Utah State",2.5,"400919942"
4,1,"19:48",2388,"Norbert Janicek missed Jumper.",0,0,"Wyoming","Utah State",2.5,"400919942"
5,1,"19:48",2388,"Sam Merrill Offensive Rebound.",0,0,"Wyoming","Utah State",2.5,"400919942"
6,1,"19:31",2371,"Sam Merrill missed Jumper.",0,0,"Wyoming","Utah State",2.5,"400919942"
7,1,"19:31",2371,"Alexis Dargenton Offensive Rebound.",0,0,"Wyoming","Utah State",2.5,"400919942"
8,1,"19:28",2368,"Alexis Dargenton made Layup.",2,0,"Wyoming","Utah State",2.5,"400919942"
9,1,"19:28",2368,"Foul on Jordan Naughton.",2,0,"Wyoming","Utah State",2.5,"400919942"
10,1,"19:28",2368,"Alexis Dargenton made Free Throw.",3,0,"Wyoming","Utah State",2.5,"400919942"
11,1,"19:09",2349,"Jordan Naughton made Layup. Assisted by Jason McManamen.",3,2,"Wyoming","Utah State",2.5,"400919942"
12,1,"18:41",2321,"Jalen Moore made Three Point Jumper. Assisted by Koby McEwen.",6,2,"Wyoming","Utah State",2.5,"400919942"
13,1,"18:27",2307,"Alan Herndon made Jumper. Assisted by Jeremy Lieberman.",6,4,"Wyoming","Utah State",2.5,"400919942"
14,1,"18:10",2290,"Jalen Moore missed Layup.",6,4,"Wyoming","Utah State",2.5,"400919942"
15,1,"18:10",2290,"Alexis Dargenton Offensive Rebound.",6,4,"Wyoming","Utah State",2.5,"400919942"
16,1,"18:07",2287,"Alexis Dargenton made Two Point Tip Shot.",8,4,"Wyoming","Utah State",2.5,"400919942"
17,1,"17:46",2266,"Louis Adams made Three Point Jumper. Assisted by Jeremy Lieberman.",8,7,"Wyoming","Utah State",2.5,"400919942"
18,1,"17:30",2250,"Koby McEwen Turnover.",8,7,"Wyoming","Utah State",2.5,"400919942"
19,1,"17:16",2236,"Jason McManamen Turnover.",8,7,"Wyoming","Utah State",2.5,"400919942"
20,1,"17:15",2235,"Alexis Dargenton Steal.",8,7,"Wyoming","Utah State",2.5,"400919942"
21,1,"17:14",2234,"Norbert Janicek Turnover.",8,7,"Wyoming","Utah State",2.5,"400919942"
22,1,"17:13",2233,"Louis Adams Steal.",8,7,"Wyoming","Utah State",2.5,"400919942"
23,1,"17:09",2229,"Louis Adams missed Layup.",8,7,"Wyoming","Utah State",2.5,"400919942"
24,1,"17:09",2229,"Alexis Dargenton Block.",8,7,"Wyoming","Utah State",2.5,"400919942"
25,1,"17:08",2228,"Jordan Naughton Offensive Rebound.",8,7,"Wyoming","Utah State",2.5,"400919942"
26,1,"17:08",2228,"Foul on Sam Merrill.",8,7,"Wyoming","Utah State",2.5,"400919942"
27,1,"17:08",2228,"Jordan Naughton missed Free Throw.",8,7,"Wyoming","Utah State",2.5,"400919942"
28,1,"17:08",2228,"Wyoming Deadball Team Rebound.",8,7,"Wyoming","Utah State",2.5,"400919942"
29,1,"17:08",2228,"Jordan Naughton made Free Throw.",8,8,"Wyoming","Utah State",2.5,"400919942"
30,1,"16:47",2207,"Koby McEwen Turnover.",8,8,"Wyoming","Utah State",2.5,"400919942"
31,1,"16:46",2206,"Louis Adams Steal.",8,8,"Wyoming","Utah State",2.5,"400919942"
32,1,"16:43",2203,"Louis Adams made Layup.",8,10,"Wyoming","Utah State",2.5,"400919942"
33,1,"16:26",2186,"Alexis Dargenton made Jumper. Assisted by Jalen Moore.",10,10,"Wyoming","Utah State",2.5,"400919942"
34,1,"16:01",2161,"Alan Herndon made Layup. Assisted by Jason McManamen.",10,12,"Wyoming","Utah State",2.5,"400919942"
35,1,"16:01",2161,"Foul on Jalen Moore.",10,12,"Wyoming","Utah State",2.5,"400919942"
36,1,"16:01",2161,"Alan Herndon made Free Throw.",10,13,"Wyoming","Utah State",2.5,"400919942"
37,1,"15:57",2157,"Foul on Jeremy Lieberman.",10,13,"Wyoming","Utah State",2.5,"400919942"
38,1,"15:57",2157,"Official TV Timeout",10,13,"Wyoming","Utah State",2.5,"400919942"
39,1,"15:45",2145,"Sam Merrill made Three Point Jumper. Assisted by Koby McEwen.",13,13,"Wyoming","Utah State",2.5,"400919942"
40,1,"15:37",2137,"Louis Adams missed Layup.",13,13,"Wyoming","Utah State",2.5,"400919942"
41,1,"15:37",2137,"Alexis Dargenton Defensive Rebound.",13,13,"Wyoming","Utah State",2.5,"400919942"
42,1,"15:23",2123,"Jalen Moore made Three Point Jumper. Assisted by Sam Merrill.",16,13,"Wyoming","Utah State",2.5,"400919942"
43,1,"15:06",2106,"Louis Adams missed Layup.",16,13,"Wyoming","Utah State",2.5,"400919942"
44,1,"15:06",2106,"Alexis Dargenton Block.",16,13,"Wyoming","Utah State",2.5,"400919942"
45,1,"15:05",2105,"Sam Merrill Defensive Rebound.",16,13,"Wyoming","Utah State",2.5,"400919942"
46,1,"14:59",2099,"Koby McEwen missed Three Point Jumper.",16,13,"Wyoming","Utah State",2.5,"400919942"
47,1,"14:59",2099,"Quinn Taylor Offensive Rebound.",16,13,"Wyoming","Utah State",2.5,"400919942"
48,1,"14:49",2089,"Foul on Alan Herndon.",16,13,"Wyoming","Utah State",2.5,"400919942"
49,1,"14:49",2089,"Koby McEwen made Free Throw.",17,13,"Wyoming","Utah State",2.5,"400919942"
50,1,"14:49",2089,"Koby McEwen made Free Throw.",18,13,"Wyoming","Utah State",2.5,"400919942"
51,1,"14:31",2071,"Morris Marshall missed Jumper.",18,13,"Wyoming","Utah State",2.5,"400919942"
52,1,"14:31",2071,"Quinn Taylor Defensive Rebound.",18,13,"Wyoming","Utah State",2.5,"400919942"
53,1,"14:13",2053,"Jalen Moore made Dunk.",20,13,"Wyoming","Utah State",2.5,"400919942"
54,1,"14:12",2052,"Foul on Morris Marshall.",20,13,"Wyoming","Utah State",2.5,"400919942"
55,1,"14:12",2052,"Jalen Moore made Free Throw.",21,13,"Wyoming","Utah State",2.5,"400919942"
56,1,"13:51",2031,"Foul on Koby McEwen.",21,13,"Wyoming","Utah State",2.5,"400919942"
57,1,"13:34",2014,"Hayden Dalton made Three Point Jumper. Assisted by Cody Kelley.",21,16,"Wyoming","Utah State",2.5,"400919942"
58,1,"13:05",1985,"Quinn Taylor made Layup. Assisted by Alexis Dargenton.",23,16,"Wyoming","Utah State",2.5,"400919942"
59,1,"12:35",1955,"Wyoming  Turnover.",23,16,"Wyoming","Utah State",2.5,"400919942"
60,1,"12:17",1937,"Julion Pearre missed Three Point Jumper.",23,16,"Wyoming","Utah State",2.5,"400919942"
61,1,"12:17",1937,"Quinn Taylor Offensive Rebound.",23,16,"Wyoming","Utah State",2.5,"400919942"
62,1,"12:12",1932,"Foul on Jason McManamen.",23,16,"Wyoming","Utah State",2.5,"400919942"
63,1,"12:12",1932,"Koby McEwen Turnover.",23,16,"Wyoming","Utah State",2.5,"400919942"
64,1,"11:51",1911,"Hayden Dalton missed Three Point Jumper.",23,16,"Wyoming","Utah State",2.5,"400919942"
65,1,"11:51",1911,"Morris Marshall Offensive Rebound.",23,16,"Wyoming","Utah State",2.5,"400919942"
66,1,"11:46",1906,"Cody Kelley made Three Point Jumper. Assisted by Morris Marshall.",23,19,"Wyoming","Utah State",2.5,"400919942"
67,1,"11:23",1883,"Quinn Taylor made Layup. Assisted by Julion Pearre.",25,19,"Wyoming","Utah State",2.5,"400919942"
68,1,"11:11",1871,"Hayden Dalton made Three Point Jumper. Assisted by Jason McManamen.",25,22,"Wyoming","Utah State",2.5,"400919942"
69,1,"10:54",1854,"Koby McEwen missed Three Point Jumper.",25,22,"Wyoming","Utah State",2.5,"400919942"
70,1,"10:54",1854,"Quinn Taylor Offensive Rebound.",25,22,"Wyoming","Utah State",2.5,"400919942"
71,1,"10:52",1852,"Quinn Taylor made Layup.",27,22,"Wyoming","Utah State",2.5,"400919942"
72,1,"10:36",1836,"Cody Kelley made Three Point Jumper. Assisted by Hayden Dalton.",27,25,"Wyoming","Utah State",2.5,"400919942"
73,1,"10:05",1805,"Sam Merrill made Jumper. Assisted by Quinn Taylor.",29,25,"Wyoming","Utah State",2.5,"400919942"
74,1,"9:50",1790,"Jason McManamen made Layup.",29,27,"Wyoming","Utah State",2.5,"400919942"
75,1,"9:31",1771,"Koby McEwen Turnover.",29,27,"Wyoming","Utah State",2.5,"400919942"
76,1,"9:30",1770,"Alan Herndon Steal.",29,27,"Wyoming","Utah State",2.5,"400919942"
77,1,"9:07",1747,"Hayden Dalton missed Three Point Jumper.",29,27,"Wyoming","Utah State",2.5,"400919942"
78,1,"9:07",1747,"Alexis Dargenton Defensive Rebound.",29,27,"Wyoming","Utah State",2.5,"400919942"
79,1,"8:40",1720,"Julion Pearre made Three Point Jumper. Assisted by Quinn Taylor.",32,27,"Wyoming","Utah State",2.5,"400919942"
80,1,"8:31",1711,"Wyoming  Timeout",32,27,"Wyoming","Utah State",2.5,"400919942"
81,1,"8:31",1711,"Official TV Timeout",32,27,"Wyoming","Utah State",2.5,"400919942"
82,1,"8:12",1692,"Jordan Naughton missed Layup.",32,27,"Wyoming","Utah State",2.5,"400919942"
83,1,"8:12",1692,"Ngor Barnaba Defensive Rebound.",32,27,"Wyoming","Utah State",2.5,"400919942"
84,1,"7:51",1671,"Jalen Moore missed Three Point Jumper.",32,27,"Wyoming","Utah State",2.5,"400919942"
85,1,"7:51",1671,"Jason McManamen Defensive Rebound.",32,27,"Wyoming","Utah State",2.5,"400919942"
86,1,"7:33",1653,"Justin James missed Dunk.",32,27,"Wyoming","Utah State",2.5,"400919942"
87,1,"7:33",1653,"Jason McManamen Offensive Rebound.",32,27,"Wyoming","Utah State",2.5,"400919942"
88,1,"7:31",1651,"Jason McManamen made Three Point Jumper.",32,30,"Wyoming","Utah State",2.5,"400919942"
89,1,"7:03",1623,"Ngor Barnaba missed Jumper.",32,30,"Wyoming","Utah State",2.5,"400919942"
90,1,"7:03",1623,"Norbert Janicek Offensive Rebound.",32,30,"Wyoming","Utah State",2.5,"400919942"
91,1,"7:00",1620,"Foul on Jordan Naughton.",32,30,"Wyoming","Utah State",2.5,"400919942"
92,1,"7:00",1620,"Official TV Timeout",32,30,"Wyoming","Utah State",2.5,"400919942"
93,1,"7:00",1620,"Norbert Janicek made Free Throw.",33,30,"Wyoming","Utah State",2.5,"400919942"
94,1,"7:00",1620,"Norbert Janicek missed Free Throw.",33,30,"Wyoming","Utah State",2.5,"400919942"
95,1,"7:00",1620,"Alan Herndon Defensive Rebound.",33,30,"Wyoming","Utah State",2.5,"400919942"
96,1,"6:45",1605,"Louis Adams made Layup.",33,32,"Wyoming","Utah State",2.5,"400919942"
97,1,"6:26",1586,"Jalen Moore missed Jumper.",33,32,"Wyoming","Utah State",2.5,"400919942"
98,1,"6:26",1586,"Justin James Defensive Rebound.",33,32,"Wyoming","Utah State",2.5,"400919942"
99,1,"6:05",1565,"Justin James made Three Point Jumper. Assisted by Louis Adams.",33,35,"Wyoming","Utah State",2.5,"400919942"
100,1,"5:47",1547,"Foul on Jonathan Barnes.",33,35,"Wyoming","Utah State",2.5,"400919942"
101,1,"5:47",1547,"Jalen Moore made Free Throw.",34,35,"Wyoming","Utah State",2.5,"400919942"
102,1,"5:47",1547,"Jalen Moore made Free Throw.",35,35,"Wyoming","Utah State",2.5,"400919942"
103,1,"5:29",1529,"Alan Herndon missed Three Point Jumper.",35,35,"Wyoming","Utah State",2.5,"400919942"
104,1,"5:29",1529,"Quinn Taylor Defensive Rebound.",35,35,"Wyoming","Utah State",2.5,"400919942"
105,1,"5:22",1522,"Koby McEwen missed Layup.",35,35,"Wyoming","Utah State",2.5,"400919942"
106,1,"5:22",1522,"Justin James Block.",35,35,"Wyoming","Utah State",2.5,"400919942"
107,1,"5:18",1518,"Jonathan Barnes Defensive Rebound.",35,35,"Wyoming","Utah State",2.5,"400919942"
108,1,"5:12",1512,"Justin James missed Jumper.",35,35,"Wyoming","Utah State",2.5,"400919942"
109,1,"5:12",1512,"Quinn Taylor Defensive Rebound.",35,35,"Wyoming","Utah State",2.5,"400919942"
110,1,"4:51",1491,"Foul on Justin James.",35,35,"Wyoming","Utah State",2.5,"400919942"
111,1,"4:51",1491,"Jalen Moore missed Free Throw.",35,35,"Wyoming","Utah State",2.5,"400919942"
112,1,"4:51",1491,"Hayden Dalton Defensive Rebound.",35,35,"Wyoming","Utah State",2.5,"400919942"
113,1,"4:44",1484,"Louis Adams made Layup.",35,37,"Wyoming","Utah State",2.5,"400919942"
114,1,"4:22",1462,"Quinn Taylor Turnover.",35,37,"Wyoming","Utah State",2.5,"400919942"
115,1,"4:22",1462,"Foul on Quinn Taylor.",35,37,"Wyoming","Utah State",2.5,"400919942"
116,1,"4:05",1445,"Hayden Dalton missed Three Point Jumper.",35,37,"Wyoming","Utah State",2.5,"400919942"
117,1,"4:05",1445,"Utah State Defensive Rebound.",35,37,"Wyoming","Utah State",2.5,"400919942"
118,1,"3:46",1426,"Alexis Dargenton Turnover.",35,37,"Wyoming","Utah State",2.5,"400919942"
119,1,"3:46",1426,"Foul on Alexis Dargenton.",35,37,"Wyoming","Utah State",2.5,"400919942"
120,1,"3:46",1426,"Official TV Timeout",35,37,"Wyoming","Utah State",2.5,"400919942"
121,1,"3:33",1413,"Louis Adams Turnover.",35,37,"Wyoming","Utah State",2.5,"400919942"
122,1,"3:32",1412,"Sam Merrill Steal.",35,37,"Wyoming","Utah State",2.5,"400919942"
123,1,"3:23",1403,"Utah State  Timeout",35,37,"Wyoming","Utah State",2.5,"400919942"
124,1,"3:05",1385,"Foul on Jeremy Lieberman.",35,37,"Wyoming","Utah State",2.5,"400919942"
125,1,"3:05",1385,"Alexis Dargenton made Free Throw.",36,37,"Wyoming","Utah State",2.5,"400919942"
126,1,"3:05",1385,"Alexis Dargenton made Free Throw.",37,37,"Wyoming","Utah State",2.5,"400919942"
127,1,"2:53",1373,"Alan Herndon missed Three Point Jumper.",37,37,"Wyoming","Utah State",2.5,"400919942"
128,1,"2:53",1373,"Koby McEwen Defensive Rebound.",37,37,"Wyoming","Utah State",2.5,"400919942"
129,1,"2:28",1348,"Jalen Moore missed Jumper.",37,37,"Wyoming","Utah State",2.5,"400919942"
130,1,"2:28",1348,"Alan Herndon Block.",37,37,"Wyoming","Utah State",2.5,"400919942"
131,1,"2:26",1346,"Jalen Moore Offensive Rebound.",37,37,"Wyoming","Utah State",2.5,"400919942"
132,1,"2:24",1344,"Jalen Moore made Two Point Tip Shot.",39,37,"Wyoming","Utah State",2.5,"400919942"
133,1,"2:13",1333,"Louis Adams made Three Point Jumper. Assisted by Cody Kelley.",39,40,"Wyoming","Utah State",2.5,"400919942"
134,1,"1:49",1309,"Alexis Dargenton missed Three Point Jumper.",39,40,"Wyoming","Utah State",2.5,"400919942"
135,1,"1:49",1309,"Cody Kelley Defensive Rebound.",39,40,"Wyoming","Utah State",2.5,"400919942"
136,1,"1:33",1293,"Jason McManamen missed Layup.",39,40,"Wyoming","Utah State",2.5,"400919942"
137,1,"1:33",1293,"Koby McEwen Defensive Rebound.",39,40,"Wyoming","Utah State",2.5,"400919942"
138,1,"1:24",1284,"Sam Merrill made Three Point Jumper. Assisted by Jalen Moore.",42,40,"Wyoming","Utah State",2.5,"400919942"
139,1,"1:04",1264,"Alan Herndon missed Three Point Jumper.",42,40,"Wyoming","Utah State",2.5,"400919942"
140,1,"1:04",1264,"Jalen Moore Defensive Rebound.",42,40,"Wyoming","Utah State",2.5,"400919942"
141,1,"0:54",1254,"Sam Merrill Turnover.",42,40,"Wyoming","Utah State",2.5,"400919942"
142,1,"0:53",1253,"Cody Kelley Steal.",42,40,"Wyoming","Utah State",2.5,"400919942"
143,1,"0:49",1249,"Louis Adams missed Layup.",42,40,"Wyoming","Utah State",2.5,"400919942"
144,1,"0:49",1249,"Alexis Dargenton Block.",42,40,"Wyoming","Utah State",2.5,"400919942"
145,1,"0:47",1247,"Koby McEwen Defensive Rebound.",42,40,"Wyoming","Utah State",2.5,"400919942"
146,1,"0:37",1237,"Foul on Cody Kelley.",42,40,"Wyoming","Utah State",2.5,"400919942"
147,1,"0:37",1237,"Koby McEwen missed Free Throw.",42,40,"Wyoming","Utah State",2.5,"400919942"
148,1,"0:37",1237,"Utah State Deadball Team Rebound.",42,40,"Wyoming","Utah State",2.5,"400919942"
149,1,"0:37",1237,"Koby McEwen made Free Throw.",43,40,"Wyoming","Utah State",2.5,"400919942"
150,1,"0:18",1218,"Foul on Koby McEwen.",43,40,"Wyoming","Utah State",2.5,"400919942"
151,1,"0:18",1218,"Louis Adams made Free Throw.",43,41,"Wyoming","Utah State",2.5,"400919942"
152,1,"0:18",1218,"Louis Adams made Free Throw.",43,42,"Wyoming","Utah State",2.5,"400919942"
153,1,"0:03",1203,"Koby McEwen missed Jumper.",43,42,"Wyoming","Utah State",2.5,"400919942"
154,1,"0:03",1203,"Alan Herndon Defensive Rebound.",43,42,"Wyoming","Utah State",2.5,"400919942"
155,1,"0:00",1200,"End of 1st half",43,42,"Wyoming","Utah State",2.5,"400919942"
156,2,"20:00",1200,"PLAY",43,42,"Wyoming","Utah State",2.5,"400919942"
157,2,"19:51",1191,"Foul on Sam Merrill.",43,42,"Wyoming","Utah State",2.5,"400919942"
158,2,"19:45",1185,"Jason McManamen made Three Point Jumper. Assisted by Alan Herndon.",43,45,"Wyoming","Utah State",2.5,"400919942"
159,2,"19:23",1163,"Koby McEwen missed Jumper.",43,45,"Wyoming","Utah State",2.5,"400919942"
160,2,"19:23",1163,"Louis Adams Defensive Rebound.",43,45,"Wyoming","Utah State",2.5,"400919942"
161,2,"19:03",1143,"Alan Herndon missed Three Point Jumper.",43,45,"Wyoming","Utah State",2.5,"400919942"
162,2,"19:03",1143,"Jordan Naughton Offensive Rebound.",43,45,"Wyoming","Utah State",2.5,"400919942"
163,2,"19:01",1141,"Foul on Sam Merrill.",43,45,"Wyoming","Utah State",2.5,"400919942"
164,2,"19:01",1141,"Jordan Naughton made Free Throw.",43,46,"Wyoming","Utah State",2.5,"400919942"
165,2,"19:01",1141,"Jordan Naughton missed Free Throw.",43,46,"Wyoming","Utah State",2.5,"400919942"
166,2,"19:01",1141,"Alexis Dargenton Defensive Rebound.",43,46,"Wyoming","Utah State",2.5,"400919942"
167,2,"18:40",1120,"Quinn Taylor made Layup. Assisted by Koby McEwen.",45,46,"Wyoming","Utah State",2.5,"400919942"
168,2,"18:27",1107,"Jeremy Lieberman missed Three Point Jumper.",45,46,"Wyoming","Utah State",2.5,"400919942"
169,2,"18:27",1107,"Alexis Dargenton Defensive Rebound.",45,46,"Wyoming","Utah State",2.5,"400919942"
170,2,"18:04",1084,"Foul on Jordan Naughton.",45,46,"Wyoming","Utah State",2.5,"400919942"
171,2,"18:04",1084,"Jalen Moore made Free Throw.",46,46,"Wyoming","Utah State",2.5,"400919942"
172,2,"18:04",1084,"Jalen Moore made Free Throw.",47,46,"Wyoming","Utah State",2.5,"400919942"
173,2,"17:55",1075,"Hayden Dalton made Layup. Assisted by Alan Herndon.",47,48,"Wyoming","Utah State",2.5,"400919942"
174,2,"17:35",1055,"Foul on Alan Herndon.",47,48,"Wyoming","Utah State",2.5,"400919942"
175,2,"17:35",1055,"Alexis Dargenton made Free Throw.",48,48,"Wyoming","Utah State",2.5,"400919942"
176,2,"17:35",1055,"Alexis Dargenton made Free Throw.",49,48,"Wyoming","Utah State",2.5,"400919942"
177,2,"17:17",1037,"Jason McManamen missed Three Point Jumper.",49,48,"Wyoming","Utah State",2.5,"400919942"
