"play_id","half","time_remaining_half","secs_remaining","description","home_score","away_score","away","home","home_favored_by","game_id"
1,1,"20:00",2400,"PLAY",0,0,"Utah State","UC Irvine",4.5,"400918952"
2,1,"19:41",2381,"Koby McEwen made Three Point Jumper.",0,3,"Utah State","UC Irvine",4.5,"400918952"
3,1,"19:17",2357,"Foul on Norbert Janicek.",0,3,"Utah State","UC Irvine",4.5,"400918952"
4,1,"19:17",2357,"Max Hazzard missed Free Throw.",0,3,"Utah State","UC Irvine",4.5,"400918952"
5,1,"19:17",2357,"UC Irvine Deadball Team Rebound.",0,3,"Utah State","UC Irvine",4.5,"400918952"
6,1,"19:17",2357,"Max Hazzard made Free Throw.",1,3,"Utah State","UC Irvine",4.5,"400918952"
7,1,"19:03",2343,"Quinn Taylor Turnover.",1,3,"Utah State","UC Irvine",4.5,"400918952"
8,1,"19:01",2341,"Jaron Martin Steal.",1,3,"Utah State","UC Irvine",4.5,"400918952"
9,1,"18:36",2316,"Max Hazzard made Three Point Jumper. Assisted by Ioannis Dimakopoulos.",4,3,"Utah State","UC Irvine",4.5,"400918952"
10,1,"18:20",2300,"Shane Rector made Three Point Jumper. Assisted by Norbert Janicek.",4,6,"Utah State","UC Irvine",4.5,"400918952"
11,1,"17:58",2278,"Max Hazzard missed Three Point Jumper.",4,6,"Utah State","UC Irvine",4.5,"400918952"
12,1,"17:58",2278,"Norbert Janicek Defensive Rebound.",4,6,"Utah State","UC Irvine",4.5,"400918952"
13,1,"17:46",2266,"Norbert Janicek Turnover.",4,6,"Utah State","UC Irvine",4.5,"400918952"
14,1,"17:44",2264,"Brandon Smith Steal.",4,6,"Utah State","UC Irvine",4.5,"400918952"
15,1,"17:40",2260,"Max Hazzard missed Layup.",4,6,"Utah State","UC Irvine",4.5,"400918952"
16,1,"17:40",2260,"Norbert Janicek Defensive Rebound.",4,6,"Utah State","UC Irvine",4.5,"400918952"
17,1,"17:23",2243,"Shane Rector missed Jumper.",4,6,"Utah State","UC Irvine",4.5,"400918952"
18,1,"17:23",2243,"Norbert Janicek Offensive Rebound.",4,6,"Utah State","UC Irvine",4.5,"400918952"
19,1,"17:18",2238,"Jalen Moore missed Jumper.",4,6,"Utah State","UC Irvine",4.5,"400918952"
20,1,"17:18",2238,"Jonathan Galloway Defensive Rebound.",4,6,"Utah State","UC Irvine",4.5,"400918952"
21,1,"16:54",2214,"Jonathan Galloway missed Jumper.",4,6,"Utah State","UC Irvine",4.5,"400918952"
22,1,"16:54",2214,"Utah State Defensive Rebound.",4,6,"Utah State","UC Irvine",4.5,"400918952"
23,1,"16:33",2193,"Foul on Brandon Smith.",4,6,"Utah State","UC Irvine",4.5,"400918952"
24,1,"16:33",2193,"Norbert Janicek missed Free Throw.",4,6,"Utah State","UC Irvine",4.5,"400918952"
25,1,"16:33",2193,"Utah State Deadball Team Rebound.",4,6,"Utah State","UC Irvine",4.5,"400918952"
26,1,"16:33",2193,"Norbert Janicek made Free Throw.",4,7,"Utah State","UC Irvine",4.5,"400918952"
27,1,"16:21",2181,"Jaron Martin missed Three Point Jumper.",4,7,"Utah State","UC Irvine",4.5,"400918952"
28,1,"16:21",2181,"Quinn Taylor Defensive Rebound.",4,7,"Utah State","UC Irvine",4.5,"400918952"
29,1,"16:18",2178,"Foul on Jonathan Galloway.",4,7,"Utah State","UC Irvine",4.5,"400918952"
30,1,"16:08",2168,"Jalen Moore Turnover.",4,7,"Utah State","UC Irvine",4.5,"400918952"
31,1,"15:55",2155,"Ioannis Dimakopoulos missed Three Point Jumper.",4,7,"Utah State","UC Irvine",4.5,"400918952"
32,1,"15:55",2155,"Koby McEwen Defensive Rebound.",4,7,"Utah State","UC Irvine",4.5,"400918952"
33,1,"15:45",2145,"Quinn Taylor made Three Point Jumper. Assisted by Shane Rector.",4,10,"Utah State","UC Irvine",4.5,"400918952"
34,1,"15:17",2117,"Brandon Smith made Three Point Jumper. Assisted by Max Hazzard.",7,10,"Utah State","UC Irvine",4.5,"400918952"
35,1,"15:01",2101,"Official TV Timeout",7,10,"Utah State","UC Irvine",4.5,"400918952"
36,1,"14:48",2088,"Shane Rector missed Three Point Jumper.",7,10,"Utah State","UC Irvine",4.5,"400918952"
37,1,"14:48",2088,"Brandon Smith Defensive Rebound.",7,10,"Utah State","UC Irvine",4.5,"400918952"
38,1,"14:28",2068,"Eyassu Worku made Jumper.",9,10,"Utah State","UC Irvine",4.5,"400918952"
39,1,"14:07",2047,"Foul on Brandon Smith.",9,10,"Utah State","UC Irvine",4.5,"400918952"
40,1,"14:07",2047,"Shane Rector made Free Throw.",9,11,"Utah State","UC Irvine",4.5,"400918952"
41,1,"14:07",2047,"Shane Rector made Free Throw.",9,12,"Utah State","UC Irvine",4.5,"400918952"
42,1,"13:56",2036,"Jalen Moore missed Jumper.",9,12,"Utah State","UC Irvine",4.5,"400918952"
43,1,"13:56",2036,"Brandon Smith Defensive Rebound.",9,12,"Utah State","UC Irvine",4.5,"400918952"
44,1,"13:47",2027,"Brandon Smith missed Three Point Jumper.",9,12,"Utah State","UC Irvine",4.5,"400918952"
45,1,"13:47",2027,"Eyassu Worku Offensive Rebound.",9,12,"Utah State","UC Irvine",4.5,"400918952"
46,1,"13:39",2019,"Eyassu Worku missed Layup.",9,12,"Utah State","UC Irvine",4.5,"400918952"
47,1,"13:36",2016,"Tommy Rutherford Offensive Rebound.",9,12,"Utah State","UC Irvine",4.5,"400918952"
48,1,"13:17",1997,"Eyassu Worku missed Three Point Jumper.",9,12,"Utah State","UC Irvine",4.5,"400918952"
49,1,"13:17",1997,"Koby McEwen Defensive Rebound.",9,12,"Utah State","UC Irvine",4.5,"400918952"
50,1,"13:02",1982,"Jalen Moore missed Layup.",9,12,"Utah State","UC Irvine",4.5,"400918952"
51,1,"13:02",1982,"Evan Leonard Defensive Rebound.",9,12,"Utah State","UC Irvine",4.5,"400918952"
52,1,"12:55",1975,"Foul on Koby McEwen.",9,12,"Utah State","UC Irvine",4.5,"400918952"
53,1,"12:45",1965,"Jaron Martin missed Three Point Jumper.",9,12,"Utah State","UC Irvine",4.5,"400918952"
54,1,"12:45",1965,"Ngor Barnaba Defensive Rebound.",9,12,"Utah State","UC Irvine",4.5,"400918952"
55,1,"12:30",1950,"Foul on Evan Leonard.",9,12,"Utah State","UC Irvine",4.5,"400918952"
56,1,"12:30",1950,"Jalen Moore made Free Throw.",9,13,"Utah State","UC Irvine",4.5,"400918952"
57,1,"12:30",1950,"Jalen Moore made Free Throw.",9,14,"Utah State","UC Irvine",4.5,"400918952"
58,1,"12:10",1930,"Jaron Martin Turnover.",9,14,"Utah State","UC Irvine",4.5,"400918952"
59,1,"11:53",1913,"Julion Pearre missed Jumper.",9,14,"Utah State","UC Irvine",4.5,"400918952"
60,1,"11:53",1913,"Tommy Rutherford Block.",9,14,"Utah State","UC Irvine",4.5,"400918952"
61,1,"11:49",1909,"Eyassu Worku Defensive Rebound.",9,14,"Utah State","UC Irvine",4.5,"400918952"
62,1,"11:46",1906,"Eyassu Worku missed Jumper.",9,14,"Utah State","UC Irvine",4.5,"400918952"
63,1,"11:46",1906,"Alexis Dargenton Block.",9,14,"Utah State","UC Irvine",4.5,"400918952"
64,1,"11:46",1906,"UC Irvine Offensive Rebound.",9,14,"Utah State","UC Irvine",4.5,"400918952"
65,1,"11:46",1906,"Official TV Timeout",9,14,"Utah State","UC Irvine",4.5,"400918952"
66,1,"11:31",1891,"Evan Leonard made Three Point Jumper. Assisted by Eyassu Worku.",12,14,"Utah State","UC Irvine",4.5,"400918952"
67,1,"11:10",1870,"Foul on Evan Leonard.",12,14,"Utah State","UC Irvine",4.5,"400918952"
68,1,"11:03",1863,"Alexis Dargenton missed Jumper.",12,14,"Utah State","UC Irvine",4.5,"400918952"
69,1,"11:03",1863,"Eyassu Worku Defensive Rebound.",12,14,"Utah State","UC Irvine",4.5,"400918952"
70,1,"10:53",1853,"Foul on Sam Merrill.",12,14,"Utah State","UC Irvine",4.5,"400918952"
71,1,"10:53",1853,"Eyassu Worku made Free Throw.",13,14,"Utah State","UC Irvine",4.5,"400918952"
72,1,"10:53",1853,"Eyassu Worku missed Free Throw.",13,14,"Utah State","UC Irvine",4.5,"400918952"
73,1,"10:53",1853,"Alexis Dargenton Defensive Rebound.",13,14,"Utah State","UC Irvine",4.5,"400918952"
74,1,"10:48",1848,"Shane Rector missed Three Point Jumper.",13,14,"Utah State","UC Irvine",4.5,"400918952"
75,1,"10:48",1848,"Eyassu Worku Defensive Rebound.",13,14,"Utah State","UC Irvine",4.5,"400918952"
76,1,"10:20",1820,"Ioannis Dimakopoulos made Jumper.",15,14,"Utah State","UC Irvine",4.5,"400918952"
77,1,"9:56",1796,"Sam Merrill made Jumper. Assisted by Julion Pearre.",15,16,"Utah State","UC Irvine",4.5,"400918952"
78,1,"9:37",1777,"Ioannis Dimakopoulos Turnover.",15,16,"Utah State","UC Irvine",4.5,"400918952"
79,1,"9:36",1776,"Julion Pearre Steal.",15,16,"Utah State","UC Irvine",4.5,"400918952"
80,1,"9:32",1772,"Foul on John Edgar Jr..",15,16,"Utah State","UC Irvine",4.5,"400918952"
81,1,"9:23",1763,"Jalen Moore made Three Point Jumper. Assisted by Shane Rector.",15,19,"Utah State","UC Irvine",4.5,"400918952"
82,1,"9:09",1749,"Foul on Ngor Barnaba.",15,19,"Utah State","UC Irvine",4.5,"400918952"
83,1,"9:06",1746,"Ioannis Dimakopoulos Turnover.",15,19,"Utah State","UC Irvine",4.5,"400918952"
84,1,"9:05",1745,"Shane Rector Steal.",15,19,"Utah State","UC Irvine",4.5,"400918952"
85,1,"8:55",1735,"Foul on Darrian Traylor.",15,19,"Utah State","UC Irvine",4.5,"400918952"
86,1,"8:55",1735,"Jalen Moore made Free Throw.",15,20,"Utah State","UC Irvine",4.5,"400918952"
87,1,"8:55",1735,"Jalen Moore missed Free Throw.",15,20,"Utah State","UC Irvine",4.5,"400918952"
88,1,"8:55",1735,"Ioannis Dimakopoulos Defensive Rebound.",15,20,"Utah State","UC Irvine",4.5,"400918952"
89,1,"8:25",1705,"Max Hazzard missed Three Point Jumper.",15,20,"Utah State","UC Irvine",4.5,"400918952"
90,1,"8:25",1705,"Sam Merrill Defensive Rebound.",15,20,"Utah State","UC Irvine",4.5,"400918952"
91,1,"7:59",1679,"Shane Rector missed Jumper.",15,20,"Utah State","UC Irvine",4.5,"400918952"
92,1,"7:59",1679,"Brandon Smith Defensive Rebound.",15,20,"Utah State","UC Irvine",4.5,"400918952"
93,1,"7:37",1657,"Max Hazzard Turnover.",15,20,"Utah State","UC Irvine",4.5,"400918952"
94,1,"7:36",1656,"Norbert Janicek Steal.",15,20,"Utah State","UC Irvine",4.5,"400918952"
95,1,"7:31",1651,"Sam Merrill missed Jumper.",15,20,"Utah State","UC Irvine",4.5,"400918952"
96,1,"7:31",1651,"Shane Rector Offensive Rebound.",15,20,"Utah State","UC Irvine",4.5,"400918952"
97,1,"7:23",1643,"Shane Rector made Layup.",15,22,"Utah State","UC Irvine",4.5,"400918952"
98,1,"7:23",1643,"Foul on Ioannis Dimakopoulos.",15,22,"Utah State","UC Irvine",4.5,"400918952"
99,1,"7:23",1643,"Official TV Timeout",15,22,"Utah State","UC Irvine",4.5,"400918952"
100,1,"7:23",1643,"Shane Rector made Free Throw.",15,23,"Utah State","UC Irvine",4.5,"400918952"
101,1,"7:00",1620,"Jaron Martin missed Jumper.",15,23,"Utah State","UC Irvine",4.5,"400918952"
102,1,"7:00",1620,"Shane Rector Defensive Rebound.",15,23,"Utah State","UC Irvine",4.5,"400918952"
103,1,"6:54",1614,"Jalen Moore made Layup. Assisted by Shane Rector.",15,25,"Utah State","UC Irvine",4.5,"400918952"
104,1,"6:36",1596,"Jaron Martin missed Three Point Jumper.",15,25,"Utah State","UC Irvine",4.5,"400918952"
105,1,"6:36",1596,"Jonathan Galloway Offensive Rebound.",15,25,"Utah State","UC Irvine",4.5,"400918952"
106,1,"6:30",1590,"Eyassu Worku made Three Point Jumper. Assisted by Jaron Martin.",18,25,"Utah State","UC Irvine",4.5,"400918952"
107,1,"6:12",1572,"Jalen Moore made Jumper. Assisted by Quinn Taylor.",18,27,"Utah State","UC Irvine",4.5,"400918952"
108,1,"5:55",1555,"Max Hazzard Turnover.",18,27,"Utah State","UC Irvine",4.5,"400918952"
109,1,"5:43",1543,"Jalen Moore missed Jumper.",18,27,"Utah State","UC Irvine",4.5,"400918952"
110,1,"5:43",1543,"Eyassu Worku Defensive Rebound.",18,27,"Utah State","UC Irvine",4.5,"400918952"
111,1,"5:20",1520,"Eyassu Worku Turnover.",18,27,"Utah State","UC Irvine",4.5,"400918952"
112,1,"5:06",1506,"Shane Rector missed Three Point Jumper.",18,27,"Utah State","UC Irvine",4.5,"400918952"
113,1,"5:06",1506,"Evan Leonard Defensive Rebound.",18,27,"Utah State","UC Irvine",4.5,"400918952"
114,1,"5:00",1500,"Evan Leonard Turnover.",18,27,"Utah State","UC Irvine",4.5,"400918952"
115,1,"4:51",1491,"Quinn Taylor made Three Point Jumper. Assisted by Jalen Moore.",18,30,"Utah State","UC Irvine",4.5,"400918952"
116,1,"4:32",1472,"Tommy Rutherford Turnover.",18,30,"Utah State","UC Irvine",4.5,"400918952"
117,1,"4:32",1472,"Foul on Tommy Rutherford.",18,30,"Utah State","UC Irvine",4.5,"400918952"
118,1,"4:17",1457,"Julion Pearre made Jumper. Assisted by Koby McEwen.",18,32,"Utah State","UC Irvine",4.5,"400918952"
119,1,"3:59",1439,"Ioannis Dimakopoulos missed Jumper.",18,32,"Utah State","UC Irvine",4.5,"400918952"
120,1,"3:59",1439,"Quinn Taylor Defensive Rebound.",18,32,"Utah State","UC Irvine",4.5,"400918952"
121,1,"3:52",1432,"Koby McEwen made Layup.",18,34,"Utah State","UC Irvine",4.5,"400918952"
122,1,"3:50",1430,"UC Irvine  Timeout",18,34,"Utah State","UC Irvine",4.5,"400918952"
123,1,"3:24",1404,"Jaron Martin missed Jumper.",18,34,"Utah State","UC Irvine",4.5,"400918952"
124,1,"3:24",1404,"Ioannis Dimakopoulos Offensive Rebound.",18,34,"Utah State","UC Irvine",4.5,"400918952"
125,1,"3:16",1396,"Ioannis Dimakopoulos missed Jumper.",18,34,"Utah State","UC Irvine",4.5,"400918952"
126,1,"3:16",1396,"Quinn Taylor Defensive Rebound.",18,34,"Utah State","UC Irvine",4.5,"400918952"
127,1,"2:52",1372,"Jalen Moore missed Three Point Jumper.",18,34,"Utah State","UC Irvine",4.5,"400918952"
128,1,"2:52",1372,"Utah State Offensive Rebound.",18,34,"Utah State","UC Irvine",4.5,"400918952"
129,1,"2:48",1368,"Quinn Taylor missed Three Point Jumper.",18,34,"Utah State","UC Irvine",4.5,"400918952"
130,1,"2:48",1368,"Brandon Smith Defensive Rebound.",18,34,"Utah State","UC Irvine",4.5,"400918952"
131,1,"2:39",1359,"Foul on Quinn Taylor.",18,34,"Utah State","UC Irvine",4.5,"400918952"
132,1,"2:34",1354,"Evan Leonard missed Three Point Jumper.",18,34,"Utah State","UC Irvine",4.5,"400918952"
133,1,"2:34",1354,"Quinn Taylor Defensive Rebound.",18,34,"Utah State","UC Irvine",4.5,"400918952"
134,1,"2:21",1341,"Julion Pearre made Layup.",18,36,"Utah State","UC Irvine",4.5,"400918952"
135,1,"2:10",1330,"Jaron Martin missed Three Point Jumper.",18,36,"Utah State","UC Irvine",4.5,"400918952"
136,1,"2:10",1330,"Norbert Janicek Defensive Rebound.",18,36,"Utah State","UC Irvine",4.5,"400918952"
137,1,"1:50",1310,"Koby McEwen missed Three Point Jumper.",18,36,"Utah State","UC Irvine",4.5,"400918952"
138,1,"1:50",1310,"Jaron Martin Defensive Rebound.",18,36,"Utah State","UC Irvine",4.5,"400918952"
139,1,"1:41",1301,"Ioannis Dimakopoulos made Three Point Jumper. Assisted by Jaron Martin.",21,36,"Utah State","UC Irvine",4.5,"400918952"
140,1,"1:18",1278,"Norbert Janicek Turnover.",21,36,"Utah State","UC Irvine",4.5,"400918952"
141,1,"1:18",1278,"Ioannis Dimakopoulos Steal.",21,36,"Utah State","UC Irvine",4.5,"400918952"
142,1,"1:15",1275,"Foul on Jalen Moore.",21,36,"Utah State","UC Irvine",4.5,"400918952"
143,1,"1:15",1275,"Evan Leonard made Free Throw.",22,36,"Utah State","UC Irvine",4.5,"400918952"
144,1,"0:53",1253,"Alexis Dargenton missed Jumper.",22,36,"Utah State","UC Irvine",4.5,"400918952"
145,1,"0:53",1253,"Brad Greene Defensive Rebound.",22,36,"Utah State","UC Irvine",4.5,"400918952"
146,1,"0:45",1245,"John Edgar Jr. made Layup. Assisted by Jaron Martin.",24,36,"Utah State","UC Irvine",4.5,"400918952"
147,1,"0:45",1245,"Foul on Alexis Dargenton.",24,36,"Utah State","UC Irvine",4.5,"400918952"
148,1,"0:45",1245,"Utah State  Timeout",24,36,"Utah State","UC Irvine",4.5,"400918952"
149,1,"0:45",1245,"John Edgar Jr. missed Free Throw.",24,36,"Utah State","UC Irvine",4.5,"400918952"
150,1,"0:45",1245,"Ngor Barnaba Defensive Rebound.",24,36,"Utah State","UC Irvine",4.5,"400918952"
151,1,"0:31",1231,"Foul on Brad Greene.",24,36,"Utah State","UC Irvine",4.5,"400918952"
152,1,"0:31",1231,"Jalen Moore made Free Throw.",24,37,"Utah State","UC Irvine",4.5,"400918952"
153,1,"0:31",1231,"Jalen Moore made Free Throw.",24,38,"Utah State","UC Irvine",4.5,"400918952"
154,1,"0:11",1211,"Eyassu Worku missed Three Point Jumper.",24,38,"Utah State","UC Irvine",4.5,"400918952"
155,1,"0:11",1211,"Alexis Dargenton Defensive Rebound.",24,38,"Utah State","UC Irvine",4.5,"400918952"
156,1,"0:09",1209,"Foul on Brad Greene.",24,38,"Utah State","UC Irvine",4.5,"400918952"
157,1,"0:09",1209,"Alexis Dargenton made Free Throw.",24,39,"Utah State","UC Irvine",4.5,"400918952"
158,1,"0:09",1209,"Alexis Dargenton made Free Throw.",24,40,"Utah State","UC Irvine",4.5,"400918952"
159,1,"0:01",1201,"Jaron Martin missed Jumper.",24,40,"Utah State","UC Irvine",4.5,"400918952"
160,1,"0:01",1201,"Jalen Moore Defensive Rebound.",24,40,"Utah State","UC Irvine",4.5,"400918952"
161,1,"0:00",1200,"End of 1st half",24,40,"Utah State","UC Irvine",4.5,"400918952"
162,2,"20:00",1200,"PLAY",24,40,"Utah State","UC Irvine",4.5,"400918952"
163,2,"19:45",1185,"Koby McEwen Turnover.",24,40,"Utah State","UC Irvine",4.5,"400918952"
164,2,"19:44",1184,"Brandon Smith Steal.",24,40,"Utah State","UC Irvine",4.5,"400918952"
165,2,"19:29",1169,"Brandon Smith missed Three Point Jumper.",24,40,"Utah State","UC Irvine",4.5,"400918952"
166,2,"19:29",1169,"Jalen Moore Defensive Rebound.",24,40,"Utah State","UC Irvine",4.5,"400918952"
167,2,"19:11",1151,"Norbert Janicek made Three Point Jumper. Assisted by Jalen Moore.",24,43,"Utah State","UC Irvine",4.5,"400918952"
168,2,"18:43",1123,"Brandon Smith missed Jumper.",24,43,"Utah State","UC Irvine",4.5,"400918952"
169,2,"18:43",1123,"Jonathan Galloway Offensive Rebound.",24,43,"Utah State","UC Irvine",4.5,"400918952"
170,2,"18:39",1119,"Jonathan Galloway missed Jumper.",24,43,"Utah State","UC Irvine",4.5,"400918952"
171,2,"18:39",1119,"Quinn Taylor Defensive Rebound.",24,43,"Utah State","UC Irvine",4.5,"400918952"
172,2,"18:33",1113,"Shane Rector missed Jumper.",24,43,"Utah State","UC Irvine",4.5,"400918952"
173,2,"18:33",1113,"Jonathan Galloway Block.",24,43,"Utah State","UC Irvine",4.5,"400918952"
174,2,"18:31",1111,"Max Hazzard Defensive Rebound.",24,43,"Utah State","UC Irvine",4.5,"400918952"
175,2,"18:19",1099,"Ioannis Dimakopoulos missed Three Point Jumper.",24,43,"Utah State","UC Irvine",4.5,"400918952"
176,2,"18:19",1099,"UC Irvine Offensive Rebound.",24,43,"Utah State","UC Irvine",4.5,"400918952"
177,2,"18:16",1096,"Foul on Quinn Taylor.",24,43,"Utah State","UC Irvine",4.5,"400918952"
178,2,"18:14",1094,"Max Hazzard missed Three Point Jumper.",24,43,"Utah State","UC Irvine",4.5,"400918952"
179,2,"18:14",1094,"Koby McEwen Defensive Rebound.",24,43,"Utah State","UC Irvine",4.5,"400918952"
180,2,"17:45",1065,"Koby McEwen missed Jumper.",24,43,"Utah State","UC Irvine",4.5,"400918952"
181,2,"17:45",1065,"Jonathan Galloway Block.",24,43,"Utah State","UC Irvine",4.5,"400918952"
182,2,"17:43",1063,"Ioannis Dimakopoulos Defensive Rebound.",24,43,"Utah State","UC Irvine",4.5,"400918952"
183,2,"17:39",1059,"Foul on Quinn Taylor.",24,43,"Utah State","UC Irvine",4.5,"400918952"
184,2,"17:39",1059,"Brandon Smith missed Free Throw.",24,43,"Utah State","UC Irvine",4.5,"400918952"
185,2,"17:39",1059,"UC Irvine Deadball Team Rebound.",24,43,"Utah State","UC Irvine",4.5,"400918952"
186,2,"17:39",1059,"Brandon Smith made Free Throw.",25,43,"Utah State","UC Irvine",4.5,"400918952"
187,2,"17:25",1045,"Foul on Tommy Rutherford.",25,43,"Utah State","UC Irvine",4.5,"400918952"
188,2,"17:10",1030,"Foul on Tommy Rutherford.",25,43,"Utah State","UC Irvine",4.5,"400918952"
189,2,"17:10",1030,"Jalen Moore made Free Throw.",25,44,"Utah State","UC Irvine",4.5,"400918952"
190,2,"17:10",1030,"Jalen Moore made Free Throw.",25,45,"Utah State","UC Irvine",4.5,"400918952"
191,2,"16:51",1011,"Ngor Barnaba missed Jumper.",25,45,"Utah State","UC Irvine",4.5,"400918952"
192,2,"16:51",1011,"Evan Leonard Defensive Rebound.",25,45,"Utah State","UC Irvine",4.5,"400918952"
193,2,"16:44",1004,"Norbert Janicek made Layup. Assisted by Jalen Moore.",25,47,"Utah State","UC Irvine",4.5,"400918952"
194,2,"16:31",991,"Eyassu Worku missed Three Point Jumper.",25,47,"Utah State","UC Irvine",4.5,"400918952"
195,2,"16:31",991,"Tommy Rutherford Offensive Rebound.",25,47,"Utah State","UC Irvine",4.5,"400918952"
196,2,"16:26",986,"Jaron Martin made Three Point Jumper. Assisted by Tommy Rutherford.",28,47,"Utah State","UC Irvine",4.5,"400918952"
197,2,"16:09",969,"Norbert Janicek made Jumper.",28,49,"Utah State","UC Irvine",4.5,"400918952"
198,2,"15:47",947,"Eyassu Worku missed Jumper.",28,49,"Utah State","UC Irvine",4.5,"400918952"
199,2,"15:47",947,"Jonathan Galloway Offensive Rebound.",28,49,"Utah State","UC Irvine",4.5,"400918952"
200,2,"15:44",944,"Jonathan Galloway missed Jumper.",28,49,"Utah State","UC Irvine",4.5,"400918952"
201,2,"15:44",944,"Jonathan Galloway Offensive Rebound.",28,49,"Utah State","UC Irvine",4.5,"400918952"
202,2,"15:36",936,"Official TV Timeout",28,49,"Utah State","UC Irvine",4.5,"400918952"
203,2,"15:25",925,"Jaron Martin missed Layup.",28,49,"Utah State","UC Irvine",4.5,"400918952"
204,2,"15:25",925,"Ngor Barnaba Defensive Rebound.",28,49,"Utah State","UC Irvine",4.5,"400918952"
205,2,"15:04",904,"Foul on John Edgar Jr..",28,49,"Utah State","UC Irvine",4.5,"400918952"
206,2,"14:51",891,"Jalen Moore made Jumper. Assisted by Koby McEwen.",28,51,"Utah State","UC Irvine",4.5,"400918952"
207,2,"14:30",870,"Evan Leonard made Free Throw.",30,51,"Utah State","UC Irvine",4.5,"400918952"
208,2,"14:30",870,"Evan Leonard made Free Throw.",29,51,"Utah State","UC Irvine",4.5,"400918952"
209,2,"14:28",868,"Foul on Alexis Dargenton.",30,51,"Utah State","UC Irvine",4.5,"400918952"
210,2,"14:17",857,"Koby McEwen Turnover.",30,51,"Utah State","UC Irvine",4.5,"400918952"
211,2,"14:16",856,"Jaron Martin Steal.",30,51,"Utah State","UC Irvine",4.5,"400918952"
212,2,"13:56",836,"John Edgar Jr. missed Three Point Jumper.",30,51,"Utah State","UC Irvine",4.5,"400918952"
213,2,"13:56",836,"Tommy Rutherford Offensive Rebound.",30,51,"Utah State","UC Irvine",4.5,"400918952"
214,2,"13:54",834,"Foul on Ngor Barnaba.",30,51,"Utah State","UC Irvine",4.5,"400918952"
215,2,"13:49",829,"Foul on Tommy Rutherford.",30,51,"Utah State","UC Irvine",4.5,"400918952"
216,2,"13:49",829,"Tommy Rutherford Turnover.",30,51,"Utah State","UC Irvine",4.5,"400918952"
217,2,"13:38",818,"Sam Merrill missed Three Point Jumper.",30,51,"Utah State","UC Irvine",4.5,"400918952"
218,2,"13:38",818,"Tommy Rutherford Defensive Rebound.",30,51,"Utah State","UC Irvine",4.5,"400918952"
219,2,"13:32",812,"Foul on Alexis Dargenton.",30,51,"Utah State","UC Irvine",4.5,"400918952"
220,2,"13:17",797,"Evan Leonard missed Jumper.",30,51,"Utah State","UC Irvine",4.5,"400918952"
221,2,"13:17",797,"Julion Pearre Defensive Rebound.",30,51,"Utah State","UC Irvine",4.5,"400918952"
222,2,"12:56",776,"Foul on Shane Rector.",30,51,"Utah State","UC Irvine",4.5,"400918952"
223,2,"12:56",776,"Shane Rector Turnover.",30,51,"Utah State","UC Irvine",4.5,"400918952"
224,2,"12:42",762,"John Edgar Jr. made Jumper. Assisted by Eyassu Worku.",32,51,"Utah State","UC Irvine",4.5,"400918952"
225,2,"12:17",737,"Ngor Barnaba made Three Point Jumper. Assisted by Shane Rector.",32,54,"Utah State","UC Irvine",4.5,"400918952"
226,2,"11:54",714,"Eyassu Worku missed Jumper.",32,54,"Utah State","UC Irvine",4.5,"400918952"
227,2,"11:54",714,"Brad Greene Offensive Rebound.",32,54,"Utah State","UC Irvine",4.5,"400918952"
228,2,"11:52",712,"Brad Greene made Jumper.",34,54,"Utah State","UC Irvine",4.5,"400918952"
229,2,"11:52",712,"Foul on Ngor Barnaba.",34,54,"Utah State","UC Irvine",4.5,"400918952"
230,2,"11:52",712,"Official TV Timeout",34,54,"Utah State","UC Irvine",4.5,"400918952"
231,2,"11:52",712,"Brad Greene made Free Throw.",35,54,"Utah State","UC Irvine",4.5,"400918952"
232,2,"11:35",695,"Foul on Evan Leonard.",35,54,"Utah State","UC Irvine",4.5,"400918952"
233,2,"11:28",688,"Alexis Dargenton missed Jumper.",35,54,"Utah State","UC Irvine",4.5,"400918952"
234,2,"11:28",688,"Brad Greene Defensive Rebound.",35,54,"Utah State","UC Irvine",4.5,"400918952"
235,2,"11:10",670,"John Edgar Jr. made Three Point Jumper. Assisted by Max Hazzard.",38,54,"Utah State","UC Irvine",4.5,"400918952"
236,2,"10:47",647,"Koby McEwen made Layup.",38,56,"Utah State","UC Irvine",4.5,"400918952"
237,2,"10:29",629,"Eyassu Worku made Jumper. Assisted by Evan Leonard.",40,56,"Utah State","UC Irvine",4.5,"400918952"
238,2,"10:09",609,"Alexis Dargenton Turnover.",40,56,"Utah State","UC Irvine",4.5,"400918952"
239,2,"10:08",608,"Evan Leonard Steal.",40,56,"Utah State","UC Irvine",4.5,"400918952"
240,2,"10:05",605,"Evan Leonard made Layup.",42,56,"Utah State","UC Irvine",4.5,"400918952"
241,2,"9:46",586,"Foul on John Edgar Jr..",42,56,"Utah State","UC Irvine",4.5,"400918952"
242,2,"9:37",577,"Foul on Evan Leonard.",42,56,"Utah State","UC Irvine",4.5,"400918952"
243,2,"9:37",577,"Jalen Moore made Free Throw.",42,57,"Utah State","UC Irvine",4.5,"400918952"
244,2,"9:37",577,"Jalen Moore made Free Throw.",42,58,"Utah State","UC Irvine",4.5,"400918952"
245,2,"9:37",577,"Utah State  Timeout",42,58,"Utah State","UC Irvine",4.5,"400918952"
246,2,"9:15",555,"Alexis Dargenton missed Three Point Jumper.",42,58,"Utah State","UC Irvine",4.5,"400918952"
247,2,"9:09",549,"John Edgar Jr. missed Three Point Jumper.",42,58,"Utah State","UC Irvine",4.5,"400918952"
248,2,"9:09",549,"Koby McEwen Defensive Rebound.",42,58,"Utah State","UC Irvine",4.5,"400918952"
249,2,"9:05",545,"Sam Merrill missed Three Point Jumper.",42,58,"Utah State","UC Irvine",4.5,"400918952"
250,2,"9:05",545,"UC Irvine Defensive Rebound.",42,58,"Utah State","UC Irvine",4.5,"400918952"
251,2,"8:57",537,"Eyassu Worku Turnover.",42,58,"Utah State","UC Irvine",4.5,"400918952"
252,2,"8:42",522,"Foul on Eyassu Worku.",42,58,"Utah State","UC Irvine",4.5,"400918952"
253,2,"8:42",522,"Norbert Janicek missed Free Throw.",42,58,"Utah State","UC Irvine",4.5,"400918952"
254,2,"8:42",522,"Max Hazzard Defensive Rebound.",42,58,"Utah State","UC Irvine",4.5,"400918952"
255,2,"8:20",500,"Eyassu Worku missed Jumper.",42,58,"Utah State","UC Irvine",4.5,"400918952"
256,2,"8:20",500,"Norbert Janicek Defensive Rebound.",42,58,"Utah State","UC Irvine",4.5,"400918952"
257,2,"8:08",488,"Koby McEwen made Jumper.",42,60,"Utah State","UC Irvine",4.5,"400918952"
258,2,"7:49",469,"Max Hazzard missed Jumper.",42,60,"Utah State","UC Irvine",4.5,"400918952"
259,2,"7:49",469,"Quinn Taylor Defensive Rebound.",42,60,"Utah State","UC Irvine",4.5,"400918952"
260,2,"7:42",462,"Koby McEwen made Layup.",42,62,"Utah State","UC Irvine",4.5,"400918952"
261,2,"7:41",461,"Foul on John Edgar Jr..",42,62,"Utah State","UC Irvine",4.5,"400918952"
262,2,"7:41",461,"Official TV Timeout",42,62,"Utah State","UC Irvine",4.5,"400918952"
