"play_id","half","time_remaining_half","secs_remaining","description","home_score","away_score","away","home","home_favored_by","game_id"
1,1,"20:00",2400,"PLAY",0,0,"Wagner","Connecticut",NA,"400916467"
2,1,"19:43",2383,"Romone Saunders missed Three Point Jumper.",0,0,"Wagner","Connecticut",NA,"400916467"
3,1,"19:43",2383,"Mike Aaman Offensive Rebound.",0,0,"Wagner","Connecticut",NA,"400916467"
4,1,"19:37",2377,"Romone Saunders Turnover.",0,0,"Wagner","Connecticut",NA,"400916467"
5,1,"19:23",2363,"Amida Brimah made Dunk. Assisted by Jalen Adams.",2,0,"Wagner","Connecticut",NA,"400916467"
6,1,"18:55",2335,"Michael Carey missed Jumper.",2,0,"Wagner","Connecticut",NA,"400916467"
7,1,"18:55",2335,"Mike Aaman Offensive Rebound.",2,0,"Wagner","Connecticut",NA,"400916467"
8,1,"18:53",2333,"Mike Aaman made Layup.",2,2,"Wagner","Connecticut",NA,"400916467"
9,1,"18:42",2322,"Terry Larrier missed Three Point Jumper.",2,2,"Wagner","Connecticut",NA,"400916467"
10,1,"18:42",2322,"Romone Saunders Defensive Rebound.",2,2,"Wagner","Connecticut",NA,"400916467"
11,1,"18:10",2290,"Romone Saunders made Jumper.",2,4,"Wagner","Connecticut",NA,"400916467"
12,1,"17:45",2265,"Terry Larrier Turnover.",2,4,"Wagner","Connecticut",NA,"400916467"
13,1,"17:44",2264,"Michael Carey Steal.",2,4,"Wagner","Connecticut",NA,"400916467"
14,1,"17:31",2251,"Foul on Rodney Purvis.",2,4,"Wagner","Connecticut",NA,"400916467"
15,1,"17:16",2236,"Michael Carey made Three Point Jumper. Assisted by Corey Henson.",2,7,"Wagner","Connecticut",NA,"400916467"
16,1,"16:53",2213,"Jalen Adams missed Layup.",2,7,"Wagner","Connecticut",NA,"400916467"
17,1,"16:53",2213,"Wagner Defensive Rebound.",2,7,"Wagner","Connecticut",NA,"400916467"
18,1,"16:53",2213,"Foul on Amida Brimah.",2,7,"Wagner","Connecticut",NA,"400916467"
19,1,"16:32",2192,"Michael Carey missed Layup.",2,7,"Wagner","Connecticut",NA,"400916467"
20,1,"16:32",2192,"Steven Enoch Block.",2,7,"Wagner","Connecticut",NA,"400916467"
21,1,"16:31",2191,"Mike Aaman Offensive Rebound.",2,7,"Wagner","Connecticut",NA,"400916467"
22,1,"16:29",2189,"Mike Aaman missed Layup.",2,7,"Wagner","Connecticut",NA,"400916467"
23,1,"16:29",2189,"Jalen Adams Defensive Rebound.",2,7,"Wagner","Connecticut",NA,"400916467"
24,1,"16:25",2185,"Jalen Adams missed Layup.",2,7,"Wagner","Connecticut",NA,"400916467"
25,1,"16:25",2185,"Terry Larrier Offensive Rebound.",2,7,"Wagner","Connecticut",NA,"400916467"
26,1,"16:22",2182,"Terry Larrier made Two Point Tip Shot.",4,7,"Wagner","Connecticut",NA,"400916467"
27,1,"16:05",2165,"Corey Henson made Jumper.",4,9,"Wagner","Connecticut",NA,"400916467"
28,1,"15:44",2144,"Steven Enoch missed Jumper.",4,9,"Wagner","Connecticut",NA,"400916467"
29,1,"15:44",2144,"Romone Saunders Defensive Rebound.",4,9,"Wagner","Connecticut",NA,"400916467"
30,1,"15:32",2132,"Mike Aaman made Jumper.",4,11,"Wagner","Connecticut",NA,"400916467"
31,1,"15:12",2112,"Terry Larrier made Three Point Jumper. Assisted by Kentan Facey.",7,11,"Wagner","Connecticut",NA,"400916467"
32,1,"14:44",2084,"Mike Aaman made Layup. Assisted by Michael Carey.",7,13,"Wagner","Connecticut",NA,"400916467"
33,1,"14:35",2075,"Terry Larrier missed Three Point Jumper.",7,13,"Wagner","Connecticut",NA,"400916467"
34,1,"14:35",2075,"Connecticut Offensive Rebound.",7,13,"Wagner","Connecticut",NA,"400916467"
35,1,"14:33",2073,"Official TV Timeout",7,13,"Wagner","Connecticut",NA,"400916467"
36,1,"14:11",2051,"Alterique Gilbert made Jumper.",9,13,"Wagner","Connecticut",NA,"400916467"
37,1,"13:51",2031,"Romone Saunders missed Three Point Jumper.",9,13,"Wagner","Connecticut",NA,"400916467"
38,1,"13:51",2031,"Connecticut Defensive Rebound.",9,13,"Wagner","Connecticut",NA,"400916467"
39,1,"13:36",2016,"Steven Enoch missed Jumper.",9,13,"Wagner","Connecticut",NA,"400916467"
40,1,"13:36",2016,"JoJo Cooper Defensive Rebound.",9,13,"Wagner","Connecticut",NA,"400916467"
41,1,"13:09",1989,"Devin Liggeons made Three Point Jumper. Assisted by Romone Saunders.",9,16,"Wagner","Connecticut",NA,"400916467"
42,1,"12:52",1972,"Terry Larrier made Jumper.",11,16,"Wagner","Connecticut",NA,"400916467"
43,1,"12:21",1941,"JoJo Cooper made Three Point Jumper. Assisted by Shack Scott.",11,19,"Wagner","Connecticut",NA,"400916467"
44,1,"12:07",1927,"Terry Larrier missed Jumper.",11,19,"Wagner","Connecticut",NA,"400916467"
45,1,"12:07",1927,"AJ Sumbry Defensive Rebound.",11,19,"Wagner","Connecticut",NA,"400916467"
46,1,"11:42",1902,"AJ Sumbry made Jumper. Assisted by JoJo Cooper.",11,21,"Wagner","Connecticut",NA,"400916467"
47,1,"11:41",1901,"Connecticut  Timeout",11,21,"Wagner","Connecticut",NA,"400916467"
48,1,"11:27",1887,"Alterique Gilbert made Layup.",13,21,"Wagner","Connecticut",NA,"400916467"
49,1,"10:56",1856,"Devin Liggeons missed Three Point Jumper.",13,21,"Wagner","Connecticut",NA,"400916467"
50,1,"10:56",1856,"Connecticut Defensive Rebound.",13,21,"Wagner","Connecticut",NA,"400916467"
51,1,"10:56",1856,"Foul on Shack Scott.",13,21,"Wagner","Connecticut",NA,"400916467"
52,1,"10:38",1838,"Foul on JoJo Cooper.",13,21,"Wagner","Connecticut",NA,"400916467"
53,1,"10:32",1832,"Alterique Gilbert missed Three Point Jumper.",13,21,"Wagner","Connecticut",NA,"400916467"
54,1,"10:32",1832,"Corey Henson Defensive Rebound.",13,21,"Wagner","Connecticut",NA,"400916467"
55,1,"10:12",1812,"Shack Scott missed Layup.",13,21,"Wagner","Connecticut",NA,"400916467"
56,1,"10:12",1812,"Connecticut Defensive Rebound.",13,21,"Wagner","Connecticut",NA,"400916467"
57,1,"10:05",1805,"Foul on Romone Saunders.",13,21,"Wagner","Connecticut",NA,"400916467"
58,1,"9:58",1798,"Rodney Purvis Turnover.",13,21,"Wagner","Connecticut",NA,"400916467"
59,1,"9:57",1797,"Michael Carey Steal.",13,21,"Wagner","Connecticut",NA,"400916467"
60,1,"9:38",1778,"Corey Henson missed Three Point Jumper.",13,21,"Wagner","Connecticut",NA,"400916467"
61,1,"9:38",1778,"Mike Aaman Offensive Rebound.",13,21,"Wagner","Connecticut",NA,"400916467"
62,1,"9:28",1768,"Mike Aaman missed Layup.",13,21,"Wagner","Connecticut",NA,"400916467"
63,1,"9:28",1768,"Amida Brimah Defensive Rebound.",13,21,"Wagner","Connecticut",NA,"400916467"
64,1,"9:18",1758,"Rodney Purvis made Three Point Jumper. Assisted by Alterique Gilbert.",16,21,"Wagner","Connecticut",NA,"400916467"
65,1,"8:49",1729,"Romone Saunders missed Three Point Jumper.",16,21,"Wagner","Connecticut",NA,"400916467"
66,1,"8:49",1729,"Rodney Purvis Defensive Rebound.",16,21,"Wagner","Connecticut",NA,"400916467"
67,1,"8:31",1711,"Foul on JoJo Cooper.",16,21,"Wagner","Connecticut",NA,"400916467"
68,1,"8:31",1711,"Alterique Gilbert made Free Throw.",17,21,"Wagner","Connecticut",NA,"400916467"
69,1,"8:31",1711,"Alterique Gilbert made Free Throw.",18,21,"Wagner","Connecticut",NA,"400916467"
70,1,"8:21",1701,"Mike Aaman made Layup. Assisted by Romone Saunders.",18,23,"Wagner","Connecticut",NA,"400916467"
71,1,"8:21",1701,"Foul on Juwan Durham.",18,23,"Wagner","Connecticut",NA,"400916467"
72,1,"8:21",1701,"Mike Aaman made Free Throw.",18,24,"Wagner","Connecticut",NA,"400916467"
73,1,"7:59",1679,"Rodney Purvis missed Three Point Jumper.",18,24,"Wagner","Connecticut",NA,"400916467"
74,1,"7:59",1679,"Kentan Facey Offensive Rebound.",18,24,"Wagner","Connecticut",NA,"400916467"
75,1,"7:56",1676,"Kentan Facey Turnover.",18,24,"Wagner","Connecticut",NA,"400916467"
76,1,"7:56",1676,"Michael Carey Steal.",18,24,"Wagner","Connecticut",NA,"400916467"
77,1,"7:56",1676,"Wagner  Timeout",18,24,"Wagner","Connecticut",NA,"400916467"
78,1,"7:56",1676,"Wagner  Timeout",18,24,"Wagner","Connecticut",NA,"400916467"
79,1,"7:39",1659,"Corey Henson missed Three Point Jumper.",18,24,"Wagner","Connecticut",NA,"400916467"
80,1,"7:39",1659,"Corey Henson Offensive Rebound.",18,24,"Wagner","Connecticut",NA,"400916467"
81,1,"7:22",1642,"Foul on Rodney Purvis.",18,24,"Wagner","Connecticut",NA,"400916467"
82,1,"7:09",1629,"Michael Carey missed Three Point Jumper.",18,24,"Wagner","Connecticut",NA,"400916467"
83,1,"7:09",1629,"Alterique Gilbert Defensive Rebound.",18,24,"Wagner","Connecticut",NA,"400916467"
84,1,"6:54",1614,"Foul on Marquis Salmon.",18,24,"Wagner","Connecticut",NA,"400916467"
85,1,"6:54",1614,"Terry Larrier missed Free Throw.",18,24,"Wagner","Connecticut",NA,"400916467"
86,1,"6:54",1614,"Connecticut Deadball Team Rebound.",18,24,"Wagner","Connecticut",NA,"400916467"
87,1,"6:54",1614,"Terry Larrier made Free Throw.",19,24,"Wagner","Connecticut",NA,"400916467"
88,1,"6:24",1584,"Romone Saunders made Jumper.",19,26,"Wagner","Connecticut",NA,"400916467"
89,1,"6:14",1574,"Foul on Terry Larrier.",19,26,"Wagner","Connecticut",NA,"400916467"
90,1,"6:14",1574,"Terry Larrier Turnover.",19,26,"Wagner","Connecticut",NA,"400916467"
91,1,"5:48",1548,"Corey Henson missed Three Point Jumper.",19,26,"Wagner","Connecticut",NA,"400916467"
92,1,"5:48",1548,"Vance Jackson Defensive Rebound.",19,26,"Wagner","Connecticut",NA,"400916467"
93,1,"5:35",1535,"Foul on Corey Henson.",19,26,"Wagner","Connecticut",NA,"400916467"
94,1,"5:19",1519,"Alterique Gilbert made Jumper.",21,26,"Wagner","Connecticut",NA,"400916467"
95,1,"4:51",1491,"Foul on Terry Larrier.",21,26,"Wagner","Connecticut",NA,"400916467"
96,1,"4:51",1491,"Devin Liggeons made Free Throw.",21,27,"Wagner","Connecticut",NA,"400916467"
97,1,"4:50",1490,"Devin Liggeons made Free Throw.",21,28,"Wagner","Connecticut",NA,"400916467"
98,1,"4:50",1490,"Devin Liggeons made Free Throw.",21,29,"Wagner","Connecticut",NA,"400916467"
99,1,"4:39",1479,"Jalen Adams missed Three Point Jumper.",21,29,"Wagner","Connecticut",NA,"400916467"
100,1,"4:39",1479,"Marquis Salmon Defensive Rebound.",21,29,"Wagner","Connecticut",NA,"400916467"
101,1,"4:27",1467,"Michael Carey Turnover.",21,29,"Wagner","Connecticut",NA,"400916467"
102,1,"4:26",1466,"Jalen Adams Steal.",21,29,"Wagner","Connecticut",NA,"400916467"
103,1,"4:24",1464,"Jalen Adams made Layup.",23,29,"Wagner","Connecticut",NA,"400916467"
104,1,"4:00",1440,"Devin Liggeons Turnover.",23,29,"Wagner","Connecticut",NA,"400916467"
105,1,"3:59",1439,"Official TV Timeout",23,29,"Wagner","Connecticut",NA,"400916467"
106,1,"3:31",1411,"Jalen Adams made Three Point Jumper.",26,29,"Wagner","Connecticut",NA,"400916467"
107,1,"3:02",1382,"Corey Henson made Jumper.",26,31,"Wagner","Connecticut",NA,"400916467"
108,1,"2:57",1377,"Foul on Corey Henson.",26,31,"Wagner","Connecticut",NA,"400916467"
109,1,"2:57",1377,"Christian Vital made Free Throw.",27,31,"Wagner","Connecticut",NA,"400916467"
110,1,"2:57",1377,"Christian Vital made Free Throw.",28,31,"Wagner","Connecticut",NA,"400916467"
111,1,"2:44",1364,"Foul on Christian Vital.",28,31,"Wagner","Connecticut",NA,"400916467"
112,1,"2:44",1364,"Romone Saunders made Free Throw.",28,32,"Wagner","Connecticut",NA,"400916467"
113,1,"2:44",1364,"Romone Saunders made Free Throw.",28,33,"Wagner","Connecticut",NA,"400916467"
114,1,"2:26",1346,"Amida Brimah made Dunk. Assisted by Jalen Adams.",30,33,"Wagner","Connecticut",NA,"400916467"
115,1,"2:06",1326,"Foul on Alterique Gilbert.",30,33,"Wagner","Connecticut",NA,"400916467"
116,1,"2:06",1326,"JoJo Cooper made Free Throw.",30,34,"Wagner","Connecticut",NA,"400916467"
117,1,"2:06",1326,"JoJo Cooper made Free Throw.",30,35,"Wagner","Connecticut",NA,"400916467"
118,1,"1:50",1310,"Alterique Gilbert missed Layup.",30,35,"Wagner","Connecticut",NA,"400916467"
119,1,"1:50",1310,"AJ Sumbry Block.",30,35,"Wagner","Connecticut",NA,"400916467"
120,1,"1:49",1309,"Amida Brimah Offensive Rebound.",30,35,"Wagner","Connecticut",NA,"400916467"
121,1,"1:43",1303,"Christian Vital made Three Point Jumper. Assisted by Vance Jackson.",33,35,"Wagner","Connecticut",NA,"400916467"
122,1,"1:13",1273,"Michael Carey Turnover.",33,35,"Wagner","Connecticut",NA,"400916467"
123,1,"1:12",1272,"Christian Vital Steal.",33,35,"Wagner","Connecticut",NA,"400916467"
124,1,"1:10",1270,"Christian Vital missed Layup.",33,35,"Wagner","Connecticut",NA,"400916467"
125,1,"1:10",1270,"Vance Jackson Offensive Rebound.",33,35,"Wagner","Connecticut",NA,"400916467"
126,1,"1:05",1265,"Vance Jackson missed Layup.",33,35,"Wagner","Connecticut",NA,"400916467"
127,1,"1:05",1265,"Christian Vital Offensive Rebound.",33,35,"Wagner","Connecticut",NA,"400916467"
128,1,"1:05",1265,"Foul on AJ Sumbry.",33,35,"Wagner","Connecticut",NA,"400916467"
129,1,"1:05",1265,"Vance Jackson made Free Throw.",34,35,"Wagner","Connecticut",NA,"400916467"
130,1,"1:05",1265,"Vance Jackson made Free Throw.",35,35,"Wagner","Connecticut",NA,"400916467"
131,1,"0:43",1243,"Romone Saunders made Three Point Jumper.",35,38,"Wagner","Connecticut",NA,"400916467"
132,1,"0:25",1225,"Christian Vital missed Three Point Jumper.",35,38,"Wagner","Connecticut",NA,"400916467"
133,1,"0:25",1225,"JoJo Cooper Defensive Rebound.",35,38,"Wagner","Connecticut",NA,"400916467"
134,1,"0:00",1200,"Romone Saunders missed Three Point Jumper.",35,38,"Wagner","Connecticut",NA,"400916467"
135,1,"0:00",1200,"Wagner Deadball Team Rebound.",35,38,"Wagner","Connecticut",NA,"400916467"
136,1,"0:00",1200,"End of 1st half",35,38,"Wagner","Connecticut",NA,"400916467"
137,2,"20:00",1200,"PLAY",35,38,"Wagner","Connecticut",NA,"400916467"
138,2,"19:40",1180,"Mike Aaman missed Layup.",35,38,"Wagner","Connecticut",NA,"400916467"
139,2,"19:40",1180,"Terry Larrier Defensive Rebound.",35,38,"Wagner","Connecticut",NA,"400916467"
140,2,"19:32",1172,"Terry Larrier missed Three Point Jumper.",35,38,"Wagner","Connecticut",NA,"400916467"
141,2,"19:32",1172,"Mike Aaman Defensive Rebound.",35,38,"Wagner","Connecticut",NA,"400916467"
142,2,"19:01",1141,"Michael Carey missed Three Point Jumper.",35,38,"Wagner","Connecticut",NA,"400916467"
143,2,"19:01",1141,"Amida Brimah Defensive Rebound.",35,38,"Wagner","Connecticut",NA,"400916467"
144,2,"18:52",1132,"Jalen Adams missed Layup.",35,38,"Wagner","Connecticut",NA,"400916467"
145,2,"18:52",1132,"Marquis Salmon Defensive Rebound.",35,38,"Wagner","Connecticut",NA,"400916467"
146,2,"18:46",1126,"Romone Saunders missed Layup.",35,38,"Wagner","Connecticut",NA,"400916467"
147,2,"18:46",1126,"Wagner Offensive Rebound.",35,38,"Wagner","Connecticut",NA,"400916467"
148,2,"18:32",1112,"Corey Henson made Three Point Jumper. Assisted by Mike Aaman.",35,41,"Wagner","Connecticut",NA,"400916467"
149,2,"18:19",1099,"Terry Larrier missed Jumper.",35,41,"Wagner","Connecticut",NA,"400916467"
150,2,"18:19",1099,"Connecticut Offensive Rebound.",35,41,"Wagner","Connecticut",NA,"400916467"
151,2,"18:08",1088,"Jalen Adams missed Three Point Jumper.",35,41,"Wagner","Connecticut",NA,"400916467"
152,2,"18:08",1088,"Wagner Defensive Rebound.",35,41,"Wagner","Connecticut",NA,"400916467"
153,2,"18:07",1087,"Foul on Kentan Facey.",35,41,"Wagner","Connecticut",NA,"400916467"
154,2,"17:39",1059,"Mike Aaman missed Jumper.",35,41,"Wagner","Connecticut",NA,"400916467"
155,2,"17:39",1059,"Michael Carey Offensive Rebound.",35,41,"Wagner","Connecticut",NA,"400916467"
156,2,"17:35",1055,"Corey Henson missed Three Point Jumper.",35,41,"Wagner","Connecticut",NA,"400916467"
157,2,"17:35",1055,"Rodney Purvis Defensive Rebound.",35,41,"Wagner","Connecticut",NA,"400916467"
158,2,"17:25",1045,"Rodney Purvis Turnover.",35,41,"Wagner","Connecticut",NA,"400916467"
159,2,"16:54",1014,"Michael Carey missed Three Point Jumper.",35,41,"Wagner","Connecticut",NA,"400916467"
160,2,"16:54",1014,"Wagner Deadball Team Rebound.",35,41,"Wagner","Connecticut",NA,"400916467"
161,2,"16:53",1013,"Wagner  Turnover.",35,41,"Wagner","Connecticut",NA,"400916467"
162,2,"16:28",988,"Jalen Adams missed Jumper.",35,41,"Wagner","Connecticut",NA,"400916467"
163,2,"16:28",988,"Corey Henson Defensive Rebound.",35,41,"Wagner","Connecticut",NA,"400916467"
164,2,"16:08",968,"Foul on Terry Larrier.",35,41,"Wagner","Connecticut",NA,"400916467"
165,2,"15:40",940,"Mike Aaman missed Layup.",35,41,"Wagner","Connecticut",NA,"400916467"
166,2,"15:40",940,"Terry Larrier Defensive Rebound.",35,41,"Wagner","Connecticut",NA,"400916467"
167,2,"15:39",939,"Foul on Romone Saunders.",35,41,"Wagner","Connecticut",NA,"400916467"
168,2,"15:39",939,"Official TV Timeout",35,41,"Wagner","Connecticut",NA,"400916467"
169,2,"15:19",919,"Steven Enoch missed Jumper.",35,41,"Wagner","Connecticut",NA,"400916467"
170,2,"15:19",919,"Michael Carey Defensive Rebound.",35,41,"Wagner","Connecticut",NA,"400916467"
171,2,"14:57",897,"Romone Saunders missed Jumper.",35,41,"Wagner","Connecticut",NA,"400916467"
172,2,"14:57",897,"Mike Aaman Offensive Rebound.",35,41,"Wagner","Connecticut",NA,"400916467"
173,2,"14:53",893,"Mike Aaman Turnover.",35,41,"Wagner","Connecticut",NA,"400916467"
174,2,"14:52",892,"Alterique Gilbert Steal.",35,41,"Wagner","Connecticut",NA,"400916467"
175,2,"14:47",887,"Vance Jackson missed Three Point Jumper.",35,41,"Wagner","Connecticut",NA,"400916467"
176,2,"14:47",887,"Steven Enoch Offensive Rebound.",35,41,"Wagner","Connecticut",NA,"400916467"
177,2,"14:43",883,"Steven Enoch missed Layup.",35,41,"Wagner","Connecticut",NA,"400916467"
178,2,"14:43",883,"Jalen Adams Offensive Rebound.",35,41,"Wagner","Connecticut",NA,"400916467"
179,2,"14:41",881,"Jalen Adams made Two Point Tip Shot.",37,41,"Wagner","Connecticut",NA,"400916467"
180,2,"14:10",850,"Romone Saunders made Three Point Jumper. Assisted by JoJo Cooper.",37,44,"Wagner","Connecticut",NA,"400916467"
181,2,"14:00",840,"Jalen Adams missed Layup.",37,44,"Wagner","Connecticut",NA,"400916467"
182,2,"14:00",840,"Steven Enoch Offensive Rebound.",37,44,"Wagner","Connecticut",NA,"400916467"
183,2,"13:59",839,"Steven Enoch missed Two Point Tip Shot.",37,44,"Wagner","Connecticut",NA,"400916467"
184,2,"13:59",839,"Mike Aaman Defensive Rebound.",37,44,"Wagner","Connecticut",NA,"400916467"
185,2,"13:58",838,"Foul on Steven Enoch.",37,44,"Wagner","Connecticut",NA,"400916467"
186,2,"13:53",833,"Foul on Alterique Gilbert.",37,44,"Wagner","Connecticut",NA,"400916467"
187,2,"13:43",823,"Foul on Amida Brimah.",37,44,"Wagner","Connecticut",NA,"400916467"
188,2,"13:43",823,"Devin Liggeons made Free Throw.",37,45,"Wagner","Connecticut",NA,"400916467"
189,2,"13:43",823,"Devin Liggeons made Free Throw.",37,46,"Wagner","Connecticut",NA,"400916467"
190,2,"13:28",808,"Foul on JoJo Cooper.",37,46,"Wagner","Connecticut",NA,"400916467"
191,2,"13:21",801,"Rodney Purvis Turnover.",37,46,"Wagner","Connecticut",NA,"400916467"
192,2,"13:20",800,"Devin Liggeons Steal.",37,46,"Wagner","Connecticut",NA,"400916467"
193,2,"13:08",788,"Romone Saunders made Three Point Jumper. Assisted by JoJo Cooper.",37,49,"Wagner","Connecticut",NA,"400916467"
194,2,"13:00",780,"Connecticut  Timeout",37,49,"Wagner","Connecticut",NA,"400916467"
195,2,"12:50",770,"Terry Larrier Turnover.",37,49,"Wagner","Connecticut",NA,"400916467"
196,2,"12:49",769,"Michael Carey Steal.",37,49,"Wagner","Connecticut",NA,"400916467"
197,2,"12:36",756,"Devin Liggeons Turnover.",37,49,"Wagner","Connecticut",NA,"400916467"
198,2,"12:35",755,"Alterique Gilbert Steal.",37,49,"Wagner","Connecticut",NA,"400916467"
199,2,"12:33",753,"Alterique Gilbert made Layup.",39,49,"Wagner","Connecticut",NA,"400916467"
200,2,"12:10",730,"Romone Saunders Turnover.",39,49,"Wagner","Connecticut",NA,"400916467"
201,2,"11:48",708,"Foul on Corey Henson.",39,49,"Wagner","Connecticut",NA,"400916467"
202,2,"11:48",708,"Official TV Timeout",39,49,"Wagner","Connecticut",NA,"400916467"
203,2,"11:48",708,"Alterique Gilbert missed Free Throw.",39,49,"Wagner","Connecticut",NA,"400916467"
204,2,"11:48",708,"Connecticut Deadball Team Rebound.",39,49,"Wagner","Connecticut",NA,"400916467"
205,2,"11:48",708,"Alterique Gilbert made Free Throw.",40,49,"Wagner","Connecticut",NA,"400916467"
206,2,"11:48",708,"Alterique Gilbert made Free Throw.",41,49,"Wagner","Connecticut",NA,"400916467"
207,2,"11:28",688,"AJ Sumbry missed Layup.",41,49,"Wagner","Connecticut",NA,"400916467"
208,2,"11:28",688,"Jalen Adams Defensive Rebound.",41,49,"Wagner","Connecticut",NA,"400916467"
209,2,"11:23",683,"Jalen Adams Turnover.",41,49,"Wagner","Connecticut",NA,"400916467"
210,2,"11:21",681,"JoJo Cooper Steal.",41,49,"Wagner","Connecticut",NA,"400916467"
211,2,"11:19",679,"Devin Liggeons missed Layup.",41,49,"Wagner","Connecticut",NA,"400916467"
212,2,"11:19",679,"Terry Larrier Defensive Rebound.",41,49,"Wagner","Connecticut",NA,"400916467"
213,2,"11:13",673,"Alterique Gilbert made Layup. Assisted by Terry Larrier.",43,49,"Wagner","Connecticut",NA,"400916467"
214,2,"10:45",645,"Michael Carey Turnover.",43,49,"Wagner","Connecticut",NA,"400916467"
215,2,"10:26",626,"Jalen Adams missed Jumper.",43,49,"Wagner","Connecticut",NA,"400916467"
216,2,"10:26",626,"JoJo Cooper Defensive Rebound.",43,49,"Wagner","Connecticut",NA,"400916467"
217,2,"10:01",601,"Marquis Salmon missed Jumper.",43,49,"Wagner","Connecticut",NA,"400916467"
218,2,"10:01",601,"Amida Brimah Defensive Rebound.",43,49,"Wagner","Connecticut",NA,"400916467"
219,2,"9:51",591,"Foul on Mike Aaman.",43,49,"Wagner","Connecticut",NA,"400916467"
220,2,"9:45",585,"Rodney Purvis missed Three Point Jumper.",43,49,"Wagner","Connecticut",NA,"400916467"
221,2,"9:45",585,"JoJo Cooper Defensive Rebound.",43,49,"Wagner","Connecticut",NA,"400916467"
222,2,"9:29",569,"Corey Henson Turnover.",43,49,"Wagner","Connecticut",NA,"400916467"
223,2,"9:16",556,"Terry Larrier made Three Point Jumper. Assisted by Jalen Adams.",46,49,"Wagner","Connecticut",NA,"400916467"
224,2,"8:45",525,"Marquis Salmon missed Layup.",46,49,"Wagner","Connecticut",NA,"400916467"
225,2,"8:45",525,"Amida Brimah Block.",46,49,"Wagner","Connecticut",NA,"400916467"
226,2,"8:43",523,"Wagner Offensive Rebound.",46,49,"Wagner","Connecticut",NA,"400916467"
227,2,"8:41",521,"JoJo Cooper missed Three Point Jumper.",46,49,"Wagner","Connecticut",NA,"400916467"
228,2,"8:41",521,"Wagner Deadball Team Rebound.",46,49,"Wagner","Connecticut",NA,"400916467"
229,2,"8:39",519,"Wagner  Turnover.",46,49,"Wagner","Connecticut",NA,"400916467"
230,2,"8:25",505,"Foul on Devin Liggeons.",46,49,"Wagner","Connecticut",NA,"400916467"
231,2,"8:07",487,"Amida Brimah missed Jumper.",46,49,"Wagner","Connecticut",NA,"400916467"
232,2,"8:07",487,"Michael Carey Defensive Rebound.",46,49,"Wagner","Connecticut",NA,"400916467"
233,2,"7:45",465,"Devin Liggeons Turnover.",46,49,"Wagner","Connecticut",NA,"400916467"
234,2,"7:44",464,"Official TV Timeout",46,49,"Wagner","Connecticut",NA,"400916467"
235,2,"7:28",448,"Rodney Purvis made Jumper.",48,49,"Wagner","Connecticut",NA,"400916467"
236,2,"7:01",421,"Devin Liggeons missed Three Point Jumper.",48,49,"Wagner","Connecticut",NA,"400916467"
237,2,"7:01",421,"Terry Larrier Defensive Rebound.",48,49,"Wagner","Connecticut",NA,"400916467"
238,2,"6:46",406,"Foul on Michael Carey.",48,49,"Wagner","Connecticut",NA,"400916467"
239,2,"6:46",406,"Terry Larrier made Free Throw.",49,49,"Wagner","Connecticut",NA,"400916467"
240,2,"6:46",406,"Terry Larrier missed Free Throw.",49,49,"Wagner","Connecticut",NA,"400916467"
241,2,"6:46",406,"Mike Aaman Defensive Rebound.",49,49,"Wagner","Connecticut",NA,"400916467"
242,2,"6:19",379,"Marquis Salmon made Three Point Jumper. Assisted by Corey Henson.",49,52,"Wagner","Connecticut",NA,"400916467"
243,2,"6:02",362,"Terry Larrier made Jumper. Assisted by Jalen Adams.",51,52,"Wagner","Connecticut",NA,"400916467"
244,2,"5:36",336,"JoJo Cooper missed Three Point Jumper.",51,52,"Wagner","Connecticut",NA,"400916467"
245,2,"5:36",336,"Marquis Salmon Offensive Rebound.",51,52,"Wagner","Connecticut",NA,"400916467"
246,2,"5:34",334,"Foul on Rodney Purvis.",51,52,"Wagner","Connecticut",NA,"400916467"
247,2,"5:34",334,"Marquis Salmon missed Free Throw.",51,52,"Wagner","Connecticut",NA,"400916467"
248,2,"5:34",334,"Wagner Deadball Team Rebound.",51,52,"Wagner","Connecticut",NA,"400916467"
249,2,"5:34",334,"Marquis Salmon made Free Throw.",51,53,"Wagner","Connecticut",NA,"400916467"
250,2,"5:21",321,"Rodney Purvis missed Layup.",51,53,"Wagner","Connecticut",NA,"400916467"
251,2,"5:21",321,"AJ Sumbry Block.",51,53,"Wagner","Connecticut",NA,"400916467"
252,2,"5:20",320,"Corey Henson Defensive Rebound.",51,53,"Wagner","Connecticut",NA,"400916467"
253,2,"5:00",300,"Michael Carey missed Three Point Jumper.",51,53,"Wagner","Connecticut",NA,"400916467"
254,2,"5:00",300,"Alterique Gilbert Defensive Rebound.",51,53,"Wagner","Connecticut",NA,"400916467"
255,2,"4:53",293,"Foul on AJ Sumbry.",51,53,"Wagner","Connecticut",NA,"400916467"
256,2,"4:53",293,"Kentan Facey missed Free Throw.",51,53,"Wagner","Connecticut",NA,"400916467"
257,2,"4:53",293,"Michael Carey Defensive Rebound.",51,53,"Wagner","Connecticut",NA,"400916467"
258,2,"4:31",271,"AJ Sumbry missed Jumper.",51,53,"Wagner","Connecticut",NA,"400916467"
259,2,"4:31",271,"Terry Larrier Defensive Rebound.",51,53,"Wagner","Connecticut",NA,"400916467"
260,2,"4:22",262,"Rodney Purvis missed Three Point Jumper.",51,53,"Wagner","Connecticut",NA,"400916467"
261,2,"4:22",262,"JoJo Cooper Defensive Rebound.",51,53,"Wagner","Connecticut",NA,"400916467"
262,2,"4:16",256,"Michael Carey made Layup. Assisted by Marquis Salmon.",51,55,"Wagner","Connecticut",NA,"400916467"
263,2,"3:55",235,"Terry Larrier missed Three Point Jumper.",51,55,"Wagner","Connecticut",NA,"400916467"
264,2,"3:55",235,"Kentan Facey Offensive Rebound.",51,55,"Wagner","Connecticut",NA,"400916467"
265,2,"3:53",233,"Official TV Timeout",51,55,"Wagner","Connecticut",NA,"400916467"
266,2,"3:39",219,"Foul on Marquis Salmon.",51,55,"Wagner","Connecticut",NA,"400916467"
267,2,"3:38",218,"Terry Larrier made Free Throw.",52,55,"Wagner","Connecticut",NA,"400916467"
268,2,"3:38",218,"Terry Larrier made Free Throw.",53,55,"Wagner","Connecticut",NA,"400916467"
269,2,"3:14",194,"Corey Henson made Three Point Jumper. Assisted by Mike Aaman.",53,58,"Wagner","Connecticut",NA,"400916467"
270,2,"2:57",177,"Jalen Adams missed Jumper.",53,58,"Wagner","Connecticut",NA,"400916467"
271,2,"2:57",177,"Alterique Gilbert Offensive Rebound.",53,58,"Wagner","Connecticut",NA,"400916467"
272,2,"2:48",168,"Jalen Adams missed Layup.",53,58,"Wagner","Connecticut",NA,"400916467"
