"play_id","half","time_remaining_half","secs_remaining","description","home_score","away_score","away","home","home_favored_by","game_id"
180,2,"15:57",957,"Martez Cameron missed Jumper.",38,43,"Wagner","Morgan State",NA,"400919156"
181,2,"15:57",957,"Phillip Carr Offensive Rebound.",38,43,"Wagner","Morgan State",NA,"400919156"
182,2,"15:53",953,"Phillip Carr made Layup.",40,43,"Wagner","Morgan State",NA,"400919156"
183,2,"15:26",926,"Corey Henson missed Layup.",40,43,"Wagner","Morgan State",NA,"400919156"
184,2,"15:26",926,"David Syfax Block.",40,43,"Wagner","Morgan State",NA,"400919156"
185,2,"15:25",925,"Wagner Offensive Rebound.",40,43,"Wagner","Morgan State",NA,"400919156"
186,2,"15:25",925,"Official TV Timeout",40,43,"Wagner","Morgan State",NA,"400919156"
187,2,"15:23",923,"Michael Carey missed Jumper.",40,43,"Wagner","Morgan State",NA,"400919156"
188,2,"15:23",923,"Isiah Graves Defensive Rebound.",40,43,"Wagner","Morgan State",NA,"400919156"
189,2,"14:59",899,"Foul on Greg Senat.",40,43,"Wagner","Morgan State",NA,"400919156"
190,2,"14:59",899,"David Syfax missed Free Throw.",40,43,"Wagner","Morgan State",NA,"400919156"
191,2,"14:59",899,"Morgan St Deadball Team Rebound.",40,43,"Wagner","Morgan State",NA,"400919156"
192,2,"14:59",899,"David Syfax made Free Throw.",41,43,"Wagner","Morgan State",NA,"400919156"
193,2,"14:42",882,"JoJo Cooper Turnover.",41,43,"Wagner","Morgan State",NA,"400919156"
194,2,"14:40",880,"Martez Cameron Steal.",41,43,"Wagner","Morgan State",NA,"400919156"
195,2,"14:33",873,"Isiah Graves missed Layup.",41,43,"Wagner","Morgan State",NA,"400919156"
196,2,"14:33",873,"AJ Sumbry Block.",41,43,"Wagner","Morgan State",NA,"400919156"
197,2,"14:33",873,"Morgan St Offensive Rebound.",41,43,"Wagner","Morgan State",NA,"400919156"
198,2,"14:14",854,"Foul on AJ Sumbry.",41,43,"Wagner","Morgan State",NA,"400919156"
199,2,"14:09",849,"Isiah Graves made Jumper.",43,43,"Wagner","Morgan State",NA,"400919156"
200,2,"13:46",826,"Corey Henson made Three Point Jumper.",43,46,"Wagner","Morgan State",NA,"400919156"
201,2,"13:31",811,"Kyle Thomas missed Three Point Jumper.",43,46,"Wagner","Morgan State",NA,"400919156"
202,2,"13:31",811,"David Syfax Offensive Rebound.",43,46,"Wagner","Morgan State",NA,"400919156"
203,2,"13:28",808,"David Syfax made Layup.",45,46,"Wagner","Morgan State",NA,"400919156"
204,2,"13:10",790,"Michael Carey missed Three Point Jumper.",45,46,"Wagner","Morgan State",NA,"400919156"
205,2,"13:02",782,"Wagner Offensive Rebound.",45,46,"Wagner","Morgan State",NA,"400919156"
206,2,"12:56",776,"Michael Carey Turnover.",45,46,"Wagner","Morgan State",NA,"400919156"
207,2,"12:36",756,"Isiah Graves missed Three Point Jumper.",45,46,"Wagner","Morgan State",NA,"400919156"
208,2,"12:36",756,"AJ Sumbry Defensive Rebound.",45,46,"Wagner","Morgan State",NA,"400919156"
209,2,"12:29",749,"JoJo Cooper made Layup.",45,48,"Wagner","Morgan State",NA,"400919156"
210,2,"12:17",737,"David Syfax made Three Point Jumper. Assisted by Martez Cameron.",48,48,"Wagner","Morgan State",NA,"400919156"
211,2,"11:45",705,"Shack Scott missed Jumper.",48,48,"Wagner","Morgan State",NA,"400919156"
212,2,"11:45",705,"Martez Cameron Defensive Rebound.",48,48,"Wagner","Morgan State",NA,"400919156"
213,2,"11:38",698,"Foul on Isiah Graves.",48,48,"Wagner","Morgan State",NA,"400919156"
214,2,"11:38",698,"Isiah Graves Turnover.",48,48,"Wagner","Morgan State",NA,"400919156"
215,2,"11:38",698,"Official TV Timeout",48,48,"Wagner","Morgan State",NA,"400919156"
216,2,"11:16",676,"Foul on David Syfax.",48,48,"Wagner","Morgan State",NA,"400919156"
217,2,"11:03",663,"AJ Sumbry made Layup. Assisted by Corey Henson.",48,50,"Wagner","Morgan State",NA,"400919156"
218,2,"10:52",652,"Kyle Thomas missed Jumper.",48,50,"Wagner","Morgan State",NA,"400919156"
219,2,"10:52",652,"JoJo Cooper Defensive Rebound.",48,50,"Wagner","Morgan State",NA,"400919156"
220,2,"10:25",625,"JoJo Cooper missed Jumper.",48,50,"Wagner","Morgan State",NA,"400919156"
221,2,"10:25",625,"AJ Sumbry Offensive Rebound.",48,50,"Wagner","Morgan State",NA,"400919156"
222,2,"10:22",622,"Foul on Phillip Carr.",48,50,"Wagner","Morgan State",NA,"400919156"
223,2,"10:22",622,"AJ Sumbry made Free Throw.",48,51,"Wagner","Morgan State",NA,"400919156"
224,2,"10:22",622,"AJ Sumbry missed Free Throw.",48,51,"Wagner","Morgan State",NA,"400919156"
225,2,"10:22",622,"Phillip Carr Defensive Rebound.",48,51,"Wagner","Morgan State",NA,"400919156"
226,2,"10:03",603,"Foul on Michael Carey.",48,51,"Wagner","Morgan State",NA,"400919156"
227,2,"10:03",603,"Kyle Thomas made Free Throw.",49,51,"Wagner","Morgan State",NA,"400919156"
228,2,"10:03",603,"Kyle Thomas made Free Throw.",50,51,"Wagner","Morgan State",NA,"400919156"
229,2,"9:42",582,"JoJo Cooper missed Three Point Jumper.",50,51,"Wagner","Morgan State",NA,"400919156"
230,2,"9:42",582,"Phillip Carr Defensive Rebound.",50,51,"Wagner","Morgan State",NA,"400919156"
231,2,"9:28",568,"Phillip Carr made Jumper.",52,51,"Wagner","Morgan State",NA,"400919156"
232,2,"9:23",563,"Morgan St  Timeout",52,51,"Wagner","Morgan State",NA,"400919156"
233,2,"9:01",541,"Corey Henson made Three Point Jumper. Assisted by JoJo Cooper.",52,54,"Wagner","Morgan State",NA,"400919156"
234,2,"8:52",532,"Phillip Carr Turnover.",52,54,"Wagner","Morgan State",NA,"400919156"
235,2,"8:52",532,"Foul on Phillip Carr.",52,54,"Wagner","Morgan State",NA,"400919156"
236,2,"8:32",512,"Foul on David Syfax.",52,54,"Wagner","Morgan State",NA,"400919156"
237,2,"8:32",512,"Connor Ferrell missed Free Throw.",52,54,"Wagner","Morgan State",NA,"400919156"
238,2,"8:32",512,"Wagner Deadball Team Rebound.",52,54,"Wagner","Morgan State",NA,"400919156"
239,2,"8:32",512,"Connor Ferrell missed Free Throw.",52,54,"Wagner","Morgan State",NA,"400919156"
240,2,"8:32",512,"Wagner Deadball Team Rebound.",52,54,"Wagner","Morgan State",NA,"400919156"
241,2,"8:32",512,"Connor Ferrell missed Free Throw.",52,54,"Wagner","Morgan State",NA,"400919156"
242,2,"8:32",512,"Alex Ennis Defensive Rebound.",52,54,"Wagner","Morgan State",NA,"400919156"
243,2,"8:13",493,"Martez Cameron Turnover.",52,54,"Wagner","Morgan State",NA,"400919156"
244,2,"7:39",459,"AJ Sumbry Turnover.",52,54,"Wagner","Morgan State",NA,"400919156"
245,2,"7:39",459,"Official TV Timeout",52,54,"Wagner","Morgan State",NA,"400919156"
246,2,"7:15",435,"Isiah Graves made Layup.",54,54,"Wagner","Morgan State",NA,"400919156"
247,2,"7:01",421,"Michael Carey missed Layup.",54,54,"Wagner","Morgan State",NA,"400919156"
248,2,"7:01",421,"AJ Sumbry Offensive Rebound.",54,54,"Wagner","Morgan State",NA,"400919156"
249,2,"6:56",416,"AJ Sumbry missed Layup.",54,54,"Wagner","Morgan State",NA,"400919156"
250,2,"6:56",416,"Alex Ennis Block.",54,54,"Wagner","Morgan State",NA,"400919156"
251,2,"6:51",411,"Phillip Carr Defensive Rebound.",54,54,"Wagner","Morgan State",NA,"400919156"
252,2,"6:48",408,"Foul on Michael Carey.",54,54,"Wagner","Morgan State",NA,"400919156"
253,2,"6:35",395,"Alex Ennis Turnover.",54,54,"Wagner","Morgan State",NA,"400919156"
254,2,"6:32",392,"JoJo Cooper Steal.",54,54,"Wagner","Morgan State",NA,"400919156"
255,2,"6:30",390,"Foul on Martez Cameron.",54,54,"Wagner","Morgan State",NA,"400919156"
256,2,"6:30",390,"JoJo Cooper missed Free Throw.",54,54,"Wagner","Morgan State",NA,"400919156"
257,2,"6:30",390,"Wagner Deadball Team Rebound.",54,54,"Wagner","Morgan State",NA,"400919156"
258,2,"6:30",390,"JoJo Cooper missed Free Throw.",54,54,"Wagner","Morgan State",NA,"400919156"
259,2,"6:30",390,"Isiah Graves Defensive Rebound.",54,54,"Wagner","Morgan State",NA,"400919156"
260,2,"6:20",380,"Kyle Thomas missed Jumper.",54,54,"Wagner","Morgan State",NA,"400919156"
261,2,"6:20",380,"AJ Sumbry Defensive Rebound.",54,54,"Wagner","Morgan State",NA,"400919156"
262,2,"5:52",352,"AJ Sumbry made Layup. Assisted by JoJo Cooper.",54,56,"Wagner","Morgan State",NA,"400919156"
263,2,"5:52",352,"Foul on Kyle Thomas.",54,56,"Wagner","Morgan State",NA,"400919156"
264,2,"5:52",352,"AJ Sumbry missed Free Throw.",54,56,"Wagner","Morgan State",NA,"400919156"
265,2,"5:52",352,"Wagner Offensive Rebound.",54,56,"Wagner","Morgan State",NA,"400919156"
266,2,"5:34",334,"Corey Henson missed Three Point Jumper.",54,56,"Wagner","Morgan State",NA,"400919156"
267,2,"5:34",334,"Shack Scott Offensive Rebound.",54,56,"Wagner","Morgan State",NA,"400919156"
268,2,"5:30",330,"Shack Scott made Layup.",54,58,"Wagner","Morgan State",NA,"400919156"
269,2,"5:15",315,"Foul on Connor Ferrell.",54,58,"Wagner","Morgan State",NA,"400919156"
270,2,"5:15",315,"Alex Ennis made Free Throw.",55,58,"Wagner","Morgan State",NA,"400919156"
271,2,"5:15",315,"Alex Ennis missed Free Throw.",55,58,"Wagner","Morgan State",NA,"400919156"
272,2,"5:15",315,"JoJo Cooper Defensive Rebound.",55,58,"Wagner","Morgan State",NA,"400919156"
273,2,"4:52",292,"Corey Henson missed Layup.",55,58,"Wagner","Morgan State",NA,"400919156"
274,2,"4:52",292,"Martez Cameron Defensive Rebound.",55,58,"Wagner","Morgan State",NA,"400919156"
275,2,"4:43",283,"Foul on Shack Scott.",55,58,"Wagner","Morgan State",NA,"400919156"
276,2,"4:43",283,"Martez Cameron made Free Throw.",56,58,"Wagner","Morgan State",NA,"400919156"
277,2,"4:43",283,"Martez Cameron missed Free Throw.",56,58,"Wagner","Morgan State",NA,"400919156"
278,2,"4:43",283,"JoJo Cooper Defensive Rebound.",56,58,"Wagner","Morgan State",NA,"400919156"
279,2,"4:17",257,"Connor Ferrell missed Three Point Jumper.",56,58,"Wagner","Morgan State",NA,"400919156"
280,2,"4:17",257,"Morgan St Defensive Rebound.",56,58,"Wagner","Morgan State",NA,"400919156"
281,2,"4:11",251,"Foul on Shack Scott.",56,58,"Wagner","Morgan State",NA,"400919156"
282,2,"4:11",251,"Phillip Carr made Free Throw.",57,58,"Wagner","Morgan State",NA,"400919156"
283,2,"4:11",251,"Phillip Carr made Free Throw.",58,58,"Wagner","Morgan State",NA,"400919156"
284,2,"4:01",241,"Shack Scott missed Jumper.",58,58,"Wagner","Morgan State",NA,"400919156"
285,2,"4:01",241,"AJ Sumbry Offensive Rebound.",58,58,"Wagner","Morgan State",NA,"400919156"
286,2,"3:57",237,"AJ Sumbry made Layup.",58,60,"Wagner","Morgan State",NA,"400919156"
287,2,"3:54",234,"Wagner  Timeout",58,60,"Wagner","Morgan State",NA,"400919156"
288,2,"3:36",216,"Kyle Thomas made Jumper. Assisted by Phillip Carr.",60,60,"Wagner","Morgan State",NA,"400919156"
289,2,"3:05",185,"Corey Henson missed Layup.",60,60,"Wagner","Morgan State",NA,"400919156"
290,2,"3:05",185,"Shack Scott Offensive Rebound.",60,60,"Wagner","Morgan State",NA,"400919156"
291,2,"3:01",181,"Shack Scott made Layup.",60,62,"Wagner","Morgan State",NA,"400919156"
292,2,"3:01",181,"Foul on David Syfax.",60,62,"Wagner","Morgan State",NA,"400919156"
293,2,"3:01",181,"Shack Scott missed Free Throw.",60,62,"Wagner","Morgan State",NA,"400919156"
294,2,"3:01",181,"Kyle Thomas Defensive Rebound.",60,62,"Wagner","Morgan State",NA,"400919156"
295,2,"2:46",166,"Phillip Carr made Three Point Jumper. Assisted by Martez Cameron.",63,62,"Wagner","Morgan State",NA,"400919156"
296,2,"2:16",136,"JoJo Cooper missed Three Point Jumper.",63,62,"Wagner","Morgan State",NA,"400919156"
297,2,"2:16",136,"Michael Carey Offensive Rebound.",63,62,"Wagner","Morgan State",NA,"400919156"
298,2,"2:13",133,"Michael Carey made Layup.",63,64,"Wagner","Morgan State",NA,"400919156"
299,2,"2:01",121,"Kyle Thomas missed Jumper.",63,64,"Wagner","Morgan State",NA,"400919156"
300,2,"2:01",121,"Phillip Carr Offensive Rebound.",63,64,"Wagner","Morgan State",NA,"400919156"
301,2,"1:34",94,"Isiah Graves Turnover.",63,64,"Wagner","Morgan State",NA,"400919156"
302,2,"1:32",92,"Michael Carey Steal.",63,64,"Wagner","Morgan State",NA,"400919156"
303,2,"1:10",70,"AJ Sumbry made Layup. Assisted by JoJo Cooper.",63,66,"Wagner","Morgan State",NA,"400919156"
304,2,"0:53",53,"Isiah Graves made Three Point Jumper.",66,66,"Wagner","Morgan State",NA,"400919156"
305,2,"0:22",22,"Foul on Isiah Graves.",66,66,"Wagner","Morgan State",NA,"400919156"
306,2,"0:22",22,"Corey Henson made Free Throw.",66,67,"Wagner","Morgan State",NA,"400919156"
307,2,"0:22",22,"Corey Henson made Free Throw.",66,68,"Wagner","Morgan State",NA,"400919156"
308,2,"0:22",22,"Wagner  Timeout",66,68,"Wagner","Morgan State",NA,"400919156"
309,2,"0:22",22,"Morgan St  Timeout",66,68,"Wagner","Morgan State",NA,"400919156"
310,2,"0:06",6,"David Syfax missed Three Point Jumper.",66,68,"Wagner","Morgan State",NA,"400919156"
311,2,"0:05",5,"Phillip Carr Offensive Rebound.",66,68,"Wagner","Morgan State",NA,"400919156"
312,2,"0:02",2,"Phillip Carr missed Layup.",66,68,"Wagner","Morgan State",NA,"400919156"
313,2,"0:00",0,"Morgan St Offensive Rebound.",66,68,"Wagner","Morgan State",NA,"400919156"
314,2,"0:00",0,"End of Game",66,68,"Wagner","Morgan State",NA,"400919156"
1,1,"20:00",2400,"PLAY",0,0,"Wagner","Providence",NA,"400919160"
2,1,"19:38",2378,"Foul on Michael Carey.",0,0,"Wagner","Providence",NA,"400919160"
3,1,"19:35",2375,"Kyron Cartwright made Three Point Jumper. Assisted by Isaiah Jackson.",3,0,"Wagner","Providence",NA,"400919160"
4,1,"19:10",2350,"Corey Henson made Three Point Jumper.",3,3,"Wagner","Providence",NA,"400919160"
5,1,"18:47",2327,"Isaiah Jackson missed Three Point Jumper.",3,3,"Wagner","Providence",NA,"400919160"
6,1,"18:47",2327,"Michael Carey Defensive Rebound.",3,3,"Wagner","Providence",NA,"400919160"
7,1,"18:41",2321,"Elijah Davis made Layup. Assisted by Michael Carey.",3,5,"Wagner","Providence",NA,"400919160"
8,1,"18:41",2321,"Providence  Timeout",3,5,"Wagner","Providence",NA,"400919160"
9,1,"18:31",2311,"Kyron Cartwright missed Jumper.",3,5,"Wagner","Providence",NA,"400919160"
10,1,"18:31",2311,"Jalen Lindsey Offensive Rebound.",3,5,"Wagner","Providence",NA,"400919160"
11,1,"18:27",2307,"Foul on Elijah Davis.",3,5,"Wagner","Providence",NA,"400919160"
12,1,"18:27",2307,"Jalen Lindsey missed Free Throw.",3,5,"Wagner","Providence",NA,"400919160"
13,1,"18:27",2307,"Providence Deadball Team Rebound.",3,5,"Wagner","Providence",NA,"400919160"
14,1,"18:27",2307,"Jalen Lindsey made Free Throw.",4,5,"Wagner","Providence",NA,"400919160"
15,1,"18:11",2291,"AJ Sumbry missed Jumper.",4,5,"Wagner","Providence",NA,"400919160"
16,1,"18:11",2291,"Rodney Bullock Defensive Rebound.",4,5,"Wagner","Providence",NA,"400919160"
17,1,"18:02",2282,"Isaiah Jackson missed Three Point Jumper.",4,5,"Wagner","Providence",NA,"400919160"
18,1,"18:02",2282,"Elijah Davis Defensive Rebound.",4,5,"Wagner","Providence",NA,"400919160"
19,1,"17:35",2255,"AJ Sumbry Turnover.",4,5,"Wagner","Providence",NA,"400919160"
20,1,"17:33",2253,"Rodney Bullock Turnover.",4,5,"Wagner","Providence",NA,"400919160"
21,1,"17:32",2252,"JoJo Cooper Steal.",4,5,"Wagner","Providence",NA,"400919160"
22,1,"17:09",2229,"Elijah Davis made Jumper.",4,7,"Wagner","Providence",NA,"400919160"
23,1,"16:49",2209,"Emmitt Holt missed Jumper.",4,7,"Wagner","Providence",NA,"400919160"
24,1,"16:49",2209,"Michael Carey Defensive Rebound.",4,7,"Wagner","Providence",NA,"400919160"
25,1,"16:41",2201,"AJ Sumbry missed Layup.",4,7,"Wagner","Providence",NA,"400919160"
26,1,"16:41",2201,"Wagner Offensive Rebound.",4,7,"Wagner","Providence",NA,"400919160"
27,1,"16:19",2179,"JoJo Cooper made Three Point Jumper. Assisted by Corey Henson.",4,10,"Wagner","Providence",NA,"400919160"
28,1,"16:08",2168,"Rodney Bullock missed Jumper.",4,10,"Wagner","Providence",NA,"400919160"
29,1,"16:08",2168,"Providence Offensive Rebound.",4,10,"Wagner","Providence",NA,"400919160"
30,1,"15:46",2146,"Kalif Young made Jumper.",6,10,"Wagner","Providence",NA,"400919160"
31,1,"15:24",2124,"Elijah Davis missed Three Point Jumper.",6,10,"Wagner","Providence",NA,"400919160"
32,1,"15:24",2124,"Jalen Lindsey Defensive Rebound.",6,10,"Wagner","Providence",NA,"400919160"
33,1,"15:22",2122,"Foul on Greg Senat.",6,10,"Wagner","Providence",NA,"400919160"
34,1,"15:22",2122,"Providence  Timeout",6,10,"Wagner","Providence",NA,"400919160"
35,1,"15:03",2103,"Rodney Bullock made Jumper.",8,10,"Wagner","Providence",NA,"400919160"
36,1,"14:36",2076,"Corey Henson Turnover.",8,10,"Wagner","Providence",NA,"400919160"
37,1,"14:34",2074,"Jalen Lindsey Steal.",8,10,"Wagner","Providence",NA,"400919160"
38,1,"14:31",2071,"Rodney Bullock missed Three Point Jumper.",8,10,"Wagner","Providence",NA,"400919160"
39,1,"14:31",2071,"Jalen Lindsey Offensive Rebound.",8,10,"Wagner","Providence",NA,"400919160"
40,1,"14:28",2068,"Jalen Lindsey made Layup.",10,10,"Wagner","Providence",NA,"400919160"
41,1,"13:57",2037,"JoJo Cooper missed Three Point Jumper.",10,10,"Wagner","Providence",NA,"400919160"
42,1,"13:57",2037,"Rodney Bullock Defensive Rebound.",10,10,"Wagner","Providence",NA,"400919160"
43,1,"13:47",2027,"Foul on Corey Henson.",10,10,"Wagner","Providence",NA,"400919160"
44,1,"13:47",2027,"Foul on Connor Ferrell.",10,10,"Wagner","Providence",NA,"400919160"
45,1,"13:44",2024,"Kyron Cartwright missed Jumper.",10,10,"Wagner","Providence",NA,"400919160"
46,1,"13:44",2024,"Corey Henson Defensive Rebound.",10,10,"Wagner","Providence",NA,"400919160"
47,1,"13:19",1999,"Connor Ferrell missed Three Point Jumper.",10,10,"Wagner","Providence",NA,"400919160"
48,1,"13:19",1999,"Providence Defensive Rebound.",10,10,"Wagner","Providence",NA,"400919160"
49,1,"12:57",1977,"Maliek White made Layup.",12,10,"Wagner","Providence",NA,"400919160"
50,1,"12:36",1956,"Shack Scott missed Jumper.",12,10,"Wagner","Providence",NA,"400919160"
51,1,"12:36",1956,"Alpha Diallo Defensive Rebound.",12,10,"Wagner","Providence",NA,"400919160"
52,1,"12:26",1946,"Alpha Diallo Turnover.",12,10,"Wagner","Providence",NA,"400919160"
53,1,"12:00",1920,"Corey Henson missed Jumper.",12,10,"Wagner","Providence",NA,"400919160"
54,1,"12:00",1920,"Rodney Bullock Defensive Rebound.",12,10,"Wagner","Providence",NA,"400919160"
55,1,"11:43",1903,"Rodney Bullock missed Jumper.",12,10,"Wagner","Providence",NA,"400919160"
56,1,"11:43",1903,"Wagner Defensive Rebound.",12,10,"Wagner","Providence",NA,"400919160"
57,1,"11:42",1902,"Foul on Alpha Diallo.",12,10,"Wagner","Providence",NA,"400919160"
58,1,"11:42",1902,"Wagner  Timeout",12,10,"Wagner","Providence",NA,"400919160"
59,1,"11:22",1882,"AJ Sumbry Turnover.",12,10,"Wagner","Providence",NA,"400919160"
60,1,"11:22",1882,"Foul on AJ Sumbry.",12,10,"Wagner","Providence",NA,"400919160"
61,1,"11:07",1867,"Emmitt Holt made Jumper. Assisted by Alpha Diallo.",14,10,"Wagner","Providence",NA,"400919160"
62,1,"10:50",1850,"Michael Carey missed Jumper.",14,10,"Wagner","Providence",NA,"400919160"
63,1,"10:50",1850,"Wagner Offensive Rebound.",14,10,"Wagner","Providence",NA,"400919160"
64,1,"10:42",1842,"Michael Carey missed Layup.",14,10,"Wagner","Providence",NA,"400919160"
65,1,"10:42",1842,"Emmitt Holt Block.",14,10,"Wagner","Providence",NA,"400919160"
66,1,"10:42",1842,"Wagner Offensive Rebound.",14,10,"Wagner","Providence",NA,"400919160"
67,1,"10:26",1826,"JoJo Cooper Turnover.",14,10,"Wagner","Providence",NA,"400919160"
68,1,"10:26",1826,"Alpha Diallo Steal.",14,10,"Wagner","Providence",NA,"400919160"
69,1,"10:15",1815,"Ryan Fazekas missed Three Point Jumper.",14,10,"Wagner","Providence",NA,"400919160"
70,1,"10:15",1815,"Emmitt Holt Offensive Rebound.",14,10,"Wagner","Providence",NA,"400919160"
71,1,"10:13",1813,"Foul on Shack Scott.",14,10,"Wagner","Providence",NA,"400919160"
72,1,"10:13",1813,"Emmitt Holt made Free Throw.",15,10,"Wagner","Providence",NA,"400919160"
73,1,"10:13",1813,"Emmitt Holt made Free Throw.",16,10,"Wagner","Providence",NA,"400919160"
74,1,"9:55",1795,"Mike Aaman missed Layup.",16,10,"Wagner","Providence",NA,"400919160"
75,1,"9:55",1795,"Mike Aaman Offensive Rebound.",16,10,"Wagner","Providence",NA,"400919160"
76,1,"9:53",1793,"Foul on Ryan Fazekas.",16,10,"Wagner","Providence",NA,"400919160"
77,1,"9:41",1781,"Foul on Emmitt Holt.",16,10,"Wagner","Providence",NA,"400919160"
78,1,"9:35",1775,"Mike Aaman missed Jumper.",16,10,"Wagner","Providence",NA,"400919160"
79,1,"9:35",1775,"Emmitt Holt Defensive Rebound.",16,10,"Wagner","Providence",NA,"400919160"
80,1,"9:29",1769,"Alpha Diallo made Jumper. Assisted by Kyron Cartwright.",18,10,"Wagner","Providence",NA,"400919160"
81,1,"9:09",1749,"Foul on Rodney Bullock.",18,10,"Wagner","Providence",NA,"400919160"
82,1,"8:55",1735,"Corey Henson missed Layup.",18,10,"Wagner","Providence",NA,"400919160"
83,1,"8:55",1735,"Kyron Cartwright Defensive Rebound.",18,10,"Wagner","Providence",NA,"400919160"
84,1,"8:48",1728,"Alpha Diallo made Dunk. Assisted by Kyron Cartwright.",20,10,"Wagner","Providence",NA,"400919160"
85,1,"8:20",1700,"Elijah Davis Turnover.",20,10,"Wagner","Providence",NA,"400919160"
86,1,"8:20",1700,"Foul on Elijah Davis.",20,10,"Wagner","Providence",NA,"400919160"
87,1,"7:57",1677,"Jalen Lindsey made Three Point Jumper. Assisted by Kyron Cartwright.",23,10,"Wagner","Providence",NA,"400919160"
88,1,"7:39",1659,"Michael Carey missed Three Point Jumper.",23,10,"Wagner","Providence",NA,"400919160"
89,1,"7:39",1659,"Rodney Bullock Defensive Rebound.",23,10,"Wagner","Providence",NA,"400919160"
90,1,"7:24",1644,"Alpha Diallo made Three Point Jumper. Assisted by Emmitt Holt.",26,10,"Wagner","Providence",NA,"400919160"
91,1,"7:22",1642,"Wagner  Timeout",26,10,"Wagner","Providence",NA,"400919160"
92,1,"7:01",1621,"Corey Henson Turnover.",26,10,"Wagner","Providence",NA,"400919160"
93,1,"7:01",1621,"Kyron Cartwright Turnover.",26,10,"Wagner","Providence",NA,"400919160"
94,1,"6:17",1577,"Corey Henson Turnover.",26,10,"Wagner","Providence",NA,"400919160"
95,1,"6:16",1576,"Alpha Diallo Steal.",26,10,"Wagner","Providence",NA,"400919160"
96,1,"6:14",1574,"Foul on Devin Liggeons.",26,10,"Wagner","Providence",NA,"400919160"
97,1,"6:14",1574,"Jalen Lindsey made Free Throw.",27,10,"Wagner","Providence",NA,"400919160"
98,1,"6:14",1574,"Jalen Lindsey made Free Throw.",28,10,"Wagner","Providence",NA,"400919160"
99,1,"5:56",1556,"Mike Aaman missed Layup.",28,10,"Wagner","Providence",NA,"400919160"
100,1,"5:56",1556,"Kalif Young Defensive Rebound.",28,10,"Wagner","Providence",NA,"400919160"
101,1,"5:49",1549,"Kyron Cartwright Turnover.",28,10,"Wagner","Providence",NA,"400919160"
102,1,"5:49",1549,"Foul on Kyron Cartwright.",28,10,"Wagner","Providence",NA,"400919160"
103,1,"5:29",1529,"Blake Francis missed Three Point Jumper.",28,10,"Wagner","Providence",NA,"400919160"
104,1,"5:29",1529,"Rodney Bullock Block.",28,10,"Wagner","Providence",NA,"400919160"
105,1,"5:29",1529,"Wagner Offensive Rebound.",28,10,"Wagner","Providence",NA,"400919160"
106,1,"5:28",1528,"Foul on Kalif Young.",28,10,"Wagner","Providence",NA,"400919160"
107,1,"5:17",1517,"Michael Carey missed Jumper.",28,10,"Wagner","Providence",NA,"400919160"
108,1,"5:17",1517,"Jalen Lindsey Defensive Rebound.",28,10,"Wagner","Providence",NA,"400919160"
109,1,"5:17",1517,"Foul on AJ Sumbry.",28,10,"Wagner","Providence",NA,"400919160"
110,1,"5:17",1517,"Jalen Lindsey made Free Throw.",29,10,"Wagner","Providence",NA,"400919160"
111,1,"5:17",1517,"Jalen Lindsey made Free Throw.",30,10,"Wagner","Providence",NA,"400919160"
112,1,"4:57",1497,"Ryan Fazekas missed Layup.",30,10,"Wagner","Providence",NA,"400919160"
113,1,"4:57",1497,"JoJo Cooper Defensive Rebound.",30,10,"Wagner","Providence",NA,"400919160"
114,1,"4:45",1485,"Kalif Young made Layup. Assisted by Kyron Cartwright.",32,10,"Wagner","Providence",NA,"400919160"
115,1,"4:24",1464,"Michael Carey missed Jumper.",32,10,"Wagner","Providence",NA,"400919160"
116,1,"4:24",1464,"Rodney Bullock Defensive Rebound.",32,10,"Wagner","Providence",NA,"400919160"
117,1,"4:15",1455,"Jalen Lindsey missed Three Point Jumper.",32,10,"Wagner","Providence",NA,"400919160"
118,1,"4:15",1455,"Corey Henson Defensive Rebound.",32,10,"Wagner","Providence",NA,"400919160"
119,1,"4:06",1446,"Devin Liggeons Turnover.",32,10,"Wagner","Providence",NA,"400919160"
120,1,"4:06",1446,"Foul on Devin Liggeons.",32,10,"Wagner","Providence",NA,"400919160"
121,1,"3:54",1434,"Maliek White made Three Point Jumper. Assisted by Jalen Lindsey.",35,10,"Wagner","Providence",NA,"400919160"
122,1,"3:32",1412,"JoJo Cooper missed Three Point Jumper.",35,10,"Wagner","Providence",NA,"400919160"
123,1,"3:32",1412,"Greg Senat Offensive Rebound.",35,10,"Wagner","Providence",NA,"400919160"
124,1,"3:32",1412,"Foul on Kalif Young.",35,10,"Wagner","Providence",NA,"400919160"
125,1,"3:32",1412,"Wagner  Timeout",35,10,"Wagner","Providence",NA,"400919160"
126,1,"3:32",1412,"Greg Senat made Free Throw.",35,11,"Wagner","Providence",NA,"400919160"
127,1,"3:32",1412,"Greg Senat made Free Throw.",35,12,"Wagner","Providence",NA,"400919160"
128,1,"3:20",1400,"Rodney Bullock made Dunk. Assisted by Kalif Young.",37,12,"Wagner","Providence",NA,"400919160"
129,1,"3:04",1384,"Greg Senat made Layup.",37,14,"Wagner","Providence",NA,"400919160"
130,1,"2:43",1363,"Drew Edwards missed Layup.",37,14,"Wagner","Providence",NA,"400919160"
131,1,"2:43",1363,"Elijah Davis Defensive Rebound.",37,14,"Wagner","Providence",NA,"400919160"
132,1,"2:43",1363,"Foul on Kalif Young.",37,14,"Wagner","Providence",NA,"400919160"
133,1,"2:43",1363,"Elijah Davis missed Free Throw.",37,14,"Wagner","Providence",NA,"400919160"
134,1,"2:43",1363,"Devin Liggeons Offensive Rebound.",37,14,"Wagner","Providence",NA,"400919160"
135,1,"2:43",1363,"Foul on Drew Edwards.",37,14,"Wagner","Providence",NA,"400919160"
136,1,"2:43",1363,"Devin Liggeons made Free Throw.",37,15,"Wagner","Providence",NA,"400919160"
137,1,"2:43",1363,"Devin Liggeons made Free Throw.",37,16,"Wagner","Providence",NA,"400919160"
138,1,"2:34",1354,"Emmitt Holt made Layup. Assisted by Isaiah Jackson.",39,16,"Wagner","Providence",NA,"400919160"
139,1,"2:22",1342,"Elijah Davis missed Layup.",39,16,"Wagner","Providence",NA,"400919160"
140,1,"2:22",1342,"Elijah Davis Offensive Rebound.",39,16,"Wagner","Providence",NA,"400919160"
141,1,"2:20",1340,"Elijah Davis Turnover.",39,16,"Wagner","Providence",NA,"400919160"
142,1,"2:18",1338,"Rodney Bullock Steal.",39,16,"Wagner","Providence",NA,"400919160"
143,1,"2:14",1334,"Emmitt Holt missed Layup.",39,16,"Wagner","Providence",NA,"400919160"
