"play_id","half","time_remaining_half","secs_remaining","description","home_score","away_score","away","home","home_favored_by","game_id"
84,1,"8:58",1738,"TJ Distefano Defensive Rebound.",24,7,"Schreiner","Abilene Christian",NA,"400988949"
85,1,"8:48",1728,"Keenan Gumbs missed Layup.",24,7,"Schreiner","Abilene Christian",NA,"400988949"
86,1,"8:48",1728,"Jalone Friday Defensive Rebound.",24,7,"Schreiner","Abilene Christian",NA,"400988949"
87,1,"8:41",1721,"Tevin Foster missed Jumper.",24,7,"Schreiner","Abilene Christian",NA,"400988949"
88,1,"8:41",1721,"Josh Bashford Defensive Rebound.",24,7,"Schreiner","Abilene Christian",NA,"400988949"
89,1,"8:36",1716,"Josh Bashford Turnover.",24,7,"Schreiner","Abilene Christian",NA,"400988949"
90,1,"8:35",1715,"Tevin Foster Steal.",24,7,"Schreiner","Abilene Christian",NA,"400988949"
91,1,"8:33",1713,"Jaren Lewis made Layup. Assisted by Tevin Foster.",26,7,"Schreiner","Abilene Christian",NA,"400988949"
92,1,"8:14",1694,"Josh Bashford missed Three Point Jumper.",26,7,"Schreiner","Abilene Christian",NA,"400988949"
93,1,"8:14",1694,"Josh Berry Offensive Rebound.",26,7,"Schreiner","Abilene Christian",NA,"400988949"
94,1,"8:12",1692,"Josh Berry made Layup.",26,9,"Schreiner","Abilene Christian",NA,"400988949"
95,1,"7:52",1672,"B.J. Maxwell missed Three Point Jumper.",26,9,"Schreiner","Abilene Christian",NA,"400988949"
96,1,"7:52",1672,"TJ Distefano Defensive Rebound.",26,9,"Schreiner","Abilene Christian",NA,"400988949"
97,1,"7:32",1652,"TJ Distefano missed Three Point Jumper.",26,9,"Schreiner","Abilene Christian",NA,"400988949"
98,1,"7:32",1652,"Jalone Friday Defensive Rebound.",26,9,"Schreiner","Abilene Christian",NA,"400988949"
99,1,"7:22",1642,"Jalone Friday made Three Point Jumper. Assisted by Tevin Foster.",29,9,"Schreiner","Abilene Christian",NA,"400988949"
100,1,"6:59",1619,"Luis Mancillas made Three Point Jumper.",29,12,"Schreiner","Abilene Christian",NA,"400988949"
101,1,"6:57",1617,"Foul on Tevin Foster.",29,12,"Schreiner","Abilene Christian",NA,"400988949"
102,1,"6:57",1617,"Official TV Timeout",29,12,"Schreiner","Abilene Christian",NA,"400988949"
103,1,"6:57",1617,"Luis Mancillas made Free Throw.",29,13,"Schreiner","Abilene Christian",NA,"400988949"
104,1,"6:35",1595,"Foul on Matthew Rindahl.",29,13,"Schreiner","Abilene Christian",NA,"400988949"
105,1,"6:35",1595,"Kolton Kohl missed Free Throw.",29,13,"Schreiner","Abilene Christian",NA,"400988949"
106,1,"6:35",1595,"Abilene Christian Deadball Team Rebound.",29,13,"Schreiner","Abilene Christian",NA,"400988949"
107,1,"6:35",1595,"Kolton Kohl made Free Throw.",30,13,"Schreiner","Abilene Christian",NA,"400988949"
108,1,"6:17",1577,"Paul Wells Turnover.",30,13,"Schreiner","Abilene Christian",NA,"400988949"
109,1,"6:17",1577,"Payten Ricks Steal.",30,13,"Schreiner","Abilene Christian",NA,"400988949"
110,1,"6:02",1562,"Trey Lenox missed Jumper.",30,13,"Schreiner","Abilene Christian",NA,"400988949"
111,1,"6:02",1562,"Chase Pinter Defensive Rebound.",30,13,"Schreiner","Abilene Christian",NA,"400988949"
112,1,"5:39",1539,"Paul Wells missed Jumper.",30,13,"Schreiner","Abilene Christian",NA,"400988949"
113,1,"5:39",1539,"Paul Wells Offensive Rebound.",30,13,"Schreiner","Abilene Christian",NA,"400988949"
114,1,"5:35",1535,"Foul on Trey Lenox.",30,13,"Schreiner","Abilene Christian",NA,"400988949"
115,1,"5:35",1535,"Paul Wells made Free Throw.",30,14,"Schreiner","Abilene Christian",NA,"400988949"
116,1,"5:35",1535,"Paul Wells made Free Throw.",30,15,"Schreiner","Abilene Christian",NA,"400988949"
117,1,"5:18",1518,"Kolton Kohl missed Jumper.",30,15,"Schreiner","Abilene Christian",NA,"400988949"
118,1,"5:18",1518,"Paul Wells Defensive Rebound.",30,15,"Schreiner","Abilene Christian",NA,"400988949"
119,1,"5:08",1508,"Matthew Rindahl made Three Point Jumper. Assisted by Chase Pinter.",30,18,"Schreiner","Abilene Christian",NA,"400988949"
120,1,"4:48",1488,"Kolton Kohl missed Jumper.",30,18,"Schreiner","Abilene Christian",NA,"400988949"
121,1,"4:48",1488,"Chase Pinter Defensive Rebound.",30,18,"Schreiner","Abilene Christian",NA,"400988949"
122,1,"4:39",1479,"Andrew Sparks missed Three Point Jumper.",30,18,"Schreiner","Abilene Christian",NA,"400988949"
123,1,"4:39",1479,"Jaylen Franklin Defensive Rebound.",30,18,"Schreiner","Abilene Christian",NA,"400988949"
124,1,"4:36",1476,"Foul on Chase Pinter.",30,18,"Schreiner","Abilene Christian",NA,"400988949"
125,1,"4:13",1453,"Isaiah Tripp missed Three Point Jumper.",30,18,"Schreiner","Abilene Christian",NA,"400988949"
126,1,"4:13",1453,"Chase Pinter Defensive Rebound.",30,18,"Schreiner","Abilene Christian",NA,"400988949"
127,1,"4:04",1444,"Foul on Kolton Kohl.",30,18,"Schreiner","Abilene Christian",NA,"400988949"
128,1,"4:04",1444,"Matthew Rindahl missed Free Throw.",30,18,"Schreiner","Abilene Christian",NA,"400988949"
129,1,"4:04",1444,"Schreiner Deadball Team Rebound.",30,18,"Schreiner","Abilene Christian",NA,"400988949"
130,1,"4:04",1444,"Matthew Rindahl made Free Throw.",30,19,"Schreiner","Abilene Christian",NA,"400988949"
131,1,"3:56",1436,"Kolton Kohl missed Jumper.",30,19,"Schreiner","Abilene Christian",NA,"400988949"
132,1,"3:56",1436,"Matthew Rindahl Block.",30,19,"Schreiner","Abilene Christian",NA,"400988949"
133,1,"3:55",1435,"Matthew Rindahl Defensive Rebound.",30,19,"Schreiner","Abilene Christian",NA,"400988949"
134,1,"3:49",1429,"Paul Wells Turnover.",30,19,"Schreiner","Abilene Christian",NA,"400988949"
135,1,"3:49",1429,"Official TV Timeout",30,19,"Schreiner","Abilene Christian",NA,"400988949"
136,1,"3:31",1411,"Tevin Foster missed Three Point Jumper.",30,19,"Schreiner","Abilene Christian",NA,"400988949"
137,1,"3:31",1411,"Matthew Rindahl Defensive Rebound.",30,19,"Schreiner","Abilene Christian",NA,"400988949"
138,1,"3:24",1404,"Matthew Rindahl made Three Point Jumper. Assisted by Ellis Jones.",30,22,"Schreiner","Abilene Christian",NA,"400988949"
139,1,"3:00",1380,"Jalone Friday made Jumper. Assisted by Jaren Lewis.",32,22,"Schreiner","Abilene Christian",NA,"400988949"
140,1,"2:39",1359,"Ellis Jones missed Three Point Jumper.",32,22,"Schreiner","Abilene Christian",NA,"400988949"
141,1,"2:39",1359,"Jaylen Franklin Defensive Rebound.",32,22,"Schreiner","Abilene Christian",NA,"400988949"
142,1,"2:31",1351,"Tevin Foster made Layup. Assisted by Jaylen Franklin.",34,22,"Schreiner","Abilene Christian",NA,"400988949"
143,1,"2:31",1351,"Foul on Chase Pinter.",34,22,"Schreiner","Abilene Christian",NA,"400988949"
144,1,"2:31",1351,"Tevin Foster made Free Throw.",35,22,"Schreiner","Abilene Christian",NA,"400988949"
145,1,"2:22",1342,"Foul on Jalone Friday.",35,22,"Schreiner","Abilene Christian",NA,"400988949"
146,1,"2:22",1342,"Paul Wells missed Free Throw.",35,22,"Schreiner","Abilene Christian",NA,"400988949"
147,1,"2:22",1342,"Hayden Howell Defensive Rebound.",35,22,"Schreiner","Abilene Christian",NA,"400988949"
148,1,"2:18",1338,"Foul on Paul Wells.",35,22,"Schreiner","Abilene Christian",NA,"400988949"
149,1,"1:57",1317,"Jaren Lewis Turnover.",35,22,"Schreiner","Abilene Christian",NA,"400988949"
150,1,"1:57",1317,"Matthew Rindahl Steal.",35,22,"Schreiner","Abilene Christian",NA,"400988949"
151,1,"1:36",1296,"Ellis Jones Turnover.",35,22,"Schreiner","Abilene Christian",NA,"400988949"
152,1,"1:35",1295,"Jaylen Franklin Steal.",35,22,"Schreiner","Abilene Christian",NA,"400988949"
153,1,"1:31",1291,"Jaylen Franklin Turnover.",35,22,"Schreiner","Abilene Christian",NA,"400988949"
154,1,"1:30",1290,"Ellis Jones Steal.",35,22,"Schreiner","Abilene Christian",NA,"400988949"
155,1,"1:22",1282,"Matthew Rindahl missed Jumper.",35,22,"Schreiner","Abilene Christian",NA,"400988949"
156,1,"1:22",1282,"Andrew Sparks Offensive Rebound.",35,22,"Schreiner","Abilene Christian",NA,"400988949"
157,1,"1:19",1279,"Andrew Sparks Turnover.",35,22,"Schreiner","Abilene Christian",NA,"400988949"
158,1,"1:18",1278,"Payten Ricks Steal.",35,22,"Schreiner","Abilene Christian",NA,"400988949"
159,1,"1:15",1275,"Tevin Foster made Jumper. Assisted by Payten Ricks.",37,22,"Schreiner","Abilene Christian",NA,"400988949"
160,1,"1:00",1260,"Ellis Jones Turnover.",37,22,"Schreiner","Abilene Christian",NA,"400988949"
161,1,"0:59",1259,"Tevin Foster Steal.",37,22,"Schreiner","Abilene Christian",NA,"400988949"
162,1,"0:54",1254,"Jaren Lewis made Layup. Assisted by Tevin Foster.",39,22,"Schreiner","Abilene Christian",NA,"400988949"
163,1,"0:54",1254,"Foul on Paul Wells.",39,22,"Schreiner","Abilene Christian",NA,"400988949"
164,1,"0:54",1254,"Jaren Lewis made Free Throw.",40,22,"Schreiner","Abilene Christian",NA,"400988949"
165,1,"0:49",1249,"Matthew Rindahl Turnover.",40,22,"Schreiner","Abilene Christian",NA,"400988949"
166,1,"0:19",1219,"Jaylen Franklin made Layup.",42,22,"Schreiner","Abilene Christian",NA,"400988949"
167,1,"0:07",1207,"Foul on Tevin Foster.",42,22,"Schreiner","Abilene Christian",NA,"400988949"
168,1,"0:07",1207,"Schreiner  Timeout",42,22,"Schreiner","Abilene Christian",NA,"400988949"
169,1,"0:07",1207,"Ellis Jones made Free Throw.",42,23,"Schreiner","Abilene Christian",NA,"400988949"
170,1,"0:07",1207,"Ellis Jones made Free Throw.",42,24,"Schreiner","Abilene Christian",NA,"400988949"
171,1,"0:02",1202,"Payten Ricks missed Three Point Jumper.",42,24,"Schreiner","Abilene Christian",NA,"400988949"
172,1,"0:02",1202,"Abilene Christian Offensive Rebound.",42,24,"Schreiner","Abilene Christian",NA,"400988949"
173,1,"0:00",1200,"End of 1st half",42,24,"Schreiner","Abilene Christian",NA,"400988949"
174,2,"20:00",1200,"PLAY",42,24,"Schreiner","Abilene Christian",NA,"400988949"
175,2,"19:51",1191,"Josh Berry Turnover.",42,24,"Schreiner","Abilene Christian",NA,"400988949"
176,2,"19:50",1190,"Jaylen Franklin Steal.",42,24,"Schreiner","Abilene Christian",NA,"400988949"
177,2,"19:35",1175,"Jalone Friday made Jumper.",44,24,"Schreiner","Abilene Christian",NA,"400988949"
178,2,"19:18",1158,"Keenan Gumbs missed Jumper.",44,24,"Schreiner","Abilene Christian",NA,"400988949"
179,2,"19:18",1158,"Jaren Lewis Defensive Rebound.",44,24,"Schreiner","Abilene Christian",NA,"400988949"
180,2,"19:00",1140,"Foul on Josh Berry.",44,24,"Schreiner","Abilene Christian",NA,"400988949"
181,2,"18:45",1125,"Jaren Lewis made Jumper.",46,24,"Schreiner","Abilene Christian",NA,"400988949"
182,2,"18:45",1125,"Foul on Luis Mancillas.",46,24,"Schreiner","Abilene Christian",NA,"400988949"
183,2,"18:45",1125,"Jaren Lewis missed Free Throw.",46,24,"Schreiner","Abilene Christian",NA,"400988949"
184,2,"18:45",1125,"Keenan Gumbs Defensive Rebound.",46,24,"Schreiner","Abilene Christian",NA,"400988949"
185,2,"18:20",1100,"Luis Mancillas missed Jumper.",46,24,"Schreiner","Abilene Christian",NA,"400988949"
186,2,"18:20",1100,"Jalone Friday Block.",46,24,"Schreiner","Abilene Christian",NA,"400988949"
187,2,"18:11",1091,"Payten Ricks Defensive Rebound.",46,24,"Schreiner","Abilene Christian",NA,"400988949"
188,2,"18:05",1085,"Tevin Foster missed Three Point Jumper.",46,24,"Schreiner","Abilene Christian",NA,"400988949"
189,2,"18:05",1085,"Abilene Christian Offensive Rebound.",46,24,"Schreiner","Abilene Christian",NA,"400988949"
190,2,"17:56",1076,"Foul on Josh Berry.",46,24,"Schreiner","Abilene Christian",NA,"400988949"
191,2,"17:53",1073,"Jaylen Franklin Turnover.",46,24,"Schreiner","Abilene Christian",NA,"400988949"
192,2,"17:41",1061,"Foul on Payten Ricks.",46,24,"Schreiner","Abilene Christian",NA,"400988949"
193,2,"17:41",1061,"Josh Bashford missed Free Throw.",46,24,"Schreiner","Abilene Christian",NA,"400988949"
194,2,"17:41",1061,"Schreiner Deadball Team Rebound.",46,24,"Schreiner","Abilene Christian",NA,"400988949"
195,2,"17:41",1061,"Josh Bashford made Free Throw.",46,25,"Schreiner","Abilene Christian",NA,"400988949"
196,2,"17:26",1046,"Jalone Friday made Jumper. Assisted by Payten Ricks.",48,25,"Schreiner","Abilene Christian",NA,"400988949"
197,2,"16:56",1016,"TJ Distefano made Three Point Jumper. Assisted by Luis Mancillas.",48,28,"Schreiner","Abilene Christian",NA,"400988949"
198,2,"16:25",985,"Jaren Lewis made Layup.",50,28,"Schreiner","Abilene Christian",NA,"400988949"
199,2,"16:10",970,"Josh Bashford missed Three Point Jumper.",50,28,"Schreiner","Abilene Christian",NA,"400988949"
200,2,"16:10",970,"Tevin Foster Defensive Rebound.",50,28,"Schreiner","Abilene Christian",NA,"400988949"
201,2,"16:02",962,"Jaylen Franklin missed Three Point Jumper.",50,28,"Schreiner","Abilene Christian",NA,"400988949"
202,2,"16:02",962,"Keenan Gumbs Defensive Rebound.",50,28,"Schreiner","Abilene Christian",NA,"400988949"
203,2,"16:02",962,"Foul on Jaren Lewis.",50,28,"Schreiner","Abilene Christian",NA,"400988949"
204,2,"15:57",957,"TJ Distefano missed Three Point Jumper.",50,28,"Schreiner","Abilene Christian",NA,"400988949"
205,2,"15:57",957,"Jaylen Franklin Defensive Rebound.",50,28,"Schreiner","Abilene Christian",NA,"400988949"
206,2,"15:50",950,"Jaylen Franklin made Dunk. Assisted by Drake Green.",52,28,"Schreiner","Abilene Christian",NA,"400988949"
207,2,"15:35",935,"Foul on Josh Berry.",52,28,"Schreiner","Abilene Christian",NA,"400988949"
208,2,"15:35",935,"Josh Berry Turnover.",52,28,"Schreiner","Abilene Christian",NA,"400988949"
209,2,"15:11",911,"Hayden Howell missed Jumper.",52,28,"Schreiner","Abilene Christian",NA,"400988949"
210,2,"15:11",911,"Luis Mancillas Defensive Rebound.",52,28,"Schreiner","Abilene Christian",NA,"400988949"
211,2,"15:04",904,"Keenan Gumbs made Layup.",52,30,"Schreiner","Abilene Christian",NA,"400988949"
212,2,"14:46",886,"Foul on Hayden Howell.",52,30,"Schreiner","Abilene Christian",NA,"400988949"
213,2,"14:46",886,"Hayden Howell Turnover.",52,30,"Schreiner","Abilene Christian",NA,"400988949"
214,2,"14:25",865,"Foul on B.J. Maxwell.",52,30,"Schreiner","Abilene Christian",NA,"400988949"
215,2,"14:25",865,"Josh Bashford missed Free Throw.",52,30,"Schreiner","Abilene Christian",NA,"400988949"
216,2,"14:25",865,"Schreiner Deadball Team Rebound.",52,30,"Schreiner","Abilene Christian",NA,"400988949"
217,2,"14:25",865,"Josh Bashford made Free Throw.",52,31,"Schreiner","Abilene Christian",NA,"400988949"
218,2,"14:03",843,"Jaylen Franklin missed Jumper.",52,31,"Schreiner","Abilene Christian",NA,"400988949"
219,2,"14:03",843,"Schreiner Defensive Rebound.",52,31,"Schreiner","Abilene Christian",NA,"400988949"
220,2,"13:43",823,"Paul Wells Turnover.",52,31,"Schreiner","Abilene Christian",NA,"400988949"
221,2,"13:42",822,"Drake Green Steal.",52,31,"Schreiner","Abilene Christian",NA,"400988949"
222,2,"13:37",817,"Jaren Lewis made Layup. Assisted by Drake Green.",54,31,"Schreiner","Abilene Christian",NA,"400988949"
223,2,"13:21",801,"Chase Pinter Turnover.",54,31,"Schreiner","Abilene Christian",NA,"400988949"
224,2,"12:57",777,"Foul on Matthew Rindahl.",54,31,"Schreiner","Abilene Christian",NA,"400988949"
225,2,"12:41",761,"Tevin Foster missed Three Point Jumper.",54,31,"Schreiner","Abilene Christian",NA,"400988949"
226,2,"12:41",761,"Schreiner Defensive Rebound.",54,31,"Schreiner","Abilene Christian",NA,"400988949"
227,2,"12:41",761,"Foul on Hayden Howell.",54,31,"Schreiner","Abilene Christian",NA,"400988949"
228,2,"12:28",748,"Brandon Warbrick Turnover.",54,31,"Schreiner","Abilene Christian",NA,"400988949"
229,2,"12:27",747,"Tevin Foster Steal.",54,31,"Schreiner","Abilene Christian",NA,"400988949"
230,2,"12:23",743,"Tevin Foster missed Layup.",54,31,"Schreiner","Abilene Christian",NA,"400988949"
231,2,"12:23",743,"Ellis Jones Block.",54,31,"Schreiner","Abilene Christian",NA,"400988949"
232,2,"12:23",743,"Abilene Christian Offensive Rebound.",54,31,"Schreiner","Abilene Christian",NA,"400988949"
233,2,"12:09",729,"Isaiah Tripp missed Jumper.",54,31,"Schreiner","Abilene Christian",NA,"400988949"
234,2,"12:09",729,"Hayden Howell Offensive Rebound.",54,31,"Schreiner","Abilene Christian",NA,"400988949"
235,2,"12:03",723,"Hayden Howell Turnover.",54,31,"Schreiner","Abilene Christian",NA,"400988949"
236,2,"11:53",713,"Ellis Jones Turnover.",54,31,"Schreiner","Abilene Christian",NA,"400988949"
237,2,"11:51",711,"Jaren Lewis Steal.",54,31,"Schreiner","Abilene Christian",NA,"400988949"
238,2,"11:49",709,"Tevin Foster made Layup. Assisted by Jaren Lewis.",56,31,"Schreiner","Abilene Christian",NA,"400988949"
239,2,"11:30",690,"Foul on Isaiah Tripp.",56,31,"Schreiner","Abilene Christian",NA,"400988949"
240,2,"11:30",690,"Official TV Timeout",56,31,"Schreiner","Abilene Christian",NA,"400988949"
241,2,"11:30",690,"Matthew Rindahl made Free Throw.",56,32,"Schreiner","Abilene Christian",NA,"400988949"
242,2,"11:30",690,"Matthew Rindahl missed Free Throw.",56,32,"Schreiner","Abilene Christian",NA,"400988949"
243,2,"11:30",690,"B.J. Maxwell Defensive Rebound.",56,32,"Schreiner","Abilene Christian",NA,"400988949"
244,2,"11:11",671,"Foul on Brandon Warbrick.",56,32,"Schreiner","Abilene Christian",NA,"400988949"
245,2,"11:11",671,"Hayden Howell missed Free Throw.",56,32,"Schreiner","Abilene Christian",NA,"400988949"
246,2,"11:11",671,"Abilene Christian Deadball Team Rebound.",56,32,"Schreiner","Abilene Christian",NA,"400988949"
247,2,"11:11",671,"Hayden Howell missed Free Throw.",56,32,"Schreiner","Abilene Christian",NA,"400988949"
248,2,"11:11",671,"Andrew Sparks Defensive Rebound.",56,32,"Schreiner","Abilene Christian",NA,"400988949"
249,2,"10:58",658,"Andrew Sparks Turnover.",56,32,"Schreiner","Abilene Christian",NA,"400988949"
250,2,"10:56",656,"B.J. Maxwell Steal.",56,32,"Schreiner","Abilene Christian",NA,"400988949"
251,2,"10:55",655,"B.J. Maxwell made Dunk.",58,32,"Schreiner","Abilene Christian",NA,"400988949"
252,2,"10:40",640,"Foul on Isaiah Tripp.",58,32,"Schreiner","Abilene Christian",NA,"400988949"
253,2,"10:40",640,"Andrew Sparks made Free Throw.",58,33,"Schreiner","Abilene Christian",NA,"400988949"
254,2,"10:40",640,"Andrew Sparks missed Free Throw.",58,33,"Schreiner","Abilene Christian",NA,"400988949"
255,2,"10:40",640,"Hayden Farquhar Defensive Rebound.",58,33,"Schreiner","Abilene Christian",NA,"400988949"
256,2,"10:08",608,"Hayden Farquhar missed Three Point Jumper.",58,33,"Schreiner","Abilene Christian",NA,"400988949"
257,2,"10:08",608,"Andrew Sparks Defensive Rebound.",58,33,"Schreiner","Abilene Christian",NA,"400988949"
258,2,"9:53",593,"Andrew Sparks missed Three Point Jumper.",58,33,"Schreiner","Abilene Christian",NA,"400988949"
259,2,"9:53",593,"Tevin Foster Defensive Rebound.",58,33,"Schreiner","Abilene Christian",NA,"400988949"
260,2,"9:47",587,"Isaiah Tripp Turnover.",58,33,"Schreiner","Abilene Christian",NA,"400988949"
261,2,"9:46",586,"Andrew Sparks Steal.",58,33,"Schreiner","Abilene Christian",NA,"400988949"
262,2,"9:39",579,"Chase Pinter made Three Point Jumper. Assisted by Luis Mancillas.",58,36,"Schreiner","Abilene Christian",NA,"400988949"
263,2,"9:36",576,"Schreiner  Timeout",58,36,"Schreiner","Abilene Christian",NA,"400988949"
264,2,"9:17",557,"Hayden Farquhar missed Three Point Jumper.",58,36,"Schreiner","Abilene Christian",NA,"400988949"
265,2,"9:17",557,"Brandon Warbrick Defensive Rebound.",58,36,"Schreiner","Abilene Christian",NA,"400988949"
266,2,"9:17",557,"Foul on Kolton Kohl.",58,36,"Schreiner","Abilene Christian",NA,"400988949"
267,2,"9:17",557,"Brandon Warbrick missed Free Throw.",58,36,"Schreiner","Abilene Christian",NA,"400988949"
268,2,"9:17",557,"Armaine Ratcliff Offensive Rebound.",58,36,"Schreiner","Abilene Christian",NA,"400988949"
269,2,"9:17",557,"Brandon Warbrick missed Jumper.",58,36,"Schreiner","Abilene Christian",NA,"400988949"
270,2,"9:17",557,"Brandon Warbrick Offensive Rebound.",58,36,"Schreiner","Abilene Christian",NA,"400988949"
271,2,"9:17",557,"Brandon Warbrick missed Three Point Jumper.",58,36,"Schreiner","Abilene Christian",NA,"400988949"
272,2,"9:17",557,"Chase Pinter Offensive Rebound.",58,36,"Schreiner","Abilene Christian",NA,"400988949"
273,2,"9:17",557,"Chase Pinter missed Jumper.",58,36,"Schreiner","Abilene Christian",NA,"400988949"
274,2,"9:17",557,"Hayden Farquhar Defensive Rebound.",58,36,"Schreiner","Abilene Christian",NA,"400988949"
275,2,"8:54",534,"Foul on Hayden Farquhar.",58,36,"Schreiner","Abilene Christian",NA,"400988949"
276,2,"8:54",534,"Hayden Farquhar Turnover.",58,36,"Schreiner","Abilene Christian",NA,"400988949"
277,2,"8:51",531,"Chase Pinter missed Three Point Jumper.",58,36,"Schreiner","Abilene Christian",NA,"400988949"
278,2,"8:51",531,"Armaine Ratcliff Offensive Rebound.",58,36,"Schreiner","Abilene Christian",NA,"400988949"
279,2,"8:46",526,"Brandon Warbrick missed Jumper.",58,36,"Schreiner","Abilene Christian",NA,"400988949"
280,2,"8:46",526,"Kolton Kohl Block.",58,36,"Schreiner","Abilene Christian",NA,"400988949"
281,2,"8:44",524,"Isaiah Tripp Defensive Rebound.",58,36,"Schreiner","Abilene Christian",NA,"400988949"
282,2,"8:41",521,"B.J. Maxwell made Three Point Jumper. Assisted by Isaiah Tripp.",61,36,"Schreiner","Abilene Christian",NA,"400988949"
283,2,"8:40",520,"Foul on Luis Mancillas.",61,36,"Schreiner","Abilene Christian",NA,"400988949"
284,2,"8:40",520,"B.J. Maxwell made Free Throw.",62,36,"Schreiner","Abilene Christian",NA,"400988949"
285,2,"8:08",488,"Luis Mancillas Turnover.",62,36,"Schreiner","Abilene Christian",NA,"400988949"
286,2,"8:07",487,"Isaiah Tripp Steal.",62,36,"Schreiner","Abilene Christian",NA,"400988949"
287,2,"8:03",483,"B.J. Maxwell missed Three Point Jumper.",62,36,"Schreiner","Abilene Christian",NA,"400988949"
288,2,"8:03",483,"Luis Mancillas Defensive Rebound.",62,36,"Schreiner","Abilene Christian",NA,"400988949"
289,2,"7:44",464,"Andrew Sparks missed Jumper.",62,36,"Schreiner","Abilene Christian",NA,"400988949"
290,2,"7:44",464,"Isaiah Tripp Defensive Rebound.",62,36,"Schreiner","Abilene Christian",NA,"400988949"
291,2,"7:39",459,"Isaiah Tripp Turnover.",62,36,"Schreiner","Abilene Christian",NA,"400988949"
292,2,"7:39",459,"Luis Mancillas Steal.",62,36,"Schreiner","Abilene Christian",NA,"400988949"
293,2,"7:14",434,"Andrew Sparks missed Three Point Jumper.",62,36,"Schreiner","Abilene Christian",NA,"400988949"
294,2,"7:14",434,"Isaiah Tripp Defensive Rebound.",62,36,"Schreiner","Abilene Christian",NA,"400988949"
295,2,"7:11",431,"Foul on Chase Pinter.",62,36,"Schreiner","Abilene Christian",NA,"400988949"
296,2,"7:11",431,"Official TV Timeout",62,36,"Schreiner","Abilene Christian",NA,"400988949"
297,2,"7:11",431,"Isaiah Tripp made Free Throw.",63,36,"Schreiner","Abilene Christian",NA,"400988949"
298,2,"7:11",431,"Isaiah Tripp made Free Throw.",64,36,"Schreiner","Abilene Christian",NA,"400988949"
299,2,"6:56",416,"Foul on Josh Bashford.",64,36,"Schreiner","Abilene Christian",NA,"400988949"
300,2,"6:56",416,"Josh Bashford Turnover.",64,36,"Schreiner","Abilene Christian",NA,"400988949"
301,2,"6:39",399,"Hayden Farquhar Turnover.",64,36,"Schreiner","Abilene Christian",NA,"400988949"
302,2,"6:38",398,"Josh Bashford Steal.",64,36,"Schreiner","Abilene Christian",NA,"400988949"
303,2,"6:35",395,"Luis Mancillas Turnover.",64,36,"Schreiner","Abilene Christian",NA,"400988949"
304,2,"6:34",394,"Hayden Farquhar Steal.",64,36,"Schreiner","Abilene Christian",NA,"400988949"
305,2,"6:14",374,"Kolton Kohl missed Jumper.",64,36,"Schreiner","Abilene Christian",NA,"400988949"
306,2,"6:14",374,"Kolton Kohl Offensive Rebound.",64,36,"Schreiner","Abilene Christian",NA,"400988949"
307,2,"6:12",372,"Kolton Kohl missed Jumper.",64,36,"Schreiner","Abilene Christian",NA,"400988949"
308,2,"6:12",372,"Schreiner Defensive Rebound.",64,36,"Schreiner","Abilene Christian",NA,"400988949"
309,2,"5:52",352,"Matthew Rindahl missed Three Point Jumper.",64,36,"Schreiner","Abilene Christian",NA,"400988949"
310,2,"5:52",352,"B.J. Maxwell Defensive Rebound.",64,36,"Schreiner","Abilene Christian",NA,"400988949"
311,2,"5:36",336,"Kolton Kohl Turnover.",64,36,"Schreiner","Abilene Christian",NA,"400988949"
312,2,"5:15",315,"Foul on Kolton Kohl.",64,36,"Schreiner","Abilene Christian",NA,"400988949"
313,2,"5:15",315,"Matthew Rindahl made Free Throw.",64,37,"Schreiner","Abilene Christian",NA,"400988949"
314,2,"5:15",315,"Matthew Rindahl made Free Throw.",64,38,"Schreiner","Abilene Christian",NA,"400988949"
315,2,"5:01",301,"Trey Lenox missed Layup.",64,38,"Schreiner","Abilene Christian",NA,"400988949"
316,2,"5:01",301,"Trey Lenox Offensive Rebound.",64,38,"Schreiner","Abilene Christian",NA,"400988949"
317,2,"4:57",297,"Trey Lenox missed Layup.",64,38,"Schreiner","Abilene Christian",NA,"400988949"
318,2,"4:57",297,"B.J. Maxwell Offensive Rebound.",64,38,"Schreiner","Abilene Christian",NA,"400988949"
319,2,"4:54",294,"B.J. Maxwell missed Jumper.",64,38,"Schreiner","Abilene Christian",NA,"400988949"
320,2,"4:54",294,"Matthew Rindahl Block.",64,38,"Schreiner","Abilene Christian",NA,"400988949"
321,2,"4:53",293,"Keenan Gumbs Defensive Rebound.",64,38,"Schreiner","Abilene Christian",NA,"400988949"
322,2,"4:52",292,"Foul on B.J. Maxwell.",64,38,"Schreiner","Abilene Christian",NA,"400988949"
323,2,"4:52",292,"Keenan Gumbs made Free Throw.",64,39,"Schreiner","Abilene Christian",NA,"400988949"
324,2,"4:52",292,"Keenan Gumbs missed Free Throw.",64,39,"Schreiner","Abilene Christian",NA,"400988949"
325,2,"4:52",292,"Trey Lenox Defensive Rebound.",64,39,"Schreiner","Abilene Christian",NA,"400988949"
326,2,"4:36",276,"Hayden Farquhar missed Three Point Jumper.",64,39,"Schreiner","Abilene Christian",NA,"400988949"
327,2,"4:36",276,"Josh Bashford Defensive Rebound.",64,39,"Schreiner","Abilene Christian",NA,"400988949"
328,2,"4:21",261,"Foul on Hayden Farquhar.",64,39,"Schreiner","Abilene Christian",NA,"400988949"
329,2,"4:21",261,"Josh Bashford missed Free Throw.",64,39,"Schreiner","Abilene Christian",NA,"400988949"
330,2,"4:21",261,"Schreiner Deadball Team Rebound.",64,39,"Schreiner","Abilene Christian",NA,"400988949"
331,2,"4:21",261,"Josh Bashford missed Free Throw.",64,39,"Schreiner","Abilene Christian",NA,"400988949"
332,2,"4:21",261,"Trey Lenox Defensive Rebound.",64,39,"Schreiner","Abilene Christian",NA,"400988949"
333,2,"4:11",251,"Foul on Matthew Rindahl.",64,39,"Schreiner","Abilene Christian",NA,"400988949"
