"play_id","half","time_remaining_half","secs_remaining","description","home_score","away_score","away","home","home_favored_by","game_id"
363,2,"0:29",29,"Garrison Mathews made Free Throw.",64,60,"Abilene Christian","Lipscomb",NA,"400988978"
364,2,"0:23",23,"Jaylen Franklin missed Layup.",64,60,"Abilene Christian","Lipscomb",NA,"400988978"
365,2,"0:23",23,"Rob Marberry Defensive Rebound.",64,60,"Abilene Christian","Lipscomb",NA,"400988978"
366,2,"0:18",18,"Foul on Tevin Foster.",64,60,"Abilene Christian","Lipscomb",NA,"400988978"
367,2,"0:18",18,"Kenny Cooper made Free Throw.",65,60,"Abilene Christian","Lipscomb",NA,"400988978"
368,2,"0:18",18,"Kenny Cooper missed Free Throw.",65,60,"Abilene Christian","Lipscomb",NA,"400988978"
369,2,"0:18",18,"Payten Ricks Defensive Rebound.",65,60,"Abilene Christian","Lipscomb",NA,"400988978"
370,2,"0:14",14,"Payten Ricks made Three Point Jumper.",65,63,"Abilene Christian","Lipscomb",NA,"400988978"
371,2,"0:13",13,"Abilene Christian  Timeout",65,63,"Abilene Christian","Lipscomb",NA,"400988978"
372,2,"0:10",10,"Foul on Jaylen Franklin.",65,63,"Abilene Christian","Lipscomb",NA,"400988978"
373,2,"0:10",10,"Michael Buckland made Free Throw.",66,63,"Abilene Christian","Lipscomb",NA,"400988978"
374,2,"0:10",10,"Michael Buckland made Free Throw.",67,63,"Abilene Christian","Lipscomb",NA,"400988978"
375,2,"0:06",6,"Payten Ricks missed Three Point Jumper.",67,63,"Abilene Christian","Lipscomb",NA,"400988978"
376,2,"0:06",6,"Jalone Friday Offensive Rebound.",67,63,"Abilene Christian","Lipscomb",NA,"400988978"
377,2,"0:01",1,"Jalone Friday made Jumper.",67,65,"Abilene Christian","Lipscomb",NA,"400988978"
378,2,"0:00",0,"End of Game",67,65,"Abilene Christian","Lipscomb",NA,"400988978"
1,1,"20:00",2400,"PLAY",0,0,"Arlington Baptist","Abilene Christian",NA,"400988982"
2,1,"19:48",2388,"Jalone Friday missed Three Point Jumper.",0,0,"Arlington Baptist","Abilene Christian",NA,"400988982"
3,1,"19:48",2388,"Markel Semien Defensive Rebound.",0,0,"Arlington Baptist","Abilene Christian",NA,"400988982"
4,1,"19:36",2376,"Quinton Moore Turnover.",0,0,"Arlington Baptist","Abilene Christian",NA,"400988982"
5,1,"19:35",2375,"Jaren Lewis Steal.",0,0,"Arlington Baptist","Abilene Christian",NA,"400988982"
6,1,"19:34",2374,"Jaren Lewis made Layup.",2,0,"Arlington Baptist","Abilene Christian",NA,"400988982"
7,1,"19:08",2348,"Kel Wallace made Jumper. Assisted by Markel Semien.",2,2,"Arlington Baptist","Abilene Christian",NA,"400988982"
8,1,"18:52",2332,"Jalone Friday Turnover.",2,2,"Arlington Baptist","Abilene Christian",NA,"400988982"
9,1,"18:30",2310,"Bryce Morgan made Layup.",2,4,"Arlington Baptist","Abilene Christian",NA,"400988982"
10,1,"18:11",2291,"Payten Ricks made Three Point Jumper. Assisted by Jaren Lewis.",5,4,"Arlington Baptist","Abilene Christian",NA,"400988982"
11,1,"17:57",2277,"Kel Wallace Turnover.",5,4,"Arlington Baptist","Abilene Christian",NA,"400988982"
12,1,"17:48",2268,"Foul on Jalone Friday.",5,4,"Arlington Baptist","Abilene Christian",NA,"400988982"
13,1,"17:48",2268,"Jalone Friday Turnover.",5,4,"Arlington Baptist","Abilene Christian",NA,"400988982"
14,1,"17:42",2262,"Markel Semien Turnover.",5,4,"Arlington Baptist","Abilene Christian",NA,"400988982"
15,1,"17:42",2262,"Jaren Lewis Steal.",5,4,"Arlington Baptist","Abilene Christian",NA,"400988982"
16,1,"17:40",2260,"Jaren Lewis made Layup.",7,4,"Arlington Baptist","Abilene Christian",NA,"400988982"
17,1,"17:28",2248,"Bryce Morgan made Layup.",7,6,"Arlington Baptist","Abilene Christian",NA,"400988982"
18,1,"17:19",2239,"Jalone Friday made Jumper.",9,6,"Arlington Baptist","Abilene Christian",NA,"400988982"
19,1,"17:06",2226,"Kel Wallace Turnover.",9,6,"Arlington Baptist","Abilene Christian",NA,"400988982"
20,1,"17:05",2225,"Payten Ricks Steal.",9,6,"Arlington Baptist","Abilene Christian",NA,"400988982"
21,1,"17:00",2220,"Jalone Friday missed Three Point Jumper.",9,6,"Arlington Baptist","Abilene Christian",NA,"400988982"
22,1,"17:00",2220,"Abilene Christian Offensive Rebound.",9,6,"Arlington Baptist","Abilene Christian",NA,"400988982"
23,1,"16:52",2212,"Tevin Foster missed Three Point Jumper.",9,6,"Arlington Baptist","Abilene Christian",NA,"400988982"
24,1,"16:52",2212,"Jalone Friday Offensive Rebound.",9,6,"Arlington Baptist","Abilene Christian",NA,"400988982"
25,1,"16:48",2208,"Jalone Friday made Layup.",11,6,"Arlington Baptist","Abilene Christian",NA,"400988982"
26,1,"16:32",2192,"Kel Wallace Turnover.",11,6,"Arlington Baptist","Abilene Christian",NA,"400988982"
27,1,"16:12",2172,"Hayden Farquhar missed Three Point Jumper.",11,6,"Arlington Baptist","Abilene Christian",NA,"400988982"
28,1,"16:12",2172,"Markel Semien Defensive Rebound.",11,6,"Arlington Baptist","Abilene Christian",NA,"400988982"
29,1,"16:09",2169,"Markel Semien missed Jumper.",11,6,"Arlington Baptist","Abilene Christian",NA,"400988982"
30,1,"16:09",2169,"Hayden Farquhar Block.",11,6,"Arlington Baptist","Abilene Christian",NA,"400988982"
31,1,"16:07",2167,"Hayden Farquhar Defensive Rebound.",11,6,"Arlington Baptist","Abilene Christian",NA,"400988982"
32,1,"15:54",2154,"Jalone Friday missed Jumper.",11,6,"Arlington Baptist","Abilene Christian",NA,"400988982"
33,1,"15:54",2154,"Arlington Baptist Defensive Rebound.",11,6,"Arlington Baptist","Abilene Christian",NA,"400988982"
34,1,"15:54",2154,"Official TV Timeout",11,6,"Arlington Baptist","Abilene Christian",NA,"400988982"
35,1,"15:35",2135,"Markel Semien missed Jumper.",11,6,"Arlington Baptist","Abilene Christian",NA,"400988982"
36,1,"15:35",2135,"Kel Wallace Offensive Rebound.",11,6,"Arlington Baptist","Abilene Christian",NA,"400988982"
37,1,"15:32",2132,"Kel Wallace made Layup.",11,8,"Arlington Baptist","Abilene Christian",NA,"400988982"
38,1,"15:18",2118,"Tevin Foster missed Three Point Jumper.",11,8,"Arlington Baptist","Abilene Christian",NA,"400988982"
39,1,"15:18",2118,"Markel Semien Defensive Rebound.",11,8,"Arlington Baptist","Abilene Christian",NA,"400988982"
40,1,"15:02",2102,"Quinton Moore made Three Point Jumper. Assisted by Bryce Morgan.",11,11,"Arlington Baptist","Abilene Christian",NA,"400988982"
41,1,"14:48",2088,"Payten Ricks made Three Point Jumper. Assisted by Jaylen Franklin.",14,11,"Arlington Baptist","Abilene Christian",NA,"400988982"
42,1,"14:27",2067,"Eric Wood missed Three Point Jumper.",14,11,"Arlington Baptist","Abilene Christian",NA,"400988982"
43,1,"14:27",2067,"Jalone Friday Defensive Rebound.",14,11,"Arlington Baptist","Abilene Christian",NA,"400988982"
44,1,"14:19",2059,"Foul on Quinton Moore.",14,11,"Arlington Baptist","Abilene Christian",NA,"400988982"
45,1,"14:19",2059,"Tevin Foster made Free Throw.",15,11,"Arlington Baptist","Abilene Christian",NA,"400988982"
46,1,"14:19",2059,"Tevin Foster missed Free Throw.",15,11,"Arlington Baptist","Abilene Christian",NA,"400988982"
47,1,"14:19",2059,"Kennedy Jones Defensive Rebound.",15,11,"Arlington Baptist","Abilene Christian",NA,"400988982"
48,1,"14:06",2046,"Kel Wallace Turnover.",15,11,"Arlington Baptist","Abilene Christian",NA,"400988982"
49,1,"14:04",2044,"Jaren Lewis Steal.",15,11,"Arlington Baptist","Abilene Christian",NA,"400988982"
50,1,"14:01",2041,"Jaylen Franklin made Layup. Assisted by Tevin Foster.",17,11,"Arlington Baptist","Abilene Christian",NA,"400988982"
51,1,"13:42",2022,"Foul on Tevin Foster.",17,11,"Arlington Baptist","Abilene Christian",NA,"400988982"
52,1,"13:24",2004,"Eric Wood missed Three Point Jumper.",17,11,"Arlington Baptist","Abilene Christian",NA,"400988982"
53,1,"13:24",2004,"B.J. Maxwell Block.",17,11,"Arlington Baptist","Abilene Christian",NA,"400988982"
54,1,"13:23",2003,"Arlington Baptist Offensive Rebound.",17,11,"Arlington Baptist","Abilene Christian",NA,"400988982"
55,1,"13:22",2002,"Markel Semien Turnover.",17,11,"Arlington Baptist","Abilene Christian",NA,"400988982"
56,1,"13:21",2001,"Jaren Lewis Steal.",17,11,"Arlington Baptist","Abilene Christian",NA,"400988982"
57,1,"13:20",2000,"Jaren Lewis made Dunk.",19,11,"Arlington Baptist","Abilene Christian",NA,"400988982"
58,1,"13:03",1983,"Kennedy Jones made Layup.",19,13,"Arlington Baptist","Abilene Christian",NA,"400988982"
59,1,"12:49",1969,"Jaren Lewis Turnover.",19,13,"Arlington Baptist","Abilene Christian",NA,"400988982"
60,1,"12:32",1952,"Markel Semien missed Layup.",19,13,"Arlington Baptist","Abilene Christian",NA,"400988982"
61,1,"12:32",1952,"Payten Ricks Defensive Rebound.",19,13,"Arlington Baptist","Abilene Christian",NA,"400988982"
62,1,"12:27",1947,"Hayden Farquhar made Layup. Assisted by B.J. Maxwell.",21,13,"Arlington Baptist","Abilene Christian",NA,"400988982"
63,1,"12:03",1923,"Markel Semien made Three Point Jumper.",21,16,"Arlington Baptist","Abilene Christian",NA,"400988982"
64,1,"11:43",1903,"Hayden Farquhar Turnover.",21,16,"Arlington Baptist","Abilene Christian",NA,"400988982"
65,1,"11:42",1902,"Jashun Petite Steal.",21,16,"Arlington Baptist","Abilene Christian",NA,"400988982"
66,1,"11:29",1889,"Official TV Timeout",21,16,"Arlington Baptist","Abilene Christian",NA,"400988982"
67,1,"11:29",1889,"Markel Semien missed Jumper.",21,16,"Arlington Baptist","Abilene Christian",NA,"400988982"
68,1,"11:29",1889,"Hayden Howell Defensive Rebound.",21,16,"Arlington Baptist","Abilene Christian",NA,"400988982"
69,1,"11:29",1889,"Payten Ricks made Jumper. Assisted by Isaiah Tripp.",23,16,"Arlington Baptist","Abilene Christian",NA,"400988982"
70,1,"10:54",1854,"Jashun Petite Turnover.",23,16,"Arlington Baptist","Abilene Christian",NA,"400988982"
71,1,"10:54",1854,"Isaiah Tripp Steal.",23,16,"Arlington Baptist","Abilene Christian",NA,"400988982"
72,1,"10:51",1851,"Isaiah Tripp made Layup. Assisted by Drake Green.",25,16,"Arlington Baptist","Abilene Christian",NA,"400988982"
73,1,"10:28",1828,"Markel Semien missed Jumper.",25,16,"Arlington Baptist","Abilene Christian",NA,"400988982"
74,1,"10:28",1828,"Hayden Howell Defensive Rebound.",25,16,"Arlington Baptist","Abilene Christian",NA,"400988982"
75,1,"10:14",1814,"Drake Green made Three Point Jumper. Assisted by Hayden Howell.",28,16,"Arlington Baptist","Abilene Christian",NA,"400988982"
76,1,"9:45",1785,"Markel Semien missed Three Point Jumper.",28,16,"Arlington Baptist","Abilene Christian",NA,"400988982"
77,1,"9:45",1785,"Kel Wallace Offensive Rebound.",28,16,"Arlington Baptist","Abilene Christian",NA,"400988982"
78,1,"9:42",1782,"Foul on Payten Ricks.",28,16,"Arlington Baptist","Abilene Christian",NA,"400988982"
79,1,"9:26",1766,"Eric Wood Turnover.",28,16,"Arlington Baptist","Abilene Christian",NA,"400988982"
80,1,"9:25",1765,"Hayden Howell Steal.",28,16,"Arlington Baptist","Abilene Christian",NA,"400988982"
81,1,"9:21",1761,"Drake Green made Three Point Jumper. Assisted by Payten Ricks.",31,16,"Arlington Baptist","Abilene Christian",NA,"400988982"
82,1,"8:52",1732,"Markel Semien missed Jumper.",31,16,"Arlington Baptist","Abilene Christian",NA,"400988982"
83,1,"8:52",1732,"Trey Lenox Defensive Rebound.",31,16,"Arlington Baptist","Abilene Christian",NA,"400988982"
84,1,"8:50",1730,"Trey Lenox Turnover.",31,16,"Arlington Baptist","Abilene Christian",NA,"400988982"
85,1,"8:49",1729,"Kel Wallace Steal.",31,16,"Arlington Baptist","Abilene Christian",NA,"400988982"
86,1,"8:46",1726,"Kel Wallace missed Jumper.",31,16,"Arlington Baptist","Abilene Christian",NA,"400988982"
87,1,"8:46",1726,"Drake Green Defensive Rebound.",31,16,"Arlington Baptist","Abilene Christian",NA,"400988982"
88,1,"8:32",1712,"Hayden Howell made Jumper. Assisted by Payten Ricks.",33,16,"Arlington Baptist","Abilene Christian",NA,"400988982"
89,1,"8:06",1686,"Eric Wood Turnover.",33,16,"Arlington Baptist","Abilene Christian",NA,"400988982"
90,1,"8:05",1685,"Jaylen Franklin Steal.",33,16,"Arlington Baptist","Abilene Christian",NA,"400988982"
91,1,"7:55",1675,"Payten Ricks missed Three Point Jumper.",33,16,"Arlington Baptist","Abilene Christian",NA,"400988982"
92,1,"7:55",1675,"Hayden Howell Offensive Rebound.",33,16,"Arlington Baptist","Abilene Christian",NA,"400988982"
93,1,"7:54",1674,"Jaylen Franklin made Layup. Assisted by Hayden Howell.",35,16,"Arlington Baptist","Abilene Christian",NA,"400988982"
94,1,"7:54",1674,"Official TV Timeout",35,16,"Arlington Baptist","Abilene Christian",NA,"400988982"
95,1,"7:28",1648,"Bryce Morgan made Layup. Assisted by Bryce Morgan.",35,18,"Arlington Baptist","Abilene Christian",NA,"400988982"
96,1,"7:16",1636,"Jalone Friday made Three Point Jumper. Assisted by Tevin Foster.",38,18,"Arlington Baptist","Abilene Christian",NA,"400988982"
97,1,"6:57",1617,"Eric Wood made Three Point Jumper. Assisted by Jashun Petite.",38,21,"Arlington Baptist","Abilene Christian",NA,"400988982"
98,1,"6:39",1599,"Jaylen Franklin made Jumper.",40,21,"Arlington Baptist","Abilene Christian",NA,"400988982"
99,1,"6:12",1572,"Eric Wood Turnover.",40,21,"Arlington Baptist","Abilene Christian",NA,"400988982"
100,1,"6:12",1572,"Jalone Friday Steal.",40,21,"Arlington Baptist","Abilene Christian",NA,"400988982"
101,1,"5:54",1554,"Payten Ricks missed Jumper.",40,21,"Arlington Baptist","Abilene Christian",NA,"400988982"
102,1,"5:54",1554,"Jalone Friday Offensive Rebound.",40,21,"Arlington Baptist","Abilene Christian",NA,"400988982"
103,1,"5:54",1554,"Jalone Friday Turnover.",40,21,"Arlington Baptist","Abilene Christian",NA,"400988982"
104,1,"5:42",1542,"Bryce Morgan missed Layup.",40,21,"Arlington Baptist","Abilene Christian",NA,"400988982"
105,1,"5:42",1542,"Jalone Friday Block.",40,21,"Arlington Baptist","Abilene Christian",NA,"400988982"
106,1,"5:34",1534,"Trey Lenox Defensive Rebound.",40,21,"Arlington Baptist","Abilene Christian",NA,"400988982"
107,1,"5:32",1532,"Jalone Friday made Three Point Jumper. Assisted by Tevin Foster.",43,21,"Arlington Baptist","Abilene Christian",NA,"400988982"
108,1,"5:19",1519,"Eric Wood missed Three Point Jumper.",43,21,"Arlington Baptist","Abilene Christian",NA,"400988982"
109,1,"5:19",1519,"Trey Lenox Defensive Rebound.",43,21,"Arlington Baptist","Abilene Christian",NA,"400988982"
110,1,"5:07",1507,"Jalone Friday made Three Point Jumper. Assisted by Tevin Foster.",46,21,"Arlington Baptist","Abilene Christian",NA,"400988982"
111,1,"5:05",1505,"Arlington Baptist  Timeout",46,21,"Arlington Baptist","Abilene Christian",NA,"400988982"
112,1,"4:54",1494,"Foul on B.J. Maxwell.",46,21,"Arlington Baptist","Abilene Christian",NA,"400988982"
113,1,"4:49",1489,"Kennedy Jones missed Jumper.",46,21,"Arlington Baptist","Abilene Christian",NA,"400988982"
114,1,"4:49",1489,"Kel Wallace Offensive Rebound.",46,21,"Arlington Baptist","Abilene Christian",NA,"400988982"
115,1,"4:48",1488,"Kel Wallace missed Layup.",46,21,"Arlington Baptist","Abilene Christian",NA,"400988982"
116,1,"4:48",1488,"Jalone Friday Defensive Rebound.",46,21,"Arlington Baptist","Abilene Christian",NA,"400988982"
117,1,"4:47",1487,"Foul on Kennedy Jones.",46,21,"Arlington Baptist","Abilene Christian",NA,"400988982"
118,1,"4:23",1463,"B.J. Maxwell made Layup. Assisted by Jaylen Franklin.",48,21,"Arlington Baptist","Abilene Christian",NA,"400988982"
119,1,"4:04",1444,"Foul on Jaylen Franklin.",48,21,"Arlington Baptist","Abilene Christian",NA,"400988982"
120,1,"3:50",1430,"Markel Semien made Three Point Jumper.",48,24,"Arlington Baptist","Abilene Christian",NA,"400988982"
121,1,"3:29",1409,"B.J. Maxwell made Layup. Assisted by Jaylen Franklin.",50,24,"Arlington Baptist","Abilene Christian",NA,"400988982"
122,1,"3:02",1382,"Markel Semien missed Jumper.",50,24,"Arlington Baptist","Abilene Christian",NA,"400988982"
123,1,"3:02",1382,"B.J. Maxwell Defensive Rebound.",50,24,"Arlington Baptist","Abilene Christian",NA,"400988982"
124,1,"3:02",1382,"Foul on Jaylen Franklin.",50,24,"Arlington Baptist","Abilene Christian",NA,"400988982"
125,1,"3:02",1382,"Official TV Timeout",50,24,"Arlington Baptist","Abilene Christian",NA,"400988982"
126,1,"3:02",1382,"Eric Wood Turnover.",50,24,"Arlington Baptist","Abilene Christian",NA,"400988982"
127,1,"3:02",1382,"B.J. Maxwell Steal.",50,24,"Arlington Baptist","Abilene Christian",NA,"400988982"
128,1,"3:02",1382,"B.J. Maxwell missed Layup.",50,24,"Arlington Baptist","Abilene Christian",NA,"400988982"
129,1,"3:02",1382,"Hayden Farquhar Offensive Rebound.",50,24,"Arlington Baptist","Abilene Christian",NA,"400988982"
130,1,"3:02",1382,"Hayden Farquhar made Layup.",52,24,"Arlington Baptist","Abilene Christian",NA,"400988982"
131,1,"3:02",1382,"Markel Semien made Three Point Jumper.",52,27,"Arlington Baptist","Abilene Christian",NA,"400988982"
132,1,"2:10",1330,"Kolton Kohl Turnover.",52,27,"Arlington Baptist","Abilene Christian",NA,"400988982"
133,1,"1:55",1315,"Foul on Kolton Kohl.",52,27,"Arlington Baptist","Abilene Christian",NA,"400988982"
134,1,"1:55",1315,"Markel Semien made Free Throw.",52,28,"Arlington Baptist","Abilene Christian",NA,"400988982"
135,1,"1:55",1315,"Markel Semien missed Free Throw.",52,28,"Arlington Baptist","Abilene Christian",NA,"400988982"
136,1,"1:55",1315,"Hayden Farquhar Defensive Rebound.",52,28,"Arlington Baptist","Abilene Christian",NA,"400988982"
137,1,"1:46",1306,"Kolton Kohl missed Jumper.",52,28,"Arlington Baptist","Abilene Christian",NA,"400988982"
138,1,"1:46",1306,"B.J. Maxwell Offensive Rebound.",52,28,"Arlington Baptist","Abilene Christian",NA,"400988982"
139,1,"1:44",1304,"B.J. Maxwell missed Layup.",52,28,"Arlington Baptist","Abilene Christian",NA,"400988982"
140,1,"1:44",1304,"Bryce Morgan Block.",52,28,"Arlington Baptist","Abilene Christian",NA,"400988982"
141,1,"1:42",1302,"B.J. Maxwell Offensive Rebound.",52,28,"Arlington Baptist","Abilene Christian",NA,"400988982"
142,1,"1:38",1298,"Hayden Farquhar missed Three Point Jumper.",52,28,"Arlington Baptist","Abilene Christian",NA,"400988982"
143,1,"1:38",1298,"Kolton Kohl Offensive Rebound.",52,28,"Arlington Baptist","Abilene Christian",NA,"400988982"
144,1,"1:35",1295,"Kolton Kohl made Layup.",54,28,"Arlington Baptist","Abilene Christian",NA,"400988982"
145,1,"1:25",1285,"Markel Semien Turnover.",54,28,"Arlington Baptist","Abilene Christian",NA,"400988982"
146,1,"1:14",1274,"Hayden Farquhar missed Three Point Jumper.",54,28,"Arlington Baptist","Abilene Christian",NA,"400988982"
147,1,"1:14",1274,"Chase Cobb Offensive Rebound.",54,28,"Arlington Baptist","Abilene Christian",NA,"400988982"
148,1,"1:11",1271,"Chase Cobb made Jumper.",56,28,"Arlington Baptist","Abilene Christian",NA,"400988982"
149,1,"0:54",1254,"Kennedy Jones missed Jumper.",56,28,"Arlington Baptist","Abilene Christian",NA,"400988982"
150,1,"0:54",1254,"Hayden Farquhar Defensive Rebound.",56,28,"Arlington Baptist","Abilene Christian",NA,"400988982"
151,1,"0:45",1245,"Foul on Kennedy Jones.",56,28,"Arlington Baptist","Abilene Christian",NA,"400988982"
152,1,"0:45",1245,"B.J. Maxwell made Free Throw.",57,28,"Arlington Baptist","Abilene Christian",NA,"400988982"
153,1,"0:45",1245,"B.J. Maxwell missed Free Throw.",57,28,"Arlington Baptist","Abilene Christian",NA,"400988982"
154,1,"0:45",1245,"Bryce Morgan Defensive Rebound.",57,28,"Arlington Baptist","Abilene Christian",NA,"400988982"
155,1,"0:17",1217,"Foul on B.J. Maxwell.",57,28,"Arlington Baptist","Abilene Christian",NA,"400988982"
156,1,"0:17",1217,"Markel Semien made Free Throw.",57,29,"Arlington Baptist","Abilene Christian",NA,"400988982"
157,1,"0:17",1217,"Markel Semien missed Free Throw.",57,29,"Arlington Baptist","Abilene Christian",NA,"400988982"
158,1,"0:17",1217,"Hayden Farquhar Defensive Rebound.",57,29,"Arlington Baptist","Abilene Christian",NA,"400988982"
159,1,"0:03",1203,"B.J. Maxwell made Layup.",59,29,"Arlington Baptist","Abilene Christian",NA,"400988982"
160,1,"0:00",1200,"End of 1st half",59,29,"Arlington Baptist","Abilene Christian",NA,"400988982"
161,2,"20:00",1200,"PLAY",59,29,"Arlington Baptist","Abilene Christian",NA,"400988982"
162,2,"19:42",1182,"Quinton Moore missed Three Point Jumper.",59,29,"Arlington Baptist","Abilene Christian",NA,"400988982"
163,2,"19:42",1182,"Jaren Lewis Defensive Rebound.",59,29,"Arlington Baptist","Abilene Christian",NA,"400988982"
164,2,"19:23",1163,"Foul on Bryce Morgan.",59,29,"Arlington Baptist","Abilene Christian",NA,"400988982"
165,2,"19:23",1163,"Jaren Lewis made Free Throw.",60,29,"Arlington Baptist","Abilene Christian",NA,"400988982"
166,2,"19:23",1163,"Jaren Lewis made Free Throw.",61,29,"Arlington Baptist","Abilene Christian",NA,"400988982"
167,2,"19:10",1150,"Bryce Morgan missed Jumper.",61,29,"Arlington Baptist","Abilene Christian",NA,"400988982"
168,2,"19:10",1150,"Jalone Friday Block.",61,29,"Arlington Baptist","Abilene Christian",NA,"400988982"
169,2,"19:08",1148,"Arlington Baptist Offensive Rebound.",61,29,"Arlington Baptist","Abilene Christian",NA,"400988982"
170,2,"19:04",1144,"Bryce Morgan made Layup. Assisted by Kel Wallace.",61,31,"Arlington Baptist","Abilene Christian",NA,"400988982"
171,2,"18:40",1120,"Tevin Foster missed Layup.",61,31,"Arlington Baptist","Abilene Christian",NA,"400988982"
172,2,"18:40",1120,"Kel Wallace Block.",61,31,"Arlington Baptist","Abilene Christian",NA,"400988982"
173,2,"18:39",1119,"Quinton Moore Defensive Rebound.",61,31,"Arlington Baptist","Abilene Christian",NA,"400988982"
174,2,"18:19",1099,"Jaren Lewis made Layup.",63,31,"Arlington Baptist","Abilene Christian",NA,"400988982"
175,2,"17:54",1074,"Markel Semien missed Jumper.",63,31,"Arlington Baptist","Abilene Christian",NA,"400988982"
176,2,"17:54",1074,"Jalone Friday Defensive Rebound.",63,31,"Arlington Baptist","Abilene Christian",NA,"400988982"
177,2,"17:46",1066,"Foul on Bryce Morgan.",63,31,"Arlington Baptist","Abilene Christian",NA,"400988982"
178,2,"17:39",1059,"Jalone Friday made Three Point Jumper. Assisted by Jaylen Franklin.",66,31,"Arlington Baptist","Abilene Christian",NA,"400988982"
179,2,"17:18",1038,"Kel Wallace missed Jumper.",66,31,"Arlington Baptist","Abilene Christian",NA,"400988982"
180,2,"17:18",1038,"Jaren Lewis Defensive Rebound.",66,31,"Arlington Baptist","Abilene Christian",NA,"400988982"
181,2,"17:12",1032,"Payten Ricks missed Three Point Jumper.",66,31,"Arlington Baptist","Abilene Christian",NA,"400988982"
182,2,"17:12",1032,"Jaren Lewis Offensive Rebound.",66,31,"Arlington Baptist","Abilene Christian",NA,"400988982"
183,2,"17:04",1024,"Jaren Lewis Turnover.",66,31,"Arlington Baptist","Abilene Christian",NA,"400988982"
184,2,"17:03",1023,"Markel Semien Steal.",66,31,"Arlington Baptist","Abilene Christian",NA,"400988982"
185,2,"16:54",1014,"Kel Wallace missed Layup.",66,31,"Arlington Baptist","Abilene Christian",NA,"400988982"
186,2,"16:54",1014,"Bryce Morgan Offensive Rebound.",66,31,"Arlington Baptist","Abilene Christian",NA,"400988982"
187,2,"16:53",1013,"Bryce Morgan made Jumper.",66,33,"Arlington Baptist","Abilene Christian",NA,"400988982"
188,2,"16:33",993,"Jalone Friday made Three Point Jumper. Assisted by Jaylen Franklin.",69,33,"Arlington Baptist","Abilene Christian",NA,"400988982"
189,2,"16:02",962,"Foul on Jalone Friday.",69,33,"Arlington Baptist","Abilene Christian",NA,"400988982"
190,2,"15:51",951,"Quinton Moore Turnover.",69,33,"Arlington Baptist","Abilene Christian",NA,"400988982"
191,2,"15:50",950,"Jaren Lewis Steal.",69,33,"Arlington Baptist","Abilene Christian",NA,"400988982"
192,2,"15:47",947,"Jaylen Franklin made Dunk. Assisted by Tevin Foster.",71,33,"Arlington Baptist","Abilene Christian",NA,"400988982"
193,2,"15:39",939,"Markel Semien missed Layup.",71,33,"Arlington Baptist","Abilene Christian",NA,"400988982"
194,2,"15:39",939,"Jaylen Franklin Block.",71,33,"Arlington Baptist","Abilene Christian",NA,"400988982"
195,2,"15:38",938,"Jaylen Franklin Defensive Rebound.",71,33,"Arlington Baptist","Abilene Christian",NA,"400988982"
196,2,"15:36",936,"Payten Ricks made Three Point Jumper. Assisted by Jaylen Franklin.",74,33,"Arlington Baptist","Abilene Christian",NA,"400988982"
197,2,"15:32",932,"Arlington Baptist  Timeout",74,33,"Arlington Baptist","Abilene Christian",NA,"400988982"
198,2,"15:32",932,"Kel Wallace made Jumper. Assisted by Quinton Moore.",74,35,"Arlington Baptist","Abilene Christian",NA,"400988982"
199,2,"15:32",932,"Drake Green made Three Point Jumper.",77,35,"Arlington Baptist","Abilene Christian",NA,"400988982"
200,2,"15:30",930,"Eric Wood made Jumper.",77,37,"Arlington Baptist","Abilene Christian",NA,"400988982"
201,2,"14:30",870,"Hayden Howell Turnover.",77,37,"Arlington Baptist","Abilene Christian",NA,"400988982"
202,2,"14:18",858,"Foul on Trey Lenox.",77,37,"Arlington Baptist","Abilene Christian",NA,"400988982"
203,2,"13:57",837,"Kennedy Jones missed Jumper.",77,37,"Arlington Baptist","Abilene Christian",NA,"400988982"
204,2,"13:57",837,"B.J. Maxwell Defensive Rebound.",77,37,"Arlington Baptist","Abilene Christian",NA,"400988982"
205,2,"13:50",830,"Drake Green Turnover.",77,37,"Arlington Baptist","Abilene Christian",NA,"400988982"
206,2,"13:49",829,"Jashun Petite Steal.",77,37,"Arlington Baptist","Abilene Christian",NA,"400988982"
207,2,"13:33",813,"Eric Wood made Three Point Jumper.",77,40,"Arlington Baptist","Abilene Christian",NA,"400988982"
208,2,"13:19",799,"Drake Green made Three Point Jumper. Assisted by Isaiah Tripp.",80,40,"Arlington Baptist","Abilene Christian",NA,"400988982"
209,2,"13:00",780,"Jashun Petite made Layup.",80,42,"Arlington Baptist","Abilene Christian",NA,"400988982"
210,2,"13:00",780,"Foul on Isaiah Tripp.",80,42,"Arlington Baptist","Abilene Christian",NA,"400988982"
211,2,"13:00",780,"Jashun Petite missed Free Throw.",80,42,"Arlington Baptist","Abilene Christian",NA,"400988982"
212,2,"13:00",780,"Trey Lenox Defensive Rebound.",80,42,"Arlington Baptist","Abilene Christian",NA,"400988982"
213,2,"12:49",769,"Hayden Howell Turnover.",80,42,"Arlington Baptist","Abilene Christian",NA,"400988982"
214,2,"12:49",769,"Jashun Petite Steal.",80,42,"Arlington Baptist","Abilene Christian",NA,"400988982"
215,2,"12:34",754,"Foul on Trey Lenox.",80,42,"Arlington Baptist","Abilene Christian",NA,"400988982"
216,2,"12:34",754,"Jashun Petite missed Jumper.",80,42,"Arlington Baptist","Abilene Christian",NA,"400988982"
