"play_id","half","time_remaining_half","secs_remaining","description","home_score","away_score","away","home","home_favored_by","game_id"
1,1,"20:00",2400,"PLAY",0,0,"Randall University","Abilene Christian",NA,"400988880"
2,1,"19:46",2386,"Jalone Friday missed Jumper.",0,0,"Randall University","Abilene Christian",NA,"400988880"
3,1,"19:46",2386,"Brad Ficken Defensive Rebound.",0,0,"Randall University","Abilene Christian",NA,"400988880"
4,1,"19:19",2359,"Ben Collier missed Three Point Jumper.",0,0,"Randall University","Abilene Christian",NA,"400988880"
5,1,"19:19",2359,"Tevin Foster Defensive Rebound.",0,0,"Randall University","Abilene Christian",NA,"400988880"
6,1,"19:12",2352,"Jaylen Franklin missed Jumper.",0,0,"Randall University","Abilene Christian",NA,"400988880"
7,1,"19:12",2352,"Isaac Bowles Defensive Rebound.",0,0,"Randall University","Abilene Christian",NA,"400988880"
8,1,"19:01",2341,"Kashus Lyons missed Jumper.",0,0,"Randall University","Abilene Christian",NA,"400988880"
9,1,"19:01",2341,"Xavier Hunter Offensive Rebound.",0,0,"Randall University","Abilene Christian",NA,"400988880"
10,1,"18:55",2335,"Xavier Hunter missed Jumper.",0,0,"Randall University","Abilene Christian",NA,"400988880"
11,1,"18:55",2335,"Jalone Friday Defensive Rebound.",0,0,"Randall University","Abilene Christian",NA,"400988880"
12,1,"18:52",2332,"Foul on Isaac Bowles.",0,0,"Randall University","Abilene Christian",NA,"400988880"
13,1,"18:42",2322,"Jalone Friday made Jumper. Assisted by Jaylen Franklin.",2,0,"Randall University","Abilene Christian",NA,"400988880"
14,1,"18:21",2301,"Foul on Jaren Lewis.",2,0,"Randall University","Abilene Christian",NA,"400988880"
15,1,"18:18",2298,"Brad Ficken Turnover.",2,0,"Randall University","Abilene Christian",NA,"400988880"
16,1,"18:16",2296,"Jaylen Franklin Steal.",2,0,"Randall University","Abilene Christian",NA,"400988880"
17,1,"18:13",2293,"Jaylen Franklin made Dunk. Assisted by Tevin Foster.",4,0,"Randall University","Abilene Christian",NA,"400988880"
18,1,"17:57",2277,"Foul on Tevin Foster.",4,0,"Randall University","Abilene Christian",NA,"400988880"
19,1,"17:52",2272,"Brad Ficken missed Jumper.",4,0,"Randall University","Abilene Christian",NA,"400988880"
20,1,"17:52",2272,"Jalone Friday Defensive Rebound.",4,0,"Randall University","Abilene Christian",NA,"400988880"
21,1,"17:36",2256,"Jalone Friday missed Three Point Jumper.",4,0,"Randall University","Abilene Christian",NA,"400988880"
22,1,"17:36",2256,"Brad Ficken Defensive Rebound.",4,0,"Randall University","Abilene Christian",NA,"400988880"
23,1,"17:14",2234,"Brad Ficken Turnover.",4,0,"Randall University","Abilene Christian",NA,"400988880"
24,1,"17:12",2232,"Drake Green Steal.",4,0,"Randall University","Abilene Christian",NA,"400988880"
25,1,"17:09",2229,"B.J. Maxwell made Layup.",6,0,"Randall University","Abilene Christian",NA,"400988880"
26,1,"17:06",2226,"Foul on Kashus Lyons.",6,0,"Randall University","Abilene Christian",NA,"400988880"
27,1,"17:06",2226,"B.J. Maxwell made Free Throw.",7,0,"Randall University","Abilene Christian",NA,"400988880"
28,1,"16:57",2217,"Ben Collier missed Three Point Jumper.",7,0,"Randall University","Abilene Christian",NA,"400988880"
29,1,"16:57",2217,"Kashus Lyons Offensive Rebound.",7,0,"Randall University","Abilene Christian",NA,"400988880"
30,1,"16:42",2202,"Xavier Hunter missed Three Point Jumper.",7,0,"Randall University","Abilene Christian",NA,"400988880"
31,1,"16:42",2202,"Jaren Lewis Defensive Rebound.",7,0,"Randall University","Abilene Christian",NA,"400988880"
32,1,"16:33",2193,"Drake Green missed Three Point Jumper.",7,0,"Randall University","Abilene Christian",NA,"400988880"
33,1,"16:33",2193,"Jaren Lewis Offensive Rebound.",7,0,"Randall University","Abilene Christian",NA,"400988880"
34,1,"16:28",2188,"Jaren Lewis Turnover.",7,0,"Randall University","Abilene Christian",NA,"400988880"
35,1,"16:16",2176,"Xavier Hunter Turnover.",7,0,"Randall University","Abilene Christian",NA,"400988880"
36,1,"16:15",2175,"B.J. Maxwell Steal.",7,0,"Randall University","Abilene Christian",NA,"400988880"
37,1,"16:11",2171,"Jaylen Franklin Turnover.",7,0,"Randall University","Abilene Christian",NA,"400988880"
38,1,"15:58",2158,"Official TV Timeout",7,0,"Randall University","Abilene Christian",NA,"400988880"
39,1,"15:53",2153,"Jordan Downs missed Jumper.",7,0,"Randall University","Abilene Christian",NA,"400988880"
40,1,"15:53",2153,"Tevin Foster Defensive Rebound.",7,0,"Randall University","Abilene Christian",NA,"400988880"
41,1,"15:39",2139,"Tevin Foster missed Three Point Jumper.",7,0,"Randall University","Abilene Christian",NA,"400988880"
42,1,"15:39",2139,"Brandon Askew Defensive Rebound.",7,0,"Randall University","Abilene Christian",NA,"400988880"
43,1,"15:17",2117,"Antonio Wilson missed Jumper.",7,0,"Randall University","Abilene Christian",NA,"400988880"
44,1,"15:17",2117,"Tevin Foster Defensive Rebound.",7,0,"Randall University","Abilene Christian",NA,"400988880"
45,1,"14:54",2094,"Hayden Howell missed Jumper.",7,0,"Randall University","Abilene Christian",NA,"400988880"
46,1,"14:54",2094,"Isaac Bowles Defensive Rebound.",7,0,"Randall University","Abilene Christian",NA,"400988880"
47,1,"14:46",2086,"Brandon Askew missed Three Point Jumper.",7,0,"Randall University","Abilene Christian",NA,"400988880"
48,1,"14:46",2086,"Abilene Christian Defensive Rebound.",7,0,"Randall University","Abilene Christian",NA,"400988880"
49,1,"14:31",2071,"Isaiah Tripp missed Layup.",7,0,"Randall University","Abilene Christian",NA,"400988880"
50,1,"14:31",2071,"Hayden Farquhar Offensive Rebound.",7,0,"Randall University","Abilene Christian",NA,"400988880"
51,1,"14:29",2069,"Hayden Farquhar made Jumper.",9,0,"Randall University","Abilene Christian",NA,"400988880"
52,1,"14:26",2066,"Foul on Jordan Downs.",9,0,"Randall University","Abilene Christian",NA,"400988880"
53,1,"14:26",2066,"Hayden Farquhar made Free Throw.",10,0,"Randall University","Abilene Christian",NA,"400988880"
54,1,"14:19",2059,"Foul on Isaiah Tripp.",10,0,"Randall University","Abilene Christian",NA,"400988880"
55,1,"14:13",2053,"Kashus Lyons missed Three Point Jumper.",10,0,"Randall University","Abilene Christian",NA,"400988880"
56,1,"14:13",2053,"Antonio Wilson Offensive Rebound.",10,0,"Randall University","Abilene Christian",NA,"400988880"
57,1,"13:59",2039,"Kashus Lyons missed Three Point Jumper.",10,0,"Randall University","Abilene Christian",NA,"400988880"
58,1,"13:59",2039,"Isaac Bowles Offensive Rebound.",10,0,"Randall University","Abilene Christian",NA,"400988880"
59,1,"13:55",2035,"Isaac Bowles missed Jumper.",10,0,"Randall University","Abilene Christian",NA,"400988880"
60,1,"13:55",2035,"Kashus Lyons Offensive Rebound.",10,0,"Randall University","Abilene Christian",NA,"400988880"
61,1,"13:54",2034,"Foul on Hayden Howell.",10,0,"Randall University","Abilene Christian",NA,"400988880"
62,1,"13:41",2021,"Antonio Wilson made Jumper. Assisted by Brandon Askew.",10,2,"Randall University","Abilene Christian",NA,"400988880"
63,1,"13:20",2000,"Hayden Howell missed Jumper.",10,2,"Randall University","Abilene Christian",NA,"400988880"
64,1,"13:20",2000,"Isaac Bowles Block.",10,2,"Randall University","Abilene Christian",NA,"400988880"
65,1,"13:19",1999,"Dante Lewis Defensive Rebound.",10,2,"Randall University","Abilene Christian",NA,"400988880"
66,1,"13:12",1992,"Antonio Wilson made Three Point Jumper. Assisted by Brandon Askew.",10,5,"Randall University","Abilene Christian",NA,"400988880"
67,1,"12:43",1963,"Hayden Howell Turnover.",10,5,"Randall University","Abilene Christian",NA,"400988880"
68,1,"12:22",1942,"Brandon Askew made Jumper.",10,7,"Randall University","Abilene Christian",NA,"400988880"
69,1,"12:03",1923,"Jalone Friday made Layup. Assisted by Jaren Lewis.",12,7,"Randall University","Abilene Christian",NA,"400988880"
70,1,"11:48",1908,"Antonio Wilson missed Jumper.",12,7,"Randall University","Abilene Christian",NA,"400988880"
71,1,"11:48",1908,"Dante Lewis Offensive Rebound.",12,7,"Randall University","Abilene Christian",NA,"400988880"
72,1,"11:41",1901,"Dante Lewis made Dunk.",12,9,"Randall University","Abilene Christian",NA,"400988880"
73,1,"11:30",1890,"Jalone Friday made Three Point Jumper.",15,9,"Randall University","Abilene Christian",NA,"400988880"
74,1,"11:15",1875,"Kashus Lyons Turnover.",15,9,"Randall University","Abilene Christian",NA,"400988880"
75,1,"11:15",1875,"Official TV Timeout",15,9,"Randall University","Abilene Christian",NA,"400988880"
76,1,"11:01",1861,"Jaren Lewis missed Jumper.",15,9,"Randall University","Abilene Christian",NA,"400988880"
77,1,"11:01",1861,"Jalone Friday Offensive Rebound.",15,9,"Randall University","Abilene Christian",NA,"400988880"
78,1,"10:58",1858,"Jalone Friday missed Jumper.",15,9,"Randall University","Abilene Christian",NA,"400988880"
79,1,"10:58",1858,"Dante Lewis Defensive Rebound.",15,9,"Randall University","Abilene Christian",NA,"400988880"
80,1,"10:40",1840,"Brandon Askew missed Jumper.",15,9,"Randall University","Abilene Christian",NA,"400988880"
81,1,"10:40",1840,"B.J. Maxwell Defensive Rebound.",15,9,"Randall University","Abilene Christian",NA,"400988880"
82,1,"10:22",1822,"B.J. Maxwell missed Three Point Jumper.",15,9,"Randall University","Abilene Christian",NA,"400988880"
83,1,"10:22",1822,"Jalone Friday Offensive Rebound.",15,9,"Randall University","Abilene Christian",NA,"400988880"
84,1,"10:18",1818,"Jalone Friday Turnover.",15,9,"Randall University","Abilene Christian",NA,"400988880"
85,1,"10:17",1817,"Brandon Askew Steal.",15,9,"Randall University","Abilene Christian",NA,"400988880"
86,1,"10:01",1801,"Isaac Bowles made Jumper.",15,11,"Randall University","Abilene Christian",NA,"400988880"
87,1,"10:01",1801,"Foul on Xavier Hunter.",15,11,"Randall University","Abilene Christian",NA,"400988880"
88,1,"10:01",1801,"Xavier Hunter Turnover.",15,11,"Randall University","Abilene Christian",NA,"400988880"
89,1,"9:58",1798,"Jalone Friday made Jumper. Assisted by Drake Green.",17,11,"Randall University","Abilene Christian",NA,"400988880"
90,1,"9:42",1782,"Antonio Wilson made Three Point Jumper. Assisted by Xavier Hunter.",17,14,"Randall University","Abilene Christian",NA,"400988880"
91,1,"9:26",1766,"Jaylen Franklin missed Jumper.",17,14,"Randall University","Abilene Christian",NA,"400988880"
92,1,"9:26",1766,"Jaren Lewis Offensive Rebound.",17,14,"Randall University","Abilene Christian",NA,"400988880"
93,1,"9:26",1766,"Foul on Dante Lewis.",17,14,"Randall University","Abilene Christian",NA,"400988880"
94,1,"9:18",1758,"Drake Green made Layup. Assisted by Jaylen Franklin.",19,14,"Randall University","Abilene Christian",NA,"400988880"
95,1,"9:01",1741,"Xavier Hunter made Jumper.",19,16,"Randall University","Abilene Christian",NA,"400988880"
96,1,"8:41",1721,"Jaren Lewis made Jumper. Assisted by Jaylen Franklin.",21,16,"Randall University","Abilene Christian",NA,"400988880"
97,1,"8:31",1711,"Dante Lewis missed Jumper.",21,16,"Randall University","Abilene Christian",NA,"400988880"
98,1,"8:31",1711,"Quan Hopkins Offensive Rebound.",21,16,"Randall University","Abilene Christian",NA,"400988880"
99,1,"8:26",1706,"Quan Hopkins missed Jumper.",21,16,"Randall University","Abilene Christian",NA,"400988880"
100,1,"8:26",1706,"Jalone Friday Block.",21,16,"Randall University","Abilene Christian",NA,"400988880"
101,1,"8:24",1704,"Jalone Friday Defensive Rebound.",21,16,"Randall University","Abilene Christian",NA,"400988880"
102,1,"8:19",1699,"Tevin Foster missed Jumper.",21,16,"Randall University","Abilene Christian",NA,"400988880"
103,1,"8:19",1699,"Antonio Wilson Defensive Rebound.",21,16,"Randall University","Abilene Christian",NA,"400988880"
104,1,"8:02",1682,"Xavier Hunter missed Three Point Jumper.",21,16,"Randall University","Abilene Christian",NA,"400988880"
105,1,"8:02",1682,"Jalone Friday Defensive Rebound.",21,16,"Randall University","Abilene Christian",NA,"400988880"
106,1,"7:37",1657,"Foul on Dante Lewis.",21,16,"Randall University","Abilene Christian",NA,"400988880"
107,1,"7:37",1657,"Official TV Timeout",21,16,"Randall University","Abilene Christian",NA,"400988880"
108,1,"7:37",1657,"Jalone Friday made Free Throw.",22,16,"Randall University","Abilene Christian",NA,"400988880"
109,1,"7:37",1657,"Jalone Friday made Free Throw.",23,16,"Randall University","Abilene Christian",NA,"400988880"
110,1,"7:15",1635,"Brad Ficken made Three Point Jumper. Assisted by Xavier Hunter.",23,19,"Randall University","Abilene Christian",NA,"400988880"
111,1,"7:00",1620,"Drake Green Turnover.",23,19,"Randall University","Abilene Christian",NA,"400988880"
112,1,"6:41",1601,"Xavier Hunter missed Jumper.",23,19,"Randall University","Abilene Christian",NA,"400988880"
113,1,"6:41",1601,"Jaren Lewis Defensive Rebound.",23,19,"Randall University","Abilene Christian",NA,"400988880"
114,1,"6:33",1593,"Isaiah Tripp missed Three Point Jumper.",23,19,"Randall University","Abilene Christian",NA,"400988880"
115,1,"6:33",1593,"Randall University Defensive Rebound.",23,19,"Randall University","Abilene Christian",NA,"400988880"
116,1,"6:10",1570,"Brad Ficken missed Three Point Jumper.",23,19,"Randall University","Abilene Christian",NA,"400988880"
117,1,"6:10",1570,"Isaiah Tripp Defensive Rebound.",23,19,"Randall University","Abilene Christian",NA,"400988880"
118,1,"6:07",1567,"Isaiah Tripp Turnover.",23,19,"Randall University","Abilene Christian",NA,"400988880"
119,1,"6:06",1566,"Brad Ficken Steal.",23,19,"Randall University","Abilene Christian",NA,"400988880"
120,1,"5:56",1556,"Antonio Wilson missed Jumper.",23,19,"Randall University","Abilene Christian",NA,"400988880"
121,1,"5:56",1556,"Jaren Lewis Block.",23,19,"Randall University","Abilene Christian",NA,"400988880"
122,1,"5:55",1555,"Isaiah Tripp Defensive Rebound.",23,19,"Randall University","Abilene Christian",NA,"400988880"
123,1,"5:55",1555,"Foul on Antonio Wilson.",23,19,"Randall University","Abilene Christian",NA,"400988880"
124,1,"5:55",1555,"Isaiah Tripp made Free Throw.",24,19,"Randall University","Abilene Christian",NA,"400988880"
125,1,"5:55",1555,"Isaiah Tripp made Free Throw.",25,19,"Randall University","Abilene Christian",NA,"400988880"
126,1,"5:38",1538,"Trystin Jarvis made Jumper. Assisted by Brad Ficken.",25,21,"Randall University","Abilene Christian",NA,"400988880"
127,1,"5:28",1528,"Foul on Jaylen Franklin.",25,21,"Randall University","Abilene Christian",NA,"400988880"
128,1,"5:28",1528,"Jaylen Franklin Turnover.",25,21,"Randall University","Abilene Christian",NA,"400988880"
129,1,"5:11",1511,"Brad Ficken made Layup.",25,23,"Randall University","Abilene Christian",NA,"400988880"
130,1,"4:54",1494,"Hayden Farquhar made Jumper. Assisted by Drake Green.",27,23,"Randall University","Abilene Christian",NA,"400988880"
131,1,"4:44",1484,"Ben Collier made Three Point Jumper. Assisted by Brad Ficken.",27,26,"Randall University","Abilene Christian",NA,"400988880"
132,1,"4:24",1464,"Jaylen Franklin made Layup.",29,26,"Randall University","Abilene Christian",NA,"400988880"
133,1,"4:11",1451,"Ben Collier missed Jumper.",29,26,"Randall University","Abilene Christian",NA,"400988880"
134,1,"4:11",1451,"Jaren Lewis Block.",29,26,"Randall University","Abilene Christian",NA,"400988880"
135,1,"4:05",1445,"Jaren Lewis Defensive Rebound.",29,26,"Randall University","Abilene Christian",NA,"400988880"
136,1,"4:03",1443,"Foul on Brad Ficken.",29,26,"Randall University","Abilene Christian",NA,"400988880"
137,1,"4:03",1443,"Tevin Foster made Free Throw.",30,26,"Randall University","Abilene Christian",NA,"400988880"
138,1,"4:03",1443,"Tevin Foster made Free Throw.",31,26,"Randall University","Abilene Christian",NA,"400988880"
139,1,"3:49",1429,"Xavier Hunter missed Jumper.",31,26,"Randall University","Abilene Christian",NA,"400988880"
140,1,"3:49",1429,"Hayden Farquhar Defensive Rebound.",31,26,"Randall University","Abilene Christian",NA,"400988880"
141,1,"3:38",1418,"Foul on B.J. Maxwell.",31,26,"Randall University","Abilene Christian",NA,"400988880"
142,1,"3:38",1418,"B.J. Maxwell Turnover.",31,26,"Randall University","Abilene Christian",NA,"400988880"
143,1,"3:38",1418,"Official TV Timeout",31,26,"Randall University","Abilene Christian",NA,"400988880"
144,1,"3:19",1399,"Foul on Jalone Friday.",31,26,"Randall University","Abilene Christian",NA,"400988880"
145,1,"3:19",1399,"Isaac Bowles missed Free Throw.",31,26,"Randall University","Abilene Christian",NA,"400988880"
146,1,"3:19",1399,"Randall University Deadball Team Rebound.",31,26,"Randall University","Abilene Christian",NA,"400988880"
147,1,"3:19",1399,"Isaac Bowles missed Free Throw.",31,26,"Randall University","Abilene Christian",NA,"400988880"
148,1,"3:19",1399,"B.J. Maxwell Defensive Rebound.",31,26,"Randall University","Abilene Christian",NA,"400988880"
149,1,"3:01",1381,"Trey Lenox missed Jumper.",31,26,"Randall University","Abilene Christian",NA,"400988880"
150,1,"3:01",1381,"Kashus Lyons Block.",31,26,"Randall University","Abilene Christian",NA,"400988880"
151,1,"2:59",1379,"Brandon Askew Defensive Rebound.",31,26,"Randall University","Abilene Christian",NA,"400988880"
152,1,"2:56",1376,"Kashus Lyons missed Three Point Jumper.",31,26,"Randall University","Abilene Christian",NA,"400988880"
153,1,"2:56",1376,"Tevin Foster Defensive Rebound.",31,26,"Randall University","Abilene Christian",NA,"400988880"
154,1,"2:45",1365,"Foul on Brandon Askew.",31,26,"Randall University","Abilene Christian",NA,"400988880"
155,1,"2:45",1365,"Tevin Foster made Free Throw.",32,26,"Randall University","Abilene Christian",NA,"400988880"
156,1,"2:45",1365,"Tevin Foster missed Free Throw.",32,26,"Randall University","Abilene Christian",NA,"400988880"
157,1,"2:45",1365,"Kashus Lyons Defensive Rebound.",32,26,"Randall University","Abilene Christian",NA,"400988880"
158,1,"2:36",1356,"Foul on Isaac Bowles.",32,26,"Randall University","Abilene Christian",NA,"400988880"
159,1,"2:36",1356,"Isaac Bowles Turnover.",32,26,"Randall University","Abilene Christian",NA,"400988880"
160,1,"2:25",1345,"Jalone Friday missed Jumper.",32,26,"Randall University","Abilene Christian",NA,"400988880"
161,1,"2:25",1345,"Jalone Friday Offensive Rebound.",32,26,"Randall University","Abilene Christian",NA,"400988880"
162,1,"2:20",1340,"Jalone Friday made Jumper.",34,26,"Randall University","Abilene Christian",NA,"400988880"
163,1,"1:57",1317,"Brad Ficken missed Three Point Jumper.",34,26,"Randall University","Abilene Christian",NA,"400988880"
164,1,"1:57",1317,"Jalone Friday Defensive Rebound.",34,26,"Randall University","Abilene Christian",NA,"400988880"
165,1,"1:54",1314,"Foul on Trystin Jarvis.",34,26,"Randall University","Abilene Christian",NA,"400988880"
166,1,"1:54",1314,"Jalone Friday missed Free Throw.",34,26,"Randall University","Abilene Christian",NA,"400988880"
167,1,"1:54",1314,"Abilene Christian Deadball Team Rebound.",34,26,"Randall University","Abilene Christian",NA,"400988880"
168,1,"1:54",1314,"Jalone Friday made Free Throw.",35,26,"Randall University","Abilene Christian",NA,"400988880"
169,1,"1:30",1290,"Kashus Lyons missed Three Point Jumper.",35,26,"Randall University","Abilene Christian",NA,"400988880"
170,1,"1:30",1290,"Randall University Offensive Rebound.",35,26,"Randall University","Abilene Christian",NA,"400988880"
171,1,"1:29",1289,"Foul on Jalone Friday.",35,26,"Randall University","Abilene Christian",NA,"400988880"
172,1,"1:29",1289,"Trystin Jarvis made Free Throw.",35,27,"Randall University","Abilene Christian",NA,"400988880"
173,1,"1:29",1289,"Trystin Jarvis made Free Throw.",35,28,"Randall University","Abilene Christian",NA,"400988880"
174,1,"1:10",1270,"Hayden Howell missed Layup.",35,28,"Randall University","Abilene Christian",NA,"400988880"
175,1,"1:10",1270,"Hayden Howell Offensive Rebound.",35,28,"Randall University","Abilene Christian",NA,"400988880"
176,1,"1:04",1264,"B.J. Maxwell made Layup.",37,28,"Randall University","Abilene Christian",NA,"400988880"
177,1,"0:49",1249,"Brandon Askew made Layup.",37,30,"Randall University","Abilene Christian",NA,"400988880"
178,1,"0:25",1225,"Jaren Lewis made Layup. Assisted by Tevin Foster.",39,30,"Randall University","Abilene Christian",NA,"400988880"
179,1,"0:17",1217,"Randall University  Timeout",39,30,"Randall University","Abilene Christian",NA,"400988880"
180,1,"0:07",1207,"Brandon Askew made Three Point Jumper. Assisted by Brad Ficken.",39,33,"Randall University","Abilene Christian",NA,"400988880"
181,1,"0:00",1200,"Tevin Foster missed Three Point Jumper.",39,33,"Randall University","Abilene Christian",NA,"400988880"
182,1,"0:00",1200,"Randall University Defensive Rebound.",39,33,"Randall University","Abilene Christian",NA,"400988880"
183,1,"0:00",1200,"End of 1st half",39,33,"Randall University","Abilene Christian",NA,"400988880"
184,2,"20:00",1200,"PLAY",39,33,"Randall University","Abilene Christian",NA,"400988880"
185,2,"19:51",1191,"Jalone Friday missed Three Point Jumper.",39,33,"Randall University","Abilene Christian",NA,"400988880"
186,2,"19:51",1191,"Kashus Lyons Defensive Rebound.",39,33,"Randall University","Abilene Christian",NA,"400988880"
187,2,"19:41",1181,"Kashus Lyons Turnover.",39,33,"Randall University","Abilene Christian",NA,"400988880"
188,2,"19:39",1179,"Jaylen Franklin Steal.",39,33,"Randall University","Abilene Christian",NA,"400988880"
189,2,"19:33",1173,"Jaren Lewis made Layup.",41,33,"Randall University","Abilene Christian",NA,"400988880"
190,2,"19:18",1158,"Foul on Kashus Lyons.",41,33,"Randall University","Abilene Christian",NA,"400988880"
191,2,"19:18",1158,"Kashus Lyons Turnover.",41,33,"Randall University","Abilene Christian",NA,"400988880"
192,2,"19:01",1141,"Jalone Friday made Jumper. Assisted by B.J. Maxwell.",43,33,"Randall University","Abilene Christian",NA,"400988880"
193,2,"18:48",1128,"Kashus Lyons Turnover.",43,33,"Randall University","Abilene Christian",NA,"400988880"
194,2,"18:48",1128,"Jaylen Franklin Steal.",43,33,"Randall University","Abilene Christian",NA,"400988880"
195,2,"18:46",1126,"Jaylen Franklin made Layup.",45,33,"Randall University","Abilene Christian",NA,"400988880"
196,2,"18:30",1110,"Foul on B.J. Maxwell.",45,33,"Randall University","Abilene Christian",NA,"400988880"
197,2,"18:20",1100,"Kashus Lyons made Three Point Jumper. Assisted by Ben Collier.",45,36,"Randall University","Abilene Christian",NA,"400988880"
198,2,"18:04",1084,"Jalone Friday made Layup. Assisted by Tevin Foster.",47,36,"Randall University","Abilene Christian",NA,"400988880"
199,2,"17:48",1068,"Ben Collier missed Jumper.",47,36,"Randall University","Abilene Christian",NA,"400988880"
200,2,"17:48",1068,"Jaren Lewis Defensive Rebound.",47,36,"Randall University","Abilene Christian",NA,"400988880"
201,2,"17:35",1055,"B.J. Maxwell missed Jumper.",47,36,"Randall University","Abilene Christian",NA,"400988880"
202,2,"17:35",1055,"Ben Collier Defensive Rebound.",47,36,"Randall University","Abilene Christian",NA,"400988880"
203,2,"17:24",1044,"Ben Collier made Jumper.",47,38,"Randall University","Abilene Christian",NA,"400988880"
204,2,"17:12",1032,"Jaylen Franklin missed Layup.",47,38,"Randall University","Abilene Christian",NA,"400988880"
205,2,"17:12",1032,"Isaac Bowles Defensive Rebound.",47,38,"Randall University","Abilene Christian",NA,"400988880"
206,2,"16:58",1018,"Isaac Bowles missed Jumper.",47,38,"Randall University","Abilene Christian",NA,"400988880"
207,2,"16:58",1018,"Jaren Lewis Defensive Rebound.",47,38,"Randall University","Abilene Christian",NA,"400988880"
208,2,"16:42",1002,"Foul on B.J. Maxwell.",47,38,"Randall University","Abilene Christian",NA,"400988880"
209,2,"16:42",1002,"B.J. Maxwell Turnover.",47,38,"Randall University","Abilene Christian",NA,"400988880"
210,2,"16:26",986,"Kashus Lyons made Jumper.",47,40,"Randall University","Abilene Christian",NA,"400988880"
211,2,"16:08",968,"Foul on Jalone Friday.",47,40,"Randall University","Abilene Christian",NA,"400988880"
212,2,"16:08",968,"Jalone Friday Turnover.",47,40,"Randall University","Abilene Christian",NA,"400988880"
213,2,"15:57",957,"Xavier Hunter missed Jumper.",47,40,"Randall University","Abilene Christian",NA,"400988880"
214,2,"15:57",957,"Jaren Lewis Defensive Rebound.",47,40,"Randall University","Abilene Christian",NA,"400988880"
215,2,"15:48",948,"Foul on Brad Ficken.",47,40,"Randall University","Abilene Christian",NA,"400988880"
216,2,"15:48",948,"Official TV Timeout",47,40,"Randall University","Abilene Christian",NA,"400988880"
217,2,"15:46",946,"Tevin Foster missed Three Point Jumper.",47,40,"Randall University","Abilene Christian",NA,"400988880"
218,2,"15:46",946,"Jaren Lewis Offensive Rebound.",47,40,"Randall University","Abilene Christian",NA,"400988880"
219,2,"15:39",939,"Jaren Lewis made Layup.",49,40,"Randall University","Abilene Christian",NA,"400988880"
220,2,"15:22",922,"Brad Ficken Turnover.",49,40,"Randall University","Abilene Christian",NA,"400988880"
221,2,"15:14",914,"Jaylen Franklin Turnover.",49,40,"Randall University","Abilene Christian",NA,"400988880"
222,2,"15:12",912,"Kashus Lyons Steal.",49,40,"Randall University","Abilene Christian",NA,"400988880"
223,2,"15:10",910,"Kashus Lyons missed Layup.",49,40,"Randall University","Abilene Christian",NA,"400988880"
224,2,"15:10",910,"Tevin Foster Defensive Rebound.",49,40,"Randall University","Abilene Christian",NA,"400988880"
225,2,"15:01",901,"Tevin Foster made Three Point Jumper. Assisted by Jaylen Franklin.",52,40,"Randall University","Abilene Christian",NA,"400988880"
226,2,"14:41",881,"Ben Collier missed Jumper.",52,40,"Randall University","Abilene Christian",NA,"400988880"
227,2,"14:41",881,"Jaren Lewis Block.",52,40,"Randall University","Abilene Christian",NA,"400988880"
228,2,"14:39",879,"Ben Collier Offensive Rebound.",52,40,"Randall University","Abilene Christian",NA,"400988880"
229,2,"14:37",877,"Brad Ficken missed Three Point Jumper.",52,40,"Randall University","Abilene Christian",NA,"400988880"
230,2,"14:37",877,"Isaiah Tripp Defensive Rebound.",52,40,"Randall University","Abilene Christian",NA,"400988880"
