"play_id","half","time_remaining_half","secs_remaining","description","home_score","away_score","away","home","home_favored_by","game_id"
174,2,"17:46",1066,"Michael Buckland Defensive Rebound.",30,30,"Lipscomb","Abilene Christian",NA,"400988914"
175,2,"17:30",1050,"Aaron Korn made Three Point Jumper. Assisted by Rob Marberry.",30,33,"Lipscomb","Abilene Christian",NA,"400988914"
176,2,"16:56",1016,"Isaiah Tripp made Three Point Jumper. Assisted by Jaylen Franklin.",33,33,"Lipscomb","Abilene Christian",NA,"400988914"
177,2,"16:41",1001,"Kenny Cooper missed Layup.",33,33,"Lipscomb","Abilene Christian",NA,"400988914"
178,2,"16:41",1001,"Tevin Foster Defensive Rebound.",33,33,"Lipscomb","Abilene Christian",NA,"400988914"
179,2,"16:37",997,"Tevin Foster made Layup.",35,33,"Lipscomb","Abilene Christian",NA,"400988914"
180,2,"16:18",978,"Matt Rose made Three Point Jumper. Assisted by Kenny Cooper.",35,36,"Lipscomb","Abilene Christian",NA,"400988914"
181,2,"15:48",948,"Jaren Lewis Turnover.",35,36,"Lipscomb","Abilene Christian",NA,"400988914"
182,2,"15:47",947,"Aaron Korn Steal.",35,36,"Lipscomb","Abilene Christian",NA,"400988914"
183,2,"15:34",934,"Rob Marberry missed Layup.",35,36,"Lipscomb","Abilene Christian",NA,"400988914"
184,2,"15:34",934,"Aaron Korn Offensive Rebound.",35,36,"Lipscomb","Abilene Christian",NA,"400988914"
185,2,"15:29",929,"Aaron Korn made Layup.",35,38,"Lipscomb","Abilene Christian",NA,"400988914"
186,2,"15:20",920,"Foul on Michael Buckland.",35,38,"Lipscomb","Abilene Christian",NA,"400988914"
187,2,"15:20",920,"Official TV Timeout",35,38,"Lipscomb","Abilene Christian",NA,"400988914"
188,2,"15:02",902,"Jaren Lewis made Layup. Assisted by Jaylen Franklin.",37,38,"Lipscomb","Abilene Christian",NA,"400988914"
189,2,"14:43",883,"Greg Jones Turnover.",37,38,"Lipscomb","Abilene Christian",NA,"400988914"
190,2,"14:42",882,"Jaylen Franklin Steal.",37,38,"Lipscomb","Abilene Christian",NA,"400988914"
191,2,"14:40",880,"Jaylen Franklin made Layup.",39,38,"Lipscomb","Abilene Christian",NA,"400988914"
192,2,"14:11",851,"Michael Buckland made Three Point Jumper. Assisted by Andrew Fleming.",39,41,"Lipscomb","Abilene Christian",NA,"400988914"
193,2,"13:47",827,"Drake Green missed Three Point Jumper.",39,41,"Lipscomb","Abilene Christian",NA,"400988914"
194,2,"13:47",827,"Greg Jones Defensive Rebound.",39,41,"Lipscomb","Abilene Christian",NA,"400988914"
195,2,"13:41",821,"Matt Rose missed Three Point Jumper.",39,41,"Lipscomb","Abilene Christian",NA,"400988914"
196,2,"13:41",821,"Matt Rose Offensive Rebound.",39,41,"Lipscomb","Abilene Christian",NA,"400988914"
197,2,"13:22",802,"Matt Rose missed Three Point Jumper.",39,41,"Lipscomb","Abilene Christian",NA,"400988914"
198,2,"13:22",802,"George Brammeier Offensive Rebound.",39,41,"Lipscomb","Abilene Christian",NA,"400988914"
199,2,"13:16",796,"Greg Jones missed Three Point Jumper.",39,41,"Lipscomb","Abilene Christian",NA,"400988914"
200,2,"13:16",796,"Drake Green Defensive Rebound.",39,41,"Lipscomb","Abilene Christian",NA,"400988914"
201,2,"13:14",794,"Foul on Andrew Fleming.",39,41,"Lipscomb","Abilene Christian",NA,"400988914"
202,2,"13:04",784,"Jalone Friday missed Jumper.",39,41,"Lipscomb","Abilene Christian",NA,"400988914"
203,2,"13:04",784,"George Brammeier Defensive Rebound.",39,41,"Lipscomb","Abilene Christian",NA,"400988914"
204,2,"12:52",772,"George Brammeier made Layup. Assisted by Aaron Korn.",39,43,"Lipscomb","Abilene Christian",NA,"400988914"
205,2,"12:34",754,"Tevin Foster made Three Point Jumper.",42,43,"Lipscomb","Abilene Christian",NA,"400988914"
206,2,"12:10",730,"Kenny Cooper Turnover.",42,43,"Lipscomb","Abilene Christian",NA,"400988914"
207,2,"12:09",729,"Tevin Foster Steal.",42,43,"Lipscomb","Abilene Christian",NA,"400988914"
208,2,"12:09",729,"Foul on Aaron Korn.",42,43,"Lipscomb","Abilene Christian",NA,"400988914"
209,2,"11:57",717,"Foul on Kenny Cooper.",42,43,"Lipscomb","Abilene Christian",NA,"400988914"
210,2,"11:57",717,"Official TV Timeout",42,43,"Lipscomb","Abilene Christian",NA,"400988914"
211,2,"11:55",715,"Tevin Foster Turnover.",42,43,"Lipscomb","Abilene Christian",NA,"400988914"
212,2,"11:25",685,"George Brammeier Turnover.",42,43,"Lipscomb","Abilene Christian",NA,"400988914"
213,2,"11:12",672,"Jaren Lewis made Jumper.",44,43,"Lipscomb","Abilene Christian",NA,"400988914"
214,2,"11:04",664,"Eli Pepper Turnover.",44,43,"Lipscomb","Abilene Christian",NA,"400988914"
215,2,"10:42",642,"Foul on Andrew Fleming.",44,43,"Lipscomb","Abilene Christian",NA,"400988914"
216,2,"10:22",622,"Jalone Friday missed Jumper.",44,43,"Lipscomb","Abilene Christian",NA,"400988914"
217,2,"10:22",622,"Rob Marberry Defensive Rebound.",44,43,"Lipscomb","Abilene Christian",NA,"400988914"
218,2,"10:10",610,"Garrison Mathews made Three Point Jumper. Assisted by Michael Buckland.",44,46,"Lipscomb","Abilene Christian",NA,"400988914"
219,2,"9:51",591,"Tevin Foster made Layup.",46,46,"Lipscomb","Abilene Christian",NA,"400988914"
220,2,"9:41",581,"Rob Marberry made Jumper.",46,48,"Lipscomb","Abilene Christian",NA,"400988914"
221,2,"9:21",561,"Jalone Friday made Jumper. Assisted by Isaiah Tripp.",48,48,"Lipscomb","Abilene Christian",NA,"400988914"
222,2,"9:08",548,"Foul on Tevin Foster.",48,48,"Lipscomb","Abilene Christian",NA,"400988914"
223,2,"9:08",548,"Eli Pepper made Free Throw.",48,49,"Lipscomb","Abilene Christian",NA,"400988914"
224,2,"9:08",548,"Eli Pepper made Free Throw.",48,50,"Lipscomb","Abilene Christian",NA,"400988914"
225,2,"8:45",525,"Isaiah Tripp missed Three Point Jumper.",48,50,"Lipscomb","Abilene Christian",NA,"400988914"
226,2,"8:45",525,"Michael Buckland Defensive Rebound.",48,50,"Lipscomb","Abilene Christian",NA,"400988914"
227,2,"8:33",513,"Foul on Jalone Friday.",48,50,"Lipscomb","Abilene Christian",NA,"400988914"
228,2,"8:33",513,"Rob Marberry made Free Throw.",48,51,"Lipscomb","Abilene Christian",NA,"400988914"
229,2,"8:33",513,"Rob Marberry missed Free Throw.",48,51,"Lipscomb","Abilene Christian",NA,"400988914"
230,2,"8:33",513,"Jaren Lewis Defensive Rebound.",48,51,"Lipscomb","Abilene Christian",NA,"400988914"
231,2,"8:21",501,"Foul on Rob Marberry.",48,51,"Lipscomb","Abilene Christian",NA,"400988914"
232,2,"8:21",501,"Jalone Friday missed Free Throw.",48,51,"Lipscomb","Abilene Christian",NA,"400988914"
233,2,"8:21",501,"Eli Pepper Defensive Rebound.",48,51,"Lipscomb","Abilene Christian",NA,"400988914"
234,2,"8:08",488,"Rob Marberry missed Jumper.",48,51,"Lipscomb","Abilene Christian",NA,"400988914"
235,2,"8:08",488,"Jalone Friday Block.",48,51,"Lipscomb","Abilene Christian",NA,"400988914"
236,2,"8:07",487,"Isaiah Tripp Defensive Rebound.",48,51,"Lipscomb","Abilene Christian",NA,"400988914"
237,2,"8:02",482,"Jaylen Franklin made Jumper.",50,51,"Lipscomb","Abilene Christian",NA,"400988914"
238,2,"7:50",470,"Foul on Tevin Foster.",50,51,"Lipscomb","Abilene Christian",NA,"400988914"
239,2,"7:50",470,"Official TV Timeout",50,51,"Lipscomb","Abilene Christian",NA,"400988914"
240,2,"7:36",456,"Rob Marberry made Jumper.",50,53,"Lipscomb","Abilene Christian",NA,"400988914"
241,2,"7:14",434,"Foul on Rob Marberry.",50,53,"Lipscomb","Abilene Christian",NA,"400988914"
242,2,"7:14",434,"Hayden Farquhar made Free Throw.",51,53,"Lipscomb","Abilene Christian",NA,"400988914"
243,2,"7:14",434,"Hayden Farquhar missed Free Throw.",51,53,"Lipscomb","Abilene Christian",NA,"400988914"
244,2,"7:14",434,"Eli Pepper Defensive Rebound.",51,53,"Lipscomb","Abilene Christian",NA,"400988914"
245,2,"7:05",425,"Garrison Mathews missed Three Point Jumper.",51,53,"Lipscomb","Abilene Christian",NA,"400988914"
246,2,"7:05",425,"Tevin Foster Defensive Rebound.",51,53,"Lipscomb","Abilene Christian",NA,"400988914"
247,2,"6:58",418,"Tevin Foster made Layup.",53,53,"Lipscomb","Abilene Christian",NA,"400988914"
248,2,"6:45",405,"Kenny Cooper made Layup.",53,55,"Lipscomb","Abilene Christian",NA,"400988914"
249,2,"6:31",391,"Foul on Matt Rose.",53,55,"Lipscomb","Abilene Christian",NA,"400988914"
250,2,"6:31",391,"Tevin Foster missed Free Throw.",53,55,"Lipscomb","Abilene Christian",NA,"400988914"
251,2,"6:31",391,"Garrison Mathews Defensive Rebound.",53,55,"Lipscomb","Abilene Christian",NA,"400988914"
252,2,"6:18",378,"Eli Pepper made Jumper.",53,57,"Lipscomb","Abilene Christian",NA,"400988914"
253,2,"6:01",361,"Jaren Lewis missed Layup.",53,57,"Lipscomb","Abilene Christian",NA,"400988914"
254,2,"6:01",361,"Eli Pepper Defensive Rebound.",53,57,"Lipscomb","Abilene Christian",NA,"400988914"
255,2,"5:55",355,"Eli Pepper Turnover.",53,57,"Lipscomb","Abilene Christian",NA,"400988914"
256,2,"5:54",354,"Jaren Lewis Steal.",53,57,"Lipscomb","Abilene Christian",NA,"400988914"
257,2,"5:45",345,"Foul on Jaren Lewis.",53,57,"Lipscomb","Abilene Christian",NA,"400988914"
258,2,"5:45",345,"Jaren Lewis Turnover.",53,57,"Lipscomb","Abilene Christian",NA,"400988914"
259,2,"5:31",331,"Andrew Fleming missed Three Point Jumper.",53,57,"Lipscomb","Abilene Christian",NA,"400988914"
260,2,"5:31",331,"Isaiah Tripp Defensive Rebound.",53,57,"Lipscomb","Abilene Christian",NA,"400988914"
261,2,"5:25",325,"Jaren Lewis made Layup. Assisted by Jaylen Franklin.",55,57,"Lipscomb","Abilene Christian",NA,"400988914"
262,2,"4:59",299,"Jaren Lewis made Free Throw.",56,57,"Lipscomb","Abilene Christian",NA,"400988914"
263,2,"4:59",299,"Garrison Mathews missed Free Throw.",56,57,"Lipscomb","Abilene Christian",NA,"400988914"
264,2,"4:59",299,"Jaren Lewis made Free Throw.",57,57,"Lipscomb","Abilene Christian",NA,"400988914"
265,2,"4:59",299,"Foul on Tevin Foster.",57,57,"Lipscomb","Abilene Christian",NA,"400988914"
266,2,"4:59",299,"Jaren Lewis Defensive Rebound.",57,57,"Lipscomb","Abilene Christian",NA,"400988914"
267,2,"4:59",299,"Foul on Matt Rose.",57,57,"Lipscomb","Abilene Christian",NA,"400988914"
268,2,"4:53",293,"Matt Rose missed Three Point Jumper.",57,57,"Lipscomb","Abilene Christian",NA,"400988914"
269,2,"4:53",293,"Garrison Mathews Offensive Rebound.",57,57,"Lipscomb","Abilene Christian",NA,"400988914"
270,2,"4:50",290,"Garrison Mathews made Layup.",57,59,"Lipscomb","Abilene Christian",NA,"400988914"
271,2,"4:50",290,"Michael Buckland missed Three Point Jumper.",57,59,"Lipscomb","Abilene Christian",NA,"400988914"
272,2,"4:50",290,"Isaiah Tripp Defensive Rebound.",57,59,"Lipscomb","Abilene Christian",NA,"400988914"
273,2,"4:27",267,"Foul on Jaren Lewis.",57,59,"Lipscomb","Abilene Christian",NA,"400988914"
274,2,"4:26",266,"Jaren Lewis Turnover.",57,59,"Lipscomb","Abilene Christian",NA,"400988914"
275,2,"4:18",258,"Foul on B.J. Maxwell.",57,59,"Lipscomb","Abilene Christian",NA,"400988914"
276,2,"4:18",258,"Andrew Fleming made Free Throw.",57,60,"Lipscomb","Abilene Christian",NA,"400988914"
277,2,"4:18",258,"Andrew Fleming missed Free Throw.",57,60,"Lipscomb","Abilene Christian",NA,"400988914"
278,2,"4:18",258,"B.J. Maxwell Defensive Rebound.",57,60,"Lipscomb","Abilene Christian",NA,"400988914"
279,2,"3:58",238,"B.J. Maxwell missed Jumper.",57,60,"Lipscomb","Abilene Christian",NA,"400988914"
280,2,"3:58",238,"Eli Pepper Defensive Rebound.",57,60,"Lipscomb","Abilene Christian",NA,"400988914"
281,2,"3:39",219,"Foul on Jaylen Franklin.",57,60,"Lipscomb","Abilene Christian",NA,"400988914"
282,2,"3:37",217,"Official TV Timeout",57,60,"Lipscomb","Abilene Christian",NA,"400988914"
283,2,"3:37",217,"Matt Rose made Free Throw.",57,61,"Lipscomb","Abilene Christian",NA,"400988914"
284,2,"3:37",217,"Matt Rose made Free Throw.",57,62,"Lipscomb","Abilene Christian",NA,"400988914"
285,2,"3:24",204,"Foul on Eli Pepper.",57,62,"Lipscomb","Abilene Christian",NA,"400988914"
286,2,"3:19",199,"Jalone Friday missed Free Throw.",57,62,"Lipscomb","Abilene Christian",NA,"400988914"
287,2,"3:19",199,"Abilene Christian Deadball Team Rebound.",57,62,"Lipscomb","Abilene Christian",NA,"400988914"
288,2,"3:19",199,"Jalone Friday made Free Throw.",58,62,"Lipscomb","Abilene Christian",NA,"400988914"
289,2,"3:07",187,"Rob Marberry made Layup. Assisted by Michael Buckland.",58,64,"Lipscomb","Abilene Christian",NA,"400988914"
290,2,"2:58",178,"Foul on Kenny Cooper.",58,64,"Lipscomb","Abilene Christian",NA,"400988914"
291,2,"2:58",178,"Tevin Foster made Free Throw.",59,64,"Lipscomb","Abilene Christian",NA,"400988914"
292,2,"2:58",178,"Tevin Foster made Free Throw.",60,64,"Lipscomb","Abilene Christian",NA,"400988914"
293,2,"2:30",150,"Garrison Mathews missed Jumper.",60,64,"Lipscomb","Abilene Christian",NA,"400988914"
294,2,"2:30",150,"Tevin Foster Defensive Rebound.",60,64,"Lipscomb","Abilene Christian",NA,"400988914"
295,2,"2:26",146,"Foul on Michael Buckland.",60,64,"Lipscomb","Abilene Christian",NA,"400988914"
296,2,"2:26",146,"Tevin Foster made Free Throw.",61,64,"Lipscomb","Abilene Christian",NA,"400988914"
297,2,"2:26",146,"Tevin Foster made Free Throw.",62,64,"Lipscomb","Abilene Christian",NA,"400988914"
298,2,"2:12",132,"Garrison Mathews Turnover.",62,64,"Lipscomb","Abilene Christian",NA,"400988914"
299,2,"2:12",132,"Isaiah Tripp Steal.",62,64,"Lipscomb","Abilene Christian",NA,"400988914"
300,2,"2:02",122,"Foul on Garrison Mathews.",62,64,"Lipscomb","Abilene Christian",NA,"400988914"
301,2,"2:02",122,"Jaren Lewis missed Free Throw.",62,64,"Lipscomb","Abilene Christian",NA,"400988914"
302,2,"2:02",122,"Abilene Christian Deadball Team Rebound.",62,64,"Lipscomb","Abilene Christian",NA,"400988914"
303,2,"2:02",122,"Jaren Lewis made Free Throw.",63,64,"Lipscomb","Abilene Christian",NA,"400988914"
304,2,"1:54",114,"Matt Rose made Three Point Jumper. Assisted by Kenny Cooper.",63,67,"Lipscomb","Abilene Christian",NA,"400988914"
305,2,"1:22",82,"Jaylen Franklin missed Three Point Jumper.",63,67,"Lipscomb","Abilene Christian",NA,"400988914"
306,2,"1:22",82,"Michael Buckland Defensive Rebound.",63,67,"Lipscomb","Abilene Christian",NA,"400988914"
307,2,"0:55",55,"Michael Buckland made Layup.",63,69,"Lipscomb","Abilene Christian",NA,"400988914"
308,2,"0:46",46,"Isaiah Tripp made Layup. Assisted by Jaylen Franklin.",65,69,"Lipscomb","Abilene Christian",NA,"400988914"
309,2,"0:32",32,"Foul on Jaren Lewis.",65,69,"Lipscomb","Abilene Christian",NA,"400988914"
310,2,"0:32",32,"Matt Rose made Free Throw.",65,70,"Lipscomb","Abilene Christian",NA,"400988914"
311,2,"0:32",32,"Matt Rose made Free Throw.",65,71,"Lipscomb","Abilene Christian",NA,"400988914"
312,2,"0:28",28,"Jaylen Franklin made Layup.",67,71,"Lipscomb","Abilene Christian",NA,"400988914"
313,2,"0:24",24,"Abilene Christian  Timeout",67,71,"Lipscomb","Abilene Christian",NA,"400988914"
314,2,"0:20",20,"Foul on Jaren Lewis.",67,71,"Lipscomb","Abilene Christian",NA,"400988914"
315,2,"0:20",20,"Michael Buckland made Free Throw.",67,72,"Lipscomb","Abilene Christian",NA,"400988914"
316,2,"0:20",20,"Michael Buckland made Free Throw.",67,73,"Lipscomb","Abilene Christian",NA,"400988914"
317,2,"0:13",13,"Tevin Foster missed Three Point Jumper.",67,73,"Lipscomb","Abilene Christian",NA,"400988914"
318,2,"0:13",13,"Matt Rose Defensive Rebound.",67,73,"Lipscomb","Abilene Christian",NA,"400988914"
319,2,"0:12",12,"Foul on Drake Green.",67,73,"Lipscomb","Abilene Christian",NA,"400988914"
320,2,"0:12",12,"Matt Rose made Free Throw.",67,74,"Lipscomb","Abilene Christian",NA,"400988914"
321,2,"0:12",12,"Matt Rose made Free Throw.",67,75,"Lipscomb","Abilene Christian",NA,"400988914"
322,2,"0:07",7,"Isaiah Tripp missed Three Point Jumper.",67,75,"Lipscomb","Abilene Christian",NA,"400988914"
323,2,"0:07",7,"Jalone Friday Offensive Rebound.",67,75,"Lipscomb","Abilene Christian",NA,"400988914"
324,2,"0:02",2,"Jalone Friday missed Jumper.",67,75,"Lipscomb","Abilene Christian",NA,"400988914"
325,2,"0:02",2,"Michael Buckland Defensive Rebound.",67,75,"Lipscomb","Abilene Christian",NA,"400988914"
326,2,"0:00",0,"End of Game",67,75,"Lipscomb","Abilene Christian",NA,"400988914"
1,1,"20:00",2700,"PLAY",0,0,"Abilene Christian","Campbell",NA,"400988922"
2,1,"19:51",2691,"Jaren Lewis made Layup. Assisted by Isaiah Tripp.",0,2,"Abilene Christian","Campbell",NA,"400988922"
3,1,"19:31",2671,"Cory Gensler Turnover.",0,2,"Abilene Christian","Campbell",NA,"400988922"
4,1,"19:30",2670,"Tevin Foster Steal.",0,2,"Abilene Christian","Campbell",NA,"400988922"
5,1,"19:18",2658,"Isaiah Tripp missed Layup.",0,2,"Abilene Christian","Campbell",NA,"400988922"
6,1,"19:18",2658,"Cory Gensler Defensive Rebound.",0,2,"Abilene Christian","Campbell",NA,"400988922"
7,1,"19:15",2655,"Marcus Burk missed Three Point Jumper.",0,2,"Abilene Christian","Campbell",NA,"400988922"
8,1,"19:15",2655,"Campbell Offensive Rebound.",0,2,"Abilene Christian","Campbell",NA,"400988922"
9,1,"18:56",2636,"Chris Clemons missed Three Point Jumper.",0,2,"Abilene Christian","Campbell",NA,"400988922"
10,1,"18:56",2636,"Tevin Foster Defensive Rebound.",0,2,"Abilene Christian","Campbell",NA,"400988922"
11,1,"18:37",2617,"Isaiah Tripp made Jumper.",0,4,"Abilene Christian","Campbell",NA,"400988922"
12,1,"18:23",2603,"Andrew Eudy made Layup.",2,4,"Abilene Christian","Campbell",NA,"400988922"
13,1,"18:09",2589,"Foul on Andrew Eudy.",2,4,"Abilene Christian","Campbell",NA,"400988922"
14,1,"18:07",2587,"Hayden Howell made Jumper. Assisted by Jaylen Franklin.",2,6,"Abilene Christian","Campbell",NA,"400988922"
15,1,"17:50",2570,"Marcus Burk Turnover.",2,6,"Abilene Christian","Campbell",NA,"400988922"
16,1,"17:47",2567,"Jaren Lewis Steal.",2,6,"Abilene Christian","Campbell",NA,"400988922"
17,1,"17:45",2565,"Tevin Foster missed Jumper.",2,6,"Abilene Christian","Campbell",NA,"400988922"
18,1,"17:45",2565,"Andrew Eudy Defensive Rebound.",2,6,"Abilene Christian","Campbell",NA,"400988922"
19,1,"17:31",2551,"Marcus Burk made Three Point Jumper. Assisted by Andrew Eudy.",5,6,"Abilene Christian","Campbell",NA,"400988922"
20,1,"17:19",2539,"Foul on Chris Clemons.",5,6,"Abilene Christian","Campbell",NA,"400988922"
21,1,"17:10",2530,"Hayden Howell made Jumper. Assisted by Tevin Foster.",5,8,"Abilene Christian","Campbell",NA,"400988922"
22,1,"16:51",2511,"Andrew Eudy made Jumper. Assisted by Ja'Cor Nelson.",7,8,"Abilene Christian","Campbell",NA,"400988922"
23,1,"16:25",2485,"Jaylen Franklin made Layup.",7,10,"Abilene Christian","Campbell",NA,"400988922"
24,1,"16:05",2465,"Foul on Jaren Lewis.",7,10,"Abilene Christian","Campbell",NA,"400988922"
25,1,"16:05",2465,"Shane Whitfield made Free Throw.",8,10,"Abilene Christian","Campbell",NA,"400988922"
26,1,"16:05",2465,"Shane Whitfield made Free Throw.",9,10,"Abilene Christian","Campbell",NA,"400988922"
27,1,"15:45",2445,"Hayden Howell made Jumper. Assisted by Jaylen Franklin.",9,12,"Abilene Christian","Campbell",NA,"400988922"
28,1,"15:34",2434,"Official TV Timeout",9,12,"Abilene Christian","Campbell",NA,"400988922"
29,1,"15:34",2434,"Foul on Isaiah Tripp.",9,12,"Abilene Christian","Campbell",NA,"400988922"
30,1,"15:33",2433,"Chris Clemons missed Three Point Jumper.",9,12,"Abilene Christian","Campbell",NA,"400988922"
31,1,"15:33",2433,"Andrew Eudy Offensive Rebound.",9,12,"Abilene Christian","Campbell",NA,"400988922"
32,1,"15:18",2418,"Shane Whitfield missed Jumper.",9,12,"Abilene Christian","Campbell",NA,"400988922"
33,1,"15:18",2418,"Jaren Lewis Defensive Rebound.",9,12,"Abilene Christian","Campbell",NA,"400988922"
34,1,"15:12",2412,"B.J. Maxwell made Three Point Jumper. Assisted by Jalone Friday.",9,15,"Abilene Christian","Campbell",NA,"400988922"
35,1,"14:39",2379,"Cory Gensler missed Layup.",9,15,"Abilene Christian","Campbell",NA,"400988922"
36,1,"14:39",2379,"Jalone Friday Defensive Rebound.",9,15,"Abilene Christian","Campbell",NA,"400988922"
37,1,"14:20",2360,"B.J. Maxwell missed Layup.",9,15,"Abilene Christian","Campbell",NA,"400988922"
38,1,"14:20",2360,"Shane Whitfield Defensive Rebound.",9,15,"Abilene Christian","Campbell",NA,"400988922"
39,1,"14:13",2353,"Shane Whitfield missed Layup.",9,15,"Abilene Christian","Campbell",NA,"400988922"
40,1,"14:13",2353,"Jalone Friday Block.",9,15,"Abilene Christian","Campbell",NA,"400988922"
41,1,"14:12",2352,"B.J. Maxwell Defensive Rebound.",9,15,"Abilene Christian","Campbell",NA,"400988922"
42,1,"14:07",2347,"B.J. Maxwell made Layup.",9,17,"Abilene Christian","Campbell",NA,"400988922"
43,1,"13:49",2329,"Andrew Eudy missed Jumper.",9,17,"Abilene Christian","Campbell",NA,"400988922"
44,1,"13:49",2329,"Jaren Lewis Defensive Rebound.",9,17,"Abilene Christian","Campbell",NA,"400988922"
45,1,"13:28",2308,"Payten Ricks missed Jumper.",9,17,"Abilene Christian","Campbell",NA,"400988922"
46,1,"13:28",2308,"Jalone Friday Offensive Rebound.",9,17,"Abilene Christian","Campbell",NA,"400988922"
47,1,"13:04",2284,"Jaren Lewis Turnover.",9,17,"Abilene Christian","Campbell",NA,"400988922"
48,1,"12:40",2260,"Shane Whitfield missed Jumper.",9,17,"Abilene Christian","Campbell",NA,"400988922"
49,1,"12:40",2260,"Ja'Cor Nelson Offensive Rebound.",9,17,"Abilene Christian","Campbell",NA,"400988922"
50,1,"12:37",2257,"Foul on B.J. Maxwell.",9,17,"Abilene Christian","Campbell",NA,"400988922"
51,1,"12:37",2257,"Ja'Cor Nelson made Free Throw.",10,17,"Abilene Christian","Campbell",NA,"400988922"
52,1,"12:37",2257,"Ja'Cor Nelson missed Free Throw.",10,17,"Abilene Christian","Campbell",NA,"400988922"
53,1,"12:37",2257,"Hayden Farquhar Defensive Rebound.",10,17,"Abilene Christian","Campbell",NA,"400988922"
54,1,"12:24",2244,"Drake Green Turnover.",10,17,"Abilene Christian","Campbell",NA,"400988922"
55,1,"12:22",2242,"Shane Whitfield Steal.",10,17,"Abilene Christian","Campbell",NA,"400988922"
56,1,"12:19",2239,"Damontez Oliver missed Three Point Jumper.",10,17,"Abilene Christian","Campbell",NA,"400988922"
57,1,"12:19",2239,"Hayden Farquhar Block.",10,17,"Abilene Christian","Campbell",NA,"400988922"
58,1,"12:16",2236,"Jalone Friday Defensive Rebound.",10,17,"Abilene Christian","Campbell",NA,"400988922"
59,1,"12:08",2228,"Payten Ricks made Layup. Assisted by Jalone Friday.",10,19,"Abilene Christian","Campbell",NA,"400988922"
60,1,"12:07",2227,"Foul on Cory Gensler.",10,19,"Abilene Christian","Campbell",NA,"400988922"
61,1,"12:07",2227,"Payten Ricks made Free Throw.",10,20,"Abilene Christian","Campbell",NA,"400988922"
62,1,"11:56",2216,"Official TV Timeout",10,20,"Abilene Christian","Campbell",NA,"400988922"
63,1,"11:44",2204,"Damontez Oliver Turnover.",10,20,"Abilene Christian","Campbell",NA,"400988922"
64,1,"11:43",2203,"Foul on Damontez Oliver.",10,20,"Abilene Christian","Campbell",NA,"400988922"
65,1,"11:21",2181,"Kolton Kohl missed Layup.",10,20,"Abilene Christian","Campbell",NA,"400988922"
66,1,"11:21",2181,"Mogga Lado Block.",10,20,"Abilene Christian","Campbell",NA,"400988922"
67,1,"11:20",2180,"Shane Whitfield Defensive Rebound.",10,20,"Abilene Christian","Campbell",NA,"400988922"
68,1,"11:12",2172,"Foul on Drake Green.",10,20,"Abilene Christian","Campbell",NA,"400988922"
69,1,"11:12",2172,"Shane Whitfield made Free Throw.",11,20,"Abilene Christian","Campbell",NA,"400988922"
70,1,"11:12",2172,"Shane Whitfield missed Free Throw.",11,20,"Abilene Christian","Campbell",NA,"400988922"
71,1,"11:12",2172,"Jaren Lewis Defensive Rebound.",11,20,"Abilene Christian","Campbell",NA,"400988922"
72,1,"10:45",2145,"Jaren Lewis missed Jumper.",11,20,"Abilene Christian","Campbell",NA,"400988922"
73,1,"10:45",2145,"Chris Clemons Defensive Rebound.",11,20,"Abilene Christian","Campbell",NA,"400988922"
74,1,"10:21",2121,"Chris Clemons missed Layup.",11,20,"Abilene Christian","Campbell",NA,"400988922"
75,1,"10:21",2121,"Drake Green Defensive Rebound.",11,20,"Abilene Christian","Campbell",NA,"400988922"
76,1,"10:14",2114,"Kolton Kohl made Layup. Assisted by Jaren Lewis.",11,22,"Abilene Christian","Campbell",NA,"400988922"
77,1,"9:48",2088,"Jordan Whitfield missed Jumper.",11,22,"Abilene Christian","Campbell",NA,"400988922"
78,1,"9:48",2088,"Kolton Kohl Defensive Rebound.",11,22,"Abilene Christian","Campbell",NA,"400988922"
79,1,"9:34",2074,"Jaren Lewis missed Layup.",11,22,"Abilene Christian","Campbell",NA,"400988922"
80,1,"9:34",2074,"Shane Whitfield Defensive Rebound.",11,22,"Abilene Christian","Campbell",NA,"400988922"
81,1,"9:17",2057,"Chris Clemons made Three Point Jumper. Assisted by Shane Whitfield.",14,22,"Abilene Christian","Campbell",NA,"400988922"
82,1,"8:56",2036,"Jaren Lewis made Layup. Assisted by Kolton Kohl.",14,24,"Abilene Christian","Campbell",NA,"400988922"
83,1,"8:35",2015,"Jordan Whitfield Turnover.",14,24,"Abilene Christian","Campbell",NA,"400988922"
84,1,"8:34",2014,"Jaren Lewis Steal.",14,24,"Abilene Christian","Campbell",NA,"400988922"
85,1,"8:30",2010,"Jaren Lewis made Dunk. Assisted by Tevin Foster.",14,26,"Abilene Christian","Campbell",NA,"400988922"
86,1,"8:29",2009,"Abilene Christian  Timeout",14,26,"Abilene Christian","Campbell",NA,"400988922"
87,1,"8:29",2009,"Official TV Timeout",14,26,"Abilene Christian","Campbell",NA,"400988922"
88,1,"8:05",1985,"Foul on Trey Lenox.",14,26,"Abilene Christian","Campbell",NA,"400988922"
89,1,"8:05",1985,"Mogga Lado made Free Throw.",15,26,"Abilene Christian","Campbell",NA,"400988922"
90,1,"8:05",1985,"Mogga Lado made Free Throw.",16,26,"Abilene Christian","Campbell",NA,"400988922"
91,1,"7:44",1964,"Payten Ricks made Three Point Jumper. Assisted by Isaiah Tripp.",16,29,"Abilene Christian","Campbell",NA,"400988922"
92,1,"7:16",1936,"Marcus Burk made Jumper.",18,29,"Abilene Christian","Campbell",NA,"400988922"
93,1,"6:49",1909,"Trey Lenox Turnover.",18,29,"Abilene Christian","Campbell",NA,"400988922"
94,1,"6:34",1894,"Ja'Cor Nelson made Jumper.",20,29,"Abilene Christian","Campbell",NA,"400988922"
95,1,"6:14",1874,"Hayden Howell missed Jumper.",20,29,"Abilene Christian","Campbell",NA,"400988922"
96,1,"6:14",1874,"Andrew Eudy Defensive Rebound.",20,29,"Abilene Christian","Campbell",NA,"400988922"
97,1,"6:04",1864,"Chris Clemons made Layup.",22,29,"Abilene Christian","Campbell",NA,"400988922"
98,1,"6:02",1862,"Abilene Christian  Timeout",22,29,"Abilene Christian","Campbell",NA,"400988922"
99,1,"6:01",1861,"B.J. Maxwell Steal.",22,29,"Abilene Christian","Campbell",NA,"400988922"
100,1,"5:59",1859,"Isaiah Tripp Turnover.",22,29,"Abilene Christian","Campbell",NA,"400988922"
