"play_id","half","time_remaining_half","secs_remaining","description","home_score","away_score","away","home","home_favored_by","game_id"
375,2,"1:07",67,"Concordia (AL) Defensive Rebound.",102,51,"Concordia College (AL)","Alcorn State",NA,"400992862"
376,2,"0:52",52,"Markel Carlton missed Layup.",102,51,"Concordia College (AL)","Alcorn State",NA,"400992862"
377,2,"0:52",52,"Kobe Wilson Block.",102,51,"Concordia College (AL)","Alcorn State",NA,"400992862"
378,2,"0:46",46,"Juwan Henderson Defensive Rebound.",102,51,"Concordia College (AL)","Alcorn State",NA,"400992862"
379,2,"0:41",41,"James Stokes missed Layup.",102,51,"Concordia College (AL)","Alcorn State",NA,"400992862"
380,2,"0:41",41,"Markel Carlton Block.",102,51,"Concordia College (AL)","Alcorn State",NA,"400992862"
381,2,"0:38",38,"David Freeman Defensive Rebound.",102,51,"Concordia College (AL)","Alcorn State",NA,"400992862"
382,2,"0:38",38,"Concordia (AL)  Timeout",102,51,"Concordia College (AL)","Alcorn State",NA,"400992862"
383,2,"0:38",38,"Sammy Frazier made Layup.",102,53,"Concordia College (AL)","Alcorn State",NA,"400992862"
384,2,"0:31",31,"Juwan Henderson Turnover.",102,53,"Concordia College (AL)","Alcorn State",NA,"400992862"
385,2,"0:30",30,"Josh Williamson Steal.",102,53,"Concordia College (AL)","Alcorn State",NA,"400992862"
386,2,"0:29",29,"Josh Williamson made Layup.",102,55,"Concordia College (AL)","Alcorn State",NA,"400992862"
387,2,"0:29",29,"Foul on Kobe Wilson.",102,55,"Concordia College (AL)","Alcorn State",NA,"400992862"
388,2,"0:29",29,"Josh Williamson made Free Throw.",102,56,"Concordia College (AL)","Alcorn State",NA,"400992862"
389,2,"0:22",22,"Foul on Josh Williamson.",102,56,"Concordia College (AL)","Alcorn State",NA,"400992862"
390,2,"0:22",22,"Juwan Henderson made Free Throw.",103,56,"Concordia College (AL)","Alcorn State",NA,"400992862"
391,2,"0:22",22,"Juwan Henderson missed Free Throw.",103,56,"Concordia College (AL)","Alcorn State",NA,"400992862"
392,2,"0:22",22,"Markel Carlton Defensive Rebound.",103,56,"Concordia College (AL)","Alcorn State",NA,"400992862"
393,2,"0:12",12,"Josh Williamson missed Three Point Jumper.",103,56,"Concordia College (AL)","Alcorn State",NA,"400992862"
394,2,"0:12",12,"Kobe Wilson Defensive Rebound.",103,56,"Concordia College (AL)","Alcorn State",NA,"400992862"
395,2,"0:05",5,"Kobe Wilson Turnover.",103,56,"Concordia College (AL)","Alcorn State",NA,"400992862"
396,2,"0:04",4,"Kevin Dennis Steal.",103,56,"Concordia College (AL)","Alcorn State",NA,"400992862"
397,2,"0:02",2,"Josh Williamson missed Three Point Jumper.",103,56,"Concordia College (AL)","Alcorn State",NA,"400992862"
398,2,"0:02",2,"Alcorn State Defensive Rebound.",103,56,"Concordia College (AL)","Alcorn State",NA,"400992862"
399,2,"0:00",0,"End of Game",103,56,"Concordia College (AL)","Alcorn State",NA,"400992862"
1,1,"20:00",2400,"PLAY",0,0,"Alcorn State","Tulane",NA,"400987979"
2,1,"19:35",2375,"Blake Paul Turnover.",0,0,"Alcorn State","Tulane",NA,"400987979"
3,1,"19:25",2365,"Dante Sterling missed Three Point Jumper.",0,0,"Alcorn State","Tulane",NA,"400987979"
4,1,"19:25",2365,"Jordan Cornish Defensive Rebound.",0,0,"Alcorn State","Tulane",NA,"400987979"
5,1,"19:00",2340,"Cameron Reynolds made Three Point Jumper. Assisted by Ray Ona Embo.",3,0,"Alcorn State","Tulane",NA,"400987979"
6,1,"18:37",2317,"A.J. Mosby made Three Point Jumper. Assisted by Avery Patterson.",3,3,"Alcorn State","Tulane",NA,"400987979"
7,1,"18:18",2298,"Jordan Cornish missed Three Point Jumper.",3,3,"Alcorn State","Tulane",NA,"400987979"
8,1,"18:18",2298,"A.J. Mosby Defensive Rebound.",3,3,"Alcorn State","Tulane",NA,"400987979"
9,1,"18:11",2291,"A.J. Mosby made Three Point Jumper.",3,6,"Alcorn State","Tulane",NA,"400987979"
10,1,"17:45",2265,"Cameron Reynolds missed Jumper.",3,6,"Alcorn State","Tulane",NA,"400987979"
11,1,"17:45",2265,"Reginal Johnson Defensive Rebound.",3,6,"Alcorn State","Tulane",NA,"400987979"
12,1,"17:23",2243,"Yalen Reed missed Three Point Jumper.",3,6,"Alcorn State","Tulane",NA,"400987979"
13,1,"17:23",2243,"Jordan Cornish Defensive Rebound.",3,6,"Alcorn State","Tulane",NA,"400987979"
14,1,"17:14",2234,"Melvin Frazier missed Three Point Jumper.",3,6,"Alcorn State","Tulane",NA,"400987979"
15,1,"17:14",2234,"A.J. Mosby Defensive Rebound.",3,6,"Alcorn State","Tulane",NA,"400987979"
16,1,"17:06",2226,"Avery Patterson made Jumper.",3,8,"Alcorn State","Tulane",NA,"400987979"
17,1,"16:46",2206,"Foul on Yalen Reed.",3,8,"Alcorn State","Tulane",NA,"400987979"
18,1,"16:46",2206,"Ray Ona Embo missed Free Throw.",3,8,"Alcorn State","Tulane",NA,"400987979"
19,1,"16:46",2206,"Tulane Deadball Team Rebound.",3,8,"Alcorn State","Tulane",NA,"400987979"
20,1,"16:46",2206,"Ray Ona Embo made Free Throw.",4,8,"Alcorn State","Tulane",NA,"400987979"
21,1,"16:38",2198,"A.J. Mosby missed Three Point Jumper.",4,8,"Alcorn State","Tulane",NA,"400987979"
22,1,"16:38",2198,"Reginal Johnson Offensive Rebound.",4,8,"Alcorn State","Tulane",NA,"400987979"
23,1,"16:33",2193,"Reginal Johnson made Layup.",4,10,"Alcorn State","Tulane",NA,"400987979"
24,1,"16:17",2177,"Jordan Cornish made Three Point Jumper. Assisted by Ray Ona Embo.",7,10,"Alcorn State","Tulane",NA,"400987979"
25,1,"15:44",2144,"Reginal Johnson missed Three Point Jumper.",7,10,"Alcorn State","Tulane",NA,"400987979"
26,1,"15:44",2144,"Dante Sterling Offensive Rebound.",7,10,"Alcorn State","Tulane",NA,"400987979"
27,1,"15:41",2141,"Dante Sterling missed Layup.",7,10,"Alcorn State","Tulane",NA,"400987979"
28,1,"15:41",2141,"Cameron Reynolds Block.",7,10,"Alcorn State","Tulane",NA,"400987979"
29,1,"15:40",2140,"Blake Paul Defensive Rebound.",7,10,"Alcorn State","Tulane",NA,"400987979"
30,1,"15:33",2133,"Foul on Devon Brewer.",7,10,"Alcorn State","Tulane",NA,"400987979"
31,1,"15:33",2133,"Official TV Timeout",7,10,"Alcorn State","Tulane",NA,"400987979"
32,1,"15:33",2133,"Melvin Frazier made Free Throw.",8,10,"Alcorn State","Tulane",NA,"400987979"
33,1,"15:33",2133,"Melvin Frazier made Free Throw.",9,10,"Alcorn State","Tulane",NA,"400987979"
34,1,"15:21",2121,"Avery Patterson missed Three Point Jumper.",9,10,"Alcorn State","Tulane",NA,"400987979"
35,1,"15:21",2121,"Samir Sehic Defensive Rebound.",9,10,"Alcorn State","Tulane",NA,"400987979"
36,1,"15:10",2110,"Cameron Reynolds missed Three Point Jumper.",9,10,"Alcorn State","Tulane",NA,"400987979"
37,1,"15:10",2110,"A.J. Mosby Defensive Rebound.",9,10,"Alcorn State","Tulane",NA,"400987979"
38,1,"14:45",2085,"Reginal Johnson missed Three Point Jumper.",9,10,"Alcorn State","Tulane",NA,"400987979"
39,1,"14:45",2085,"Jordan Cornish Defensive Rebound.",9,10,"Alcorn State","Tulane",NA,"400987979"
40,1,"14:20",2060,"Ray Ona Embo missed Layup.",9,10,"Alcorn State","Tulane",NA,"400987979"
41,1,"14:20",2060,"A.J. Mosby Block.",9,10,"Alcorn State","Tulane",NA,"400987979"
42,1,"14:18",2058,"A.J. Mosby Defensive Rebound.",9,10,"Alcorn State","Tulane",NA,"400987979"
43,1,"14:10",2050,"Devon Brewer Turnover.",9,10,"Alcorn State","Tulane",NA,"400987979"
44,1,"13:58",2038,"Cameron Reynolds made Layup.",11,10,"Alcorn State","Tulane",NA,"400987979"
45,1,"13:58",2038,"Foul on Devon Brewer.",11,10,"Alcorn State","Tulane",NA,"400987979"
46,1,"13:58",2038,"Cameron Reynolds made Free Throw.",12,10,"Alcorn State","Tulane",NA,"400987979"
47,1,"13:38",2018,"Reginal Johnson missed Layup.",12,10,"Alcorn State","Tulane",NA,"400987979"
48,1,"13:38",2018,"Cameron Reynolds Block.",12,10,"Alcorn State","Tulane",NA,"400987979"
49,1,"13:37",2017,"Reginal Johnson Offensive Rebound.",12,10,"Alcorn State","Tulane",NA,"400987979"
50,1,"13:35",2015,"Reginal Johnson missed Layup.",12,10,"Alcorn State","Tulane",NA,"400987979"
51,1,"13:35",2015,"Alcorn State Offensive Rebound.",12,10,"Alcorn State","Tulane",NA,"400987979"
52,1,"13:26",2006,"Maurice Howard missed Three Point Jumper.",12,10,"Alcorn State","Tulane",NA,"400987979"
53,1,"13:26",2006,"Cameron Reynolds Defensive Rebound.",12,10,"Alcorn State","Tulane",NA,"400987979"
54,1,"13:12",1992,"Melvin Frazier Turnover.",12,10,"Alcorn State","Tulane",NA,"400987979"
55,1,"12:50",1970,"Foul on Ray Ona Embo.",12,10,"Alcorn State","Tulane",NA,"400987979"
56,1,"12:50",1970,"Troymain Crosby missed Free Throw.",12,10,"Alcorn State","Tulane",NA,"400987979"
57,1,"12:50",1970,"Alcorn State Deadball Team Rebound.",12,10,"Alcorn State","Tulane",NA,"400987979"
58,1,"12:50",1970,"Troymain Crosby made Free Throw.",12,11,"Alcorn State","Tulane",NA,"400987979"
59,1,"12:39",1959,"Foul on Tyler Carter.",12,11,"Alcorn State","Tulane",NA,"400987979"
60,1,"12:22",1942,"Ray Ona Embo made Three Point Jumper. Assisted by Jordan Cornish.",15,11,"Alcorn State","Tulane",NA,"400987979"
61,1,"12:06",1926,"Yalen Reed missed Layup.",15,11,"Alcorn State","Tulane",NA,"400987979"
62,1,"12:06",1926,"Cameron Reynolds Defensive Rebound.",15,11,"Alcorn State","Tulane",NA,"400987979"
63,1,"11:52",1912,"Samir Sehic made Layup. Assisted by Jordan Cornish.",17,11,"Alcorn State","Tulane",NA,"400987979"
64,1,"11:26",1886,"Yalen Reed missed Jumper.",17,11,"Alcorn State","Tulane",NA,"400987979"
65,1,"11:26",1886,"Jordan Cornish Defensive Rebound.",17,11,"Alcorn State","Tulane",NA,"400987979"
66,1,"11:14",1874,"Samir Sehic made Layup. Assisted by Cameron Reynolds.",19,11,"Alcorn State","Tulane",NA,"400987979"
67,1,"10:51",1851,"Troymain Crosby Turnover.",19,11,"Alcorn State","Tulane",NA,"400987979"
68,1,"10:51",1851,"Official TV Timeout",19,11,"Alcorn State","Tulane",NA,"400987979"
69,1,"10:42",1842,"Foul on Cameron Reynolds.",19,11,"Alcorn State","Tulane",NA,"400987979"
70,1,"10:42",1842,"Cameron Reynolds Turnover.",19,11,"Alcorn State","Tulane",NA,"400987979"
71,1,"10:17",1817,"Troymain Crosby missed Layup.",19,11,"Alcorn State","Tulane",NA,"400987979"
72,1,"10:17",1817,"Tulane Deadball Team Rebound.",19,11,"Alcorn State","Tulane",NA,"400987979"
73,1,"10:03",1803,"Ray Ona Embo made Three Point Jumper. Assisted by Colin Slater.",22,11,"Alcorn State","Tulane",NA,"400987979"
74,1,"9:45",1785,"Dante Sterling missed Three Point Jumper.",22,11,"Alcorn State","Tulane",NA,"400987979"
75,1,"9:45",1785,"Colin Slater Defensive Rebound.",22,11,"Alcorn State","Tulane",NA,"400987979"
76,1,"9:37",1777,"Foul on Tyler Carter.",22,11,"Alcorn State","Tulane",NA,"400987979"
77,1,"9:37",1777,"Colin Slater made Free Throw.",23,11,"Alcorn State","Tulane",NA,"400987979"
78,1,"9:37",1777,"Colin Slater made Free Throw.",24,11,"Alcorn State","Tulane",NA,"400987979"
79,1,"9:21",1761,"TyQuaylon Smith Turnover.",24,11,"Alcorn State","Tulane",NA,"400987979"
80,1,"9:20",1760,"Melvin Frazier Steal.",24,11,"Alcorn State","Tulane",NA,"400987979"
81,1,"9:17",1757,"Samir Sehic made Layup. Assisted by Colin Slater.",26,11,"Alcorn State","Tulane",NA,"400987979"
82,1,"9:14",1754,"Alcorn State  Timeout",26,11,"Alcorn State","Tulane",NA,"400987979"
83,1,"8:48",1728,"TyQuaylon Smith missed Jumper.",26,11,"Alcorn State","Tulane",NA,"400987979"
84,1,"8:48",1728,"Tulane Defensive Rebound.",26,11,"Alcorn State","Tulane",NA,"400987979"
85,1,"8:32",1712,"Jordan Cornish missed Three Point Jumper.",26,11,"Alcorn State","Tulane",NA,"400987979"
86,1,"8:32",1712,"Maurice Howard Defensive Rebound.",26,11,"Alcorn State","Tulane",NA,"400987979"
87,1,"8:18",1698,"Avery Patterson Turnover.",26,11,"Alcorn State","Tulane",NA,"400987979"
88,1,"8:17",1697,"Bul Ajang Steal.",26,11,"Alcorn State","Tulane",NA,"400987979"
89,1,"8:03",1683,"Bul Ajang Turnover.",26,11,"Alcorn State","Tulane",NA,"400987979"
90,1,"8:03",1683,"TyQuaylon Smith Steal.",26,11,"Alcorn State","Tulane",NA,"400987979"
91,1,"7:43",1663,"Yalen Reed Turnover.",26,11,"Alcorn State","Tulane",NA,"400987979"
92,1,"7:42",1662,"Samir Sehic Steal.",26,11,"Alcorn State","Tulane",NA,"400987979"
93,1,"7:38",1658,"Colin Slater missed Three Point Jumper.",26,11,"Alcorn State","Tulane",NA,"400987979"
94,1,"7:38",1658,"A.J. Mosby Defensive Rebound.",26,11,"Alcorn State","Tulane",NA,"400987979"
95,1,"7:27",1647,"Avery Patterson Turnover.",26,11,"Alcorn State","Tulane",NA,"400987979"
96,1,"7:27",1647,"Official TV Timeout",26,11,"Alcorn State","Tulane",NA,"400987979"
97,1,"7:15",1635,"Melvin Frazier made Dunk. Assisted by Jordan Cornish.",28,11,"Alcorn State","Tulane",NA,"400987979"
98,1,"6:48",1608,"Avery Patterson missed Three Point Jumper.",28,11,"Alcorn State","Tulane",NA,"400987979"
99,1,"6:48",1608,"Jordan Cornish Defensive Rebound.",28,11,"Alcorn State","Tulane",NA,"400987979"
100,1,"6:23",1583,"Bul Ajang missed Jumper.",28,11,"Alcorn State","Tulane",NA,"400987979"
101,1,"6:23",1583,"Melvin Frazier Offensive Rebound.",28,11,"Alcorn State","Tulane",NA,"400987979"
102,1,"6:22",1582,"Foul on Avery Patterson.",28,11,"Alcorn State","Tulane",NA,"400987979"
103,1,"6:16",1576,"Bul Ajang missed Layup.",28,11,"Alcorn State","Tulane",NA,"400987979"
104,1,"6:16",1576,"Avery Patterson Block.",28,11,"Alcorn State","Tulane",NA,"400987979"
105,1,"6:16",1576,"Tulane Offensive Rebound.",28,11,"Alcorn State","Tulane",NA,"400987979"
106,1,"6:15",1575,"Samir Sehic made Jumper. Assisted by Jordan Cornish.",30,11,"Alcorn State","Tulane",NA,"400987979"
107,1,"5:53",1553,"A.J. Mosby missed Jumper.",30,11,"Alcorn State","Tulane",NA,"400987979"
108,1,"5:53",1553,"Samir Sehic Block.",30,11,"Alcorn State","Tulane",NA,"400987979"
109,1,"5:51",1551,"Samir Sehic Defensive Rebound.",30,11,"Alcorn State","Tulane",NA,"400987979"
110,1,"5:51",1551,"Foul on A.J. Mosby.",30,11,"Alcorn State","Tulane",NA,"400987979"
111,1,"5:51",1551,"Samir Sehic made Free Throw.",31,11,"Alcorn State","Tulane",NA,"400987979"
112,1,"5:51",1551,"Samir Sehic made Free Throw.",32,11,"Alcorn State","Tulane",NA,"400987979"
113,1,"5:36",1536,"Maurice Howard made Three Point Jumper. Assisted by A.J. Mosby.",32,14,"Alcorn State","Tulane",NA,"400987979"
114,1,"5:18",1518,"Foul on Caleb Daniels.",32,14,"Alcorn State","Tulane",NA,"400987979"
115,1,"5:18",1518,"Caleb Daniels Turnover.",32,14,"Alcorn State","Tulane",NA,"400987979"
116,1,"5:06",1506,"Maurice Howard Turnover.",32,14,"Alcorn State","Tulane",NA,"400987979"
117,1,"4:51",1491,"Caleb Daniels missed Three Point Jumper.",32,14,"Alcorn State","Tulane",NA,"400987979"
118,1,"4:51",1491,"Alcorn State Defensive Rebound.",32,14,"Alcorn State","Tulane",NA,"400987979"
119,1,"4:45",1485,"Maurice Howard missed Three Point Jumper.",32,14,"Alcorn State","Tulane",NA,"400987979"
120,1,"4:45",1485,"Buay Koka Defensive Rebound.",32,14,"Alcorn State","Tulane",NA,"400987979"
121,1,"4:34",1474,"Foul on Kobe Wilson.",32,14,"Alcorn State","Tulane",NA,"400987979"
122,1,"4:34",1474,"Cameron Reynolds missed Free Throw.",32,14,"Alcorn State","Tulane",NA,"400987979"
123,1,"4:34",1474,"Tulane Deadball Team Rebound.",32,14,"Alcorn State","Tulane",NA,"400987979"
124,1,"4:34",1474,"Cameron Reynolds made Free Throw.",33,14,"Alcorn State","Tulane",NA,"400987979"
125,1,"4:34",1474,"Cameron Reynolds made Free Throw.",34,14,"Alcorn State","Tulane",NA,"400987979"
126,1,"4:22",1462,"Foul on Buay Koka.",34,14,"Alcorn State","Tulane",NA,"400987979"
127,1,"4:15",1455,"A.J. Mosby missed Three Point Jumper.",34,14,"Alcorn State","Tulane",NA,"400987979"
128,1,"4:15",1455,"Colin Slater Defensive Rebound.",34,14,"Alcorn State","Tulane",NA,"400987979"
129,1,"4:05",1445,"Colin Slater missed Jumper.",34,14,"Alcorn State","Tulane",NA,"400987979"
130,1,"4:05",1445,"Yalen Reed Block.",34,14,"Alcorn State","Tulane",NA,"400987979"
131,1,"4:03",1443,"Kobe Wilson Defensive Rebound.",34,14,"Alcorn State","Tulane",NA,"400987979"
132,1,"3:56",1436,"Yalen Reed made Layup. Assisted by A.J. Mosby.",34,16,"Alcorn State","Tulane",NA,"400987979"
133,1,"3:25",1405,"Colin Slater made Three Point Jumper. Assisted by Cameron Reynolds.",37,16,"Alcorn State","Tulane",NA,"400987979"
134,1,"3:00",1380,"Yalen Reed made Three Point Jumper. Assisted by Dante Sterling.",37,19,"Alcorn State","Tulane",NA,"400987979"
135,1,"2:39",1359,"Buay Koka missed Layup.",37,19,"Alcorn State","Tulane",NA,"400987979"
136,1,"2:39",1359,"Buay Koka Offensive Rebound.",37,19,"Alcorn State","Tulane",NA,"400987979"
137,1,"2:35",1355,"Buay Koka missed Jumper.",37,19,"Alcorn State","Tulane",NA,"400987979"
138,1,"2:35",1355,"Dante Sterling Defensive Rebound.",37,19,"Alcorn State","Tulane",NA,"400987979"
139,1,"2:16",1336,"Dante Sterling made Three Point Jumper. Assisted by A.J. Mosby.",37,22,"Alcorn State","Tulane",NA,"400987979"
140,1,"2:01",1321,"Cameron Reynolds missed Jumper.",37,22,"Alcorn State","Tulane",NA,"400987979"
141,1,"2:01",1321,"Kobe Wilson Defensive Rebound.",37,22,"Alcorn State","Tulane",NA,"400987979"
142,1,"1:50",1310,"A.J. Mosby made Jumper.",37,24,"Alcorn State","Tulane",NA,"400987979"
143,1,"1:41",1301,"Tulane  Timeout",37,24,"Alcorn State","Tulane",NA,"400987979"
144,1,"1:41",1301,"Official TV Timeout",37,24,"Alcorn State","Tulane",NA,"400987979"
145,1,"1:31",1291,"Melvin Frazier made Three Point Jumper. Assisted by Samir Sehic.",40,24,"Alcorn State","Tulane",NA,"400987979"
146,1,"1:14",1274,"A.J. Mosby made Three Point Jumper. Assisted by Maurice Howard.",40,27,"Alcorn State","Tulane",NA,"400987979"
147,1,"0:51",1251,"Cameron Reynolds missed Three Point Jumper.",40,27,"Alcorn State","Tulane",NA,"400987979"
148,1,"0:51",1251,"Samir Sehic Offensive Rebound.",40,27,"Alcorn State","Tulane",NA,"400987979"
149,1,"0:47",1247,"Foul on Maurice Howard.",40,27,"Alcorn State","Tulane",NA,"400987979"
150,1,"0:47",1247,"Samir Sehic made Free Throw.",41,27,"Alcorn State","Tulane",NA,"400987979"
151,1,"0:47",1247,"Samir Sehic made Free Throw.",42,27,"Alcorn State","Tulane",NA,"400987979"
152,1,"0:26",1226,"Foul on Jordan Cornish.",42,27,"Alcorn State","Tulane",NA,"400987979"
153,1,"0:11",1211,"A.J. Mosby missed Three Point Jumper.",42,27,"Alcorn State","Tulane",NA,"400987979"
154,1,"0:11",1211,"Dante Sterling Offensive Rebound.",42,27,"Alcorn State","Tulane",NA,"400987979"
155,1,"0:02",1202,"TyQuaylon Smith missed Layup.",42,27,"Alcorn State","Tulane",NA,"400987979"
156,1,"0:02",1202,"TyQuaylon Smith Offensive Rebound.",42,27,"Alcorn State","Tulane",NA,"400987979"
157,1,"0:01",1201,"TyQuaylon Smith made Two Point Tip Shot.",42,29,"Alcorn State","Tulane",NA,"400987979"
158,1,"0:00",1200,"End of 1st half",42,27,"Alcorn State","Tulane",NA,"400987979"
159,2,"20:00",1200,"PLAY",42,27,"Alcorn State","Tulane",NA,"400987979"
160,2,"19:35",1175,"Avery Patterson Turnover.",42,29,"Alcorn State","Tulane",NA,"400987979"
161,2,"19:34",1174,"Melvin Frazier Steal.",42,29,"Alcorn State","Tulane",NA,"400987979"
162,2,"19:16",1156,"Melvin Frazier missed Layup.",42,29,"Alcorn State","Tulane",NA,"400987979"
163,2,"19:16",1156,"Melvin Frazier Offensive Rebound.",42,29,"Alcorn State","Tulane",NA,"400987979"
164,2,"19:14",1154,"Melvin Frazier made Two Point Tip Shot.",44,29,"Alcorn State","Tulane",NA,"400987979"
165,2,"18:48",1128,"Devon Brewer made Jumper. Assisted by Yalen Reed.",44,31,"Alcorn State","Tulane",NA,"400987979"
166,2,"18:21",1101,"Cameron Reynolds made Three Point Jumper. Assisted by Jordan Cornish.",47,31,"Alcorn State","Tulane",NA,"400987979"
167,2,"18:07",1087,"Foul on Cameron Reynolds.",47,31,"Alcorn State","Tulane",NA,"400987979"
168,2,"18:07",1087,"Yalen Reed missed Free Throw.",47,31,"Alcorn State","Tulane",NA,"400987979"
169,2,"18:07",1087,"Alcorn State Deadball Team Rebound.",47,31,"Alcorn State","Tulane",NA,"400987979"
170,2,"18:07",1087,"Yalen Reed made Free Throw.",47,32,"Alcorn State","Tulane",NA,"400987979"
171,2,"17:41",1061,"Melvin Frazier missed Three Point Jumper.",47,32,"Alcorn State","Tulane",NA,"400987979"
172,2,"17:41",1061,"A.J. Mosby Defensive Rebound.",47,32,"Alcorn State","Tulane",NA,"400987979"
173,2,"17:26",1046,"A.J. Mosby missed Three Point Jumper.",47,32,"Alcorn State","Tulane",NA,"400987979"
174,2,"17:26",1046,"Jordan Cornish Defensive Rebound.",47,32,"Alcorn State","Tulane",NA,"400987979"
175,2,"17:09",1029,"Cameron Reynolds Turnover.",47,32,"Alcorn State","Tulane",NA,"400987979"
176,2,"17:08",1028,"Devon Brewer Steal.",47,32,"Alcorn State","Tulane",NA,"400987979"
177,2,"17:05",1025,"Avery Patterson made Layup.",47,34,"Alcorn State","Tulane",NA,"400987979"
178,2,"16:43",1003,"Cameron Reynolds made Three Point Jumper. Assisted by Ray Ona Embo.",50,34,"Alcorn State","Tulane",NA,"400987979"
179,2,"16:22",982,"Tyler Carter made Jumper. Assisted by Avery Patterson.",50,36,"Alcorn State","Tulane",NA,"400987979"
180,2,"16:07",967,"Cameron Reynolds missed Three Point Jumper.",50,36,"Alcorn State","Tulane",NA,"400987979"
181,2,"16:07",967,"Yalen Reed Defensive Rebound.",50,36,"Alcorn State","Tulane",NA,"400987979"
182,2,"16:01",961,"Yalen Reed missed Three Point Jumper.",50,36,"Alcorn State","Tulane",NA,"400987979"
183,2,"16:01",961,"Cameron Reynolds Defensive Rebound.",50,36,"Alcorn State","Tulane",NA,"400987979"
184,2,"15:51",951,"Melvin Frazier made Layup.",52,36,"Alcorn State","Tulane",NA,"400987979"
185,2,"15:43",943,"Dante Sterling missed Jumper.",52,36,"Alcorn State","Tulane",NA,"400987979"
186,2,"15:43",943,"Jordan Cornish Defensive Rebound.",52,36,"Alcorn State","Tulane",NA,"400987979"
187,2,"15:33",933,"Jordan Cornish made Layup.",54,36,"Alcorn State","Tulane",NA,"400987979"
188,2,"15:33",933,"Foul on Yalen Reed.",54,36,"Alcorn State","Tulane",NA,"400987979"
189,2,"15:33",933,"Official TV Timeout",54,36,"Alcorn State","Tulane",NA,"400987979"
190,2,"15:33",933,"Jordan Cornish made Free Throw.",55,36,"Alcorn State","Tulane",NA,"400987979"
191,2,"15:24",924,"Tyler Carter missed Layup.",55,36,"Alcorn State","Tulane",NA,"400987979"
192,2,"15:24",924,"Blake Paul Block.",55,36,"Alcorn State","Tulane",NA,"400987979"
193,2,"15:23",923,"Cameron Reynolds Defensive Rebound.",55,36,"Alcorn State","Tulane",NA,"400987979"
194,2,"15:16",916,"Ray Ona Embo made Three Point Jumper. Assisted by Cameron Reynolds.",58,36,"Alcorn State","Tulane",NA,"400987979"
195,2,"15:12",912,"Alcorn State  Timeout",58,36,"Alcorn State","Tulane",NA,"400987979"
196,2,"15:12",912,"Technical Foul on Alcorn State.",58,36,"Alcorn State","Tulane",NA,"400987979"
197,2,"15:12",912,"Cameron Reynolds missed Free Throw.",58,36,"Alcorn State","Tulane",NA,"400987979"
198,2,"15:12",912,"Tulane Deadball Team Rebound.",58,36,"Alcorn State","Tulane",NA,"400987979"
199,2,"15:12",912,"Cameron Reynolds made Free Throw.",59,36,"Alcorn State","Tulane",NA,"400987979"
200,2,"14:54",894,"Foul on Cameron Reynolds.",59,36,"Alcorn State","Tulane",NA,"400987979"
201,2,"14:54",894,"Tyler Carter made Free Throw.",59,37,"Alcorn State","Tulane",NA,"400987979"
202,2,"14:54",894,"Tyler Carter made Free Throw.",59,38,"Alcorn State","Tulane",NA,"400987979"
203,2,"14:47",887,"Foul on Troymain Crosby.",59,38,"Alcorn State","Tulane",NA,"400987979"
204,2,"14:42",882,"Jordan Cornish missed Three Point Jumper.",59,38,"Alcorn State","Tulane",NA,"400987979"
205,2,"14:42",882,"Tyler Carter Defensive Rebound.",59,38,"Alcorn State","Tulane",NA,"400987979"
206,2,"14:24",864,"Maurice Howard made Three Point Jumper. Assisted by Tyler Carter.",59,41,"Alcorn State","Tulane",NA,"400987979"
207,2,"13:49",829,"Melvin Frazier missed Three Point Jumper.",59,41,"Alcorn State","Tulane",NA,"400987979"
208,2,"13:49",829,"Tyler Carter Defensive Rebound.",59,41,"Alcorn State","Tulane",NA,"400987979"
209,2,"13:37",817,"Foul on TyQuaylon Smith.",59,41,"Alcorn State","Tulane",NA,"400987979"
210,2,"13:37",817,"TyQuaylon Smith Turnover.",59,41,"Alcorn State","Tulane",NA,"400987979"
211,2,"13:29",809,"Ray Ona Embo Turnover.",59,41,"Alcorn State","Tulane",NA,"400987979"
212,2,"13:28",808,"Tyler Carter Steal.",59,41,"Alcorn State","Tulane",NA,"400987979"
213,2,"13:25",805,"Maurice Howard missed Three Point Jumper.",59,41,"Alcorn State","Tulane",NA,"400987979"
214,2,"13:25",805,"TyQuaylon Smith Offensive Rebound.",59,41,"Alcorn State","Tulane",NA,"400987979"
215,2,"13:21",801,"A.J. Mosby made Three Point Jumper. Assisted by TyQuaylon Smith.",59,44,"Alcorn State","Tulane",NA,"400987979"
216,2,"13:02",782,"Jordan Cornish made Layup.",61,44,"Alcorn State","Tulane",NA,"400987979"
217,2,"12:41",761,"Tyler Carter missed Three Point Jumper.",61,44,"Alcorn State","Tulane",NA,"400987979"
218,2,"12:41",761,"Alcorn State Offensive Rebound.",61,44,"Alcorn State","Tulane",NA,"400987979"
219,2,"12:39",759,"Foul on Samir Sehic.",61,44,"Alcorn State","Tulane",NA,"400987979"
220,2,"12:26",746,"Devon Brewer missed Jumper.",61,44,"Alcorn State","Tulane",NA,"400987979"
221,2,"12:26",746,"Caleb Daniels Defensive Rebound.",61,44,"Alcorn State","Tulane",NA,"400987979"
222,2,"12:15",735,"Ray Ona Embo Turnover.",61,44,"Alcorn State","Tulane",NA,"400987979"
223,2,"12:14",734,"Maurice Howard Steal.",61,44,"Alcorn State","Tulane",NA,"400987979"
224,2,"12:08",728,"Dante Sterling missed Three Point Jumper.",61,44,"Alcorn State","Tulane",NA,"400987979"
225,2,"12:08",728,"Samir Sehic Defensive Rebound.",61,44,"Alcorn State","Tulane",NA,"400987979"
226,2,"11:45",705,"Cameron Reynolds missed Three Point Jumper.",61,44,"Alcorn State","Tulane",NA,"400987979"
227,2,"11:45",705,"Yalen Reed Defensive Rebound.",61,44,"Alcorn State","Tulane",NA,"400987979"
228,2,"11:30",690,"Maurice Howard missed Three Point Jumper.",61,44,"Alcorn State","Tulane",NA,"400987979"
229,2,"11:30",690,"Cameron Reynolds Defensive Rebound.",61,44,"Alcorn State","Tulane",NA,"400987979"
230,2,"11:18",678,"Samir Sehic Turnover.",61,44,"Alcorn State","Tulane",NA,"400987979"
231,2,"11:17",677,"Dante Sterling Steal.",61,44,"Alcorn State","Tulane",NA,"400987979"
232,2,"11:12",672,"Dante Sterling made Layup.",61,46,"Alcorn State","Tulane",NA,"400987979"
233,2,"10:54",654,"Samir Sehic made Jumper. Assisted by Caleb Daniels.",63,46,"Alcorn State","Tulane",NA,"400987979"
234,2,"10:33",633,"Maurice Howard missed Jumper.",63,46,"Alcorn State","Tulane",NA,"400987979"
235,2,"10:33",633,"Melvin Frazier Defensive Rebound.",63,46,"Alcorn State","Tulane",NA,"400987979"
236,2,"10:26",626,"Cameron Reynolds made Three Point Jumper. Assisted by Melvin Frazier.",66,46,"Alcorn State","Tulane",NA,"400987979"
