"play_id","half","time_remaining_half","secs_remaining","description","home_score","away_score","away","home","home_favored_by","game_id"
118,1,"6:10",1570,"Jordan Howard made Free Throw.",37,14,"Alcorn State","Central Arkansas",NA,"400988910"
119,1,"6:01",1561,"Khari Jabriel Allen made Three Point Jumper.",37,17,"Alcorn State","Central Arkansas",NA,"400988910"
120,1,"5:42",1542,"Hayden Koval missed Jumper.",37,17,"Alcorn State","Central Arkansas",NA,"400988910"
121,1,"5:42",1542,"Otas Iyekekpolor Offensive Rebound.",37,17,"Alcorn State","Central Arkansas",NA,"400988910"
122,1,"5:38",1538,"Otas Iyekekpolor made Layup.",39,17,"Alcorn State","Central Arkansas",NA,"400988910"
123,1,"5:19",1519,"A.J. Mosby missed Three Point Jumper.",39,17,"Alcorn State","Central Arkansas",NA,"400988910"
124,1,"5:19",1519,"Jordan Howard Defensive Rebound.",39,17,"Alcorn State","Central Arkansas",NA,"400988910"
125,1,"5:11",1511,"Otas Iyekekpolor Turnover.",39,17,"Alcorn State","Central Arkansas",NA,"400988910"
126,1,"4:56",1496,"A.J. Mosby made Jumper.",39,19,"Alcorn State","Central Arkansas",NA,"400988910"
127,1,"4:50",1490,"Tanner Schmit missed Jumper.",39,19,"Alcorn State","Central Arkansas",NA,"400988910"
128,1,"4:50",1490,"A.J. Mosby Defensive Rebound.",39,19,"Alcorn State","Central Arkansas",NA,"400988910"
129,1,"4:41",1481,"Dante Sterling made Layup. Assisted by A.J. Mosby.",39,21,"Alcorn State","Central Arkansas",NA,"400988910"
130,1,"4:41",1481,"Central Arkansas  Timeout",39,21,"Alcorn State","Central Arkansas",NA,"400988910"
131,1,"4:29",1469,"Jordan Howard missed Three Point Jumper.",39,21,"Alcorn State","Central Arkansas",NA,"400988910"
132,1,"4:29",1469,"Central Arkansas Offensive Rebound.",39,21,"Alcorn State","Central Arkansas",NA,"400988910"
133,1,"4:17",1457,"Foul on Dante Sterling.",39,21,"Alcorn State","Central Arkansas",NA,"400988910"
134,1,"4:17",1457,"Jordan Howard missed Free Throw.",39,21,"Alcorn State","Central Arkansas",NA,"400988910"
135,1,"4:17",1457,"Central Arkansas Deadball Team Rebound.",39,21,"Alcorn State","Central Arkansas",NA,"400988910"
136,1,"4:17",1457,"Jordan Howard made Free Throw.",40,21,"Alcorn State","Central Arkansas",NA,"400988910"
137,1,"4:01",1441,"Juwan Henderson missed Layup.",40,21,"Alcorn State","Central Arkansas",NA,"400988910"
138,1,"4:01",1441,"Yalen Reed Offensive Rebound.",40,21,"Alcorn State","Central Arkansas",NA,"400988910"
139,1,"3:57",1437,"Yalen Reed made Layup.",40,23,"Alcorn State","Central Arkansas",NA,"400988910"
140,1,"3:51",1431,"Hayden Koval made Layup. Assisted by Deandre Jones.",42,23,"Alcorn State","Central Arkansas",NA,"400988910"
141,1,"3:40",1420,"Foul on Ethan Lee.",42,23,"Alcorn State","Central Arkansas",NA,"400988910"
142,1,"3:40",1420,"Alcorn State  Timeout",42,23,"Alcorn State","Central Arkansas",NA,"400988910"
143,1,"3:40",1420,"Khari Jabriel Allen missed Free Throw.",42,23,"Alcorn State","Central Arkansas",NA,"400988910"
144,1,"3:40",1420,"Alcorn State Deadball Team Rebound.",42,23,"Alcorn State","Central Arkansas",NA,"400988910"
145,1,"3:40",1420,"Khari Jabriel Allen made Free Throw.",42,24,"Alcorn State","Central Arkansas",NA,"400988910"
146,1,"3:26",1406,"Hayden Koval missed Dunk.",42,24,"Alcorn State","Central Arkansas",NA,"400988910"
147,1,"3:26",1406,"A.J. Mosby Defensive Rebound.",42,24,"Alcorn State","Central Arkansas",NA,"400988910"
148,1,"3:19",1399,"Dante Sterling missed Jumper.",42,24,"Alcorn State","Central Arkansas",NA,"400988910"
149,1,"3:19",1399,"Hayden Koval Defensive Rebound.",42,24,"Alcorn State","Central Arkansas",NA,"400988910"
150,1,"3:08",1388,"Ethan Lee Turnover.",42,24,"Alcorn State","Central Arkansas",NA,"400988910"
151,1,"3:07",1387,"Maurice Howard Steal.",42,24,"Alcorn State","Central Arkansas",NA,"400988910"
152,1,"2:59",1379,"Khari Jabriel Allen missed Jumper.",42,24,"Alcorn State","Central Arkansas",NA,"400988910"
153,1,"2:59",1379,"Ethan Lee Defensive Rebound.",42,24,"Alcorn State","Central Arkansas",NA,"400988910"
154,1,"2:54",1374,"Foul on Tyler Carter.",42,24,"Alcorn State","Central Arkansas",NA,"400988910"
155,1,"2:54",1374,"Ethan Lee missed Free Throw.",42,24,"Alcorn State","Central Arkansas",NA,"400988910"
156,1,"2:54",1374,"Central Arkansas Deadball Team Rebound.",42,24,"Alcorn State","Central Arkansas",NA,"400988910"
157,1,"2:54",1374,"Ethan Lee missed Free Throw.",42,24,"Alcorn State","Central Arkansas",NA,"400988910"
158,1,"2:54",1374,"Dante Sterling Defensive Rebound.",42,24,"Alcorn State","Central Arkansas",NA,"400988910"
159,1,"2:48",1368,"Foul on Darraja Parnell.",42,24,"Alcorn State","Central Arkansas",NA,"400988910"
160,1,"2:48",1368,"Yalen Reed made Free Throw.",42,25,"Alcorn State","Central Arkansas",NA,"400988910"
161,1,"2:48",1368,"Yalen Reed missed Free Throw.",42,25,"Alcorn State","Central Arkansas",NA,"400988910"
162,1,"2:48",1368,"Ethan Lee Defensive Rebound.",42,25,"Alcorn State","Central Arkansas",NA,"400988910"
163,1,"2:39",1359,"Foul on Yalen Reed.",42,25,"Alcorn State","Central Arkansas",NA,"400988910"
164,1,"2:39",1359,"Hayden Koval missed Free Throw.",42,25,"Alcorn State","Central Arkansas",NA,"400988910"
165,1,"2:39",1359,"Central Arkansas Deadball Team Rebound.",42,25,"Alcorn State","Central Arkansas",NA,"400988910"
166,1,"2:39",1359,"Hayden Koval missed Free Throw.",42,25,"Alcorn State","Central Arkansas",NA,"400988910"
167,1,"2:39",1359,"Dante Sterling Defensive Rebound.",42,25,"Alcorn State","Central Arkansas",NA,"400988910"
168,1,"2:34",1354,"Dante Sterling Turnover.",42,25,"Alcorn State","Central Arkansas",NA,"400988910"
169,1,"2:18",1338,"Hayden Koval Turnover.",42,25,"Alcorn State","Central Arkansas",NA,"400988910"
170,1,"2:18",1338,"TyQuaylon Smith Steal.",42,25,"Alcorn State","Central Arkansas",NA,"400988910"
171,1,"2:06",1326,"A.J. Mosby missed Layup.",42,25,"Alcorn State","Central Arkansas",NA,"400988910"
172,1,"2:06",1326,"Hayden Koval Defensive Rebound.",42,25,"Alcorn State","Central Arkansas",NA,"400988910"
173,1,"1:58",1318,"Deandre Jones made Layup.",44,25,"Alcorn State","Central Arkansas",NA,"400988910"
174,1,"1:58",1318,"Foul on Khari Jabriel Allen.",44,25,"Alcorn State","Central Arkansas",NA,"400988910"
175,1,"1:58",1318,"Deandre Jones made Free Throw.",45,25,"Alcorn State","Central Arkansas",NA,"400988910"
176,1,"1:43",1303,"Troymain Crosby missed Jumper.",45,25,"Alcorn State","Central Arkansas",NA,"400988910"
177,1,"1:43",1303,"Darraja Parnell Defensive Rebound.",45,25,"Alcorn State","Central Arkansas",NA,"400988910"
178,1,"1:35",1295,"Jordan Howard missed Jumper.",45,25,"Alcorn State","Central Arkansas",NA,"400988910"
179,1,"1:35",1295,"Khari Jabriel Allen Defensive Rebound.",45,25,"Alcorn State","Central Arkansas",NA,"400988910"
180,1,"1:26",1286,"Maurice Howard made Three Point Jumper. Assisted by Troymain Crosby.",45,28,"Alcorn State","Central Arkansas",NA,"400988910"
181,1,"1:11",1271,"Jordan Howard made Layup. Assisted by Darraja Parnell.",47,28,"Alcorn State","Central Arkansas",NA,"400988910"
182,1,"0:54",1254,"A.J. Mosby made Layup. Assisted by Maurice Howard.",47,30,"Alcorn State","Central Arkansas",NA,"400988910"
183,1,"0:36",1236,"Foul on A.J. Mosby.",47,30,"Alcorn State","Central Arkansas",NA,"400988910"
184,1,"0:36",1236,"Ethan Lee made Free Throw.",48,30,"Alcorn State","Central Arkansas",NA,"400988910"
185,1,"0:36",1236,"Ethan Lee made Free Throw.",49,30,"Alcorn State","Central Arkansas",NA,"400988910"
186,1,"0:32",1232,"Foul on Ethan Lee.",49,30,"Alcorn State","Central Arkansas",NA,"400988910"
187,1,"0:20",1220,"TyQuaylon Smith missed Free Throw.",49,30,"Alcorn State","Central Arkansas",NA,"400988910"
188,1,"0:20",1220,"Central Arkansas Defensive Rebound.",49,30,"Alcorn State","Central Arkansas",NA,"400988910"
189,1,"0:20",1220,"Alcorn State  Timeout",49,30,"Alcorn State","Central Arkansas",NA,"400988910"
190,1,"0:02",1202,"Jordan Howard made Three Point Jumper.",52,30,"Alcorn State","Central Arkansas",NA,"400988910"
191,1,"0:00",1200,"End of 1st half",52,30,"Alcorn State","Central Arkansas",NA,"400988910"
192,2,"20:00",1200,"PLAY",52,30,"Alcorn State","Central Arkansas",NA,"400988910"
193,2,"19:36",1176,"Hayden Koval Turnover.",52,30,"Alcorn State","Central Arkansas",NA,"400988910"
194,2,"19:35",1175,"Maurice Howard Steal.",52,30,"Alcorn State","Central Arkansas",NA,"400988910"
195,2,"19:26",1166,"Khari Jabriel Allen made Jumper.",52,32,"Alcorn State","Central Arkansas",NA,"400988910"
196,2,"19:11",1151,"Foul on Tyler Carter.",52,32,"Alcorn State","Central Arkansas",NA,"400988910"
197,2,"19:11",1151,"Ethan Lee made Free Throw.",53,32,"Alcorn State","Central Arkansas",NA,"400988910"
198,2,"19:11",1151,"Ethan Lee made Free Throw.",54,32,"Alcorn State","Central Arkansas",NA,"400988910"
199,2,"18:49",1129,"Foul on Hayden Koval.",54,32,"Alcorn State","Central Arkansas",NA,"400988910"
200,2,"18:49",1129,"Reginal Johnson made Free Throw.",54,33,"Alcorn State","Central Arkansas",NA,"400988910"
201,2,"18:49",1129,"Reginal Johnson made Free Throw.",54,34,"Alcorn State","Central Arkansas",NA,"400988910"
202,2,"18:49",1129,"Foul on Tyler Carter.",54,34,"Alcorn State","Central Arkansas",NA,"400988910"
203,2,"18:30",1110,"Foul on Troymain Crosby.",54,34,"Alcorn State","Central Arkansas",NA,"400988910"
204,2,"18:30",1110,"Thatch Unruh missed Free Throw.",54,34,"Alcorn State","Central Arkansas",NA,"400988910"
205,2,"18:30",1110,"Central Arkansas Deadball Team Rebound.",54,34,"Alcorn State","Central Arkansas",NA,"400988910"
206,2,"18:30",1110,"Thatch Unruh made Free Throw.",55,34,"Alcorn State","Central Arkansas",NA,"400988910"
207,2,"18:30",1110,"Thatch Unruh made Free Throw.",56,34,"Alcorn State","Central Arkansas",NA,"400988910"
208,2,"18:16",1096,"Maurice Howard Turnover.",56,34,"Alcorn State","Central Arkansas",NA,"400988910"
209,2,"18:15",1095,"Ethan Lee Steal.",56,34,"Alcorn State","Central Arkansas",NA,"400988910"
210,2,"18:08",1088,"Thatch Unruh made Layup. Assisted by Jordan Howard.",58,34,"Alcorn State","Central Arkansas",NA,"400988910"
211,2,"17:40",1060,"Troymain Crosby made Jumper.",58,36,"Alcorn State","Central Arkansas",NA,"400988910"
212,2,"17:24",1044,"Ethan Lee made Dunk. Assisted by Hayden Koval.",60,36,"Alcorn State","Central Arkansas",NA,"400988910"
213,2,"17:04",1024,"Khari Jabriel Allen missed Jumper.",60,36,"Alcorn State","Central Arkansas",NA,"400988910"
214,2,"17:04",1024,"Troymain Crosby Offensive Rebound.",60,36,"Alcorn State","Central Arkansas",NA,"400988910"
215,2,"17:04",1024,"Troymain Crosby made Layup.",60,38,"Alcorn State","Central Arkansas",NA,"400988910"
216,2,"16:42",1002,"Hayden Koval Turnover.",60,38,"Alcorn State","Central Arkansas",NA,"400988910"
217,2,"16:42",1002,"TyQuaylon Smith Steal.",60,38,"Alcorn State","Central Arkansas",NA,"400988910"
218,2,"16:20",980,"Reginal Johnson missed Jumper.",60,38,"Alcorn State","Central Arkansas",NA,"400988910"
219,2,"16:20",980,"Jordan Howard Defensive Rebound.",60,38,"Alcorn State","Central Arkansas",NA,"400988910"
220,2,"16:01",961,"Foul on TyQuaylon Smith.",60,38,"Alcorn State","Central Arkansas",NA,"400988910"
221,2,"16:01",961,"Otas Iyekekpolor made Free Throw.",61,38,"Alcorn State","Central Arkansas",NA,"400988910"
222,2,"16:01",961,"Otas Iyekekpolor missed Free Throw.",61,38,"Alcorn State","Central Arkansas",NA,"400988910"
223,2,"16:01",961,"Reginal Johnson Defensive Rebound.",61,38,"Alcorn State","Central Arkansas",NA,"400988910"
224,2,"15:47",947,"Foul on TyQuaylon Smith.",61,38,"Alcorn State","Central Arkansas",NA,"400988910"
225,2,"15:47",947,"TyQuaylon Smith Turnover.",61,38,"Alcorn State","Central Arkansas",NA,"400988910"
226,2,"15:46",946,"Central Arkansas  Timeout",61,38,"Alcorn State","Central Arkansas",NA,"400988910"
227,2,"15:36",936,"Otas Iyekekpolor made Dunk. Assisted by Hayden Koval.",63,38,"Alcorn State","Central Arkansas",NA,"400988910"
228,2,"15:11",911,"Dante Sterling made Three Point Jumper. Assisted by Reginal Johnson.",63,41,"Alcorn State","Central Arkansas",NA,"400988910"
229,2,"15:02",902,"Otas Iyekekpolor made Layup. Assisted by Darraja Parnell.",65,41,"Alcorn State","Central Arkansas",NA,"400988910"
230,2,"14:48",888,"A.J. Mosby missed Jumper.",65,41,"Alcorn State","Central Arkansas",NA,"400988910"
231,2,"14:48",888,"Alcorn State Offensive Rebound.",65,41,"Alcorn State","Central Arkansas",NA,"400988910"
232,2,"14:48",888,"A.J. Mosby made Three Point Jumper. Assisted by Avery Patterson.",65,44,"Alcorn State","Central Arkansas",NA,"400988910"
233,2,"14:04",844,"Foul on A.J. Mosby.",65,44,"Alcorn State","Central Arkansas",NA,"400988910"
234,2,"13:48",828,"Deandre Jones missed Jumper.",65,44,"Alcorn State","Central Arkansas",NA,"400988910"
235,2,"13:48",828,"Darraja Parnell Offensive Rebound.",65,44,"Alcorn State","Central Arkansas",NA,"400988910"
236,2,"13:45",825,"Darraja Parnell missed Jumper.",65,44,"Alcorn State","Central Arkansas",NA,"400988910"
237,2,"13:45",825,"TyQuaylon Smith Block.",65,44,"Alcorn State","Central Arkansas",NA,"400988910"
238,2,"13:43",823,"A.J. Mosby Defensive Rebound.",65,44,"Alcorn State","Central Arkansas",NA,"400988910"
239,2,"13:40",820,"Foul on Aaron Weidenaar.",65,44,"Alcorn State","Central Arkansas",NA,"400988910"
240,2,"13:40",820,"A.J. Mosby missed Free Throw.",65,44,"Alcorn State","Central Arkansas",NA,"400988910"
241,2,"13:40",820,"Alcorn State Deadball Team Rebound.",65,44,"Alcorn State","Central Arkansas",NA,"400988910"
242,2,"13:40",820,"A.J. Mosby made Free Throw.",65,45,"Alcorn State","Central Arkansas",NA,"400988910"
243,2,"13:22",802,"Aaron Weidenaar made Three Point Jumper. Assisted by Deandre Jones.",68,45,"Alcorn State","Central Arkansas",NA,"400988910"
244,2,"12:59",779,"Foul on Otas Iyekekpolor.",68,45,"Alcorn State","Central Arkansas",NA,"400988910"
245,2,"12:59",779,"Avery Patterson made Free Throw.",68,46,"Alcorn State","Central Arkansas",NA,"400988910"
246,2,"12:59",779,"Avery Patterson missed Free Throw.",68,46,"Alcorn State","Central Arkansas",NA,"400988910"
247,2,"12:59",779,"Tanner Schmit Defensive Rebound.",68,46,"Alcorn State","Central Arkansas",NA,"400988910"
248,2,"12:55",775,"Deandre Jones Turnover.",68,46,"Alcorn State","Central Arkansas",NA,"400988910"
249,2,"12:54",774,"TyQuaylon Smith Steal.",68,46,"Alcorn State","Central Arkansas",NA,"400988910"
250,2,"12:50",770,"Avery Patterson missed Jumper.",68,46,"Alcorn State","Central Arkansas",NA,"400988910"
251,2,"12:50",770,"Thatch Unruh Defensive Rebound.",68,46,"Alcorn State","Central Arkansas",NA,"400988910"
252,2,"12:44",764,"Foul on TyQuaylon Smith.",68,46,"Alcorn State","Central Arkansas",NA,"400988910"
253,2,"12:44",764,"Ethan Lee made Free Throw.",69,46,"Alcorn State","Central Arkansas",NA,"400988910"
254,2,"12:44",764,"Ethan Lee made Free Throw.",70,46,"Alcorn State","Central Arkansas",NA,"400988910"
255,2,"12:27",747,"Juwan Henderson missed Jumper.",70,46,"Alcorn State","Central Arkansas",NA,"400988910"
256,2,"12:27",747,"Troymain Crosby Offensive Rebound.",70,46,"Alcorn State","Central Arkansas",NA,"400988910"
257,2,"12:26",746,"Foul on Tanner Schmit.",70,46,"Alcorn State","Central Arkansas",NA,"400988910"
258,2,"12:26",746,"Troymain Crosby made Free Throw.",70,47,"Alcorn State","Central Arkansas",NA,"400988910"
259,2,"12:26",746,"Troymain Crosby made Free Throw.",70,48,"Alcorn State","Central Arkansas",NA,"400988910"
260,2,"12:06",726,"Foul on Troymain Crosby.",70,48,"Alcorn State","Central Arkansas",NA,"400988910"
261,2,"12:06",726,"Thatch Unruh made Free Throw.",71,48,"Alcorn State","Central Arkansas",NA,"400988910"
262,2,"12:06",726,"Thatch Unruh made Free Throw.",72,48,"Alcorn State","Central Arkansas",NA,"400988910"
263,2,"11:54",714,"Foul on Jordan Howard.",72,48,"Alcorn State","Central Arkansas",NA,"400988910"
264,2,"11:54",714,"Alcorn State  Timeout",72,48,"Alcorn State","Central Arkansas",NA,"400988910"
265,2,"11:54",714,"Troymain Crosby made Free Throw.",72,49,"Alcorn State","Central Arkansas",NA,"400988910"
266,2,"11:54",714,"Troymain Crosby made Free Throw.",72,50,"Alcorn State","Central Arkansas",NA,"400988910"
267,2,"11:38",698,"Thatch Unruh missed Three Point Jumper.",72,50,"Alcorn State","Central Arkansas",NA,"400988910"
268,2,"11:38",698,"Ethan Lee Offensive Rebound.",72,50,"Alcorn State","Central Arkansas",NA,"400988910"
269,2,"11:32",692,"Jordan Howard missed Three Point Jumper.",72,50,"Alcorn State","Central Arkansas",NA,"400988910"
270,2,"11:32",692,"Juwan Henderson Defensive Rebound.",72,50,"Alcorn State","Central Arkansas",NA,"400988910"
271,2,"11:21",681,"Troymain Crosby made Jumper. Assisted by Juwan Henderson.",72,52,"Alcorn State","Central Arkansas",NA,"400988910"
272,2,"11:09",669,"Thatch Unruh made Three Point Jumper. Assisted by Deandre Jones.",75,52,"Alcorn State","Central Arkansas",NA,"400988910"
273,2,"10:59",659,"Reginal Johnson made Layup. Assisted by Juwan Henderson.",75,54,"Alcorn State","Central Arkansas",NA,"400988910"
274,2,"10:59",659,"Foul on Tanner Schmit.",75,54,"Alcorn State","Central Arkansas",NA,"400988910"
275,2,"10:59",659,"Reginal Johnson made Free Throw.",75,55,"Alcorn State","Central Arkansas",NA,"400988910"
276,2,"10:51",651,"Jordan Howard made Layup. Assisted by Thatch Unruh.",77,55,"Alcorn State","Central Arkansas",NA,"400988910"
277,2,"10:42",642,"Troymain Crosby made Layup.",77,57,"Alcorn State","Central Arkansas",NA,"400988910"
278,2,"10:25",625,"Jordan Howard made Three Point Jumper. Assisted by Thatch Unruh.",80,57,"Alcorn State","Central Arkansas",NA,"400988910"
279,2,"10:11",611,"Foul on TyQuaylon Smith.",80,57,"Alcorn State","Central Arkansas",NA,"400988910"
280,2,"10:11",611,"TyQuaylon Smith Turnover.",80,57,"Alcorn State","Central Arkansas",NA,"400988910"
281,2,"10:01",601,"Thatch Unruh Turnover.",80,57,"Alcorn State","Central Arkansas",NA,"400988910"
282,2,"9:52",592,"Maurice Howard missed Three Point Jumper.",80,57,"Alcorn State","Central Arkansas",NA,"400988910"
283,2,"9:52",592,"Hayden Koval Defensive Rebound.",80,57,"Alcorn State","Central Arkansas",NA,"400988910"
284,2,"9:24",564,"Jordan Howard made Three Point Jumper.",83,57,"Alcorn State","Central Arkansas",NA,"400988910"
285,2,"9:03",543,"Tyler Carter missed Three Point Jumper.",83,57,"Alcorn State","Central Arkansas",NA,"400988910"
286,2,"9:03",543,"Thatch Unruh Defensive Rebound.",83,57,"Alcorn State","Central Arkansas",NA,"400988910"
287,2,"8:54",534,"Darraja Parnell missed Jumper.",83,57,"Alcorn State","Central Arkansas",NA,"400988910"
288,2,"8:54",534,"Tyler Carter Defensive Rebound.",83,57,"Alcorn State","Central Arkansas",NA,"400988910"
289,2,"8:38",518,"Tyler Carter Turnover.",83,57,"Alcorn State","Central Arkansas",NA,"400988910"
290,2,"8:38",518,"Otas Iyekekpolor Steal.",83,57,"Alcorn State","Central Arkansas",NA,"400988910"
291,2,"8:38",518,"Central Arkansas  Timeout",83,57,"Alcorn State","Central Arkansas",NA,"400988910"
292,2,"8:26",506,"Foul on TyQuaylon Smith.",83,57,"Alcorn State","Central Arkansas",NA,"400988910"
293,2,"8:26",506,"Hayden Koval made Free Throw.",84,57,"Alcorn State","Central Arkansas",NA,"400988910"
294,2,"8:26",506,"Hayden Koval made Free Throw.",85,57,"Alcorn State","Central Arkansas",NA,"400988910"
295,2,"8:18",498,"Maurice Howard missed Three Point Jumper.",85,57,"Alcorn State","Central Arkansas",NA,"400988910"
296,2,"8:18",498,"Hayden Koval Defensive Rebound.",85,57,"Alcorn State","Central Arkansas",NA,"400988910"
297,2,"8:06",486,"Foul on Tyler Carter.",85,57,"Alcorn State","Central Arkansas",NA,"400988910"
298,2,"8:06",486,"Hayden Koval made Free Throw.",86,57,"Alcorn State","Central Arkansas",NA,"400988910"
299,2,"8:06",486,"Hayden Koval made Free Throw.",87,57,"Alcorn State","Central Arkansas",NA,"400988910"
300,2,"7:55",475,"Reginal Johnson made Jumper.",87,59,"Alcorn State","Central Arkansas",NA,"400988910"
301,2,"7:38",458,"Deandre Jones made Three Point Jumper. Assisted by Hayden Koval.",90,59,"Alcorn State","Central Arkansas",NA,"400988910"
302,2,"7:27",447,"Reginal Johnson missed Jumper.",90,59,"Alcorn State","Central Arkansas",NA,"400988910"
303,2,"7:27",447,"Maurice Howard Offensive Rebound.",90,59,"Alcorn State","Central Arkansas",NA,"400988910"
304,2,"7:23",443,"Maurice Howard missed Jumper.",90,59,"Alcorn State","Central Arkansas",NA,"400988910"
305,2,"7:23",443,"Jared Chatham Defensive Rebound.",90,59,"Alcorn State","Central Arkansas",NA,"400988910"
306,2,"6:59",419,"Jordan Howard missed Jumper.",90,59,"Alcorn State","Central Arkansas",NA,"400988910"
307,2,"6:59",419,"Dante Sterling Defensive Rebound.",90,59,"Alcorn State","Central Arkansas",NA,"400988910"
308,2,"6:53",413,"A.J. Mosby made Layup.",90,61,"Alcorn State","Central Arkansas",NA,"400988910"
309,2,"6:41",401,"Central Arkansas  Timeout",90,61,"Alcorn State","Central Arkansas",NA,"400988910"
310,2,"6:32",392,"Ethan Lee Turnover.",90,61,"Alcorn State","Central Arkansas",NA,"400988910"
311,2,"6:18",378,"Reginal Johnson made Layup. Assisted by Troymain Crosby.",90,63,"Alcorn State","Central Arkansas",NA,"400988910"
312,2,"5:57",357,"Ethan Lee missed Layup.",90,63,"Alcorn State","Central Arkansas",NA,"400988910"
313,2,"5:57",357,"Reginal Johnson Defensive Rebound.",90,63,"Alcorn State","Central Arkansas",NA,"400988910"
314,2,"5:49",349,"Dante Sterling missed Layup.",90,63,"Alcorn State","Central Arkansas",NA,"400988910"
315,2,"5:49",349,"Jared Chatham Defensive Rebound.",90,63,"Alcorn State","Central Arkansas",NA,"400988910"
316,2,"5:34",334,"Jordan Howard missed Three Point Jumper.",90,63,"Alcorn State","Central Arkansas",NA,"400988910"
317,2,"5:34",334,"Yalen Reed Defensive Rebound.",90,63,"Alcorn State","Central Arkansas",NA,"400988910"
318,2,"5:26",326,"Troymain Crosby made Jumper.",90,65,"Alcorn State","Central Arkansas",NA,"400988910"
319,2,"4:59",299,"Tanner Schmit missed Jumper.",90,65,"Alcorn State","Central Arkansas",NA,"400988910"
320,2,"4:59",299,"Yalen Reed Defensive Rebound.",90,65,"Alcorn State","Central Arkansas",NA,"400988910"
321,2,"4:50",290,"A.J. Mosby missed Three Point Jumper.",90,65,"Alcorn State","Central Arkansas",NA,"400988910"
322,2,"4:50",290,"Jared Chatham Defensive Rebound.",90,65,"Alcorn State","Central Arkansas",NA,"400988910"
323,2,"4:46",286,"Foul on Troymain Crosby.",90,65,"Alcorn State","Central Arkansas",NA,"400988910"
324,2,"4:46",286,"Jared Chatham made Free Throw.",91,65,"Alcorn State","Central Arkansas",NA,"400988910"
325,2,"4:46",286,"Jared Chatham missed Free Throw.",91,65,"Alcorn State","Central Arkansas",NA,"400988910"
326,2,"4:46",286,"Yalen Reed Defensive Rebound.",91,65,"Alcorn State","Central Arkansas",NA,"400988910"
327,2,"4:41",281,"Foul on Tanner Schmit.",91,65,"Alcorn State","Central Arkansas",NA,"400988910"
328,2,"4:41",281,"Yalen Reed missed Free Throw.",91,65,"Alcorn State","Central Arkansas",NA,"400988910"
329,2,"4:41",281,"Thatch Unruh Defensive Rebound.",91,65,"Alcorn State","Central Arkansas",NA,"400988910"
330,2,"4:36",276,"Jordan Howard made Layup.",93,65,"Alcorn State","Central Arkansas",NA,"400988910"
331,2,"4:22",262,"Avery Patterson Turnover.",93,65,"Alcorn State","Central Arkansas",NA,"400988910"
332,2,"4:11",251,"Thatch Unruh made Layup.",95,65,"Alcorn State","Central Arkansas",NA,"400988910"
333,2,"4:11",251,"Foul on Troymain Crosby.",95,65,"Alcorn State","Central Arkansas",NA,"400988910"
334,2,"4:11",251,"Thatch Unruh missed Free Throw.",95,65,"Alcorn State","Central Arkansas",NA,"400988910"
335,2,"4:11",251,"Reginal Johnson Defensive Rebound.",95,65,"Alcorn State","Central Arkansas",NA,"400988910"
336,2,"4:00",240,"Alcorn State  Timeout",95,65,"Alcorn State","Central Arkansas",NA,"400988910"
337,2,"3:48",228,"Maurice Howard missed Jumper.",95,65,"Alcorn State","Central Arkansas",NA,"400988910"
338,2,"3:48",228,"Reginal Johnson Offensive Rebound.",95,65,"Alcorn State","Central Arkansas",NA,"400988910"
339,2,"3:43",223,"Reginal Johnson made Layup.",95,67,"Alcorn State","Central Arkansas",NA,"400988910"
340,2,"3:21",201,"Jordan Howard missed Three Point Jumper.",95,67,"Alcorn State","Central Arkansas",NA,"400988910"
341,2,"3:21",201,"Alcorn State Defensive Rebound.",95,67,"Alcorn State","Central Arkansas",NA,"400988910"
342,2,"3:06",186,"Dante Sterling missed Three Point Jumper.",95,67,"Alcorn State","Central Arkansas",NA,"400988910"
343,2,"3:06",186,"Deandre Jones Defensive Rebound.",95,67,"Alcorn State","Central Arkansas",NA,"400988910"
344,2,"2:57",177,"Tyler Simmons missed Three Point Jumper.",95,67,"Alcorn State","Central Arkansas",NA,"400988910"
345,2,"2:57",177,"Yalen Reed Defensive Rebound.",95,67,"Alcorn State","Central Arkansas",NA,"400988910"
346,2,"2:48",168,"Reginal Johnson made Three Point Jumper. Assisted by Maurice Howard.",95,70,"Alcorn State","Central Arkansas",NA,"400988910"
347,2,"2:12",132,"Jared Chatham made Jumper. Assisted by Jordan Grant.",97,70,"Alcorn State","Central Arkansas",NA,"400988910"
348,2,"1:52",112,"Maurice Howard missed Three Point Jumper.",97,70,"Alcorn State","Central Arkansas",NA,"400988910"
349,2,"1:52",112,"Yalen Reed Offensive Rebound.",97,70,"Alcorn State","Central Arkansas",NA,"400988910"
350,2,"1:49",109,"Foul on Jared Chatham.",97,70,"Alcorn State","Central Arkansas",NA,"400988910"
351,2,"1:49",109,"Yalen Reed missed Free Throw.",97,70,"Alcorn State","Central Arkansas",NA,"400988910"
352,2,"1:49",109,"Alcorn State Deadball Team Rebound.",97,70,"Alcorn State","Central Arkansas",NA,"400988910"
353,2,"1:49",109,"Yalen Reed missed Free Throw.",97,70,"Alcorn State","Central Arkansas",NA,"400988910"
354,2,"1:49",109,"Juwan Henderson Offensive Rebound.",97,70,"Alcorn State","Central Arkansas",NA,"400988910"
355,2,"1:43",103,"Juwan Henderson made Layup.",97,72,"Alcorn State","Central Arkansas",NA,"400988910"
356,2,"1:31",91,"Jared Chatham made Dunk. Assisted by Deandre Jones.",99,72,"Alcorn State","Central Arkansas",NA,"400988910"
357,2,"1:11",71,"Foul on Jordan Grant.",99,72,"Alcorn State","Central Arkansas",NA,"400988910"
358,2,"1:11",71,"Maurice Howard made Free Throw.",99,73,"Alcorn State","Central Arkansas",NA,"400988910"
