"play_id","half","time_remaining_half","secs_remaining","description","home_score","away_score","away","home","home_favored_by","game_id"
1,1,"20:00",2400,"PLAY",0,0,"Alcorn State","LSU",NA,"400987152"
2,1,"19:42",2382,"Avery Patterson missed Jumper.",0,0,"Alcorn State","LSU",NA,"400987152"
3,1,"19:42",2382,"LSU Defensive Rebound.",0,0,"Alcorn State","LSU",NA,"400987152"
4,1,"19:13",2353,"Duop Reath made Jumper. Assisted by Skylar Mays.",2,0,"Alcorn State","LSU",NA,"400987152"
5,1,"18:53",2333,"Avery Patterson Turnover.",2,0,"Alcorn State","LSU",NA,"400987152"
6,1,"18:52",2332,"Brandon Sampson Steal.",2,0,"Alcorn State","LSU",NA,"400987152"
7,1,"18:48",2328,"Brandon Sampson made Three Point Jumper.",5,0,"Alcorn State","LSU",NA,"400987152"
8,1,"18:29",2309,"Reginal Johnson missed Three Point Jumper.",5,0,"Alcorn State","LSU",NA,"400987152"
9,1,"18:29",2309,"Wayde Sims Defensive Rebound.",5,0,"Alcorn State","LSU",NA,"400987152"
10,1,"18:22",2302,"Foul on Avery Patterson.",5,0,"Alcorn State","LSU",NA,"400987152"
11,1,"18:22",2302,"Tremont Waters missed Free Throw.",5,0,"Alcorn State","LSU",NA,"400987152"
12,1,"18:22",2302,"LSU Deadball Team Rebound.",5,0,"Alcorn State","LSU",NA,"400987152"
13,1,"18:22",2302,"Tremont Waters made Free Throw.",6,0,"Alcorn State","LSU",NA,"400987152"
14,1,"18:14",2294,"Avery Patterson Turnover.",6,0,"Alcorn State","LSU",NA,"400987152"
15,1,"18:13",2293,"Tremont Waters Steal.",6,0,"Alcorn State","LSU",NA,"400987152"
16,1,"18:02",2282,"Duop Reath Turnover.",6,0,"Alcorn State","LSU",NA,"400987152"
17,1,"18:02",2282,"Foul on Duop Reath.",6,0,"Alcorn State","LSU",NA,"400987152"
18,1,"17:48",2268,"Reginal Johnson missed Jumper.",6,0,"Alcorn State","LSU",NA,"400987152"
19,1,"17:48",2268,"Jeremy Combs Block.",6,0,"Alcorn State","LSU",NA,"400987152"
20,1,"17:44",2264,"Jeremy Combs Defensive Rebound.",6,0,"Alcorn State","LSU",NA,"400987152"
21,1,"17:37",2257,"Tremont Waters made Three Point Jumper.",9,0,"Alcorn State","LSU",NA,"400987152"
22,1,"17:35",2255,"Alcorn State  Timeout",9,0,"Alcorn State","LSU",NA,"400987152"
23,1,"17:14",2234,"A.J. Mosby missed Three Point Jumper.",9,0,"Alcorn State","LSU",NA,"400987152"
24,1,"17:14",2234,"Tremont Waters Defensive Rebound.",9,0,"Alcorn State","LSU",NA,"400987152"
25,1,"17:10",2230,"Tremont Waters Turnover.",9,0,"Alcorn State","LSU",NA,"400987152"
26,1,"17:09",2229,"Maurice Howard Steal.",9,0,"Alcorn State","LSU",NA,"400987152"
27,1,"17:04",2224,"Reginal Johnson made Layup. Assisted by Maurice Howard.",9,2,"Alcorn State","LSU",NA,"400987152"
28,1,"16:36",2196,"Brandon Sampson made Three Point Jumper. Assisted by Jeremy Combs.",12,2,"Alcorn State","LSU",NA,"400987152"
29,1,"16:27",2187,"Dante Sterling Turnover.",12,2,"Alcorn State","LSU",NA,"400987152"
30,1,"16:26",2186,"Wayde Sims Steal.",12,2,"Alcorn State","LSU",NA,"400987152"
31,1,"16:23",2183,"Foul on Maurice Howard.",12,2,"Alcorn State","LSU",NA,"400987152"
32,1,"16:23",2183,"Jeremy Combs missed Free Throw.",12,2,"Alcorn State","LSU",NA,"400987152"
33,1,"16:23",2183,"LSU Deadball Team Rebound.",12,2,"Alcorn State","LSU",NA,"400987152"
34,1,"16:23",2183,"Jeremy Combs made Free Throw.",13,2,"Alcorn State","LSU",NA,"400987152"
35,1,"16:07",2167,"Reginal Johnson made Layup. Assisted by Yalen Reed.",13,4,"Alcorn State","LSU",NA,"400987152"
36,1,"15:41",2141,"Wayde Sims made Dunk. Assisted by Jeremy Combs.",15,4,"Alcorn State","LSU",NA,"400987152"
37,1,"15:25",2125,"Maurice Howard missed Three Point Jumper.",15,4,"Alcorn State","LSU",NA,"400987152"
38,1,"15:25",2125,"Brandon Sampson Defensive Rebound.",15,4,"Alcorn State","LSU",NA,"400987152"
39,1,"15:17",2117,"Foul on Maurice Howard.",15,4,"Alcorn State","LSU",NA,"400987152"
40,1,"15:17",2117,"Official TV Timeout",15,4,"Alcorn State","LSU",NA,"400987152"
41,1,"15:17",2117,"Tremont Waters made Free Throw.",16,4,"Alcorn State","LSU",NA,"400987152"
42,1,"15:17",2117,"Tremont Waters made Free Throw.",17,4,"Alcorn State","LSU",NA,"400987152"
43,1,"14:46",2086,"Khari Jabriel Allen made Jumper.",17,6,"Alcorn State","LSU",NA,"400987152"
44,1,"14:26",2066,"Tremont Waters missed Three Point Jumper.",17,6,"Alcorn State","LSU",NA,"400987152"
45,1,"14:26",2066,"Reginal Johnson Defensive Rebound.",17,6,"Alcorn State","LSU",NA,"400987152"
46,1,"14:10",2050,"Reginal Johnson made Layup. Assisted by Maurice Howard.",17,8,"Alcorn State","LSU",NA,"400987152"
47,1,"13:38",2018,"Foul on Reginal Johnson.",17,8,"Alcorn State","LSU",NA,"400987152"
48,1,"13:17",1997,"Skylar Mays missed Jumper.",17,8,"Alcorn State","LSU",NA,"400987152"
49,1,"13:17",1997,"Devon Brewer Block.",17,8,"Alcorn State","LSU",NA,"400987152"
50,1,"13:17",1997,"Devon Brewer Defensive Rebound.",17,8,"Alcorn State","LSU",NA,"400987152"
51,1,"13:02",1982,"Maurice Howard made Jumper.",17,10,"Alcorn State","LSU",NA,"400987152"
52,1,"12:44",1964,"Foul on Devon Brewer.",17,10,"Alcorn State","LSU",NA,"400987152"
53,1,"12:44",1964,"Jeremy Combs missed Free Throw.",17,10,"Alcorn State","LSU",NA,"400987152"
54,1,"12:44",1964,"LSU Deadball Team Rebound.",17,10,"Alcorn State","LSU",NA,"400987152"
55,1,"12:44",1964,"Jeremy Combs made Free Throw.",18,10,"Alcorn State","LSU",NA,"400987152"
56,1,"12:21",1941,"Maurice Howard missed Three Point Jumper.",18,10,"Alcorn State","LSU",NA,"400987152"
57,1,"12:21",1941,"Dante Sterling Offensive Rebound.",18,10,"Alcorn State","LSU",NA,"400987152"
58,1,"12:11",1931,"Tyler Carter made Three Point Jumper.",18,13,"Alcorn State","LSU",NA,"400987152"
59,1,"11:48",1908,"Daryl Edwards made Three Point Jumper. Assisted by Skylar Mays.",21,13,"Alcorn State","LSU",NA,"400987152"
60,1,"11:39",1899,"Foul on Daryl Edwards.",21,13,"Alcorn State","LSU",NA,"400987152"
61,1,"11:39",1899,"Official TV Timeout",21,13,"Alcorn State","LSU",NA,"400987152"
62,1,"11:38",1898,"Maurice Howard missed Three Point Jumper.",21,13,"Alcorn State","LSU",NA,"400987152"
63,1,"11:38",1898,"Duop Reath Defensive Rebound.",21,13,"Alcorn State","LSU",NA,"400987152"
64,1,"11:28",1888,"Skylar Mays made Layup.",23,13,"Alcorn State","LSU",NA,"400987152"
65,1,"11:11",1871,"Devon Brewer Turnover.",23,13,"Alcorn State","LSU",NA,"400987152"
66,1,"10:43",1843,"Foul on Troymain Crosby.",23,13,"Alcorn State","LSU",NA,"400987152"
67,1,"10:43",1843,"Duop Reath missed Free Throw.",23,13,"Alcorn State","LSU",NA,"400987152"
68,1,"10:43",1843,"LSU Deadball Team Rebound.",23,13,"Alcorn State","LSU",NA,"400987152"
69,1,"10:43",1843,"Duop Reath made Free Throw.",24,13,"Alcorn State","LSU",NA,"400987152"
70,1,"10:25",1825,"A.J. Mosby missed Layup.",24,13,"Alcorn State","LSU",NA,"400987152"
71,1,"10:25",1825,"Tyler Carter Offensive Rebound.",24,13,"Alcorn State","LSU",NA,"400987152"
72,1,"10:21",1821,"Tyler Carter made Jumper.",24,15,"Alcorn State","LSU",NA,"400987152"
73,1,"10:07",1807,"Daryl Edwards made Three Point Jumper. Assisted by Duop Reath.",27,15,"Alcorn State","LSU",NA,"400987152"
74,1,"9:53",1793,"A.J. Mosby made Three Point Jumper. Assisted by Tyler Carter.",27,18,"Alcorn State","LSU",NA,"400987152"
75,1,"9:35",1775,"Randy Onwuasor Turnover.",27,18,"Alcorn State","LSU",NA,"400987152"
76,1,"9:34",1774,"A.J. Mosby Steal.",27,18,"Alcorn State","LSU",NA,"400987152"
77,1,"9:31",1771,"A.J. Mosby made Layup.",27,20,"Alcorn State","LSU",NA,"400987152"
78,1,"9:11",1751,"Wayde Sims Turnover.",27,20,"Alcorn State","LSU",NA,"400987152"
79,1,"9:11",1751,"Foul on Wayde Sims.",27,20,"Alcorn State","LSU",NA,"400987152"
80,1,"8:50",1730,"Foul on Wayde Sims.",27,20,"Alcorn State","LSU",NA,"400987152"
81,1,"8:32",1712,"Dante Sterling missed Three Point Jumper.",27,20,"Alcorn State","LSU",NA,"400987152"
82,1,"8:32",1712,"Tremont Waters Defensive Rebound.",27,20,"Alcorn State","LSU",NA,"400987152"
83,1,"8:28",1708,"Foul on A.J. Mosby.",27,20,"Alcorn State","LSU",NA,"400987152"
84,1,"8:28",1708,"Tremont Waters made Free Throw.",28,20,"Alcorn State","LSU",NA,"400987152"
85,1,"8:28",1708,"Tremont Waters made Free Throw.",29,20,"Alcorn State","LSU",NA,"400987152"
86,1,"8:19",1699,"A.J. Mosby Turnover.",29,20,"Alcorn State","LSU",NA,"400987152"
87,1,"8:18",1698,"Tremont Waters Steal.",29,20,"Alcorn State","LSU",NA,"400987152"
88,1,"8:06",1686,"Duop Reath missed Layup.",29,20,"Alcorn State","LSU",NA,"400987152"
89,1,"8:06",1686,"Brandon Rachal Offensive Rebound.",29,20,"Alcorn State","LSU",NA,"400987152"
90,1,"8:02",1682,"Brandon Rachal missed Layup.",29,20,"Alcorn State","LSU",NA,"400987152"
91,1,"8:02",1682,"Yalen Reed Defensive Rebound.",29,20,"Alcorn State","LSU",NA,"400987152"
92,1,"7:40",1660,"Reginal Johnson missed Jumper.",29,20,"Alcorn State","LSU",NA,"400987152"
93,1,"7:40",1660,"Brandon Rachal Defensive Rebound.",29,20,"Alcorn State","LSU",NA,"400987152"
94,1,"7:33",1653,"Daryl Edwards missed Three Point Jumper.",29,20,"Alcorn State","LSU",NA,"400987152"
95,1,"7:33",1653,"Brandon Rachal Offensive Rebound.",29,20,"Alcorn State","LSU",NA,"400987152"
96,1,"7:30",1650,"Brandon Rachal made Layup.",31,20,"Alcorn State","LSU",NA,"400987152"
97,1,"7:18",1638,"A.J. Mosby made Jumper.",31,22,"Alcorn State","LSU",NA,"400987152"
98,1,"6:53",1613,"Duop Reath missed Jumper.",31,22,"Alcorn State","LSU",NA,"400987152"
99,1,"6:53",1613,"Dante Sterling Defensive Rebound.",31,22,"Alcorn State","LSU",NA,"400987152"
100,1,"6:39",1599,"Yalen Reed missed Three Point Jumper.",31,22,"Alcorn State","LSU",NA,"400987152"
101,1,"6:39",1599,"Tremont Waters Defensive Rebound.",31,22,"Alcorn State","LSU",NA,"400987152"
102,1,"6:31",1591,"Tremont Waters missed Three Point Jumper.",31,22,"Alcorn State","LSU",NA,"400987152"
103,1,"6:31",1591,"Brandon Sampson Offensive Rebound.",31,22,"Alcorn State","LSU",NA,"400987152"
104,1,"6:24",1584,"Brandon Sampson made Jumper.",33,22,"Alcorn State","LSU",NA,"400987152"
105,1,"6:16",1576,"Dante Sterling missed Three Point Jumper.",33,22,"Alcorn State","LSU",NA,"400987152"
106,1,"6:16",1576,"Tremont Waters Defensive Rebound.",33,22,"Alcorn State","LSU",NA,"400987152"
107,1,"6:08",1568,"Tremont Waters missed Jumper.",33,22,"Alcorn State","LSU",NA,"400987152"
108,1,"6:08",1568,"Avery Patterson Defensive Rebound.",33,22,"Alcorn State","LSU",NA,"400987152"
109,1,"5:54",1554,"Avery Patterson Turnover.",33,22,"Alcorn State","LSU",NA,"400987152"
110,1,"5:52",1552,"Tremont Waters Steal.",33,22,"Alcorn State","LSU",NA,"400987152"
111,1,"5:50",1550,"Duop Reath made Layup. Assisted by Tremont Waters.",35,22,"Alcorn State","LSU",NA,"400987152"
112,1,"5:40",1540,"A.J. Mosby missed Jumper.",35,22,"Alcorn State","LSU",NA,"400987152"
113,1,"5:40",1540,"A.J. Mosby Offensive Rebound.",35,22,"Alcorn State","LSU",NA,"400987152"
114,1,"5:37",1537,"A.J. Mosby made Jumper.",35,24,"Alcorn State","LSU",NA,"400987152"
115,1,"5:02",1502,"Duop Reath missed Jumper.",35,24,"Alcorn State","LSU",NA,"400987152"
116,1,"5:02",1502,"Dante Sterling Defensive Rebound.",35,24,"Alcorn State","LSU",NA,"400987152"
117,1,"4:50",1490,"Dante Sterling missed Layup.",35,24,"Alcorn State","LSU",NA,"400987152"
118,1,"4:50",1490,"Brandon Sampson Block.",35,24,"Alcorn State","LSU",NA,"400987152"
119,1,"4:50",1490,"Alcorn State Offensive Rebound.",35,24,"Alcorn State","LSU",NA,"400987152"
120,1,"4:50",1490,"Official TV Timeout",35,24,"Alcorn State","LSU",NA,"400987152"
121,1,"4:43",1483,"Khari Jabriel Allen made Jumper.",35,26,"Alcorn State","LSU",NA,"400987152"
122,1,"4:43",1483,"Foul on Brandon Sampson.",35,26,"Alcorn State","LSU",NA,"400987152"
123,1,"4:43",1483,"Khari Jabriel Allen made Free Throw.",35,27,"Alcorn State","LSU",NA,"400987152"
124,1,"4:28",1468,"Brandon Rachal made Jumper.",37,27,"Alcorn State","LSU",NA,"400987152"
125,1,"4:28",1468,"Foul on Devon Brewer.",37,27,"Alcorn State","LSU",NA,"400987152"
126,1,"4:28",1468,"Brandon Rachal missed Free Throw.",37,27,"Alcorn State","LSU",NA,"400987152"
127,1,"4:28",1468,"Reginal Johnson Defensive Rebound.",37,27,"Alcorn State","LSU",NA,"400987152"
128,1,"3:59",1439,"Khari Jabriel Allen missed Three Point Jumper.",37,27,"Alcorn State","LSU",NA,"400987152"
129,1,"3:59",1439,"Jeremy Combs Defensive Rebound.",37,27,"Alcorn State","LSU",NA,"400987152"
130,1,"3:49",1429,"Tremont Waters made Layup.",39,27,"Alcorn State","LSU",NA,"400987152"
131,1,"3:28",1408,"Devon Brewer Turnover.",39,27,"Alcorn State","LSU",NA,"400987152"
132,1,"3:27",1407,"Brandon Sampson Steal.",39,27,"Alcorn State","LSU",NA,"400987152"
133,1,"3:23",1403,"Jeremy Combs missed Layup.",39,27,"Alcorn State","LSU",NA,"400987152"
134,1,"3:23",1403,"Jeremy Combs Offensive Rebound.",39,27,"Alcorn State","LSU",NA,"400987152"
135,1,"3:20",1400,"Jeremy Combs missed Layup.",39,27,"Alcorn State","LSU",NA,"400987152"
136,1,"3:20",1400,"Brandon Sampson Offensive Rebound.",39,27,"Alcorn State","LSU",NA,"400987152"
137,1,"3:08",1388,"Jeremy Combs made Jumper.",41,27,"Alcorn State","LSU",NA,"400987152"
138,1,"2:59",1379,"Khari Jabriel Allen missed Jumper.",41,27,"Alcorn State","LSU",NA,"400987152"
139,1,"2:59",1379,"Brandon Rachal Defensive Rebound.",41,27,"Alcorn State","LSU",NA,"400987152"
140,1,"2:49",1369,"Jeremy Combs made Jumper. Assisted by Tremont Waters.",43,27,"Alcorn State","LSU",NA,"400987152"
141,1,"2:36",1356,"Reginal Johnson missed Jumper.",43,27,"Alcorn State","LSU",NA,"400987152"
142,1,"2:36",1356,"Brandon Sampson Block.",43,27,"Alcorn State","LSU",NA,"400987152"
143,1,"2:35",1355,"LSU Defensive Rebound.",43,27,"Alcorn State","LSU",NA,"400987152"
144,1,"2:35",1355,"Official TV Timeout",43,27,"Alcorn State","LSU",NA,"400987152"
145,1,"2:34",1354,"Official TV Timeout",43,27,"Alcorn State","LSU",NA,"400987152"
146,1,"2:08",1328,"Tremont Waters missed Layup.",43,27,"Alcorn State","LSU",NA,"400987152"
147,1,"2:08",1328,"Khari Jabriel Allen Defensive Rebound.",43,27,"Alcorn State","LSU",NA,"400987152"
148,1,"2:05",1325,"Khari Jabriel Allen Turnover.",43,27,"Alcorn State","LSU",NA,"400987152"
149,1,"2:04",1324,"Skylar Mays Steal.",43,27,"Alcorn State","LSU",NA,"400987152"
150,1,"2:01",1321,"Tremont Waters made Layup. Assisted by Skylar Mays.",45,27,"Alcorn State","LSU",NA,"400987152"
151,1,"1:46",1306,"Troymain Crosby Turnover.",45,27,"Alcorn State","LSU",NA,"400987152"
152,1,"1:46",1306,"Brandon Rachal Steal.",45,27,"Alcorn State","LSU",NA,"400987152"
153,1,"1:40",1300,"Tremont Waters made Three Point Jumper. Assisted by Brandon Rachal.",48,27,"Alcorn State","LSU",NA,"400987152"
154,1,"1:18",1278,"Yalen Reed missed Three Point Jumper.",48,27,"Alcorn State","LSU",NA,"400987152"
155,1,"1:18",1278,"Reginal Johnson Offensive Rebound.",48,27,"Alcorn State","LSU",NA,"400987152"
156,1,"1:16",1276,"Foul on Brandon Rachal.",48,27,"Alcorn State","LSU",NA,"400987152"
157,1,"1:02",1262,"A.J. Mosby made Layup.",48,29,"Alcorn State","LSU",NA,"400987152"
158,1,"0:57",1257,"Jeremy Combs Turnover.",48,29,"Alcorn State","LSU",NA,"400987152"
159,1,"0:56",1256,"A.J. Mosby Steal.",48,29,"Alcorn State","LSU",NA,"400987152"
160,1,"0:50",1250,"Avery Patterson made Three Point Jumper.",48,32,"Alcorn State","LSU",NA,"400987152"
161,1,"0:49",1249,"LSU  Timeout",48,32,"Alcorn State","LSU",NA,"400987152"
162,1,"0:32",1232,"Tremont Waters made Three Point Jumper.",51,32,"Alcorn State","LSU",NA,"400987152"
163,1,"0:03",1203,"A.J. Mosby missed Three Point Jumper.",51,32,"Alcorn State","LSU",NA,"400987152"
164,1,"0:03",1203,"Dante Sterling Offensive Rebound.",51,32,"Alcorn State","LSU",NA,"400987152"
165,1,"0:01",1201,"Dante Sterling made Jumper.",51,34,"Alcorn State","LSU",NA,"400987152"
166,1,"0:00",1200,"End of 1st half",51,34,"Alcorn State","LSU",NA,"400987152"
167,2,"20:00",1200,"PLAY",51,34,"Alcorn State","LSU",NA,"400987152"
168,2,"19:32",1172,"Duop Reath missed Jumper.",51,34,"Alcorn State","LSU",NA,"400987152"
169,2,"19:32",1172,"Brandon Sampson Offensive Rebound.",51,34,"Alcorn State","LSU",NA,"400987152"
170,2,"19:14",1154,"Skylar Mays missed Three Point Jumper.",51,34,"Alcorn State","LSU",NA,"400987152"
171,2,"19:14",1154,"A.J. Mosby Defensive Rebound.",51,34,"Alcorn State","LSU",NA,"400987152"
172,2,"19:11",1151,"Foul on Duop Reath.",51,34,"Alcorn State","LSU",NA,"400987152"
173,2,"18:53",1133,"Avery Patterson missed Three Point Jumper.",51,34,"Alcorn State","LSU",NA,"400987152"
174,2,"18:53",1133,"Skylar Mays Defensive Rebound.",51,34,"Alcorn State","LSU",NA,"400987152"
175,2,"18:46",1126,"Skylar Mays made Layup.",53,34,"Alcorn State","LSU",NA,"400987152"
176,2,"18:46",1126,"Foul on Yalen Reed.",53,34,"Alcorn State","LSU",NA,"400987152"
177,2,"18:46",1126,"Skylar Mays made Free Throw.",54,34,"Alcorn State","LSU",NA,"400987152"
178,2,"18:31",1111,"A.J. Mosby Turnover.",54,34,"Alcorn State","LSU",NA,"400987152"
179,2,"18:31",1111,"Skylar Mays Steal.",54,34,"Alcorn State","LSU",NA,"400987152"
180,2,"18:15",1095,"Wayde Sims missed Jumper.",54,34,"Alcorn State","LSU",NA,"400987152"
181,2,"18:15",1095,"Yalen Reed Defensive Rebound.",54,34,"Alcorn State","LSU",NA,"400987152"
182,2,"18:05",1085,"Reginal Johnson missed Three Point Jumper.",54,34,"Alcorn State","LSU",NA,"400987152"
183,2,"18:05",1085,"Avery Patterson Offensive Rebound.",54,34,"Alcorn State","LSU",NA,"400987152"
184,2,"18:01",1081,"Avery Patterson missed Jumper.",54,34,"Alcorn State","LSU",NA,"400987152"
185,2,"18:01",1081,"Wayde Sims Block.",54,34,"Alcorn State","LSU",NA,"400987152"
186,2,"17:59",1079,"Avery Patterson Offensive Rebound.",54,34,"Alcorn State","LSU",NA,"400987152"
187,2,"17:56",1076,"A.J. Mosby missed Jumper.",54,34,"Alcorn State","LSU",NA,"400987152"
188,2,"17:56",1076,"Brandon Sampson Defensive Rebound.",54,34,"Alcorn State","LSU",NA,"400987152"
189,2,"17:40",1060,"Wayde Sims made Three Point Jumper. Assisted by Tremont Waters.",57,34,"Alcorn State","LSU",NA,"400987152"
190,2,"17:20",1040,"Reginal Johnson missed Jumper.",57,34,"Alcorn State","LSU",NA,"400987152"
191,2,"17:20",1040,"Wayde Sims Defensive Rebound.",57,34,"Alcorn State","LSU",NA,"400987152"
192,2,"17:13",1033,"Duop Reath made Layup. Assisted by Tremont Waters.",59,34,"Alcorn State","LSU",NA,"400987152"
193,2,"16:51",1011,"Yalen Reed Turnover.",59,34,"Alcorn State","LSU",NA,"400987152"
194,2,"16:50",1010,"Tremont Waters Steal.",59,34,"Alcorn State","LSU",NA,"400987152"
195,2,"16:44",1004,"Brandon Sampson made Dunk. Assisted by Tremont Waters.",61,34,"Alcorn State","LSU",NA,"400987152"
196,2,"16:39",999,"Alcorn State  Timeout",61,34,"Alcorn State","LSU",NA,"400987152"
197,2,"16:29",989,"A.J. Mosby missed Jumper.",61,34,"Alcorn State","LSU",NA,"400987152"
198,2,"16:29",989,"A.J. Mosby Offensive Rebound.",61,34,"Alcorn State","LSU",NA,"400987152"
199,2,"16:28",988,"Khari Jabriel Allen Turnover.",61,34,"Alcorn State","LSU",NA,"400987152"
200,2,"16:28",988,"Tremont Waters Steal.",61,34,"Alcorn State","LSU",NA,"400987152"
201,2,"16:05",965,"Wayde Sims made Layup. Assisted by Skylar Mays.",63,34,"Alcorn State","LSU",NA,"400987152"
202,2,"15:50",950,"A.J. Mosby made Jumper.",63,36,"Alcorn State","LSU",NA,"400987152"
203,2,"15:32",932,"Foul on Devon Brewer.",63,36,"Alcorn State","LSU",NA,"400987152"
204,2,"15:32",932,"Official TV Timeout",63,36,"Alcorn State","LSU",NA,"400987152"
205,2,"15:26",926,"Brandon Sampson Turnover.",63,36,"Alcorn State","LSU",NA,"400987152"
206,2,"15:22",922,"Maurice Howard made Layup.",63,38,"Alcorn State","LSU",NA,"400987152"
207,2,"15:09",909,"Skylar Mays made Layup.",65,38,"Alcorn State","LSU",NA,"400987152"
208,2,"14:57",897,"Maurice Howard Turnover.",65,38,"Alcorn State","LSU",NA,"400987152"
209,2,"14:32",872,"Skylar Mays Turnover.",65,38,"Alcorn State","LSU",NA,"400987152"
210,2,"14:30",870,"A.J. Mosby Steal.",65,38,"Alcorn State","LSU",NA,"400987152"
211,2,"14:27",867,"Khari Jabriel Allen missed Three Point Jumper.",65,38,"Alcorn State","LSU",NA,"400987152"
212,2,"14:27",867,"Skylar Mays Defensive Rebound.",65,38,"Alcorn State","LSU",NA,"400987152"
213,2,"14:20",860,"Jeremy Combs made Layup. Assisted by Skylar Mays.",67,38,"Alcorn State","LSU",NA,"400987152"
214,2,"13:57",837,"Kobe Wilson missed Three Point Jumper.",67,38,"Alcorn State","LSU",NA,"400987152"
215,2,"13:57",837,"Skylar Mays Defensive Rebound.",67,38,"Alcorn State","LSU",NA,"400987152"
216,2,"13:46",826,"Jeremy Combs missed Layup.",67,38,"Alcorn State","LSU",NA,"400987152"
217,2,"13:46",826,"Reginal Johnson Defensive Rebound.",67,38,"Alcorn State","LSU",NA,"400987152"
218,2,"13:31",811,"Reginal Johnson missed Three Point Jumper.",67,38,"Alcorn State","LSU",NA,"400987152"
219,2,"13:31",811,"Jeremy Combs Defensive Rebound.",67,38,"Alcorn State","LSU",NA,"400987152"
220,2,"13:11",791,"Foul on A.J. Mosby.",67,38,"Alcorn State","LSU",NA,"400987152"
221,2,"13:05",785,"Foul on Yalen Reed.",67,38,"Alcorn State","LSU",NA,"400987152"
222,2,"13:05",785,"Duop Reath missed Free Throw.",67,38,"Alcorn State","LSU",NA,"400987152"
223,2,"13:05",785,"LSU Deadball Team Rebound.",67,38,"Alcorn State","LSU",NA,"400987152"
224,2,"13:05",785,"Duop Reath made Free Throw.",68,38,"Alcorn State","LSU",NA,"400987152"
225,2,"12:57",777,"Dante Sterling missed Three Point Jumper.",68,38,"Alcorn State","LSU",NA,"400987152"
226,2,"12:57",777,"Daryl Edwards Defensive Rebound.",68,38,"Alcorn State","LSU",NA,"400987152"
227,2,"12:31",751,"Brandon Rachal missed Jumper.",68,38,"Alcorn State","LSU",NA,"400987152"
228,2,"12:31",751,"Yalen Reed Defensive Rebound.",68,38,"Alcorn State","LSU",NA,"400987152"
229,2,"12:26",746,"Yalen Reed Turnover.",68,38,"Alcorn State","LSU",NA,"400987152"
230,2,"12:22",742,"Brandon Rachal missed Jumper.",68,38,"Alcorn State","LSU",NA,"400987152"
231,2,"12:22",742,"Randy Onwuasor Offensive Rebound.",68,38,"Alcorn State","LSU",NA,"400987152"
232,2,"12:16",736,"Brandon Rachal made Jumper.",70,38,"Alcorn State","LSU",NA,"400987152"
233,2,"11:46",706,"Official TV Timeout",70,38,"Alcorn State","LSU",NA,"400987152"
234,2,"11:43",703,"Alcorn State  Turnover.",70,38,"Alcorn State","LSU",NA,"400987152"
235,2,"11:21",681,"Duop Reath made Jumper. Assisted by Tremont Waters.",72,38,"Alcorn State","LSU",NA,"400987152"
236,2,"11:07",667,"Tyler Carter made Jumper.",72,40,"Alcorn State","LSU",NA,"400987152"
237,2,"10:54",654,"Tremont Waters made Layup.",74,40,"Alcorn State","LSU",NA,"400987152"
238,2,"10:37",637,"Foul on Brandon Rachal.",74,40,"Alcorn State","LSU",NA,"400987152"
239,2,"10:19",619,"Tyler Carter missed Jumper.",74,40,"Alcorn State","LSU",NA,"400987152"
240,2,"10:19",619,"Wayde Sims Block.",74,40,"Alcorn State","LSU",NA,"400987152"
241,2,"10:17",617,"Duop Reath Defensive Rebound.",74,40,"Alcorn State","LSU",NA,"400987152"
242,2,"9:49",589,"Duop Reath missed Jumper.",74,40,"Alcorn State","LSU",NA,"400987152"
243,2,"9:49",589,"Devon Brewer Block.",74,40,"Alcorn State","LSU",NA,"400987152"
244,2,"9:47",587,"Alcorn State Deadball Team Rebound.",74,40,"Alcorn State","LSU",NA,"400987152"
245,2,"9:27",567,"Tyler Carter missed Three Point Jumper.",74,40,"Alcorn State","LSU",NA,"400987152"
246,2,"9:27",567,"Daryl Edwards Defensive Rebound.",74,40,"Alcorn State","LSU",NA,"400987152"
247,2,"9:19",559,"Foul on Tyler Carter.",74,40,"Alcorn State","LSU",NA,"400987152"
248,2,"9:19",559,"Duop Reath missed Free Throw.",74,40,"Alcorn State","LSU",NA,"400987152"
249,2,"9:19",559,"LSU Deadball Team Rebound.",74,40,"Alcorn State","LSU",NA,"400987152"
250,2,"9:19",559,"Duop Reath made Free Throw.",75,40,"Alcorn State","LSU",NA,"400987152"
251,2,"9:02",542,"Khari Jabriel Allen missed Three Point Jumper.",75,40,"Alcorn State","LSU",NA,"400987152"
252,2,"9:02",542,"Tremont Waters Defensive Rebound.",75,40,"Alcorn State","LSU",NA,"400987152"
253,2,"8:56",536,"Foul on Avery Patterson.",75,40,"Alcorn State","LSU",NA,"400987152"
254,2,"8:44",524,"Tremont Waters made Jumper.",77,40,"Alcorn State","LSU",NA,"400987152"
255,2,"8:31",511,"Foul on Wayde Sims.",77,40,"Alcorn State","LSU",NA,"400987152"
256,2,"8:28",508,"Khari Jabriel Allen Turnover.",77,40,"Alcorn State","LSU",NA,"400987152"
257,2,"8:26",506,"Daryl Edwards Steal.",77,40,"Alcorn State","LSU",NA,"400987152"
258,2,"8:25",505,"Daryl Edwards made Layup.",79,40,"Alcorn State","LSU",NA,"400987152"
259,2,"8:09",489,"Avery Patterson made Layup.",79,42,"Alcorn State","LSU",NA,"400987152"
260,2,"7:58",478,"Tremont Waters made Layup.",81,42,"Alcorn State","LSU",NA,"400987152"
261,2,"7:53",473,"Foul on Devon Brewer.",81,42,"Alcorn State","LSU",NA,"400987152"
262,2,"7:53",473,"Foul on Jeremy Combs.",81,42,"Alcorn State","LSU",NA,"400987152"
263,2,"7:53",473,"Official TV Timeout",81,42,"Alcorn State","LSU",NA,"400987152"
264,2,"7:34",454,"Avery Patterson missed Three Point Jumper.",81,42,"Alcorn State","LSU",NA,"400987152"
265,2,"7:34",454,"Reginal Johnson Offensive Rebound.",81,42,"Alcorn State","LSU",NA,"400987152"
266,2,"7:32",452,"Reginal Johnson made Layup.",81,44,"Alcorn State","LSU",NA,"400987152"
267,2,"7:11",431,"Daryl Edwards missed Three Point Jumper.",81,44,"Alcorn State","LSU",NA,"400987152"
268,2,"7:11",431,"Randy Onwuasor Offensive Rebound.",81,44,"Alcorn State","LSU",NA,"400987152"
269,2,"6:59",419,"Tremont Waters made Three Point Jumper.",84,44,"Alcorn State","LSU",NA,"400987152"
270,2,"6:40",400,"Foul on Jeremy Combs.",84,44,"Alcorn State","LSU",NA,"400987152"
271,2,"6:40",400,"Avery Patterson made Free Throw.",84,45,"Alcorn State","LSU",NA,"400987152"
272,2,"6:40",400,"Avery Patterson made Free Throw.",84,46,"Alcorn State","LSU",NA,"400987152"
273,2,"6:15",375,"Wayde Sims made Three Point Jumper. Assisted by Marshall Graves.",87,46,"Alcorn State","LSU",NA,"400987152"
274,2,"6:06",366,"Reginal Johnson made Layup. Assisted by A.J. Mosby.",87,48,"Alcorn State","LSU",NA,"400987152"
275,2,"5:53",353,"Foul on Khari Jabriel Allen.",87,48,"Alcorn State","LSU",NA,"400987152"
276,2,"5:53",353,"Randy Onwuasor made Free Throw.",88,48,"Alcorn State","LSU",NA,"400987152"
277,2,"5:53",353,"Randy Onwuasor made Free Throw.",89,48,"Alcorn State","LSU",NA,"400987152"
278,2,"5:43",343,"A.J. Mosby made Layup. Assisted by Khari Jabriel Allen.",89,50,"Alcorn State","LSU",NA,"400987152"
279,2,"5:16",316,"Wayde Sims missed Three Point Jumper.",89,50,"Alcorn State","LSU",NA,"400987152"
