"play_id","half","time_remaining_half","secs_remaining","description","home_score","away_score","away","home","home_favored_by","game_id"
41,1,"14:14",2054,"Victor Alston made Free Throw.",7,5,"Fisk","Alcorn State",NA,"400992864"
42,1,"14:14",2054,"Victor Alston made Free Throw.",7,6,"Fisk","Alcorn State",NA,"400992864"
43,1,"13:48",2028,"Devon Brewer made Layup.",9,6,"Fisk","Alcorn State",NA,"400992864"
44,1,"13:27",2007,"El Paso Pitts missed Layup.",9,6,"Fisk","Alcorn State",NA,"400992864"
45,1,"13:27",2007,"Devon Brewer Defensive Rebound.",9,6,"Fisk","Alcorn State",NA,"400992864"
46,1,"13:06",1986,"Troymain Crosby Turnover.",9,6,"Fisk","Alcorn State",NA,"400992864"
47,1,"13:04",1984,"Montreal Nabors Steal.",9,6,"Fisk","Alcorn State",NA,"400992864"
48,1,"12:59",1979,"Tyran Davis missed Three Point Jumper.",9,6,"Fisk","Alcorn State",NA,"400992864"
49,1,"12:59",1979,"Devon Brewer Defensive Rebound.",9,6,"Fisk","Alcorn State",NA,"400992864"
50,1,"12:47",1967,"Tyler Carter made Layup. Assisted by Maurice Howard.",11,6,"Fisk","Alcorn State",NA,"400992864"
51,1,"12:20",1940,"Montreal Nabors made Jumper. Assisted by Victor Alston.",11,8,"Fisk","Alcorn State",NA,"400992864"
52,1,"12:12",1932,"Avery Patterson missed Layup.",11,8,"Fisk","Alcorn State",NA,"400992864"
53,1,"12:12",1932,"El Paso Pitts Defensive Rebound.",11,8,"Fisk","Alcorn State",NA,"400992864"
54,1,"12:03",1923,"El Paso Pitts Turnover.",11,8,"Fisk","Alcorn State",NA,"400992864"
55,1,"12:00",1920,"Troymain Crosby Steal.",11,8,"Fisk","Alcorn State",NA,"400992864"
56,1,"11:57",1917,"Devon Brewer missed Layup.",11,8,"Fisk","Alcorn State",NA,"400992864"
57,1,"11:57",1917,"Tyran Davis Defensive Rebound.",11,8,"Fisk","Alcorn State",NA,"400992864"
58,1,"11:41",1901,"Montreal Nabors made Three Point Jumper. Assisted by Ryainni Scott.",11,11,"Fisk","Alcorn State",NA,"400992864"
59,1,"11:25",1885,"Troymain Crosby missed Three Point Jumper.",11,11,"Fisk","Alcorn State",NA,"400992864"
60,1,"11:25",1885,"Montreal Nabors Defensive Rebound.",11,11,"Fisk","Alcorn State",NA,"400992864"
61,1,"11:18",1878,"Montreal Nabors made Layup.",11,13,"Fisk","Alcorn State",NA,"400992864"
62,1,"10:54",1854,"Ryainni Scott missed Jumper.",11,13,"Fisk","Alcorn State",NA,"400992864"
63,1,"10:54",1854,"A.J. Mosby Defensive Rebound.",11,13,"Fisk","Alcorn State",NA,"400992864"
64,1,"10:49",1849,"Montreal Nabors made Layup.",11,15,"Fisk","Alcorn State",NA,"400992864"
65,1,"10:27",1827,"Devon Brewer missed Layup.",11,15,"Fisk","Alcorn State",NA,"400992864"
66,1,"10:27",1827,"Tyran Davis Defensive Rebound.",11,15,"Fisk","Alcorn State",NA,"400992864"
67,1,"10:26",1826,"Foul on Tyler Carter.",11,15,"Fisk","Alcorn State",NA,"400992864"
68,1,"10:26",1826,"Official TV Timeout",11,15,"Fisk","Alcorn State",NA,"400992864"
69,1,"10:14",1814,"Addison Miller missed Three Point Jumper.",11,15,"Fisk","Alcorn State",NA,"400992864"
70,1,"10:14",1814,"Joshua Madison Offensive Rebound.",11,15,"Fisk","Alcorn State",NA,"400992864"
71,1,"10:03",1803,"Ryainni Scott missed Jumper.",11,15,"Fisk","Alcorn State",NA,"400992864"
72,1,"10:03",1803,"Dante Sterling Defensive Rebound.",11,15,"Fisk","Alcorn State",NA,"400992864"
73,1,"10:02",1802,"Foul on Montreal Nabors.",11,15,"Fisk","Alcorn State",NA,"400992864"
74,1,"9:49",1789,"A.J. Mosby missed Jumper.",11,15,"Fisk","Alcorn State",NA,"400992864"
75,1,"9:49",1789,"Ryainni Scott Defensive Rebound.",11,15,"Fisk","Alcorn State",NA,"400992864"
76,1,"9:20",1760,"Ryainni Scott missed Jumper.",11,15,"Fisk","Alcorn State",NA,"400992864"
77,1,"9:20",1760,"A.J. Mosby Defensive Rebound.",11,15,"Fisk","Alcorn State",NA,"400992864"
78,1,"9:15",1755,"Foul on Joshua Madison.",11,15,"Fisk","Alcorn State",NA,"400992864"
79,1,"9:15",1755,"Avery Patterson missed Free Throw.",11,15,"Fisk","Alcorn State",NA,"400992864"
80,1,"9:15",1755,"Alcorn State Deadball Team Rebound.",11,15,"Fisk","Alcorn State",NA,"400992864"
81,1,"9:15",1755,"Avery Patterson made Free Throw.",12,15,"Fisk","Alcorn State",NA,"400992864"
82,1,"9:01",1741,"Montreal Nabors Turnover.",12,15,"Fisk","Alcorn State",NA,"400992864"
83,1,"9:00",1740,"Dante Sterling Steal.",12,15,"Fisk","Alcorn State",NA,"400992864"
84,1,"8:57",1737,"Avery Patterson missed Layup.",12,15,"Fisk","Alcorn State",NA,"400992864"
85,1,"8:57",1737,"Victor Alston Defensive Rebound.",12,15,"Fisk","Alcorn State",NA,"400992864"
86,1,"8:49",1729,"Ryainni Scott made Layup. Assisted by Victor Alston.",12,17,"Fisk","Alcorn State",NA,"400992864"
87,1,"8:32",1712,"A.J. Mosby made Jumper. Assisted by Yalen Reed.",14,17,"Fisk","Alcorn State",NA,"400992864"
88,1,"8:09",1689,"Joshua Madison missed Jumper.",14,17,"Fisk","Alcorn State",NA,"400992864"
89,1,"8:09",1689,"TyQuaylon Smith Block.",14,17,"Fisk","Alcorn State",NA,"400992864"
90,1,"8:07",1687,"Avery Patterson Defensive Rebound.",14,17,"Fisk","Alcorn State",NA,"400992864"
91,1,"7:58",1678,"Yalen Reed Turnover.",14,17,"Fisk","Alcorn State",NA,"400992864"
92,1,"7:57",1677,"Addison Miller Steal.",14,17,"Fisk","Alcorn State",NA,"400992864"
93,1,"7:39",1659,"Montreal Nabors made Three Point Jumper. Assisted by Victor Alston.",14,20,"Fisk","Alcorn State",NA,"400992864"
94,1,"7:26",1646,"Avery Patterson missed Three Point Jumper.",14,20,"Fisk","Alcorn State",NA,"400992864"
95,1,"7:26",1646,"Joshua Madison Defensive Rebound.",14,20,"Fisk","Alcorn State",NA,"400992864"
96,1,"7:18",1638,"Joshua Madison Turnover.",14,20,"Fisk","Alcorn State",NA,"400992864"
97,1,"7:18",1638,"Foul on Joshua Madison.",14,20,"Fisk","Alcorn State",NA,"400992864"
98,1,"7:18",1638,"Official TV Timeout",14,20,"Fisk","Alcorn State",NA,"400992864"
99,1,"7:03",1623,"Foul on Larson Ashford.",14,20,"Fisk","Alcorn State",NA,"400992864"
100,1,"6:54",1614,"A.J. Mosby missed Three Point Jumper.",14,20,"Fisk","Alcorn State",NA,"400992864"
101,1,"6:54",1614,"El Paso Pitts Defensive Rebound.",14,20,"Fisk","Alcorn State",NA,"400992864"
102,1,"6:44",1604,"Addison Miller made Three Point Jumper. Assisted by David Patton.",14,23,"Fisk","Alcorn State",NA,"400992864"
103,1,"6:32",1592,"Maurice Howard made Three Point Jumper. Assisted by A.J. Mosby.",17,23,"Fisk","Alcorn State",NA,"400992864"
104,1,"6:10",1570,"Tyran Davis missed Jumper.",17,23,"Fisk","Alcorn State",NA,"400992864"
105,1,"6:10",1570,"Yalen Reed Defensive Rebound.",17,23,"Fisk","Alcorn State",NA,"400992864"
106,1,"6:04",1564,"A.J. Mosby made Layup. Assisted by Yalen Reed.",19,23,"Fisk","Alcorn State",NA,"400992864"
107,1,"5:48",1548,"Addison Miller made Three Point Jumper. Assisted by Tyran Davis.",19,26,"Fisk","Alcorn State",NA,"400992864"
108,1,"5:30",1530,"Dante Sterling missed Jumper.",19,26,"Fisk","Alcorn State",NA,"400992864"
109,1,"5:30",1530,"Larson Ashford Defensive Rebound.",19,26,"Fisk","Alcorn State",NA,"400992864"
110,1,"5:20",1520,"David Patton made Dunk.",19,28,"Fisk","Alcorn State",NA,"400992864"
111,1,"5:13",1513,"Alcorn State  Timeout",19,28,"Fisk","Alcorn State",NA,"400992864"
112,1,"5:05",1505,"Maurice Howard made Jumper.",21,28,"Fisk","Alcorn State",NA,"400992864"
113,1,"4:49",1489,"Addison Miller missed Three Point Jumper.",21,28,"Fisk","Alcorn State",NA,"400992864"
114,1,"4:49",1489,"Devon Brewer Defensive Rebound.",21,28,"Fisk","Alcorn State",NA,"400992864"
115,1,"4:26",1466,"Tyler Carter missed Jumper.",21,28,"Fisk","Alcorn State",NA,"400992864"
116,1,"4:26",1466,"Larson Ashford Defensive Rebound.",21,28,"Fisk","Alcorn State",NA,"400992864"
117,1,"4:19",1459,"El Paso Pitts missed Three Point Jumper.",21,28,"Fisk","Alcorn State",NA,"400992864"
118,1,"4:19",1459,"A.J. Mosby Defensive Rebound.",21,28,"Fisk","Alcorn State",NA,"400992864"
119,1,"4:04",1444,"Maurice Howard missed Three Point Jumper.",21,28,"Fisk","Alcorn State",NA,"400992864"
120,1,"4:04",1444,"Addison Miller Defensive Rebound.",21,28,"Fisk","Alcorn State",NA,"400992864"
121,1,"3:36",1416,"El Paso Pitts made Layup.",21,30,"Fisk","Alcorn State",NA,"400992864"
122,1,"3:24",1404,"Dante Sterling missed Three Point Jumper.",21,30,"Fisk","Alcorn State",NA,"400992864"
123,1,"3:24",1404,"Tyran Davis Defensive Rebound.",21,30,"Fisk","Alcorn State",NA,"400992864"
124,1,"3:15",1395,"Addison Miller made Three Point Jumper. Assisted by Tyran Davis.",21,33,"Fisk","Alcorn State",NA,"400992864"
125,1,"3:03",1383,"Maurice Howard missed Three Point Jumper.",21,33,"Fisk","Alcorn State",NA,"400992864"
126,1,"3:03",1383,"Maurice Howard Offensive Rebound.",21,33,"Fisk","Alcorn State",NA,"400992864"
127,1,"2:57",1377,"Dante Sterling made Layup. Assisted by Maurice Howard.",23,33,"Fisk","Alcorn State",NA,"400992864"
128,1,"2:41",1361,"Larson Ashford missed Layup.",23,33,"Fisk","Alcorn State",NA,"400992864"
129,1,"2:41",1361,"Devon Brewer Defensive Rebound.",23,33,"Fisk","Alcorn State",NA,"400992864"
130,1,"2:31",1351,"Dante Sterling made Three Point Jumper. Assisted by A.J. Mosby.",26,33,"Fisk","Alcorn State",NA,"400992864"
131,1,"2:15",1335,"David Patton missed Three Point Jumper.",26,33,"Fisk","Alcorn State",NA,"400992864"
132,1,"2:15",1335,"Dante Sterling Defensive Rebound.",26,33,"Fisk","Alcorn State",NA,"400992864"
133,1,"2:04",1324,"Dante Sterling missed Three Point Jumper.",26,33,"Fisk","Alcorn State",NA,"400992864"
134,1,"2:04",1324,"Addison Miller Defensive Rebound.",26,33,"Fisk","Alcorn State",NA,"400992864"
135,1,"1:51",1311,"El Paso Pitts missed Three Point Jumper.",26,33,"Fisk","Alcorn State",NA,"400992864"
136,1,"1:51",1311,"Fisk Offensive Rebound.",26,33,"Fisk","Alcorn State",NA,"400992864"
137,1,"1:48",1308,"Official TV Timeout",26,33,"Fisk","Alcorn State",NA,"400992864"
138,1,"1:48",1308,"Fisk  Timeout",26,33,"Fisk","Alcorn State",NA,"400992864"
139,1,"1:32",1292,"El Paso Pitts missed Three Point Jumper.",26,33,"Fisk","Alcorn State",NA,"400992864"
140,1,"1:32",1292,"Troymain Crosby Defensive Rebound.",26,33,"Fisk","Alcorn State",NA,"400992864"
141,1,"1:00",1260,"Maurice Howard missed Jumper.",26,33,"Fisk","Alcorn State",NA,"400992864"
142,1,"1:00",1260,"Tyler Carter Offensive Rebound.",26,33,"Fisk","Alcorn State",NA,"400992864"
143,1,"0:57",1257,"Tyler Carter missed Layup.",26,33,"Fisk","Alcorn State",NA,"400992864"
144,1,"0:57",1257,"Tyler Carter Offensive Rebound.",26,33,"Fisk","Alcorn State",NA,"400992864"
145,1,"0:37",1237,"Foul on Tyran Davis.",26,33,"Fisk","Alcorn State",NA,"400992864"
146,1,"0:22",1222,"Troymain Crosby made Three Point Jumper. Assisted by A.J. Mosby.",29,33,"Fisk","Alcorn State",NA,"400992864"
147,1,"0:03",1203,"David Patton missed Three Point Jumper.",29,33,"Fisk","Alcorn State",NA,"400992864"
148,1,"0:03",1203,"Troymain Crosby Defensive Rebound.",29,33,"Fisk","Alcorn State",NA,"400992864"
149,1,"0:00",1200,"End of 1st half",29,33,"Fisk","Alcorn State",NA,"400992864"
150,2,"20:00",1200,"PLAY",29,33,"Fisk","Alcorn State",NA,"400992864"
151,2,"19:45",1185,"Ryainni Scott Turnover.",29,33,"Fisk","Alcorn State",NA,"400992864"
152,2,"19:44",1184,"Avery Patterson Steal.",29,33,"Fisk","Alcorn State",NA,"400992864"
153,2,"19:27",1167,"Dante Sterling made Layup. Assisted by Avery Patterson.",31,33,"Fisk","Alcorn State",NA,"400992864"
154,2,"19:27",1167,"Foul on Montreal Nabors.",31,33,"Fisk","Alcorn State",NA,"400992864"
155,2,"19:27",1167,"Dante Sterling missed Free Throw.",31,33,"Fisk","Alcorn State",NA,"400992864"
156,2,"19:27",1167,"Fisk Defensive Rebound.",31,33,"Fisk","Alcorn State",NA,"400992864"
157,2,"19:27",1167,"Foul on Avery Patterson.",31,33,"Fisk","Alcorn State",NA,"400992864"
158,2,"19:11",1151,"El Paso Pitts made Layup.",31,35,"Fisk","Alcorn State",NA,"400992864"
159,2,"18:52",1132,"Dante Sterling made Jumper.",33,35,"Fisk","Alcorn State",NA,"400992864"
160,2,"18:31",1111,"Montreal Nabors missed Three Point Jumper.",33,35,"Fisk","Alcorn State",NA,"400992864"
161,2,"18:31",1111,"Alcorn State Defensive Rebound.",33,35,"Fisk","Alcorn State",NA,"400992864"
162,2,"18:17",1097,"Dante Sterling Turnover.",33,35,"Fisk","Alcorn State",NA,"400992864"
163,2,"18:15",1095,"El Paso Pitts Steal.",33,35,"Fisk","Alcorn State",NA,"400992864"
164,2,"17:50",1070,"Tyran Davis Turnover.",33,35,"Fisk","Alcorn State",NA,"400992864"
165,2,"17:49",1069,"Dante Sterling Steal.",33,35,"Fisk","Alcorn State",NA,"400992864"
166,2,"17:47",1067,"Dante Sterling made Layup.",35,35,"Fisk","Alcorn State",NA,"400992864"
167,2,"17:25",1045,"Victor Alston missed Three Point Jumper.",35,35,"Fisk","Alcorn State",NA,"400992864"
168,2,"17:25",1045,"Tyler Carter Defensive Rebound.",35,35,"Fisk","Alcorn State",NA,"400992864"
169,2,"16:58",1018,"A.J. Mosby made Three Point Jumper. Assisted by Dante Sterling.",38,35,"Fisk","Alcorn State",NA,"400992864"
170,2,"16:29",989,"Victor Alston made Three Point Jumper. Assisted by Ryainni Scott.",38,38,"Fisk","Alcorn State",NA,"400992864"
171,2,"16:18",978,"Dante Sterling missed Three Point Jumper.",38,38,"Fisk","Alcorn State",NA,"400992864"
172,2,"16:18",978,"Montreal Nabors Defensive Rebound.",38,38,"Fisk","Alcorn State",NA,"400992864"
173,2,"16:08",968,"Foul on Maurice Howard.",38,38,"Fisk","Alcorn State",NA,"400992864"
174,2,"16:00",960,"Tyran Davis made Jumper.",38,40,"Fisk","Alcorn State",NA,"400992864"
175,2,"15:54",954,"Foul on Victor Alston.",38,40,"Fisk","Alcorn State",NA,"400992864"
176,2,"15:54",954,"Official TV Timeout",38,40,"Fisk","Alcorn State",NA,"400992864"
177,2,"15:54",954,"Maurice Howard missed Free Throw.",38,40,"Fisk","Alcorn State",NA,"400992864"
178,2,"15:54",954,"Alcorn State Deadball Team Rebound.",38,40,"Fisk","Alcorn State",NA,"400992864"
179,2,"15:54",954,"Maurice Howard made Free Throw.",39,40,"Fisk","Alcorn State",NA,"400992864"
180,2,"15:26",926,"El Paso Pitts missed Three Point Jumper.",39,40,"Fisk","Alcorn State",NA,"400992864"
181,2,"15:26",926,"A.J. Mosby Defensive Rebound.",39,40,"Fisk","Alcorn State",NA,"400992864"
182,2,"15:16",916,"Tyler Carter missed Layup.",39,40,"Fisk","Alcorn State",NA,"400992864"
183,2,"15:16",916,"Ryainni Scott Block.",39,40,"Fisk","Alcorn State",NA,"400992864"
184,2,"15:12",912,"Ryainni Scott Defensive Rebound.",39,40,"Fisk","Alcorn State",NA,"400992864"
185,2,"14:59",899,"El Paso Pitts missed Three Point Jumper.",39,40,"Fisk","Alcorn State",NA,"400992864"
186,2,"14:59",899,"Troymain Crosby Defensive Rebound.",39,40,"Fisk","Alcorn State",NA,"400992864"
187,2,"14:44",884,"A.J. Mosby made Layup. Assisted by Maurice Howard.",41,40,"Fisk","Alcorn State",NA,"400992864"
188,2,"14:26",866,"Tyran Davis missed Layup.",41,40,"Fisk","Alcorn State",NA,"400992864"
189,2,"14:26",866,"Tyler Carter Defensive Rebound.",41,40,"Fisk","Alcorn State",NA,"400992864"
190,2,"14:19",859,"A.J. Mosby made Jumper.",43,40,"Fisk","Alcorn State",NA,"400992864"
191,2,"14:03",843,"El Paso Pitts missed Three Point Jumper.",43,40,"Fisk","Alcorn State",NA,"400992864"
192,2,"14:03",843,"Troymain Crosby Defensive Rebound.",43,40,"Fisk","Alcorn State",NA,"400992864"
193,2,"13:56",836,"A.J. Mosby made Layup.",45,40,"Fisk","Alcorn State",NA,"400992864"
194,2,"13:53",833,"Official TV Timeout",45,40,"Fisk","Alcorn State",NA,"400992864"
195,2,"13:53",833,"Fisk  Timeout",45,40,"Fisk","Alcorn State",NA,"400992864"
196,2,"13:32",812,"Joshua Madison made Layup. Assisted by Ryainni Scott.",45,42,"Fisk","Alcorn State",NA,"400992864"
197,2,"13:32",812,"Foul on Yalen Reed.",45,42,"Fisk","Alcorn State",NA,"400992864"
198,2,"13:32",812,"Joshua Madison made Free Throw.",45,43,"Fisk","Alcorn State",NA,"400992864"
199,2,"13:21",801,"Yalen Reed made Jumper. Assisted by Maurice Howard.",47,43,"Fisk","Alcorn State",NA,"400992864"
200,2,"13:01",781,"Addison Miller missed Three Point Jumper.",47,43,"Fisk","Alcorn State",NA,"400992864"
201,2,"13:01",781,"Troymain Crosby Defensive Rebound.",47,43,"Fisk","Alcorn State",NA,"400992864"
202,2,"12:56",776,"A.J. Mosby made Layup. Assisted by Troymain Crosby.",49,43,"Fisk","Alcorn State",NA,"400992864"
203,2,"12:42",762,"Addison Miller Turnover.",49,43,"Fisk","Alcorn State",NA,"400992864"
204,2,"12:41",761,"Troymain Crosby Steal.",49,43,"Fisk","Alcorn State",NA,"400992864"
205,2,"12:37",757,"Yalen Reed missed Layup.",49,43,"Fisk","Alcorn State",NA,"400992864"
206,2,"12:37",757,"Ryainni Scott Defensive Rebound.",49,43,"Fisk","Alcorn State",NA,"400992864"
207,2,"12:20",740,"Ryainni Scott missed Layup.",49,43,"Fisk","Alcorn State",NA,"400992864"
208,2,"12:20",740,"TyQuaylon Smith Defensive Rebound.",49,43,"Fisk","Alcorn State",NA,"400992864"
209,2,"12:19",739,"Foul on Joshua Madison.",49,43,"Fisk","Alcorn State",NA,"400992864"
210,2,"12:07",727,"Troymain Crosby made Three Point Jumper. Assisted by A.J. Mosby.",52,43,"Fisk","Alcorn State",NA,"400992864"
211,2,"11:54",714,"Addison Miller missed Three Point Jumper.",52,43,"Fisk","Alcorn State",NA,"400992864"
212,2,"11:54",714,"Ryainni Scott Offensive Rebound.",52,43,"Fisk","Alcorn State",NA,"400992864"
213,2,"11:49",709,"Ryainni Scott made Two Point Tip Shot.",52,45,"Fisk","Alcorn State",NA,"400992864"
214,2,"11:44",704,"Yalen Reed made Layup.",54,45,"Fisk","Alcorn State",NA,"400992864"
215,2,"11:29",689,"Addison Miller Turnover.",54,45,"Fisk","Alcorn State",NA,"400992864"
216,2,"11:28",688,"Troymain Crosby Steal.",54,45,"Fisk","Alcorn State",NA,"400992864"
217,2,"11:26",686,"Foul on Ryainni Scott.",54,45,"Fisk","Alcorn State",NA,"400992864"
218,2,"11:26",686,"Official TV Timeout",54,45,"Fisk","Alcorn State",NA,"400992864"
219,2,"11:25",685,"Maurice Howard missed Three Point Jumper.",54,45,"Fisk","Alcorn State",NA,"400992864"
220,2,"11:25",685,"Joshua Madison Defensive Rebound.",54,45,"Fisk","Alcorn State",NA,"400992864"
221,2,"11:09",669,"Victor Alston missed Three Point Jumper.",54,45,"Fisk","Alcorn State",NA,"400992864"
222,2,"11:09",669,"Maurice Howard Defensive Rebound.",54,45,"Fisk","Alcorn State",NA,"400992864"
223,2,"10:53",653,"Troymain Crosby Turnover.",54,45,"Fisk","Alcorn State",NA,"400992864"
224,2,"10:52",652,"Addison Miller Steal.",54,45,"Fisk","Alcorn State",NA,"400992864"
225,2,"10:44",644,"Ryainni Scott missed Layup.",54,45,"Fisk","Alcorn State",NA,"400992864"
226,2,"10:44",644,"A.J. Mosby Defensive Rebound.",54,45,"Fisk","Alcorn State",NA,"400992864"
227,2,"10:35",635,"Troymain Crosby made Jumper. Assisted by A.J. Mosby.",56,45,"Fisk","Alcorn State",NA,"400992864"
228,2,"10:07",607,"Ryainni Scott Turnover.",56,45,"Fisk","Alcorn State",NA,"400992864"
229,2,"10:06",606,"Maurice Howard Steal.",56,45,"Fisk","Alcorn State",NA,"400992864"
230,2,"10:03",603,"A.J. Mosby missed Three Point Jumper.",56,45,"Fisk","Alcorn State",NA,"400992864"
231,2,"10:03",603,"Yalen Reed Offensive Rebound.",56,45,"Fisk","Alcorn State",NA,"400992864"
232,2,"9:58",598,"Yalen Reed missed Jumper.",56,45,"Fisk","Alcorn State",NA,"400992864"
233,2,"9:58",598,"Tyran Davis Defensive Rebound.",56,45,"Fisk","Alcorn State",NA,"400992864"
234,2,"9:53",593,"Tyran Davis Turnover.",56,45,"Fisk","Alcorn State",NA,"400992864"
235,2,"9:35",575,"Maurice Howard missed Three Point Jumper.",56,45,"Fisk","Alcorn State",NA,"400992864"
236,2,"9:35",575,"Tyran Davis Defensive Rebound.",56,45,"Fisk","Alcorn State",NA,"400992864"
237,2,"9:18",558,"Addison Miller Turnover.",56,45,"Fisk","Alcorn State",NA,"400992864"
238,2,"9:17",557,"Maurice Howard Steal.",56,45,"Fisk","Alcorn State",NA,"400992864"
239,2,"9:10",550,"Maurice Howard Turnover.",56,45,"Fisk","Alcorn State",NA,"400992864"
240,2,"8:49",529,"Joshua Madison missed Layup.",56,45,"Fisk","Alcorn State",NA,"400992864"
241,2,"8:49",529,"Troymain Crosby Defensive Rebound.",56,45,"Fisk","Alcorn State",NA,"400992864"
242,2,"8:31",511,"Troymain Crosby made Layup.",58,45,"Fisk","Alcorn State",NA,"400992864"
243,2,"8:13",493,"Victor Alston Turnover.",58,45,"Fisk","Alcorn State",NA,"400992864"
244,2,"8:13",493,"Foul on Victor Alston.",58,45,"Fisk","Alcorn State",NA,"400992864"
245,2,"7:56",476,"Avery Patterson made Three Point Jumper. Assisted by Maurice Howard.",61,45,"Fisk","Alcorn State",NA,"400992864"
246,2,"7:32",452,"Joshua Madison made Layup.",61,47,"Fisk","Alcorn State",NA,"400992864"
247,2,"7:03",423,"Dante Sterling Turnover.",61,47,"Fisk","Alcorn State",NA,"400992864"
248,2,"7:03",423,"Official TV Timeout",61,47,"Fisk","Alcorn State",NA,"400992864"
249,2,"6:53",413,"Victor Alston made Three Point Jumper. Assisted by David Patton.",61,50,"Fisk","Alcorn State",NA,"400992864"
250,2,"6:31",391,"Maurice Howard missed Three Point Jumper.",61,50,"Fisk","Alcorn State",NA,"400992864"
251,2,"6:31",391,"Yalen Reed Offensive Rebound.",61,50,"Fisk","Alcorn State",NA,"400992864"
252,2,"6:14",374,"Tyler Carter made Layup. Assisted by Yalen Reed.",63,50,"Fisk","Alcorn State",NA,"400992864"
253,2,"5:54",354,"Joshua Madison made Jumper.",63,52,"Fisk","Alcorn State",NA,"400992864"
254,2,"5:40",340,"Avery Patterson missed Jumper.",63,52,"Fisk","Alcorn State",NA,"400992864"
255,2,"5:40",340,"Yalen Reed Offensive Rebound.",63,52,"Fisk","Alcorn State",NA,"400992864"
256,2,"5:35",335,"Yalen Reed made Layup.",65,52,"Fisk","Alcorn State",NA,"400992864"
257,2,"5:27",327,"Montreal Nabors Turnover.",65,52,"Fisk","Alcorn State",NA,"400992864"
258,2,"5:07",307,"Tyler Carter missed Layup.",65,52,"Fisk","Alcorn State",NA,"400992864"
259,2,"5:07",307,"Joshua Madison Block.",65,52,"Fisk","Alcorn State",NA,"400992864"
260,2,"5:07",307,"Alcorn State Offensive Rebound.",65,52,"Fisk","Alcorn State",NA,"400992864"
261,2,"5:06",306,"Dante Sterling made Three Point Jumper. Assisted by Avery Patterson.",68,52,"Fisk","Alcorn State",NA,"400992864"
262,2,"4:46",286,"Victor Alston missed Three Point Jumper.",68,52,"Fisk","Alcorn State",NA,"400992864"
263,2,"4:46",286,"Avery Patterson Defensive Rebound.",68,52,"Fisk","Alcorn State",NA,"400992864"
264,2,"4:25",265,"Dante Sterling missed Three Point Jumper.",68,52,"Fisk","Alcorn State",NA,"400992864"
265,2,"4:25",265,"Ryainni Scott Defensive Rebound.",68,52,"Fisk","Alcorn State",NA,"400992864"
266,2,"4:15",255,"Foul on Troymain Crosby.",68,52,"Fisk","Alcorn State",NA,"400992864"
267,2,"4:15",255,"Ryainni Scott made Free Throw.",68,53,"Fisk","Alcorn State",NA,"400992864"
268,2,"4:15",255,"Ryainni Scott made Free Throw.",68,54,"Fisk","Alcorn State",NA,"400992864"
269,2,"3:51",231,"Troymain Crosby made Layup. Assisted by Maurice Howard.",70,54,"Fisk","Alcorn State",NA,"400992864"
270,2,"3:36",216,"Foul on Troymain Crosby.",70,54,"Fisk","Alcorn State",NA,"400992864"
271,2,"3:36",216,"Official TV Timeout",70,54,"Fisk","Alcorn State",NA,"400992864"
272,2,"3:32",212,"David Patton made Jumper.",70,56,"Fisk","Alcorn State",NA,"400992864"
273,2,"3:19",199,"Maurice Howard missed Three Point Jumper.",70,56,"Fisk","Alcorn State",NA,"400992864"
274,2,"3:19",199,"Fisk Defensive Rebound.",70,56,"Fisk","Alcorn State",NA,"400992864"
275,2,"3:01",181,"Ryainni Scott made Layup.",70,58,"Fisk","Alcorn State",NA,"400992864"
276,2,"3:00",180,"Foul on A.J. Mosby.",70,58,"Fisk","Alcorn State",NA,"400992864"
277,2,"3:00",180,"Ryainni Scott made Free Throw.",70,59,"Fisk","Alcorn State",NA,"400992864"
278,2,"2:43",163,"A.J. Mosby made Layup.",72,59,"Fisk","Alcorn State",NA,"400992864"
279,2,"2:35",155,"Foul on Troymain Crosby.",72,59,"Fisk","Alcorn State",NA,"400992864"
280,2,"2:35",155,"Joshua Madison missed Free Throw.",72,59,"Fisk","Alcorn State",NA,"400992864"
281,2,"2:35",155,"Devon Brewer Defensive Rebound.",72,59,"Fisk","Alcorn State",NA,"400992864"
282,2,"2:28",148,"Foul on Ryainni Scott.",72,59,"Fisk","Alcorn State",NA,"400992864"
283,2,"2:10",130,"Dante Sterling Turnover.",72,59,"Fisk","Alcorn State",NA,"400992864"
284,2,"2:09",129,"Victor Alston Steal.",72,59,"Fisk","Alcorn State",NA,"400992864"
285,2,"2:06",126,"Victor Alston made Layup.",72,61,"Fisk","Alcorn State",NA,"400992864"
286,2,"2:03",123,"Fisk  Timeout",72,61,"Fisk","Alcorn State",NA,"400992864"
287,2,"1:50",110,"Foul on Ryainni Scott.",72,61,"Fisk","Alcorn State",NA,"400992864"
288,2,"1:50",110,"Devon Brewer missed Free Throw.",72,61,"Fisk","Alcorn State",NA,"400992864"
289,2,"1:50",110,"Alcorn State Deadball Team Rebound.",72,61,"Fisk","Alcorn State",NA,"400992864"
290,2,"1:50",110,"Devon Brewer missed Free Throw.",72,61,"Fisk","Alcorn State",NA,"400992864"
291,2,"1:50",110,"Joshua Madison Defensive Rebound.",72,61,"Fisk","Alcorn State",NA,"400992864"
292,2,"1:43",103,"Victor Alston made Three Point Jumper. Assisted by Montreal Nabors.",72,64,"Fisk","Alcorn State",NA,"400992864"
293,2,"1:12",72,"A.J. Mosby missed Jumper.",72,64,"Fisk","Alcorn State",NA,"400992864"
294,2,"1:12",72,"Ryainni Scott Defensive Rebound.",72,64,"Fisk","Alcorn State",NA,"400992864"
295,2,"1:02",62,"Montreal Nabors missed Three Point Jumper.",72,64,"Fisk","Alcorn State",NA,"400992864"
296,2,"1:02",62,"A.J. Mosby Defensive Rebound.",72,64,"Fisk","Alcorn State",NA,"400992864"
297,2,"0:38",38,"Foul on Victor Alston.",72,64,"Fisk","Alcorn State",NA,"400992864"
298,2,"0:38",38,"Dante Sterling missed Free Throw.",72,64,"Fisk","Alcorn State",NA,"400992864"
299,2,"0:38",38,"Alcorn State Deadball Team Rebound.",72,64,"Fisk","Alcorn State",NA,"400992864"
300,2,"0:38",38,"Dante Sterling made Free Throw.",73,64,"Fisk","Alcorn State",NA,"400992864"
301,2,"0:32",32,"Victor Alston missed Three Point Jumper.",73,64,"Fisk","Alcorn State",NA,"400992864"
302,2,"0:32",32,"Devon Brewer Defensive Rebound.",73,64,"Fisk","Alcorn State",NA,"400992864"
303,2,"0:22",22,"Foul on Montreal Nabors.",73,64,"Fisk","Alcorn State",NA,"400992864"
304,2,"0:22",22,"Maurice Howard made Free Throw.",74,64,"Fisk","Alcorn State",NA,"400992864"
305,2,"0:22",22,"Maurice Howard made Free Throw.",75,64,"Fisk","Alcorn State",NA,"400992864"
306,2,"0:16",16,"Joshua Madison made Layup.",75,66,"Fisk","Alcorn State",NA,"400992864"
307,2,"0:16",16,"Foul on Troymain Crosby.",75,66,"Fisk","Alcorn State",NA,"400992864"
308,2,"0:16",16,"Joshua Madison made Free Throw.",75,67,"Fisk","Alcorn State",NA,"400992864"
309,2,"0:14",14,"Foul on Malik Yant.",75,67,"Fisk","Alcorn State",NA,"400992864"
310,2,"0:14",14,"A.J. Mosby made Free Throw.",76,67,"Fisk","Alcorn State",NA,"400992864"
311,2,"0:14",14,"A.J. Mosby made Free Throw.",77,67,"Fisk","Alcorn State",NA,"400992864"
