"play_id","half","time_remaining_half","secs_remaining","description","home_score","away_score","away","home","home_favored_by","game_id"
367,2,"1:02",62,"Jalen Knight missed Free Throw.",89,53,"Hartford","Rider",NA,"400991065"
368,2,"1:02",62,"Hartford Deadball Team Rebound.",89,53,"Hartford","Rider",NA,"400991065"
369,2,"1:02",62,"Jalen Knight missed Free Throw.",89,53,"Hartford","Rider",NA,"400991065"
370,2,"1:02",62,"Joe Ajike Defensive Rebound.",89,53,"Hartford","Rider",NA,"400991065"
371,2,"0:45",45,"Karamoko Cisse missed Layup.",89,53,"Hartford","Rider",NA,"400991065"
372,2,"0:45",45,"Mark Plousis Block.",89,53,"Hartford","Rider",NA,"400991065"
373,2,"0:44",44,"Karamoko Cisse Offensive Rebound.",89,53,"Hartford","Rider",NA,"400991065"
374,2,"0:44",44,"Karamoko Cisse Turnover.",89,53,"Hartford","Rider",NA,"400991065"
375,2,"0:38",38,"Jalen Knight Turnover.",89,53,"Hartford","Rider",NA,"400991065"
376,2,"0:08",8,"Rider  Turnover.",89,53,"Hartford","Rider",NA,"400991065"
377,2,"0:00",0,"End of Game",89,53,"Hartford","Rider",NA,"400991065"
1,1,"20:00",2400,"PLAY",0,0,"Hartford","LIU Brooklyn",NA,"400991515"
2,1,"19:48",2388,"Joel Hernandez missed Layup.",0,0,"Hartford","LIU Brooklyn",NA,"400991515"
3,1,"19:48",2388,"Jack Hobbs Defensive Rebound.",0,0,"Hartford","LIU Brooklyn",NA,"400991515"
4,1,"19:23",2363,"Jack Hobbs missed Three Point Jumper.",0,0,"Hartford","LIU Brooklyn",NA,"400991515"
5,1,"19:23",2363,"Joel Hernandez Defensive Rebound.",0,0,"Hartford","LIU Brooklyn",NA,"400991515"
6,1,"19:13",2353,"Zach Coleman made Three Point Jumper. Assisted by Julian Batts.",3,0,"Hartford","LIU Brooklyn",NA,"400991515"
7,1,"18:53",2333,"Jason Dunne made Layup.",3,2,"Hartford","LIU Brooklyn",NA,"400991515"
8,1,"18:30",2310,"Joel Hernandez made Jumper.",5,2,"Hartford","LIU Brooklyn",NA,"400991515"
9,1,"18:13",2293,"John Carroll missed Jumper.",5,2,"Hartford","LIU Brooklyn",NA,"400991515"
10,1,"18:13",2293,"Zach Coleman Defensive Rebound.",5,2,"Hartford","LIU Brooklyn",NA,"400991515"
11,1,"18:02",2282,"Raiquan Clark missed Layup.",5,2,"Hartford","LIU Brooklyn",NA,"400991515"
12,1,"18:02",2282,"Hassan Attia Block.",5,2,"Hartford","LIU Brooklyn",NA,"400991515"
13,1,"18:01",2281,"Raiquan Clark Offensive Rebound.",5,2,"Hartford","LIU Brooklyn",NA,"400991515"
14,1,"17:58",2278,"Raiquan Clark made Layup.",7,2,"Hartford","LIU Brooklyn",NA,"400991515"
15,1,"17:43",2263,"Jason Dunne made Jumper. Assisted by J.R. Lynch.",7,4,"Hartford","LIU Brooklyn",NA,"400991515"
16,1,"17:19",2239,"Foul on Zach Coleman.",7,4,"Hartford","LIU Brooklyn",NA,"400991515"
17,1,"17:19",2239,"Zach Coleman Turnover.",7,4,"Hartford","LIU Brooklyn",NA,"400991515"
18,1,"17:04",2224,"Hassan Attia made Dunk. Assisted by Jason Dunne.",7,6,"Hartford","LIU Brooklyn",NA,"400991515"
19,1,"16:48",2208,"Julian Batts made Three Point Jumper. Assisted by Raiquan Clark.",10,6,"Hartford","LIU Brooklyn",NA,"400991515"
20,1,"16:23",2183,"Jason Dunne made Three Point Jumper. Assisted by J.R. Lynch.",10,9,"Hartford","LIU Brooklyn",NA,"400991515"
21,1,"16:00",2160,"Julian Batts Turnover.",10,9,"Hartford","LIU Brooklyn",NA,"400991515"
22,1,"15:59",2159,"John Carroll Steal.",10,9,"Hartford","LIU Brooklyn",NA,"400991515"
23,1,"15:55",2155,"Jason Dunne missed Three Point Jumper.",10,9,"Hartford","LIU Brooklyn",NA,"400991515"
24,1,"15:53",2153,"Hassan Attia Offensive Rebound.",10,9,"Hartford","LIU Brooklyn",NA,"400991515"
25,1,"15:52",2152,"Foul on Julian Batts.",10,9,"Hartford","LIU Brooklyn",NA,"400991515"
26,1,"15:52",2152,"Official TV Timeout",10,9,"Hartford","LIU Brooklyn",NA,"400991515"
27,1,"15:52",2152,"Hassan Attia made Free Throw.",10,10,"Hartford","LIU Brooklyn",NA,"400991515"
28,1,"15:52",2152,"Hassan Attia made Free Throw.",10,11,"Hartford","LIU Brooklyn",NA,"400991515"
29,1,"15:39",2139,"Zach Coleman missed Jumper.",10,11,"Hartford","LIU Brooklyn",NA,"400991515"
30,1,"15:39",2139,"Jack Hobbs Defensive Rebound.",10,11,"Hartford","LIU Brooklyn",NA,"400991515"
31,1,"15:29",2129,"Jack Hobbs missed Three Point Jumper.",10,11,"Hartford","LIU Brooklyn",NA,"400991515"
32,1,"15:29",2129,"Jashaun Agosto Defensive Rebound.",10,11,"Hartford","LIU Brooklyn",NA,"400991515"
33,1,"15:22",2122,"Zach Coleman Turnover.",10,11,"Hartford","LIU Brooklyn",NA,"400991515"
34,1,"15:21",2121,"J.R. Lynch Steal.",10,11,"Hartford","LIU Brooklyn",NA,"400991515"
35,1,"15:06",2106,"John Carroll made Layup.",10,13,"Hartford","LIU Brooklyn",NA,"400991515"
36,1,"14:50",2090,"Joel Hernandez made Jumper. Assisted by Jashaun Agosto.",12,13,"Hartford","LIU Brooklyn",NA,"400991515"
37,1,"14:30",2070,"J.R. Lynch Turnover.",12,13,"Hartford","LIU Brooklyn",NA,"400991515"
38,1,"14:18",2058,"Foul on Jason Dunne.",12,13,"Hartford","LIU Brooklyn",NA,"400991515"
39,1,"14:10",2050,"Jamall Robinson missed Three Point Jumper.",12,13,"Hartford","LIU Brooklyn",NA,"400991515"
40,1,"14:10",2050,"Travis Weatherington Defensive Rebound.",12,13,"Hartford","LIU Brooklyn",NA,"400991515"
41,1,"13:45",2025,"J.R. Lynch made Three Point Jumper. Assisted by John Carroll.",12,16,"Hartford","LIU Brooklyn",NA,"400991515"
42,1,"13:26",2006,"Joel Hernandez made Jumper.",14,16,"Hartford","LIU Brooklyn",NA,"400991515"
43,1,"13:03",1983,"John Carroll made Layup.",14,18,"Hartford","LIU Brooklyn",NA,"400991515"
44,1,"12:47",1967,"Jashaun Agosto made Three Point Jumper. Assisted by Jamall Robinson.",17,18,"Hartford","LIU Brooklyn",NA,"400991515"
45,1,"12:32",1952,"Travis Weatherington made Three Point Jumper. Assisted by J.R. Lynch.",17,21,"Hartford","LIU Brooklyn",NA,"400991515"
46,1,"12:07",1927,"Zach Coleman missed Layup.",17,21,"Hartford","LIU Brooklyn",NA,"400991515"
47,1,"12:05",1925,"LIU Brooklyn Offensive Rebound.",17,21,"Hartford","LIU Brooklyn",NA,"400991515"
48,1,"12:00",1920,"Foul on J.R. Lynch.",17,21,"Hartford","LIU Brooklyn",NA,"400991515"
49,1,"12:00",1920,"Official TV Timeout",17,21,"Hartford","LIU Brooklyn",NA,"400991515"
50,1,"11:48",1908,"Jashaun Agosto made Layup.",19,21,"Hartford","LIU Brooklyn",NA,"400991515"
51,1,"11:40",1900,"George Blagojevic Turnover.",19,21,"Hartford","LIU Brooklyn",NA,"400991515"
52,1,"11:32",1892,"Zach Coleman made Three Point Jumper. Assisted by Jashaun Agosto.",22,21,"Hartford","LIU Brooklyn",NA,"400991515"
53,1,"11:16",1876,"Foul on George Blagojevic.",22,21,"Hartford","LIU Brooklyn",NA,"400991515"
54,1,"11:16",1876,"George Blagojevic Turnover.",22,21,"Hartford","LIU Brooklyn",NA,"400991515"
55,1,"11:05",1865,"Joel Hernandez missed Three Point Jumper.",22,21,"Hartford","LIU Brooklyn",NA,"400991515"
56,1,"11:05",1865,"Travis Weatherington Defensive Rebound.",22,21,"Hartford","LIU Brooklyn",NA,"400991515"
57,1,"10:44",1844,"Travis Weatherington missed Three Point Jumper.",22,21,"Hartford","LIU Brooklyn",NA,"400991515"
58,1,"10:44",1844,"Jashaun Agosto Defensive Rebound.",22,21,"Hartford","LIU Brooklyn",NA,"400991515"
59,1,"10:40",1840,"Jashaun Agosto made Layup.",24,21,"Hartford","LIU Brooklyn",NA,"400991515"
60,1,"10:40",1840,"Foul on J.R. Lynch.",24,21,"Hartford","LIU Brooklyn",NA,"400991515"
61,1,"10:40",1840,"Jashaun Agosto made Free Throw.",25,21,"Hartford","LIU Brooklyn",NA,"400991515"
62,1,"10:16",1816,"John Carroll missed Jumper.",25,21,"Hartford","LIU Brooklyn",NA,"400991515"
63,1,"10:16",1816,"Raiquan Clark Defensive Rebound.",25,21,"Hartford","LIU Brooklyn",NA,"400991515"
64,1,"10:03",1803,"Raul Frias made Three Point Jumper. Assisted by Jashaun Agosto.",28,21,"Hartford","LIU Brooklyn",NA,"400991515"
65,1,"9:44",1784,"John Carroll made Layup. Assisted by Jason Dunne.",28,23,"Hartford","LIU Brooklyn",NA,"400991515"
66,1,"9:44",1784,"Foul on Julius van Sauers.",28,23,"Hartford","LIU Brooklyn",NA,"400991515"
67,1,"9:44",1784,"John Carroll made Free Throw.",28,24,"Hartford","LIU Brooklyn",NA,"400991515"
68,1,"9:32",1772,"Jashaun Agosto missed Three Point Jumper.",28,24,"Hartford","LIU Brooklyn",NA,"400991515"
69,1,"9:28",1768,"Hartford Defensive Rebound.",28,24,"Hartford","LIU Brooklyn",NA,"400991515"
70,1,"9:11",1751,"Jack Hobbs Turnover.",28,24,"Hartford","LIU Brooklyn",NA,"400991515"
71,1,"9:10",1750,"Jamall Robinson Steal.",28,24,"Hartford","LIU Brooklyn",NA,"400991515"
72,1,"9:08",1748,"Jamall Robinson made Layup.",30,24,"Hartford","LIU Brooklyn",NA,"400991515"
73,1,"8:48",1728,"Travis Weatherington missed Layup.",30,24,"Hartford","LIU Brooklyn",NA,"400991515"
74,1,"8:48",1728,"Raiquan Clark Defensive Rebound.",30,24,"Hartford","LIU Brooklyn",NA,"400991515"
75,1,"8:48",1728,"Foul on Travis Weatherington.",30,24,"Hartford","LIU Brooklyn",NA,"400991515"
76,1,"8:32",1712,"Julius van Sauers missed Three Point Jumper.",30,24,"Hartford","LIU Brooklyn",NA,"400991515"
77,1,"8:32",1712,"Hassan Attia Defensive Rebound.",30,24,"Hartford","LIU Brooklyn",NA,"400991515"
78,1,"8:17",1697,"Jason Dunne missed Three Point Jumper.",30,24,"Hartford","LIU Brooklyn",NA,"400991515"
79,1,"8:17",1697,"Jamall Robinson Defensive Rebound.",30,24,"Hartford","LIU Brooklyn",NA,"400991515"
80,1,"8:01",1681,"Jashaun Agosto made Jumper.",32,24,"Hartford","LIU Brooklyn",NA,"400991515"
81,1,"7:41",1661,"Jack Hobbs missed Three Point Jumper.",32,24,"Hartford","LIU Brooklyn",NA,"400991515"
82,1,"7:41",1661,"Jamall Robinson Defensive Rebound.",32,24,"Hartford","LIU Brooklyn",NA,"400991515"
83,1,"7:38",1658,"Foul on Hassan Attia.",32,24,"Hartford","LIU Brooklyn",NA,"400991515"
84,1,"7:38",1658,"Official TV Timeout",32,24,"Hartford","LIU Brooklyn",NA,"400991515"
85,1,"7:28",1648,"Jashaun Agosto made Jumper.",34,24,"Hartford","LIU Brooklyn",NA,"400991515"
86,1,"7:00",1620,"John Carroll made Layup.",34,26,"Hartford","LIU Brooklyn",NA,"400991515"
87,1,"6:47",1607,"Foul on Hassan Attia.",34,26,"Hartford","LIU Brooklyn",NA,"400991515"
88,1,"6:47",1607,"Julius van Sauers made Free Throw.",35,26,"Hartford","LIU Brooklyn",NA,"400991515"
89,1,"6:47",1607,"Julius van Sauers made Free Throw.",36,26,"Hartford","LIU Brooklyn",NA,"400991515"
90,1,"6:33",1593,"Foul on Julius van Sauers.",36,26,"Hartford","LIU Brooklyn",NA,"400991515"
91,1,"6:31",1591,"Foul on Eral Penn.",36,26,"Hartford","LIU Brooklyn",NA,"400991515"
92,1,"6:24",1584,"J.R. Lynch Turnover.",36,26,"Hartford","LIU Brooklyn",NA,"400991515"
93,1,"6:23",1583,"Eral Penn Steal.",36,26,"Hartford","LIU Brooklyn",NA,"400991515"
94,1,"6:16",1576,"Jashaun Agosto made Jumper.",38,26,"Hartford","LIU Brooklyn",NA,"400991515"
95,1,"6:01",1561,"John Carroll Turnover.",38,26,"Hartford","LIU Brooklyn",NA,"400991515"
96,1,"5:59",1559,"Raul Frias Steal.",38,26,"Hartford","LIU Brooklyn",NA,"400991515"
97,1,"5:51",1551,"Raiquan Clark made Jumper.",40,26,"Hartford","LIU Brooklyn",NA,"400991515"
98,1,"5:51",1551,"Foul on Jack Hobbs.",40,26,"Hartford","LIU Brooklyn",NA,"400991515"
99,1,"5:51",1551,"Raiquan Clark made Free Throw.",41,26,"Hartford","LIU Brooklyn",NA,"400991515"
100,1,"5:38",1538,"Max Twyman made Three Point Jumper. Assisted by Jason Dunne.",41,29,"Hartford","LIU Brooklyn",NA,"400991515"
101,1,"5:36",1536,"Hartford  Timeout",41,29,"Hartford","LIU Brooklyn",NA,"400991515"
102,1,"5:23",1523,"Raiquan Clark missed Layup.",41,29,"Hartford","LIU Brooklyn",NA,"400991515"
103,1,"5:23",1523,"John Carroll Block.",41,29,"Hartford","LIU Brooklyn",NA,"400991515"
104,1,"5:20",1520,"Hartford Defensive Rebound.",41,29,"Hartford","LIU Brooklyn",NA,"400991515"
105,1,"5:02",1502,"J.R. Lynch made Jumper.",41,31,"Hartford","LIU Brooklyn",NA,"400991515"
106,1,"4:45",1485,"Raul Frias made Three Point Jumper. Assisted by Jashaun Agosto.",44,31,"Hartford","LIU Brooklyn",NA,"400991515"
107,1,"4:33",1473,"Foul on Raiquan Clark.",44,31,"Hartford","LIU Brooklyn",NA,"400991515"
108,1,"4:30",1470,"Jason Dunne made Layup. Assisted by Jack Hobbs.",44,33,"Hartford","LIU Brooklyn",NA,"400991515"
109,1,"4:09",1449,"Raul Frias made Three Point Jumper. Assisted by Jashaun Agosto.",47,33,"Hartford","LIU Brooklyn",NA,"400991515"
110,1,"3:33",1413,"Jason Dunne missed Three Point Jumper.",47,33,"Hartford","LIU Brooklyn",NA,"400991515"
111,1,"3:33",1413,"John Carroll Offensive Rebound.",47,33,"Hartford","LIU Brooklyn",NA,"400991515"
112,1,"3:33",1413,"Foul on Zach Coleman.",47,33,"Hartford","LIU Brooklyn",NA,"400991515"
113,1,"3:33",1413,"Official TV Timeout",47,33,"Hartford","LIU Brooklyn",NA,"400991515"
114,1,"3:33",1413,"John Carroll made Free Throw.",47,34,"Hartford","LIU Brooklyn",NA,"400991515"
115,1,"3:33",1413,"John Carroll missed Free Throw.",47,34,"Hartford","LIU Brooklyn",NA,"400991515"
116,1,"3:33",1413,"Julius van Sauers Defensive Rebound.",47,34,"Hartford","LIU Brooklyn",NA,"400991515"
117,1,"3:16",1396,"Foul on Julius van Sauers.",47,34,"Hartford","LIU Brooklyn",NA,"400991515"
118,1,"3:16",1396,"Julius van Sauers Turnover.",47,34,"Hartford","LIU Brooklyn",NA,"400991515"
119,1,"3:02",1382,"Max Twyman made Jumper. Assisted by John Carroll.",47,36,"Hartford","LIU Brooklyn",NA,"400991515"
120,1,"2:53",1373,"Joel Hernandez missed Jumper.",47,36,"Hartford","LIU Brooklyn",NA,"400991515"
121,1,"2:53",1373,"Jason Dunne Defensive Rebound.",47,36,"Hartford","LIU Brooklyn",NA,"400991515"
122,1,"2:44",1364,"John Carroll made Layup. Assisted by Jack Hobbs.",47,38,"Hartford","LIU Brooklyn",NA,"400991515"
123,1,"2:42",1362,"LIU Brooklyn  Timeout",47,38,"Hartford","LIU Brooklyn",NA,"400991515"
124,1,"2:29",1349,"Jamall Robinson missed Layup.",47,38,"Hartford","LIU Brooklyn",NA,"400991515"
125,1,"2:29",1349,"Jack Hobbs Block.",47,38,"Hartford","LIU Brooklyn",NA,"400991515"
126,1,"2:25",1345,"J.R. Lynch Defensive Rebound.",47,38,"Hartford","LIU Brooklyn",NA,"400991515"
127,1,"2:20",1340,"Jason Dunne missed Layup.",47,38,"Hartford","LIU Brooklyn",NA,"400991515"
128,1,"2:20",1340,"Raiquan Clark Defensive Rebound.",47,38,"Hartford","LIU Brooklyn",NA,"400991515"
129,1,"2:08",1328,"Raul Frias missed Jumper.",47,38,"Hartford","LIU Brooklyn",NA,"400991515"
130,1,"2:08",1328,"J.R. Lynch Defensive Rebound.",47,38,"Hartford","LIU Brooklyn",NA,"400991515"
131,1,"1:38",1298,"Foul on Joel Hernandez.",47,38,"Hartford","LIU Brooklyn",NA,"400991515"
132,1,"1:38",1298,"Jack Hobbs made Free Throw.",47,39,"Hartford","LIU Brooklyn",NA,"400991515"
133,1,"1:38",1298,"Jack Hobbs made Free Throw.",47,40,"Hartford","LIU Brooklyn",NA,"400991515"
134,1,"1:25",1285,"Jamall Robinson made Three Point Jumper. Assisted by Jashaun Agosto.",50,40,"Hartford","LIU Brooklyn",NA,"400991515"
135,1,"1:10",1270,"Jack Hobbs missed Three Point Jumper.",50,40,"Hartford","LIU Brooklyn",NA,"400991515"
136,1,"1:10",1270,"Joel Hernandez Defensive Rebound.",50,40,"Hartford","LIU Brooklyn",NA,"400991515"
137,1,"1:01",1261,"Jamall Robinson missed Three Point Jumper.",50,40,"Hartford","LIU Brooklyn",NA,"400991515"
138,1,"1:01",1261,"John Carroll Defensive Rebound.",50,40,"Hartford","LIU Brooklyn",NA,"400991515"
139,1,"0:35",1235,"Jason Dunne made Layup.",50,42,"Hartford","LIU Brooklyn",NA,"400991515"
140,1,"0:08",1208,"Raiquan Clark missed Three Point Jumper.",50,42,"Hartford","LIU Brooklyn",NA,"400991515"
141,1,"0:08",1208,"Jason Dunne Defensive Rebound.",50,42,"Hartford","LIU Brooklyn",NA,"400991515"
142,1,"0:06",1206,"Foul on Jamall Robinson.",50,42,"Hartford","LIU Brooklyn",NA,"400991515"
143,1,"0:06",1206,"Jason Dunne made Free Throw.",50,43,"Hartford","LIU Brooklyn",NA,"400991515"
144,1,"0:06",1206,"Jason Dunne made Free Throw.",50,44,"Hartford","LIU Brooklyn",NA,"400991515"
145,1,"0:01",1201,"Jashaun Agosto missed Jumper.",50,44,"Hartford","LIU Brooklyn",NA,"400991515"
146,1,"0:01",1201,"Eral Penn Offensive Rebound.",50,44,"Hartford","LIU Brooklyn",NA,"400991515"
147,1,"0:00",1200,"End of 1st half",50,44,"Hartford","LIU Brooklyn",NA,"400991515"
148,2,"20:00",1200,"PLAY",50,44,"Hartford","LIU Brooklyn",NA,"400991515"
149,2,"19:51",1191,"Jack Hobbs missed Three Point Jumper.",50,44,"Hartford","LIU Brooklyn",NA,"400991515"
150,2,"19:51",1191,"Jashaun Agosto Defensive Rebound.",50,44,"Hartford","LIU Brooklyn",NA,"400991515"
151,2,"19:43",1183,"Raiquan Clark missed Layup.",50,44,"Hartford","LIU Brooklyn",NA,"400991515"
152,2,"19:43",1183,"Jack Hobbs Block.",50,44,"Hartford","LIU Brooklyn",NA,"400991515"
153,2,"19:43",1183,"LIU Brooklyn Offensive Rebound.",50,44,"Hartford","LIU Brooklyn",NA,"400991515"
154,2,"19:36",1176,"Zach Coleman missed Three Point Jumper.",50,44,"Hartford","LIU Brooklyn",NA,"400991515"
155,2,"19:36",1176,"Jack Hobbs Defensive Rebound.",50,44,"Hartford","LIU Brooklyn",NA,"400991515"
156,2,"19:23",1163,"J.R. Lynch made Jumper.",50,46,"Hartford","LIU Brooklyn",NA,"400991515"
157,2,"19:01",1141,"Zach Coleman made Three Point Jumper. Assisted by Raiquan Clark.",53,46,"Hartford","LIU Brooklyn",NA,"400991515"
158,2,"18:36",1116,"John Carroll missed Layup.",53,46,"Hartford","LIU Brooklyn",NA,"400991515"
159,2,"18:36",1116,"Hassan Attia Offensive Rebound.",53,46,"Hartford","LIU Brooklyn",NA,"400991515"
160,2,"18:32",1112,"Hassan Attia made Two Point Tip Shot.",53,48,"Hartford","LIU Brooklyn",NA,"400991515"
161,2,"18:10",1090,"Joel Hernandez missed Layup.",53,48,"Hartford","LIU Brooklyn",NA,"400991515"
162,2,"18:10",1090,"Hassan Attia Block.",53,48,"Hartford","LIU Brooklyn",NA,"400991515"
163,2,"18:09",1089,"Jack Hobbs Defensive Rebound.",53,48,"Hartford","LIU Brooklyn",NA,"400991515"
164,2,"18:03",1083,"Jack Hobbs missed Three Point Jumper.",53,48,"Hartford","LIU Brooklyn",NA,"400991515"
165,2,"18:03",1083,"Hassan Attia Offensive Rebound.",53,48,"Hartford","LIU Brooklyn",NA,"400991515"
166,2,"17:59",1079,"Jason Dunne made Layup. Assisted by Hassan Attia.",53,50,"Hartford","LIU Brooklyn",NA,"400991515"
167,2,"17:36",1056,"Joel Hernandez missed Jumper.",53,50,"Hartford","LIU Brooklyn",NA,"400991515"
168,2,"17:36",1056,"Hassan Attia Block.",53,50,"Hartford","LIU Brooklyn",NA,"400991515"
169,2,"17:35",1055,"Jack Hobbs Defensive Rebound.",53,50,"Hartford","LIU Brooklyn",NA,"400991515"
170,2,"17:22",1042,"Hassan Attia made Layup.",53,52,"Hartford","LIU Brooklyn",NA,"400991515"
171,2,"17:20",1040,"LIU Brooklyn  Timeout",53,52,"Hartford","LIU Brooklyn",NA,"400991515"
172,2,"17:20",1040,"Official TV Timeout",53,52,"Hartford","LIU Brooklyn",NA,"400991515"
173,2,"17:07",1027,"Foul on Hassan Attia.",53,52,"Hartford","LIU Brooklyn",NA,"400991515"
174,2,"17:07",1027,"Raiquan Clark made Free Throw.",54,52,"Hartford","LIU Brooklyn",NA,"400991515"
175,2,"17:07",1027,"Raiquan Clark made Free Throw.",55,52,"Hartford","LIU Brooklyn",NA,"400991515"
176,2,"16:51",1011,"Foul on John Carroll.",55,52,"Hartford","LIU Brooklyn",NA,"400991515"
177,2,"16:51",1011,"John Carroll Turnover.",55,52,"Hartford","LIU Brooklyn",NA,"400991515"
178,2,"16:40",1000,"Joel Hernandez missed Layup.",55,52,"Hartford","LIU Brooklyn",NA,"400991515"
179,2,"16:40",1000,"Max Twyman Defensive Rebound.",55,52,"Hartford","LIU Brooklyn",NA,"400991515"
180,2,"16:29",989,"John Carroll missed Three Point Jumper.",55,52,"Hartford","LIU Brooklyn",NA,"400991515"
181,2,"16:29",989,"Zach Coleman Defensive Rebound.",55,52,"Hartford","LIU Brooklyn",NA,"400991515"
182,2,"16:19",979,"Julian Batts missed Three Point Jumper.",55,52,"Hartford","LIU Brooklyn",NA,"400991515"
183,2,"16:19",979,"Jashaun Agosto Offensive Rebound.",55,52,"Hartford","LIU Brooklyn",NA,"400991515"
184,2,"16:13",973,"Zach Coleman made Layup. Assisted by Joel Hernandez.",57,52,"Hartford","LIU Brooklyn",NA,"400991515"
185,2,"15:51",951,"John Carroll missed Jumper.",57,52,"Hartford","LIU Brooklyn",NA,"400991515"
186,2,"15:51",951,"Zach Coleman Defensive Rebound.",57,52,"Hartford","LIU Brooklyn",NA,"400991515"
187,2,"15:41",941,"Foul on Jason Dunne.",57,52,"Hartford","LIU Brooklyn",NA,"400991515"
188,2,"15:41",941,"Official TV Timeout",57,52,"Hartford","LIU Brooklyn",NA,"400991515"
189,2,"15:41",941,"Raiquan Clark made Free Throw.",58,52,"Hartford","LIU Brooklyn",NA,"400991515"
190,2,"15:41",941,"Raiquan Clark made Free Throw.",59,52,"Hartford","LIU Brooklyn",NA,"400991515"
191,2,"15:26",926,"Jack Hobbs made Three Point Jumper. Assisted by J.R. Lynch.",59,55,"Hartford","LIU Brooklyn",NA,"400991515"
192,2,"15:04",904,"Zach Coleman Turnover.",59,55,"Hartford","LIU Brooklyn",NA,"400991515"
193,2,"15:03",903,"Jack Hobbs Steal.",59,55,"Hartford","LIU Brooklyn",NA,"400991515"
194,2,"14:49",889,"John Carroll missed Layup.",59,55,"Hartford","LIU Brooklyn",NA,"400991515"
195,2,"14:49",889,"Julian Batts Defensive Rebound.",59,55,"Hartford","LIU Brooklyn",NA,"400991515"
196,2,"14:48",888,"Foul on Jack Hobbs.",59,55,"Hartford","LIU Brooklyn",NA,"400991515"
197,2,"14:29",869,"Joel Hernandez made Jumper.",61,55,"Hartford","LIU Brooklyn",NA,"400991515"
198,2,"14:08",848,"John Carroll made Layup. Assisted by Jason Dunne.",61,57,"Hartford","LIU Brooklyn",NA,"400991515"
199,2,"14:00",840,"Foul on J.R. Lynch.",61,57,"Hartford","LIU Brooklyn",NA,"400991515"
200,2,"13:53",833,"Joel Hernandez Turnover.",61,57,"Hartford","LIU Brooklyn",NA,"400991515"
201,2,"13:40",820,"Foul on Julian Batts.",61,57,"Hartford","LIU Brooklyn",NA,"400991515"
202,2,"13:40",820,"J.R. Lynch made Free Throw.",61,58,"Hartford","LIU Brooklyn",NA,"400991515"
203,2,"13:40",820,"J.R. Lynch made Free Throw.",61,59,"Hartford","LIU Brooklyn",NA,"400991515"
204,2,"13:23",803,"Jashaun Agosto Turnover.",61,59,"Hartford","LIU Brooklyn",NA,"400991515"
205,2,"12:57",777,"J.R. Lynch made Jumper.",61,61,"Hartford","LIU Brooklyn",NA,"400991515"
206,2,"12:49",769,"Jamall Robinson made Three Point Jumper. Assisted by Jashaun Agosto.",64,61,"Hartford","LIU Brooklyn",NA,"400991515"
207,2,"12:22",742,"Max Twyman missed Three Point Jumper.",64,61,"Hartford","LIU Brooklyn",NA,"400991515"
208,2,"12:22",742,"Jashaun Agosto Defensive Rebound.",64,61,"Hartford","LIU Brooklyn",NA,"400991515"
209,2,"11:57",717,"Jashaun Agosto missed Jumper.",64,61,"Hartford","LIU Brooklyn",NA,"400991515"
210,2,"11:57",717,"Jack Hobbs Defensive Rebound.",64,61,"Hartford","LIU Brooklyn",NA,"400991515"
211,2,"11:39",699,"Foul on Julius van Sauers.",64,61,"Hartford","LIU Brooklyn",NA,"400991515"
212,2,"11:39",699,"Official TV Timeout",64,61,"Hartford","LIU Brooklyn",NA,"400991515"
213,2,"11:26",686,"Jason Dunne made Three Point Jumper. Assisted by Travis Weatherington.",64,64,"Hartford","LIU Brooklyn",NA,"400991515"
214,2,"11:09",669,"Raiquan Clark Turnover.",64,64,"Hartford","LIU Brooklyn",NA,"400991515"
215,2,"10:55",655,"Foul on Jashaun Agosto.",64,64,"Hartford","LIU Brooklyn",NA,"400991515"
216,2,"10:55",655,"J.R. Lynch made Free Throw.",64,65,"Hartford","LIU Brooklyn",NA,"400991515"
217,2,"10:55",655,"J.R. Lynch made Free Throw.",64,66,"Hartford","LIU Brooklyn",NA,"400991515"
218,2,"10:36",636,"Zach Coleman made Three Point Jumper. Assisted by Joel Hernandez.",67,66,"Hartford","LIU Brooklyn",NA,"400991515"
219,2,"10:22",622,"Jason Dunne missed Three Point Jumper.",67,66,"Hartford","LIU Brooklyn",NA,"400991515"
220,2,"10:20",620,"Raiquan Clark Defensive Rebound.",67,66,"Hartford","LIU Brooklyn",NA,"400991515"
221,2,"10:19",619,"Foul on Jack Hobbs.",67,66,"Hartford","LIU Brooklyn",NA,"400991515"
222,2,"10:06",606,"Jamall Robinson Turnover.",67,66,"Hartford","LIU Brooklyn",NA,"400991515"
223,2,"9:55",595,"J.R. Lynch missed Jumper.",67,66,"Hartford","LIU Brooklyn",NA,"400991515"
224,2,"9:55",595,"Jashaun Agosto Defensive Rebound.",67,66,"Hartford","LIU Brooklyn",NA,"400991515"
225,2,"9:47",587,"Zach Coleman missed Layup.",67,66,"Hartford","LIU Brooklyn",NA,"400991515"
226,2,"9:47",587,"Jack Hobbs Defensive Rebound.",67,66,"Hartford","LIU Brooklyn",NA,"400991515"
227,2,"9:33",573,"Hassan Attia made Dunk. Assisted by Travis Weatherington.",67,68,"Hartford","LIU Brooklyn",NA,"400991515"
228,2,"9:13",553,"Joel Hernandez missed Jumper.",67,68,"Hartford","LIU Brooklyn",NA,"400991515"
229,2,"9:13",553,"John Carroll Defensive Rebound.",67,68,"Hartford","LIU Brooklyn",NA,"400991515"
230,2,"8:45",525,"Foul on Hassan Attia.",67,68,"Hartford","LIU Brooklyn",NA,"400991515"
231,2,"8:45",525,"Hassan Attia Turnover.",67,68,"Hartford","LIU Brooklyn",NA,"400991515"
232,2,"8:31",511,"Raiquan Clark missed Layup.",67,68,"Hartford","LIU Brooklyn",NA,"400991515"
233,2,"8:31",511,"Jack Hobbs Defensive Rebound.",67,68,"Hartford","LIU Brooklyn",NA,"400991515"
234,2,"8:06",486,"Jason Dunne missed Layup.",67,68,"Hartford","LIU Brooklyn",NA,"400991515"
235,2,"8:06",486,"Zach Coleman Defensive Rebound.",67,68,"Hartford","LIU Brooklyn",NA,"400991515"
236,2,"7:58",478,"Joel Hernandez missed Layup.",67,68,"Hartford","LIU Brooklyn",NA,"400991515"
237,2,"7:58",478,"Jack Hobbs Defensive Rebound.",67,68,"Hartford","LIU Brooklyn",NA,"400991515"
238,2,"7:49",469,"Jason Dunne Turnover.",67,68,"Hartford","LIU Brooklyn",NA,"400991515"
239,2,"7:48",468,"Jamall Robinson Steal.",67,68,"Hartford","LIU Brooklyn",NA,"400991515"
240,2,"7:45",465,"Raiquan Clark made Layup. Assisted by Jamall Robinson.",69,68,"Hartford","LIU Brooklyn",NA,"400991515"
241,2,"7:45",465,"Foul on Jack Hobbs.",69,68,"Hartford","LIU Brooklyn",NA,"400991515"
242,2,"7:45",465,"Official TV Timeout",69,68,"Hartford","LIU Brooklyn",NA,"400991515"
243,2,"7:45",465,"Raiquan Clark made Free Throw.",70,68,"Hartford","LIU Brooklyn",NA,"400991515"
244,2,"7:26",446,"Foul on Jamall Robinson.",70,68,"Hartford","LIU Brooklyn",NA,"400991515"
245,2,"7:15",435,"J.R. Lynch made Three Point Jumper.",70,71,"Hartford","LIU Brooklyn",NA,"400991515"
246,2,"7:01",421,"Foul on Max Twyman.",70,71,"Hartford","LIU Brooklyn",NA,"400991515"
247,2,"7:01",421,"Raiquan Clark made Free Throw.",71,71,"Hartford","LIU Brooklyn",NA,"400991515"
248,2,"7:01",421,"Raiquan Clark made Free Throw.",72,71,"Hartford","LIU Brooklyn",NA,"400991515"
249,2,"6:45",405,"J.R. Lynch missed Jumper.",72,71,"Hartford","LIU Brooklyn",NA,"400991515"
250,2,"6:45",405,"Zach Coleman Defensive Rebound.",72,71,"Hartford","LIU Brooklyn",NA,"400991515"
251,2,"6:34",394,"Raiquan Clark made Layup.",74,71,"Hartford","LIU Brooklyn",NA,"400991515"
252,2,"6:34",394,"Foul on John Carroll.",74,71,"Hartford","LIU Brooklyn",NA,"400991515"
253,2,"6:34",394,"Raiquan Clark made Free Throw.",75,71,"Hartford","LIU Brooklyn",NA,"400991515"
