"play_id","half","time_remaining_half","secs_remaining","description","home_score","away_score","away","home","home_favored_by","game_id"
259,2,"5:47",347,"Andrew Robinson missed Three Point Jumper.",62,60,"Quinnipiac","Hartford",NA,"400991094"
260,2,"5:45",345,"Hartford Defensive Rebound.",62,60,"Quinnipiac","Hartford",NA,"400991094"
261,2,"5:36",336,"Hassan Attia made Dunk. Assisted by J.R. Lynch.",64,60,"Quinnipiac","Hartford",NA,"400991094"
262,2,"5:07",307,"Abdulai Bundu missed Jumper.",64,60,"Quinnipiac","Hartford",NA,"400991094"
263,2,"5:07",307,"Abdulai Bundu Offensive Rebound.",64,60,"Quinnipiac","Hartford",NA,"400991094"
264,2,"5:05",305,"Foul on J.R. Lynch.",64,60,"Quinnipiac","Hartford",NA,"400991094"
265,2,"5:05",305,"Abdulai Bundu missed Free Throw.",64,60,"Quinnipiac","Hartford",NA,"400991094"
266,2,"5:05",305,"Cameron Young Offensive Rebound.",64,60,"Quinnipiac","Hartford",NA,"400991094"
267,2,"5:04",304,"Foul on Hassan Attia.",64,60,"Quinnipiac","Hartford",NA,"400991094"
268,2,"5:04",304,"Cameron Young made Free Throw.",64,61,"Quinnipiac","Hartford",NA,"400991094"
269,2,"5:04",304,"Cameron Young made Free Throw.",64,62,"Quinnipiac","Hartford",NA,"400991094"
270,2,"4:46",286,"Travis Weatherington missed Three Point Jumper.",64,62,"Quinnipiac","Hartford",NA,"400991094"
271,2,"4:46",286,"Cameron Young Block.",64,62,"Quinnipiac","Hartford",NA,"400991094"
272,2,"4:46",286,"Travis Weatherington Offensive Rebound.",64,62,"Quinnipiac","Hartford",NA,"400991094"
273,2,"4:40",280,"J.R. Lynch Turnover.",64,62,"Quinnipiac","Hartford",NA,"400991094"
274,2,"4:39",279,"Cameron Young Steal.",64,62,"Quinnipiac","Hartford",NA,"400991094"
275,2,"4:18",258,"Abdulai Bundu made Dunk. Assisted by Isaiah Washington.",64,64,"Quinnipiac","Hartford",NA,"400991094"
276,2,"3:56",236,"Jason Dunne made Three Point Jumper. Assisted by John Carroll.",67,64,"Quinnipiac","Hartford",NA,"400991094"
277,2,"3:36",216,"Isaiah Washington made Layup.",67,66,"Quinnipiac","Hartford",NA,"400991094"
278,2,"3:36",216,"Foul on Travis Weatherington.",67,66,"Quinnipiac","Hartford",NA,"400991094"
279,2,"3:36",216,"Official TV Timeout",67,66,"Quinnipiac","Hartford",NA,"400991094"
280,2,"3:36",216,"Isaiah Washington made Free Throw.",67,67,"Quinnipiac","Hartford",NA,"400991094"
281,2,"3:19",199,"Travis Weatherington made Jumper.",69,67,"Quinnipiac","Hartford",NA,"400991094"
282,2,"2:53",173,"Foul on Travis Weatherington.",69,67,"Quinnipiac","Hartford",NA,"400991094"
283,2,"2:53",173,"Isaiah Washington missed Free Throw.",69,67,"Quinnipiac","Hartford",NA,"400991094"
284,2,"2:53",173,"Quinnipiac Deadball Team Rebound.",69,67,"Quinnipiac","Hartford",NA,"400991094"
285,2,"2:53",173,"Isaiah Washington missed Free Throw.",69,67,"Quinnipiac","Hartford",NA,"400991094"
286,2,"2:53",173,"Cameron Young Offensive Rebound.",69,67,"Quinnipiac","Hartford",NA,"400991094"
287,2,"2:43",163,"Cameron Young missed Three Point Jumper.",69,67,"Quinnipiac","Hartford",NA,"400991094"
288,2,"2:43",163,"Cameron Young Offensive Rebound.",69,67,"Quinnipiac","Hartford",NA,"400991094"
289,2,"2:38",158,"Cameron Young made Layup.",69,69,"Quinnipiac","Hartford",NA,"400991094"
290,2,"2:38",158,"Foul on John Carroll.",69,69,"Quinnipiac","Hartford",NA,"400991094"
291,2,"2:38",158,"Cameron Young made Free Throw.",69,70,"Quinnipiac","Hartford",NA,"400991094"
292,2,"2:26",146,"Foul on Cameron Young.",69,70,"Quinnipiac","Hartford",NA,"400991094"
293,2,"2:26",146,"Jason Dunne made Free Throw.",70,70,"Quinnipiac","Hartford",NA,"400991094"
294,2,"2:26",146,"Jason Dunne made Free Throw.",71,70,"Quinnipiac","Hartford",NA,"400991094"
295,2,"2:13",133,"Abdulai Bundu made Layup. Assisted by Rich Kelly.",71,72,"Quinnipiac","Hartford",NA,"400991094"
296,2,"1:51",111,"John Carroll missed Jumper.",71,72,"Quinnipiac","Hartford",NA,"400991094"
297,2,"1:51",111,"Cameron Young Defensive Rebound.",71,72,"Quinnipiac","Hartford",NA,"400991094"
298,2,"1:49",109,"Foul on Hassan Attia.",71,72,"Quinnipiac","Hartford",NA,"400991094"
299,2,"1:49",109,"Cameron Young made Free Throw.",71,73,"Quinnipiac","Hartford",NA,"400991094"
300,2,"1:49",109,"Cameron Young made Free Throw.",71,74,"Quinnipiac","Hartford",NA,"400991094"
301,2,"1:40",100,"Travis Weatherington Turnover.",71,74,"Quinnipiac","Hartford",NA,"400991094"
302,2,"1:14",74,"Cameron Young missed Jumper.",71,74,"Quinnipiac","Hartford",NA,"400991094"
303,2,"1:14",74,"Cameron Young Offensive Rebound.",71,74,"Quinnipiac","Hartford",NA,"400991094"
304,2,"1:00",60,"Quinnipiac  Timeout",71,74,"Quinnipiac","Hartford",NA,"400991094"
305,2,"0:46",46,"Cameron Young missed Three Point Jumper.",71,74,"Quinnipiac","Hartford",NA,"400991094"
306,2,"0:44",44,"Hartford Defensive Rebound.",71,74,"Quinnipiac","Hartford",NA,"400991094"
307,2,"0:35",35,"John Carroll missed Layup.",71,74,"Quinnipiac","Hartford",NA,"400991094"
308,2,"0:35",35,"Cameron Young Defensive Rebound.",71,74,"Quinnipiac","Hartford",NA,"400991094"
309,2,"0:32",32,"Foul on Alain Chigha.",71,74,"Quinnipiac","Hartford",NA,"400991094"
310,2,"0:32",32,"Hartford  Timeout",71,74,"Quinnipiac","Hartford",NA,"400991094"
311,2,"0:25",25,"Jason Dunne made Layup.",73,74,"Quinnipiac","Hartford",NA,"400991094"
312,2,"0:25",25,"Quinnipiac  Turnover.",73,74,"Quinnipiac","Hartford",NA,"400991094"
313,2,"0:23",23,"Jason Dunne missed Three Point Jumper.",73,74,"Quinnipiac","Hartford",NA,"400991094"
314,2,"0:23",23,"John Carroll Offensive Rebound.",73,74,"Quinnipiac","Hartford",NA,"400991094"
315,2,"0:22",22,"John Carroll made Layup.",75,74,"Quinnipiac","Hartford",NA,"400991094"
316,2,"0:22",22,"Foul on Alain Chigha.",75,74,"Quinnipiac","Hartford",NA,"400991094"
317,2,"0:22",22,"John Carroll made Free Throw.",76,74,"Quinnipiac","Hartford",NA,"400991094"
318,2,"0:11",11,"Rich Kelly missed Three Point Jumper.",76,74,"Quinnipiac","Hartford",NA,"400991094"
319,2,"0:11",11,"Jacob Rigoni Offensive Rebound.",76,74,"Quinnipiac","Hartford",NA,"400991094"
320,2,"0:09",9,"Foul on Jason Dunne.",76,74,"Quinnipiac","Hartford",NA,"400991094"
321,2,"0:09",9,"Jacob Rigoni made Free Throw.",76,75,"Quinnipiac","Hartford",NA,"400991094"
322,2,"0:09",9,"Jacob Rigoni missed Free Throw.",76,75,"Quinnipiac","Hartford",NA,"400991094"
323,2,"0:09",9,"John Carroll Defensive Rebound.",76,75,"Quinnipiac","Hartford",NA,"400991094"
324,2,"0:07",7,"Foul on Cameron Young.",76,75,"Quinnipiac","Hartford",NA,"400991094"
325,2,"0:07",7,"John Carroll made Free Throw.",77,75,"Quinnipiac","Hartford",NA,"400991094"
326,2,"0:07",7,"John Carroll missed Free Throw.",77,75,"Quinnipiac","Hartford",NA,"400991094"
327,2,"0:07",7,"Isaiah Washington Defensive Rebound.",77,75,"Quinnipiac","Hartford",NA,"400991094"
328,2,"0:00",0,"Isaiah Washington missed Three Point Jumper.",77,75,"Quinnipiac","Hartford",NA,"400991094"
329,2,"0:00",0,"Quinnipiac Offensive Rebound.",77,75,"Quinnipiac","Hartford",NA,"400991094"
330,2,"0:00",0,"End of Game",77,75,"Quinnipiac","Hartford",NA,"400991094"
1,1,"20:00",2400,"PLAY",0,0,"Sacred Heart","Hartford",NA,"400990763"
2,1,"19:40",2380,"Joseph Lopez missed Layup.",0,0,"Sacred Heart","Hartford",NA,"400990763"
3,1,"19:40",2380,"Hassan Attia Block.",0,0,"Sacred Heart","Hartford",NA,"400990763"
4,1,"19:39",2379,"Joseph Lopez Offensive Rebound.",0,0,"Sacred Heart","Hartford",NA,"400990763"
5,1,"19:36",2376,"Joseph Lopez missed Layup.",0,0,"Sacred Heart","Hartford",NA,"400990763"
6,1,"19:36",2376,"Hartford Defensive Rebound.",0,0,"Sacred Heart","Hartford",NA,"400990763"
7,1,"19:11",2351,"Jason Dunne missed Layup.",0,0,"Sacred Heart","Hartford",NA,"400990763"
8,1,"19:11",2351,"Hassan Attia Offensive Rebound.",0,0,"Sacred Heart","Hartford",NA,"400990763"
9,1,"19:09",2349,"Hassan Attia made Layup.",2,0,"Sacred Heart","Hartford",NA,"400990763"
10,1,"18:52",2332,"Foul on John Carroll.",2,0,"Sacred Heart","Hartford",NA,"400990763"
11,1,"18:40",2320,"Mario Matasovic missed Jumper.",2,0,"Sacred Heart","Hartford",NA,"400990763"
12,1,"18:35",2315,"Hartford Defensive Rebound.",2,0,"Sacred Heart","Hartford",NA,"400990763"
13,1,"18:11",2291,"Hassan Attia Turnover.",2,0,"Sacred Heart","Hartford",NA,"400990763"
14,1,"17:59",2279,"Sean Hoehn Turnover.",2,0,"Sacred Heart","Hartford",NA,"400990763"
15,1,"17:59",2279,"John Carroll Steal.",2,0,"Sacred Heart","Hartford",NA,"400990763"
16,1,"17:59",2279,"Foul on Mario Matasovic.",2,0,"Sacred Heart","Hartford",NA,"400990763"
17,1,"17:48",2268,"J.R. Lynch made Jumper. Assisted by Hassan Attia.",4,0,"Sacred Heart","Hartford",NA,"400990763"
18,1,"17:29",2249,"Joseph Lopez made Layup.",4,2,"Sacred Heart","Hartford",NA,"400990763"
19,1,"17:16",2236,"John Carroll made Three Point Jumper. Assisted by Travis Weatherington.",7,2,"Sacred Heart","Hartford",NA,"400990763"
20,1,"17:00",2220,"Foul on Sean Hoehn.",7,2,"Sacred Heart","Hartford",NA,"400990763"
21,1,"17:00",2220,"Sean Hoehn Turnover.",7,2,"Sacred Heart","Hartford",NA,"400990763"
22,1,"16:46",2206,"J.R. Lynch missed Three Point Jumper.",7,2,"Sacred Heart","Hartford",NA,"400990763"
23,1,"16:46",2206,"Joseph Lopez Defensive Rebound.",7,2,"Sacred Heart","Hartford",NA,"400990763"
24,1,"16:37",2197,"Charles Tucker Jr. missed Jumper.",7,2,"Sacred Heart","Hartford",NA,"400990763"
25,1,"16:37",2197,"Hassan Attia Block.",7,2,"Sacred Heart","Hartford",NA,"400990763"
26,1,"16:36",2196,"Joseph Lopez Offensive Rebound.",7,2,"Sacred Heart","Hartford",NA,"400990763"
27,1,"16:35",2195,"Joseph Lopez made Layup.",7,4,"Sacred Heart","Hartford",NA,"400990763"
28,1,"16:10",2170,"Foul on Charles Tucker Jr..",7,4,"Sacred Heart","Hartford",NA,"400990763"
29,1,"15:54",2154,"J.R. Lynch missed Three Point Jumper.",7,4,"Sacred Heart","Hartford",NA,"400990763"
30,1,"15:54",2154,"Travis Weatherington Offensive Rebound.",7,4,"Sacred Heart","Hartford",NA,"400990763"
31,1,"15:50",2150,"Jason Dunne missed Three Point Jumper.",7,4,"Sacred Heart","Hartford",NA,"400990763"
32,1,"15:47",2147,"Official TV Timeout",7,4,"Sacred Heart","Hartford",NA,"400990763"
33,1,"15:47",2147,"Sacred Heart Defensive Rebound.",7,4,"Sacred Heart","Hartford",NA,"400990763"
34,1,"15:47",2147,"Official TV Timeout",7,4,"Sacred Heart","Hartford",NA,"400990763"
35,1,"15:35",2135,"Zach Radz missed Three Point Jumper.",7,4,"Sacred Heart","Hartford",NA,"400990763"
36,1,"15:35",2135,"John Carroll Defensive Rebound.",7,4,"Sacred Heart","Hartford",NA,"400990763"
37,1,"15:19",2119,"Foul on Hassan Attia.",7,4,"Sacred Heart","Hartford",NA,"400990763"
38,1,"15:19",2119,"Hassan Attia Turnover.",7,4,"Sacred Heart","Hartford",NA,"400990763"
39,1,"15:00",2100,"Charles Tucker Jr. missed Jumper.",7,4,"Sacred Heart","Hartford",NA,"400990763"
40,1,"15:00",2100,"Sacred Heart Deadball Team Rebound.",7,4,"Sacred Heart","Hartford",NA,"400990763"
41,1,"14:59",2099,"Foul on Jack Hobbs.",7,4,"Sacred Heart","Hartford",NA,"400990763"
42,1,"14:55",2095,"Joseph Lopez missed Jumper.",7,4,"Sacred Heart","Hartford",NA,"400990763"
43,1,"14:55",2095,"J.R. Lynch Defensive Rebound.",7,4,"Sacred Heart","Hartford",NA,"400990763"
44,1,"14:39",2079,"John Carroll made Jumper.",9,4,"Sacred Heart","Hartford",NA,"400990763"
45,1,"14:39",2079,"Foul on Joseph Lopez.",9,4,"Sacred Heart","Hartford",NA,"400990763"
46,1,"14:39",2079,"John Carroll made Free Throw.",10,4,"Sacred Heart","Hartford",NA,"400990763"
47,1,"14:29",2069,"Kinnon LaRose made Layup.",10,6,"Sacred Heart","Hartford",NA,"400990763"
48,1,"14:11",2051,"John Carroll missed Three Point Jumper.",10,6,"Sacred Heart","Hartford",NA,"400990763"
49,1,"14:11",2051,"Zach Radz Defensive Rebound.",10,6,"Sacred Heart","Hartford",NA,"400990763"
50,1,"13:50",2030,"Foul on Jack Hobbs.",10,6,"Sacred Heart","Hartford",NA,"400990763"
51,1,"13:43",2023,"Foul on John Carroll.",10,6,"Sacred Heart","Hartford",NA,"400990763"
52,1,"13:35",2015,"Sean Hoehn missed Three Point Jumper.",10,6,"Sacred Heart","Hartford",NA,"400990763"
53,1,"13:35",2015,"Sean Hoehn Offensive Rebound.",10,6,"Sacred Heart","Hartford",NA,"400990763"
54,1,"13:27",2007,"E.J. Anosike missed Layup.",10,6,"Sacred Heart","Hartford",NA,"400990763"
55,1,"13:27",2007,"Hassan Attia Block.",10,6,"Sacred Heart","Hartford",NA,"400990763"
56,1,"13:24",2004,"Hassan Attia Defensive Rebound.",10,6,"Sacred Heart","Hartford",NA,"400990763"
57,1,"13:10",1990,"George Blagojevic Turnover.",10,6,"Sacred Heart","Hartford",NA,"400990763"
58,1,"13:09",1989,"Zach Radz Steal.",10,6,"Sacred Heart","Hartford",NA,"400990763"
59,1,"13:06",1986,"De'von Barnett missed Layup.",10,6,"Sacred Heart","Hartford",NA,"400990763"
60,1,"13:06",1986,"Sean Hoehn Offensive Rebound.",10,6,"Sacred Heart","Hartford",NA,"400990763"
61,1,"13:05",1985,"Foul on Hassan Attia.",10,6,"Sacred Heart","Hartford",NA,"400990763"
62,1,"12:55",1975,"Foul on De'von Barnett.",10,6,"Sacred Heart","Hartford",NA,"400990763"
63,1,"12:55",1975,"De'von Barnett Turnover.",10,6,"Sacred Heart","Hartford",NA,"400990763"
64,1,"12:28",1948,"J.R. Lynch made Jumper.",12,6,"Sacred Heart","Hartford",NA,"400990763"
65,1,"12:01",1921,"De'von Barnett missed Jumper.",12,6,"Sacred Heart","Hartford",NA,"400990763"
66,1,"12:01",1921,"George Blagojevic Defensive Rebound.",12,6,"Sacred Heart","Hartford",NA,"400990763"
67,1,"11:55",1915,"Foul on Alex Watson.",12,6,"Sacred Heart","Hartford",NA,"400990763"
68,1,"11:55",1915,"Official TV Timeout",12,6,"Sacred Heart","Hartford",NA,"400990763"
69,1,"11:35",1895,"J.R. Lynch Turnover.",12,6,"Sacred Heart","Hartford",NA,"400990763"
70,1,"11:09",1869,"Zach Radz missed Layup.",12,6,"Sacred Heart","Hartford",NA,"400990763"
71,1,"11:09",1869,"Jason Dunne Defensive Rebound.",12,6,"Sacred Heart","Hartford",NA,"400990763"
72,1,"10:44",1844,"Max Twyman missed Jumper.",12,6,"Sacred Heart","Hartford",NA,"400990763"
73,1,"10:44",1844,"Mario Matasovic Defensive Rebound.",12,6,"Sacred Heart","Hartford",NA,"400990763"
74,1,"10:32",1832,"Foul on Max Twyman.",12,6,"Sacred Heart","Hartford",NA,"400990763"
75,1,"10:32",1832,"Mario Matasovic missed Free Throw.",12,6,"Sacred Heart","Hartford",NA,"400990763"
76,1,"10:32",1832,"Sacred Heart Deadball Team Rebound.",12,6,"Sacred Heart","Hartford",NA,"400990763"
77,1,"10:32",1832,"Mario Matasovic made Free Throw.",12,7,"Sacred Heart","Hartford",NA,"400990763"
78,1,"10:09",1809,"Jason Dunne made Three Point Jumper. Assisted by Max Twyman.",15,7,"Sacred Heart","Hartford",NA,"400990763"
79,1,"10:03",1803,"Mario Matasovic made Layup. Assisted by Sean Hoehn.",15,9,"Sacred Heart","Hartford",NA,"400990763"
80,1,"9:50",1790,"Andrew Ramirez missed Layup.",15,9,"Sacred Heart","Hartford",NA,"400990763"
81,1,"9:50",1790,"Alex Watson Block.",15,9,"Sacred Heart","Hartford",NA,"400990763"
82,1,"9:50",1790,"Joseph Lopez Defensive Rebound.",15,9,"Sacred Heart","Hartford",NA,"400990763"
83,1,"9:40",1780,"Alex Watson missed Three Point Jumper.",15,9,"Sacred Heart","Hartford",NA,"400990763"
84,1,"9:40",1780,"Zach Radz Offensive Rebound.",15,9,"Sacred Heart","Hartford",NA,"400990763"
85,1,"9:38",1778,"Zach Radz made Layup.",15,11,"Sacred Heart","Hartford",NA,"400990763"
86,1,"9:06",1746,"J.R. Lynch made Layup. Assisted by Max Twyman.",17,11,"Sacred Heart","Hartford",NA,"400990763"
87,1,"8:49",1729,"Mario Matasovic made Layup.",17,13,"Sacred Heart","Hartford",NA,"400990763"
88,1,"8:22",1702,"Andrew Ramirez missed Three Point Jumper.",17,13,"Sacred Heart","Hartford",NA,"400990763"
89,1,"8:22",1702,"George Blagojevic Offensive Rebound.",17,13,"Sacred Heart","Hartford",NA,"400990763"
90,1,"8:03",1683,"Jason Dunne made Three Point Jumper. Assisted by George Blagojevic.",20,13,"Sacred Heart","Hartford",NA,"400990763"
91,1,"7:52",1672,"Zach Radz missed Jumper.",20,13,"Sacred Heart","Hartford",NA,"400990763"
92,1,"7:52",1672,"Joseph Lopez Offensive Rebound.",20,13,"Sacred Heart","Hartford",NA,"400990763"
93,1,"7:49",1669,"Joseph Lopez missed Layup.",20,13,"Sacred Heart","Hartford",NA,"400990763"
94,1,"7:49",1669,"J.R. Lynch Defensive Rebound.",20,13,"Sacred Heart","Hartford",NA,"400990763"
95,1,"7:39",1659,"J.R. Lynch missed Layup.",20,13,"Sacred Heart","Hartford",NA,"400990763"
96,1,"7:39",1659,"Hartford Offensive Rebound.",20,13,"Sacred Heart","Hartford",NA,"400990763"
97,1,"7:38",1658,"Official TV Timeout",20,13,"Sacred Heart","Hartford",NA,"400990763"
98,1,"7:34",1654,"Jason Dunne missed Three Point Jumper.",20,13,"Sacred Heart","Hartford",NA,"400990763"
99,1,"7:34",1654,"Max Twyman Offensive Rebound.",20,13,"Sacred Heart","Hartford",NA,"400990763"
100,1,"7:08",1628,"Jason Dunne made Three Point Jumper.",23,13,"Sacred Heart","Hartford",NA,"400990763"
101,1,"6:35",1595,"Sean Hoehn Turnover.",23,13,"Sacred Heart","Hartford",NA,"400990763"
102,1,"6:10",1570,"Jason Dunne missed Three Point Jumper.",23,13,"Sacred Heart","Hartford",NA,"400990763"
103,1,"6:10",1570,"Charles Tucker Jr. Defensive Rebound.",23,13,"Sacred Heart","Hartford",NA,"400990763"
104,1,"5:56",1556,"Sean Hoehn missed Three Point Jumper.",23,13,"Sacred Heart","Hartford",NA,"400990763"
105,1,"5:56",1556,"Jalen Knight Defensive Rebound.",23,13,"Sacred Heart","Hartford",NA,"400990763"
106,1,"5:31",1531,"J.R. Lynch missed Three Point Jumper.",23,13,"Sacred Heart","Hartford",NA,"400990763"
107,1,"5:31",1531,"Sean Hoehn Defensive Rebound.",23,13,"Sacred Heart","Hartford",NA,"400990763"
108,1,"5:24",1524,"Mario Matasovic made Jumper. Assisted by Charles Tucker Jr..",23,15,"Sacred Heart","Hartford",NA,"400990763"
109,1,"5:01",1501,"Jalen Knight missed Layup.",23,15,"Sacred Heart","Hartford",NA,"400990763"
110,1,"5:01",1501,"Mario Matasovic Defensive Rebound.",23,15,"Sacred Heart","Hartford",NA,"400990763"
111,1,"4:50",1490,"Joseph Lopez made Layup.",23,17,"Sacred Heart","Hartford",NA,"400990763"
112,1,"4:50",1490,"Foul on Jack Hobbs.",23,17,"Sacred Heart","Hartford",NA,"400990763"
113,1,"4:50",1490,"Joseph Lopez made Free Throw.",23,18,"Sacred Heart","Hartford",NA,"400990763"
114,1,"4:36",1476,"John Carroll missed Jumper.",23,18,"Sacred Heart","Hartford",NA,"400990763"
115,1,"4:36",1476,"Kinnon LaRose Defensive Rebound.",23,18,"Sacred Heart","Hartford",NA,"400990763"
116,1,"4:27",1467,"Joseph Lopez made Layup. Assisted by Charles Tucker Jr..",23,20,"Sacred Heart","Hartford",NA,"400990763"
117,1,"4:10",1450,"Travis Weatherington made Jumper.",25,20,"Sacred Heart","Hartford",NA,"400990763"
118,1,"4:04",1444,"Foul on Max Twyman.",25,20,"Sacred Heart","Hartford",NA,"400990763"
119,1,"4:04",1444,"Mario Matasovic made Free Throw.",25,21,"Sacred Heart","Hartford",NA,"400990763"
120,1,"4:04",1444,"Mario Matasovic made Free Throw.",25,22,"Sacred Heart","Hartford",NA,"400990763"
121,1,"3:51",1431,"John Carroll made Layup. Assisted by Jason Dunne.",27,22,"Sacred Heart","Hartford",NA,"400990763"
122,1,"3:51",1431,"Foul on De'von Barnett.",27,22,"Sacred Heart","Hartford",NA,"400990763"
123,1,"3:51",1431,"Official TV Timeout",27,22,"Sacred Heart","Hartford",NA,"400990763"
124,1,"3:51",1431,"John Carroll missed Free Throw.",27,22,"Sacred Heart","Hartford",NA,"400990763"
125,1,"3:51",1431,"Mario Matasovic Defensive Rebound.",27,22,"Sacred Heart","Hartford",NA,"400990763"
126,1,"3:26",1406,"Kinnon LaRose made Three Point Jumper. Assisted by Charles Tucker Jr..",27,25,"Sacred Heart","Hartford",NA,"400990763"
127,1,"3:04",1384,"Jalen Knight Turnover.",27,25,"Sacred Heart","Hartford",NA,"400990763"
128,1,"2:48",1368,"Foul on Hassan Attia.",27,25,"Sacred Heart","Hartford",NA,"400990763"
129,1,"2:48",1368,"Joseph Lopez missed Free Throw.",27,25,"Sacred Heart","Hartford",NA,"400990763"
130,1,"2:48",1368,"Sacred Heart Deadball Team Rebound.",27,25,"Sacred Heart","Hartford",NA,"400990763"
131,1,"2:48",1368,"Joseph Lopez made Free Throw.",27,26,"Sacred Heart","Hartford",NA,"400990763"
132,1,"2:33",1353,"J.R. Lynch missed Three Point Jumper.",27,26,"Sacred Heart","Hartford",NA,"400990763"
133,1,"2:33",1353,"Joseph Lopez Defensive Rebound.",27,26,"Sacred Heart","Hartford",NA,"400990763"
134,1,"2:23",1343,"Kinnon LaRose missed Three Point Jumper.",27,26,"Sacred Heart","Hartford",NA,"400990763"
135,1,"2:23",1343,"J.R. Lynch Defensive Rebound.",27,26,"Sacred Heart","Hartford",NA,"400990763"
136,1,"2:12",1332,"Travis Weatherington made Three Point Jumper. Assisted by Max Twyman.",30,26,"Sacred Heart","Hartford",NA,"400990763"
137,1,"2:10",1330,"Hartford  Timeout",30,26,"Sacred Heart","Hartford",NA,"400990763"
138,1,"1:45",1305,"Mario Matasovic made Layup. Assisted by Joseph Lopez.",30,28,"Sacred Heart","Hartford",NA,"400990763"
139,1,"1:45",1305,"Foul on J.R. Lynch.",30,28,"Sacred Heart","Hartford",NA,"400990763"
140,1,"1:45",1305,"Mario Matasovic made Free Throw.",30,29,"Sacred Heart","Hartford",NA,"400990763"
141,1,"1:29",1289,"John Carroll missed Jumper.",30,29,"Sacred Heart","Hartford",NA,"400990763"
142,1,"1:29",1289,"Charles Tucker Jr. Defensive Rebound.",30,29,"Sacred Heart","Hartford",NA,"400990763"
143,1,"1:03",1263,"Joseph Lopez made Layup.",30,31,"Sacred Heart","Hartford",NA,"400990763"
144,1,"0:48",1248,"John Carroll made Layup.",32,31,"Sacred Heart","Hartford",NA,"400990763"
145,1,"0:40",1240,"Mario Matasovic made Layup. Assisted by Charles Tucker Jr..",32,33,"Sacred Heart","Hartford",NA,"400990763"
146,1,"0:25",1225,"Foul on Mario Matasovic.",32,33,"Sacred Heart","Hartford",NA,"400990763"
147,1,"0:25",1225,"Jason Dunne made Free Throw.",33,33,"Sacred Heart","Hartford",NA,"400990763"
148,1,"0:25",1225,"Jason Dunne made Free Throw.",34,33,"Sacred Heart","Hartford",NA,"400990763"
149,1,"0:03",1203,"Zach Radz missed Layup.",34,33,"Sacred Heart","Hartford",NA,"400990763"
150,1,"0:03",1203,"Mario Matasovic Offensive Rebound.",34,33,"Sacred Heart","Hartford",NA,"400990763"
151,1,"0:01",1201,"Mario Matasovic missed Layup.",34,33,"Sacred Heart","Hartford",NA,"400990763"
152,1,"0:00",1200,"Sacred Heart Offensive Rebound.",34,33,"Sacred Heart","Hartford",NA,"400990763"
153,1,"0:00",1200,"End of 1st half",34,33,"Sacred Heart","Hartford",NA,"400990763"
154,2,"20:00",1200,"PLAY",34,33,"Sacred Heart","Hartford",NA,"400990763"
155,2,"19:48",1188,"Mario Matasovic missed Three Point Jumper.",34,33,"Sacred Heart","Hartford",NA,"400990763"
156,2,"19:48",1188,"Joseph Lopez Offensive Rebound.",34,33,"Sacred Heart","Hartford",NA,"400990763"
157,2,"19:46",1186,"Joseph Lopez missed Layup.",34,33,"Sacred Heart","Hartford",NA,"400990763"
158,2,"19:46",1186,"Hassan Attia Block.",34,33,"Sacred Heart","Hartford",NA,"400990763"
159,2,"19:46",1186,"Hassan Attia Defensive Rebound.",34,33,"Sacred Heart","Hartford",NA,"400990763"
160,2,"19:34",1174,"Hassan Attia missed Layup.",34,33,"Sacred Heart","Hartford",NA,"400990763"
161,2,"19:32",1172,"Hartford Offensive Rebound.",34,33,"Sacred Heart","Hartford",NA,"400990763"
162,2,"19:27",1167,"J.R. Lynch Turnover.",34,33,"Sacred Heart","Hartford",NA,"400990763"
163,2,"19:26",1166,"Joseph Lopez Steal.",34,33,"Sacred Heart","Hartford",NA,"400990763"
164,2,"19:00",1140,"Foul on Joseph Lopez.",34,33,"Sacred Heart","Hartford",NA,"400990763"
165,2,"19:00",1140,"Joseph Lopez Turnover.",34,33,"Sacred Heart","Hartford",NA,"400990763"
166,2,"18:31",1111,"Jason Dunne made Layup.",36,33,"Sacred Heart","Hartford",NA,"400990763"
167,2,"18:15",1095,"Sean Hoehn missed Three Point Jumper.",36,33,"Sacred Heart","Hartford",NA,"400990763"
168,2,"18:15",1095,"Hassan Attia Defensive Rebound.",36,33,"Sacred Heart","Hartford",NA,"400990763"
169,2,"18:11",1091,"Hassan Attia Turnover.",36,33,"Sacred Heart","Hartford",NA,"400990763"
170,2,"18:02",1082,"Joseph Lopez missed Layup.",36,33,"Sacred Heart","Hartford",NA,"400990763"
171,2,"18:02",1082,"Hassan Attia Block.",36,33,"Sacred Heart","Hartford",NA,"400990763"
172,2,"18:02",1082,"Joseph Lopez Offensive Rebound.",36,33,"Sacred Heart","Hartford",NA,"400990763"
173,2,"18:00",1080,"Foul on John Carroll.",36,33,"Sacred Heart","Hartford",NA,"400990763"
174,2,"17:45",1065,"Sean Hoehn Turnover.",36,33,"Sacred Heart","Hartford",NA,"400990763"
175,2,"17:44",1064,"J.R. Lynch Steal.",36,33,"Sacred Heart","Hartford",NA,"400990763"
176,2,"17:33",1053,"Travis Weatherington made Three Point Jumper. Assisted by J.R. Lynch.",39,33,"Sacred Heart","Hartford",NA,"400990763"
177,2,"17:16",1036,"Kinnon LaRose made Layup. Assisted by Sean Hoehn.",39,35,"Sacred Heart","Hartford",NA,"400990763"
178,2,"16:49",1009,"Hassan Attia made Layup.",41,35,"Sacred Heart","Hartford",NA,"400990763"
179,2,"16:40",1000,"Sean Hoehn missed Three Point Jumper.",41,35,"Sacred Heart","Hartford",NA,"400990763"
180,2,"16:40",1000,"Jack Hobbs Defensive Rebound.",41,35,"Sacred Heart","Hartford",NA,"400990763"
181,2,"16:10",970,"Travis Weatherington made Layup.",43,35,"Sacred Heart","Hartford",NA,"400990763"
182,2,"15:59",959,"Sean Hoehn made Layup. Assisted by Mario Matasovic.",43,37,"Sacred Heart","Hartford",NA,"400990763"
183,2,"15:37",937,"J.R. Lynch made Layup.",45,37,"Sacred Heart","Hartford",NA,"400990763"
184,2,"15:23",923,"Official TV Timeout",45,37,"Sacred Heart","Hartford",NA,"400990763"
185,2,"15:17",917,"Foul on Hassan Attia.",45,37,"Sacred Heart","Hartford",NA,"400990763"
186,2,"15:17",917,"Alex Watson missed Free Throw.",45,37,"Sacred Heart","Hartford",NA,"400990763"
187,2,"15:17",917,"Sacred Heart Deadball Team Rebound.",45,37,"Sacred Heart","Hartford",NA,"400990763"
188,2,"15:17",917,"Alex Watson made Free Throw.",45,38,"Sacred Heart","Hartford",NA,"400990763"
189,2,"14:54",894,"John Carroll missed Layup.",45,38,"Sacred Heart","Hartford",NA,"400990763"
190,2,"14:54",894,"De'von Barnett Defensive Rebound.",45,38,"Sacred Heart","Hartford",NA,"400990763"
191,2,"14:42",882,"Joseph Lopez made Layup. Assisted by Alex Watson.",45,40,"Sacred Heart","Hartford",NA,"400990763"
192,2,"14:26",866,"George Blagojevic made Layup. Assisted by John Carroll.",47,40,"Sacred Heart","Hartford",NA,"400990763"
193,2,"14:12",852,"Joseph Lopez made Layup. Assisted by Zach Radz.",47,42,"Sacred Heart","Hartford",NA,"400990763"
194,2,"13:52",832,"Jack Hobbs made Three Point Jumper. Assisted by John Carroll.",50,42,"Sacred Heart","Hartford",NA,"400990763"
195,2,"13:31",811,"Foul on De'von Barnett.",50,42,"Sacred Heart","Hartford",NA,"400990763"
