"play_id","half","time_remaining_half","secs_remaining","description","home_score","away_score","away","home","home_favored_by","game_id"
107,1,"6:29",1589,"Foul on Jared Stutzman.",23,19,"Youngstown State","Idaho State",4.5,"400992195"
108,1,"6:29",1589,"Cameron Morse made Free Throw.",23,20,"Youngstown State","Idaho State",4.5,"400992195"
109,1,"6:29",1589,"Cameron Morse missed Free Throw.",23,20,"Youngstown State","Idaho State",4.5,"400992195"
110,1,"6:29",1589,"Idaho State Defensive Rebound.",23,20,"Youngstown State","Idaho State",4.5,"400992195"
111,1,"6:17",1577,"Geno Luzcando Turnover.",23,20,"Youngstown State","Idaho State",4.5,"400992195"
112,1,"6:17",1577,"Foul on Geno Luzcando.",23,20,"Youngstown State","Idaho State",4.5,"400992195"
113,1,"6:08",1568,"Braun Hartfield Turnover.",23,20,"Youngstown State","Idaho State",4.5,"400992195"
114,1,"6:08",1568,"Foul on Braun Hartfield.",23,20,"Youngstown State","Idaho State",4.5,"400992195"
115,1,"5:59",1559,"Foul on Jaylen Benton.",23,20,"Youngstown State","Idaho State",4.5,"400992195"
116,1,"5:59",1559,"Balint Mocsan missed Free Throw.",23,20,"Youngstown State","Idaho State",4.5,"400992195"
117,1,"5:59",1559,"Naz Bohannon Defensive Rebound.",23,20,"Youngstown State","Idaho State",4.5,"400992195"
118,1,"5:44",1544,"Devin Haygood missed Layup.",23,20,"Youngstown State","Idaho State",4.5,"400992195"
119,1,"5:44",1544,"Kyle Ingram Block.",23,20,"Youngstown State","Idaho State",4.5,"400992195"
120,1,"5:42",1542,"Brandon Boyd Defensive Rebound.",23,20,"Youngstown State","Idaho State",4.5,"400992195"
121,1,"5:16",1516,"Brandon Boyd made Dunk.",25,20,"Youngstown State","Idaho State",4.5,"400992195"
122,1,"4:43",1483,"Naz Bohannon Turnover.",25,20,"Youngstown State","Idaho State",4.5,"400992195"
123,1,"4:43",1483,"Brandon Boyd Steal.",25,20,"Youngstown State","Idaho State",4.5,"400992195"
124,1,"4:43",1483,"Brandon Boyd made Layup.",27,20,"Youngstown State","Idaho State",4.5,"400992195"
125,1,"4:43",1483,"Youngstown State  Timeout",27,20,"Youngstown State","Idaho State",4.5,"400992195"
126,1,"4:30",1470,"Naz Bohannon Turnover.",27,20,"Youngstown State","Idaho State",4.5,"400992195"
127,1,"4:29",1469,"Brandon Boyd Steal.",27,20,"Youngstown State","Idaho State",4.5,"400992195"
128,1,"4:18",1458,"Gary Chivichyan missed Jumper.",27,20,"Youngstown State","Idaho State",4.5,"400992195"
129,1,"4:18",1458,"Naz Bohannon Defensive Rebound.",27,20,"Youngstown State","Idaho State",4.5,"400992195"
130,1,"4:02",1442,"Kyle Ingram Block.",27,20,"Youngstown State","Idaho State",4.5,"400992195"
131,1,"4:02",1442,"Tyree Robinson missed Jumper.",27,20,"Youngstown State","Idaho State",4.5,"400992195"
132,1,"4:02",1442,"Brandon Boyd Defensive Rebound.",27,20,"Youngstown State","Idaho State",4.5,"400992195"
133,1,"3:40",1420,"Jared Stutzman missed Three Point Jumper.",27,20,"Youngstown State","Idaho State",4.5,"400992195"
134,1,"3:40",1420,"Tyree Robinson Defensive Rebound.",27,20,"Youngstown State","Idaho State",4.5,"400992195"
135,1,"3:33",1413,"Naz Bohannon made Layup.",27,22,"Youngstown State","Idaho State",4.5,"400992195"
136,1,"3:22",1402,"Brandon Boyd Turnover.",27,22,"Youngstown State","Idaho State",4.5,"400992195"
137,1,"3:21",1401,"Tyree Robinson Steal.",27,22,"Youngstown State","Idaho State",4.5,"400992195"
138,1,"3:14",1394,"Naz Bohannon missed Layup.",27,22,"Youngstown State","Idaho State",4.5,"400992195"
139,1,"3:14",1394,"Garrett Covington Offensive Rebound.",27,22,"Youngstown State","Idaho State",4.5,"400992195"
140,1,"3:10",1390,"Garrett Covington missed Two Point Tip Shot.",27,22,"Youngstown State","Idaho State",4.5,"400992195"
141,1,"3:10",1390,"Balint Mocsan Defensive Rebound.",27,22,"Youngstown State","Idaho State",4.5,"400992195"
142,1,"3:10",1390,"Foul on Jaylen Benton.",27,22,"Youngstown State","Idaho State",4.5,"400992195"
143,1,"3:10",1390,"Balint Mocsan made Free Throw.",28,22,"Youngstown State","Idaho State",4.5,"400992195"
144,1,"3:10",1390,"Balint Mocsan made Free Throw.",29,22,"Youngstown State","Idaho State",4.5,"400992195"
145,1,"2:58",1378,"Tyree Robinson made Layup.",29,24,"Youngstown State","Idaho State",4.5,"400992195"
146,1,"2:40",1360,"Youngstown State  Timeout",29,24,"Youngstown State","Idaho State",4.5,"400992195"
147,1,"2:37",1357,"Balint Mocsan made Three Point Jumper. Assisted by Brandon Boyd.",32,24,"Youngstown State","Idaho State",4.5,"400992195"
148,1,"2:19",1339,"Tyree Robinson missed Layup.",32,24,"Youngstown State","Idaho State",4.5,"400992195"
149,1,"2:19",1339,"Balint Mocsan Defensive Rebound.",32,24,"Youngstown State","Idaho State",4.5,"400992195"
150,1,"2:03",1323,"Jared Stutzman made Layup. Assisted by Kyle Ingram.",34,24,"Youngstown State","Idaho State",4.5,"400992195"
151,1,"2:01",1321,"Foul on Michael Akuchie.",34,24,"Youngstown State","Idaho State",4.5,"400992195"
152,1,"2:01",1321,"Jared Stutzman made Free Throw.",35,24,"Youngstown State","Idaho State",4.5,"400992195"
153,1,"1:35",1295,"Jaylen Benton missed Layup.",35,24,"Youngstown State","Idaho State",4.5,"400992195"
154,1,"1:35",1295,"Kyle Ingram Block.",35,24,"Youngstown State","Idaho State",4.5,"400992195"
155,1,"1:33",1293,"Gary Chivichyan Defensive Rebound.",35,24,"Youngstown State","Idaho State",4.5,"400992195"
156,1,"1:19",1279,"Gary Chivichyan missed Layup.",35,24,"Youngstown State","Idaho State",4.5,"400992195"
157,1,"1:19",1279,"Devin Haygood Block.",35,24,"Youngstown State","Idaho State",4.5,"400992195"
158,1,"1:17",1277,"Devin Haygood Defensive Rebound.",35,24,"Youngstown State","Idaho State",4.5,"400992195"
159,1,"1:14",1274,"Jaylen Benton missed Three Point Jumper.",35,24,"Youngstown State","Idaho State",4.5,"400992195"
160,1,"1:14",1274,"Gary Chivichyan Defensive Rebound.",35,24,"Youngstown State","Idaho State",4.5,"400992195"
161,1,"0:56",1256,"Kyle Ingram made Jumper.",37,24,"Youngstown State","Idaho State",4.5,"400992195"
162,1,"0:29",1229,"Foul on Kyle Ingram.",37,24,"Youngstown State","Idaho State",4.5,"400992195"
163,1,"0:29",1229,"Idaho State  Timeout",37,24,"Youngstown State","Idaho State",4.5,"400992195"
164,1,"0:29",1229,"Devin Haygood made Free Throw.",37,25,"Youngstown State","Idaho State",4.5,"400992195"
165,1,"0:29",1229,"Devin Haygood made Free Throw.",37,26,"Youngstown State","Idaho State",4.5,"400992195"
166,1,"0:03",1203,"Gary Chivichyan made Three Point Jumper.",40,26,"Youngstown State","Idaho State",4.5,"400992195"
167,1,"0:00",1200,"End of 1st half",40,26,"Youngstown State","Idaho State",4.5,"400992195"
168,2,"20:00",1200,"PLAY",40,26,"Youngstown State","Idaho State",4.5,"400992195"
169,2,"19:51",1191,"Cameron Morse missed Jumper.",40,26,"Youngstown State","Idaho State",4.5,"400992195"
170,2,"19:51",1191,"Balint Mocsan Defensive Rebound.",40,26,"Youngstown State","Idaho State",4.5,"400992195"
171,2,"19:33",1173,"Novak Topalovic Turnover.",40,26,"Youngstown State","Idaho State",4.5,"400992195"
172,2,"19:31",1171,"Cameron Morse Steal.",40,26,"Youngstown State","Idaho State",4.5,"400992195"
173,2,"19:28",1168,"Foul on Novak Topalovic.",40,26,"Youngstown State","Idaho State",4.5,"400992195"
174,2,"19:28",1168,"Devin Haygood missed Free Throw.",40,26,"Youngstown State","Idaho State",4.5,"400992195"
175,2,"19:28",1168,"Youngstown State Deadball Team Rebound.",40,26,"Youngstown State","Idaho State",4.5,"400992195"
176,2,"19:28",1168,"Devin Haygood missed Free Throw.",40,26,"Youngstown State","Idaho State",4.5,"400992195"
177,2,"19:28",1168,"Balint Mocsan Defensive Rebound.",40,26,"Youngstown State","Idaho State",4.5,"400992195"
178,2,"19:21",1161,"Geno Luzcando Turnover.",40,26,"Youngstown State","Idaho State",4.5,"400992195"
179,2,"19:02",1142,"Braun Hartfield made Three Point Jumper. Assisted by Devin Haygood.",40,29,"Youngstown State","Idaho State",4.5,"400992195"
180,2,"18:44",1124,"Balint Mocsan missed Three Point Jumper.",40,29,"Youngstown State","Idaho State",4.5,"400992195"
181,2,"18:44",1124,"Kyle Ingram missed Two Point Tip Shot.",40,29,"Youngstown State","Idaho State",4.5,"400992195"
182,2,"18:44",1124,"Kyle Ingram Offensive Rebound.",40,29,"Youngstown State","Idaho State",4.5,"400992195"
183,2,"18:44",1124,"Kyle Ingram Offensive Rebound.",40,29,"Youngstown State","Idaho State",4.5,"400992195"
184,2,"18:36",1116,"Foul on Tyree Robinson.",40,29,"Youngstown State","Idaho State",4.5,"400992195"
185,2,"18:16",1096,"Balint Mocsan missed Three Point Jumper.",40,29,"Youngstown State","Idaho State",4.5,"400992195"
186,2,"18:16",1096,"Cameron Morse Defensive Rebound.",40,29,"Youngstown State","Idaho State",4.5,"400992195"
187,2,"18:11",1091,"Jaylen Benton Turnover.",40,29,"Youngstown State","Idaho State",4.5,"400992195"
188,2,"18:09",1089,"Jared Stutzman Steal.",40,29,"Youngstown State","Idaho State",4.5,"400992195"
189,2,"18:07",1087,"Jared Stutzman made Layup.",42,29,"Youngstown State","Idaho State",4.5,"400992195"
190,2,"17:49",1069,"Tyree Robinson Turnover.",42,29,"Youngstown State","Idaho State",4.5,"400992195"
191,2,"17:48",1068,"Jared Stutzman Steal.",42,29,"Youngstown State","Idaho State",4.5,"400992195"
192,2,"17:40",1060,"Foul on Braun Hartfield.",42,29,"Youngstown State","Idaho State",4.5,"400992195"
193,2,"17:23",1043,"Balint Mocsan missed Layup.",42,29,"Youngstown State","Idaho State",4.5,"400992195"
194,2,"17:23",1043,"Jacob Brown Block.",42,29,"Youngstown State","Idaho State",4.5,"400992195"
195,2,"17:15",1035,"Jacob Brown Defensive Rebound.",42,29,"Youngstown State","Idaho State",4.5,"400992195"
196,2,"17:13",1033,"Devin Haygood made Layup.",42,31,"Youngstown State","Idaho State",4.5,"400992195"
197,2,"17:02",1022,"Novak Topalovic made Dunk. Assisted by Jared Stutzman.",44,31,"Youngstown State","Idaho State",4.5,"400992195"
198,2,"16:39",999,"Jacob Brown missed Three Point Jumper.",44,31,"Youngstown State","Idaho State",4.5,"400992195"
199,2,"16:39",999,"Geno Luzcando Defensive Rebound.",44,31,"Youngstown State","Idaho State",4.5,"400992195"
200,2,"16:32",992,"Balint Mocsan made Dunk. Assisted by Jared Stutzman.",46,31,"Youngstown State","Idaho State",4.5,"400992195"
201,2,"16:04",964,"Cameron Morse missed Jumper.",46,31,"Youngstown State","Idaho State",4.5,"400992195"
202,2,"16:04",964,"Idaho State Defensive Rebound.",46,31,"Youngstown State","Idaho State",4.5,"400992195"
203,2,"16:03",963,"Official TV Timeout",46,31,"Youngstown State","Idaho State",4.5,"400992195"
204,2,"15:56",956,"Novak Topalovic missed Layup.",46,31,"Youngstown State","Idaho State",4.5,"400992195"
205,2,"15:56",956,"Idaho State Offensive Rebound.",46,31,"Youngstown State","Idaho State",4.5,"400992195"
206,2,"15:56",956,"Foul on Noe Anabir.",46,31,"Youngstown State","Idaho State",4.5,"400992195"
207,2,"15:47",947,"Foul on Naz Bohannon.",46,31,"Youngstown State","Idaho State",4.5,"400992195"
208,2,"15:27",927,"Idaho State  Turnover.",46,31,"Youngstown State","Idaho State",4.5,"400992195"
209,2,"15:12",912,"Jeremiah Ferguson Turnover.",46,31,"Youngstown State","Idaho State",4.5,"400992195"
210,2,"15:11",911,"Geno Luzcando Steal.",46,31,"Youngstown State","Idaho State",4.5,"400992195"
211,2,"15:09",909,"Geno Luzcando made Layup.",48,31,"Youngstown State","Idaho State",4.5,"400992195"
212,2,"14:52",892,"Garrett Covington made Layup.",48,33,"Youngstown State","Idaho State",4.5,"400992195"
213,2,"14:38",878,"Balint Mocsan Turnover.",48,33,"Youngstown State","Idaho State",4.5,"400992195"
214,2,"14:35",875,"Braun Hartfield missed Three Point Jumper.",48,33,"Youngstown State","Idaho State",4.5,"400992195"
215,2,"14:35",875,"Balint Mocsan Defensive Rebound.",48,33,"Youngstown State","Idaho State",4.5,"400992195"
216,2,"14:22",862,"Geno Luzcando made Layup. Assisted by Kyle Ingram.",50,33,"Youngstown State","Idaho State",4.5,"400992195"
217,2,"14:05",845,"Garrett Covington missed Jumper.",50,33,"Youngstown State","Idaho State",4.5,"400992195"
218,2,"14:05",845,"Novak Topalovic Block.",50,33,"Youngstown State","Idaho State",4.5,"400992195"
219,2,"14:05",845,"Geno Luzcando Defensive Rebound.",50,33,"Youngstown State","Idaho State",4.5,"400992195"
220,2,"14:02",842,"Geno Luzcando made Layup.",52,33,"Youngstown State","Idaho State",4.5,"400992195"
221,2,"14:02",842,"Foul on Braun Hartfield.",52,33,"Youngstown State","Idaho State",4.5,"400992195"
222,2,"14:02",842,"Geno Luzcando missed Free Throw.",52,33,"Youngstown State","Idaho State",4.5,"400992195"
223,2,"14:02",842,"Jeremiah Ferguson Defensive Rebound.",52,33,"Youngstown State","Idaho State",4.5,"400992195"
224,2,"13:50",830,"Michael Akuchie missed Three Point Jumper.",52,33,"Youngstown State","Idaho State",4.5,"400992195"
225,2,"13:50",830,"Brandon Boyd Defensive Rebound.",52,33,"Youngstown State","Idaho State",4.5,"400992195"
226,2,"13:45",825,"Foul on Jeremiah Ferguson.",52,33,"Youngstown State","Idaho State",4.5,"400992195"
227,2,"13:28",808,"Geno Luzcando made Layup.",54,33,"Youngstown State","Idaho State",4.5,"400992195"
228,2,"13:10",790,"Noe Anabir Turnover.",54,33,"Youngstown State","Idaho State",4.5,"400992195"
229,2,"13:08",788,"Geno Luzcando Steal.",54,33,"Youngstown State","Idaho State",4.5,"400992195"
230,2,"12:58",778,"Novak Topalovic missed Layup.",54,33,"Youngstown State","Idaho State",4.5,"400992195"
231,2,"12:58",778,"Noe Anabir Defensive Rebound.",54,33,"Youngstown State","Idaho State",4.5,"400992195"
232,2,"12:49",769,"Garrett Covington missed Jumper.",54,33,"Youngstown State","Idaho State",4.5,"400992195"
233,2,"12:49",769,"Garrett Covington Offensive Rebound.",54,33,"Youngstown State","Idaho State",4.5,"400992195"
234,2,"12:45",765,"Garrett Covington made Layup.",54,35,"Youngstown State","Idaho State",4.5,"400992195"
235,2,"12:17",737,"Foul on Michael Akuchie.",54,35,"Youngstown State","Idaho State",4.5,"400992195"
236,2,"12:17",737,"Geno Luzcando made Free Throw.",55,35,"Youngstown State","Idaho State",4.5,"400992195"
237,2,"12:17",737,"Geno Luzcando made Free Throw.",56,35,"Youngstown State","Idaho State",4.5,"400992195"
238,2,"12:00",720,"Tyree Robinson missed Layup.",56,35,"Youngstown State","Idaho State",4.5,"400992195"
239,2,"12:00",720,"Michael Akuchie Offensive Rebound.",56,35,"Youngstown State","Idaho State",4.5,"400992195"
240,2,"11:56",716,"Foul on Geno Luzcando.",56,35,"Youngstown State","Idaho State",4.5,"400992195"
241,2,"11:56",716,"Official TV Timeout",56,35,"Youngstown State","Idaho State",4.5,"400992195"
242,2,"11:56",716,"Michael Akuchie made Free Throw.",56,36,"Youngstown State","Idaho State",4.5,"400992195"
243,2,"11:56",716,"Michael Akuchie made Free Throw.",56,37,"Youngstown State","Idaho State",4.5,"400992195"
244,2,"11:41",701,"Jacob McCord made Layup.",58,37,"Youngstown State","Idaho State",4.5,"400992195"
245,2,"11:30",690,"Garrett Covington missed Jumper.",58,37,"Youngstown State","Idaho State",4.5,"400992195"
246,2,"11:30",690,"Jacob McCord Defensive Rebound.",58,37,"Youngstown State","Idaho State",4.5,"400992195"
247,2,"10:59",659,"Balint Mocsan made Three Point Jumper. Assisted by Geno Luzcando.",61,37,"Youngstown State","Idaho State",4.5,"400992195"
248,2,"10:50",650,"Foul on Geno Luzcando.",61,37,"Youngstown State","Idaho State",4.5,"400992195"
249,2,"10:25",625,"Jaylen Benton Turnover.",61,37,"Youngstown State","Idaho State",4.5,"400992195"
250,2,"10:11",611,"Foul on Jacob Brown.",61,37,"Youngstown State","Idaho State",4.5,"400992195"
251,2,"10:11",611,"Jacob McCord missed Free Throw.",61,37,"Youngstown State","Idaho State",4.5,"400992195"
252,2,"10:11",611,"Idaho State Deadball Team Rebound.",61,37,"Youngstown State","Idaho State",4.5,"400992195"
253,2,"10:11",611,"Jacob McCord made Free Throw.",62,37,"Youngstown State","Idaho State",4.5,"400992195"
254,2,"9:47",587,"Jaylen Benton missed Jumper.",62,37,"Youngstown State","Idaho State",4.5,"400992195"
255,2,"9:47",587,"Kyle Ingram Defensive Rebound.",62,37,"Youngstown State","Idaho State",4.5,"400992195"
256,2,"9:40",580,"Foul on Jaylen Benton.",62,37,"Youngstown State","Idaho State",4.5,"400992195"
257,2,"9:40",580,"Sam Dowd missed Free Throw.",62,37,"Youngstown State","Idaho State",4.5,"400992195"
258,2,"9:40",580,"Naz Bohannon Defensive Rebound.",62,37,"Youngstown State","Idaho State",4.5,"400992195"
259,2,"9:33",573,"Michael Akuchie missed Three Point Jumper.",62,37,"Youngstown State","Idaho State",4.5,"400992195"
260,2,"9:33",573,"Gary Chivichyan Defensive Rebound.",62,37,"Youngstown State","Idaho State",4.5,"400992195"
261,2,"9:28",568,"Sam Dowd Turnover.",62,37,"Youngstown State","Idaho State",4.5,"400992195"
262,2,"9:22",562,"Garrett Covington made Layup.",62,39,"Youngstown State","Idaho State",4.5,"400992195"
263,2,"8:50",530,"Jacob McCord Turnover.",62,39,"Youngstown State","Idaho State",4.5,"400992195"
264,2,"8:33",513,"Jeremiah Ferguson made Layup.",62,41,"Youngstown State","Idaho State",4.5,"400992195"
265,2,"8:02",482,"Foul on Garrett Covington.",62,41,"Youngstown State","Idaho State",4.5,"400992195"
266,2,"8:02",482,"Brandon Boyd missed Free Throw.",62,41,"Youngstown State","Idaho State",4.5,"400992195"
267,2,"8:02",482,"Idaho State Deadball Team Rebound.",62,41,"Youngstown State","Idaho State",4.5,"400992195"
268,2,"8:02",482,"Brandon Boyd made Free Throw.",63,41,"Youngstown State","Idaho State",4.5,"400992195"
269,2,"7:52",472,"Michael Akuchie missed Three Point Jumper.",63,41,"Youngstown State","Idaho State",4.5,"400992195"
270,2,"7:52",472,"Sam Dowd Defensive Rebound.",63,41,"Youngstown State","Idaho State",4.5,"400992195"
271,2,"7:45",465,"Foul on Jeremiah Ferguson.",63,41,"Youngstown State","Idaho State",4.5,"400992195"
272,2,"7:45",465,"Official TV Timeout",63,41,"Youngstown State","Idaho State",4.5,"400992195"
273,2,"7:45",465,"Jacob McCord made Free Throw.",64,41,"Youngstown State","Idaho State",4.5,"400992195"
274,2,"7:45",465,"Jacob McCord made Free Throw.",65,41,"Youngstown State","Idaho State",4.5,"400992195"
275,2,"7:37",457,"Foul on Jacob McCord.",65,41,"Youngstown State","Idaho State",4.5,"400992195"
276,2,"7:32",452,"Foul on Kyle Ingram.",65,41,"Youngstown State","Idaho State",4.5,"400992195"
277,2,"7:27",447,"Devin Haygood made Jumper.",65,43,"Youngstown State","Idaho State",4.5,"400992195"
278,2,"7:11",431,"Gary Chivichyan missed Layup.",65,43,"Youngstown State","Idaho State",4.5,"400992195"
279,2,"7:11",431,"Jacob Brown Defensive Rebound.",65,43,"Youngstown State","Idaho State",4.5,"400992195"
280,2,"7:02",422,"Naz Bohannon missed Three Point Jumper.",65,43,"Youngstown State","Idaho State",4.5,"400992195"
281,2,"7:02",422,"Gary Chivichyan Defensive Rebound.",65,43,"Youngstown State","Idaho State",4.5,"400992195"
282,2,"6:52",412,"Brandon Boyd made Three Point Jumper. Assisted by Sam Dowd.",68,43,"Youngstown State","Idaho State",4.5,"400992195"
283,2,"6:33",393,"Jeremiah Ferguson missed Layup.",68,43,"Youngstown State","Idaho State",4.5,"400992195"
284,2,"6:33",393,"Sam Dowd Defensive Rebound.",68,43,"Youngstown State","Idaho State",4.5,"400992195"
285,2,"6:28",388,"Gary Chivichyan made Layup. Assisted by Sam Dowd.",70,43,"Youngstown State","Idaho State",4.5,"400992195"
286,2,"6:05",365,"Naz Bohannon made Jumper. Assisted by Jeremiah Ferguson.",70,45,"Youngstown State","Idaho State",4.5,"400992195"
287,2,"5:49",349,"Gary Chivichyan missed Three Point Jumper.",70,45,"Youngstown State","Idaho State",4.5,"400992195"
288,2,"5:49",349,"Devin Haygood Defensive Rebound.",70,45,"Youngstown State","Idaho State",4.5,"400992195"
289,2,"5:40",340,"Jeremiah Ferguson made Layup.",70,47,"Youngstown State","Idaho State",4.5,"400992195"
290,2,"5:33",333,"Idaho State  Timeout",70,47,"Youngstown State","Idaho State",4.5,"400992195"
291,2,"5:33",333,"Official TV Timeout",70,47,"Youngstown State","Idaho State",4.5,"400992195"
292,2,"5:14",314,"Brandon Boyd missed Three Point Jumper.",70,47,"Youngstown State","Idaho State",4.5,"400992195"
293,2,"5:14",314,"Naz Bohannon Defensive Rebound.",70,47,"Youngstown State","Idaho State",4.5,"400992195"
294,2,"4:55",295,"Foul on Novak Topalovic.",70,47,"Youngstown State","Idaho State",4.5,"400992195"
295,2,"4:52",292,"Jaylen Benton made Three Point Jumper. Assisted by Tyree Robinson.",70,50,"Youngstown State","Idaho State",4.5,"400992195"
296,2,"4:40",280,"Foul on Michael Akuchie.",70,50,"Youngstown State","Idaho State",4.5,"400992195"
297,2,"4:40",280,"Sam Dowd made Free Throw.",71,50,"Youngstown State","Idaho State",4.5,"400992195"
298,2,"4:40",280,"Sam Dowd made Free Throw.",72,50,"Youngstown State","Idaho State",4.5,"400992195"
299,2,"4:31",271,"Jaylen Benton Turnover.",72,50,"Youngstown State","Idaho State",4.5,"400992195"
300,2,"4:15",255,"Erik Nakken made Three Point Jumper.",75,50,"Youngstown State","Idaho State",4.5,"400992195"
301,2,"3:54",234,"Jaylen Benton made Jumper.",75,52,"Youngstown State","Idaho State",4.5,"400992195"
302,2,"3:37",217,"Foul on Naz Bohannon.",75,52,"Youngstown State","Idaho State",4.5,"400992195"
303,2,"3:37",217,"Official TV Timeout",75,52,"Youngstown State","Idaho State",4.5,"400992195"
304,2,"3:37",217,"Novak Topalovic missed Free Throw.",75,52,"Youngstown State","Idaho State",4.5,"400992195"
305,2,"3:37",217,"Idaho State Deadball Team Rebound.",75,52,"Youngstown State","Idaho State",4.5,"400992195"
306,2,"3:37",217,"Novak Topalovic made Free Throw.",76,52,"Youngstown State","Idaho State",4.5,"400992195"
307,2,"3:35",215,"Erik Nakken made Three Point Jumper. Assisted by Gary Chivichyan.",79,52,"Youngstown State","Idaho State",4.5,"400992195"
308,2,"3:19",199,"Foul on Lyle Sutton.",79,52,"Youngstown State","Idaho State",4.5,"400992195"
309,2,"3:19",199,"Jaylen Benton made Free Throw.",79,53,"Youngstown State","Idaho State",4.5,"400992195"
310,2,"3:19",199,"Jaylen Benton missed Free Throw.",79,53,"Youngstown State","Idaho State",4.5,"400992195"
311,2,"3:19",199,"Sam Dowd Defensive Rebound.",79,53,"Youngstown State","Idaho State",4.5,"400992195"
312,2,"3:00",180,"Gary Chivichyan made Layup.",81,53,"Youngstown State","Idaho State",4.5,"400992195"
313,2,"2:58",178,"Foul on Braun Hartfield.",81,53,"Youngstown State","Idaho State",4.5,"400992195"
314,2,"2:58",178,"Gary Chivichyan missed Free Throw.",81,53,"Youngstown State","Idaho State",4.5,"400992195"
315,2,"2:58",178,"Tyree Robinson Defensive Rebound.",81,53,"Youngstown State","Idaho State",4.5,"400992195"
316,2,"2:47",167,"Foul on Lyle Sutton.",81,53,"Youngstown State","Idaho State",4.5,"400992195"
317,2,"2:47",167,"Tyree Robinson missed Free Throw.",81,53,"Youngstown State","Idaho State",4.5,"400992195"
318,2,"2:47",167,"Youngstown State Deadball Team Rebound.",81,53,"Youngstown State","Idaho State",4.5,"400992195"
319,2,"2:47",167,"Tyree Robinson made Free Throw.",81,54,"Youngstown State","Idaho State",4.5,"400992195"
320,2,"2:39",159,"Blake Truman made Three Point Jumper. Assisted by Sam Dowd.",84,54,"Youngstown State","Idaho State",4.5,"400992195"
321,2,"2:23",143,"Michael Akuchie made Three Point Jumper. Assisted by Jaylen Benton.",84,57,"Youngstown State","Idaho State",4.5,"400992195"
322,2,"2:09",129,"Foul on Jaylen Benton.",84,57,"Youngstown State","Idaho State",4.5,"400992195"
323,2,"2:09",129,"Sam Dowd made Free Throw.",85,57,"Youngstown State","Idaho State",4.5,"400992195"
324,2,"2:09",129,"Sam Dowd made Free Throw.",86,57,"Youngstown State","Idaho State",4.5,"400992195"
325,2,"1:54",114,"Naz Bohannon Turnover.",86,57,"Youngstown State","Idaho State",4.5,"400992195"
326,2,"1:53",113,"Blake Truman Steal.",86,57,"Youngstown State","Idaho State",4.5,"400992195"
327,2,"1:50",110,"Sam Dowd missed Three Point Jumper.",86,57,"Youngstown State","Idaho State",4.5,"400992195"
328,2,"1:50",110,"Tyree Robinson Defensive Rebound.",86,57,"Youngstown State","Idaho State",4.5,"400992195"
329,2,"1:33",93,"Dan Ritter missed Three Point Jumper.",86,57,"Youngstown State","Idaho State",4.5,"400992195"
330,2,"1:33",93,"Blake Truman Defensive Rebound.",86,57,"Youngstown State","Idaho State",4.5,"400992195"
331,2,"1:19",79,"Jacob McCord missed Jumper.",86,57,"Youngstown State","Idaho State",4.5,"400992195"
332,2,"1:19",79,"Tyree Robinson Defensive Rebound.",86,57,"Youngstown State","Idaho State",4.5,"400992195"
333,2,"1:12",72,"Jaylen Benton made Three Point Jumper. Assisted by Dan Ritter.",86,60,"Youngstown State","Idaho State",4.5,"400992195"
334,2,"0:53",53,"Lyle Sutton Turnover.",86,60,"Youngstown State","Idaho State",4.5,"400992195"
335,2,"0:52",52,"Tyree Robinson Steal.",86,60,"Youngstown State","Idaho State",4.5,"400992195"
336,2,"0:49",49,"Tyree Robinson made Dunk. Assisted by Jaylen Benton.",86,62,"Youngstown State","Idaho State",4.5,"400992195"
337,2,"0:28",28,"Jacob McCord missed Layup.",86,62,"Youngstown State","Idaho State",4.5,"400992195"
338,2,"0:28",28,"Sam Dowd Offensive Rebound.",86,62,"Youngstown State","Idaho State",4.5,"400992195"
339,2,"0:26",26,"Sam Dowd Turnover.",86,62,"Youngstown State","Idaho State",4.5,"400992195"
340,2,"0:23",23,"Dan Ritter Steal.",86,62,"Youngstown State","Idaho State",4.5,"400992195"
341,2,"0:16",16,"Naz Bohannon missed Jumper.",86,62,"Youngstown State","Idaho State",4.5,"400992195"
342,2,"0:16",16,"Jacob McCord Defensive Rebound.",86,62,"Youngstown State","Idaho State",4.5,"400992195"
343,2,"0:00",0,"End of Game",86,62,"Youngstown State","Idaho State",4.5,"400992195"
1,1,"20:00",2400,"PLAY",0,0,"Idaho State","BYU",19.5,"400986857"
2,1,"19:36",2376,"Yoeli Childs made Jumper.",2,0,"Idaho State","BYU",19.5,"400986857"
3,1,"19:15",2355,"Novak Topalovic made Jumper.",2,2,"Idaho State","BYU",19.5,"400986857"
4,1,"19:00",2340,"Yoeli Childs missed Jumper.",2,2,"Idaho State","BYU",19.5,"400986857"
5,1,"19:00",2340,"Novak Topalovic Defensive Rebound.",2,2,"Idaho State","BYU",19.5,"400986857"
6,1,"18:49",2329,"Jared Stutzman made Layup. Assisted by Kyle Ingram.",2,4,"Idaho State","BYU",19.5,"400986857"
7,1,"18:20",2300,"Yoeli Childs missed Jumper.",2,4,"Idaho State","BYU",19.5,"400986857"
8,1,"18:20",2300,"Kyle Ingram Block.",2,4,"Idaho State","BYU",19.5,"400986857"
9,1,"18:16",2296,"Kyle Ingram Defensive Rebound.",2,4,"Idaho State","BYU",19.5,"400986857"
10,1,"17:54",2274,"Geno Luzcando Turnover.",2,4,"Idaho State","BYU",19.5,"400986857"
