"play_id","half","time_remaining_half","secs_remaining","description","home_score","away_score","away","home","home_favored_by","game_id"
53,1,"12:56",1976,"Tavrion Dawson Turnover.",7,10,"CSU Northridge","Idaho State",2.5,"400992399"
54,1,"12:55",1975,"Balint Mocsan Steal.",7,10,"CSU Northridge","Idaho State",2.5,"400992399"
55,1,"12:42",1962,"Foul on Novak Topalovic.",7,10,"CSU Northridge","Idaho State",2.5,"400992399"
56,1,"12:42",1962,"Novak Topalovic Turnover.",7,10,"CSU Northridge","Idaho State",2.5,"400992399"
57,1,"12:28",1948,"Mahamadou Kaba-Camara made Dunk. Assisted by Lyrik Shreiner.",7,12,"CSU Northridge","Idaho State",2.5,"400992399"
58,1,"12:08",1928,"Brandon Boyd made Three Point Jumper. Assisted by Geno Luzcando.",10,12,"CSU Northridge","Idaho State",2.5,"400992399"
59,1,"11:53",1913,"Micheal Warren missed Three Point Jumper.",10,12,"CSU Northridge","Idaho State",2.5,"400992399"
60,1,"11:53",1913,"CSU Northridge Deadball Team Rebound.",10,12,"CSU Northridge","Idaho State",2.5,"400992399"
61,1,"11:52",1912,"Micheal Warren made Free Throw.",10,13,"CSU Northridge","Idaho State",2.5,"400992399"
62,1,"11:52",1912,"Official TV Timeout",10,12,"CSU Northridge","Idaho State",2.5,"400992399"
63,1,"11:52",1912,"Foul on Kyle Ingram.",10,12,"CSU Northridge","Idaho State",2.5,"400992399"
64,1,"11:52",1912,"Micheal Warren missed Free Throw.",10,12,"CSU Northridge","Idaho State",2.5,"400992399"
65,1,"11:52",1912,"CSU Northridge Deadball Team Rebound.",10,12,"CSU Northridge","Idaho State",2.5,"400992399"
66,1,"11:52",1912,"Micheal Warren made Free Throw.",10,14,"CSU Northridge","Idaho State",2.5,"400992399"
67,1,"11:42",1902,"Balint Mocsan made Three Point Jumper. Assisted by Kyle Ingram.",13,14,"CSU Northridge","Idaho State",2.5,"400992399"
68,1,"11:18",1878,"Mahamadou Kaba-Camara made Layup.",13,16,"CSU Northridge","Idaho State",2.5,"400992399"
69,1,"10:57",1857,"Erik Nakken missed Three Point Jumper.",13,16,"CSU Northridge","Idaho State",2.5,"400992399"
70,1,"10:57",1857,"Kyle Ingram Offensive Rebound.",13,16,"CSU Northridge","Idaho State",2.5,"400992399"
71,1,"10:50",1850,"Erik Nakken missed Three Point Jumper.",13,16,"CSU Northridge","Idaho State",2.5,"400992399"
72,1,"10:50",1850,"Micheal Warren Defensive Rebound.",13,16,"CSU Northridge","Idaho State",2.5,"400992399"
73,1,"10:32",1832,"Terrell Gomez missed Layup.",13,16,"CSU Northridge","Idaho State",2.5,"400992399"
74,1,"10:32",1832,"Mahamadou Kaba-Camara Offensive Rebound.",13,16,"CSU Northridge","Idaho State",2.5,"400992399"
75,1,"10:26",1826,"Terrell Gomez missed Three Point Jumper.",13,16,"CSU Northridge","Idaho State",2.5,"400992399"
76,1,"10:26",1826,"Balint Mocsan Defensive Rebound.",13,16,"CSU Northridge","Idaho State",2.5,"400992399"
77,1,"10:15",1815,"Kyle Ingram missed Jumper.",13,16,"CSU Northridge","Idaho State",2.5,"400992399"
78,1,"10:15",1815,"Carl Brown Defensive Rebound.",13,16,"CSU Northridge","Idaho State",2.5,"400992399"
79,1,"10:01",1801,"Tavrion Dawson missed Jumper.",13,16,"CSU Northridge","Idaho State",2.5,"400992399"
80,1,"10:01",1801,"Kyle Ingram Block.",13,16,"CSU Northridge","Idaho State",2.5,"400992399"
81,1,"9:58",1798,"Brandon Boyd Defensive Rebound.",13,16,"CSU Northridge","Idaho State",2.5,"400992399"
82,1,"9:53",1793,"Geno Luzcando missed Layup.",13,16,"CSU Northridge","Idaho State",2.5,"400992399"
83,1,"9:53",1793,"Balint Mocsan Offensive Rebound.",13,16,"CSU Northridge","Idaho State",2.5,"400992399"
84,1,"9:40",1780,"Balint Mocsan made Three Point Jumper.",16,16,"CSU Northridge","Idaho State",2.5,"400992399"
85,1,"9:32",1772,"Tavrion Dawson Turnover.",16,16,"CSU Northridge","Idaho State",2.5,"400992399"
86,1,"9:32",1772,"Geno Luzcando Steal.",16,16,"CSU Northridge","Idaho State",2.5,"400992399"
87,1,"9:32",1772,"Foul on Tavrion Dawson.",16,16,"CSU Northridge","Idaho State",2.5,"400992399"
88,1,"9:22",1762,"Balint Mocsan Turnover.",16,16,"CSU Northridge","Idaho State",2.5,"400992399"
89,1,"9:17",1757,"Lyrik Shreiner made Layup.",16,18,"CSU Northridge","Idaho State",2.5,"400992399"
90,1,"9:05",1745,"Foul on Reggie Theus Jr..",16,18,"CSU Northridge","Idaho State",2.5,"400992399"
91,1,"8:44",1724,"Sam Dowd missed Three Point Jumper.",16,18,"CSU Northridge","Idaho State",2.5,"400992399"
92,1,"8:44",1724,"Micheal Warren Defensive Rebound.",16,18,"CSU Northridge","Idaho State",2.5,"400992399"
93,1,"8:29",1709,"Foul on Lyrik Shreiner.",16,18,"CSU Northridge","Idaho State",2.5,"400992399"
94,1,"8:29",1709,"Lyrik Shreiner Turnover.",16,18,"CSU Northridge","Idaho State",2.5,"400992399"
95,1,"8:07",1687,"Jared Stutzman made Three Point Jumper. Assisted by Gary Chivichyan.",19,18,"CSU Northridge","Idaho State",2.5,"400992399"
96,1,"7:45",1665,"Reggie Theus Jr. made Layup. Assisted by Jonathan Guevara.",19,20,"CSU Northridge","Idaho State",2.5,"400992399"
97,1,"7:31",1651,"Official TV Timeout",19,20,"CSU Northridge","Idaho State",2.5,"400992399"
98,1,"7:16",1636,"Foul on Micheal Warren.",19,20,"CSU Northridge","Idaho State",2.5,"400992399"
99,1,"7:16",1636,"Balint Mocsan made Free Throw.",20,20,"CSU Northridge","Idaho State",2.5,"400992399"
100,1,"7:16",1636,"Balint Mocsan missed Free Throw.",20,20,"CSU Northridge","Idaho State",2.5,"400992399"
101,1,"7:16",1636,"Micheal Warren Defensive Rebound.",20,20,"CSU Northridge","Idaho State",2.5,"400992399"
102,1,"7:07",1627,"Jonathan Guevara Turnover.",20,20,"CSU Northridge","Idaho State",2.5,"400992399"
103,1,"7:05",1625,"Balint Mocsan Steal.",20,20,"CSU Northridge","Idaho State",2.5,"400992399"
104,1,"7:03",1623,"Balint Mocsan made Layup.",22,20,"CSU Northridge","Idaho State",2.5,"400992399"
105,1,"6:41",1601,"Reggie Theus Jr. made Jumper.",22,22,"CSU Northridge","Idaho State",2.5,"400992399"
106,1,"6:26",1586,"Gary Chivichyan missed Three Point Jumper.",22,22,"CSU Northridge","Idaho State",2.5,"400992399"
107,1,"6:26",1586,"Lyrik Shreiner Defensive Rebound.",22,22,"CSU Northridge","Idaho State",2.5,"400992399"
108,1,"6:07",1567,"Foul on Balint Mocsan.",22,22,"CSU Northridge","Idaho State",2.5,"400992399"
109,1,"6:07",1567,"Lyrik Shreiner made Free Throw.",22,23,"CSU Northridge","Idaho State",2.5,"400992399"
110,1,"6:07",1567,"Lyrik Shreiner made Free Throw.",22,24,"CSU Northridge","Idaho State",2.5,"400992399"
111,1,"5:51",1551,"Jared Stutzman missed Three Point Jumper.",22,24,"CSU Northridge","Idaho State",2.5,"400992399"
112,1,"5:51",1551,"Lyrik Shreiner Defensive Rebound.",22,24,"CSU Northridge","Idaho State",2.5,"400992399"
113,1,"5:41",1541,"Foul on Reggie Theus Jr..",22,24,"CSU Northridge","Idaho State",2.5,"400992399"
114,1,"5:41",1541,"Reggie Theus Jr. Turnover.",22,24,"CSU Northridge","Idaho State",2.5,"400992399"
115,1,"5:19",1519,"Sam Dowd missed Jumper.",22,24,"CSU Northridge","Idaho State",2.5,"400992399"
116,1,"5:19",1519,"Blake Truman Offensive Rebound.",22,24,"CSU Northridge","Idaho State",2.5,"400992399"
117,1,"5:11",1511,"Jared Stutzman missed Three Point Jumper.",22,24,"CSU Northridge","Idaho State",2.5,"400992399"
118,1,"5:11",1511,"Micheal Warren Defensive Rebound.",22,24,"CSU Northridge","Idaho State",2.5,"400992399"
119,1,"5:06",1506,"Micheal Warren made Layup.",22,26,"CSU Northridge","Idaho State",2.5,"400992399"
120,1,"4:52",1492,"Gary Chivichyan missed Three Point Jumper.",22,26,"CSU Northridge","Idaho State",2.5,"400992399"
121,1,"4:52",1492,"Reggie Theus Jr. Defensive Rebound.",22,26,"CSU Northridge","Idaho State",2.5,"400992399"
122,1,"4:33",1473,"Terrell Gomez Turnover.",22,26,"CSU Northridge","Idaho State",2.5,"400992399"
123,1,"4:29",1469,"Gary Chivichyan missed Three Point Jumper.",22,26,"CSU Northridge","Idaho State",2.5,"400992399"
124,1,"4:29",1469,"Terrell Gomez Defensive Rebound.",22,26,"CSU Northridge","Idaho State",2.5,"400992399"
125,1,"4:23",1463,"Lyrik Shreiner made Layup. Assisted by Terrell Gomez.",22,28,"CSU Northridge","Idaho State",2.5,"400992399"
126,1,"4:10",1450,"Geno Luzcando made Layup.",24,28,"CSU Northridge","Idaho State",2.5,"400992399"
127,1,"3:53",1433,"Foul on Geno Luzcando.",24,28,"CSU Northridge","Idaho State",2.5,"400992399"
128,1,"3:53",1433,"Official TV Timeout",24,28,"CSU Northridge","Idaho State",2.5,"400992399"
129,1,"3:53",1433,"Tavrion Dawson made Free Throw.",24,29,"CSU Northridge","Idaho State",2.5,"400992399"
130,1,"3:53",1433,"Tavrion Dawson made Free Throw.",24,30,"CSU Northridge","Idaho State",2.5,"400992399"
131,1,"3:53",1433,"Lyle Sutton Turnover.",24,30,"CSU Northridge","Idaho State",2.5,"400992399"
132,1,"3:53",1433,"Micheal Warren Steal.",24,30,"CSU Northridge","Idaho State",2.5,"400992399"
133,1,"3:46",1426,"Carl Brown Turnover.",24,30,"CSU Northridge","Idaho State",2.5,"400992399"
134,1,"3:43",1423,"Geno Luzcando Steal.",24,30,"CSU Northridge","Idaho State",2.5,"400992399"
135,1,"3:30",1410,"Foul on Tavrion Dawson.",24,30,"CSU Northridge","Idaho State",2.5,"400992399"
136,1,"3:12",1392,"Lyle Sutton made Free Throw.",25,30,"CSU Northridge","Idaho State",2.5,"400992399"
137,1,"3:12",1392,"Lyle Sutton missed Free Throw.",25,30,"CSU Northridge","Idaho State",2.5,"400992399"
138,1,"3:12",1392,"Blake Truman Offensive Rebound.",25,30,"CSU Northridge","Idaho State",2.5,"400992399"
139,1,"2:52",1372,"Geno Luzcando missed Jumper.",25,30,"CSU Northridge","Idaho State",2.5,"400992399"
140,1,"2:52",1372,"Geno Luzcando Offensive Rebound.",25,30,"CSU Northridge","Idaho State",2.5,"400992399"
141,1,"2:43",1363,"Foul on Mahamadou Kaba-Camara.",25,30,"CSU Northridge","Idaho State",2.5,"400992399"
142,1,"2:43",1363,"Geno Luzcando made Free Throw.",26,30,"CSU Northridge","Idaho State",2.5,"400992399"
143,1,"2:43",1363,"Geno Luzcando made Free Throw.",27,30,"CSU Northridge","Idaho State",2.5,"400992399"
144,1,"2:29",1349,"Micheal Warren missed Three Point Jumper.",27,30,"CSU Northridge","Idaho State",2.5,"400992399"
145,1,"2:29",1349,"Carl Brown Offensive Rebound.",27,30,"CSU Northridge","Idaho State",2.5,"400992399"
146,1,"2:17",1337,"Foul on Geno Luzcando.",27,30,"CSU Northridge","Idaho State",2.5,"400992399"
147,1,"2:17",1337,"Mahamadou Kaba-Camara missed Free Throw.",27,30,"CSU Northridge","Idaho State",2.5,"400992399"
148,1,"2:17",1337,"CSU Northridge Deadball Team Rebound.",27,30,"CSU Northridge","Idaho State",2.5,"400992399"
149,1,"2:17",1337,"Mahamadou Kaba-Camara missed Free Throw.",27,30,"CSU Northridge","Idaho State",2.5,"400992399"
150,1,"2:17",1337,"Jared Stutzman Defensive Rebound.",27,30,"CSU Northridge","Idaho State",2.5,"400992399"
151,1,"2:03",1323,"Blake Truman missed Three Point Jumper.",27,30,"CSU Northridge","Idaho State",2.5,"400992399"
152,1,"2:03",1323,"Micheal Warren Defensive Rebound.",27,30,"CSU Northridge","Idaho State",2.5,"400992399"
153,1,"1:33",1293,"Terrell Gomez made Layup.",27,32,"CSU Northridge","Idaho State",2.5,"400992399"
154,1,"1:19",1279,"Foul on Micheal Warren.",27,32,"CSU Northridge","Idaho State",2.5,"400992399"
155,1,"1:19",1279,"Brandon Boyd made Free Throw.",28,32,"CSU Northridge","Idaho State",2.5,"400992399"
156,1,"1:19",1279,"Brandon Boyd made Free Throw.",29,32,"CSU Northridge","Idaho State",2.5,"400992399"
157,1,"1:19",1279,"Brandon Boyd made Free Throw.",30,32,"CSU Northridge","Idaho State",2.5,"400992399"
158,1,"1:19",1279,"CSU Northridge  Timeout",30,32,"CSU Northridge","Idaho State",2.5,"400992399"
159,1,"0:58",1258,"Carl Brown missed Three Point Jumper.",30,32,"CSU Northridge","Idaho State",2.5,"400992399"
160,1,"0:58",1258,"Anthony Swan Offensive Rebound.",30,32,"CSU Northridge","Idaho State",2.5,"400992399"
161,1,"0:53",1253,"Terrell Gomez made Three Point Jumper. Assisted by Anthony Swan.",30,35,"CSU Northridge","Idaho State",2.5,"400992399"
162,1,"0:35",1235,"Erik Nakken missed Three Point Jumper.",30,35,"CSU Northridge","Idaho State",2.5,"400992399"
163,1,"0:35",1235,"Micheal Warren Defensive Rebound.",30,35,"CSU Northridge","Idaho State",2.5,"400992399"
164,1,"0:06",1206,"Micheal Warren missed Three Point Jumper.",30,35,"CSU Northridge","Idaho State",2.5,"400992399"
165,1,"0:06",1206,"Sam Dowd Defensive Rebound.",30,35,"CSU Northridge","Idaho State",2.5,"400992399"
166,1,"0:05",1205,"Idaho State  Timeout",30,35,"CSU Northridge","Idaho State",2.5,"400992399"
167,1,"0:02",1202,"Jared Stutzman missed Layup.",30,35,"CSU Northridge","Idaho State",2.5,"400992399"
168,1,"0:02",1202,"Micheal Warren Block.",30,35,"CSU Northridge","Idaho State",2.5,"400992399"
169,1,"0:02",1202,"Idaho State Offensive Rebound.",30,35,"CSU Northridge","Idaho State",2.5,"400992399"
170,1,"0:00",1200,"End of 1st half",30,35,"CSU Northridge","Idaho State",2.5,"400992399"
171,2,"20:00",1200,"PLAY",30,35,"CSU Northridge","Idaho State",2.5,"400992399"
172,2,"19:45",1185,"Lyrik Shreiner Turnover.",30,35,"CSU Northridge","Idaho State",2.5,"400992399"
173,2,"19:40",1180,"Brandon Boyd Turnover.",30,35,"CSU Northridge","Idaho State",2.5,"400992399"
174,2,"19:39",1179,"Terrell Gomez Steal.",30,35,"CSU Northridge","Idaho State",2.5,"400992399"
175,2,"19:34",1174,"Lyrik Shreiner missed Jumper.",30,35,"CSU Northridge","Idaho State",2.5,"400992399"
176,2,"19:34",1174,"Tavrion Dawson Offensive Rebound.",30,35,"CSU Northridge","Idaho State",2.5,"400992399"
177,2,"19:31",1171,"Tavrion Dawson missed Jumper.",30,35,"CSU Northridge","Idaho State",2.5,"400992399"
178,2,"19:31",1171,"Brandon Boyd Defensive Rebound.",30,35,"CSU Northridge","Idaho State",2.5,"400992399"
179,2,"19:25",1165,"Brandon Boyd missed Layup.",30,35,"CSU Northridge","Idaho State",2.5,"400992399"
180,2,"19:25",1165,"Micheal Warren Defensive Rebound.",30,35,"CSU Northridge","Idaho State",2.5,"400992399"
181,2,"19:15",1155,"Zeno Lake made Jumper. Assisted by Tavrion Dawson.",30,37,"CSU Northridge","Idaho State",2.5,"400992399"
182,2,"18:54",1134,"Jared Stutzman made Three Point Jumper. Assisted by Geno Luzcando.",33,37,"CSU Northridge","Idaho State",2.5,"400992399"
183,2,"18:29",1109,"Foul on Brandon Boyd.",33,37,"CSU Northridge","Idaho State",2.5,"400992399"
184,2,"18:23",1103,"Tavrion Dawson Turnover.",33,37,"CSU Northridge","Idaho State",2.5,"400992399"
185,2,"18:21",1101,"Geno Luzcando Steal.",33,37,"CSU Northridge","Idaho State",2.5,"400992399"
186,2,"18:17",1097,"Jared Stutzman made Layup. Assisted by Geno Luzcando.",35,37,"CSU Northridge","Idaho State",2.5,"400992399"
187,2,"18:14",1094,"CSU Northridge  Timeout",35,37,"CSU Northridge","Idaho State",2.5,"400992399"
188,2,"18:04",1084,"Micheal Warren Turnover.",35,37,"CSU Northridge","Idaho State",2.5,"400992399"
189,2,"18:02",1082,"Brandon Boyd Steal.",35,37,"CSU Northridge","Idaho State",2.5,"400992399"
190,2,"18:00",1080,"Brandon Boyd made Layup.",37,37,"CSU Northridge","Idaho State",2.5,"400992399"
191,2,"17:38",1058,"Terrell Gomez made Jumper.",37,39,"CSU Northridge","Idaho State",2.5,"400992399"
192,2,"17:11",1031,"Novak Topalovic made Layup.",39,39,"CSU Northridge","Idaho State",2.5,"400992399"
193,2,"16:53",1013,"Terrell Gomez missed Jumper.",39,39,"CSU Northridge","Idaho State",2.5,"400992399"
194,2,"16:53",1013,"Novak Topalovic Defensive Rebound.",39,39,"CSU Northridge","Idaho State",2.5,"400992399"
195,2,"16:45",1005,"Balint Mocsan made Three Point Jumper. Assisted by Jared Stutzman.",42,39,"CSU Northridge","Idaho State",2.5,"400992399"
196,2,"16:19",979,"Foul on Geno Luzcando.",42,39,"CSU Northridge","Idaho State",2.5,"400992399"
197,2,"16:15",975,"Micheal Warren made Layup. Assisted by Reggie Theus Jr..",42,41,"CSU Northridge","Idaho State",2.5,"400992399"
198,2,"16:15",975,"Foul on Novak Topalovic.",42,41,"CSU Northridge","Idaho State",2.5,"400992399"
199,2,"16:15",975,"Micheal Warren made Free Throw.",42,42,"CSU Northridge","Idaho State",2.5,"400992399"
200,2,"15:46",946,"Kyle Ingram missed Jumper.",42,42,"CSU Northridge","Idaho State",2.5,"400992399"
201,2,"15:46",946,"Micheal Warren Defensive Rebound.",42,42,"CSU Northridge","Idaho State",2.5,"400992399"
202,2,"15:43",943,"Lyrik Shreiner Turnover.",42,42,"CSU Northridge","Idaho State",2.5,"400992399"
203,2,"15:41",941,"Brandon Boyd Steal.",42,42,"CSU Northridge","Idaho State",2.5,"400992399"
204,2,"15:39",939,"Balint Mocsan made Three Point Jumper. Assisted by Brandon Boyd.",45,42,"CSU Northridge","Idaho State",2.5,"400992399"
205,2,"15:04",904,"Lyrik Shreiner made Jumper.",45,44,"CSU Northridge","Idaho State",2.5,"400992399"
206,2,"14:38",878,"Jared Stutzman missed Layup.",45,44,"CSU Northridge","Idaho State",2.5,"400992399"
207,2,"14:38",878,"Zeno Lake Block.",45,44,"CSU Northridge","Idaho State",2.5,"400992399"
208,2,"14:36",876,"Zeno Lake Defensive Rebound.",45,44,"CSU Northridge","Idaho State",2.5,"400992399"
209,2,"14:20",860,"Reggie Theus Jr. missed Jumper.",45,44,"CSU Northridge","Idaho State",2.5,"400992399"
210,2,"14:20",860,"Zeno Lake Offensive Rebound.",45,44,"CSU Northridge","Idaho State",2.5,"400992399"
211,2,"14:15",855,"Reggie Theus Jr. missed Jumper.",45,44,"CSU Northridge","Idaho State",2.5,"400992399"
212,2,"14:15",855,"Idaho State Defensive Rebound.",45,44,"CSU Northridge","Idaho State",2.5,"400992399"
213,2,"14:15",855,"Official TV Timeout",45,44,"CSU Northridge","Idaho State",2.5,"400992399"
214,2,"14:13",853,"Official TV Timeout",45,44,"CSU Northridge","Idaho State",2.5,"400992399"
215,2,"14:01",841,"Balint Mocsan made Three Point Jumper. Assisted by Kyle Ingram.",48,44,"CSU Northridge","Idaho State",2.5,"400992399"
216,2,"13:43",823,"Tavrion Dawson made Layup.",48,46,"CSU Northridge","Idaho State",2.5,"400992399"
217,2,"13:43",823,"Foul on Kyle Ingram.",48,46,"CSU Northridge","Idaho State",2.5,"400992399"
218,2,"13:43",823,"Tavrion Dawson made Free Throw.",48,47,"CSU Northridge","Idaho State",2.5,"400992399"
219,2,"13:22",802,"Balint Mocsan Turnover.",48,47,"CSU Northridge","Idaho State",2.5,"400992399"
220,2,"13:06",786,"Terrell Gomez missed Jumper.",48,47,"CSU Northridge","Idaho State",2.5,"400992399"
221,2,"13:06",786,"Kyle Ingram Defensive Rebound.",48,47,"CSU Northridge","Idaho State",2.5,"400992399"
222,2,"12:45",765,"Brandon Boyd missed Layup.",48,47,"CSU Northridge","Idaho State",2.5,"400992399"
223,2,"12:45",765,"Zeno Lake Defensive Rebound.",48,47,"CSU Northridge","Idaho State",2.5,"400992399"
224,2,"12:34",754,"Carl Brown missed Three Point Jumper.",48,47,"CSU Northridge","Idaho State",2.5,"400992399"
225,2,"12:34",754,"Brandon Boyd Defensive Rebound.",48,47,"CSU Northridge","Idaho State",2.5,"400992399"
226,2,"12:21",741,"Foul on Zeno Lake.",48,47,"CSU Northridge","Idaho State",2.5,"400992399"
227,2,"12:10",730,"Jared Stutzman made Layup.",50,47,"CSU Northridge","Idaho State",2.5,"400992399"
228,2,"11:54",714,"Tavrion Dawson missed Layup.",50,47,"CSU Northridge","Idaho State",2.5,"400992399"
229,2,"11:54",714,"Geno Luzcando Defensive Rebound.",50,47,"CSU Northridge","Idaho State",2.5,"400992399"
230,2,"11:43",703,"Foul on Mahamadou Kaba-Camara.",50,47,"CSU Northridge","Idaho State",2.5,"400992399"
231,2,"11:43",703,"Official TV Timeout",50,47,"CSU Northridge","Idaho State",2.5,"400992399"
232,2,"11:34",694,"Geno Luzcando made Layup. Assisted by Novak Topalovic.",52,47,"CSU Northridge","Idaho State",2.5,"400992399"
233,2,"11:15",675,"Foul on Brandon Boyd.",52,47,"CSU Northridge","Idaho State",2.5,"400992399"
234,2,"11:11",671,"Micheal Warren missed Layup.",52,47,"CSU Northridge","Idaho State",2.5,"400992399"
235,2,"11:11",671,"Novak Topalovic Block.",52,47,"CSU Northridge","Idaho State",2.5,"400992399"
236,2,"11:09",669,"Novak Topalovic Defensive Rebound.",52,47,"CSU Northridge","Idaho State",2.5,"400992399"
237,2,"11:06",666,"Balint Mocsan made Three Point Jumper. Assisted by Geno Luzcando.",55,47,"CSU Northridge","Idaho State",2.5,"400992399"
238,2,"10:47",647,"Terrell Gomez missed Three Point Jumper.",55,47,"CSU Northridge","Idaho State",2.5,"400992399"
239,2,"10:47",647,"Terrell Gomez Offensive Rebound.",55,47,"CSU Northridge","Idaho State",2.5,"400992399"
240,2,"10:40",640,"Mahamadou Kaba-Camara made Jumper.",55,49,"CSU Northridge","Idaho State",2.5,"400992399"
241,2,"10:14",614,"Foul on Geno Luzcando.",55,49,"CSU Northridge","Idaho State",2.5,"400992399"
242,2,"10:14",614,"Geno Luzcando Turnover.",55,49,"CSU Northridge","Idaho State",2.5,"400992399"
243,2,"10:00",600,"Terrell Gomez Turnover.",55,49,"CSU Northridge","Idaho State",2.5,"400992399"
244,2,"9:58",598,"Sam Dowd Steal.",55,49,"CSU Northridge","Idaho State",2.5,"400992399"
245,2,"9:46",586,"Brandon Boyd missed Three Point Jumper.",55,49,"CSU Northridge","Idaho State",2.5,"400992399"
246,2,"9:46",586,"Micheal Warren Defensive Rebound.",55,49,"CSU Northridge","Idaho State",2.5,"400992399"
247,2,"9:27",567,"Micheal Warren made Jumper.",55,51,"CSU Northridge","Idaho State",2.5,"400992399"
248,2,"9:10",550,"Foul on Mahamadou Kaba-Camara.",55,51,"CSU Northridge","Idaho State",2.5,"400992399"
249,2,"9:10",550,"Novak Topalovic made Free Throw.",56,51,"CSU Northridge","Idaho State",2.5,"400992399"
250,2,"9:10",550,"Novak Topalovic made Free Throw.",57,51,"CSU Northridge","Idaho State",2.5,"400992399"
251,2,"8:53",533,"Tavrion Dawson missed Jumper.",57,51,"CSU Northridge","Idaho State",2.5,"400992399"
252,2,"8:53",533,"Sam Dowd Defensive Rebound.",57,51,"CSU Northridge","Idaho State",2.5,"400992399"
253,2,"8:36",516,"Novak Topalovic missed Jumper.",57,51,"CSU Northridge","Idaho State",2.5,"400992399"
254,2,"8:36",516,"Novak Topalovic Offensive Rebound.",57,51,"CSU Northridge","Idaho State",2.5,"400992399"
255,2,"8:35",515,"Foul on Terrell Gomez.",57,51,"CSU Northridge","Idaho State",2.5,"400992399"
256,2,"8:35",515,"Novak Topalovic made Free Throw.",58,51,"CSU Northridge","Idaho State",2.5,"400992399"
257,2,"8:35",515,"Novak Topalovic made Free Throw.",59,51,"CSU Northridge","Idaho State",2.5,"400992399"
258,2,"8:19",499,"Tavrion Dawson missed Three Point Jumper.",59,51,"CSU Northridge","Idaho State",2.5,"400992399"
259,2,"8:19",499,"Idaho State Deadball Team Rebound.",59,51,"CSU Northridge","Idaho State",2.5,"400992399"
260,2,"8:18",498,"Foul on Zeno Lake.",59,51,"CSU Northridge","Idaho State",2.5,"400992399"
261,2,"8:08",488,"Balint Mocsan missed Three Point Jumper.",59,51,"CSU Northridge","Idaho State",2.5,"400992399"
262,2,"8:08",488,"Novak Topalovic Offensive Rebound.",59,51,"CSU Northridge","Idaho State",2.5,"400992399"
263,2,"7:56",476,"Novak Topalovic missed Jumper.",59,51,"CSU Northridge","Idaho State",2.5,"400992399"
264,2,"7:56",476,"CSU Northridge Deadball Team Rebound.",59,51,"CSU Northridge","Idaho State",2.5,"400992399"
265,2,"7:54",474,"Foul on Novak Topalovic.",59,51,"CSU Northridge","Idaho State",2.5,"400992399"
266,2,"7:54",474,"Official TV Timeout",59,51,"CSU Northridge","Idaho State",2.5,"400992399"
267,2,"7:54",474,"Mahamadou Kaba-Camara missed Free Throw.",59,51,"CSU Northridge","Idaho State",2.5,"400992399"
268,2,"7:54",474,"Micheal Warren Offensive Rebound.",59,51,"CSU Northridge","Idaho State",2.5,"400992399"
269,2,"7:52",472,"Foul on Erik Nakken.",59,51,"CSU Northridge","Idaho State",2.5,"400992399"
270,2,"7:52",472,"Micheal Warren missed Free Throw.",59,51,"CSU Northridge","Idaho State",2.5,"400992399"
271,2,"7:52",472,"Brandon Boyd Defensive Rebound.",59,51,"CSU Northridge","Idaho State",2.5,"400992399"
272,2,"7:28",448,"Brandon Boyd missed Three Point Jumper.",59,51,"CSU Northridge","Idaho State",2.5,"400992399"
273,2,"7:28",448,"Tavrion Dawson Defensive Rebound.",59,51,"CSU Northridge","Idaho State",2.5,"400992399"
274,2,"7:08",428,"Terrell Gomez made Three Point Jumper. Assisted by Micheal Warren.",59,54,"CSU Northridge","Idaho State",2.5,"400992399"
275,2,"6:47",407,"Kyle Ingram missed Jumper.",59,54,"CSU Northridge","Idaho State",2.5,"400992399"
276,2,"6:47",407,"Mahamadou Kaba-Camara Block.",59,54,"CSU Northridge","Idaho State",2.5,"400992399"
277,2,"6:45",405,"Mahamadou Kaba-Camara Defensive Rebound.",59,54,"CSU Northridge","Idaho State",2.5,"400992399"
278,2,"6:28",388,"Mahamadou Kaba-Camara Turnover.",59,54,"CSU Northridge","Idaho State",2.5,"400992399"
279,2,"6:24",384,"Erik Nakken missed Three Point Jumper.",59,54,"CSU Northridge","Idaho State",2.5,"400992399"
280,2,"6:24",384,"Mahamadou Kaba-Camara Defensive Rebound.",59,54,"CSU Northridge","Idaho State",2.5,"400992399"
281,2,"6:01",361,"Micheal Warren made Layup.",59,56,"CSU Northridge","Idaho State",2.5,"400992399"
282,2,"5:42",342,"Kyle Ingram made Layup. Assisted by Balint Mocsan.",61,56,"CSU Northridge","Idaho State",2.5,"400992399"
283,2,"5:21",321,"Foul on Tavrion Dawson.",61,56,"CSU Northridge","Idaho State",2.5,"400992399"
284,2,"5:21",321,"Tavrion Dawson Turnover.",61,56,"CSU Northridge","Idaho State",2.5,"400992399"
285,2,"5:04",304,"Balint Mocsan made Layup.",63,56,"CSU Northridge","Idaho State",2.5,"400992399"
286,2,"4:54",294,"CSU Northridge  Timeout",63,56,"CSU Northridge","Idaho State",2.5,"400992399"
287,2,"4:42",282,"Tavrion Dawson made Jumper. Assisted by Lyrik Shreiner.",63,58,"CSU Northridge","Idaho State",2.5,"400992399"
288,2,"4:26",266,"Kyle Ingram made Jumper.",65,58,"CSU Northridge","Idaho State",2.5,"400992399"
289,2,"4:10",250,"Terrell Gomez missed Three Point Jumper.",65,58,"CSU Northridge","Idaho State",2.5,"400992399"
290,2,"4:10",250,"Geno Luzcando Defensive Rebound.",65,58,"CSU Northridge","Idaho State",2.5,"400992399"
291,2,"3:58",238,"Official TV Timeout",65,58,"CSU Northridge","Idaho State",2.5,"400992399"
292,2,"3:57",237,"Balint Mocsan missed Three Point Jumper.",65,58,"CSU Northridge","Idaho State",2.5,"400992399"
293,2,"3:57",237,"Micheal Warren Defensive Rebound.",65,58,"CSU Northridge","Idaho State",2.5,"400992399"
294,2,"3:25",205,"Micheal Warren made Three Point Jumper. Assisted by Terrell Gomez.",65,61,"CSU Northridge","Idaho State",2.5,"400992399"
295,2,"3:01",181,"Balint Mocsan Turnover.",65,61,"CSU Northridge","Idaho State",2.5,"400992399"
296,2,"2:38",158,"Terrell Gomez made Three Point Jumper.",65,64,"CSU Northridge","Idaho State",2.5,"400992399"
297,2,"2:36",156,"Foul on Geno Luzcando.",65,64,"CSU Northridge","Idaho State",2.5,"400992399"
298,2,"2:36",156,"Zeno Lake missed Free Throw.",65,64,"CSU Northridge","Idaho State",2.5,"400992399"
