"play_id","half","time_remaining_half","secs_remaining","description","home_score","away_score","away","home","home_favored_by","game_id"
248,2,"6:26",386,"JD Notae missed Three Point Jumper.",52,65,"Northern Arizona","Jacksonville",NA,"400991263"
249,2,"6:26",386,"Gino Littles Defensive Rebound.",52,65,"Northern Arizona","Jacksonville",NA,"400991263"
250,2,"6:17",377,"Jojo Anderson missed Three Point Jumper.",52,65,"Northern Arizona","Jacksonville",NA,"400991263"
251,2,"6:17",377,"Jalyn Hinton Defensive Rebound.",52,65,"Northern Arizona","Jacksonville",NA,"400991263"
252,2,"6:06",366,"JD Notae missed Layup.",52,65,"Northern Arizona","Jacksonville",NA,"400991263"
253,2,"6:06",366,"Isaiah Thomas Block.",52,65,"Northern Arizona","Jacksonville",NA,"400991263"
254,2,"6:04",364,"Jojo Anderson Defensive Rebound.",52,65,"Northern Arizona","Jacksonville",NA,"400991263"
255,2,"5:55",355,"Chris Bowling made Jumper.",52,67,"Northern Arizona","Jacksonville",NA,"400991263"
256,2,"5:48",348,"Jacksonville  Timeout",52,67,"Northern Arizona","Jacksonville",NA,"400991263"
257,2,"5:41",341,"Cody Helgeland missed Layup.",52,67,"Northern Arizona","Jacksonville",NA,"400991263"
258,2,"5:41",341,"Derrick Flowers Offensive Rebound.",52,67,"Northern Arizona","Jacksonville",NA,"400991263"
259,2,"5:38",338,"Derrick Flowers made Layup.",54,67,"Northern Arizona","Jacksonville",NA,"400991263"
260,2,"5:10",310,"Gino Littles missed Layup.",54,67,"Northern Arizona","Jacksonville",NA,"400991263"
261,2,"5:10",310,"Gino Littles Offensive Rebound.",54,67,"Northern Arizona","Jacksonville",NA,"400991263"
262,2,"5:05",305,"Gino Littles made Layup.",54,69,"Northern Arizona","Jacksonville",NA,"400991263"
263,2,"4:59",299,"Cody Helgeland made Three Point Jumper. Assisted by Corey Romich.",57,69,"Northern Arizona","Jacksonville",NA,"400991263"
264,2,"4:45",285,"Foul on Cody Helgeland.",57,69,"Northern Arizona","Jacksonville",NA,"400991263"
265,2,"4:45",285,"Lenell Henry made Free Throw.",57,70,"Northern Arizona","Jacksonville",NA,"400991263"
266,2,"4:25",265,"Foul on Gino Littles.",57,70,"Northern Arizona","Jacksonville",NA,"400991263"
267,2,"4:25",265,"Cody Helgeland made Free Throw.",58,70,"Northern Arizona","Jacksonville",NA,"400991263"
268,2,"4:25",265,"Cody Helgeland missed Free Throw.",58,70,"Northern Arizona","Jacksonville",NA,"400991263"
269,2,"4:25",265,"Chris Bowling Defensive Rebound.",58,70,"Northern Arizona","Jacksonville",NA,"400991263"
270,2,"4:12",252,"Torry Johnson made Layup.",58,72,"Northern Arizona","Jacksonville",NA,"400991263"
271,2,"4:03",243,"Tanner Rubio missed Three Point Jumper.",58,72,"Northern Arizona","Jacksonville",NA,"400991263"
272,2,"4:03",243,"Isaiah Thomas Defensive Rebound.",58,72,"Northern Arizona","Jacksonville",NA,"400991263"
273,2,"3:39",219,"Northern Arizona  Timeout",58,72,"Northern Arizona","Jacksonville",NA,"400991263"
274,2,"3:34",214,"Jojo Anderson missed Three Point Jumper.",58,72,"Northern Arizona","Jacksonville",NA,"400991263"
275,2,"3:34",214,"Jalyn Hinton Defensive Rebound.",58,72,"Northern Arizona","Jacksonville",NA,"400991263"
276,2,"3:17",197,"JD Notae missed Jumper.",58,72,"Northern Arizona","Jacksonville",NA,"400991263"
277,2,"3:17",197,"Isaiah Thomas Defensive Rebound.",58,72,"Northern Arizona","Jacksonville",NA,"400991263"
278,2,"3:13",193,"Foul on JD Notae.",58,72,"Northern Arizona","Jacksonville",NA,"400991263"
279,2,"3:13",193,"Isaiah Thomas made Free Throw.",58,73,"Northern Arizona","Jacksonville",NA,"400991263"
280,2,"3:13",193,"Isaiah Thomas made Free Throw.",58,74,"Northern Arizona","Jacksonville",NA,"400991263"
281,2,"2:50",170,"Jalyn Hinton made Layup. Assisted by Cody Helgeland.",60,74,"Northern Arizona","Jacksonville",NA,"400991263"
282,2,"2:50",170,"Foul on Torry Johnson.",60,74,"Northern Arizona","Jacksonville",NA,"400991263"
283,2,"2:50",170,"Jalyn Hinton made Free Throw.",61,74,"Northern Arizona","Jacksonville",NA,"400991263"
284,2,"2:40",160,"Foul on Derrick Flowers.",61,74,"Northern Arizona","Jacksonville",NA,"400991263"
285,2,"2:40",160,"Chris Bowling made Free Throw.",61,75,"Northern Arizona","Jacksonville",NA,"400991263"
286,2,"2:40",160,"Chris Bowling made Free Throw.",61,76,"Northern Arizona","Jacksonville",NA,"400991263"
287,2,"2:29",149,"Tanner Rubio made Three Point Jumper. Assisted by JD Notae.",64,76,"Northern Arizona","Jacksonville",NA,"400991263"
288,2,"2:20",140,"Northern Arizona  Timeout",64,76,"Northern Arizona","Jacksonville",NA,"400991263"
289,2,"2:13",133,"Foul on Cody Helgeland.",64,76,"Northern Arizona","Jacksonville",NA,"400991263"
290,2,"2:13",133,"Torry Johnson made Free Throw.",64,77,"Northern Arizona","Jacksonville",NA,"400991263"
291,2,"2:13",133,"Torry Johnson made Free Throw.",64,78,"Northern Arizona","Jacksonville",NA,"400991263"
292,2,"1:57",117,"Foul on Isaiah Thomas.",64,78,"Northern Arizona","Jacksonville",NA,"400991263"
293,2,"1:57",117,"Tanner Rubio made Free Throw.",65,78,"Northern Arizona","Jacksonville",NA,"400991263"
294,2,"1:57",117,"Tanner Rubio missed Free Throw.",65,78,"Northern Arizona","Jacksonville",NA,"400991263"
295,2,"1:57",117,"Isaiah Thomas Defensive Rebound.",65,78,"Northern Arizona","Jacksonville",NA,"400991263"
296,2,"1:52",112,"Gino Littles Turnover.",65,78,"Northern Arizona","Jacksonville",NA,"400991263"
297,2,"1:51",111,"Jalyn Hinton Steal.",65,78,"Northern Arizona","Jacksonville",NA,"400991263"
298,2,"1:49",109,"Jalyn Hinton missed Jumper.",65,78,"Northern Arizona","Jacksonville",NA,"400991263"
299,2,"1:49",109,"Chris Bowling Block.",65,78,"Northern Arizona","Jacksonville",NA,"400991263"
300,2,"1:47",107,"Jalyn Hinton Offensive Rebound.",65,78,"Northern Arizona","Jacksonville",NA,"400991263"
301,2,"1:45",105,"Jalyn Hinton made Layup.",67,78,"Northern Arizona","Jacksonville",NA,"400991263"
302,2,"1:38",98,"Foul on JD Notae.",67,78,"Northern Arizona","Jacksonville",NA,"400991263"
303,2,"1:38",98,"Jojo Anderson made Free Throw.",67,79,"Northern Arizona","Jacksonville",NA,"400991263"
304,2,"1:38",98,"Jojo Anderson missed Free Throw.",67,79,"Northern Arizona","Jacksonville",NA,"400991263"
305,2,"1:38",98,"Jalyn Hinton Defensive Rebound.",67,79,"Northern Arizona","Jacksonville",NA,"400991263"
306,2,"1:33",93,"Foul on Torry Johnson.",67,79,"Northern Arizona","Jacksonville",NA,"400991263"
307,2,"1:33",93,"JD Notae made Free Throw.",68,79,"Northern Arizona","Jacksonville",NA,"400991263"
308,2,"1:33",93,"JD Notae made Free Throw.",69,79,"Northern Arizona","Jacksonville",NA,"400991263"
309,2,"1:33",93,"JD Notae made Free Throw.",70,79,"Northern Arizona","Jacksonville",NA,"400991263"
310,2,"1:27",87,"Chris Bowling made Dunk. Assisted by Isaiah Thomas.",70,81,"Northern Arizona","Jacksonville",NA,"400991263"
311,2,"1:16",76,"JD Notae missed Layup.",70,81,"Northern Arizona","Jacksonville",NA,"400991263"
312,2,"1:16",76,"Isaiah Thomas Defensive Rebound.",70,81,"Northern Arizona","Jacksonville",NA,"400991263"
313,2,"1:04",64,"Gino Littles Turnover.",70,81,"Northern Arizona","Jacksonville",NA,"400991263"
314,2,"1:03",63,"JD Notae Steal.",70,81,"Northern Arizona","Jacksonville",NA,"400991263"
315,2,"1:02",62,"JD Notae made Layup.",72,81,"Northern Arizona","Jacksonville",NA,"400991263"
316,2,"0:43",43,"Foul on JD Notae.",72,81,"Northern Arizona","Jacksonville",NA,"400991263"
317,2,"0:43",43,"Jojo Anderson made Free Throw.",72,82,"Northern Arizona","Jacksonville",NA,"400991263"
318,2,"0:43",43,"Jojo Anderson made Free Throw.",72,83,"Northern Arizona","Jacksonville",NA,"400991263"
319,2,"0:32",32,"Tanner Rubio missed Layup.",72,83,"Northern Arizona","Jacksonville",NA,"400991263"
320,2,"0:32",32,"Chris Bowling Block.",72,83,"Northern Arizona","Jacksonville",NA,"400991263"
321,2,"0:32",32,"Jacksonville Offensive Rebound.",72,83,"Northern Arizona","Jacksonville",NA,"400991263"
322,2,"0:29",29,"Tanner Rubio missed Three Point Jumper.",72,83,"Northern Arizona","Jacksonville",NA,"400991263"
323,2,"0:29",29,"Tanner Rubio Offensive Rebound.",72,83,"Northern Arizona","Jacksonville",NA,"400991263"
324,2,"0:22",22,"Tanner Rubio Turnover.",72,83,"Northern Arizona","Jacksonville",NA,"400991263"
325,2,"0:20",20,"Torry Johnson Steal.",72,83,"Northern Arizona","Jacksonville",NA,"400991263"
326,2,"0:00",0,"End of Game",72,83,"Northern Arizona","Jacksonville",NA,"400991263"
1,1,"20:00",2400,"PLAY",0,0,"Jacksonville","NC State",NA,"400986161"
2,1,"19:39",2379,"Abdul-Malik Abu missed Jumper.",0,0,"Jacksonville","NC State",NA,"400986161"
3,1,"19:39",2379,"Omer Yurtseven Offensive Rebound.",0,0,"Jacksonville","NC State",NA,"400986161"
4,1,"19:36",2376,"Omer Yurtseven made Two Point Tip Shot.",2,0,"Jacksonville","NC State",NA,"400986161"
5,1,"19:15",2355,"JD Notae missed Layup.",2,0,"Jacksonville","NC State",NA,"400986161"
6,1,"19:15",2355,"Allerik Freeman Defensive Rebound.",2,0,"Jacksonville","NC State",NA,"400986161"
7,1,"19:04",2344,"Abdul-Malik Abu made Layup. Assisted by Torin Dorn.",4,0,"Jacksonville","NC State",NA,"400986161"
8,1,"18:32",2312,"Foul on Omer Yurtseven.",4,0,"Jacksonville","NC State",NA,"400986161"
9,1,"18:32",2312,"JD Notae made Free Throw.",4,1,"Jacksonville","NC State",NA,"400986161"
10,1,"18:32",2312,"JD Notae made Free Throw.",4,2,"Jacksonville","NC State",NA,"400986161"
11,1,"18:22",2302,"Foul on Corey Romich.",4,2,"Jacksonville","NC State",NA,"400986161"
12,1,"18:22",2302,"Torin Dorn missed Free Throw.",4,2,"Jacksonville","NC State",NA,"400986161"
13,1,"18:22",2302,"NC State Deadball Team Rebound.",4,2,"Jacksonville","NC State",NA,"400986161"
14,1,"18:22",2302,"Torin Dorn made Free Throw.",5,2,"Jacksonville","NC State",NA,"400986161"
15,1,"17:56",2276,"Cody Helgeland missed Three Point Jumper.",5,2,"Jacksonville","NC State",NA,"400986161"
16,1,"17:56",2276,"Torin Dorn Defensive Rebound.",5,2,"Jacksonville","NC State",NA,"400986161"
17,1,"17:44",2264,"Braxton Beverly missed Three Point Jumper.",5,2,"Jacksonville","NC State",NA,"400986161"
18,1,"17:44",2264,"Omer Yurtseven Offensive Rebound.",5,2,"Jacksonville","NC State",NA,"400986161"
19,1,"17:35",2255,"Abdul-Malik Abu made Jumper. Assisted by Braxton Beverly.",7,2,"Jacksonville","NC State",NA,"400986161"
20,1,"17:01",2221,"JD Notae made Layup.",7,4,"Jacksonville","NC State",NA,"400986161"
21,1,"16:46",2206,"Omer Yurtseven missed Layup.",7,4,"Jacksonville","NC State",NA,"400986161"
22,1,"16:46",2206,"Omer Yurtseven Offensive Rebound.",7,4,"Jacksonville","NC State",NA,"400986161"
23,1,"16:44",2204,"Omer Yurtseven made Layup.",9,4,"Jacksonville","NC State",NA,"400986161"
24,1,"16:32",2192,"Corey Romich missed Three Point Jumper.",9,4,"Jacksonville","NC State",NA,"400986161"
25,1,"16:32",2192,"Allerik Freeman Defensive Rebound.",9,4,"Jacksonville","NC State",NA,"400986161"
26,1,"16:13",2173,"Allerik Freeman made Three Point Jumper.",12,4,"Jacksonville","NC State",NA,"400986161"
27,1,"16:07",2167,"Tanner Rubio Turnover.",12,4,"Jacksonville","NC State",NA,"400986161"
28,1,"15:46",2146,"Lavar Batts Jr. missed Three Point Jumper.",12,4,"Jacksonville","NC State",NA,"400986161"
29,1,"15:46",2146,"Omer Yurtseven Offensive Rebound.",12,4,"Jacksonville","NC State",NA,"400986161"
30,1,"15:38",2138,"Braxton Beverly made Three Point Jumper. Assisted by Omer Yurtseven.",15,4,"Jacksonville","NC State",NA,"400986161"
31,1,"15:02",2102,"Tanner Rubio made Three Point Jumper. Assisted by Corey Romich.",15,7,"Jacksonville","NC State",NA,"400986161"
32,1,"14:45",2085,"Allerik Freeman missed Three Point Jumper.",15,7,"Jacksonville","NC State",NA,"400986161"
33,1,"14:45",2085,"Omer Yurtseven Offensive Rebound.",15,7,"Jacksonville","NC State",NA,"400986161"
34,1,"14:41",2081,"Lavar Batts Jr. made Three Point Jumper. Assisted by Braxton Beverly.",18,7,"Jacksonville","NC State",NA,"400986161"
35,1,"14:23",2063,"Tanner Rubio made Three Point Jumper. Assisted by JD Notae.",18,10,"Jacksonville","NC State",NA,"400986161"
36,1,"14:12",2052,"Allerik Freeman missed Jumper.",18,10,"Jacksonville","NC State",NA,"400986161"
37,1,"14:12",2052,"Radwan Bakkali Block.",18,10,"Jacksonville","NC State",NA,"400986161"
38,1,"14:10",2050,"NC State Offensive Rebound.",18,10,"Jacksonville","NC State",NA,"400986161"
39,1,"14:10",2050,"Official TV Timeout",18,10,"Jacksonville","NC State",NA,"400986161"
40,1,"14:03",2043,"Sam Hunt missed Three Point Jumper.",18,10,"Jacksonville","NC State",NA,"400986161"
41,1,"14:03",2043,"Radwan Bakkali Defensive Rebound.",18,10,"Jacksonville","NC State",NA,"400986161"
42,1,"13:28",2008,"Jacksonville  Turnover.",18,10,"Jacksonville","NC State",NA,"400986161"
43,1,"13:07",1987,"Braxton Beverly Turnover.",18,10,"Jacksonville","NC State",NA,"400986161"
44,1,"13:07",1987,"JD Notae Steal.",18,10,"Jacksonville","NC State",NA,"400986161"
45,1,"13:04",1984,"JD Notae Turnover.",18,10,"Jacksonville","NC State",NA,"400986161"
46,1,"13:03",1983,"Braxton Beverly Steal.",18,10,"Jacksonville","NC State",NA,"400986161"
47,1,"12:56",1976,"Allerik Freeman missed Jumper.",18,10,"Jacksonville","NC State",NA,"400986161"
48,1,"12:56",1976,"Jalyn Hinton Defensive Rebound.",18,10,"Jacksonville","NC State",NA,"400986161"
49,1,"12:38",1958,"Tanner Rubio made Three Point Jumper. Assisted by Jalyn Hinton.",18,13,"Jacksonville","NC State",NA,"400986161"
50,1,"12:17",1937,"Braxton Beverly made Three Point Jumper. Assisted by Allerik Freeman.",21,13,"Jacksonville","NC State",NA,"400986161"
51,1,"11:59",1919,"Tanner Rubio missed Three Point Jumper.",21,13,"Jacksonville","NC State",NA,"400986161"
52,1,"11:59",1919,"Lennard Freeman Defensive Rebound.",21,13,"Jacksonville","NC State",NA,"400986161"
53,1,"11:45",1905,"Allerik Freeman Turnover.",21,13,"Jacksonville","NC State",NA,"400986161"
54,1,"11:44",1904,"Tanner Rubio Steal.",21,13,"Jacksonville","NC State",NA,"400986161"
55,1,"11:41",1901,"Jalyn Hinton made Dunk. Assisted by JD Notae.",21,15,"Jacksonville","NC State",NA,"400986161"
56,1,"11:39",1899,"Official TV Timeout",21,15,"Jacksonville","NC State",NA,"400986161"
57,1,"11:24",1884,"Foul on Radwan Bakkali.",21,15,"Jacksonville","NC State",NA,"400986161"
58,1,"11:24",1884,"Torin Dorn made Free Throw.",22,15,"Jacksonville","NC State",NA,"400986161"
59,1,"11:24",1884,"Torin Dorn made Free Throw.",23,15,"Jacksonville","NC State",NA,"400986161"
60,1,"11:13",1873,"Jacksonville  Turnover.",23,15,"Jacksonville","NC State",NA,"400986161"
61,1,"11:03",1863,"Sam Hunt made Three Point Jumper. Assisted by Braxton Beverly.",26,15,"Jacksonville","NC State",NA,"400986161"
62,1,"10:44",1844,"Jalyn Hinton missed Layup.",26,15,"Jacksonville","NC State",NA,"400986161"
63,1,"10:44",1844,"Lavar Batts Jr. Block.",26,15,"Jacksonville","NC State",NA,"400986161"
64,1,"10:42",1842,"Braxton Beverly Defensive Rebound.",26,15,"Jacksonville","NC State",NA,"400986161"
65,1,"10:36",1836,"Sam Hunt made Three Point Jumper. Assisted by Braxton Beverly.",29,15,"Jacksonville","NC State",NA,"400986161"
66,1,"10:33",1833,"Jacksonville  Timeout",29,15,"Jacksonville","NC State",NA,"400986161"
67,1,"10:19",1819,"Tanner Rubio Turnover.",29,15,"Jacksonville","NC State",NA,"400986161"
68,1,"10:18",1818,"Sam Hunt Steal.",29,15,"Jacksonville","NC State",NA,"400986161"
69,1,"10:16",1816,"Sam Hunt made Layup.",31,15,"Jacksonville","NC State",NA,"400986161"
70,1,"10:03",1803,"JD Notae made Layup.",31,17,"Jacksonville","NC State",NA,"400986161"
71,1,"9:48",1788,"Sam Hunt missed Jumper.",31,17,"Jacksonville","NC State",NA,"400986161"
72,1,"9:48",1788,"Torin Dorn Offensive Rebound.",31,17,"Jacksonville","NC State",NA,"400986161"
73,1,"9:45",1785,"Torin Dorn made Layup.",33,17,"Jacksonville","NC State",NA,"400986161"
74,1,"9:12",1752,"Tanner Rubio made Three Point Jumper. Assisted by Cody Helgeland.",33,20,"Jacksonville","NC State",NA,"400986161"
75,1,"8:43",1723,"Torin Dorn Turnover.",33,20,"Jacksonville","NC State",NA,"400986161"
76,1,"8:40",1720,"Foul on Lavar Batts Jr..",33,20,"Jacksonville","NC State",NA,"400986161"
77,1,"8:14",1694,"Jalyn Hinton made Jumper.",33,22,"Jacksonville","NC State",NA,"400986161"
78,1,"7:53",1673,"Braxton Beverly made Three Point Jumper. Assisted by Omer Yurtseven.",36,22,"Jacksonville","NC State",NA,"400986161"
79,1,"7:22",1642,"Damien Sears missed Jumper.",36,22,"Jacksonville","NC State",NA,"400986161"
80,1,"7:22",1642,"Shaun Kirk Defensive Rebound.",36,22,"Jacksonville","NC State",NA,"400986161"
81,1,"7:09",1629,"Omer Yurtseven made Layup. Assisted by Braxton Beverly.",38,22,"Jacksonville","NC State",NA,"400986161"
82,1,"7:09",1629,"Foul on Lee Richmond.",38,22,"Jacksonville","NC State",NA,"400986161"
83,1,"7:09",1629,"Official TV Timeout",38,22,"Jacksonville","NC State",NA,"400986161"
84,1,"7:09",1629,"Omer Yurtseven made Free Throw.",39,22,"Jacksonville","NC State",NA,"400986161"
85,1,"6:59",1619,"Foul on Omer Yurtseven.",39,22,"Jacksonville","NC State",NA,"400986161"
86,1,"6:52",1612,"Tanner Rubio Turnover.",39,22,"Jacksonville","NC State",NA,"400986161"
87,1,"6:51",1611,"Braxton Beverly Steal.",39,22,"Jacksonville","NC State",NA,"400986161"
88,1,"6:47",1607,"Braxton Beverly Turnover.",39,22,"Jacksonville","NC State",NA,"400986161"
89,1,"6:19",1579,"Radwan Bakkali Turnover.",39,22,"Jacksonville","NC State",NA,"400986161"
90,1,"6:02",1562,"Allerik Freeman missed Three Point Jumper.",39,22,"Jacksonville","NC State",NA,"400986161"
91,1,"6:02",1562,"Abdul-Malik Abu Offensive Rebound.",39,22,"Jacksonville","NC State",NA,"400986161"
92,1,"5:54",1554,"Abdul-Malik Abu made Layup.",41,22,"Jacksonville","NC State",NA,"400986161"
93,1,"5:53",1553,"Foul on Cody Helgeland.",41,22,"Jacksonville","NC State",NA,"400986161"
94,1,"5:53",1553,"Abdul-Malik Abu missed Free Throw.",41,22,"Jacksonville","NC State",NA,"400986161"
95,1,"5:53",1553,"Jacksonville Defensive Rebound.",41,22,"Jacksonville","NC State",NA,"400986161"
96,1,"5:51",1551,"Tanner Rubio Turnover.",41,22,"Jacksonville","NC State",NA,"400986161"
97,1,"5:36",1536,"Torin Dorn missed Three Point Jumper.",41,22,"Jacksonville","NC State",NA,"400986161"
98,1,"5:36",1536,"Jalyn Hinton Defensive Rebound.",41,22,"Jacksonville","NC State",NA,"400986161"
99,1,"5:16",1516,"JD Notae missed Layup.",41,22,"Jacksonville","NC State",NA,"400986161"
100,1,"5:16",1516,"Abdul-Malik Abu Defensive Rebound.",41,22,"Jacksonville","NC State",NA,"400986161"
101,1,"5:09",1509,"Lavar Batts Jr. Turnover.",41,22,"Jacksonville","NC State",NA,"400986161"
102,1,"5:08",1508,"Tanner Rubio Steal.",41,22,"Jacksonville","NC State",NA,"400986161"
103,1,"5:06",1506,"Tanner Rubio Turnover.",41,22,"Jacksonville","NC State",NA,"400986161"
104,1,"5:05",1505,"Shaun Kirk Steal.",41,22,"Jacksonville","NC State",NA,"400986161"
105,1,"5:02",1502,"Torin Dorn made Layup. Assisted by Shaun Kirk.",43,22,"Jacksonville","NC State",NA,"400986161"
106,1,"4:49",1489,"Jacksonville  Timeout",43,22,"Jacksonville","NC State",NA,"400986161"
107,1,"4:39",1479,"JD Notae missed Jumper.",43,22,"Jacksonville","NC State",NA,"400986161"
108,1,"4:39",1479,"Allerik Freeman Defensive Rebound.",43,22,"Jacksonville","NC State",NA,"400986161"
109,1,"4:31",1471,"Allerik Freeman made Layup.",45,22,"Jacksonville","NC State",NA,"400986161"
110,1,"4:21",1461,"Jalyn Hinton missed Layup.",45,22,"Jacksonville","NC State",NA,"400986161"
111,1,"4:21",1461,"Jalyn Hinton Offensive Rebound.",45,22,"Jacksonville","NC State",NA,"400986161"
112,1,"4:17",1457,"Jalyn Hinton Turnover.",45,22,"Jacksonville","NC State",NA,"400986161"
113,1,"4:16",1456,"Lavar Batts Jr. Steal.",45,22,"Jacksonville","NC State",NA,"400986161"
114,1,"4:09",1449,"Torin Dorn made Dunk. Assisted by Lavar Batts Jr..",47,22,"Jacksonville","NC State",NA,"400986161"
115,1,"3:54",1434,"Tanner Rubio Turnover.",47,22,"Jacksonville","NC State",NA,"400986161"
116,1,"3:54",1434,"Official TV Timeout",47,22,"Jacksonville","NC State",NA,"400986161"
117,1,"3:47",1427,"Foul on Jalyn Hinton.",47,22,"Jacksonville","NC State",NA,"400986161"
118,1,"3:47",1427,"Braxton Beverly Turnover.",47,22,"Jacksonville","NC State",NA,"400986161"
119,1,"3:47",1427,"Foul on Braxton Beverly.",47,22,"Jacksonville","NC State",NA,"400986161"
120,1,"3:43",1423,"JD Notae missed Jumper.",47,22,"Jacksonville","NC State",NA,"400986161"
121,1,"3:43",1423,"Torin Dorn Defensive Rebound.",47,22,"Jacksonville","NC State",NA,"400986161"
122,1,"3:33",1413,"Allerik Freeman made Three Point Jumper. Assisted by Braxton Beverly.",50,22,"Jacksonville","NC State",NA,"400986161"
123,1,"3:24",1404,"Jalyn Hinton made Dunk. Assisted by JD Notae.",50,24,"Jacksonville","NC State",NA,"400986161"
124,1,"3:05",1385,"Allerik Freeman missed Three Point Jumper.",50,24,"Jacksonville","NC State",NA,"400986161"
125,1,"3:05",1385,"JD Notae Defensive Rebound.",50,24,"Jacksonville","NC State",NA,"400986161"
126,1,"2:39",1359,"JD Notae missed Layup.",50,24,"Jacksonville","NC State",NA,"400986161"
127,1,"2:39",1359,"Braxton Beverly Defensive Rebound.",50,24,"Jacksonville","NC State",NA,"400986161"
128,1,"2:22",1342,"Foul on Cody Helgeland.",50,24,"Jacksonville","NC State",NA,"400986161"
129,1,"2:22",1342,"Allerik Freeman made Free Throw.",51,24,"Jacksonville","NC State",NA,"400986161"
130,1,"2:22",1342,"Allerik Freeman made Free Throw.",52,24,"Jacksonville","NC State",NA,"400986161"
131,1,"2:15",1335,"JD Notae Turnover.",52,24,"Jacksonville","NC State",NA,"400986161"
132,1,"2:14",1334,"Abdul-Malik Abu Steal.",52,24,"Jacksonville","NC State",NA,"400986161"
133,1,"2:11",1331,"Abdul-Malik Abu made Dunk. Assisted by Allerik Freeman.",54,24,"Jacksonville","NC State",NA,"400986161"
134,1,"1:39",1299,"JD Notae missed Three Point Jumper.",54,24,"Jacksonville","NC State",NA,"400986161"
135,1,"1:39",1299,"Abdul-Malik Abu Defensive Rebound.",54,24,"Jacksonville","NC State",NA,"400986161"
136,1,"1:28",1288,"Omer Yurtseven made Dunk. Assisted by Allerik Freeman.",56,24,"Jacksonville","NC State",NA,"400986161"
137,1,"1:28",1288,"Foul on Damien Sears.",56,24,"Jacksonville","NC State",NA,"400986161"
138,1,"1:28",1288,"Omer Yurtseven made Free Throw.",57,24,"Jacksonville","NC State",NA,"400986161"
139,1,"1:00",1260,"Foul on Sam Hunt.",57,24,"Jacksonville","NC State",NA,"400986161"
140,1,"1:00",1260,"Corey Romich missed Three Point Jumper.",57,24,"Jacksonville","NC State",NA,"400986161"
141,1,"1:00",1260,"Derrick Flowers Offensive Rebound.",57,24,"Jacksonville","NC State",NA,"400986161"
142,1,"0:55",1255,"Derrick Flowers missed Layup.",57,24,"Jacksonville","NC State",NA,"400986161"
143,1,"0:55",1255,"Damien Sears Offensive Rebound.",57,24,"Jacksonville","NC State",NA,"400986161"
144,1,"0:53",1253,"Damien Sears made Two Point Tip Shot.",57,26,"Jacksonville","NC State",NA,"400986161"
145,1,"0:25",1225,"Sam Hunt made Three Point Jumper. Assisted by Lavar Batts Jr..",60,26,"Jacksonville","NC State",NA,"400986161"
146,1,"0:03",1203,"JD Notae missed Jumper.",60,26,"Jacksonville","NC State",NA,"400986161"
147,1,"0:03",1203,"Jacksonville Offensive Rebound.",60,26,"Jacksonville","NC State",NA,"400986161"
148,1,"0:00",1200,"Corey Romich made Jumper.",60,28,"Jacksonville","NC State",NA,"400986161"
149,1,"0:00",1200,"End of 1st half",60,29,"Jacksonville","NC State",NA,"400986161"
150,2,"20:00",1200,"PLAY",60,29,"Jacksonville","NC State",NA,"400986161"
151,2,"19:46",1186,"Braxton Beverly missed Three Point Jumper.",60,28,"Jacksonville","NC State",NA,"400986161"
152,2,"19:46",1186,"JD Notae Defensive Rebound.",60,28,"Jacksonville","NC State",NA,"400986161"
153,2,"19:17",1157,"JD Notae missed Layup.",60,28,"Jacksonville","NC State",NA,"400986161"
154,2,"19:17",1157,"Damien Sears Offensive Rebound.",60,28,"Jacksonville","NC State",NA,"400986161"
155,2,"19:13",1153,"Damien Sears missed Two Point Tip Shot.",60,28,"Jacksonville","NC State",NA,"400986161"
156,2,"19:13",1153,"Omer Yurtseven Defensive Rebound.",60,28,"Jacksonville","NC State",NA,"400986161"
157,2,"19:04",1144,"Abdul-Malik Abu missed Three Point Jumper.",60,28,"Jacksonville","NC State",NA,"400986161"
158,2,"19:04",1144,"Torin Dorn Offensive Rebound.",60,28,"Jacksonville","NC State",NA,"400986161"
159,2,"18:59",1139,"Torin Dorn made Jumper.",62,28,"Jacksonville","NC State",NA,"400986161"
160,2,"18:27",1107,"Tanner Rubio missed Three Point Jumper.",62,28,"Jacksonville","NC State",NA,"400986161"
161,2,"18:27",1107,"Omer Yurtseven Defensive Rebound.",62,28,"Jacksonville","NC State",NA,"400986161"
162,2,"18:20",1100,"Braxton Beverly made Three Point Jumper. Assisted by Allerik Freeman.",65,28,"Jacksonville","NC State",NA,"400986161"
163,2,"18:05",1085,"JD Notae made Layup.",65,30,"Jacksonville","NC State",NA,"400986161"
164,2,"18:00",1080,"Allerik Freeman made Three Point Jumper. Assisted by Braxton Beverly.",68,30,"Jacksonville","NC State",NA,"400986161"
165,2,"17:43",1063,"JD Notae Turnover.",68,30,"Jacksonville","NC State",NA,"400986161"
166,2,"17:42",1062,"Allerik Freeman Steal.",68,30,"Jacksonville","NC State",NA,"400986161"
167,2,"17:37",1057,"Omer Yurtseven made Layup. Assisted by Allerik Freeman.",70,30,"Jacksonville","NC State",NA,"400986161"
168,2,"17:12",1032,"JD Notae missed Three Point Jumper.",70,30,"Jacksonville","NC State",NA,"400986161"
169,2,"17:12",1032,"Damien Sears Offensive Rebound.",70,30,"Jacksonville","NC State",NA,"400986161"
170,2,"17:07",1027,"Tanner Rubio missed Three Point Jumper.",70,30,"Jacksonville","NC State",NA,"400986161"
171,2,"17:07",1027,"Damien Sears Offensive Rebound.",70,30,"Jacksonville","NC State",NA,"400986161"
172,2,"17:00",1020,"Damien Sears made Layup. Assisted by JD Notae.",70,32,"Jacksonville","NC State",NA,"400986161"
173,2,"16:51",1011,"Foul on Corey Romich.",70,32,"Jacksonville","NC State",NA,"400986161"
174,2,"16:51",1011,"Torin Dorn made Free Throw.",71,32,"Jacksonville","NC State",NA,"400986161"
175,2,"16:51",1011,"Torin Dorn missed Free Throw.",71,32,"Jacksonville","NC State",NA,"400986161"
176,2,"16:51",1011,"Damien Sears Defensive Rebound.",71,32,"Jacksonville","NC State",NA,"400986161"
177,2,"16:37",997,"Cody Helgeland missed Layup.",71,32,"Jacksonville","NC State",NA,"400986161"
178,2,"16:37",997,"Radwan Bakkali Offensive Rebound.",71,32,"Jacksonville","NC State",NA,"400986161"
