"play_id","half","time_remaining_half","secs_remaining","description","home_score","away_score","away","home","home_favored_by","game_id"
10,1,"17:48",2568,"JD Notae Steal.",2,4,"Jacksonville","Eastern Kentucky",NA,"400990920"
11,1,"17:45",2565,"JD Notae made Layup.",2,6,"Jacksonville","Eastern Kentucky",NA,"400990920"
12,1,"17:29",2549,"Dillon Avare made Three Point Jumper. Assisted by Asante Gist.",5,6,"Jacksonville","Eastern Kentucky",NA,"400990920"
13,1,"17:15",2535,"Devin Harris Turnover.",5,6,"Jacksonville","Eastern Kentucky",NA,"400990920"
14,1,"17:14",2534,"Dedric Boyd Steal.",5,6,"Jacksonville","Eastern Kentucky",NA,"400990920"
15,1,"17:03",2523,"Dedric Boyd missed Three Point Jumper.",5,6,"Jacksonville","Eastern Kentucky",NA,"400990920"
16,1,"17:03",2523,"Devin Harris Defensive Rebound.",5,6,"Jacksonville","Eastern Kentucky",NA,"400990920"
17,1,"16:49",2509,"Foul on Dillon Avare.",5,6,"Jacksonville","Eastern Kentucky",NA,"400990920"
18,1,"16:44",2504,"Cody Helgeland missed Three Point Jumper.",5,6,"Jacksonville","Eastern Kentucky",NA,"400990920"
19,1,"16:44",2504,"Nick Mayo Defensive Rebound.",5,6,"Jacksonville","Eastern Kentucky",NA,"400990920"
20,1,"16:42",2502,"Foul on Radwan Bakkali.",5,6,"Jacksonville","Eastern Kentucky",NA,"400990920"
21,1,"16:26",2486,"Dedric Boyd missed Three Point Jumper.",5,6,"Jacksonville","Eastern Kentucky",NA,"400990920"
22,1,"16:26",2486,"Nick Mayo Offensive Rebound.",5,6,"Jacksonville","Eastern Kentucky",NA,"400990920"
23,1,"16:23",2483,"Foul on Damien Sears.",5,6,"Jacksonville","Eastern Kentucky",NA,"400990920"
24,1,"16:14",2474,"Dedric Boyd missed Jumper.",5,6,"Jacksonville","Eastern Kentucky",NA,"400990920"
25,1,"16:14",2474,"Devin Harris Block.",5,6,"Jacksonville","Eastern Kentucky",NA,"400990920"
26,1,"16:12",2472,"Dillon Avare Offensive Rebound.",5,6,"Jacksonville","Eastern Kentucky",NA,"400990920"
27,1,"16:02",2462,"Dedric Boyd made Jumper.",7,6,"Jacksonville","Eastern Kentucky",NA,"400990920"
28,1,"15:37",2437,"Damien Sears missed Layup.",7,6,"Jacksonville","Eastern Kentucky",NA,"400990920"
29,1,"15:37",2437,"Nick Mayo Defensive Rebound.",7,6,"Jacksonville","Eastern Kentucky",NA,"400990920"
30,1,"15:31",2431,"Dillon Avare missed Three Point Jumper.",7,6,"Jacksonville","Eastern Kentucky",NA,"400990920"
31,1,"15:31",2431,"Devin Harris Defensive Rebound.",7,6,"Jacksonville","Eastern Kentucky",NA,"400990920"
32,1,"15:16",2416,"Jace Hogan missed Jumper.",7,6,"Jacksonville","Eastern Kentucky",NA,"400990920"
33,1,"15:11",2411,"Nick Mayo Block.",7,6,"Jacksonville","Eastern Kentucky",NA,"400990920"
34,1,"15:11",2411,"DeAndre Dishman Defensive Rebound.",7,6,"Jacksonville","Eastern Kentucky",NA,"400990920"
35,1,"14:56",2396,"Asante Gist made Layup.",9,6,"Jacksonville","Eastern Kentucky",NA,"400990920"
36,1,"14:47",2387,"JD Notae Turnover.",9,6,"Jacksonville","Eastern Kentucky",NA,"400990920"
37,1,"14:46",2386,"DeAndre Dishman Steal.",9,6,"Jacksonville","Eastern Kentucky",NA,"400990920"
38,1,"14:42",2382,"Dedric Boyd missed Jumper.",9,6,"Jacksonville","Eastern Kentucky",NA,"400990920"
39,1,"14:42",2382,"Jace Hogan Block.",9,6,"Jacksonville","Eastern Kentucky",NA,"400990920"
40,1,"14:41",2381,"Cody Helgeland Defensive Rebound.",9,6,"Jacksonville","Eastern Kentucky",NA,"400990920"
41,1,"14:30",2370,"JD Notae missed Layup.",9,6,"Jacksonville","Eastern Kentucky",NA,"400990920"
42,1,"14:30",2370,"Jace Hogan Offensive Rebound.",9,6,"Jacksonville","Eastern Kentucky",NA,"400990920"
43,1,"14:30",2370,"Foul on Asante Gist.",9,6,"Jacksonville","Eastern Kentucky",NA,"400990920"
44,1,"14:30",2370,"Official TV Timeout",9,6,"Jacksonville","Eastern Kentucky",NA,"400990920"
45,1,"14:30",2370,"Jace Hogan made Free Throw.",9,7,"Jacksonville","Eastern Kentucky",NA,"400990920"
46,1,"14:30",2370,"Jace Hogan made Free Throw.",9,8,"Jacksonville","Eastern Kentucky",NA,"400990920"
47,1,"14:13",2353,"Foul on Devin Harris.",9,8,"Jacksonville","Eastern Kentucky",NA,"400990920"
48,1,"14:13",2353,"Asante Gist made Free Throw.",10,8,"Jacksonville","Eastern Kentucky",NA,"400990920"
49,1,"14:13",2353,"Asante Gist made Free Throw.",11,8,"Jacksonville","Eastern Kentucky",NA,"400990920"
50,1,"14:02",2342,"Tanner Rubio Turnover.",11,8,"Jacksonville","Eastern Kentucky",NA,"400990920"
51,1,"14:01",2341,"Asante Gist Steal.",11,8,"Jacksonville","Eastern Kentucky",NA,"400990920"
52,1,"13:56",2336,"Peyton Broughton missed Jumper.",11,8,"Jacksonville","Eastern Kentucky",NA,"400990920"
53,1,"13:56",2336,"Nick Mayo Offensive Rebound.",11,8,"Jacksonville","Eastern Kentucky",NA,"400990920"
54,1,"13:53",2333,"Nick Mayo made Two Point Tip Shot.",13,8,"Jacksonville","Eastern Kentucky",NA,"400990920"
55,1,"13:43",2323,"Jace Hogan missed Jumper.",13,8,"Jacksonville","Eastern Kentucky",NA,"400990920"
56,1,"13:43",2323,"DeAndre Dishman Defensive Rebound.",13,8,"Jacksonville","Eastern Kentucky",NA,"400990920"
57,1,"13:21",2301,"Asante Gist missed Layup.",13,8,"Jacksonville","Eastern Kentucky",NA,"400990920"
58,1,"13:21",2301,"Jace Hogan Defensive Rebound.",13,8,"Jacksonville","Eastern Kentucky",NA,"400990920"
59,1,"13:14",2294,"JD Notae made Three Point Jumper. Assisted by Devin Harris.",13,11,"Jacksonville","Eastern Kentucky",NA,"400990920"
60,1,"12:40",2260,"Foul on Damien Sears.",13,11,"Jacksonville","Eastern Kentucky",NA,"400990920"
61,1,"12:40",2260,"DeAndre Dishman missed Free Throw.",13,11,"Jacksonville","Eastern Kentucky",NA,"400990920"
62,1,"12:40",2260,"Eastern Kentucky Deadball Team Rebound.",13,11,"Jacksonville","Eastern Kentucky",NA,"400990920"
63,1,"12:40",2260,"DeAndre Dishman made Free Throw.",14,11,"Jacksonville","Eastern Kentucky",NA,"400990920"
64,1,"12:31",2251,"JD Notae missed Layup.",14,11,"Jacksonville","Eastern Kentucky",NA,"400990920"
65,1,"12:31",2251,"Nick Mayo Block.",14,11,"Jacksonville","Eastern Kentucky",NA,"400990920"
66,1,"12:31",2251,"Jacksonville Offensive Rebound.",14,11,"Jacksonville","Eastern Kentucky",NA,"400990920"
67,1,"12:25",2245,"Foul on Dujuanta Weaver.",14,11,"Jacksonville","Eastern Kentucky",NA,"400990920"
68,1,"12:18",2238,"JD Notae made Layup. Assisted by Tanner Rubio.",14,13,"Jacksonville","Eastern Kentucky",NA,"400990920"
69,1,"12:00",2220,"Nick Mayo made Layup.",16,13,"Jacksonville","Eastern Kentucky",NA,"400990920"
70,1,"11:59",2219,"Foul on Radwan Bakkali.",16,13,"Jacksonville","Eastern Kentucky",NA,"400990920"
71,1,"11:59",2219,"Official TV Timeout",16,13,"Jacksonville","Eastern Kentucky",NA,"400990920"
72,1,"11:59",2219,"Nick Mayo made Free Throw.",17,13,"Jacksonville","Eastern Kentucky",NA,"400990920"
73,1,"11:54",2214,"Tanner Rubio Turnover.",17,13,"Jacksonville","Eastern Kentucky",NA,"400990920"
74,1,"11:53",2213,"Asante Gist Steal.",17,13,"Jacksonville","Eastern Kentucky",NA,"400990920"
75,1,"11:50",2210,"Foul on Jace Hogan.",17,13,"Jacksonville","Eastern Kentucky",NA,"400990920"
76,1,"11:50",2210,"Nick Mayo made Free Throw.",18,13,"Jacksonville","Eastern Kentucky",NA,"400990920"
77,1,"11:50",2210,"Nick Mayo made Free Throw.",19,13,"Jacksonville","Eastern Kentucky",NA,"400990920"
78,1,"11:42",2202,"JD Notae missed Jumper.",19,13,"Jacksonville","Eastern Kentucky",NA,"400990920"
79,1,"11:42",2202,"Asante Gist Defensive Rebound.",19,13,"Jacksonville","Eastern Kentucky",NA,"400990920"
80,1,"11:35",2195,"Asante Gist missed Jumper.",19,13,"Jacksonville","Eastern Kentucky",NA,"400990920"
81,1,"11:35",2195,"Devin Harris Defensive Rebound.",19,13,"Jacksonville","Eastern Kentucky",NA,"400990920"
82,1,"11:25",2185,"Foul on Zach Charles.",19,13,"Jacksonville","Eastern Kentucky",NA,"400990920"
83,1,"11:25",2185,"Jace Hogan missed Free Throw.",19,13,"Jacksonville","Eastern Kentucky",NA,"400990920"
84,1,"11:25",2185,"Jacksonville Deadball Team Rebound.",19,13,"Jacksonville","Eastern Kentucky",NA,"400990920"
85,1,"11:25",2185,"Jace Hogan made Free Throw.",19,14,"Jacksonville","Eastern Kentucky",NA,"400990920"
86,1,"11:10",2170,"Peyton Broughton Turnover.",19,14,"Jacksonville","Eastern Kentucky",NA,"400990920"
87,1,"10:54",2154,"JD Notae Turnover.",19,14,"Jacksonville","Eastern Kentucky",NA,"400990920"
88,1,"10:53",2153,"JacQuess Hobbs Steal.",19,14,"Jacksonville","Eastern Kentucky",NA,"400990920"
89,1,"10:51",2151,"JacQuess Hobbs missed Layup.",19,14,"Jacksonville","Eastern Kentucky",NA,"400990920"
90,1,"10:51",2151,"Cody Helgeland Defensive Rebound.",19,14,"Jacksonville","Eastern Kentucky",NA,"400990920"
91,1,"10:24",2124,"Cody Helgeland made Three Point Jumper. Assisted by Devin Harris.",19,17,"Jacksonville","Eastern Kentucky",NA,"400990920"
92,1,"9:59",2099,"Nick Mayo Turnover.",19,17,"Jacksonville","Eastern Kentucky",NA,"400990920"
93,1,"9:58",2098,"Damien Sears Steal.",19,17,"Jacksonville","Eastern Kentucky",NA,"400990920"
94,1,"9:48",2088,"Cody Helgeland Turnover.",19,17,"Jacksonville","Eastern Kentucky",NA,"400990920"
95,1,"9:34",2074,"Dedric Boyd missed Layup.",19,17,"Jacksonville","Eastern Kentucky",NA,"400990920"
96,1,"9:34",2074,"Jalyn Hinton Block.",19,17,"Jacksonville","Eastern Kentucky",NA,"400990920"
97,1,"9:31",2071,"Eastern Kentucky Offensive Rebound.",19,17,"Jacksonville","Eastern Kentucky",NA,"400990920"
98,1,"9:24",2064,"Nick Mayo Turnover.",19,17,"Jacksonville","Eastern Kentucky",NA,"400990920"
99,1,"9:22",2062,"JD Notae Steal.",19,17,"Jacksonville","Eastern Kentucky",NA,"400990920"
100,1,"9:20",2060,"JD Notae made Layup.",19,19,"Jacksonville","Eastern Kentucky",NA,"400990920"
101,1,"9:01",2041,"Dedric Boyd made Three Point Jumper. Assisted by JacQuess Hobbs.",22,19,"Jacksonville","Eastern Kentucky",NA,"400990920"
102,1,"8:48",2028,"Devin Harris missed Layup.",22,19,"Jacksonville","Eastern Kentucky",NA,"400990920"
103,1,"8:48",2028,"JacQuess Hobbs Defensive Rebound.",22,19,"Jacksonville","Eastern Kentucky",NA,"400990920"
104,1,"8:36",2016,"Dillon Avare missed Three Point Jumper.",22,19,"Jacksonville","Eastern Kentucky",NA,"400990920"
105,1,"8:36",2016,"Devin Harris Defensive Rebound.",22,19,"Jacksonville","Eastern Kentucky",NA,"400990920"
106,1,"8:18",1998,"Jalyn Hinton made Layup.",22,21,"Jacksonville","Eastern Kentucky",NA,"400990920"
107,1,"8:18",1998,"Foul on Zach Charles.",22,21,"Jacksonville","Eastern Kentucky",NA,"400990920"
108,1,"8:18",1998,"Jalyn Hinton missed Free Throw.",22,21,"Jacksonville","Eastern Kentucky",NA,"400990920"
109,1,"8:18",1998,"Zach Charles Defensive Rebound.",22,21,"Jacksonville","Eastern Kentucky",NA,"400990920"
110,1,"7:58",1978,"Dedric Boyd Turnover.",22,21,"Jacksonville","Eastern Kentucky",NA,"400990920"
111,1,"7:57",1977,"Jalyn Hinton Steal.",22,21,"Jacksonville","Eastern Kentucky",NA,"400990920"
112,1,"7:47",1967,"Foul on Zach Charles.",22,21,"Jacksonville","Eastern Kentucky",NA,"400990920"
113,1,"7:47",1967,"Official TV Timeout",22,21,"Jacksonville","Eastern Kentucky",NA,"400990920"
114,1,"7:38",1958,"Devin Harris missed Three Point Jumper.",22,21,"Jacksonville","Eastern Kentucky",NA,"400990920"
115,1,"7:38",1958,"Dedric Boyd Defensive Rebound.",22,21,"Jacksonville","Eastern Kentucky",NA,"400990920"
116,1,"7:20",1940,"Asante Gist missed Jumper.",22,21,"Jacksonville","Eastern Kentucky",NA,"400990920"
117,1,"7:20",1940,"Jalyn Hinton Block.",22,21,"Jacksonville","Eastern Kentucky",NA,"400990920"
118,1,"7:18",1938,"Asante Gist Offensive Rebound.",22,21,"Jacksonville","Eastern Kentucky",NA,"400990920"
119,1,"7:10",1930,"DeAndre Dishman missed Jumper.",22,21,"Jacksonville","Eastern Kentucky",NA,"400990920"
120,1,"7:10",1930,"JD Notae Defensive Rebound.",22,21,"Jacksonville","Eastern Kentucky",NA,"400990920"
121,1,"6:58",1918,"Cody Helgeland made Layup. Assisted by Devin Harris.",22,23,"Jacksonville","Eastern Kentucky",NA,"400990920"
122,1,"6:33",1893,"Asante Gist Turnover.",22,23,"Jacksonville","Eastern Kentucky",NA,"400990920"
123,1,"6:32",1892,"Devin Harris Steal.",22,23,"Jacksonville","Eastern Kentucky",NA,"400990920"
124,1,"6:28",1888,"Foul on Dedric Boyd.",22,23,"Jacksonville","Eastern Kentucky",NA,"400990920"
125,1,"6:28",1888,"Devin Harris missed Free Throw.",22,23,"Jacksonville","Eastern Kentucky",NA,"400990920"
126,1,"6:28",1888,"Jacksonville Deadball Team Rebound.",22,23,"Jacksonville","Eastern Kentucky",NA,"400990920"
127,1,"6:28",1888,"Devin Harris made Free Throw.",22,24,"Jacksonville","Eastern Kentucky",NA,"400990920"
128,1,"6:20",1880,"Dedric Boyd Turnover.",22,24,"Jacksonville","Eastern Kentucky",NA,"400990920"
129,1,"6:07",1867,"JD Notae missed Layup.",22,24,"Jacksonville","Eastern Kentucky",NA,"400990920"
130,1,"6:07",1867,"Nick Mayo Block.",22,24,"Jacksonville","Eastern Kentucky",NA,"400990920"
131,1,"6:06",1866,"Nick Mayo Defensive Rebound.",22,24,"Jacksonville","Eastern Kentucky",NA,"400990920"
132,1,"5:46",1846,"Nick Mayo missed Jumper.",22,24,"Jacksonville","Eastern Kentucky",NA,"400990920"
133,1,"5:46",1846,"Devin Harris Defensive Rebound.",22,24,"Jacksonville","Eastern Kentucky",NA,"400990920"
134,1,"5:38",1838,"Devin Harris Turnover.",22,24,"Jacksonville","Eastern Kentucky",NA,"400990920"
135,1,"5:10",1810,"Asante Gist missed Jumper.",22,24,"Jacksonville","Eastern Kentucky",NA,"400990920"
136,1,"5:10",1810,"Devin Harris Defensive Rebound.",22,24,"Jacksonville","Eastern Kentucky",NA,"400990920"
137,1,"4:56",1796,"JD Notae missed Jumper.",22,24,"Jacksonville","Eastern Kentucky",NA,"400990920"
138,1,"4:56",1796,"A.J. Youngman Defensive Rebound.",22,24,"Jacksonville","Eastern Kentucky",NA,"400990920"
139,1,"4:48",1788,"Dillon Avare Turnover.",22,24,"Jacksonville","Eastern Kentucky",NA,"400990920"
140,1,"4:47",1787,"Cody Helgeland Steal.",22,24,"Jacksonville","Eastern Kentucky",NA,"400990920"
141,1,"4:23",1763,"Cody Helgeland missed Jumper.",22,24,"Jacksonville","Eastern Kentucky",NA,"400990920"
142,1,"4:23",1763,"Jalyn Hinton Offensive Rebound.",22,24,"Jacksonville","Eastern Kentucky",NA,"400990920"
143,1,"4:18",1758,"Devin Harris missed Jumper.",22,24,"Jacksonville","Eastern Kentucky",NA,"400990920"
144,1,"4:18",1758,"Eastern Kentucky Defensive Rebound.",22,24,"Jacksonville","Eastern Kentucky",NA,"400990920"
145,1,"4:01",1741,"Nick Mayo made Jumper. Assisted by Dillon Avare.",24,24,"Jacksonville","Eastern Kentucky",NA,"400990920"
146,1,"3:47",1727,"Jalyn Hinton missed Layup.",24,24,"Jacksonville","Eastern Kentucky",NA,"400990920"
147,1,"3:47",1727,"Nick Mayo Block.",24,24,"Jacksonville","Eastern Kentucky",NA,"400990920"
148,1,"3:47",1727,"Jacksonville Offensive Rebound.",24,24,"Jacksonville","Eastern Kentucky",NA,"400990920"
149,1,"3:44",1724,"Official TV Timeout",24,24,"Jacksonville","Eastern Kentucky",NA,"400990920"
150,1,"3:29",1709,"Jace Hogan made Three Point Jumper.",24,27,"Jacksonville","Eastern Kentucky",NA,"400990920"
151,1,"3:06",1686,"Dedric Boyd missed Three Point Jumper.",24,27,"Jacksonville","Eastern Kentucky",NA,"400990920"
152,1,"3:06",1686,"Eastern Kentucky Offensive Rebound.",24,27,"Jacksonville","Eastern Kentucky",NA,"400990920"
153,1,"2:54",1674,"Foul on Jace Hogan.",24,27,"Jacksonville","Eastern Kentucky",NA,"400990920"
154,1,"2:54",1674,"Nick Mayo made Free Throw.",25,27,"Jacksonville","Eastern Kentucky",NA,"400990920"
155,1,"2:54",1674,"Nick Mayo made Free Throw.",26,27,"Jacksonville","Eastern Kentucky",NA,"400990920"
156,1,"2:35",1655,"Jalyn Hinton missed Jumper.",26,27,"Jacksonville","Eastern Kentucky",NA,"400990920"
157,1,"2:35",1655,"Damien Sears Offensive Rebound.",26,27,"Jacksonville","Eastern Kentucky",NA,"400990920"
158,1,"2:28",1648,"Damien Sears made Two Point Tip Shot.",26,29,"Jacksonville","Eastern Kentucky",NA,"400990920"
159,1,"2:08",1628,"Dedric Boyd made Jumper.",28,29,"Jacksonville","Eastern Kentucky",NA,"400990920"
160,1,"1:57",1617,"Foul on JacQuess Hobbs.",28,29,"Jacksonville","Eastern Kentucky",NA,"400990920"
161,1,"1:57",1617,"Damien Sears missed Free Throw.",28,29,"Jacksonville","Eastern Kentucky",NA,"400990920"
162,1,"1:57",1617,"Nick Mayo Defensive Rebound.",28,29,"Jacksonville","Eastern Kentucky",NA,"400990920"
163,1,"1:42",1602,"Foul on Jalyn Hinton.",28,29,"Jacksonville","Eastern Kentucky",NA,"400990920"
164,1,"1:42",1602,"JacQuess Hobbs missed Free Throw.",28,29,"Jacksonville","Eastern Kentucky",NA,"400990920"
165,1,"1:42",1602,"Eastern Kentucky Deadball Team Rebound.",28,29,"Jacksonville","Eastern Kentucky",NA,"400990920"
166,1,"1:42",1602,"JacQuess Hobbs made Free Throw.",29,29,"Jacksonville","Eastern Kentucky",NA,"400990920"
167,1,"1:33",1593,"JD Notae Turnover.",29,29,"Jacksonville","Eastern Kentucky",NA,"400990920"
168,1,"1:16",1576,"Dujuanta Weaver missed Three Point Jumper.",29,29,"Jacksonville","Eastern Kentucky",NA,"400990920"
169,1,"1:16",1576,"Jalyn Hinton Defensive Rebound.",29,29,"Jacksonville","Eastern Kentucky",NA,"400990920"
170,1,"0:56",1556,"Damien Sears made Jumper. Assisted by Cody Helgeland.",29,31,"Jacksonville","Eastern Kentucky",NA,"400990920"
171,1,"0:54",1554,"Jacksonville  Timeout",29,31,"Jacksonville","Eastern Kentucky",NA,"400990920"
172,1,"0:46",1546,"Foul on JD Notae.",29,31,"Jacksonville","Eastern Kentucky",NA,"400990920"
173,1,"0:46",1546,"Dedric Boyd missed Free Throw.",29,31,"Jacksonville","Eastern Kentucky",NA,"400990920"
174,1,"0:46",1546,"Devin Harris Defensive Rebound.",29,31,"Jacksonville","Eastern Kentucky",NA,"400990920"
175,1,"0:29",1529,"JD Notae missed Layup.",29,31,"Jacksonville","Eastern Kentucky",NA,"400990920"
176,1,"0:29",1529,"Nick Mayo Defensive Rebound.",29,31,"Jacksonville","Eastern Kentucky",NA,"400990920"
177,1,"0:04",1504,"Dedric Boyd missed Three Point Jumper.",29,31,"Jacksonville","Eastern Kentucky",NA,"400990920"
178,1,"0:04",1504,"JD Notae Defensive Rebound.",29,31,"Jacksonville","Eastern Kentucky",NA,"400990920"
179,1,"0:00",1500,"End of 1st half",29,31,"Jacksonville","Eastern Kentucky",NA,"400990920"
180,2,"20:00",1500,"PLAY",29,31,"Jacksonville","Eastern Kentucky",NA,"400990920"
181,2,"19:48",1488,"Nick Mayo made Three Point Jumper.",32,31,"Jacksonville","Eastern Kentucky",NA,"400990920"
182,2,"19:18",1458,"Jace Hogan missed Jumper.",32,31,"Jacksonville","Eastern Kentucky",NA,"400990920"
183,2,"19:18",1458,"DeAndre Dishman Defensive Rebound.",32,31,"Jacksonville","Eastern Kentucky",NA,"400990920"
184,2,"19:05",1445,"Dedric Boyd made Three Point Jumper. Assisted by Nick Mayo.",35,31,"Jacksonville","Eastern Kentucky",NA,"400990920"
185,2,"18:44",1424,"Foul on Dillon Avare.",35,31,"Jacksonville","Eastern Kentucky",NA,"400990920"
186,2,"18:39",1419,"Devin Harris Turnover.",35,31,"Jacksonville","Eastern Kentucky",NA,"400990920"
187,2,"18:19",1399,"DeAndre Dishman made Layup. Assisted by Nick Mayo.",37,31,"Jacksonville","Eastern Kentucky",NA,"400990920"
188,2,"18:01",1381,"JD Notae missed Three Point Jumper.",37,31,"Jacksonville","Eastern Kentucky",NA,"400990920"
189,2,"18:01",1381,"Asante Gist Defensive Rebound.",37,31,"Jacksonville","Eastern Kentucky",NA,"400990920"
190,2,"17:49",1369,"Asante Gist made Jumper.",39,31,"Jacksonville","Eastern Kentucky",NA,"400990920"
191,2,"17:46",1366,"Jacksonville  Timeout",39,31,"Jacksonville","Eastern Kentucky",NA,"400990920"
192,2,"17:46",1366,"Official TV Timeout",39,31,"Jacksonville","Eastern Kentucky",NA,"400990920"
193,2,"17:27",1347,"Cody Helgeland made Three Point Jumper. Assisted by Devin Harris.",39,34,"Jacksonville","Eastern Kentucky",NA,"400990920"
194,2,"16:56",1316,"DeAndre Dishman made Layup. Assisted by Asante Gist.",41,34,"Jacksonville","Eastern Kentucky",NA,"400990920"
195,2,"16:43",1303,"Jace Hogan made Jumper. Assisted by Damien Sears.",41,36,"Jacksonville","Eastern Kentucky",NA,"400990920"
196,2,"16:22",1282,"Foul on JD Notae.",41,36,"Jacksonville","Eastern Kentucky",NA,"400990920"
197,2,"16:22",1282,"Nick Mayo Turnover.",41,36,"Jacksonville","Eastern Kentucky",NA,"400990920"
198,2,"16:22",1282,"JD Notae Steal.",41,36,"Jacksonville","Eastern Kentucky",NA,"400990920"
199,2,"16:22",1282,"Jace Hogan made Jumper. Assisted by JD Notae.",41,38,"Jacksonville","Eastern Kentucky",NA,"400990920"
200,2,"16:22",1282,"Dedric Boyd missed Three Point Jumper.",41,38,"Jacksonville","Eastern Kentucky",NA,"400990920"
201,2,"16:22",1282,"Damien Sears Defensive Rebound.",41,38,"Jacksonville","Eastern Kentucky",NA,"400990920"
202,2,"15:28",1228,"Jace Hogan Turnover.",41,38,"Jacksonville","Eastern Kentucky",NA,"400990920"
203,2,"15:28",1228,"Official TV Timeout",41,38,"Jacksonville","Eastern Kentucky",NA,"400990920"
204,2,"15:02",1202,"Asante Gist missed Jumper.",41,38,"Jacksonville","Eastern Kentucky",NA,"400990920"
205,2,"15:02",1202,"Jace Hogan Defensive Rebound.",41,38,"Jacksonville","Eastern Kentucky",NA,"400990920"
206,2,"14:51",1191,"Foul on Damien Sears.",41,38,"Jacksonville","Eastern Kentucky",NA,"400990920"
207,2,"14:51",1191,"Damien Sears Turnover.",41,38,"Jacksonville","Eastern Kentucky",NA,"400990920"
208,2,"14:28",1168,"DeAndre Dishman missed Layup.",41,38,"Jacksonville","Eastern Kentucky",NA,"400990920"
209,2,"14:28",1168,"DeAndre Dishman Offensive Rebound.",41,38,"Jacksonville","Eastern Kentucky",NA,"400990920"
210,2,"14:24",1164,"DeAndre Dishman missed Two Point Tip Shot.",41,38,"Jacksonville","Eastern Kentucky",NA,"400990920"
211,2,"14:24",1164,"Damien Sears Defensive Rebound.",41,38,"Jacksonville","Eastern Kentucky",NA,"400990920"
212,2,"14:16",1156,"Devin Harris missed Jumper.",41,38,"Jacksonville","Eastern Kentucky",NA,"400990920"
213,2,"14:16",1156,"Devin Harris Offensive Rebound.",41,38,"Jacksonville","Eastern Kentucky",NA,"400990920"
214,2,"14:13",1153,"Devin Harris missed Two Point Tip Shot.",41,38,"Jacksonville","Eastern Kentucky",NA,"400990920"
215,2,"14:13",1153,"Dedric Boyd Defensive Rebound.",41,38,"Jacksonville","Eastern Kentucky",NA,"400990920"
216,2,"13:49",1129,"Nick Mayo made Dunk. Assisted by Asante Gist.",43,38,"Jacksonville","Eastern Kentucky",NA,"400990920"
217,2,"13:46",1126,"Eastern Kentucky  Timeout",43,38,"Jacksonville","Eastern Kentucky",NA,"400990920"
218,2,"13:19",1099,"Cody Helgeland missed Three Point Jumper.",43,38,"Jacksonville","Eastern Kentucky",NA,"400990920"
219,2,"13:19",1099,"Nick Mayo Defensive Rebound.",43,38,"Jacksonville","Eastern Kentucky",NA,"400990920"
220,2,"12:58",1078,"Asante Gist Turnover.",43,38,"Jacksonville","Eastern Kentucky",NA,"400990920"
221,2,"12:58",1078,"JD Notae Steal.",43,38,"Jacksonville","Eastern Kentucky",NA,"400990920"
222,2,"12:46",1066,"Foul on Zach Charles.",43,38,"Jacksonville","Eastern Kentucky",NA,"400990920"
223,2,"12:46",1066,"Devin Harris made Free Throw.",43,39,"Jacksonville","Eastern Kentucky",NA,"400990920"
224,2,"12:46",1066,"Devin Harris missed Free Throw.",43,39,"Jacksonville","Eastern Kentucky",NA,"400990920"
225,2,"12:46",1066,"Zach Charles Defensive Rebound.",43,39,"Jacksonville","Eastern Kentucky",NA,"400990920"
226,2,"12:28",1048,"Dedric Boyd missed Layup.",43,39,"Jacksonville","Eastern Kentucky",NA,"400990920"
227,2,"12:28",1048,"Jalyn Hinton Block.",43,39,"Jacksonville","Eastern Kentucky",NA,"400990920"
228,2,"12:26",1046,"Devin Harris Defensive Rebound.",43,39,"Jacksonville","Eastern Kentucky",NA,"400990920"
229,2,"12:09",1029,"Damien Sears Turnover.",43,39,"Jacksonville","Eastern Kentucky",NA,"400990920"
230,2,"11:52",1012,"Asante Gist made Three Point Jumper.",46,39,"Jacksonville","Eastern Kentucky",NA,"400990920"
231,2,"11:29",989,"Foul on Dedric Boyd.",46,39,"Jacksonville","Eastern Kentucky",NA,"400990920"
232,2,"11:29",989,"Official TV Timeout",46,39,"Jacksonville","Eastern Kentucky",NA,"400990920"
233,2,"11:28",988,"Jacksonville  Turnover.",46,39,"Jacksonville","Eastern Kentucky",NA,"400990920"
234,2,"11:00",960,"Asante Gist missed Jumper.",46,39,"Jacksonville","Eastern Kentucky",NA,"400990920"
235,2,"11:00",960,"Jacksonville Defensive Rebound.",46,39,"Jacksonville","Eastern Kentucky",NA,"400990920"
236,2,"10:43",943,"Jace Hogan missed Jumper.",46,39,"Jacksonville","Eastern Kentucky",NA,"400990920"
237,2,"10:43",943,"Peyton Broughton Defensive Rebound.",46,39,"Jacksonville","Eastern Kentucky",NA,"400990920"
238,2,"10:16",916,"Peyton Broughton missed Jumper.",46,39,"Jacksonville","Eastern Kentucky",NA,"400990920"
239,2,"10:16",916,"Nick Mayo Offensive Rebound.",46,39,"Jacksonville","Eastern Kentucky",NA,"400990920"
240,2,"10:14",914,"Nick Mayo made Two Point Tip Shot.",48,39,"Jacksonville","Eastern Kentucky",NA,"400990920"
241,2,"10:13",913,"Foul on JD Notae.",48,39,"Jacksonville","Eastern Kentucky",NA,"400990920"
242,2,"10:13",913,"Nick Mayo missed Free Throw.",48,39,"Jacksonville","Eastern Kentucky",NA,"400990920"
243,2,"10:13",913,"Dujuanta Weaver Offensive Rebound.",48,39,"Jacksonville","Eastern Kentucky",NA,"400990920"
244,2,"9:46",886,"Dedric Boyd missed Three Point Jumper.",48,39,"Jacksonville","Eastern Kentucky",NA,"400990920"
245,2,"9:46",886,"Peyton Broughton Offensive Rebound.",48,39,"Jacksonville","Eastern Kentucky",NA,"400990920"
246,2,"9:38",878,"Asante Gist missed Three Point Jumper.",48,39,"Jacksonville","Eastern Kentucky",NA,"400990920"
247,2,"9:38",878,"JD Notae Defensive Rebound.",48,39,"Jacksonville","Eastern Kentucky",NA,"400990920"
248,2,"9:17",857,"Tanner Rubio missed Three Point Jumper.",48,39,"Jacksonville","Eastern Kentucky",NA,"400990920"
249,2,"9:16",856,"Dujuanta Weaver Block.",48,39,"Jacksonville","Eastern Kentucky",NA,"400990920"
250,2,"9:15",855,"Cody Helgeland Offensive Rebound.",48,39,"Jacksonville","Eastern Kentucky",NA,"400990920"
251,2,"9:11",851,"Devin Harris Turnover.",48,39,"Jacksonville","Eastern Kentucky",NA,"400990920"
252,2,"9:04",844,"Asante Gist made Jumper.",50,39,"Jacksonville","Eastern Kentucky",NA,"400990920"
253,2,"8:52",832,"JD Notae made Jumper.",50,41,"Jacksonville","Eastern Kentucky",NA,"400990920"
254,2,"8:27",807,"Foul on JD Notae.",50,41,"Jacksonville","Eastern Kentucky",NA,"400990920"
255,2,"8:18",798,"Foul on Jalyn Hinton.",50,41,"Jacksonville","Eastern Kentucky",NA,"400990920"
256,2,"8:12",792,"DeAndre Dishman Turnover.",50,41,"Jacksonville","Eastern Kentucky",NA,"400990920"
257,2,"8:02",782,"Devin Harris missed Layup.",50,41,"Jacksonville","Eastern Kentucky",NA,"400990920"
258,2,"8:02",782,"DeAndre Dishman Block.",50,41,"Jacksonville","Eastern Kentucky",NA,"400990920"
