"play_id","half","time_remaining_half","secs_remaining","description","home_score","away_score","away","home","home_favored_by","game_id"
270,2,"11:39",699,"Damien Sears made Free Throw.",62,51,"Webber Int.","Jacksonville",NA,"400991876"
271,2,"11:39",699,"Damien Sears missed Free Throw.",62,51,"Webber Int.","Jacksonville",NA,"400991876"
272,2,"11:39",699,"McDonald Jean-Louis Defensive Rebound.",62,51,"Webber Int.","Jacksonville",NA,"400991876"
273,2,"11:31",691,"Shaquille Williams missed Three Point Jumper.",62,51,"Webber Int.","Jacksonville",NA,"400991876"
274,2,"11:31",691,"Devin Harris Defensive Rebound.",62,51,"Webber Int.","Jacksonville",NA,"400991876"
275,2,"11:15",675,"Jace Hogan Turnover.",62,51,"Webber Int.","Jacksonville",NA,"400991876"
276,2,"11:00",660,"McDonald Jean-Louis Turnover.",62,51,"Webber Int.","Jacksonville",NA,"400991876"
277,2,"10:58",658,"Cody Helgeland Steal.",62,51,"Webber Int.","Jacksonville",NA,"400991876"
278,2,"10:43",643,"Devin Harris missed Jumper.",62,51,"Webber Int.","Jacksonville",NA,"400991876"
279,2,"10:43",643,"Obi Romeo Defensive Rebound.",62,51,"Webber Int.","Jacksonville",NA,"400991876"
280,2,"10:35",635,"Foul on Cody Helgeland.",62,51,"Webber Int.","Jacksonville",NA,"400991876"
281,2,"10:35",635,"Shaquille Williams made Free Throw.",62,52,"Webber Int.","Jacksonville",NA,"400991876"
282,2,"10:35",635,"Shaquille Williams made Free Throw.",62,53,"Webber Int.","Jacksonville",NA,"400991876"
283,2,"10:32",632,"Foul on Nicholas Blocker.",62,53,"Webber Int.","Jacksonville",NA,"400991876"
284,2,"10:32",632,"Tanner Rubio missed Free Throw.",62,53,"Webber Int.","Jacksonville",NA,"400991876"
285,2,"10:32",632,"Johnathan Childs Defensive Rebound.",62,53,"Webber Int.","Jacksonville",NA,"400991876"
286,2,"10:17",617,"McDonald Jean-Louis made Jumper. Assisted by Nicholas Blocker.",62,55,"Webber Int.","Jacksonville",NA,"400991876"
287,2,"10:06",606,"JD Notae made Layup. Assisted by Devin Harris.",64,55,"Webber Int.","Jacksonville",NA,"400991876"
288,2,"9:58",598,"Nicholas Blocker made Layup.",64,57,"Webber Int.","Jacksonville",NA,"400991876"
289,2,"9:40",580,"JD Notae missed Jumper.",64,57,"Webber Int.","Jacksonville",NA,"400991876"
290,2,"9:40",580,"Jace Hogan Offensive Rebound.",64,57,"Webber Int.","Jacksonville",NA,"400991876"
291,2,"9:40",580,"Jace Hogan made Layup.",66,57,"Webber Int.","Jacksonville",NA,"400991876"
292,2,"9:40",580,"Foul on McDonald Jean-Louis.",66,57,"Webber Int.","Jacksonville",NA,"400991876"
293,2,"9:40",580,"Jace Hogan made Free Throw.",67,57,"Webber Int.","Jacksonville",NA,"400991876"
294,2,"9:22",562,"Shaquille Williams made Layup.",67,59,"Webber Int.","Jacksonville",NA,"400991876"
295,2,"9:09",549,"Devin Harris made Layup.",69,59,"Webber Int.","Jacksonville",NA,"400991876"
296,2,"9:05",545,"Official TV Timeout",69,59,"Webber Int.","Jacksonville",NA,"400991876"
297,2,"8:52",532,"Nicholas Blocker Turnover.",69,59,"Webber Int.","Jacksonville",NA,"400991876"
298,2,"8:52",532,"JD Notae Steal.",69,59,"Webber Int.","Jacksonville",NA,"400991876"
299,2,"8:37",517,"JD Notae missed Three Point Jumper.",69,59,"Webber Int.","Jacksonville",NA,"400991876"
300,2,"8:37",517,"Cody Helgeland Offensive Rebound.",69,59,"Webber Int.","Jacksonville",NA,"400991876"
301,2,"8:35",515,"Cody Helgeland Turnover.",69,59,"Webber Int.","Jacksonville",NA,"400991876"
302,2,"8:33",513,"Shaquille Williams Steal.",69,59,"Webber Int.","Jacksonville",NA,"400991876"
303,2,"8:31",511,"Foul on Devin Harris.",69,59,"Webber Int.","Jacksonville",NA,"400991876"
304,2,"8:06",486,"Rasheem Etienne missed Three Point Jumper.",69,59,"Webber Int.","Jacksonville",NA,"400991876"
305,2,"8:06",486,"Devin Harris Defensive Rebound.",69,59,"Webber Int.","Jacksonville",NA,"400991876"
306,2,"8:00",480,"Foul on Rasheem Etienne.",69,59,"Webber Int.","Jacksonville",NA,"400991876"
307,2,"8:00",480,"Jace Hogan missed Free Throw.",69,59,"Webber Int.","Jacksonville",NA,"400991876"
308,2,"8:00",480,"Jacksonville Deadball Team Rebound.",69,59,"Webber Int.","Jacksonville",NA,"400991876"
309,2,"8:00",480,"Jace Hogan made Free Throw.",70,59,"Webber Int.","Jacksonville",NA,"400991876"
310,2,"7:48",468,"Andre Brooks made Dunk. Assisted by Osandai Vaughn.",70,61,"Webber Int.","Jacksonville",NA,"400991876"
311,2,"7:25",445,"Jace Hogan missed Jumper.",70,61,"Webber Int.","Jacksonville",NA,"400991876"
312,2,"7:25",445,"Tanner Rubio Offensive Rebound.",70,61,"Webber Int.","Jacksonville",NA,"400991876"
313,2,"7:17",437,"Cody Helgeland missed Three Point Jumper.",70,61,"Webber Int.","Jacksonville",NA,"400991876"
314,2,"7:17",437,"Osandai Vaughn Defensive Rebound.",70,61,"Webber Int.","Jacksonville",NA,"400991876"
315,2,"6:58",418,"Shaquille Williams missed Three Point Jumper.",70,61,"Webber Int.","Jacksonville",NA,"400991876"
316,2,"6:58",418,"Devin Harris Defensive Rebound.",70,61,"Webber Int.","Jacksonville",NA,"400991876"
317,2,"6:58",418,"Foul on Johnathan Childs.",70,61,"Webber Int.","Jacksonville",NA,"400991876"
318,2,"6:58",418,"Official TV Timeout",70,61,"Webber Int.","Jacksonville",NA,"400991876"
319,2,"6:58",418,"Devin Harris made Free Throw.",71,61,"Webber Int.","Jacksonville",NA,"400991876"
320,2,"6:58",418,"Devin Harris made Free Throw.",72,61,"Webber Int.","Jacksonville",NA,"400991876"
321,2,"6:34",394,"Andre Brooks missed Jumper.",72,61,"Webber Int.","Jacksonville",NA,"400991876"
322,2,"6:34",394,"Devin Harris Defensive Rebound.",72,61,"Webber Int.","Jacksonville",NA,"400991876"
323,2,"6:26",386,"JD Notae made Jumper. Assisted by Devin Harris.",74,61,"Webber Int.","Jacksonville",NA,"400991876"
324,2,"6:08",368,"Webber  Timeout",74,61,"Webber Int.","Jacksonville",NA,"400991876"
325,2,"5:52",352,"Rasheem Etienne made Layup.",74,63,"Webber Int.","Jacksonville",NA,"400991876"
326,2,"5:38",338,"JD Notae made Jumper.",76,63,"Webber Int.","Jacksonville",NA,"400991876"
327,2,"5:29",329,"Osandai Vaughn Turnover.",76,63,"Webber Int.","Jacksonville",NA,"400991876"
328,2,"5:11",311,"Foul on Nikita Orap.",76,63,"Webber Int.","Jacksonville",NA,"400991876"
329,2,"5:11",311,"JD Notae missed Free Throw.",76,63,"Webber Int.","Jacksonville",NA,"400991876"
330,2,"5:11",311,"Jacksonville Deadball Team Rebound.",76,63,"Webber Int.","Jacksonville",NA,"400991876"
331,2,"5:11",311,"JD Notae missed Free Throw.",76,63,"Webber Int.","Jacksonville",NA,"400991876"
332,2,"5:11",311,"Johnathan Childs Defensive Rebound.",76,63,"Webber Int.","Jacksonville",NA,"400991876"
333,2,"4:55",295,"Foul on Cody Helgeland.",76,63,"Webber Int.","Jacksonville",NA,"400991876"
334,2,"4:55",295,"Osandai Vaughn missed Free Throw.",76,63,"Webber Int.","Jacksonville",NA,"400991876"
335,2,"4:55",295,"Webber Deadball Team Rebound.",76,63,"Webber Int.","Jacksonville",NA,"400991876"
336,2,"4:55",295,"Osandai Vaughn made Free Throw.",76,64,"Webber Int.","Jacksonville",NA,"400991876"
337,2,"4:40",280,"Foul on Tommie Luke.",76,64,"Webber Int.","Jacksonville",NA,"400991876"
338,2,"4:40",280,"JD Notae made Free Throw.",77,64,"Webber Int.","Jacksonville",NA,"400991876"
339,2,"4:40",280,"JD Notae missed Free Throw.",77,64,"Webber Int.","Jacksonville",NA,"400991876"
340,2,"4:40",280,"Johnathan Childs Defensive Rebound.",77,64,"Webber Int.","Jacksonville",NA,"400991876"
341,2,"4:19",259,"Nikita Orap missed Three Point Jumper.",77,64,"Webber Int.","Jacksonville",NA,"400991876"
342,2,"4:19",259,"JD Notae Defensive Rebound.",77,64,"Webber Int.","Jacksonville",NA,"400991876"
343,2,"4:12",252,"Tanner Rubio made Three Point Jumper. Assisted by JD Notae.",80,64,"Webber Int.","Jacksonville",NA,"400991876"
344,2,"3:47",227,"Rasheem Etienne made Layup. Assisted by Johnathan Childs.",80,66,"Webber Int.","Jacksonville",NA,"400991876"
345,2,"3:30",210,"Radwan Bakkali made Layup.",82,66,"Webber Int.","Jacksonville",NA,"400991876"
346,2,"3:14",194,"Nikita Orap missed Three Point Jumper.",82,66,"Webber Int.","Jacksonville",NA,"400991876"
347,2,"3:14",194,"Tanner Rubio Defensive Rebound.",82,66,"Webber Int.","Jacksonville",NA,"400991876"
348,2,"3:07",187,"JD Notae Turnover.",82,66,"Webber Int.","Jacksonville",NA,"400991876"
349,2,"3:07",187,"Official TV Timeout",82,66,"Webber Int.","Jacksonville",NA,"400991876"
350,2,"2:56",176,"Tommie Luke missed Layup.",82,66,"Webber Int.","Jacksonville",NA,"400991876"
351,2,"2:56",176,"Radwan Bakkali Defensive Rebound.",82,66,"Webber Int.","Jacksonville",NA,"400991876"
352,2,"2:51",171,"Foul on Tommie Luke.",82,66,"Webber Int.","Jacksonville",NA,"400991876"
353,2,"2:51",171,"Radwan Bakkali missed Free Throw.",82,66,"Webber Int.","Jacksonville",NA,"400991876"
354,2,"2:51",171,"Jacksonville Deadball Team Rebound.",82,66,"Webber Int.","Jacksonville",NA,"400991876"
355,2,"2:51",171,"Radwan Bakkali made Free Throw.",83,66,"Webber Int.","Jacksonville",NA,"400991876"
356,2,"2:42",162,"Garrett Woodmansee missed Three Point Jumper.",83,66,"Webber Int.","Jacksonville",NA,"400991876"
357,2,"2:42",162,"Devin Harris Defensive Rebound.",83,66,"Webber Int.","Jacksonville",NA,"400991876"
358,2,"2:32",152,"Tanner Rubio missed Layup.",83,66,"Webber Int.","Jacksonville",NA,"400991876"
359,2,"2:32",152,"Johnathan Childs Defensive Rebound.",83,66,"Webber Int.","Jacksonville",NA,"400991876"
360,2,"2:22",142,"Johnathan Childs missed Three Point Jumper.",83,66,"Webber Int.","Jacksonville",NA,"400991876"
361,2,"2:22",142,"JD Notae Defensive Rebound.",83,66,"Webber Int.","Jacksonville",NA,"400991876"
362,2,"2:16",136,"Radwan Bakkali made Layup. Assisted by JD Notae.",85,66,"Webber Int.","Jacksonville",NA,"400991876"
363,2,"2:03",123,"Garrett Woodmansee missed Jumper.",85,66,"Webber Int.","Jacksonville",NA,"400991876"
364,2,"2:03",123,"Devin Harris Defensive Rebound.",85,66,"Webber Int.","Jacksonville",NA,"400991876"
365,2,"1:55",115,"Tanner Rubio missed Three Point Jumper.",85,66,"Webber Int.","Jacksonville",NA,"400991876"
366,2,"1:55",115,"Garrett Woodmansee Defensive Rebound.",85,66,"Webber Int.","Jacksonville",NA,"400991876"
367,2,"1:55",115,"Foul on Radwan Bakkali.",85,66,"Webber Int.","Jacksonville",NA,"400991876"
368,2,"1:55",115,"Garrett Woodmansee made Free Throw.",85,67,"Webber Int.","Jacksonville",NA,"400991876"
369,2,"1:55",115,"Garrett Woodmansee missed Free Throw.",85,67,"Webber Int.","Jacksonville",NA,"400991876"
370,2,"1:55",115,"Jace Hogan Defensive Rebound.",85,67,"Webber Int.","Jacksonville",NA,"400991876"
371,2,"1:47",107,"Devin Harris Turnover.",85,67,"Webber Int.","Jacksonville",NA,"400991876"
372,2,"1:43",103,"Shaquille Williams Steal.",85,67,"Webber Int.","Jacksonville",NA,"400991876"
373,2,"1:43",103,"Shaquille Williams Turnover.",85,67,"Webber Int.","Jacksonville",NA,"400991876"
374,2,"1:19",79,"Jace Hogan Turnover.",85,67,"Webber Int.","Jacksonville",NA,"400991876"
375,2,"1:11",71,"Rasheem Etienne missed Three Point Jumper.",85,67,"Webber Int.","Jacksonville",NA,"400991876"
376,2,"1:11",71,"Radwan Bakkali Defensive Rebound.",85,67,"Webber Int.","Jacksonville",NA,"400991876"
377,2,"0:57",57,"Foul on Shaquille Williams.",85,67,"Webber Int.","Jacksonville",NA,"400991876"
378,2,"0:57",57,"Corey Romich made Free Throw.",86,67,"Webber Int.","Jacksonville",NA,"400991876"
379,2,"0:57",57,"Corey Romich made Free Throw.",87,67,"Webber Int.","Jacksonville",NA,"400991876"
380,2,"0:50",50,"Shaquille Williams missed Jumper.",87,67,"Webber Int.","Jacksonville",NA,"400991876"
381,2,"0:50",50,"Radwan Bakkali Defensive Rebound.",87,67,"Webber Int.","Jacksonville",NA,"400991876"
382,2,"0:34",34,"Derrick Flowers missed Jumper.",87,67,"Webber Int.","Jacksonville",NA,"400991876"
383,2,"0:34",34,"Obi Romeo Defensive Rebound.",87,67,"Webber Int.","Jacksonville",NA,"400991876"
384,2,"0:34",34,"Foul on Radwan Bakkali.",87,67,"Webber Int.","Jacksonville",NA,"400991876"
385,2,"0:34",34,"Obi Romeo made Free Throw.",87,68,"Webber Int.","Jacksonville",NA,"400991876"
386,2,"0:34",34,"Obi Romeo missed Free Throw.",87,68,"Webber Int.","Jacksonville",NA,"400991876"
387,2,"0:34",34,"Jalyn Hinton Defensive Rebound.",87,68,"Webber Int.","Jacksonville",NA,"400991876"
388,2,"0:21",21,"Foul on Obi Romeo.",87,68,"Webber Int.","Jacksonville",NA,"400991876"
389,2,"0:21",21,"Radwan Bakkali missed Free Throw.",87,68,"Webber Int.","Jacksonville",NA,"400991876"
390,2,"0:21",21,"Jacksonville Deadball Team Rebound.",87,68,"Webber Int.","Jacksonville",NA,"400991876"
391,2,"0:21",21,"Radwan Bakkali made Free Throw.",88,68,"Webber Int.","Jacksonville",NA,"400991876"
392,2,"0:11",11,"Garrett Woodmansee missed Three Point Jumper.",88,68,"Webber Int.","Jacksonville",NA,"400991876"
393,2,"0:11",11,"Andre Brooks Offensive Rebound.",88,68,"Webber Int.","Jacksonville",NA,"400991876"
394,2,"0:07",7,"Andre Brooks made Layup.",88,70,"Webber Int.","Jacksonville",NA,"400991876"
395,2,"0:00",0,"End of Game",88,70,"Webber Int.","Jacksonville",NA,"400991876"
1,1,"20:00",2400,"PLAY",0,0,"Jacksonville","Wright State",9.5,"400991877"
2,1,"19:39",2379,"JD Notae missed Jumper.",0,0,"Jacksonville","Wright State",9.5,"400991877"
3,1,"19:39",2379,"Parker Ernsthausen Defensive Rebound.",0,0,"Jacksonville","Wright State",9.5,"400991877"
4,1,"19:26",2366,"Foul on Radwan Bakkali.",0,0,"Jacksonville","Wright State",9.5,"400991877"
5,1,"19:19",2359,"Justin Mitchell missed Layup.",0,0,"Jacksonville","Wright State",9.5,"400991877"
6,1,"19:19",2359,"Devin Harris Defensive Rebound.",0,0,"Jacksonville","Wright State",9.5,"400991877"
7,1,"19:08",2348,"Cody Helgeland made Three Point Jumper. Assisted by Devin Harris.",0,3,"Jacksonville","Wright State",9.5,"400991877"
8,1,"18:54",2334,"Justin Mitchell made Layup.",2,3,"Jacksonville","Wright State",9.5,"400991877"
9,1,"18:35",2315,"Jace Hogan missed Jumper.",2,3,"Jacksonville","Wright State",9.5,"400991877"
10,1,"18:35",2315,"Justin Mitchell Defensive Rebound.",2,3,"Jacksonville","Wright State",9.5,"400991877"
11,1,"18:09",2289,"Justin Mitchell missed Three Point Jumper.",2,3,"Jacksonville","Wright State",9.5,"400991877"
12,1,"18:09",2289,"Loudon Love Offensive Rebound.",2,3,"Jacksonville","Wright State",9.5,"400991877"
13,1,"18:05",2285,"Loudon Love missed Layup.",2,3,"Jacksonville","Wright State",9.5,"400991877"
14,1,"18:05",2285,"Loudon Love Offensive Rebound.",2,3,"Jacksonville","Wright State",9.5,"400991877"
15,1,"17:57",2277,"Grant Benzinger missed Jumper.",2,3,"Jacksonville","Wright State",9.5,"400991877"
16,1,"17:57",2277,"Justin Mitchell Offensive Rebound.",2,3,"Jacksonville","Wright State",9.5,"400991877"
17,1,"17:42",2262,"Mark Hughes made Three Point Jumper.",5,3,"Jacksonville","Wright State",9.5,"400991877"
18,1,"17:23",2243,"Cody Helgeland missed Three Point Jumper.",5,3,"Jacksonville","Wright State",9.5,"400991877"
19,1,"17:23",2243,"Parker Ernsthausen Block.",5,3,"Jacksonville","Wright State",9.5,"400991877"
20,1,"17:22",2242,"Devin Harris Offensive Rebound.",5,3,"Jacksonville","Wright State",9.5,"400991877"
21,1,"17:13",2233,"Jace Hogan missed Jumper.",5,3,"Jacksonville","Wright State",9.5,"400991877"
22,1,"17:13",2233,"Mark Hughes Defensive Rebound.",5,3,"Jacksonville","Wright State",9.5,"400991877"
23,1,"16:48",2208,"Justin Mitchell missed Three Point Jumper.",5,3,"Jacksonville","Wright State",9.5,"400991877"
24,1,"16:48",2208,"Justin Mitchell Offensive Rebound.",5,3,"Jacksonville","Wright State",9.5,"400991877"
25,1,"16:45",2205,"Foul on Jace Hogan.",5,3,"Jacksonville","Wright State",9.5,"400991877"
26,1,"16:41",2201,"Everett Winchester made Layup. Assisted by Justin Mitchell.",7,3,"Jacksonville","Wright State",9.5,"400991877"
27,1,"16:41",2201,"Foul on Damien Sears.",7,3,"Jacksonville","Wright State",9.5,"400991877"
28,1,"16:41",2201,"Everett Winchester missed Free Throw.",7,3,"Jacksonville","Wright State",9.5,"400991877"
29,1,"16:41",2201,"Devin Harris Defensive Rebound.",7,3,"Jacksonville","Wright State",9.5,"400991877"
30,1,"16:31",2191,"JD Notae missed Three Point Jumper.",7,3,"Jacksonville","Wright State",9.5,"400991877"
31,1,"16:31",2191,"Grant Benzinger Defensive Rebound.",7,3,"Jacksonville","Wright State",9.5,"400991877"
32,1,"16:18",2178,"Grant Benzinger missed Three Point Jumper.",7,3,"Jacksonville","Wright State",9.5,"400991877"
33,1,"16:18",2178,"Cody Helgeland Defensive Rebound.",7,3,"Jacksonville","Wright State",9.5,"400991877"
34,1,"15:50",2150,"JD Notae made Jumper.",7,5,"Jacksonville","Wright State",9.5,"400991877"
35,1,"15:36",2136,"Everett Winchester missed Jumper.",7,5,"Jacksonville","Wright State",9.5,"400991877"
36,1,"15:36",2136,"JD Notae Defensive Rebound.",7,5,"Jacksonville","Wright State",9.5,"400991877"
37,1,"15:27",2127,"Devin Harris missed Three Point Jumper.",7,5,"Jacksonville","Wright State",9.5,"400991877"
38,1,"15:27",2127,"Justin Mitchell Defensive Rebound.",7,5,"Jacksonville","Wright State",9.5,"400991877"
39,1,"15:18",2118,"Mark Hughes made Three Point Jumper. Assisted by Justin Mitchell.",10,5,"Jacksonville","Wright State",9.5,"400991877"
40,1,"14:57",2097,"Foul on Grant Benzinger.",10,5,"Jacksonville","Wright State",9.5,"400991877"
41,1,"14:57",2097,"Official TV Timeout",10,5,"Jacksonville","Wright State",9.5,"400991877"
42,1,"14:53",2093,"Foul on Radwan Bakkali.",10,5,"Jacksonville","Wright State",9.5,"400991877"
43,1,"14:53",2093,"Radwan Bakkali Turnover.",10,5,"Jacksonville","Wright State",9.5,"400991877"
44,1,"14:28",2068,"Justin Mitchell missed Jumper.",10,5,"Jacksonville","Wright State",9.5,"400991877"
45,1,"14:28",2068,"Devin Harris Defensive Rebound.",10,5,"Jacksonville","Wright State",9.5,"400991877"
46,1,"14:09",2049,"Damien Sears missed Jumper.",10,5,"Jacksonville","Wright State",9.5,"400991877"
47,1,"14:09",2049,"Justin Mitchell Block.",10,5,"Jacksonville","Wright State",9.5,"400991877"
48,1,"14:06",2046,"Grant Benzinger Defensive Rebound.",10,5,"Jacksonville","Wright State",9.5,"400991877"
49,1,"13:57",2037,"Foul on JD Notae.",10,5,"Jacksonville","Wright State",9.5,"400991877"
50,1,"13:48",2028,"Parker Ernsthausen made Jumper. Assisted by Mark Hughes.",12,5,"Jacksonville","Wright State",9.5,"400991877"
51,1,"13:26",2006,"Devin Harris missed Jumper.",12,5,"Jacksonville","Wright State",9.5,"400991877"
52,1,"13:26",2006,"Everett Winchester Defensive Rebound.",12,5,"Jacksonville","Wright State",9.5,"400991877"
53,1,"13:16",1996,"Grant Benzinger made Layup.",14,5,"Jacksonville","Wright State",9.5,"400991877"
54,1,"12:47",1967,"Jace Hogan Turnover.",14,5,"Jacksonville","Wright State",9.5,"400991877"
55,1,"12:29",1949,"Jaylon Hall made Three Point Jumper. Assisted by Mark Hughes.",17,5,"Jacksonville","Wright State",9.5,"400991877"
56,1,"12:15",1935,"Tanner Rubio made Jumper.",17,7,"Jacksonville","Wright State",9.5,"400991877"
57,1,"11:53",1913,"Grant Benzinger made Layup.",19,7,"Jacksonville","Wright State",9.5,"400991877"
58,1,"11:53",1913,"Foul on Damien Sears.",19,7,"Jacksonville","Wright State",9.5,"400991877"
59,1,"11:53",1913,"Official TV Timeout",19,7,"Jacksonville","Wright State",9.5,"400991877"
60,1,"11:53",1913,"Grant Benzinger made Free Throw.",20,7,"Jacksonville","Wright State",9.5,"400991877"
61,1,"11:32",1892,"Jace Hogan made Jumper.",20,9,"Jacksonville","Wright State",9.5,"400991877"
62,1,"11:15",1875,"Justin Mitchell missed Three Point Jumper.",20,9,"Jacksonville","Wright State",9.5,"400991877"
63,1,"11:15",1875,"Jace Hogan Defensive Rebound.",20,9,"Jacksonville","Wright State",9.5,"400991877"
64,1,"10:44",1844,"Foul on Justin Mitchell.",20,9,"Jacksonville","Wright State",9.5,"400991877"
65,1,"10:44",1844,"Devin Harris made Free Throw.",20,10,"Jacksonville","Wright State",9.5,"400991877"
66,1,"10:44",1844,"Devin Harris made Free Throw.",20,11,"Jacksonville","Wright State",9.5,"400991877"
67,1,"10:21",1821,"Mark Hughes made Three Point Jumper. Assisted by Everett Winchester.",23,11,"Jacksonville","Wright State",9.5,"400991877"
68,1,"9:56",1796,"Jace Hogan made Jumper. Assisted by Devin Harris.",23,13,"Jacksonville","Wright State",9.5,"400991877"
69,1,"9:38",1778,"Justin Mitchell missed Jumper.",23,13,"Jacksonville","Wright State",9.5,"400991877"
70,1,"9:38",1778,"Wright State Offensive Rebound.",23,13,"Jacksonville","Wright State",9.5,"400991877"
71,1,"9:27",1767,"Jaylon Hall missed Three Point Jumper.",23,13,"Jacksonville","Wright State",9.5,"400991877"
72,1,"9:27",1767,"JD Notae Defensive Rebound.",23,13,"Jacksonville","Wright State",9.5,"400991877"
73,1,"9:14",1754,"Jace Hogan made Jumper. Assisted by Devin Harris.",23,15,"Jacksonville","Wright State",9.5,"400991877"
74,1,"8:59",1739,"Justin Mitchell made Jumper.",25,15,"Jacksonville","Wright State",9.5,"400991877"
75,1,"8:45",1725,"JD Notae Turnover.",25,15,"Jacksonville","Wright State",9.5,"400991877"
76,1,"8:28",1708,"Foul on JD Notae.",25,15,"Jacksonville","Wright State",9.5,"400991877"
77,1,"8:28",1708,"Parker Ernsthausen missed Free Throw.",25,15,"Jacksonville","Wright State",9.5,"400991877"
78,1,"8:28",1708,"Parker Ernsthausen Offensive Rebound.",25,15,"Jacksonville","Wright State",9.5,"400991877"
79,1,"8:21",1701,"Grant Benzinger made Three Point Jumper. Assisted by Mark Hughes.",28,15,"Jacksonville","Wright State",9.5,"400991877"
80,1,"7:45",1665,"Jacksonville  Turnover.",28,15,"Jacksonville","Wright State",9.5,"400991877"
81,1,"7:45",1665,"Official TV Timeout",28,15,"Jacksonville","Wright State",9.5,"400991877"
82,1,"7:21",1641,"Foul on Jalyn Hinton.",28,15,"Jacksonville","Wright State",9.5,"400991877"
83,1,"7:21",1641,"Justin Mitchell missed Free Throw.",28,15,"Jacksonville","Wright State",9.5,"400991877"
84,1,"7:21",1641,"Wright State Deadball Team Rebound.",28,15,"Jacksonville","Wright State",9.5,"400991877"
85,1,"7:21",1641,"Justin Mitchell made Free Throw.",29,15,"Jacksonville","Wright State",9.5,"400991877"
86,1,"7:10",1630,"Foul on Jaylon Hall.",29,15,"Jacksonville","Wright State",9.5,"400991877"
87,1,"6:55",1615,"Tanner Rubio missed Three Point Jumper.",29,15,"Jacksonville","Wright State",9.5,"400991877"
88,1,"6:55",1615,"Mark Hughes Defensive Rebound.",29,15,"Jacksonville","Wright State",9.5,"400991877"
89,1,"6:36",1596,"Justin Mitchell missed Jumper.",29,15,"Jacksonville","Wright State",9.5,"400991877"
90,1,"6:36",1596,"Justin Mitchell Offensive Rebound.",29,15,"Jacksonville","Wright State",9.5,"400991877"
91,1,"6:21",1581,"Jaylon Hall missed Jumper.",29,15,"Jacksonville","Wright State",9.5,"400991877"
92,1,"6:21",1581,"Jalyn Hinton Defensive Rebound.",29,15,"Jacksonville","Wright State",9.5,"400991877"
93,1,"6:03",1563,"Tanner Rubio made Jumper. Assisted by Devin Harris.",29,17,"Jacksonville","Wright State",9.5,"400991877"
94,1,"5:45",1545,"Justin Mitchell missed Jumper.",29,17,"Jacksonville","Wright State",9.5,"400991877"
95,1,"5:45",1545,"Jalyn Hinton Defensive Rebound.",29,17,"Jacksonville","Wright State",9.5,"400991877"
96,1,"5:37",1537,"Tanner Rubio made Three Point Jumper. Assisted by Devin Harris.",29,20,"Jacksonville","Wright State",9.5,"400991877"
97,1,"5:23",1523,"Justin Mitchell made Layup.",31,20,"Jacksonville","Wright State",9.5,"400991877"
98,1,"5:11",1511,"Cody Helgeland made Three Point Jumper. Assisted by Jace Hogan.",31,23,"Jacksonville","Wright State",9.5,"400991877"
99,1,"5:09",1509,"Jacksonville  Timeout",31,23,"Jacksonville","Wright State",9.5,"400991877"
100,1,"4:39",1479,"Grant Benzinger made Jumper. Assisted by Tye Wilburn.",33,23,"Jacksonville","Wright State",9.5,"400991877"
101,1,"4:14",1454,"Cody Helgeland Turnover.",33,23,"Jacksonville","Wright State",9.5,"400991877"
102,1,"3:53",1433,"Everett Winchester made Layup.",35,23,"Jacksonville","Wright State",9.5,"400991877"
103,1,"3:33",1413,"Tanner Rubio missed Layup.",35,23,"Jacksonville","Wright State",9.5,"400991877"
104,1,"3:33",1413,"Grant Benzinger Defensive Rebound.",35,23,"Jacksonville","Wright State",9.5,"400991877"
105,1,"3:07",1387,"Mark Hughes made Dunk.",37,23,"Jacksonville","Wright State",9.5,"400991877"
106,1,"2:51",1371,"Tanner Rubio made Jumper.",37,25,"Jacksonville","Wright State",9.5,"400991877"
107,1,"2:50",1370,"Foul on Mark Hughes.",37,25,"Jacksonville","Wright State",9.5,"400991877"
108,1,"2:50",1370,"Official TV Timeout",37,25,"Jacksonville","Wright State",9.5,"400991877"
109,1,"2:50",1370,"Tanner Rubio made Free Throw.",37,26,"Jacksonville","Wright State",9.5,"400991877"
110,1,"2:34",1354,"Foul on Jace Hogan.",37,26,"Jacksonville","Wright State",9.5,"400991877"
111,1,"2:34",1354,"Loudon Love missed Free Throw.",37,26,"Jacksonville","Wright State",9.5,"400991877"
112,1,"2:34",1354,"Cody Helgeland Defensive Rebound.",37,26,"Jacksonville","Wright State",9.5,"400991877"
113,1,"2:11",1331,"Tanner Rubio missed Three Point Jumper.",37,26,"Jacksonville","Wright State",9.5,"400991877"
114,1,"2:11",1331,"Wright State Defensive Rebound.",37,26,"Jacksonville","Wright State",9.5,"400991877"
115,1,"1:42",1302,"Mark Hughes missed Three Point Jumper.",37,26,"Jacksonville","Wright State",9.5,"400991877"
116,1,"1:42",1302,"Loudon Love Offensive Rebound.",37,26,"Jacksonville","Wright State",9.5,"400991877"
117,1,"1:36",1296,"Loudon Love Turnover.",37,26,"Jacksonville","Wright State",9.5,"400991877"
118,1,"1:35",1295,"Tanner Rubio Steal.",37,26,"Jacksonville","Wright State",9.5,"400991877"
119,1,"1:31",1291,"Foul on Justin Mitchell.",37,26,"Jacksonville","Wright State",9.5,"400991877"
120,1,"1:31",1291,"Devin Harris made Free Throw.",37,27,"Jacksonville","Wright State",9.5,"400991877"
121,1,"1:31",1291,"Devin Harris made Free Throw.",37,28,"Jacksonville","Wright State",9.5,"400991877"
122,1,"1:10",1270,"Grant Benzinger missed Three Point Jumper.",37,28,"Jacksonville","Wright State",9.5,"400991877"
123,1,"1:10",1270,"Corey Romich Defensive Rebound.",37,28,"Jacksonville","Wright State",9.5,"400991877"
124,1,"1:00",1260,"Cody Helgeland missed Three Point Jumper.",37,28,"Jacksonville","Wright State",9.5,"400991877"
125,1,"1:00",1260,"Grant Benzinger Defensive Rebound.",37,28,"Jacksonville","Wright State",9.5,"400991877"
126,1,"0:41",1241,"Foul on Tanner Rubio.",37,28,"Jacksonville","Wright State",9.5,"400991877"
127,1,"0:41",1241,"Grant Benzinger made Free Throw.",38,28,"Jacksonville","Wright State",9.5,"400991877"
