"play_id","half","time_remaining_half","secs_remaining","description","home_score","away_score","away","home","home_favored_by","game_id"
1,1,"20:00",2400,"PLAY",0,0,"Jacksonville","UAB",NA,"400991874"
2,1,"19:47",2387,"Nick Norton missed Three Point Jumper.",0,0,"Jacksonville","UAB",NA,"400991874"
3,1,"19:47",2387,"Devin Harris Defensive Rebound.",0,0,"Jacksonville","UAB",NA,"400991874"
4,1,"19:16",2356,"Devin Harris missed Three Point Jumper.",0,0,"Jacksonville","UAB",NA,"400991874"
5,1,"19:16",2356,"Nate Darling Defensive Rebound.",0,0,"Jacksonville","UAB",NA,"400991874"
6,1,"19:08",2348,"Chris Cokley missed Jumper.",0,0,"Jacksonville","UAB",NA,"400991874"
7,1,"19:08",2348,"Chris Cokley Offensive Rebound.",0,0,"Jacksonville","UAB",NA,"400991874"
8,1,"18:58",2338,"JD Notae made Three Point Jumper.",0,3,"Jacksonville","UAB",NA,"400991874"
9,1,"18:32",2312,"William Lee missed Jumper.",0,3,"Jacksonville","UAB",NA,"400991874"
10,1,"18:32",2312,"JD Notae Defensive Rebound.",0,3,"Jacksonville","UAB",NA,"400991874"
11,1,"18:17",2297,"Radwan Bakkali Turnover.",0,3,"Jacksonville","UAB",NA,"400991874"
12,1,"18:08",2288,"Zack Bryant missed Three Point Jumper.",0,3,"Jacksonville","UAB",NA,"400991874"
13,1,"18:08",2288,"William Lee Offensive Rebound.",0,3,"Jacksonville","UAB",NA,"400991874"
14,1,"17:59",2279,"Zack Bryant made Layup.",2,3,"Jacksonville","UAB",NA,"400991874"
15,1,"17:40",2260,"Radwan Bakkali Turnover.",2,3,"Jacksonville","UAB",NA,"400991874"
16,1,"17:31",2251,"Zack Bryant made Three Point Jumper. Assisted by William Lee.",5,3,"Jacksonville","UAB",NA,"400991874"
17,1,"16:57",2217,"JD Notae missed Three Point Jumper.",5,3,"Jacksonville","UAB",NA,"400991874"
18,1,"16:57",2217,"William Lee Defensive Rebound.",5,3,"Jacksonville","UAB",NA,"400991874"
19,1,"16:50",2210,"Nate Darling missed Three Point Jumper.",5,3,"Jacksonville","UAB",NA,"400991874"
20,1,"16:50",2210,"Chris Cokley Offensive Rebound.",5,3,"Jacksonville","UAB",NA,"400991874"
21,1,"16:44",2204,"Foul on JD Notae.",5,3,"Jacksonville","UAB",NA,"400991874"
22,1,"16:44",2204,"Chris Cokley made Free Throw.",6,3,"Jacksonville","UAB",NA,"400991874"
23,1,"16:44",2204,"Chris Cokley made Free Throw.",7,3,"Jacksonville","UAB",NA,"400991874"
24,1,"16:36",2196,"Foul on Zack Bryant.",7,3,"Jacksonville","UAB",NA,"400991874"
25,1,"16:29",2189,"Cody Helgeland missed Three Point Jumper.",7,3,"Jacksonville","UAB",NA,"400991874"
26,1,"16:29",2189,"Damien Sears Offensive Rebound.",7,3,"Jacksonville","UAB",NA,"400991874"
27,1,"16:23",2183,"Tanner Rubio missed Three Point Jumper.",7,3,"Jacksonville","UAB",NA,"400991874"
28,1,"16:23",2183,"Nate Darling Defensive Rebound.",7,3,"Jacksonville","UAB",NA,"400991874"
29,1,"16:16",2176,"Nate Darling missed Three Point Jumper.",7,3,"Jacksonville","UAB",NA,"400991874"
30,1,"16:16",2176,"Cody Helgeland Defensive Rebound.",7,3,"Jacksonville","UAB",NA,"400991874"
31,1,"15:59",2159,"Devin Harris made Jumper.",7,5,"Jacksonville","UAB",NA,"400991874"
32,1,"15:36",2136,"Nate Darling Turnover.",7,5,"Jacksonville","UAB",NA,"400991874"
33,1,"15:34",2134,"Devin Harris Steal.",7,5,"Jacksonville","UAB",NA,"400991874"
34,1,"15:32",2132,"Devin Harris made Layup.",7,7,"Jacksonville","UAB",NA,"400991874"
35,1,"15:07",2107,"Nate Darling made Three Point Jumper. Assisted by Chris Cokley.",10,7,"Jacksonville","UAB",NA,"400991874"
36,1,"14:43",2083,"Foul on William Lee.",10,7,"Jacksonville","UAB",NA,"400991874"
37,1,"14:43",2083,"Official TV Timeout",10,7,"Jacksonville","UAB",NA,"400991874"
38,1,"14:39",2079,"Damien Sears made Layup. Assisted by JD Notae.",10,9,"Jacksonville","UAB",NA,"400991874"
39,1,"14:12",2052,"Jalen Perry made Three Point Jumper. Assisted by Nate Darling.",13,9,"Jacksonville","UAB",NA,"400991874"
40,1,"13:46",2026,"Damien Sears made Layup.",13,11,"Jacksonville","UAB",NA,"400991874"
41,1,"13:21",2001,"Lewis Sullivan missed Layup.",13,11,"Jacksonville","UAB",NA,"400991874"
42,1,"13:21",2001,"Damien Sears Defensive Rebound.",13,11,"Jacksonville","UAB",NA,"400991874"
43,1,"13:15",1995,"Devin Harris missed Three Point Jumper.",13,11,"Jacksonville","UAB",NA,"400991874"
44,1,"13:15",1995,"Zack Bryant Defensive Rebound.",13,11,"Jacksonville","UAB",NA,"400991874"
45,1,"13:08",1988,"Zack Bryant made Layup.",15,11,"Jacksonville","UAB",NA,"400991874"
46,1,"12:39",1959,"Cody Helgeland missed Layup.",15,11,"Jacksonville","UAB",NA,"400991874"
47,1,"12:39",1959,"Jalen Perry Block.",15,11,"Jacksonville","UAB",NA,"400991874"
48,1,"12:36",1956,"Lewis Sullivan Defensive Rebound.",15,11,"Jacksonville","UAB",NA,"400991874"
49,1,"12:32",1952,"UAB  Timeout",15,11,"Jacksonville","UAB",NA,"400991874"
50,1,"12:16",1936,"Lewis Sullivan made Layup. Assisted by Zack Bryant.",17,11,"Jacksonville","UAB",NA,"400991874"
51,1,"11:58",1918,"Cody Helgeland made Three Point Jumper.",17,14,"Jacksonville","UAB",NA,"400991874"
52,1,"11:42",1902,"Zack Bryant made Layup.",19,14,"Jacksonville","UAB",NA,"400991874"
53,1,"11:25",1885,"Tanner Rubio Turnover.",19,14,"Jacksonville","UAB",NA,"400991874"
54,1,"11:24",1884,"Lewis Sullivan Steal.",19,14,"Jacksonville","UAB",NA,"400991874"
55,1,"11:20",1880,"Zack Bryant made Layup. Assisted by Lewis Sullivan.",21,14,"Jacksonville","UAB",NA,"400991874"
56,1,"11:04",1864,"Tanner Rubio made Jumper.",21,16,"Jacksonville","UAB",NA,"400991874"
57,1,"10:51",1851,"Deion Lavender Turnover.",21,16,"Jacksonville","UAB",NA,"400991874"
58,1,"10:51",1851,"Official TV Timeout",21,16,"Jacksonville","UAB",NA,"400991874"
59,1,"10:50",1850,"Jacksonville  Turnover.",21,16,"Jacksonville","UAB",NA,"400991874"
60,1,"10:49",1849,"Nick Norton missed Three Point Jumper.",21,16,"Jacksonville","UAB",NA,"400991874"
61,1,"10:49",1849,"Devin Harris Defensive Rebound.",21,16,"Jacksonville","UAB",NA,"400991874"
62,1,"10:37",1837,"Cody Helgeland missed Layup.",21,16,"Jacksonville","UAB",NA,"400991874"
63,1,"10:37",1837,"Makhtar Gueye Defensive Rebound.",21,16,"Jacksonville","UAB",NA,"400991874"
64,1,"10:29",1829,"Foul on Tanner Rubio.",21,16,"Jacksonville","UAB",NA,"400991874"
65,1,"10:29",1829,"Deion Lavender missed Free Throw.",21,16,"Jacksonville","UAB",NA,"400991874"
66,1,"10:29",1829,"Jacksonville Deadball Team Rebound.",21,16,"Jacksonville","UAB",NA,"400991874"
67,1,"10:29",1829,"Deion Lavender made Free Throw.",22,16,"Jacksonville","UAB",NA,"400991874"
68,1,"10:19",1819,"JD Notae missed Layup.",22,16,"Jacksonville","UAB",NA,"400991874"
69,1,"10:19",1819,"Lewis Sullivan Block.",22,16,"Jacksonville","UAB",NA,"400991874"
70,1,"10:19",1819,"JD Notae Offensive Rebound.",22,16,"Jacksonville","UAB",NA,"400991874"
71,1,"10:19",1819,"JD Notae Turnover.",22,16,"Jacksonville","UAB",NA,"400991874"
72,1,"10:15",1815,"Chris Cokley made Dunk. Assisted by Nick Norton.",24,16,"Jacksonville","UAB",NA,"400991874"
73,1,"10:06",1806,"Tanner Rubio missed Three Point Jumper.",24,16,"Jacksonville","UAB",NA,"400991874"
74,1,"10:06",1806,"Chris Cokley Defensive Rebound.",24,16,"Jacksonville","UAB",NA,"400991874"
75,1,"9:51",1791,"Lewis Sullivan Turnover.",24,16,"Jacksonville","UAB",NA,"400991874"
76,1,"9:30",1770,"Tanner Rubio Turnover.",24,16,"Jacksonville","UAB",NA,"400991874"
77,1,"9:30",1770,"Foul on Tanner Rubio.",24,16,"Jacksonville","UAB",NA,"400991874"
78,1,"9:13",1753,"Jalen Perry missed Jumper.",24,16,"Jacksonville","UAB",NA,"400991874"
79,1,"9:13",1753,"Lee Richmond Defensive Rebound.",24,16,"Jacksonville","UAB",NA,"400991874"
80,1,"9:04",1744,"Cody Helgeland Turnover.",24,16,"Jacksonville","UAB",NA,"400991874"
81,1,"9:02",1742,"Lewis Sullivan Steal.",24,16,"Jacksonville","UAB",NA,"400991874"
82,1,"8:58",1738,"Lewis Sullivan Turnover.",24,16,"Jacksonville","UAB",NA,"400991874"
83,1,"8:56",1736,"Lee Richmond Steal.",24,16,"Jacksonville","UAB",NA,"400991874"
84,1,"8:37",1717,"Devin Harris missed Layup.",24,16,"Jacksonville","UAB",NA,"400991874"
85,1,"8:37",1717,"Chris Cokley Defensive Rebound.",24,16,"Jacksonville","UAB",NA,"400991874"
86,1,"8:28",1708,"Chris Cokley made Layup. Assisted by Nick Norton.",26,16,"Jacksonville","UAB",NA,"400991874"
87,1,"8:06",1686,"Radwan Bakkali missed Layup.",26,16,"Jacksonville","UAB",NA,"400991874"
88,1,"8:06",1686,"Chris Cokley Defensive Rebound.",26,16,"Jacksonville","UAB",NA,"400991874"
89,1,"7:58",1678,"Foul on Lee Richmond.",26,16,"Jacksonville","UAB",NA,"400991874"
90,1,"7:58",1678,"Official TV Timeout",26,16,"Jacksonville","UAB",NA,"400991874"
91,1,"7:35",1655,"Nick Norton Turnover.",26,16,"Jacksonville","UAB",NA,"400991874"
92,1,"7:33",1653,"Devin Harris Steal.",26,16,"Jacksonville","UAB",NA,"400991874"
93,1,"7:32",1652,"Devin Harris made Dunk.",26,18,"Jacksonville","UAB",NA,"400991874"
94,1,"7:10",1630,"Chris Cokley made Dunk. Assisted by Nick Norton.",28,18,"Jacksonville","UAB",NA,"400991874"
95,1,"6:51",1611,"JD Notae missed Three Point Jumper.",28,18,"Jacksonville","UAB",NA,"400991874"
96,1,"6:51",1611,"Chris Cokley Defensive Rebound.",28,18,"Jacksonville","UAB",NA,"400991874"
97,1,"6:39",1599,"Chris Cokley made Jumper. Assisted by Jalen Perry.",30,18,"Jacksonville","UAB",NA,"400991874"
98,1,"6:18",1578,"Foul on Jalen Perry.",30,18,"Jacksonville","UAB",NA,"400991874"
99,1,"6:18",1578,"Corey Romich Turnover.",30,18,"Jacksonville","UAB",NA,"400991874"
100,1,"6:18",1578,"Foul on Corey Romich.",30,18,"Jacksonville","UAB",NA,"400991874"
101,1,"5:56",1556,"William Lee missed Three Point Jumper.",30,18,"Jacksonville","UAB",NA,"400991874"
102,1,"5:56",1556,"Cody Helgeland Defensive Rebound.",30,18,"Jacksonville","UAB",NA,"400991874"
103,1,"5:49",1549,"Foul on Zack Bryant.",30,18,"Jacksonville","UAB",NA,"400991874"
104,1,"5:37",1537,"Cody Helgeland missed Three Point Jumper.",30,18,"Jacksonville","UAB",NA,"400991874"
105,1,"5:36",1536,"Chris Cokley Defensive Rebound.",30,18,"Jacksonville","UAB",NA,"400991874"
106,1,"5:34",1534,"Foul on Damien Sears.",30,18,"Jacksonville","UAB",NA,"400991874"
107,1,"5:34",1534,"Chris Cokley made Free Throw.",31,18,"Jacksonville","UAB",NA,"400991874"
108,1,"5:34",1534,"Chris Cokley made Free Throw.",32,18,"Jacksonville","UAB",NA,"400991874"
109,1,"5:21",1521,"Damien Sears Turnover.",32,18,"Jacksonville","UAB",NA,"400991874"
110,1,"5:00",1500,"William Lee made Jumper. Assisted by Nick Norton.",34,18,"Jacksonville","UAB",NA,"400991874"
111,1,"5:00",1500,"Foul on Lee Richmond.",34,18,"Jacksonville","UAB",NA,"400991874"
112,1,"5:00",1500,"William Lee made Free Throw.",35,18,"Jacksonville","UAB",NA,"400991874"
113,1,"4:47",1487,"Cody Helgeland missed Three Point Jumper.",35,18,"Jacksonville","UAB",NA,"400991874"
114,1,"4:47",1487,"Makhtar Gueye Defensive Rebound.",35,18,"Jacksonville","UAB",NA,"400991874"
115,1,"4:29",1469,"Nate Darling missed Three Point Jumper.",35,18,"Jacksonville","UAB",NA,"400991874"
116,1,"4:29",1469,"Cody Helgeland Defensive Rebound.",35,18,"Jacksonville","UAB",NA,"400991874"
117,1,"4:22",1462,"JD Notae made Three Point Jumper. Assisted by Devin Harris.",35,21,"Jacksonville","UAB",NA,"400991874"
118,1,"3:58",1438,"Chris Cokley missed Jumper.",35,21,"Jacksonville","UAB",NA,"400991874"
119,1,"3:58",1438,"Damien Sears Defensive Rebound.",35,21,"Jacksonville","UAB",NA,"400991874"
120,1,"3:51",1431,"Cody Helgeland missed Three Point Jumper.",35,21,"Jacksonville","UAB",NA,"400991874"
121,1,"3:51",1431,"Chris Cokley Defensive Rebound.",35,21,"Jacksonville","UAB",NA,"400991874"
122,1,"3:36",1416,"Chris Cokley Turnover.",35,21,"Jacksonville","UAB",NA,"400991874"
123,1,"3:36",1416,"Official TV Timeout",35,21,"Jacksonville","UAB",NA,"400991874"
124,1,"3:26",1406,"Foul on Nate Darling.",35,21,"Jacksonville","UAB",NA,"400991874"
125,1,"3:11",1391,"Cody Helgeland missed Three Point Jumper.",35,21,"Jacksonville","UAB",NA,"400991874"
126,1,"3:11",1391,"Lewis Sullivan Defensive Rebound.",35,21,"Jacksonville","UAB",NA,"400991874"
127,1,"3:02",1382,"Zack Bryant missed Jumper.",35,21,"Jacksonville","UAB",NA,"400991874"
128,1,"3:02",1382,"Devin Harris Defensive Rebound.",35,21,"Jacksonville","UAB",NA,"400991874"
129,1,"2:52",1372,"JD Notae made Three Point Jumper. Assisted by Damien Sears.",35,24,"Jacksonville","UAB",NA,"400991874"
130,1,"2:46",1366,"Jacksonville  Timeout",35,24,"Jacksonville","UAB",NA,"400991874"
131,1,"2:37",1357,"Chris Cokley made Jumper.",37,24,"Jacksonville","UAB",NA,"400991874"
132,1,"1:58",1318,"JD Notae made Three Point Jumper.",37,27,"Jacksonville","UAB",NA,"400991874"
133,1,"1:52",1312,"Chris Cokley made Layup. Assisted by Nate Darling.",39,27,"Jacksonville","UAB",NA,"400991874"
134,1,"1:32",1292,"JD Notae missed Layup.",39,27,"Jacksonville","UAB",NA,"400991874"
135,1,"1:32",1292,"Jalen Perry Defensive Rebound.",39,27,"Jacksonville","UAB",NA,"400991874"
136,1,"1:23",1283,"Nate Darling Turnover.",39,27,"Jacksonville","UAB",NA,"400991874"
137,1,"1:22",1282,"Damien Sears Steal.",39,27,"Jacksonville","UAB",NA,"400991874"
138,1,"1:16",1276,"Foul on Lewis Sullivan.",39,27,"Jacksonville","UAB",NA,"400991874"
139,1,"1:16",1276,"Devin Harris missed Free Throw.",39,27,"Jacksonville","UAB",NA,"400991874"
140,1,"1:16",1276,"Jacksonville Deadball Team Rebound.",39,27,"Jacksonville","UAB",NA,"400991874"
141,1,"1:16",1276,"Devin Harris missed Free Throw.",39,27,"Jacksonville","UAB",NA,"400991874"
142,1,"1:16",1276,"Chris Cokley Defensive Rebound.",39,27,"Jacksonville","UAB",NA,"400991874"
143,1,"1:08",1268,"Nick Norton Turnover.",39,27,"Jacksonville","UAB",NA,"400991874"
144,1,"1:07",1267,"Damien Sears Steal.",39,27,"Jacksonville","UAB",NA,"400991874"
145,1,"1:04",1264,"Foul on Lewis Sullivan.",39,27,"Jacksonville","UAB",NA,"400991874"
146,1,"1:04",1264,"Damien Sears missed Free Throw.",39,27,"Jacksonville","UAB",NA,"400991874"
147,1,"1:04",1264,"Jacksonville Deadball Team Rebound.",39,27,"Jacksonville","UAB",NA,"400991874"
148,1,"1:04",1264,"Damien Sears missed Free Throw.",39,27,"Jacksonville","UAB",NA,"400991874"
149,1,"1:04",1264,"William Lee Defensive Rebound.",39,27,"Jacksonville","UAB",NA,"400991874"
150,1,"1:04",1264,"William Lee made Layup. Assisted by Chris Cokley.",41,27,"Jacksonville","UAB",NA,"400991874"
151,1,"1:04",1264,"Damien Sears Turnover.",41,27,"Jacksonville","UAB",NA,"400991874"
152,1,"1:04",1264,"Nick Norton Steal.",41,27,"Jacksonville","UAB",NA,"400991874"
153,1,"1:03",1263,"Chris Cokley made Layup.",43,27,"Jacksonville","UAB",NA,"400991874"
154,1,"0:32",1232,"Devin Harris missed Jumper.",43,27,"Jacksonville","UAB",NA,"400991874"
155,1,"0:32",1232,"William Lee Defensive Rebound.",43,27,"Jacksonville","UAB",NA,"400991874"
156,1,"0:00",1200,"End of 1st half",43,27,"Jacksonville","UAB",NA,"400991874"
157,2,"20:00",1200,"PLAY",43,27,"Jacksonville","UAB",NA,"400991874"
158,2,"19:51",1191,"William Lee made Dunk. Assisted by Chris Cokley.",45,27,"Jacksonville","UAB",NA,"400991874"
159,2,"19:25",1165,"Cody Helgeland missed Layup.",45,27,"Jacksonville","UAB",NA,"400991874"
160,2,"19:25",1165,"William Lee Defensive Rebound.",45,27,"Jacksonville","UAB",NA,"400991874"
161,2,"19:14",1154,"Nate Darling made Layup. Assisted by William Lee.",47,27,"Jacksonville","UAB",NA,"400991874"
162,2,"18:50",1130,"JD Notae made Layup.",47,29,"Jacksonville","UAB",NA,"400991874"
163,2,"18:36",1116,"Nick Norton missed Three Point Jumper.",47,29,"Jacksonville","UAB",NA,"400991874"
164,2,"18:36",1116,"Radwan Bakkali Defensive Rebound.",47,29,"Jacksonville","UAB",NA,"400991874"
165,2,"18:25",1105,"Tanner Rubio made Layup.",47,31,"Jacksonville","UAB",NA,"400991874"
166,2,"18:25",1105,"Foul on Chris Cokley.",47,31,"Jacksonville","UAB",NA,"400991874"
167,2,"18:25",1105,"Tanner Rubio made Free Throw.",47,32,"Jacksonville","UAB",NA,"400991874"
168,2,"18:13",1093,"William Lee made Jumper. Assisted by Zack Bryant.",49,32,"Jacksonville","UAB",NA,"400991874"
169,2,"17:58",1078,"Radwan Bakkali Turnover.",49,32,"Jacksonville","UAB",NA,"400991874"
170,2,"17:56",1076,"Zack Bryant Steal.",49,32,"Jacksonville","UAB",NA,"400991874"
171,2,"17:53",1073,"Zack Bryant made Dunk.",51,32,"Jacksonville","UAB",NA,"400991874"
172,2,"17:30",1050,"Radwan Bakkali made Jumper. Assisted by JD Notae.",51,34,"Jacksonville","UAB",NA,"400991874"
173,2,"17:09",1029,"Nate Darling Turnover.",51,34,"Jacksonville","UAB",NA,"400991874"
174,2,"16:57",1017,"Tanner Rubio made Three Point Jumper.",51,37,"Jacksonville","UAB",NA,"400991874"
175,2,"16:46",1006,"Chris Cokley missed Layup.",51,37,"Jacksonville","UAB",NA,"400991874"
176,2,"16:46",1006,"Chris Cokley Offensive Rebound.",51,37,"Jacksonville","UAB",NA,"400991874"
177,2,"16:41",1001,"Chris Cokley made Dunk. Assisted by Nate Darling.",53,37,"Jacksonville","UAB",NA,"400991874"
178,2,"16:15",975,"Cody Helgeland missed Three Point Jumper.",53,37,"Jacksonville","UAB",NA,"400991874"
179,2,"16:15",975,"Radwan Bakkali Offensive Rebound.",53,37,"Jacksonville","UAB",NA,"400991874"
180,2,"16:09",969,"Devin Harris made Layup. Assisted by Radwan Bakkali.",53,39,"Jacksonville","UAB",NA,"400991874"
181,2,"15:49",949,"William Lee made Three Point Jumper. Assisted by Zack Bryant.",56,39,"Jacksonville","UAB",NA,"400991874"
182,2,"15:42",942,"Official TV Timeout",56,39,"Jacksonville","UAB",NA,"400991874"
183,2,"15:41",941,"Tanner Rubio missed Three Point Jumper.",56,39,"Jacksonville","UAB",NA,"400991874"
184,2,"15:41",941,"Jalen Perry Defensive Rebound.",56,39,"Jacksonville","UAB",NA,"400991874"
185,2,"15:31",931,"Chris Cokley made Jumper. Assisted by Zack Bryant.",58,39,"Jacksonville","UAB",NA,"400991874"
186,2,"15:22",922,"Devin Harris made Layup.",58,41,"Jacksonville","UAB",NA,"400991874"
187,2,"15:22",922,"Foul on Jalen Perry.",58,41,"Jacksonville","UAB",NA,"400991874"
188,2,"15:22",922,"Devin Harris made Free Throw.",58,42,"Jacksonville","UAB",NA,"400991874"
189,2,"15:07",907,"Foul on Tanner Rubio.",58,42,"Jacksonville","UAB",NA,"400991874"
190,2,"15:07",907,"Jalen Perry made Free Throw.",59,42,"Jacksonville","UAB",NA,"400991874"
191,2,"15:07",907,"Jalen Perry made Free Throw.",60,42,"Jacksonville","UAB",NA,"400991874"
192,2,"14:51",891,"Foul on Deion Lavender.",60,42,"Jacksonville","UAB",NA,"400991874"
193,2,"14:51",891,"JD Notae made Free Throw.",60,43,"Jacksonville","UAB",NA,"400991874"
194,2,"14:51",891,"JD Notae missed Free Throw.",60,43,"Jacksonville","UAB",NA,"400991874"
195,2,"14:51",891,"Lewis Sullivan Defensive Rebound.",60,43,"Jacksonville","UAB",NA,"400991874"
196,2,"14:40",880,"Deion Lavender Turnover.",60,43,"Jacksonville","UAB",NA,"400991874"
197,2,"14:31",871,"JD Notae missed Layup.",60,43,"Jacksonville","UAB",NA,"400991874"
198,2,"14:31",871,"Deion Lavender Defensive Rebound.",60,43,"Jacksonville","UAB",NA,"400991874"
199,2,"14:18",858,"Jalen Perry missed Three Point Jumper.",60,43,"Jacksonville","UAB",NA,"400991874"
200,2,"14:18",858,"Chris Cokley Offensive Rebound.",60,43,"Jacksonville","UAB",NA,"400991874"
201,2,"14:09",849,"Chris Cokley made Two Point Tip Shot.",62,43,"Jacksonville","UAB",NA,"400991874"
202,2,"13:59",839,"Foul on Lewis Sullivan.",62,43,"Jacksonville","UAB",NA,"400991874"
203,2,"13:47",827,"Tanner Rubio made Layup.",62,45,"Jacksonville","UAB",NA,"400991874"
204,2,"13:31",811,"Lewis Sullivan made Layup. Assisted by Chris Cokley.",64,45,"Jacksonville","UAB",NA,"400991874"
205,2,"13:13",793,"Damien Sears Turnover.",64,45,"Jacksonville","UAB",NA,"400991874"
206,2,"13:13",793,"Foul on Damien Sears.",64,45,"Jacksonville","UAB",NA,"400991874"
207,2,"12:55",775,"Jalen Perry missed Three Point Jumper.",64,45,"Jacksonville","UAB",NA,"400991874"
208,2,"12:55",775,"Tanner Rubio Defensive Rebound.",64,45,"Jacksonville","UAB",NA,"400991874"
209,2,"12:42",762,"JD Notae made Three Point Jumper. Assisted by Devin Harris.",64,48,"Jacksonville","UAB",NA,"400991874"
210,2,"12:27",747,"Zack Bryant Turnover.",64,48,"Jacksonville","UAB",NA,"400991874"
211,2,"12:26",746,"Devin Harris Steal.",64,48,"Jacksonville","UAB",NA,"400991874"
212,2,"12:23",743,"Devin Harris missed Layup.",64,48,"Jacksonville","UAB",NA,"400991874"
213,2,"12:23",743,"Devin Harris Offensive Rebound.",64,48,"Jacksonville","UAB",NA,"400991874"
214,2,"12:20",740,"Devin Harris made Layup.",64,50,"Jacksonville","UAB",NA,"400991874"
215,2,"12:18",738,"UAB  Timeout",64,50,"Jacksonville","UAB",NA,"400991874"
216,2,"12:03",723,"Lewis Sullivan missed Layup.",64,50,"Jacksonville","UAB",NA,"400991874"
217,2,"12:03",723,"Damien Sears Block.",64,50,"Jacksonville","UAB",NA,"400991874"
218,2,"11:58",718,"Jacksonville Defensive Rebound.",64,50,"Jacksonville","UAB",NA,"400991874"
219,2,"11:44",704,"Tanner Rubio missed Three Point Jumper.",64,50,"Jacksonville","UAB",NA,"400991874"
220,2,"11:44",704,"Lewis Sullivan Defensive Rebound.",64,50,"Jacksonville","UAB",NA,"400991874"
221,2,"11:19",679,"Nick Norton made Three Point Jumper. Assisted by Nate Darling.",67,50,"Jacksonville","UAB",NA,"400991874"
222,2,"11:15",675,"Official TV Timeout",67,50,"Jacksonville","UAB",NA,"400991874"
223,2,"11:15",675,"Damien Sears made Free Throw.",67,51,"Jacksonville","UAB",NA,"400991874"
224,2,"11:15",675,"Damien Sears made Free Throw.",67,52,"Jacksonville","UAB",NA,"400991874"
225,2,"11:09",669,"Foul on Makhtar Gueye.",67,52,"Jacksonville","UAB",NA,"400991874"
226,2,"11:00",660,"Jalen Perry Turnover.",67,52,"Jacksonville","UAB",NA,"400991874"
227,2,"10:45",645,"Foul on Jalen Perry.",67,52,"Jacksonville","UAB",NA,"400991874"
228,2,"10:39",639,"Foul on Nick Norton.",67,52,"Jacksonville","UAB",NA,"400991874"
229,2,"10:34",634,"Tanner Rubio missed Free Throw.",67,52,"Jacksonville","UAB",NA,"400991874"
230,2,"10:34",634,"Jacksonville Deadball Team Rebound.",67,52,"Jacksonville","UAB",NA,"400991874"
231,2,"10:25",625,"Foul on Devin Harris.",67,52,"Jacksonville","UAB",NA,"400991874"
232,2,"10:20",620,"Nick Norton missed Jumper.",67,52,"Jacksonville","UAB",NA,"400991874"
233,2,"10:20",620,"Devin Harris Defensive Rebound.",67,52,"Jacksonville","UAB",NA,"400991874"
234,2,"10:16",616,"Devin Harris Turnover.",67,52,"Jacksonville","UAB",NA,"400991874"
235,2,"10:16",616,"Tanner Rubio missed Free Throw.",67,52,"Jacksonville","UAB",NA,"400991874"
236,2,"10:16",616,"UAB Defensive Rebound.",67,52,"Jacksonville","UAB",NA,"400991874"
237,2,"10:15",615,"Jalen Perry made Three Point Jumper. Assisted by Chris Cokley.",70,52,"Jacksonville","UAB",NA,"400991874"
238,2,"9:55",595,"Damien Sears Turnover.",70,52,"Jacksonville","UAB",NA,"400991874"
239,2,"9:45",585,"Zack Bryant made Dunk. Assisted by Nick Norton.",72,52,"Jacksonville","UAB",NA,"400991874"
240,2,"9:25",565,"Cody Helgeland missed Layup.",72,52,"Jacksonville","UAB",NA,"400991874"
241,2,"9:25",565,"Radwan Bakkali Offensive Rebound.",72,52,"Jacksonville","UAB",NA,"400991874"
242,2,"9:22",562,"Radwan Bakkali made Jumper.",72,54,"Jacksonville","UAB",NA,"400991874"
243,2,"9:09",549,"Foul on Tanner Rubio.",72,54,"Jacksonville","UAB",NA,"400991874"
244,2,"9:09",549,"Nick Norton made Free Throw.",73,54,"Jacksonville","UAB",NA,"400991874"
245,2,"9:09",549,"Nick Norton made Free Throw.",74,54,"Jacksonville","UAB",NA,"400991874"
246,2,"8:57",537,"Cody Helgeland missed Three Point Jumper.",74,54,"Jacksonville","UAB",NA,"400991874"
247,2,"8:57",537,"JD Notae Offensive Rebound.",74,54,"Jacksonville","UAB",NA,"400991874"
248,2,"8:43",523,"JD Notae missed Three Point Jumper.",74,54,"Jacksonville","UAB",NA,"400991874"
249,2,"8:43",523,"Cody Helgeland Offensive Rebound.",74,54,"Jacksonville","UAB",NA,"400991874"
250,2,"8:32",512,"JD Notae missed Jumper.",74,54,"Jacksonville","UAB",NA,"400991874"
251,2,"8:32",512,"Lewis Sullivan Defensive Rebound.",74,54,"Jacksonville","UAB",NA,"400991874"
252,2,"8:29",509,"Foul on Cody Helgeland.",74,54,"Jacksonville","UAB",NA,"400991874"
253,2,"8:12",492,"Foul on JD Notae.",74,54,"Jacksonville","UAB",NA,"400991874"
254,2,"8:12",492,"Zack Bryant missed Free Throw.",74,54,"Jacksonville","UAB",NA,"400991874"
255,2,"8:12",492,"UAB Deadball Team Rebound.",74,54,"Jacksonville","UAB",NA,"400991874"
256,2,"8:12",492,"Zack Bryant made Free Throw.",75,54,"Jacksonville","UAB",NA,"400991874"
257,2,"8:01",481,"Corey Romich made Three Point Jumper. Assisted by Devin Harris.",75,57,"Jacksonville","UAB",NA,"400991874"
258,2,"7:46",466,"Makhtar Gueye made Three Point Jumper. Assisted by Zack Bryant.",78,57,"Jacksonville","UAB",NA,"400991874"
259,2,"7:23",443,"Devin Harris missed Jumper.",78,57,"Jacksonville","UAB",NA,"400991874"
260,2,"7:23",443,"UAB Defensive Rebound.",78,57,"Jacksonville","UAB",NA,"400991874"
261,2,"7:22",442,"Zack Bryant missed Free Throw.",78,57,"Jacksonville","UAB",NA,"400991874"
262,2,"7:22",442,"Cody Helgeland Defensive Rebound.",78,57,"Jacksonville","UAB",NA,"400991874"
263,2,"7:19",439,"Foul on Radwan Bakkali.",78,57,"Jacksonville","UAB",NA,"400991874"
264,2,"7:19",439,"Official TV Timeout",78,57,"Jacksonville","UAB",NA,"400991874"
265,2,"7:09",429,"JD Notae missed Three Point Jumper.",78,57,"Jacksonville","UAB",NA,"400991874"
266,2,"7:09",429,"Makhtar Gueye Defensive Rebound.",78,57,"Jacksonville","UAB",NA,"400991874"
267,2,"6:59",419,"Lewis Sullivan Turnover.",78,57,"Jacksonville","UAB",NA,"400991874"
268,2,"6:48",408,"Radwan Bakkali missed Jumper.",78,57,"Jacksonville","UAB",NA,"400991874"
269,2,"6:48",408,"Zack Bryant Defensive Rebound.",78,57,"Jacksonville","UAB",NA,"400991874"
270,2,"6:33",393,"Jalen Perry missed Layup.",78,57,"Jacksonville","UAB",NA,"400991874"
271,2,"6:33",393,"Jalen Perry Offensive Rebound.",78,57,"Jacksonville","UAB",NA,"400991874"
272,2,"6:28",388,"Jalen Perry made Free Throw.",79,57,"Jacksonville","UAB",NA,"400991874"
273,2,"6:28",388,"JD Notae Offensive Rebound.",78,57,"Jacksonville","UAB",NA,"400991874"
274,2,"6:28",388,"Foul on Radwan Bakkali.",78,57,"Jacksonville","UAB",NA,"400991874"
275,2,"6:28",388,"Jalen Perry missed Free Throw.",79,57,"Jacksonville","UAB",NA,"400991874"
276,2,"6:28",388,"Damien Sears Defensive Rebound.",79,57,"Jacksonville","UAB",NA,"400991874"
277,2,"6:28",388,"Foul on Lewis Sullivan.",79,57,"Jacksonville","UAB",NA,"400991874"
278,2,"6:28",388,"Damien Sears missed Free Throw.",79,57,"Jacksonville","UAB",NA,"400991874"
279,2,"6:28",388,"Foul on Makhtar Gueye.",79,57,"Jacksonville","UAB",NA,"400991874"
