"play_id","half","time_remaining_half","secs_remaining","description","home_score","away_score","away","home","home_favored_by","game_id"
1,1,"20:00",2400,"PLAY",0,0,"Tennessee State","Kansas",26.5,"400989174"
2,1,"20:00",2400,"Jump Ball won by Tennessee State",0,0,"Tennessee State","Kansas",26.5,"400989174"
3,1,"19:43",2383,"Darreon Reddick made Layup.",0,2,"Tennessee State","Kansas",26.5,"400989174"
4,1,"19:22",2362,"Foul on Daniel Cummings.",0,2,"Tennessee State","Kansas",26.5,"400989174"
5,1,"19:14",2354,"Lagerald Vick made Three Point Jumper. Assisted by Devonte' Graham.",3,2,"Tennessee State","Kansas",26.5,"400989174"
6,1,"18:52",2332,"A.C. Reid missed Three Point Jumper.",3,2,"Tennessee State","Kansas",26.5,"400989174"
7,1,"18:52",2332,"Kansas Defensive Rebound.",3,2,"Tennessee State","Kansas",26.5,"400989174"
8,1,"18:33",2313,"Devonte' Graham made Three Point Jumper.",6,2,"Tennessee State","Kansas",26.5,"400989174"
9,1,"18:20",2300,"Christian Mekowulu Turnover.",6,2,"Tennessee State","Kansas",26.5,"400989174"
10,1,"18:20",2300,"Devonte' Graham Steal.",6,2,"Tennessee State","Kansas",26.5,"400989174"
11,1,"18:16",2296,"Devonte' Graham made Dunk.",8,2,"Tennessee State","Kansas",26.5,"400989174"
12,1,"17:52",2272,"Christian Mekowulu Turnover.",8,2,"Tennessee State","Kansas",26.5,"400989174"
13,1,"17:52",2272,"Devonte' Graham Steal.",8,2,"Tennessee State","Kansas",26.5,"400989174"
14,1,"17:52",2272,"Foul on Christian Mekowulu.",8,2,"Tennessee State","Kansas",26.5,"400989174"
15,1,"17:44",2264,"Sviatoslav Mykhailiuk Turnover.",8,2,"Tennessee State","Kansas",26.5,"400989174"
16,1,"17:44",2264,"Armani Chaney Steal.",8,2,"Tennessee State","Kansas",26.5,"400989174"
17,1,"17:37",2257,"A.C. Reid missed Three Point Jumper.",8,2,"Tennessee State","Kansas",26.5,"400989174"
18,1,"17:37",2257,"Udoka Azubuike Defensive Rebound.",8,2,"Tennessee State","Kansas",26.5,"400989174"
19,1,"17:16",2236,"Udoka Azubuike made Jumper.",10,2,"Tennessee State","Kansas",26.5,"400989174"
20,1,"16:55",2215,"Ken'Darrius Hamilton Turnover.",10,2,"Tennessee State","Kansas",26.5,"400989174"
21,1,"16:44",2204,"Marcus Garrett Turnover.",10,2,"Tennessee State","Kansas",26.5,"400989174"
22,1,"16:44",2204,"Ken'Darrius Hamilton Steal.",10,2,"Tennessee State","Kansas",26.5,"400989174"
23,1,"16:18",2178,"A.C. Reid missed Three Point Jumper.",10,2,"Tennessee State","Kansas",26.5,"400989174"
24,1,"16:18",2178,"Udoka Azubuike Defensive Rebound.",10,2,"Tennessee State","Kansas",26.5,"400989174"
25,1,"16:07",2167,"Marcus Garrett made Layup.",12,2,"Tennessee State","Kansas",26.5,"400989174"
26,1,"16:07",2167,"Foul on Armani Chaney.",12,2,"Tennessee State","Kansas",26.5,"400989174"
27,1,"16:07",2167,"Marcus Garrett missed Free Throw.",12,2,"Tennessee State","Kansas",26.5,"400989174"
28,1,"16:07",2167,"Mitch Lightfoot Offensive Rebound.",12,2,"Tennessee State","Kansas",26.5,"400989174"
29,1,"16:07",2167,"Mitch Lightfoot Turnover.",12,2,"Tennessee State","Kansas",26.5,"400989174"
30,1,"16:07",2167,"Christian Mekowulu Steal.",12,2,"Tennessee State","Kansas",26.5,"400989174"
31,1,"15:42",2142,"Darreon Reddick missed Layup.",12,2,"Tennessee State","Kansas",26.5,"400989174"
32,1,"15:42",2142,"Mitch Lightfoot Block.",12,2,"Tennessee State","Kansas",26.5,"400989174"
33,1,"15:42",2142,"Marcus Garrett Defensive Rebound.",12,2,"Tennessee State","Kansas",26.5,"400989174"
34,1,"15:31",2131,"Foul on Delano Spencer.",12,2,"Tennessee State","Kansas",26.5,"400989174"
35,1,"15:31",2131,"Official TV Timeout",12,2,"Tennessee State","Kansas",26.5,"400989174"
36,1,"15:31",2131,"Lagerald Vick made Free Throw.",13,2,"Tennessee State","Kansas",26.5,"400989174"
37,1,"15:31",2131,"Lagerald Vick made Free Throw.",14,2,"Tennessee State","Kansas",26.5,"400989174"
38,1,"15:22",2122,"Armani Chaney made Layup.",14,4,"Tennessee State","Kansas",26.5,"400989174"
39,1,"15:04",2104,"Sviatoslav Mykhailiuk made Three Point Jumper. Assisted by Devonte' Graham.",17,4,"Tennessee State","Kansas",26.5,"400989174"
40,1,"14:41",2081,"Christian Mekowulu missed Jumper.",17,4,"Tennessee State","Kansas",26.5,"400989174"
41,1,"14:41",2081,"Mitch Lightfoot Block.",17,4,"Tennessee State","Kansas",26.5,"400989174"
42,1,"14:41",2081,"Devonte' Graham Defensive Rebound.",17,4,"Tennessee State","Kansas",26.5,"400989174"
43,1,"14:34",2074,"Malik Newman made Three Point Jumper. Assisted by Lagerald Vick.",20,4,"Tennessee State","Kansas",26.5,"400989174"
44,1,"14:13",2053,"Delano Spencer missed Jumper.",20,4,"Tennessee State","Kansas",26.5,"400989174"
45,1,"14:13",2053,"Delano Spencer Offensive Rebound.",20,4,"Tennessee State","Kansas",26.5,"400989174"
46,1,"14:13",2053,"Foul on Mitch Lightfoot.",20,4,"Tennessee State","Kansas",26.5,"400989174"
47,1,"14:11",2051,"Delano Spencer made Three Point Jumper. Assisted by Ken'Darrius Hamilton.",20,7,"Tennessee State","Kansas",26.5,"400989174"
48,1,"13:55",2035,"Udoka Azubuike made Layup. Assisted by Devonte' Graham.",22,7,"Tennessee State","Kansas",26.5,"400989174"
49,1,"13:55",2035,"Foul on Ken'Darrius Hamilton.",22,7,"Tennessee State","Kansas",26.5,"400989174"
50,1,"13:55",2035,"Udoka Azubuike made Free Throw.",23,7,"Tennessee State","Kansas",26.5,"400989174"
51,1,"13:32",2012,"Armani Chaney missed Three Point Jumper.",23,7,"Tennessee State","Kansas",26.5,"400989174"
52,1,"13:32",2012,"Devonte' Graham Defensive Rebound.",23,7,"Tennessee State","Kansas",26.5,"400989174"
53,1,"13:23",2003,"Malik Newman made Layup.",25,7,"Tennessee State","Kansas",26.5,"400989174"
54,1,"13:21",2001,"Tennessee State  Timeout",25,7,"Tennessee State","Kansas",26.5,"400989174"
55,1,"13:03",1983,"Ken'Darrius Hamilton missed Three Point Jumper.",25,7,"Tennessee State","Kansas",26.5,"400989174"
56,1,"13:03",1983,"Devonte' Graham Defensive Rebound.",25,7,"Tennessee State","Kansas",26.5,"400989174"
57,1,"12:52",1972,"Udoka Azubuike Turnover.",25,7,"Tennessee State","Kansas",26.5,"400989174"
58,1,"12:37",1957,"Ken'Darrius Hamilton Turnover.",25,7,"Tennessee State","Kansas",26.5,"400989174"
59,1,"12:37",1957,"Udoka Azubuike Steal.",25,7,"Tennessee State","Kansas",26.5,"400989174"
60,1,"12:29",1949,"Malik Newman missed Layup.",25,7,"Tennessee State","Kansas",26.5,"400989174"
61,1,"12:29",1949,"Lagerald Vick Offensive Rebound.",25,7,"Tennessee State","Kansas",26.5,"400989174"
62,1,"12:29",1949,"Lagerald Vick missed Layup.",25,7,"Tennessee State","Kansas",26.5,"400989174"
63,1,"12:27",1947,"Marcus Garrett Offensive Rebound.",25,7,"Tennessee State","Kansas",26.5,"400989174"
64,1,"12:21",1941,"Marcus Garrett made Layup.",27,7,"Tennessee State","Kansas",26.5,"400989174"
65,1,"12:06",1926,"Foul on Lagerald Vick.",27,7,"Tennessee State","Kansas",26.5,"400989174"
66,1,"12:06",1926,"Darreon Reddick made Free Throw.",27,8,"Tennessee State","Kansas",26.5,"400989174"
67,1,"12:06",1926,"Darreon Reddick made Free Throw.",27,9,"Tennessee State","Kansas",26.5,"400989174"
68,1,"11:56",1916,"Udoka Azubuike made Layup. Assisted by Marcus Garrett.",29,9,"Tennessee State","Kansas",26.5,"400989174"
69,1,"11:31",1891,"Official TV Timeout",29,9,"Tennessee State","Kansas",26.5,"400989174"
70,1,"11:31",1891,"Foul on Udoka Azubuike.",29,9,"Tennessee State","Kansas",26.5,"400989174"
71,1,"11:31",1891,"Christian Mekowulu made Free Throw.",29,10,"Tennessee State","Kansas",26.5,"400989174"
72,1,"11:31",1891,"Christian Mekowulu missed Free Throw.",29,10,"Tennessee State","Kansas",26.5,"400989174"
73,1,"11:31",1891,"Marcus Garrett Defensive Rebound.",29,10,"Tennessee State","Kansas",26.5,"400989174"
74,1,"11:11",1871,"Lagerald Vick missed Three Point Jumper.",29,10,"Tennessee State","Kansas",26.5,"400989174"
75,1,"11:11",1871,"Sviatoslav Mykhailiuk Offensive Rebound.",29,10,"Tennessee State","Kansas",26.5,"400989174"
76,1,"11:08",1868,"Sviatoslav Mykhailiuk made Dunk.",31,10,"Tennessee State","Kansas",26.5,"400989174"
77,1,"10:50",1850,"Christian Mekowulu missed Dunk.",31,10,"Tennessee State","Kansas",26.5,"400989174"
78,1,"10:50",1850,"Malik Newman Defensive Rebound.",31,10,"Tennessee State","Kansas",26.5,"400989174"
79,1,"10:32",1832,"Lagerald Vick Turnover.",31,10,"Tennessee State","Kansas",26.5,"400989174"
80,1,"10:15",1815,"Christian Mekowulu made Layup.",31,12,"Tennessee State","Kansas",26.5,"400989174"
81,1,"9:55",1795,"Foul on Delano Spencer.",31,12,"Tennessee State","Kansas",26.5,"400989174"
82,1,"9:41",1781,"Sviatoslav Mykhailiuk missed Three Point Jumper.",31,12,"Tennessee State","Kansas",26.5,"400989174"
83,1,"9:41",1781,"Armani Chaney Defensive Rebound.",31,12,"Tennessee State","Kansas",26.5,"400989174"
84,1,"9:24",1764,"Christian Mekowulu missed Layup.",31,12,"Tennessee State","Kansas",26.5,"400989174"
85,1,"9:24",1764,"Devonte' Graham Defensive Rebound.",31,12,"Tennessee State","Kansas",26.5,"400989174"
86,1,"9:19",1759,"Lagerald Vick made Dunk. Assisted by Devonte' Graham.",33,12,"Tennessee State","Kansas",26.5,"400989174"
87,1,"8:51",1731,"Darreon Reddick missed Jumper.",33,12,"Tennessee State","Kansas",26.5,"400989174"
88,1,"8:51",1731,"Christian Mekowulu Offensive Rebound.",33,12,"Tennessee State","Kansas",26.5,"400989174"
89,1,"8:48",1728,"Christian Mekowulu made Layup.",33,14,"Tennessee State","Kansas",26.5,"400989174"
90,1,"8:45",1725,"Devonte' Graham Turnover.",33,14,"Tennessee State","Kansas",26.5,"400989174"
91,1,"8:37",1717,"Armani Chaney missed Jumper.",33,14,"Tennessee State","Kansas",26.5,"400989174"
92,1,"8:37",1717,"Sviatoslav Mykhailiuk Defensive Rebound.",33,14,"Tennessee State","Kansas",26.5,"400989174"
93,1,"8:31",1711,"Devonte' Graham Turnover.",33,14,"Tennessee State","Kansas",26.5,"400989174"
94,1,"8:31",1711,"Delano Spencer Steal.",33,14,"Tennessee State","Kansas",26.5,"400989174"
95,1,"8:23",1703,"Delano Spencer missed Layup.",33,14,"Tennessee State","Kansas",26.5,"400989174"
96,1,"8:23",1703,"Devonte' Graham Block.",33,14,"Tennessee State","Kansas",26.5,"400989174"
97,1,"8:23",1703,"Tennessee State Offensive Rebound.",33,14,"Tennessee State","Kansas",26.5,"400989174"
98,1,"8:20",1700,"Foul on Marcus Garrett.",33,14,"Tennessee State","Kansas",26.5,"400989174"
99,1,"8:20",1700,"Armani Chaney missed Free Throw.",33,14,"Tennessee State","Kansas",26.5,"400989174"
100,1,"8:20",1700,"Tennessee State Deadball Team Rebound.",33,14,"Tennessee State","Kansas",26.5,"400989174"
101,1,"8:20",1700,"Armani Chaney missed Free Throw.",33,14,"Tennessee State","Kansas",26.5,"400989174"
102,1,"8:20",1700,"Lagerald Vick Defensive Rebound.",33,14,"Tennessee State","Kansas",26.5,"400989174"
103,1,"8:07",1687,"Sviatoslav Mykhailiuk missed Layup.",33,14,"Tennessee State","Kansas",26.5,"400989174"
104,1,"8:07",1687,"Christian Mekowulu Defensive Rebound.",33,14,"Tennessee State","Kansas",26.5,"400989174"
105,1,"8:07",1687,"Foul on Mitch Lightfoot.",33,14,"Tennessee State","Kansas",26.5,"400989174"
106,1,"7:45",1665,"Christian Mekowulu Turnover.",33,14,"Tennessee State","Kansas",26.5,"400989174"
107,1,"7:45",1665,"Official TV Timeout",33,14,"Tennessee State","Kansas",26.5,"400989174"
108,1,"7:39",1659,"Udoka Azubuike made Jumper. Assisted by Lagerald Vick.",35,14,"Tennessee State","Kansas",26.5,"400989174"
109,1,"7:23",1643,"Tripp Davis missed Layup.",35,14,"Tennessee State","Kansas",26.5,"400989174"
110,1,"7:23",1643,"Marcus Garrett Defensive Rebound.",35,14,"Tennessee State","Kansas",26.5,"400989174"
111,1,"7:14",1634,"Lagerald Vick made Layup. Assisted by Marcus Garrett.",37,14,"Tennessee State","Kansas",26.5,"400989174"
112,1,"7:14",1634,"Foul on Darreon Reddick.",37,14,"Tennessee State","Kansas",26.5,"400989174"
113,1,"7:14",1634,"Lagerald Vick made Free Throw.",38,14,"Tennessee State","Kansas",26.5,"400989174"
114,1,"7:01",1621,"Delano Spencer made Three Point Jumper.",38,17,"Tennessee State","Kansas",26.5,"400989174"
115,1,"6:49",1609,"Devonte' Graham missed Three Point Jumper.",38,17,"Tennessee State","Kansas",26.5,"400989174"
116,1,"6:49",1609,"Darreon Reddick Defensive Rebound.",38,17,"Tennessee State","Kansas",26.5,"400989174"
117,1,"6:49",1609,"Foul on Marcus Garrett.",38,17,"Tennessee State","Kansas",26.5,"400989174"
118,1,"6:30",1590,"Foul on Lagerald Vick.",38,17,"Tennessee State","Kansas",26.5,"400989174"
119,1,"6:30",1590,"Delano Spencer made Free Throw.",38,18,"Tennessee State","Kansas",26.5,"400989174"
120,1,"6:30",1590,"Delano Spencer made Free Throw.",38,19,"Tennessee State","Kansas",26.5,"400989174"
121,1,"6:09",1569,"Marcus Garrett made Layup. Assisted by Devonte' Graham.",40,19,"Tennessee State","Kansas",26.5,"400989174"
122,1,"5:41",1541,"Ken'Darrius Hamilton missed Jumper.",40,19,"Tennessee State","Kansas",26.5,"400989174"
123,1,"5:41",1541,"Sviatoslav Mykhailiuk Defensive Rebound.",40,19,"Tennessee State","Kansas",26.5,"400989174"
124,1,"5:36",1536,"Devonte' Graham made Layup.",42,19,"Tennessee State","Kansas",26.5,"400989174"
125,1,"5:36",1536,"Foul on Ken'Darrius Hamilton.",42,19,"Tennessee State","Kansas",26.5,"400989174"
126,1,"5:36",1536,"Devonte' Graham made Free Throw.",43,19,"Tennessee State","Kansas",26.5,"400989174"
127,1,"5:19",1519,"Darreon Reddick missed Three Point Jumper.",43,19,"Tennessee State","Kansas",26.5,"400989174"
128,1,"5:19",1519,"Marcus Garrett Defensive Rebound.",43,19,"Tennessee State","Kansas",26.5,"400989174"
129,1,"5:04",1504,"Sviatoslav Mykhailiuk made Three Point Jumper. Assisted by Clay Young.",46,19,"Tennessee State","Kansas",26.5,"400989174"
130,1,"4:41",1481,"Darreon Reddick made Layup.",46,21,"Tennessee State","Kansas",26.5,"400989174"
131,1,"4:27",1467,"Sviatoslav Mykhailiuk made Three Point Jumper. Assisted by Malik Newman.",49,21,"Tennessee State","Kansas",26.5,"400989174"
132,1,"4:04",1444,"Delano Spencer made Three Point Jumper.",49,24,"Tennessee State","Kansas",26.5,"400989174"
133,1,"3:56",1436,"Foul on Ken'Darrius Hamilton.",49,24,"Tennessee State","Kansas",26.5,"400989174"
134,1,"3:56",1436,"Official TV Timeout",49,24,"Tennessee State","Kansas",26.5,"400989174"
135,1,"3:56",1436,"Clay Young missed Free Throw.",49,24,"Tennessee State","Kansas",26.5,"400989174"
136,1,"3:56",1436,"Kansas Deadball Team Rebound.",49,24,"Tennessee State","Kansas",26.5,"400989174"
137,1,"3:56",1436,"Clay Young made Free Throw.",50,24,"Tennessee State","Kansas",26.5,"400989174"
138,1,"3:56",1436,"Ken'Darrius Hamilton Turnover.",50,24,"Tennessee State","Kansas",26.5,"400989174"
139,1,"3:41",1421,"Devonte' Graham made Layup.",52,24,"Tennessee State","Kansas",26.5,"400989174"
140,1,"3:29",1409,"Armani Chaney Turnover.",52,24,"Tennessee State","Kansas",26.5,"400989174"
141,1,"3:29",1409,"Marcus Garrett Steal.",52,24,"Tennessee State","Kansas",26.5,"400989174"
142,1,"3:27",1407,"Foul on Daniel Cummings.",52,24,"Tennessee State","Kansas",26.5,"400989174"
143,1,"3:27",1407,"Marcus Garrett missed Free Throw.",52,24,"Tennessee State","Kansas",26.5,"400989174"
144,1,"3:27",1407,"Kansas Deadball Team Rebound.",52,24,"Tennessee State","Kansas",26.5,"400989174"
145,1,"3:27",1407,"Marcus Garrett made Free Throw.",53,24,"Tennessee State","Kansas",26.5,"400989174"
146,1,"3:16",1396,"Foul on Daniel Cummings.",53,24,"Tennessee State","Kansas",26.5,"400989174"
147,1,"3:16",1396,"Daniel Cummings Turnover.",53,24,"Tennessee State","Kansas",26.5,"400989174"
148,1,"2:55",1375,"Marcus Garrett made Layup.",55,24,"Tennessee State","Kansas",26.5,"400989174"
149,1,"2:55",1375,"Foul on Delano Spencer.",55,24,"Tennessee State","Kansas",26.5,"400989174"
150,1,"2:55",1375,"Marcus Garrett made Free Throw.",56,24,"Tennessee State","Kansas",26.5,"400989174"
151,1,"2:44",1364,"Darreon Reddick made Three Point Jumper.",56,27,"Tennessee State","Kansas",26.5,"400989174"
152,1,"2:22",1342,"Udoka Azubuike Turnover.",56,27,"Tennessee State","Kansas",26.5,"400989174"
153,1,"2:22",1342,"Armani Chaney Steal.",56,27,"Tennessee State","Kansas",26.5,"400989174"
154,1,"1:56",1316,"Daniel Cummings missed Jumper.",56,27,"Tennessee State","Kansas",26.5,"400989174"
155,1,"1:56",1316,"Sviatoslav Mykhailiuk Defensive Rebound.",56,27,"Tennessee State","Kansas",26.5,"400989174"
156,1,"1:50",1310,"Sviatoslav Mykhailiuk missed Three Point Jumper.",56,27,"Tennessee State","Kansas",26.5,"400989174"
157,1,"1:50",1310,"Darreon Reddick Defensive Rebound.",56,27,"Tennessee State","Kansas",26.5,"400989174"
158,1,"1:18",1278,"Armani Chaney Turnover.",56,27,"Tennessee State","Kansas",26.5,"400989174"
159,1,"1:02",1262,"Lagerald Vick Turnover.",56,27,"Tennessee State","Kansas",26.5,"400989174"
160,1,"0:46",1246,"Armani Chaney Turnover.",56,27,"Tennessee State","Kansas",26.5,"400989174"
161,1,"0:46",1246,"Lagerald Vick Steal.",56,27,"Tennessee State","Kansas",26.5,"400989174"
162,1,"0:36",1236,"Devonte' Graham missed Three Point Jumper.",56,27,"Tennessee State","Kansas",26.5,"400989174"
163,1,"0:36",1236,"Christian Mekowulu Defensive Rebound.",56,27,"Tennessee State","Kansas",26.5,"400989174"
164,1,"0:07",1207,"Darreon Reddick missed Three Point Jumper.",56,27,"Tennessee State","Kansas",26.5,"400989174"
165,1,"0:07",1207,"Malik Newman Defensive Rebound.",56,27,"Tennessee State","Kansas",26.5,"400989174"
166,1,"0:01",1201,"Malik Newman missed Three Point Jumper.",56,27,"Tennessee State","Kansas",26.5,"400989174"
167,1,"0:01",1201,"Tennessee State Defensive Rebound.",56,27,"Tennessee State","Kansas",26.5,"400989174"
168,1,"0:00",1200,"End of 1st half",56,27,"Tennessee State","Kansas",26.5,"400989174"
169,2,"20:00",1200,"PLAY",56,27,"Tennessee State","Kansas",26.5,"400989174"
170,2,"20:00",1200,"Jump Ball won by Kansas",56,27,"Tennessee State","Kansas",26.5,"400989174"
171,2,"19:51",1191,"Lagerald Vick made Jumper. Assisted by Devonte' Graham.",58,27,"Tennessee State","Kansas",26.5,"400989174"
172,2,"19:32",1172,"Ken'Darrius Hamilton missed Three Point Jumper.",58,27,"Tennessee State","Kansas",26.5,"400989174"
173,2,"19:32",1172,"Devonte' Graham Defensive Rebound.",58,27,"Tennessee State","Kansas",26.5,"400989174"
174,2,"19:16",1156,"Sviatoslav Mykhailiuk missed Three Point Jumper.",58,27,"Tennessee State","Kansas",26.5,"400989174"
175,2,"19:16",1156,"Christian Mekowulu Defensive Rebound.",58,27,"Tennessee State","Kansas",26.5,"400989174"
176,2,"19:03",1143,"Darreon Reddick missed Three Point Jumper.",58,27,"Tennessee State","Kansas",26.5,"400989174"
177,2,"19:03",1143,"Udoka Azubuike Defensive Rebound.",58,27,"Tennessee State","Kansas",26.5,"400989174"
178,2,"18:51",1131,"Lagerald Vick made Jumper. Assisted by Devonte' Graham.",60,27,"Tennessee State","Kansas",26.5,"400989174"
179,2,"18:30",1110,"Ken'Darrius Hamilton Turnover.",60,27,"Tennessee State","Kansas",26.5,"400989174"
180,2,"18:30",1110,"Marcus Garrett Steal.",60,27,"Tennessee State","Kansas",26.5,"400989174"
181,2,"18:17",1097,"Foul on Ken'Darrius Hamilton.",60,27,"Tennessee State","Kansas",26.5,"400989174"
182,2,"18:16",1096,"Lagerald Vick Turnover.",60,27,"Tennessee State","Kansas",26.5,"400989174"
183,2,"18:16",1096,"Armani Chaney Steal.",60,27,"Tennessee State","Kansas",26.5,"400989174"
184,2,"18:08",1088,"Foul on Lagerald Vick.",60,27,"Tennessee State","Kansas",26.5,"400989174"
185,2,"18:08",1088,"Darreon Reddick made Free Throw.",60,28,"Tennessee State","Kansas",26.5,"400989174"
186,2,"18:08",1088,"Darreon Reddick missed Free Throw.",60,28,"Tennessee State","Kansas",26.5,"400989174"
187,2,"18:08",1088,"Armani Chaney Offensive Rebound.",60,28,"Tennessee State","Kansas",26.5,"400989174"
188,2,"18:05",1085,"Delano Spencer missed Three Point Jumper.",60,28,"Tennessee State","Kansas",26.5,"400989174"
189,2,"18:05",1085,"Lagerald Vick Defensive Rebound.",60,28,"Tennessee State","Kansas",26.5,"400989174"
190,2,"17:44",1064,"Udoka Azubuike made Dunk. Assisted by Lagerald Vick.",62,28,"Tennessee State","Kansas",26.5,"400989174"
191,2,"17:30",1050,"A.C. Reid missed Three Point Jumper.",62,28,"Tennessee State","Kansas",26.5,"400989174"
192,2,"17:30",1050,"Lagerald Vick Defensive Rebound.",62,28,"Tennessee State","Kansas",26.5,"400989174"
193,2,"17:21",1041,"Sviatoslav Mykhailiuk made Layup. Assisted by Devonte' Graham.",64,28,"Tennessee State","Kansas",26.5,"400989174"
194,2,"16:49",1009,"Christian Mekowulu missed Jumper.",64,28,"Tennessee State","Kansas",26.5,"400989174"
195,2,"16:49",1009,"Devonte' Graham Defensive Rebound.",64,28,"Tennessee State","Kansas",26.5,"400989174"
196,2,"16:44",1004,"Sviatoslav Mykhailiuk made Layup. Assisted by Devonte' Graham.",66,28,"Tennessee State","Kansas",26.5,"400989174"
197,2,"16:41",1001,"Tennessee State  Timeout",66,28,"Tennessee State","Kansas",26.5,"400989174"
198,2,"16:15",975,"Darreon Reddick missed Layup.",66,28,"Tennessee State","Kansas",26.5,"400989174"
199,2,"16:15",975,"Udoka Azubuike Block.",66,28,"Tennessee State","Kansas",26.5,"400989174"
200,2,"16:15",975,"Devonte' Graham Defensive Rebound.",66,28,"Tennessee State","Kansas",26.5,"400989174"
201,2,"16:08",968,"Lagerald Vick missed Three Point Jumper.",66,28,"Tennessee State","Kansas",26.5,"400989174"
202,2,"16:08",968,"Stokley Chaffee Jr. Defensive Rebound.",66,28,"Tennessee State","Kansas",26.5,"400989174"
203,2,"15:58",958,"Kamar McKnight missed Layup.",66,28,"Tennessee State","Kansas",26.5,"400989174"
204,2,"15:58",958,"Stokley Chaffee Jr. Offensive Rebound.",66,28,"Tennessee State","Kansas",26.5,"400989174"
205,2,"15:58",958,"Foul on Udoka Azubuike.",66,28,"Tennessee State","Kansas",26.5,"400989174"
206,2,"15:58",958,"Official TV Timeout",66,28,"Tennessee State","Kansas",26.5,"400989174"
207,2,"15:58",958,"Stokley Chaffee Jr. made Free Throw.",66,29,"Tennessee State","Kansas",26.5,"400989174"
208,2,"15:58",958,"Stokley Chaffee Jr. missed Free Throw.",66,29,"Tennessee State","Kansas",26.5,"400989174"
209,2,"15:58",958,"Mitch Lightfoot Defensive Rebound.",66,29,"Tennessee State","Kansas",26.5,"400989174"
210,2,"15:47",947,"Malik Newman made Layup.",68,29,"Tennessee State","Kansas",26.5,"400989174"
211,2,"15:27",927,"Delano Spencer missed Layup.",68,29,"Tennessee State","Kansas",26.5,"400989174"
212,2,"15:27",927,"Malik Newman Block.",68,29,"Tennessee State","Kansas",26.5,"400989174"
213,2,"15:27",927,"Malik Newman Defensive Rebound.",68,29,"Tennessee State","Kansas",26.5,"400989174"
214,2,"15:22",922,"Malik Newman Turnover.",68,29,"Tennessee State","Kansas",26.5,"400989174"
215,2,"15:20",920,"Ken'Darrius Hamilton missed Three Point Jumper.",68,29,"Tennessee State","Kansas",26.5,"400989174"
216,2,"15:20",920,"Malik Newman Defensive Rebound.",68,29,"Tennessee State","Kansas",26.5,"400989174"
217,2,"15:04",904,"Malik Newman Turnover.",68,29,"Tennessee State","Kansas",26.5,"400989174"
218,2,"14:48",888,"Darreon Reddick missed Three Point Jumper.",68,29,"Tennessee State","Kansas",26.5,"400989174"
219,2,"14:48",888,"Stokley Chaffee Jr. Offensive Rebound.",68,29,"Tennessee State","Kansas",26.5,"400989174"
220,2,"14:45",885,"Stokley Chaffee Jr. made Layup.",68,31,"Tennessee State","Kansas",26.5,"400989174"
221,2,"14:28",868,"Lagerald Vick made Three Point Jumper. Assisted by Malik Newman.",71,31,"Tennessee State","Kansas",26.5,"400989174"
222,2,"14:10",850,"Ken'Darrius Hamilton made Three Point Jumper.",71,34,"Tennessee State","Kansas",26.5,"400989174"
223,2,"13:54",834,"Malik Newman made Three Point Jumper. Assisted by Sviatoslav Mykhailiuk.",74,34,"Tennessee State","Kansas",26.5,"400989174"
224,2,"13:32",812,"Kamar McKnight missed Three Point Jumper.",74,34,"Tennessee State","Kansas",26.5,"400989174"
225,2,"13:32",812,"Sviatoslav Mykhailiuk Defensive Rebound.",74,34,"Tennessee State","Kansas",26.5,"400989174"
226,2,"13:16",796,"Foul on Ken'Darrius Hamilton.",74,34,"Tennessee State","Kansas",26.5,"400989174"
227,2,"13:14",794,"Foul on Mitch Lightfoot.",74,34,"Tennessee State","Kansas",26.5,"400989174"
228,2,"13:14",794,"Mitch Lightfoot Turnover.",74,34,"Tennessee State","Kansas",26.5,"400989174"
229,2,"12:54",774,"Darreon Reddick made Jumper. Assisted by Christian Mekowulu.",74,36,"Tennessee State","Kansas",26.5,"400989174"
230,2,"12:38",758,"Malik Newman missed Three Point Jumper.",74,36,"Tennessee State","Kansas",26.5,"400989174"
231,2,"12:38",758,"Mitch Lightfoot Offensive Rebound.",74,36,"Tennessee State","Kansas",26.5,"400989174"
232,2,"12:34",754,"Mitch Lightfoot missed Jumper.",74,36,"Tennessee State","Kansas",26.5,"400989174"
233,2,"12:34",754,"Stokley Chaffee Jr. Defensive Rebound.",74,36,"Tennessee State","Kansas",26.5,"400989174"
234,2,"12:00",720,"Kamar McKnight missed Jumper.",74,36,"Tennessee State","Kansas",26.5,"400989174"
235,2,"12:00",720,"Udoka Azubuike Block.",74,36,"Tennessee State","Kansas",26.5,"400989174"
236,2,"12:00",720,"Kansas Defensive Rebound.",74,36,"Tennessee State","Kansas",26.5,"400989174"
237,2,"11:42",702,"Sviatoslav Mykhailiuk missed Jumper.",74,36,"Tennessee State","Kansas",26.5,"400989174"
238,2,"11:42",702,"Delano Spencer Defensive Rebound.",74,36,"Tennessee State","Kansas",26.5,"400989174"
239,2,"11:29",689,"Armani Chaney missed Jumper.",74,36,"Tennessee State","Kansas",26.5,"400989174"
240,2,"11:29",689,"Christian Mekowulu Offensive Rebound.",74,36,"Tennessee State","Kansas",26.5,"400989174"
241,2,"11:25",685,"Christian Mekowulu missed Jumper.",74,36,"Tennessee State","Kansas",26.5,"400989174"
242,2,"11:25",685,"Mitch Lightfoot Defensive Rebound.",74,36,"Tennessee State","Kansas",26.5,"400989174"
243,2,"11:15",675,"Malik Newman Turnover.",74,36,"Tennessee State","Kansas",26.5,"400989174"
244,2,"11:15",675,"Kamar McKnight Steal.",74,36,"Tennessee State","Kansas",26.5,"400989174"
245,2,"11:07",667,"Delano Spencer Turnover.",74,36,"Tennessee State","Kansas",26.5,"400989174"
246,2,"11:07",667,"Official TV Timeout",74,36,"Tennessee State","Kansas",26.5,"400989174"
247,2,"10:48",648,"Marcus Garrett missed Three Point Jumper.",74,36,"Tennessee State","Kansas",26.5,"400989174"
248,2,"10:48",648,"Darreon Reddick Defensive Rebound.",74,36,"Tennessee State","Kansas",26.5,"400989174"
249,2,"10:30",630,"Delano Spencer missed Layup.",74,36,"Tennessee State","Kansas",26.5,"400989174"
250,2,"10:30",630,"Mitch Lightfoot Block.",74,36,"Tennessee State","Kansas",26.5,"400989174"
