"play_id","half","time_remaining_half","secs_remaining","description","home_score","away_score","away","home","home_favored_by","game_id"
174,2,"18:51",1131,"Daniel Norl missed Three Point Jumper.",57,29,"Omaha","Kansas",34,"400989179"
175,2,"18:51",1131,"Udoka Azubuike Defensive Rebound.",57,29,"Omaha","Kansas",34,"400989179"
176,2,"18:41",1121,"Foul on JT Gibson.",57,29,"Omaha","Kansas",34,"400989179"
177,2,"18:34",1114,"Udoka Azubuike made Layup.",59,29,"Omaha","Kansas",34,"400989179"
178,2,"18:12",1092,"Lamar Wofford-Humphrey missed Jumper.",59,29,"Omaha","Kansas",34,"400989179"
179,2,"18:12",1092,"Udoka Azubuike Defensive Rebound.",59,29,"Omaha","Kansas",34,"400989179"
180,2,"18:02",1082,"Devonte' Graham made Three Point Jumper.",62,29,"Omaha","Kansas",34,"400989179"
181,2,"17:41",1061,"Daniel Norl made Three Point Jumper. Assisted by Zach Jackson.",62,32,"Omaha","Kansas",34,"400989179"
182,2,"17:27",1047,"Malik Newman missed Three Point Jumper.",62,32,"Omaha","Kansas",34,"400989179"
183,2,"17:27",1047,"Zach Jackson Defensive Rebound.",62,32,"Omaha","Kansas",34,"400989179"
184,2,"17:22",1042,"KJ Robinson made Three Point Jumper. Assisted by Daniel Norl.",62,35,"Omaha","Kansas",34,"400989179"
185,2,"17:02",1022,"Lagerald Vick missed Three Point Jumper.",62,35,"Omaha","Kansas",34,"400989179"
186,2,"17:02",1022,"Udoka Azubuike Offensive Rebound.",62,35,"Omaha","Kansas",34,"400989179"
187,2,"16:58",1018,"Foul on Lamar Wofford-Humphrey.",62,35,"Omaha","Kansas",34,"400989179"
188,2,"16:52",1012,"Sviatoslav Mykhailiuk made Jumper.",64,35,"Omaha","Kansas",34,"400989179"
189,2,"16:35",995,"Daniel Norl missed Layup.",64,35,"Omaha","Kansas",34,"400989179"
190,2,"16:35",995,"Udoka Azubuike Defensive Rebound.",64,35,"Omaha","Kansas",34,"400989179"
191,2,"16:29",989,"Lagerald Vick made Dunk. Assisted by Sviatoslav Mykhailiuk.",66,35,"Omaha","Kansas",34,"400989179"
192,2,"16:15",975,"Foul on Malik Newman.",66,35,"Omaha","Kansas",34,"400989179"
193,2,"16:15",975,"Zach Jackson made Free Throw.",66,36,"Omaha","Kansas",34,"400989179"
194,2,"16:15",975,"Zach Jackson made Free Throw.",66,37,"Omaha","Kansas",34,"400989179"
195,2,"16:00",960,"Malik Newman missed Three Point Jumper.",66,37,"Omaha","Kansas",34,"400989179"
196,2,"16:00",960,"Zach Jackson Defensive Rebound.",66,37,"Omaha","Kansas",34,"400989179"
197,2,"15:49",949,"KJ Robinson missed Three Point Jumper.",66,37,"Omaha","Kansas",34,"400989179"
198,2,"15:49",949,"Devonte' Graham Defensive Rebound.",66,37,"Omaha","Kansas",34,"400989179"
199,2,"15:39",939,"Malik Newman Turnover.",66,37,"Omaha","Kansas",34,"400989179"
200,2,"15:39",939,"Official TV Timeout",66,37,"Omaha","Kansas",34,"400989179"
201,2,"15:30",930,"Matt Pile made Layup. Assisted by Daniel Norl.",66,39,"Omaha","Kansas",34,"400989179"
202,2,"15:11",911,"Udoka Azubuike made Layup.",68,39,"Omaha","Kansas",34,"400989179"
203,2,"14:50",890,"KJ Robinson Turnover.",68,39,"Omaha","Kansas",34,"400989179"
204,2,"14:50",890,"Lagerald Vick Steal.",68,39,"Omaha","Kansas",34,"400989179"
205,2,"14:37",877,"Udoka Azubuike Turnover.",68,39,"Omaha","Kansas",34,"400989179"
206,2,"14:37",877,"KJ Robinson Steal.",68,39,"Omaha","Kansas",34,"400989179"
207,2,"14:32",872,"KJ Robinson missed Layup.",68,39,"Omaha","Kansas",34,"400989179"
208,2,"14:32",872,"Sviatoslav Mykhailiuk Block.",68,39,"Omaha","Kansas",34,"400989179"
209,2,"14:32",872,"Zach Jackson Offensive Rebound.",68,39,"Omaha","Kansas",34,"400989179"
210,2,"14:30",870,"Foul on Marcus Garrett.",68,39,"Omaha","Kansas",34,"400989179"
211,2,"14:30",870,"Zach Jackson made Free Throw.",68,40,"Omaha","Kansas",34,"400989179"
212,2,"14:30",870,"Zach Jackson made Free Throw.",68,41,"Omaha","Kansas",34,"400989179"
213,2,"14:07",847,"Foul on Ayo Akinwole.",68,41,"Omaha","Kansas",34,"400989179"
214,2,"13:57",837,"Mitch Lightfoot made Layup. Assisted by Devonte' Graham.",70,41,"Omaha","Kansas",34,"400989179"
215,2,"13:51",831,"JT Gibson made Layup.",70,43,"Omaha","Kansas",34,"400989179"
216,2,"13:30",810,"Marcus Garrett made Layup.",72,43,"Omaha","Kansas",34,"400989179"
217,2,"13:10",790,"Matt Pile made Layup.",72,45,"Omaha","Kansas",34,"400989179"
218,2,"12:59",779,"Devonte' Graham missed Three Point Jumper.",72,45,"Omaha","Kansas",34,"400989179"
219,2,"12:59",779,"Omaha Defensive Rebound.",72,45,"Omaha","Kansas",34,"400989179"
220,2,"12:53",773,"Zach Jackson Turnover.",72,45,"Omaha","Kansas",34,"400989179"
221,2,"12:53",773,"Sam Cunliffe Steal.",72,45,"Omaha","Kansas",34,"400989179"
222,2,"12:49",769,"Mitch Lightfoot missed Dunk.",72,45,"Omaha","Kansas",34,"400989179"
223,2,"12:49",769,"Matt Pile Defensive Rebound.",72,45,"Omaha","Kansas",34,"400989179"
224,2,"12:42",762,"JT Gibson made Layup.",72,47,"Omaha","Kansas",34,"400989179"
225,2,"12:36",756,"Sam Cunliffe missed Three Point Jumper.",72,47,"Omaha","Kansas",34,"400989179"
226,2,"12:28",748,"Sviatoslav Mykhailiuk Offensive Rebound.",72,47,"Omaha","Kansas",34,"400989179"
227,2,"12:22",742,"Sviatoslav Mykhailiuk made Three Point Jumper. Assisted by Devonte' Graham.",75,47,"Omaha","Kansas",34,"400989179"
228,2,"12:05",725,"Ayo Akinwole made Three Point Jumper. Assisted by Zach Jackson.",75,50,"Omaha","Kansas",34,"400989179"
229,2,"11:45",705,"Sviatoslav Mykhailiuk made Three Point Jumper. Assisted by Mitch Lightfoot.",78,50,"Omaha","Kansas",34,"400989179"
230,2,"11:17",677,"Official TV Timeout",78,50,"Omaha","Kansas",34,"400989179"
231,2,"11:15",675,"JT Gibson missed Three Point Jumper.",78,50,"Omaha","Kansas",34,"400989179"
232,2,"11:15",675,"Kansas Defensive Rebound.",78,50,"Omaha","Kansas",34,"400989179"
233,2,"11:05",665,"Udoka Azubuike made Layup. Assisted by Sviatoslav Mykhailiuk.",80,50,"Omaha","Kansas",34,"400989179"
234,2,"10:44",644,"JT Gibson missed Layup.",80,50,"Omaha","Kansas",34,"400989179"
235,2,"10:44",644,"Udoka Azubuike Block.",80,50,"Omaha","Kansas",34,"400989179"
236,2,"10:44",644,"Kansas Defensive Rebound.",80,50,"Omaha","Kansas",34,"400989179"
237,2,"10:18",618,"Lagerald Vick Turnover.",80,50,"Omaha","Kansas",34,"400989179"
238,2,"10:18",618,"JT Gibson Steal.",80,50,"Omaha","Kansas",34,"400989179"
239,2,"10:07",607,"JT Gibson missed Jumper.",80,50,"Omaha","Kansas",34,"400989179"
240,2,"10:07",607,"Udoka Azubuike Defensive Rebound.",80,50,"Omaha","Kansas",34,"400989179"
241,2,"9:55",595,"Sviatoslav Mykhailiuk made Three Point Jumper. Assisted by Lagerald Vick.",83,50,"Omaha","Kansas",34,"400989179"
242,2,"9:26",566,"JT Gibson missed Three Point Jumper.",83,50,"Omaha","Kansas",34,"400989179"
243,2,"9:26",566,"Malik Newman Defensive Rebound.",83,50,"Omaha","Kansas",34,"400989179"
244,2,"9:10",550,"Malik Newman missed Three Point Jumper.",83,50,"Omaha","Kansas",34,"400989179"
245,2,"9:10",550,"Daniel Meyer Defensive Rebound.",83,50,"Omaha","Kansas",34,"400989179"
246,2,"9:03",543,"Ayo Akinwole missed Jumper.",83,50,"Omaha","Kansas",34,"400989179"
247,2,"9:03",543,"Omaha Offensive Rebound.",83,50,"Omaha","Kansas",34,"400989179"
248,2,"8:55",535,"Daniel Norl missed Layup.",83,50,"Omaha","Kansas",34,"400989179"
249,2,"8:55",535,"Devonte' Graham Defensive Rebound.",83,50,"Omaha","Kansas",34,"400989179"
250,2,"8:42",522,"Malik Newman made Jumper.",85,50,"Omaha","Kansas",34,"400989179"
251,2,"8:28",508,"Daniel Norl missed Three Point Jumper.",85,50,"Omaha","Kansas",34,"400989179"
252,2,"8:28",508,"Lagerald Vick Defensive Rebound.",85,50,"Omaha","Kansas",34,"400989179"
253,2,"8:19",499,"Lagerald Vick made Layup.",87,50,"Omaha","Kansas",34,"400989179"
254,2,"7:55",475,"Zach Jackson missed Layup.",87,50,"Omaha","Kansas",34,"400989179"
255,2,"7:55",475,"Daniel Meyer Offensive Rebound.",87,50,"Omaha","Kansas",34,"400989179"
256,2,"7:55",475,"Daniel Meyer missed Two Point Tip Shot.",87,50,"Omaha","Kansas",34,"400989179"
257,2,"7:55",475,"Mitch Lightfoot Defensive Rebound.",87,50,"Omaha","Kansas",34,"400989179"
258,2,"7:45",465,"Sam Cunliffe made Jumper.",89,50,"Omaha","Kansas",34,"400989179"
259,2,"7:28",448,"Foul on Mitch Lightfoot.",89,50,"Omaha","Kansas",34,"400989179"
260,2,"7:28",448,"Official TV Timeout",89,50,"Omaha","Kansas",34,"400989179"
261,2,"7:28",448,"Daniel Norl made Free Throw.",89,51,"Omaha","Kansas",34,"400989179"
262,2,"7:28",448,"Daniel Norl made Free Throw.",89,52,"Omaha","Kansas",34,"400989179"
263,2,"7:17",437,"Mitch Lightfoot made Layup.",91,52,"Omaha","Kansas",34,"400989179"
264,2,"6:54",414,"Daniel Meyer missed Three Point Jumper.",91,52,"Omaha","Kansas",34,"400989179"
265,2,"6:54",414,"Sam Cunliffe Defensive Rebound.",91,52,"Omaha","Kansas",34,"400989179"
266,2,"6:42",402,"Foul on Daniel Norl.",91,52,"Omaha","Kansas",34,"400989179"
267,2,"6:42",402,"Mitch Lightfoot made Free Throw.",92,52,"Omaha","Kansas",34,"400989179"
268,2,"6:42",402,"Mitch Lightfoot made Free Throw.",93,52,"Omaha","Kansas",34,"400989179"
269,2,"6:32",392,"Daniel Norl missed Layup.",93,52,"Omaha","Kansas",34,"400989179"
270,2,"6:32",392,"Daniel Meyer Offensive Rebound.",93,52,"Omaha","Kansas",34,"400989179"
271,2,"6:28",388,"Daniel Meyer made Layup.",93,54,"Omaha","Kansas",34,"400989179"
272,2,"6:17",377,"Malik Newman made Jumper. Assisted by Sam Cunliffe.",95,54,"Omaha","Kansas",34,"400989179"
273,2,"6:01",361,"JT Gibson missed Jumper.",95,54,"Omaha","Kansas",34,"400989179"
274,2,"6:01",361,"Malik Newman Defensive Rebound.",95,54,"Omaha","Kansas",34,"400989179"
275,2,"5:51",351,"Malik Newman made Jumper.",97,54,"Omaha","Kansas",34,"400989179"
276,2,"5:27",327,"Daniel Meyer missed Layup.",97,54,"Omaha","Kansas",34,"400989179"
277,2,"5:27",327,"Sam Cunliffe Defensive Rebound.",97,54,"Omaha","Kansas",34,"400989179"
278,2,"5:22",322,"Sam Cunliffe made Dunk. Assisted by Devonte' Graham.",99,54,"Omaha","Kansas",34,"400989179"
279,2,"4:59",299,"Daniel Norl missed Three Point Jumper.",99,54,"Omaha","Kansas",34,"400989179"
280,2,"4:59",299,"Mitch Lightfoot Defensive Rebound.",99,54,"Omaha","Kansas",34,"400989179"
281,2,"4:45",285,"Lagerald Vick missed Layup.",99,54,"Omaha","Kansas",34,"400989179"
282,2,"4:45",285,"Daniel Meyer Defensive Rebound.",99,54,"Omaha","Kansas",34,"400989179"
283,2,"4:36",276,"Zach Jackson missed Three Point Jumper.",99,54,"Omaha","Kansas",34,"400989179"
284,2,"4:36",276,"Malik Newman Defensive Rebound.",99,54,"Omaha","Kansas",34,"400989179"
285,2,"4:19",259,"Mitch Lightfoot missed Jumper.",99,54,"Omaha","Kansas",34,"400989179"
286,2,"4:19",259,"Zach Jackson Defensive Rebound.",99,54,"Omaha","Kansas",34,"400989179"
287,2,"4:07",247,"Daniel Norl missed Three Point Jumper.",99,54,"Omaha","Kansas",34,"400989179"
288,2,"4:07",247,"Lagerald Vick Defensive Rebound.",99,54,"Omaha","Kansas",34,"400989179"
289,2,"3:54",234,"Malik Newman made Three Point Jumper.",102,54,"Omaha","Kansas",34,"400989179"
290,2,"3:40",220,"Omaha  Timeout",102,54,"Omaha","Kansas",34,"400989179"
291,2,"3:24",204,"Foul on James Sosinski.",102,54,"Omaha","Kansas",34,"400989179"
292,2,"3:24",204,"Official TV Timeout",102,54,"Omaha","Kansas",34,"400989179"
293,2,"3:24",204,"Lamar Wofford-Humphrey made Free Throw.",102,55,"Omaha","Kansas",34,"400989179"
294,2,"3:24",204,"Lamar Wofford-Humphrey missed Free Throw.",102,55,"Omaha","Kansas",34,"400989179"
295,2,"3:24",204,"James Sosinski Defensive Rebound.",102,55,"Omaha","Kansas",34,"400989179"
296,2,"3:00",180,"Chris Teahan made Three Point Jumper. Assisted by Sam Cunliffe.",105,55,"Omaha","Kansas",34,"400989179"
297,2,"2:42",162,"Ayo Akinwole made Three Point Jumper. Assisted by Matt Pile.",105,58,"Omaha","Kansas",34,"400989179"
298,2,"2:21",141,"James Sosinski made Jumper. Assisted by Clay Young.",107,58,"Omaha","Kansas",34,"400989179"
299,2,"1:58",118,"Alex Allbery made Three Point Jumper. Assisted by Matt Pile.",107,61,"Omaha","Kansas",34,"400989179"
300,2,"1:34",94,"Sam Cunliffe missed Jumper.",107,61,"Omaha","Kansas",34,"400989179"
301,2,"1:34",94,"Alex Allbery Defensive Rebound.",107,61,"Omaha","Kansas",34,"400989179"
302,2,"1:26",86,"Daniel Norl made Three Point Jumper. Assisted by Alex Allbery.",107,64,"Omaha","Kansas",34,"400989179"
303,2,"0:57",57,"Marcus Garrett missed Layup.",107,64,"Omaha","Kansas",34,"400989179"
304,2,"0:57",57,"James Sosinski Offensive Rebound.",107,64,"Omaha","Kansas",34,"400989179"
305,2,"0:57",57,"James Sosinski made Two Point Tip Shot.",109,64,"Omaha","Kansas",34,"400989179"
306,2,"0:38",38,"JT Gibson missed Jumper.",109,64,"Omaha","Kansas",34,"400989179"
307,2,"0:38",38,"JT Gibson Offensive Rebound.",109,64,"Omaha","Kansas",34,"400989179"
308,2,"0:38",38,"JT Gibson missed Two Point Tip Shot.",109,64,"Omaha","Kansas",34,"400989179"
309,2,"0:38",38,"JT Gibson Offensive Rebound.",109,64,"Omaha","Kansas",34,"400989179"
310,2,"0:38",38,"JT Gibson missed Two Point Tip Shot.",109,64,"Omaha","Kansas",34,"400989179"
311,2,"0:38",38,"Kansas Defensive Rebound.",109,64,"Omaha","Kansas",34,"400989179"
312,2,"0:00",0,"End of Game",109,64,"Omaha","Kansas",34,"400989179"
1,1,"20:00",2400,"PLAY",0,0,"Kansas","Stanford",-15.5,"400988284"
2,1,"20:00",2400,"Jump Ball won by Kansas",0,0,"Kansas","Stanford",-15.5,"400988284"
3,1,"19:47",2387,"Udoka Azubuike made Dunk. Assisted by Malik Newman.",0,2,"Kansas","Stanford",-15.5,"400988284"
4,1,"19:27",2367,"Oscar da Silva missed Layup.",0,2,"Kansas","Stanford",-15.5,"400988284"
5,1,"19:27",2367,"Devonte' Graham Defensive Rebound.",0,2,"Kansas","Stanford",-15.5,"400988284"
6,1,"19:20",2360,"Malik Newman missed Three Point Jumper.",0,2,"Kansas","Stanford",-15.5,"400988284"
7,1,"19:20",2360,"Daejon Davis Defensive Rebound.",0,2,"Kansas","Stanford",-15.5,"400988284"
8,1,"19:12",2352,"Daejon Davis missed Layup.",0,2,"Kansas","Stanford",-15.5,"400988284"
9,1,"19:12",2352,"Robert Cartwright Offensive Rebound.",0,2,"Kansas","Stanford",-15.5,"400988284"
10,1,"19:07",2347,"Reid Travis missed Three Point Jumper.",0,2,"Kansas","Stanford",-15.5,"400988284"
11,1,"19:07",2347,"Malik Newman Defensive Rebound.",0,2,"Kansas","Stanford",-15.5,"400988284"
12,1,"18:47",2327,"Udoka Azubuike missed Jumper.",0,2,"Kansas","Stanford",-15.5,"400988284"
13,1,"18:47",2327,"Oscar da Silva Defensive Rebound.",0,2,"Kansas","Stanford",-15.5,"400988284"
14,1,"18:34",2314,"Robert Cartwright made Three Point Jumper. Assisted by Daejon Davis.",3,2,"Kansas","Stanford",-15.5,"400988284"
15,1,"18:15",2295,"Udoka Azubuike made Jumper.",3,4,"Kansas","Stanford",-15.5,"400988284"
16,1,"17:46",2266,"Daejon Davis Turnover.",3,4,"Kansas","Stanford",-15.5,"400988284"
17,1,"17:36",2256,"Udoka Azubuike made Dunk. Assisted by Lagerald Vick.",3,6,"Kansas","Stanford",-15.5,"400988284"
18,1,"17:20",2240,"Michael Humphrey made Three Point Jumper. Assisted by Oscar da Silva.",6,6,"Kansas","Stanford",-15.5,"400988284"
19,1,"17:04",2224,"Sviatoslav Mykhailiuk Turnover.",6,6,"Kansas","Stanford",-15.5,"400988284"
20,1,"17:04",2224,"Oscar da Silva Steal.",6,6,"Kansas","Stanford",-15.5,"400988284"
21,1,"16:59",2219,"Robert Cartwright made Layup.",8,6,"Kansas","Stanford",-15.5,"400988284"
22,1,"16:44",2204,"Udoka Azubuike made Jumper.",8,8,"Kansas","Stanford",-15.5,"400988284"
23,1,"16:28",2188,"Oscar da Silva missed Layup.",8,8,"Kansas","Stanford",-15.5,"400988284"
24,1,"16:28",2188,"Lagerald Vick Defensive Rebound.",8,8,"Kansas","Stanford",-15.5,"400988284"
25,1,"16:17",2177,"Udoka Azubuike made Layup. Assisted by Lagerald Vick.",8,10,"Kansas","Stanford",-15.5,"400988284"
26,1,"16:03",2163,"Daejon Davis missed Jumper.",8,10,"Kansas","Stanford",-15.5,"400988284"
27,1,"16:03",2163,"Udoka Azubuike Block.",8,10,"Kansas","Stanford",-15.5,"400988284"
28,1,"16:03",2163,"Stanford Offensive Rebound.",8,10,"Kansas","Stanford",-15.5,"400988284"
29,1,"16:00",2160,"Official TV Timeout",8,10,"Kansas","Stanford",-15.5,"400988284"
30,1,"15:56",2156,"Robert Cartwright missed Three Point Jumper.",8,10,"Kansas","Stanford",-15.5,"400988284"
31,1,"15:56",2156,"Robert Cartwright Offensive Rebound.",8,10,"Kansas","Stanford",-15.5,"400988284"
32,1,"15:50",2150,"Robert Cartwright Turnover.",8,10,"Kansas","Stanford",-15.5,"400988284"
33,1,"15:50",2150,"Devonte' Graham Steal.",8,10,"Kansas","Stanford",-15.5,"400988284"
34,1,"15:35",2135,"Sviatoslav Mykhailiuk missed Three Point Jumper.",8,10,"Kansas","Stanford",-15.5,"400988284"
35,1,"15:35",2135,"Kezie Okpala Defensive Rebound.",8,10,"Kansas","Stanford",-15.5,"400988284"
36,1,"15:23",2123,"Michael Humphrey made Three Point Jumper. Assisted by Daejon Davis.",11,10,"Kansas","Stanford",-15.5,"400988284"
37,1,"14:59",2099,"Lagerald Vick made Dunk. Assisted by Sviatoslav Mykhailiuk.",11,12,"Kansas","Stanford",-15.5,"400988284"
38,1,"14:40",2080,"Michael Humphrey missed Three Point Jumper.",11,12,"Kansas","Stanford",-15.5,"400988284"
39,1,"14:40",2080,"Lagerald Vick Defensive Rebound.",11,12,"Kansas","Stanford",-15.5,"400988284"
40,1,"14:29",2069,"Foul on Reid Travis.",11,12,"Kansas","Stanford",-15.5,"400988284"
41,1,"14:16",2056,"Lagerald Vick missed Jumper.",11,12,"Kansas","Stanford",-15.5,"400988284"
42,1,"14:16",2056,"Michael Humphrey Defensive Rebound.",11,12,"Kansas","Stanford",-15.5,"400988284"
43,1,"13:56",2036,"Reid Travis missed Jumper.",11,12,"Kansas","Stanford",-15.5,"400988284"
44,1,"13:56",2036,"Sviatoslav Mykhailiuk Defensive Rebound.",11,12,"Kansas","Stanford",-15.5,"400988284"
45,1,"13:53",2033,"Technical Foul on Michael Humphrey.",11,12,"Kansas","Stanford",-15.5,"400988284"
46,1,"13:53",2033,"Devonte' Graham made Free Throw.",11,13,"Kansas","Stanford",-15.5,"400988284"
47,1,"13:45",2025,"Devonte' Graham made Three Point Jumper. Assisted by Marcus Garrett.",11,16,"Kansas","Stanford",-15.5,"400988284"
48,1,"13:23",2003,"Reid Travis made Layup.",13,16,"Kansas","Stanford",-15.5,"400988284"
49,1,"13:15",1995,"Foul on Kezie Okpala.",13,16,"Kansas","Stanford",-15.5,"400988284"
50,1,"13:11",1991,"Lagerald Vick made Dunk. Assisted by Devonte' Graham.",13,18,"Kansas","Stanford",-15.5,"400988284"
51,1,"12:55",1975,"Daejon Davis missed Jumper.",13,18,"Kansas","Stanford",-15.5,"400988284"
52,1,"12:55",1975,"Marcus Garrett Defensive Rebound.",13,18,"Kansas","Stanford",-15.5,"400988284"
53,1,"12:48",1968,"Devonte' Graham made Three Point Jumper.",13,21,"Kansas","Stanford",-15.5,"400988284"
54,1,"12:43",1963,"Stanford  Timeout",13,21,"Kansas","Stanford",-15.5,"400988284"
55,1,"12:43",1963,"Reid Travis Turnover.",13,21,"Kansas","Stanford",-15.5,"400988284"
56,1,"12:43",1963,"Lagerald Vick Steal.",13,21,"Kansas","Stanford",-15.5,"400988284"
57,1,"12:34",1954,"Lagerald Vick made Three Point Jumper. Assisted by Devonte' Graham.",13,24,"Kansas","Stanford",-15.5,"400988284"
58,1,"12:09",1929,"Foul on Lagerald Vick.",13,24,"Kansas","Stanford",-15.5,"400988284"
59,1,"12:09",1929,"Foul on Lagerald Vick.",13,24,"Kansas","Stanford",-15.5,"400988284"
60,1,"12:03",1923,"Kezie Okpala missed Jumper.",13,24,"Kansas","Stanford",-15.5,"400988284"
61,1,"12:03",1923,"Josh Sharma Offensive Rebound.",13,24,"Kansas","Stanford",-15.5,"400988284"
62,1,"11:57",1917,"Jump Ball won by Stanford",13,24,"Kansas","Stanford",-15.5,"400988284"
63,1,"11:57",1917,"Official TV Timeout",13,24,"Kansas","Stanford",-15.5,"400988284"
64,1,"11:49",1909,"Josh Sharma missed Jumper.",13,24,"Kansas","Stanford",-15.5,"400988284"
65,1,"11:49",1909,"Udoka Azubuike Defensive Rebound.",13,24,"Kansas","Stanford",-15.5,"400988284"
66,1,"11:29",1889,"Foul on Kezie Okpala.",13,24,"Kansas","Stanford",-15.5,"400988284"
67,1,"11:23",1883,"Devonte' Graham missed Layup.",13,24,"Kansas","Stanford",-15.5,"400988284"
68,1,"11:23",1883,"Udoka Azubuike Offensive Rebound.",13,24,"Kansas","Stanford",-15.5,"400988284"
69,1,"11:11",1871,"Sviatoslav Mykhailiuk made Dunk.",13,26,"Kansas","Stanford",-15.5,"400988284"
70,1,"11:00",1860,"Foul on Marcus Garrett.",13,26,"Kansas","Stanford",-15.5,"400988284"
71,1,"10:45",1845,"Daejon Davis Turnover.",13,26,"Kansas","Stanford",-15.5,"400988284"
72,1,"10:28",1828,"Udoka Azubuike made Dunk. Assisted by Devonte' Graham.",13,28,"Kansas","Stanford",-15.5,"400988284"
73,1,"9:59",1799,"Michael Humphrey made Dunk. Assisted by Isaac White.",15,28,"Kansas","Stanford",-15.5,"400988284"
74,1,"9:44",1784,"Malik Newman made Three Point Jumper.",15,31,"Kansas","Stanford",-15.5,"400988284"
75,1,"9:34",1774,"Isaac White missed Three Point Jumper.",15,31,"Kansas","Stanford",-15.5,"400988284"
76,1,"9:34",1774,"Michael Humphrey Offensive Rebound.",15,31,"Kansas","Stanford",-15.5,"400988284"
77,1,"9:24",1764,"Foul on Sam Cunliffe.",15,31,"Kansas","Stanford",-15.5,"400988284"
78,1,"9:15",1755,"Reid Travis Turnover.",15,31,"Kansas","Stanford",-15.5,"400988284"
79,1,"9:00",1740,"Devonte' Graham missed Layup.",15,31,"Kansas","Stanford",-15.5,"400988284"
80,1,"9:00",1740,"Oscar da Silva Defensive Rebound.",15,31,"Kansas","Stanford",-15.5,"400988284"
81,1,"8:42",1722,"Michael Humphrey missed Three Point Jumper.",15,31,"Kansas","Stanford",-15.5,"400988284"
82,1,"8:42",1722,"Michael Humphrey Offensive Rebound.",15,31,"Kansas","Stanford",-15.5,"400988284"
83,1,"8:38",1718,"Michael Humphrey missed Layup.",15,31,"Kansas","Stanford",-15.5,"400988284"
84,1,"8:38",1718,"Sam Cunliffe Defensive Rebound.",15,31,"Kansas","Stanford",-15.5,"400988284"
85,1,"8:29",1709,"Devonte' Graham missed Three Point Jumper.",15,31,"Kansas","Stanford",-15.5,"400988284"
86,1,"8:29",1709,"Isaac White Defensive Rebound.",15,31,"Kansas","Stanford",-15.5,"400988284"
87,1,"8:13",1693,"Michael Humphrey made Jumper. Assisted by Oscar da Silva.",17,31,"Kansas","Stanford",-15.5,"400988284"
88,1,"7:55",1675,"Sam Cunliffe made Layup.",17,33,"Kansas","Stanford",-15.5,"400988284"
89,1,"7:40",1660,"Isaac White missed Three Point Jumper.",17,33,"Kansas","Stanford",-15.5,"400988284"
90,1,"7:40",1660,"Udoka Azubuike Defensive Rebound.",17,33,"Kansas","Stanford",-15.5,"400988284"
91,1,"7:40",1660,"Udoka Azubuike Turnover.",17,33,"Kansas","Stanford",-15.5,"400988284"
92,1,"7:17",1637,"Devonte' Graham missed Three Point Jumper.",17,33,"Kansas","Stanford",-15.5,"400988284"
93,1,"7:17",1637,"Official TV Timeout",17,33,"Kansas","Stanford",-15.5,"400988284"
94,1,"7:17",1637,"Udoka Azubuike Offensive Rebound.",17,33,"Kansas","Stanford",-15.5,"400988284"
95,1,"6:53",1613,"Michael Humphrey made Dunk. Assisted by Robert Cartwright.",19,33,"Kansas","Stanford",-15.5,"400988284"
96,1,"6:39",1599,"Sam Cunliffe missed Layup.",19,33,"Kansas","Stanford",-15.5,"400988284"
97,1,"6:39",1599,"Oscar da Silva Block.",19,33,"Kansas","Stanford",-15.5,"400988284"
98,1,"6:39",1599,"Kansas Offensive Rebound.",19,33,"Kansas","Stanford",-15.5,"400988284"
99,1,"6:27",1587,"Mitch Lightfoot missed Three Point Jumper.",19,33,"Kansas","Stanford",-15.5,"400988284"
100,1,"6:27",1587,"Robert Cartwright Defensive Rebound.",19,33,"Kansas","Stanford",-15.5,"400988284"
101,1,"6:13",1573,"Michael Humphrey Turnover.",19,33,"Kansas","Stanford",-15.5,"400988284"
102,1,"6:13",1573,"Malik Newman Steal.",19,33,"Kansas","Stanford",-15.5,"400988284"
103,1,"6:08",1568,"Lagerald Vick made Three Point Jumper.",19,36,"Kansas","Stanford",-15.5,"400988284"
104,1,"5:40",1540,"Kezie Okpala made Three Point Jumper. Assisted by Robert Cartwright.",22,36,"Kansas","Stanford",-15.5,"400988284"
105,1,"5:21",1521,"Sviatoslav Mykhailiuk made Jumper.",22,38,"Kansas","Stanford",-15.5,"400988284"
106,1,"5:03",1503,"Robert Cartwright made Layup.",24,38,"Kansas","Stanford",-15.5,"400988284"
107,1,"4:47",1487,"Foul on Mitch Lightfoot.",24,38,"Kansas","Stanford",-15.5,"400988284"
108,1,"4:47",1487,"Mitch Lightfoot Turnover.",24,38,"Kansas","Stanford",-15.5,"400988284"
109,1,"4:30",1470,"Michael Humphrey missed Jumper.",24,38,"Kansas","Stanford",-15.5,"400988284"
110,1,"4:30",1470,"Lagerald Vick Defensive Rebound.",24,38,"Kansas","Stanford",-15.5,"400988284"
111,1,"4:19",1459,"Marcus Garrett missed Three Point Jumper.",24,38,"Kansas","Stanford",-15.5,"400988284"
112,1,"4:19",1459,"Reid Travis Defensive Rebound.",24,38,"Kansas","Stanford",-15.5,"400988284"
113,1,"4:04",1444,"Foul on Devonte' Graham.",24,38,"Kansas","Stanford",-15.5,"400988284"
114,1,"4:01",1441,"Daejon Davis Turnover.",24,38,"Kansas","Stanford",-15.5,"400988284"
115,1,"4:01",1441,"Devonte' Graham Steal.",24,38,"Kansas","Stanford",-15.5,"400988284"
116,1,"3:51",1431,"Udoka Azubuike made Layup.",24,40,"Kansas","Stanford",-15.5,"400988284"
117,1,"3:33",1413,"Foul on Udoka Azubuike.",24,40,"Kansas","Stanford",-15.5,"400988284"
118,1,"3:33",1413,"Official TV Timeout",24,40,"Kansas","Stanford",-15.5,"400988284"
119,1,"3:33",1413,"Reid Travis missed Free Throw.",24,40,"Kansas","Stanford",-15.5,"400988284"
120,1,"3:33",1413,"Malik Newman Defensive Rebound.",24,40,"Kansas","Stanford",-15.5,"400988284"
121,1,"3:11",1391,"Sviatoslav Mykhailiuk missed Three Point Jumper.",24,40,"Kansas","Stanford",-15.5,"400988284"
122,1,"3:11",1391,"Josh Sharma Defensive Rebound.",24,40,"Kansas","Stanford",-15.5,"400988284"
123,1,"2:54",1374,"Kezie Okpala missed Three Point Jumper.",24,40,"Kansas","Stanford",-15.5,"400988284"
124,1,"2:54",1374,"Josh Sharma Offensive Rebound.",24,40,"Kansas","Stanford",-15.5,"400988284"
125,1,"2:24",1344,"Josh Sharma missed Three Point Jumper.",24,40,"Kansas","Stanford",-15.5,"400988284"
126,1,"2:24",1344,"Udoka Azubuike Defensive Rebound.",24,40,"Kansas","Stanford",-15.5,"400988284"
127,1,"2:17",1337,"Sviatoslav Mykhailiuk made Dunk. Assisted by Devonte' Graham.",24,42,"Kansas","Stanford",-15.5,"400988284"
128,1,"1:46",1306,"Foul on Lagerald Vick.",24,42,"Kansas","Stanford",-15.5,"400988284"
129,1,"1:46",1306,"Kezie Okpala made Free Throw.",25,42,"Kansas","Stanford",-15.5,"400988284"
130,1,"1:46",1306,"Kezie Okpala missed Free Throw.",25,42,"Kansas","Stanford",-15.5,"400988284"
131,1,"1:46",1306,"Reid Travis Offensive Rebound.",25,42,"Kansas","Stanford",-15.5,"400988284"
132,1,"1:31",1291,"Reid Travis made Jumper.",27,42,"Kansas","Stanford",-15.5,"400988284"
133,1,"1:11",1271,"Devonte' Graham made Three Point Jumper. Assisted by Malik Newman.",27,45,"Kansas","Stanford",-15.5,"400988284"
134,1,"0:40",1240,"Robert Cartwright missed Jumper.",27,45,"Kansas","Stanford",-15.5,"400988284"
