"play_id","half","time_remaining_half","secs_remaining","description","home_score","away_score","away","home","home_favored_by","game_id"
12,1,"18:23",2303,"Lagerald Vick Offensive Rebound.",2,8,"Texas Southern","Kansas",NA,"400989176"
13,1,"18:17",2297,"Udoka Azubuike missed Layup.",2,8,"Texas Southern","Kansas",NA,"400989176"
14,1,"18:17",2297,"Lagerald Vick Offensive Rebound.",2,8,"Texas Southern","Kansas",NA,"400989176"
15,1,"18:17",2297,"Lagerald Vick missed Two Point Tip Shot.",2,8,"Texas Southern","Kansas",NA,"400989176"
16,1,"18:17",2297,"Lagerald Vick Offensive Rebound.",2,8,"Texas Southern","Kansas",NA,"400989176"
17,1,"18:17",2297,"Lagerald Vick made Two Point Tip Shot.",4,8,"Texas Southern","Kansas",NA,"400989176"
18,1,"18:01",2281,"Donte Clark missed Jumper.",4,8,"Texas Southern","Kansas",NA,"400989176"
19,1,"18:01",2281,"Devonte' Graham Defensive Rebound.",4,8,"Texas Southern","Kansas",NA,"400989176"
20,1,"17:52",2272,"Foul on Kevin Scott.",4,8,"Texas Southern","Kansas",NA,"400989176"
21,1,"17:38",2258,"Foul on Trayvon Reed.",4,8,"Texas Southern","Kansas",NA,"400989176"
22,1,"17:38",2258,"Udoka Azubuike missed Free Throw.",4,8,"Texas Southern","Kansas",NA,"400989176"
23,1,"17:38",2258,"Kansas Deadball Team Rebound.",4,8,"Texas Southern","Kansas",NA,"400989176"
24,1,"17:38",2258,"Udoka Azubuike made Free Throw.",5,8,"Texas Southern","Kansas",NA,"400989176"
25,1,"17:26",2246,"Demontrae Jefferson Turnover.",5,8,"Texas Southern","Kansas",NA,"400989176"
26,1,"17:26",2246,"Devonte' Graham Steal.",5,8,"Texas Southern","Kansas",NA,"400989176"
27,1,"17:21",2241,"Malik Newman made Three Point Jumper. Assisted by Devonte' Graham.",8,8,"Texas Southern","Kansas",NA,"400989176"
28,1,"17:07",2227,"Kevin Scott made Three Point Jumper. Assisted by Robert Lewis.",8,11,"Texas Southern","Kansas",NA,"400989176"
29,1,"16:52",2212,"Udoka Azubuike made Layup. Assisted by Devonte' Graham.",10,11,"Texas Southern","Kansas",NA,"400989176"
30,1,"16:29",2189,"Foul on Sviatoslav Mykhailiuk.",10,11,"Texas Southern","Kansas",NA,"400989176"
31,1,"16:21",2181,"Kevin Scott Turnover.",10,11,"Texas Southern","Kansas",NA,"400989176"
32,1,"16:19",2179,"Malik Newman missed Jumper.",10,11,"Texas Southern","Kansas",NA,"400989176"
33,1,"16:19",2179,"Trayvon Reed Defensive Rebound.",10,11,"Texas Southern","Kansas",NA,"400989176"
34,1,"16:10",2170,"Robert Lewis missed Three Point Jumper.",10,11,"Texas Southern","Kansas",NA,"400989176"
35,1,"16:10",2170,"Malik Newman Defensive Rebound.",10,11,"Texas Southern","Kansas",NA,"400989176"
36,1,"16:02",2162,"Lagerald Vick Turnover.",10,11,"Texas Southern","Kansas",NA,"400989176"
37,1,"16:02",2162,"Demontrae Jefferson Steal.",10,11,"Texas Southern","Kansas",NA,"400989176"
38,1,"15:41",2141,"Trayvon Reed missed Jumper.",10,11,"Texas Southern","Kansas",NA,"400989176"
39,1,"15:41",2141,"Devonte' Graham Defensive Rebound.",10,11,"Texas Southern","Kansas",NA,"400989176"
40,1,"15:34",2134,"Foul on Donte Clark.",10,11,"Texas Southern","Kansas",NA,"400989176"
41,1,"15:34",2134,"Official TV Timeout",10,11,"Texas Southern","Kansas",NA,"400989176"
42,1,"15:15",2115,"Lagerald Vick made Three Point Jumper.",13,11,"Texas Southern","Kansas",NA,"400989176"
43,1,"14:41",2081,"Demontrae Jefferson missed Jumper.",13,11,"Texas Southern","Kansas",NA,"400989176"
44,1,"14:41",2081,"Devonte' Graham Defensive Rebound.",13,11,"Texas Southern","Kansas",NA,"400989176"
45,1,"14:29",2069,"Devonte' Graham made Three Point Jumper. Assisted by Lagerald Vick.",16,11,"Texas Southern","Kansas",NA,"400989176"
46,1,"14:04",2044,"Donte Clark missed Jumper.",16,11,"Texas Southern","Kansas",NA,"400989176"
47,1,"14:04",2044,"Udoka Azubuike Defensive Rebound.",16,11,"Texas Southern","Kansas",NA,"400989176"
48,1,"13:46",2026,"Malik Newman missed Jumper.",16,11,"Texas Southern","Kansas",NA,"400989176"
49,1,"13:46",2026,"Derrick Bruce Defensive Rebound.",16,11,"Texas Southern","Kansas",NA,"400989176"
50,1,"13:36",2016,"Derrick Bruce Turnover.",16,11,"Texas Southern","Kansas",NA,"400989176"
51,1,"13:36",2016,"Udoka Azubuike Steal.",16,11,"Texas Southern","Kansas",NA,"400989176"
52,1,"13:30",2010,"Devonte' Graham missed Three Point Jumper.",16,11,"Texas Southern","Kansas",NA,"400989176"
53,1,"13:30",2010,"Udoka Azubuike Offensive Rebound.",16,11,"Texas Southern","Kansas",NA,"400989176"
54,1,"13:30",2010,"Udoka Azubuike Turnover.",16,11,"Texas Southern","Kansas",NA,"400989176"
55,1,"13:30",2010,"Derrick Bruce Steal.",16,11,"Texas Southern","Kansas",NA,"400989176"
56,1,"13:22",2002,"Foul on Malik Newman.",16,11,"Texas Southern","Kansas",NA,"400989176"
57,1,"13:14",1994,"Derrick Bruce missed Layup.",16,11,"Texas Southern","Kansas",NA,"400989176"
58,1,"13:14",1994,"Marcus Garrett Block.",16,11,"Texas Southern","Kansas",NA,"400989176"
59,1,"13:14",1994,"Marcus Garrett Defensive Rebound.",16,11,"Texas Southern","Kansas",NA,"400989176"
60,1,"13:05",1985,"Lagerald Vick made Three Point Jumper. Assisted by Marcus Garrett.",19,11,"Texas Southern","Kansas",NA,"400989176"
61,1,"12:39",1959,"Trayvon Reed made Dunk. Assisted by Kevin Scott.",19,13,"Texas Southern","Kansas",NA,"400989176"
62,1,"12:13",1933,"Marcus Garrett made Three Point Jumper. Assisted by Devonte' Graham.",22,13,"Texas Southern","Kansas",NA,"400989176"
63,1,"11:52",1912,"Kevin Scott missed Three Point Jumper.",22,13,"Texas Southern","Kansas",NA,"400989176"
64,1,"11:52",1912,"Marcus Garrett Defensive Rebound.",22,13,"Texas Southern","Kansas",NA,"400989176"
65,1,"11:44",1904,"Devonte' Graham made Layup.",24,13,"Texas Southern","Kansas",NA,"400989176"
66,1,"11:42",1902,"Texas Southern  Timeout",24,13,"Texas Southern","Kansas",NA,"400989176"
67,1,"11:28",1888,"Demontrae Jefferson Turnover.",24,13,"Texas Southern","Kansas",NA,"400989176"
68,1,"11:11",1871,"Sviatoslav Mykhailiuk missed Three Point Jumper.",24,13,"Texas Southern","Kansas",NA,"400989176"
69,1,"11:11",1871,"Texas Southern Defensive Rebound.",24,13,"Texas Southern","Kansas",NA,"400989176"
70,1,"10:56",1856,"Kevin Scott missed Jumper.",24,13,"Texas Southern","Kansas",NA,"400989176"
71,1,"10:56",1856,"Kansas Defensive Rebound.",24,13,"Texas Southern","Kansas",NA,"400989176"
72,1,"10:36",1836,"Malik Newman made Three Point Jumper. Assisted by Devonte' Graham.",27,13,"Texas Southern","Kansas",NA,"400989176"
73,1,"10:24",1824,"Demontrae Jefferson Turnover.",27,13,"Texas Southern","Kansas",NA,"400989176"
74,1,"10:24",1824,"Devonte' Graham Steal.",27,13,"Texas Southern","Kansas",NA,"400989176"
75,1,"10:14",1814,"Sviatoslav Mykhailiuk made Jumper.",29,13,"Texas Southern","Kansas",NA,"400989176"
76,1,"9:51",1791,"Trayvon Reed made Dunk. Assisted by Kevin Scott.",29,15,"Texas Southern","Kansas",NA,"400989176"
77,1,"9:29",1769,"Marcus Garrett missed Layup.",29,15,"Texas Southern","Kansas",NA,"400989176"
78,1,"9:29",1769,"Trayvon Reed Block.",29,15,"Texas Southern","Kansas",NA,"400989176"
79,1,"9:29",1769,"Sviatoslav Mykhailiuk Offensive Rebound.",29,15,"Texas Southern","Kansas",NA,"400989176"
80,1,"9:22",1762,"Sviatoslav Mykhailiuk made Three Point Jumper. Assisted by Marcus Garrett.",32,15,"Texas Southern","Kansas",NA,"400989176"
81,1,"9:06",1746,"Kevin Scott missed Three Point Jumper.",32,15,"Texas Southern","Kansas",NA,"400989176"
82,1,"9:06",1746,"Udoka Azubuike Defensive Rebound.",32,15,"Texas Southern","Kansas",NA,"400989176"
83,1,"8:59",1739,"Sviatoslav Mykhailiuk made Three Point Jumper.",35,15,"Texas Southern","Kansas",NA,"400989176"
84,1,"8:34",1714,"Donte Clark Turnover.",35,15,"Texas Southern","Kansas",NA,"400989176"
85,1,"8:34",1714,"Malik Newman Steal.",35,15,"Texas Southern","Kansas",NA,"400989176"
86,1,"8:29",1709,"Udoka Azubuike made Dunk. Assisted by Malik Newman.",37,15,"Texas Southern","Kansas",NA,"400989176"
87,1,"8:24",1704,"Technical Foul on Udoka Azubuike.",37,15,"Texas Southern","Kansas",NA,"400989176"
88,1,"8:24",1704,"Foul on Udoka Azubuike.",37,15,"Texas Southern","Kansas",NA,"400989176"
89,1,"8:24",1704,"Donte Clark made Free Throw.",37,16,"Texas Southern","Kansas",NA,"400989176"
90,1,"8:08",1688,"Foul on Lagerald Vick.",37,16,"Texas Southern","Kansas",NA,"400989176"
91,1,"8:02",1682,"Demontrae Jefferson made Layup.",37,18,"Texas Southern","Kansas",NA,"400989176"
92,1,"7:45",1665,"Foul on Derrick Bruce.",37,18,"Texas Southern","Kansas",NA,"400989176"
93,1,"7:45",1665,"Official TV Timeout",37,18,"Texas Southern","Kansas",NA,"400989176"
94,1,"7:45",1665,"Marcus Garrett made Free Throw.",38,18,"Texas Southern","Kansas",NA,"400989176"
95,1,"7:45",1665,"Marcus Garrett made Free Throw.",39,18,"Texas Southern","Kansas",NA,"400989176"
96,1,"7:34",1654,"Donte Clark made Jumper.",39,20,"Texas Southern","Kansas",NA,"400989176"
97,1,"7:18",1638,"Sviatoslav Mykhailiuk made Three Point Jumper. Assisted by Malik Newman.",42,20,"Texas Southern","Kansas",NA,"400989176"
98,1,"6:57",1617,"Demontrae Jefferson made Three Point Jumper.",42,23,"Texas Southern","Kansas",NA,"400989176"
99,1,"6:47",1607,"Lagerald Vick missed Three Point Jumper.",42,23,"Texas Southern","Kansas",NA,"400989176"
100,1,"6:47",1607,"Marquis Salmon Defensive Rebound.",42,23,"Texas Southern","Kansas",NA,"400989176"
101,1,"6:36",1596,"Demontrae Jefferson missed Jumper.",42,23,"Texas Southern","Kansas",NA,"400989176"
102,1,"6:36",1596,"Udoka Azubuike Block.",42,23,"Texas Southern","Kansas",NA,"400989176"
103,1,"6:36",1596,"Marquis Salmon Offensive Rebound.",42,23,"Texas Southern","Kansas",NA,"400989176"
104,1,"6:30",1590,"Marquis Salmon missed Layup.",42,23,"Texas Southern","Kansas",NA,"400989176"
105,1,"6:30",1590,"Marcus Garrett Block.",42,23,"Texas Southern","Kansas",NA,"400989176"
106,1,"6:30",1590,"Marcus Garrett Defensive Rebound.",42,23,"Texas Southern","Kansas",NA,"400989176"
107,1,"6:28",1588,"Foul on Kevin Scott.",42,23,"Texas Southern","Kansas",NA,"400989176"
108,1,"6:28",1588,"Sviatoslav Mykhailiuk made Free Throw.",43,23,"Texas Southern","Kansas",NA,"400989176"
109,1,"6:28",1588,"Sviatoslav Mykhailiuk made Free Throw.",44,23,"Texas Southern","Kansas",NA,"400989176"
110,1,"6:07",1567,"Trayvon Reed made Layup. Assisted by Demontrae Jefferson.",44,25,"Texas Southern","Kansas",NA,"400989176"
111,1,"6:07",1567,"Foul on Mitch Lightfoot.",44,25,"Texas Southern","Kansas",NA,"400989176"
112,1,"6:07",1567,"Trayvon Reed missed Free Throw.",44,25,"Texas Southern","Kansas",NA,"400989176"
113,1,"6:07",1567,"Malik Newman Defensive Rebound.",44,25,"Texas Southern","Kansas",NA,"400989176"
114,1,"6:07",1567,"Foul on Robert Lewis.",44,25,"Texas Southern","Kansas",NA,"400989176"
115,1,"5:56",1556,"Mitch Lightfoot made Jumper. Assisted by Devonte' Graham.",46,25,"Texas Southern","Kansas",NA,"400989176"
116,1,"5:32",1532,"Derrick Bruce Turnover.",46,25,"Texas Southern","Kansas",NA,"400989176"
117,1,"5:32",1532,"Devonte' Graham Steal.",46,25,"Texas Southern","Kansas",NA,"400989176"
118,1,"5:23",1523,"Lagerald Vick made Dunk. Assisted by Devonte' Graham.",48,25,"Texas Southern","Kansas",NA,"400989176"
119,1,"5:07",1507,"Donte Clark missed Layup.",48,25,"Texas Southern","Kansas",NA,"400989176"
120,1,"5:07",1507,"Trayvon Reed Offensive Rebound.",48,25,"Texas Southern","Kansas",NA,"400989176"
121,1,"5:06",1506,"Trayvon Reed missed Two Point Tip Shot.",48,25,"Texas Southern","Kansas",NA,"400989176"
122,1,"5:06",1506,"Mitch Lightfoot Defensive Rebound.",48,25,"Texas Southern","Kansas",NA,"400989176"
123,1,"4:57",1497,"Foul on Donte Clark.",48,25,"Texas Southern","Kansas",NA,"400989176"
124,1,"4:57",1497,"Technical Foul on Donte Clark.",48,25,"Texas Southern","Kansas",NA,"400989176"
125,1,"4:57",1497,"Foul on Donte Clark.",48,25,"Texas Southern","Kansas",NA,"400989176"
126,1,"4:57",1497,"Devonte' Graham made Free Throw.",49,25,"Texas Southern","Kansas",NA,"400989176"
127,1,"4:57",1497,"Devonte' Graham made Free Throw.",50,25,"Texas Southern","Kansas",NA,"400989176"
128,1,"4:57",1497,"Mitch Lightfoot missed Free Throw.",51,25,"Texas Southern","Kansas",NA,"400989176"
129,1,"4:57",1497,"Mitch Lightfoot made Free Throw.",51,25,"Texas Southern","Kansas",NA,"400989176"
130,1,"4:56",1496,"Sviatoslav Mykhailiuk Offensive Rebound.",51,25,"Texas Southern","Kansas",NA,"400989176"
131,1,"4:50",1490,"Lagerald Vick made Three Point Jumper. Assisted by Devonte' Graham.",54,25,"Texas Southern","Kansas",NA,"400989176"
132,1,"4:34",1474,"Kevin Scott missed Jumper.",54,25,"Texas Southern","Kansas",NA,"400989176"
133,1,"4:34",1474,"Mitch Lightfoot Block.",54,25,"Texas Southern","Kansas",NA,"400989176"
134,1,"4:34",1474,"Texas Southern Offensive Rebound.",54,25,"Texas Southern","Kansas",NA,"400989176"
135,1,"4:24",1464,"Derrick Bruce Turnover.",54,25,"Texas Southern","Kansas",NA,"400989176"
136,1,"4:11",1451,"Marcus Garrett missed Layup.",54,25,"Texas Southern","Kansas",NA,"400989176"
137,1,"4:11",1451,"Trayvon Reed Block.",54,25,"Texas Southern","Kansas",NA,"400989176"
138,1,"4:11",1451,"Marcus Garrett Offensive Rebound.",54,25,"Texas Southern","Kansas",NA,"400989176"
139,1,"4:03",1443,"Marcus Garrett missed Three Point Jumper.",54,25,"Texas Southern","Kansas",NA,"400989176"
140,1,"4:03",1443,"Mitch Lightfoot Offensive Rebound.",54,25,"Texas Southern","Kansas",NA,"400989176"
141,1,"3:58",1438,"Devonte' Graham missed Three Point Jumper.",54,25,"Texas Southern","Kansas",NA,"400989176"
142,1,"3:58",1438,"Mitch Lightfoot Offensive Rebound.",54,25,"Texas Southern","Kansas",NA,"400989176"
143,1,"3:48",1428,"Marcus Garrett made Three Point Jumper. Assisted by Lagerald Vick.",57,25,"Texas Southern","Kansas",NA,"400989176"
144,1,"3:24",1404,"Official TV Timeout",57,25,"Texas Southern","Kansas",NA,"400989176"
145,1,"3:12",1392,"Demontrae Jefferson missed Three Point Jumper.",57,25,"Texas Southern","Kansas",NA,"400989176"
146,1,"3:12",1392,"Kansas Defensive Rebound.",57,25,"Texas Southern","Kansas",NA,"400989176"
147,1,"2:50",1370,"Marcus Garrett made Layup.",59,25,"Texas Southern","Kansas",NA,"400989176"
148,1,"2:50",1370,"Foul on Derrick Bruce.",59,25,"Texas Southern","Kansas",NA,"400989176"
149,1,"2:50",1370,"Marcus Garrett missed Free Throw.",59,25,"Texas Southern","Kansas",NA,"400989176"
150,1,"2:50",1370,"Trayvon Reed Defensive Rebound.",59,25,"Texas Southern","Kansas",NA,"400989176"
151,1,"2:40",1360,"Trayvon Reed made Dunk. Assisted by Cainan McClelland.",59,27,"Texas Southern","Kansas",NA,"400989176"
152,1,"2:21",1341,"Udoka Azubuike missed Jumper.",59,27,"Texas Southern","Kansas",NA,"400989176"
153,1,"2:21",1341,"Trayvon Reed Block.",59,27,"Texas Southern","Kansas",NA,"400989176"
154,1,"2:21",1341,"Derrick Bruce Defensive Rebound.",59,27,"Texas Southern","Kansas",NA,"400989176"
155,1,"2:05",1325,"Demontrae Jefferson missed Jumper.",59,27,"Texas Southern","Kansas",NA,"400989176"
156,1,"2:05",1325,"Lagerald Vick Defensive Rebound.",59,27,"Texas Southern","Kansas",NA,"400989176"
157,1,"1:57",1317,"Malik Newman made Three Point Jumper. Assisted by Lagerald Vick.",62,27,"Texas Southern","Kansas",NA,"400989176"
158,1,"1:38",1298,"Kevin Scott missed Jumper.",62,27,"Texas Southern","Kansas",NA,"400989176"
159,1,"1:38",1298,"Udoka Azubuike Defensive Rebound.",62,27,"Texas Southern","Kansas",NA,"400989176"
160,1,"1:22",1282,"Udoka Azubuike made Dunk. Assisted by Lagerald Vick.",64,27,"Texas Southern","Kansas",NA,"400989176"
161,1,"1:07",1267,"Derrick Bruce made Three Point Jumper. Assisted by Kevin Scott.",64,30,"Texas Southern","Kansas",NA,"400989176"
162,1,"0:47",1247,"Udoka Azubuike made Layup.",66,30,"Texas Southern","Kansas",NA,"400989176"
163,1,"0:38",1238,"Foul on Kevin Scott.",66,30,"Texas Southern","Kansas",NA,"400989176"
164,1,"0:38",1238,"Kevin Scott Turnover.",66,30,"Texas Southern","Kansas",NA,"400989176"
165,1,"0:16",1216,"Marcus Garrett missed Three Point Jumper.",66,30,"Texas Southern","Kansas",NA,"400989176"
166,1,"0:16",1216,"Marcus Garrett Offensive Rebound.",66,30,"Texas Southern","Kansas",NA,"400989176"
167,1,"0:03",1203,"Devonte' Graham missed Three Point Jumper.",66,30,"Texas Southern","Kansas",NA,"400989176"
168,1,"0:03",1203,"Demontrae Jefferson Defensive Rebound.",66,30,"Texas Southern","Kansas",NA,"400989176"
169,1,"0:00",1200,"End of 1st half",66,30,"Texas Southern","Kansas",NA,"400989176"
170,2,"20:00",1200,"PLAY",66,30,"Texas Southern","Kansas",NA,"400989176"
171,2,"20:00",1200,"Jump Ball won by Kansas",66,30,"Texas Southern","Kansas",NA,"400989176"
172,2,"19:49",1189,"Lagerald Vick missed Layup.",66,30,"Texas Southern","Kansas",NA,"400989176"
173,2,"19:49",1189,"Trayvon Reed Defensive Rebound.",66,30,"Texas Southern","Kansas",NA,"400989176"
174,2,"19:39",1179,"Demontrae Jefferson missed Jumper.",66,30,"Texas Southern","Kansas",NA,"400989176"
175,2,"19:39",1179,"Trayvon Reed Offensive Rebound.",66,30,"Texas Southern","Kansas",NA,"400989176"
176,2,"19:39",1179,"Trayvon Reed made Two Point Tip Shot.",66,32,"Texas Southern","Kansas",NA,"400989176"
177,2,"19:19",1159,"Malik Newman missed Three Point Jumper.",66,32,"Texas Southern","Kansas",NA,"400989176"
178,2,"19:19",1159,"Trayvon Reed Defensive Rebound.",66,32,"Texas Southern","Kansas",NA,"400989176"
179,2,"19:18",1158,"Demontrae Jefferson missed Layup.",66,32,"Texas Southern","Kansas",NA,"400989176"
180,2,"19:18",1158,"Trayvon Reed Offensive Rebound.",66,32,"Texas Southern","Kansas",NA,"400989176"
181,2,"19:07",1147,"Foul on Devonte' Graham.",66,32,"Texas Southern","Kansas",NA,"400989176"
182,2,"19:07",1147,"Trayvon Reed made Free Throw.",66,33,"Texas Southern","Kansas",NA,"400989176"
183,2,"19:07",1147,"Trayvon Reed made Free Throw.",66,34,"Texas Southern","Kansas",NA,"400989176"
184,2,"18:56",1136,"Devonte' Graham made Three Point Jumper.",69,34,"Texas Southern","Kansas",NA,"400989176"
185,2,"18:26",1106,"Donte Clark missed Jumper.",69,34,"Texas Southern","Kansas",NA,"400989176"
186,2,"18:26",1106,"Trayvon Reed Offensive Rebound.",69,34,"Texas Southern","Kansas",NA,"400989176"
187,2,"18:22",1102,"Foul on Udoka Azubuike.",69,34,"Texas Southern","Kansas",NA,"400989176"
188,2,"18:22",1102,"Trayvon Reed missed Free Throw.",69,34,"Texas Southern","Kansas",NA,"400989176"
189,2,"18:22",1102,"Texas Southern Deadball Team Rebound.",69,34,"Texas Southern","Kansas",NA,"400989176"
190,2,"18:10",1090,"Devonte' Graham Turnover.",69,34,"Texas Southern","Kansas",NA,"400989176"
191,2,"18:05",1085,"Robert Lewis missed Three Point Jumper.",69,34,"Texas Southern","Kansas",NA,"400989176"
192,2,"18:05",1085,"Lagerald Vick Defensive Rebound.",69,34,"Texas Southern","Kansas",NA,"400989176"
193,2,"17:53",1073,"Udoka Azubuike made Jumper.",71,34,"Texas Southern","Kansas",NA,"400989176"
194,2,"17:37",1057,"Demontrae Jefferson made Jumper.",71,36,"Texas Southern","Kansas",NA,"400989176"
195,2,"17:23",1043,"Foul on Kevin Scott.",71,36,"Texas Southern","Kansas",NA,"400989176"
196,2,"17:16",1036,"Sviatoslav Mykhailiuk made Three Point Jumper. Assisted by Devonte' Graham.",74,36,"Texas Southern","Kansas",NA,"400989176"
197,2,"16:58",1018,"Derrick Bruce missed Three Point Jumper.",74,36,"Texas Southern","Kansas",NA,"400989176"
198,2,"16:58",1018,"Marquis Salmon Offensive Rebound.",74,36,"Texas Southern","Kansas",NA,"400989176"
199,2,"16:52",1012,"Jump Ball won by Texas Southern",74,36,"Texas Southern","Kansas",NA,"400989176"
200,2,"16:41",1001,"Demontrae Jefferson made Three Point Jumper.",74,39,"Texas Southern","Kansas",NA,"400989176"
201,2,"16:31",991,"Devonte' Graham missed Jumper.",74,39,"Texas Southern","Kansas",NA,"400989176"
202,2,"16:31",991,"Robert Lewis Defensive Rebound.",74,39,"Texas Southern","Kansas",NA,"400989176"
203,2,"16:22",982,"Donte Clark missed Layup.",74,39,"Texas Southern","Kansas",NA,"400989176"
204,2,"16:22",982,"Marquis Salmon Offensive Rebound.",74,39,"Texas Southern","Kansas",NA,"400989176"
205,2,"16:16",976,"Marquis Salmon missed Layup.",74,39,"Texas Southern","Kansas",NA,"400989176"
206,2,"16:16",976,"Mitch Lightfoot Block.",74,39,"Texas Southern","Kansas",NA,"400989176"
207,2,"16:16",976,"Marquis Salmon Offensive Rebound.",74,39,"Texas Southern","Kansas",NA,"400989176"
208,2,"16:16",976,"Marquis Salmon missed Layup.",74,39,"Texas Southern","Kansas",NA,"400989176"
209,2,"16:16",976,"Lagerald Vick Defensive Rebound.",74,39,"Texas Southern","Kansas",NA,"400989176"
210,2,"16:10",970,"Lagerald Vick Turnover.",74,39,"Texas Southern","Kansas",NA,"400989176"
211,2,"16:10",970,"Derrick Bruce Steal.",74,39,"Texas Southern","Kansas",NA,"400989176"
212,2,"16:09",969,"Derrick Bruce made Layup.",74,41,"Texas Southern","Kansas",NA,"400989176"
213,2,"16:09",969,"Foul on Lagerald Vick.",74,41,"Texas Southern","Kansas",NA,"400989176"
214,2,"16:09",969,"Trayvon Reed made Free Throw.",74,42,"Texas Southern","Kansas",NA,"400989176"
215,2,"15:55",955,"Official TV Timeout",74,42,"Texas Southern","Kansas",NA,"400989176"
216,2,"15:54",954,"Sviatoslav Mykhailiuk made Three Point Jumper. Assisted by Devonte' Graham.",77,42,"Texas Southern","Kansas",NA,"400989176"
217,2,"15:34",934,"Donte Clark made Three Point Jumper. Assisted by Demontrae Jefferson.",77,45,"Texas Southern","Kansas",NA,"400989176"
218,2,"15:20",920,"Lagerald Vick made Jumper.",79,45,"Texas Southern","Kansas",NA,"400989176"
219,2,"14:47",887,"Demontrae Jefferson missed Jumper.",79,45,"Texas Southern","Kansas",NA,"400989176"
220,2,"14:47",887,"Trayvon Reed Offensive Rebound.",79,45,"Texas Southern","Kansas",NA,"400989176"
221,2,"14:47",887,"Trayvon Reed made Two Point Tip Shot.",79,47,"Texas Southern","Kansas",NA,"400989176"
222,2,"14:37",877,"Sviatoslav Mykhailiuk made Dunk. Assisted by Devonte' Graham.",81,47,"Texas Southern","Kansas",NA,"400989176"
223,2,"14:21",861,"Derrick Bruce missed Three Point Jumper.",81,47,"Texas Southern","Kansas",NA,"400989176"
224,2,"14:21",861,"Lagerald Vick Defensive Rebound.",81,47,"Texas Southern","Kansas",NA,"400989176"
225,2,"14:14",854,"Devonte' Graham missed Three Point Jumper.",81,47,"Texas Southern","Kansas",NA,"400989176"
226,2,"14:14",854,"Robert Lewis Defensive Rebound.",81,47,"Texas Southern","Kansas",NA,"400989176"
227,2,"14:07",847,"Demontrae Jefferson made Three Point Jumper. Assisted by Robert Lewis.",81,50,"Texas Southern","Kansas",NA,"400989176"
228,2,"13:48",828,"Lagerald Vick made Jumper.",83,50,"Texas Southern","Kansas",NA,"400989176"
229,2,"13:29",809,"Donte Clark missed Three Point Jumper.",83,50,"Texas Southern","Kansas",NA,"400989176"
230,2,"13:29",809,"Marcus Garrett Defensive Rebound.",83,50,"Texas Southern","Kansas",NA,"400989176"
231,2,"13:03",783,"Devonte' Graham missed Jumper.",83,50,"Texas Southern","Kansas",NA,"400989176"
232,2,"13:03",783,"Trayvon Reed Defensive Rebound.",83,50,"Texas Southern","Kansas",NA,"400989176"
233,2,"12:49",769,"Demontrae Jefferson missed Three Point Jumper.",83,50,"Texas Southern","Kansas",NA,"400989176"
234,2,"12:49",769,"Donte Clark Offensive Rebound.",83,50,"Texas Southern","Kansas",NA,"400989176"
235,2,"12:42",762,"Donte Clark missed Three Point Jumper.",83,50,"Texas Southern","Kansas",NA,"400989176"
236,2,"12:42",762,"Marcus Garrett Defensive Rebound.",83,50,"Texas Southern","Kansas",NA,"400989176"
237,2,"12:35",755,"Sviatoslav Mykhailiuk missed Three Point Jumper.",83,50,"Texas Southern","Kansas",NA,"400989176"
238,2,"12:35",755,"Marcus Garrett Offensive Rebound.",83,50,"Texas Southern","Kansas",NA,"400989176"
239,2,"12:27",747,"Mitch Lightfoot missed Jumper.",83,50,"Texas Southern","Kansas",NA,"400989176"
240,2,"12:27",747,"Lagerald Vick Offensive Rebound.",83,50,"Texas Southern","Kansas",NA,"400989176"
241,2,"12:22",742,"Foul on Derrick Bruce.",83,50,"Texas Southern","Kansas",NA,"400989176"
242,2,"12:18",738,"Malik Newman made Three Point Jumper. Assisted by Lagerald Vick.",86,50,"Texas Southern","Kansas",NA,"400989176"
243,2,"12:01",721,"Kevin Scott made Three Point Jumper.",86,53,"Texas Southern","Kansas",NA,"400989176"
244,2,"11:48",708,"Udoka Azubuike made Jumper.",88,53,"Texas Southern","Kansas",NA,"400989176"
245,2,"11:44",704,"Official TV Timeout",88,53,"Texas Southern","Kansas",NA,"400989176"
246,2,"11:37",697,"Foul on Malik Newman.",88,53,"Texas Southern","Kansas",NA,"400989176"
247,2,"11:27",687,"Donte Clark missed Three Point Jumper.",88,53,"Texas Southern","Kansas",NA,"400989176"
248,2,"11:27",687,"Kansas Defensive Rebound.",88,53,"Texas Southern","Kansas",NA,"400989176"
249,2,"11:11",671,"Malik Newman Turnover.",88,53,"Texas Southern","Kansas",NA,"400989176"
250,2,"11:11",671,"Trayvon Reed Steal.",88,53,"Texas Southern","Kansas",NA,"400989176"
251,2,"10:58",658,"Demontrae Jefferson missed Three Point Jumper.",88,53,"Texas Southern","Kansas",NA,"400989176"
252,2,"10:58",658,"Marcus Garrett Defensive Rebound.",88,53,"Texas Southern","Kansas",NA,"400989176"
253,2,"10:51",651,"Malik Newman Turnover.",88,53,"Texas Southern","Kansas",NA,"400989176"
254,2,"10:51",651,"Demontrae Jefferson Steal.",88,53,"Texas Southern","Kansas",NA,"400989176"
255,2,"10:45",645,"Demontrae Jefferson made Layup. Assisted by Cainan McClelland.",88,55,"Texas Southern","Kansas",NA,"400989176"
256,2,"10:31",631,"Udoka Azubuike missed Jumper.",88,55,"Texas Southern","Kansas",NA,"400989176"
257,2,"10:31",631,"Trayvon Reed Block.",88,55,"Texas Southern","Kansas",NA,"400989176"
258,2,"10:31",631,"Kansas Offensive Rebound.",88,55,"Texas Southern","Kansas",NA,"400989176"
259,2,"10:20",620,"Foul on Mitch Lightfoot.",88,55,"Texas Southern","Kansas",NA,"400989176"
260,2,"10:20",620,"Mitch Lightfoot Turnover.",88,55,"Texas Southern","Kansas",NA,"400989176"
261,2,"10:04",604,"Donte Clark missed Layup.",88,55,"Texas Southern","Kansas",NA,"400989176"
262,2,"10:04",604,"Lagerald Vick Defensive Rebound.",88,55,"Texas Southern","Kansas",NA,"400989176"
263,2,"9:59",599,"Devonte' Graham made Three Point Jumper. Assisted by Lagerald Vick.",91,55,"Texas Southern","Kansas",NA,"400989176"
264,2,"9:37",577,"Kevin Scott missed Jumper.",91,55,"Texas Southern","Kansas",NA,"400989176"
265,2,"9:37",577,"Udoka Azubuike Defensive Rebound.",91,55,"Texas Southern","Kansas",NA,"400989176"
266,2,"9:25",565,"Udoka Azubuike made Dunk. Assisted by Lagerald Vick.",93,55,"Texas Southern","Kansas",NA,"400989176"
