"play_id","half","time_remaining_half","secs_remaining","description","home_score","away_score","away","home","home_favored_by","game_id"
341,2,"2:59",179,"Noah Dickerson made Free Throw.",70,70,"Loyola Marymount","Washington",9,"400986911"
342,2,"2:59",179,"Noah Dickerson missed Free Throw.",70,70,"Loyola Marymount","Washington",9,"400986911"
343,2,"2:59",179,"Eli Scott Defensive Rebound.",70,70,"Loyola Marymount","Washington",9,"400986911"
344,2,"2:41",161,"Eli Scott missed Jumper.",70,70,"Loyola Marymount","Washington",9,"400986911"
345,2,"2:41",161,"Hameir Wright Block.",70,70,"Loyola Marymount","Washington",9,"400986911"
346,2,"2:39",159,"Noah Dickerson Defensive Rebound.",70,70,"Loyola Marymount","Washington",9,"400986911"
347,2,"2:24",144,"David Crisp missed Three Point Jumper.",70,70,"Loyola Marymount","Washington",9,"400986911"
348,2,"2:24",144,"Zafir Williams Defensive Rebound.",70,70,"Loyola Marymount","Washington",9,"400986911"
349,2,"1:54",114,"Zafir Williams missed Jumper.",70,70,"Loyola Marymount","Washington",9,"400986911"
350,2,"1:54",114,"Eli Scott Offensive Rebound.",70,70,"Loyola Marymount","Washington",9,"400986911"
351,2,"1:51",111,"Eli Scott missed Jumper.",70,70,"Loyola Marymount","Washington",9,"400986911"
352,2,"1:51",111,"Noah Dickerson Defensive Rebound.",70,70,"Loyola Marymount","Washington",9,"400986911"
353,2,"1:48",108,"Foul on James Batemon.",70,70,"Loyola Marymount","Washington",9,"400986911"
354,2,"1:48",108,"Noah Dickerson made Free Throw.",71,70,"Loyola Marymount","Washington",9,"400986911"
355,2,"1:48",108,"Noah Dickerson made Free Throw.",72,70,"Loyola Marymount","Washington",9,"400986911"
356,2,"1:41",101,"Foul on Noah Dickerson.",72,70,"Loyola Marymount","Washington",9,"400986911"
357,2,"1:41",101,"Eli Scott made Free Throw.",72,71,"Loyola Marymount","Washington",9,"400986911"
358,2,"1:41",101,"Eli Scott made Free Throw.",72,72,"Loyola Marymount","Washington",9,"400986911"
359,2,"1:21",81,"Noah Dickerson made Dunk. Assisted by Hameir Wright.",74,72,"Loyola Marymount","Washington",9,"400986911"
360,2,"1:12",72,"Loyola Marymount  Timeout",74,72,"Loyola Marymount","Washington",9,"400986911"
361,2,"1:00",60,"Zafir Williams missed Jumper.",74,72,"Loyola Marymount","Washington",9,"400986911"
362,2,"1:00",60,"Matisse Thybulle Block.",74,72,"Loyola Marymount","Washington",9,"400986911"
363,2,"0:58",58,"Zafir Williams Offensive Rebound.",74,72,"Loyola Marymount","Washington",9,"400986911"
364,2,"0:55",55,"Cameron Allen missed Three Point Jumper.",74,72,"Loyola Marymount","Washington",9,"400986911"
365,2,"0:55",55,"Matisse Thybulle Defensive Rebound.",74,72,"Loyola Marymount","Washington",9,"400986911"
366,2,"0:33",33,"Jaylen Nowell made Jumper.",76,72,"Loyola Marymount","Washington",9,"400986911"
367,2,"0:32",32,"Washington  Timeout",76,72,"Loyola Marymount","Washington",9,"400986911"
368,2,"0:16",16,"Steven Haney missed Three Point Jumper.",76,72,"Loyola Marymount","Washington",9,"400986911"
369,2,"0:16",16,"Noah Dickerson Defensive Rebound.",76,72,"Loyola Marymount","Washington",9,"400986911"
370,2,"0:13",13,"Foul on Zafir Williams.",76,72,"Loyola Marymount","Washington",9,"400986911"
371,2,"0:12",12,"Noah Dickerson made Free Throw.",77,72,"Loyola Marymount","Washington",9,"400986911"
372,2,"0:12",12,"Noah Dickerson made Free Throw.",78,72,"Loyola Marymount","Washington",9,"400986911"
373,2,"0:07",7,"James Batemon made Jumper.",78,74,"Loyola Marymount","Washington",9,"400986911"
374,2,"0:07",7,"Foul on Jaylen Nowell.",78,74,"Loyola Marymount","Washington",9,"400986911"
375,2,"0:07",7,"James Batemon made Free Throw.",78,75,"Loyola Marymount","Washington",9,"400986911"
376,2,"0:07",7,"Loyola Marymount  Timeout",78,75,"Loyola Marymount","Washington",9,"400986911"
377,2,"0:06",6,"Foul on Cameron Allen.",78,75,"Loyola Marymount","Washington",9,"400986911"
378,2,"0:06",6,"Noah Dickerson made Free Throw.",79,75,"Loyola Marymount","Washington",9,"400986911"
379,2,"0:06",6,"Noah Dickerson made Free Throw.",80,75,"Loyola Marymount","Washington",9,"400986911"
380,2,"0:03",3,"Cameron Allen made Three Point Jumper. Assisted by James Batemon.",80,78,"Loyola Marymount","Washington",9,"400986911"
381,2,"0:00",0,"End of Game",80,78,"Loyola Marymount","Washington",9,"400986911"
1,1,"20:00",2400,"PLAY",0,0,"CS Fullerton","Loyola Marymount",4.5,"400986912"
2,1,"19:38",2378,"Steven Haney made Three Point Jumper. Assisted by Jeffery McClendon.",3,0,"CS Fullerton","Loyola Marymount",4.5,"400986912"
3,1,"19:25",2365,"Arkim Robertson Turnover.",3,0,"CS Fullerton","Loyola Marymount",4.5,"400986912"
4,1,"19:25",2365,"Foul on Arkim Robertson.",3,0,"CS Fullerton","Loyola Marymount",4.5,"400986912"
5,1,"18:59",2339,"Jeffery McClendon Turnover.",3,0,"CS Fullerton","Loyola Marymount",4.5,"400986912"
6,1,"18:58",2338,"Jamal Smith Steal.",3,0,"CS Fullerton","Loyola Marymount",4.5,"400986912"
7,1,"18:55",2335,"Kyle Allman missed Layup.",3,0,"CS Fullerton","Loyola Marymount",4.5,"400986912"
8,1,"18:55",2335,"Arkim Robertson Offensive Rebound.",3,0,"CS Fullerton","Loyola Marymount",4.5,"400986912"
9,1,"18:52",2332,"Arkim Robertson made Layup.",3,2,"CS Fullerton","Loyola Marymount",4.5,"400986912"
10,1,"18:52",2332,"Foul on Jeffery McClendon.",3,2,"CS Fullerton","Loyola Marymount",4.5,"400986912"
11,1,"18:52",2332,"Arkim Robertson made Free Throw.",3,3,"CS Fullerton","Loyola Marymount",4.5,"400986912"
12,1,"18:32",2312,"Zafir Williams missed Layup.",3,3,"CS Fullerton","Loyola Marymount",4.5,"400986912"
13,1,"18:32",2312,"Kyle Allman Defensive Rebound.",3,3,"CS Fullerton","Loyola Marymount",4.5,"400986912"
14,1,"18:16",2296,"Kyle Allman missed Three Point Jumper.",3,3,"CS Fullerton","Loyola Marymount",4.5,"400986912"
15,1,"18:16",2296,"Mattias Markusson Defensive Rebound.",3,3,"CS Fullerton","Loyola Marymount",4.5,"400986912"
16,1,"18:04",2284,"Jeffery McClendon made Three Point Jumper.",6,3,"CS Fullerton","Loyola Marymount",4.5,"400986912"
17,1,"17:47",2267,"Khalil Ahmad missed Three Point Jumper.",6,3,"CS Fullerton","Loyola Marymount",4.5,"400986912"
18,1,"17:47",2267,"Mattias Markusson Defensive Rebound.",6,3,"CS Fullerton","Loyola Marymount",4.5,"400986912"
19,1,"17:25",2245,"James Batemon made Jumper.",8,3,"CS Fullerton","Loyola Marymount",4.5,"400986912"
20,1,"17:13",2233,"Arkim Robertson Turnover.",8,3,"CS Fullerton","Loyola Marymount",4.5,"400986912"
21,1,"16:55",2215,"James Batemon missed Jumper.",8,3,"CS Fullerton","Loyola Marymount",4.5,"400986912"
22,1,"16:55",2215,"Kyle Allman Defensive Rebound.",8,3,"CS Fullerton","Loyola Marymount",4.5,"400986912"
23,1,"16:51",2211,"Foul on Zafir Williams.",8,3,"CS Fullerton","Loyola Marymount",4.5,"400986912"
24,1,"16:35",2195,"Khalil Ahmad made Layup. Assisted by Kyle Allman.",8,5,"CS Fullerton","Loyola Marymount",4.5,"400986912"
25,1,"16:16",2176,"Zafir Williams missed Jumper.",8,5,"CS Fullerton","Loyola Marymount",4.5,"400986912"
26,1,"16:16",2176,"Khalil Ahmad Defensive Rebound.",8,5,"CS Fullerton","Loyola Marymount",4.5,"400986912"
27,1,"16:07",2167,"Jamal Smith made Three Point Jumper. Assisted by Kyle Allman.",8,8,"CS Fullerton","Loyola Marymount",4.5,"400986912"
28,1,"15:39",2139,"Mattias Markusson made Layup. Assisted by James Batemon.",10,8,"CS Fullerton","Loyola Marymount",4.5,"400986912"
29,1,"15:20",2120,"Arkim Robertson made Dunk. Assisted by Kyle Allman.",10,10,"CS Fullerton","Loyola Marymount",4.5,"400986912"
30,1,"15:05",2105,"Jeffery McClendon Turnover.",10,10,"CS Fullerton","Loyola Marymount",4.5,"400986912"
31,1,"15:04",2104,"Khalil Ahmad Steal.",10,10,"CS Fullerton","Loyola Marymount",4.5,"400986912"
32,1,"15:02",2102,"Foul on Jeffery McClendon.",10,10,"CS Fullerton","Loyola Marymount",4.5,"400986912"
33,1,"15:02",2102,"Official TV Timeout",10,10,"CS Fullerton","Loyola Marymount",4.5,"400986912"
34,1,"15:02",2102,"Khalil Ahmad made Free Throw.",10,11,"CS Fullerton","Loyola Marymount",4.5,"400986912"
35,1,"15:02",2102,"Khalil Ahmad made Free Throw.",10,12,"CS Fullerton","Loyola Marymount",4.5,"400986912"
36,1,"14:47",2087,"Cameron Allen missed Jumper.",10,12,"CS Fullerton","Loyola Marymount",4.5,"400986912"
37,1,"14:47",2087,"Eli Scott Offensive Rebound.",10,12,"CS Fullerton","Loyola Marymount",4.5,"400986912"
38,1,"14:35",2075,"Eli Scott missed Jumper.",10,12,"CS Fullerton","Loyola Marymount",4.5,"400986912"
39,1,"14:35",2075,"Eli Scott Offensive Rebound.",10,12,"CS Fullerton","Loyola Marymount",4.5,"400986912"
40,1,"14:32",2072,"Foul on Jamal Smith.",10,12,"CS Fullerton","Loyola Marymount",4.5,"400986912"
41,1,"14:31",2071,"Eli Scott made Free Throw.",11,12,"CS Fullerton","Loyola Marymount",4.5,"400986912"
42,1,"14:31",2071,"Eli Scott missed Free Throw.",11,12,"CS Fullerton","Loyola Marymount",4.5,"400986912"
43,1,"14:31",2071,"Davon Clare Defensive Rebound.",11,12,"CS Fullerton","Loyola Marymount",4.5,"400986912"
44,1,"14:19",2059,"Kyle Allman Turnover.",11,12,"CS Fullerton","Loyola Marymount",4.5,"400986912"
45,1,"14:18",2058,"Steven Haney Steal.",11,12,"CS Fullerton","Loyola Marymount",4.5,"400986912"
46,1,"14:11",2051,"Steven Haney made Dunk.",13,12,"CS Fullerton","Loyola Marymount",4.5,"400986912"
47,1,"13:51",2031,"Dominik Heinzl made Layup. Assisted by Davon Clare.",13,14,"CS Fullerton","Loyola Marymount",4.5,"400986912"
48,1,"13:20",2000,"Eli Scott missed Jumper.",13,14,"CS Fullerton","Loyola Marymount",4.5,"400986912"
49,1,"13:20",2000,"Zafir Williams Offensive Rebound.",13,14,"CS Fullerton","Loyola Marymount",4.5,"400986912"
50,1,"13:17",1997,"Zafir Williams missed Layup.",13,14,"CS Fullerton","Loyola Marymount",4.5,"400986912"
51,1,"13:17",1997,"Dominik Heinzl Block.",13,14,"CS Fullerton","Loyola Marymount",4.5,"400986912"
52,1,"13:16",1996,"Loyola Marymount Offensive Rebound.",13,14,"CS Fullerton","Loyola Marymount",4.5,"400986912"
53,1,"13:16",1996,"Loyola Marymount  Turnover.",13,14,"CS Fullerton","Loyola Marymount",4.5,"400986912"
54,1,"13:00",1980,"Kyle Allman missed Jumper.",13,14,"CS Fullerton","Loyola Marymount",4.5,"400986912"
55,1,"13:00",1980,"Mattias Markusson Defensive Rebound.",13,14,"CS Fullerton","Loyola Marymount",4.5,"400986912"
56,1,"12:48",1968,"Steven Haney missed Three Point Jumper.",13,14,"CS Fullerton","Loyola Marymount",4.5,"400986912"
57,1,"12:48",1968,"Kyle Allman Defensive Rebound.",13,14,"CS Fullerton","Loyola Marymount",4.5,"400986912"
58,1,"12:43",1963,"Dwight Ramos missed Three Point Jumper.",13,14,"CS Fullerton","Loyola Marymount",4.5,"400986912"
59,1,"12:43",1963,"Eli Scott Defensive Rebound.",13,14,"CS Fullerton","Loyola Marymount",4.5,"400986912"
60,1,"12:34",1954,"Cameron Allen made Three Point Jumper. Assisted by Eli Scott.",16,14,"CS Fullerton","Loyola Marymount",4.5,"400986912"
61,1,"12:12",1932,"Dwight Ramos Turnover.",16,14,"CS Fullerton","Loyola Marymount",4.5,"400986912"
62,1,"12:11",1931,"James Batemon Steal.",16,14,"CS Fullerton","Loyola Marymount",4.5,"400986912"
63,1,"12:08",1928,"James Batemon made Layup.",18,14,"CS Fullerton","Loyola Marymount",4.5,"400986912"
64,1,"11:50",1910,"Austen Awosika made Layup.",18,16,"CS Fullerton","Loyola Marymount",4.5,"400986912"
65,1,"11:27",1887,"Cameron Allen missed Layup.",18,16,"CS Fullerton","Loyola Marymount",4.5,"400986912"
66,1,"11:27",1887,"Mattias Markusson Offensive Rebound.",18,16,"CS Fullerton","Loyola Marymount",4.5,"400986912"
67,1,"11:22",1882,"Mattias Markusson made Dunk.",20,16,"CS Fullerton","Loyola Marymount",4.5,"400986912"
68,1,"11:07",1867,"Austen Awosika made Jumper. Assisted by Kyle Allman.",20,18,"CS Fullerton","Loyola Marymount",4.5,"400986912"
69,1,"10:55",1855,"Foul on Davon Clare.",20,18,"CS Fullerton","Loyola Marymount",4.5,"400986912"
70,1,"10:55",1855,"Official TV Timeout",20,18,"CS Fullerton","Loyola Marymount",4.5,"400986912"
71,1,"10:55",1855,"Mattias Markusson made Free Throw.",21,18,"CS Fullerton","Loyola Marymount",4.5,"400986912"
72,1,"10:55",1855,"Mattias Markusson made Free Throw.",22,18,"CS Fullerton","Loyola Marymount",4.5,"400986912"
73,1,"10:32",1832,"Jackson Rowe made Three Point Jumper. Assisted by Kyle Allman.",22,21,"CS Fullerton","Loyola Marymount",4.5,"400986912"
74,1,"10:03",1803,"James Batemon missed Three Point Jumper.",22,21,"CS Fullerton","Loyola Marymount",4.5,"400986912"
75,1,"10:03",1803,"Mattias Markusson Offensive Rebound.",22,21,"CS Fullerton","Loyola Marymount",4.5,"400986912"
76,1,"9:57",1797,"Mattias Markusson Turnover.",22,21,"CS Fullerton","Loyola Marymount",4.5,"400986912"
77,1,"9:56",1796,"Kyle Allman Steal.",22,21,"CS Fullerton","Loyola Marymount",4.5,"400986912"
78,1,"9:52",1792,"Khalil Ahmad missed Layup.",22,21,"CS Fullerton","Loyola Marymount",4.5,"400986912"
79,1,"9:52",1792,"Erik Johansson Defensive Rebound.",22,21,"CS Fullerton","Loyola Marymount",4.5,"400986912"
80,1,"9:44",1784,"Mattias Markusson made Jumper. Assisted by Eli Scott.",24,21,"CS Fullerton","Loyola Marymount",4.5,"400986912"
81,1,"9:13",1753,"Arkim Robertson made Dunk. Assisted by Austen Awosika.",24,23,"CS Fullerton","Loyola Marymount",4.5,"400986912"
82,1,"8:49",1729,"Eli Scott missed Jumper.",24,23,"CS Fullerton","Loyola Marymount",4.5,"400986912"
83,1,"8:49",1729,"Arkim Robertson Defensive Rebound.",24,23,"CS Fullerton","Loyola Marymount",4.5,"400986912"
84,1,"8:41",1721,"Khalil Ahmad missed Three Point Jumper.",24,23,"CS Fullerton","Loyola Marymount",4.5,"400986912"
85,1,"8:41",1721,"Arkim Robertson Offensive Rebound.",24,23,"CS Fullerton","Loyola Marymount",4.5,"400986912"
86,1,"8:36",1716,"Jackson Rowe Turnover.",24,23,"CS Fullerton","Loyola Marymount",4.5,"400986912"
87,1,"8:14",1694,"Erik Johansson missed Three Point Jumper.",24,23,"CS Fullerton","Loyola Marymount",4.5,"400986912"
88,1,"8:14",1694,"Austen Awosika Defensive Rebound.",24,23,"CS Fullerton","Loyola Marymount",4.5,"400986912"
89,1,"8:07",1687,"Khalil Ahmad made Layup. Assisted by Austen Awosika.",24,25,"CS Fullerton","Loyola Marymount",4.5,"400986912"
90,1,"7:49",1669,"Eli Scott missed Jumper.",24,25,"CS Fullerton","Loyola Marymount",4.5,"400986912"
91,1,"7:49",1669,"Loyola Marymount Offensive Rebound.",24,25,"CS Fullerton","Loyola Marymount",4.5,"400986912"
92,1,"7:47",1667,"Official TV Timeout",24,25,"CS Fullerton","Loyola Marymount",4.5,"400986912"
93,1,"7:30",1650,"Zafir Williams missed Layup.",24,25,"CS Fullerton","Loyola Marymount",4.5,"400986912"
94,1,"7:30",1650,"Khalil Ahmad Defensive Rebound.",24,25,"CS Fullerton","Loyola Marymount",4.5,"400986912"
95,1,"7:20",1640,"Jackson Rowe missed Three Point Jumper.",24,25,"CS Fullerton","Loyola Marymount",4.5,"400986912"
96,1,"7:20",1640,"Steven Haney Defensive Rebound.",24,25,"CS Fullerton","Loyola Marymount",4.5,"400986912"
97,1,"7:14",1634,"James Batemon made Layup. Assisted by Steven Haney.",26,25,"CS Fullerton","Loyola Marymount",4.5,"400986912"
98,1,"6:54",1614,"Austen Awosika Turnover.",26,25,"CS Fullerton","Loyola Marymount",4.5,"400986912"
99,1,"6:54",1614,"Foul on Austen Awosika.",26,25,"CS Fullerton","Loyola Marymount",4.5,"400986912"
100,1,"6:41",1601,"Steven Haney Turnover.",26,25,"CS Fullerton","Loyola Marymount",4.5,"400986912"
101,1,"6:39",1599,"Kyle Allman Steal.",26,25,"CS Fullerton","Loyola Marymount",4.5,"400986912"
102,1,"6:34",1594,"Jackson Rowe Turnover.",26,25,"CS Fullerton","Loyola Marymount",4.5,"400986912"
103,1,"6:19",1579,"Mattias Markusson missed Jumper.",26,25,"CS Fullerton","Loyola Marymount",4.5,"400986912"
104,1,"6:19",1579,"Arkim Robertson Defensive Rebound.",26,25,"CS Fullerton","Loyola Marymount",4.5,"400986912"
105,1,"6:07",1567,"Jamal Smith Turnover.",26,25,"CS Fullerton","Loyola Marymount",4.5,"400986912"
106,1,"6:06",1566,"Donald Gipson Steal.",26,25,"CS Fullerton","Loyola Marymount",4.5,"400986912"
107,1,"6:03",1563,"Donald Gipson made Layup.",28,25,"CS Fullerton","Loyola Marymount",4.5,"400986912"
108,1,"5:46",1546,"Arkim Robertson Turnover.",28,25,"CS Fullerton","Loyola Marymount",4.5,"400986912"
109,1,"5:41",1541,"Donald Gipson missed Three Point Jumper.",28,25,"CS Fullerton","Loyola Marymount",4.5,"400986912"
110,1,"5:41",1541,"Kyle Allman Defensive Rebound.",28,25,"CS Fullerton","Loyola Marymount",4.5,"400986912"
111,1,"5:33",1533,"Foul on Cameron Allen.",28,25,"CS Fullerton","Loyola Marymount",4.5,"400986912"
112,1,"5:21",1521,"Khalil Ahmad Turnover.",28,25,"CS Fullerton","Loyola Marymount",4.5,"400986912"
113,1,"4:57",1497,"Donald Gipson Turnover.",28,25,"CS Fullerton","Loyola Marymount",4.5,"400986912"
114,1,"4:57",1497,"Foul on Donald Gipson.",28,25,"CS Fullerton","Loyola Marymount",4.5,"400986912"
115,1,"4:44",1484,"Foul on Mattias Markusson.",28,25,"CS Fullerton","Loyola Marymount",4.5,"400986912"
116,1,"4:44",1484,"Khalil Ahmad made Free Throw.",28,26,"CS Fullerton","Loyola Marymount",4.5,"400986912"
117,1,"4:44",1484,"Khalil Ahmad made Free Throw.",28,27,"CS Fullerton","Loyola Marymount",4.5,"400986912"
118,1,"4:24",1464,"Eli Scott missed Jumper.",28,27,"CS Fullerton","Loyola Marymount",4.5,"400986912"
119,1,"4:24",1464,"Arkim Robertson Defensive Rebound.",28,27,"CS Fullerton","Loyola Marymount",4.5,"400986912"
120,1,"4:14",1454,"Kyle Allman missed Layup.",28,27,"CS Fullerton","Loyola Marymount",4.5,"400986912"
121,1,"4:14",1454,"Arkim Robertson Offensive Rebound.",28,27,"CS Fullerton","Loyola Marymount",4.5,"400986912"
122,1,"4:07",1447,"Khalil Ahmad made Layup. Assisted by Arkim Robertson.",28,29,"CS Fullerton","Loyola Marymount",4.5,"400986912"
123,1,"3:53",1433,"Eli Scott Turnover.",28,29,"CS Fullerton","Loyola Marymount",4.5,"400986912"
124,1,"3:53",1433,"Khalil Ahmad Steal.",28,29,"CS Fullerton","Loyola Marymount",4.5,"400986912"
125,1,"3:53",1433,"Official TV Timeout",28,29,"CS Fullerton","Loyola Marymount",4.5,"400986912"
126,1,"3:38",1418,"Foul on James Batemon.",28,29,"CS Fullerton","Loyola Marymount",4.5,"400986912"
127,1,"3:38",1418,"Arkim Robertson made Free Throw.",28,30,"CS Fullerton","Loyola Marymount",4.5,"400986912"
128,1,"3:38",1418,"Arkim Robertson made Free Throw.",28,31,"CS Fullerton","Loyola Marymount",4.5,"400986912"
129,1,"3:25",1405,"James Batemon Turnover.",28,31,"CS Fullerton","Loyola Marymount",4.5,"400986912"
130,1,"3:24",1404,"Arkim Robertson Steal.",28,31,"CS Fullerton","Loyola Marymount",4.5,"400986912"
131,1,"3:21",1401,"Austen Awosika made Layup. Assisted by Kyle Allman.",28,33,"CS Fullerton","Loyola Marymount",4.5,"400986912"
132,1,"2:49",1369,"Eli Scott made Layup. Assisted by Mattias Markusson.",30,33,"CS Fullerton","Loyola Marymount",4.5,"400986912"
133,1,"2:32",1352,"Khalil Ahmad made Layup.",30,35,"CS Fullerton","Loyola Marymount",4.5,"400986912"
134,1,"2:13",1333,"Eli Scott Turnover.",30,35,"CS Fullerton","Loyola Marymount",4.5,"400986912"
135,1,"2:12",1332,"Jamal Smith Steal.",30,35,"CS Fullerton","Loyola Marymount",4.5,"400986912"
136,1,"2:06",1326,"Khalil Ahmad missed Three Point Jumper.",30,35,"CS Fullerton","Loyola Marymount",4.5,"400986912"
137,1,"2:06",1326,"Arkim Robertson Offensive Rebound.",30,35,"CS Fullerton","Loyola Marymount",4.5,"400986912"
138,1,"1:46",1306,"Jamal Smith made Three Point Jumper. Assisted by Arkim Robertson.",30,38,"CS Fullerton","Loyola Marymount",4.5,"400986912"
139,1,"1:39",1299,"Loyola Marymount  Timeout",30,38,"CS Fullerton","Loyola Marymount",4.5,"400986912"
140,1,"1:20",1280,"Steven Haney Turnover.",30,38,"CS Fullerton","Loyola Marymount",4.5,"400986912"
141,1,"1:08",1268,"Kyle Allman made Layup. Assisted by Arkim Robertson.",30,40,"CS Fullerton","Loyola Marymount",4.5,"400986912"
142,1,"1:07",1267,"Foul on Steven Haney.",30,40,"CS Fullerton","Loyola Marymount",4.5,"400986912"
143,1,"1:07",1267,"Kyle Allman made Free Throw.",30,41,"CS Fullerton","Loyola Marymount",4.5,"400986912"
144,1,"0:48",1248,"James Batemon made Jumper.",32,41,"CS Fullerton","Loyola Marymount",4.5,"400986912"
145,1,"0:47",1247,"Foul on Jamal Smith.",32,41,"CS Fullerton","Loyola Marymount",4.5,"400986912"
146,1,"0:47",1247,"James Batemon made Free Throw.",33,41,"CS Fullerton","Loyola Marymount",4.5,"400986912"
147,1,"0:42",1242,"Khalil Ahmad made Layup. Assisted by Kyle Allman.",33,43,"CS Fullerton","Loyola Marymount",4.5,"400986912"
148,1,"0:22",1222,"Mattias Markusson Turnover.",33,43,"CS Fullerton","Loyola Marymount",4.5,"400986912"
149,1,"0:18",1218,"CSU Fullerton  Timeout",33,43,"CS Fullerton","Loyola Marymount",4.5,"400986912"
150,1,"0:04",1204,"Austen Awosika missed Three Point Jumper.",33,43,"CS Fullerton","Loyola Marymount",4.5,"400986912"
151,1,"0:04",1204,"Loyola Marymount Defensive Rebound.",33,43,"CS Fullerton","Loyola Marymount",4.5,"400986912"
152,1,"0:00",1200,"End of 1st half",33,43,"CS Fullerton","Loyola Marymount",4.5,"400986912"
153,2,"20:00",1200,"PLAY",33,43,"CS Fullerton","Loyola Marymount",4.5,"400986912"
154,2,"19:53",1193,"Zafir Williams missed Jumper.",33,43,"CS Fullerton","Loyola Marymount",4.5,"400986912"
155,2,"19:53",1193,"Jamal Smith Defensive Rebound.",33,43,"CS Fullerton","Loyola Marymount",4.5,"400986912"
156,2,"19:43",1183,"Jackson Rowe missed Three Point Jumper.",33,43,"CS Fullerton","Loyola Marymount",4.5,"400986912"
157,2,"19:43",1183,"Mattias Markusson Defensive Rebound.",33,43,"CS Fullerton","Loyola Marymount",4.5,"400986912"
158,2,"19:36",1176,"James Batemon missed Layup.",33,43,"CS Fullerton","Loyola Marymount",4.5,"400986912"
159,2,"19:36",1176,"Arkim Robertson Block.",33,43,"CS Fullerton","Loyola Marymount",4.5,"400986912"
160,2,"19:34",1174,"Loyola Marymount Offensive Rebound.",33,43,"CS Fullerton","Loyola Marymount",4.5,"400986912"
161,2,"19:21",1161,"James Batemon made Jumper.",35,43,"CS Fullerton","Loyola Marymount",4.5,"400986912"
162,2,"19:06",1146,"Foul on Mattias Markusson.",35,43,"CS Fullerton","Loyola Marymount",4.5,"400986912"
163,2,"19:00",1140,"Khalil Ahmad missed Layup.",35,43,"CS Fullerton","Loyola Marymount",4.5,"400986912"
164,2,"19:00",1140,"Mattias Markusson Defensive Rebound.",35,43,"CS Fullerton","Loyola Marymount",4.5,"400986912"
165,2,"18:34",1114,"Zafir Williams Turnover.",35,43,"CS Fullerton","Loyola Marymount",4.5,"400986912"
166,2,"18:25",1105,"Arkim Robertson missed Layup.",35,43,"CS Fullerton","Loyola Marymount",4.5,"400986912"
167,2,"18:25",1105,"Zafir Williams Block.",35,43,"CS Fullerton","Loyola Marymount",4.5,"400986912"
168,2,"18:22",1102,"Khalil Ahmad Offensive Rebound.",35,43,"CS Fullerton","Loyola Marymount",4.5,"400986912"
169,2,"18:22",1102,"Foul on Mattias Markusson.",35,43,"CS Fullerton","Loyola Marymount",4.5,"400986912"
170,2,"18:22",1102,"Khalil Ahmad made Free Throw.",35,44,"CS Fullerton","Loyola Marymount",4.5,"400986912"
171,2,"18:22",1102,"Khalil Ahmad made Free Throw.",35,45,"CS Fullerton","Loyola Marymount",4.5,"400986912"
172,2,"18:06",1086,"Steven Haney made Layup. Assisted by James Batemon.",37,45,"CS Fullerton","Loyola Marymount",4.5,"400986912"
173,2,"17:50",1070,"Kyle Allman missed Jumper.",37,45,"CS Fullerton","Loyola Marymount",4.5,"400986912"
174,2,"17:50",1070,"Jackson Rowe Offensive Rebound.",37,45,"CS Fullerton","Loyola Marymount",4.5,"400986912"
175,2,"17:34",1054,"CSU Fullerton  Timeout",37,45,"CS Fullerton","Loyola Marymount",4.5,"400986912"
176,2,"17:33",1053,"CSU Fullerton  Turnover.",37,45,"CS Fullerton","Loyola Marymount",4.5,"400986912"
177,2,"17:20",1040,"James Batemon made Three Point Jumper. Assisted by Jeffery McClendon.",40,45,"CS Fullerton","Loyola Marymount",4.5,"400986912"
178,2,"16:54",1014,"Khalil Ahmad missed Jumper.",40,45,"CS Fullerton","Loyola Marymount",4.5,"400986912"
179,2,"16:54",1014,"Jeffery McClendon Block.",40,45,"CS Fullerton","Loyola Marymount",4.5,"400986912"
180,2,"16:52",1012,"Arkim Robertson Offensive Rebound.",40,45,"CS Fullerton","Loyola Marymount",4.5,"400986912"
181,2,"16:51",1011,"Foul on Mattias Markusson.",40,45,"CS Fullerton","Loyola Marymount",4.5,"400986912"
182,2,"16:51",1011,"Arkim Robertson made Free Throw.",40,46,"CS Fullerton","Loyola Marymount",4.5,"400986912"
183,2,"16:51",1011,"Arkim Robertson missed Free Throw.",40,46,"CS Fullerton","Loyola Marymount",4.5,"400986912"
184,2,"16:51",1011,"Eli Scott Defensive Rebound.",40,46,"CS Fullerton","Loyola Marymount",4.5,"400986912"
185,2,"16:46",1006,"Foul on Jackson Rowe.",40,46,"CS Fullerton","Loyola Marymount",4.5,"400986912"
186,2,"16:36",996,"Foul on Jackson Rowe.",40,46,"CS Fullerton","Loyola Marymount",4.5,"400986912"
187,2,"16:23",983,"Steven Haney missed Three Point Jumper.",40,46,"CS Fullerton","Loyola Marymount",4.5,"400986912"
188,2,"16:23",983,"Eli Scott Offensive Rebound.",40,46,"CS Fullerton","Loyola Marymount",4.5,"400986912"
189,2,"16:21",981,"Foul on Khalil Ahmad.",40,46,"CS Fullerton","Loyola Marymount",4.5,"400986912"
190,2,"16:17",977,"Eli Scott Turnover.",40,46,"CS Fullerton","Loyola Marymount",4.5,"400986912"
191,2,"16:16",976,"Austen Awosika Steal.",40,46,"CS Fullerton","Loyola Marymount",4.5,"400986912"
192,2,"16:14",974,"Austen Awosika made Layup.",40,48,"CS Fullerton","Loyola Marymount",4.5,"400986912"
193,2,"15:51",951,"Zafir Williams Turnover.",40,48,"CS Fullerton","Loyola Marymount",4.5,"400986912"
194,2,"15:50",950,"Khalil Ahmad Steal.",40,48,"CS Fullerton","Loyola Marymount",4.5,"400986912"
195,2,"15:48",948,"Khalil Ahmad Turnover.",40,48,"CS Fullerton","Loyola Marymount",4.5,"400986912"
196,2,"15:47",947,"Eli Scott Steal.",40,48,"CS Fullerton","Loyola Marymount",4.5,"400986912"
197,2,"15:43",943,"Foul on Arkim Robertson.",40,48,"CS Fullerton","Loyola Marymount",4.5,"400986912"
198,2,"15:43",943,"Official TV Timeout",40,48,"CS Fullerton","Loyola Marymount",4.5,"400986912"
199,2,"15:43",943,"Jeffery McClendon made Free Throw.",41,48,"CS Fullerton","Loyola Marymount",4.5,"400986912"
200,2,"15:43",943,"Jeffery McClendon made Free Throw.",42,48,"CS Fullerton","Loyola Marymount",4.5,"400986912"
201,2,"15:33",933,"Jamal Smith Turnover.",42,48,"CS Fullerton","Loyola Marymount",4.5,"400986912"
202,2,"15:20",920,"Steven Haney missed Layup.",42,48,"CS Fullerton","Loyola Marymount",4.5,"400986912"
203,2,"15:20",920,"Arkim Robertson Block.",42,48,"CS Fullerton","Loyola Marymount",4.5,"400986912"
