"play_id","half","time_remaining_half","secs_remaining","description","home_score","away_score","away","home","home_favored_by","game_id"
1,1,"20:00",2400,"PLAY",0,0,"UC Riverside","Loyola Marymount",4.5,"400986904"
2,1,"19:49",2389,"Mattias Markusson made Jumper. Assisted by Joe Quintana.",2,0,"UC Riverside","Loyola Marymount",4.5,"400986904"
3,1,"19:29",2369,"Brandon Rosser Turnover.",2,0,"UC Riverside","Loyola Marymount",4.5,"400986904"
4,1,"19:14",2354,"Joe Quintana missed Three Point Jumper.",2,0,"UC Riverside","Loyola Marymount",4.5,"400986904"
5,1,"19:14",2354,"Chance Murray Defensive Rebound.",2,0,"UC Riverside","Loyola Marymount",4.5,"400986904"
6,1,"18:52",2332,"Dikymbe Martin made Three Point Jumper. Assisted by Chance Murray.",2,3,"UC Riverside","Loyola Marymount",4.5,"400986904"
7,1,"18:28",2308,"Zafir Williams missed Jumper.",2,3,"UC Riverside","Loyola Marymount",4.5,"400986904"
8,1,"18:28",2308,"Dominick Pickett Defensive Rebound.",2,3,"UC Riverside","Loyola Marymount",4.5,"400986904"
9,1,"18:13",2293,"Brandon Rosser made Three Point Jumper. Assisted by Chance Murray.",2,6,"UC Riverside","Loyola Marymount",4.5,"400986904"
10,1,"18:01",2281,"Jeffery McClendon missed Three Point Jumper.",2,6,"UC Riverside","Loyola Marymount",4.5,"400986904"
11,1,"18:01",2281,"Zafir Williams Offensive Rebound.",2,6,"UC Riverside","Loyola Marymount",4.5,"400986904"
12,1,"17:53",2273,"James Batemon Turnover.",2,6,"UC Riverside","Loyola Marymount",4.5,"400986904"
13,1,"17:37",2257,"Dikymbe Martin made Jumper. Assisted by Dominick Pickett.",2,8,"UC Riverside","Loyola Marymount",4.5,"400986904"
14,1,"17:08",2228,"James Batemon made Dunk.",4,8,"UC Riverside","Loyola Marymount",4.5,"400986904"
15,1,"16:34",2194,"Dikymbe Martin missed Jumper.",4,8,"UC Riverside","Loyola Marymount",4.5,"400986904"
16,1,"16:34",2194,"Alex Larsson Offensive Rebound.",4,8,"UC Riverside","Loyola Marymount",4.5,"400986904"
17,1,"16:15",2175,"Brandon Rosser Turnover.",4,8,"UC Riverside","Loyola Marymount",4.5,"400986904"
18,1,"16:15",2175,"Foul on Brandon Rosser.",4,8,"UC Riverside","Loyola Marymount",4.5,"400986904"
19,1,"15:50",2150,"Joe Quintana missed Three Point Jumper.",4,8,"UC Riverside","Loyola Marymount",4.5,"400986904"
20,1,"15:50",2150,"Chance Murray Defensive Rebound.",4,8,"UC Riverside","Loyola Marymount",4.5,"400986904"
21,1,"15:40",2140,"Chance Murray Turnover.",4,8,"UC Riverside","Loyola Marymount",4.5,"400986904"
22,1,"15:40",2140,"Official TV Timeout",4,8,"UC Riverside","Loyola Marymount",4.5,"400986904"
23,1,"15:20",2120,"James Batemon missed Three Point Jumper.",4,8,"UC Riverside","Loyola Marymount",4.5,"400986904"
24,1,"15:20",2120,"Mikail Simmons Offensive Rebound.",4,8,"UC Riverside","Loyola Marymount",4.5,"400986904"
25,1,"15:14",2114,"Eli Scott made Jumper. Assisted by Jeffery McClendon.",6,8,"UC Riverside","Loyola Marymount",4.5,"400986904"
26,1,"14:53",2093,"Chance Murray Turnover.",6,8,"UC Riverside","Loyola Marymount",4.5,"400986904"
27,1,"14:40",2080,"Cameron Allen Turnover.",6,8,"UC Riverside","Loyola Marymount",4.5,"400986904"
28,1,"14:24",2064,"Idy Diallo missed Jumper.",6,8,"UC Riverside","Loyola Marymount",4.5,"400986904"
29,1,"14:24",2064,"Mikail Simmons Defensive Rebound.",6,8,"UC Riverside","Loyola Marymount",4.5,"400986904"
30,1,"14:15",2055,"Eli Scott missed Three Point Jumper.",6,8,"UC Riverside","Loyola Marymount",4.5,"400986904"
31,1,"14:15",2055,"Chance Murray Defensive Rebound.",6,8,"UC Riverside","Loyola Marymount",4.5,"400986904"
32,1,"14:01",2041,"Menno Dijkstra missed Three Point Jumper.",6,8,"UC Riverside","Loyola Marymount",4.5,"400986904"
33,1,"14:01",2041,"James Batemon Defensive Rebound.",6,8,"UC Riverside","Loyola Marymount",4.5,"400986904"
34,1,"13:33",2013,"Foul on Idy Diallo.",6,8,"UC Riverside","Loyola Marymount",4.5,"400986904"
35,1,"13:33",2013,"Mikail Simmons made Free Throw.",7,8,"UC Riverside","Loyola Marymount",4.5,"400986904"
36,1,"13:33",2013,"Mikail Simmons made Free Throw.",8,8,"UC Riverside","Loyola Marymount",4.5,"400986904"
37,1,"13:25",2005,"Idy Diallo made Jumper. Assisted by Dikymbe Martin.",8,10,"UC Riverside","Loyola Marymount",4.5,"400986904"
38,1,"13:08",1988,"Eli Scott Turnover.",8,10,"UC Riverside","Loyola Marymount",4.5,"400986904"
39,1,"12:42",1962,"James Jackson Turnover.",8,10,"UC Riverside","Loyola Marymount",4.5,"400986904"
40,1,"12:42",1962,"Foul on James Jackson.",8,10,"UC Riverside","Loyola Marymount",4.5,"400986904"
41,1,"12:29",1949,"Cameron Allen missed Three Point Jumper.",8,10,"UC Riverside","Loyola Marymount",4.5,"400986904"
42,1,"12:29",1949,"Chance Murray Defensive Rebound.",8,10,"UC Riverside","Loyola Marymount",4.5,"400986904"
43,1,"12:11",1931,"Dikymbe Martin made Layup.",8,12,"UC Riverside","Loyola Marymount",4.5,"400986904"
44,1,"11:49",1909,"Mikail Simmons made Jumper. Assisted by Steven Haney.",10,12,"UC Riverside","Loyola Marymount",4.5,"400986904"
45,1,"11:25",1885,"Chance Murray Turnover.",10,12,"UC Riverside","Loyola Marymount",4.5,"400986904"
46,1,"11:25",1885,"Official TV Timeout",10,12,"UC Riverside","Loyola Marymount",4.5,"400986904"
47,1,"11:15",1875,"Steven Haney made Three Point Jumper. Assisted by Cameron Allen.",13,12,"UC Riverside","Loyola Marymount",4.5,"400986904"
48,1,"11:04",1864,"DJ Sylvester missed Layup.",13,12,"UC Riverside","Loyola Marymount",4.5,"400986904"
49,1,"11:04",1864,"Loyola Marymount Defensive Rebound.",13,12,"UC Riverside","Loyola Marymount",4.5,"400986904"
50,1,"10:51",1851,"Steven Haney missed Three Point Jumper.",13,12,"UC Riverside","Loyola Marymount",4.5,"400986904"
51,1,"10:51",1851,"Eli Scott Offensive Rebound.",13,12,"UC Riverside","Loyola Marymount",4.5,"400986904"
52,1,"10:47",1847,"Foul on Ryker Pierce.",13,12,"UC Riverside","Loyola Marymount",4.5,"400986904"
53,1,"10:47",1847,"Eli Scott made Free Throw.",14,12,"UC Riverside","Loyola Marymount",4.5,"400986904"
54,1,"10:47",1847,"Eli Scott made Free Throw.",15,12,"UC Riverside","Loyola Marymount",4.5,"400986904"
55,1,"10:31",1831,"Alex Larsson made Layup. Assisted by Menno Dijkstra.",15,14,"UC Riverside","Loyola Marymount",4.5,"400986904"
56,1,"10:31",1831,"Foul on Mikail Simmons.",15,14,"UC Riverside","Loyola Marymount",4.5,"400986904"
57,1,"10:31",1831,"Alex Larsson made Free Throw.",15,15,"UC Riverside","Loyola Marymount",4.5,"400986904"
58,1,"10:12",1812,"Erik Johansson made Three Point Jumper. Assisted by James Batemon.",18,15,"UC Riverside","Loyola Marymount",4.5,"400986904"
59,1,"9:56",1796,"Dikymbe Martin Turnover.",18,15,"UC Riverside","Loyola Marymount",4.5,"400986904"
60,1,"9:42",1782,"Jeffery McClendon missed Three Point Jumper.",18,15,"UC Riverside","Loyola Marymount",4.5,"400986904"
61,1,"9:42",1782,"Jeffery McClendon Offensive Rebound.",18,15,"UC Riverside","Loyola Marymount",4.5,"400986904"
62,1,"9:36",1776,"Eli Scott made Jumper. Assisted by Jeffery McClendon.",20,15,"UC Riverside","Loyola Marymount",4.5,"400986904"
63,1,"9:32",1772,"UC Riverside  Timeout",20,15,"UC Riverside","Loyola Marymount",4.5,"400986904"
64,1,"9:17",1757,"Menno Dijkstra Turnover.",20,15,"UC Riverside","Loyola Marymount",4.5,"400986904"
65,1,"8:57",1737,"Mattias Markusson made Dunk. Assisted by James Batemon.",22,15,"UC Riverside","Loyola Marymount",4.5,"400986904"
66,1,"8:36",1716,"Dikymbe Martin made Jumper.",22,17,"UC Riverside","Loyola Marymount",4.5,"400986904"
67,1,"8:23",1703,"Eli Scott missed Three Point Jumper.",22,17,"UC Riverside","Loyola Marymount",4.5,"400986904"
68,1,"8:23",1703,"Menno Dijkstra Defensive Rebound.",22,17,"UC Riverside","Loyola Marymount",4.5,"400986904"
69,1,"8:11",1691,"Menno Dijkstra missed Three Point Jumper.",22,17,"UC Riverside","Loyola Marymount",4.5,"400986904"
70,1,"8:11",1691,"Brandon Rosser Offensive Rebound.",22,17,"UC Riverside","Loyola Marymount",4.5,"400986904"
71,1,"8:06",1686,"Foul on Eli Scott.",22,17,"UC Riverside","Loyola Marymount",4.5,"400986904"
72,1,"8:06",1686,"Brandon Rosser made Free Throw.",22,18,"UC Riverside","Loyola Marymount",4.5,"400986904"
73,1,"8:06",1686,"Brandon Rosser made Free Throw.",22,19,"UC Riverside","Loyola Marymount",4.5,"400986904"
74,1,"7:43",1663,"Zafir Williams made Jumper.",24,19,"UC Riverside","Loyola Marymount",4.5,"400986904"
75,1,"7:35",1655,"DJ Sylvester Turnover.",24,19,"UC Riverside","Loyola Marymount",4.5,"400986904"
76,1,"7:35",1655,"Foul on DJ Sylvester.",24,19,"UC Riverside","Loyola Marymount",4.5,"400986904"
77,1,"7:35",1655,"Official TV Timeout",24,19,"UC Riverside","Loyola Marymount",4.5,"400986904"
78,1,"6:49",1609,"Donald Gipson missed Three Point Jumper.",24,19,"UC Riverside","Loyola Marymount",4.5,"400986904"
79,1,"6:49",1609,"Alex Larsson Defensive Rebound.",24,19,"UC Riverside","Loyola Marymount",4.5,"400986904"
80,1,"6:47",1607,"Foul on Jeffery McClendon.",24,19,"UC Riverside","Loyola Marymount",4.5,"400986904"
81,1,"6:25",1585,"Alex Larsson made Layup. Assisted by Dikymbe Martin.",24,21,"UC Riverside","Loyola Marymount",4.5,"400986904"
82,1,"6:06",1566,"Mattias Markusson made Jumper. Assisted by Donald Gipson.",26,21,"UC Riverside","Loyola Marymount",4.5,"400986904"
83,1,"5:52",1552,"Dikymbe Martin Turnover.",26,21,"UC Riverside","Loyola Marymount",4.5,"400986904"
84,1,"5:52",1552,"Donald Gipson Steal.",26,21,"UC Riverside","Loyola Marymount",4.5,"400986904"
85,1,"5:52",1552,"Foul on Dikymbe Martin.",26,21,"UC Riverside","Loyola Marymount",4.5,"400986904"
86,1,"5:28",1528,"James Batemon missed Layup.",26,21,"UC Riverside","Loyola Marymount",4.5,"400986904"
87,1,"5:28",1528,"Chance Murray Defensive Rebound.",26,21,"UC Riverside","Loyola Marymount",4.5,"400986904"
88,1,"5:22",1522,"Foul on Jeffery McClendon.",26,21,"UC Riverside","Loyola Marymount",4.5,"400986904"
89,1,"5:22",1522,"Chance Murray made Free Throw.",26,22,"UC Riverside","Loyola Marymount",4.5,"400986904"
90,1,"5:22",1522,"Chance Murray made Free Throw.",26,23,"UC Riverside","Loyola Marymount",4.5,"400986904"
91,1,"5:00",1500,"Mattias Markusson missed Layup.",26,23,"UC Riverside","Loyola Marymount",4.5,"400986904"
92,1,"5:00",1500,"Zafir Williams Offensive Rebound.",26,23,"UC Riverside","Loyola Marymount",4.5,"400986904"
93,1,"4:55",1495,"Zafir Williams missed Layup.",26,23,"UC Riverside","Loyola Marymount",4.5,"400986904"
94,1,"4:55",1495,"Alex Larsson Defensive Rebound.",26,23,"UC Riverside","Loyola Marymount",4.5,"400986904"
95,1,"4:45",1485,"Idy Diallo Turnover.",26,23,"UC Riverside","Loyola Marymount",4.5,"400986904"
96,1,"4:44",1484,"Mattias Markusson Steal.",26,23,"UC Riverside","Loyola Marymount",4.5,"400986904"
97,1,"4:32",1472,"Donald Gipson made Jumper.",28,23,"UC Riverside","Loyola Marymount",4.5,"400986904"
98,1,"4:17",1457,"Foul on Donald Gipson.",28,23,"UC Riverside","Loyola Marymount",4.5,"400986904"
99,1,"4:08",1448,"Foul on Mikail Simmons.",28,23,"UC Riverside","Loyola Marymount",4.5,"400986904"
100,1,"3:51",1431,"Marcus Berkley missed Three Point Jumper.",28,23,"UC Riverside","Loyola Marymount",4.5,"400986904"
101,1,"3:51",1431,"Donald Gipson Defensive Rebound.",28,23,"UC Riverside","Loyola Marymount",4.5,"400986904"
102,1,"3:26",1406,"Joe Quintana Turnover.",28,23,"UC Riverside","Loyola Marymount",4.5,"400986904"
103,1,"3:25",1405,"Chance Murray Steal.",28,23,"UC Riverside","Loyola Marymount",4.5,"400986904"
104,1,"3:20",1400,"Marcus Berkley Turnover.",28,23,"UC Riverside","Loyola Marymount",4.5,"400986904"
105,1,"3:20",1400,"Official TV Timeout",28,23,"UC Riverside","Loyola Marymount",4.5,"400986904"
106,1,"2:59",1379,"Eli Scott Turnover.",28,23,"UC Riverside","Loyola Marymount",4.5,"400986904"
107,1,"2:43",1363,"Chance Murray missed Three Point Jumper.",28,23,"UC Riverside","Loyola Marymount",4.5,"400986904"
108,1,"2:43",1363,"James Batemon Defensive Rebound.",28,23,"UC Riverside","Loyola Marymount",4.5,"400986904"
109,1,"2:36",1356,"Steven Haney missed Three Point Jumper.",28,23,"UC Riverside","Loyola Marymount",4.5,"400986904"
110,1,"2:36",1356,"Brandon Rosser Defensive Rebound.",28,23,"UC Riverside","Loyola Marymount",4.5,"400986904"
111,1,"2:27",1347,"Foul on Mikail Simmons.",28,23,"UC Riverside","Loyola Marymount",4.5,"400986904"
112,1,"2:27",1347,"Alex Larsson made Free Throw.",28,24,"UC Riverside","Loyola Marymount",4.5,"400986904"
113,1,"2:27",1347,"Alex Larsson made Free Throw.",28,25,"UC Riverside","Loyola Marymount",4.5,"400986904"
114,1,"2:05",1325,"Steven Haney made Three Point Jumper. Assisted by James Batemon.",31,25,"UC Riverside","Loyola Marymount",4.5,"400986904"
115,1,"1:41",1301,"Alex Larsson Turnover.",31,25,"UC Riverside","Loyola Marymount",4.5,"400986904"
116,1,"1:41",1301,"Loyola Marymount  Timeout",31,25,"UC Riverside","Loyola Marymount",4.5,"400986904"
117,1,"1:34",1294,"Eli Scott missed Layup.",31,25,"UC Riverside","Loyola Marymount",4.5,"400986904"
118,1,"1:34",1294,"Eli Scott Offensive Rebound.",31,25,"UC Riverside","Loyola Marymount",4.5,"400986904"
119,1,"1:27",1287,"Foul on Eric Rwahwire.",31,25,"UC Riverside","Loyola Marymount",4.5,"400986904"
120,1,"1:27",1287,"Steven Haney missed Free Throw.",31,25,"UC Riverside","Loyola Marymount",4.5,"400986904"
121,1,"1:27",1287,"Brandon Rosser Defensive Rebound.",31,25,"UC Riverside","Loyola Marymount",4.5,"400986904"
122,1,"1:17",1277,"Alex Larsson Turnover.",31,25,"UC Riverside","Loyola Marymount",4.5,"400986904"
123,1,"1:16",1276,"James Batemon Steal.",31,25,"UC Riverside","Loyola Marymount",4.5,"400986904"
124,1,"1:11",1271,"Cameron Allen missed Layup.",31,25,"UC Riverside","Loyola Marymount",4.5,"400986904"
125,1,"1:07",1267,"UC Riverside Defensive Rebound.",31,25,"UC Riverside","Loyola Marymount",4.5,"400986904"
126,1,"1:07",1267,"Foul on Mikail Simmons.",31,25,"UC Riverside","Loyola Marymount",4.5,"400986904"
127,1,"1:07",1267,"Alex Larsson made Free Throw.",31,26,"UC Riverside","Loyola Marymount",4.5,"400986904"
128,1,"1:07",1267,"Alex Larsson made Free Throw.",31,27,"UC Riverside","Loyola Marymount",4.5,"400986904"
129,1,"0:56",1256,"Foul on Dominick Pickett.",31,27,"UC Riverside","Loyola Marymount",4.5,"400986904"
130,1,"0:56",1256,"Steven Haney made Free Throw.",32,27,"UC Riverside","Loyola Marymount",4.5,"400986904"
131,1,"0:56",1256,"Steven Haney missed Free Throw.",32,27,"UC Riverside","Loyola Marymount",4.5,"400986904"
132,1,"0:56",1256,"Brandon Rosser Defensive Rebound.",32,27,"UC Riverside","Loyola Marymount",4.5,"400986904"
133,1,"0:43",1243,"Dikymbe Martin missed Jumper.",32,27,"UC Riverside","Loyola Marymount",4.5,"400986904"
134,1,"0:43",1243,"Loyola Marymount Defensive Rebound.",32,27,"UC Riverside","Loyola Marymount",4.5,"400986904"
135,1,"0:31",1231,"Foul on Chance Murray.",32,27,"UC Riverside","Loyola Marymount",4.5,"400986904"
136,1,"0:31",1231,"James Batemon made Free Throw.",33,27,"UC Riverside","Loyola Marymount",4.5,"400986904"
137,1,"0:31",1231,"James Batemon missed Free Throw.",33,27,"UC Riverside","Loyola Marymount",4.5,"400986904"
138,1,"0:31",1231,"Chance Murray Defensive Rebound.",33,27,"UC Riverside","Loyola Marymount",4.5,"400986904"
139,1,"0:05",1205,"Chance Murray missed Three Point Jumper.",33,27,"UC Riverside","Loyola Marymount",4.5,"400986904"
140,1,"0:05",1205,"Dominick Pickett Offensive Rebound.",33,27,"UC Riverside","Loyola Marymount",4.5,"400986904"
141,1,"0:03",1203,"Dominick Pickett missed Two Point Tip Shot.",33,27,"UC Riverside","Loyola Marymount",4.5,"400986904"
142,1,"0:03",1203,"Alex Larsson Offensive Rebound.",33,27,"UC Riverside","Loyola Marymount",4.5,"400986904"
143,1,"0:00",1200,"Alex Larsson made Two Point Tip Shot.",33,29,"UC Riverside","Loyola Marymount",4.5,"400986904"
144,1,"0:00",1200,"End of 1st half",33,29,"UC Riverside","Loyola Marymount",4.5,"400986904"
145,2,"20:00",1200,"PLAY",33,29,"UC Riverside","Loyola Marymount",4.5,"400986904"
146,2,"19:50",1190,"Alex Larsson missed Jumper.",33,29,"UC Riverside","Loyola Marymount",4.5,"400986904"
147,2,"19:50",1190,"Mattias Markusson Defensive Rebound.",33,29,"UC Riverside","Loyola Marymount",4.5,"400986904"
148,2,"19:24",1164,"James Batemon missed Three Point Jumper.",33,29,"UC Riverside","Loyola Marymount",4.5,"400986904"
149,2,"19:24",1164,"Zafir Williams Offensive Rebound.",33,29,"UC Riverside","Loyola Marymount",4.5,"400986904"
150,2,"19:19",1159,"Jeffery McClendon made Three Point Jumper. Assisted by Zafir Williams.",36,29,"UC Riverside","Loyola Marymount",4.5,"400986904"
151,2,"18:49",1129,"Brandon Rosser made Layup. Assisted by Alex Larsson.",36,31,"UC Riverside","Loyola Marymount",4.5,"400986904"
152,2,"18:49",1129,"Foul on Zafir Williams.",36,31,"UC Riverside","Loyola Marymount",4.5,"400986904"
153,2,"18:49",1129,"Brandon Rosser made Free Throw.",36,32,"UC Riverside","Loyola Marymount",4.5,"400986904"
154,2,"18:23",1103,"Joe Quintana missed Three Point Jumper.",36,32,"UC Riverside","Loyola Marymount",4.5,"400986904"
155,2,"18:23",1103,"Jeffery McClendon Offensive Rebound.",36,32,"UC Riverside","Loyola Marymount",4.5,"400986904"
156,2,"18:19",1099,"Jeffery McClendon missed Layup.",36,32,"UC Riverside","Loyola Marymount",4.5,"400986904"
157,2,"18:19",1099,"Alex Larsson Defensive Rebound.",36,32,"UC Riverside","Loyola Marymount",4.5,"400986904"
158,2,"18:10",1090,"Dikymbe Martin Turnover.",36,32,"UC Riverside","Loyola Marymount",4.5,"400986904"
159,2,"18:09",1089,"Jeffery McClendon Steal.",36,32,"UC Riverside","Loyola Marymount",4.5,"400986904"
160,2,"18:04",1084,"James Batemon made Layup. Assisted by Jeffery McClendon.",38,32,"UC Riverside","Loyola Marymount",4.5,"400986904"
161,2,"17:51",1071,"Foul on Mattias Markusson.",38,32,"UC Riverside","Loyola Marymount",4.5,"400986904"
162,2,"17:42",1062,"Brandon Rosser missed Jumper.",38,32,"UC Riverside","Loyola Marymount",4.5,"400986904"
163,2,"17:42",1062,"Mattias Markusson Defensive Rebound.",38,32,"UC Riverside","Loyola Marymount",4.5,"400986904"
164,2,"17:19",1039,"Mattias Markusson made Dunk. Assisted by Zafir Williams.",40,32,"UC Riverside","Loyola Marymount",4.5,"400986904"
165,2,"16:53",1013,"Alex Larsson made Layup. Assisted by Chance Murray.",40,34,"UC Riverside","Loyola Marymount",4.5,"400986904"
166,2,"16:33",993,"Zafir Williams Turnover.",40,34,"UC Riverside","Loyola Marymount",4.5,"400986904"
167,2,"16:33",993,"Foul on Zafir Williams.",40,34,"UC Riverside","Loyola Marymount",4.5,"400986904"
168,2,"16:17",977,"Dikymbe Martin made Jumper.",40,36,"UC Riverside","Loyola Marymount",4.5,"400986904"
169,2,"15:57",957,"Eli Scott missed Jumper.",40,36,"UC Riverside","Loyola Marymount",4.5,"400986904"
170,2,"15:57",957,"Chance Murray Defensive Rebound.",40,36,"UC Riverside","Loyola Marymount",4.5,"400986904"
171,2,"15:40",940,"Chance Murray missed Three Point Jumper.",40,36,"UC Riverside","Loyola Marymount",4.5,"400986904"
172,2,"15:40",940,"James Batemon Defensive Rebound.",40,36,"UC Riverside","Loyola Marymount",4.5,"400986904"
173,2,"15:31",931,"Foul on Idy Diallo.",40,36,"UC Riverside","Loyola Marymount",4.5,"400986904"
174,2,"15:31",931,"Official TV Timeout",40,36,"UC Riverside","Loyola Marymount",4.5,"400986904"
175,2,"15:20",920,"Foul on Idy Diallo.",40,36,"UC Riverside","Loyola Marymount",4.5,"400986904"
176,2,"15:20",920,"Eli Scott made Free Throw.",41,36,"UC Riverside","Loyola Marymount",4.5,"400986904"
177,2,"15:20",920,"Eli Scott missed Free Throw.",41,36,"UC Riverside","Loyola Marymount",4.5,"400986904"
178,2,"15:20",920,"Idy Diallo Defensive Rebound.",41,36,"UC Riverside","Loyola Marymount",4.5,"400986904"
179,2,"15:06",906,"Menno Dijkstra made Jumper.",41,38,"UC Riverside","Loyola Marymount",4.5,"400986904"
180,2,"14:41",881,"Eli Scott made Jumper. Assisted by Cameron Allen.",43,38,"UC Riverside","Loyola Marymount",4.5,"400986904"
181,2,"14:38",878,"Foul on Ryker Pierce.",43,38,"UC Riverside","Loyola Marymount",4.5,"400986904"
182,2,"14:19",859,"Mattias Markusson Turnover.",43,38,"UC Riverside","Loyola Marymount",4.5,"400986904"
183,2,"14:19",859,"Foul on Mattias Markusson.",43,38,"UC Riverside","Loyola Marymount",4.5,"400986904"
184,2,"14:00",840,"Chance Murray missed Jumper.",43,38,"UC Riverside","Loyola Marymount",4.5,"400986904"
185,2,"14:00",840,"Brandon Rosser Offensive Rebound.",43,38,"UC Riverside","Loyola Marymount",4.5,"400986904"
186,2,"13:56",836,"Brandon Rosser Turnover.",43,38,"UC Riverside","Loyola Marymount",4.5,"400986904"
187,2,"13:53",833,"Joe Quintana Steal.",43,38,"UC Riverside","Loyola Marymount",4.5,"400986904"
188,2,"13:44",824,"Joe Quintana missed Jumper.",43,38,"UC Riverside","Loyola Marymount",4.5,"400986904"
189,2,"13:44",824,"Eli Scott Offensive Rebound.",43,38,"UC Riverside","Loyola Marymount",4.5,"400986904"
190,2,"13:33",813,"Eli Scott made Layup.",45,38,"UC Riverside","Loyola Marymount",4.5,"400986904"
191,2,"13:33",813,"Foul on Brandon Rosser.",45,38,"UC Riverside","Loyola Marymount",4.5,"400986904"
192,2,"13:33",813,"Eli Scott made Free Throw.",46,38,"UC Riverside","Loyola Marymount",4.5,"400986904"
193,2,"13:20",800,"Alex Larsson missed Layup.",46,38,"UC Riverside","Loyola Marymount",4.5,"400986904"
194,2,"13:20",800,"Mattias Markusson Block.",46,38,"UC Riverside","Loyola Marymount",4.5,"400986904"
195,2,"13:20",800,"UC Riverside Offensive Rebound.",46,38,"UC Riverside","Loyola Marymount",4.5,"400986904"
196,2,"13:15",795,"Brandon Rosser made Three Point Jumper. Assisted by Dikymbe Martin.",46,41,"UC Riverside","Loyola Marymount",4.5,"400986904"
197,2,"12:53",773,"Steven Haney missed Three Point Jumper.",46,41,"UC Riverside","Loyola Marymount",4.5,"400986904"
198,2,"12:53",773,"Eli Scott Offensive Rebound.",46,41,"UC Riverside","Loyola Marymount",4.5,"400986904"
199,2,"12:43",763,"Eli Scott missed Jumper.",46,41,"UC Riverside","Loyola Marymount",4.5,"400986904"
200,2,"12:43",763,"Chance Murray Defensive Rebound.",46,41,"UC Riverside","Loyola Marymount",4.5,"400986904"
201,2,"12:29",749,"Alex Larsson missed Layup.",46,41,"UC Riverside","Loyola Marymount",4.5,"400986904"
202,2,"12:29",749,"Mattias Markusson Defensive Rebound.",46,41,"UC Riverside","Loyola Marymount",4.5,"400986904"
203,2,"12:21",741,"Cameron Allen missed Layup.",46,41,"UC Riverside","Loyola Marymount",4.5,"400986904"
204,2,"12:21",741,"Alex Larsson Block.",46,41,"UC Riverside","Loyola Marymount",4.5,"400986904"
205,2,"12:19",739,"Eli Scott Offensive Rebound.",46,41,"UC Riverside","Loyola Marymount",4.5,"400986904"
206,2,"12:16",736,"Eli Scott made Layup.",48,41,"UC Riverside","Loyola Marymount",4.5,"400986904"
207,2,"12:16",736,"Foul on Alex Larsson.",48,41,"UC Riverside","Loyola Marymount",4.5,"400986904"
208,2,"12:16",736,"UC Riverside  Timeout",48,41,"UC Riverside","Loyola Marymount",4.5,"400986904"
209,2,"12:16",736,"Eli Scott missed Free Throw.",48,41,"UC Riverside","Loyola Marymount",4.5,"400986904"
210,2,"12:16",736,"Ryker Pierce Defensive Rebound.",48,41,"UC Riverside","Loyola Marymount",4.5,"400986904"
211,2,"12:05",725,"Alex Larsson missed Layup.",48,41,"UC Riverside","Loyola Marymount",4.5,"400986904"
212,2,"12:05",725,"Brandon Rosser Offensive Rebound.",48,41,"UC Riverside","Loyola Marymount",4.5,"400986904"
213,2,"12:01",721,"Brandon Rosser missed Two Point Tip Shot.",48,41,"UC Riverside","Loyola Marymount",4.5,"400986904"
214,2,"12:01",721,"Cameron Allen Defensive Rebound.",48,41,"UC Riverside","Loyola Marymount",4.5,"400986904"
215,2,"11:57",717,"Steven Haney made Layup. Assisted by Cameron Allen.",50,41,"UC Riverside","Loyola Marymount",4.5,"400986904"
216,2,"11:57",717,"Foul on Brandon Rosser.",50,41,"UC Riverside","Loyola Marymount",4.5,"400986904"
217,2,"11:57",717,"Official TV Timeout",50,41,"UC Riverside","Loyola Marymount",4.5,"400986904"
218,2,"11:57",717,"Steven Haney made Free Throw.",51,41,"UC Riverside","Loyola Marymount",4.5,"400986904"
219,2,"11:50",710,"Foul on Jeffery McClendon.",51,41,"UC Riverside","Loyola Marymount",4.5,"400986904"
220,2,"11:38",698,"Alex Larsson Turnover.",51,41,"UC Riverside","Loyola Marymount",4.5,"400986904"
221,2,"11:15",675,"Cameron Allen made Jumper.",53,41,"UC Riverside","Loyola Marymount",4.5,"400986904"
222,2,"10:48",648,"Alex Larsson missed Jumper.",53,41,"UC Riverside","Loyola Marymount",4.5,"400986904"
223,2,"10:48",648,"Mattias Markusson Defensive Rebound.",53,41,"UC Riverside","Loyola Marymount",4.5,"400986904"
224,2,"10:41",641,"Eli Scott missed Three Point Jumper.",53,41,"UC Riverside","Loyola Marymount",4.5,"400986904"
225,2,"10:41",641,"Brandon Rosser Defensive Rebound.",53,41,"UC Riverside","Loyola Marymount",4.5,"400986904"
226,2,"10:08",608,"Chance Murray missed Three Point Jumper.",53,41,"UC Riverside","Loyola Marymount",4.5,"400986904"
227,2,"10:08",608,"Brandon Rosser Offensive Rebound.",53,41,"UC Riverside","Loyola Marymount",4.5,"400986904"
228,2,"10:06",606,"Brandon Rosser made Layup.",53,43,"UC Riverside","Loyola Marymount",4.5,"400986904"
229,2,"10:06",606,"Foul on Steven Haney.",53,43,"UC Riverside","Loyola Marymount",4.5,"400986904"
230,2,"10:06",606,"Brandon Rosser missed Free Throw.",53,43,"UC Riverside","Loyola Marymount",4.5,"400986904"
231,2,"10:06",606,"Mattias Markusson Defensive Rebound.",53,43,"UC Riverside","Loyola Marymount",4.5,"400986904"
232,2,"9:56",596,"Jeffery McClendon missed Three Point Jumper.",53,43,"UC Riverside","Loyola Marymount",4.5,"400986904"
233,2,"9:56",596,"Loyola Marymount Offensive Rebound.",53,43,"UC Riverside","Loyola Marymount",4.5,"400986904"
234,2,"9:26",566,"James Batemon missed Layup.",53,43,"UC Riverside","Loyola Marymount",4.5,"400986904"
235,2,"9:26",566,"Brandon Rosser Block.",53,43,"UC Riverside","Loyola Marymount",4.5,"400986904"
236,2,"9:25",565,"Mattias Markusson Offensive Rebound.",53,43,"UC Riverside","Loyola Marymount",4.5,"400986904"
237,2,"9:25",565,"Mattias Markusson made Layup.",55,43,"UC Riverside","Loyola Marymount",4.5,"400986904"
238,2,"9:25",565,"Foul on Alex Larsson.",55,43,"UC Riverside","Loyola Marymount",4.5,"400986904"
239,2,"9:25",565,"Mattias Markusson missed Free Throw.",55,43,"UC Riverside","Loyola Marymount",4.5,"400986904"
240,2,"9:25",565,"Chance Murray Defensive Rebound.",55,43,"UC Riverside","Loyola Marymount",4.5,"400986904"
