"play_id","half","time_remaining_half","secs_remaining","description","home_score","away_score","away","home","home_favored_by","game_id"
281,2,"8:20",500,"Jeffery McClendon Offensive Rebound.",67,64,"Loyola Marymount","Incarnate Word",NA,"400986906"
282,2,"8:10",490,"Jeffery McClendon Turnover.",67,64,"Loyola Marymount","Incarnate Word",NA,"400986906"
283,2,"8:01",481,"Simi Socks made Jumper. Assisted by Shawn Johnson.",69,64,"Loyola Marymount","Incarnate Word",NA,"400986906"
284,2,"7:40",460,"James Batemon Turnover.",69,64,"Loyola Marymount","Incarnate Word",NA,"400986906"
285,2,"7:38",458,"Shawn Johnson Steal.",69,64,"Loyola Marymount","Incarnate Word",NA,"400986906"
286,2,"7:35",455,"Foul on Donald Gipson.",69,64,"Loyola Marymount","Incarnate Word",NA,"400986906"
287,2,"7:35",455,"Official TV Timeout",69,64,"Loyola Marymount","Incarnate Word",NA,"400986906"
288,2,"7:35",455,"Augustine Ene made Free Throw.",70,64,"Loyola Marymount","Incarnate Word",NA,"400986906"
289,2,"7:35",455,"Augustine Ene made Free Throw.",71,64,"Loyola Marymount","Incarnate Word",NA,"400986906"
290,2,"7:21",441,"Donald Gipson made Three Point Jumper. Assisted by Eli Scott.",71,67,"Loyola Marymount","Incarnate Word",NA,"400986906"
291,2,"7:05",425,"Shawn Johnson made Three Point Jumper. Assisted by Augustine Ene.",74,67,"Loyola Marymount","Incarnate Word",NA,"400986906"
292,2,"6:32",392,"Eli Scott Turnover.",74,67,"Loyola Marymount","Incarnate Word",NA,"400986906"
293,2,"6:21",381,"Shawn Johnson missed Layup.",74,67,"Loyola Marymount","Incarnate Word",NA,"400986906"
294,2,"6:21",381,"Shawn Johnson Offensive Rebound.",74,67,"Loyola Marymount","Incarnate Word",NA,"400986906"
295,2,"6:18",378,"Shawn Johnson missed Jumper.",74,67,"Loyola Marymount","Incarnate Word",NA,"400986906"
296,2,"6:18",378,"Zafir Williams Defensive Rebound.",74,67,"Loyola Marymount","Incarnate Word",NA,"400986906"
297,2,"6:09",369,"James Batemon made Layup.",74,69,"Loyola Marymount","Incarnate Word",NA,"400986906"
298,2,"6:09",369,"Foul on Simi Socks.",74,69,"Loyola Marymount","Incarnate Word",NA,"400986906"
299,2,"6:09",369,"James Batemon made Free Throw.",74,70,"Loyola Marymount","Incarnate Word",NA,"400986906"
300,2,"5:53",353,"Shawn Johnson Turnover.",74,70,"Loyola Marymount","Incarnate Word",NA,"400986906"
301,2,"5:42",342,"Foul on Jalin Hart.",74,70,"Loyola Marymount","Incarnate Word",NA,"400986906"
302,2,"5:42",342,"James Batemon made Free Throw.",74,71,"Loyola Marymount","Incarnate Word",NA,"400986906"
303,2,"5:42",342,"James Batemon made Free Throw.",74,72,"Loyola Marymount","Incarnate Word",NA,"400986906"
304,2,"5:21",321,"Augustine Ene missed Three Point Jumper.",74,72,"Loyola Marymount","Incarnate Word",NA,"400986906"
305,2,"5:21",321,"Jeffery McClendon Defensive Rebound.",74,72,"Loyola Marymount","Incarnate Word",NA,"400986906"
306,2,"5:09",309,"Foul on Zafir Williams.",74,72,"Loyola Marymount","Incarnate Word",NA,"400986906"
307,2,"5:09",309,"Zafir Williams Turnover.",74,72,"Loyola Marymount","Incarnate Word",NA,"400986906"
308,2,"4:59",299,"Sam Burmeister Turnover.",74,72,"Loyola Marymount","Incarnate Word",NA,"400986906"
309,2,"4:58",298,"Jeffery McClendon Steal.",74,72,"Loyola Marymount","Incarnate Word",NA,"400986906"
310,2,"4:55",295,"James Batemon made Layup.",74,74,"Loyola Marymount","Incarnate Word",NA,"400986906"
311,2,"4:55",295,"Foul on Shawn Johnson.",74,74,"Loyola Marymount","Incarnate Word",NA,"400986906"
312,2,"4:55",295,"James Batemon made Free Throw.",74,75,"Loyola Marymount","Incarnate Word",NA,"400986906"
313,2,"4:31",271,"Shawn Johnson missed Three Point Jumper.",74,75,"Loyola Marymount","Incarnate Word",NA,"400986906"
314,2,"4:31",271,"Eli Scott Defensive Rebound.",74,75,"Loyola Marymount","Incarnate Word",NA,"400986906"
315,2,"4:22",262,"James Batemon made Layup.",74,77,"Loyola Marymount","Incarnate Word",NA,"400986906"
316,2,"4:09",249,"Foul on James Batemon.",74,77,"Loyola Marymount","Incarnate Word",NA,"400986906"
317,2,"4:09",249,"Jalin Hart made Free Throw.",75,77,"Loyola Marymount","Incarnate Word",NA,"400986906"
318,2,"4:09",249,"Jalin Hart missed Free Throw.",75,77,"Loyola Marymount","Incarnate Word",NA,"400986906"
319,2,"4:09",249,"Loyola Marymount Defensive Rebound.",75,77,"Loyola Marymount","Incarnate Word",NA,"400986906"
320,2,"3:52",232,"Jeffery McClendon made Jumper. Assisted by James Batemon.",75,79,"Loyola Marymount","Incarnate Word",NA,"400986906"
321,2,"3:32",212,"Christian Peevy missed Layup.",75,79,"Loyola Marymount","Incarnate Word",NA,"400986906"
322,2,"3:32",212,"Eli Scott Defensive Rebound.",75,79,"Loyola Marymount","Incarnate Word",NA,"400986906"
323,2,"3:26",206,"James Batemon Turnover.",75,79,"Loyola Marymount","Incarnate Word",NA,"400986906"
324,2,"3:26",206,"Official TV Timeout",75,79,"Loyola Marymount","Incarnate Word",NA,"400986906"
325,2,"2:59",179,"Simi Socks missed Layup.",75,79,"Loyola Marymount","Incarnate Word",NA,"400986906"
326,2,"2:59",179,"Mattias Markusson Block.",75,79,"Loyola Marymount","Incarnate Word",NA,"400986906"
327,2,"2:57",177,"James Batemon Defensive Rebound.",75,79,"Loyola Marymount","Incarnate Word",NA,"400986906"
328,2,"2:37",157,"Cameron Allen Turnover.",75,79,"Loyola Marymount","Incarnate Word",NA,"400986906"
329,2,"2:23",143,"Foul on Jeffery McClendon.",75,79,"Loyola Marymount","Incarnate Word",NA,"400986906"
330,2,"2:23",143,"Jalin Hart made Free Throw.",76,79,"Loyola Marymount","Incarnate Word",NA,"400986906"
331,2,"2:23",143,"Jalin Hart missed Free Throw.",76,79,"Loyola Marymount","Incarnate Word",NA,"400986906"
332,2,"2:23",143,"Mattias Markusson Defensive Rebound.",76,79,"Loyola Marymount","Incarnate Word",NA,"400986906"
333,2,"2:16",136,"Loyola Marymount  Timeout",76,79,"Loyola Marymount","Incarnate Word",NA,"400986906"
334,2,"1:56",116,"Mattias Markusson made Dunk. Assisted by James Batemon.",76,81,"Loyola Marymount","Incarnate Word",NA,"400986906"
335,2,"1:46",106,"Jalin Hart missed Layup.",76,81,"Loyola Marymount","Incarnate Word",NA,"400986906"
336,2,"1:46",106,"Mattias Markusson Block.",76,81,"Loyola Marymount","Incarnate Word",NA,"400986906"
337,2,"1:44",104,"Steven Haney Defensive Rebound.",76,81,"Loyola Marymount","Incarnate Word",NA,"400986906"
338,2,"1:35",95,"Mattias Markusson made Layup. Assisted by Steven Haney.",76,83,"Loyola Marymount","Incarnate Word",NA,"400986906"
339,2,"1:35",95,"Incarnate Word  Timeout",76,83,"Loyola Marymount","Incarnate Word",NA,"400986906"
340,2,"1:25",85,"Foul on Eli Scott.",76,83,"Loyola Marymount","Incarnate Word",NA,"400986906"
341,2,"1:25",85,"Keaton Hervey made Free Throw.",77,83,"Loyola Marymount","Incarnate Word",NA,"400986906"
342,2,"1:25",85,"Keaton Hervey made Free Throw.",78,83,"Loyola Marymount","Incarnate Word",NA,"400986906"
343,2,"1:01",61,"Loyola Marymount  Timeout",78,83,"Loyola Marymount","Incarnate Word",NA,"400986906"
344,2,"0:57",57,"Steven Haney missed Jumper.",78,83,"Loyola Marymount","Incarnate Word",NA,"400986906"
345,2,"0:57",57,"Jalin Hart Defensive Rebound.",78,83,"Loyola Marymount","Incarnate Word",NA,"400986906"
346,2,"0:52",52,"Foul on Cameron Allen.",78,83,"Loyola Marymount","Incarnate Word",NA,"400986906"
347,2,"0:52",52,"Jalin Hart made Free Throw.",79,83,"Loyola Marymount","Incarnate Word",NA,"400986906"
348,2,"0:52",52,"Jalin Hart missed Free Throw.",79,83,"Loyola Marymount","Incarnate Word",NA,"400986906"
349,2,"0:52",52,"Jalin Hart Offensive Rebound.",79,83,"Loyola Marymount","Incarnate Word",NA,"400986906"
350,2,"0:45",45,"Jalin Hart missed Three Point Jumper.",79,83,"Loyola Marymount","Incarnate Word",NA,"400986906"
351,2,"0:45",45,"Eli Scott Defensive Rebound.",79,83,"Loyola Marymount","Incarnate Word",NA,"400986906"
352,2,"0:43",43,"Jeffery McClendon missed Free Throw.",79,83,"Loyola Marymount","Incarnate Word",NA,"400986906"
353,2,"0:43",43,"Jeffery McClendon made Free Throw.",79,84,"Loyola Marymount","Incarnate Word",NA,"400986906"
354,2,"0:43",43,"Jeffery McClendon made Free Throw.",79,85,"Loyola Marymount","Incarnate Word",NA,"400986906"
355,2,"0:41",41,"Foul on Shawn Johnson.",79,83,"Loyola Marymount","Incarnate Word",NA,"400986906"
356,2,"0:37",37,"Christian Peevy missed Layup.",79,85,"Loyola Marymount","Incarnate Word",NA,"400986906"
357,2,"0:37",37,"Jalin Hart Offensive Rebound.",79,85,"Loyola Marymount","Incarnate Word",NA,"400986906"
358,2,"0:31",31,"Foul on Mattias Markusson.",79,85,"Loyola Marymount","Incarnate Word",NA,"400986906"
359,2,"0:31",31,"Christian Peevy made Free Throw.",80,85,"Loyola Marymount","Incarnate Word",NA,"400986906"
360,2,"0:31",31,"Christian Peevy made Free Throw.",81,85,"Loyola Marymount","Incarnate Word",NA,"400986906"
361,2,"0:31",31,"Incarnate Word  Timeout",81,85,"Loyola Marymount","Incarnate Word",NA,"400986906"
362,2,"0:27",27,"Foul on Augustine Ene.",81,85,"Loyola Marymount","Incarnate Word",NA,"400986906"
363,2,"0:27",27,"Eli Scott missed Free Throw.",81,85,"Loyola Marymount","Incarnate Word",NA,"400986906"
364,2,"0:27",27,"Loyola Marymount Deadball Team Rebound.",81,85,"Loyola Marymount","Incarnate Word",NA,"400986906"
365,2,"0:27",27,"Eli Scott missed Free Throw.",81,85,"Loyola Marymount","Incarnate Word",NA,"400986906"
366,2,"0:27",27,"Augustine Ene Defensive Rebound.",81,85,"Loyola Marymount","Incarnate Word",NA,"400986906"
367,2,"0:24",24,"Foul on Mattias Markusson.",81,85,"Loyola Marymount","Incarnate Word",NA,"400986906"
368,2,"0:24",24,"Simi Socks made Free Throw.",82,85,"Loyola Marymount","Incarnate Word",NA,"400986906"
369,2,"0:24",24,"Simi Socks made Free Throw.",83,85,"Loyola Marymount","Incarnate Word",NA,"400986906"
370,2,"0:23",23,"Foul on Augustine Ene.",83,85,"Loyola Marymount","Incarnate Word",NA,"400986906"
371,2,"0:23",23,"James Batemon made Free Throw.",83,86,"Loyola Marymount","Incarnate Word",NA,"400986906"
372,2,"0:23",23,"James Batemon made Free Throw.",83,87,"Loyola Marymount","Incarnate Word",NA,"400986906"
373,2,"0:17",17,"Christian Peevy made Layup. Assisted by Jalin Hart.",85,87,"Loyola Marymount","Incarnate Word",NA,"400986906"
374,2,"0:17",17,"Incarnate Word  Timeout",85,87,"Loyola Marymount","Incarnate Word",NA,"400986906"
375,2,"0:16",16,"Foul on Augustine Ene.",85,87,"Loyola Marymount","Incarnate Word",NA,"400986906"
376,2,"0:16",16,"James Batemon made Free Throw.",85,88,"Loyola Marymount","Incarnate Word",NA,"400986906"
377,2,"0:16",16,"James Batemon made Free Throw.",85,89,"Loyola Marymount","Incarnate Word",NA,"400986906"
378,2,"0:08",8,"Christian Peevy made Jumper. Assisted by Jalin Hart.",87,89,"Loyola Marymount","Incarnate Word",NA,"400986906"
379,2,"0:07",7,"Foul on Christian Peevy.",87,89,"Loyola Marymount","Incarnate Word",NA,"400986906"
380,2,"0:07",7,"Steven Haney made Free Throw.",87,90,"Loyola Marymount","Incarnate Word",NA,"400986906"
381,2,"0:07",7,"Steven Haney made Free Throw.",87,91,"Loyola Marymount","Incarnate Word",NA,"400986906"
382,2,"0:03",3,"Jalin Hart missed Three Point Jumper.",87,91,"Loyola Marymount","Incarnate Word",NA,"400986906"
383,2,"0:03",3,"Steven Haney Defensive Rebound.",87,91,"Loyola Marymount","Incarnate Word",NA,"400986906"
384,2,"0:00",0,"End of Game",87,91,"Loyola Marymount","Incarnate Word",NA,"400986906"
1,1,"20:00",2400,"PLAY",0,0,"Loyola Marymount","Boise State",9,"400986907"
2,1,"19:46",2386,"Eli Scott missed Jumper.",0,0,"Loyola Marymount","Boise State",9,"400986907"
3,1,"19:46",2386,"Zach Haney Defensive Rebound.",0,0,"Loyola Marymount","Boise State",9,"400986907"
4,1,"19:37",2377,"Zach Haney missed Three Point Jumper.",0,0,"Loyola Marymount","Boise State",9,"400986907"
5,1,"19:37",2377,"Mattias Markusson Defensive Rebound.",0,0,"Loyola Marymount","Boise State",9,"400986907"
6,1,"19:13",2353,"James Batemon missed Three Point Jumper.",0,0,"Loyola Marymount","Boise State",9,"400986907"
7,1,"19:13",2353,"Christian Sengfelder Defensive Rebound.",0,0,"Loyola Marymount","Boise State",9,"400986907"
8,1,"18:59",2339,"Christian Sengfelder missed Three Point Jumper.",0,0,"Loyola Marymount","Boise State",9,"400986907"
9,1,"18:59",2339,"Cameron Allen Defensive Rebound.",0,0,"Loyola Marymount","Boise State",9,"400986907"
10,1,"18:50",2330,"Cameron Allen made Jumper.",0,2,"Loyola Marymount","Boise State",9,"400986907"
11,1,"18:28",2308,"Justinian Jessup made Jumper.",2,2,"Loyola Marymount","Boise State",9,"400986907"
12,1,"18:01",2281,"Mattias Markusson Turnover.",2,2,"Loyola Marymount","Boise State",9,"400986907"
13,1,"17:47",2267,"Lexus Williams made Three Point Jumper. Assisted by Justinian Jessup.",5,2,"Loyola Marymount","Boise State",9,"400986907"
14,1,"17:21",2241,"Mattias Markusson made Layup. Assisted by James Batemon.",5,4,"Loyola Marymount","Boise State",9,"400986907"
15,1,"16:54",2214,"Alex Hobbs missed Jumper.",5,4,"Loyola Marymount","Boise State",9,"400986907"
16,1,"16:54",2214,"Zach Haney Offensive Rebound.",5,4,"Loyola Marymount","Boise State",9,"400986907"
17,1,"16:51",2211,"Zach Haney missed Jumper.",5,4,"Loyola Marymount","Boise State",9,"400986907"
18,1,"16:51",2211,"Boise State Deadball Team Rebound.",5,4,"Loyola Marymount","Boise State",9,"400986907"
19,1,"16:51",2211,"Foul on Cameron Allen.",5,4,"Loyola Marymount","Boise State",9,"400986907"
20,1,"16:50",2210,"Zach Haney made Layup. Assisted by Lexus Williams.",7,4,"Loyola Marymount","Boise State",9,"400986907"
21,1,"16:28",2188,"Eli Scott missed Jumper.",7,4,"Loyola Marymount","Boise State",9,"400986907"
22,1,"16:28",2188,"Alex Hobbs Defensive Rebound.",7,4,"Loyola Marymount","Boise State",9,"400986907"
23,1,"16:13",2173,"Alex Hobbs missed Three Point Jumper.",7,4,"Loyola Marymount","Boise State",9,"400986907"
24,1,"16:13",2173,"James Batemon Defensive Rebound.",7,4,"Loyola Marymount","Boise State",9,"400986907"
25,1,"15:54",2154,"James Batemon made Layup.",7,6,"Loyola Marymount","Boise State",9,"400986907"
26,1,"15:30",2130,"Zach Haney missed Jumper.",7,6,"Loyola Marymount","Boise State",9,"400986907"
27,1,"15:30",2130,"Christian Sengfelder Offensive Rebound.",7,6,"Loyola Marymount","Boise State",9,"400986907"
28,1,"15:27",2127,"Christian Sengfelder missed Jumper.",7,6,"Loyola Marymount","Boise State",9,"400986907"
29,1,"15:27",2127,"Zach Haney Offensive Rebound.",7,6,"Loyola Marymount","Boise State",9,"400986907"
30,1,"15:24",2124,"Zach Haney made Layup.",9,6,"Loyola Marymount","Boise State",9,"400986907"
31,1,"15:05",2105,"Eli Scott missed Jumper.",9,6,"Loyola Marymount","Boise State",9,"400986907"
32,1,"15:05",2105,"Christian Sengfelder Defensive Rebound.",9,6,"Loyola Marymount","Boise State",9,"400986907"
33,1,"14:57",2097,"Foul on Steven Haney.",9,6,"Loyola Marymount","Boise State",9,"400986907"
34,1,"14:57",2097,"Official TV Timeout",9,6,"Loyola Marymount","Boise State",9,"400986907"
35,1,"14:47",2087,"Justinian Jessup made Three Point Jumper. Assisted by Zach Haney.",12,6,"Loyola Marymount","Boise State",9,"400986907"
36,1,"14:24",2064,"Eli Scott Turnover.",12,6,"Loyola Marymount","Boise State",9,"400986907"
37,1,"14:23",2063,"Zach Haney Steal.",12,6,"Loyola Marymount","Boise State",9,"400986907"
38,1,"14:11",2051,"Zach Haney Turnover.",12,6,"Loyola Marymount","Boise State",9,"400986907"
39,1,"14:11",2051,"Zafir Williams Steal.",12,6,"Loyola Marymount","Boise State",9,"400986907"
40,1,"13:54",2034,"Cameron Allen missed Jumper.",12,6,"Loyola Marymount","Boise State",9,"400986907"
41,1,"13:54",2034,"Marcus Dickinson Defensive Rebound.",12,6,"Loyola Marymount","Boise State",9,"400986907"
42,1,"13:46",2026,"Marcus Dickinson missed Layup.",12,6,"Loyola Marymount","Boise State",9,"400986907"
43,1,"13:46",2026,"Mattias Markusson Defensive Rebound.",12,6,"Loyola Marymount","Boise State",9,"400986907"
44,1,"13:38",2018,"James Batemon missed Three Point Jumper.",12,6,"Loyola Marymount","Boise State",9,"400986907"
45,1,"13:38",2018,"Justinian Jessup Defensive Rebound.",12,6,"Loyola Marymount","Boise State",9,"400986907"
46,1,"13:08",1988,"Robin Jorch Turnover.",12,6,"Loyola Marymount","Boise State",9,"400986907"
47,1,"12:52",1972,"Zafir Williams made Jumper.",12,8,"Loyola Marymount","Boise State",9,"400986907"
48,1,"12:33",1953,"Justinian Jessup made Jumper.",14,8,"Loyola Marymount","Boise State",9,"400986907"
49,1,"12:13",1933,"Foul on James Batemon.",14,8,"Loyola Marymount","Boise State",9,"400986907"
50,1,"12:13",1933,"Foul on Robin Jorch.",14,8,"Loyola Marymount","Boise State",9,"400986907"
51,1,"12:00",1920,"Justinian Jessup missed Three Point Jumper.",14,8,"Loyola Marymount","Boise State",9,"400986907"
52,1,"12:00",1920,"Mattias Markusson Defensive Rebound.",14,8,"Loyola Marymount","Boise State",9,"400986907"
53,1,"11:36",1896,"James Batemon Turnover.",14,8,"Loyola Marymount","Boise State",9,"400986907"
54,1,"11:36",1896,"Official TV Timeout",14,8,"Loyola Marymount","Boise State",9,"400986907"
55,1,"11:32",1892,"Alex Hobbs made Jumper.",16,8,"Loyola Marymount","Boise State",9,"400986907"
56,1,"11:02",1862,"Steven Haney Turnover.",16,8,"Loyola Marymount","Boise State",9,"400986907"
57,1,"10:48",1848,"Marcus Dickinson missed Three Point Jumper.",16,8,"Loyola Marymount","Boise State",9,"400986907"
58,1,"10:48",1848,"James Batemon Defensive Rebound.",16,8,"Loyola Marymount","Boise State",9,"400986907"
59,1,"10:22",1822,"Foul on Marcus Dickinson.",16,8,"Loyola Marymount","Boise State",9,"400986907"
60,1,"10:22",1822,"Joe Quintana missed Three Point Jumper.",16,8,"Loyola Marymount","Boise State",9,"400986907"
61,1,"10:22",1822,"Loyola Marymount Deadball Team Rebound.",16,8,"Loyola Marymount","Boise State",9,"400986907"
62,1,"10:22",1822,"Joe Quintana made Three Point Jumper. Assisted by Donald Gipson.",16,11,"Loyola Marymount","Boise State",9,"400986907"
63,1,"10:06",1806,"Alex Hobbs missed Jumper.",16,11,"Loyola Marymount","Boise State",9,"400986907"
64,1,"10:06",1806,"James Batemon Defensive Rebound.",16,11,"Loyola Marymount","Boise State",9,"400986907"
65,1,"9:46",1786,"Donald Gipson missed Three Point Jumper.",16,11,"Loyola Marymount","Boise State",9,"400986907"
66,1,"9:46",1786,"Marcus Dickinson Defensive Rebound.",16,11,"Loyola Marymount","Boise State",9,"400986907"
67,1,"9:29",1769,"Zach Haney missed Three Point Jumper.",16,11,"Loyola Marymount","Boise State",9,"400986907"
68,1,"9:29",1769,"Boise State Offensive Rebound.",16,11,"Loyola Marymount","Boise State",9,"400986907"
69,1,"8:58",1738,"Foul on Donald Gipson.",16,11,"Loyola Marymount","Boise State",9,"400986907"
70,1,"8:48",1728,"Christian Sengfelder Turnover.",16,11,"Loyola Marymount","Boise State",9,"400986907"
71,1,"8:40",1720,"Donald Gipson missed Layup.",16,11,"Loyola Marymount","Boise State",9,"400986907"
72,1,"8:40",1720,"Alex Hobbs Defensive Rebound.",16,11,"Loyola Marymount","Boise State",9,"400986907"
73,1,"8:27",1707,"Christian Sengfelder missed Three Point Jumper.",16,11,"Loyola Marymount","Boise State",9,"400986907"
74,1,"8:27",1707,"Eli Scott Defensive Rebound.",16,11,"Loyola Marymount","Boise State",9,"400986907"
75,1,"8:02",1682,"Joe Quintana missed Jumper.",16,11,"Loyola Marymount","Boise State",9,"400986907"
76,1,"8:02",1682,"Zach Haney Defensive Rebound.",16,11,"Loyola Marymount","Boise State",9,"400986907"
77,1,"7:33",1653,"Lexus Williams missed Jumper.",16,11,"Loyola Marymount","Boise State",9,"400986907"
78,1,"7:33",1653,"Boise State Offensive Rebound.",16,11,"Loyola Marymount","Boise State",9,"400986907"
79,1,"7:31",1651,"Official TV Timeout",16,11,"Loyola Marymount","Boise State",9,"400986907"
80,1,"7:24",1644,"Alex Hobbs made Layup.",18,11,"Loyola Marymount","Boise State",9,"400986907"
81,1,"7:16",1636,"Steven Haney Turnover.",18,11,"Loyola Marymount","Boise State",9,"400986907"
82,1,"7:16",1636,"Justinian Jessup Steal.",18,11,"Loyola Marymount","Boise State",9,"400986907"
83,1,"7:01",1621,"Zach Haney Turnover.",18,11,"Loyola Marymount","Boise State",9,"400986907"
84,1,"7:01",1621,"Foul on Zach Haney.",18,11,"Loyola Marymount","Boise State",9,"400986907"
85,1,"6:48",1608,"Eli Scott missed Jumper.",18,11,"Loyola Marymount","Boise State",9,"400986907"
86,1,"6:47",1607,"Zach Haney Block.",18,11,"Loyola Marymount","Boise State",9,"400986907"
87,1,"6:47",1607,"Loyola Marymount Offensive Rebound.",18,11,"Loyola Marymount","Boise State",9,"400986907"
88,1,"6:31",1591,"James Batemon made Jumper.",18,13,"Loyola Marymount","Boise State",9,"400986907"
89,1,"6:21",1581,"Foul on Jeffery McClendon.",18,13,"Loyola Marymount","Boise State",9,"400986907"
90,1,"6:21",1581,"Alex Hobbs made Free Throw.",19,13,"Loyola Marymount","Boise State",9,"400986907"
91,1,"6:21",1581,"Alex Hobbs made Free Throw.",20,13,"Loyola Marymount","Boise State",9,"400986907"
92,1,"6:00",1560,"Eli Scott made Jumper.",20,15,"Loyola Marymount","Boise State",9,"400986907"
93,1,"5:38",1538,"Justinian Jessup missed Three Point Jumper.",20,15,"Loyola Marymount","Boise State",9,"400986907"
94,1,"5:38",1538,"Alex Hobbs Offensive Rebound.",20,15,"Loyola Marymount","Boise State",9,"400986907"
95,1,"5:31",1531,"Alex Hobbs missed Layup.",20,15,"Loyola Marymount","Boise State",9,"400986907"
96,1,"5:31",1531,"Cameron Allen Defensive Rebound.",20,15,"Loyola Marymount","Boise State",9,"400986907"
97,1,"5:22",1522,"Cameron Allen missed Jumper.",20,15,"Loyola Marymount","Boise State",9,"400986907"
98,1,"5:22",1522,"Christian Sengfelder Defensive Rebound.",20,15,"Loyola Marymount","Boise State",9,"400986907"
99,1,"5:12",1512,"Marcus Dickinson made Layup.",22,15,"Loyola Marymount","Boise State",9,"400986907"
100,1,"5:04",1504,"Loyola Marymount  Timeout",22,15,"Loyola Marymount","Boise State",9,"400986907"
101,1,"4:51",1491,"Foul on Casdon Jardine.",22,15,"Loyola Marymount","Boise State",9,"400986907"
102,1,"4:44",1484,"Joe Quintana Turnover.",22,15,"Loyola Marymount","Boise State",9,"400986907"
103,1,"4:33",1473,"Justinian Jessup made Layup. Assisted by Marcus Dickinson.",24,15,"Loyola Marymount","Boise State",9,"400986907"
104,1,"4:21",1461,"Eli Scott missed Jumper.",24,15,"Loyola Marymount","Boise State",9,"400986907"
105,1,"4:21",1461,"Marcus Dickinson Defensive Rebound.",24,15,"Loyola Marymount","Boise State",9,"400986907"
106,1,"4:16",1456,"Marcus Dickinson Turnover.",24,15,"Loyola Marymount","Boise State",9,"400986907"
107,1,"4:15",1455,"James Batemon Steal.",24,15,"Loyola Marymount","Boise State",9,"400986907"
108,1,"4:13",1453,"Foul on Marcus Dickinson.",24,15,"Loyola Marymount","Boise State",9,"400986907"
109,1,"4:13",1453,"James Batemon missed Free Throw.",24,15,"Loyola Marymount","Boise State",9,"400986907"
110,1,"4:13",1453,"Loyola Marymount Deadball Team Rebound.",24,15,"Loyola Marymount","Boise State",9,"400986907"
111,1,"4:13",1453,"James Batemon missed Free Throw.",24,15,"Loyola Marymount","Boise State",9,"400986907"
112,1,"4:13",1453,"Boise State Defensive Rebound.",24,15,"Loyola Marymount","Boise State",9,"400986907"
113,1,"4:05",1445,"Alex Hobbs Turnover.",24,15,"Loyola Marymount","Boise State",9,"400986907"
114,1,"4:05",1445,"Foul on Alex Hobbs.",24,15,"Loyola Marymount","Boise State",9,"400986907"
115,1,"3:58",1438,"Eli Scott Turnover.",24,15,"Loyola Marymount","Boise State",9,"400986907"
116,1,"3:49",1429,"Derrick Alston made Layup.",26,15,"Loyola Marymount","Boise State",9,"400986907"
117,1,"3:38",1418,"Steven Haney made Three Point Jumper. Assisted by James Batemon.",26,18,"Loyola Marymount","Boise State",9,"400986907"
118,1,"3:32",1412,"Official TV Timeout",26,18,"Loyola Marymount","Boise State",9,"400986907"
119,1,"3:12",1392,"Justinian Jessup missed Three Point Jumper.",26,18,"Loyola Marymount","Boise State",9,"400986907"
120,1,"3:12",1392,"Zafir Williams Defensive Rebound.",26,18,"Loyola Marymount","Boise State",9,"400986907"
121,1,"3:02",1382,"James Batemon missed Three Point Jumper.",26,18,"Loyola Marymount","Boise State",9,"400986907"
122,1,"3:02",1382,"Derrick Alston Defensive Rebound.",26,18,"Loyola Marymount","Boise State",9,"400986907"
123,1,"2:53",1373,"Derrick Alston Turnover.",26,18,"Loyola Marymount","Boise State",9,"400986907"
124,1,"2:52",1372,"Donald Gipson Steal.",26,18,"Loyola Marymount","Boise State",9,"400986907"
125,1,"2:33",1353,"Steven Haney made Three Point Jumper. Assisted by Donald Gipson.",26,21,"Loyola Marymount","Boise State",9,"400986907"
126,1,"2:15",1335,"Alex Hobbs Turnover.",26,21,"Loyola Marymount","Boise State",9,"400986907"
127,1,"2:14",1334,"Donald Gipson Steal.",26,21,"Loyola Marymount","Boise State",9,"400986907"
128,1,"2:11",1331,"Steven Haney missed Three Point Jumper.",26,21,"Loyola Marymount","Boise State",9,"400986907"
129,1,"2:11",1331,"Alex Hobbs Defensive Rebound.",26,21,"Loyola Marymount","Boise State",9,"400986907"
130,1,"1:52",1312,"Lexus Williams Turnover.",26,21,"Loyola Marymount","Boise State",9,"400986907"
131,1,"1:51",1311,"Donald Gipson Steal.",26,21,"Loyola Marymount","Boise State",9,"400986907"
132,1,"1:49",1309,"Donald Gipson made Layup.",26,23,"Loyola Marymount","Boise State",9,"400986907"
133,1,"1:46",1306,"Boise State  Timeout",26,23,"Loyola Marymount","Boise State",9,"400986907"
134,1,"1:19",1279,"Zach Haney missed Layup.",26,23,"Loyola Marymount","Boise State",9,"400986907"
135,1,"1:19",1279,"Steven Haney Defensive Rebound.",26,23,"Loyola Marymount","Boise State",9,"400986907"
136,1,"1:10",1270,"Steven Haney made Three Point Jumper. Assisted by James Batemon.",26,26,"Loyola Marymount","Boise State",9,"400986907"
137,1,"0:40",1240,"Justinian Jessup made Three Point Jumper.",29,26,"Loyola Marymount","Boise State",9,"400986907"
138,1,"0:23",1223,"Donald Gipson missed Three Point Jumper.",29,26,"Loyola Marymount","Boise State",9,"400986907"
139,1,"0:23",1223,"Boise State Defensive Rebound.",29,26,"Loyola Marymount","Boise State",9,"400986907"
140,1,"0:01",1201,"Derrick Alston Turnover.",29,26,"Loyola Marymount","Boise State",9,"400986907"
141,1,"0:00",1200,"End of 1st half",29,26,"Loyola Marymount","Boise State",9,"400986907"
142,2,"20:00",1200,"PLAY",29,26,"Loyola Marymount","Boise State",9,"400986907"
143,2,"19:37",1177,"Cameron Allen made Layup.",29,28,"Loyola Marymount","Boise State",9,"400986907"
