"play_id","half","time_remaining_half","secs_remaining","description","home_score","away_score","away","home","home_favored_by","game_id"
189,2,"16:48",1008,"James Batemon Turnover.",43,32,"Loyola Marymount","Oregon State",10,"400986909"
190,2,"16:47",1007,"Seth Berger Steal.",43,32,"Loyola Marymount","Oregon State",10,"400986909"
191,2,"16:43",1003,"Tres Tinkle made Layup.",45,32,"Loyola Marymount","Oregon State",10,"400986909"
192,2,"16:19",979,"Eli Scott missed Three Point Jumper.",45,32,"Loyola Marymount","Oregon State",10,"400986909"
193,2,"16:19",979,"Tres Tinkle Defensive Rebound.",45,32,"Loyola Marymount","Oregon State",10,"400986909"
194,2,"16:10",970,"Drew Eubanks made Dunk. Assisted by Tres Tinkle.",47,32,"Loyola Marymount","Oregon State",10,"400986909"
195,2,"16:10",970,"Loyola Marymount  Timeout",47,32,"Loyola Marymount","Oregon State",10,"400986909"
196,2,"16:10",970,"Official TV Timeout",47,32,"Loyola Marymount","Oregon State",10,"400986909"
197,2,"16:09",969,"Official TV Timeout",47,32,"Loyola Marymount","Oregon State",10,"400986909"
198,2,"16:00",960,"Donald Gipson missed Jumper.",47,32,"Loyola Marymount","Oregon State",10,"400986909"
199,2,"16:00",960,"Mattias Markusson Offensive Rebound.",47,32,"Loyola Marymount","Oregon State",10,"400986909"
200,2,"15:57",957,"Official TV Timeout",47,34,"Loyola Marymount","Oregon State",10,"400986909"
201,2,"15:57",957,"Mattias Markusson made Two Point Tip Shot.",47,34,"Loyola Marymount","Oregon State",10,"400986909"
202,2,"15:57",957,"Foul on Alfred Hollins.",47,34,"Loyola Marymount","Oregon State",10,"400986909"
203,2,"15:57",957,"Official TV Timeout",47,34,"Loyola Marymount","Oregon State",10,"400986909"
204,2,"15:57",957,"Mattias Markusson made Free Throw.",47,35,"Loyola Marymount","Oregon State",10,"400986909"
205,2,"15:46",946,"Tres Tinkle missed Three Point Jumper.",47,35,"Loyola Marymount","Oregon State",10,"400986909"
206,2,"15:46",946,"Tres Tinkle Offensive Rebound.",47,35,"Loyola Marymount","Oregon State",10,"400986909"
207,2,"15:40",940,"Foul on Mattias Markusson.",47,35,"Loyola Marymount","Oregon State",10,"400986909"
208,2,"15:40",940,"Tres Tinkle made Free Throw.",48,35,"Loyola Marymount","Oregon State",10,"400986909"
209,2,"15:40",940,"Tres Tinkle made Free Throw.",49,35,"Loyola Marymount","Oregon State",10,"400986909"
210,2,"15:30",930,"Steven Haney made Three Point Jumper. Assisted by James Batemon.",49,38,"Loyola Marymount","Oregon State",10,"400986909"
211,2,"15:19",919,"Ethan Thompson missed Three Point Jumper.",49,38,"Loyola Marymount","Oregon State",10,"400986909"
212,2,"15:19",919,"Jeffery McClendon Defensive Rebound.",49,38,"Loyola Marymount","Oregon State",10,"400986909"
213,2,"15:02",902,"Jeffery McClendon made Three Point Jumper. Assisted by Eli Scott.",49,41,"Loyola Marymount","Oregon State",10,"400986909"
214,2,"14:33",873,"Stephen Thompson Jr. missed Three Point Jumper.",49,41,"Loyola Marymount","Oregon State",10,"400986909"
215,2,"14:33",873,"Jeffery McClendon Defensive Rebound.",49,41,"Loyola Marymount","Oregon State",10,"400986909"
216,2,"14:15",855,"James Batemon made Three Point Jumper. Assisted by Eli Scott.",49,44,"Loyola Marymount","Oregon State",10,"400986909"
217,2,"14:12",852,"Oregon State  Timeout",49,44,"Loyola Marymount","Oregon State",10,"400986909"
218,2,"13:52",832,"Drew Eubanks made Layup. Assisted by Tres Tinkle.",51,44,"Loyola Marymount","Oregon State",10,"400986909"
219,2,"13:35",815,"James Batemon Turnover.",51,44,"Loyola Marymount","Oregon State",10,"400986909"
220,2,"13:34",814,"Stephen Thompson Jr. Steal.",51,44,"Loyola Marymount","Oregon State",10,"400986909"
221,2,"13:34",814,"Foul on Eli Scott.",51,44,"Loyola Marymount","Oregon State",10,"400986909"
222,2,"13:17",797,"Foul on Steven Haney.",51,44,"Loyola Marymount","Oregon State",10,"400986909"
223,2,"13:17",797,"Tres Tinkle missed Free Throw.",51,44,"Loyola Marymount","Oregon State",10,"400986909"
224,2,"13:17",797,"Oregon State Deadball Team Rebound.",51,44,"Loyola Marymount","Oregon State",10,"400986909"
225,2,"13:17",797,"Tres Tinkle made Free Throw.",52,44,"Loyola Marymount","Oregon State",10,"400986909"
226,2,"13:05",785,"Foul on Drew Eubanks.",52,44,"Loyola Marymount","Oregon State",10,"400986909"
227,2,"12:56",776,"Cameron Allen missed Three Point Jumper.",52,44,"Loyola Marymount","Oregon State",10,"400986909"
228,2,"12:56",776,"Tres Tinkle Defensive Rebound.",52,44,"Loyola Marymount","Oregon State",10,"400986909"
229,2,"12:48",768,"Stephen Thompson Jr. missed Layup.",52,44,"Loyola Marymount","Oregon State",10,"400986909"
230,2,"12:48",768,"Jeffery McClendon Defensive Rebound.",52,44,"Loyola Marymount","Oregon State",10,"400986909"
231,2,"12:39",759,"Eli Scott Turnover.",52,44,"Loyola Marymount","Oregon State",10,"400986909"
232,2,"12:35",755,"Foul on Jeffery McClendon.",52,44,"Loyola Marymount","Oregon State",10,"400986909"
233,2,"12:35",755,"Ethan Thompson made Free Throw.",53,44,"Loyola Marymount","Oregon State",10,"400986909"
234,2,"12:35",755,"Ethan Thompson made Free Throw.",54,44,"Loyola Marymount","Oregon State",10,"400986909"
235,2,"12:24",744,"Erik Johansson missed Three Point Jumper.",54,44,"Loyola Marymount","Oregon State",10,"400986909"
236,2,"12:24",744,"Zafir Williams Offensive Rebound.",54,44,"Loyola Marymount","Oregon State",10,"400986909"
237,2,"12:20",740,"Zafir Williams made Layup.",54,46,"Loyola Marymount","Oregon State",10,"400986909"
238,2,"12:06",726,"Stephen Thompson Jr. missed Layup.",54,46,"Loyola Marymount","Oregon State",10,"400986909"
239,2,"12:06",726,"Loyola Marymount Defensive Rebound.",54,46,"Loyola Marymount","Oregon State",10,"400986909"
240,2,"11:43",703,"Erik Johansson made Three Point Jumper. Assisted by Cameron Allen.",54,49,"Loyola Marymount","Oregon State",10,"400986909"
241,2,"11:34",694,"Official TV Timeout",54,49,"Loyola Marymount","Oregon State",10,"400986909"
242,2,"11:18",678,"Official TV Timeout",54,49,"Loyola Marymount","Oregon State",10,"400986909"
243,2,"11:16",676,"Kendal Manuel Turnover.",54,49,"Loyola Marymount","Oregon State",10,"400986909"
244,2,"11:03",663,"Zafir Williams made Layup. Assisted by Cameron Allen.",54,51,"Loyola Marymount","Oregon State",10,"400986909"
245,2,"10:38",638,"Drew Eubanks made Layup.",56,51,"Loyola Marymount","Oregon State",10,"400986909"
246,2,"10:13",613,"Foul on Tres Tinkle.",56,51,"Loyola Marymount","Oregon State",10,"400986909"
247,2,"10:13",613,"Mattias Markusson missed Free Throw.",56,51,"Loyola Marymount","Oregon State",10,"400986909"
248,2,"10:13",613,"Loyola Marymount Deadball Team Rebound.",56,51,"Loyola Marymount","Oregon State",10,"400986909"
249,2,"10:13",613,"Mattias Markusson made Free Throw.",56,52,"Loyola Marymount","Oregon State",10,"400986909"
250,2,"9:54",594,"Ronnie Stacy made Layup.",58,52,"Loyola Marymount","Oregon State",10,"400986909"
251,2,"9:34",574,"Joe Quintana missed Three Point Jumper.",58,52,"Loyola Marymount","Oregon State",10,"400986909"
252,2,"9:34",574,"Tres Tinkle Block.",58,52,"Loyola Marymount","Oregon State",10,"400986909"
253,2,"9:32",572,"Ethan Thompson Defensive Rebound.",58,52,"Loyola Marymount","Oregon State",10,"400986909"
254,2,"9:26",566,"Foul on Cameron Allen.",58,52,"Loyola Marymount","Oregon State",10,"400986909"
255,2,"9:26",566,"Kendal Manuel made Free Throw.",59,52,"Loyola Marymount","Oregon State",10,"400986909"
256,2,"9:26",566,"Kendal Manuel made Free Throw.",60,52,"Loyola Marymount","Oregon State",10,"400986909"
257,2,"9:10",550,"Erik Johansson made Three Point Jumper. Assisted by Zafir Williams.",60,55,"Loyola Marymount","Oregon State",10,"400986909"
258,2,"8:37",517,"Ethan Thompson missed Layup.",60,55,"Loyola Marymount","Oregon State",10,"400986909"
259,2,"8:37",517,"Erik Johansson Defensive Rebound.",60,55,"Loyola Marymount","Oregon State",10,"400986909"
260,2,"8:29",509,"James Batemon missed Layup.",60,55,"Loyola Marymount","Oregon State",10,"400986909"
261,2,"8:29",509,"Tres Tinkle Block.",60,55,"Loyola Marymount","Oregon State",10,"400986909"
262,2,"8:27",507,"Ronnie Stacy Defensive Rebound.",60,55,"Loyola Marymount","Oregon State",10,"400986909"
263,2,"8:24",504,"Foul on Zafir Williams.",60,55,"Loyola Marymount","Oregon State",10,"400986909"
264,2,"8:24",504,"Ronnie Stacy made Free Throw.",61,55,"Loyola Marymount","Oregon State",10,"400986909"
265,2,"8:24",504,"Ronnie Stacy missed Free Throw.",61,55,"Loyola Marymount","Oregon State",10,"400986909"
266,2,"8:24",504,"Mattias Markusson Defensive Rebound.",61,55,"Loyola Marymount","Oregon State",10,"400986909"
267,2,"8:15",495,"Jeffery McClendon missed Jumper.",61,55,"Loyola Marymount","Oregon State",10,"400986909"
268,2,"8:15",495,"Eli Scott Offensive Rebound.",61,55,"Loyola Marymount","Oregon State",10,"400986909"
269,2,"8:11",491,"Eli Scott missed Layup.",61,55,"Loyola Marymount","Oregon State",10,"400986909"
270,2,"8:11",491,"Tres Tinkle Block.",61,55,"Loyola Marymount","Oregon State",10,"400986909"
271,2,"8:11",491,"Loyola Marymount Offensive Rebound.",61,55,"Loyola Marymount","Oregon State",10,"400986909"
272,2,"7:53",473,"Zafir Williams missed Jumper.",61,55,"Loyola Marymount","Oregon State",10,"400986909"
273,2,"7:53",473,"Stephen Thompson Jr. Block.",61,55,"Loyola Marymount","Oregon State",10,"400986909"
274,2,"7:51",471,"Jeffery McClendon Offensive Rebound.",61,55,"Loyola Marymount","Oregon State",10,"400986909"
275,2,"7:49",469,"Jeffery McClendon missed Jumper.",61,55,"Loyola Marymount","Oregon State",10,"400986909"
276,2,"7:49",469,"Mattias Markusson Offensive Rebound.",61,55,"Loyola Marymount","Oregon State",10,"400986909"
277,2,"7:42",462,"Jeffery McClendon made Three Point Jumper. Assisted by Eli Scott.",61,58,"Loyola Marymount","Oregon State",10,"400986909"
278,2,"7:22",442,"Foul on Zafir Williams.",61,58,"Loyola Marymount","Oregon State",10,"400986909"
279,2,"7:22",442,"Official TV Timeout",61,58,"Loyola Marymount","Oregon State",10,"400986909"
280,2,"7:22",442,"Ethan Thompson made Free Throw.",62,58,"Loyola Marymount","Oregon State",10,"400986909"
281,2,"7:22",442,"Ethan Thompson made Free Throw.",63,58,"Loyola Marymount","Oregon State",10,"400986909"
282,2,"6:59",419,"Steven Haney made Three Point Jumper. Assisted by Jeffery McClendon.",63,61,"Loyola Marymount","Oregon State",10,"400986909"
283,2,"6:47",407,"Stephen Thompson Jr. made Jumper. Assisted by Ethan Thompson.",65,61,"Loyola Marymount","Oregon State",10,"400986909"
284,2,"6:27",387,"Steven Haney missed Three Point Jumper.",65,61,"Loyola Marymount","Oregon State",10,"400986909"
285,2,"6:27",387,"Ronnie Stacy Defensive Rebound.",65,61,"Loyola Marymount","Oregon State",10,"400986909"
286,2,"5:59",359,"Stephen Thompson Jr. Turnover.",65,61,"Loyola Marymount","Oregon State",10,"400986909"
287,2,"5:39",339,"Mattias Markusson made Jumper.",65,63,"Loyola Marymount","Oregon State",10,"400986909"
288,2,"5:13",313,"Tres Tinkle made Layup.",67,63,"Loyola Marymount","Oregon State",10,"400986909"
289,2,"4:57",297,"Foul on Tres Tinkle.",67,63,"Loyola Marymount","Oregon State",10,"400986909"
290,2,"4:37",277,"Eli Scott made Layup.",67,65,"Loyola Marymount","Oregon State",10,"400986909"
291,2,"4:19",259,"Foul on Eli Scott.",67,65,"Loyola Marymount","Oregon State",10,"400986909"
292,2,"4:19",259,"Tres Tinkle made Free Throw.",68,65,"Loyola Marymount","Oregon State",10,"400986909"
293,2,"4:19",259,"Tres Tinkle made Free Throw.",69,65,"Loyola Marymount","Oregon State",10,"400986909"
294,2,"3:59",239,"Cameron Allen Turnover.",69,65,"Loyola Marymount","Oregon State",10,"400986909"
295,2,"3:58",238,"Stephen Thompson Jr. Steal.",69,65,"Loyola Marymount","Oregon State",10,"400986909"
296,2,"3:55",235,"Stephen Thompson Jr. made Layup.",71,65,"Loyola Marymount","Oregon State",10,"400986909"
297,2,"3:47",227,"Foul on Ronnie Stacy.",71,65,"Loyola Marymount","Oregon State",10,"400986909"
298,2,"3:47",227,"Official TV Timeout",71,65,"Loyola Marymount","Oregon State",10,"400986909"
299,2,"3:32",212,"Steven Haney missed Three Point Jumper.",71,65,"Loyola Marymount","Oregon State",10,"400986909"
300,2,"3:32",212,"Drew Eubanks Defensive Rebound.",71,65,"Loyola Marymount","Oregon State",10,"400986909"
301,2,"3:05",185,"Ronnie Stacy missed Layup.",71,65,"Loyola Marymount","Oregon State",10,"400986909"
302,2,"3:05",185,"Zafir Williams Defensive Rebound.",71,65,"Loyola Marymount","Oregon State",10,"400986909"
303,2,"2:40",160,"Jeffery McClendon made Three Point Jumper.",71,68,"Loyola Marymount","Oregon State",10,"400986909"
304,2,"2:15",135,"Oregon State  Timeout",71,68,"Loyola Marymount","Oregon State",10,"400986909"
305,2,"2:04",124,"Kendal Manuel Turnover.",71,68,"Loyola Marymount","Oregon State",10,"400986909"
306,2,"2:03",123,"Erik Johansson Steal.",71,68,"Loyola Marymount","Oregon State",10,"400986909"
307,2,"1:50",110,"Foul on Eli Scott.",71,68,"Loyola Marymount","Oregon State",10,"400986909"
308,2,"1:50",110,"Eli Scott Turnover.",71,68,"Loyola Marymount","Oregon State",10,"400986909"
309,2,"1:33",93,"Ethan Thompson made Layup.",73,68,"Loyola Marymount","Oregon State",10,"400986909"
310,2,"1:24",84,"Loyola Marymount  Timeout",73,68,"Loyola Marymount","Oregon State",10,"400986909"
311,2,"1:18",78,"Foul on Stephen Thompson Jr..",73,68,"Loyola Marymount","Oregon State",10,"400986909"
312,2,"1:18",78,"Steven Haney made Free Throw.",73,69,"Loyola Marymount","Oregon State",10,"400986909"
313,2,"1:18",78,"Steven Haney missed Free Throw.",73,69,"Loyola Marymount","Oregon State",10,"400986909"
314,2,"1:18",78,"Loyola Marymount Deadball Team Rebound.",73,69,"Loyola Marymount","Oregon State",10,"400986909"
315,2,"1:18",78,"Steven Haney made Free Throw.",73,70,"Loyola Marymount","Oregon State",10,"400986909"
316,2,"0:54",54,"Stephen Thompson Jr. made Layup.",75,70,"Loyola Marymount","Oregon State",10,"400986909"
317,2,"0:54",54,"Foul on Jeffery McClendon.",75,70,"Loyola Marymount","Oregon State",10,"400986909"
318,2,"0:54",54,"Stephen Thompson Jr. made Free Throw.",76,70,"Loyola Marymount","Oregon State",10,"400986909"
319,2,"0:43",43,"Foul on Tres Tinkle.",76,70,"Loyola Marymount","Oregon State",10,"400986909"
320,2,"0:43",43,"Eli Scott made Free Throw.",76,71,"Loyola Marymount","Oregon State",10,"400986909"
321,2,"0:43",43,"Eli Scott made Free Throw.",76,72,"Loyola Marymount","Oregon State",10,"400986909"
322,2,"0:18",18,"Foul on James Batemon.",76,72,"Loyola Marymount","Oregon State",10,"400986909"
323,2,"0:18",18,"Tres Tinkle made Free Throw.",77,72,"Loyola Marymount","Oregon State",10,"400986909"
324,2,"0:18",18,"Tres Tinkle missed Free Throw.",77,72,"Loyola Marymount","Oregon State",10,"400986909"
325,2,"0:18",18,"Jeffery McClendon Defensive Rebound.",77,72,"Loyola Marymount","Oregon State",10,"400986909"
326,2,"0:11",11,"Eli Scott made Layup.",77,74,"Loyola Marymount","Oregon State",10,"400986909"
327,2,"0:11",11,"Foul on Drew Eubanks.",77,74,"Loyola Marymount","Oregon State",10,"400986909"
328,2,"0:11",11,"Eli Scott missed Free Throw.",77,74,"Loyola Marymount","Oregon State",10,"400986909"
329,2,"0:11",11,"Tres Tinkle Defensive Rebound.",77,74,"Loyola Marymount","Oregon State",10,"400986909"
330,2,"0:10",10,"Foul on James Batemon.",77,74,"Loyola Marymount","Oregon State",10,"400986909"
331,2,"0:10",10,"Tres Tinkle missed Free Throw.",77,74,"Loyola Marymount","Oregon State",10,"400986909"
332,2,"0:10",10,"Oregon State Deadball Team Rebound.",77,74,"Loyola Marymount","Oregon State",10,"400986909"
333,2,"0:10",10,"Tres Tinkle made Free Throw.",78,74,"Loyola Marymount","Oregon State",10,"400986909"
334,2,"0:02",2,"Erik Johansson missed Three Point Jumper.",78,74,"Loyola Marymount","Oregon State",10,"400986909"
335,2,"0:02",2,"Kendal Manuel Defensive Rebound.",78,74,"Loyola Marymount","Oregon State",10,"400986909"
336,2,"0:00",0,"End of Game",78,74,"Loyola Marymount","Oregon State",10,"400986909"
1,1,"20:00",2400,"PLAY",0,0,"Portland St","Loyola Marymount",2.5,"400993187"
2,1,"19:39",2379,"Deante Strickland made Three Point Jumper. Assisted by Ryan Edwards.",0,3,"Portland St","Loyola Marymount",2.5,"400993187"
3,1,"19:12",2352,"James Batemon missed Jumper.",0,3,"Portland St","Loyola Marymount",2.5,"400993187"
4,1,"19:12",2352,"Bryce Canda Defensive Rebound.",0,3,"Portland St","Loyola Marymount",2.5,"400993187"
5,1,"19:02",2342,"Deante Strickland Turnover.",0,3,"Portland St","Loyola Marymount",2.5,"400993187"
6,1,"19:01",2341,"Jeffery McClendon Steal.",0,3,"Portland St","Loyola Marymount",2.5,"400993187"
7,1,"18:59",2339,"Jeffery McClendon made Layup.",2,3,"Portland St","Loyola Marymount",2.5,"400993187"
8,1,"18:47",2327,"Bryce Canda made Three Point Jumper. Assisted by Deante Strickland.",2,6,"Portland St","Loyola Marymount",2.5,"400993187"
9,1,"18:33",2313,"Mattias Markusson missed Jumper.",2,6,"Portland St","Loyola Marymount",2.5,"400993187"
10,1,"18:33",2313,"Zafir Williams Offensive Rebound.",2,6,"Portland St","Loyola Marymount",2.5,"400993187"
11,1,"18:28",2308,"Steven Haney missed Three Point Jumper.",2,6,"Portland St","Loyola Marymount",2.5,"400993187"
12,1,"18:28",2308,"Bryce Canda Defensive Rebound.",2,6,"Portland St","Loyola Marymount",2.5,"400993187"
13,1,"18:19",2299,"Brandon Hollins made Layup. Assisted by Bryce Canda.",2,8,"Portland St","Loyola Marymount",2.5,"400993187"
14,1,"18:03",2283,"Loyola Marymount  Turnover.",2,8,"Portland St","Loyola Marymount",2.5,"400993187"
15,1,"17:50",2270,"Deontae North missed Jumper.",2,8,"Portland St","Loyola Marymount",2.5,"400993187"
16,1,"17:50",2270,"Brandon Hollins Offensive Rebound.",2,8,"Portland St","Loyola Marymount",2.5,"400993187"
17,1,"17:42",2262,"Foul on Deante Strickland.",2,8,"Portland St","Loyola Marymount",2.5,"400993187"
18,1,"17:41",2261,"James Batemon Turnover.",2,8,"Portland St","Loyola Marymount",2.5,"400993187"
19,1,"17:40",2260,"Bryce Canda Steal.",2,8,"Portland St","Loyola Marymount",2.5,"400993187"
20,1,"17:37",2257,"Bryce Canda made Dunk.",2,10,"Portland St","Loyola Marymount",2.5,"400993187"
21,1,"17:24",2244,"Mattias Markusson made Dunk. Assisted by Zafir Williams.",4,10,"Portland St","Loyola Marymount",2.5,"400993187"
22,1,"17:13",2233,"Foul on Mattias Markusson.",4,10,"Portland St","Loyola Marymount",2.5,"400993187"
23,1,"17:07",2227,"Ryan Edwards missed Jumper.",4,10,"Portland St","Loyola Marymount",2.5,"400993187"
24,1,"17:07",2227,"Steven Haney Defensive Rebound.",4,10,"Portland St","Loyola Marymount",2.5,"400993187"
25,1,"16:43",2203,"Zafir Williams missed Jumper.",4,10,"Portland St","Loyola Marymount",2.5,"400993187"
26,1,"16:43",2203,"Ryan Edwards Block.",4,10,"Portland St","Loyola Marymount",2.5,"400993187"
27,1,"16:41",2201,"Brandon Hollins Defensive Rebound.",4,10,"Portland St","Loyola Marymount",2.5,"400993187"
28,1,"16:37",2197,"Bryce Canda made Three Point Jumper. Assisted by Brandon Hollins.",4,13,"Portland St","Loyola Marymount",2.5,"400993187"
29,1,"16:33",2193,"Loyola Marymount  Timeout",4,13,"Portland St","Loyola Marymount",2.5,"400993187"
30,1,"16:09",2169,"Foul on Brendan Rumel.",4,13,"Portland St","Loyola Marymount",2.5,"400993187"
31,1,"16:09",2169,"Eli Scott made Free Throw.",5,13,"Portland St","Loyola Marymount",2.5,"400993187"
32,1,"16:09",2169,"Eli Scott made Free Throw.",6,13,"Portland St","Loyola Marymount",2.5,"400993187"
33,1,"15:48",2148,"Bryce Canda missed Three Point Jumper.",6,13,"Portland St","Loyola Marymount",2.5,"400993187"
34,1,"15:48",2148,"Eli Scott Defensive Rebound.",6,13,"Portland St","Loyola Marymount",2.5,"400993187"
35,1,"15:35",2135,"Jeffery McClendon missed Three Point Jumper.",6,13,"Portland St","Loyola Marymount",2.5,"400993187"
36,1,"15:35",2135,"Holland Woods Defensive Rebound.",6,13,"Portland St","Loyola Marymount",2.5,"400993187"
37,1,"15:27",2127,"Deontae North missed Three Point Jumper.",6,13,"Portland St","Loyola Marymount",2.5,"400993187"
38,1,"15:27",2127,"Eli Scott Defensive Rebound.",6,13,"Portland St","Loyola Marymount",2.5,"400993187"
39,1,"15:23",2123,"Eli Scott Turnover.",6,13,"Portland St","Loyola Marymount",2.5,"400993187"
40,1,"15:21",2121,"Brendan Rumel Steal.",6,13,"Portland St","Loyola Marymount",2.5,"400993187"
41,1,"15:20",2120,"Brendan Rumel made Layup.",6,15,"Portland St","Loyola Marymount",2.5,"400993187"
42,1,"15:13",2113,"Foul on Brandon Hollins.",6,15,"Portland St","Loyola Marymount",2.5,"400993187"
43,1,"15:13",2113,"Official TV Timeout",6,15,"Portland St","Loyola Marymount",2.5,"400993187"
44,1,"14:56",2096,"James Batemon missed Jumper.",6,15,"Portland St","Loyola Marymount",2.5,"400993187"
45,1,"14:56",2096,"Mattias Markusson Offensive Rebound.",6,15,"Portland St","Loyola Marymount",2.5,"400993187"
46,1,"14:56",2096,"Cameron Allen Turnover.",6,15,"Portland St","Loyola Marymount",2.5,"400993187"
47,1,"14:46",2086,"Foul on Jeffery McClendon.",6,15,"Portland St","Loyola Marymount",2.5,"400993187"
48,1,"14:35",2075,"Michael Mayhew missed Three Point Jumper.",6,15,"Portland St","Loyola Marymount",2.5,"400993187"
49,1,"14:35",2075,"Holland Woods Offensive Rebound.",6,15,"Portland St","Loyola Marymount",2.5,"400993187"
50,1,"14:29",2069,"Jamie Orme missed Layup.",6,15,"Portland St","Loyola Marymount",2.5,"400993187"
51,1,"14:29",2069,"Eli Scott Block.",6,15,"Portland St","Loyola Marymount",2.5,"400993187"
52,1,"14:27",2067,"James Batemon Defensive Rebound.",6,15,"Portland St","Loyola Marymount",2.5,"400993187"
53,1,"14:18",2058,"Foul on Brendan Rumel.",6,15,"Portland St","Loyola Marymount",2.5,"400993187"
54,1,"14:18",2058,"James Batemon made Free Throw.",7,15,"Portland St","Loyola Marymount",2.5,"400993187"
55,1,"14:18",2058,"James Batemon made Free Throw.",8,15,"Portland St","Loyola Marymount",2.5,"400993187"
56,1,"14:05",2045,"Foul on Zafir Williams.",8,15,"Portland St","Loyola Marymount",2.5,"400993187"
57,1,"14:05",2045,"Ryan Edwards made Free Throw.",8,16,"Portland St","Loyola Marymount",2.5,"400993187"
58,1,"14:05",2045,"Ryan Edwards missed Free Throw.",8,16,"Portland St","Loyola Marymount",2.5,"400993187"
59,1,"14:05",2045,"Eli Scott Defensive Rebound.",8,16,"Portland St","Loyola Marymount",2.5,"400993187"
60,1,"13:54",2034,"Steven Haney missed Jumper.",8,16,"Portland St","Loyola Marymount",2.5,"400993187"
61,1,"13:54",2034,"Eli Scott Offensive Rebound.",8,16,"Portland St","Loyola Marymount",2.5,"400993187"
62,1,"13:50",2030,"Eli Scott missed Layup.",8,16,"Portland St","Loyola Marymount",2.5,"400993187"
63,1,"13:50",2030,"Ryan Edwards Block.",8,16,"Portland St","Loyola Marymount",2.5,"400993187"
64,1,"13:50",2030,"Loyola Marymount Offensive Rebound.",8,16,"Portland St","Loyola Marymount",2.5,"400993187"
65,1,"13:35",2015,"Cameron Allen Turnover.",8,16,"Portland St","Loyola Marymount",2.5,"400993187"
66,1,"13:34",2014,"Jamie Orme Steal.",8,16,"Portland St","Loyola Marymount",2.5,"400993187"
67,1,"13:31",2011,"Jamie Orme Turnover.",8,16,"Portland St","Loyola Marymount",2.5,"400993187"
68,1,"13:31",2011,"Foul on Jamie Orme.",8,16,"Portland St","Loyola Marymount",2.5,"400993187"
69,1,"13:26",2006,"Donald Gipson Turnover.",8,16,"Portland St","Loyola Marymount",2.5,"400993187"
70,1,"13:25",2005,"Holland Woods Steal.",8,16,"Portland St","Loyola Marymount",2.5,"400993187"
71,1,"13:24",2004,"Deontae North missed Layup.",8,16,"Portland St","Loyola Marymount",2.5,"400993187"
72,1,"13:24",2004,"Eli Scott Defensive Rebound.",8,16,"Portland St","Loyola Marymount",2.5,"400993187"
73,1,"13:19",1999,"Eli Scott Turnover.",8,16,"Portland St","Loyola Marymount",2.5,"400993187"
74,1,"13:18",1998,"Michael Mayhew Steal.",8,16,"Portland St","Loyola Marymount",2.5,"400993187"
75,1,"13:16",1996,"Michael Mayhew made Jumper.",8,18,"Portland St","Loyola Marymount",2.5,"400993187"
76,1,"13:12",1992,"Foul on Michael Mayhew.",8,18,"Portland St","Loyola Marymount",2.5,"400993187"
77,1,"13:04",1984,"Zafir Williams made Jumper. Assisted by Donald Gipson.",10,18,"Portland St","Loyola Marymount",2.5,"400993187"
78,1,"13:01",1981,"Foul on Donald Gipson.",10,18,"Portland St","Loyola Marymount",2.5,"400993187"
79,1,"12:46",1966,"Ryan Edwards missed Layup.",10,18,"Portland St","Loyola Marymount",2.5,"400993187"
80,1,"12:46",1966,"James Batemon Defensive Rebound.",10,18,"Portland St","Loyola Marymount",2.5,"400993187"
81,1,"12:40",1960,"Foul on Ryan Edwards.",10,18,"Portland St","Loyola Marymount",2.5,"400993187"
82,1,"12:40",1960,"James Batemon made Free Throw.",11,18,"Portland St","Loyola Marymount",2.5,"400993187"
83,1,"12:40",1960,"James Batemon made Free Throw.",12,18,"Portland St","Loyola Marymount",2.5,"400993187"
84,1,"12:32",1952,"Ryan Edwards Turnover.",12,18,"Portland St","Loyola Marymount",2.5,"400993187"
85,1,"12:32",1952,"Foul on Ryan Edwards.",12,18,"Portland St","Loyola Marymount",2.5,"400993187"
86,1,"12:25",1945,"Steven Haney made Layup. Assisted by James Batemon.",14,18,"Portland St","Loyola Marymount",2.5,"400993187"
87,1,"12:12",1932,"Deontae North missed Layup.",14,18,"Portland St","Loyola Marymount",2.5,"400993187"
88,1,"12:12",1932,"Steven Haney Defensive Rebound.",14,18,"Portland St","Loyola Marymount",2.5,"400993187"
89,1,"12:09",1929,"Foul on Brandon Hollins.",14,18,"Portland St","Loyola Marymount",2.5,"400993187"
90,1,"12:09",1929,"Steven Haney missed Free Throw.",14,18,"Portland St","Loyola Marymount",2.5,"400993187"
91,1,"12:09",1929,"Deante Strickland Defensive Rebound.",14,18,"Portland St","Loyola Marymount",2.5,"400993187"
92,1,"12:06",1926,"Foul on Jeffery McClendon.",14,18,"Portland St","Loyola Marymount",2.5,"400993187"
93,1,"11:54",1914,"Michael Mayhew Turnover.",14,18,"Portland St","Loyola Marymount",2.5,"400993187"
94,1,"11:48",1908,"James Batemon Turnover.",14,18,"Portland St","Loyola Marymount",2.5,"400993187"
95,1,"11:46",1906,"Jamie Orme Steal.",14,18,"Portland St","Loyola Marymount",2.5,"400993187"
96,1,"11:45",1905,"Deontae North missed Dunk.",14,18,"Portland St","Loyola Marymount",2.5,"400993187"
97,1,"11:45",1905,"Eli Scott Block.",14,18,"Portland St","Loyola Marymount",2.5,"400993187"
98,1,"11:43",1903,"Eli Scott Defensive Rebound.",14,18,"Portland St","Loyola Marymount",2.5,"400993187"
