"play_id","half","time_remaining_half","secs_remaining","description","home_score","away_score","away","home","home_favored_by","game_id"
242,2,"15:23",923,"Brandon Goldsmith Defensive Rebound.",68,35,"Warren Wilson","North Carolina Central",NA,"400992811"
243,2,"15:10",910,"Pablo Rivas missed Layup.",68,35,"Warren Wilson","North Carolina Central",NA,"400992811"
244,2,"15:10",910,"Lukas Juozapavicius Defensive Rebound.",68,35,"Warren Wilson","North Carolina Central",NA,"400992811"
245,2,"14:57",897,"Lukas Juozapavicius missed Three Point Jumper.",68,35,"Warren Wilson","North Carolina Central",NA,"400992811"
246,2,"14:57",897,"Pablo Rivas Defensive Rebound.",68,35,"Warren Wilson","North Carolina Central",NA,"400992811"
247,2,"14:51",891,"Raasean Davis missed Layup.",68,35,"Warren Wilson","North Carolina Central",NA,"400992811"
248,2,"14:51",891,"Tyquavion Dix Defensive Rebound.",68,35,"Warren Wilson","North Carolina Central",NA,"400992811"
249,2,"14:45",885,"Tyquavion Dix made Layup.",68,37,"Warren Wilson","North Carolina Central",NA,"400992811"
250,2,"14:19",859,"Foul on Lukas Juozapavicius.",68,37,"Warren Wilson","North Carolina Central",NA,"400992811"
251,2,"14:18",858,"Pablo Rivas missed Jumper.",68,37,"Warren Wilson","North Carolina Central",NA,"400992811"
252,2,"14:18",858,"Tyquavion Dix Defensive Rebound.",68,37,"Warren Wilson","North Carolina Central",NA,"400992811"
253,2,"14:05",845,"Lukas Juozapavicius made Three Point Jumper. Assisted by Kahlon Whitley.",68,40,"Warren Wilson","North Carolina Central",NA,"400992811"
254,2,"13:52",832,"Jordan Perkins missed Three Point Jumper.",68,40,"Warren Wilson","North Carolina Central",NA,"400992811"
255,2,"13:52",832,"Raasean Davis Offensive Rebound.",68,40,"Warren Wilson","North Carolina Central",NA,"400992811"
256,2,"13:44",824,"Raasean Davis missed Jumper.",68,40,"Warren Wilson","North Carolina Central",NA,"400992811"
257,2,"13:44",824,"Tyquavion Dix Defensive Rebound.",68,40,"Warren Wilson","North Carolina Central",NA,"400992811"
258,2,"13:43",823,"Foul on Raasean Davis.",68,40,"Warren Wilson","North Carolina Central",NA,"400992811"
259,2,"13:36",816,"Tyquavion Dix missed Jumper.",68,40,"Warren Wilson","North Carolina Central",NA,"400992811"
260,2,"13:36",816,"Pablo Rivas Defensive Rebound.",68,40,"Warren Wilson","North Carolina Central",NA,"400992811"
261,2,"13:29",809,"Alston Jones missed Jumper.",68,40,"Warren Wilson","North Carolina Central",NA,"400992811"
262,2,"13:29",809,"Jordan Perkins Offensive Rebound.",68,40,"Warren Wilson","North Carolina Central",NA,"400992811"
263,2,"13:26",806,"Jordan Perkins made Two Point Tip Shot.",70,40,"Warren Wilson","North Carolina Central",NA,"400992811"
264,2,"13:10",790,"Marques Sullivan missed Layup.",70,40,"Warren Wilson","North Carolina Central",NA,"400992811"
265,2,"13:10",790,"Raasean Davis Defensive Rebound.",70,40,"Warren Wilson","North Carolina Central",NA,"400992811"
266,2,"12:49",769,"Pablo Rivas missed Three Point Jumper.",70,40,"Warren Wilson","North Carolina Central",NA,"400992811"
267,2,"12:49",769,"Tyquavion Dix Defensive Rebound.",70,40,"Warren Wilson","North Carolina Central",NA,"400992811"
268,2,"12:40",760,"Kahlon Whitley made Layup.",70,42,"Warren Wilson","North Carolina Central",NA,"400992811"
269,2,"12:22",742,"Brandon Goldsmith Turnover.",70,42,"Warren Wilson","North Carolina Central",NA,"400992811"
270,2,"12:07",727,"Lukas Juozapavicius made Three Point Jumper. Assisted by Kahlon Whitley.",70,45,"Warren Wilson","North Carolina Central",NA,"400992811"
271,2,"12:04",724,"Warren Wilson  Timeout",70,45,"Warren Wilson","North Carolina Central",NA,"400992811"
272,2,"12:04",724,"Official TV Timeout",70,45,"Warren Wilson","North Carolina Central",NA,"400992811"
273,2,"11:52",712,"Alston Jones made Three Point Jumper.",73,45,"Warren Wilson","North Carolina Central",NA,"400992811"
274,2,"11:38",698,"Foul on Jordan Perkins.",73,45,"Warren Wilson","North Carolina Central",NA,"400992811"
275,2,"11:38",698,"Official TV Timeout",73,45,"Warren Wilson","North Carolina Central",NA,"400992811"
276,2,"11:24",684,"Lukas Juozapavicius Turnover.",73,45,"Warren Wilson","North Carolina Central",NA,"400992811"
277,2,"11:12",672,"Dominique Reid missed Jumper.",73,45,"Warren Wilson","North Carolina Central",NA,"400992811"
278,2,"11:12",672,"Jordan Gant Defensive Rebound.",73,45,"Warren Wilson","North Carolina Central",NA,"400992811"
279,2,"11:02",662,"Lukas Juozapavicius missed Three Point Jumper.",73,45,"Warren Wilson","North Carolina Central",NA,"400992811"
280,2,"11:02",662,"Pablo Rivas Defensive Rebound.",73,45,"Warren Wilson","North Carolina Central",NA,"400992811"
281,2,"10:51",651,"Reginald Gardner Jr missed Layup.",73,45,"Warren Wilson","North Carolina Central",NA,"400992811"
282,2,"10:51",651,"Marques Sullivan Block.",73,45,"Warren Wilson","North Carolina Central",NA,"400992811"
283,2,"10:50",650,"Tyquavion Dix Defensive Rebound.",73,45,"Warren Wilson","North Carolina Central",NA,"400992811"
284,2,"10:46",646,"Tyquavion Dix missed Layup.",73,45,"Warren Wilson","North Carolina Central",NA,"400992811"
285,2,"10:46",646,"Pablo Rivas Defensive Rebound.",73,45,"Warren Wilson","North Carolina Central",NA,"400992811"
286,2,"10:39",639,"Dominique Reid Turnover.",73,45,"Warren Wilson","North Carolina Central",NA,"400992811"
287,2,"10:31",631,"Kahlon Whitley missed Jumper.",73,45,"Warren Wilson","North Carolina Central",NA,"400992811"
288,2,"10:31",631,"Zacarry Douglas Defensive Rebound.",73,45,"Warren Wilson","North Carolina Central",NA,"400992811"
289,2,"10:18",618,"Alston Jones Turnover.",73,45,"Warren Wilson","North Carolina Central",NA,"400992811"
290,2,"10:02",602,"Jordan Gant made Three Point Jumper. Assisted by Michael Pomeroy.",73,48,"Warren Wilson","North Carolina Central",NA,"400992811"
291,2,"9:41",581,"Pablo Rivas made Three Point Jumper. Assisted by C.J. Wiggins.",76,48,"Warren Wilson","North Carolina Central",NA,"400992811"
292,2,"9:28",568,"Jordan Gant made Three Point Jumper.",76,51,"Warren Wilson","North Carolina Central",NA,"400992811"
293,2,"9:07",547,"Alex Mills missed Three Point Jumper.",76,51,"Warren Wilson","North Carolina Central",NA,"400992811"
294,2,"9:07",547,"Zacarry Douglas Offensive Rebound.",76,51,"Warren Wilson","North Carolina Central",NA,"400992811"
295,2,"8:58",538,"Zacarry Douglas made Layup.",78,51,"Warren Wilson","North Carolina Central",NA,"400992811"
296,2,"8:54",534,"Kahlon Whitley made Three Point Jumper. Assisted by Marques Sullivan.",78,54,"Warren Wilson","North Carolina Central",NA,"400992811"
297,2,"8:40",520,"Pablo Rivas made Dunk. Assisted by Brandon Goldsmith.",80,54,"Warren Wilson","North Carolina Central",NA,"400992811"
298,2,"8:40",520,"Foul on Tyquavion Dix.",80,54,"Warren Wilson","North Carolina Central",NA,"400992811"
299,2,"8:40",520,"Pablo Rivas made Free Throw.",81,54,"Warren Wilson","North Carolina Central",NA,"400992811"
300,2,"8:21",501,"Tyquavion Dix made Layup. Assisted by Marques Sullivan.",81,56,"Warren Wilson","North Carolina Central",NA,"400992811"
301,2,"8:00",480,"Brandon Goldsmith made Jumper.",83,56,"Warren Wilson","North Carolina Central",NA,"400992811"
302,2,"7:43",463,"Tyquavion Dix made Layup.",83,58,"Warren Wilson","North Carolina Central",NA,"400992811"
303,2,"7:39",459,"Official TV Timeout",83,58,"Warren Wilson","North Carolina Central",NA,"400992811"
304,2,"7:17",437,"C.J. Wiggins missed Three Point Jumper.",83,58,"Warren Wilson","North Carolina Central",NA,"400992811"
305,2,"7:17",437,"Zacarry Douglas Offensive Rebound.",83,58,"Warren Wilson","North Carolina Central",NA,"400992811"
306,2,"7:11",431,"Jordan Perkins made Three Point Jumper. Assisted by C.J. Wiggins.",86,58,"Warren Wilson","North Carolina Central",NA,"400992811"
307,2,"6:55",415,"Tyquavion Dix missed Jumper.",86,58,"Warren Wilson","North Carolina Central",NA,"400992811"
308,2,"6:55",415,"Zacarry Douglas Defensive Rebound.",86,58,"Warren Wilson","North Carolina Central",NA,"400992811"
309,2,"6:47",407,"C.J. Wiggins missed Jumper.",86,58,"Warren Wilson","North Carolina Central",NA,"400992811"
310,2,"6:47",407,"Marques Sullivan Defensive Rebound.",86,58,"Warren Wilson","North Carolina Central",NA,"400992811"
311,2,"6:36",396,"Tyquavion Dix made Layup.",86,60,"Warren Wilson","North Carolina Central",NA,"400992811"
312,2,"6:36",396,"Foul on Jordan Perkins.",86,60,"Warren Wilson","North Carolina Central",NA,"400992811"
313,2,"6:36",396,"Tyquavion Dix missed Free Throw.",86,60,"Warren Wilson","North Carolina Central",NA,"400992811"
314,2,"6:36",396,"Zacarry Douglas Defensive Rebound.",86,60,"Warren Wilson","North Carolina Central",NA,"400992811"
315,2,"6:09",369,"C.J. Wiggins made Three Point Jumper. Assisted by Jordan Perkins.",89,60,"Warren Wilson","North Carolina Central",NA,"400992811"
316,2,"5:54",354,"Foul on Dominique Reid.",89,60,"Warren Wilson","North Carolina Central",NA,"400992811"
317,2,"5:49",349,"Jordan Gant missed Three Point Jumper.",89,60,"Warren Wilson","North Carolina Central",NA,"400992811"
318,2,"5:49",349,"Dominique Reid Defensive Rebound.",89,60,"Warren Wilson","North Carolina Central",NA,"400992811"
319,2,"5:33",333,"Brandon Goldsmith missed Three Point Jumper.",89,60,"Warren Wilson","North Carolina Central",NA,"400992811"
320,2,"5:33",333,"Pablo Rivas Offensive Rebound.",89,60,"Warren Wilson","North Carolina Central",NA,"400992811"
321,2,"5:28",328,"Pablo Rivas made Jumper.",91,60,"Warren Wilson","North Carolina Central",NA,"400992811"
322,2,"5:19",319,"Marques Sullivan Turnover.",91,60,"Warren Wilson","North Carolina Central",NA,"400992811"
323,2,"5:18",318,"John Guerra Steal.",91,60,"Warren Wilson","North Carolina Central",NA,"400992811"
324,2,"5:13",313,"C.J. Wiggins made Layup. Assisted by Dominique Reid.",93,60,"Warren Wilson","North Carolina Central",NA,"400992811"
325,2,"4:59",299,"Kahlon Whitley made Layup.",93,62,"Warren Wilson","North Carolina Central",NA,"400992811"
326,2,"4:35",275,"Brandon Goldsmith missed Layup.",93,62,"Warren Wilson","North Carolina Central",NA,"400992811"
327,2,"4:35",275,"John Guerra Offensive Rebound.",93,62,"Warren Wilson","North Carolina Central",NA,"400992811"
328,2,"4:26",266,"C.J. Wiggins missed Three Point Jumper.",93,62,"Warren Wilson","North Carolina Central",NA,"400992811"
329,2,"4:26",266,"Kahlon Whitley Defensive Rebound.",93,62,"Warren Wilson","North Carolina Central",NA,"400992811"
330,2,"4:21",261,"Kahlon Whitley Turnover.",93,62,"Warren Wilson","North Carolina Central",NA,"400992811"
331,2,"4:01",241,"Reginald Gardner Jr missed Three Point Jumper.",93,62,"Warren Wilson","North Carolina Central",NA,"400992811"
332,2,"4:01",241,"Tyquavion Dix Defensive Rebound.",93,62,"Warren Wilson","North Carolina Central",NA,"400992811"
333,2,"3:52",232,"Tyquavion Dix made Jumper.",93,64,"Warren Wilson","North Carolina Central",NA,"400992811"
334,2,"3:43",223,"Foul on Marques Sullivan.",93,64,"Warren Wilson","North Carolina Central",NA,"400992811"
335,2,"3:43",223,"Official TV Timeout",93,64,"Warren Wilson","North Carolina Central",NA,"400992811"
336,2,"3:31",211,"Larry McKnight Jr. missed Jumper.",93,64,"Warren Wilson","North Carolina Central",NA,"400992811"
337,2,"3:31",211,"Merault Almonor Defensive Rebound.",93,64,"Warren Wilson","North Carolina Central",NA,"400992811"
338,2,"3:22",202,"Foul on Dominique Reid.",93,64,"Warren Wilson","North Carolina Central",NA,"400992811"
339,2,"3:22",202,"Tyquavion Dix made Free Throw.",93,65,"Warren Wilson","North Carolina Central",NA,"400992811"
340,2,"3:22",202,"Tyquavion Dix missed Free Throw.",93,65,"Warren Wilson","North Carolina Central",NA,"400992811"
341,2,"3:22",202,"Pablo Rivas Defensive Rebound.",93,65,"Warren Wilson","North Carolina Central",NA,"400992811"
342,2,"3:10",190,"Larry McKnight Jr. missed Three Point Jumper.",93,65,"Warren Wilson","North Carolina Central",NA,"400992811"
343,2,"3:10",190,"Pablo Rivas Offensive Rebound.",93,65,"Warren Wilson","North Carolina Central",NA,"400992811"
344,2,"3:04",184,"Larry McKnight Jr. missed Layup.",93,65,"Warren Wilson","North Carolina Central",NA,"400992811"
345,2,"3:04",184,"Pablo Rivas Offensive Rebound.",93,65,"Warren Wilson","North Carolina Central",NA,"400992811"
346,2,"3:01",181,"Pablo Rivas made Layup.",95,65,"Warren Wilson","North Carolina Central",NA,"400992811"
347,2,"2:52",172,"Tyquavion Dix made Layup.",95,67,"Warren Wilson","North Carolina Central",NA,"400992811"
348,2,"2:52",172,"Foul on Larry McKnight Jr..",95,67,"Warren Wilson","North Carolina Central",NA,"400992811"
349,2,"2:52",172,"Tyquavion Dix missed Free Throw.",95,67,"Warren Wilson","North Carolina Central",NA,"400992811"
350,2,"2:52",172,"Lukas Juozapavicius Offensive Rebound.",95,67,"Warren Wilson","North Carolina Central",NA,"400992811"
351,2,"2:46",166,"Tyquavion Dix Turnover.",95,67,"Warren Wilson","North Carolina Central",NA,"400992811"
352,2,"2:31",151,"Pablo Rivas made Three Point Jumper. Assisted by John Guerra.",98,67,"Warren Wilson","North Carolina Central",NA,"400992811"
353,2,"2:15",135,"Lukas Juozapavicius missed Three Point Jumper.",98,67,"Warren Wilson","North Carolina Central",NA,"400992811"
354,2,"2:15",135,"Dominique Reid Defensive Rebound.",98,67,"Warren Wilson","North Carolina Central",NA,"400992811"
355,2,"1:47",107,"Dominique Reid missed Layup.",98,67,"Warren Wilson","North Carolina Central",NA,"400992811"
356,2,"1:47",107,"Marques Sullivan Defensive Rebound.",98,67,"Warren Wilson","North Carolina Central",NA,"400992811"
357,2,"1:39",99,"Michael Pomeroy made Three Point Jumper. Assisted by Marques Sullivan.",98,70,"Warren Wilson","North Carolina Central",NA,"400992811"
358,2,"1:13",73,"Foul on Merault Almonor.",98,70,"Warren Wilson","North Carolina Central",NA,"400992811"
359,2,"1:13",73,"John Guerra missed Free Throw.",98,70,"Warren Wilson","North Carolina Central",NA,"400992811"
360,2,"1:13",73,"North Carolina Central Deadball Team Rebound.",98,70,"Warren Wilson","North Carolina Central",NA,"400992811"
361,2,"1:13",73,"John Guerra made Free Throw.",99,70,"Warren Wilson","North Carolina Central",NA,"400992811"
362,2,"1:04",64,"Lukas Juozapavicius made Three Point Jumper. Assisted by Tyquavion Dix.",99,73,"Warren Wilson","North Carolina Central",NA,"400992811"
363,2,"0:46",46,"Dominique Reid made Jumper. Assisted by Alston Jones.",101,73,"Warren Wilson","North Carolina Central",NA,"400992811"
364,2,"0:36",36,"Tyquavion Dix made Layup.",101,75,"Warren Wilson","North Carolina Central",NA,"400992811"
365,2,"0:35",35,"Foul on Dominique Reid.",101,75,"Warren Wilson","North Carolina Central",NA,"400992811"
366,2,"0:35",35,"Tyquavion Dix made Free Throw.",101,76,"Warren Wilson","North Carolina Central",NA,"400992811"
367,2,"0:21",21,"Larry McKnight Jr. missed Three Point Jumper.",101,76,"Warren Wilson","North Carolina Central",NA,"400992811"
368,2,"0:21",21,"Tyquavion Dix Defensive Rebound.",101,76,"Warren Wilson","North Carolina Central",NA,"400992811"
369,2,"0:13",13,"Tyquavion Dix missed Dunk.",101,76,"Warren Wilson","North Carolina Central",NA,"400992811"
370,2,"0:13",13,"North Carolina Central Defensive Rebound.",101,76,"Warren Wilson","North Carolina Central",NA,"400992811"
371,2,"0:00",0,"End of Game",103,74,"Warren Wilson","North Carolina Central",NA,"400992811"
1,1,"20:00",2400,"PLAY",0,0,"Southern","North Carolina Central",NA,"400992812"
2,1,"19:33",2373,"Foul on Jared Sam.",0,0,"Southern","North Carolina Central",NA,"400992812"
3,1,"19:33",2373,"Raasean Davis missed Free Throw.",0,0,"Southern","North Carolina Central",NA,"400992812"
4,1,"19:33",2373,"North Carolina Central Deadball Team Rebound.",0,0,"Southern","North Carolina Central",NA,"400992812"
5,1,"19:33",2373,"Raasean Davis made Free Throw.",1,0,"Southern","North Carolina Central",NA,"400992812"
6,1,"19:27",2367,"Foul on Raasean Davis.",1,0,"Southern","North Carolina Central",NA,"400992812"
7,1,"19:27",2367,"Chris Thomas made Free Throw.",1,1,"Southern","North Carolina Central",NA,"400992812"
8,1,"19:27",2367,"Chris Thomas made Free Throw.",1,2,"Southern","North Carolina Central",NA,"400992812"
9,1,"18:58",2338,"Brandon Goldsmith missed Three Point Jumper.",1,2,"Southern","North Carolina Central",NA,"400992812"
10,1,"18:58",2338,"Zacarry Douglas Offensive Rebound.",1,2,"Southern","North Carolina Central",NA,"400992812"
11,1,"18:52",2332,"Zacarry Douglas made Layup.",3,2,"Southern","North Carolina Central",NA,"400992812"
12,1,"18:25",2305,"Jamar Sandifer missed Jumper.",3,2,"Southern","North Carolina Central",NA,"400992812"
13,1,"18:25",2305,"Raasean Davis Defensive Rebound.",3,2,"Southern","North Carolina Central",NA,"400992812"
14,1,"18:13",2293,"Raasean Davis Turnover.",3,2,"Southern","North Carolina Central",NA,"400992812"
15,1,"17:53",2273,"Eddie Reese made Three Point Jumper. Assisted by Jamar Sandifer.",3,5,"Southern","North Carolina Central",NA,"400992812"
16,1,"17:31",2251,"Reginald Gardner Jr made Layup.",5,5,"Southern","North Carolina Central",NA,"400992812"
17,1,"17:15",2235,"Emanual Shepherd missed Layup.",5,5,"Southern","North Carolina Central",NA,"400992812"
18,1,"17:15",2235,"Raasean Davis Block.",5,5,"Southern","North Carolina Central",NA,"400992812"
19,1,"17:14",2234,"Zacarry Douglas Defensive Rebound.",5,5,"Southern","North Carolina Central",NA,"400992812"
20,1,"17:11",2231,"Reginald Gardner Jr made Layup.",7,5,"Southern","North Carolina Central",NA,"400992812"
21,1,"16:52",2212,"Foul on Brandon Goldsmith.",7,5,"Southern","North Carolina Central",NA,"400992812"
22,1,"16:46",2206,"Jared Sam made Layup. Assisted by Eddie Reese.",7,7,"Southern","North Carolina Central",NA,"400992812"
23,1,"16:29",2189,"C.J. Wiggins Turnover.",7,7,"Southern","North Carolina Central",NA,"400992812"
24,1,"16:14",2174,"Jamar Sandifer missed Jumper.",7,7,"Southern","North Carolina Central",NA,"400992812"
25,1,"16:14",2174,"Chris Thomas Offensive Rebound.",7,7,"Southern","North Carolina Central",NA,"400992812"
26,1,"16:10",2170,"Chris Thomas made Layup.",7,9,"Southern","North Carolina Central",NA,"400992812"
27,1,"16:10",2170,"Foul on Brandon Goldsmith.",7,9,"Southern","North Carolina Central",NA,"400992812"
28,1,"16:10",2170,"Chris Thomas made Free Throw.",7,10,"Southern","North Carolina Central",NA,"400992812"
29,1,"15:48",2148,"Raasean Davis Turnover.",7,10,"Southern","North Carolina Central",NA,"400992812"
30,1,"15:47",2147,"Official TV Timeout",7,10,"Southern","North Carolina Central",NA,"400992812"
31,1,"15:30",2130,"Eddie Reese missed Three Point Jumper.",7,10,"Southern","North Carolina Central",NA,"400992812"
32,1,"15:30",2130,"Jamar Sandifer Offensive Rebound.",7,10,"Southern","North Carolina Central",NA,"400992812"
33,1,"15:22",2122,"Chris Thomas missed Jumper.",7,10,"Southern","North Carolina Central",NA,"400992812"
34,1,"15:22",2122,"Emanual Shepherd Offensive Rebound.",7,10,"Southern","North Carolina Central",NA,"400992812"
35,1,"15:19",2119,"Emanual Shepherd missed Two Point Tip Shot.",7,10,"Southern","North Carolina Central",NA,"400992812"
36,1,"15:19",2119,"Raasean Davis Defensive Rebound.",7,10,"Southern","North Carolina Central",NA,"400992812"
37,1,"15:06",2106,"Zacarry Douglas missed Three Point Jumper.",7,10,"Southern","North Carolina Central",NA,"400992812"
38,1,"15:06",2106,"Jamar Sandifer Defensive Rebound.",7,10,"Southern","North Carolina Central",NA,"400992812"
39,1,"14:43",2083,"Foul on Zacarry Douglas.",7,10,"Southern","North Carolina Central",NA,"400992812"
40,1,"14:42",2082,"Foul on Pablo Rivas.",7,10,"Southern","North Carolina Central",NA,"400992812"
41,1,"14:42",2082,"Jared Sam made Free Throw.",7,11,"Southern","North Carolina Central",NA,"400992812"
42,1,"14:42",2082,"Jared Sam made Free Throw.",7,12,"Southern","North Carolina Central",NA,"400992812"
43,1,"14:26",2066,"Pablo Rivas missed Three Point Jumper.",7,12,"Southern","North Carolina Central",NA,"400992812"
44,1,"14:26",2066,"Eddie Reese Defensive Rebound.",7,12,"Southern","North Carolina Central",NA,"400992812"
45,1,"14:17",2057,"Richard Lee made Jumper.",7,14,"Southern","North Carolina Central",NA,"400992812"
46,1,"13:51",2031,"Reginald Gardner Jr missed Three Point Jumper.",7,14,"Southern","North Carolina Central",NA,"400992812"
47,1,"13:51",2031,"Richard Lee Defensive Rebound.",7,14,"Southern","North Carolina Central",NA,"400992812"
48,1,"13:41",2021,"Richard Lee Turnover.",7,14,"Southern","North Carolina Central",NA,"400992812"
49,1,"13:39",2019,"C.J. Wiggins Steal.",7,14,"Southern","North Carolina Central",NA,"400992812"
50,1,"13:36",2016,"Reginald Gardner Jr missed Three Point Jumper.",7,14,"Southern","North Carolina Central",NA,"400992812"
51,1,"13:36",2016,"Eddie Reese Defensive Rebound.",7,14,"Southern","North Carolina Central",NA,"400992812"
52,1,"13:26",2006,"Eddie Reese Turnover.",7,14,"Southern","North Carolina Central",NA,"400992812"
53,1,"13:09",1989,"Foul on Jared Sam.",7,14,"Southern","North Carolina Central",NA,"400992812"
54,1,"13:00",1980,"Raasean Davis missed Jumper.",7,14,"Southern","North Carolina Central",NA,"400992812"
55,1,"13:00",1980,"Jamar Sandifer Defensive Rebound.",7,14,"Southern","North Carolina Central",NA,"400992812"
56,1,"12:47",1967,"Foul on Alston Jones.",7,14,"Southern","North Carolina Central",NA,"400992812"
57,1,"12:29",1949,"Eddie Reese missed Jumper.",7,14,"Southern","North Carolina Central",NA,"400992812"
58,1,"12:29",1949,"Pablo Rivas Defensive Rebound.",7,14,"Southern","North Carolina Central",NA,"400992812"
59,1,"12:20",1940,"Jordan Perkins missed Three Point Jumper.",7,14,"Southern","North Carolina Central",NA,"400992812"
60,1,"12:20",1940,"Raasean Davis Offensive Rebound.",7,14,"Southern","North Carolina Central",NA,"400992812"
61,1,"12:17",1937,"Raasean Davis made Two Point Tip Shot.",9,14,"Southern","North Carolina Central",NA,"400992812"
62,1,"11:55",1915,"Eddie Reese Turnover.",9,14,"Southern","North Carolina Central",NA,"400992812"
63,1,"11:28",1888,"Pablo Rivas made Three Point Jumper. Assisted by Alston Jones.",12,14,"Southern","North Carolina Central",NA,"400992812"
64,1,"10:59",1859,"Shaquille Benson made Jumper.",12,16,"Southern","North Carolina Central",NA,"400992812"
65,1,"10:43",1843,"Larry McKnight Jr. missed Three Point Jumper.",12,16,"Southern","North Carolina Central",NA,"400992812"
66,1,"10:43",1843,"Eddie Reese Defensive Rebound.",12,16,"Southern","North Carolina Central",NA,"400992812"
67,1,"10:31",1831,"Richard Lee missed Jumper.",12,16,"Southern","North Carolina Central",NA,"400992812"
68,1,"10:31",1831,"Pablo Rivas Defensive Rebound.",12,16,"Southern","North Carolina Central",NA,"400992812"
69,1,"10:25",1825,"Foul on Torrey Mayo.",12,16,"Southern","North Carolina Central",NA,"400992812"
70,1,"10:25",1825,"Official TV Timeout",12,16,"Southern","North Carolina Central",NA,"400992812"
71,1,"10:11",1811,"Pablo Rivas made Three Point Jumper. Assisted by Alston Jones.",15,16,"Southern","North Carolina Central",NA,"400992812"
72,1,"9:46",1786,"Foul on Pablo Rivas.",15,16,"Southern","North Carolina Central",NA,"400992812"
73,1,"9:46",1786,"Emanual Shepherd missed Free Throw.",15,16,"Southern","North Carolina Central",NA,"400992812"
74,1,"9:46",1786,"Southern Deadball Team Rebound.",15,16,"Southern","North Carolina Central",NA,"400992812"
75,1,"9:46",1786,"Emanual Shepherd made Free Throw.",15,17,"Southern","North Carolina Central",NA,"400992812"
76,1,"9:27",1767,"Reginald Gardner Jr Turnover.",15,17,"Southern","North Carolina Central",NA,"400992812"
77,1,"9:24",1764,"Shaquille Benson Steal.",15,17,"Southern","North Carolina Central",NA,"400992812"
78,1,"9:00",1740,"Jamar Sandifer missed Three Point Jumper.",15,17,"Southern","North Carolina Central",NA,"400992812"
79,1,"9:00",1740,"Raasean Davis Defensive Rebound.",15,17,"Southern","North Carolina Central",NA,"400992812"
80,1,"8:49",1729,"Alston Jones missed Jumper.",15,17,"Southern","North Carolina Central",NA,"400992812"
81,1,"8:49",1729,"Shaquille Benson Block.",15,17,"Southern","North Carolina Central",NA,"400992812"
82,1,"8:47",1727,"Jordan Perkins Offensive Rebound.",15,17,"Southern","North Carolina Central",NA,"400992812"
83,1,"8:43",1723,"Raasean Davis made Layup. Assisted by Jordan Perkins.",17,17,"Southern","North Carolina Central",NA,"400992812"
84,1,"8:13",1693,"Torrey Mayo missed Three Point Jumper.",17,17,"Southern","North Carolina Central",NA,"400992812"
85,1,"8:13",1693,"Pablo Rivas Defensive Rebound.",17,17,"Southern","North Carolina Central",NA,"400992812"
86,1,"7:51",1671,"Pablo Rivas missed Layup.",17,17,"Southern","North Carolina Central",NA,"400992812"
87,1,"7:51",1671,"Reginald Gardner Jr Offensive Rebound.",17,17,"Southern","North Carolina Central",NA,"400992812"
88,1,"7:39",1659,"Alston Jones made Three Point Jumper. Assisted by Reginald Gardner Jr.",20,17,"Southern","North Carolina Central",NA,"400992812"
89,1,"7:34",1654,"Southern  Timeout",20,17,"Southern","North Carolina Central",NA,"400992812"
90,1,"7:34",1654,"Official TV Timeout",20,17,"Southern","North Carolina Central",NA,"400992812"
91,1,"7:24",1644,"Eddie Reese Turnover.",20,17,"Southern","North Carolina Central",NA,"400992812"
92,1,"7:24",1644,"Raasean Davis Steal.",20,17,"Southern","North Carolina Central",NA,"400992812"
93,1,"7:11",1631,"Pablo Rivas missed Three Point Jumper.",20,17,"Southern","North Carolina Central",NA,"400992812"
94,1,"7:11",1631,"Raasean Davis Offensive Rebound.",20,17,"Southern","North Carolina Central",NA,"400992812"
95,1,"7:08",1628,"Raasean Davis made Two Point Tip Shot.",22,17,"Southern","North Carolina Central",NA,"400992812"
96,1,"6:47",1607,"LaQuentin Collins missed Three Point Jumper.",22,17,"Southern","North Carolina Central",NA,"400992812"
97,1,"6:47",1607,"Raasean Davis Defensive Rebound.",22,17,"Southern","North Carolina Central",NA,"400992812"
98,1,"6:25",1585,"Raasean Davis made Two Point Tip Shot.",24,17,"Southern","North Carolina Central",NA,"400992812"
99,1,"6:25",1585,"Foul on Emanual Shepherd.",24,17,"Southern","North Carolina Central",NA,"400992812"
