"play_id","half","time_remaining_half","secs_remaining","description","home_score","away_score","away","home","home_favored_by","game_id"
77,1,"8:17",1697,"Foul on Jonathan Dalton.",19,26,"North Carolina Central","Southeast Missouri State",NA,"400990906"
78,1,"8:09",1689,"Alston Jones made Layup.",19,28,"North Carolina Central","Southeast Missouri State",NA,"400990906"
79,1,"7:57",1677,"Southeast Missouri State  Timeout",19,28,"North Carolina Central","Southeast Missouri State",NA,"400990906"
80,1,"7:57",1677,"Foul on Alston Jones.",19,28,"North Carolina Central","Southeast Missouri State",NA,"400990906"
81,1,"7:40",1660,"Justin Carpenter missed Layup.",19,28,"North Carolina Central","Southeast Missouri State",NA,"400990906"
82,1,"7:40",1660,"Donnie Lewis Offensive Rebound.",19,28,"North Carolina Central","Southeast Missouri State",NA,"400990906"
83,1,"7:39",1659,"Foul on Pablo Rivas.",19,28,"North Carolina Central","Southeast Missouri State",NA,"400990906"
84,1,"7:39",1659,"Donnie Lewis missed Free Throw.",19,28,"North Carolina Central","Southeast Missouri State",NA,"400990906"
85,1,"7:39",1659,"Southeast Missouri State Deadball Team Rebound.",19,28,"North Carolina Central","Southeast Missouri State",NA,"400990906"
86,1,"7:39",1659,"Donnie Lewis made Free Throw.",20,28,"North Carolina Central","Southeast Missouri State",NA,"400990906"
87,1,"7:21",1641,"Jordan Perkins missed Three Point Jumper.",20,28,"North Carolina Central","Southeast Missouri State",NA,"400990906"
88,1,"7:21",1641,"Ray Kowalski Defensive Rebound.",20,28,"North Carolina Central","Southeast Missouri State",NA,"400990906"
89,1,"7:13",1633,"Ledarrius Brewer made Jumper.",22,28,"North Carolina Central","Southeast Missouri State",NA,"400990906"
90,1,"6:51",1611,"Dominique Reid made Jumper. Assisted by Jordan Perkins.",22,30,"North Carolina Central","Southeast Missouri State",NA,"400990906"
91,1,"6:26",1586,"Foul on Dominique Reid.",22,30,"North Carolina Central","Southeast Missouri State",NA,"400990906"
92,1,"6:26",1586,"Justin Carpenter made Free Throw.",23,30,"North Carolina Central","Southeast Missouri State",NA,"400990906"
93,1,"6:26",1586,"Justin Carpenter missed Free Throw.",23,30,"North Carolina Central","Southeast Missouri State",NA,"400990906"
94,1,"6:26",1586,"Zacarry Douglas Defensive Rebound.",23,30,"North Carolina Central","Southeast Missouri State",NA,"400990906"
95,1,"6:13",1573,"Reginald Gardner Jr Turnover.",23,30,"North Carolina Central","Southeast Missouri State",NA,"400990906"
96,1,"6:10",1570,"Justin Carpenter Steal.",23,30,"North Carolina Central","Southeast Missouri State",NA,"400990906"
97,1,"5:59",1559,"Denzel Mahoney made Jumper. Assisted by Justin Carpenter.",25,30,"North Carolina Central","Southeast Missouri State",NA,"400990906"
98,1,"5:39",1539,"Jordan Perkins missed Three Point Jumper.",25,30,"North Carolina Central","Southeast Missouri State",NA,"400990906"
99,1,"5:39",1539,"Justin Carpenter Defensive Rebound.",25,30,"North Carolina Central","Southeast Missouri State",NA,"400990906"
100,1,"5:25",1525,"Ledarrius Brewer missed Jumper.",25,30,"North Carolina Central","Southeast Missouri State",NA,"400990906"
101,1,"5:25",1525,"Reginald Gardner Jr Defensive Rebound.",25,30,"North Carolina Central","Southeast Missouri State",NA,"400990906"
102,1,"5:10",1510,"Raasean Davis made Layup.",25,32,"North Carolina Central","Southeast Missouri State",NA,"400990906"
103,1,"4:51",1491,"Denzel Mahoney missed Three Point Jumper.",25,32,"North Carolina Central","Southeast Missouri State",NA,"400990906"
104,1,"4:51",1491,"North Carolina Central Defensive Rebound.",25,32,"North Carolina Central","Southeast Missouri State",NA,"400990906"
105,1,"4:38",1478,"C.J. Wiggins made Three Point Jumper. Assisted by Jordan Perkins.",25,35,"North Carolina Central","Southeast Missouri State",NA,"400990906"
106,1,"4:13",1453,"Mark Laros missed Layup.",25,35,"North Carolina Central","Southeast Missouri State",NA,"400990906"
107,1,"4:13",1453,"Raasean Davis Defensive Rebound.",25,35,"North Carolina Central","Southeast Missouri State",NA,"400990906"
108,1,"4:07",1447,"C.J. Wiggins missed Jumper.",25,35,"North Carolina Central","Southeast Missouri State",NA,"400990906"
109,1,"4:07",1447,"Milos Vranes Defensive Rebound.",25,35,"North Carolina Central","Southeast Missouri State",NA,"400990906"
110,1,"3:54",1434,"Denzel Mahoney missed Jumper.",25,35,"North Carolina Central","Southeast Missouri State",NA,"400990906"
111,1,"3:54",1434,"Mark Laros Offensive Rebound.",25,35,"North Carolina Central","Southeast Missouri State",NA,"400990906"
112,1,"3:50",1430,"Mark Laros made Layup.",27,35,"North Carolina Central","Southeast Missouri State",NA,"400990906"
113,1,"3:24",1404,"Reginald Gardner Jr missed Three Point Jumper.",27,35,"North Carolina Central","Southeast Missouri State",NA,"400990906"
114,1,"3:24",1404,"Daniel Simmons Defensive Rebound.",27,35,"North Carolina Central","Southeast Missouri State",NA,"400990906"
115,1,"3:11",1391,"Foul on Raasean Davis.",27,35,"North Carolina Central","Southeast Missouri State",NA,"400990906"
116,1,"3:11",1391,"Official TV Timeout",27,35,"North Carolina Central","Southeast Missouri State",NA,"400990906"
117,1,"3:11",1391,"Daniel Simmons made Free Throw.",28,35,"North Carolina Central","Southeast Missouri State",NA,"400990906"
118,1,"3:11",1391,"Daniel Simmons missed Free Throw.",28,35,"North Carolina Central","Southeast Missouri State",NA,"400990906"
119,1,"3:11",1391,"Raasean Davis Defensive Rebound.",28,35,"North Carolina Central","Southeast Missouri State",NA,"400990906"
120,1,"2:46",1366,"Jordan Perkins made Jumper.",28,37,"North Carolina Central","Southeast Missouri State",NA,"400990906"
121,1,"2:29",1349,"Denzel Mahoney missed Jumper.",28,37,"North Carolina Central","Southeast Missouri State",NA,"400990906"
122,1,"2:29",1349,"Denzel Mahoney Offensive Rebound.",28,37,"North Carolina Central","Southeast Missouri State",NA,"400990906"
123,1,"2:23",1343,"Denzel Mahoney made Layup.",30,37,"North Carolina Central","Southeast Missouri State",NA,"400990906"
124,1,"1:58",1318,"Reginald Gardner Jr missed Three Point Jumper.",30,37,"North Carolina Central","Southeast Missouri State",NA,"400990906"
125,1,"1:58",1318,"Milos Vranes Defensive Rebound.",30,37,"North Carolina Central","Southeast Missouri State",NA,"400990906"
126,1,"1:48",1308,"Foul on Reginald Gardner Jr.",30,37,"North Carolina Central","Southeast Missouri State",NA,"400990906"
127,1,"1:48",1308,"Denzel Mahoney made Free Throw.",31,37,"North Carolina Central","Southeast Missouri State",NA,"400990906"
128,1,"1:48",1308,"Denzel Mahoney made Free Throw.",32,37,"North Carolina Central","Southeast Missouri State",NA,"400990906"
129,1,"1:34",1294,"Jordan Perkins Turnover.",32,37,"North Carolina Central","Southeast Missouri State",NA,"400990906"
130,1,"1:34",1294,"Foul on Jordan Perkins.",32,37,"North Carolina Central","Southeast Missouri State",NA,"400990906"
131,1,"1:17",1277,"Ledarrius Brewer Turnover.",32,37,"North Carolina Central","Southeast Missouri State",NA,"400990906"
132,1,"1:14",1274,"Zacarry Douglas Steal.",32,37,"North Carolina Central","Southeast Missouri State",NA,"400990906"
133,1,"1:14",1274,"Foul on Ledarrius Brewer.",32,37,"North Carolina Central","Southeast Missouri State",NA,"400990906"
134,1,"1:14",1274,"Jordan Perkins made Free Throw.",32,38,"North Carolina Central","Southeast Missouri State",NA,"400990906"
135,1,"1:14",1274,"Jordan Perkins made Free Throw.",32,39,"North Carolina Central","Southeast Missouri State",NA,"400990906"
136,1,"1:04",1264,"Milos Vranes missed Three Point Jumper.",32,39,"North Carolina Central","Southeast Missouri State",NA,"400990906"
137,1,"1:04",1264,"Larry McKnight Jr. Defensive Rebound.",32,39,"North Carolina Central","Southeast Missouri State",NA,"400990906"
138,1,"0:32",1232,"C.J. Wiggins made Jumper.",32,41,"North Carolina Central","Southeast Missouri State",NA,"400990906"
139,1,"0:11",1211,"Ray Kowalski missed Three Point Jumper.",32,41,"North Carolina Central","Southeast Missouri State",NA,"400990906"
140,1,"0:11",1211,"Denzel Mahoney Offensive Rebound.",32,41,"North Carolina Central","Southeast Missouri State",NA,"400990906"
141,1,"0:05",1205,"Denzel Mahoney missed Jumper.",32,41,"North Carolina Central","Southeast Missouri State",NA,"400990906"
142,1,"0:05",1205,"North Carolina Central Defensive Rebound.",32,41,"North Carolina Central","Southeast Missouri State",NA,"400990906"
143,1,"0:00",1200,"Jordan Perkins missed Jumper.",32,41,"North Carolina Central","Southeast Missouri State",NA,"400990906"
144,1,"0:00",1200,"Southeast Missouri State Defensive Rebound.",32,41,"North Carolina Central","Southeast Missouri State",NA,"400990906"
145,1,"0:00",1200,"End of 1st half",32,41,"North Carolina Central","Southeast Missouri State",NA,"400990906"
146,2,"20:00",1200,"PLAY",32,41,"North Carolina Central","Southeast Missouri State",NA,"400990906"
147,2,"19:50",1190,"Foul on Jordan Perkins.",32,41,"North Carolina Central","Southeast Missouri State",NA,"400990906"
148,2,"19:37",1177,"Denzel Mahoney missed Three Point Jumper.",32,41,"North Carolina Central","Southeast Missouri State",NA,"400990906"
149,2,"19:37",1177,"Jordan Perkins Defensive Rebound.",32,41,"North Carolina Central","Southeast Missouri State",NA,"400990906"
150,2,"19:26",1166,"Reginald Gardner Jr made Layup. Assisted by C.J. Wiggins.",32,43,"North Carolina Central","Southeast Missouri State",NA,"400990906"
151,2,"19:05",1145,"Milos Vranes missed Three Point Jumper.",32,43,"North Carolina Central","Southeast Missouri State",NA,"400990906"
152,2,"19:05",1145,"Jordan Perkins Defensive Rebound.",32,43,"North Carolina Central","Southeast Missouri State",NA,"400990906"
153,2,"18:52",1132,"Jordan Perkins missed Jumper.",32,43,"North Carolina Central","Southeast Missouri State",NA,"400990906"
154,2,"18:52",1132,"Ledarrius Brewer Defensive Rebound.",32,43,"North Carolina Central","Southeast Missouri State",NA,"400990906"
155,2,"18:43",1123,"Justin Carpenter missed Three Point Jumper.",32,43,"North Carolina Central","Southeast Missouri State",NA,"400990906"
156,2,"18:43",1123,"Zacarry Douglas Defensive Rebound.",32,43,"North Carolina Central","Southeast Missouri State",NA,"400990906"
157,2,"18:15",1095,"Raasean Davis made Layup.",32,45,"North Carolina Central","Southeast Missouri State",NA,"400990906"
158,2,"17:57",1077,"Ledarrius Brewer missed Three Point Jumper.",32,45,"North Carolina Central","Southeast Missouri State",NA,"400990906"
159,2,"17:57",1077,"Zacarry Douglas Defensive Rebound.",32,45,"North Carolina Central","Southeast Missouri State",NA,"400990906"
160,2,"17:42",1062,"Raasean Davis made Dunk. Assisted by Jordan Perkins.",32,47,"North Carolina Central","Southeast Missouri State",NA,"400990906"
161,2,"17:31",1051,"Southeast Missouri State  Timeout",32,47,"North Carolina Central","Southeast Missouri State",NA,"400990906"
162,2,"17:17",1037,"Daniel Simmons missed Layup.",32,47,"North Carolina Central","Southeast Missouri State",NA,"400990906"
163,2,"17:17",1037,"Daniel Simmons Offensive Rebound.",32,47,"North Carolina Central","Southeast Missouri State",NA,"400990906"
164,2,"17:13",1033,"Justin Carpenter made Layup. Assisted by Daniel Simmons.",34,47,"North Carolina Central","Southeast Missouri State",NA,"400990906"
165,2,"17:13",1033,"Foul on Reginald Gardner Jr.",34,47,"North Carolina Central","Southeast Missouri State",NA,"400990906"
166,2,"17:13",1033,"Justin Carpenter missed Free Throw.",34,47,"North Carolina Central","Southeast Missouri State",NA,"400990906"
167,2,"17:13",1033,"Zacarry Douglas Defensive Rebound.",34,47,"North Carolina Central","Southeast Missouri State",NA,"400990906"
168,2,"16:55",1015,"C.J. Wiggins missed Three Point Jumper.",34,47,"North Carolina Central","Southeast Missouri State",NA,"400990906"
169,2,"16:55",1015,"Jonathan Dalton Defensive Rebound.",34,47,"North Carolina Central","Southeast Missouri State",NA,"400990906"
170,2,"16:47",1007,"Daniel Simmons missed Layup.",34,47,"North Carolina Central","Southeast Missouri State",NA,"400990906"
171,2,"16:47",1007,"C.J. Wiggins Defensive Rebound.",34,47,"North Carolina Central","Southeast Missouri State",NA,"400990906"
172,2,"16:41",1001,"Foul on Ledarrius Brewer.",34,47,"North Carolina Central","Southeast Missouri State",NA,"400990906"
173,2,"16:41",1001,"Raasean Davis missed Free Throw.",34,47,"North Carolina Central","Southeast Missouri State",NA,"400990906"
174,2,"16:41",1001,"North Carolina Central Deadball Team Rebound.",34,47,"North Carolina Central","Southeast Missouri State",NA,"400990906"
175,2,"16:41",1001,"Raasean Davis made Free Throw.",34,48,"North Carolina Central","Southeast Missouri State",NA,"400990906"
176,2,"16:28",988,"Daniel Simmons made Layup. Assisted by Jonathan Dalton.",36,48,"North Carolina Central","Southeast Missouri State",NA,"400990906"
177,2,"16:03",963,"Reginald Gardner Jr made Three Point Jumper. Assisted by Jordan Perkins.",36,51,"North Carolina Central","Southeast Missouri State",NA,"400990906"
178,2,"15:42",942,"Denzel Mahoney missed Jumper.",36,51,"North Carolina Central","Southeast Missouri State",NA,"400990906"
179,2,"15:42",942,"Justin Carpenter Offensive Rebound.",36,51,"North Carolina Central","Southeast Missouri State",NA,"400990906"
180,2,"15:36",936,"Justin Carpenter made Jumper.",38,51,"North Carolina Central","Southeast Missouri State",NA,"400990906"
181,2,"15:14",914,"Official TV Timeout",38,51,"North Carolina Central","Southeast Missouri State",NA,"400990906"
182,2,"15:13",913,"Foul on Denzel Mahoney.",38,51,"North Carolina Central","Southeast Missouri State",NA,"400990906"
183,2,"15:01",901,"Pablo Rivas made Three Point Jumper. Assisted by C.J. Wiggins.",38,54,"North Carolina Central","Southeast Missouri State",NA,"400990906"
184,2,"14:47",887,"Ray Kowalski Turnover.",38,54,"North Carolina Central","Southeast Missouri State",NA,"400990906"
185,2,"14:31",871,"Raasean Davis missed Jumper.",38,54,"North Carolina Central","Southeast Missouri State",NA,"400990906"
186,2,"14:31",871,"Justin Carpenter Defensive Rebound.",38,54,"North Carolina Central","Southeast Missouri State",NA,"400990906"
187,2,"14:17",857,"Justin Carpenter made Layup. Assisted by Daniel Simmons.",40,54,"North Carolina Central","Southeast Missouri State",NA,"400990906"
188,2,"13:55",835,"Jordan Perkins Turnover.",40,54,"North Carolina Central","Southeast Missouri State",NA,"400990906"
189,2,"13:45",825,"Ray Kowalski made Jumper.",42,54,"North Carolina Central","Southeast Missouri State",NA,"400990906"
190,2,"13:19",799,"Jordan Perkins Turnover.",42,54,"North Carolina Central","Southeast Missouri State",NA,"400990906"
191,2,"13:16",796,"Jonathan Dalton Steal.",42,54,"North Carolina Central","Southeast Missouri State",NA,"400990906"
192,2,"13:15",795,"Milos Vranes missed Layup.",42,54,"North Carolina Central","Southeast Missouri State",NA,"400990906"
193,2,"13:15",795,"Pablo Rivas Block.",42,54,"North Carolina Central","Southeast Missouri State",NA,"400990906"
194,2,"13:15",795,"North Carolina Central Defensive Rebound.",42,54,"North Carolina Central","Southeast Missouri State",NA,"400990906"
195,2,"13:15",795,"Foul on Justin Carpenter.",42,54,"North Carolina Central","Southeast Missouri State",NA,"400990906"
196,2,"13:00",780,"Reginald Gardner Jr missed Three Point Jumper.",42,54,"North Carolina Central","Southeast Missouri State",NA,"400990906"
197,2,"13:00",780,"North Carolina Central Offensive Rebound.",42,54,"North Carolina Central","Southeast Missouri State",NA,"400990906"
198,2,"12:48",768,"Raasean Davis Turnover.",42,54,"North Carolina Central","Southeast Missouri State",NA,"400990906"
199,2,"12:48",768,"Foul on Raasean Davis.",42,54,"North Carolina Central","Southeast Missouri State",NA,"400990906"
200,2,"12:28",748,"Daniel Simmons made Three Point Jumper. Assisted by Ray Kowalski.",45,54,"North Carolina Central","Southeast Missouri State",NA,"400990906"
201,2,"12:10",730,"Reginald Gardner Jr made Layup.",45,56,"North Carolina Central","Southeast Missouri State",NA,"400990906"
202,2,"12:10",730,"Foul on Justin Carpenter.",45,56,"North Carolina Central","Southeast Missouri State",NA,"400990906"
203,2,"12:10",730,"Reginald Gardner Jr made Free Throw.",45,57,"North Carolina Central","Southeast Missouri State",NA,"400990906"
204,2,"11:48",708,"Milos Vranes Turnover.",45,57,"North Carolina Central","Southeast Missouri State",NA,"400990906"
205,2,"11:45",705,"Pablo Rivas Steal.",45,57,"North Carolina Central","Southeast Missouri State",NA,"400990906"
206,2,"11:42",702,"Alston Jones Turnover.",45,57,"North Carolina Central","Southeast Missouri State",NA,"400990906"
207,2,"11:42",702,"Official TV Timeout",45,57,"North Carolina Central","Southeast Missouri State",NA,"400990906"
208,2,"11:33",693,"Daniel Simmons made Jumper.",47,57,"North Carolina Central","Southeast Missouri State",NA,"400990906"
209,2,"11:13",673,"Alston Jones Turnover.",47,57,"North Carolina Central","Southeast Missouri State",NA,"400990906"
210,2,"11:04",664,"Daniel Simmons Turnover.",47,57,"North Carolina Central","Southeast Missouri State",NA,"400990906"
211,2,"11:01",661,"Jordan Perkins Steal.",47,57,"North Carolina Central","Southeast Missouri State",NA,"400990906"
212,2,"10:58",658,"Jordan Perkins missed Layup.",47,57,"North Carolina Central","Southeast Missouri State",NA,"400990906"
213,2,"10:58",658,"Southeast Missouri State Defensive Rebound.",47,57,"North Carolina Central","Southeast Missouri State",NA,"400990906"
214,2,"10:58",658,"Foul on Pablo Rivas.",47,57,"North Carolina Central","Southeast Missouri State",NA,"400990906"
215,2,"10:48",648,"Milos Vranes missed Layup.",47,57,"North Carolina Central","Southeast Missouri State",NA,"400990906"
216,2,"10:48",648,"Raasean Davis Defensive Rebound.",47,57,"North Carolina Central","Southeast Missouri State",NA,"400990906"
217,2,"10:37",637,"Foul on Milos Vranes.",47,57,"North Carolina Central","Southeast Missouri State",NA,"400990906"
218,2,"10:34",634,"Pablo Rivas missed Jumper.",47,57,"North Carolina Central","Southeast Missouri State",NA,"400990906"
219,2,"10:34",634,"Mark Laros Defensive Rebound.",47,57,"North Carolina Central","Southeast Missouri State",NA,"400990906"
220,2,"10:24",624,"Foul on Raasean Davis.",47,57,"North Carolina Central","Southeast Missouri State",NA,"400990906"
221,2,"10:16",616,"Ledarrius Brewer made Three Point Jumper. Assisted by Mark Laros.",50,57,"North Carolina Central","Southeast Missouri State",NA,"400990906"
222,2,"9:48",588,"Alston Jones missed Layup.",50,57,"North Carolina Central","Southeast Missouri State",NA,"400990906"
223,2,"9:48",588,"Raasean Davis Offensive Rebound.",50,57,"North Carolina Central","Southeast Missouri State",NA,"400990906"
224,2,"9:46",586,"Raasean Davis missed Layup.",50,57,"North Carolina Central","Southeast Missouri State",NA,"400990906"
225,2,"9:46",586,"Raasean Davis Offensive Rebound.",50,57,"North Carolina Central","Southeast Missouri State",NA,"400990906"
226,2,"9:46",586,"Raasean Davis made Layup.",50,59,"North Carolina Central","Southeast Missouri State",NA,"400990906"
227,2,"9:46",586,"Technical Foul on Alston Jones.",50,59,"North Carolina Central","Southeast Missouri State",NA,"400990906"
228,2,"9:46",586,"Foul on Alston Jones.",50,59,"North Carolina Central","Southeast Missouri State",NA,"400990906"
229,2,"9:46",586,"Jonathan Dalton made Free Throw.",51,59,"North Carolina Central","Southeast Missouri State",NA,"400990906"
230,2,"9:46",586,"Jonathan Dalton made Free Throw.",52,59,"North Carolina Central","Southeast Missouri State",NA,"400990906"
231,2,"9:39",579,"Ledarrius Brewer missed Jumper.",52,59,"North Carolina Central","Southeast Missouri State",NA,"400990906"
232,2,"9:39",579,"Mark Laros Offensive Rebound.",52,59,"North Carolina Central","Southeast Missouri State",NA,"400990906"
233,2,"9:39",579,"Foul on Raasean Davis.",52,59,"North Carolina Central","Southeast Missouri State",NA,"400990906"
234,2,"9:39",579,"Mark Laros made Free Throw.",53,59,"North Carolina Central","Southeast Missouri State",NA,"400990906"
235,2,"9:39",579,"Mark Laros made Free Throw.",54,59,"North Carolina Central","Southeast Missouri State",NA,"400990906"
236,2,"9:12",552,"Dominique Reid Turnover.",54,59,"North Carolina Central","Southeast Missouri State",NA,"400990906"
237,2,"9:10",550,"Daniel Simmons Steal.",54,59,"North Carolina Central","Southeast Missouri State",NA,"400990906"
238,2,"9:06",546,"Foul on Jordan Perkins.",54,59,"North Carolina Central","Southeast Missouri State",NA,"400990906"
239,2,"9:06",546,"Daniel Simmons made Free Throw.",55,59,"North Carolina Central","Southeast Missouri State",NA,"400990906"
240,2,"9:06",546,"Daniel Simmons made Free Throw.",56,59,"North Carolina Central","Southeast Missouri State",NA,"400990906"
241,2,"8:44",524,"Jordan Perkins Turnover.",56,59,"North Carolina Central","Southeast Missouri State",NA,"400990906"
242,2,"8:44",524,"Ledarrius Brewer Steal.",56,59,"North Carolina Central","Southeast Missouri State",NA,"400990906"
243,2,"8:44",524,"Foul on Jordan Perkins.",56,59,"North Carolina Central","Southeast Missouri State",NA,"400990906"
244,2,"8:44",524,"Ledarrius Brewer made Free Throw.",57,59,"North Carolina Central","Southeast Missouri State",NA,"400990906"
245,2,"8:44",524,"Ledarrius Brewer made Free Throw.",58,59,"North Carolina Central","Southeast Missouri State",NA,"400990906"
246,2,"8:40",520,"North Carolina Central  Timeout",58,59,"North Carolina Central","Southeast Missouri State",NA,"400990906"
247,2,"8:15",495,"Reginald Gardner Jr missed Three Point Jumper.",58,59,"North Carolina Central","Southeast Missouri State",NA,"400990906"
248,2,"8:15",495,"Mark Laros Defensive Rebound.",58,59,"North Carolina Central","Southeast Missouri State",NA,"400990906"
249,2,"8:04",484,"Ledarrius Brewer missed Jumper.",58,59,"North Carolina Central","Southeast Missouri State",NA,"400990906"
250,2,"8:04",484,"Ledarrius Brewer Offensive Rebound.",58,59,"North Carolina Central","Southeast Missouri State",NA,"400990906"
251,2,"7:57",477,"Official TV Timeout",58,59,"North Carolina Central","Southeast Missouri State",NA,"400990906"
252,2,"7:45",465,"Denzel Mahoney Turnover.",58,59,"North Carolina Central","Southeast Missouri State",NA,"400990906"
253,2,"7:45",465,"Pablo Rivas Steal.",58,59,"North Carolina Central","Southeast Missouri State",NA,"400990906"
254,2,"7:30",450,"Pablo Rivas made Three Point Jumper. Assisted by Reginald Gardner Jr.",58,62,"North Carolina Central","Southeast Missouri State",NA,"400990906"
255,2,"7:09",429,"Daniel Simmons Turnover.",58,62,"North Carolina Central","Southeast Missouri State",NA,"400990906"
256,2,"6:57",417,"C.J. Wiggins Turnover.",58,62,"North Carolina Central","Southeast Missouri State",NA,"400990906"
257,2,"6:57",417,"Daniel Simmons Steal.",58,62,"North Carolina Central","Southeast Missouri State",NA,"400990906"
258,2,"6:48",408,"Denzel Mahoney missed Jumper.",58,62,"North Carolina Central","Southeast Missouri State",NA,"400990906"
259,2,"6:48",408,"Alston Jones Defensive Rebound.",58,62,"North Carolina Central","Southeast Missouri State",NA,"400990906"
260,2,"6:40",400,"Raasean Davis made Layup. Assisted by Alston Jones.",58,64,"North Carolina Central","Southeast Missouri State",NA,"400990906"
261,2,"6:40",400,"Foul on Denzel Mahoney.",58,64,"North Carolina Central","Southeast Missouri State",NA,"400990906"
262,2,"6:40",400,"Raasean Davis made Free Throw.",58,65,"North Carolina Central","Southeast Missouri State",NA,"400990906"
263,2,"6:14",374,"Denzel Mahoney missed Three Point Jumper.",58,65,"North Carolina Central","Southeast Missouri State",NA,"400990906"
264,2,"6:14",374,"Raasean Davis Defensive Rebound.",58,65,"North Carolina Central","Southeast Missouri State",NA,"400990906"
265,2,"5:50",350,"Reginald Gardner Jr missed Three Point Jumper.",58,65,"North Carolina Central","Southeast Missouri State",NA,"400990906"
266,2,"5:50",350,"Justin Carpenter Defensive Rebound.",58,65,"North Carolina Central","Southeast Missouri State",NA,"400990906"
267,2,"5:39",339,"Foul on Alston Jones.",58,65,"North Carolina Central","Southeast Missouri State",NA,"400990906"
268,2,"5:39",339,"Jonathan Dalton made Free Throw.",59,65,"North Carolina Central","Southeast Missouri State",NA,"400990906"
269,2,"5:39",339,"Jonathan Dalton missed Free Throw.",59,65,"North Carolina Central","Southeast Missouri State",NA,"400990906"
270,2,"5:39",339,"Pablo Rivas Defensive Rebound.",59,65,"North Carolina Central","Southeast Missouri State",NA,"400990906"
271,2,"5:20",320,"Raasean Davis made Layup. Assisted by Jordan Perkins.",59,67,"North Carolina Central","Southeast Missouri State",NA,"400990906"
272,2,"5:05",305,"Jonathan Dalton made Layup. Assisted by Denzel Mahoney.",61,67,"North Carolina Central","Southeast Missouri State",NA,"400990906"
273,2,"4:43",283,"C.J. Wiggins made Three Point Jumper. Assisted by Jordan Perkins.",61,70,"North Carolina Central","Southeast Missouri State",NA,"400990906"
274,2,"4:24",264,"Ledarrius Brewer missed Jumper.",61,70,"North Carolina Central","Southeast Missouri State",NA,"400990906"
275,2,"4:24",264,"Justin Carpenter Offensive Rebound.",61,70,"North Carolina Central","Southeast Missouri State",NA,"400990906"
276,2,"4:22",262,"Foul on Reginald Gardner Jr.",61,70,"North Carolina Central","Southeast Missouri State",NA,"400990906"
277,2,"4:22",262,"Justin Carpenter made Free Throw.",62,70,"North Carolina Central","Southeast Missouri State",NA,"400990906"
278,2,"4:22",262,"Justin Carpenter made Free Throw.",63,70,"North Carolina Central","Southeast Missouri State",NA,"400990906"
279,2,"4:12",252,"Raasean Davis made Dunk. Assisted by Jordan Perkins.",63,72,"North Carolina Central","Southeast Missouri State",NA,"400990906"
280,2,"3:55",235,"Ledarrius Brewer missed Three Point Jumper.",63,72,"North Carolina Central","Southeast Missouri State",NA,"400990906"
281,2,"3:55",235,"Jordan Perkins Defensive Rebound.",63,72,"North Carolina Central","Southeast Missouri State",NA,"400990906"
