"play_id","half","time_remaining_half","secs_remaining","description","home_score","away_score","away","home","home_favored_by","game_id"
242,2,"6:15",375,"Ray Kowalski missed Jumper.",66,72,"Southeast Missouri State","North Carolina Central",NA,"400990915"
243,2,"6:15",375,"Pablo Rivas Defensive Rebound.",66,72,"Southeast Missouri State","North Carolina Central",NA,"400990915"
244,2,"6:04",364,"Reginald Gardner Jr missed Three Point Jumper.",66,72,"Southeast Missouri State","North Carolina Central",NA,"400990915"
245,2,"6:04",364,"Pablo Rivas Offensive Rebound.",66,72,"Southeast Missouri State","North Carolina Central",NA,"400990915"
246,2,"5:47",347,"Jordan Perkins Turnover.",66,72,"Southeast Missouri State","North Carolina Central",NA,"400990915"
247,2,"5:28",328,"Denzel Mahoney made Layup.",66,74,"Southeast Missouri State","North Carolina Central",NA,"400990915"
248,2,"5:12",312,"Pablo Rivas made Three Point Jumper. Assisted by Jordan Perkins.",69,74,"Southeast Missouri State","North Carolina Central",NA,"400990915"
249,2,"4:43",283,"Ledarrius Brewer made Three Point Jumper. Assisted by Justin Carpenter.",69,77,"Southeast Missouri State","North Carolina Central",NA,"400990915"
250,2,"4:22",262,"Pablo Rivas missed Three Point Jumper.",69,77,"Southeast Missouri State","North Carolina Central",NA,"400990915"
251,2,"4:22",262,"Daniel Simmons Defensive Rebound.",69,77,"Southeast Missouri State","North Carolina Central",NA,"400990915"
252,2,"4:12",252,"Southeast Missouri State  Timeout",69,77,"Southeast Missouri State","North Carolina Central",NA,"400990915"
253,2,"4:12",252,"Official TV Timeout",69,77,"Southeast Missouri State","North Carolina Central",NA,"400990915"
254,2,"3:55",235,"Daniel Simmons missed Jumper.",69,77,"Southeast Missouri State","North Carolina Central",NA,"400990915"
255,2,"3:55",235,"Dominique Reid Defensive Rebound.",69,77,"Southeast Missouri State","North Carolina Central",NA,"400990915"
256,2,"3:44",224,"Jordan Perkins missed Layup.",69,77,"Southeast Missouri State","North Carolina Central",NA,"400990915"
257,2,"3:44",224,"Pablo Rivas Offensive Rebound.",69,77,"Southeast Missouri State","North Carolina Central",NA,"400990915"
258,2,"3:27",207,"Foul on Justin Carpenter.",69,77,"Southeast Missouri State","North Carolina Central",NA,"400990915"
259,2,"3:27",207,"Foul on Dominique Reid.",69,77,"Southeast Missouri State","North Carolina Central",NA,"400990915"
260,2,"3:17",197,"Jordan Perkins missed Layup.",69,77,"Southeast Missouri State","North Carolina Central",NA,"400990915"
261,2,"3:17",197,"Denzel Mahoney Defensive Rebound.",69,77,"Southeast Missouri State","North Carolina Central",NA,"400990915"
262,2,"3:08",188,"Denzel Mahoney made Layup.",69,79,"Southeast Missouri State","North Carolina Central",NA,"400990915"
263,2,"2:54",174,"Jordan Perkins missed Three Point Jumper.",69,79,"Southeast Missouri State","North Carolina Central",NA,"400990915"
264,2,"2:54",174,"Justin Carpenter Defensive Rebound.",69,79,"Southeast Missouri State","North Carolina Central",NA,"400990915"
265,2,"2:37",157,"Daniel Simmons missed Jumper.",69,79,"Southeast Missouri State","North Carolina Central",NA,"400990915"
266,2,"2:37",157,"Pablo Rivas Defensive Rebound.",69,79,"Southeast Missouri State","North Carolina Central",NA,"400990915"
267,2,"2:26",146,"C.J. Wiggins missed Jumper.",69,79,"Southeast Missouri State","North Carolina Central",NA,"400990915"
268,2,"2:26",146,"Justin Carpenter Defensive Rebound.",69,79,"Southeast Missouri State","North Carolina Central",NA,"400990915"
269,2,"2:06",126,"Ledarrius Brewer missed Layup.",69,79,"Southeast Missouri State","North Carolina Central",NA,"400990915"
270,2,"2:06",126,"Pablo Rivas Defensive Rebound.",69,79,"Southeast Missouri State","North Carolina Central",NA,"400990915"
271,2,"1:59",119,"Reginald Gardner Jr made Layup. Assisted by Jordan Perkins.",71,79,"Southeast Missouri State","North Carolina Central",NA,"400990915"
272,2,"1:57",117,"North Carolina Central  Timeout",71,79,"Southeast Missouri State","North Carolina Central",NA,"400990915"
273,2,"1:48",108,"Foul on Dominique Reid.",71,79,"Southeast Missouri State","North Carolina Central",NA,"400990915"
274,2,"1:48",108,"Denzel Mahoney made Free Throw.",71,80,"Southeast Missouri State","North Carolina Central",NA,"400990915"
275,2,"1:48",108,"Denzel Mahoney missed Free Throw.",71,80,"Southeast Missouri State","North Carolina Central",NA,"400990915"
276,2,"1:48",108,"Pablo Rivas Defensive Rebound.",71,80,"Southeast Missouri State","North Carolina Central",NA,"400990915"
277,2,"1:36",96,"Pablo Rivas missed Jumper.",71,80,"Southeast Missouri State","North Carolina Central",NA,"400990915"
278,2,"1:36",96,"Daniel Simmons Defensive Rebound.",71,80,"Southeast Missouri State","North Carolina Central",NA,"400990915"
279,2,"1:23",83,"Daniel Simmons Turnover.",71,80,"Southeast Missouri State","North Carolina Central",NA,"400990915"
280,2,"1:22",82,"Pablo Rivas Steal.",71,80,"Southeast Missouri State","North Carolina Central",NA,"400990915"
281,2,"1:18",78,"Pablo Rivas made Layup.",73,80,"Southeast Missouri State","North Carolina Central",NA,"400990915"
282,2,"1:05",65,"Ledarrius Brewer made Layup.",73,82,"Southeast Missouri State","North Carolina Central",NA,"400990915"
283,2,"0:54",54,"Raasean Davis Turnover.",73,82,"Southeast Missouri State","North Carolina Central",NA,"400990915"
284,2,"0:54",54,"Denzel Mahoney Steal.",73,82,"Southeast Missouri State","North Carolina Central",NA,"400990915"
285,2,"0:51",51,"Foul on C.J. Wiggins.",73,82,"Southeast Missouri State","North Carolina Central",NA,"400990915"
286,2,"0:51",51,"Denzel Mahoney made Free Throw.",73,83,"Southeast Missouri State","North Carolina Central",NA,"400990915"
287,2,"0:51",51,"Denzel Mahoney made Free Throw.",73,84,"Southeast Missouri State","North Carolina Central",NA,"400990915"
288,2,"0:40",40,"Pablo Rivas made Dunk. Assisted by Dominique Reid.",75,84,"Southeast Missouri State","North Carolina Central",NA,"400990915"
289,2,"0:40",40,"North Carolina Central  Timeout",75,84,"Southeast Missouri State","North Carolina Central",NA,"400990915"
290,2,"0:38",38,"Foul on Jordan Perkins.",75,84,"Southeast Missouri State","North Carolina Central",NA,"400990915"
291,2,"0:38",38,"Denzel Mahoney missed Free Throw.",75,84,"Southeast Missouri State","North Carolina Central",NA,"400990915"
292,2,"0:38",38,"Pablo Rivas Defensive Rebound.",75,84,"Southeast Missouri State","North Carolina Central",NA,"400990915"
293,2,"0:32",32,"Alston Jones made Layup. Assisted by Jordan Perkins.",77,84,"Southeast Missouri State","North Carolina Central",NA,"400990915"
294,2,"0:30",30,"Foul on Pablo Rivas.",77,84,"Southeast Missouri State","North Carolina Central",NA,"400990915"
295,2,"0:30",30,"Daniel Simmons missed Free Throw.",77,84,"Southeast Missouri State","North Carolina Central",NA,"400990915"
296,2,"0:30",30,"Pablo Rivas Defensive Rebound.",77,84,"Southeast Missouri State","North Carolina Central",NA,"400990915"
297,2,"0:29",29,"Foul on Milos Vranes.",77,84,"Southeast Missouri State","North Carolina Central",NA,"400990915"
298,2,"0:29",29,"Pablo Rivas missed Free Throw.",77,84,"Southeast Missouri State","North Carolina Central",NA,"400990915"
299,2,"0:29",29,"North Carolina Central Deadball Team Rebound.",77,84,"Southeast Missouri State","North Carolina Central",NA,"400990915"
300,2,"0:29",29,"Pablo Rivas missed Free Throw.",77,84,"Southeast Missouri State","North Carolina Central",NA,"400990915"
301,2,"0:29",29,"Ledarrius Brewer Defensive Rebound.",77,84,"Southeast Missouri State","North Carolina Central",NA,"400990915"
302,2,"0:23",23,"Foul on Dominique Reid.",77,84,"Southeast Missouri State","North Carolina Central",NA,"400990915"
303,2,"0:23",23,"Denzel Mahoney made Free Throw.",77,85,"Southeast Missouri State","North Carolina Central",NA,"400990915"
304,2,"0:23",23,"Denzel Mahoney made Free Throw.",77,86,"Southeast Missouri State","North Carolina Central",NA,"400990915"
305,2,"0:14",14,"Reginald Gardner Jr missed Three Point Jumper.",77,86,"Southeast Missouri State","North Carolina Central",NA,"400990915"
306,2,"0:14",14,"Southeast Missouri State Defensive Rebound.",77,86,"Southeast Missouri State","North Carolina Central",NA,"400990915"
307,2,"0:00",0,"End of Game",77,86,"Southeast Missouri State","North Carolina Central",NA,"400990915"
1,1,"20:00",2400,"PLAY",0,0,"North Carolina Central","George Mason",NA,"400989884"
2,1,"19:44",2384,"Raasean Davis made Jumper. Assisted by Jordan Perkins.",0,2,"North Carolina Central","George Mason",NA,"400989884"
3,1,"19:20",2360,"Ian Boyd missed Three Point Jumper.",0,2,"North Carolina Central","George Mason",NA,"400989884"
4,1,"19:20",2360,"Ian Boyd Offensive Rebound.",0,2,"North Carolina Central","George Mason",NA,"400989884"
5,1,"19:04",2344,"Otis Livingston II Turnover.",0,2,"North Carolina Central","George Mason",NA,"400989884"
6,1,"18:43",2323,"Raasean Davis made Layup. Assisted by Jordan Perkins.",0,4,"North Carolina Central","George Mason",NA,"400989884"
7,1,"18:24",2304,"Otis Livingston II Turnover.",0,4,"North Carolina Central","George Mason",NA,"400989884"
8,1,"18:02",2282,"Raasean Davis missed Jumper.",0,4,"North Carolina Central","George Mason",NA,"400989884"
9,1,"18:02",2282,"Jaire Grayer Defensive Rebound.",0,4,"North Carolina Central","George Mason",NA,"400989884"
10,1,"17:53",2273,"Justin Kier missed Three Point Jumper.",0,4,"North Carolina Central","George Mason",NA,"400989884"
11,1,"17:53",2273,"Jaire Grayer Offensive Rebound.",0,4,"North Carolina Central","George Mason",NA,"400989884"
12,1,"17:50",2270,"Foul on Jordan Perkins.",0,4,"North Carolina Central","George Mason",NA,"400989884"
13,1,"17:46",2266,"Ian Boyd missed Three Point Jumper.",0,4,"North Carolina Central","George Mason",NA,"400989884"
14,1,"17:46",2266,"Jordan Perkins Defensive Rebound.",0,4,"North Carolina Central","George Mason",NA,"400989884"
15,1,"17:38",2258,"Reginald Gardner Jr missed Three Point Jumper.",0,4,"North Carolina Central","George Mason",NA,"400989884"
16,1,"17:38",2258,"Goanar Mar Defensive Rebound.",0,4,"North Carolina Central","George Mason",NA,"400989884"
17,1,"17:28",2248,"Otis Livingston II made Jumper.",2,4,"North Carolina Central","George Mason",NA,"400989884"
18,1,"17:19",2239,"Raasean Davis missed Jumper.",2,4,"North Carolina Central","George Mason",NA,"400989884"
19,1,"17:19",2239,"Raasean Davis Offensive Rebound.",2,4,"North Carolina Central","George Mason",NA,"400989884"
20,1,"17:13",2233,"Raasean Davis made Jumper.",2,6,"North Carolina Central","George Mason",NA,"400989884"
21,1,"16:49",2209,"Foul on Jordan Perkins.",2,6,"North Carolina Central","George Mason",NA,"400989884"
22,1,"16:41",2201,"Jaire Grayer missed Three Point Jumper.",2,6,"North Carolina Central","George Mason",NA,"400989884"
23,1,"16:41",2201,"Raasean Davis Defensive Rebound.",2,6,"North Carolina Central","George Mason",NA,"400989884"
24,1,"16:22",2182,"Reginald Gardner Jr Turnover.",2,6,"North Carolina Central","George Mason",NA,"400989884"
25,1,"16:21",2181,"Jaire Grayer Steal.",2,6,"North Carolina Central","George Mason",NA,"400989884"
26,1,"16:18",2178,"Jaire Grayer made Layup.",4,6,"North Carolina Central","George Mason",NA,"400989884"
27,1,"16:04",2164,"Zacarry Douglas missed Three Point Jumper.",4,6,"North Carolina Central","George Mason",NA,"400989884"
28,1,"16:04",2164,"Greg Calixte Defensive Rebound.",4,6,"North Carolina Central","George Mason",NA,"400989884"
29,1,"15:57",2157,"Foul on Greg Calixte.",4,6,"North Carolina Central","George Mason",NA,"400989884"
30,1,"15:57",2157,"Greg Calixte Turnover.",4,6,"North Carolina Central","George Mason",NA,"400989884"
31,1,"15:57",2157,"Official TV Timeout",4,6,"North Carolina Central","George Mason",NA,"400989884"
32,1,"15:49",2149,"C.J. Wiggins Turnover.",4,6,"North Carolina Central","George Mason",NA,"400989884"
33,1,"15:48",2148,"Justin Kier Steal.",4,6,"North Carolina Central","George Mason",NA,"400989884"
34,1,"15:45",2145,"Justin Kier made Layup.",6,6,"North Carolina Central","George Mason",NA,"400989884"
35,1,"15:28",2128,"Reginald Gardner Jr missed Jumper.",6,6,"North Carolina Central","George Mason",NA,"400989884"
36,1,"15:28",2128,"Brandon Goldsmith Offensive Rebound.",6,6,"North Carolina Central","George Mason",NA,"400989884"
37,1,"15:01",2101,"Foul on Jaire Grayer.",6,6,"North Carolina Central","George Mason",NA,"400989884"
38,1,"14:54",2094,"Reginald Gardner Jr missed Three Point Jumper.",6,6,"North Carolina Central","George Mason",NA,"400989884"
39,1,"14:54",2094,"Brandon Goldsmith Offensive Rebound.",6,6,"North Carolina Central","George Mason",NA,"400989884"
40,1,"14:52",2092,"Foul on Goanar Mar.",6,6,"North Carolina Central","George Mason",NA,"400989884"
41,1,"14:47",2087,"Foul on Raasean Davis.",6,6,"North Carolina Central","George Mason",NA,"400989884"
42,1,"14:47",2087,"Raasean Davis Turnover.",6,6,"North Carolina Central","George Mason",NA,"400989884"
43,1,"14:33",2073,"Jaire Grayer made Jumper. Assisted by Justin Kier.",8,6,"North Carolina Central","George Mason",NA,"400989884"
44,1,"14:17",2057,"Larry McKnight Jr. Turnover.",8,6,"North Carolina Central","George Mason",NA,"400989884"
45,1,"14:15",2055,"Justin Kier Turnover.",8,6,"North Carolina Central","George Mason",NA,"400989884"
46,1,"14:14",2054,"C.J. Wiggins Steal.",8,6,"North Carolina Central","George Mason",NA,"400989884"
47,1,"14:11",2051,"Pablo Rivas missed Three Point Jumper.",8,6,"North Carolina Central","George Mason",NA,"400989884"
48,1,"14:11",2051,"Otis Livingston II Defensive Rebound.",8,6,"North Carolina Central","George Mason",NA,"400989884"
49,1,"14:09",2049,"Foul on Brandon Goldsmith.",8,6,"North Carolina Central","George Mason",NA,"400989884"
50,1,"13:43",2023,"Greg Calixte made Jumper. Assisted by Justin Kier.",10,6,"North Carolina Central","George Mason",NA,"400989884"
51,1,"13:24",2004,"Foul on Greg Calixte.",10,6,"North Carolina Central","George Mason",NA,"400989884"
52,1,"13:24",2004,"Raasean Davis made Free Throw.",10,7,"North Carolina Central","George Mason",NA,"400989884"
53,1,"13:24",2004,"Raasean Davis made Free Throw.",10,8,"North Carolina Central","George Mason",NA,"400989884"
54,1,"13:07",1987,"Ian Boyd made Layup.",12,8,"North Carolina Central","George Mason",NA,"400989884"
55,1,"12:48",1968,"Brandon Goldsmith missed Jumper.",12,8,"North Carolina Central","George Mason",NA,"400989884"
56,1,"12:48",1968,"Jaire Grayer Defensive Rebound.",12,8,"North Carolina Central","George Mason",NA,"400989884"
57,1,"12:38",1958,"Javon Greene made Layup.",14,8,"North Carolina Central","George Mason",NA,"400989884"
58,1,"12:38",1958,"Foul on Dominique Reid.",14,8,"North Carolina Central","George Mason",NA,"400989884"
59,1,"12:38",1958,"Javon Greene made Free Throw.",15,8,"North Carolina Central","George Mason",NA,"400989884"
60,1,"12:27",1947,"Larry McKnight Jr. made Three Point Jumper. Assisted by C.J. Wiggins.",15,11,"North Carolina Central","George Mason",NA,"400989884"
61,1,"12:15",1935,"Foul on Dominique Reid.",15,11,"North Carolina Central","George Mason",NA,"400989884"
62,1,"12:14",1934,"Goanar Mar Turnover.",15,11,"North Carolina Central","George Mason",NA,"400989884"
63,1,"11:45",1905,"Reginald Gardner Jr missed Three Point Jumper.",15,11,"North Carolina Central","George Mason",NA,"400989884"
64,1,"11:45",1905,"Goanar Mar Defensive Rebound.",15,11,"North Carolina Central","George Mason",NA,"400989884"
65,1,"11:33",1893,"Jaire Grayer made Three Point Jumper. Assisted by Javon Greene.",18,11,"North Carolina Central","George Mason",NA,"400989884"
66,1,"11:13",1873,"Dominique Reid made Jumper. Assisted by C.J. Wiggins.",18,13,"North Carolina Central","George Mason",NA,"400989884"
67,1,"10:51",1851,"Goanar Mar made Jumper.",20,13,"North Carolina Central","George Mason",NA,"400989884"
68,1,"10:24",1824,"Larry McKnight Jr. Turnover.",20,13,"North Carolina Central","George Mason",NA,"400989884"
69,1,"10:24",1824,"Official TV Timeout",20,13,"North Carolina Central","George Mason",NA,"400989884"
70,1,"10:13",1813,"Otis Livingston II Turnover.",20,13,"North Carolina Central","George Mason",NA,"400989884"
71,1,"10:02",1802,"Raasean Davis Turnover.",20,13,"North Carolina Central","George Mason",NA,"400989884"
72,1,"9:47",1787,"Javon Greene missed Three Point Jumper.",20,13,"North Carolina Central","George Mason",NA,"400989884"
73,1,"9:47",1787,"Pablo Rivas Defensive Rebound.",20,13,"North Carolina Central","George Mason",NA,"400989884"
74,1,"9:27",1767,"Raasean Davis missed Jumper.",20,13,"North Carolina Central","George Mason",NA,"400989884"
75,1,"9:27",1767,"AJ Wilson Block.",20,13,"North Carolina Central","George Mason",NA,"400989884"
76,1,"9:25",1765,"Ian Boyd Defensive Rebound.",20,13,"North Carolina Central","George Mason",NA,"400989884"
77,1,"9:16",1756,"Justin Kier missed Jumper.",20,13,"North Carolina Central","George Mason",NA,"400989884"
78,1,"9:16",1756,"Raasean Davis Defensive Rebound.",20,13,"North Carolina Central","George Mason",NA,"400989884"
79,1,"9:09",1749,"Alston Jones missed Jumper.",20,13,"North Carolina Central","George Mason",NA,"400989884"
80,1,"9:09",1749,"Pablo Rivas Offensive Rebound.",20,13,"North Carolina Central","George Mason",NA,"400989884"
81,1,"9:06",1746,"Pablo Rivas made Jumper.",20,15,"North Carolina Central","George Mason",NA,"400989884"
82,1,"8:46",1726,"Foul on Larry McKnight Jr..",20,15,"North Carolina Central","George Mason",NA,"400989884"
83,1,"8:46",1726,"Javon Greene made Free Throw.",21,15,"North Carolina Central","George Mason",NA,"400989884"
84,1,"8:46",1726,"Javon Greene missed Free Throw.",21,15,"North Carolina Central","George Mason",NA,"400989884"
85,1,"8:46",1726,"Pablo Rivas Defensive Rebound.",21,15,"North Carolina Central","George Mason",NA,"400989884"
86,1,"8:30",1710,"Foul on Reginald Gardner Jr.",21,15,"North Carolina Central","George Mason",NA,"400989884"
87,1,"8:30",1710,"Reginald Gardner Jr Turnover.",21,15,"North Carolina Central","George Mason",NA,"400989884"
88,1,"8:21",1701,"AJ Wilson made Dunk. Assisted by Ian Boyd.",23,15,"North Carolina Central","George Mason",NA,"400989884"
89,1,"8:21",1701,"Foul on Reginald Gardner Jr.",23,15,"North Carolina Central","George Mason",NA,"400989884"
90,1,"8:21",1701,"AJ Wilson made Free Throw.",24,15,"North Carolina Central","George Mason",NA,"400989884"
91,1,"8:08",1688,"Foul on AJ Wilson.",24,15,"North Carolina Central","George Mason",NA,"400989884"
92,1,"8:08",1688,"Raasean Davis made Free Throw.",24,16,"North Carolina Central","George Mason",NA,"400989884"
93,1,"8:08",1688,"Raasean Davis made Free Throw.",24,17,"North Carolina Central","George Mason",NA,"400989884"
94,1,"7:41",1661,"Justin Kier missed Three Point Jumper.",24,17,"North Carolina Central","George Mason",NA,"400989884"
95,1,"7:41",1661,"Brandon Goldsmith Defensive Rebound.",24,17,"North Carolina Central","George Mason",NA,"400989884"
96,1,"7:31",1651,"Alston Jones Turnover.",24,17,"North Carolina Central","George Mason",NA,"400989884"
97,1,"7:30",1650,"Jaire Grayer Steal.",24,17,"North Carolina Central","George Mason",NA,"400989884"
98,1,"7:30",1650,"Official TV Timeout",24,17,"North Carolina Central","George Mason",NA,"400989884"
99,1,"7:07",1627,"Justin Kier Turnover.",24,17,"North Carolina Central","George Mason",NA,"400989884"
100,1,"6:54",1614,"Foul on AJ Wilson.",24,17,"North Carolina Central","George Mason",NA,"400989884"
101,1,"6:54",1614,"Brandon Goldsmith missed Free Throw.",24,17,"North Carolina Central","George Mason",NA,"400989884"
102,1,"6:54",1614,"North Carolina Central Deadball Team Rebound.",24,17,"North Carolina Central","George Mason",NA,"400989884"
103,1,"6:54",1614,"Brandon Goldsmith made Free Throw.",24,18,"North Carolina Central","George Mason",NA,"400989884"
104,1,"6:36",1596,"Goanar Mar missed Three Point Jumper.",24,18,"North Carolina Central","George Mason",NA,"400989884"
105,1,"6:36",1596,"Brandon Goldsmith Defensive Rebound.",24,18,"North Carolina Central","George Mason",NA,"400989884"
106,1,"6:21",1581,"Brandon Goldsmith missed Layup.",24,18,"North Carolina Central","George Mason",NA,"400989884"
107,1,"6:21",1581,"Justin Kier Defensive Rebound.",24,18,"North Carolina Central","George Mason",NA,"400989884"
108,1,"6:01",1561,"Justin Kier missed Jumper.",24,18,"North Carolina Central","George Mason",NA,"400989884"
109,1,"6:01",1561,"Goanar Mar Offensive Rebound.",24,18,"North Carolina Central","George Mason",NA,"400989884"
110,1,"6:00",1560,"Foul on Brandon Goldsmith.",24,18,"North Carolina Central","George Mason",NA,"400989884"
111,1,"6:00",1560,"Goanar Mar made Free Throw.",25,18,"North Carolina Central","George Mason",NA,"400989884"
112,1,"6:00",1560,"Goanar Mar made Free Throw.",26,18,"North Carolina Central","George Mason",NA,"400989884"
113,1,"5:44",1544,"Pablo Rivas missed Jumper.",26,18,"North Carolina Central","George Mason",NA,"400989884"
114,1,"5:44",1544,"Raasean Davis Offensive Rebound.",26,18,"North Carolina Central","George Mason",NA,"400989884"
115,1,"5:38",1538,"Raasean Davis made Jumper.",26,20,"North Carolina Central","George Mason",NA,"400989884"
116,1,"5:24",1524,"Justin Kier Turnover.",26,20,"North Carolina Central","George Mason",NA,"400989884"
117,1,"5:21",1521,"Raasean Davis Steal.",26,20,"North Carolina Central","George Mason",NA,"400989884"
118,1,"4:56",1496,"C.J. Wiggins missed Three Point Jumper.",26,20,"North Carolina Central","George Mason",NA,"400989884"
119,1,"4:56",1496,"Javon Greene Defensive Rebound.",26,20,"North Carolina Central","George Mason",NA,"400989884"
120,1,"4:40",1480,"Jaire Grayer missed Three Point Jumper.",26,20,"North Carolina Central","George Mason",NA,"400989884"
121,1,"4:40",1480,"Jordan Perkins Defensive Rebound.",26,20,"North Carolina Central","George Mason",NA,"400989884"
122,1,"4:32",1472,"Larry McKnight Jr. missed Layup.",26,20,"North Carolina Central","George Mason",NA,"400989884"
123,1,"4:32",1472,"Larry McKnight Jr. Offensive Rebound.",26,20,"North Carolina Central","George Mason",NA,"400989884"
124,1,"4:29",1469,"Larry McKnight Jr. missed Jumper.",26,20,"North Carolina Central","George Mason",NA,"400989884"
125,1,"4:29",1469,"Larry McKnight Jr. Offensive Rebound.",26,20,"North Carolina Central","George Mason",NA,"400989884"
126,1,"4:25",1465,"Larry McKnight Jr. missed Jumper.",26,20,"North Carolina Central","George Mason",NA,"400989884"
127,1,"4:18",1458,"Official TV Timeout",28,20,"North Carolina Central","George Mason",NA,"400989884"
128,1,"4:18",1458,"Justin Kier Defensive Rebound.",26,20,"North Carolina Central","George Mason",NA,"400989884"
129,1,"4:18",1458,"Otis Livingston II made Jumper.",28,20,"North Carolina Central","George Mason",NA,"400989884"
130,1,"4:18",1458,"Official TV Timeout",28,20,"North Carolina Central","George Mason",NA,"400989884"
131,1,"4:01",1441,"Reginald Gardner Jr missed Layup.",28,20,"North Carolina Central","George Mason",NA,"400989884"
132,1,"4:01",1441,"Greg Calixte Defensive Rebound.",28,20,"North Carolina Central","George Mason",NA,"400989884"
133,1,"3:48",1428,"Jaire Grayer missed Three Point Jumper.",28,20,"North Carolina Central","George Mason",NA,"400989884"
134,1,"3:48",1428,"Otis Livingston II Offensive Rebound.",28,20,"North Carolina Central","George Mason",NA,"400989884"
135,1,"3:40",1420,"Otis Livingston II made Layup.",30,20,"North Carolina Central","George Mason",NA,"400989884"
136,1,"3:32",1412,"Jordan Perkins made Layup.",30,22,"North Carolina Central","George Mason",NA,"400989884"
137,1,"3:16",1396,"Javon Greene missed Three Point Jumper.",30,22,"North Carolina Central","George Mason",NA,"400989884"
138,1,"3:16",1396,"Raasean Davis Defensive Rebound.",30,22,"North Carolina Central","George Mason",NA,"400989884"
139,1,"3:04",1384,"Reginald Gardner Jr missed Three Point Jumper.",30,22,"North Carolina Central","George Mason",NA,"400989884"
140,1,"3:04",1384,"Javon Greene Defensive Rebound.",30,22,"North Carolina Central","George Mason",NA,"400989884"
141,1,"3:01",1381,"Foul on Pablo Rivas.",30,22,"North Carolina Central","George Mason",NA,"400989884"
142,1,"3:01",1381,"Javon Greene made Free Throw.",31,22,"North Carolina Central","George Mason",NA,"400989884"
143,1,"3:01",1381,"Javon Greene missed Free Throw.",31,22,"North Carolina Central","George Mason",NA,"400989884"
144,1,"3:01",1381,"Pablo Rivas Defensive Rebound.",31,22,"North Carolina Central","George Mason",NA,"400989884"
145,1,"2:46",1366,"Pablo Rivas Turnover.",31,22,"North Carolina Central","George Mason",NA,"400989884"
146,1,"2:25",1345,"Ian Boyd missed Three Point Jumper.",31,22,"North Carolina Central","George Mason",NA,"400989884"
147,1,"2:25",1345,"Greg Calixte Offensive Rebound.",31,22,"North Carolina Central","George Mason",NA,"400989884"
148,1,"2:17",1337,"Greg Calixte made Two Point Tip Shot.",33,22,"North Carolina Central","George Mason",NA,"400989884"
149,1,"2:15",1335,"Foul on Greg Calixte.",33,22,"North Carolina Central","George Mason",NA,"400989884"
150,1,"2:15",1335,"Raasean Davis made Free Throw.",33,23,"North Carolina Central","George Mason",NA,"400989884"
151,1,"2:15",1335,"Raasean Davis missed Free Throw.",33,23,"North Carolina Central","George Mason",NA,"400989884"
152,1,"2:15",1335,"Ian Boyd Defensive Rebound.",33,23,"North Carolina Central","George Mason",NA,"400989884"
153,1,"2:04",1324,"Justin Kier made Jumper. Assisted by Jaire Grayer.",35,23,"North Carolina Central","George Mason",NA,"400989884"
154,1,"1:41",1301,"Foul on Goanar Mar.",35,23,"North Carolina Central","George Mason",NA,"400989884"
155,1,"1:41",1301,"Raasean Davis made Free Throw.",35,24,"North Carolina Central","George Mason",NA,"400989884"
156,1,"1:41",1301,"Raasean Davis made Free Throw.",35,25,"North Carolina Central","George Mason",NA,"400989884"
157,1,"1:16",1276,"AJ Wilson missed Jumper.",35,25,"North Carolina Central","George Mason",NA,"400989884"
158,1,"1:16",1276,"Ian Boyd Offensive Rebound.",35,25,"North Carolina Central","George Mason",NA,"400989884"
