"play_id","half","time_remaining_half","secs_remaining","description","home_score","away_score","away","home","home_favored_by","game_id"
258,2,"7:00",720,"Yauhen Massalski made Free Throw.",59,63,"North Texas","San Diego",9.5,"400987000"
259,2,"6:49",709,"Zachary Simmons Turnover.",59,63,"North Texas","San Diego",9.5,"400987000"
260,2,"6:47",707,"Juwan Gray Steal.",59,63,"North Texas","San Diego",9.5,"400987000"
261,2,"6:45",705,"Isaiah Pineiro made Dunk. Assisted by Juwan Gray.",61,63,"North Texas","San Diego",9.5,"400987000"
262,2,"6:43",703,"North Texas  Timeout",61,63,"North Texas","San Diego",9.5,"400987000"
263,2,"6:17",677,"Roosevelt Smart made Three Point Jumper. Assisted by Ryan Woolridge.",61,66,"North Texas","San Diego",9.5,"400987000"
264,2,"6:10",670,"Juwan Gray made Jumper.",63,66,"North Texas","San Diego",9.5,"400987000"
265,2,"5:39",639,"Roosevelt Smart missed Three Point Jumper.",63,66,"North Texas","San Diego",9.5,"400987000"
266,2,"5:39",639,"DJ Draper Offensive Rebound.",63,66,"North Texas","San Diego",9.5,"400987000"
267,2,"5:34",634,"Ryan Woolridge missed Jumper.",63,66,"North Texas","San Diego",9.5,"400987000"
268,2,"5:34",634,"Isaiah Pineiro Block.",63,66,"North Texas","San Diego",9.5,"400987000"
269,2,"5:34",634,"Isaiah Pineiro Defensive Rebound.",63,66,"North Texas","San Diego",9.5,"400987000"
270,2,"5:34",634,"Tyler Williams missed Three Point Jumper.",63,66,"North Texas","San Diego",9.5,"400987000"
271,2,"5:34",634,"Ryan Woolridge Defensive Rebound.",63,66,"North Texas","San Diego",9.5,"400987000"
272,2,"5:33",633,"Ryan Woolridge made Jumper.",63,68,"North Texas","San Diego",9.5,"400987000"
273,2,"5:29",629,"Foul on Cameron Neubauer.",63,68,"North Texas","San Diego",9.5,"400987000"
274,2,"5:06",606,"Ryan Woolridge made Free Throw.",63,69,"North Texas","San Diego",9.5,"400987000"
275,2,"4:51",591,"Isaiah Pineiro Turnover.",63,69,"North Texas","San Diego",9.5,"400987000"
276,2,"4:25",565,"Ryan Woolridge missed Jumper.",63,69,"North Texas","San Diego",9.5,"400987000"
277,2,"4:25",565,"Cameron Neubauer Block.",63,69,"North Texas","San Diego",9.5,"400987000"
278,2,"4:23",563,"Ryan Woolridge Offensive Rebound.",63,69,"North Texas","San Diego",9.5,"400987000"
279,2,"4:22",562,"North Texas  Turnover.",63,69,"North Texas","San Diego",9.5,"400987000"
280,2,"4:10",550,"Tyler Williams made Layup.",65,69,"North Texas","San Diego",9.5,"400987000"
281,2,"3:46",526,"A.J. Lawson missed Jumper.",65,69,"North Texas","San Diego",9.5,"400987000"
282,2,"3:46",526,"Juwan Gray Block.",65,69,"North Texas","San Diego",9.5,"400987000"
283,2,"3:44",524,"Olin Carter III Defensive Rebound.",65,69,"North Texas","San Diego",9.5,"400987000"
284,2,"3:22",502,"Tyler Williams missed Three Point Jumper.",65,69,"North Texas","San Diego",9.5,"400987000"
285,2,"3:22",502,"Ryan Woolridge Defensive Rebound.",65,69,"North Texas","San Diego",9.5,"400987000"
286,2,"2:49",469,"A.J. Lawson made Layup.",65,71,"North Texas","San Diego",9.5,"400987000"
287,2,"2:44",464,"San Diego  Timeout",65,71,"North Texas","San Diego",9.5,"400987000"
288,2,"2:32",452,"Cameron Neubauer missed Three Point Jumper.",65,71,"North Texas","San Diego",9.5,"400987000"
289,2,"2:32",452,"Isaiah Wright Offensive Rebound.",65,71,"North Texas","San Diego",9.5,"400987000"
290,2,"2:29",449,"Olin Carter III made Three Point Jumper. Assisted by Isaiah Wright.",68,71,"North Texas","San Diego",9.5,"400987000"
291,2,"2:09",429,"Foul on Olin Carter III.",68,71,"North Texas","San Diego",9.5,"400987000"
292,2,"2:09",429,"A.J. Lawson made Free Throw.",68,72,"North Texas","San Diego",9.5,"400987000"
293,2,"2:09",429,"A.J. Lawson missed Free Throw.",68,72,"North Texas","San Diego",9.5,"400987000"
294,2,"2:09",429,"Isaiah Wright Defensive Rebound.",68,72,"North Texas","San Diego",9.5,"400987000"
295,2,"1:55",415,"Tyler Williams made Jumper.",70,72,"North Texas","San Diego",9.5,"400987000"
296,2,"1:31",391,"Roosevelt Smart made Three Point Jumper. Assisted by Allante Holston.",70,75,"North Texas","San Diego",9.5,"400987000"
297,2,"1:24",384,"San Diego  Timeout",70,75,"North Texas","San Diego",9.5,"400987000"
298,2,"1:13",373,"Tyler Williams Turnover.",70,75,"North Texas","San Diego",9.5,"400987000"
299,2,"1:12",372,"DJ Draper Steal.",70,75,"North Texas","San Diego",9.5,"400987000"
300,2,"0:50",350,"A.J. Lawson missed Jumper.",70,75,"North Texas","San Diego",9.5,"400987000"
301,2,"0:50",350,"San Diego Defensive Rebound.",70,75,"North Texas","San Diego",9.5,"400987000"
302,2,"0:30",330,"Tyler Williams made Jumper. Assisted by Isaiah Wright.",72,75,"North Texas","San Diego",9.5,"400987000"
303,2,"0:28",328,"Foul on Cameron Neubauer.",72,75,"North Texas","San Diego",9.5,"400987000"
304,2,"0:28",328,"Roosevelt Smart made Free Throw.",72,76,"North Texas","San Diego",9.5,"400987000"
305,2,"0:28",328,"Roosevelt Smart made Free Throw.",72,77,"North Texas","San Diego",9.5,"400987000"
306,2,"0:25",325,"Foul on Ryan Woolridge.",72,77,"North Texas","San Diego",9.5,"400987000"
307,2,"0:25",325,"Isaiah Wright made Free Throw.",73,77,"North Texas","San Diego",9.5,"400987000"
308,2,"0:25",325,"Isaiah Wright made Free Throw.",74,77,"North Texas","San Diego",9.5,"400987000"
309,2,"0:25",325,"North Texas  Turnover.",74,77,"North Texas","San Diego",9.5,"400987000"
310,2,"0:18",318,"Olin Carter III made Three Point Jumper. Assisted by Isaiah Wright.",77,77,"North Texas","San Diego",9.5,"400987000"
311,2,"0:11",311,"North Texas  Timeout",77,77,"North Texas","San Diego",9.5,"400987000"
312,2,"0:00",300,"Roosevelt Smart missed Jumper.",77,77,"North Texas","San Diego",9.5,"400987000"
313,2,"0:00",300,"San Diego Defensive Rebound.",77,77,"North Texas","San Diego",9.5,"400987000"
314,2,"0:00",300,"End of 2nd half",77,77,"North Texas","San Diego",9.5,"400987000"
315,3,"5:00",300,"PLAY",77,77,"North Texas","San Diego",9.5,"400987000"
316,3,"4:48",288,"Juwan Gray missed Jumper.",77,77,"North Texas","San Diego",9.5,"400987000"
317,3,"4:48",288,"A.J. Lawson Defensive Rebound.",77,77,"North Texas","San Diego",9.5,"400987000"
318,3,"4:23",263,"Roosevelt Smart missed Jumper.",77,77,"North Texas","San Diego",9.5,"400987000"
319,3,"4:23",263,"North Texas Offensive Rebound.",77,77,"North Texas","San Diego",9.5,"400987000"
320,3,"4:11",251,"Foul on Cameron Neubauer.",77,77,"North Texas","San Diego",9.5,"400987000"
321,3,"4:11",251,"Ryan Woolridge made Free Throw.",77,78,"North Texas","San Diego",9.5,"400987000"
322,3,"4:11",251,"Ryan Woolridge made Free Throw.",77,79,"North Texas","San Diego",9.5,"400987000"
323,3,"3:49",229,"Olin Carter III missed Three Point Jumper.",77,79,"North Texas","San Diego",9.5,"400987000"
324,3,"3:49",229,"Allante Holston Defensive Rebound.",77,79,"North Texas","San Diego",9.5,"400987000"
325,3,"3:31",211,"Shane Temara Turnover.",77,79,"North Texas","San Diego",9.5,"400987000"
326,3,"3:08",188,"Isaiah Wright made Layup.",79,79,"North Texas","San Diego",9.5,"400987000"
327,3,"2:35",155,"Roosevelt Smart made Three Point Jumper.",79,82,"North Texas","San Diego",9.5,"400987000"
328,3,"2:14",134,"Juwan Gray missed Three Point Jumper.",79,82,"North Texas","San Diego",9.5,"400987000"
329,3,"2:14",134,"Roosevelt Smart Defensive Rebound.",79,82,"North Texas","San Diego",9.5,"400987000"
330,3,"1:49",109,"Roosevelt Smart missed Three Point Jumper.",79,82,"North Texas","San Diego",9.5,"400987000"
331,3,"1:49",109,"Isaiah Pineiro Defensive Rebound.",79,82,"North Texas","San Diego",9.5,"400987000"
332,3,"1:35",95,"Foul on Roosevelt Smart.",79,82,"North Texas","San Diego",9.5,"400987000"
333,3,"1:35",95,"Isaiah Pineiro made Free Throw.",80,82,"North Texas","San Diego",9.5,"400987000"
334,3,"1:35",95,"Isaiah Pineiro made Free Throw.",81,82,"North Texas","San Diego",9.5,"400987000"
335,3,"1:21",81,"A.J. Lawson missed Three Point Jumper.",81,82,"North Texas","San Diego",9.5,"400987000"
336,3,"1:21",81,"Ryan Woolridge Offensive Rebound.",81,82,"North Texas","San Diego",9.5,"400987000"
337,3,"1:04",64,"Roosevelt Smart missed Three Point Jumper.",81,82,"North Texas","San Diego",9.5,"400987000"
338,3,"1:04",64,"Ryan Woolridge Offensive Rebound.",81,82,"North Texas","San Diego",9.5,"400987000"
339,3,"0:50",50,"North Texas  Timeout",81,82,"North Texas","San Diego",9.5,"400987000"
340,3,"0:35",35,"Roosevelt Smart made Jumper.",81,84,"North Texas","San Diego",9.5,"400987000"
341,3,"0:14",14,"Isaiah Pineiro missed Three Point Jumper.",81,84,"North Texas","San Diego",9.5,"400987000"
342,3,"0:14",14,"A.J. Lawson Defensive Rebound.",81,84,"North Texas","San Diego",9.5,"400987000"
343,3,"0:12",12,"Foul on Isaiah Wright.",81,84,"North Texas","San Diego",9.5,"400987000"
344,3,"0:12",12,"A.J. Lawson missed Free Throw.",81,84,"North Texas","San Diego",9.5,"400987000"
345,3,"0:12",12,"North Texas Deadball Team Rebound.",81,84,"North Texas","San Diego",9.5,"400987000"
346,3,"0:12",12,"A.J. Lawson made Free Throw.",81,85,"North Texas","San Diego",9.5,"400987000"
347,3,"0:06",6,"Foul on DJ Draper.",81,85,"North Texas","San Diego",9.5,"400987000"
348,3,"0:06",6,"Tyler Williams made Free Throw.",82,85,"North Texas","San Diego",9.5,"400987000"
349,3,"0:06",6,"Tyler Williams made Free Throw.",83,85,"North Texas","San Diego",9.5,"400987000"
350,3,"0:04",4,"Foul on Isaiah Wright.",83,85,"North Texas","San Diego",9.5,"400987000"
351,3,"0:04",4,"DJ Draper missed Free Throw.",83,85,"North Texas","San Diego",9.5,"400987000"
352,3,"0:04",4,"North Texas Deadball Team Rebound.",83,85,"North Texas","San Diego",9.5,"400987000"
353,3,"0:04",4,"San Diego  Timeout",83,85,"North Texas","San Diego",9.5,"400987000"
354,3,"0:04",4,"DJ Draper made Free Throw.",83,86,"North Texas","San Diego",9.5,"400987000"
355,3,"0:04",4,"San Diego  Timeout",83,86,"North Texas","San Diego",9.5,"400987000"
356,3,"0:03",3,"Isaiah Pineiro Turnover.",83,86,"North Texas","San Diego",9.5,"400987000"
357,3,"0:00",0,"Allante Holston Turnover.",83,86,"North Texas","San Diego",9.5,"400987000"
358,3,"0:00",0,"Yauhen Massalski Steal.",83,86,"North Texas","San Diego",9.5,"400987000"
359,3,"0:00",0,"Yauhen Massalski missed Three Point Jumper.",83,86,"North Texas","San Diego",9.5,"400987000"
360,3,"0:00",0,"North Texas Defensive Rebound.",83,86,"North Texas","San Diego",9.5,"400987000"
361,3,"0:00",0,"End of Game",83,86,"North Texas","San Diego",9.5,"400987000"
1,1,"20:00",2400,"PLAY",0,0,"Life Pacific","San Diego",NA,"400987001"
2,1,"19:48",2388,"Foul on Trey Huckabay.",0,0,"Life Pacific","San Diego",NA,"400987001"
3,1,"19:41",2381,"Olin Carter III missed Jumper.",0,0,"Life Pacific","San Diego",NA,"400987001"
4,1,"19:41",2381,"Isaiah Pineiro Offensive Rebound.",0,0,"Life Pacific","San Diego",NA,"400987001"
5,1,"19:40",2380,"Isaiah Pineiro made Two Point Tip Shot.",2,0,"Life Pacific","San Diego",NA,"400987001"
6,1,"19:40",2380,"Foul on Trey Huckabay.",2,0,"Life Pacific","San Diego",NA,"400987001"
7,1,"19:40",2380,"Isaiah Pineiro missed Free Throw.",2,0,"Life Pacific","San Diego",NA,"400987001"
8,1,"19:40",2380,"Jonathan Cortez Defensive Rebound.",2,0,"Life Pacific","San Diego",NA,"400987001"
9,1,"19:25",2365,"Jonathan Cortez missed Jumper.",2,0,"Life Pacific","San Diego",NA,"400987001"
10,1,"19:25",2365,"Isaiah Wright Defensive Rebound.",2,0,"Life Pacific","San Diego",NA,"400987001"
11,1,"19:18",2358,"Isaiah Pineiro made Layup. Assisted by Isaiah Wright.",4,0,"Life Pacific","San Diego",NA,"400987001"
12,1,"18:51",2331,"Trey Huckabay missed Three Point Jumper.",4,0,"Life Pacific","San Diego",NA,"400987001"
13,1,"18:51",2331,"Olin Carter III Defensive Rebound.",4,0,"Life Pacific","San Diego",NA,"400987001"
14,1,"18:41",2321,"Olin Carter III Turnover.",4,0,"Life Pacific","San Diego",NA,"400987001"
15,1,"18:39",2319,"Adam Saavedra Steal.",4,0,"Life Pacific","San Diego",NA,"400987001"
16,1,"18:36",2316,"Adam Saavedra missed Layup.",4,0,"Life Pacific","San Diego",NA,"400987001"
17,1,"18:36",2316,"Tyler Williams Defensive Rebound.",4,0,"Life Pacific","San Diego",NA,"400987001"
18,1,"18:19",2299,"Cameron Neubauer missed Three Point Jumper.",4,0,"Life Pacific","San Diego",NA,"400987001"
19,1,"18:19",2299,"Mark Eden Defensive Rebound.",4,0,"Life Pacific","San Diego",NA,"400987001"
20,1,"18:10",2290,"Mark Eden made Layup.",4,2,"Life Pacific","San Diego",NA,"400987001"
21,1,"17:54",2274,"Isaiah Wright missed Three Point Jumper.",4,2,"Life Pacific","San Diego",NA,"400987001"
22,1,"17:54",2274,"San Diego Offensive Rebound.",4,2,"Life Pacific","San Diego",NA,"400987001"
23,1,"17:44",2264,"Tyler Williams made Three Point Jumper. Assisted by Isaiah Pineiro.",7,2,"Life Pacific","San Diego",NA,"400987001"
24,1,"17:22",2242,"Foul on Isaiah Pineiro.",7,2,"Life Pacific","San Diego",NA,"400987001"
25,1,"17:22",2242,"Jonathan Cortez missed Free Throw.",7,2,"Life Pacific","San Diego",NA,"400987001"
26,1,"17:22",2242,"Life Pacific Deadball Team Rebound.",7,2,"Life Pacific","San Diego",NA,"400987001"
27,1,"17:22",2242,"Jonathan Cortez made Free Throw.",7,3,"Life Pacific","San Diego",NA,"400987001"
28,1,"17:12",2232,"Foul on Adam Saavedra.",7,3,"Life Pacific","San Diego",NA,"400987001"
29,1,"17:12",2232,"Isaiah Wright made Free Throw.",8,3,"Life Pacific","San Diego",NA,"400987001"
30,1,"17:12",2232,"Isaiah Wright made Free Throw.",9,3,"Life Pacific","San Diego",NA,"400987001"
31,1,"16:58",2218,"Mark Eden made Three Point Jumper. Assisted by Jonathan Cortez.",9,6,"Life Pacific","San Diego",NA,"400987001"
32,1,"16:51",2211,"Foul on Mark Eden.",9,6,"Life Pacific","San Diego",NA,"400987001"
33,1,"16:47",2207,"Olin Carter III made Three Point Jumper. Assisted by Isaiah Wright.",12,6,"Life Pacific","San Diego",NA,"400987001"
34,1,"16:25",2185,"Adam Saavedra missed Three Point Jumper.",12,6,"Life Pacific","San Diego",NA,"400987001"
35,1,"16:25",2185,"Olin Carter III Defensive Rebound.",12,6,"Life Pacific","San Diego",NA,"400987001"
36,1,"16:17",2177,"Isaiah Wright missed Jumper.",12,6,"Life Pacific","San Diego",NA,"400987001"
37,1,"16:17",2177,"Isaiah Pineiro Offensive Rebound.",12,6,"Life Pacific","San Diego",NA,"400987001"
38,1,"16:12",2172,"Isaiah Pineiro missed Jumper.",12,6,"Life Pacific","San Diego",NA,"400987001"
39,1,"16:12",2172,"Isaiah Wright Offensive Rebound.",12,6,"Life Pacific","San Diego",NA,"400987001"
40,1,"16:11",2171,"Isaiah Wright Turnover.",12,6,"Life Pacific","San Diego",NA,"400987001"
41,1,"16:10",2170,"Mark Eden Steal.",12,6,"Life Pacific","San Diego",NA,"400987001"
42,1,"15:50",2150,"Mark Eden made Three Point Jumper.",12,9,"Life Pacific","San Diego",NA,"400987001"
43,1,"15:37",2137,"Isaiah Pineiro missed Layup.",12,9,"Life Pacific","San Diego",NA,"400987001"
44,1,"15:37",2137,"Trey Huckabay Defensive Rebound.",12,9,"Life Pacific","San Diego",NA,"400987001"
45,1,"15:24",2124,"James Noble missed Jumper.",12,9,"Life Pacific","San Diego",NA,"400987001"
46,1,"15:24",2124,"Isaiah Pineiro Block.",12,9,"Life Pacific","San Diego",NA,"400987001"
47,1,"15:20",2120,"Isaiah Wright Defensive Rebound.",12,9,"Life Pacific","San Diego",NA,"400987001"
48,1,"15:17",2117,"Tyler Williams made Three Point Jumper. Assisted by Isaiah Wright.",15,9,"Life Pacific","San Diego",NA,"400987001"
49,1,"14:54",2094,"Mark Eden missed Jumper.",15,9,"Life Pacific","San Diego",NA,"400987001"
50,1,"14:54",2094,"Olin Carter III Defensive Rebound.",15,9,"Life Pacific","San Diego",NA,"400987001"
51,1,"14:40",2080,"Olin Carter III missed Three Point Jumper.",15,9,"Life Pacific","San Diego",NA,"400987001"
52,1,"14:40",2080,"Mark Eden Defensive Rebound.",15,9,"Life Pacific","San Diego",NA,"400987001"
53,1,"14:20",2060,"Foul on Olin Carter III.",15,9,"Life Pacific","San Diego",NA,"400987001"
54,1,"14:20",2060,"Official TV Timeout",15,9,"Life Pacific","San Diego",NA,"400987001"
55,1,"14:01",2041,"Jonathan Cortez missed Jumper.",15,9,"Life Pacific","San Diego",NA,"400987001"
56,1,"14:01",2041,"Juwan Gray Defensive Rebound.",15,9,"Life Pacific","San Diego",NA,"400987001"
57,1,"13:53",2033,"Isaiah Wright Turnover.",15,9,"Life Pacific","San Diego",NA,"400987001"
58,1,"13:32",2012,"Jonathan Cortez missed Jumper.",15,9,"Life Pacific","San Diego",NA,"400987001"
59,1,"13:32",2012,"Juwan Gray Defensive Rebound.",15,9,"Life Pacific","San Diego",NA,"400987001"
60,1,"13:11",1991,"Olin Carter III made Jumper.",17,9,"Life Pacific","San Diego",NA,"400987001"
61,1,"12:45",1965,"Mark Eden Turnover.",17,9,"Life Pacific","San Diego",NA,"400987001"
62,1,"12:43",1963,"Isaiah Wright Steal.",17,9,"Life Pacific","San Diego",NA,"400987001"
63,1,"12:41",1961,"Tyler Williams missed Three Point Jumper.",17,9,"Life Pacific","San Diego",NA,"400987001"
64,1,"12:41",1961,"Alex Floresca Offensive Rebound.",17,9,"Life Pacific","San Diego",NA,"400987001"
65,1,"12:36",1956,"Olin Carter III missed Three Point Jumper.",17,9,"Life Pacific","San Diego",NA,"400987001"
66,1,"12:36",1956,"Trey Huckabay Defensive Rebound.",17,9,"Life Pacific","San Diego",NA,"400987001"
67,1,"12:18",1938,"Foul on Juwan Gray.",17,9,"Life Pacific","San Diego",NA,"400987001"
68,1,"12:18",1938,"Trey Huckabay made Free Throw.",17,10,"Life Pacific","San Diego",NA,"400987001"
69,1,"12:18",1938,"Trey Huckabay made Free Throw.",17,11,"Life Pacific","San Diego",NA,"400987001"
70,1,"12:03",1923,"Alex Floresca made Layup. Assisted by Olin Carter III.",19,11,"Life Pacific","San Diego",NA,"400987001"
71,1,"11:34",1894,"James Noble missed Three Point Jumper.",19,11,"Life Pacific","San Diego",NA,"400987001"
72,1,"11:34",1894,"San Diego Defensive Rebound.",19,11,"Life Pacific","San Diego",NA,"400987001"
73,1,"11:32",1892,"Official TV Timeout",19,11,"Life Pacific","San Diego",NA,"400987001"
74,1,"11:16",1876,"Isaiah Wright Turnover.",19,11,"Life Pacific","San Diego",NA,"400987001"
75,1,"11:14",1874,"Mark Eden Steal.",19,11,"Life Pacific","San Diego",NA,"400987001"
76,1,"10:58",1858,"Trey Huckabay missed Three Point Jumper.",19,11,"Life Pacific","San Diego",NA,"400987001"
77,1,"10:58",1858,"Isaiah Wright Block.",19,11,"Life Pacific","San Diego",NA,"400987001"
78,1,"10:55",1855,"Isaiah Pineiro Defensive Rebound.",19,11,"Life Pacific","San Diego",NA,"400987001"
79,1,"10:38",1838,"Juwan Gray made Layup. Assisted by Isaiah Wright.",21,11,"Life Pacific","San Diego",NA,"400987001"
80,1,"10:16",1816,"Jacob Brummett made Layup. Assisted by James Noble.",21,13,"Life Pacific","San Diego",NA,"400987001"
81,1,"9:58",1798,"Yauhen Massalski made Layup. Assisted by Isaiah Pineiro.",23,13,"Life Pacific","San Diego",NA,"400987001"
82,1,"9:29",1769,"Chez Lister missed Layup.",23,13,"Life Pacific","San Diego",NA,"400987001"
83,1,"9:29",1769,"Yauhen Massalski Block.",23,13,"Life Pacific","San Diego",NA,"400987001"
84,1,"9:27",1767,"Juwan Gray Defensive Rebound.",23,13,"Life Pacific","San Diego",NA,"400987001"
85,1,"9:23",1763,"Isaiah Pineiro made Jumper. Assisted by Juwan Gray.",25,13,"Life Pacific","San Diego",NA,"400987001"
86,1,"8:56",1736,"Dean Waltz missed Three Point Jumper.",25,13,"Life Pacific","San Diego",NA,"400987001"
87,1,"8:56",1736,"Cameron Neubauer Defensive Rebound.",25,13,"Life Pacific","San Diego",NA,"400987001"
88,1,"8:41",1721,"Juwan Gray missed Three Point Jumper.",25,13,"Life Pacific","San Diego",NA,"400987001"
89,1,"8:41",1721,"Elijah Todd Defensive Rebound.",25,13,"Life Pacific","San Diego",NA,"400987001"
90,1,"8:09",1689,"Chez Lister missed Three Point Jumper.",25,13,"Life Pacific","San Diego",NA,"400987001"
91,1,"8:09",1689,"Juwan Gray Block.",25,13,"Life Pacific","San Diego",NA,"400987001"
92,1,"8:06",1686,"Isaiah Pineiro Defensive Rebound.",25,13,"Life Pacific","San Diego",NA,"400987001"
93,1,"8:01",1681,"Isaiah Wright missed Three Point Jumper.",25,13,"Life Pacific","San Diego",NA,"400987001"
94,1,"8:01",1681,"Yauhen Massalski Offensive Rebound.",25,13,"Life Pacific","San Diego",NA,"400987001"
95,1,"7:55",1675,"Foul on Jacob Brummett.",25,13,"Life Pacific","San Diego",NA,"400987001"
96,1,"7:55",1675,"Official TV Timeout",25,13,"Life Pacific","San Diego",NA,"400987001"
97,1,"7:52",1672,"Isaiah Pineiro missed Jumper.",25,13,"Life Pacific","San Diego",NA,"400987001"
98,1,"7:52",1672,"Yauhen Massalski Offensive Rebound.",25,13,"Life Pacific","San Diego",NA,"400987001"
99,1,"7:43",1663,"Foul on Jonathan Cortez.",25,13,"Life Pacific","San Diego",NA,"400987001"
100,1,"7:43",1663,"Yauhen Massalski missed Free Throw.",25,13,"Life Pacific","San Diego",NA,"400987001"
101,1,"7:43",1663,"San Diego Deadball Team Rebound.",25,13,"Life Pacific","San Diego",NA,"400987001"
102,1,"7:43",1663,"Yauhen Massalski made Free Throw.",26,13,"Life Pacific","San Diego",NA,"400987001"
103,1,"7:32",1652,"Foul on Isaiah Wright.",26,13,"Life Pacific","San Diego",NA,"400987001"
104,1,"7:31",1651,"Elijah Todd missed Three Point Jumper.",26,13,"Life Pacific","San Diego",NA,"400987001"
105,1,"7:31",1651,"San Diego Defensive Rebound.",26,13,"Life Pacific","San Diego",NA,"400987001"
106,1,"7:14",1634,"Isaiah Pineiro missed Three Point Jumper.",26,13,"Life Pacific","San Diego",NA,"400987001"
107,1,"7:14",1634,"Chez Lister Defensive Rebound.",26,13,"Life Pacific","San Diego",NA,"400987001"
108,1,"7:09",1629,"Foul on Tyler Williams.",26,13,"Life Pacific","San Diego",NA,"400987001"
109,1,"6:47",1607,"Mark Eden missed Jumper.",26,13,"Life Pacific","San Diego",NA,"400987001"
110,1,"6:47",1607,"Isaiah Wright Block.",26,13,"Life Pacific","San Diego",NA,"400987001"
111,1,"6:44",1604,"Isaiah Wright Defensive Rebound.",26,13,"Life Pacific","San Diego",NA,"400987001"
112,1,"6:38",1598,"Tyler Williams missed Three Point Jumper.",26,13,"Life Pacific","San Diego",NA,"400987001"
113,1,"6:38",1598,"Life Pacific Defensive Rebound.",26,13,"Life Pacific","San Diego",NA,"400987001"
114,1,"6:19",1579,"Mark Eden missed Three Point Jumper.",26,13,"Life Pacific","San Diego",NA,"400987001"
115,1,"6:19",1579,"Alex Floresca Defensive Rebound.",26,13,"Life Pacific","San Diego",NA,"400987001"
116,1,"6:09",1569,"Isaiah Wright made Jumper.",28,13,"Life Pacific","San Diego",NA,"400987001"
117,1,"5:49",1549,"Foul on Alex Floresca.",28,13,"Life Pacific","San Diego",NA,"400987001"
118,1,"5:33",1533,"Adam Saavedra missed Jumper.",28,13,"Life Pacific","San Diego",NA,"400987001"
119,1,"5:33",1533,"Jonathan Cortez Offensive Rebound.",28,13,"Life Pacific","San Diego",NA,"400987001"
120,1,"5:30",1530,"Chez Lister missed Jumper.",28,13,"Life Pacific","San Diego",NA,"400987001"
121,1,"5:30",1530,"Tyler Williams Defensive Rebound.",28,13,"Life Pacific","San Diego",NA,"400987001"
122,1,"5:22",1522,"Foul on Jonathan Cortez.",28,13,"Life Pacific","San Diego",NA,"400987001"
123,1,"5:22",1522,"Alex Floresca made Free Throw.",29,13,"Life Pacific","San Diego",NA,"400987001"
124,1,"5:22",1522,"Alex Floresca made Free Throw.",30,13,"Life Pacific","San Diego",NA,"400987001"
125,1,"4:55",1495,"Chez Lister made Layup.",30,15,"Life Pacific","San Diego",NA,"400987001"
126,1,"4:44",1484,"Juwan Gray Turnover.",30,15,"Life Pacific","San Diego",NA,"400987001"
127,1,"4:42",1482,"Chez Lister Steal.",30,15,"Life Pacific","San Diego",NA,"400987001"
128,1,"4:39",1479,"Chez Lister missed Jumper.",30,15,"Life Pacific","San Diego",NA,"400987001"
129,1,"4:39",1479,"Juwan Gray Block.",30,15,"Life Pacific","San Diego",NA,"400987001"
130,1,"4:39",1479,"Life Pacific Offensive Rebound.",30,15,"Life Pacific","San Diego",NA,"400987001"
131,1,"4:38",1478,"James Noble missed Jumper.",30,15,"Life Pacific","San Diego",NA,"400987001"
132,1,"4:38",1478,"Tyler Williams Defensive Rebound.",30,15,"Life Pacific","San Diego",NA,"400987001"
133,1,"4:11",1451,"Yauhen Massalski made Layup.",32,15,"Life Pacific","San Diego",NA,"400987001"
134,1,"3:56",1436,"Foul on Cameron Neubauer.",32,15,"Life Pacific","San Diego",NA,"400987001"
135,1,"3:56",1436,"Official TV Timeout",32,15,"Life Pacific","San Diego",NA,"400987001"
136,1,"3:56",1436,"Jacob Brummett missed Free Throw.",32,15,"Life Pacific","San Diego",NA,"400987001"
137,1,"3:56",1436,"Life Pacific Deadball Team Rebound.",32,15,"Life Pacific","San Diego",NA,"400987001"
138,1,"3:56",1436,"Jacob Brummett made Free Throw.",32,16,"Life Pacific","San Diego",NA,"400987001"
139,1,"3:43",1423,"Foul on James Noble.",32,16,"Life Pacific","San Diego",NA,"400987001"
140,1,"3:43",1423,"Yauhen Massalski missed Free Throw.",32,16,"Life Pacific","San Diego",NA,"400987001"
141,1,"3:43",1423,"San Diego Deadball Team Rebound.",32,16,"Life Pacific","San Diego",NA,"400987001"
142,1,"3:43",1423,"Yauhen Massalski made Free Throw.",33,16,"Life Pacific","San Diego",NA,"400987001"
143,1,"3:24",1404,"Jacob Brummett missed Layup.",33,16,"Life Pacific","San Diego",NA,"400987001"
144,1,"3:24",1404,"Yauhen Massalski Block.",33,16,"Life Pacific","San Diego",NA,"400987001"
145,1,"3:21",1401,"Isaiah Wright Defensive Rebound.",33,16,"Life Pacific","San Diego",NA,"400987001"
146,1,"3:16",1396,"Cameron Neubauer made Three Point Jumper. Assisted by Tyler Williams.",36,16,"Life Pacific","San Diego",NA,"400987001"
147,1,"2:57",1377,"Mark Eden made Layup.",36,18,"Life Pacific","San Diego",NA,"400987001"
148,1,"2:38",1358,"Cameron Neubauer missed Three Point Jumper.",36,18,"Life Pacific","San Diego",NA,"400987001"
149,1,"2:38",1358,"Mark Eden Defensive Rebound.",36,18,"Life Pacific","San Diego",NA,"400987001"
150,1,"2:15",1335,"Adam Saavedra Turnover.",36,18,"Life Pacific","San Diego",NA,"400987001"
151,1,"2:13",1333,"Cameron Neubauer Steal.",36,18,"Life Pacific","San Diego",NA,"400987001"
152,1,"2:11",1331,"Tyler Williams missed Three Point Jumper.",36,18,"Life Pacific","San Diego",NA,"400987001"
153,1,"2:11",1331,"Jacob Brummett Defensive Rebound.",36,18,"Life Pacific","San Diego",NA,"400987001"
154,1,"1:41",1301,"Foul on Yauhen Massalski.",36,18,"Life Pacific","San Diego",NA,"400987001"
155,1,"1:41",1301,"James Noble made Free Throw.",36,19,"Life Pacific","San Diego",NA,"400987001"
156,1,"1:41",1301,"James Noble made Free Throw.",36,20,"Life Pacific","San Diego",NA,"400987001"
157,1,"1:22",1282,"Isaiah Wright made Three Point Jumper. Assisted by Isaiah Pineiro.",39,20,"Life Pacific","San Diego",NA,"400987001"
