"play_id","half","time_remaining_half","secs_remaining","description","home_score","away_score","away","home","home_favored_by","game_id"
339,2,"0:16",16,"Isaiah Pineiro missed Free Throw.",70,62,"Norfolk State","San Diego",NA,"400986992"
340,2,"0:16",16,"San Diego Deadball Team Rebound.",70,62,"Norfolk State","San Diego",NA,"400986992"
341,2,"0:16",16,"Isaiah Pineiro made Free Throw.",71,62,"Norfolk State","San Diego",NA,"400986992"
342,2,"0:09",9,"Derrik Jamerson Jr. missed Three Point Jumper.",71,62,"Norfolk State","San Diego",NA,"400986992"
343,2,"0:09",9,"Norfolk State Offensive Rebound.",71,62,"Norfolk State","San Diego",NA,"400986992"
344,2,"0:03",3,"Steven Whitley missed Three Point Jumper.",71,62,"Norfolk State","San Diego",NA,"400986992"
345,2,"0:03",3,"Juwan Gray Defensive Rebound.",71,62,"Norfolk State","San Diego",NA,"400986992"
346,2,"0:00",0,"End of Game",71,62,"Norfolk State","San Diego",NA,"400986992"
1,1,"20:00",2400,"PLAY",0,0,"Little Rock","San Diego",8.5,"400986993"
2,1,"19:33",2373,"Jaizec Lottie missed Jumper.",0,0,"Little Rock","San Diego",8.5,"400986993"
3,1,"19:33",2373,"Isaiah Wright Defensive Rebound.",0,0,"Little Rock","San Diego",8.5,"400986993"
4,1,"19:22",2362,"Olin Carter III missed Layup.",0,0,"Little Rock","San Diego",8.5,"400986993"
5,1,"19:22",2362,"Andre Jones Defensive Rebound.",0,0,"Little Rock","San Diego",8.5,"400986993"
6,1,"19:16",2356,"Ben Marcus Turnover.",0,0,"Little Rock","San Diego",8.5,"400986993"
7,1,"19:15",2355,"Alex Floresca Steal.",0,0,"Little Rock","San Diego",8.5,"400986993"
8,1,"18:48",2328,"Isaiah Wright made Three Point Jumper.",3,0,"Little Rock","San Diego",8.5,"400986993"
9,1,"18:18",2298,"Andre Jones missed Three Point Jumper.",3,0,"Little Rock","San Diego",8.5,"400986993"
10,1,"18:18",2298,"Isaiah Pineiro Defensive Rebound.",3,0,"Little Rock","San Diego",8.5,"400986993"
11,1,"18:12",2292,"Olin Carter III missed Three Point Jumper.",3,0,"Little Rock","San Diego",8.5,"400986993"
12,1,"18:12",2292,"Cameron Neubauer Offensive Rebound.",3,0,"Little Rock","San Diego",8.5,"400986993"
13,1,"18:07",2287,"Isaiah Pineiro made Layup.",5,0,"Little Rock","San Diego",8.5,"400986993"
14,1,"18:07",2287,"Foul on Ben Marcus.",5,0,"Little Rock","San Diego",8.5,"400986993"
15,1,"18:07",2287,"Little Rock  Timeout",5,0,"Little Rock","San Diego",8.5,"400986993"
16,1,"18:05",2285,"Isaiah Pineiro missed Free Throw.",5,0,"Little Rock","San Diego",8.5,"400986993"
17,1,"18:05",2285,"Ben Marcus Defensive Rebound.",5,0,"Little Rock","San Diego",8.5,"400986993"
18,1,"17:40",2260,"Jaizec Lottie Turnover.",5,0,"Little Rock","San Diego",8.5,"400986993"
19,1,"17:38",2258,"Isaiah Pineiro Steal.",5,0,"Little Rock","San Diego",8.5,"400986993"
20,1,"17:32",2252,"Cameron Neubauer missed Three Point Jumper.",5,0,"Little Rock","San Diego",8.5,"400986993"
21,1,"17:32",2252,"Alex Floresca Offensive Rebound.",5,0,"Little Rock","San Diego",8.5,"400986993"
22,1,"17:32",2252,"Foul on Oliver Black.",5,0,"Little Rock","San Diego",8.5,"400986993"
23,1,"17:25",2245,"Isaiah Pineiro made Three Point Jumper. Assisted by Olin Carter III.",8,0,"Little Rock","San Diego",8.5,"400986993"
24,1,"16:59",2219,"Wadly Mompremier missed Jumper.",8,0,"Little Rock","San Diego",8.5,"400986993"
25,1,"16:59",2219,"Alex Floresca Defensive Rebound.",8,0,"Little Rock","San Diego",8.5,"400986993"
26,1,"16:45",2205,"Isaiah Pineiro missed Jumper.",8,0,"Little Rock","San Diego",8.5,"400986993"
27,1,"16:45",2205,"Anthony Black Defensive Rebound.",8,0,"Little Rock","San Diego",8.5,"400986993"
28,1,"16:16",2176,"Foul on Anthony Black.",8,0,"Little Rock","San Diego",8.5,"400986993"
29,1,"16:16",2176,"Anthony Black Turnover.",8,0,"Little Rock","San Diego",8.5,"400986993"
30,1,"15:56",2156,"Juwan Gray missed Three Point Jumper.",8,0,"Little Rock","San Diego",8.5,"400986993"
31,1,"15:56",2156,"Little Rock Defensive Rebound.",8,0,"Little Rock","San Diego",8.5,"400986993"
32,1,"15:56",2156,"Foul on Yauhen Massalski.",8,0,"Little Rock","San Diego",8.5,"400986993"
33,1,"15:56",2156,"Official TV Timeout",8,0,"Little Rock","San Diego",8.5,"400986993"
34,1,"15:36",2136,"Cameron Corcoran missed Three Point Jumper.",8,0,"Little Rock","San Diego",8.5,"400986993"
35,1,"15:36",2136,"Damir Hadzic Offensive Rebound.",8,0,"Little Rock","San Diego",8.5,"400986993"
36,1,"15:21",2121,"Damir Hadzic missed Three Point Jumper.",8,0,"Little Rock","San Diego",8.5,"400986993"
37,1,"15:21",2121,"Isaiah Wright Defensive Rebound.",8,0,"Little Rock","San Diego",8.5,"400986993"
38,1,"15:10",2110,"Foul on Cameron Corcoran.",8,0,"Little Rock","San Diego",8.5,"400986993"
39,1,"14:59",2099,"Hunter Summy missed Three Point Jumper.",8,0,"Little Rock","San Diego",8.5,"400986993"
40,1,"14:59",2099,"Wadly Mompremier Defensive Rebound.",8,0,"Little Rock","San Diego",8.5,"400986993"
41,1,"14:51",2091,"Foul on Yauhen Massalski.",8,0,"Little Rock","San Diego",8.5,"400986993"
42,1,"14:36",2076,"K.J. Gilmore missed Three Point Jumper.",8,0,"Little Rock","San Diego",8.5,"400986993"
43,1,"14:36",2076,"Olin Carter III Defensive Rebound.",8,0,"Little Rock","San Diego",8.5,"400986993"
44,1,"14:12",2052,"Juwan Gray made Three Point Jumper. Assisted by Hunter Summy.",11,0,"Little Rock","San Diego",8.5,"400986993"
45,1,"13:57",2037,"Wadly Mompremier Turnover.",11,0,"Little Rock","San Diego",8.5,"400986993"
46,1,"13:56",2036,"Hunter Summy Steal.",11,0,"Little Rock","San Diego",8.5,"400986993"
47,1,"13:53",2033,"Hunter Summy missed Layup.",11,0,"Little Rock","San Diego",8.5,"400986993"
48,1,"13:53",2033,"Oliver Black Block.",11,0,"Little Rock","San Diego",8.5,"400986993"
49,1,"13:50",2030,"Anthony Black Defensive Rebound.",11,0,"Little Rock","San Diego",8.5,"400986993"
50,1,"13:28",2008,"K.J. Gilmore made Layup.",11,2,"Little Rock","San Diego",8.5,"400986993"
51,1,"13:04",1984,"Olin Carter III missed Three Point Jumper.",11,2,"Little Rock","San Diego",8.5,"400986993"
52,1,"13:04",1984,"Juwan Gray Offensive Rebound.",11,2,"Little Rock","San Diego",8.5,"400986993"
53,1,"12:58",1978,"Juwan Gray missed Jumper.",11,2,"Little Rock","San Diego",8.5,"400986993"
54,1,"12:56",1976,"Oliver Black Defensive Rebound.",11,2,"Little Rock","San Diego",8.5,"400986993"
55,1,"12:52",1972,"K.J. Gilmore missed Jumper.",11,2,"Little Rock","San Diego",8.5,"400986993"
56,1,"12:52",1972,"Little Rock Offensive Rebound.",11,2,"Little Rock","San Diego",8.5,"400986993"
57,1,"12:52",1972,"Wadly Mompremier made Layup.",11,4,"Little Rock","San Diego",8.5,"400986993"
58,1,"12:51",1971,"Olin Carter III Turnover.",11,4,"Little Rock","San Diego",8.5,"400986993"
59,1,"12:50",1970,"Cameron Corcoran Steal.",11,4,"Little Rock","San Diego",8.5,"400986993"
60,1,"12:00",1920,"Wadly Mompremier missed Three Point Jumper.",11,4,"Little Rock","San Diego",8.5,"400986993"
61,1,"12:00",1920,"Alex Floresca Defensive Rebound.",11,4,"Little Rock","San Diego",8.5,"400986993"
62,1,"11:49",1909,"Foul on Andre Jones.",11,4,"Little Rock","San Diego",8.5,"400986993"
63,1,"11:49",1909,"Official TV Timeout",11,4,"Little Rock","San Diego",8.5,"400986993"
64,1,"11:49",1909,"Olin Carter III missed Three Point Jumper.",11,4,"Little Rock","San Diego",8.5,"400986993"
65,1,"11:49",1909,"Kris Bankston Defensive Rebound.",11,4,"Little Rock","San Diego",8.5,"400986993"
66,1,"11:22",1882,"Andre Jones Turnover.",11,4,"Little Rock","San Diego",8.5,"400986993"
67,1,"11:22",1882,"Olin Carter III Steal.",11,4,"Little Rock","San Diego",8.5,"400986993"
68,1,"11:14",1874,"Jose Martinez missed Three Point Jumper.",11,4,"Little Rock","San Diego",8.5,"400986993"
69,1,"11:14",1874,"Isaiah Pineiro Offensive Rebound.",11,4,"Little Rock","San Diego",8.5,"400986993"
70,1,"11:14",1874,"Foul on Cameron Corcoran.",11,4,"Little Rock","San Diego",8.5,"400986993"
71,1,"10:49",1849,"Jose Martinez made Three Point Jumper. Assisted by Isaiah Pineiro.",14,4,"Little Rock","San Diego",8.5,"400986993"
72,1,"10:33",1833,"Oliver Black missed Jumper.",14,4,"Little Rock","San Diego",8.5,"400986993"
73,1,"10:33",1833,"Jose Martinez Defensive Rebound.",14,4,"Little Rock","San Diego",8.5,"400986993"
74,1,"10:22",1822,"Jose Martinez Turnover.",14,4,"Little Rock","San Diego",8.5,"400986993"
75,1,"10:21",1821,"Kris Bankston Steal.",14,4,"Little Rock","San Diego",8.5,"400986993"
76,1,"10:14",1814,"Foul on K.J. Gilmore.",14,4,"Little Rock","San Diego",8.5,"400986993"
77,1,"10:14",1814,"K.J. Gilmore Turnover.",14,4,"Little Rock","San Diego",8.5,"400986993"
78,1,"9:49",1789,"Jose Martinez missed Three Point Jumper.",14,4,"Little Rock","San Diego",8.5,"400986993"
79,1,"9:49",1789,"Andre Jones Defensive Rebound.",14,4,"Little Rock","San Diego",8.5,"400986993"
80,1,"9:38",1778,"Foul on Jose Martinez.",14,4,"Little Rock","San Diego",8.5,"400986993"
81,1,"9:38",1778,"Kris Bankston missed Free Throw.",14,4,"Little Rock","San Diego",8.5,"400986993"
82,1,"9:38",1778,"Little Rock Deadball Team Rebound.",14,4,"Little Rock","San Diego",8.5,"400986993"
83,1,"9:38",1778,"Kris Bankston made Free Throw.",14,5,"Little Rock","San Diego",8.5,"400986993"
84,1,"9:37",1777,"Isaiah Wright Turnover.",14,5,"Little Rock","San Diego",8.5,"400986993"
85,1,"9:19",1759,"Andre Jones Turnover.",14,5,"Little Rock","San Diego",8.5,"400986993"
86,1,"9:04",1744,"Foul on Jaizec Lottie.",14,5,"Little Rock","San Diego",8.5,"400986993"
87,1,"9:04",1744,"Isaiah Wright made Free Throw.",15,5,"Little Rock","San Diego",8.5,"400986993"
88,1,"9:04",1744,"Isaiah Wright missed Free Throw.",15,5,"Little Rock","San Diego",8.5,"400986993"
89,1,"9:04",1744,"Wadly Mompremier Defensive Rebound.",15,5,"Little Rock","San Diego",8.5,"400986993"
90,1,"8:46",1726,"Andre Jones Turnover.",15,5,"Little Rock","San Diego",8.5,"400986993"
91,1,"8:45",1725,"Isaiah Wright Steal.",15,5,"Little Rock","San Diego",8.5,"400986993"
92,1,"8:39",1719,"Isaiah Wright missed Layup.",15,5,"Little Rock","San Diego",8.5,"400986993"
93,1,"8:39",1719,"Andre Jones Defensive Rebound.",15,5,"Little Rock","San Diego",8.5,"400986993"
94,1,"8:39",1719,"Foul on Juwan Gray.",15,5,"Little Rock","San Diego",8.5,"400986993"
95,1,"8:22",1702,"Foul on Isaiah Pineiro.",15,5,"Little Rock","San Diego",8.5,"400986993"
96,1,"8:18",1698,"Foul on Kris Bankston.",15,5,"Little Rock","San Diego",8.5,"400986993"
97,1,"8:18",1698,"Kris Bankston Turnover.",15,5,"Little Rock","San Diego",8.5,"400986993"
98,1,"7:55",1675,"Cameron Neubauer made Three Point Jumper. Assisted by Isaiah Wright.",18,5,"Little Rock","San Diego",8.5,"400986993"
99,1,"7:50",1670,"Official TV Timeout",18,5,"Little Rock","San Diego",8.5,"400986993"
100,1,"7:38",1658,"Camron Reedus missed Three Point Jumper.",18,5,"Little Rock","San Diego",8.5,"400986993"
101,1,"7:38",1658,"Andre Jones Offensive Rebound.",18,5,"Little Rock","San Diego",8.5,"400986993"
102,1,"7:15",1635,"Andre Jones made Layup. Assisted by Jaizec Lottie.",18,7,"Little Rock","San Diego",8.5,"400986993"
103,1,"6:46",1606,"Isaiah Pineiro missed Jumper.",18,7,"Little Rock","San Diego",8.5,"400986993"
104,1,"6:46",1606,"Camron Reedus Defensive Rebound.",18,7,"Little Rock","San Diego",8.5,"400986993"
105,1,"6:22",1582,"Foul on Juwan Gray.",18,7,"Little Rock","San Diego",8.5,"400986993"
106,1,"6:22",1582,"Wadly Mompremier made Free Throw.",18,8,"Little Rock","San Diego",8.5,"400986993"
107,1,"6:22",1582,"Wadly Mompremier made Free Throw.",18,9,"Little Rock","San Diego",8.5,"400986993"
108,1,"5:57",1557,"Isaiah Pineiro missed Jumper.",18,9,"Little Rock","San Diego",8.5,"400986993"
109,1,"5:57",1557,"Jaizec Lottie Defensive Rebound.",18,9,"Little Rock","San Diego",8.5,"400986993"
110,1,"5:50",1550,"Damir Hadzic missed Three Point Jumper.",18,9,"Little Rock","San Diego",8.5,"400986993"
111,1,"5:50",1550,"Isaiah Pineiro Defensive Rebound.",18,9,"Little Rock","San Diego",8.5,"400986993"
112,1,"5:22",1522,"Isaiah Wright Turnover.",18,9,"Little Rock","San Diego",8.5,"400986993"
113,1,"5:22",1522,"Camron Reedus Steal.",18,9,"Little Rock","San Diego",8.5,"400986993"
114,1,"5:03",1503,"Khari Harley missed Three Point Jumper.",18,9,"Little Rock","San Diego",8.5,"400986993"
115,1,"5:03",1503,"Isaiah Wright Defensive Rebound.",18,9,"Little Rock","San Diego",8.5,"400986993"
116,1,"4:48",1488,"Olin Carter III missed Three Point Jumper.",18,9,"Little Rock","San Diego",8.5,"400986993"
117,1,"4:48",1488,"Camron Reedus Defensive Rebound.",18,9,"Little Rock","San Diego",8.5,"400986993"
118,1,"4:39",1479,"Camron Reedus missed Three Point Jumper.",18,9,"Little Rock","San Diego",8.5,"400986993"
119,1,"4:39",1479,"Isaiah Wright Defensive Rebound.",18,9,"Little Rock","San Diego",8.5,"400986993"
120,1,"4:20",1460,"Cameron Neubauer missed Three Point Jumper.",18,9,"Little Rock","San Diego",8.5,"400986993"
121,1,"4:20",1460,"Damir Hadzic Defensive Rebound.",18,9,"Little Rock","San Diego",8.5,"400986993"
122,1,"4:19",1459,"Foul on Alex Floresca.",18,9,"Little Rock","San Diego",8.5,"400986993"
123,1,"4:19",1459,"Damir Hadzic made Free Throw.",18,10,"Little Rock","San Diego",8.5,"400986993"
124,1,"4:19",1459,"Damir Hadzic made Free Throw.",18,11,"Little Rock","San Diego",8.5,"400986993"
125,1,"3:50",1430,"Isaiah Wright made Three Point Jumper.",21,11,"Little Rock","San Diego",8.5,"400986993"
126,1,"3:15",1395,"Damir Hadzic Turnover.",21,11,"Little Rock","San Diego",8.5,"400986993"
127,1,"3:15",1395,"Official TV Timeout",21,11,"Little Rock","San Diego",8.5,"400986993"
128,1,"3:01",1381,"Alex Floresca missed Three Point Jumper.",21,11,"Little Rock","San Diego",8.5,"400986993"
129,1,"3:01",1381,"Damir Hadzic Defensive Rebound.",21,11,"Little Rock","San Diego",8.5,"400986993"
130,1,"2:32",1352,"Andre Jones missed Layup.",21,11,"Little Rock","San Diego",8.5,"400986993"
131,1,"2:32",1352,"Damir Hadzic Offensive Rebound.",21,11,"Little Rock","San Diego",8.5,"400986993"
132,1,"2:31",1351,"Damir Hadzic made Jumper.",21,13,"Little Rock","San Diego",8.5,"400986993"
133,1,"2:31",1351,"Foul on Cameron Neubauer.",21,13,"Little Rock","San Diego",8.5,"400986993"
134,1,"2:31",1351,"Damir Hadzic missed Free Throw.",21,13,"Little Rock","San Diego",8.5,"400986993"
135,1,"2:31",1351,"Isaiah Pineiro Defensive Rebound.",21,13,"Little Rock","San Diego",8.5,"400986993"
136,1,"2:13",1333,"Cameron Neubauer made Three Point Jumper. Assisted by Isaiah Pineiro.",24,13,"Little Rock","San Diego",8.5,"400986993"
137,1,"1:56",1316,"Anthony Black made Layup. Assisted by Damir Hadzic.",24,15,"Little Rock","San Diego",8.5,"400986993"
138,1,"1:39",1299,"Cameron Neubauer missed Three Point Jumper.",24,15,"Little Rock","San Diego",8.5,"400986993"
139,1,"1:39",1299,"Andre Jones Defensive Rebound.",24,15,"Little Rock","San Diego",8.5,"400986993"
140,1,"1:32",1292,"Foul on Cameron Neubauer.",24,15,"Little Rock","San Diego",8.5,"400986993"
141,1,"1:32",1292,"Damir Hadzic made Free Throw.",24,16,"Little Rock","San Diego",8.5,"400986993"
142,1,"1:32",1292,"Damir Hadzic made Free Throw.",24,17,"Little Rock","San Diego",8.5,"400986993"
143,1,"1:27",1287,"Foul on Anthony Black.",24,17,"Little Rock","San Diego",8.5,"400986993"
144,1,"1:27",1287,"Isaiah Pineiro made Free Throw.",25,17,"Little Rock","San Diego",8.5,"400986993"
145,1,"1:27",1287,"Isaiah Pineiro made Free Throw.",26,17,"Little Rock","San Diego",8.5,"400986993"
146,1,"1:08",1268,"Damir Hadzic missed Jumper.",26,17,"Little Rock","San Diego",8.5,"400986993"
147,1,"1:08",1268,"Hunter Summy Defensive Rebound.",26,17,"Little Rock","San Diego",8.5,"400986993"
148,1,"1:00",1260,"San Diego  Timeout",26,17,"Little Rock","San Diego",8.5,"400986993"
149,1,"0:53",1253,"Isaiah Pineiro Turnover.",26,17,"Little Rock","San Diego",8.5,"400986993"
150,1,"0:39",1239,"Oliver Black made Layup.",26,19,"Little Rock","San Diego",8.5,"400986993"
151,1,"0:35",1235,"Cameron Neubauer Turnover.",26,19,"Little Rock","San Diego",8.5,"400986993"
152,1,"0:22",1222,"Cameron Corcoran Turnover.",26,19,"Little Rock","San Diego",8.5,"400986993"
153,1,"0:21",1221,"Isaiah Pineiro Steal.",26,19,"Little Rock","San Diego",8.5,"400986993"
154,1,"0:02",1202,"Isaiah Wright made Jumper.",28,19,"Little Rock","San Diego",8.5,"400986993"
155,1,"0:00",1200,"End of 1st half",28,19,"Little Rock","San Diego",8.5,"400986993"
156,2,"20:00",1200,"PLAY",28,19,"Little Rock","San Diego",8.5,"400986993"
157,2,"19:31",1171,"Cameron Neubauer made Layup. Assisted by Alex Floresca.",30,19,"Little Rock","San Diego",8.5,"400986993"
158,2,"19:06",1146,"Jaizec Lottie Turnover.",30,19,"Little Rock","San Diego",8.5,"400986993"
159,2,"19:05",1145,"Cameron Neubauer Steal.",30,19,"Little Rock","San Diego",8.5,"400986993"
160,2,"19:02",1142,"Foul on Oliver Black.",30,19,"Little Rock","San Diego",8.5,"400986993"
161,2,"19:02",1142,"Olin Carter III made Free Throw.",31,19,"Little Rock","San Diego",8.5,"400986993"
162,2,"19:02",1142,"Olin Carter III missed Free Throw.",31,19,"Little Rock","San Diego",8.5,"400986993"
163,2,"19:02",1142,"Alex Floresca Offensive Rebound.",31,19,"Little Rock","San Diego",8.5,"400986993"
164,2,"18:57",1137,"Alex Floresca made Layup.",33,19,"Little Rock","San Diego",8.5,"400986993"
165,2,"18:35",1115,"Andre Jones missed Jumper.",33,19,"Little Rock","San Diego",8.5,"400986993"
166,2,"18:35",1115,"Isaiah Pineiro Defensive Rebound.",33,19,"Little Rock","San Diego",8.5,"400986993"
167,2,"18:18",1098,"Isaiah Pineiro missed Jumper.",33,19,"Little Rock","San Diego",8.5,"400986993"
168,2,"18:18",1098,"Andre Jones Defensive Rebound.",33,19,"Little Rock","San Diego",8.5,"400986993"
169,2,"18:00",1080,"Jaizec Lottie missed Three Point Jumper.",33,19,"Little Rock","San Diego",8.5,"400986993"
170,2,"18:00",1080,"Isaiah Wright Defensive Rebound.",33,19,"Little Rock","San Diego",8.5,"400986993"
171,2,"17:55",1075,"Isaiah Pineiro made Dunk. Assisted by Isaiah Wright.",35,19,"Little Rock","San Diego",8.5,"400986993"
172,2,"17:54",1074,"Little Rock  Timeout",35,19,"Little Rock","San Diego",8.5,"400986993"
173,2,"17:39",1059,"Camron Reedus Turnover.",35,19,"Little Rock","San Diego",8.5,"400986993"
174,2,"17:38",1058,"Olin Carter III Steal.",35,19,"Little Rock","San Diego",8.5,"400986993"
175,2,"17:33",1053,"Foul on K.J. Gilmore.",35,19,"Little Rock","San Diego",8.5,"400986993"
176,2,"17:33",1053,"Isaiah Pineiro made Free Throw.",36,19,"Little Rock","San Diego",8.5,"400986993"
177,2,"17:33",1053,"Isaiah Pineiro made Free Throw.",37,19,"Little Rock","San Diego",8.5,"400986993"
178,2,"17:24",1044,"Camron Reedus missed Three Point Jumper.",37,19,"Little Rock","San Diego",8.5,"400986993"
179,2,"17:24",1044,"Alex Floresca Defensive Rebound.",37,19,"Little Rock","San Diego",8.5,"400986993"
180,2,"17:16",1036,"Isaiah Pineiro made Layup. Assisted by Isaiah Wright.",39,19,"Little Rock","San Diego",8.5,"400986993"
181,2,"16:58",1018,"Oliver Black made Layup. Assisted by K.J. Gilmore.",39,21,"Little Rock","San Diego",8.5,"400986993"
182,2,"16:58",1018,"Foul on Olin Carter III.",39,21,"Little Rock","San Diego",8.5,"400986993"
183,2,"16:58",1018,"Oliver Black missed Free Throw.",39,21,"Little Rock","San Diego",8.5,"400986993"
184,2,"16:58",1018,"Cameron Neubauer Defensive Rebound.",39,21,"Little Rock","San Diego",8.5,"400986993"
185,2,"16:44",1004,"Olin Carter III made Jumper. Assisted by Isaiah Pineiro.",41,21,"Little Rock","San Diego",8.5,"400986993"
186,2,"16:18",978,"K.J. Gilmore made Jumper.",41,23,"Little Rock","San Diego",8.5,"400986993"
187,2,"16:03",963,"Isaiah Wright Turnover.",41,23,"Little Rock","San Diego",8.5,"400986993"
188,2,"16:02",962,"Oliver Black Steal.",41,23,"Little Rock","San Diego",8.5,"400986993"
189,2,"15:55",955,"Cameron Corcoran made Three Point Jumper.",41,26,"Little Rock","San Diego",8.5,"400986993"
190,2,"15:33",933,"Official TV Timeout",41,26,"Little Rock","San Diego",8.5,"400986993"
191,2,"15:28",928,"Olin Carter III missed Three Point Jumper.",41,26,"Little Rock","San Diego",8.5,"400986993"
192,2,"15:28",928,"Anthony Black Defensive Rebound.",41,26,"Little Rock","San Diego",8.5,"400986993"
193,2,"15:05",905,"K.J. Gilmore missed Jumper.",41,26,"Little Rock","San Diego",8.5,"400986993"
194,2,"15:05",905,"Isaiah Pineiro Defensive Rebound.",41,26,"Little Rock","San Diego",8.5,"400986993"
195,2,"14:57",897,"Foul on Oliver Black.",41,26,"Little Rock","San Diego",8.5,"400986993"
196,2,"14:57",897,"Yauhen Massalski missed Free Throw.",41,26,"Little Rock","San Diego",8.5,"400986993"
197,2,"14:57",897,"San Diego Deadball Team Rebound.",41,26,"Little Rock","San Diego",8.5,"400986993"
198,2,"14:57",897,"Yauhen Massalski missed Free Throw.",41,26,"Little Rock","San Diego",8.5,"400986993"
199,2,"14:57",897,"Wadly Mompremier Defensive Rebound.",41,26,"Little Rock","San Diego",8.5,"400986993"
200,2,"14:31",871,"Cameron Corcoran made Three Point Jumper.",41,29,"Little Rock","San Diego",8.5,"400986993"
201,2,"14:24",864,"Cameron Neubauer made Three Point Jumper. Assisted by Olin Carter III.",44,29,"Little Rock","San Diego",8.5,"400986993"
202,2,"14:24",864,"Wadly Mompremier made Jumper.",44,31,"Little Rock","San Diego",8.5,"400986993"
203,2,"13:16",796,"Isaiah Wright made Three Point Jumper.",47,31,"Little Rock","San Diego",8.5,"400986993"
204,2,"12:54",774,"Damir Hadzic missed Jumper.",47,31,"Little Rock","San Diego",8.5,"400986993"
205,2,"12:54",774,"Wadly Mompremier Offensive Rebound.",47,31,"Little Rock","San Diego",8.5,"400986993"
206,2,"12:51",771,"Wadly Mompremier missed Two Point Tip Shot.",47,31,"Little Rock","San Diego",8.5,"400986993"
207,2,"12:51",771,"San Diego Defensive Rebound.",47,31,"Little Rock","San Diego",8.5,"400986993"
208,2,"12:28",748,"Hunter Summy made Three Point Jumper. Assisted by Yauhen Massalski.",50,31,"Little Rock","San Diego",8.5,"400986993"
209,2,"12:11",731,"Cameron Corcoran missed Jumper.",50,31,"Little Rock","San Diego",8.5,"400986993"
210,2,"12:11",731,"Yauhen Massalski Block.",50,31,"Little Rock","San Diego",8.5,"400986993"
211,2,"12:09",729,"Wadly Mompremier Offensive Rebound.",50,31,"Little Rock","San Diego",8.5,"400986993"
212,2,"12:08",728,"Foul on Yauhen Massalski.",50,31,"Little Rock","San Diego",8.5,"400986993"
213,2,"12:08",728,"Wadly Mompremier made Free Throw.",50,32,"Little Rock","San Diego",8.5,"400986993"
214,2,"12:08",728,"Wadly Mompremier missed Free Throw.",50,32,"Little Rock","San Diego",8.5,"400986993"
215,2,"12:08",728,"Isaiah Pineiro Defensive Rebound.",50,32,"Little Rock","San Diego",8.5,"400986993"
216,2,"11:50",710,"Foul on Damir Hadzic.",50,32,"Little Rock","San Diego",8.5,"400986993"
217,2,"11:50",710,"Official TV Timeout",50,32,"Little Rock","San Diego",8.5,"400986993"
218,2,"11:50",710,"Juwan Gray missed Free Throw.",50,32,"Little Rock","San Diego",8.5,"400986993"
219,2,"11:50",710,"San Diego Deadball Team Rebound.",50,32,"Little Rock","San Diego",8.5,"400986993"
220,2,"11:50",710,"Juwan Gray made Free Throw.",51,32,"Little Rock","San Diego",8.5,"400986993"
221,2,"11:29",689,"Damir Hadzic made Jumper. Assisted by K.J. Gilmore.",51,34,"Little Rock","San Diego",8.5,"400986993"
222,2,"11:14",674,"Isaiah Pineiro Turnover.",51,34,"Little Rock","San Diego",8.5,"400986993"
223,2,"11:12",672,"Jaizec Lottie Steal.",51,34,"Little Rock","San Diego",8.5,"400986993"
224,2,"11:09",669,"Jaizec Lottie missed Layup.",51,34,"Little Rock","San Diego",8.5,"400986993"
225,2,"11:09",669,"Isaiah Pineiro Block.",51,34,"Little Rock","San Diego",8.5,"400986993"
226,2,"11:09",669,"Little Rock Offensive Rebound.",51,34,"Little Rock","San Diego",8.5,"400986993"
227,2,"11:04",664,"Damir Hadzic missed Three Point Jumper.",51,34,"Little Rock","San Diego",8.5,"400986993"
228,2,"11:04",664,"Oliver Black Offensive Rebound.",51,34,"Little Rock","San Diego",8.5,"400986993"
229,2,"10:52",652,"Jaizec Lottie missed Jumper.",51,34,"Little Rock","San Diego",8.5,"400986993"
230,2,"10:52",652,"Isaiah Wright Defensive Rebound.",51,34,"Little Rock","San Diego",8.5,"400986993"
231,2,"10:47",647,"Technical Foul on Little Rock.",51,34,"Little Rock","San Diego",8.5,"400986993"
232,2,"10:47",647,"Olin Carter III made Free Throw.",52,34,"Little Rock","San Diego",8.5,"400986993"
233,2,"10:47",647,"Olin Carter III missed Free Throw.",52,34,"Little Rock","San Diego",8.5,"400986993"
234,2,"10:47",647,"San Diego Offensive Rebound.",52,34,"Little Rock","San Diego",8.5,"400986993"
235,2,"10:47",647,"Isaiah Pineiro made Jumper. Assisted by Isaiah Wright.",54,34,"Little Rock","San Diego",8.5,"400986993"
236,2,"10:43",643,"Anthony Black missed Jumper.",54,34,"Little Rock","San Diego",8.5,"400986993"
237,2,"10:43",643,"Yauhen Massalski Defensive Rebound.",54,34,"Little Rock","San Diego",8.5,"400986993"
238,2,"9:51",591,"Yauhen Massalski Turnover.",54,34,"Little Rock","San Diego",8.5,"400986993"
239,2,"9:50",590,"Anthony Black Steal.",54,34,"Little Rock","San Diego",8.5,"400986993"
240,2,"9:36",576,"Foul on Yauhen Massalski.",54,34,"Little Rock","San Diego",8.5,"400986993"
241,2,"9:36",576,"Oliver Black missed Free Throw.",54,34,"Little Rock","San Diego",8.5,"400986993"
242,2,"9:36",576,"Little Rock Deadball Team Rebound.",54,34,"Little Rock","San Diego",8.5,"400986993"
243,2,"9:36",576,"Oliver Black missed Free Throw.",54,34,"Little Rock","San Diego",8.5,"400986993"
244,2,"9:36",576,"Jose Martinez Defensive Rebound.",54,34,"Little Rock","San Diego",8.5,"400986993"
245,2,"9:06",546,"Jose Martinez Turnover.",54,34,"Little Rock","San Diego",8.5,"400986993"
246,2,"9:05",545,"Ben Marcus Steal.",54,34,"Little Rock","San Diego",8.5,"400986993"
247,2,"8:48",528,"Oliver Black made Jumper.",54,36,"Little Rock","San Diego",8.5,"400986993"
248,2,"8:18",498,"Foul on Cameron Corcoran.",54,36,"Little Rock","San Diego",8.5,"400986993"
249,2,"8:18",498,"Juwan Gray made Free Throw.",55,36,"Little Rock","San Diego",8.5,"400986993"
250,2,"8:18",498,"Juwan Gray made Free Throw.",56,36,"Little Rock","San Diego",8.5,"400986993"
251,2,"7:58",478,"Andre Jones made Jumper. Assisted by Ben Marcus.",56,38,"Little Rock","San Diego",8.5,"400986993"
252,2,"7:58",478,"Foul on Alex Floresca.",56,38,"Little Rock","San Diego",8.5,"400986993"
253,2,"7:58",478,"Official TV Timeout",56,38,"Little Rock","San Diego",8.5,"400986993"
