"play_id","half","time_remaining_half","secs_remaining","description","home_score","away_score","away","home","home_favored_by","game_id"
1,1,"20:00",2400,"PLAY",0,0,"San Diego","San Jose State",-3,"400986990"
2,1,"19:27",2367,"Keith Fisher III missed Layup.",0,0,"San Diego","San Jose State",-3,"400986990"
3,1,"19:27",2367,"Isaiah Wright Defensive Rebound.",0,0,"San Diego","San Jose State",-3,"400986990"
4,1,"19:19",2359,"Isaiah Pineiro missed Jumper.",0,0,"San Diego","San Jose State",-3,"400986990"
5,1,"19:19",2359,"Jaycee Hillsman Defensive Rebound.",0,0,"San Diego","San Jose State",-3,"400986990"
6,1,"19:12",2352,"Ryan Welage made Jumper.",2,0,"San Diego","San Jose State",-3,"400986990"
7,1,"18:59",2339,"Alex Floresca missed Layup.",2,0,"San Diego","San Jose State",-3,"400986990"
8,1,"18:59",2339,"Keith Fisher III Defensive Rebound.",2,0,"San Diego","San Jose State",-3,"400986990"
9,1,"18:54",2334,"Keith Fisher III Turnover.",2,0,"San Diego","San Jose State",-3,"400986990"
10,1,"18:52",2332,"Isaiah Wright Steal.",2,0,"San Diego","San Jose State",-3,"400986990"
11,1,"18:45",2325,"Isaiah Pineiro made Dunk. Assisted by Isaiah Wright.",2,2,"San Diego","San Jose State",-3,"400986990"
12,1,"17:54",2274,"Oumar Barry missed Layup.",2,2,"San Diego","San Jose State",-3,"400986990"
13,1,"17:54",2274,"Isaiah Pineiro Defensive Rebound.",2,2,"San Diego","San Jose State",-3,"400986990"
14,1,"17:44",2264,"Isaiah Wright made Three Point Jumper.",2,5,"San Diego","San Jose State",-3,"400986990"
15,1,"17:37",2257,"Foul on Isaiah Pineiro.",2,5,"San Diego","San Jose State",-3,"400986990"
16,1,"17:37",2257,"Keith Fisher III missed Free Throw.",2,5,"San Diego","San Jose State",-3,"400986990"
17,1,"17:37",2257,"San José State Deadball Team Rebound.",2,5,"San Diego","San Jose State",-3,"400986990"
18,1,"17:37",2257,"Keith Fisher III made Free Throw.",3,5,"San Diego","San Jose State",-3,"400986990"
19,1,"17:25",2245,"Isaiah Wright made Layup.",3,7,"San Diego","San Jose State",-3,"400986990"
20,1,"17:25",2245,"Foul on Oumar Barry.",3,7,"San Diego","San Jose State",-3,"400986990"
21,1,"17:25",2245,"Isaiah Wright missed Free Throw.",3,7,"San Diego","San Jose State",-3,"400986990"
22,1,"17:25",2245,"Oumar Barry Defensive Rebound.",3,7,"San Diego","San Jose State",-3,"400986990"
23,1,"17:04",2224,"Jaycee Hillsman made Layup.",5,7,"San Diego","San Jose State",-3,"400986990"
24,1,"16:55",2215,"Alex Floresca Turnover.",5,7,"San Diego","San Jose State",-3,"400986990"
25,1,"16:55",2215,"Foul on Alex Floresca.",5,7,"San Diego","San Jose State",-3,"400986990"
26,1,"16:37",2197,"Oumar Barry Turnover.",5,7,"San Diego","San Jose State",-3,"400986990"
27,1,"16:36",2196,"Isaiah Wright Steal.",5,7,"San Diego","San Jose State",-3,"400986990"
28,1,"16:36",2196,"Foul on Keith Fisher III.",5,7,"San Diego","San Jose State",-3,"400986990"
29,1,"16:18",2178,"Juwan Gray missed Three Point Jumper.",5,7,"San Diego","San Jose State",-3,"400986990"
30,1,"16:18",2178,"Jaycee Hillsman Defensive Rebound.",5,7,"San Diego","San Jose State",-3,"400986990"
31,1,"15:57",2157,"Jalen James missed Jumper.",5,7,"San Diego","San Jose State",-3,"400986990"
32,1,"15:57",2157,"Yauhen Massalski Defensive Rebound.",5,7,"San Diego","San Jose State",-3,"400986990"
33,1,"15:29",2129,"Isaiah Wright made Layup. Assisted by Yauhen Massalski.",5,9,"San Diego","San Jose State",-3,"400986990"
34,1,"15:29",2129,"Foul on Jalen James.",5,9,"San Diego","San Jose State",-3,"400986990"
35,1,"15:29",2129,"Official TV Timeout",5,9,"San Diego","San Jose State",-3,"400986990"
36,1,"15:29",2129,"Isaiah Wright made Free Throw.",5,10,"San Diego","San Jose State",-3,"400986990"
37,1,"15:05",2105,"Keith Fisher III Turnover.",5,10,"San Diego","San Jose State",-3,"400986990"
38,1,"15:05",2105,"Foul on Keith Fisher III.",5,10,"San Diego","San Jose State",-3,"400986990"
39,1,"14:49",2089,"Yauhen Massalski missed Layup.",5,10,"San Diego","San Jose State",-3,"400986990"
40,1,"14:49",2089,"Ryan Singer Defensive Rebound.",5,10,"San Diego","San Jose State",-3,"400986990"
41,1,"14:47",2087,"Foul on Yauhen Massalski.",5,10,"San Diego","San Jose State",-3,"400986990"
42,1,"14:31",2071,"Isaiah Nichols Turnover.",5,10,"San Diego","San Jose State",-3,"400986990"
43,1,"14:17",2057,"Isaiah Pineiro missed Jumper.",5,10,"San Diego","San Jose State",-3,"400986990"
44,1,"14:17",2057,"Jaycee Hillsman Defensive Rebound.",5,10,"San Diego","San Jose State",-3,"400986990"
45,1,"14:04",2044,"Ryan Singer Turnover.",5,10,"San Diego","San Jose State",-3,"400986990"
46,1,"14:02",2042,"Isaiah Wright Steal.",5,10,"San Diego","San Jose State",-3,"400986990"
47,1,"14:00",2040,"Juwan Gray missed Layup.",5,10,"San Diego","San Jose State",-3,"400986990"
48,1,"14:00",2040,"Olin Carter Iii Offensive Rebound.",5,10,"San Diego","San Jose State",-3,"400986990"
49,1,"13:55",2035,"Olin Carter Iii made Layup.",5,12,"San Diego","San Jose State",-3,"400986990"
50,1,"13:47",2027,"Jaycee Hillsman missed Layup.",5,12,"San Diego","San Jose State",-3,"400986990"
51,1,"13:47",2027,"Olin Carter Iii Defensive Rebound.",5,12,"San Diego","San Jose State",-3,"400986990"
52,1,"13:42",2022,"Juwan Gray made Dunk. Assisted by Olin Carter Iii.",5,14,"San Diego","San Jose State",-3,"400986990"
53,1,"13:37",2017,"San José State  Timeout",5,14,"San Diego","San Jose State",-3,"400986990"
54,1,"13:30",2010,"Jaycee Hillsman missed Layup.",5,14,"San Diego","San Jose State",-3,"400986990"
55,1,"13:30",2010,"Cameron Neubauer Defensive Rebound.",5,14,"San Diego","San Jose State",-3,"400986990"
56,1,"13:24",2004,"Isaiah Pineiro Turnover.",5,14,"San Diego","San Jose State",-3,"400986990"
57,1,"13:23",2003,"Jaycee Hillsman Steal.",5,14,"San Diego","San Jose State",-3,"400986990"
58,1,"13:20",2000,"Jalen James made Layup.",7,14,"San Diego","San Jose State",-3,"400986990"
59,1,"12:59",1979,"Hunter Summy missed Three Point Jumper.",7,14,"San Diego","San Jose State",-3,"400986990"
60,1,"12:59",1979,"Isaiah Nichols Defensive Rebound.",7,14,"San Diego","San Jose State",-3,"400986990"
61,1,"12:46",1966,"Ryan Welage made Three Point Jumper. Assisted by Isaiah Nichols.",10,14,"San Diego","San Jose State",-3,"400986990"
62,1,"12:26",1946,"Foul on Oumar Barry.",10,14,"San Diego","San Jose State",-3,"400986990"
63,1,"12:23",1943,"Alex Floresca Turnover.",10,14,"San Diego","San Jose State",-3,"400986990"
64,1,"12:23",1943,"Foul on Alex Floresca.",10,14,"San Diego","San Jose State",-3,"400986990"
65,1,"12:10",1930,"Ryan Welage missed Jumper.",10,14,"San Diego","San Jose State",-3,"400986990"
66,1,"12:10",1930,"San Diego Deadball Team Rebound.",10,14,"San Diego","San Jose State",-3,"400986990"
67,1,"12:09",1929,"Foul on Ryan Singer.",10,14,"San Diego","San Jose State",-3,"400986990"
68,1,"11:57",1917,"Isaiah Wright made Layup.",10,16,"San Diego","San Jose State",-3,"400986990"
69,1,"11:43",1903,"Jaycee Hillsman missed Layup.",10,16,"San Diego","San Jose State",-3,"400986990"
70,1,"11:43",1903,"Isaiah Nichols Offensive Rebound.",10,16,"San Diego","San Jose State",-3,"400986990"
71,1,"11:40",1900,"Isaiah Nichols made Layup.",12,16,"San Diego","San Jose State",-3,"400986990"
72,1,"11:18",1878,"Yauhen Massalski missed Layup.",12,16,"San Diego","San Jose State",-3,"400986990"
73,1,"11:18",1878,"Isaiah Nichols Defensive Rebound.",12,16,"San Diego","San Jose State",-3,"400986990"
74,1,"11:12",1872,"Foul on Hunter Summy.",12,16,"San Diego","San Jose State",-3,"400986990"
75,1,"11:12",1872,"Official TV Timeout",12,16,"San Diego","San Jose State",-3,"400986990"
76,1,"11:12",1872,"Jaycee Hillsman made Free Throw.",13,16,"San Diego","San Jose State",-3,"400986990"
77,1,"11:12",1872,"Jaycee Hillsman made Free Throw.",14,16,"San Diego","San Jose State",-3,"400986990"
78,1,"11:00",1860,"Isaiah Pineiro made Layup.",14,18,"San Diego","San Jose State",-3,"400986990"
79,1,"10:43",1843,"Foul on Yauhen Massalski.",14,18,"San Diego","San Jose State",-3,"400986990"
80,1,"10:43",1843,"Isaiah Nichols missed Free Throw.",14,18,"San Diego","San Jose State",-3,"400986990"
81,1,"10:43",1843,"San José State Deadball Team Rebound.",14,18,"San Diego","San Jose State",-3,"400986990"
82,1,"10:43",1843,"Isaiah Nichols made Free Throw.",15,18,"San Diego","San Jose State",-3,"400986990"
83,1,"10:30",1830,"Cameron Neubauer made Layup. Assisted by Olin Carter Iii.",15,20,"San Diego","San Jose State",-3,"400986990"
84,1,"10:17",1817,"Jaycee Hillsman missed Three Point Jumper.",15,20,"San Diego","San Jose State",-3,"400986990"
85,1,"10:17",1817,"Yauhen Massalski Defensive Rebound.",15,20,"San Diego","San Jose State",-3,"400986990"
86,1,"10:10",1810,"Cameron Neubauer made Three Point Jumper. Assisted by Isaiah Wright.",15,23,"San Diego","San Jose State",-3,"400986990"
87,1,"9:44",1784,"Jalen James missed Layup.",15,23,"San Diego","San Jose State",-3,"400986990"
88,1,"9:44",1784,"San Diego Defensive Rebound.",15,23,"San Diego","San Jose State",-3,"400986990"
89,1,"9:23",1763,"Cameron Neubauer missed Three Point Jumper.",15,23,"San Diego","San Jose State",-3,"400986990"
90,1,"9:23",1763,"Jalen James Defensive Rebound.",15,23,"San Diego","San Jose State",-3,"400986990"
91,1,"9:14",1754,"Ryan Welage Turnover.",15,23,"San Diego","San Jose State",-3,"400986990"
92,1,"9:14",1754,"Foul on Ryan Welage.",15,23,"San Diego","San Jose State",-3,"400986990"
93,1,"9:01",1741,"Olin Carter Iii missed Three Point Jumper.",15,23,"San Diego","San Jose State",-3,"400986990"
94,1,"9:01",1741,"Isaiah Nichols Defensive Rebound.",15,23,"San Diego","San Jose State",-3,"400986990"
95,1,"8:39",1719,"Ryan Welage missed Jumper.",15,23,"San Diego","San Jose State",-3,"400986990"
96,1,"8:39",1719,"Isaiah Pineiro Defensive Rebound.",15,23,"San Diego","San Jose State",-3,"400986990"
97,1,"8:31",1711,"Isaiah Wright made Jumper.",15,25,"San Diego","San Jose State",-3,"400986990"
98,1,"8:31",1711,"Foul on Isaiah Nichols.",15,25,"San Diego","San Jose State",-3,"400986990"
99,1,"8:31",1711,"Isaiah Wright missed Free Throw.",15,25,"San Diego","San Jose State",-3,"400986990"
100,1,"8:31",1711,"Ryan Singer Defensive Rebound.",15,25,"San Diego","San Jose State",-3,"400986990"
101,1,"8:17",1697,"Ryan Singer Turnover.",15,25,"San Diego","San Jose State",-3,"400986990"
102,1,"8:00",1680,"Hunter Summy made Three Point Jumper. Assisted by Alex Floresca.",15,28,"San Diego","San Jose State",-3,"400986990"
103,1,"7:59",1679,"Alex Floresca Defensive Rebound.",15,28,"San Diego","San Jose State",-3,"400986990"
104,1,"7:38",1658,"Noah Baumann missed Three Point Jumper.",15,28,"San Diego","San Jose State",-3,"400986990"
105,1,"7:16",1636,"Olin Carter Iii made Three Point Jumper.",15,31,"San Diego","San Jose State",-3,"400986990"
106,1,"7:07",1627,"Ryan Welage made Jumper.",17,31,"San Diego","San Jose State",-3,"400986990"
107,1,"6:53",1613,"Foul on Ryan Welage.",17,31,"San Diego","San Jose State",-3,"400986990"
108,1,"6:53",1613,"Official TV Timeout",17,31,"San Diego","San Jose State",-3,"400986990"
109,1,"6:53",1613,"Cameron Neubauer made Free Throw.",17,32,"San Diego","San Jose State",-3,"400986990"
110,1,"6:53",1613,"Cameron Neubauer made Free Throw.",17,33,"San Diego","San Jose State",-3,"400986990"
111,1,"6:32",1592,"Noah Baumann made Three Point Jumper.",20,33,"San Diego","San Jose State",-3,"400986990"
112,1,"6:11",1571,"Isaiah Pineiro made Layup. Assisted by Isaiah Wright.",20,35,"San Diego","San Jose State",-3,"400986990"
113,1,"5:49",1549,"Jaycee Hillsman made Layup. Assisted by Noah Baumann.",22,35,"San Diego","San Jose State",-3,"400986990"
114,1,"5:31",1531,"Jose Martinez missed Jumper.",22,35,"San Diego","San Jose State",-3,"400986990"
115,1,"5:31",1531,"Caleb Simmons Defensive Rebound.",22,35,"San Diego","San Jose State",-3,"400986990"
116,1,"5:05",1505,"Caleb Simmons missed Layup.",22,35,"San Diego","San Jose State",-3,"400986990"
117,1,"5:05",1505,"San José State Deadball Team Rebound.",22,35,"San Diego","San Jose State",-3,"400986990"
118,1,"5:05",1505,"Foul on Jose Martinez.",22,35,"San Diego","San Jose State",-3,"400986990"
119,1,"5:05",1505,"Ryan Singer made Free Throw.",23,35,"San Diego","San Jose State",-3,"400986990"
120,1,"5:05",1505,"Ryan Singer made Free Throw.",24,35,"San Diego","San Jose State",-3,"400986990"
121,1,"4:44",1484,"Foul on Ryan Singer.",24,35,"San Diego","San Jose State",-3,"400986990"
122,1,"4:44",1484,"Isaiah Pineiro missed Free Throw.",24,35,"San Diego","San Jose State",-3,"400986990"
123,1,"4:44",1484,"San Diego Deadball Team Rebound.",24,35,"San Diego","San Jose State",-3,"400986990"
124,1,"4:44",1484,"Isaiah Pineiro made Free Throw.",24,36,"San Diego","San Jose State",-3,"400986990"
125,1,"4:26",1466,"Caleb Simmons Turnover.",24,36,"San Diego","San Jose State",-3,"400986990"
126,1,"4:03",1443,"Olin Carter Iii made Three Point Jumper. Assisted by Isaiah Wright.",24,39,"San Diego","San Jose State",-3,"400986990"
127,1,"3:46",1426,"Noah Baumann made Three Point Jumper. Assisted by Jalen James.",27,39,"San Diego","San Jose State",-3,"400986990"
128,1,"3:28",1408,"Isaiah Wright made Three Point Jumper. Assisted by Isaiah Pineiro.",27,42,"San Diego","San Jose State",-3,"400986990"
129,1,"3:11",1391,"Jalen James missed Three Point Jumper.",27,42,"San Diego","San Jose State",-3,"400986990"
130,1,"3:11",1391,"Cameron Neubauer Defensive Rebound.",27,42,"San Diego","San Jose State",-3,"400986990"
131,1,"2:51",1371,"Olin Carter Iii missed Layup.",27,42,"San Diego","San Jose State",-3,"400986990"
132,1,"2:51",1371,"Ryan Singer Defensive Rebound.",27,42,"San Diego","San Jose State",-3,"400986990"
133,1,"2:36",1356,"Jaycee Hillsman missed Three Point Jumper.",27,42,"San Diego","San Jose State",-3,"400986990"
134,1,"2:36",1356,"San Diego Defensive Rebound.",27,42,"San Diego","San Jose State",-3,"400986990"
135,1,"2:31",1351,"Official TV Timeout",27,42,"San Diego","San Jose State",-3,"400986990"
136,1,"2:19",1339,"Olin Carter Iii Turnover.",27,42,"San Diego","San Jose State",-3,"400986990"
137,1,"2:19",1339,"Caleb Simmons Steal.",27,42,"San Diego","San Jose State",-3,"400986990"
138,1,"2:19",1339,"Foul on Olin Carter Iii.",27,42,"San Diego","San Jose State",-3,"400986990"
139,1,"2:19",1339,"Caleb Simmons made Free Throw.",28,42,"San Diego","San Jose State",-3,"400986990"
140,1,"2:19",1339,"Caleb Simmons made Free Throw.",29,42,"San Diego","San Jose State",-3,"400986990"
141,1,"2:05",1325,"Isaiah Pineiro made Layup.",29,44,"San Diego","San Jose State",-3,"400986990"
142,1,"1:51",1311,"Noah Baumann missed Three Point Jumper.",29,44,"San Diego","San Jose State",-3,"400986990"
143,1,"1:51",1311,"Isaiah Pineiro Defensive Rebound.",29,44,"San Diego","San Jose State",-3,"400986990"
144,1,"1:42",1302,"Cameron Neubauer made Three Point Jumper. Assisted by Olin Carter Iii.",29,47,"San Diego","San Jose State",-3,"400986990"
145,1,"1:26",1286,"Noah Baumann Turnover.",29,47,"San Diego","San Jose State",-3,"400986990"
146,1,"1:25",1285,"Isaiah Wright Steal.",29,47,"San Diego","San Jose State",-3,"400986990"
147,1,"1:23",1283,"Isaiah Wright made Layup.",29,49,"San Diego","San Jose State",-3,"400986990"
148,1,"1:07",1267,"Ryan Singer missed Jumper.",29,49,"San Diego","San Jose State",-3,"400986990"
149,1,"1:07",1267,"Isaiah Pineiro Defensive Rebound.",29,49,"San Diego","San Jose State",-3,"400986990"
150,1,"0:52",1252,"Isaiah Wright missed Layup.",29,49,"San Diego","San Jose State",-3,"400986990"
151,1,"0:52",1252,"San José State Deadball Team Rebound.",29,49,"San Diego","San Jose State",-3,"400986990"
152,1,"0:36",1236,"Jalen James Turnover.",29,49,"San Diego","San Jose State",-3,"400986990"
153,1,"0:35",1235,"Cameron Neubauer Steal.",29,49,"San Diego","San Jose State",-3,"400986990"
154,1,"0:30",1230,"San Diego  Timeout",29,49,"San Diego","San Jose State",-3,"400986990"
155,1,"0:13",1213,"Foul on Jalen James.",29,49,"San Diego","San Jose State",-3,"400986990"
156,1,"0:13",1213,"Isaiah Pineiro made Free Throw.",29,50,"San Diego","San Jose State",-3,"400986990"
157,1,"0:13",1213,"Isaiah Pineiro made Free Throw.",29,51,"San Diego","San Jose State",-3,"400986990"
158,1,"0:02",1202,"Noah Baumann missed Jumper.",29,51,"San Diego","San Jose State",-3,"400986990"
159,1,"0:02",1202,"Isaiah Pineiro Block.",29,51,"San Diego","San Jose State",-3,"400986990"
160,1,"0:00",1200,"Isaiah Pineiro Defensive Rebound.",29,51,"San Diego","San Jose State",-3,"400986990"
161,1,"0:00",1200,"End of 1st half",29,51,"San Diego","San Jose State",-3,"400986990"
162,2,"20:00",1200,"PLAY",29,51,"San Diego","San Jose State",-3,"400986990"
163,2,"19:41",1181,"Cameron Neubauer Turnover.",29,51,"San Diego","San Jose State",-3,"400986990"
164,2,"19:39",1179,"Jaycee Hillsman Steal.",29,51,"San Diego","San Jose State",-3,"400986990"
165,2,"19:28",1168,"Keith Fisher III missed Layup.",29,51,"San Diego","San Jose State",-3,"400986990"
166,2,"19:28",1168,"San José State Offensive Rebound.",29,51,"San Diego","San Jose State",-3,"400986990"
167,2,"19:12",1152,"Foul on Alex Floresca.",29,51,"San Diego","San Jose State",-3,"400986990"
168,2,"19:05",1145,"Jalen James made Layup. Assisted by Jaycee Hillsman.",31,51,"San Diego","San Jose State",-3,"400986990"
169,2,"18:52",1132,"Isaiah Pineiro missed Three Point Jumper.",31,51,"San Diego","San Jose State",-3,"400986990"
170,2,"18:52",1132,"Jalen James Defensive Rebound.",31,51,"San Diego","San Jose State",-3,"400986990"
171,2,"18:44",1124,"Jalen James Turnover.",31,51,"San Diego","San Jose State",-3,"400986990"
172,2,"18:44",1124,"Olin Carter Iii made Three Point Jumper.",31,54,"San Diego","San Jose State",-3,"400986990"
173,2,"18:05",1085,"Foul on Isaiah Pineiro.",31,54,"San Diego","San Jose State",-3,"400986990"
174,2,"18:05",1085,"Keith Fisher III missed Free Throw.",31,54,"San Diego","San Jose State",-3,"400986990"
175,2,"18:05",1085,"San José State Deadball Team Rebound.",31,54,"San Diego","San Jose State",-3,"400986990"
176,2,"18:05",1085,"Keith Fisher III made Free Throw.",32,54,"San Diego","San Jose State",-3,"400986990"
177,2,"17:49",1069,"Olin Carter Iii missed Jumper.",32,54,"San Diego","San Jose State",-3,"400986990"
178,2,"17:49",1069,"San Diego Deadball Team Rebound.",32,54,"San Diego","San Jose State",-3,"400986990"
179,2,"17:47",1067,"Foul on Jaycee Hillsman.",32,54,"San Diego","San Jose State",-3,"400986990"
180,2,"17:33",1053,"Isaiah Wright missed Jumper.",32,54,"San Diego","San Jose State",-3,"400986990"
181,2,"17:33",1053,"Oumar Barry Block.",32,54,"San Diego","San Jose State",-3,"400986990"
182,2,"17:30",1050,"Jaycee Hillsman Defensive Rebound.",32,54,"San Diego","San Jose State",-3,"400986990"
183,2,"17:29",1049,"Foul on Olin Carter Iii.",32,54,"San Diego","San Jose State",-3,"400986990"
184,2,"17:18",1038,"Keith Fisher III made Layup. Assisted by Jaycee Hillsman.",34,54,"San Diego","San Jose State",-3,"400986990"
185,2,"17:01",1021,"Isaiah Wright Turnover.",34,54,"San Diego","San Jose State",-3,"400986990"
186,2,"16:50",1010,"Foul on Olin Carter Iii.",34,54,"San Diego","San Jose State",-3,"400986990"
187,2,"16:34",994,"Ryan Welage missed Jumper.",34,54,"San Diego","San Jose State",-3,"400986990"
188,2,"16:34",994,"Yauhen Massalski Defensive Rebound.",34,54,"San Diego","San Jose State",-3,"400986990"
189,2,"16:14",974,"Yauhen Massalski made Layup.",34,56,"San Diego","San Jose State",-3,"400986990"
190,2,"15:55",955,"Keith Fisher III missed Jumper.",34,56,"San Diego","San Jose State",-3,"400986990"
191,2,"15:55",955,"Jaycee Hillsman Offensive Rebound.",34,56,"San Diego","San Jose State",-3,"400986990"
192,2,"15:51",951,"Ryan Welage missed Jumper.",34,56,"San Diego","San Jose State",-3,"400986990"
193,2,"15:51",951,"San Diego Deadball Team Rebound.",34,56,"San Diego","San Jose State",-3,"400986990"
194,2,"15:49",949,"Foul on Oumar Barry.",34,56,"San Diego","San Jose State",-3,"400986990"
195,2,"15:49",949,"Official TV Timeout",34,56,"San Diego","San Jose State",-3,"400986990"
196,2,"15:40",940,"Foul on Jalen James.",34,56,"San Diego","San Jose State",-3,"400986990"
197,2,"15:27",927,"Cameron Neubauer made Layup. Assisted by Isaiah Wright.",34,58,"San Diego","San Jose State",-3,"400986990"
198,2,"15:17",917,"Jalen James Turnover.",34,58,"San Diego","San Jose State",-3,"400986990"
199,2,"14:58",898,"Juwan Gray made Layup. Assisted by Isaiah Wright.",34,60,"San Diego","San Jose State",-3,"400986990"
200,2,"14:38",878,"Foul on Isaiah Pineiro.",34,60,"San Diego","San Jose State",-3,"400986990"
201,2,"14:33",873,"Isaiah Nichols Turnover.",34,60,"San Diego","San Jose State",-3,"400986990"
202,2,"14:32",872,"Isaiah Wright Steal.",34,60,"San Diego","San Jose State",-3,"400986990"
203,2,"14:30",870,"Foul on Isaiah Nichols.",34,60,"San Diego","San Jose State",-3,"400986990"
204,2,"14:30",870,"Isaiah Wright made Free Throw.",34,61,"San Diego","San Jose State",-3,"400986990"
205,2,"14:30",870,"Cameron Neubauer made Free Throw.",34,62,"San Diego","San Jose State",-3,"400986990"
206,2,"14:18",858,"Jaycee Hillsman Turnover.",34,62,"San Diego","San Jose State",-3,"400986990"
207,2,"14:17",857,"Juwan Gray Steal.",34,62,"San Diego","San Jose State",-3,"400986990"
208,2,"14:13",853,"Yauhen Massalski made Dunk. Assisted by Olin Carter Iii.",34,64,"San Diego","San Jose State",-3,"400986990"
209,2,"14:00",840,"Jaycee Hillsman made Dunk. Assisted by Isaiah Nichols.",36,64,"San Diego","San Jose State",-3,"400986990"
210,2,"13:44",824,"Olin Carter Iii missed Layup.",36,64,"San Diego","San Jose State",-3,"400986990"
211,2,"13:44",824,"Keith Fisher III Defensive Rebound.",36,64,"San Diego","San Jose State",-3,"400986990"
212,2,"13:33",813,"Jaycee Hillsman missed Three Point Jumper.",36,64,"San Diego","San Jose State",-3,"400986990"
213,2,"13:33",813,"Ryan Welage Offensive Rebound.",36,64,"San Diego","San Jose State",-3,"400986990"
214,2,"13:22",802,"Jaycee Hillsman Turnover.",36,64,"San Diego","San Jose State",-3,"400986990"
215,2,"13:22",802,"Official TV Timeout",36,64,"San Diego","San Jose State",-3,"400986990"
216,2,"13:09",789,"Foul on Keith Fisher III.",36,64,"San Diego","San Jose State",-3,"400986990"
217,2,"12:53",773,"Alex Floresca Turnover.",36,64,"San Diego","San Jose State",-3,"400986990"
218,2,"12:53",773,"Foul on Alex Floresca.",36,64,"San Diego","San Jose State",-3,"400986990"
219,2,"12:35",755,"Ryan Welage missed Jumper.",36,64,"San Diego","San Jose State",-3,"400986990"
220,2,"12:35",755,"Ryan Welage Offensive Rebound.",36,64,"San Diego","San Jose State",-3,"400986990"
221,2,"12:34",754,"Foul on Cameron Neubauer.",36,64,"San Diego","San Jose State",-3,"400986990"
222,2,"12:34",754,"Ryan Welage missed Free Throw.",36,64,"San Diego","San Jose State",-3,"400986990"
223,2,"12:34",754,"San José State Deadball Team Rebound.",36,64,"San Diego","San Jose State",-3,"400986990"
224,2,"12:34",754,"Ryan Welage made Free Throw.",37,64,"San Diego","San Jose State",-3,"400986990"
225,2,"12:14",734,"Isaiah Wright Turnover.",37,64,"San Diego","San Jose State",-3,"400986990"
226,2,"11:53",713,"Keith Fisher III made Dunk. Assisted by Noah Baumann.",39,64,"San Diego","San Jose State",-3,"400986990"
227,2,"11:36",696,"Foul on Isaiah Nichols.",39,64,"San Diego","San Jose State",-3,"400986990"
228,2,"11:36",696,"Official TV Timeout",39,64,"San Diego","San Jose State",-3,"400986990"
229,2,"11:30",690,"Olin Carter Iii missed Three Point Jumper.",39,64,"San Diego","San Jose State",-3,"400986990"
230,2,"11:30",690,"Oumar Barry Defensive Rebound.",39,64,"San Diego","San Jose State",-3,"400986990"
231,2,"11:01",661,"Ryan Welage made Jumper.",41,64,"San Diego","San Jose State",-3,"400986990"
232,2,"10:47",647,"Juwan Gray missed Three Point Jumper.",41,64,"San Diego","San Jose State",-3,"400986990"
233,2,"10:47",647,"Isaiah Nichols Defensive Rebound.",41,64,"San Diego","San Jose State",-3,"400986990"
234,2,"10:32",632,"Keith Fisher III made Layup. Assisted by Ryan Welage.",43,64,"San Diego","San Jose State",-3,"400986990"
235,2,"10:07",607,"Olin Carter Iii made Three Point Jumper.",43,67,"San Diego","San Jose State",-3,"400986990"
236,2,"9:48",588,"Ryan Welage missed Jumper.",43,67,"San Diego","San Jose State",-3,"400986990"
237,2,"9:48",588,"Isaiah Pineiro Defensive Rebound.",43,67,"San Diego","San Jose State",-3,"400986990"
238,2,"9:46",586,"Foul on Keith Fisher III.",43,67,"San Diego","San Jose State",-3,"400986990"
239,2,"9:46",586,"Isaiah Pineiro missed Free Throw.",43,67,"San Diego","San Jose State",-3,"400986990"
240,2,"9:46",586,"Ryan Welage Defensive Rebound.",43,67,"San Diego","San Jose State",-3,"400986990"
241,2,"9:40",580,"Noah Baumann missed Three Point Jumper.",43,67,"San Diego","San Jose State",-3,"400986990"
242,2,"9:40",580,"Cameron Neubauer Defensive Rebound.",43,67,"San Diego","San Jose State",-3,"400986990"
243,2,"9:33",573,"Isaiah Wright Turnover.",43,67,"San Diego","San Jose State",-3,"400986990"
244,2,"9:33",573,"Foul on Isaiah Wright.",43,67,"San Diego","San Jose State",-3,"400986990"
245,2,"9:10",550,"Noah Baumann missed Layup.",43,67,"San Diego","San Jose State",-3,"400986990"
246,2,"9:10",550,"Jose Martinez Defensive Rebound.",43,67,"San Diego","San Jose State",-3,"400986990"
247,2,"8:58",538,"Isaiah Pineiro missed Layup.",43,67,"San Diego","San Jose State",-3,"400986990"
248,2,"8:58",538,"Isaiah Nichols Block.",43,67,"San Diego","San Jose State",-3,"400986990"
249,2,"8:56",536,"Isaiah Nichols Defensive Rebound.",43,67,"San Diego","San Jose State",-3,"400986990"
250,2,"8:46",526,"Ryan Welage missed Jumper.",43,67,"San Diego","San Jose State",-3,"400986990"
251,2,"8:46",526,"Ryan Welage Offensive Rebound.",43,67,"San Diego","San Jose State",-3,"400986990"
252,2,"8:44",524,"Foul on Isaiah Pineiro.",43,67,"San Diego","San Jose State",-3,"400986990"
253,2,"8:44",524,"Ryan Welage made Free Throw.",44,67,"San Diego","San Jose State",-3,"400986990"
254,2,"8:44",524,"Ryan Welage made Free Throw.",45,67,"San Diego","San Jose State",-3,"400986990"
255,2,"8:27",507,"Yauhen Massalski made Layup. Assisted by Cameron Neubauer.",45,69,"San Diego","San Jose State",-3,"400986990"
