"play_id","half","time_remaining_half","secs_remaining","description","home_score","away_score","away","home","home_favored_by","game_id"
1,1,"20:00",2400,"PLAY",0,0,"Fairleigh Dickinson","Seton Hall",25,"400988408"
2,1,"19:48",2388,"Mike Holloway Jr. made Three Point Jumper. Assisted by Jahlil Jenkins.",0,3,"Fairleigh Dickinson","Seton Hall",25,"400988408"
3,1,"19:33",2373,"Desi Rodriguez missed Three Point Jumper.",0,3,"Fairleigh Dickinson","Seton Hall",25,"400988408"
4,1,"19:33",2373,"Angel Delgado Offensive Rebound.",0,3,"Fairleigh Dickinson","Seton Hall",25,"400988408"
5,1,"19:29",2369,"Angel Delgado Turnover.",0,3,"Fairleigh Dickinson","Seton Hall",25,"400988408"
6,1,"19:11",2351,"Darnell Edge missed Jumper.",0,3,"Fairleigh Dickinson","Seton Hall",25,"400988408"
7,1,"19:11",2351,"Elyjah Williams Offensive Rebound.",0,3,"Fairleigh Dickinson","Seton Hall",25,"400988408"
8,1,"18:53",2333,"Elyjah Williams made Jumper.",0,5,"Fairleigh Dickinson","Seton Hall",25,"400988408"
9,1,"18:46",2326,"Foul on Jahlil Jenkins.",0,5,"Fairleigh Dickinson","Seton Hall",25,"400988408"
10,1,"18:45",2325,"Foul on Kaleb Bishop.",0,5,"Fairleigh Dickinson","Seton Hall",25,"400988408"
11,1,"18:39",2319,"Desi Rodriguez Turnover.",0,5,"Fairleigh Dickinson","Seton Hall",25,"400988408"
12,1,"18:39",2319,"Foul on Desi Rodriguez.",0,5,"Fairleigh Dickinson","Seton Hall",25,"400988408"
13,1,"18:26",2306,"Jahlil Jenkins missed Three Point Jumper.",0,5,"Fairleigh Dickinson","Seton Hall",25,"400988408"
14,1,"18:26",2306,"Elyjah Williams Offensive Rebound.",0,5,"Fairleigh Dickinson","Seton Hall",25,"400988408"
15,1,"18:06",2286,"Darnell Edge Turnover.",0,5,"Fairleigh Dickinson","Seton Hall",25,"400988408"
16,1,"17:55",2275,"Khadeen Carrington made Layup.",2,5,"Fairleigh Dickinson","Seton Hall",25,"400988408"
17,1,"17:42",2262,"Kaleb Bishop made Layup. Assisted by Jahlil Jenkins.",2,7,"Fairleigh Dickinson","Seton Hall",25,"400988408"
18,1,"17:26",2246,"Desi Rodriguez missed Three Point Jumper.",2,7,"Fairleigh Dickinson","Seton Hall",25,"400988408"
19,1,"17:26",2246,"Angel Delgado Offensive Rebound.",2,7,"Fairleigh Dickinson","Seton Hall",25,"400988408"
20,1,"17:22",2242,"Foul on Elyjah Williams.",2,7,"Fairleigh Dickinson","Seton Hall",25,"400988408"
21,1,"17:18",2238,"Myles Powell made Three Point Jumper. Assisted by Khadeen Carrington.",5,7,"Fairleigh Dickinson","Seton Hall",25,"400988408"
22,1,"17:03",2223,"Kaleb Bishop made Three Point Jumper. Assisted by Elyjah Williams.",5,10,"Fairleigh Dickinson","Seton Hall",25,"400988408"
23,1,"16:53",2213,"Myles Powell missed Three Point Jumper.",5,10,"Fairleigh Dickinson","Seton Hall",25,"400988408"
24,1,"16:53",2213,"Kaleb Bishop Defensive Rebound.",5,10,"Fairleigh Dickinson","Seton Hall",25,"400988408"
25,1,"16:32",2192,"Mike Holloway Jr. made Jumper. Assisted by Darnell Edge.",5,12,"Fairleigh Dickinson","Seton Hall",25,"400988408"
26,1,"16:18",2178,"Khadeen Carrington missed Three Point Jumper.",5,12,"Fairleigh Dickinson","Seton Hall",25,"400988408"
27,1,"16:18",2178,"Angel Delgado Offensive Rebound.",5,12,"Fairleigh Dickinson","Seton Hall",25,"400988408"
28,1,"16:15",2175,"Angel Delgado made Dunk.",7,12,"Fairleigh Dickinson","Seton Hall",25,"400988408"
29,1,"15:48",2148,"Mike Holloway Jr. missed Jumper.",7,12,"Fairleigh Dickinson","Seton Hall",25,"400988408"
30,1,"15:48",2148,"Ismael Sanogo Defensive Rebound.",7,12,"Fairleigh Dickinson","Seton Hall",25,"400988408"
31,1,"15:39",2139,"Myles Powell missed Three Point Jumper.",7,12,"Fairleigh Dickinson","Seton Hall",25,"400988408"
32,1,"15:39",2139,"Jahlil Jenkins Defensive Rebound.",7,12,"Fairleigh Dickinson","Seton Hall",25,"400988408"
33,1,"15:30",2130,"Kaleb Bishop missed Three Point Jumper.",7,12,"Fairleigh Dickinson","Seton Hall",25,"400988408"
34,1,"15:30",2130,"Myles Powell Defensive Rebound.",7,12,"Fairleigh Dickinson","Seton Hall",25,"400988408"
35,1,"15:06",2106,"Myles Powell missed Layup.",7,12,"Fairleigh Dickinson","Seton Hall",25,"400988408"
36,1,"15:06",2106,"Seton Hall Offensive Rebound.",7,12,"Fairleigh Dickinson","Seton Hall",25,"400988408"
37,1,"15:04",2104,"Official TV Timeout",7,12,"Fairleigh Dickinson","Seton Hall",25,"400988408"
38,1,"14:56",2096,"Seton Hall  Turnover.",7,12,"Fairleigh Dickinson","Seton Hall",25,"400988408"
39,1,"14:28",2068,"Darnell Edge missed Three Point Jumper.",7,12,"Fairleigh Dickinson","Seton Hall",25,"400988408"
40,1,"14:28",2068,"Desi Rodriguez Defensive Rebound.",7,12,"Fairleigh Dickinson","Seton Hall",25,"400988408"
41,1,"14:16",2056,"Ismael Sanogo made Layup. Assisted by Angel Delgado.",9,12,"Fairleigh Dickinson","Seton Hall",25,"400988408"
42,1,"13:59",2039,"Jahlil Jenkins Turnover.",9,12,"Fairleigh Dickinson","Seton Hall",25,"400988408"
43,1,"13:58",2038,"Ismael Sanogo Steal.",9,12,"Fairleigh Dickinson","Seton Hall",25,"400988408"
44,1,"13:53",2033,"Myles Powell made Layup. Assisted by Khadeen Carrington.",11,12,"Fairleigh Dickinson","Seton Hall",25,"400988408"
45,1,"13:33",2013,"Jahlil Jenkins Turnover.",11,12,"Fairleigh Dickinson","Seton Hall",25,"400988408"
46,1,"13:23",2003,"Desi Rodriguez made Layup. Assisted by Jordan Walker.",13,12,"Fairleigh Dickinson","Seton Hall",25,"400988408"
47,1,"13:10",1990,"Fairleigh Dickinson  Turnover.",13,12,"Fairleigh Dickinson","Seton Hall",25,"400988408"
48,1,"13:01",1981,"Desi Rodriguez missed Layup.",13,12,"Fairleigh Dickinson","Seton Hall",25,"400988408"
49,1,"13:01",1981,"Sandro Mamukelashvili Offensive Rebound.",13,12,"Fairleigh Dickinson","Seton Hall",25,"400988408"
50,1,"12:58",1978,"Sandro Mamukelashvili missed Layup.",13,12,"Fairleigh Dickinson","Seton Hall",25,"400988408"
51,1,"12:58",1978,"Nadi Beciri Block.",13,12,"Fairleigh Dickinson","Seton Hall",25,"400988408"
52,1,"12:57",1977,"Sandro Mamukelashvili Offensive Rebound.",13,12,"Fairleigh Dickinson","Seton Hall",25,"400988408"
53,1,"12:49",1969,"Sandro Mamukelashvili Turnover.",13,12,"Fairleigh Dickinson","Seton Hall",25,"400988408"
54,1,"12:48",1968,"Nadi Beciri Steal.",13,12,"Fairleigh Dickinson","Seton Hall",25,"400988408"
55,1,"12:46",1966,"Foul on Ismael Sanogo.",13,12,"Fairleigh Dickinson","Seton Hall",25,"400988408"
56,1,"12:38",1958,"Darnell Edge Turnover.",13,12,"Fairleigh Dickinson","Seton Hall",25,"400988408"
57,1,"12:31",1951,"Eron Gordon missed Three Point Jumper.",13,12,"Fairleigh Dickinson","Seton Hall",25,"400988408"
58,1,"12:31",1951,"Sandro Mamukelashvili Offensive Rebound.",13,12,"Fairleigh Dickinson","Seton Hall",25,"400988408"
59,1,"12:27",1947,"Foul on Nadi Beciri.",13,12,"Fairleigh Dickinson","Seton Hall",25,"400988408"
60,1,"12:27",1947,"Sandro Mamukelashvili missed Free Throw.",13,12,"Fairleigh Dickinson","Seton Hall",25,"400988408"
61,1,"12:27",1947,"Seton Hall Deadball Team Rebound.",13,12,"Fairleigh Dickinson","Seton Hall",25,"400988408"
62,1,"12:27",1947,"Sandro Mamukelashvili made Free Throw.",14,12,"Fairleigh Dickinson","Seton Hall",25,"400988408"
63,1,"12:19",1939,"Mike Schroback Turnover.",14,12,"Fairleigh Dickinson","Seton Hall",25,"400988408"
64,1,"12:19",1939,"Myles Cale Steal.",14,12,"Fairleigh Dickinson","Seton Hall",25,"400988408"
65,1,"11:52",1912,"Eron Gordon Turnover.",14,12,"Fairleigh Dickinson","Seton Hall",25,"400988408"
66,1,"11:51",1911,"Nadi Beciri Steal.",14,12,"Fairleigh Dickinson","Seton Hall",25,"400988408"
67,1,"11:47",1907,"Pat McNamara made Three Point Jumper. Assisted by Jahlil Jenkins.",14,15,"Fairleigh Dickinson","Seton Hall",25,"400988408"
68,1,"11:27",1887,"Eron Gordon Turnover.",14,15,"Fairleigh Dickinson","Seton Hall",25,"400988408"
69,1,"11:27",1887,"Official TV Timeout",14,15,"Fairleigh Dickinson","Seton Hall",25,"400988408"
70,1,"11:15",1875,"Mike Schroback Turnover.",14,15,"Fairleigh Dickinson","Seton Hall",25,"400988408"
71,1,"11:14",1874,"Khadeen Carrington Steal.",14,15,"Fairleigh Dickinson","Seton Hall",25,"400988408"
72,1,"11:11",1871,"Desi Rodriguez made Layup. Assisted by Michael Nzei.",16,15,"Fairleigh Dickinson","Seton Hall",25,"400988408"
73,1,"11:09",1869,"Fairleigh Dickinson  Timeout",16,15,"Fairleigh Dickinson","Seton Hall",25,"400988408"
74,1,"10:55",1855,"Jahlil Jenkins made Layup.",16,17,"Fairleigh Dickinson","Seton Hall",25,"400988408"
75,1,"10:41",1841,"Desi Rodriguez made Three Point Jumper. Assisted by Myles Powell.",19,17,"Fairleigh Dickinson","Seton Hall",25,"400988408"
76,1,"10:29",1829,"Fairleigh Dickinson  Turnover.",19,17,"Fairleigh Dickinson","Seton Hall",25,"400988408"
77,1,"10:26",1826,"Desi Rodriguez made Layup. Assisted by Myles Powell.",21,17,"Fairleigh Dickinson","Seton Hall",25,"400988408"
78,1,"10:26",1826,"Foul on Elyjah Williams.",21,17,"Fairleigh Dickinson","Seton Hall",25,"400988408"
79,1,"10:26",1826,"Desi Rodriguez made Free Throw.",22,17,"Fairleigh Dickinson","Seton Hall",25,"400988408"
80,1,"10:19",1819,"Darnell Edge missed Three Point Jumper.",22,17,"Fairleigh Dickinson","Seton Hall",25,"400988408"
81,1,"10:19",1819,"Mike Holloway Jr. Offensive Rebound.",22,17,"Fairleigh Dickinson","Seton Hall",25,"400988408"
82,1,"10:12",1812,"Kaleb Bishop missed Layup.",22,17,"Fairleigh Dickinson","Seton Hall",25,"400988408"
83,1,"10:12",1812,"Michael Nzei Defensive Rebound.",22,17,"Fairleigh Dickinson","Seton Hall",25,"400988408"
84,1,"10:04",1804,"Myles Powell missed Three Point Jumper.",22,17,"Fairleigh Dickinson","Seton Hall",25,"400988408"
85,1,"10:04",1804,"Mike Holloway Jr. Defensive Rebound.",22,17,"Fairleigh Dickinson","Seton Hall",25,"400988408"
86,1,"9:44",1784,"Mike Holloway Jr. missed Layup.",22,17,"Fairleigh Dickinson","Seton Hall",25,"400988408"
87,1,"9:44",1784,"Michael Nzei Defensive Rebound.",22,17,"Fairleigh Dickinson","Seton Hall",25,"400988408"
88,1,"9:27",1767,"Myles Powell made Three Point Jumper. Assisted by Khadeen Carrington.",25,17,"Fairleigh Dickinson","Seton Hall",25,"400988408"
89,1,"9:11",1751,"Jahlil Jenkins missed Three Point Jumper.",25,17,"Fairleigh Dickinson","Seton Hall",25,"400988408"
90,1,"9:11",1751,"Michael Nzei Defensive Rebound.",25,17,"Fairleigh Dickinson","Seton Hall",25,"400988408"
91,1,"9:03",1743,"Desi Rodriguez made Three Point Jumper. Assisted by Khadeen Carrington.",28,17,"Fairleigh Dickinson","Seton Hall",25,"400988408"
92,1,"8:58",1738,"Fairleigh Dickinson  Timeout",28,17,"Fairleigh Dickinson","Seton Hall",25,"400988408"
93,1,"8:45",1725,"Kaleb Bishop missed Layup.",28,17,"Fairleigh Dickinson","Seton Hall",25,"400988408"
94,1,"8:45",1725,"Kaleb Bishop Offensive Rebound.",28,17,"Fairleigh Dickinson","Seton Hall",25,"400988408"
95,1,"8:41",1721,"Kaleb Bishop missed Layup.",28,17,"Fairleigh Dickinson","Seton Hall",25,"400988408"
96,1,"8:41",1721,"Ismael Sanogo Defensive Rebound.",28,17,"Fairleigh Dickinson","Seton Hall",25,"400988408"
97,1,"8:36",1716,"Myles Cale missed Layup.",28,17,"Fairleigh Dickinson","Seton Hall",25,"400988408"
98,1,"8:36",1716,"Elyjah Williams Block.",28,17,"Fairleigh Dickinson","Seton Hall",25,"400988408"
99,1,"8:35",1715,"Seton Hall Offensive Rebound.",28,17,"Fairleigh Dickinson","Seton Hall",25,"400988408"
100,1,"8:30",1710,"Khadeen Carrington missed Jumper.",28,17,"Fairleigh Dickinson","Seton Hall",25,"400988408"
101,1,"8:30",1710,"Myles Cale Offensive Rebound.",28,17,"Fairleigh Dickinson","Seton Hall",25,"400988408"
102,1,"8:27",1707,"Myles Cale made Layup.",30,17,"Fairleigh Dickinson","Seton Hall",25,"400988408"
103,1,"8:18",1698,"Elyjah Williams Turnover.",30,17,"Fairleigh Dickinson","Seton Hall",25,"400988408"
104,1,"8:17",1697,"Desi Rodriguez Steal.",30,17,"Fairleigh Dickinson","Seton Hall",25,"400988408"
105,1,"8:15",1695,"Myles Cale missed Layup.",30,17,"Fairleigh Dickinson","Seton Hall",25,"400988408"
106,1,"8:15",1695,"Myles Cale Offensive Rebound.",30,17,"Fairleigh Dickinson","Seton Hall",25,"400988408"
107,1,"8:11",1691,"Foul on Kaleb Bishop.",30,17,"Fairleigh Dickinson","Seton Hall",25,"400988408"
108,1,"8:11",1691,"Ismael Sanogo missed Free Throw.",30,17,"Fairleigh Dickinson","Seton Hall",25,"400988408"
109,1,"8:11",1691,"Seton Hall Deadball Team Rebound.",30,17,"Fairleigh Dickinson","Seton Hall",25,"400988408"
110,1,"8:11",1691,"Ismael Sanogo made Free Throw.",31,17,"Fairleigh Dickinson","Seton Hall",25,"400988408"
111,1,"8:02",1682,"Noah Morgan made Three Point Jumper. Assisted by Jahlil Jenkins.",31,20,"Fairleigh Dickinson","Seton Hall",25,"400988408"
112,1,"7:52",1672,"Ismael Sanogo missed Three Point Jumper.",31,20,"Fairleigh Dickinson","Seton Hall",25,"400988408"
113,1,"7:52",1672,"Sandro Mamukelashvili Offensive Rebound.",31,20,"Fairleigh Dickinson","Seton Hall",25,"400988408"
114,1,"7:37",1657,"Sandro Mamukelashvili missed Three Point Jumper.",31,20,"Fairleigh Dickinson","Seton Hall",25,"400988408"
115,1,"7:37",1657,"Mike Holloway Jr. Defensive Rebound.",31,20,"Fairleigh Dickinson","Seton Hall",25,"400988408"
116,1,"7:20",1640,"Official TV Timeout",31,20,"Fairleigh Dickinson","Seton Hall",25,"400988408"
117,1,"7:13",1633,"Foul on Myles Cale.",31,20,"Fairleigh Dickinson","Seton Hall",25,"400988408"
118,1,"7:06",1626,"Malik Miller missed Three Point Jumper.",31,20,"Fairleigh Dickinson","Seton Hall",25,"400988408"
119,1,"7:06",1626,"Myles Cale Defensive Rebound.",31,20,"Fairleigh Dickinson","Seton Hall",25,"400988408"
120,1,"6:44",1604,"Myles Cale made Three Point Jumper. Assisted by Jordan Walker.",34,20,"Fairleigh Dickinson","Seton Hall",25,"400988408"
121,1,"6:16",1576,"Jahlil Jenkins missed Three Point Jumper.",34,20,"Fairleigh Dickinson","Seton Hall",25,"400988408"
122,1,"6:16",1576,"Fairleigh Dickinson Offensive Rebound.",34,20,"Fairleigh Dickinson","Seton Hall",25,"400988408"
123,1,"6:14",1574,"Foul on Myles Cale.",34,20,"Fairleigh Dickinson","Seton Hall",25,"400988408"
124,1,"5:59",1559,"Jahlil Jenkins missed Jumper.",34,20,"Fairleigh Dickinson","Seton Hall",25,"400988408"
125,1,"5:59",1559,"Ismael Sanogo Defensive Rebound.",34,20,"Fairleigh Dickinson","Seton Hall",25,"400988408"
126,1,"5:54",1554,"Khadeen Carrington made Layup.",36,20,"Fairleigh Dickinson","Seton Hall",25,"400988408"
127,1,"5:47",1547,"Jahlil Jenkins Turnover.",36,20,"Fairleigh Dickinson","Seton Hall",25,"400988408"
128,1,"5:42",1542,"Khadeen Carrington missed Layup.",36,20,"Fairleigh Dickinson","Seton Hall",25,"400988408"
129,1,"5:42",1542,"Fairleigh Dickinson Defensive Rebound.",36,20,"Fairleigh Dickinson","Seton Hall",25,"400988408"
130,1,"5:23",1523,"Mike Holloway Jr. made Dunk. Assisted by Darnell Edge.",36,22,"Fairleigh Dickinson","Seton Hall",25,"400988408"
131,1,"5:00",1500,"Foul on Mike Holloway Jr..",36,22,"Fairleigh Dickinson","Seton Hall",25,"400988408"
132,1,"5:00",1500,"Sandro Mamukelashvili made Free Throw.",37,22,"Fairleigh Dickinson","Seton Hall",25,"400988408"
133,1,"5:00",1500,"Sandro Mamukelashvili made Free Throw.",38,22,"Fairleigh Dickinson","Seton Hall",25,"400988408"
134,1,"4:44",1484,"Darnell Edge made Jumper.",38,24,"Fairleigh Dickinson","Seton Hall",25,"400988408"
135,1,"4:24",1464,"Khadeen Carrington missed Three Point Jumper.",38,24,"Fairleigh Dickinson","Seton Hall",25,"400988408"
136,1,"4:24",1464,"Fairleigh Dickinson Defensive Rebound.",38,24,"Fairleigh Dickinson","Seton Hall",25,"400988408"
137,1,"4:23",1463,"Foul on Angel Delgado.",38,24,"Fairleigh Dickinson","Seton Hall",25,"400988408"
138,1,"4:11",1451,"Foul on Ismael Sanogo.",38,24,"Fairleigh Dickinson","Seton Hall",25,"400988408"
139,1,"4:11",1451,"Kaleb Bishop made Free Throw.",38,25,"Fairleigh Dickinson","Seton Hall",25,"400988408"
140,1,"4:11",1451,"Kaleb Bishop made Free Throw.",38,26,"Fairleigh Dickinson","Seton Hall",25,"400988408"
141,1,"3:48",1428,"Foul on Noah Morgan.",38,26,"Fairleigh Dickinson","Seton Hall",25,"400988408"
142,1,"3:48",1428,"Official TV Timeout",38,26,"Fairleigh Dickinson","Seton Hall",25,"400988408"
143,1,"3:48",1428,"Myles Powell made Free Throw.",39,26,"Fairleigh Dickinson","Seton Hall",25,"400988408"
144,1,"3:48",1428,"Myles Powell made Free Throw.",40,26,"Fairleigh Dickinson","Seton Hall",25,"400988408"
145,1,"3:38",1418,"Mike Holloway Jr. missed Jumper.",40,26,"Fairleigh Dickinson","Seton Hall",25,"400988408"
146,1,"3:38",1418,"Myles Powell Defensive Rebound.",40,26,"Fairleigh Dickinson","Seton Hall",25,"400988408"
147,1,"3:24",1404,"Michael Nzei made Layup. Assisted by Eron Gordon.",42,26,"Fairleigh Dickinson","Seton Hall",25,"400988408"
148,1,"3:10",1390,"Kaleb Bishop Turnover.",42,26,"Fairleigh Dickinson","Seton Hall",25,"400988408"
149,1,"2:52",1372,"Angel Delgado made Dunk. Assisted by Myles Powell.",44,26,"Fairleigh Dickinson","Seton Hall",25,"400988408"
150,1,"2:37",1357,"Foul on Myles Powell.",44,26,"Fairleigh Dickinson","Seton Hall",25,"400988408"
151,1,"2:37",1357,"Pat McNamara missed Free Throw.",44,26,"Fairleigh Dickinson","Seton Hall",25,"400988408"
152,1,"2:37",1357,"Myles Powell Defensive Rebound.",44,26,"Fairleigh Dickinson","Seton Hall",25,"400988408"
153,1,"2:20",1340,"Khadeen Carrington missed Layup.",44,26,"Fairleigh Dickinson","Seton Hall",25,"400988408"
154,1,"2:20",1340,"Angel Delgado Offensive Rebound.",44,26,"Fairleigh Dickinson","Seton Hall",25,"400988408"
155,1,"2:07",1327,"Foul on Nadi Beciri.",44,26,"Fairleigh Dickinson","Seton Hall",25,"400988408"
156,1,"2:07",1327,"Michael Nzei made Free Throw.",45,26,"Fairleigh Dickinson","Seton Hall",25,"400988408"
157,1,"2:07",1327,"Michael Nzei made Free Throw.",46,26,"Fairleigh Dickinson","Seton Hall",25,"400988408"
158,1,"1:43",1303,"Elyjah Williams made Layup. Assisted by Darnell Edge.",46,28,"Fairleigh Dickinson","Seton Hall",25,"400988408"
159,1,"1:33",1293,"Khadeen Carrington Turnover.",46,28,"Fairleigh Dickinson","Seton Hall",25,"400988408"
160,1,"1:32",1292,"Elyjah Williams Steal.",46,28,"Fairleigh Dickinson","Seton Hall",25,"400988408"
161,1,"1:24",1284,"Kaleb Bishop missed Three Point Jumper.",46,28,"Fairleigh Dickinson","Seton Hall",25,"400988408"
162,1,"1:24",1284,"Seton Hall Defensive Rebound.",46,28,"Fairleigh Dickinson","Seton Hall",25,"400988408"
163,1,"1:04",1264,"Angel Delgado missed Layup.",46,28,"Fairleigh Dickinson","Seton Hall",25,"400988408"
164,1,"1:04",1264,"Angel Delgado Offensive Rebound.",46,28,"Fairleigh Dickinson","Seton Hall",25,"400988408"
165,1,"1:00",1260,"Foul on Nadi Beciri.",46,28,"Fairleigh Dickinson","Seton Hall",25,"400988408"
166,1,"1:00",1260,"Angel Delgado missed Free Throw.",46,28,"Fairleigh Dickinson","Seton Hall",25,"400988408"
167,1,"1:00",1260,"Seton Hall Deadball Team Rebound.",46,28,"Fairleigh Dickinson","Seton Hall",25,"400988408"
168,1,"1:00",1260,"Angel Delgado missed Free Throw.",46,28,"Fairleigh Dickinson","Seton Hall",25,"400988408"
169,1,"1:00",1260,"Mike Holloway Jr. Defensive Rebound.",46,28,"Fairleigh Dickinson","Seton Hall",25,"400988408"
170,1,"0:49",1249,"Jahlil Jenkins Turnover.",46,28,"Fairleigh Dickinson","Seton Hall",25,"400988408"
171,1,"0:49",1249,"Jordan Walker Steal.",46,28,"Fairleigh Dickinson","Seton Hall",25,"400988408"
172,1,"0:49",1249,"Foul on Mike Holloway Jr..",46,28,"Fairleigh Dickinson","Seton Hall",25,"400988408"
173,1,"0:49",1249,"Jordan Walker missed Free Throw.",46,28,"Fairleigh Dickinson","Seton Hall",25,"400988408"
174,1,"0:49",1249,"Seton Hall Deadball Team Rebound.",46,28,"Fairleigh Dickinson","Seton Hall",25,"400988408"
175,1,"0:49",1249,"Jordan Walker made Free Throw.",47,28,"Fairleigh Dickinson","Seton Hall",25,"400988408"
176,1,"0:25",1225,"Mike Holloway Jr. missed Three Point Jumper.",47,28,"Fairleigh Dickinson","Seton Hall",25,"400988408"
177,1,"0:25",1225,"Michael Nzei Defensive Rebound.",47,28,"Fairleigh Dickinson","Seton Hall",25,"400988408"
178,1,"0:01",1201,"Desi Rodriguez missed Three Point Jumper.",47,28,"Fairleigh Dickinson","Seton Hall",25,"400988408"
179,1,"0:01",1201,"Seton Hall Deadball Team Rebound.",47,28,"Fairleigh Dickinson","Seton Hall",25,"400988408"
180,1,"0:00",1200,"End of 1st half",47,28,"Fairleigh Dickinson","Seton Hall",25,"400988408"
181,2,"20:00",1200,"PLAY",47,28,"Fairleigh Dickinson","Seton Hall",25,"400988408"
182,2,"19:36",1176,"Desi Rodriguez missed Three Point Jumper.",47,28,"Fairleigh Dickinson","Seton Hall",25,"400988408"
183,2,"19:36",1176,"Jahlil Jenkins Defensive Rebound.",47,28,"Fairleigh Dickinson","Seton Hall",25,"400988408"
184,2,"19:30",1170,"Darnell Edge made Layup. Assisted by Jahlil Jenkins.",47,30,"Fairleigh Dickinson","Seton Hall",25,"400988408"
185,2,"19:30",1170,"Foul on Michael Nzei.",47,30,"Fairleigh Dickinson","Seton Hall",25,"400988408"
186,2,"19:30",1170,"Darnell Edge made Free Throw.",47,31,"Fairleigh Dickinson","Seton Hall",25,"400988408"
187,2,"19:10",1150,"Desi Rodriguez made Layup. Assisted by Angel Delgado.",49,31,"Fairleigh Dickinson","Seton Hall",25,"400988408"
188,2,"18:38",1118,"Foul on Michael Nzei.",49,31,"Fairleigh Dickinson","Seton Hall",25,"400988408"
189,2,"18:34",1114,"Darnell Edge missed Three Point Jumper.",49,31,"Fairleigh Dickinson","Seton Hall",25,"400988408"
190,2,"18:34",1114,"Desi Rodriguez Defensive Rebound.",49,31,"Fairleigh Dickinson","Seton Hall",25,"400988408"
191,2,"18:19",1099,"Angel Delgado made Dunk. Assisted by Desi Rodriguez.",51,31,"Fairleigh Dickinson","Seton Hall",25,"400988408"
192,2,"18:01",1081,"Mike Holloway Jr. made Jumper.",51,33,"Fairleigh Dickinson","Seton Hall",25,"400988408"
193,2,"17:50",1070,"Khadeen Carrington missed Three Point Jumper.",51,33,"Fairleigh Dickinson","Seton Hall",25,"400988408"
194,2,"17:50",1070,"Michael Nzei Offensive Rebound.",51,33,"Fairleigh Dickinson","Seton Hall",25,"400988408"
195,2,"17:49",1069,"Foul on Darnell Edge.",51,33,"Fairleigh Dickinson","Seton Hall",25,"400988408"
196,2,"17:40",1060,"Myles Powell missed Three Point Jumper.",51,33,"Fairleigh Dickinson","Seton Hall",25,"400988408"
197,2,"17:40",1060,"Jahlil Jenkins Defensive Rebound.",51,33,"Fairleigh Dickinson","Seton Hall",25,"400988408"
198,2,"17:30",1050,"Jahlil Jenkins missed Three Point Jumper.",51,33,"Fairleigh Dickinson","Seton Hall",25,"400988408"
199,2,"17:30",1050,"Angel Delgado Defensive Rebound.",51,33,"Fairleigh Dickinson","Seton Hall",25,"400988408"
200,2,"17:20",1040,"Desi Rodriguez missed Layup.",51,33,"Fairleigh Dickinson","Seton Hall",25,"400988408"
201,2,"17:20",1040,"Khadeen Carrington Offensive Rebound.",51,33,"Fairleigh Dickinson","Seton Hall",25,"400988408"
202,2,"17:18",1038,"Khadeen Carrington made Layup.",53,33,"Fairleigh Dickinson","Seton Hall",25,"400988408"
203,2,"17:10",1030,"Darnell Edge made Three Point Jumper. Assisted by Jahlil Jenkins.",53,36,"Fairleigh Dickinson","Seton Hall",25,"400988408"
204,2,"16:39",999,"Foul on Nadi Beciri.",53,36,"Fairleigh Dickinson","Seton Hall",25,"400988408"
205,2,"16:39",999,"Desi Rodriguez made Free Throw.",54,36,"Fairleigh Dickinson","Seton Hall",25,"400988408"
206,2,"16:39",999,"Desi Rodriguez made Free Throw.",55,36,"Fairleigh Dickinson","Seton Hall",25,"400988408"
207,2,"16:25",985,"Darnell Edge missed Layup.",55,36,"Fairleigh Dickinson","Seton Hall",25,"400988408"
208,2,"16:25",985,"Angel Delgado Defensive Rebound.",55,36,"Fairleigh Dickinson","Seton Hall",25,"400988408"
209,2,"16:10",970,"Angel Delgado missed Jumper.",55,36,"Fairleigh Dickinson","Seton Hall",25,"400988408"
210,2,"16:10",970,"Elyjah Williams Defensive Rebound.",55,36,"Fairleigh Dickinson","Seton Hall",25,"400988408"
211,2,"16:00",960,"Mike Holloway Jr. made Layup.",55,38,"Fairleigh Dickinson","Seton Hall",25,"400988408"
212,2,"15:36",936,"Desi Rodriguez missed Jumper.",55,38,"Fairleigh Dickinson","Seton Hall",25,"400988408"
213,2,"15:36",936,"Elyjah Williams Defensive Rebound.",55,38,"Fairleigh Dickinson","Seton Hall",25,"400988408"
214,2,"15:09",909,"Darnell Edge Turnover.",55,38,"Fairleigh Dickinson","Seton Hall",25,"400988408"
215,2,"15:09",909,"Official TV Timeout",55,38,"Fairleigh Dickinson","Seton Hall",25,"400988408"
216,2,"15:04",904,"Myles Powell missed Dunk.",55,38,"Fairleigh Dickinson","Seton Hall",25,"400988408"
217,2,"15:04",904,"Kaleb Bishop Defensive Rebound.",55,38,"Fairleigh Dickinson","Seton Hall",25,"400988408"
218,2,"14:36",876,"Foul on Angel Delgado.",55,38,"Fairleigh Dickinson","Seton Hall",25,"400988408"
219,2,"14:36",876,"Kaleb Bishop made Free Throw.",55,39,"Fairleigh Dickinson","Seton Hall",25,"400988408"
220,2,"14:36",876,"Kaleb Bishop made Free Throw.",55,40,"Fairleigh Dickinson","Seton Hall",25,"400988408"
221,2,"14:26",866,"Angel Delgado made Layup. Assisted by Khadeen Carrington.",57,40,"Fairleigh Dickinson","Seton Hall",25,"400988408"
222,2,"14:08",848,"Kaleb Bishop missed Layup.",57,40,"Fairleigh Dickinson","Seton Hall",25,"400988408"
223,2,"14:08",848,"Angel Delgado Defensive Rebound.",57,40,"Fairleigh Dickinson","Seton Hall",25,"400988408"
224,2,"14:02",842,"Myles Cale made Layup. Assisted by Khadeen Carrington.",59,40,"Fairleigh Dickinson","Seton Hall",25,"400988408"
225,2,"13:49",829,"Foul on Elyjah Williams.",59,40,"Fairleigh Dickinson","Seton Hall",25,"400988408"
226,2,"13:49",829,"Mike Holloway Jr. missed Layup.",59,40,"Fairleigh Dickinson","Seton Hall",25,"400988408"
227,2,"13:49",829,"Seton Hall Deadball Team Rebound.",59,40,"Fairleigh Dickinson","Seton Hall",25,"400988408"
228,2,"13:19",799,"Khadeen Carrington made Layup.",61,40,"Fairleigh Dickinson","Seton Hall",25,"400988408"
229,2,"13:02",782,"Kaleb Bishop Turnover.",61,40,"Fairleigh Dickinson","Seton Hall",25,"400988408"
230,2,"13:02",782,"Foul on Kaleb Bishop.",61,40,"Fairleigh Dickinson","Seton Hall",25,"400988408"
231,2,"12:49",769,"Ismael Sanogo made Layup. Assisted by Eron Gordon.",63,40,"Fairleigh Dickinson","Seton Hall",25,"400988408"
232,2,"12:32",752,"Mike Holloway Jr. Turnover.",63,40,"Fairleigh Dickinson","Seton Hall",25,"400988408"
233,2,"12:14",734,"Sandro Mamukelashvili missed Layup.",63,40,"Fairleigh Dickinson","Seton Hall",25,"400988408"
234,2,"12:14",734,"Jahlil Jenkins Defensive Rebound.",63,40,"Fairleigh Dickinson","Seton Hall",25,"400988408"
235,2,"12:08",728,"Malik Miller made Three Point Jumper. Assisted by Jahlil Jenkins.",63,43,"Fairleigh Dickinson","Seton Hall",25,"400988408"
236,2,"11:37",697,"Official TV Timeout",63,43,"Fairleigh Dickinson","Seton Hall",25,"400988408"
