"play_id","half","time_remaining_half","secs_remaining","description","home_score","away_score","away","home","home_favored_by","game_id"
326,2,"5:17",317,"Ismael Sanogo Defensive Rebound.",56,63,"Seton Hall","Rutgers",-9,"400986442"
327,2,"5:00",300,"Khadeen Carrington missed Layup.",56,63,"Seton Hall","Rutgers",-9,"400986442"
328,2,"5:00",300,"Deshawn Freeman Defensive Rebound.",56,63,"Seton Hall","Rutgers",-9,"400986442"
329,2,"4:45",285,"Corey Sanders made Layup.",58,63,"Seton Hall","Rutgers",-9,"400986442"
330,2,"4:27",267,"Angel Delgado missed Layup.",58,63,"Seton Hall","Rutgers",-9,"400986442"
331,2,"4:27",267,"Eugene Omoruyi Defensive Rebound.",58,63,"Seton Hall","Rutgers",-9,"400986442"
332,2,"4:17",257,"Corey Sanders Turnover.",58,63,"Seton Hall","Rutgers",-9,"400986442"
333,2,"4:16",256,"Myles Cale Steal.",58,63,"Seton Hall","Rutgers",-9,"400986442"
334,2,"3:53",233,"Khadeen Carrington missed Jumper.",58,63,"Seton Hall","Rutgers",-9,"400986442"
335,2,"3:53",233,"Angel Delgado Offensive Rebound.",58,63,"Seton Hall","Rutgers",-9,"400986442"
336,2,"3:53",233,"Foul on Eugene Omoruyi.",58,63,"Seton Hall","Rutgers",-9,"400986442"
337,2,"3:52",232,"Official TV Timeout",58,63,"Seton Hall","Rutgers",-9,"400986442"
338,2,"3:48",228,"Angel Delgado Turnover.",58,63,"Seton Hall","Rutgers",-9,"400986442"
339,2,"3:47",227,"Geo Baker Steal.",58,63,"Seton Hall","Rutgers",-9,"400986442"
340,2,"3:44",224,"Eugene Omoruyi made Layup. Assisted by Geo Baker.",60,63,"Seton Hall","Rutgers",-9,"400986442"
341,2,"3:22",202,"Khadeen Carrington missed Jumper.",60,63,"Seton Hall","Rutgers",-9,"400986442"
342,2,"3:22",202,"Geo Baker Defensive Rebound.",60,63,"Seton Hall","Rutgers",-9,"400986442"
343,2,"3:11",191,"Deshawn Freeman missed Layup.",60,63,"Seton Hall","Rutgers",-9,"400986442"
344,2,"3:11",191,"Eugene Omoruyi Offensive Rebound.",60,63,"Seton Hall","Rutgers",-9,"400986442"
345,2,"3:11",191,"Foul on Desi Rodriguez.",60,63,"Seton Hall","Rutgers",-9,"400986442"
346,2,"3:11",191,"Eugene Omoruyi made Free Throw.",61,63,"Seton Hall","Rutgers",-9,"400986442"
347,2,"3:11",191,"Eugene Omoruyi missed Free Throw.",61,63,"Seton Hall","Rutgers",-9,"400986442"
348,2,"3:11",191,"Seton Hall Defensive Rebound.",61,63,"Seton Hall","Rutgers",-9,"400986442"
349,2,"2:50",170,"Desi Rodriguez Turnover.",61,63,"Seton Hall","Rutgers",-9,"400986442"
350,2,"2:50",170,"Mike Williams Steal.",61,63,"Seton Hall","Rutgers",-9,"400986442"
351,2,"2:36",156,"Corey Sanders made Jumper.",63,63,"Seton Hall","Rutgers",-9,"400986442"
352,2,"2:31",151,"Seton Hall  Timeout",63,63,"Seton Hall","Rutgers",-9,"400986442"
353,2,"2:22",142,"Khadeen Carrington missed Three Point Jumper.",63,63,"Seton Hall","Rutgers",-9,"400986442"
354,2,"2:22",142,"Corey Sanders Defensive Rebound.",63,63,"Seton Hall","Rutgers",-9,"400986442"
355,2,"2:22",142,"Foul on Ismael Sanogo.",63,63,"Seton Hall","Rutgers",-9,"400986442"
356,2,"2:22",142,"Corey Sanders made Free Throw.",64,63,"Seton Hall","Rutgers",-9,"400986442"
357,2,"2:22",142,"Corey Sanders made Free Throw.",65,63,"Seton Hall","Rutgers",-9,"400986442"
358,2,"2:10",130,"Foul on Geo Baker.",65,63,"Seton Hall","Rutgers",-9,"400986442"
359,2,"1:53",113,"Khadeen Carrington missed Jumper.",65,63,"Seton Hall","Rutgers",-9,"400986442"
360,2,"1:53",113,"Deshawn Freeman Defensive Rebound.",65,63,"Seton Hall","Rutgers",-9,"400986442"
361,2,"1:35",95,"Corey Sanders made Jumper.",67,63,"Seton Hall","Rutgers",-9,"400986442"
362,2,"1:22",82,"Angel Delgado Turnover.",67,63,"Seton Hall","Rutgers",-9,"400986442"
363,2,"1:21",81,"Corey Sanders Steal.",67,63,"Seton Hall","Rutgers",-9,"400986442"
364,2,"1:12",72,"Rutgers  Timeout",67,63,"Seton Hall","Rutgers",-9,"400986442"
365,2,"0:52",52,"Mike Williams missed Three Point Jumper.",67,63,"Seton Hall","Rutgers",-9,"400986442"
366,2,"0:52",52,"Myles Powell Defensive Rebound.",67,63,"Seton Hall","Rutgers",-9,"400986442"
367,2,"0:50",50,"Foul on Geo Baker.",67,63,"Seton Hall","Rutgers",-9,"400986442"
368,2,"0:50",50,"Myles Powell made Free Throw.",67,64,"Seton Hall","Rutgers",-9,"400986442"
369,2,"0:50",50,"Myles Powell made Free Throw.",67,65,"Seton Hall","Rutgers",-9,"400986442"
370,2,"0:21",21,"Foul on Khadeen Carrington.",67,65,"Seton Hall","Rutgers",-9,"400986442"
371,2,"0:21",21,"Deshawn Freeman made Free Throw.",68,65,"Seton Hall","Rutgers",-9,"400986442"
372,2,"0:21",21,"Seton Hall  Timeout",68,65,"Seton Hall","Rutgers",-9,"400986442"
373,2,"0:21",21,"Deshawn Freeman missed Free Throw.",68,65,"Seton Hall","Rutgers",-9,"400986442"
374,2,"0:21",21,"Angel Delgado Defensive Rebound.",68,65,"Seton Hall","Rutgers",-9,"400986442"
375,2,"0:09",9,"Myles Powell missed Three Point Jumper.",68,65,"Seton Hall","Rutgers",-9,"400986442"
376,2,"0:09",9,"Mike Williams Defensive Rebound.",68,65,"Seton Hall","Rutgers",-9,"400986442"
377,2,"0:08",8,"Foul on Angel Delgado.",68,65,"Seton Hall","Rutgers",-9,"400986442"
378,2,"0:08",8,"Mike Williams missed Free Throw.",68,65,"Seton Hall","Rutgers",-9,"400986442"
379,2,"0:08",8,"Rutgers Deadball Team Rebound.",68,65,"Seton Hall","Rutgers",-9,"400986442"
380,2,"0:08",8,"Mike Williams made Free Throw.",69,65,"Seton Hall","Rutgers",-9,"400986442"
381,2,"0:08",8,"Rutgers  Timeout",69,65,"Seton Hall","Rutgers",-9,"400986442"
382,2,"0:07",7,"Seton Hall  Timeout",69,65,"Seton Hall","Rutgers",-9,"400986442"
383,2,"0:06",6,"Khadeen Carrington Turnover.",69,65,"Seton Hall","Rutgers",-9,"400986442"
384,2,"0:06",6,"Eugene Omoruyi Steal.",69,65,"Seton Hall","Rutgers",-9,"400986442"
385,2,"0:04",4,"Foul on Myles Powell.",69,65,"Seton Hall","Rutgers",-9,"400986442"
386,2,"0:04",4,"Eugene Omoruyi made Free Throw.",70,65,"Seton Hall","Rutgers",-9,"400986442"
387,2,"0:04",4,"Eugene Omoruyi made Free Throw.",71,65,"Seton Hall","Rutgers",-9,"400986442"
388,2,"0:00",0,"End of Game",71,65,"Seton Hall","Rutgers",-9,"400986442"
1,1,"20:00",2400,"PLAY",0,0,"Wagner","Seton Hall",22.5,"400988537"
2,1,"19:45",2385,"Desi Rodriguez missed Jumper.",0,0,"Wagner","Seton Hall",22.5,"400988537"
3,1,"19:45",2385,"Angel Delgado Offensive Rebound.",0,0,"Wagner","Seton Hall",22.5,"400988537"
4,1,"19:42",2382,"Angel Delgado made Layup.",2,0,"Wagner","Seton Hall",22.5,"400988537"
5,1,"19:24",2364,"Blake Francis missed Three Point Jumper.",2,0,"Wagner","Seton Hall",22.5,"400988537"
6,1,"19:24",2364,"Khadeen Carrington Defensive Rebound.",2,0,"Wagner","Seton Hall",22.5,"400988537"
7,1,"19:12",2352,"Desi Rodriguez missed Three Point Jumper.",2,0,"Wagner","Seton Hall",22.5,"400988537"
8,1,"19:12",2352,"Angel Delgado Offensive Rebound.",2,0,"Wagner","Seton Hall",22.5,"400988537"
9,1,"19:10",2350,"Foul on AJ Sumbry.",2,0,"Wagner","Seton Hall",22.5,"400988537"
10,1,"19:03",2343,"Myles Powell missed Three Point Jumper.",2,0,"Wagner","Seton Hall",22.5,"400988537"
11,1,"19:03",2343,"Michael Nzei Offensive Rebound.",2,0,"Wagner","Seton Hall",22.5,"400988537"
12,1,"19:00",2340,"Michael Nzei made Layup.",4,0,"Wagner","Seton Hall",22.5,"400988537"
13,1,"18:48",2328,"Blake Francis Turnover.",4,0,"Wagner","Seton Hall",22.5,"400988537"
14,1,"18:47",2327,"Myles Powell Steal.",4,0,"Wagner","Seton Hall",22.5,"400988537"
15,1,"18:45",2325,"Foul on Blake Francis.",4,0,"Wagner","Seton Hall",22.5,"400988537"
16,1,"18:45",2325,"Myles Powell made Free Throw.",5,0,"Wagner","Seton Hall",22.5,"400988537"
17,1,"18:45",2325,"Myles Powell made Free Throw.",6,0,"Wagner","Seton Hall",22.5,"400988537"
18,1,"18:32",2312,"JoJo Cooper missed Jumper.",6,0,"Wagner","Seton Hall",22.5,"400988537"
19,1,"18:32",2312,"Desi Rodriguez Block.",6,0,"Wagner","Seton Hall",22.5,"400988537"
20,1,"18:30",2310,"JoJo Cooper Offensive Rebound.",6,0,"Wagner","Seton Hall",22.5,"400988537"
21,1,"18:25",2305,"Devin Liggeons missed Layup.",6,0,"Wagner","Seton Hall",22.5,"400988537"
22,1,"18:25",2305,"Nigel Jackson Offensive Rebound.",6,0,"Wagner","Seton Hall",22.5,"400988537"
23,1,"18:20",2300,"Nigel Jackson made Layup.",6,2,"Wagner","Seton Hall",22.5,"400988537"
24,1,"18:05",2285,"Khadeen Carrington missed Jumper.",6,2,"Wagner","Seton Hall",22.5,"400988537"
25,1,"18:05",2285,"Khadeen Carrington Offensive Rebound.",6,2,"Wagner","Seton Hall",22.5,"400988537"
26,1,"18:03",2283,"Foul on Blake Francis.",6,2,"Wagner","Seton Hall",22.5,"400988537"
27,1,"18:01",2281,"Khadeen Carrington Turnover.",6,2,"Wagner","Seton Hall",22.5,"400988537"
28,1,"18:01",2281,"Foul on Khadeen Carrington.",6,2,"Wagner","Seton Hall",22.5,"400988537"
29,1,"17:44",2264,"JoJo Cooper made Layup. Assisted by Devin Liggeons.",6,4,"Wagner","Seton Hall",22.5,"400988537"
30,1,"17:24",2244,"Angel Delgado made Layup. Assisted by Khadeen Carrington.",8,4,"Wagner","Seton Hall",22.5,"400988537"
31,1,"17:08",2228,"Nigel Jackson missed Three Point Jumper.",8,4,"Wagner","Seton Hall",22.5,"400988537"
32,1,"17:08",2228,"Romone Saunders Offensive Rebound.",8,4,"Wagner","Seton Hall",22.5,"400988537"
33,1,"17:01",2221,"Nigel Jackson missed Three Point Jumper.",8,4,"Wagner","Seton Hall",22.5,"400988537"
34,1,"17:01",2221,"Angel Delgado Defensive Rebound.",8,4,"Wagner","Seton Hall",22.5,"400988537"
35,1,"16:50",2210,"Myles Powell made Three Point Jumper. Assisted by Michael Nzei.",11,4,"Wagner","Seton Hall",22.5,"400988537"
36,1,"16:34",2194,"JoJo Cooper missed Layup.",11,4,"Wagner","Seton Hall",22.5,"400988537"
37,1,"16:34",2194,"Angel Delgado Defensive Rebound.",11,4,"Wagner","Seton Hall",22.5,"400988537"
38,1,"16:17",2177,"Khadeen Carrington made Three Point Jumper. Assisted by Angel Delgado.",14,4,"Wagner","Seton Hall",22.5,"400988537"
39,1,"15:47",2147,"Devin Liggeons missed Three Point Jumper.",14,4,"Wagner","Seton Hall",22.5,"400988537"
40,1,"15:47",2147,"Wagner Offensive Rebound.",14,4,"Wagner","Seton Hall",22.5,"400988537"
41,1,"15:42",2142,"Official TV Timeout",14,4,"Wagner","Seton Hall",22.5,"400988537"
42,1,"15:31",2131,"AJ Sumbry missed Jumper.",14,4,"Wagner","Seton Hall",22.5,"400988537"
43,1,"15:31",2131,"Seton Hall Defensive Rebound.",14,4,"Wagner","Seton Hall",22.5,"400988537"
44,1,"15:30",2130,"Foul on Nigel Jackson.",14,4,"Wagner","Seton Hall",22.5,"400988537"
45,1,"15:17",2117,"Desi Rodriguez missed Jumper.",14,4,"Wagner","Seton Hall",22.5,"400988537"
46,1,"15:17",2117,"Nigel Jackson Block.",14,4,"Wagner","Seton Hall",22.5,"400988537"
47,1,"15:16",2116,"Michael Nzei Offensive Rebound.",14,4,"Wagner","Seton Hall",22.5,"400988537"
48,1,"15:14",2114,"Michael Nzei Turnover.",14,4,"Wagner","Seton Hall",22.5,"400988537"
49,1,"15:14",2114,"Elijah Davis Steal.",14,4,"Wagner","Seton Hall",22.5,"400988537"
50,1,"14:52",2092,"JoJo Cooper made Layup.",14,6,"Wagner","Seton Hall",22.5,"400988537"
51,1,"14:38",2078,"Myles Powell Turnover.",14,6,"Wagner","Seton Hall",22.5,"400988537"
52,1,"14:38",2078,"Foul on Myles Powell.",14,6,"Wagner","Seton Hall",22.5,"400988537"
53,1,"14:21",2061,"AJ Sumbry made Layup.",14,8,"Wagner","Seton Hall",22.5,"400988537"
54,1,"14:05",2045,"Myles Cale missed Three Point Jumper.",14,8,"Wagner","Seton Hall",22.5,"400988537"
55,1,"14:05",2045,"Wagner Defensive Rebound.",14,8,"Wagner","Seton Hall",22.5,"400988537"
56,1,"13:43",2023,"Romone Saunders missed Layup.",14,8,"Wagner","Seton Hall",22.5,"400988537"
57,1,"13:43",2023,"Desi Rodriguez Block.",14,8,"Wagner","Seton Hall",22.5,"400988537"
58,1,"13:42",2022,"Myles Cale Defensive Rebound.",14,8,"Wagner","Seton Hall",22.5,"400988537"
59,1,"13:27",2007,"Angel Delgado made Layup. Assisted by Khadeen Carrington.",16,8,"Wagner","Seton Hall",22.5,"400988537"
60,1,"13:09",1989,"Tyler Plummer missed Layup.",16,8,"Wagner","Seton Hall",22.5,"400988537"
61,1,"13:09",1989,"Ismael Sanogo Defensive Rebound.",16,8,"Wagner","Seton Hall",22.5,"400988537"
62,1,"12:58",1978,"Khadeen Carrington made Three Point Jumper. Assisted by Angel Delgado.",19,8,"Wagner","Seton Hall",22.5,"400988537"
63,1,"12:39",1959,"JoJo Cooper missed Three Point Jumper.",19,8,"Wagner","Seton Hall",22.5,"400988537"
64,1,"12:39",1959,"Angel Delgado Defensive Rebound.",19,8,"Wagner","Seton Hall",22.5,"400988537"
65,1,"12:21",1941,"Khadeen Carrington made Three Point Jumper.",22,8,"Wagner","Seton Hall",22.5,"400988537"
66,1,"11:57",1917,"Romone Saunders made Layup.",22,10,"Wagner","Seton Hall",22.5,"400988537"
67,1,"11:35",1895,"Ismael Sanogo missed Jumper.",22,10,"Wagner","Seton Hall",22.5,"400988537"
68,1,"11:35",1895,"AJ Sumbry Defensive Rebound.",22,10,"Wagner","Seton Hall",22.5,"400988537"
69,1,"11:27",1887,"Elijah Davis missed Layup.",22,10,"Wagner","Seton Hall",22.5,"400988537"
70,1,"11:27",1887,"AJ Sumbry Offensive Rebound.",22,10,"Wagner","Seton Hall",22.5,"400988537"
71,1,"11:24",1884,"AJ Sumbry made Two Point Tip Shot.",22,12,"Wagner","Seton Hall",22.5,"400988537"
72,1,"11:11",1871,"Khadeen Carrington made Layup. Assisted by Myles Powell.",24,12,"Wagner","Seton Hall",22.5,"400988537"
73,1,"11:11",1871,"Foul on AJ Sumbry.",24,12,"Wagner","Seton Hall",22.5,"400988537"
74,1,"11:11",1871,"Official TV Timeout",24,12,"Wagner","Seton Hall",22.5,"400988537"
75,1,"11:11",1871,"Khadeen Carrington made Free Throw.",25,12,"Wagner","Seton Hall",22.5,"400988537"
76,1,"10:54",1854,"Romone Saunders missed Jumper.",25,12,"Wagner","Seton Hall",22.5,"400988537"
77,1,"10:54",1854,"Ismael Sanogo Defensive Rebound.",25,12,"Wagner","Seton Hall",22.5,"400988537"
78,1,"10:43",1843,"Myles Cale Turnover.",25,12,"Wagner","Seton Hall",22.5,"400988537"
79,1,"10:42",1842,"Tyler Plummer Steal.",25,12,"Wagner","Seton Hall",22.5,"400988537"
80,1,"10:36",1836,"JoJo Cooper made Layup.",25,14,"Wagner","Seton Hall",22.5,"400988537"
81,1,"10:20",1820,"Ismael Sanogo made Jumper.",27,14,"Wagner","Seton Hall",22.5,"400988537"
82,1,"9:58",1798,"JoJo Cooper made Jumper.",27,16,"Wagner","Seton Hall",22.5,"400988537"
83,1,"9:49",1789,"Sandro Mamukelashvili Turnover.",27,16,"Wagner","Seton Hall",22.5,"400988537"
84,1,"9:48",1788,"Tyler Plummer Steal.",27,16,"Wagner","Seton Hall",22.5,"400988537"
85,1,"9:45",1785,"JoJo Cooper made Layup. Assisted by Romone Saunders.",27,18,"Wagner","Seton Hall",22.5,"400988537"
86,1,"9:45",1785,"Foul on Eron Gordon.",27,18,"Wagner","Seton Hall",22.5,"400988537"
87,1,"9:45",1785,"JoJo Cooper made Free Throw.",27,19,"Wagner","Seton Hall",22.5,"400988537"
88,1,"9:36",1776,"Ismael Sanogo made Dunk. Assisted by Myles Powell.",29,19,"Wagner","Seton Hall",22.5,"400988537"
89,1,"9:07",1747,"Blake Francis missed Three Point Jumper.",29,19,"Wagner","Seton Hall",22.5,"400988537"
90,1,"9:07",1747,"Desi Rodriguez Block.",29,19,"Wagner","Seton Hall",22.5,"400988537"
91,1,"9:07",1747,"Seton Hall Defensive Rebound.",29,19,"Wagner","Seton Hall",22.5,"400988537"
92,1,"8:56",1736,"Desi Rodriguez made Layup. Assisted by Sandro Mamukelashvili.",31,19,"Wagner","Seton Hall",22.5,"400988537"
93,1,"8:56",1736,"Foul on Romone Saunders.",31,19,"Wagner","Seton Hall",22.5,"400988537"
94,1,"8:56",1736,"Desi Rodriguez missed Free Throw.",31,19,"Wagner","Seton Hall",22.5,"400988537"
95,1,"8:56",1736,"Romone Saunders Defensive Rebound.",31,19,"Wagner","Seton Hall",22.5,"400988537"
96,1,"8:31",1711,"Blake Francis Turnover.",31,19,"Wagner","Seton Hall",22.5,"400988537"
97,1,"8:31",1711,"Foul on Blake Francis.",31,19,"Wagner","Seton Hall",22.5,"400988537"
98,1,"8:17",1697,"Angel Delgado missed Jumper.",31,19,"Wagner","Seton Hall",22.5,"400988537"
99,1,"8:17",1697,"Nigel Jackson Block.",31,19,"Wagner","Seton Hall",22.5,"400988537"
100,1,"8:15",1695,"Elijah Davis Defensive Rebound.",31,19,"Wagner","Seton Hall",22.5,"400988537"
101,1,"8:11",1691,"Romone Saunders made Three Point Jumper. Assisted by Elijah Davis.",31,22,"Wagner","Seton Hall",22.5,"400988537"
102,1,"7:57",1677,"Eron Gordon made Three Point Jumper. Assisted by Desi Rodriguez.",34,22,"Wagner","Seton Hall",22.5,"400988537"
103,1,"7:44",1664,"JoJo Cooper Turnover.",34,22,"Wagner","Seton Hall",22.5,"400988537"
104,1,"7:42",1662,"Angel Delgado Steal.",34,22,"Wagner","Seton Hall",22.5,"400988537"
105,1,"7:40",1660,"Sandro Mamukelashvili made Dunk. Assisted by Angel Delgado.",36,22,"Wagner","Seton Hall",22.5,"400988537"
106,1,"7:21",1641,"Nigel Jackson made Three Point Jumper. Assisted by Tyler Plummer.",36,25,"Wagner","Seton Hall",22.5,"400988537"
107,1,"7:09",1629,"Angel Delgado made Layup. Assisted by Myles Powell.",38,25,"Wagner","Seton Hall",22.5,"400988537"
108,1,"7:00",1620,"JoJo Cooper missed Layup.",38,25,"Wagner","Seton Hall",22.5,"400988537"
109,1,"7:00",1620,"Desi Rodriguez Block.",38,25,"Wagner","Seton Hall",22.5,"400988537"
110,1,"6:59",1619,"Wagner Offensive Rebound.",38,25,"Wagner","Seton Hall",22.5,"400988537"
111,1,"6:59",1619,"Official TV Timeout",38,25,"Wagner","Seton Hall",22.5,"400988537"
112,1,"6:42",1602,"Tyler Plummer made Layup.",38,27,"Wagner","Seton Hall",22.5,"400988537"
113,1,"6:32",1592,"Foul on Shack Scott.",38,27,"Wagner","Seton Hall",22.5,"400988537"
114,1,"6:32",1592,"Angel Delgado missed Free Throw.",38,27,"Wagner","Seton Hall",22.5,"400988537"
115,1,"6:32",1592,"Devin Liggeons Defensive Rebound.",38,27,"Wagner","Seton Hall",22.5,"400988537"
116,1,"6:24",1584,"Devin Liggeons missed Three Point Jumper.",38,27,"Wagner","Seton Hall",22.5,"400988537"
117,1,"6:24",1584,"Michael Nzei Defensive Rebound.",38,27,"Wagner","Seton Hall",22.5,"400988537"
118,1,"6:09",1569,"Angel Delgado missed Layup.",38,27,"Wagner","Seton Hall",22.5,"400988537"
119,1,"6:09",1569,"Elijah Davis Defensive Rebound.",38,27,"Wagner","Seton Hall",22.5,"400988537"
120,1,"6:04",1564,"Tyler Plummer made Three Point Jumper. Assisted by JoJo Cooper.",38,30,"Wagner","Seton Hall",22.5,"400988537"
121,1,"5:44",1544,"Angel Delgado made Layup. Assisted by Desi Rodriguez.",40,30,"Wagner","Seton Hall",22.5,"400988537"
122,1,"5:22",1522,"Elijah Davis Turnover.",40,30,"Wagner","Seton Hall",22.5,"400988537"
123,1,"5:13",1513,"Desi Rodriguez missed Layup.",40,30,"Wagner","Seton Hall",22.5,"400988537"
124,1,"5:13",1513,"Shack Scott Block.",40,30,"Wagner","Seton Hall",22.5,"400988537"
125,1,"5:13",1513,"Seton Hall Offensive Rebound.",40,30,"Wagner","Seton Hall",22.5,"400988537"
126,1,"5:05",1505,"Michael Nzei missed Layup.",40,30,"Wagner","Seton Hall",22.5,"400988537"
127,1,"5:05",1505,"Devin Liggeons Block.",40,30,"Wagner","Seton Hall",22.5,"400988537"
128,1,"5:03",1503,"Devin Liggeons Defensive Rebound.",40,30,"Wagner","Seton Hall",22.5,"400988537"
129,1,"4:59",1499,"Tyler Plummer missed Layup.",40,30,"Wagner","Seton Hall",22.5,"400988537"
130,1,"4:59",1499,"Angel Delgado Defensive Rebound.",40,30,"Wagner","Seton Hall",22.5,"400988537"
131,1,"4:45",1485,"Desi Rodriguez made Three Point Jumper.",43,30,"Wagner","Seton Hall",22.5,"400988537"
132,1,"4:18",1458,"Elijah Davis missed Jumper.",43,30,"Wagner","Seton Hall",22.5,"400988537"
133,1,"4:18",1458,"Angel Delgado Defensive Rebound.",43,30,"Wagner","Seton Hall",22.5,"400988537"
134,1,"4:15",1455,"Foul on Shack Scott.",43,30,"Wagner","Seton Hall",22.5,"400988537"
135,1,"4:15",1455,"Angel Delgado missed Free Throw.",43,30,"Wagner","Seton Hall",22.5,"400988537"
136,1,"4:15",1455,"Romone Saunders Defensive Rebound.",43,30,"Wagner","Seton Hall",22.5,"400988537"
137,1,"4:06",1446,"Romone Saunders missed Three Point Jumper.",43,30,"Wagner","Seton Hall",22.5,"400988537"
138,1,"4:06",1446,"Michael Nzei Defensive Rebound.",43,30,"Wagner","Seton Hall",22.5,"400988537"
139,1,"3:46",1426,"Desi Rodriguez missed Jumper.",43,30,"Wagner","Seton Hall",22.5,"400988537"
140,1,"3:46",1426,"JoJo Cooper Defensive Rebound.",43,30,"Wagner","Seton Hall",22.5,"400988537"
141,1,"3:38",1418,"Romone Saunders Turnover.",43,30,"Wagner","Seton Hall",22.5,"400988537"
142,1,"3:38",1418,"Foul on Romone Saunders.",43,30,"Wagner","Seton Hall",22.5,"400988537"
143,1,"3:38",1418,"Official TV Timeout",43,30,"Wagner","Seton Hall",22.5,"400988537"
144,1,"3:20",1400,"Khadeen Carrington missed Jumper.",43,30,"Wagner","Seton Hall",22.5,"400988537"
145,1,"3:20",1400,"Michael Nzei Offensive Rebound.",43,30,"Wagner","Seton Hall",22.5,"400988537"
146,1,"3:16",1396,"Michael Nzei missed Layup.",43,30,"Wagner","Seton Hall",22.5,"400988537"
147,1,"3:16",1396,"JoJo Cooper Defensive Rebound.",43,30,"Wagner","Seton Hall",22.5,"400988537"
148,1,"3:08",1388,"Elijah Davis missed Three Point Jumper.",43,30,"Wagner","Seton Hall",22.5,"400988537"
149,1,"3:08",1388,"Shack Scott Offensive Rebound.",43,30,"Wagner","Seton Hall",22.5,"400988537"
150,1,"2:59",1379,"Foul on Myles Cale.",43,30,"Wagner","Seton Hall",22.5,"400988537"
151,1,"2:50",1370,"Shack Scott made Layup. Assisted by JoJo Cooper.",43,32,"Wagner","Seton Hall",22.5,"400988537"
152,1,"2:26",1346,"Myles Cale Turnover.",43,32,"Wagner","Seton Hall",22.5,"400988537"
153,1,"2:26",1346,"Foul on Myles Cale.",43,32,"Wagner","Seton Hall",22.5,"400988537"
154,1,"2:01",1321,"JoJo Cooper missed Jumper.",43,32,"Wagner","Seton Hall",22.5,"400988537"
155,1,"2:01",1321,"Ismael Sanogo Block.",43,32,"Wagner","Seton Hall",22.5,"400988537"
156,1,"1:59",1319,"Desi Rodriguez Defensive Rebound.",43,32,"Wagner","Seton Hall",22.5,"400988537"
157,1,"1:55",1315,"Ismael Sanogo Turnover.",43,32,"Wagner","Seton Hall",22.5,"400988537"
158,1,"1:37",1297,"Nigel Jackson missed Three Point Jumper.",43,32,"Wagner","Seton Hall",22.5,"400988537"
159,1,"1:37",1297,"Khadeen Carrington Defensive Rebound.",43,32,"Wagner","Seton Hall",22.5,"400988537"
160,1,"1:25",1285,"Foul on Chase Freeman.",43,32,"Wagner","Seton Hall",22.5,"400988537"
161,1,"1:25",1285,"Khadeen Carrington made Free Throw.",44,32,"Wagner","Seton Hall",22.5,"400988537"
162,1,"1:25",1285,"Khadeen Carrington made Free Throw.",45,32,"Wagner","Seton Hall",22.5,"400988537"
163,1,"1:12",1272,"Devin Liggeons missed Layup.",45,32,"Wagner","Seton Hall",22.5,"400988537"
164,1,"1:12",1272,"Michael Nzei Block.",45,32,"Wagner","Seton Hall",22.5,"400988537"
165,1,"1:12",1272,"Wagner Offensive Rebound.",45,32,"Wagner","Seton Hall",22.5,"400988537"
166,1,"1:04",1264,"Devin Liggeons Turnover.",45,32,"Wagner","Seton Hall",22.5,"400988537"
167,1,"1:03",1263,"Khadeen Carrington Steal.",45,32,"Wagner","Seton Hall",22.5,"400988537"
168,1,"1:00",1260,"Myles Powell Turnover.",45,32,"Wagner","Seton Hall",22.5,"400988537"
169,1,"1:00",1260,"JoJo Cooper Steal.",45,32,"Wagner","Seton Hall",22.5,"400988537"
170,1,"1:00",1260,"JoJo Cooper Turnover.",45,32,"Wagner","Seton Hall",22.5,"400988537"
171,1,"0:41",1241,"Khadeen Carrington missed Jumper.",45,32,"Wagner","Seton Hall",22.5,"400988537"
172,1,"0:41",1241,"Nigel Jackson Defensive Rebound.",45,32,"Wagner","Seton Hall",22.5,"400988537"
173,1,"0:31",1231,"JoJo Cooper made Jumper.",45,34,"Wagner","Seton Hall",22.5,"400988537"
174,1,"0:24",1224,"Myles Powell made Layup. Assisted by Khadeen Carrington.",47,34,"Wagner","Seton Hall",22.5,"400988537"
175,1,"0:24",1224,"Foul on Shack Scott.",47,34,"Wagner","Seton Hall",22.5,"400988537"
176,1,"0:24",1224,"Myles Powell made Free Throw.",48,34,"Wagner","Seton Hall",22.5,"400988537"
177,1,"0:22",1222,"Wagner  Timeout",48,34,"Wagner","Seton Hall",22.5,"400988537"
178,1,"0:14",1214,"Foul on Eron Gordon.",48,34,"Wagner","Seton Hall",22.5,"400988537"
179,1,"0:02",1202,"Nigel Jackson missed Three Point Jumper.",48,34,"Wagner","Seton Hall",22.5,"400988537"
180,1,"0:02",1202,"Wagner Deadball Team Rebound.",48,34,"Wagner","Seton Hall",22.5,"400988537"
181,1,"0:00",1200,"End of 1st half",48,34,"Wagner","Seton Hall",22.5,"400988537"
182,2,"20:00",1200,"PLAY",48,34,"Wagner","Seton Hall",22.5,"400988537"
183,2,"19:51",1191,"Khadeen Carrington made Three Point Jumper.",51,34,"Wagner","Seton Hall",22.5,"400988537"
184,2,"19:26",1166,"Nigel Jackson made Jumper. Assisted by Devin Liggeons.",51,36,"Wagner","Seton Hall",22.5,"400988537"
185,2,"19:11",1151,"Angel Delgado missed Jumper.",51,36,"Wagner","Seton Hall",22.5,"400988537"
186,2,"19:11",1151,"JoJo Cooper Defensive Rebound.",51,36,"Wagner","Seton Hall",22.5,"400988537"
187,2,"19:03",1143,"AJ Sumbry missed Layup.",51,36,"Wagner","Seton Hall",22.5,"400988537"
188,2,"19:03",1143,"Angel Delgado Defensive Rebound.",51,36,"Wagner","Seton Hall",22.5,"400988537"
189,2,"18:54",1134,"Foul on AJ Sumbry.",51,36,"Wagner","Seton Hall",22.5,"400988537"
190,2,"18:54",1134,"Michael Nzei missed Free Throw.",51,36,"Wagner","Seton Hall",22.5,"400988537"
191,2,"18:54",1134,"Seton Hall Deadball Team Rebound.",51,36,"Wagner","Seton Hall",22.5,"400988537"
192,2,"18:54",1134,"Michael Nzei made Free Throw.",52,36,"Wagner","Seton Hall",22.5,"400988537"
193,2,"18:33",1113,"Devin Liggeons made Layup. Assisted by AJ Sumbry.",52,38,"Wagner","Seton Hall",22.5,"400988537"
194,2,"18:18",1098,"Desi Rodriguez missed Jumper.",52,38,"Wagner","Seton Hall",22.5,"400988537"
195,2,"18:18",1098,"Nigel Jackson Defensive Rebound.",52,38,"Wagner","Seton Hall",22.5,"400988537"
196,2,"18:02",1082,"Foul on Myles Powell.",52,38,"Wagner","Seton Hall",22.5,"400988537"
197,2,"18:02",1082,"Nigel Jackson made Free Throw.",52,39,"Wagner","Seton Hall",22.5,"400988537"
198,2,"18:02",1082,"Nigel Jackson made Free Throw.",52,40,"Wagner","Seton Hall",22.5,"400988537"
199,2,"17:48",1068,"Myles Powell missed Three Point Jumper.",52,40,"Wagner","Seton Hall",22.5,"400988537"
200,2,"17:48",1068,"Wagner Deadball Team Rebound.",52,40,"Wagner","Seton Hall",22.5,"400988537"
201,2,"17:30",1050,"Nigel Jackson made Three Point Jumper. Assisted by JoJo Cooper.",52,43,"Wagner","Seton Hall",22.5,"400988537"
202,2,"17:16",1036,"Desi Rodriguez made Layup. Assisted by Angel Delgado.",54,43,"Wagner","Seton Hall",22.5,"400988537"
203,2,"17:15",1035,"Seton Hall  Timeout",54,43,"Wagner","Seton Hall",22.5,"400988537"
204,2,"17:15",1035,"Official TV Timeout",54,43,"Wagner","Seton Hall",22.5,"400988537"
205,2,"16:56",1016,"Shack Scott made Jumper. Assisted by Romone Saunders.",54,45,"Wagner","Seton Hall",22.5,"400988537"
206,2,"16:40",1000,"Foul on Shack Scott.",54,45,"Wagner","Seton Hall",22.5,"400988537"
207,2,"16:40",1000,"Angel Delgado made Free Throw.",55,45,"Wagner","Seton Hall",22.5,"400988537"
208,2,"16:40",1000,"Angel Delgado missed Free Throw.",55,45,"Wagner","Seton Hall",22.5,"400988537"
