"play_id","half","time_remaining_half","secs_remaining","description","home_score","away_score","away","home","home_favored_by","game_id"
283,2,"8:57",537,"Khadeen Carrington Offensive Rebound.",61,58,"Seton Hall","Louisville",1.5,"400986118"
284,2,"8:57",537,"Foul on Jordan Nwora.",61,58,"Seton Hall","Louisville",1.5,"400986118"
285,2,"8:43",523,"Michael Nzei missed Jumper.",61,58,"Seton Hall","Louisville",1.5,"400986118"
286,2,"8:43",523,"Angel Delgado Offensive Rebound.",61,58,"Seton Hall","Louisville",1.5,"400986118"
287,2,"8:39",519,"Khadeen Carrington missed Jumper.",61,58,"Seton Hall","Louisville",1.5,"400986118"
288,2,"8:39",519,"Louisville Defensive Rebound.",61,58,"Seton Hall","Louisville",1.5,"400986118"
289,2,"8:23",503,"Deng Adel Turnover.",61,58,"Seton Hall","Louisville",1.5,"400986118"
290,2,"8:23",503,"Myles Cale Steal.",61,58,"Seton Hall","Louisville",1.5,"400986118"
291,2,"8:21",501,"Foul on Dwayne Sutton.",61,58,"Seton Hall","Louisville",1.5,"400986118"
292,2,"8:13",493,"Khadeen Carrington missed Jumper.",61,58,"Seton Hall","Louisville",1.5,"400986118"
293,2,"8:13",493,"Anas Mahmoud Block.",61,58,"Seton Hall","Louisville",1.5,"400986118"
294,2,"8:13",493,"V.J. King Defensive Rebound.",61,58,"Seton Hall","Louisville",1.5,"400986118"
295,2,"8:06",486,"V.J. King Turnover.",61,58,"Seton Hall","Louisville",1.5,"400986118"
296,2,"8:06",486,"Myles Cale Steal.",61,58,"Seton Hall","Louisville",1.5,"400986118"
297,2,"7:58",478,"Myles Cale missed Three Point Jumper.",61,58,"Seton Hall","Louisville",1.5,"400986118"
298,2,"7:58",478,"Deng Adel Block.",61,58,"Seton Hall","Louisville",1.5,"400986118"
299,2,"7:58",478,"Michael Nzei Offensive Rebound.",61,58,"Seton Hall","Louisville",1.5,"400986118"
300,2,"7:53",473,"Foul on Dwayne Sutton.",61,58,"Seton Hall","Louisville",1.5,"400986118"
301,2,"7:53",473,"Official TV Timeout",61,58,"Seton Hall","Louisville",1.5,"400986118"
302,2,"7:53",473,"Michael Nzei made Free Throw.",61,59,"Seton Hall","Louisville",1.5,"400986118"
303,2,"7:53",473,"Michael Nzei missed Free Throw.",61,59,"Seton Hall","Louisville",1.5,"400986118"
304,2,"7:53",473,"Louisville Defensive Rebound.",61,59,"Seton Hall","Louisville",1.5,"400986118"
305,2,"7:33",453,"V.J. King missed Three Point Jumper.",61,59,"Seton Hall","Louisville",1.5,"400986118"
306,2,"7:33",453,"Desi Rodriguez Defensive Rebound.",61,59,"Seton Hall","Louisville",1.5,"400986118"
307,2,"7:27",447,"Khadeen Carrington made Layup.",61,61,"Seton Hall","Louisville",1.5,"400986118"
308,2,"7:27",447,"Foul on V.J. King.",61,61,"Seton Hall","Louisville",1.5,"400986118"
309,2,"7:27",447,"Khadeen Carrington made Free Throw.",61,62,"Seton Hall","Louisville",1.5,"400986118"
310,2,"7:07",427,"V.J. King Turnover.",61,62,"Seton Hall","Louisville",1.5,"400986118"
311,2,"7:07",427,"Ismael Sanogo Steal.",61,62,"Seton Hall","Louisville",1.5,"400986118"
312,2,"7:03",423,"Ismael Sanogo made Dunk.",61,64,"Seton Hall","Louisville",1.5,"400986118"
313,2,"7:03",423,"Louisville  Timeout",61,64,"Seton Hall","Louisville",1.5,"400986118"
314,2,"6:41",401,"Deng Adel made Layup.",63,64,"Seton Hall","Louisville",1.5,"400986118"
315,2,"6:19",379,"Myles Powell missed Three Point Jumper.",63,64,"Seton Hall","Louisville",1.5,"400986118"
316,2,"6:19",379,"Ray Spalding Defensive Rebound.",63,64,"Seton Hall","Louisville",1.5,"400986118"
317,2,"6:10",370,"Deng Adel Turnover.",63,64,"Seton Hall","Louisville",1.5,"400986118"
318,2,"6:10",370,"Desi Rodriguez Steal.",63,64,"Seton Hall","Louisville",1.5,"400986118"
319,2,"5:53",353,"Desi Rodriguez missed Three Point Jumper.",63,64,"Seton Hall","Louisville",1.5,"400986118"
320,2,"5:53",353,"Quentin Snider Defensive Rebound.",63,64,"Seton Hall","Louisville",1.5,"400986118"
321,2,"5:45",345,"Deng Adel missed Three Point Jumper.",63,64,"Seton Hall","Louisville",1.5,"400986118"
322,2,"5:45",345,"Khadeen Carrington Defensive Rebound.",63,64,"Seton Hall","Louisville",1.5,"400986118"
323,2,"5:31",331,"Khadeen Carrington made Layup.",63,66,"Seton Hall","Louisville",1.5,"400986118"
324,2,"5:21",321,"Jordan Nwora made Three Point Jumper. Assisted by V.J. King.",66,66,"Seton Hall","Louisville",1.5,"400986118"
325,2,"5:03",303,"Desi Rodriguez made Dunk. Assisted by Myles Powell.",66,68,"Seton Hall","Louisville",1.5,"400986118"
326,2,"4:47",287,"Quentin Snider made Jumper.",68,68,"Seton Hall","Louisville",1.5,"400986118"
327,2,"4:21",261,"Angel Delgado made Jumper. Assisted by Khadeen Carrington.",68,70,"Seton Hall","Louisville",1.5,"400986118"
328,2,"4:02",242,"Quentin Snider missed Jumper.",68,70,"Seton Hall","Louisville",1.5,"400986118"
329,2,"4:02",242,"Desi Rodriguez Defensive Rebound.",68,70,"Seton Hall","Louisville",1.5,"400986118"
330,2,"3:40",220,"Khadeen Carrington Turnover.",68,70,"Seton Hall","Louisville",1.5,"400986118"
331,2,"3:40",220,"Ray Spalding Steal.",68,70,"Seton Hall","Louisville",1.5,"400986118"
332,2,"3:36",216,"Jordan Nwora missed Three Point Jumper.",68,70,"Seton Hall","Louisville",1.5,"400986118"
333,2,"3:36",216,"Ray Spalding Offensive Rebound.",68,70,"Seton Hall","Louisville",1.5,"400986118"
334,2,"3:32",212,"Official TV Timeout",68,70,"Seton Hall","Louisville",1.5,"400986118"
335,2,"3:10",190,"Quentin Snider made Three Point Jumper.",71,70,"Seton Hall","Louisville",1.5,"400986118"
336,2,"2:48",168,"Angel Delgado made Layup. Assisted by Myles Powell.",71,72,"Seton Hall","Louisville",1.5,"400986118"
337,2,"2:35",155,"Quentin Snider missed Three Point Jumper.",71,72,"Seton Hall","Louisville",1.5,"400986118"
338,2,"2:35",155,"Angel Delgado Defensive Rebound.",71,72,"Seton Hall","Louisville",1.5,"400986118"
339,2,"2:17",137,"Khadeen Carrington made Jumper.",71,74,"Seton Hall","Louisville",1.5,"400986118"
340,2,"2:04",124,"Deng Adel made Jumper.",73,74,"Seton Hall","Louisville",1.5,"400986118"
341,2,"1:43",103,"Myles Powell made Three Point Jumper.",73,77,"Seton Hall","Louisville",1.5,"400986118"
342,2,"1:32",92,"Louisville  Timeout",73,77,"Seton Hall","Louisville",1.5,"400986118"
343,2,"1:22",82,"Dwayne Sutton made Dunk. Assisted by Deng Adel.",75,77,"Seton Hall","Louisville",1.5,"400986118"
344,2,"0:52",52,"Myles Powell Turnover.",75,77,"Seton Hall","Louisville",1.5,"400986118"
345,2,"0:33",33,"Louisville  Timeout",75,77,"Seton Hall","Louisville",1.5,"400986118"
346,2,"0:28",28,"Deng Adel made Jumper.",77,77,"Seton Hall","Louisville",1.5,"400986118"
347,2,"0:08",8,"Desi Rodriguez made Layup.",77,79,"Seton Hall","Louisville",1.5,"400986118"
348,2,"0:04",4,"Quentin Snider missed Three Point Jumper.",77,79,"Seton Hall","Louisville",1.5,"400986118"
349,2,"0:04",4,"Desi Rodriguez Defensive Rebound.",77,79,"Seton Hall","Louisville",1.5,"400986118"
350,2,"0:00",0,"End of Game",77,79,"Seton Hall","Louisville",1.5,"400986118"
1,1,"20:00",2400,"PLAY",0,0,"VCU","Seton Hall",13.5,"400988523"
2,1,"19:46",2386,"Angel Delgado missed Layup.",0,0,"VCU","Seton Hall",13.5,"400988523"
3,1,"19:46",2386,"Justin Tillman Defensive Rebound.",0,0,"VCU","Seton Hall",13.5,"400988523"
4,1,"19:22",2362,"Justin Tillman Turnover.",0,0,"VCU","Seton Hall",13.5,"400988523"
5,1,"19:21",2361,"Angel Delgado Steal.",0,0,"VCU","Seton Hall",13.5,"400988523"
6,1,"19:14",2354,"Angel Delgado missed Jumper.",0,0,"VCU","Seton Hall",13.5,"400988523"
7,1,"19:14",2354,"Justin Tillman Defensive Rebound.",0,0,"VCU","Seton Hall",13.5,"400988523"
8,1,"18:52",2332,"Foul on Myles Powell.",0,0,"VCU","Seton Hall",13.5,"400988523"
9,1,"18:52",2332,"Justin Tillman missed Free Throw.",0,0,"VCU","Seton Hall",13.5,"400988523"
10,1,"18:52",2332,"VCU Deadball Team Rebound.",0,0,"VCU","Seton Hall",13.5,"400988523"
11,1,"18:52",2332,"Justin Tillman made Free Throw.",0,1,"VCU","Seton Hall",13.5,"400988523"
12,1,"18:44",2324,"Khadeen Carrington missed Jumper.",0,1,"VCU","Seton Hall",13.5,"400988523"
13,1,"18:44",2324,"Khris Lane Defensive Rebound.",0,1,"VCU","Seton Hall",13.5,"400988523"
14,1,"18:37",2317,"Khris Lane Turnover.",0,1,"VCU","Seton Hall",13.5,"400988523"
15,1,"18:22",2302,"Michael Nzei made Layup.",2,1,"VCU","Seton Hall",13.5,"400988523"
16,1,"18:08",2288,"Khris Lane made Layup. Assisted by De'Riante Jenkins.",2,3,"VCU","Seton Hall",13.5,"400988523"
17,1,"18:04",2284,"Michael Nzei Turnover.",2,3,"VCU","Seton Hall",13.5,"400988523"
18,1,"17:54",2274,"Jonathan Williams Turnover.",2,3,"VCU","Seton Hall",13.5,"400988523"
19,1,"17:53",2273,"Angel Delgado Steal.",2,3,"VCU","Seton Hall",13.5,"400988523"
20,1,"17:50",2270,"Desi Rodriguez missed Dunk.",2,3,"VCU","Seton Hall",13.5,"400988523"
21,1,"17:50",2270,"Jonathan Williams Defensive Rebound.",2,3,"VCU","Seton Hall",13.5,"400988523"
22,1,"17:45",2265,"Jonathan Williams missed Layup.",2,3,"VCU","Seton Hall",13.5,"400988523"
23,1,"17:45",2265,"Khris Lane Offensive Rebound.",2,3,"VCU","Seton Hall",13.5,"400988523"
24,1,"17:42",2262,"Foul on Michael Nzei.",2,3,"VCU","Seton Hall",13.5,"400988523"
25,1,"17:42",2262,"Khris Lane missed Free Throw.",2,3,"VCU","Seton Hall",13.5,"400988523"
26,1,"17:42",2262,"VCU Deadball Team Rebound.",2,3,"VCU","Seton Hall",13.5,"400988523"
27,1,"17:42",2262,"Khris Lane made Free Throw.",2,4,"VCU","Seton Hall",13.5,"400988523"
28,1,"17:32",2252,"Michael Nzei made Layup. Assisted by Khadeen Carrington.",4,4,"VCU","Seton Hall",13.5,"400988523"
29,1,"17:26",2246,"Justin Tillman missed Three Point Jumper.",4,4,"VCU","Seton Hall",13.5,"400988523"
30,1,"17:26",2246,"Desi Rodriguez Defensive Rebound.",4,4,"VCU","Seton Hall",13.5,"400988523"
31,1,"17:09",2229,"Angel Delgado Turnover.",4,4,"VCU","Seton Hall",13.5,"400988523"
32,1,"17:07",2227,"Mike'l Simms Steal.",4,4,"VCU","Seton Hall",13.5,"400988523"
33,1,"17:00",2220,"De'Riante Jenkins missed Three Point Jumper.",4,4,"VCU","Seton Hall",13.5,"400988523"
34,1,"17:00",2220,"Desi Rodriguez Defensive Rebound.",4,4,"VCU","Seton Hall",13.5,"400988523"
35,1,"16:54",2214,"Foul on De'Riante Jenkins.",4,4,"VCU","Seton Hall",13.5,"400988523"
36,1,"16:54",2214,"Khadeen Carrington made Free Throw.",5,4,"VCU","Seton Hall",13.5,"400988523"
37,1,"16:54",2214,"Khadeen Carrington made Free Throw.",6,4,"VCU","Seton Hall",13.5,"400988523"
38,1,"16:40",2200,"Tyler Maye made Layup.",6,6,"VCU","Seton Hall",13.5,"400988523"
39,1,"16:24",2184,"Desi Rodriguez made Dunk.",8,6,"VCU","Seton Hall",13.5,"400988523"
40,1,"16:08",2168,"Mike'l Simms missed Three Point Jumper.",8,6,"VCU","Seton Hall",13.5,"400988523"
41,1,"16:08",2168,"Khadeen Carrington Defensive Rebound.",8,6,"VCU","Seton Hall",13.5,"400988523"
42,1,"16:02",2162,"Foul on De'Riante Jenkins.",8,6,"VCU","Seton Hall",13.5,"400988523"
43,1,"16:02",2162,"Desi Rodriguez made Free Throw.",9,6,"VCU","Seton Hall",13.5,"400988523"
44,1,"16:02",2162,"Desi Rodriguez made Free Throw.",10,6,"VCU","Seton Hall",13.5,"400988523"
45,1,"15:57",2157,"Foul on Mike'l Simms.",10,6,"VCU","Seton Hall",13.5,"400988523"
46,1,"15:57",2157,"Official TV Timeout",10,6,"VCU","Seton Hall",13.5,"400988523"
47,1,"15:56",2156,"Sandro Mamukelashvili missed Three Point Jumper.",10,6,"VCU","Seton Hall",13.5,"400988523"
48,1,"15:56",2156,"VCU Defensive Rebound.",10,6,"VCU","Seton Hall",13.5,"400988523"
49,1,"15:54",2154,"Foul on Desi Rodriguez.",10,6,"VCU","Seton Hall",13.5,"400988523"
50,1,"15:40",2140,"Sean Mobley Turnover.",10,6,"VCU","Seton Hall",13.5,"400988523"
51,1,"15:19",2119,"Desi Rodriguez made Jumper.",12,6,"VCU","Seton Hall",13.5,"400988523"
52,1,"15:02",2102,"Marcus Santos-Silva Turnover.",12,6,"VCU","Seton Hall",13.5,"400988523"
53,1,"15:01",2101,"Ismael Sanogo Steal.",12,6,"VCU","Seton Hall",13.5,"400988523"
54,1,"14:36",2076,"Khadeen Carrington missed Three Point Jumper.",12,6,"VCU","Seton Hall",13.5,"400988523"
55,1,"14:36",2076,"Jonathan Williams Defensive Rebound.",12,6,"VCU","Seton Hall",13.5,"400988523"
56,1,"14:25",2065,"Marcus Santos-Silva made Layup. Assisted by Jonathan Williams.",12,8,"VCU","Seton Hall",13.5,"400988523"
57,1,"14:03",2043,"Desi Rodriguez missed Layup.",12,8,"VCU","Seton Hall",13.5,"400988523"
58,1,"14:03",2043,"Marcus Santos-Silva Defensive Rebound.",12,8,"VCU","Seton Hall",13.5,"400988523"
59,1,"13:53",2033,"Jonathan Williams made Jumper.",12,10,"VCU","Seton Hall",13.5,"400988523"
60,1,"13:36",2016,"Khadeen Carrington made Layup.",14,10,"VCU","Seton Hall",13.5,"400988523"
61,1,"13:29",2009,"Foul on Desi Rodriguez.",14,10,"VCU","Seton Hall",13.5,"400988523"
62,1,"13:28",2008,"Jonathan Williams Turnover.",14,10,"VCU","Seton Hall",13.5,"400988523"
63,1,"13:08",1988,"Angel Delgado missed Layup.",14,10,"VCU","Seton Hall",13.5,"400988523"
64,1,"13:08",1988,"Michael Nzei Offensive Rebound.",14,10,"VCU","Seton Hall",13.5,"400988523"
65,1,"13:05",1985,"Michael Nzei Turnover.",14,10,"VCU","Seton Hall",13.5,"400988523"
66,1,"13:04",1984,"Mike'l Simms Steal.",14,10,"VCU","Seton Hall",13.5,"400988523"
67,1,"12:59",1979,"Jonathan Williams missed Layup.",14,10,"VCU","Seton Hall",13.5,"400988523"
68,1,"12:59",1979,"Michael Nzei Defensive Rebound.",14,10,"VCU","Seton Hall",13.5,"400988523"
69,1,"12:49",1969,"Eron Gordon missed Layup.",14,10,"VCU","Seton Hall",13.5,"400988523"
70,1,"12:49",1969,"Angel Delgado Offensive Rebound.",14,10,"VCU","Seton Hall",13.5,"400988523"
71,1,"12:46",1966,"Angel Delgado made Layup.",16,10,"VCU","Seton Hall",13.5,"400988523"
72,1,"12:20",1940,"Marcus Santos-Silva made Layup. Assisted by Jonathan Williams.",16,12,"VCU","Seton Hall",13.5,"400988523"
73,1,"11:49",1909,"Myles Powell made Layup.",18,12,"VCU","Seton Hall",13.5,"400988523"
74,1,"11:20",1880,"Xavier Jackson missed Jumper.",18,12,"VCU","Seton Hall",13.5,"400988523"
75,1,"11:20",1880,"Angel Delgado Defensive Rebound.",18,12,"VCU","Seton Hall",13.5,"400988523"
76,1,"11:18",1878,"Foul on Marcus Santos-Silva.",18,12,"VCU","Seton Hall",13.5,"400988523"
77,1,"11:18",1878,"Official TV Timeout",18,12,"VCU","Seton Hall",13.5,"400988523"
78,1,"11:01",1861,"Myles Powell missed Three Point Jumper.",18,12,"VCU","Seton Hall",13.5,"400988523"
79,1,"11:01",1861,"Angel Delgado Offensive Rebound.",18,12,"VCU","Seton Hall",13.5,"400988523"
80,1,"10:55",1855,"Eron Gordon Turnover.",18,12,"VCU","Seton Hall",13.5,"400988523"
81,1,"10:53",1853,"Tyler Maye Steal.",18,12,"VCU","Seton Hall",13.5,"400988523"
82,1,"10:51",1851,"Tyler Maye missed Layup.",18,12,"VCU","Seton Hall",13.5,"400988523"
83,1,"10:51",1851,"Myles Powell Block.",18,12,"VCU","Seton Hall",13.5,"400988523"
84,1,"10:50",1850,"Mike'l Simms Offensive Rebound.",18,12,"VCU","Seton Hall",13.5,"400988523"
85,1,"10:36",1836,"Tyler Maye missed Jumper.",18,12,"VCU","Seton Hall",13.5,"400988523"
86,1,"10:36",1836,"Angel Delgado Defensive Rebound.",18,12,"VCU","Seton Hall",13.5,"400988523"
87,1,"10:18",1818,"Angel Delgado Turnover.",18,12,"VCU","Seton Hall",13.5,"400988523"
88,1,"9:59",1799,"Foul on Michael Nzei.",18,12,"VCU","Seton Hall",13.5,"400988523"
89,1,"9:59",1799,"Foul on Ismael Sanogo.",18,12,"VCU","Seton Hall",13.5,"400988523"
90,1,"9:50",1790,"Khris Lane missed Layup.",18,12,"VCU","Seton Hall",13.5,"400988523"
91,1,"9:50",1790,"Angel Delgado Defensive Rebound.",18,12,"VCU","Seton Hall",13.5,"400988523"
92,1,"9:43",1783,"Myles Cale missed Layup.",18,12,"VCU","Seton Hall",13.5,"400988523"
93,1,"9:43",1783,"Khris Lane Defensive Rebound.",18,12,"VCU","Seton Hall",13.5,"400988523"
94,1,"9:34",1774,"Mike'l Simms missed Three Point Jumper.",18,12,"VCU","Seton Hall",13.5,"400988523"
95,1,"9:34",1774,"Khadeen Carrington Defensive Rebound.",18,12,"VCU","Seton Hall",13.5,"400988523"
96,1,"9:26",1766,"Foul on Khris Lane.",18,12,"VCU","Seton Hall",13.5,"400988523"
97,1,"9:26",1766,"Khadeen Carrington made Free Throw.",19,12,"VCU","Seton Hall",13.5,"400988523"
98,1,"9:26",1766,"Khadeen Carrington made Free Throw.",20,12,"VCU","Seton Hall",13.5,"400988523"
99,1,"9:17",1757,"Xavier Jackson Turnover.",20,12,"VCU","Seton Hall",13.5,"400988523"
100,1,"9:08",1748,"Myles Powell made Three Point Jumper. Assisted by Ismael Sanogo.",23,12,"VCU","Seton Hall",13.5,"400988523"
101,1,"8:46",1726,"Xavier Jackson missed Three Point Jumper.",23,12,"VCU","Seton Hall",13.5,"400988523"
102,1,"8:46",1726,"Desi Rodriguez Defensive Rebound.",23,12,"VCU","Seton Hall",13.5,"400988523"
103,1,"8:42",1722,"Foul on Mike'l Simms.",23,12,"VCU","Seton Hall",13.5,"400988523"
104,1,"8:23",1703,"Ismael Sanogo missed Layup.",23,12,"VCU","Seton Hall",13.5,"400988523"
105,1,"8:23",1703,"Angel Delgado Offensive Rebound.",23,12,"VCU","Seton Hall",13.5,"400988523"
106,1,"8:19",1699,"Foul on Mike'l Simms.",23,12,"VCU","Seton Hall",13.5,"400988523"
107,1,"8:19",1699,"Angel Delgado missed Free Throw.",23,12,"VCU","Seton Hall",13.5,"400988523"
108,1,"8:19",1699,"Seton Hall Deadball Team Rebound.",23,12,"VCU","Seton Hall",13.5,"400988523"
109,1,"8:19",1699,"Angel Delgado made Free Throw.",24,12,"VCU","Seton Hall",13.5,"400988523"
110,1,"8:11",1691,"Marcus Santos-Silva Turnover.",24,12,"VCU","Seton Hall",13.5,"400988523"
111,1,"8:10",1690,"Myles Powell Steal.",24,12,"VCU","Seton Hall",13.5,"400988523"
112,1,"7:59",1679,"Official TV Timeout",24,12,"VCU","Seton Hall",13.5,"400988523"
113,1,"7:58",1678,"Foul on Sean Mobley.",24,12,"VCU","Seton Hall",13.5,"400988523"
114,1,"7:58",1678,"Desi Rodriguez missed Free Throw.",24,12,"VCU","Seton Hall",13.5,"400988523"
115,1,"7:58",1678,"Justin Tillman Defensive Rebound.",24,12,"VCU","Seton Hall",13.5,"400988523"
116,1,"7:54",1674,"Justin Tillman Turnover.",24,12,"VCU","Seton Hall",13.5,"400988523"
117,1,"7:42",1662,"Sandro Mamukelashvili missed Layup.",24,12,"VCU","Seton Hall",13.5,"400988523"
118,1,"7:42",1662,"Marcus Santos-Silva Defensive Rebound.",24,12,"VCU","Seton Hall",13.5,"400988523"
119,1,"7:34",1654,"De'Riante Jenkins missed Three Point Jumper.",24,12,"VCU","Seton Hall",13.5,"400988523"
120,1,"7:34",1654,"Justin Tillman Offensive Rebound.",24,12,"VCU","Seton Hall",13.5,"400988523"
121,1,"7:29",1649,"Justin Tillman missed Jumper.",24,12,"VCU","Seton Hall",13.5,"400988523"
122,1,"7:29",1649,"Desi Rodriguez Defensive Rebound.",24,12,"VCU","Seton Hall",13.5,"400988523"
123,1,"7:22",1642,"Foul on Sean Mobley.",24,12,"VCU","Seton Hall",13.5,"400988523"
124,1,"7:22",1642,"Khadeen Carrington made Free Throw.",25,12,"VCU","Seton Hall",13.5,"400988523"
125,1,"7:22",1642,"Khadeen Carrington made Free Throw.",26,12,"VCU","Seton Hall",13.5,"400988523"
126,1,"7:06",1626,"De'Riante Jenkins missed Jumper.",26,12,"VCU","Seton Hall",13.5,"400988523"
127,1,"7:06",1626,"Marcus Santos-Silva Offensive Rebound.",26,12,"VCU","Seton Hall",13.5,"400988523"
128,1,"6:53",1613,"Foul on Sandro Mamukelashvili.",26,12,"VCU","Seton Hall",13.5,"400988523"
129,1,"6:53",1613,"Marcus Santos-Silva missed Free Throw.",26,12,"VCU","Seton Hall",13.5,"400988523"
130,1,"6:53",1613,"VCU Deadball Team Rebound.",26,12,"VCU","Seton Hall",13.5,"400988523"
131,1,"6:53",1613,"Marcus Santos-Silva made Free Throw.",26,13,"VCU","Seton Hall",13.5,"400988523"
132,1,"6:46",1606,"Khadeen Carrington Turnover.",26,13,"VCU","Seton Hall",13.5,"400988523"
133,1,"6:46",1606,"Foul on Khadeen Carrington.",26,13,"VCU","Seton Hall",13.5,"400988523"
134,1,"6:23",1583,"Sean Mobley missed Three Point Jumper.",26,13,"VCU","Seton Hall",13.5,"400988523"
135,1,"6:23",1583,"Myles Powell Defensive Rebound.",26,13,"VCU","Seton Hall",13.5,"400988523"
136,1,"6:16",1576,"Desi Rodriguez made Three Point Jumper. Assisted by Myles Powell.",29,13,"VCU","Seton Hall",13.5,"400988523"
137,1,"6:14",1574,"VCU  Timeout",29,13,"VCU","Seton Hall",13.5,"400988523"
138,1,"6:02",1562,"De'Riante Jenkins missed Layup.",29,13,"VCU","Seton Hall",13.5,"400988523"
139,1,"6:02",1562,"Justin Tillman Offensive Rebound.",29,13,"VCU","Seton Hall",13.5,"400988523"
140,1,"6:00",1560,"Justin Tillman made Layup.",29,15,"VCU","Seton Hall",13.5,"400988523"
141,1,"5:39",1539,"Khadeen Carrington missed Jumper.",29,15,"VCU","Seton Hall",13.5,"400988523"
142,1,"5:39",1539,"De'Riante Jenkins Defensive Rebound.",29,15,"VCU","Seton Hall",13.5,"400988523"
143,1,"5:29",1529,"Foul on Ismael Sanogo.",29,15,"VCU","Seton Hall",13.5,"400988523"
144,1,"5:29",1529,"De'Riante Jenkins made Free Throw.",29,16,"VCU","Seton Hall",13.5,"400988523"
145,1,"5:29",1529,"De'Riante Jenkins made Free Throw.",29,17,"VCU","Seton Hall",13.5,"400988523"
146,1,"5:10",1510,"Myles Powell made Three Point Jumper. Assisted by Angel Delgado.",32,17,"VCU","Seton Hall",13.5,"400988523"
147,1,"4:55",1495,"Justin Tillman made Three Point Jumper. Assisted by Jonathan Williams.",32,20,"VCU","Seton Hall",13.5,"400988523"
148,1,"4:35",1475,"Angel Delgado missed Jumper.",32,20,"VCU","Seton Hall",13.5,"400988523"
149,1,"4:35",1475,"Angel Delgado Offensive Rebound.",32,20,"VCU","Seton Hall",13.5,"400988523"
150,1,"4:29",1469,"Khadeen Carrington missed Three Point Jumper.",32,20,"VCU","Seton Hall",13.5,"400988523"
151,1,"4:29",1469,"Justin Tillman Defensive Rebound.",32,20,"VCU","Seton Hall",13.5,"400988523"
152,1,"4:21",1461,"De'Riante Jenkins Turnover.",32,20,"VCU","Seton Hall",13.5,"400988523"
153,1,"4:19",1459,"Khadeen Carrington Steal.",32,20,"VCU","Seton Hall",13.5,"400988523"
154,1,"4:15",1455,"Foul on Justin Tillman.",32,20,"VCU","Seton Hall",13.5,"400988523"
155,1,"4:15",1455,"Myles Cale missed Free Throw.",32,20,"VCU","Seton Hall",13.5,"400988523"
156,1,"4:15",1455,"Seton Hall Deadball Team Rebound.",32,20,"VCU","Seton Hall",13.5,"400988523"
157,1,"4:15",1455,"Myles Cale made Free Throw.",33,20,"VCU","Seton Hall",13.5,"400988523"
158,1,"3:57",1437,"Jonathan Williams made Three Point Jumper.",33,23,"VCU","Seton Hall",13.5,"400988523"
159,1,"3:29",1409,"Myles Cale Turnover.",33,23,"VCU","Seton Hall",13.5,"400988523"
160,1,"3:28",1408,"De'Riante Jenkins Steal.",33,23,"VCU","Seton Hall",13.5,"400988523"
161,1,"3:23",1403,"Jonathan Williams missed Jumper.",33,23,"VCU","Seton Hall",13.5,"400988523"
162,1,"3:23",1403,"Myles Cale Defensive Rebound.",33,23,"VCU","Seton Hall",13.5,"400988523"
163,1,"3:16",1396,"Eron Gordon made Layup. Assisted by Myles Cale.",35,23,"VCU","Seton Hall",13.5,"400988523"
164,1,"2:48",1368,"De'Riante Jenkins made Three Point Jumper. Assisted by Jonathan Williams.",35,26,"VCU","Seton Hall",13.5,"400988523"
165,1,"2:32",1352,"Myles Powell made Three Point Jumper.",38,26,"VCU","Seton Hall",13.5,"400988523"
166,1,"2:03",1323,"Lewis Djonkam missed Jumper.",38,26,"VCU","Seton Hall",13.5,"400988523"
167,1,"2:03",1323,"Angel Delgado Defensive Rebound.",38,26,"VCU","Seton Hall",13.5,"400988523"
168,1,"1:55",1315,"Myles Cale missed Layup.",38,26,"VCU","Seton Hall",13.5,"400988523"
169,1,"1:55",1315,"Xavier Jackson Defensive Rebound.",38,26,"VCU","Seton Hall",13.5,"400988523"
170,1,"1:48",1308,"Xavier Jackson made Three Point Jumper. Assisted by Jonathan Williams.",38,29,"VCU","Seton Hall",13.5,"400988523"
171,1,"1:21",1281,"Angel Delgado made Layup.",40,29,"VCU","Seton Hall",13.5,"400988523"
172,1,"1:21",1281,"Foul on Lewis Djonkam.",40,29,"VCU","Seton Hall",13.5,"400988523"
173,1,"1:21",1281,"Official TV Timeout",40,29,"VCU","Seton Hall",13.5,"400988523"
174,1,"1:21",1281,"Angel Delgado made Free Throw.",41,29,"VCU","Seton Hall",13.5,"400988523"
175,1,"1:03",1263,"Jonathan Williams missed Layup.",41,29,"VCU","Seton Hall",13.5,"400988523"
176,1,"1:03",1263,"Michael Nzei Defensive Rebound.",41,29,"VCU","Seton Hall",13.5,"400988523"
177,1,"0:53",1253,"Myles Cale made Layup. Assisted by Myles Powell.",43,29,"VCU","Seton Hall",13.5,"400988523"
178,1,"0:35",1235,"Foul on Angel Delgado.",43,29,"VCU","Seton Hall",13.5,"400988523"
179,1,"0:35",1235,"Marcus Santos-Silva missed Free Throw.",43,29,"VCU","Seton Hall",13.5,"400988523"
180,1,"0:35",1235,"Marcus Santos-Silva Offensive Rebound.",43,29,"VCU","Seton Hall",13.5,"400988523"
181,1,"0:35",1235,"Marcus Santos-Silva made Free Throw.",43,30,"VCU","Seton Hall",13.5,"400988523"
182,1,"0:05",1205,"Khadeen Carrington Turnover.",43,30,"VCU","Seton Hall",13.5,"400988523"
183,1,"0:04",1204,"Xavier Jackson Steal.",43,30,"VCU","Seton Hall",13.5,"400988523"
184,1,"0:00",1200,"Xavier Jackson missed Three Point Jumper.",43,30,"VCU","Seton Hall",13.5,"400988523"
185,1,"0:00",1200,"VCU Deadball Team Rebound.",43,30,"VCU","Seton Hall",13.5,"400988523"
186,1,"0:00",1200,"End of 1st half",43,30,"VCU","Seton Hall",13.5,"400988523"
187,2,"20:00",1200,"PLAY",43,30,"VCU","Seton Hall",13.5,"400988523"
188,2,"19:53",1193,"Justin Tillman made Layup. Assisted by De'Riante Jenkins.",43,32,"VCU","Seton Hall",13.5,"400988523"
189,2,"19:25",1165,"Khadeen Carrington missed Three Point Jumper.",43,32,"VCU","Seton Hall",13.5,"400988523"
190,2,"19:25",1165,"De'Riante Jenkins Defensive Rebound.",43,32,"VCU","Seton Hall",13.5,"400988523"
191,2,"19:12",1152,"Khris Lane Turnover.",43,32,"VCU","Seton Hall",13.5,"400988523"
192,2,"18:52",1132,"Angel Delgado made Jumper. Assisted by Khadeen Carrington.",45,32,"VCU","Seton Hall",13.5,"400988523"
193,2,"18:34",1114,"Xavier Jackson made Layup.",45,34,"VCU","Seton Hall",13.5,"400988523"
194,2,"18:11",1091,"Angel Delgado made Jumper. Assisted by Desi Rodriguez.",47,34,"VCU","Seton Hall",13.5,"400988523"
195,2,"17:54",1074,"De'Riante Jenkins missed Jumper.",47,34,"VCU","Seton Hall",13.5,"400988523"
196,2,"17:54",1074,"Desi Rodriguez Defensive Rebound.",47,34,"VCU","Seton Hall",13.5,"400988523"
197,2,"17:49",1069,"Khadeen Carrington made Layup. Assisted by Desi Rodriguez.",49,34,"VCU","Seton Hall",13.5,"400988523"
198,2,"17:49",1069,"Foul on Xavier Jackson.",49,34,"VCU","Seton Hall",13.5,"400988523"
199,2,"17:49",1069,"Khadeen Carrington made Free Throw.",50,34,"VCU","Seton Hall",13.5,"400988523"
200,2,"17:31",1051,"Khris Lane made Layup. Assisted by Xavier Jackson.",50,36,"VCU","Seton Hall",13.5,"400988523"
201,2,"17:17",1037,"Desi Rodriguez made Jumper.",52,36,"VCU","Seton Hall",13.5,"400988523"
202,2,"17:05",1025,"Khris Lane Turnover.",52,36,"VCU","Seton Hall",13.5,"400988523"
203,2,"16:46",1006,"Michael Nzei made Layup. Assisted by Desi Rodriguez.",54,36,"VCU","Seton Hall",13.5,"400988523"
204,2,"16:38",998,"Justin Tillman made Three Point Jumper. Assisted by Jonathan Williams.",54,39,"VCU","Seton Hall",13.5,"400988523"
