"play_id","half","time_remaining_half","secs_remaining","description","home_score","away_score","away","home","home_favored_by","game_id"
330,2,"0:30",30,"Foul on Jadon Cohee.",83,80,"Central Michigan","Southern Utah",-2.5,"400990171"
331,2,"0:30",30,"Gavin Peppers missed Free Throw.",83,80,"Central Michigan","Southern Utah",-2.5,"400990171"
332,2,"0:30",30,"James McGee Defensive Rebound.",83,80,"Central Michigan","Southern Utah",-2.5,"400990171"
333,2,"0:27",27,"Foul on Gavin Peppers.",83,80,"Central Michigan","Southern Utah",-2.5,"400990171"
334,2,"0:27",27,"James McGee made Free Throw.",84,80,"Central Michigan","Southern Utah",-2.5,"400990171"
335,2,"0:27",27,"James McGee missed Free Throw.",84,80,"Central Michigan","Southern Utah",-2.5,"400990171"
336,2,"0:27",27,"David DiLeo Defensive Rebound.",84,80,"Central Michigan","Southern Utah",-2.5,"400990171"
337,2,"0:15",15,"Gavin Peppers missed Three Point Jumper.",84,80,"Central Michigan","Southern Utah",-2.5,"400990171"
338,2,"0:15",15,"Southern Utah Defensive Rebound.",84,80,"Central Michigan","Southern Utah",-2.5,"400990171"
339,2,"0:11",11,"Foul on Shawn Roundtree.",84,80,"Central Michigan","Southern Utah",-2.5,"400990171"
340,2,"0:11",11,"Jadon Cohee made Free Throw.",85,80,"Central Michigan","Southern Utah",-2.5,"400990171"
341,2,"0:11",11,"Jadon Cohee made Free Throw.",86,80,"Central Michigan","Southern Utah",-2.5,"400990171"
342,2,"0:05",5,"Shawn Roundtree missed Three Point Jumper.",86,80,"Central Michigan","Southern Utah",-2.5,"400990171"
343,2,"0:05",5,"Brandon Better Defensive Rebound.",86,80,"Central Michigan","Southern Utah",-2.5,"400990171"
344,2,"0:00",0,"End of 2nd half",86,80,"Central Michigan","Southern Utah",-2.5,"400990171"
345,2,"0:00",0,"End of Game",86,80,"Central Michigan","Southern Utah",-2.5,"400990171"
1,1,"20:00",2400,"PLAY",0,0,"Southern Utah","Iowa",16,"400986446"
2,1,"19:37",2377,"Jadon Cohee Turnover.",0,0,"Southern Utah","Iowa",16,"400986446"
3,1,"19:18",2358,"Jordan Bohannon missed Jumper.",0,0,"Southern Utah","Iowa",16,"400986446"
4,1,"19:18",2358,"Nicholas Baer Offensive Rebound.",0,0,"Southern Utah","Iowa",16,"400986446"
5,1,"19:15",2355,"Isaiah Moss missed Three Point Jumper.",0,0,"Southern Utah","Iowa",16,"400986446"
6,1,"19:15",2355,"Jadon Cohee Defensive Rebound.",0,0,"Southern Utah","Iowa",16,"400986446"
7,1,"19:02",2342,"James McGee missed Three Point Jumper.",0,0,"Southern Utah","Iowa",16,"400986446"
8,1,"19:02",2342,"Tyler Cook Defensive Rebound.",0,0,"Southern Utah","Iowa",16,"400986446"
9,1,"18:49",2329,"Nicholas Baer made Jumper.",2,0,"Southern Utah","Iowa",16,"400986446"
10,1,"18:27",2307,"Jadon Cohee missed Jumper.",2,0,"Southern Utah","Iowa",16,"400986446"
11,1,"18:27",2307,"Jack Nunge Defensive Rebound.",2,0,"Southern Utah","Iowa",16,"400986446"
12,1,"18:19",2299,"Tyler Cook missed Jumper.",2,0,"Southern Utah","Iowa",16,"400986446"
13,1,"18:19",2299,"Jordan Bohannon Offensive Rebound.",2,0,"Southern Utah","Iowa",16,"400986446"
14,1,"18:10",2290,"Nicholas Baer Turnover.",2,0,"Southern Utah","Iowa",16,"400986446"
15,1,"18:09",2289,"Jacob Calloway Steal.",2,0,"Southern Utah","Iowa",16,"400986446"
16,1,"18:04",2284,"Jacob Calloway made Three Point Jumper. Assisted by Jadon Cohee.",2,3,"Southern Utah","Iowa",16,"400986446"
17,1,"17:52",2272,"Foul on Dre Marin.",2,3,"Southern Utah","Iowa",16,"400986446"
18,1,"17:49",2269,"Tyler Cook made Layup.",4,3,"Southern Utah","Iowa",16,"400986446"
19,1,"17:49",2269,"Foul on Christian Musoko.",4,3,"Southern Utah","Iowa",16,"400986446"
20,1,"17:49",2269,"Tyler Cook made Free Throw.",5,3,"Southern Utah","Iowa",16,"400986446"
21,1,"17:39",2259,"Southern Utah  Timeout",5,3,"Southern Utah","Iowa",16,"400986446"
22,1,"17:22",2242,"Jacob Calloway Turnover.",5,3,"Southern Utah","Iowa",16,"400986446"
23,1,"17:21",2241,"Nicholas Baer Steal.",5,3,"Southern Utah","Iowa",16,"400986446"
24,1,"17:18",2238,"Isaiah Moss made Three Point Jumper. Assisted by Jack Nunge.",8,3,"Southern Utah","Iowa",16,"400986446"
25,1,"16:59",2219,"Jacob Calloway Turnover.",8,3,"Southern Utah","Iowa",16,"400986446"
26,1,"16:50",2210,"Isaiah Moss Turnover.",8,3,"Southern Utah","Iowa",16,"400986446"
27,1,"16:49",2209,"Ivan Madunic Steal.",8,3,"Southern Utah","Iowa",16,"400986446"
28,1,"16:38",2198,"Jamal Aytes missed Jumper.",8,3,"Southern Utah","Iowa",16,"400986446"
29,1,"16:38",2198,"Nicholas Baer Defensive Rebound.",8,3,"Southern Utah","Iowa",16,"400986446"
30,1,"16:24",2184,"Jack Nunge made Jumper.",10,3,"Southern Utah","Iowa",16,"400986446"
31,1,"16:24",2184,"Jamal Aytes missed Jumper.",10,3,"Southern Utah","Iowa",16,"400986446"
32,1,"16:24",2184,"Tyler Cook Defensive Rebound.",10,3,"Southern Utah","Iowa",16,"400986446"
33,1,"15:55",2155,"Jack Nunge made Layup. Assisted by Tyler Cook.",12,3,"Southern Utah","Iowa",16,"400986446"
34,1,"15:55",2155,"Foul on Ivan Madunic.",12,3,"Southern Utah","Iowa",16,"400986446"
35,1,"15:55",2155,"Official TV Timeout",12,3,"Southern Utah","Iowa",16,"400986446"
36,1,"15:55",2155,"Jack Nunge made Free Throw.",13,3,"Southern Utah","Iowa",16,"400986446"
37,1,"15:35",2135,"Jamal Aytes Turnover.",13,3,"Southern Utah","Iowa",16,"400986446"
38,1,"15:35",2135,"Foul on Jamal Aytes.",13,3,"Southern Utah","Iowa",16,"400986446"
39,1,"15:19",2119,"Tyler Cook missed Jumper.",13,3,"Southern Utah","Iowa",16,"400986446"
40,1,"15:19",2119,"Ivan Madunic Defensive Rebound.",13,3,"Southern Utah","Iowa",16,"400986446"
41,1,"15:11",2111,"Foul on Jordan Bohannon.",13,3,"Southern Utah","Iowa",16,"400986446"
42,1,"15:11",2111,"Brandon Better made Free Throw.",13,4,"Southern Utah","Iowa",16,"400986446"
43,1,"15:11",2111,"Brandon Better made Free Throw.",13,5,"Southern Utah","Iowa",16,"400986446"
44,1,"14:53",2093,"Nicholas Baer missed Three Point Jumper.",13,5,"Southern Utah","Iowa",16,"400986446"
45,1,"14:53",2093,"Tyler Cook Offensive Rebound.",13,5,"Southern Utah","Iowa",16,"400986446"
46,1,"14:48",2088,"Tyler Cook made Dunk.",15,5,"Southern Utah","Iowa",16,"400986446"
47,1,"14:23",2063,"Brandon Better missed Layup.",15,5,"Southern Utah","Iowa",16,"400986446"
48,1,"14:23",2063,"Nicholas Baer Block.",15,5,"Southern Utah","Iowa",16,"400986446"
49,1,"14:21",2061,"Jordan Bohannon Defensive Rebound.",15,5,"Southern Utah","Iowa",16,"400986446"
50,1,"14:11",2051,"Nicholas Baer Turnover.",15,5,"Southern Utah","Iowa",16,"400986446"
51,1,"14:11",2051,"Ivan Madunic Steal.",15,5,"Southern Utah","Iowa",16,"400986446"
52,1,"14:04",2044,"Dre Marin Turnover.",15,5,"Southern Utah","Iowa",16,"400986446"
53,1,"14:04",2044,"Isaiah Moss Steal.",15,5,"Southern Utah","Iowa",16,"400986446"
54,1,"14:01",2041,"Isaiah Moss made Dunk. Assisted by Jack Nunge.",17,5,"Southern Utah","Iowa",16,"400986446"
55,1,"13:36",2016,"Dre Marin missed Three Point Jumper.",17,5,"Southern Utah","Iowa",16,"400986446"
56,1,"13:36",2016,"Nicholas Baer Defensive Rebound.",17,5,"Southern Utah","Iowa",16,"400986446"
57,1,"13:23",2003,"Tyler Cook missed Jumper.",17,5,"Southern Utah","Iowa",16,"400986446"
58,1,"13:23",2003,"Jamal Aytes Defensive Rebound.",17,5,"Southern Utah","Iowa",16,"400986446"
59,1,"13:04",1984,"Brandon Better made Three Point Jumper. Assisted by Dre Marin.",17,8,"Southern Utah","Iowa",16,"400986446"
60,1,"12:50",1970,"Isaiah Moss missed Jumper.",17,8,"Southern Utah","Iowa",16,"400986446"
61,1,"12:50",1970,"Dre Marin Defensive Rebound.",17,8,"Southern Utah","Iowa",16,"400986446"
62,1,"12:40",1960,"Brandon Better missed Three Point Jumper.",17,8,"Southern Utah","Iowa",16,"400986446"
63,1,"12:40",1960,"Jack Nunge Defensive Rebound.",17,8,"Southern Utah","Iowa",16,"400986446"
64,1,"12:32",1952,"Foul on Jamal Aytes.",17,8,"Southern Utah","Iowa",16,"400986446"
65,1,"12:16",1936,"Foul on Jacob Calloway.",17,8,"Southern Utah","Iowa",16,"400986446"
66,1,"12:16",1936,"Luka Garza made Free Throw.",18,8,"Southern Utah","Iowa",16,"400986446"
67,1,"12:16",1936,"Luka Garza made Free Throw.",19,8,"Southern Utah","Iowa",16,"400986446"
68,1,"12:01",1921,"Christian Musoko made Jumper.",19,10,"Southern Utah","Iowa",16,"400986446"
69,1,"11:54",1914,"Foul on Christian Musoko.",19,10,"Southern Utah","Iowa",16,"400986446"
70,1,"11:54",1914,"Official TV Timeout",19,10,"Southern Utah","Iowa",16,"400986446"
71,1,"11:54",1914,"Tyler Cook missed Free Throw.",19,10,"Southern Utah","Iowa",16,"400986446"
72,1,"11:54",1914,"Ivan Madunic Defensive Rebound.",19,10,"Southern Utah","Iowa",16,"400986446"
73,1,"11:39",1899,"Foul on Tyler Cook.",19,10,"Southern Utah","Iowa",16,"400986446"
74,1,"11:39",1899,"Ivan Madunic missed Free Throw.",19,10,"Southern Utah","Iowa",16,"400986446"
75,1,"11:39",1899,"Southern Utah Deadball Team Rebound.",19,10,"Southern Utah","Iowa",16,"400986446"
76,1,"11:39",1899,"Ivan Madunic missed Free Throw.",19,10,"Southern Utah","Iowa",16,"400986446"
77,1,"11:39",1899,"Ryan Kriener Defensive Rebound.",19,10,"Southern Utah","Iowa",16,"400986446"
78,1,"11:21",1881,"Brady Ellingson made Layup. Assisted by Luka Garza.",21,10,"Southern Utah","Iowa",16,"400986446"
79,1,"11:21",1881,"Foul on Brandon Better.",21,10,"Southern Utah","Iowa",16,"400986446"
80,1,"11:21",1881,"Brady Ellingson made Free Throw.",22,10,"Southern Utah","Iowa",16,"400986446"
81,1,"11:11",1871,"Jacob Calloway made Jumper.",22,12,"Southern Utah","Iowa",16,"400986446"
82,1,"11:03",1863,"Luka Garza missed Three Point Jumper.",22,12,"Southern Utah","Iowa",16,"400986446"
83,1,"11:03",1863,"Ryan Kriener Offensive Rebound.",22,12,"Southern Utah","Iowa",16,"400986446"
84,1,"10:57",1857,"Ryan Kriener made Layup.",24,12,"Southern Utah","Iowa",16,"400986446"
85,1,"10:48",1848,"James McGee missed Three Point Jumper.",24,12,"Southern Utah","Iowa",16,"400986446"
86,1,"10:48",1848,"Maishe Dailey Defensive Rebound.",24,12,"Southern Utah","Iowa",16,"400986446"
87,1,"10:40",1840,"Foul on James McGee.",24,12,"Southern Utah","Iowa",16,"400986446"
88,1,"10:40",1840,"Ryan Kriener missed Free Throw.",24,12,"Southern Utah","Iowa",16,"400986446"
89,1,"10:40",1840,"Dre Marin Defensive Rebound.",24,12,"Southern Utah","Iowa",16,"400986446"
90,1,"10:19",1819,"Jacob Calloway missed Jumper.",24,12,"Southern Utah","Iowa",16,"400986446"
91,1,"10:19",1819,"Luka Garza Defensive Rebound.",24,12,"Southern Utah","Iowa",16,"400986446"
92,1,"10:05",1805,"Luka Garza Turnover.",24,12,"Southern Utah","Iowa",16,"400986446"
93,1,"10:04",1804,"Ivan Madunic Steal.",24,12,"Southern Utah","Iowa",16,"400986446"
94,1,"10:00",1800,"Jadon Cohee made Layup.",24,14,"Southern Utah","Iowa",16,"400986446"
95,1,"9:45",1785,"Foul on Ivan Madunic.",24,14,"Southern Utah","Iowa",16,"400986446"
96,1,"9:45",1785,"Luka Garza made Free Throw.",25,14,"Southern Utah","Iowa",16,"400986446"
97,1,"9:45",1785,"Luka Garza made Free Throw.",26,14,"Southern Utah","Iowa",16,"400986446"
98,1,"9:31",1771,"Jamal Aytes made Jumper. Assisted by James McGee.",26,16,"Southern Utah","Iowa",16,"400986446"
99,1,"9:21",1761,"Jordan Bohannon missed Three Point Jumper.",26,16,"Southern Utah","Iowa",16,"400986446"
100,1,"9:21",1761,"Dre Marin Defensive Rebound.",26,16,"Southern Utah","Iowa",16,"400986446"
101,1,"9:08",1748,"Jamal Aytes missed Layup.",26,16,"Southern Utah","Iowa",16,"400986446"
102,1,"9:08",1748,"Isaiah Moss Defensive Rebound.",26,16,"Southern Utah","Iowa",16,"400986446"
103,1,"8:59",1739,"Luka Garza missed Jumper.",26,16,"Southern Utah","Iowa",16,"400986446"
104,1,"8:59",1739,"Dre Marin Defensive Rebound.",26,16,"Southern Utah","Iowa",16,"400986446"
105,1,"8:51",1731,"Jadon Cohee missed Three Point Jumper.",26,16,"Southern Utah","Iowa",16,"400986446"
106,1,"8:51",1731,"Maishe Dailey Defensive Rebound.",26,16,"Southern Utah","Iowa",16,"400986446"
107,1,"8:43",1723,"Maishe Dailey missed Jumper.",26,16,"Southern Utah","Iowa",16,"400986446"
108,1,"8:43",1723,"Dre Marin Defensive Rebound.",26,16,"Southern Utah","Iowa",16,"400986446"
109,1,"8:32",1712,"Ivan Madunic made Three Point Jumper. Assisted by Jadon Cohee.",26,19,"Southern Utah","Iowa",16,"400986446"
110,1,"8:20",1700,"Maishe Dailey made Three Point Jumper. Assisted by Ryan Kriener.",29,19,"Southern Utah","Iowa",16,"400986446"
111,1,"7:57",1677,"James McGee made Three Point Jumper. Assisted by Dre Marin.",29,22,"Southern Utah","Iowa",16,"400986446"
112,1,"7:41",1661,"Luka Garza made Jumper. Assisted by Isaiah Moss.",31,22,"Southern Utah","Iowa",16,"400986446"
113,1,"7:21",1641,"Jamal Aytes made Jumper. Assisted by Dre Marin.",31,24,"Southern Utah","Iowa",16,"400986446"
114,1,"7:15",1635,"Isaiah Moss missed Three Point Jumper.",31,24,"Southern Utah","Iowa",16,"400986446"
115,1,"7:15",1635,"Jadon Cohee Defensive Rebound.",31,24,"Southern Utah","Iowa",16,"400986446"
116,1,"7:05",1625,"Ivan Madunic missed Three Point Jumper.",31,24,"Southern Utah","Iowa",16,"400986446"
117,1,"7:05",1625,"Maishe Dailey Defensive Rebound.",31,24,"Southern Utah","Iowa",16,"400986446"
118,1,"6:53",1613,"Ryan Kriener made Layup. Assisted by Jordan Bohannon.",33,24,"Southern Utah","Iowa",16,"400986446"
119,1,"6:53",1613,"Foul on Jamal Aytes.",33,24,"Southern Utah","Iowa",16,"400986446"
120,1,"6:53",1613,"Official TV Timeout",33,24,"Southern Utah","Iowa",16,"400986446"
121,1,"6:53",1613,"Ryan Kriener made Free Throw.",34,24,"Southern Utah","Iowa",16,"400986446"
122,1,"6:38",1598,"Dre Marin missed Jumper.",34,24,"Southern Utah","Iowa",16,"400986446"
123,1,"6:38",1598,"Jacob Calloway Offensive Rebound.",34,24,"Southern Utah","Iowa",16,"400986446"
124,1,"6:32",1592,"Foul on Nicholas Baer.",34,24,"Southern Utah","Iowa",16,"400986446"
125,1,"6:32",1592,"Jacob Calloway missed Free Throw.",34,24,"Southern Utah","Iowa",16,"400986446"
126,1,"6:32",1592,"Southern Utah Deadball Team Rebound.",34,24,"Southern Utah","Iowa",16,"400986446"
127,1,"6:32",1592,"Jacob Calloway missed Free Throw.",34,24,"Southern Utah","Iowa",16,"400986446"
128,1,"6:32",1592,"Tyler Cook Defensive Rebound.",34,24,"Southern Utah","Iowa",16,"400986446"
129,1,"6:16",1576,"Cordell Pemsl made Layup. Assisted by Jordan Bohannon.",36,24,"Southern Utah","Iowa",16,"400986446"
130,1,"5:57",1557,"Jadon Cohee missed Jumper.",36,24,"Southern Utah","Iowa",16,"400986446"
131,1,"5:57",1557,"Nicholas Baer Defensive Rebound.",36,24,"Southern Utah","Iowa",16,"400986446"
132,1,"5:48",1548,"Jordan Bohannon missed Layup.",36,24,"Southern Utah","Iowa",16,"400986446"
133,1,"5:48",1548,"James McGee Defensive Rebound.",36,24,"Southern Utah","Iowa",16,"400986446"
134,1,"5:42",1542,"Jacob Calloway Turnover.",36,24,"Southern Utah","Iowa",16,"400986446"
135,1,"5:41",1541,"Cordell Pemsl Steal.",36,24,"Southern Utah","Iowa",16,"400986446"
136,1,"5:37",1537,"Foul on Jacob Calloway.",36,24,"Southern Utah","Iowa",16,"400986446"
137,1,"5:37",1537,"Cordell Pemsl made Free Throw.",37,24,"Southern Utah","Iowa",16,"400986446"
138,1,"5:37",1537,"Cordell Pemsl made Free Throw.",38,24,"Southern Utah","Iowa",16,"400986446"
139,1,"5:23",1523,"Joel Swallow made Dunk. Assisted by Brandon Better.",38,26,"Southern Utah","Iowa",16,"400986446"
140,1,"5:09",1509,"Isaiah Moss missed Three Point Jumper.",38,26,"Southern Utah","Iowa",16,"400986446"
141,1,"5:09",1509,"Southern Utah Defensive Rebound.",38,26,"Southern Utah","Iowa",16,"400986446"
142,1,"4:47",1487,"James McGee missed Three Point Jumper.",38,26,"Southern Utah","Iowa",16,"400986446"
143,1,"4:47",1487,"Cordell Pemsl Defensive Rebound.",38,26,"Southern Utah","Iowa",16,"400986446"
144,1,"4:32",1472,"Cordell Pemsl Turnover.",38,26,"Southern Utah","Iowa",16,"400986446"
145,1,"4:32",1472,"Foul on Cordell Pemsl.",38,26,"Southern Utah","Iowa",16,"400986446"
146,1,"4:10",1450,"Jadon Cohee missed Three Point Jumper.",38,26,"Southern Utah","Iowa",16,"400986446"
147,1,"4:10",1450,"Connor McCaffery Defensive Rebound.",38,26,"Southern Utah","Iowa",16,"400986446"
148,1,"3:56",1436,"Tyler Cook made Layup. Assisted by Nicholas Baer.",40,26,"Southern Utah","Iowa",16,"400986446"
149,1,"3:33",1413,"Brandon Better missed Three Point Jumper.",40,26,"Southern Utah","Iowa",16,"400986446"
150,1,"3:33",1413,"Nicholas Baer Defensive Rebound.",40,26,"Southern Utah","Iowa",16,"400986446"
151,1,"3:18",1398,"Official TV Timeout",40,26,"Southern Utah","Iowa",16,"400986446"
152,1,"3:06",1386,"Jack Nunge Turnover.",40,26,"Southern Utah","Iowa",16,"400986446"
153,1,"2:36",1356,"Brandon Better made Three Point Jumper. Assisted by Jadon Cohee.",40,29,"Southern Utah","Iowa",16,"400986446"
154,1,"2:24",1344,"Tyler Cook made Jumper.",42,29,"Southern Utah","Iowa",16,"400986446"
155,1,"2:09",1329,"Brandon Better missed Three Point Jumper.",42,29,"Southern Utah","Iowa",16,"400986446"
156,1,"2:09",1329,"Jordan Bohannon Defensive Rebound.",42,29,"Southern Utah","Iowa",16,"400986446"
157,1,"1:56",1316,"Tyler Cook missed Jumper.",42,29,"Southern Utah","Iowa",16,"400986446"
158,1,"1:56",1316,"Luka Garza Offensive Rebound.",42,29,"Southern Utah","Iowa",16,"400986446"
159,1,"1:55",1315,"Foul on Brandon Better.",42,29,"Southern Utah","Iowa",16,"400986446"
160,1,"1:55",1315,"Luka Garza made Free Throw.",43,29,"Southern Utah","Iowa",16,"400986446"
161,1,"1:55",1315,"Luka Garza made Free Throw.",44,29,"Southern Utah","Iowa",16,"400986446"
162,1,"1:43",1303,"Jadon Cohee missed Jumper.",44,29,"Southern Utah","Iowa",16,"400986446"
163,1,"1:43",1303,"Luka Garza Defensive Rebound.",44,29,"Southern Utah","Iowa",16,"400986446"
164,1,"1:38",1298,"Jordan Bohannon made Three Point Jumper. Assisted by Maishe Dailey.",47,29,"Southern Utah","Iowa",16,"400986446"
165,1,"1:11",1271,"Brandon Better missed Jumper.",47,29,"Southern Utah","Iowa",16,"400986446"
166,1,"1:11",1271,"Jack Nunge Defensive Rebound.",47,29,"Southern Utah","Iowa",16,"400986446"
167,1,"1:03",1263,"Maishe Dailey made Three Point Jumper. Assisted by Jordan Bohannon.",50,29,"Southern Utah","Iowa",16,"400986446"
168,1,"1:03",1263,"Foul on Brandon Better.",50,29,"Southern Utah","Iowa",16,"400986446"
169,1,"1:03",1263,"Tyler Cook missed Free Throw.",50,29,"Southern Utah","Iowa",16,"400986446"
170,1,"1:03",1263,"Iowa Deadball Team Rebound.",50,29,"Southern Utah","Iowa",16,"400986446"
171,1,"1:03",1263,"Tyler Cook made Free Throw.",51,29,"Southern Utah","Iowa",16,"400986446"
172,1,"0:38",1238,"Jadon Cohee made Jumper.",51,31,"Southern Utah","Iowa",16,"400986446"
173,1,"0:25",1225,"Luka Garza Turnover.",51,31,"Southern Utah","Iowa",16,"400986446"
174,1,"0:02",1202,"Jacob Calloway missed Three Point Jumper.",51,31,"Southern Utah","Iowa",16,"400986446"
175,1,"0:02",1202,"Jack Nunge Block.",51,31,"Southern Utah","Iowa",16,"400986446"
176,1,"0:01",1201,"Jordan Bohannon Defensive Rebound.",51,31,"Southern Utah","Iowa",16,"400986446"
177,1,"0:00",1200,"End of 1st half",51,31,"Southern Utah","Iowa",16,"400986446"
178,2,"20:00",1200,"PLAY",51,31,"Southern Utah","Iowa",16,"400986446"
179,2,"19:36",1176,"Tyler Cook made Layup. Assisted by Nicholas Baer.",53,31,"Southern Utah","Iowa",16,"400986446"
180,2,"19:01",1141,"James McGee missed Three Point Jumper.",53,31,"Southern Utah","Iowa",16,"400986446"
181,2,"19:01",1141,"Tyler Cook Defensive Rebound.",53,31,"Southern Utah","Iowa",16,"400986446"
182,2,"18:38",1118,"Isaiah Moss made Layup. Assisted by Jordan Bohannon.",55,31,"Southern Utah","Iowa",16,"400986446"
183,2,"18:20",1100,"Jadon Cohee missed Jumper.",55,31,"Southern Utah","Iowa",16,"400986446"
184,2,"18:20",1100,"Nicholas Baer Defensive Rebound.",55,31,"Southern Utah","Iowa",16,"400986446"
185,2,"18:15",1095,"Nicholas Baer made Layup.",57,31,"Southern Utah","Iowa",16,"400986446"
186,2,"18:15",1095,"Foul on Christian Musoko.",57,31,"Southern Utah","Iowa",16,"400986446"
187,2,"18:15",1095,"Nicholas Baer made Free Throw.",58,31,"Southern Utah","Iowa",16,"400986446"
188,2,"18:01",1081,"Jacob Calloway made Three Point Jumper. Assisted by Jadon Cohee.",58,34,"Southern Utah","Iowa",16,"400986446"
189,2,"17:39",1059,"Tyler Cook missed Layup.",58,34,"Southern Utah","Iowa",16,"400986446"
190,2,"17:39",1059,"Christian Musoko Defensive Rebound.",58,34,"Southern Utah","Iowa",16,"400986446"
191,2,"17:35",1055,"Foul on Isaiah Moss.",58,34,"Southern Utah","Iowa",16,"400986446"
192,2,"17:35",1055,"Jadon Cohee made Free Throw.",58,35,"Southern Utah","Iowa",16,"400986446"
193,2,"17:35",1055,"Jadon Cohee missed Free Throw.",58,35,"Southern Utah","Iowa",16,"400986446"
194,2,"17:35",1055,"Nicholas Baer Defensive Rebound.",58,35,"Southern Utah","Iowa",16,"400986446"
195,2,"17:17",1037,"Isaiah Moss missed Jumper.",58,35,"Southern Utah","Iowa",16,"400986446"
196,2,"17:17",1037,"Jadon Cohee Defensive Rebound.",58,35,"Southern Utah","Iowa",16,"400986446"
197,2,"17:09",1029,"Jacob Calloway missed Three Point Jumper.",58,35,"Southern Utah","Iowa",16,"400986446"
198,2,"17:09",1029,"Nicholas Baer Defensive Rebound.",58,35,"Southern Utah","Iowa",16,"400986446"
199,2,"17:02",1022,"Isaiah Moss made Three Point Jumper. Assisted by Jordan Bohannon.",61,35,"Southern Utah","Iowa",16,"400986446"
200,2,"16:30",990,"Christian Musoko Turnover.",61,35,"Southern Utah","Iowa",16,"400986446"
201,2,"16:21",981,"Jack Nunge missed Three Point Jumper.",61,35,"Southern Utah","Iowa",16,"400986446"
202,2,"16:21",981,"Southern Utah Defensive Rebound.",61,35,"Southern Utah","Iowa",16,"400986446"
203,2,"16:03",963,"Jamal Aytes made Layup. Assisted by Jadon Cohee.",61,37,"Southern Utah","Iowa",16,"400986446"
204,2,"15:45",945,"Tyler Cook made Layup. Assisted by Jack Nunge.",63,37,"Southern Utah","Iowa",16,"400986446"
205,2,"15:32",932,"Foul on Jordan Bohannon.",63,37,"Southern Utah","Iowa",16,"400986446"
206,2,"15:32",932,"Official TV Timeout",63,37,"Southern Utah","Iowa",16,"400986446"
207,2,"15:32",932,"Ivan Madunic made Free Throw.",63,38,"Southern Utah","Iowa",16,"400986446"
208,2,"15:32",932,"Ivan Madunic made Free Throw.",63,39,"Southern Utah","Iowa",16,"400986446"
209,2,"15:18",918,"Nicholas Baer missed Three Point Jumper.",63,39,"Southern Utah","Iowa",16,"400986446"
210,2,"15:18",918,"Isaiah Moss Offensive Rebound.",63,39,"Southern Utah","Iowa",16,"400986446"
211,2,"15:13",913,"Isaiah Moss missed Dunk.",63,39,"Southern Utah","Iowa",16,"400986446"
212,2,"15:13",913,"Nicholas Baer Offensive Rebound.",63,39,"Southern Utah","Iowa",16,"400986446"
213,2,"15:09",909,"Isaiah Moss missed Three Point Jumper.",63,39,"Southern Utah","Iowa",16,"400986446"
214,2,"15:09",909,"Dre Marin Defensive Rebound.",63,39,"Southern Utah","Iowa",16,"400986446"
215,2,"14:53",893,"Jamal Aytes made Jumper. Assisted by Ivan Madunic.",63,41,"Southern Utah","Iowa",16,"400986446"
216,2,"14:43",883,"Tyler Cook made Jumper. Assisted by Jordan Bohannon.",65,41,"Southern Utah","Iowa",16,"400986446"
217,2,"14:17",857,"Foul on Isaiah Moss.",65,41,"Southern Utah","Iowa",16,"400986446"
218,2,"14:07",847,"Jamal Aytes missed Jumper.",65,41,"Southern Utah","Iowa",16,"400986446"
219,2,"14:07",847,"Tyler Cook Block.",65,41,"Southern Utah","Iowa",16,"400986446"
220,2,"14:05",845,"Isaiah Moss Defensive Rebound.",65,41,"Southern Utah","Iowa",16,"400986446"
221,2,"13:49",829,"Foul on Brandon Better.",65,41,"Southern Utah","Iowa",16,"400986446"
222,2,"13:48",828,"Isaiah Moss missed Three Point Jumper.",65,41,"Southern Utah","Iowa",16,"400986446"
223,2,"13:48",828,"Ivan Madunic Defensive Rebound.",65,41,"Southern Utah","Iowa",16,"400986446"
224,2,"13:45",825,"Foul on Tyler Cook.",65,41,"Southern Utah","Iowa",16,"400986446"
225,2,"13:30",810,"Dre Marin missed Three Point Jumper.",65,41,"Southern Utah","Iowa",16,"400986446"
226,2,"13:30",810,"Tyler Cook Defensive Rebound.",65,41,"Southern Utah","Iowa",16,"400986446"
227,2,"13:17",797,"Jordan Bohannon missed Three Point Jumper.",65,41,"Southern Utah","Iowa",16,"400986446"
228,2,"13:17",797,"Ivan Madunic Defensive Rebound.",65,41,"Southern Utah","Iowa",16,"400986446"
229,2,"13:04",784,"Jamal Aytes missed Jumper.",65,41,"Southern Utah","Iowa",16,"400986446"
230,2,"13:04",784,"Tyler Cook Defensive Rebound.",65,41,"Southern Utah","Iowa",16,"400986446"
231,2,"12:57",777,"Jordan Bohannon Turnover.",65,41,"Southern Utah","Iowa",16,"400986446"
232,2,"12:37",757,"James McGee made Three Point Jumper. Assisted by Jacob Calloway.",65,44,"Southern Utah","Iowa",16,"400986446"
233,2,"12:29",749,"Jordan Bohannon missed Jumper.",65,44,"Southern Utah","Iowa",16,"400986446"
234,2,"12:29",749,"Jacob Calloway Defensive Rebound.",65,44,"Southern Utah","Iowa",16,"400986446"
235,2,"12:28",748,"Foul on Luka Garza.",65,44,"Southern Utah","Iowa",16,"400986446"
236,2,"12:13",733,"Jadon Cohee missed Three Point Jumper.",65,44,"Southern Utah","Iowa",16,"400986446"
237,2,"12:13",733,"Cordell Pemsl Defensive Rebound.",65,44,"Southern Utah","Iowa",16,"400986446"
238,2,"11:59",719,"Connor McCaffery missed Three Point Jumper.",65,44,"Southern Utah","Iowa",16,"400986446"
239,2,"11:59",719,"Luka Garza Offensive Rebound.",65,44,"Southern Utah","Iowa",16,"400986446"
240,2,"11:55",715,"Luka Garza made Layup.",67,44,"Southern Utah","Iowa",16,"400986446"
241,2,"11:37",697,"Dre Marin missed Jumper.",67,44,"Southern Utah","Iowa",16,"400986446"
242,2,"11:37",697,"Luka Garza Block.",67,44,"Southern Utah","Iowa",16,"400986446"
243,2,"11:35",695,"Cordell Pemsl Defensive Rebound.",67,44,"Southern Utah","Iowa",16,"400986446"
244,2,"11:25",685,"Foul on Christian Musoko.",67,44,"Southern Utah","Iowa",16,"400986446"
245,2,"11:25",685,"Official TV Timeout",67,44,"Southern Utah","Iowa",16,"400986446"
246,2,"11:24",684,"Maishe Dailey missed Three Point Jumper.",67,44,"Southern Utah","Iowa",16,"400986446"
247,2,"11:24",684,"Luka Garza Offensive Rebound.",67,44,"Southern Utah","Iowa",16,"400986446"
248,2,"11:22",682,"Foul on James McGee.",67,44,"Southern Utah","Iowa",16,"400986446"
249,2,"11:12",672,"Cordell Pemsl made Layup.",69,44,"Southern Utah","Iowa",16,"400986446"
250,2,"10:45",645,"James McGee Turnover.",69,44,"Southern Utah","Iowa",16,"400986446"
251,2,"10:45",645,"Maishe Dailey Steal.",69,44,"Southern Utah","Iowa",16,"400986446"
252,2,"10:38",638,"Cordell Pemsl made Dunk. Assisted by Connor McCaffery.",71,44,"Southern Utah","Iowa",16,"400986446"
253,2,"10:22",622,"Dre Marin missed Three Point Jumper.",71,44,"Southern Utah","Iowa",16,"400986446"
