"play_id","half","time_remaining_half","secs_remaining","description","home_score","away_score","away","home","home_favored_by","game_id"
285,2,"6:43",403,"Jaycee Hillsman made Layup.",61,52,"San Jose State","Southern Utah",-1,"400991235"
286,2,"6:43",403,"Foul on Jamal Aytes.",61,52,"San Jose State","Southern Utah",-1,"400991235"
287,2,"6:43",403,"Jaycee Hillsman made Free Throw.",61,53,"San Jose State","Southern Utah",-1,"400991235"
288,2,"6:36",396,"Foul on Keith Fisher III.",61,53,"San Jose State","Southern Utah",-1,"400991235"
289,2,"6:36",396,"Jadon Cohee made Free Throw.",62,53,"San Jose State","Southern Utah",-1,"400991235"
290,2,"6:36",396,"Jadon Cohee made Free Throw.",63,53,"San Jose State","Southern Utah",-1,"400991235"
291,2,"6:26",386,"Ryan Welage made Jumper. Assisted by Jaycee Hillsman.",63,55,"San Jose State","Southern Utah",-1,"400991235"
292,2,"5:58",358,"Ivan Madunic made Layup.",65,55,"San Jose State","Southern Utah",-1,"400991235"
293,2,"5:52",352,"Jalen James Turnover.",65,55,"San Jose State","Southern Utah",-1,"400991235"
294,2,"5:41",341,"Jamil Jackson made Layup.",67,55,"San Jose State","Southern Utah",-1,"400991235"
295,2,"5:30",330,"Noah Baumann missed Jumper.",67,55,"San Jose State","Southern Utah",-1,"400991235"
296,2,"5:30",330,"Ivan Madunic Block.",67,55,"San Jose State","Southern Utah",-1,"400991235"
297,2,"5:30",330,"Ivan Madunic Defensive Rebound.",67,55,"San Jose State","Southern Utah",-1,"400991235"
298,2,"5:21",321,"Jadon Cohee missed Layup.",67,55,"San Jose State","Southern Utah",-1,"400991235"
299,2,"5:21",321,"Keith Fisher III Defensive Rebound.",67,55,"San Jose State","Southern Utah",-1,"400991235"
300,2,"5:08",308,"Jaycee Hillsman missed Jumper.",67,55,"San Jose State","Southern Utah",-1,"400991235"
301,2,"5:08",308,"Keith Fisher III Offensive Rebound.",67,55,"San Jose State","Southern Utah",-1,"400991235"
302,2,"5:02",302,"Jalen James missed Jumper.",67,55,"San Jose State","Southern Utah",-1,"400991235"
303,2,"5:02",302,"Jaycee Hillsman Offensive Rebound.",67,55,"San Jose State","Southern Utah",-1,"400991235"
304,2,"4:54",294,"Foul on Ivan Madunic.",67,55,"San Jose State","Southern Utah",-1,"400991235"
305,2,"4:45",285,"Jaycee Hillsman made Free Throw.",67,56,"San Jose State","Southern Utah",-1,"400991235"
306,2,"4:45",285,"Jaycee Hillsman made Free Throw.",67,57,"San Jose State","Southern Utah",-1,"400991235"
307,2,"4:35",275,"Jamil Jackson made Layup.",69,57,"San Jose State","Southern Utah",-1,"400991235"
308,2,"4:28",268,"Jalen James Turnover.",69,57,"San Jose State","Southern Utah",-1,"400991235"
309,2,"4:07",247,"Christian Musoko made Layup.",71,57,"San Jose State","Southern Utah",-1,"400991235"
310,2,"3:46",226,"Ryan Welage made Jumper.",71,59,"San Jose State","Southern Utah",-1,"400991235"
311,2,"3:16",196,"Christian Musoko Turnover.",71,59,"San Jose State","Southern Utah",-1,"400991235"
312,2,"3:16",196,"Christian Musoko Turnover.",71,59,"San Jose State","Southern Utah",-1,"400991235"
313,2,"3:15",195,"Jalen James Steal.",71,59,"San Jose State","Southern Utah",-1,"400991235"
314,2,"3:13",193,"Jalen James made Layup.",71,61,"San Jose State","Southern Utah",-1,"400991235"
315,2,"2:54",174,"Southern Utah  Timeout",71,61,"San Jose State","Southern Utah",-1,"400991235"
316,2,"2:54",174,"Official TV Timeout",71,61,"San Jose State","Southern Utah",-1,"400991235"
317,2,"2:41",161,"Jadon Cohee made Three Point Jumper. Assisted by Dre Marin.",74,61,"San Jose State","Southern Utah",-1,"400991235"
318,2,"2:23",143,"Jalen James Turnover.",74,61,"San Jose State","Southern Utah",-1,"400991235"
319,2,"2:19",139,"Foul on Jalen James.",74,61,"San Jose State","Southern Utah",-1,"400991235"
320,2,"1:51",111,"James McGee missed Three Point Jumper.",74,61,"San Jose State","Southern Utah",-1,"400991235"
321,2,"1:51",111,"Ryan Welage Defensive Rebound.",74,61,"San Jose State","Southern Utah",-1,"400991235"
322,2,"1:41",101,"Foul on James McGee.",74,61,"San Jose State","Southern Utah",-1,"400991235"
323,2,"1:41",101,"Ryan Welage made Free Throw.",74,62,"San Jose State","Southern Utah",-1,"400991235"
324,2,"1:41",101,"Ryan Welage made Free Throw.",74,63,"San Jose State","Southern Utah",-1,"400991235"
325,2,"1:22",82,"Dre Marin made Jumper.",76,63,"San Jose State","Southern Utah",-1,"400991235"
326,2,"1:03",63,"Foul on Jamil Jackson.",76,63,"San Jose State","Southern Utah",-1,"400991235"
327,2,"1:01",61,"Jaycee Hillsman made Free Throw.",76,64,"San Jose State","Southern Utah",-1,"400991235"
328,2,"1:01",61,"Jaycee Hillsman made Free Throw.",76,65,"San Jose State","Southern Utah",-1,"400991235"
329,2,"0:51",51,"Foul on Jaycee Hillsman.",76,65,"San Jose State","Southern Utah",-1,"400991235"
330,2,"0:51",51,"Jadon Cohee missed Free Throw.",76,65,"San Jose State","Southern Utah",-1,"400991235"
331,2,"0:51",51,"Oumar Barry Defensive Rebound.",76,65,"San Jose State","Southern Utah",-1,"400991235"
332,2,"0:45",45,"Ryan Welage Turnover.",76,65,"San Jose State","Southern Utah",-1,"400991235"
333,2,"0:44",44,"Jadon Cohee Steal.",76,65,"San Jose State","Southern Utah",-1,"400991235"
334,2,"0:42",42,"Foul on Ryan Welage.",76,65,"San Jose State","Southern Utah",-1,"400991235"
335,2,"0:36",36,"Dre Marin missed Free Throw.",76,65,"San Jose State","Southern Utah",-1,"400991235"
336,2,"0:36",36,"Southern Utah Deadball Team Rebound.",76,65,"San Jose State","Southern Utah",-1,"400991235"
337,2,"0:36",36,"Dre Marin made Free Throw.",77,65,"San Jose State","Southern Utah",-1,"400991235"
338,2,"0:36",36,"Isaiah Nichols made Layup.",77,67,"San Jose State","Southern Utah",-1,"400991235"
339,2,"0:33",33,"Foul on Isaiah Nichols.",77,67,"San Jose State","Southern Utah",-1,"400991235"
340,2,"0:23",23,"Jadon Cohee made Free Throw.",78,67,"San Jose State","Southern Utah",-1,"400991235"
341,2,"0:23",23,"Jadon Cohee made Free Throw.",79,67,"San Jose State","Southern Utah",-1,"400991235"
342,2,"0:17",17,"Jaycee Hillsman missed Three Point Jumper.",79,67,"San Jose State","Southern Utah",-1,"400991235"
343,2,"0:11",11,"Southern Utah Defensive Rebound.",79,67,"San Jose State","Southern Utah",-1,"400991235"
344,2,"0:11",11,"Southern Utah Defensive Rebound.",79,67,"San Jose State","Southern Utah",-1,"400991235"
345,2,"0:09",9,"Foul on Isaiah Nichols.",79,67,"San Jose State","Southern Utah",-1,"400991235"
346,2,"0:08",8,"Dre Marin made Free Throw.",80,67,"San Jose State","Southern Utah",-1,"400991235"
347,2,"0:08",8,"Dre Marin made Free Throw.",81,67,"San Jose State","Southern Utah",-1,"400991235"
348,2,"0:08",8,"Jaycee Hillsman made Layup.",81,69,"San Jose State","Southern Utah",-1,"400991235"
349,2,"0:00",0,"End of 2nd half",81,69,"San Jose State","Southern Utah",-1,"400991235"
350,2,"0:00",0,"End of Game",81,69,"San Jose State","Southern Utah",-1,"400991235"
1,1,"20:00",2400,"PLAY",0,0,"Benedictine (AZ)","Southern Utah",NA,"400991241"
2,1,"19:44",2384,"Dre Marin Turnover.",0,0,"Benedictine (AZ)","Southern Utah",NA,"400991241"
3,1,"19:43",2383,"Robert Kincade Steal.",0,0,"Benedictine (AZ)","Southern Utah",NA,"400991241"
4,1,"19:40",2380,"Richie Thornton V made Layup. Assisted by Carter Aby.",0,2,"Benedictine (AZ)","Southern Utah",NA,"400991241"
5,1,"19:27",2367,"James McGee made Three Point Jumper. Assisted by Jacob Calloway.",3,2,"Benedictine (AZ)","Southern Utah",NA,"400991241"
6,1,"19:17",2357,"Jorge Cano made Jumper. Assisted by Robert Kincade.",3,4,"Benedictine (AZ)","Southern Utah",NA,"400991241"
7,1,"18:53",2333,"James McGee made Three Point Jumper. Assisted by Jadon Cohee.",6,4,"Benedictine (AZ)","Southern Utah",NA,"400991241"
8,1,"18:43",2323,"Jorge Cano made Dunk. Assisted by Robert Kincade.",6,6,"Benedictine (AZ)","Southern Utah",NA,"400991241"
9,1,"18:27",2307,"James McGee made Three Point Jumper. Assisted by Jadon Cohee.",9,6,"Benedictine (AZ)","Southern Utah",NA,"400991241"
10,1,"18:10",2290,"Carter Aby Turnover.",9,6,"Benedictine (AZ)","Southern Utah",NA,"400991241"
11,1,"18:08",2288,"James McGee Steal.",9,6,"Benedictine (AZ)","Southern Utah",NA,"400991241"
12,1,"18:01",2281,"Jacob Calloway missed Three Point Jumper.",9,6,"Benedictine (AZ)","Southern Utah",NA,"400991241"
13,1,"18:01",2281,"Devin White Defensive Rebound.",9,6,"Benedictine (AZ)","Southern Utah",NA,"400991241"
14,1,"17:36",2256,"Robert Kincade Turnover.",9,6,"Benedictine (AZ)","Southern Utah",NA,"400991241"
15,1,"17:36",2256,"Foul on Robert Kincade.",9,6,"Benedictine (AZ)","Southern Utah",NA,"400991241"
16,1,"17:23",2243,"Foul on Devin White.",9,6,"Benedictine (AZ)","Southern Utah",NA,"400991241"
17,1,"17:13",2233,"Jacob Calloway missed Three Point Jumper.",9,6,"Benedictine (AZ)","Southern Utah",NA,"400991241"
18,1,"17:13",2233,"Dre Marin Offensive Rebound.",9,6,"Benedictine (AZ)","Southern Utah",NA,"400991241"
19,1,"17:06",2226,"Jadon Cohee made Three Point Jumper. Assisted by James McGee.",12,6,"Benedictine (AZ)","Southern Utah",NA,"400991241"
20,1,"16:41",2201,"Richie Thornton V missed Three Point Jumper.",12,6,"Benedictine (AZ)","Southern Utah",NA,"400991241"
21,1,"16:41",2201,"Christian Musoko Defensive Rebound.",12,6,"Benedictine (AZ)","Southern Utah",NA,"400991241"
22,1,"16:31",2191,"Christian Musoko Turnover.",12,6,"Benedictine (AZ)","Southern Utah",NA,"400991241"
23,1,"16:29",2189,"Foul on Christian Musoko.",12,6,"Benedictine (AZ)","Southern Utah",NA,"400991241"
24,1,"16:04",2164,"Robert Kincade made Three Point Jumper.",12,9,"Benedictine (AZ)","Southern Utah",NA,"400991241"
25,1,"15:48",2148,"Jamal Aytes made Layup. Assisted by Ivan Madunic.",14,9,"Benedictine (AZ)","Southern Utah",NA,"400991241"
26,1,"15:32",2132,"Carter Aby made Layup.",14,11,"Benedictine (AZ)","Southern Utah",NA,"400991241"
27,1,"15:17",2117,"Dre Marin missed Three Point Jumper.",14,11,"Benedictine (AZ)","Southern Utah",NA,"400991241"
28,1,"15:17",2117,"Jamal Aytes Offensive Rebound.",14,11,"Benedictine (AZ)","Southern Utah",NA,"400991241"
29,1,"15:14",2114,"Jamal Aytes made Layup.",16,11,"Benedictine (AZ)","Southern Utah",NA,"400991241"
30,1,"14:55",2095,"Foul on Jadon Cohee.",16,11,"Benedictine (AZ)","Southern Utah",NA,"400991241"
31,1,"14:55",2095,"Official TV Timeout",16,11,"Benedictine (AZ)","Southern Utah",NA,"400991241"
32,1,"14:55",2095,"Carter Aby Turnover.",16,11,"Benedictine (AZ)","Southern Utah",NA,"400991241"
33,1,"14:55",2095,"Foul on Carter Aby.",16,11,"Benedictine (AZ)","Southern Utah",NA,"400991241"
34,1,"14:47",2087,"Brandon Better missed Layup.",16,11,"Benedictine (AZ)","Southern Utah",NA,"400991241"
35,1,"14:47",2087,"Carter Aby Defensive Rebound.",16,11,"Benedictine (AZ)","Southern Utah",NA,"400991241"
36,1,"14:37",2077,"Carter Aby made Three Point Jumper. Assisted by Richie Thornton V.",16,14,"Benedictine (AZ)","Southern Utah",NA,"400991241"
37,1,"14:24",2064,"Jamal Aytes made Layup. Assisted by Jamil Jackson.",18,14,"Benedictine (AZ)","Southern Utah",NA,"400991241"
38,1,"14:05",2045,"Carter Aby made Three Point Jumper. Assisted by Robert Kincade.",18,17,"Benedictine (AZ)","Southern Utah",NA,"400991241"
39,1,"13:21",2001,"Jamal Aytes Turnover.",18,17,"Benedictine (AZ)","Southern Utah",NA,"400991241"
40,1,"13:21",2001,"Carter Aby Steal.",18,17,"Benedictine (AZ)","Southern Utah",NA,"400991241"
41,1,"13:21",2001,"Kendrik Gannon made Jumper. Assisted by Robert Kincade.",18,19,"Benedictine (AZ)","Southern Utah",NA,"400991241"
42,1,"13:04",1984,"Foul on Carter Aby.",18,19,"Benedictine (AZ)","Southern Utah",NA,"400991241"
43,1,"13:04",1984,"Christian Musoko made Free Throw.",19,19,"Benedictine (AZ)","Southern Utah",NA,"400991241"
44,1,"13:04",1984,"Christian Musoko made Free Throw.",20,19,"Benedictine (AZ)","Southern Utah",NA,"400991241"
45,1,"12:50",1970,"Bryan Cervantes missed Three Point Jumper.",20,19,"Benedictine (AZ)","Southern Utah",NA,"400991241"
46,1,"12:50",1970,"Kendrik Gannon Offensive Rebound.",20,19,"Benedictine (AZ)","Southern Utah",NA,"400991241"
47,1,"12:35",1955,"Foul on James McGee.",20,19,"Benedictine (AZ)","Southern Utah",NA,"400991241"
48,1,"12:28",1948,"Robert Kincade made Three Point Jumper.",20,22,"Benedictine (AZ)","Southern Utah",NA,"400991241"
49,1,"12:23",1943,"Southern Utah  Timeout",20,22,"Benedictine (AZ)","Southern Utah",NA,"400991241"
50,1,"12:09",1929,"Jacob Calloway missed Jumper.",20,22,"Benedictine (AZ)","Southern Utah",NA,"400991241"
51,1,"12:09",1929,"Robert Kincade Defensive Rebound.",20,22,"Benedictine (AZ)","Southern Utah",NA,"400991241"
52,1,"12:05",1925,"Robert Kincade Turnover.",20,22,"Benedictine (AZ)","Southern Utah",NA,"400991241"
53,1,"11:59",1919,"Brandon Better Turnover.",20,22,"Benedictine (AZ)","Southern Utah",NA,"400991241"
54,1,"11:57",1917,"Joe Baldi Steal.",20,22,"Benedictine (AZ)","Southern Utah",NA,"400991241"
55,1,"11:36",1896,"Jalen Jordan made Jumper.",20,24,"Benedictine (AZ)","Southern Utah",NA,"400991241"
56,1,"11:13",1873,"Ivan Madunic Turnover.",20,24,"Benedictine (AZ)","Southern Utah",NA,"400991241"
57,1,"11:13",1873,"Joe Baldi missed Layup.",20,24,"Benedictine (AZ)","Southern Utah",NA,"400991241"
58,1,"11:13",1873,"Ivan Madunic Defensive Rebound.",20,24,"Benedictine (AZ)","Southern Utah",NA,"400991241"
59,1,"11:04",1864,"Foul on Bryan Cervantes.",20,24,"Benedictine (AZ)","Southern Utah",NA,"400991241"
60,1,"10:51",1851,"Dre Marin made Free Throw.",21,24,"Benedictine (AZ)","Southern Utah",NA,"400991241"
61,1,"10:51",1851,"Dre Marin made Free Throw.",22,24,"Benedictine (AZ)","Southern Utah",NA,"400991241"
62,1,"10:45",1845,"Bryan Cervantes made Three Point Jumper. Assisted by Joe Baldi.",22,27,"Benedictine (AZ)","Southern Utah",NA,"400991241"
63,1,"10:27",1827,"Jamal Aytes missed Layup.",22,27,"Benedictine (AZ)","Southern Utah",NA,"400991241"
64,1,"10:27",1827,"Bryan Cervantes Defensive Rebound.",22,27,"Benedictine (AZ)","Southern Utah",NA,"400991241"
65,1,"10:21",1821,"Jalen Jordan Turnover.",22,27,"Benedictine (AZ)","Southern Utah",NA,"400991241"
66,1,"9:53",1793,"James McGee missed Jumper.",22,27,"Benedictine (AZ)","Southern Utah",NA,"400991241"
67,1,"9:53",1793,"Jalen Jordan Defensive Rebound.",22,27,"Benedictine (AZ)","Southern Utah",NA,"400991241"
68,1,"9:36",1776,"Bryan Cervantes missed Three Point Jumper.",22,27,"Benedictine (AZ)","Southern Utah",NA,"400991241"
69,1,"9:36",1776,"Jamal Aytes Defensive Rebound.",22,27,"Benedictine (AZ)","Southern Utah",NA,"400991241"
70,1,"9:24",1764,"Brandon Better missed Three Point Jumper.",22,27,"Benedictine (AZ)","Southern Utah",NA,"400991241"
71,1,"9:24",1764,"Ivan Madunic Offensive Rebound.",22,27,"Benedictine (AZ)","Southern Utah",NA,"400991241"
72,1,"9:21",1761,"Ivan Madunic missed Layup.",22,27,"Benedictine (AZ)","Southern Utah",NA,"400991241"
73,1,"9:21",1761,"Jorge Cano Defensive Rebound.",22,27,"Benedictine (AZ)","Southern Utah",NA,"400991241"
74,1,"9:12",1752,"Foul on Ivan Madunic.",22,27,"Benedictine (AZ)","Southern Utah",NA,"400991241"
75,1,"9:12",1752,"Bryan Cervantes made Free Throw.",22,28,"Benedictine (AZ)","Southern Utah",NA,"400991241"
76,1,"9:12",1752,"Bryan Cervantes made Free Throw.",22,29,"Benedictine (AZ)","Southern Utah",NA,"400991241"
77,1,"8:59",1739,"Dre Marin Turnover.",22,29,"Benedictine (AZ)","Southern Utah",NA,"400991241"
78,1,"8:33",1713,"Kendrik Gannon missed Jumper.",22,29,"Benedictine (AZ)","Southern Utah",NA,"400991241"
79,1,"8:33",1713,"Jadon Cohee Defensive Rebound.",22,29,"Benedictine (AZ)","Southern Utah",NA,"400991241"
80,1,"8:19",1699,"Jadon Cohee missed Jumper.",22,29,"Benedictine (AZ)","Southern Utah",NA,"400991241"
81,1,"8:19",1699,"Southern Utah Offensive Rebound.",22,29,"Benedictine (AZ)","Southern Utah",NA,"400991241"
82,1,"8:08",1688,"Foul on Robert Kincade.",22,29,"Benedictine (AZ)","Southern Utah",NA,"400991241"
83,1,"8:08",1688,"Dre Marin made Jumper. Assisted by Matthew Johnson.",24,29,"Benedictine (AZ)","Southern Utah",NA,"400991241"
84,1,"8:04",1684,"Robert Kincade missed Layup.",24,29,"Benedictine (AZ)","Southern Utah",NA,"400991241"
85,1,"8:04",1684,"James McGee Defensive Rebound.",24,29,"Benedictine (AZ)","Southern Utah",NA,"400991241"
86,1,"7:57",1677,"Dre Marin made Layup.",26,29,"Benedictine (AZ)","Southern Utah",NA,"400991241"
87,1,"7:30",1650,"Robert Kincade missed Three Point Jumper.",26,29,"Benedictine (AZ)","Southern Utah",NA,"400991241"
88,1,"7:30",1650,"Jadon Cohee Defensive Rebound.",26,29,"Benedictine (AZ)","Southern Utah",NA,"400991241"
89,1,"7:20",1640,"Foul on Robert Kincade.",26,29,"Benedictine (AZ)","Southern Utah",NA,"400991241"
90,1,"7:20",1640,"Official TV Timeout",26,29,"Benedictine (AZ)","Southern Utah",NA,"400991241"
91,1,"7:20",1640,"Dre Marin made Free Throw.",27,29,"Benedictine (AZ)","Southern Utah",NA,"400991241"
92,1,"7:20",1640,"Dre Marin made Free Throw.",28,29,"Benedictine (AZ)","Southern Utah",NA,"400991241"
93,1,"7:07",1627,"Devin White missed Layup.",28,29,"Benedictine (AZ)","Southern Utah",NA,"400991241"
94,1,"7:07",1627,"James McGee Defensive Rebound.",28,29,"Benedictine (AZ)","Southern Utah",NA,"400991241"
95,1,"6:59",1619,"Dre Marin missed Three Point Jumper.",28,29,"Benedictine (AZ)","Southern Utah",NA,"400991241"
96,1,"6:59",1619,"Matthew Johnson Offensive Rebound.",28,29,"Benedictine (AZ)","Southern Utah",NA,"400991241"
97,1,"6:54",1614,"Christian Musoko missed Layup.",28,29,"Benedictine (AZ)","Southern Utah",NA,"400991241"
98,1,"6:54",1614,"Christian Musoko Offensive Rebound.",28,29,"Benedictine (AZ)","Southern Utah",NA,"400991241"
99,1,"6:51",1611,"Christian Musoko missed Layup.",28,29,"Benedictine (AZ)","Southern Utah",NA,"400991241"
100,1,"6:51",1611,"Devin White Block.",28,29,"Benedictine (AZ)","Southern Utah",NA,"400991241"
101,1,"6:51",1611,"Southern Utah Offensive Rebound.",28,29,"Benedictine (AZ)","Southern Utah",NA,"400991241"
102,1,"6:47",1607,"Foul on Devin White.",28,29,"Benedictine (AZ)","Southern Utah",NA,"400991241"
103,1,"6:47",1607,"Christian Musoko missed Free Throw.",28,29,"Benedictine (AZ)","Southern Utah",NA,"400991241"
104,1,"6:47",1607,"Southern Utah Deadball Team Rebound.",28,29,"Benedictine (AZ)","Southern Utah",NA,"400991241"
105,1,"6:47",1607,"Christian Musoko missed Free Throw.",28,29,"Benedictine (AZ)","Southern Utah",NA,"400991241"
106,1,"6:47",1607,"Southern Utah Deadball Team Rebound.",28,29,"Benedictine (AZ)","Southern Utah",NA,"400991241"
107,1,"6:47",1607,"Christian Musoko missed Jumper.",28,29,"Benedictine (AZ)","Southern Utah",NA,"400991241"
108,1,"6:47",1607,"Dre Marin Offensive Rebound.",28,29,"Benedictine (AZ)","Southern Utah",NA,"400991241"
109,1,"6:47",1607,"Jadon Cohee made Layup.",30,29,"Benedictine (AZ)","Southern Utah",NA,"400991241"
110,1,"6:24",1584,"Christian Harris missed Three Point Jumper.",30,29,"Benedictine (AZ)","Southern Utah",NA,"400991241"
111,1,"6:24",1584,"Brandon Dixon Offensive Rebound.",30,29,"Benedictine (AZ)","Southern Utah",NA,"400991241"
112,1,"6:21",1581,"Foul on Dre Marin.",30,29,"Benedictine (AZ)","Southern Utah",NA,"400991241"
113,1,"6:07",1567,"Jalen Jordan missed Layup.",30,29,"Benedictine (AZ)","Southern Utah",NA,"400991241"
114,1,"6:07",1567,"Jadon Cohee Block.",30,29,"Benedictine (AZ)","Southern Utah",NA,"400991241"
115,1,"6:07",1567,"Benedictine (AZ) Offensive Rebound.",30,29,"Benedictine (AZ)","Southern Utah",NA,"400991241"
116,1,"5:54",1554,"Foul on Jamal Aytes.",30,29,"Benedictine (AZ)","Southern Utah",NA,"400991241"
117,1,"5:51",1551,"Richie Thornton V missed Layup.",30,29,"Benedictine (AZ)","Southern Utah",NA,"400991241"
118,1,"5:51",1551,"Christian Musoko Block.",30,29,"Benedictine (AZ)","Southern Utah",NA,"400991241"
119,1,"5:51",1551,"Benedictine (AZ) Offensive Rebound.",30,29,"Benedictine (AZ)","Southern Utah",NA,"400991241"
120,1,"5:46",1546,"Brandon Dixon made Three Point Jumper. Assisted by Joe Baldi.",30,32,"Benedictine (AZ)","Southern Utah",NA,"400991241"
121,1,"5:26",1526,"Christian Musoko missed Jumper.",30,32,"Benedictine (AZ)","Southern Utah",NA,"400991241"
122,1,"5:26",1526,"Christian Musoko Offensive Rebound.",30,32,"Benedictine (AZ)","Southern Utah",NA,"400991241"
123,1,"5:23",1523,"Christian Musoko missed Jumper.",30,32,"Benedictine (AZ)","Southern Utah",NA,"400991241"
124,1,"5:23",1523,"Jamal Aytes Offensive Rebound.",30,32,"Benedictine (AZ)","Southern Utah",NA,"400991241"
125,1,"5:19",1519,"Jamal Aytes made Jumper.",32,32,"Benedictine (AZ)","Southern Utah",NA,"400991241"
126,1,"5:06",1506,"Joe Baldi Turnover.",32,32,"Benedictine (AZ)","Southern Utah",NA,"400991241"
127,1,"5:04",1504,"James McGee Steal.",32,32,"Benedictine (AZ)","Southern Utah",NA,"400991241"
128,1,"4:57",1497,"James McGee made Three Point Jumper. Assisted by Jadon Cohee.",35,32,"Benedictine (AZ)","Southern Utah",NA,"400991241"
129,1,"4:52",1492,"Benedictine (AZ)  Timeout",35,32,"Benedictine (AZ)","Southern Utah",NA,"400991241"
130,1,"4:50",1490,"Arsenio Morales missed Layup.",35,32,"Benedictine (AZ)","Southern Utah",NA,"400991241"
131,1,"4:50",1490,"Christian Musoko Block.",35,32,"Benedictine (AZ)","Southern Utah",NA,"400991241"
132,1,"4:50",1490,"Joe Baldi Offensive Rebound.",35,32,"Benedictine (AZ)","Southern Utah",NA,"400991241"
133,1,"4:50",1490,"Joe Baldi missed Three Point Jumper.",35,32,"Benedictine (AZ)","Southern Utah",NA,"400991241"
134,1,"4:50",1490,"Jamal Aytes Defensive Rebound.",35,32,"Benedictine (AZ)","Southern Utah",NA,"400991241"
135,1,"4:48",1488,"Christian Musoko Turnover.",35,32,"Benedictine (AZ)","Southern Utah",NA,"400991241"
136,1,"4:46",1486,"Foul on Christian Musoko.",35,32,"Benedictine (AZ)","Southern Utah",NA,"400991241"
137,1,"4:22",1462,"Jalen Jordan missed Layup.",35,32,"Benedictine (AZ)","Southern Utah",NA,"400991241"
138,1,"4:22",1462,"Jacob Calloway Defensive Rebound.",35,32,"Benedictine (AZ)","Southern Utah",NA,"400991241"
139,1,"4:12",1452,"Jacob Calloway Turnover.",35,32,"Benedictine (AZ)","Southern Utah",NA,"400991241"
140,1,"4:11",1451,"Brandon Dixon Steal.",35,32,"Benedictine (AZ)","Southern Utah",NA,"400991241"
141,1,"4:08",1448,"Richie Thornton V made Layup.",35,34,"Benedictine (AZ)","Southern Utah",NA,"400991241"
142,1,"3:55",1435,"Brandon Better missed Three Point Jumper.",35,34,"Benedictine (AZ)","Southern Utah",NA,"400991241"
143,1,"3:55",1435,"Arsenio Morales Defensive Rebound.",35,34,"Benedictine (AZ)","Southern Utah",NA,"400991241"
144,1,"3:46",1426,"Foul on Brandon Better.",35,34,"Benedictine (AZ)","Southern Utah",NA,"400991241"
145,1,"3:46",1426,"Official TV Timeout",35,34,"Benedictine (AZ)","Southern Utah",NA,"400991241"
146,1,"3:46",1426,"Joe Baldi made Free Throw.",35,35,"Benedictine (AZ)","Southern Utah",NA,"400991241"
147,1,"3:46",1426,"Joe Baldi missed Free Throw.",35,35,"Benedictine (AZ)","Southern Utah",NA,"400991241"
148,1,"3:46",1426,"Jamal Aytes Defensive Rebound.",35,35,"Benedictine (AZ)","Southern Utah",NA,"400991241"
149,1,"3:35",1415,"Jadon Cohee missed Three Point Jumper.",35,35,"Benedictine (AZ)","Southern Utah",NA,"400991241"
150,1,"3:35",1415,"Jalen Jordan Defensive Rebound.",35,35,"Benedictine (AZ)","Southern Utah",NA,"400991241"
151,1,"3:21",1401,"Jalen Jordan Turnover.",35,35,"Benedictine (AZ)","Southern Utah",NA,"400991241"
152,1,"3:19",1399,"Matthew Johnson Steal.",35,35,"Benedictine (AZ)","Southern Utah",NA,"400991241"
153,1,"3:13",1393,"Jamil Jackson missed Three Point Jumper.",35,35,"Benedictine (AZ)","Southern Utah",NA,"400991241"
154,1,"3:13",1393,"Brandon Dixon Defensive Rebound.",35,35,"Benedictine (AZ)","Southern Utah",NA,"400991241"
155,1,"2:55",1375,"Brandon Dixon Turnover.",35,35,"Benedictine (AZ)","Southern Utah",NA,"400991241"
156,1,"2:54",1374,"Jamal Aytes Steal.",35,35,"Benedictine (AZ)","Southern Utah",NA,"400991241"
157,1,"2:50",1370,"Dre Marin made Layup.",37,35,"Benedictine (AZ)","Southern Utah",NA,"400991241"
158,1,"2:03",1323,"Richie Thornton V Turnover.",37,35,"Benedictine (AZ)","Southern Utah",NA,"400991241"
159,1,"1:55",1315,"Foul on Joe Baldi.",37,35,"Benedictine (AZ)","Southern Utah",NA,"400991241"
160,1,"1:52",1312,"James McGee made Free Throw.",38,35,"Benedictine (AZ)","Southern Utah",NA,"400991241"
161,1,"1:52",1312,"James McGee made Free Throw.",39,35,"Benedictine (AZ)","Southern Utah",NA,"400991241"
162,1,"1:40",1300,"Bryan Cervantes Turnover.",39,35,"Benedictine (AZ)","Southern Utah",NA,"400991241"
163,1,"1:38",1298,"Jamil Jackson Steal.",39,35,"Benedictine (AZ)","Southern Utah",NA,"400991241"
164,1,"1:33",1293,"Jadon Cohee made Dunk. Assisted by Jamil Jackson.",41,35,"Benedictine (AZ)","Southern Utah",NA,"400991241"
165,1,"1:17",1277,"Foul on Jamil Jackson.",41,35,"Benedictine (AZ)","Southern Utah",NA,"400991241"
166,1,"1:17",1277,"Joe Baldi made Free Throw.",41,36,"Benedictine (AZ)","Southern Utah",NA,"400991241"
167,1,"1:17",1277,"Joe Baldi made Free Throw.",41,37,"Benedictine (AZ)","Southern Utah",NA,"400991241"
168,1,"1:15",1275,"Dre Marin made Layup.",43,37,"Benedictine (AZ)","Southern Utah",NA,"400991241"
169,1,"0:58",1258,"Richie Thornton V missed Jumper.",43,37,"Benedictine (AZ)","Southern Utah",NA,"400991241"
170,1,"0:58",1258,"James McGee Block.",43,37,"Benedictine (AZ)","Southern Utah",NA,"400991241"
171,1,"0:58",1258,"Kendrik Gannon Offensive Rebound.",43,37,"Benedictine (AZ)","Southern Utah",NA,"400991241"
172,1,"0:52",1252,"Richie Thornton V missed Layup.",43,37,"Benedictine (AZ)","Southern Utah",NA,"400991241"
173,1,"0:52",1252,"Ivan Madunic Block.",43,37,"Benedictine (AZ)","Southern Utah",NA,"400991241"
174,1,"0:52",1252,"Benedictine (AZ) Offensive Rebound.",43,37,"Benedictine (AZ)","Southern Utah",NA,"400991241"
175,1,"0:47",1247,"Jalen Jordan Turnover.",43,37,"Benedictine (AZ)","Southern Utah",NA,"400991241"
176,1,"0:47",1247,"Foul on Jalen Jordan.",43,37,"Benedictine (AZ)","Southern Utah",NA,"400991241"
177,1,"0:46",1246,"Jadon Cohee Turnover.",43,37,"Benedictine (AZ)","Southern Utah",NA,"400991241"
178,1,"0:44",1244,"Richie Thornton V Steal.",43,37,"Benedictine (AZ)","Southern Utah",NA,"400991241"
179,1,"0:40",1240,"Bryan Cervantes made Layup. Assisted by Richie Thornton V.",43,39,"Benedictine (AZ)","Southern Utah",NA,"400991241"
180,1,"0:04",1204,"Southern Utah  Turnover.",43,39,"Benedictine (AZ)","Southern Utah",NA,"400991241"
