"play_id","half","time_remaining_half","secs_remaining","description","home_score","away_score","away","home","home_favored_by","game_id"
1,1,"20:00",2400,"PLAY",0,0,"Southern Utah","Oregon State",24,"400988191"
2,1,"19:37",2377,"Drew Eubanks missed Jumper.",0,0,"Southern Utah","Oregon State",24,"400988191"
3,1,"19:37",2377,"Jadon Cohee Defensive Rebound.",0,0,"Southern Utah","Oregon State",24,"400988191"
4,1,"19:07",2347,"Jadon Cohee Turnover.",0,0,"Southern Utah","Oregon State",24,"400988191"
5,1,"19:06",2346,"Jaquori McLaughlin Steal.",0,0,"Southern Utah","Oregon State",24,"400988191"
6,1,"19:03",2343,"Tres Tinkle missed Layup.",0,0,"Southern Utah","Oregon State",24,"400988191"
7,1,"19:03",2343,"James McGee Defensive Rebound.",0,0,"Southern Utah","Oregon State",24,"400988191"
8,1,"18:54",2334,"James McGee missed Three Point Jumper.",0,0,"Southern Utah","Oregon State",24,"400988191"
9,1,"18:54",2334,"Southern Utah Offensive Rebound.",0,0,"Southern Utah","Oregon State",24,"400988191"
10,1,"18:49",2329,"Jamal Aytes Turnover.",0,0,"Southern Utah","Oregon State",24,"400988191"
11,1,"18:38",2318,"Foul on Christian Musoko.",0,0,"Southern Utah","Oregon State",24,"400988191"
12,1,"18:30",2310,"Tres Tinkle made Layup.",2,0,"Southern Utah","Oregon State",24,"400988191"
13,1,"18:16",2296,"Foul on Jacob Calloway.",2,0,"Southern Utah","Oregon State",24,"400988191"
14,1,"18:16",2296,"Jacob Calloway Turnover.",2,0,"Southern Utah","Oregon State",24,"400988191"
15,1,"17:57",2277,"Stephen Thompson Jr. made Layup.",4,0,"Southern Utah","Oregon State",24,"400988191"
16,1,"17:39",2259,"Foul on Jaquori McLaughlin.",4,0,"Southern Utah","Oregon State",24,"400988191"
17,1,"17:39",2259,"Jadon Cohee made Free Throw.",4,1,"Southern Utah","Oregon State",24,"400988191"
18,1,"17:39",2259,"Jadon Cohee made Free Throw.",4,2,"Southern Utah","Oregon State",24,"400988191"
19,1,"17:16",2236,"Stephen Thompson Jr. missed Three Point Jumper.",4,2,"Southern Utah","Oregon State",24,"400988191"
20,1,"17:16",2236,"Drew Eubanks Offensive Rebound.",4,2,"Southern Utah","Oregon State",24,"400988191"
21,1,"17:08",2228,"Drew Eubanks made Dunk. Assisted by Jaquori McLaughlin.",6,2,"Southern Utah","Oregon State",24,"400988191"
22,1,"16:50",2210,"James McGee missed Layup.",6,2,"Southern Utah","Oregon State",24,"400988191"
23,1,"16:50",2210,"Drew Eubanks Defensive Rebound.",6,2,"Southern Utah","Oregon State",24,"400988191"
24,1,"16:49",2209,"Foul on Jamal Aytes.",6,2,"Southern Utah","Oregon State",24,"400988191"
25,1,"16:30",2190,"Tres Tinkle missed Layup.",6,2,"Southern Utah","Oregon State",24,"400988191"
26,1,"16:30",2190,"Jacob Calloway Defensive Rebound.",6,2,"Southern Utah","Oregon State",24,"400988191"
27,1,"16:23",2183,"Foul on Drew Eubanks.",6,2,"Southern Utah","Oregon State",24,"400988191"
28,1,"16:23",2183,"Jacob Calloway made Free Throw.",6,3,"Southern Utah","Oregon State",24,"400988191"
29,1,"16:23",2183,"Jacob Calloway made Free Throw.",6,4,"Southern Utah","Oregon State",24,"400988191"
30,1,"16:03",2163,"Jaquori McLaughlin missed Three Point Jumper.",6,4,"Southern Utah","Oregon State",24,"400988191"
31,1,"16:03",2163,"Jamal Aytes Defensive Rebound.",6,4,"Southern Utah","Oregon State",24,"400988191"
32,1,"15:55",2155,"Jacob Calloway missed Three Point Jumper.",6,4,"Southern Utah","Oregon State",24,"400988191"
33,1,"15:55",2155,"Stephen Thompson Jr. Defensive Rebound.",6,4,"Southern Utah","Oregon State",24,"400988191"
34,1,"15:45",2145,"Tres Tinkle made Layup. Assisted by Stephen Thompson Jr..",8,4,"Southern Utah","Oregon State",24,"400988191"
35,1,"15:27",2127,"James McGee made Jumper. Assisted by Dre Marin.",8,6,"Southern Utah","Oregon State",24,"400988191"
36,1,"15:13",2113,"Official TV Timeout",8,6,"Southern Utah","Oregon State",24,"400988191"
37,1,"15:00",2100,"Ethan Thompson made Layup.",10,6,"Southern Utah","Oregon State",24,"400988191"
38,1,"14:38",2078,"Jamal Aytes made Layup.",10,8,"Southern Utah","Oregon State",24,"400988191"
39,1,"14:21",2061,"Drew Eubanks Turnover.",10,8,"Southern Utah","Oregon State",24,"400988191"
40,1,"14:19",2059,"Jamal Aytes Steal.",10,8,"Southern Utah","Oregon State",24,"400988191"
41,1,"14:16",2056,"Jadon Cohee missed Layup.",10,8,"Southern Utah","Oregon State",24,"400988191"
42,1,"14:16",2056,"Jaquori McLaughlin Defensive Rebound.",10,8,"Southern Utah","Oregon State",24,"400988191"
43,1,"14:09",2049,"Tres Tinkle made Dunk.",12,8,"Southern Utah","Oregon State",24,"400988191"
44,1,"13:47",2027,"Jamal Aytes missed Jumper.",12,8,"Southern Utah","Oregon State",24,"400988191"
45,1,"13:47",2027,"Tres Tinkle Defensive Rebound.",12,8,"Southern Utah","Oregon State",24,"400988191"
46,1,"13:33",2013,"Ethan Thompson made Jumper.",14,8,"Southern Utah","Oregon State",24,"400988191"
47,1,"13:33",2013,"Foul on Jacob Calloway.",14,8,"Southern Utah","Oregon State",24,"400988191"
48,1,"13:33",2013,"Ethan Thompson missed Free Throw.",14,8,"Southern Utah","Oregon State",24,"400988191"
49,1,"13:33",2013,"Christian Musoko Defensive Rebound.",14,8,"Southern Utah","Oregon State",24,"400988191"
50,1,"13:21",2001,"Jadon Cohee Turnover.",14,8,"Southern Utah","Oregon State",24,"400988191"
51,1,"13:21",2001,"Stephen Thompson Jr. Steal.",14,8,"Southern Utah","Oregon State",24,"400988191"
52,1,"13:07",1987,"Ethan Thompson missed Three Point Jumper.",14,8,"Southern Utah","Oregon State",24,"400988191"
53,1,"13:07",1987,"Christian Musoko Defensive Rebound.",14,8,"Southern Utah","Oregon State",24,"400988191"
54,1,"13:04",1984,"Foul on Seth Berger.",14,8,"Southern Utah","Oregon State",24,"400988191"
55,1,"12:50",1970,"Jamil Jackson missed Jumper.",14,8,"Southern Utah","Oregon State",24,"400988191"
56,1,"12:50",1970,"Ethan Thompson Defensive Rebound.",14,8,"Southern Utah","Oregon State",24,"400988191"
57,1,"12:41",1961,"Foul on Dre Marin.",14,8,"Southern Utah","Oregon State",24,"400988191"
58,1,"12:41",1961,"Ethan Thompson missed Free Throw.",14,8,"Southern Utah","Oregon State",24,"400988191"
59,1,"12:41",1961,"Oregon State Deadball Team Rebound.",14,8,"Southern Utah","Oregon State",24,"400988191"
60,1,"12:41",1961,"Ethan Thompson missed Free Throw.",14,8,"Southern Utah","Oregon State",24,"400988191"
61,1,"12:41",1961,"Christian Musoko Defensive Rebound.",14,8,"Southern Utah","Oregon State",24,"400988191"
62,1,"12:25",1945,"Foul on Seth Berger.",14,8,"Southern Utah","Oregon State",24,"400988191"
63,1,"12:19",1939,"Jadon Cohee missed Three Point Jumper.",14,8,"Southern Utah","Oregon State",24,"400988191"
64,1,"12:19",1939,"Seth Berger Defensive Rebound.",14,8,"Southern Utah","Oregon State",24,"400988191"
65,1,"12:16",1936,"Foul on Jamil Jackson.",14,8,"Southern Utah","Oregon State",24,"400988191"
66,1,"12:04",1924,"Foul on Seth Berger.",14,8,"Southern Utah","Oregon State",24,"400988191"
67,1,"12:04",1924,"Seth Berger Turnover.",14,8,"Southern Utah","Oregon State",24,"400988191"
68,1,"11:54",1914,"Brandon Better missed Three Point Jumper.",14,8,"Southern Utah","Oregon State",24,"400988191"
69,1,"11:54",1914,"Drew Eubanks Defensive Rebound.",14,8,"Southern Utah","Oregon State",24,"400988191"
70,1,"11:45",1905,"Foul on Alfred Hollins.",14,8,"Southern Utah","Oregon State",24,"400988191"
71,1,"11:45",1905,"Technical Foul on Oregon State.",14,8,"Southern Utah","Oregon State",24,"400988191"
72,1,"11:45",1905,"Official TV Timeout",14,8,"Southern Utah","Oregon State",24,"400988191"
73,1,"11:45",1905,"James McGee made Free Throw.",14,10,"Southern Utah","Oregon State",24,"400988191"
74,1,"11:45",1905,"Official TV Timeout",14,8,"Southern Utah","Oregon State",24,"400988191"
75,1,"11:45",1905,"James McGee made Free Throw.",14,9,"Southern Utah","Oregon State",24,"400988191"
76,1,"11:33",1893,"Brandon Better Turnover.",14,10,"Southern Utah","Oregon State",24,"400988191"
77,1,"11:32",1892,"Zach Reichle Steal.",14,10,"Southern Utah","Oregon State",24,"400988191"
78,1,"11:24",1884,"Stephen Thompson Jr. missed Layup.",14,10,"Southern Utah","Oregon State",24,"400988191"
79,1,"11:24",1884,"Oregon State Offensive Rebound.",14,10,"Southern Utah","Oregon State",24,"400988191"
80,1,"11:23",1883,"Foul on Jamal Aytes.",14,10,"Southern Utah","Oregon State",24,"400988191"
81,1,"11:23",1883,"Drew Eubanks made Free Throw.",15,10,"Southern Utah","Oregon State",24,"400988191"
82,1,"11:23",1883,"Drew Eubanks made Free Throw.",16,10,"Southern Utah","Oregon State",24,"400988191"
83,1,"11:06",1866,"Dre Marin Turnover.",16,10,"Southern Utah","Oregon State",24,"400988191"
84,1,"10:54",1854,"Zach Reichle Turnover.",16,10,"Southern Utah","Oregon State",24,"400988191"
85,1,"10:52",1852,"Jamil Jackson Steal.",16,10,"Southern Utah","Oregon State",24,"400988191"
86,1,"10:49",1849,"Jadon Cohee Turnover.",16,10,"Southern Utah","Oregon State",24,"400988191"
87,1,"10:36",1836,"Kendal Manuel made Layup.",18,10,"Southern Utah","Oregon State",24,"400988191"
88,1,"10:34",1834,"Technical Foul on Christian Musoko.",18,10,"Southern Utah","Oregon State",24,"400988191"
89,1,"10:34",1834,"Technical Foul on Drew Eubanks.",18,10,"Southern Utah","Oregon State",24,"400988191"
90,1,"10:21",1821,"Foul on Zach Reichle.",18,10,"Southern Utah","Oregon State",24,"400988191"
91,1,"10:21",1821,"Jadon Cohee made Free Throw.",18,11,"Southern Utah","Oregon State",24,"400988191"
92,1,"10:21",1821,"Jadon Cohee made Free Throw.",18,12,"Southern Utah","Oregon State",24,"400988191"
93,1,"10:07",1807,"Foul on Joel Swallow.",18,12,"Southern Utah","Oregon State",24,"400988191"
94,1,"10:07",1807,"Drew Eubanks made Free Throw.",19,12,"Southern Utah","Oregon State",24,"400988191"
95,1,"10:07",1807,"Drew Eubanks made Free Throw.",20,12,"Southern Utah","Oregon State",24,"400988191"
96,1,"9:55",1795,"James McGee missed Three Point Jumper.",20,12,"Southern Utah","Oregon State",24,"400988191"
97,1,"9:55",1795,"Drew Eubanks Defensive Rebound.",20,12,"Southern Utah","Oregon State",24,"400988191"
98,1,"9:44",1784,"Drew Eubanks missed Layup.",20,12,"Southern Utah","Oregon State",24,"400988191"
99,1,"9:44",1784,"Joel Swallow Defensive Rebound.",20,12,"Southern Utah","Oregon State",24,"400988191"
100,1,"9:36",1776,"Jadon Cohee missed Layup.",20,12,"Southern Utah","Oregon State",24,"400988191"
101,1,"9:36",1776,"Ethan Thompson Block.",20,12,"Southern Utah","Oregon State",24,"400988191"
102,1,"9:35",1775,"Kendal Manuel Defensive Rebound.",20,12,"Southern Utah","Oregon State",24,"400988191"
103,1,"9:31",1771,"Jaquori McLaughlin made Layup.",22,12,"Southern Utah","Oregon State",24,"400988191"
104,1,"9:10",1750,"Jadon Cohee made Layup.",22,14,"Southern Utah","Oregon State",24,"400988191"
105,1,"8:57",1737,"Tres Tinkle missed Three Point Jumper.",22,14,"Southern Utah","Oregon State",24,"400988191"
106,1,"8:57",1737,"Drew Eubanks Offensive Rebound.",22,14,"Southern Utah","Oregon State",24,"400988191"
107,1,"8:38",1718,"Kendal Manuel made Three Point Jumper. Assisted by Jaquori McLaughlin.",25,14,"Southern Utah","Oregon State",24,"400988191"
108,1,"8:13",1693,"Jadon Cohee missed Jumper.",25,14,"Southern Utah","Oregon State",24,"400988191"
109,1,"8:13",1693,"Drew Eubanks Defensive Rebound.",25,14,"Southern Utah","Oregon State",24,"400988191"
110,1,"7:59",1679,"Kendal Manuel missed Three Point Jumper.",25,14,"Southern Utah","Oregon State",24,"400988191"
111,1,"7:59",1679,"Jadon Cohee Defensive Rebound.",25,14,"Southern Utah","Oregon State",24,"400988191"
112,1,"7:40",1660,"Jamil Jackson made Layup.",25,16,"Southern Utah","Oregon State",24,"400988191"
113,1,"7:21",1641,"Drew Eubanks made Layup. Assisted by Tres Tinkle.",27,16,"Southern Utah","Oregon State",24,"400988191"
114,1,"7:21",1641,"Foul on Jamil Jackson.",27,16,"Southern Utah","Oregon State",24,"400988191"
115,1,"7:21",1641,"Official TV Timeout",27,16,"Southern Utah","Oregon State",24,"400988191"
116,1,"7:21",1641,"Drew Eubanks made Free Throw.",28,16,"Southern Utah","Oregon State",24,"400988191"
117,1,"7:06",1626,"Foul on Brandon Better.",28,16,"Southern Utah","Oregon State",24,"400988191"
118,1,"7:06",1626,"Brandon Better Turnover.",28,16,"Southern Utah","Oregon State",24,"400988191"
119,1,"6:41",1601,"Jaquori McLaughlin missed Three Point Jumper.",28,16,"Southern Utah","Oregon State",24,"400988191"
120,1,"6:41",1601,"Jamil Jackson Defensive Rebound.",28,16,"Southern Utah","Oregon State",24,"400988191"
121,1,"6:27",1587,"Jadon Cohee made Layup.",28,18,"Southern Utah","Oregon State",24,"400988191"
122,1,"6:08",1568,"Ethan Thompson made Three Point Jumper. Assisted by Jaquori McLaughlin.",31,18,"Southern Utah","Oregon State",24,"400988191"
123,1,"5:39",1539,"Jamal Aytes missed Layup.",31,18,"Southern Utah","Oregon State",24,"400988191"
124,1,"5:39",1539,"Tres Tinkle Defensive Rebound.",31,18,"Southern Utah","Oregon State",24,"400988191"
125,1,"5:23",1523,"Foul on Jamal Aytes.",31,18,"Southern Utah","Oregon State",24,"400988191"
126,1,"5:23",1523,"Ethan Thompson made Free Throw.",32,18,"Southern Utah","Oregon State",24,"400988191"
127,1,"5:23",1523,"Ethan Thompson made Free Throw.",33,18,"Southern Utah","Oregon State",24,"400988191"
128,1,"5:04",1504,"Brandon Better missed Layup.",33,18,"Southern Utah","Oregon State",24,"400988191"
129,1,"5:04",1504,"Jacob Calloway Offensive Rebound.",33,18,"Southern Utah","Oregon State",24,"400988191"
130,1,"5:01",1501,"Jacob Calloway missed Layup.",33,18,"Southern Utah","Oregon State",24,"400988191"
131,1,"5:01",1501,"Drew Eubanks Block.",33,18,"Southern Utah","Oregon State",24,"400988191"
132,1,"5:01",1501,"Christian Musoko Offensive Rebound.",33,18,"Southern Utah","Oregon State",24,"400988191"
133,1,"4:58",1498,"Foul on Jaquori McLaughlin.",33,18,"Southern Utah","Oregon State",24,"400988191"
134,1,"4:58",1498,"Christian Musoko made Free Throw.",33,19,"Southern Utah","Oregon State",24,"400988191"
135,1,"4:58",1498,"Christian Musoko missed Free Throw.",33,19,"Southern Utah","Oregon State",24,"400988191"
136,1,"4:58",1498,"Tres Tinkle Defensive Rebound.",33,19,"Southern Utah","Oregon State",24,"400988191"
137,1,"4:39",1479,"Jaquori McLaughlin made Layup.",35,19,"Southern Utah","Oregon State",24,"400988191"
138,1,"4:18",1458,"Brandon Better made Three Point Jumper. Assisted by James McGee.",35,22,"Southern Utah","Oregon State",24,"400988191"
139,1,"4:01",1441,"Tres Tinkle made Three Point Jumper. Assisted by Jaquori McLaughlin.",38,22,"Southern Utah","Oregon State",24,"400988191"
140,1,"3:45",1425,"James McGee made Three Point Jumper. Assisted by Jadon Cohee.",38,25,"Southern Utah","Oregon State",24,"400988191"
141,1,"3:21",1401,"Foul on Christian Musoko.",38,25,"Southern Utah","Oregon State",24,"400988191"
142,1,"3:21",1401,"Official TV Timeout",38,25,"Southern Utah","Oregon State",24,"400988191"
143,1,"3:21",1401,"Tres Tinkle made Free Throw.",39,25,"Southern Utah","Oregon State",24,"400988191"
144,1,"3:21",1401,"Tres Tinkle made Free Throw.",40,25,"Southern Utah","Oregon State",24,"400988191"
145,1,"2:58",1378,"Joel Swallow missed Layup.",40,25,"Southern Utah","Oregon State",24,"400988191"
146,1,"2:58",1378,"Ethan Thompson Block.",40,25,"Southern Utah","Oregon State",24,"400988191"
147,1,"2:58",1378,"Joel Swallow Offensive Rebound.",40,25,"Southern Utah","Oregon State",24,"400988191"
148,1,"2:58",1378,"Joel Swallow missed Layup.",40,25,"Southern Utah","Oregon State",24,"400988191"
149,1,"2:58",1378,"Ethan Thompson Block.",40,25,"Southern Utah","Oregon State",24,"400988191"
150,1,"2:58",1378,"Southern Utah Offensive Rebound.",40,25,"Southern Utah","Oregon State",24,"400988191"
151,1,"2:57",1377,"Jamil Jackson made Dunk. Assisted by Dre Marin.",40,27,"Southern Utah","Oregon State",24,"400988191"
152,1,"2:40",1360,"Ethan Thompson made Layup. Assisted by Kendal Manuel.",42,27,"Southern Utah","Oregon State",24,"400988191"
153,1,"2:39",1359,"Oregon State  Timeout",42,27,"Southern Utah","Oregon State",24,"400988191"
154,1,"2:23",1343,"Jadon Cohee missed Layup.",42,27,"Southern Utah","Oregon State",24,"400988191"
155,1,"2:23",1343,"Jaquori McLaughlin Block.",42,27,"Southern Utah","Oregon State",24,"400988191"
156,1,"2:20",1340,"Jaquori McLaughlin Defensive Rebound.",42,27,"Southern Utah","Oregon State",24,"400988191"
157,1,"2:18",1338,"Foul on Dre Marin.",42,27,"Southern Utah","Oregon State",24,"400988191"
158,1,"2:18",1338,"Kendal Manuel made Free Throw.",43,27,"Southern Utah","Oregon State",24,"400988191"
159,1,"2:18",1338,"Kendal Manuel made Free Throw.",44,27,"Southern Utah","Oregon State",24,"400988191"
160,1,"2:00",1320,"Jadon Cohee Turnover.",44,27,"Southern Utah","Oregon State",24,"400988191"
161,1,"1:59",1319,"Ethan Thompson Steal.",44,27,"Southern Utah","Oregon State",24,"400988191"
162,1,"1:57",1317,"Alfred Hollins made Layup. Assisted by Ethan Thompson.",46,27,"Southern Utah","Oregon State",24,"400988191"
163,1,"1:36",1296,"Foul on Jaquori McLaughlin.",46,27,"Southern Utah","Oregon State",24,"400988191"
164,1,"1:36",1296,"Jadon Cohee missed Free Throw.",46,27,"Southern Utah","Oregon State",24,"400988191"
165,1,"1:36",1296,"Southern Utah Deadball Team Rebound.",46,27,"Southern Utah","Oregon State",24,"400988191"
166,1,"1:36",1296,"Jadon Cohee missed Free Throw.",46,27,"Southern Utah","Oregon State",24,"400988191"
167,1,"1:36",1296,"Kendal Manuel Defensive Rebound.",46,27,"Southern Utah","Oregon State",24,"400988191"
168,1,"1:29",1289,"Alfred Hollins missed Three Point Jumper.",46,27,"Southern Utah","Oregon State",24,"400988191"
169,1,"1:29",1289,"James McGee Defensive Rebound.",46,27,"Southern Utah","Oregon State",24,"400988191"
170,1,"1:14",1274,"Jamil Jackson missed Jumper.",46,27,"Southern Utah","Oregon State",24,"400988191"
171,1,"1:14",1274,"Kendal Manuel Defensive Rebound.",46,27,"Southern Utah","Oregon State",24,"400988191"
172,1,"1:03",1263,"Stephen Thompson Jr. missed Layup.",46,27,"Southern Utah","Oregon State",24,"400988191"
173,1,"1:03",1263,"Joel Swallow Defensive Rebound.",46,27,"Southern Utah","Oregon State",24,"400988191"
174,1,"0:54",1254,"Foul on Kendal Manuel.",46,27,"Southern Utah","Oregon State",24,"400988191"
175,1,"0:54",1254,"Jadon Cohee missed Free Throw.",46,27,"Southern Utah","Oregon State",24,"400988191"
176,1,"0:54",1254,"Southern Utah Deadball Team Rebound.",46,27,"Southern Utah","Oregon State",24,"400988191"
177,1,"0:54",1254,"Jadon Cohee made Free Throw.",46,28,"Southern Utah","Oregon State",24,"400988191"
178,1,"0:44",1244,"Foul on Tres Tinkle.",46,28,"Southern Utah","Oregon State",24,"400988191"
179,1,"0:44",1244,"Tres Tinkle Turnover.",46,28,"Southern Utah","Oregon State",24,"400988191"
180,1,"0:44",1244,"Southern Utah  Timeout",46,28,"Southern Utah","Oregon State",24,"400988191"
181,1,"0:20",1220,"Jadon Cohee missed Layup.",46,28,"Southern Utah","Oregon State",24,"400988191"
182,1,"0:20",1220,"Stephen Thompson Jr. Block.",46,28,"Southern Utah","Oregon State",24,"400988191"
183,1,"0:19",1219,"Tres Tinkle Defensive Rebound.",46,28,"Southern Utah","Oregon State",24,"400988191"
184,1,"0:14",1214,"Alfred Hollins made Layup. Assisted by Ethan Thompson.",48,28,"Southern Utah","Oregon State",24,"400988191"
185,1,"0:05",1205,"James McGee missed Three Point Jumper.",48,28,"Southern Utah","Oregon State",24,"400988191"
186,1,"0:05",1205,"Tres Tinkle Defensive Rebound.",48,28,"Southern Utah","Oregon State",24,"400988191"
187,1,"0:01",1201,"Tres Tinkle made Three Point Jumper.",51,28,"Southern Utah","Oregon State",24,"400988191"
188,1,"0:00",1200,"End of 1st half",51,28,"Southern Utah","Oregon State",24,"400988191"
189,2,"20:00",1200,"PLAY",51,28,"Southern Utah","Oregon State",24,"400988191"
190,2,"19:53",1193,"Jadon Cohee missed Three Point Jumper.",51,28,"Southern Utah","Oregon State",24,"400988191"
191,2,"19:53",1193,"Kendal Manuel Defensive Rebound.",51,28,"Southern Utah","Oregon State",24,"400988191"
192,2,"19:46",1186,"Stephen Thompson Jr. Turnover.",51,28,"Southern Utah","Oregon State",24,"400988191"
193,2,"19:17",1157,"Jadon Cohee missed Jumper.",51,28,"Southern Utah","Oregon State",24,"400988191"
194,2,"19:17",1157,"Kendal Manuel Defensive Rebound.",51,28,"Southern Utah","Oregon State",24,"400988191"
195,2,"19:04",1144,"Foul on Drew Eubanks.",51,28,"Southern Utah","Oregon State",24,"400988191"
196,2,"19:04",1144,"Drew Eubanks Turnover.",51,28,"Southern Utah","Oregon State",24,"400988191"
197,2,"18:53",1133,"Dre Marin Turnover.",51,28,"Southern Utah","Oregon State",24,"400988191"
198,2,"18:40",1120,"Ethan Thompson missed Jumper.",51,28,"Southern Utah","Oregon State",24,"400988191"
199,2,"18:40",1120,"Oregon State Offensive Rebound.",51,28,"Southern Utah","Oregon State",24,"400988191"
200,2,"18:39",1119,"Foul on Jamal Aytes.",51,28,"Southern Utah","Oregon State",24,"400988191"
201,2,"18:33",1113,"Foul on Brandon Better.",51,28,"Southern Utah","Oregon State",24,"400988191"
202,2,"18:33",1113,"Drew Eubanks made Free Throw.",52,28,"Southern Utah","Oregon State",24,"400988191"
203,2,"18:33",1113,"Drew Eubanks made Free Throw.",53,28,"Southern Utah","Oregon State",24,"400988191"
204,2,"18:21",1101,"Foul on Stephen Thompson Jr..",53,28,"Southern Utah","Oregon State",24,"400988191"
205,2,"18:21",1101,"James McGee missed Free Throw.",53,28,"Southern Utah","Oregon State",24,"400988191"
206,2,"18:21",1101,"Southern Utah Deadball Team Rebound.",53,28,"Southern Utah","Oregon State",24,"400988191"
207,2,"18:21",1101,"James McGee made Free Throw.",53,29,"Southern Utah","Oregon State",24,"400988191"
208,2,"18:09",1089,"Tres Tinkle made Layup.",55,29,"Southern Utah","Oregon State",24,"400988191"
209,2,"18:09",1089,"Foul on Christian Musoko.",55,29,"Southern Utah","Oregon State",24,"400988191"
210,2,"18:09",1089,"Tres Tinkle made Free Throw.",56,29,"Southern Utah","Oregon State",24,"400988191"
211,2,"17:55",1075,"Jadon Cohee made Layup.",56,31,"Southern Utah","Oregon State",24,"400988191"
212,2,"17:29",1049,"Drew Eubanks made Dunk. Assisted by Ethan Thompson.",58,31,"Southern Utah","Oregon State",24,"400988191"
213,2,"17:11",1031,"Foul on Drew Eubanks.",58,31,"Southern Utah","Oregon State",24,"400988191"
214,2,"17:11",1031,"Jacob Calloway missed Free Throw.",58,31,"Southern Utah","Oregon State",24,"400988191"
215,2,"17:11",1031,"Southern Utah Deadball Team Rebound.",58,31,"Southern Utah","Oregon State",24,"400988191"
216,2,"17:11",1031,"Jacob Calloway made Free Throw.",58,32,"Southern Utah","Oregon State",24,"400988191"
217,2,"16:56",1016,"Foul on Brandon Better.",58,32,"Southern Utah","Oregon State",24,"400988191"
218,2,"16:56",1016,"Kendal Manuel missed Free Throw.",58,32,"Southern Utah","Oregon State",24,"400988191"
219,2,"16:56",1016,"Oregon State Deadball Team Rebound.",58,32,"Southern Utah","Oregon State",24,"400988191"
220,2,"16:56",1016,"Kendal Manuel missed Free Throw.",58,32,"Southern Utah","Oregon State",24,"400988191"
221,2,"16:56",1016,"Jacob Calloway Defensive Rebound.",58,32,"Southern Utah","Oregon State",24,"400988191"
222,2,"16:40",1000,"Jacob Calloway missed Layup.",58,32,"Southern Utah","Oregon State",24,"400988191"
223,2,"16:40",1000,"Tres Tinkle Defensive Rebound.",58,32,"Southern Utah","Oregon State",24,"400988191"
224,2,"16:39",999,"Foul on Brandon Better.",58,32,"Southern Utah","Oregon State",24,"400988191"
225,2,"16:36",996,"Seth Berger missed Layup.",58,32,"Southern Utah","Oregon State",24,"400988191"
226,2,"16:36",996,"Jacob Calloway Defensive Rebound.",58,32,"Southern Utah","Oregon State",24,"400988191"
227,2,"16:12",972,"Jacob Calloway made Three Point Jumper. Assisted by Jadon Cohee.",58,35,"Southern Utah","Oregon State",24,"400988191"
228,2,"15:58",958,"Stephen Thompson Jr. Turnover.",58,35,"Southern Utah","Oregon State",24,"400988191"
229,2,"15:56",956,"James McGee Steal.",58,35,"Southern Utah","Oregon State",24,"400988191"
230,2,"15:51",951,"Jamil Jackson missed Layup.",58,35,"Southern Utah","Oregon State",24,"400988191"
231,2,"15:51",951,"Seth Berger Block.",58,35,"Southern Utah","Oregon State",24,"400988191"
232,2,"15:49",949,"Jaquori McLaughlin Defensive Rebound.",58,35,"Southern Utah","Oregon State",24,"400988191"
233,2,"15:42",942,"Seth Berger made Layup. Assisted by Tres Tinkle.",60,35,"Southern Utah","Oregon State",24,"400988191"
234,2,"15:26",926,"Jacob Calloway made Layup.",60,37,"Southern Utah","Oregon State",24,"400988191"
235,2,"15:26",926,"Foul on Seth Berger.",60,37,"Southern Utah","Oregon State",24,"400988191"
236,2,"15:26",926,"Official TV Timeout",60,37,"Southern Utah","Oregon State",24,"400988191"
237,2,"15:26",926,"Jacob Calloway made Free Throw.",60,38,"Southern Utah","Oregon State",24,"400988191"
238,2,"15:10",910,"Jaquori McLaughlin missed Layup.",60,38,"Southern Utah","Oregon State",24,"400988191"
239,2,"15:10",910,"Alfred Hollins Offensive Rebound.",60,38,"Southern Utah","Oregon State",24,"400988191"
240,2,"15:07",907,"Alfred Hollins missed Two Point Tip Shot.",60,38,"Southern Utah","Oregon State",24,"400988191"
241,2,"15:07",907,"Dre Marin Defensive Rebound.",60,38,"Southern Utah","Oregon State",24,"400988191"
242,2,"14:59",899,"Jacob Calloway made Layup.",60,40,"Southern Utah","Oregon State",24,"400988191"
243,2,"14:43",883,"Stephen Thompson Jr. made Layup.",62,40,"Southern Utah","Oregon State",24,"400988191"
244,2,"14:28",868,"Jacob Calloway missed Three Point Jumper.",62,40,"Southern Utah","Oregon State",24,"400988191"
245,2,"14:28",868,"Dre Marin Offensive Rebound.",62,40,"Southern Utah","Oregon State",24,"400988191"
246,2,"14:22",862,"Dre Marin missed Layup.",62,40,"Southern Utah","Oregon State",24,"400988191"
247,2,"14:22",862,"Ethan Thompson Defensive Rebound.",62,40,"Southern Utah","Oregon State",24,"400988191"
248,2,"14:14",854,"Foul on Jadon Cohee.",62,40,"Southern Utah","Oregon State",24,"400988191"
249,2,"14:14",854,"Tres Tinkle made Free Throw.",63,40,"Southern Utah","Oregon State",24,"400988191"
250,2,"14:14",854,"Tres Tinkle made Free Throw.",64,40,"Southern Utah","Oregon State",24,"400988191"
251,2,"14:02",842,"James McGee Turnover.",64,40,"Southern Utah","Oregon State",24,"400988191"
252,2,"14:01",841,"Ethan Thompson Steal.",64,40,"Southern Utah","Oregon State",24,"400988191"
