"play_id","half","time_remaining_half","secs_remaining","description","home_score","away_score","away","home","home_favored_by","game_id"
175,1,"0:42",1242,"Kameron Edwards Defensive Rebound.",29,33,"Southern Utah","Pepperdine",7,"400986957"
176,1,"0:34",1234,"Colbey Ross missed Jumper.",29,33,"Southern Utah","Pepperdine",7,"400986957"
177,1,"0:34",1234,"James McGee Defensive Rebound.",29,33,"Southern Utah","Pepperdine",7,"400986957"
178,1,"0:04",1204,"Foul on Colbey Ross.",29,33,"Southern Utah","Pepperdine",7,"400986957"
179,1,"0:04",1204,"Jadon Cohee made Free Throw.",29,34,"Southern Utah","Pepperdine",7,"400986957"
180,1,"0:04",1204,"Pepperdine  Timeout",29,34,"Southern Utah","Pepperdine",7,"400986957"
181,1,"0:04",1204,"Jadon Cohee made Free Throw.",29,35,"Southern Utah","Pepperdine",7,"400986957"
182,1,"0:00",1200,"Jade' Smith missed Three Point Jumper.",29,35,"Southern Utah","Pepperdine",7,"400986957"
183,1,"0:00",1200,"Southern Utah Defensive Rebound.",29,35,"Southern Utah","Pepperdine",7,"400986957"
184,1,"0:00",1200,"End of 1st half",29,35,"Southern Utah","Pepperdine",7,"400986957"
185,2,"20:00",1200,"PLAY",29,35,"Southern Utah","Pepperdine",7,"400986957"
186,2,"19:48",1188,"Trae Berhow made Three Point Jumper. Assisted by Kameron Edwards.",32,35,"Southern Utah","Pepperdine",7,"400986957"
187,2,"19:27",1167,"Jacob Calloway made Three Point Jumper. Assisted by Jadon Cohee.",32,38,"Southern Utah","Pepperdine",7,"400986957"
188,2,"19:01",1141,"Trae Berhow Turnover.",32,38,"Southern Utah","Pepperdine",7,"400986957"
189,2,"19:00",1140,"Dre Marin Steal.",32,38,"Southern Utah","Pepperdine",7,"400986957"
190,2,"18:47",1127,"James McGee made Three Point Jumper. Assisted by Jamal Aytes.",32,41,"Southern Utah","Pepperdine",7,"400986957"
191,2,"18:33",1113,"Colbey Ross Turnover.",32,41,"Southern Utah","Pepperdine",7,"400986957"
192,2,"18:32",1112,"Jamal Aytes Steal.",32,41,"Southern Utah","Pepperdine",7,"400986957"
193,2,"18:29",1109,"Jamal Aytes made Layup.",32,43,"Southern Utah","Pepperdine",7,"400986957"
194,2,"17:56",1076,"Amadi Udenyi made Layup.",34,43,"Southern Utah","Pepperdine",7,"400986957"
195,2,"17:30",1050,"James McGee made Three Point Jumper. Assisted by Dre Marin.",34,46,"Southern Utah","Pepperdine",7,"400986957"
196,2,"17:14",1034,"Trae Berhow made Three Point Jumper. Assisted by Colbey Ross.",37,46,"Southern Utah","Pepperdine",7,"400986957"
197,2,"16:59",1019,"Dre Marin missed Layup.",37,46,"Southern Utah","Pepperdine",7,"400986957"
198,2,"16:59",1019,"Kameron Edwards Defensive Rebound.",37,46,"Southern Utah","Pepperdine",7,"400986957"
199,2,"16:52",1012,"Nolan Taylor made Layup. Assisted by Colbey Ross.",39,46,"Southern Utah","Pepperdine",7,"400986957"
200,2,"16:38",998,"Matthew Johnson missed Three Point Jumper.",39,46,"Southern Utah","Pepperdine",7,"400986957"
201,2,"16:38",998,"Nolan Taylor Defensive Rebound.",39,46,"Southern Utah","Pepperdine",7,"400986957"
202,2,"16:27",987,"Kameron Edwards made Dunk. Assisted by Colbey Ross.",41,46,"Southern Utah","Pepperdine",7,"400986957"
203,2,"15:57",957,"Foul on Colbey Ross.",41,46,"Southern Utah","Pepperdine",7,"400986957"
204,2,"15:57",957,"Official TV Timeout",41,46,"Southern Utah","Pepperdine",7,"400986957"
205,2,"15:56",956,"James McGee made Three Point Jumper. Assisted by Dre Marin.",41,49,"Southern Utah","Pepperdine",7,"400986957"
206,2,"15:32",932,"Foul on James McGee.",41,49,"Southern Utah","Pepperdine",7,"400986957"
207,2,"15:32",932,"Amadi Udenyi made Free Throw.",42,49,"Southern Utah","Pepperdine",7,"400986957"
208,2,"15:32",932,"Amadi Udenyi made Free Throw.",43,49,"Southern Utah","Pepperdine",7,"400986957"
209,2,"15:08",908,"Jadon Cohee made Jumper. Assisted by Dre Marin.",43,51,"Southern Utah","Pepperdine",7,"400986957"
210,2,"14:51",891,"Kameron Edwards made Layup. Assisted by Colbey Ross.",45,51,"Southern Utah","Pepperdine",7,"400986957"
211,2,"14:31",871,"Ivan Madunic missed Three Point Jumper.",45,51,"Southern Utah","Pepperdine",7,"400986957"
212,2,"14:31",871,"Amadi Udenyi Defensive Rebound.",45,51,"Southern Utah","Pepperdine",7,"400986957"
213,2,"14:21",861,"Nolan Taylor missed Jumper.",45,51,"Southern Utah","Pepperdine",7,"400986957"
214,2,"14:21",861,"Ivan Madunic Defensive Rebound.",45,51,"Southern Utah","Pepperdine",7,"400986957"
215,2,"14:07",847,"Jadon Cohee missed Three Point Jumper.",45,51,"Southern Utah","Pepperdine",7,"400986957"
216,2,"14:07",847,"Ivan Madunic Offensive Rebound.",45,51,"Southern Utah","Pepperdine",7,"400986957"
217,2,"14:03",843,"Ivan Madunic missed Jumper.",45,51,"Southern Utah","Pepperdine",7,"400986957"
218,2,"14:03",843,"Kameron Edwards Block.",45,51,"Southern Utah","Pepperdine",7,"400986957"
219,2,"14:01",841,"Kameron Edwards Defensive Rebound.",45,51,"Southern Utah","Pepperdine",7,"400986957"
220,2,"13:46",826,"Kameron Edwards made Jumper. Assisted by Colbey Ross.",47,51,"Southern Utah","Pepperdine",7,"400986957"
221,2,"13:23",803,"Dre Marin made Three Point Jumper.",47,54,"Southern Utah","Pepperdine",7,"400986957"
222,2,"13:09",789,"Trae Berhow missed Three Point Jumper.",47,54,"Southern Utah","Pepperdine",7,"400986957"
223,2,"13:09",789,"Dre Marin Defensive Rebound.",47,54,"Southern Utah","Pepperdine",7,"400986957"
224,2,"13:03",783,"James McGee missed Three Point Jumper.",47,54,"Southern Utah","Pepperdine",7,"400986957"
225,2,"13:03",783,"Kameron Edwards Defensive Rebound.",47,54,"Southern Utah","Pepperdine",7,"400986957"
226,2,"12:35",755,"Colbey Ross missed Layup.",47,54,"Southern Utah","Pepperdine",7,"400986957"
227,2,"12:35",755,"Nolan Taylor Offensive Rebound.",47,54,"Southern Utah","Pepperdine",7,"400986957"
228,2,"12:34",754,"Nolan Taylor made Layup.",49,54,"Southern Utah","Pepperdine",7,"400986957"
229,2,"12:10",730,"Ivan Madunic made Three Point Jumper. Assisted by Jadon Cohee.",49,57,"Southern Utah","Pepperdine",7,"400986957"
230,2,"11:47",707,"Nolan Taylor made Three Point Jumper.",52,57,"Southern Utah","Pepperdine",7,"400986957"
231,2,"11:16",676,"Foul on Jade' Smith.",52,57,"Southern Utah","Pepperdine",7,"400986957"
232,2,"11:16",676,"Official TV Timeout",52,57,"Southern Utah","Pepperdine",7,"400986957"
233,2,"11:16",676,"Jadon Cohee made Free Throw.",52,58,"Southern Utah","Pepperdine",7,"400986957"
234,2,"11:16",676,"Jadon Cohee made Free Throw.",52,59,"Southern Utah","Pepperdine",7,"400986957"
235,2,"11:05",665,"Harrison Meads made Layup. Assisted by Colbey Ross.",54,59,"Southern Utah","Pepperdine",7,"400986957"
236,2,"10:44",644,"Brandon Better made Three Point Jumper. Assisted by Christian Musoko.",54,62,"Southern Utah","Pepperdine",7,"400986957"
237,2,"10:30",630,"Colbey Ross missed Jumper.",54,62,"Southern Utah","Pepperdine",7,"400986957"
238,2,"10:30",630,"Brandon Better Defensive Rebound.",54,62,"Southern Utah","Pepperdine",7,"400986957"
239,2,"10:13",613,"Foul on Harrison Meads.",54,62,"Southern Utah","Pepperdine",7,"400986957"
240,2,"10:06",606,"Jadon Cohee missed Jumper.",54,62,"Southern Utah","Pepperdine",7,"400986957"
241,2,"10:06",606,"Amadi Udenyi Defensive Rebound.",54,62,"Southern Utah","Pepperdine",7,"400986957"
242,2,"10:03",603,"Foul on Jamal Aytes.",54,62,"Southern Utah","Pepperdine",7,"400986957"
243,2,"9:45",585,"Foul on Christian Musoko.",54,62,"Southern Utah","Pepperdine",7,"400986957"
244,2,"9:45",585,"Kameron Edwards missed Free Throw.",54,62,"Southern Utah","Pepperdine",7,"400986957"
245,2,"9:45",585,"Pepperdine Deadball Team Rebound.",54,62,"Southern Utah","Pepperdine",7,"400986957"
246,2,"9:45",585,"Kameron Edwards made Free Throw.",55,62,"Southern Utah","Pepperdine",7,"400986957"
247,2,"9:35",575,"Dre Marin Turnover.",55,62,"Southern Utah","Pepperdine",7,"400986957"
248,2,"9:34",574,"Jade' Smith Steal.",55,62,"Southern Utah","Pepperdine",7,"400986957"
249,2,"9:28",568,"Trae Berhow made Three Point Jumper. Assisted by Amadi Udenyi.",58,62,"Southern Utah","Pepperdine",7,"400986957"
250,2,"9:15",555,"Brandon Better missed Three Point Jumper.",58,62,"Southern Utah","Pepperdine",7,"400986957"
251,2,"9:15",555,"Pepperdine Defensive Rebound.",58,62,"Southern Utah","Pepperdine",7,"400986957"
252,2,"9:03",543,"Foul on Ivan Madunic.",58,62,"Southern Utah","Pepperdine",7,"400986957"
253,2,"8:56",536,"Jade' Smith missed Layup.",58,62,"Southern Utah","Pepperdine",7,"400986957"
254,2,"8:56",536,"Ivan Madunic Block.",58,62,"Southern Utah","Pepperdine",7,"400986957"
255,2,"8:56",536,"Kameron Edwards Offensive Rebound.",58,62,"Southern Utah","Pepperdine",7,"400986957"
256,2,"8:54",534,"Kameron Edwards made Layup.",60,62,"Southern Utah","Pepperdine",7,"400986957"
257,2,"8:36",516,"Ivan Madunic missed Jumper.",60,62,"Southern Utah","Pepperdine",7,"400986957"
258,2,"8:36",516,"Ivan Madunic Offensive Rebound.",60,62,"Southern Utah","Pepperdine",7,"400986957"
259,2,"8:34",514,"Foul on Trae Berhow.",60,62,"Southern Utah","Pepperdine",7,"400986957"
260,2,"8:20",500,"Foul on Jade' Smith.",60,62,"Southern Utah","Pepperdine",7,"400986957"
261,2,"8:20",500,"Ivan Madunic made Free Throw.",60,63,"Southern Utah","Pepperdine",7,"400986957"
262,2,"8:20",500,"Ivan Madunic missed Free Throw.",60,63,"Southern Utah","Pepperdine",7,"400986957"
263,2,"8:20",500,"Southern Utah Deadball Team Rebound.",60,63,"Southern Utah","Pepperdine",7,"400986957"
264,2,"8:20",500,"Ivan Madunic missed Free Throw.",60,63,"Southern Utah","Pepperdine",7,"400986957"
265,2,"8:20",500,"Knox Hellums Defensive Rebound.",60,63,"Southern Utah","Pepperdine",7,"400986957"
266,2,"8:01",481,"Harrison Meads made Dunk. Assisted by Amadi Udenyi.",62,63,"Southern Utah","Pepperdine",7,"400986957"
267,2,"8:01",481,"Foul on Ivan Madunic.",62,63,"Southern Utah","Pepperdine",7,"400986957"
268,2,"8:01",481,"Harrison Meads missed Free Throw.",62,63,"Southern Utah","Pepperdine",7,"400986957"
269,2,"8:01",481,"Dre Marin Defensive Rebound.",62,63,"Southern Utah","Pepperdine",7,"400986957"
270,2,"7:50",470,"Foul on Harrison Meads.",62,63,"Southern Utah","Pepperdine",7,"400986957"
271,2,"7:50",470,"Official TV Timeout",62,63,"Southern Utah","Pepperdine",7,"400986957"
272,2,"7:47",467,"Matthew Johnson missed Three Point Jumper.",62,63,"Southern Utah","Pepperdine",7,"400986957"
273,2,"7:47",467,"Kameron Edwards Defensive Rebound.",62,63,"Southern Utah","Pepperdine",7,"400986957"
274,2,"7:33",453,"Foul on Dre Marin.",62,63,"Southern Utah","Pepperdine",7,"400986957"
275,2,"7:33",453,"Foul on Kameron Edwards.",62,63,"Southern Utah","Pepperdine",7,"400986957"
276,2,"7:18",438,"Kameron Edwards made Layup.",64,63,"Southern Utah","Pepperdine",7,"400986957"
277,2,"6:52",412,"Dre Marin made Three Point Jumper. Assisted by Jamal Aytes.",64,66,"Southern Utah","Pepperdine",7,"400986957"
278,2,"6:33",393,"Kameron Edwards missed Jumper.",64,66,"Southern Utah","Pepperdine",7,"400986957"
279,2,"6:33",393,"Harrison Meads Offensive Rebound.",64,66,"Southern Utah","Pepperdine",7,"400986957"
280,2,"6:32",392,"Harrison Meads made Two Point Tip Shot.",66,66,"Southern Utah","Pepperdine",7,"400986957"
281,2,"6:04",364,"Brandon Better missed Layup.",66,66,"Southern Utah","Pepperdine",7,"400986957"
282,2,"6:04",364,"Jamal Aytes Offensive Rebound.",66,66,"Southern Utah","Pepperdine",7,"400986957"
283,2,"6:02",362,"Jamal Aytes made Layup.",66,68,"Southern Utah","Pepperdine",7,"400986957"
284,2,"5:45",345,"Foul on James McGee.",66,68,"Southern Utah","Pepperdine",7,"400986957"
285,2,"5:45",345,"Harrison Meads missed Free Throw.",66,68,"Southern Utah","Pepperdine",7,"400986957"
286,2,"5:45",345,"Southern Utah Defensive Rebound.",66,68,"Southern Utah","Pepperdine",7,"400986957"
287,2,"5:29",329,"Dre Marin made Three Point Jumper. Assisted by James McGee.",66,71,"Southern Utah","Pepperdine",7,"400986957"
288,2,"5:17",317,"Colbey Ross made Jumper.",68,71,"Southern Utah","Pepperdine",7,"400986957"
289,2,"5:17",317,"Foul on Christian Musoko.",68,71,"Southern Utah","Pepperdine",7,"400986957"
290,2,"5:17",317,"Colbey Ross missed Free Throw.",68,71,"Southern Utah","Pepperdine",7,"400986957"
291,2,"5:17",317,"Kameron Edwards Offensive Rebound.",68,71,"Southern Utah","Pepperdine",7,"400986957"
292,2,"5:15",315,"Kameron Edwards made Layup.",70,71,"Southern Utah","Pepperdine",7,"400986957"
293,2,"5:15",315,"Foul on Dre Marin.",70,71,"Southern Utah","Pepperdine",7,"400986957"
294,2,"5:15",315,"Kameron Edwards made Free Throw.",71,71,"Southern Utah","Pepperdine",7,"400986957"
295,2,"4:46",286,"Jamal Aytes made Layup. Assisted by James McGee.",71,73,"Southern Utah","Pepperdine",7,"400986957"
296,2,"4:34",274,"Colbey Ross missed Jumper.",71,73,"Southern Utah","Pepperdine",7,"400986957"
297,2,"4:34",274,"Brandon Better Defensive Rebound.",71,73,"Southern Utah","Pepperdine",7,"400986957"
298,2,"4:28",268,"Brandon Better missed Layup.",71,73,"Southern Utah","Pepperdine",7,"400986957"
299,2,"4:28",268,"Kameron Edwards Block.",71,73,"Southern Utah","Pepperdine",7,"400986957"
300,2,"4:27",267,"Southern Utah Offensive Rebound.",71,73,"Southern Utah","Pepperdine",7,"400986957"
301,2,"4:26",266,"Dre Marin made Three Point Jumper. Assisted by Brandon Better.",71,76,"Southern Utah","Pepperdine",7,"400986957"
302,2,"4:06",246,"Nolan Taylor made Jumper. Assisted by Colbey Ross.",73,76,"Southern Utah","Pepperdine",7,"400986957"
303,2,"3:44",224,"Jamal Aytes missed Jumper.",73,76,"Southern Utah","Pepperdine",7,"400986957"
304,2,"3:44",224,"Kameron Edwards Defensive Rebound.",73,76,"Southern Utah","Pepperdine",7,"400986957"
305,2,"3:35",215,"Amadi Udenyi missed Jumper.",73,76,"Southern Utah","Pepperdine",7,"400986957"
306,2,"3:35",215,"Jamal Aytes Defensive Rebound.",73,76,"Southern Utah","Pepperdine",7,"400986957"
307,2,"3:33",213,"Foul on Nolan Taylor.",73,76,"Southern Utah","Pepperdine",7,"400986957"
308,2,"3:33",213,"Official TV Timeout",73,76,"Southern Utah","Pepperdine",7,"400986957"
309,2,"3:33",213,"Jamal Aytes made Free Throw.",73,77,"Southern Utah","Pepperdine",7,"400986957"
310,2,"3:33",213,"Jamal Aytes made Free Throw.",73,78,"Southern Utah","Pepperdine",7,"400986957"
311,2,"3:14",194,"Kameron Edwards made Layup. Assisted by Nolan Taylor.",75,78,"Southern Utah","Pepperdine",7,"400986957"
312,2,"2:55",175,"Foul on Nolan Taylor.",75,78,"Southern Utah","Pepperdine",7,"400986957"
313,2,"2:55",175,"James McGee missed Free Throw.",75,78,"Southern Utah","Pepperdine",7,"400986957"
314,2,"2:55",175,"Southern Utah Deadball Team Rebound.",75,78,"Southern Utah","Pepperdine",7,"400986957"
315,2,"2:55",175,"James McGee missed Free Throw.",75,78,"Southern Utah","Pepperdine",7,"400986957"
316,2,"2:55",175,"Nolan Taylor Defensive Rebound.",75,78,"Southern Utah","Pepperdine",7,"400986957"
317,2,"2:32",152,"Kameron Edwards Turnover.",75,78,"Southern Utah","Pepperdine",7,"400986957"
318,2,"2:31",151,"Dre Marin Steal.",75,78,"Southern Utah","Pepperdine",7,"400986957"
319,2,"2:09",129,"Jamal Aytes made Layup. Assisted by Dre Marin.",75,80,"Southern Utah","Pepperdine",7,"400986957"
320,2,"2:01",121,"Colbey Ross made Three Point Jumper.",78,80,"Southern Utah","Pepperdine",7,"400986957"
321,2,"2:00",120,"Pepperdine  Timeout",78,80,"Southern Utah","Pepperdine",7,"400986957"
322,2,"1:51",111,"Foul on Jamal Aytes.",78,80,"Southern Utah","Pepperdine",7,"400986957"
323,2,"1:51",111,"Jamal Aytes Turnover.",78,80,"Southern Utah","Pepperdine",7,"400986957"
324,2,"1:27",87,"Colbey Ross missed Jumper.",78,80,"Southern Utah","Pepperdine",7,"400986957"
325,2,"1:27",87,"Jamal Aytes Defensive Rebound.",78,80,"Southern Utah","Pepperdine",7,"400986957"
326,2,"0:55",55,"Foul on Harrison Meads.",78,80,"Southern Utah","Pepperdine",7,"400986957"
327,2,"0:55",55,"Dre Marin made Free Throw.",78,81,"Southern Utah","Pepperdine",7,"400986957"
328,2,"0:55",55,"Dre Marin made Free Throw.",78,82,"Southern Utah","Pepperdine",7,"400986957"
329,2,"0:45",45,"Kameron Edwards missed Layup.",78,82,"Southern Utah","Pepperdine",7,"400986957"
330,2,"0:45",45,"Nolan Taylor Offensive Rebound.",78,82,"Southern Utah","Pepperdine",7,"400986957"
331,2,"0:42",42,"Nolan Taylor missed Layup.",78,82,"Southern Utah","Pepperdine",7,"400986957"
332,2,"0:42",42,"Jamal Aytes Defensive Rebound.",78,82,"Southern Utah","Pepperdine",7,"400986957"
333,2,"0:39",39,"Foul on Kameron Edwards.",78,82,"Southern Utah","Pepperdine",7,"400986957"
334,2,"0:39",39,"Pepperdine  Timeout",78,82,"Southern Utah","Pepperdine",7,"400986957"
335,2,"0:39",39,"Jamal Aytes made Free Throw.",78,83,"Southern Utah","Pepperdine",7,"400986957"
336,2,"0:39",39,"Jamal Aytes made Free Throw.",78,84,"Southern Utah","Pepperdine",7,"400986957"
337,2,"0:28",28,"Colbey Ross Turnover.",78,84,"Southern Utah","Pepperdine",7,"400986957"
338,2,"0:27",27,"Brandon Better Steal.",78,84,"Southern Utah","Pepperdine",7,"400986957"
339,2,"0:26",26,"Foul on Knox Hellums.",78,84,"Southern Utah","Pepperdine",7,"400986957"
340,2,"0:26",26,"Brandon Better made Free Throw.",78,85,"Southern Utah","Pepperdine",7,"400986957"
341,2,"0:26",26,"Brandon Better missed Free Throw.",78,85,"Southern Utah","Pepperdine",7,"400986957"
342,2,"0:26",26,"Kameron Edwards Defensive Rebound.",78,85,"Southern Utah","Pepperdine",7,"400986957"
343,2,"0:16",16,"Trae Berhow missed Three Point Jumper.",78,85,"Southern Utah","Pepperdine",7,"400986957"
344,2,"0:16",16,"Pepperdine Offensive Rebound.",78,85,"Southern Utah","Pepperdine",7,"400986957"
345,2,"0:15",15,"Foul on James McGee.",78,85,"Southern Utah","Pepperdine",7,"400986957"
346,2,"0:15",15,"Knox Hellums made Free Throw.",79,85,"Southern Utah","Pepperdine",7,"400986957"
347,2,"0:15",15,"Knox Hellums made Free Throw.",80,85,"Southern Utah","Pepperdine",7,"400986957"
348,2,"0:14",14,"Foul on Colbey Ross.",80,85,"Southern Utah","Pepperdine",7,"400986957"
349,2,"0:14",14,"Jadon Cohee made Free Throw.",80,86,"Southern Utah","Pepperdine",7,"400986957"
350,2,"0:14",14,"Jadon Cohee made Free Throw.",80,87,"Southern Utah","Pepperdine",7,"400986957"
351,2,"0:06",6,"Colbey Ross made Layup.",82,87,"Southern Utah","Pepperdine",7,"400986957"
352,2,"0:04",4,"Foul on Trae Berhow.",82,87,"Southern Utah","Pepperdine",7,"400986957"
353,2,"0:04",4,"Jadon Cohee missed Free Throw.",82,87,"Southern Utah","Pepperdine",7,"400986957"
354,2,"0:04",4,"Southern Utah Deadball Team Rebound.",82,87,"Southern Utah","Pepperdine",7,"400986957"
355,2,"0:04",4,"Jadon Cohee made Free Throw.",82,88,"Southern Utah","Pepperdine",7,"400986957"
356,2,"0:01",1,"Trae Berhow Turnover.",82,88,"Southern Utah","Pepperdine",7,"400986957"
357,2,"0:01",1,"Brandon Better Steal.",82,88,"Southern Utah","Pepperdine",7,"400986957"
358,2,"0:00",0,"End of Game",82,88,"Southern Utah","Pepperdine",7,"400986957"
1,1,"20:00",2400,"PLAY",0,0,"Long Beach State","Southern Utah",-2.5,"400991255"
2,1,"19:43",2383,"Jacob Calloway missed Three Point Jumper.",0,0,"Long Beach State","Southern Utah",-2.5,"400991255"
3,1,"19:43",2383,"Christian Musoko Offensive Rebound.",0,0,"Long Beach State","Southern Utah",-2.5,"400991255"
4,1,"19:37",2377,"Dre Marin missed Jumper.",0,0,"Long Beach State","Southern Utah",-2.5,"400991255"
5,1,"19:37",2377,"Gabe Levin Defensive Rebound.",0,0,"Long Beach State","Southern Utah",-2.5,"400991255"
6,1,"19:07",2347,"Bryan Alberts made Jumper. Assisted by Mason Riggins.",0,2,"Long Beach State","Southern Utah",-2.5,"400991255"
7,1,"18:52",2332,"James McGee missed Three Point Jumper.",0,2,"Long Beach State","Southern Utah",-2.5,"400991255"
8,1,"18:52",2332,"Deishuan Booker Defensive Rebound.",0,2,"Long Beach State","Southern Utah",-2.5,"400991255"
9,1,"18:45",2325,"Jordan Griffin missed Three Point Jumper.",0,2,"Long Beach State","Southern Utah",-2.5,"400991255"
10,1,"18:45",2325,"Christian Musoko Defensive Rebound.",0,2,"Long Beach State","Southern Utah",-2.5,"400991255"
11,1,"18:30",2310,"Jadon Cohee made Three Point Jumper. Assisted by Dre Marin.",3,2,"Long Beach State","Southern Utah",-2.5,"400991255"
12,1,"18:17",2297,"Deishuan Booker missed Layup.",3,2,"Long Beach State","Southern Utah",-2.5,"400991255"
13,1,"18:17",2297,"Christian Musoko Block.",3,2,"Long Beach State","Southern Utah",-2.5,"400991255"
14,1,"18:17",2297,"Jacob Calloway Defensive Rebound.",3,2,"Long Beach State","Southern Utah",-2.5,"400991255"
15,1,"18:10",2290,"James McGee made Jumper. Assisted by Jacob Calloway.",5,2,"Long Beach State","Southern Utah",-2.5,"400991255"
16,1,"17:51",2271,"Bryan Alberts Turnover.",5,2,"Long Beach State","Southern Utah",-2.5,"400991255"
17,1,"17:50",2270,"Dre Marin Steal.",5,2,"Long Beach State","Southern Utah",-2.5,"400991255"
18,1,"17:45",2265,"Christian Musoko missed Dunk.",5,2,"Long Beach State","Southern Utah",-2.5,"400991255"
19,1,"17:45",2265,"Mason Riggins Defensive Rebound.",5,2,"Long Beach State","Southern Utah",-2.5,"400991255"
20,1,"17:38",2258,"Gabe Levin missed Jumper.",5,2,"Long Beach State","Southern Utah",-2.5,"400991255"
21,1,"17:38",2258,"Jacob Calloway Defensive Rebound.",5,2,"Long Beach State","Southern Utah",-2.5,"400991255"
22,1,"17:28",2248,"Jacob Calloway made Jumper.",7,2,"Long Beach State","Southern Utah",-2.5,"400991255"
23,1,"17:19",2239,"Bryan Alberts missed Jumper.",7,2,"Long Beach State","Southern Utah",-2.5,"400991255"
24,1,"17:19",2239,"Christian Musoko Defensive Rebound.",7,2,"Long Beach State","Southern Utah",-2.5,"400991255"
25,1,"17:06",2226,"James McGee missed Three Point Jumper.",7,2,"Long Beach State","Southern Utah",-2.5,"400991255"
26,1,"17:06",2226,"Deishuan Booker Defensive Rebound.",7,2,"Long Beach State","Southern Utah",-2.5,"400991255"
27,1,"16:55",2215,"Jordan Griffin Turnover.",7,2,"Long Beach State","Southern Utah",-2.5,"400991255"
28,1,"16:55",2215,"Foul on Jordan Griffin.",7,2,"Long Beach State","Southern Utah",-2.5,"400991255"
29,1,"16:49",2209,"Jamal Aytes missed Jumper.",7,2,"Long Beach State","Southern Utah",-2.5,"400991255"
30,1,"16:49",2209,"Long Beach State Defensive Rebound.",7,2,"Long Beach State","Southern Utah",-2.5,"400991255"
31,1,"16:13",2173,"Mason Riggins missed Jumper.",7,2,"Long Beach State","Southern Utah",-2.5,"400991255"
32,1,"16:13",2173,"Dre Marin Defensive Rebound.",7,2,"Long Beach State","Southern Utah",-2.5,"400991255"
33,1,"16:05",2165,"Foul on Deishuan Booker.",7,2,"Long Beach State","Southern Utah",-2.5,"400991255"
34,1,"16:04",2164,"Southern Utah  Turnover.",7,2,"Long Beach State","Southern Utah",-2.5,"400991255"
35,1,"15:52",2152,"Gabe Levin missed Layup.",7,2,"Long Beach State","Southern Utah",-2.5,"400991255"
36,1,"15:52",2152,"Jamal Aytes Defensive Rebound.",7,2,"Long Beach State","Southern Utah",-2.5,"400991255"
37,1,"15:41",2141,"Official TV Timeout",7,2,"Long Beach State","Southern Utah",-2.5,"400991255"
38,1,"15:35",2135,"Jadon Cohee missed Jumper.",7,2,"Long Beach State","Southern Utah",-2.5,"400991255"
39,1,"15:35",2135,"Dre Marin Offensive Rebound.",7,2,"Long Beach State","Southern Utah",-2.5,"400991255"
40,1,"15:31",2131,"Jamal Aytes Turnover.",7,2,"Long Beach State","Southern Utah",-2.5,"400991255"
41,1,"15:31",2131,"Foul on Jamal Aytes.",7,2,"Long Beach State","Southern Utah",-2.5,"400991255"
42,1,"15:31",2131,"Gabe Levin made Jumper.",7,4,"Long Beach State","Southern Utah",-2.5,"400991255"
43,1,"15:16",2116,"Brandon Better made Jumper.",9,4,"Long Beach State","Southern Utah",-2.5,"400991255"
44,1,"14:56",2096,"Mason Riggins missed Jumper.",9,4,"Long Beach State","Southern Utah",-2.5,"400991255"
45,1,"14:56",2096,"Barry Ogalue Offensive Rebound.",9,4,"Long Beach State","Southern Utah",-2.5,"400991255"
46,1,"14:50",2090,"Edon Maxhuni made Jumper.",9,6,"Long Beach State","Southern Utah",-2.5,"400991255"
47,1,"14:18",2058,"Foul on Edon Maxhuni.",9,6,"Long Beach State","Southern Utah",-2.5,"400991255"
48,1,"14:18",2058,"Jadon Cohee made Free Throw.",10,6,"Long Beach State","Southern Utah",-2.5,"400991255"
49,1,"14:08",2048,"Jadon Cohee made Free Throw.",11,6,"Long Beach State","Southern Utah",-2.5,"400991255"
50,1,"14:00",2040,"Jadon Cohee made Free Throw.",12,6,"Long Beach State","Southern Utah",-2.5,"400991255"
51,1,"13:48",2028,"Temidayo Yussuf missed Layup.",12,6,"Long Beach State","Southern Utah",-2.5,"400991255"
52,1,"13:48",2028,"Brandon Better Defensive Rebound.",12,6,"Long Beach State","Southern Utah",-2.5,"400991255"
53,1,"13:40",2020,"James McGee missed Three Point Jumper.",12,6,"Long Beach State","Southern Utah",-2.5,"400991255"
54,1,"13:40",2020,"Barry Ogalue Defensive Rebound.",12,6,"Long Beach State","Southern Utah",-2.5,"400991255"
55,1,"13:32",2012,"Barry Ogalue missed Three Point Jumper.",12,6,"Long Beach State","Southern Utah",-2.5,"400991255"
56,1,"13:32",2012,"Brandon Better Defensive Rebound.",12,6,"Long Beach State","Southern Utah",-2.5,"400991255"
57,1,"13:13",1993,"James McGee missed Layup.",12,6,"Long Beach State","Southern Utah",-2.5,"400991255"
58,1,"13:13",1993,"Temidayo Yussuf Defensive Rebound.",12,6,"Long Beach State","Southern Utah",-2.5,"400991255"
59,1,"13:05",1985,"Foul on Ivan Madunic.",12,6,"Long Beach State","Southern Utah",-2.5,"400991255"
60,1,"13:05",1985,"Barry Ogalue made Free Throw.",12,7,"Long Beach State","Southern Utah",-2.5,"400991255"
61,1,"13:05",1985,"Barry Ogalue missed Free Throw.",12,7,"Long Beach State","Southern Utah",-2.5,"400991255"
62,1,"13:05",1985,"Christian Musoko Defensive Rebound.",12,7,"Long Beach State","Southern Utah",-2.5,"400991255"
63,1,"12:50",1970,"Brandon Better missed Jumper.",12,7,"Long Beach State","Southern Utah",-2.5,"400991255"
64,1,"12:50",1970,"KJ Byers Defensive Rebound.",12,7,"Long Beach State","Southern Utah",-2.5,"400991255"
65,1,"12:27",1947,"Bryan Alberts missed Three Point Jumper.",12,7,"Long Beach State","Southern Utah",-2.5,"400991255"
66,1,"12:27",1947,"Barry Ogalue Offensive Rebound.",12,7,"Long Beach State","Southern Utah",-2.5,"400991255"
67,1,"11:59",1919,"Edon Maxhuni missed Three Point Jumper.",12,7,"Long Beach State","Southern Utah",-2.5,"400991255"
68,1,"11:59",1919,"Christian Musoko Defensive Rebound.",12,7,"Long Beach State","Southern Utah",-2.5,"400991255"
69,1,"11:54",1914,"Foul on Temidayo Yussuf.",12,7,"Long Beach State","Southern Utah",-2.5,"400991255"
