"play_id","half","time_remaining_half","secs_remaining","description","home_score","away_score","away","home","home_favored_by","game_id"
349,2,"0:01",1,"Texas State Defensive Rebound.",75,58,"UT Rio Grande Valley","Texas State",NA,"400990371"
350,2,"0:00",0,"End of Game",75,58,"UT Rio Grande Valley","Texas State",NA,"400990371"
1,1,"20:00",2400,"PLAY",0,0,"Texas State","Arkansas-Pine Bluff",NA,"400990377"
2,1,"19:51",2391,"Cameron Posey made Layup. Assisted by Travon Harper.",2,0,"Texas State","Arkansas-Pine Bluff",NA,"400990377"
3,1,"19:34",2374,"Nedeljko Prijovic missed Jumper.",2,0,"Texas State","Arkansas-Pine Bluff",NA,"400990377"
4,1,"19:34",2374,"Travon Harper Defensive Rebound.",2,0,"Texas State","Arkansas-Pine Bluff",NA,"400990377"
5,1,"19:19",2359,"Travon Harper missed Jumper.",2,0,"Texas State","Arkansas-Pine Bluff",NA,"400990377"
6,1,"19:19",2359,"Nedeljko Prijovic Defensive Rebound.",2,0,"Texas State","Arkansas-Pine Bluff",NA,"400990377"
7,1,"18:51",2331,"Tyler Blount missed Three Point Jumper.",2,0,"Texas State","Arkansas-Pine Bluff",NA,"400990377"
8,1,"18:51",2331,"Nijal Pearson Offensive Rebound.",2,0,"Texas State","Arkansas-Pine Bluff",NA,"400990377"
9,1,"18:27",2307,"Foul on Charles Jackson.",2,0,"Texas State","Arkansas-Pine Bluff",NA,"400990377"
10,1,"18:20",2300,"Immanuel King missed Jumper.",2,0,"Texas State","Arkansas-Pine Bluff",NA,"400990377"
11,1,"18:20",2300,"Travon Harper Defensive Rebound.",2,0,"Texas State","Arkansas-Pine Bluff",NA,"400990377"
12,1,"18:06",2286,"Trent Steen made Layup. Assisted by Cameron Posey.",4,0,"Texas State","Arkansas-Pine Bluff",NA,"400990377"
13,1,"17:43",2263,"Nijal Pearson Turnover.",4,0,"Texas State","Arkansas-Pine Bluff",NA,"400990377"
14,1,"17:22",2242,"Cameron Posey Turnover.",4,0,"Texas State","Arkansas-Pine Bluff",NA,"400990377"
15,1,"17:21",2241,"Immanuel King Steal.",4,0,"Texas State","Arkansas-Pine Bluff",NA,"400990377"
16,1,"17:17",2237,"Tyler Blount made Jumper.",4,2,"Texas State","Arkansas-Pine Bluff",NA,"400990377"
17,1,"16:55",2215,"Martaveous McKnight missed Three Point Jumper.",4,2,"Texas State","Arkansas-Pine Bluff",NA,"400990377"
18,1,"16:55",2215,"Travon Harper Offensive Rebound.",4,2,"Texas State","Arkansas-Pine Bluff",NA,"400990377"
19,1,"16:50",2210,"Foul on Nedeljko Prijovic.",4,2,"Texas State","Arkansas-Pine Bluff",NA,"400990377"
20,1,"16:50",2210,"Travon Harper made Free Throw.",5,2,"Texas State","Arkansas-Pine Bluff",NA,"400990377"
21,1,"16:50",2210,"Travon Harper made Free Throw.",6,2,"Texas State","Arkansas-Pine Bluff",NA,"400990377"
22,1,"16:31",2191,"Tyler Blount made Three Point Jumper. Assisted by Marlin Davis.",6,5,"Texas State","Arkansas-Pine Bluff",NA,"400990377"
23,1,"16:10",2170,"Charles Jackson missed Jumper.",6,5,"Texas State","Arkansas-Pine Bluff",NA,"400990377"
24,1,"16:10",2170,"Trent Steen Offensive Rebound.",6,5,"Texas State","Arkansas-Pine Bluff",NA,"400990377"
25,1,"16:00",2160,"Christian Robertson missed Three Point Jumper.",6,5,"Texas State","Arkansas-Pine Bluff",NA,"400990377"
26,1,"16:00",2160,"Tyler Blount Defensive Rebound.",6,5,"Texas State","Arkansas-Pine Bluff",NA,"400990377"
27,1,"15:48",2148,"Foul on Trent Steen.",6,5,"Texas State","Arkansas-Pine Bluff",NA,"400990377"
28,1,"15:48",2148,"Official TV Timeout",6,5,"Texas State","Arkansas-Pine Bluff",NA,"400990377"
29,1,"15:35",2135,"Foul on Cameron Posey.",6,5,"Texas State","Arkansas-Pine Bluff",NA,"400990377"
30,1,"15:23",2123,"Marlin Davis made Jumper.",6,7,"Texas State","Arkansas-Pine Bluff",NA,"400990377"
31,1,"14:53",2093,"Foul on Nijal Pearson.",6,7,"Texas State","Arkansas-Pine Bluff",NA,"400990377"
32,1,"14:53",2093,"Martaveous McKnight made Free Throw.",7,7,"Texas State","Arkansas-Pine Bluff",NA,"400990377"
33,1,"14:53",2093,"Martaveous McKnight made Free Throw.",8,7,"Texas State","Arkansas-Pine Bluff",NA,"400990377"
34,1,"14:35",2075,"Tyler Blount made Three Point Jumper. Assisted by Nedeljko Prijovic.",8,10,"Texas State","Arkansas-Pine Bluff",NA,"400990377"
35,1,"14:14",2054,"Trent Steen made Jumper.",10,10,"Texas State","Arkansas-Pine Bluff",NA,"400990377"
36,1,"13:51",2031,"Tyler Blount missed Jumper.",10,10,"Texas State","Arkansas-Pine Bluff",NA,"400990377"
37,1,"13:51",2031,"Immanuel King Offensive Rebound.",10,10,"Texas State","Arkansas-Pine Bluff",NA,"400990377"
38,1,"13:43",2023,"Immanuel King made Two Point Tip Shot.",10,12,"Texas State","Arkansas-Pine Bluff",NA,"400990377"
39,1,"13:35",2015,"Foul on Nedeljko Prijovic.",10,12,"Texas State","Arkansas-Pine Bluff",NA,"400990377"
40,1,"13:18",1998,"Foul on Tyler Blount.",10,12,"Texas State","Arkansas-Pine Bluff",NA,"400990377"
41,1,"13:18",1998,"Quamauri Hardy missed Free Throw.",10,12,"Texas State","Arkansas-Pine Bluff",NA,"400990377"
42,1,"13:18",1998,"Arkansas-Pine Bluff Deadball Team Rebound.",10,12,"Texas State","Arkansas-Pine Bluff",NA,"400990377"
43,1,"13:18",1998,"Quamauri Hardy made Free Throw.",11,12,"Texas State","Arkansas-Pine Bluff",NA,"400990377"
44,1,"13:05",1985,"Eric Terry Turnover.",11,12,"Texas State","Arkansas-Pine Bluff",NA,"400990377"
45,1,"13:03",1983,"Quamauri Hardy Steal.",11,12,"Texas State","Arkansas-Pine Bluff",NA,"400990377"
46,1,"12:56",1976,"Trent Steen missed Jumper.",11,12,"Texas State","Arkansas-Pine Bluff",NA,"400990377"
47,1,"12:56",1976,"Charles Jackson Offensive Rebound.",11,12,"Texas State","Arkansas-Pine Bluff",NA,"400990377"
48,1,"12:54",1974,"Foul on Tre'Larenz Nottingham.",11,12,"Texas State","Arkansas-Pine Bluff",NA,"400990377"
49,1,"12:52",1972,"Trent Steen missed Jumper.",11,12,"Texas State","Arkansas-Pine Bluff",NA,"400990377"
50,1,"12:52",1972,"Eric Terry Defensive Rebound.",11,12,"Texas State","Arkansas-Pine Bluff",NA,"400990377"
51,1,"12:18",1938,"Tre'Larenz Nottingham missed Jumper.",11,12,"Texas State","Arkansas-Pine Bluff",NA,"400990377"
52,1,"12:18",1938,"Nijal Pearson Offensive Rebound.",11,12,"Texas State","Arkansas-Pine Bluff",NA,"400990377"
53,1,"12:14",1934,"Nijal Pearson made Layup.",11,14,"Texas State","Arkansas-Pine Bluff",NA,"400990377"
54,1,"11:48",1908,"Charles Jackson made Jumper.",13,14,"Texas State","Arkansas-Pine Bluff",NA,"400990377"
55,1,"11:22",1882,"Foul on Kennedy McKinney.",13,14,"Texas State","Arkansas-Pine Bluff",NA,"400990377"
56,1,"11:22",1882,"Official TV Timeout",13,14,"Texas State","Arkansas-Pine Bluff",NA,"400990377"
57,1,"11:22",1882,"Eric Terry made Free Throw.",13,15,"Texas State","Arkansas-Pine Bluff",NA,"400990377"
58,1,"11:22",1882,"Eric Terry made Free Throw.",13,16,"Texas State","Arkansas-Pine Bluff",NA,"400990377"
59,1,"11:05",1865,"Foul on Eric Terry.",13,16,"Texas State","Arkansas-Pine Bluff",NA,"400990377"
60,1,"10:48",1848,"Cameron Posey missed Three Point Jumper.",13,16,"Texas State","Arkansas-Pine Bluff",NA,"400990377"
61,1,"10:48",1848,"Christian Robertson Offensive Rebound.",13,16,"Texas State","Arkansas-Pine Bluff",NA,"400990377"
62,1,"10:34",1834,"Travon Harper missed Three Point Jumper.",13,16,"Texas State","Arkansas-Pine Bluff",NA,"400990377"
63,1,"10:34",1834,"Tre'Larenz Nottingham Defensive Rebound.",13,16,"Texas State","Arkansas-Pine Bluff",NA,"400990377"
64,1,"10:13",1813,"Alex Peacock made Jumper.",13,18,"Texas State","Arkansas-Pine Bluff",NA,"400990377"
65,1,"9:57",1797,"Cameron Posey made Layup.",15,18,"Texas State","Arkansas-Pine Bluff",NA,"400990377"
66,1,"9:37",1777,"Foul on Artavious McDyess.",15,18,"Texas State","Arkansas-Pine Bluff",NA,"400990377"
67,1,"9:37",1777,"Deris Duncan made Free Throw.",15,19,"Texas State","Arkansas-Pine Bluff",NA,"400990377"
68,1,"9:37",1777,"Deris Duncan made Free Throw.",15,20,"Texas State","Arkansas-Pine Bluff",NA,"400990377"
69,1,"9:21",1761,"Martaveous McKnight missed Three Point Jumper.",15,20,"Texas State","Arkansas-Pine Bluff",NA,"400990377"
70,1,"9:21",1761,"Tre'Larenz Nottingham Defensive Rebound.",15,20,"Texas State","Arkansas-Pine Bluff",NA,"400990377"
71,1,"9:14",1754,"Foul on Eric Terry.",15,20,"Texas State","Arkansas-Pine Bluff",NA,"400990377"
72,1,"9:14",1754,"Eric Terry Turnover.",15,20,"Texas State","Arkansas-Pine Bluff",NA,"400990377"
73,1,"9:00",1740,"Cameron Posey Turnover.",15,20,"Texas State","Arkansas-Pine Bluff",NA,"400990377"
74,1,"8:59",1739,"Deris Duncan Steal.",15,20,"Texas State","Arkansas-Pine Bluff",NA,"400990377"
75,1,"8:59",1739,"Foul on Charles Jackson.",15,20,"Texas State","Arkansas-Pine Bluff",NA,"400990377"
76,1,"8:55",1735,"Tre'Larenz Nottingham missed Three Point Jumper.",15,20,"Texas State","Arkansas-Pine Bluff",NA,"400990377"
77,1,"8:55",1735,"Isaiah Gurley Offensive Rebound.",15,20,"Texas State","Arkansas-Pine Bluff",NA,"400990377"
78,1,"8:38",1718,"Immanuel King missed Layup.",15,20,"Texas State","Arkansas-Pine Bluff",NA,"400990377"
79,1,"8:38",1718,"Artavious McDyess Block.",15,20,"Texas State","Arkansas-Pine Bluff",NA,"400990377"
80,1,"8:38",1718,"Artavious McDyess Defensive Rebound.",15,20,"Texas State","Arkansas-Pine Bluff",NA,"400990377"
81,1,"8:29",1709,"Cameron Posey made Three Point Jumper. Assisted by Martaveous McKnight.",18,20,"Texas State","Arkansas-Pine Bluff",NA,"400990377"
82,1,"8:06",1686,"Deris Duncan missed Three Point Jumper.",18,20,"Texas State","Arkansas-Pine Bluff",NA,"400990377"
83,1,"8:06",1686,"Artavious McDyess Defensive Rebound.",18,20,"Texas State","Arkansas-Pine Bluff",NA,"400990377"
84,1,"7:54",1674,"Charles Jackson missed Three Point Jumper.",18,20,"Texas State","Arkansas-Pine Bluff",NA,"400990377"
85,1,"7:54",1674,"Alex Peacock Defensive Rebound.",18,20,"Texas State","Arkansas-Pine Bluff",NA,"400990377"
86,1,"7:36",1656,"Immanuel King Turnover.",18,20,"Texas State","Arkansas-Pine Bluff",NA,"400990377"
87,1,"7:36",1656,"Official TV Timeout",18,20,"Texas State","Arkansas-Pine Bluff",NA,"400990377"
88,1,"7:24",1644,"Foul on David Tillman.",18,20,"Texas State","Arkansas-Pine Bluff",NA,"400990377"
89,1,"7:24",1644,"David Tillman Turnover.",18,20,"Texas State","Arkansas-Pine Bluff",NA,"400990377"
90,1,"7:04",1624,"Alex Peacock missed Three Point Jumper.",18,20,"Texas State","Arkansas-Pine Bluff",NA,"400990377"
91,1,"7:04",1624,"Nijal Pearson Offensive Rebound.",18,20,"Texas State","Arkansas-Pine Bluff",NA,"400990377"
92,1,"6:57",1617,"Nijal Pearson made Layup.",18,22,"Texas State","Arkansas-Pine Bluff",NA,"400990377"
93,1,"6:42",1602,"Martaveous McKnight made Jumper. Assisted by Charles Jackson.",20,22,"Texas State","Arkansas-Pine Bluff",NA,"400990377"
94,1,"6:23",1583,"Immanuel King made Jumper.",20,24,"Texas State","Arkansas-Pine Bluff",NA,"400990377"
95,1,"6:04",1564,"Martaveous McKnight missed Jumper.",20,24,"Texas State","Arkansas-Pine Bluff",NA,"400990377"
96,1,"6:04",1564,"Alex Peacock Defensive Rebound.",20,24,"Texas State","Arkansas-Pine Bluff",NA,"400990377"
97,1,"5:50",1550,"Immanuel King made Layup. Assisted by Alex Peacock.",20,26,"Texas State","Arkansas-Pine Bluff",NA,"400990377"
98,1,"5:28",1528,"Charles Jackson Turnover.",20,26,"Texas State","Arkansas-Pine Bluff",NA,"400990377"
99,1,"5:07",1507,"Tyler Blount missed Three Point Jumper.",20,26,"Texas State","Arkansas-Pine Bluff",NA,"400990377"
100,1,"5:07",1507,"Alex Peacock Offensive Rebound.",20,26,"Texas State","Arkansas-Pine Bluff",NA,"400990377"
101,1,"5:02",1502,"Alex Peacock made Layup.",20,28,"Texas State","Arkansas-Pine Bluff",NA,"400990377"
102,1,"5:00",1500,"Arkansas-Pine Bluff  Timeout",20,28,"Texas State","Arkansas-Pine Bluff",NA,"400990377"
103,1,"4:48",1488,"Cameron Posey Turnover.",20,28,"Texas State","Arkansas-Pine Bluff",NA,"400990377"
104,1,"4:47",1487,"Alex Peacock Steal.",20,28,"Texas State","Arkansas-Pine Bluff",NA,"400990377"
105,1,"4:43",1483,"Nijal Pearson missed Layup.",20,28,"Texas State","Arkansas-Pine Bluff",NA,"400990377"
106,1,"4:43",1483,"Martaveous McKnight Defensive Rebound.",20,28,"Texas State","Arkansas-Pine Bluff",NA,"400990377"
107,1,"4:25",1465,"Martaveous McKnight missed Jumper.",20,28,"Texas State","Arkansas-Pine Bluff",NA,"400990377"
108,1,"4:25",1465,"Alex Peacock Block.",20,28,"Texas State","Arkansas-Pine Bluff",NA,"400990377"
109,1,"4:25",1465,"Marlin Davis Defensive Rebound.",20,28,"Texas State","Arkansas-Pine Bluff",NA,"400990377"
110,1,"4:13",1453,"Alex Peacock made Jumper.",20,30,"Texas State","Arkansas-Pine Bluff",NA,"400990377"
111,1,"3:41",1421,"Christian Robertson missed Jumper.",20,30,"Texas State","Arkansas-Pine Bluff",NA,"400990377"
112,1,"3:41",1421,"Alex Peacock Defensive Rebound.",20,30,"Texas State","Arkansas-Pine Bluff",NA,"400990377"
113,1,"3:34",1414,"Official TV Timeout",20,30,"Texas State","Arkansas-Pine Bluff",NA,"400990377"
114,1,"3:11",1391,"Nijal Pearson missed Jumper.",20,30,"Texas State","Arkansas-Pine Bluff",NA,"400990377"
115,1,"3:11",1391,"Martaveous McKnight Defensive Rebound.",20,30,"Texas State","Arkansas-Pine Bluff",NA,"400990377"
116,1,"3:11",1391,"Foul on Alex Peacock.",20,30,"Texas State","Arkansas-Pine Bluff",NA,"400990377"
117,1,"3:07",1387,"Martaveous McKnight made Free Throw.",21,30,"Texas State","Arkansas-Pine Bluff",NA,"400990377"
118,1,"3:07",1387,"Martaveous McKnight made Free Throw.",22,30,"Texas State","Arkansas-Pine Bluff",NA,"400990377"
119,1,"2:44",1364,"Alex Peacock made Three Point Jumper. Assisted by Tyler Blount.",22,33,"Texas State","Arkansas-Pine Bluff",NA,"400990377"
120,1,"2:20",1340,"Charles Jackson made Three Point Jumper.",25,33,"Texas State","Arkansas-Pine Bluff",NA,"400990377"
121,1,"2:08",1328,"Nijal Pearson made Three Point Jumper. Assisted by Tyler Blount.",25,36,"Texas State","Arkansas-Pine Bluff",NA,"400990377"
122,1,"1:46",1306,"Foul on Marlin Davis.",25,36,"Texas State","Arkansas-Pine Bluff",NA,"400990377"
123,1,"1:46",1306,"Charles Jackson missed Free Throw.",25,36,"Texas State","Arkansas-Pine Bluff",NA,"400990377"
124,1,"1:46",1306,"Alex Peacock Defensive Rebound.",25,36,"Texas State","Arkansas-Pine Bluff",NA,"400990377"
125,1,"1:26",1286,"Alex Peacock made Layup. Assisted by Tyler Blount.",25,38,"Texas State","Arkansas-Pine Bluff",NA,"400990377"
126,1,"1:26",1286,"Foul on Trent Steen.",25,38,"Texas State","Arkansas-Pine Bluff",NA,"400990377"
127,1,"1:26",1286,"Alex Peacock made Free Throw.",25,39,"Texas State","Arkansas-Pine Bluff",NA,"400990377"
128,1,"1:02",1262,"Charles Jackson made Jumper.",27,39,"Texas State","Arkansas-Pine Bluff",NA,"400990377"
129,1,"0:33",1233,"Tre'Larenz Nottingham missed Three Point Jumper.",27,39,"Texas State","Arkansas-Pine Bluff",NA,"400990377"
130,1,"0:33",1233,"Artavious McDyess Defensive Rebound.",27,39,"Texas State","Arkansas-Pine Bluff",NA,"400990377"
131,1,"0:07",1207,"Charles Jackson missed Three Point Jumper.",27,39,"Texas State","Arkansas-Pine Bluff",NA,"400990377"
132,1,"0:07",1207,"Christian Robertson Offensive Rebound.",27,39,"Texas State","Arkansas-Pine Bluff",NA,"400990377"
133,1,"0:00",1200,"Christian Robertson missed Layup.",27,39,"Texas State","Arkansas-Pine Bluff",NA,"400990377"
134,1,"0:00",1200,"Immanuel King Defensive Rebound.",27,39,"Texas State","Arkansas-Pine Bluff",NA,"400990377"
135,1,"0:00",1200,"End of 1st half",27,39,"Texas State","Arkansas-Pine Bluff",NA,"400990377"
136,2,"20:00",1200,"PLAY",27,39,"Texas State","Arkansas-Pine Bluff",NA,"400990377"
137,2,"19:45",1185,"Immanuel King missed Layup.",27,39,"Texas State","Arkansas-Pine Bluff",NA,"400990377"
138,2,"19:45",1185,"Nijal Pearson Offensive Rebound.",27,39,"Texas State","Arkansas-Pine Bluff",NA,"400990377"
139,2,"19:41",1181,"Nijal Pearson missed Layup.",27,39,"Texas State","Arkansas-Pine Bluff",NA,"400990377"
140,2,"19:41",1181,"Charles Jackson Defensive Rebound.",27,39,"Texas State","Arkansas-Pine Bluff",NA,"400990377"
141,2,"19:20",1160,"Charles Jackson made Jumper.",29,39,"Texas State","Arkansas-Pine Bluff",NA,"400990377"
142,2,"19:01",1141,"Nedeljko Prijovic missed Jumper.",29,39,"Texas State","Arkansas-Pine Bluff",NA,"400990377"
143,2,"19:01",1141,"Trent Steen Defensive Rebound.",29,39,"Texas State","Arkansas-Pine Bluff",NA,"400990377"
144,2,"18:59",1139,"Foul on Immanuel King.",29,39,"Texas State","Arkansas-Pine Bluff",NA,"400990377"
145,2,"18:29",1109,"Arkansas-Pine Bluff  Turnover.",29,39,"Texas State","Arkansas-Pine Bluff",NA,"400990377"
146,2,"18:16",1096,"Nijal Pearson missed Three Point Jumper.",29,39,"Texas State","Arkansas-Pine Bluff",NA,"400990377"
147,2,"18:16",1096,"Immanuel King Offensive Rebound.",29,39,"Texas State","Arkansas-Pine Bluff",NA,"400990377"
148,2,"18:13",1093,"Foul on Immanuel King.",29,39,"Texas State","Arkansas-Pine Bluff",NA,"400990377"
149,2,"18:00",1080,"Martaveous McKnight Turnover.",29,39,"Texas State","Arkansas-Pine Bluff",NA,"400990377"
150,2,"17:58",1078,"Nijal Pearson Steal.",29,39,"Texas State","Arkansas-Pine Bluff",NA,"400990377"
151,2,"17:56",1076,"Nijal Pearson missed Layup.",29,39,"Texas State","Arkansas-Pine Bluff",NA,"400990377"
152,2,"17:56",1076,"Cameron Posey Defensive Rebound.",29,39,"Texas State","Arkansas-Pine Bluff",NA,"400990377"
153,2,"17:35",1055,"Trent Steen made Jumper. Assisted by Cameron Posey.",31,39,"Texas State","Arkansas-Pine Bluff",NA,"400990377"
154,2,"17:15",1035,"Marlin Davis missed Jumper.",31,39,"Texas State","Arkansas-Pine Bluff",NA,"400990377"
155,2,"17:15",1035,"Immanuel King Offensive Rebound.",31,39,"Texas State","Arkansas-Pine Bluff",NA,"400990377"
156,2,"17:12",1032,"Foul on Trent Steen.",31,39,"Texas State","Arkansas-Pine Bluff",NA,"400990377"
157,2,"16:57",1017,"Immanuel King Turnover.",31,39,"Texas State","Arkansas-Pine Bluff",NA,"400990377"
158,2,"16:43",1003,"Foul on Travon Harper.",31,39,"Texas State","Arkansas-Pine Bluff",NA,"400990377"
159,2,"16:43",1003,"Travon Harper Turnover.",31,39,"Texas State","Arkansas-Pine Bluff",NA,"400990377"
160,2,"16:33",993,"Tyler Blount made Three Point Jumper. Assisted by Marlin Davis.",31,42,"Texas State","Arkansas-Pine Bluff",NA,"400990377"
161,2,"16:19",979,"Foul on Artavious McDyess.",31,42,"Texas State","Arkansas-Pine Bluff",NA,"400990377"
162,2,"16:19",979,"Artavious McDyess Turnover.",31,42,"Texas State","Arkansas-Pine Bluff",NA,"400990377"
163,2,"16:06",966,"Nedeljko Prijovic made Jumper. Assisted by Marlin Davis.",31,44,"Texas State","Arkansas-Pine Bluff",NA,"400990377"
164,2,"15:49",949,"Travon Harper made Dunk. Assisted by Charles Jackson.",33,44,"Texas State","Arkansas-Pine Bluff",NA,"400990377"
165,2,"15:28",928,"Foul on Artavious McDyess.",33,44,"Texas State","Arkansas-Pine Bluff",NA,"400990377"
166,2,"15:28",928,"Official TV Timeout",33,44,"Texas State","Arkansas-Pine Bluff",NA,"400990377"
167,2,"15:14",914,"Nijal Pearson made Three Point Jumper. Assisted by Marlin Davis.",33,47,"Texas State","Arkansas-Pine Bluff",NA,"400990377"
168,2,"14:59",899,"Foul on Artavious McDyess.",33,47,"Texas State","Arkansas-Pine Bluff",NA,"400990377"
169,2,"14:39",879,"Immanuel King Turnover.",33,47,"Texas State","Arkansas-Pine Bluff",NA,"400990377"
170,2,"14:16",856,"Christian Robertson missed Layup.",33,47,"Texas State","Arkansas-Pine Bluff",NA,"400990377"
171,2,"14:16",856,"Immanuel King Block.",33,47,"Texas State","Arkansas-Pine Bluff",NA,"400990377"
172,2,"14:16",856,"Immanuel King Defensive Rebound.",33,47,"Texas State","Arkansas-Pine Bluff",NA,"400990377"
173,2,"13:59",839,"Tyler Blount Turnover.",33,47,"Texas State","Arkansas-Pine Bluff",NA,"400990377"
174,2,"13:59",839,"Charles Jackson Steal.",33,47,"Texas State","Arkansas-Pine Bluff",NA,"400990377"
175,2,"13:38",818,"Trent Steen missed Jumper.",33,47,"Texas State","Arkansas-Pine Bluff",NA,"400990377"
176,2,"13:38",818,"Tyler Blount Defensive Rebound.",33,47,"Texas State","Arkansas-Pine Bluff",NA,"400990377"
177,2,"13:30",810,"Foul on Cameron Posey.",33,47,"Texas State","Arkansas-Pine Bluff",NA,"400990377"
178,2,"13:30",810,"Eric Terry missed Free Throw.",33,47,"Texas State","Arkansas-Pine Bluff",NA,"400990377"
179,2,"13:30",810,"Texas State Deadball Team Rebound.",33,47,"Texas State","Arkansas-Pine Bluff",NA,"400990377"
180,2,"13:30",810,"Eric Terry made Free Throw.",33,48,"Texas State","Arkansas-Pine Bluff",NA,"400990377"
181,2,"13:08",788,"Trent Steen missed Jumper.",33,48,"Texas State","Arkansas-Pine Bluff",NA,"400990377"
182,2,"13:08",788,"Dwain Whitfield Offensive Rebound.",33,48,"Texas State","Arkansas-Pine Bluff",NA,"400990377"
183,2,"13:06",786,"Foul on Alex Peacock.",33,48,"Texas State","Arkansas-Pine Bluff",NA,"400990377"
184,2,"13:06",786,"Foul on Dwain Whitfield.",33,48,"Texas State","Arkansas-Pine Bluff",NA,"400990377"
185,2,"13:06",786,"Dwain Whitfield Turnover.",33,48,"Texas State","Arkansas-Pine Bluff",NA,"400990377"
186,2,"13:00",780,"Foul on Trent Steen.",33,48,"Texas State","Arkansas-Pine Bluff",NA,"400990377"
187,2,"12:49",769,"Isaiah Gurley missed Free Throw.",33,48,"Texas State","Arkansas-Pine Bluff",NA,"400990377"
188,2,"12:49",769,"Texas State Deadball Team Rebound.",33,48,"Texas State","Arkansas-Pine Bluff",NA,"400990377"
189,2,"12:49",769,"Isaiah Gurley missed Free Throw.",33,48,"Texas State","Arkansas-Pine Bluff",NA,"400990377"
190,2,"12:49",769,"Dwain Whitfield Defensive Rebound.",33,48,"Texas State","Arkansas-Pine Bluff",NA,"400990377"
191,2,"12:30",750,"Charles Jackson made Jumper.",35,48,"Texas State","Arkansas-Pine Bluff",NA,"400990377"
192,2,"12:15",735,"Nedeljko Prijovic made Jumper. Assisted by Eric Terry.",35,50,"Texas State","Arkansas-Pine Bluff",NA,"400990377"
193,2,"11:48",708,"Trent Steen missed Jumper.",35,50,"Texas State","Arkansas-Pine Bluff",NA,"400990377"
194,2,"11:48",708,"Nijal Pearson Defensive Rebound.",35,50,"Texas State","Arkansas-Pine Bluff",NA,"400990377"
195,2,"11:38",698,"Foul on Nijal Pearson.",35,50,"Texas State","Arkansas-Pine Bluff",NA,"400990377"
196,2,"11:38",698,"Nijal Pearson Turnover.",35,50,"Texas State","Arkansas-Pine Bluff",NA,"400990377"
197,2,"11:38",698,"Official TV Timeout",35,50,"Texas State","Arkansas-Pine Bluff",NA,"400990377"
198,2,"11:25",685,"Foul on Eric Terry.",35,50,"Texas State","Arkansas-Pine Bluff",NA,"400990377"
199,2,"11:20",680,"Trent Steen missed Jumper.",35,50,"Texas State","Arkansas-Pine Bluff",NA,"400990377"
200,2,"11:20",680,"Isaiah Gurley Defensive Rebound.",35,50,"Texas State","Arkansas-Pine Bluff",NA,"400990377"
201,2,"11:19",679,"Foul on Dwain Whitfield.",35,50,"Texas State","Arkansas-Pine Bluff",NA,"400990377"
202,2,"11:19",679,"Nedeljko Prijovic missed Free Throw.",35,50,"Texas State","Arkansas-Pine Bluff",NA,"400990377"
203,2,"11:19",679,"Charles Jackson Defensive Rebound.",35,50,"Texas State","Arkansas-Pine Bluff",NA,"400990377"
204,2,"11:00",660,"Foul on Nedeljko Prijovic.",35,50,"Texas State","Arkansas-Pine Bluff",NA,"400990377"
205,2,"11:00",660,"Travon Harper missed Free Throw.",35,50,"Texas State","Arkansas-Pine Bluff",NA,"400990377"
206,2,"11:00",660,"Arkansas-Pine Bluff Deadball Team Rebound.",35,50,"Texas State","Arkansas-Pine Bluff",NA,"400990377"
207,2,"11:00",660,"Travon Harper made Free Throw.",36,50,"Texas State","Arkansas-Pine Bluff",NA,"400990377"
208,2,"10:42",642,"Isaiah Gurley made Three Point Jumper. Assisted by Alex Peacock.",36,53,"Texas State","Arkansas-Pine Bluff",NA,"400990377"
209,2,"10:09",609,"Travon Harper Turnover.",36,53,"Texas State","Arkansas-Pine Bluff",NA,"400990377"
210,2,"9:56",596,"Isaiah Gurley missed Jumper.",36,53,"Texas State","Arkansas-Pine Bluff",NA,"400990377"
211,2,"9:56",596,"Alex Peacock Offensive Rebound.",36,53,"Texas State","Arkansas-Pine Bluff",NA,"400990377"
212,2,"9:51",591,"Alex Peacock missed Layup.",36,53,"Texas State","Arkansas-Pine Bluff",NA,"400990377"
213,2,"9:51",591,"Artavious McDyess Block.",36,53,"Texas State","Arkansas-Pine Bluff",NA,"400990377"
214,2,"9:51",591,"Eric Terry Offensive Rebound.",36,53,"Texas State","Arkansas-Pine Bluff",NA,"400990377"
215,2,"9:39",579,"Alex Peacock missed Layup.",36,53,"Texas State","Arkansas-Pine Bluff",NA,"400990377"
216,2,"9:39",579,"Arkansas-Pine Bluff Defensive Rebound.",36,53,"Texas State","Arkansas-Pine Bluff",NA,"400990377"
217,2,"9:27",567,"Foul on Isaiah Gurley.",36,53,"Texas State","Arkansas-Pine Bluff",NA,"400990377"
218,2,"9:27",567,"Charles Jackson made Free Throw.",37,53,"Texas State","Arkansas-Pine Bluff",NA,"400990377"
219,2,"9:27",567,"Charles Jackson missed Free Throw.",37,53,"Texas State","Arkansas-Pine Bluff",NA,"400990377"
220,2,"9:27",567,"Isaiah Gurley Defensive Rebound.",37,53,"Texas State","Arkansas-Pine Bluff",NA,"400990377"
221,2,"9:18",558,"Tre'Larenz Nottingham Turnover.",37,53,"Texas State","Arkansas-Pine Bluff",NA,"400990377"
222,2,"9:02",542,"Charles Jackson made Jumper.",39,53,"Texas State","Arkansas-Pine Bluff",NA,"400990377"
223,2,"8:59",539,"Arkansas-Pine Bluff  Timeout",39,53,"Texas State","Arkansas-Pine Bluff",NA,"400990377"
224,2,"8:59",539,"Official TV Timeout",39,53,"Texas State","Arkansas-Pine Bluff",NA,"400990377"
225,2,"8:41",521,"Nijal Pearson Turnover.",39,53,"Texas State","Arkansas-Pine Bluff",NA,"400990377"
226,2,"8:40",520,"Travon Harper Steal.",39,53,"Texas State","Arkansas-Pine Bluff",NA,"400990377"
227,2,"8:39",519,"Foul on Nijal Pearson.",39,53,"Texas State","Arkansas-Pine Bluff",NA,"400990377"
228,2,"8:39",519,"Travon Harper made Free Throw.",40,53,"Texas State","Arkansas-Pine Bluff",NA,"400990377"
229,2,"8:39",519,"Travon Harper made Free Throw.",41,53,"Texas State","Arkansas-Pine Bluff",NA,"400990377"
230,2,"8:21",501,"Alex Peacock Turnover.",41,53,"Texas State","Arkansas-Pine Bluff",NA,"400990377"
231,2,"8:07",487,"Foul on Alex Peacock.",41,53,"Texas State","Arkansas-Pine Bluff",NA,"400990377"
232,2,"8:07",487,"Travon Harper made Free Throw.",42,53,"Texas State","Arkansas-Pine Bluff",NA,"400990377"
233,2,"8:07",487,"Travon Harper made Free Throw.",43,53,"Texas State","Arkansas-Pine Bluff",NA,"400990377"
234,2,"7:37",457,"Immanuel King made Layup. Assisted by Alex Peacock.",43,55,"Texas State","Arkansas-Pine Bluff",NA,"400990377"
235,2,"7:14",434,"Travon Harper made Jumper.",45,55,"Texas State","Arkansas-Pine Bluff",NA,"400990377"
236,2,"6:50",410,"Foul on Artavious McDyess.",45,55,"Texas State","Arkansas-Pine Bluff",NA,"400990377"
237,2,"6:50",410,"Official TV Timeout",45,55,"Texas State","Arkansas-Pine Bluff",NA,"400990377"
