"play_id","half","time_remaining_half","secs_remaining","description","home_score","away_score","away","home","home_favored_by","game_id"
1,1,"20:00",2400,"PLAY",0,0,"Texas State","Air Force",3,"400990359"
2,1,"19:36",2376,"Lavelle Scottie missed Jumper.",0,0,"Texas State","Air Force",3,"400990359"
3,1,"19:36",2376,"Pervis Louder Offensive Rebound.",0,0,"Texas State","Air Force",3,"400990359"
4,1,"19:16",2356,"Foul on Immanuel King.",0,0,"Texas State","Air Force",3,"400990359"
5,1,"18:59",2339,"Lavelle Scottie missed Three Point Jumper.",0,0,"Texas State","Air Force",3,"400990359"
6,1,"18:59",2339,"Tyler Blount Defensive Rebound.",0,0,"Texas State","Air Force",3,"400990359"
7,1,"18:30",2310,"Immanuel King made Jumper. Assisted by Nijal Pearson.",0,2,"Texas State","Air Force",3,"400990359"
8,1,"18:14",2294,"Foul on Immanuel King.",0,2,"Texas State","Air Force",3,"400990359"
9,1,"18:12",2292,"Foul on Nedeljko Prijovic.",0,2,"Texas State","Air Force",3,"400990359"
10,1,"18:10",2290,"Pervis Louder made Layup. Assisted by Trevor Lyons.",2,2,"Texas State","Air Force",3,"400990359"
11,1,"17:55",2275,"Foul on Eric Terry.",2,2,"Texas State","Air Force",3,"400990359"
12,1,"17:55",2275,"Eric Terry Turnover.",2,2,"Texas State","Air Force",3,"400990359"
13,1,"17:55",2275,"Jacob Van missed Free Throw.",2,2,"Texas State","Air Force",3,"400990359"
14,1,"17:55",2275,"Air Force Deadball Team Rebound.",2,2,"Texas State","Air Force",3,"400990359"
15,1,"17:55",2275,"Jacob Van made Free Throw.",3,2,"Texas State","Air Force",3,"400990359"
16,1,"17:34",2254,"Lavelle Scottie missed Jumper.",3,2,"Texas State","Air Force",3,"400990359"
17,1,"17:34",2254,"Eric Terry Defensive Rebound.",3,2,"Texas State","Air Force",3,"400990359"
18,1,"17:18",2238,"Foul on Lavelle Scottie.",3,2,"Texas State","Air Force",3,"400990359"
19,1,"17:09",2229,"Nijal Pearson missed Jumper.",3,2,"Texas State","Air Force",3,"400990359"
20,1,"17:09",2229,"Ryan Swan Block.",3,2,"Texas State","Air Force",3,"400990359"
21,1,"17:07",2227,"Ryan Swan Defensive Rebound.",3,2,"Texas State","Air Force",3,"400990359"
22,1,"16:59",2219,"Trevor Lyons made Three Point Jumper. Assisted by Pervis Louder.",6,2,"Texas State","Air Force",3,"400990359"
23,1,"16:42",2202,"Nijal Pearson Turnover.",6,2,"Texas State","Air Force",3,"400990359"
24,1,"16:12",2172,"Lavelle Scottie missed Jumper.",6,2,"Texas State","Air Force",3,"400990359"
25,1,"16:12",2172,"Marlin Davis Defensive Rebound.",6,2,"Texas State","Air Force",3,"400990359"
26,1,"15:59",2159,"Tyler Blount missed Three Point Jumper.",6,2,"Texas State","Air Force",3,"400990359"
27,1,"15:59",2159,"Trevor Lyons Defensive Rebound.",6,2,"Texas State","Air Force",3,"400990359"
28,1,"15:53",2153,"Foul on Tyler Blount.",6,2,"Texas State","Air Force",3,"400990359"
29,1,"15:53",2153,"Official TV Timeout",6,2,"Texas State","Air Force",3,"400990359"
30,1,"15:38",2138,"CJ Siples made Three Point Jumper. Assisted by Lavelle Scottie.",9,2,"Texas State","Air Force",3,"400990359"
31,1,"15:30",2130,"Nijal Pearson made Three Point Jumper.",9,5,"Texas State","Air Force",3,"400990359"
32,1,"15:08",2108,"Ryan Manning missed Three Point Jumper.",9,5,"Texas State","Air Force",3,"400990359"
33,1,"15:08",2108,"Nedeljko Prijovic Defensive Rebound.",9,5,"Texas State","Air Force",3,"400990359"
34,1,"14:49",2089,"Nijal Pearson made Three Point Jumper. Assisted by Nedeljko Prijovic.",9,8,"Texas State","Air Force",3,"400990359"
35,1,"14:34",2074,"Ryan Manning made Layup. Assisted by Ryan Swan.",11,8,"Texas State","Air Force",3,"400990359"
36,1,"14:21",2061,"Nijal Pearson Turnover.",11,8,"Texas State","Air Force",3,"400990359"
37,1,"14:20",2060,"Lavelle Scottie Steal.",11,8,"Texas State","Air Force",3,"400990359"
38,1,"14:17",2057,"CJ Siples made Layup. Assisted by Trevor Lyons.",13,8,"Texas State","Air Force",3,"400990359"
39,1,"14:01",2041,"Nedeljko Prijovic made Layup.",13,10,"Texas State","Air Force",3,"400990359"
40,1,"13:43",2023,"Lavelle Scottie missed Jumper.",13,10,"Texas State","Air Force",3,"400990359"
41,1,"13:43",2023,"Nedeljko Prijovic Defensive Rebound.",13,10,"Texas State","Air Force",3,"400990359"
42,1,"13:28",2008,"Tre'Larenz Nottingham missed Three Point Jumper.",13,10,"Texas State","Air Force",3,"400990359"
43,1,"13:28",2008,"CJ Siples Defensive Rebound.",13,10,"Texas State","Air Force",3,"400990359"
44,1,"13:07",1987,"Lavelle Scottie missed Jumper.",13,10,"Texas State","Air Force",3,"400990359"
45,1,"13:07",1987,"Ryan Manning Offensive Rebound.",13,10,"Texas State","Air Force",3,"400990359"
46,1,"13:03",1983,"Ryan Manning made Dunk.",15,10,"Texas State","Air Force",3,"400990359"
47,1,"12:35",1955,"Nedeljko Prijovic made Jumper. Assisted by Marlin Davis.",15,12,"Texas State","Air Force",3,"400990359"
48,1,"12:10",1930,"Lavelle Scottie missed Three Point Jumper.",15,12,"Texas State","Air Force",3,"400990359"
49,1,"12:10",1930,"Nedeljko Prijovic Defensive Rebound.",15,12,"Texas State","Air Force",3,"400990359"
50,1,"12:02",1922,"Texas State  Timeout",15,12,"Texas State","Air Force",3,"400990359"
51,1,"12:02",1922,"Official TV Timeout",15,12,"Texas State","Air Force",3,"400990359"
52,1,"11:50",1910,"Reggie Miller missed Layup.",15,12,"Texas State","Air Force",3,"400990359"
53,1,"11:50",1910,"Ryan Manning Defensive Rebound.",15,12,"Texas State","Air Force",3,"400990359"
54,1,"11:29",1889,"Dane Norman missed Three Point Jumper.",15,12,"Texas State","Air Force",3,"400990359"
55,1,"11:29",1889,"Tre'Larenz Nottingham Defensive Rebound.",15,12,"Texas State","Air Force",3,"400990359"
56,1,"10:55",1855,"Texas State  Turnover.",15,12,"Texas State","Air Force",3,"400990359"
57,1,"10:42",1842,"Jonathan DeWane missed Layup.",15,12,"Texas State","Air Force",3,"400990359"
58,1,"10:42",1842,"Nijal Pearson Defensive Rebound.",15,12,"Texas State","Air Force",3,"400990359"
59,1,"10:28",1828,"Tre'Larenz Nottingham Turnover.",15,12,"Texas State","Air Force",3,"400990359"
60,1,"10:26",1826,"CJ Siples Steal.",15,12,"Texas State","Air Force",3,"400990359"
61,1,"10:25",1825,"Foul on CJ Siples.",15,12,"Texas State","Air Force",3,"400990359"
62,1,"10:25",1825,"CJ Siples Turnover.",15,12,"Texas State","Air Force",3,"400990359"
63,1,"10:08",1808,"Alex Peacock Turnover.",15,12,"Texas State","Air Force",3,"400990359"
64,1,"10:07",1807,"Jacob Van Steal.",15,12,"Texas State","Air Force",3,"400990359"
65,1,"9:42",1782,"Ryan Manning missed Three Point Jumper.",15,12,"Texas State","Air Force",3,"400990359"
66,1,"9:42",1782,"Nijal Pearson Defensive Rebound.",15,12,"Texas State","Air Force",3,"400990359"
67,1,"9:30",1770,"Nijal Pearson made Jumper.",15,14,"Texas State","Air Force",3,"400990359"
68,1,"9:07",1747,"Dane Norman Turnover.",15,14,"Texas State","Air Force",3,"400990359"
69,1,"9:05",1745,"Alex Peacock Steal.",15,14,"Texas State","Air Force",3,"400990359"
70,1,"9:03",1743,"Alex Peacock Turnover.",15,14,"Texas State","Air Force",3,"400990359"
71,1,"8:54",1734,"Trevor Lyons made Layup. Assisted by Jacob Van.",17,14,"Texas State","Air Force",3,"400990359"
72,1,"8:40",1720,"Shelby Adams missed Jumper.",17,14,"Texas State","Air Force",3,"400990359"
73,1,"8:40",1720,"Dane Norman Defensive Rebound.",17,14,"Texas State","Air Force",3,"400990359"
74,1,"8:26",1706,"Jacob Van missed Jumper.",17,14,"Texas State","Air Force",3,"400990359"
75,1,"8:26",1706,"Alex Peacock Defensive Rebound.",17,14,"Texas State","Air Force",3,"400990359"
76,1,"8:02",1682,"Marlin Davis made Three Point Jumper. Assisted by Eric Terry.",17,17,"Texas State","Air Force",3,"400990359"
77,1,"7:25",1645,"Jacob Van missed Three Point Jumper.",17,17,"Texas State","Air Force",3,"400990359"
78,1,"7:25",1645,"Ryan Swan Offensive Rebound.",17,17,"Texas State","Air Force",3,"400990359"
79,1,"7:20",1640,"Ryan Swan missed Jumper.",17,17,"Texas State","Air Force",3,"400990359"
80,1,"7:20",1640,"Deris Duncan Defensive Rebound.",17,17,"Texas State","Air Force",3,"400990359"
81,1,"7:20",1640,"Foul on Ryan Swan.",17,17,"Texas State","Air Force",3,"400990359"
82,1,"7:20",1640,"Official TV Timeout",17,17,"Texas State","Air Force",3,"400990359"
83,1,"7:08",1628,"Deris Duncan Turnover.",17,17,"Texas State","Air Force",3,"400990359"
84,1,"7:06",1626,"Lavelle Scottie Steal.",17,17,"Texas State","Air Force",3,"400990359"
85,1,"7:04",1624,"Trevor Lyons missed Jumper.",17,17,"Texas State","Air Force",3,"400990359"
86,1,"7:04",1624,"Lavelle Scottie Offensive Rebound.",17,17,"Texas State","Air Force",3,"400990359"
87,1,"7:01",1621,"Lavelle Scottie made Layup.",19,17,"Texas State","Air Force",3,"400990359"
88,1,"6:49",1609,"Eric Terry Turnover.",19,17,"Texas State","Air Force",3,"400990359"
89,1,"6:36",1596,"Ryan Swan Turnover.",19,17,"Texas State","Air Force",3,"400990359"
90,1,"6:09",1569,"Marlin Davis missed Jumper.",19,17,"Texas State","Air Force",3,"400990359"
91,1,"6:09",1569,"Immanuel King Offensive Rebound.",19,17,"Texas State","Air Force",3,"400990359"
92,1,"6:07",1567,"Foul on Lavelle Scottie.",19,17,"Texas State","Air Force",3,"400990359"
93,1,"6:07",1567,"Immanuel King made Free Throw.",19,18,"Texas State","Air Force",3,"400990359"
94,1,"6:07",1567,"Immanuel King made Free Throw.",19,19,"Texas State","Air Force",3,"400990359"
95,1,"5:53",1553,"Dane Norman missed Jumper.",19,19,"Texas State","Air Force",3,"400990359"
96,1,"5:53",1553,"Nijal Pearson Block.",19,19,"Texas State","Air Force",3,"400990359"
97,1,"5:51",1551,"Immanuel King Defensive Rebound.",19,19,"Texas State","Air Force",3,"400990359"
98,1,"5:36",1536,"Tre'Larenz Nottingham Turnover.",19,19,"Texas State","Air Force",3,"400990359"
99,1,"5:35",1535,"Ryan Manning Steal.",19,19,"Texas State","Air Force",3,"400990359"
100,1,"5:31",1531,"Ryan Swan made Layup. Assisted by Ryan Manning.",21,19,"Texas State","Air Force",3,"400990359"
101,1,"5:16",1516,"Nijal Pearson missed Jumper.",21,19,"Texas State","Air Force",3,"400990359"
102,1,"5:16",1516,"Nijal Pearson Offensive Rebound.",21,19,"Texas State","Air Force",3,"400990359"
103,1,"5:13",1513,"Nijal Pearson missed Jumper.",21,19,"Texas State","Air Force",3,"400990359"
104,1,"5:13",1513,"Ryan Manning Defensive Rebound.",21,19,"Texas State","Air Force",3,"400990359"
105,1,"5:09",1509,"Air Force  Timeout",21,19,"Texas State","Air Force",3,"400990359"
106,1,"4:56",1496,"Ryan Manning missed Three Point Jumper.",21,19,"Texas State","Air Force",3,"400990359"
107,1,"4:56",1496,"Nedeljko Prijovic Defensive Rebound.",21,19,"Texas State","Air Force",3,"400990359"
108,1,"4:52",1492,"Foul on Dane Norman.",21,19,"Texas State","Air Force",3,"400990359"
109,1,"4:29",1469,"Foul on Trevor Lyons.",21,19,"Texas State","Air Force",3,"400990359"
110,1,"4:12",1452,"Nijal Pearson made Jumper.",21,21,"Texas State","Air Force",3,"400990359"
111,1,"4:12",1452,"Foul on CJ Siples.",21,21,"Texas State","Air Force",3,"400990359"
112,1,"4:12",1452,"Nijal Pearson made Free Throw.",21,22,"Texas State","Air Force",3,"400990359"
113,1,"3:59",1439,"Foul on Ryan Manning.",21,22,"Texas State","Air Force",3,"400990359"
114,1,"3:59",1439,"Ryan Manning Turnover.",21,22,"Texas State","Air Force",3,"400990359"
115,1,"3:59",1439,"Official TV Timeout",21,22,"Texas State","Air Force",3,"400990359"
116,1,"3:49",1429,"Foul on Ryan Manning.",21,22,"Texas State","Air Force",3,"400990359"
117,1,"3:49",1429,"Nedeljko Prijovic missed Free Throw.",21,22,"Texas State","Air Force",3,"400990359"
118,1,"3:49",1429,"Ryan Swan Defensive Rebound.",21,22,"Texas State","Air Force",3,"400990359"
119,1,"3:39",1419,"Sid Tomes missed Layup.",21,22,"Texas State","Air Force",3,"400990359"
120,1,"3:39",1419,"Sid Tomes Offensive Rebound.",21,22,"Texas State","Air Force",3,"400990359"
121,1,"3:25",1405,"Ryan Swan missed Jumper.",21,22,"Texas State","Air Force",3,"400990359"
122,1,"3:25",1405,"Immanuel King Block.",21,22,"Texas State","Air Force",3,"400990359"
123,1,"3:23",1403,"Ryan Swan Offensive Rebound.",21,22,"Texas State","Air Force",3,"400990359"
124,1,"3:20",1400,"Ryan Swan missed Jumper.",21,22,"Texas State","Air Force",3,"400990359"
125,1,"3:20",1400,"Dane Norman Offensive Rebound.",21,22,"Texas State","Air Force",3,"400990359"
126,1,"3:18",1398,"Dane Norman made Layup.",23,22,"Texas State","Air Force",3,"400990359"
127,1,"3:00",1380,"Marlin Davis missed Layup.",23,22,"Texas State","Air Force",3,"400990359"
128,1,"3:00",1380,"Pervis Louder Defensive Rebound.",23,22,"Texas State","Air Force",3,"400990359"
129,1,"2:53",1373,"Trevor Lyons made Three Point Jumper. Assisted by Pervis Louder.",26,22,"Texas State","Air Force",3,"400990359"
130,1,"2:29",1349,"Nedeljko Prijovic made Jumper.",26,24,"Texas State","Air Force",3,"400990359"
131,1,"2:19",1339,"Pervis Louder missed Layup.",26,24,"Texas State","Air Force",3,"400990359"
132,1,"2:19",1339,"Tre'Larenz Nottingham Defensive Rebound.",26,24,"Texas State","Air Force",3,"400990359"
133,1,"2:12",1332,"Foul on Marlin Davis.",26,24,"Texas State","Air Force",3,"400990359"
134,1,"2:12",1332,"Marlin Davis Turnover.",26,24,"Texas State","Air Force",3,"400990359"
135,1,"1:58",1318,"Ryan Swan made Jumper. Assisted by Pervis Louder.",28,24,"Texas State","Air Force",3,"400990359"
136,1,"1:30",1290,"Foul on Tre'Larenz Nottingham.",28,24,"Texas State","Air Force",3,"400990359"
137,1,"1:30",1290,"Tre'Larenz Nottingham Turnover.",28,24,"Texas State","Air Force",3,"400990359"
138,1,"1:20",1280,"Ryan Swan made Three Point Jumper. Assisted by Pervis Louder.",31,24,"Texas State","Air Force",3,"400990359"
139,1,"0:53",1253,"Nijal Pearson missed Jumper.",31,24,"Texas State","Air Force",3,"400990359"
140,1,"0:53",1253,"Ryan Swan Block.",31,24,"Texas State","Air Force",3,"400990359"
141,1,"0:52",1252,"Trevor Lyons Defensive Rebound.",31,24,"Texas State","Air Force",3,"400990359"
142,1,"0:44",1244,"Sid Tomes missed Three Point Jumper.",31,24,"Texas State","Air Force",3,"400990359"
143,1,"0:44",1244,"Dane Norman Offensive Rebound.",31,24,"Texas State","Air Force",3,"400990359"
144,1,"0:41",1241,"Dane Norman made Dunk.",33,24,"Texas State","Air Force",3,"400990359"
145,1,"0:31",1231,"Tre'Larenz Nottingham Turnover.",33,24,"Texas State","Air Force",3,"400990359"
146,1,"0:29",1229,"Pervis Louder Steal.",33,24,"Texas State","Air Force",3,"400990359"
147,1,"0:06",1206,"Sid Tomes missed Three Point Jumper.",33,24,"Texas State","Air Force",3,"400990359"
148,1,"0:06",1206,"Nijal Pearson Defensive Rebound.",33,24,"Texas State","Air Force",3,"400990359"
149,1,"0:00",1200,"Nijal Pearson Turnover.",33,24,"Texas State","Air Force",3,"400990359"
150,1,"0:00",1200,"Trevor Lyons Steal.",33,24,"Texas State","Air Force",3,"400990359"
151,1,"0:00",1200,"End of 1st half",33,24,"Texas State","Air Force",3,"400990359"
152,2,"20:00",1200,"PLAY",33,24,"Texas State","Air Force",3,"400990359"
153,2,"19:32",1172,"Tyler Blount made Three Point Jumper. Assisted by Marlin Davis.",33,27,"Texas State","Air Force",3,"400990359"
154,2,"19:04",1144,"Lavelle Scottie missed Three Point Jumper.",33,27,"Texas State","Air Force",3,"400990359"
155,2,"19:04",1144,"Ryan Swan Offensive Rebound.",33,27,"Texas State","Air Force",3,"400990359"
156,2,"18:50",1130,"Pervis Louder made Layup. Assisted by Trevor Lyons.",35,27,"Texas State","Air Force",3,"400990359"
157,2,"18:25",1105,"Nijal Pearson missed Three Point Jumper.",35,27,"Texas State","Air Force",3,"400990359"
158,2,"18:25",1105,"Trevor Lyons Defensive Rebound.",35,27,"Texas State","Air Force",3,"400990359"
159,2,"18:03",1083,"Lavelle Scottie made Three Point Jumper. Assisted by Trevor Lyons.",38,27,"Texas State","Air Force",3,"400990359"
160,2,"17:38",1058,"Nijal Pearson missed Jumper.",38,27,"Texas State","Air Force",3,"400990359"
161,2,"17:38",1058,"Jacob Van Defensive Rebound.",38,27,"Texas State","Air Force",3,"400990359"
162,2,"17:19",1039,"Ryan Swan missed Jumper.",38,27,"Texas State","Air Force",3,"400990359"
163,2,"17:19",1039,"Nijal Pearson Defensive Rebound.",38,27,"Texas State","Air Force",3,"400990359"
164,2,"17:01",1021,"Tyler Blount made Jumper.",38,29,"Texas State","Air Force",3,"400990359"
165,2,"16:47",1007,"Pervis Louder missed Jumper.",38,29,"Texas State","Air Force",3,"400990359"
166,2,"16:47",1007,"Alex Peacock Defensive Rebound.",38,29,"Texas State","Air Force",3,"400990359"
167,2,"16:24",984,"Tyler Blount missed Three Point Jumper.",38,29,"Texas State","Air Force",3,"400990359"
168,2,"16:24",984,"Trevor Lyons Defensive Rebound.",38,29,"Texas State","Air Force",3,"400990359"
169,2,"16:17",977,"Foul on Tyler Blount.",38,29,"Texas State","Air Force",3,"400990359"
170,2,"16:17",977,"Trevor Lyons made Free Throw.",39,29,"Texas State","Air Force",3,"400990359"
171,2,"16:17",977,"Lavelle Scottie Turnover.",39,29,"Texas State","Air Force",3,"400990359"
172,2,"15:55",955,"Foul on Frank Toohey.",39,29,"Texas State","Air Force",3,"400990359"
173,2,"15:55",955,"Official TV Timeout",39,29,"Texas State","Air Force",3,"400990359"
174,2,"15:36",936,"Alex Peacock missed Three Point Jumper.",39,29,"Texas State","Air Force",3,"400990359"
175,2,"15:36",936,"Pervis Louder Defensive Rebound.",39,29,"Texas State","Air Force",3,"400990359"
176,2,"15:25",925,"Foul on Alex Peacock.",39,29,"Texas State","Air Force",3,"400990359"
177,2,"15:25",925,"Pervis Louder made Free Throw.",40,29,"Texas State","Air Force",3,"400990359"
178,2,"15:25",925,"Pervis Louder made Free Throw.",41,29,"Texas State","Air Force",3,"400990359"
179,2,"15:01",901,"Marlin Davis made Jumper.",41,31,"Texas State","Air Force",3,"400990359"
180,2,"14:34",874,"CJ Siples made Jumper.",43,31,"Texas State","Air Force",3,"400990359"
181,2,"14:19",859,"Nijal Pearson missed Three Point Jumper.",43,31,"Texas State","Air Force",3,"400990359"
182,2,"14:19",859,"Air Force Defensive Rebound.",43,31,"Texas State","Air Force",3,"400990359"
183,2,"14:06",846,"Pervis Louder Turnover.",43,31,"Texas State","Air Force",3,"400990359"
184,2,"13:37",817,"Nijal Pearson made Jumper.",43,33,"Texas State","Air Force",3,"400990359"
185,2,"13:16",796,"Frank Toohey missed Jumper.",43,33,"Texas State","Air Force",3,"400990359"
186,2,"13:16",796,"Alex Peacock Defensive Rebound.",43,33,"Texas State","Air Force",3,"400990359"
187,2,"13:09",789,"Nijal Pearson missed Jumper.",43,33,"Texas State","Air Force",3,"400990359"
188,2,"13:09",789,"Ryan Manning Block.",43,33,"Texas State","Air Force",3,"400990359"
189,2,"13:07",787,"Lavelle Scottie Defensive Rebound.",43,33,"Texas State","Air Force",3,"400990359"
190,2,"12:59",779,"Ryan Manning missed Three Point Jumper.",43,33,"Texas State","Air Force",3,"400990359"
191,2,"12:59",779,"Alex Peacock Defensive Rebound.",43,33,"Texas State","Air Force",3,"400990359"
192,2,"12:38",758,"Foul on Pervis Louder.",43,33,"Texas State","Air Force",3,"400990359"
193,2,"12:35",755,"Foul on Eric Terry.",43,33,"Texas State","Air Force",3,"400990359"
194,2,"12:35",755,"Eric Terry Turnover.",43,33,"Texas State","Air Force",3,"400990359"
195,2,"12:21",741,"Ryan Manning Turnover.",43,33,"Texas State","Air Force",3,"400990359"
196,2,"12:20",740,"Eric Terry Steal.",43,33,"Texas State","Air Force",3,"400990359"
197,2,"12:02",722,"Foul on Frank Toohey.",43,33,"Texas State","Air Force",3,"400990359"
198,2,"12:00",720,"Official TV Timeout",43,33,"Texas State","Air Force",3,"400990359"
199,2,"11:44",704,"Marlin Davis missed Jumper.",43,33,"Texas State","Air Force",3,"400990359"
200,2,"11:44",704,"Eric Terry Offensive Rebound.",43,33,"Texas State","Air Force",3,"400990359"
201,2,"11:41",701,"Eric Terry made Layup.",43,35,"Texas State","Air Force",3,"400990359"
202,2,"11:19",679,"Ryan Manning made Three Point Jumper. Assisted by Sid Tomes.",46,35,"Texas State","Air Force",3,"400990359"
203,2,"11:03",663,"Eric Terry Turnover.",46,35,"Texas State","Air Force",3,"400990359"
204,2,"11:02",662,"CJ Siples Steal.",46,35,"Texas State","Air Force",3,"400990359"
205,2,"10:58",658,"Sid Tomes made Three Point Jumper. Assisted by CJ Siples.",49,35,"Texas State","Air Force",3,"400990359"
206,2,"10:45",645,"Foul on Ryan Swan.",49,35,"Texas State","Air Force",3,"400990359"
207,2,"10:28",628,"Foul on Dane Norman.",49,35,"Texas State","Air Force",3,"400990359"
208,2,"10:28",628,"Alex Peacock made Free Throw.",49,36,"Texas State","Air Force",3,"400990359"
209,2,"10:28",628,"Alex Peacock made Free Throw.",49,37,"Texas State","Air Force",3,"400990359"
210,2,"10:28",628,"Alex Peacock missed Free Throw.",49,37,"Texas State","Air Force",3,"400990359"
211,2,"10:28",628,"Ryan Swan Defensive Rebound.",49,37,"Texas State","Air Force",3,"400990359"
212,2,"9:59",599,"Ryan Swan missed Layup.",49,37,"Texas State","Air Force",3,"400990359"
213,2,"9:59",599,"Tre'Larenz Nottingham Defensive Rebound.",49,37,"Texas State","Air Force",3,"400990359"
214,2,"9:54",594,"Tre'Larenz Nottingham made Layup.",49,39,"Texas State","Air Force",3,"400990359"
215,2,"9:54",594,"Foul on CJ Siples.",49,39,"Texas State","Air Force",3,"400990359"
216,2,"9:54",594,"Tre'Larenz Nottingham missed Free Throw.",49,39,"Texas State","Air Force",3,"400990359"
217,2,"9:54",594,"Trevor Lyons Defensive Rebound.",49,39,"Texas State","Air Force",3,"400990359"
218,2,"9:31",571,"CJ Siples missed Layup.",49,39,"Texas State","Air Force",3,"400990359"
219,2,"9:31",571,"Immanuel King Block.",49,39,"Texas State","Air Force",3,"400990359"
220,2,"9:29",569,"Immanuel King Defensive Rebound.",49,39,"Texas State","Air Force",3,"400990359"
221,2,"9:01",541,"Nijal Pearson Turnover.",49,39,"Texas State","Air Force",3,"400990359"
222,2,"8:58",538,"Pervis Louder Steal.",49,39,"Texas State","Air Force",3,"400990359"
223,2,"8:56",536,"Trevor Lyons made Layup. Assisted by Lavelle Scottie.",51,39,"Texas State","Air Force",3,"400990359"
224,2,"8:55",535,"Official TV Timeout",51,39,"Texas State","Air Force",3,"400990359"
225,2,"8:36",516,"Alex Peacock made Jumper.",51,41,"Texas State","Air Force",3,"400990359"
226,2,"8:23",503,"Frank Toohey made Jumper.",53,41,"Texas State","Air Force",3,"400990359"
227,2,"8:23",503,"Foul on Immanuel King.",53,41,"Texas State","Air Force",3,"400990359"
228,2,"8:23",503,"Frank Toohey made Free Throw.",54,41,"Texas State","Air Force",3,"400990359"
229,2,"8:02",482,"Foul on Lavelle Scottie.",54,41,"Texas State","Air Force",3,"400990359"
230,2,"8:02",482,"Immanuel King missed Free Throw.",54,41,"Texas State","Air Force",3,"400990359"
231,2,"8:02",482,"Texas State Deadball Team Rebound.",54,41,"Texas State","Air Force",3,"400990359"
232,2,"8:02",482,"Immanuel King made Free Throw.",54,42,"Texas State","Air Force",3,"400990359"
233,2,"7:33",453,"Trevor Lyons made Layup.",56,42,"Texas State","Air Force",3,"400990359"
234,2,"7:19",439,"Nijal Pearson missed Three Point Jumper.",56,42,"Texas State","Air Force",3,"400990359"
235,2,"7:19",439,"Immanuel King Offensive Rebound.",56,42,"Texas State","Air Force",3,"400990359"
236,2,"7:17",437,"Foul on Frank Toohey.",56,42,"Texas State","Air Force",3,"400990359"
237,2,"7:17",437,"Official TV Timeout",56,42,"Texas State","Air Force",3,"400990359"
238,2,"7:17",437,"Immanuel King made Free Throw.",56,43,"Texas State","Air Force",3,"400990359"
239,2,"7:17",437,"Immanuel King made Free Throw.",56,44,"Texas State","Air Force",3,"400990359"
240,2,"6:54",414,"Lavelle Scottie missed Jumper.",56,44,"Texas State","Air Force",3,"400990359"
241,2,"6:54",414,"Pervis Louder Offensive Rebound.",56,44,"Texas State","Air Force",3,"400990359"
242,2,"6:49",409,"Pervis Louder missed Layup.",56,44,"Texas State","Air Force",3,"400990359"
243,2,"6:49",409,"Nijal Pearson Defensive Rebound.",56,44,"Texas State","Air Force",3,"400990359"
244,2,"6:34",394,"Nijal Pearson missed Three Point Jumper.",56,44,"Texas State","Air Force",3,"400990359"
245,2,"6:34",394,"Trevor Lyons Defensive Rebound.",56,44,"Texas State","Air Force",3,"400990359"
246,2,"6:14",374,"Foul on Nijal Pearson.",56,44,"Texas State","Air Force",3,"400990359"
247,2,"6:14",374,"Frank Toohey made Free Throw.",57,44,"Texas State","Air Force",3,"400990359"
248,2,"6:14",374,"Frank Toohey made Free Throw.",58,44,"Texas State","Air Force",3,"400990359"
249,2,"5:55",355,"Tre'Larenz Nottingham Turnover.",58,44,"Texas State","Air Force",3,"400990359"
250,2,"5:54",354,"Frank Toohey Steal.",58,44,"Texas State","Air Force",3,"400990359"
251,2,"5:48",348,"Pervis Louder made Layup.",60,44,"Texas State","Air Force",3,"400990359"
252,2,"5:40",340,"Texas State  Timeout",60,44,"Texas State","Air Force",3,"400990359"
253,2,"5:24",324,"Foul on Frank Toohey.",60,44,"Texas State","Air Force",3,"400990359"
254,2,"5:24",324,"Immanuel King made Free Throw.",60,45,"Texas State","Air Force",3,"400990359"
255,2,"5:24",324,"Immanuel King made Free Throw.",60,46,"Texas State","Air Force",3,"400990359"
256,2,"4:55",295,"Trevor Lyons Turnover.",60,46,"Texas State","Air Force",3,"400990359"
257,2,"4:54",294,"Reggie Miller Steal.",60,46,"Texas State","Air Force",3,"400990359"
258,2,"4:51",291,"Tyler Blount made Layup. Assisted by Nijal Pearson.",60,48,"Texas State","Air Force",3,"400990359"
259,2,"4:18",258,"Pervis Louder made Three Point Jumper. Assisted by Lavelle Scottie.",63,48,"Texas State","Air Force",3,"400990359"
260,2,"3:54",234,"Nijal Pearson missed Jumper.",63,48,"Texas State","Air Force",3,"400990359"
261,2,"3:54",234,"Texas State Offensive Rebound.",63,48,"Texas State","Air Force",3,"400990359"
262,2,"3:52",232,"Official TV Timeout",63,48,"Texas State","Air Force",3,"400990359"
263,2,"3:52",232,"Tyler Blount missed Jumper.",63,48,"Texas State","Air Force",3,"400990359"
264,2,"3:52",232,"Lavelle Scottie Defensive Rebound.",63,48,"Texas State","Air Force",3,"400990359"
265,2,"3:40",220,"Pervis Louder made Layup.",65,48,"Texas State","Air Force",3,"400990359"
266,2,"3:40",220,"Foul on Immanuel King.",65,48,"Texas State","Air Force",3,"400990359"
267,2,"3:40",220,"Pervis Louder missed Free Throw.",65,48,"Texas State","Air Force",3,"400990359"
268,2,"3:40",220,"Alex Peacock Defensive Rebound.",65,48,"Texas State","Air Force",3,"400990359"
269,2,"3:16",196,"Shelby Adams made Layup. Assisted by Reggie Miller.",65,50,"Texas State","Air Force",3,"400990359"
