"play_id","half","time_remaining_half","secs_remaining","description","home_score","away_score","away","home","home_favored_by","game_id"
38,1,"14:33",2073,"Tre'Larenz Nottingham missed Jumper.",13,6,"Ecclesia","Texas State",NA,"400990413"
39,1,"14:33",2073,"Noah Banks Defensive Rebound.",13,6,"Ecclesia","Texas State",NA,"400990413"
40,1,"14:29",2069,"Noah Banks Turnover.",13,6,"Ecclesia","Texas State",NA,"400990413"
41,1,"14:29",2069,"Tre'Larenz Nottingham Steal.",13,6,"Ecclesia","Texas State",NA,"400990413"
42,1,"14:25",2065,"Nedeljko Prijovic missed Jumper.",13,6,"Ecclesia","Texas State",NA,"400990413"
43,1,"14:25",2065,"Noah Banks Defensive Rebound.",13,6,"Ecclesia","Texas State",NA,"400990413"
44,1,"14:23",2063,"Foul on Eric Terry.",13,6,"Ecclesia","Texas State",NA,"400990413"
45,1,"13:56",2036,"Jr Ramirez made Three Point Jumper. Assisted by Dequcelan Bagsby.",13,9,"Ecclesia","Texas State",NA,"400990413"
46,1,"13:35",2015,"Isaiah Gurley missed Three Point Jumper.",13,9,"Ecclesia","Texas State",NA,"400990413"
47,1,"13:35",2015,"Dequcelan Bagsby Defensive Rebound.",13,9,"Ecclesia","Texas State",NA,"400990413"
48,1,"13:28",2008,"Chris White Turnover.",13,9,"Ecclesia","Texas State",NA,"400990413"
49,1,"13:07",1987,"Isaiah Gurley made Jumper.",15,9,"Ecclesia","Texas State",NA,"400990413"
50,1,"12:36",1956,"Cash Krueger missed Three Point Jumper.",15,9,"Ecclesia","Texas State",NA,"400990413"
51,1,"12:36",1956,"Nedeljko Prijovic Defensive Rebound.",15,9,"Ecclesia","Texas State",NA,"400990413"
52,1,"12:26",1946,"Foul on Noah Banks.",15,9,"Ecclesia","Texas State",NA,"400990413"
53,1,"12:18",1938,"Eric Terry made Jumper. Assisted by Nedeljko Prijovic.",17,9,"Ecclesia","Texas State",NA,"400990413"
54,1,"11:57",1917,"Ashton Worgu missed Layup.",17,9,"Ecclesia","Texas State",NA,"400990413"
55,1,"11:57",1917,"Nedeljko Prijovic Defensive Rebound.",17,9,"Ecclesia","Texas State",NA,"400990413"
56,1,"11:47",1907,"Eric Terry Turnover.",17,9,"Ecclesia","Texas State",NA,"400990413"
57,1,"11:47",1907,"Official TV Timeout",17,9,"Ecclesia","Texas State",NA,"400990413"
58,1,"11:34",1894,"Chris White Turnover.",17,9,"Ecclesia","Texas State",NA,"400990413"
59,1,"11:24",1884,"Nijal Pearson missed Three Point Jumper.",17,9,"Ecclesia","Texas State",NA,"400990413"
60,1,"11:24",1884,"Jr Ramirez Defensive Rebound.",17,9,"Ecclesia","Texas State",NA,"400990413"
61,1,"11:16",1876,"Dequcelan Bagsby missed Three Point Jumper.",17,9,"Ecclesia","Texas State",NA,"400990413"
62,1,"11:16",1876,"Nijal Pearson Defensive Rebound.",17,9,"Ecclesia","Texas State",NA,"400990413"
63,1,"11:02",1862,"Immanuel King missed Layup.",17,9,"Ecclesia","Texas State",NA,"400990413"
64,1,"11:02",1862,"Ashton Worgu Block.",17,9,"Ecclesia","Texas State",NA,"400990413"
65,1,"11:02",1862,"Immanuel King Offensive Rebound.",17,9,"Ecclesia","Texas State",NA,"400990413"
66,1,"11:02",1862,"Immanuel King missed Layup.",17,9,"Ecclesia","Texas State",NA,"400990413"
67,1,"11:02",1862,"Ashton Worgu Defensive Rebound.",17,9,"Ecclesia","Texas State",NA,"400990413"
68,1,"10:49",1849,"Ashton Worgu Turnover.",17,9,"Ecclesia","Texas State",NA,"400990413"
69,1,"10:49",1849,"Nijal Pearson Steal.",17,9,"Ecclesia","Texas State",NA,"400990413"
70,1,"10:46",1846,"Nijal Pearson missed Dunk.",17,9,"Ecclesia","Texas State",NA,"400990413"
71,1,"10:46",1846,"Chris White Block.",17,9,"Ecclesia","Texas State",NA,"400990413"
72,1,"10:45",1845,"Reggie Miller Offensive Rebound.",17,9,"Ecclesia","Texas State",NA,"400990413"
73,1,"10:40",1840,"Nijal Pearson missed Layup.",17,9,"Ecclesia","Texas State",NA,"400990413"
74,1,"10:40",1840,"Ashton Worgu Block.",17,9,"Ecclesia","Texas State",NA,"400990413"
75,1,"10:39",1839,"Alex Peacock Offensive Rebound.",17,9,"Ecclesia","Texas State",NA,"400990413"
76,1,"10:29",1829,"Foul on Cash Krueger.",17,9,"Ecclesia","Texas State",NA,"400990413"
77,1,"10:29",1829,"Alex Peacock missed Free Throw.",17,9,"Ecclesia","Texas State",NA,"400990413"
78,1,"10:29",1829,"Texas State Deadball Team Rebound.",17,9,"Ecclesia","Texas State",NA,"400990413"
79,1,"10:29",1829,"Alex Peacock made Free Throw.",18,9,"Ecclesia","Texas State",NA,"400990413"
80,1,"10:09",1809,"Cash Krueger Turnover.",18,9,"Ecclesia","Texas State",NA,"400990413"
81,1,"9:47",1787,"Nijal Pearson made Three Point Jumper. Assisted by Reggie Miller.",21,9,"Ecclesia","Texas State",NA,"400990413"
82,1,"9:37",1777,"Chris White missed Jumper.",21,9,"Ecclesia","Texas State",NA,"400990413"
83,1,"9:37",1777,"Immanuel King Defensive Rebound.",21,9,"Ecclesia","Texas State",NA,"400990413"
84,1,"9:27",1767,"Nijal Pearson missed Three Point Jumper.",21,9,"Ecclesia","Texas State",NA,"400990413"
85,1,"9:27",1767,"Jr Ramirez Defensive Rebound.",21,9,"Ecclesia","Texas State",NA,"400990413"
86,1,"9:12",1752,"Ecclesia  Timeout",21,9,"Ecclesia","Texas State",NA,"400990413"
87,1,"9:02",1742,"Chris White missed Jumper.",21,9,"Ecclesia","Texas State",NA,"400990413"
88,1,"9:02",1742,"Alex Peacock Defensive Rebound.",21,9,"Ecclesia","Texas State",NA,"400990413"
89,1,"8:40",1720,"Reggie Miller made Jumper.",23,9,"Ecclesia","Texas State",NA,"400990413"
90,1,"8:15",1695,"Milacio Freeland missed Jumper.",23,9,"Ecclesia","Texas State",NA,"400990413"
91,1,"8:15",1695,"Immanuel King Defensive Rebound.",23,9,"Ecclesia","Texas State",NA,"400990413"
92,1,"7:59",1679,"Tyler Blount missed Three Point Jumper.",23,9,"Ecclesia","Texas State",NA,"400990413"
93,1,"7:59",1679,"Ashton Worgu Defensive Rebound.",23,9,"Ecclesia","Texas State",NA,"400990413"
94,1,"7:52",1672,"Dequcelan Bagsby missed Three Point Jumper.",23,9,"Ecclesia","Texas State",NA,"400990413"
95,1,"7:52",1672,"Immanuel King Defensive Rebound.",23,9,"Ecclesia","Texas State",NA,"400990413"
96,1,"7:36",1656,"Alex Peacock missed Three Point Jumper.",23,9,"Ecclesia","Texas State",NA,"400990413"
97,1,"7:36",1656,"Immanuel King Offensive Rebound.",23,9,"Ecclesia","Texas State",NA,"400990413"
98,1,"7:31",1651,"Immanuel King made Layup.",25,9,"Ecclesia","Texas State",NA,"400990413"
99,1,"7:15",1635,"Milacio Freeland made Three Point Jumper. Assisted by Dequcelan Bagsby.",25,12,"Ecclesia","Texas State",NA,"400990413"
100,1,"6:53",1613,"Reggie Miller missed Jumper.",25,12,"Ecclesia","Texas State",NA,"400990413"
101,1,"6:53",1613,"Dequcelan Bagsby Defensive Rebound.",25,12,"Ecclesia","Texas State",NA,"400990413"
102,1,"6:50",1610,"Dequcelan Bagsby Turnover.",25,12,"Ecclesia","Texas State",NA,"400990413"
103,1,"6:49",1609,"Reggie Miller Steal.",25,12,"Ecclesia","Texas State",NA,"400990413"
104,1,"6:34",1594,"Tyler Blount made Three Point Jumper. Assisted by Nijal Pearson.",28,12,"Ecclesia","Texas State",NA,"400990413"
105,1,"6:24",1584,"Ashton Worgu Turnover.",28,12,"Ecclesia","Texas State",NA,"400990413"
106,1,"6:22",1582,"Nijal Pearson Steal.",28,12,"Ecclesia","Texas State",NA,"400990413"
107,1,"6:20",1580,"Immanuel King made Dunk. Assisted by Nijal Pearson.",30,12,"Ecclesia","Texas State",NA,"400990413"
108,1,"6:17",1577,"Texas State  Timeout",30,12,"Ecclesia","Texas State",NA,"400990413"
109,1,"6:17",1577,"Official TV Timeout",30,12,"Ecclesia","Texas State",NA,"400990413"
110,1,"6:09",1569,"Foul on Tre'Larenz Nottingham.",30,12,"Ecclesia","Texas State",NA,"400990413"
111,1,"6:02",1562,"Jr Ramirez missed Three Point Jumper.",30,12,"Ecclesia","Texas State",NA,"400990413"
112,1,"6:02",1562,"Noah Banks Offensive Rebound.",30,12,"Ecclesia","Texas State",NA,"400990413"
113,1,"5:56",1556,"Noah Banks made Layup.",30,14,"Ecclesia","Texas State",NA,"400990413"
114,1,"5:42",1542,"Eric Terry Turnover.",30,14,"Ecclesia","Texas State",NA,"400990413"
115,1,"5:41",1541,"Noah Banks Steal.",30,14,"Ecclesia","Texas State",NA,"400990413"
116,1,"5:30",1530,"Milacio Freeland made Layup.",30,16,"Ecclesia","Texas State",NA,"400990413"
117,1,"5:20",1520,"Deris Duncan missed Jumper.",30,16,"Ecclesia","Texas State",NA,"400990413"
118,1,"5:20",1520,"Eric Terry Offensive Rebound.",30,16,"Ecclesia","Texas State",NA,"400990413"
119,1,"5:17",1517,"Eric Terry missed Jumper.",30,16,"Ecclesia","Texas State",NA,"400990413"
120,1,"5:17",1517,"Noah Banks Defensive Rebound.",30,16,"Ecclesia","Texas State",NA,"400990413"
121,1,"5:10",1510,"Foul on Tre'Larenz Nottingham.",30,16,"Ecclesia","Texas State",NA,"400990413"
122,1,"4:56",1496,"Chris White missed Jumper.",30,16,"Ecclesia","Texas State",NA,"400990413"
123,1,"4:56",1496,"Eric Terry Defensive Rebound.",30,16,"Ecclesia","Texas State",NA,"400990413"
124,1,"4:44",1484,"Tre'Larenz Nottingham missed Jumper.",30,16,"Ecclesia","Texas State",NA,"400990413"
125,1,"4:44",1484,"Eric Terry Offensive Rebound.",30,16,"Ecclesia","Texas State",NA,"400990413"
126,1,"4:40",1480,"Eric Terry missed Jumper.",30,16,"Ecclesia","Texas State",NA,"400990413"
127,1,"4:40",1480,"Deris Duncan Offensive Rebound.",30,16,"Ecclesia","Texas State",NA,"400990413"
128,1,"4:37",1477,"Deris Duncan missed Jumper.",30,16,"Ecclesia","Texas State",NA,"400990413"
129,1,"4:37",1477,"Noah Banks Defensive Rebound.",30,16,"Ecclesia","Texas State",NA,"400990413"
130,1,"4:31",1471,"Dequcelan Bagsby made Three Point Jumper. Assisted by Noah Banks.",30,19,"Ecclesia","Texas State",NA,"400990413"
131,1,"4:16",1456,"Eric Terry made Jumper. Assisted by Nedeljko Prijovic.",32,19,"Ecclesia","Texas State",NA,"400990413"
132,1,"3:55",1435,"Official TV Timeout",32,19,"Ecclesia","Texas State",NA,"400990413"
133,1,"3:38",1418,"Cash Krueger missed Three Point Jumper.",32,19,"Ecclesia","Texas State",NA,"400990413"
134,1,"3:38",1418,"Nedeljko Prijovic Defensive Rebound.",32,19,"Ecclesia","Texas State",NA,"400990413"
135,1,"3:31",1411,"Isaiah Gurley Turnover.",32,19,"Ecclesia","Texas State",NA,"400990413"
136,1,"3:15",1395,"Jr Ramirez missed Three Point Jumper.",32,19,"Ecclesia","Texas State",NA,"400990413"
137,1,"3:15",1395,"Eric Terry Defensive Rebound.",32,19,"Ecclesia","Texas State",NA,"400990413"
138,1,"3:02",1382,"Shelby Adams missed Three Point Jumper.",32,19,"Ecclesia","Texas State",NA,"400990413"
139,1,"3:02",1382,"Nedeljko Prijovic Offensive Rebound.",32,19,"Ecclesia","Texas State",NA,"400990413"
140,1,"3:00",1380,"Foul on Chris White.",32,19,"Ecclesia","Texas State",NA,"400990413"
141,1,"2:51",1371,"Isaiah Gurley missed Jumper.",32,19,"Ecclesia","Texas State",NA,"400990413"
142,1,"2:51",1371,"Nedeljko Prijovic Offensive Rebound.",32,19,"Ecclesia","Texas State",NA,"400990413"
143,1,"2:44",1364,"Eric Terry Turnover.",32,19,"Ecclesia","Texas State",NA,"400990413"
144,1,"2:30",1350,"Vlad Chira missed Jumper.",32,19,"Ecclesia","Texas State",NA,"400990413"
145,1,"2:30",1350,"Tre'Larenz Nottingham Defensive Rebound.",32,19,"Ecclesia","Texas State",NA,"400990413"
146,1,"2:23",1343,"Foul on Cash Krueger.",32,19,"Ecclesia","Texas State",NA,"400990413"
147,1,"2:23",1343,"Tre'Larenz Nottingham made Free Throw.",33,19,"Ecclesia","Texas State",NA,"400990413"
148,1,"2:23",1343,"Tre'Larenz Nottingham made Free Throw.",34,19,"Ecclesia","Texas State",NA,"400990413"
149,1,"2:06",1326,"Chris White Turnover.",34,19,"Ecclesia","Texas State",NA,"400990413"
150,1,"1:54",1314,"Tre'Larenz Nottingham missed Three Point Jumper.",34,19,"Ecclesia","Texas State",NA,"400990413"
151,1,"1:54",1314,"Chris White Defensive Rebound.",34,19,"Ecclesia","Texas State",NA,"400990413"
152,1,"1:48",1308,"Dequcelan Bagsby missed Three Point Jumper.",34,19,"Ecclesia","Texas State",NA,"400990413"
153,1,"1:48",1308,"Shelby Adams Defensive Rebound.",34,19,"Ecclesia","Texas State",NA,"400990413"
154,1,"1:40",1300,"Isaiah Gurley made Layup. Assisted by Shelby Adams.",36,19,"Ecclesia","Texas State",NA,"400990413"
155,1,"1:33",1293,"Chris White missed Jumper.",36,19,"Ecclesia","Texas State",NA,"400990413"
156,1,"1:33",1293,"Nedeljko Prijovic Defensive Rebound.",36,19,"Ecclesia","Texas State",NA,"400990413"
157,1,"1:29",1289,"Texas State  Timeout",36,19,"Ecclesia","Texas State",NA,"400990413"
158,1,"1:19",1279,"Tre'Larenz Nottingham made Layup. Assisted by Isaiah Gurley.",38,19,"Ecclesia","Texas State",NA,"400990413"
159,1,"1:03",1263,"Dequcelan Bagsby Turnover.",38,19,"Ecclesia","Texas State",NA,"400990413"
160,1,"1:03",1263,"Isaiah Gurley Steal.",38,19,"Ecclesia","Texas State",NA,"400990413"
161,1,"0:57",1257,"Nedeljko Prijovic made Layup. Assisted by Tre'Larenz Nottingham.",40,19,"Ecclesia","Texas State",NA,"400990413"
162,1,"0:39",1239,"Chris White missed Jumper.",40,19,"Ecclesia","Texas State",NA,"400990413"
163,1,"0:39",1239,"Nedeljko Prijovic Block.",40,19,"Ecclesia","Texas State",NA,"400990413"
164,1,"0:38",1238,"Shelby Adams Defensive Rebound.",40,19,"Ecclesia","Texas State",NA,"400990413"
165,1,"0:33",1233,"Shelby Adams missed Jumper.",40,19,"Ecclesia","Texas State",NA,"400990413"
166,1,"0:33",1233,"Shelby Adams Offensive Rebound.",40,19,"Ecclesia","Texas State",NA,"400990413"
167,1,"0:27",1227,"Shelby Adams made Layup.",42,19,"Ecclesia","Texas State",NA,"400990413"
168,1,"0:00",1200,"Jr Ramirez missed Jumper.",42,19,"Ecclesia","Texas State",NA,"400990413"
169,1,"0:00",1200,"Tre'Larenz Nottingham Block.",42,19,"Ecclesia","Texas State",NA,"400990413"
170,1,"0:00",1200,"Quentin Scott Defensive Rebound.",42,19,"Ecclesia","Texas State",NA,"400990413"
171,1,"0:00",1200,"End of 1st half",42,19,"Ecclesia","Texas State",NA,"400990413"
172,2,"20:00",1200,"PLAY",42,19,"Ecclesia","Texas State",NA,"400990413"
173,2,"19:51",1191,"Dequcelan Bagsby missed Jumper.",42,19,"Ecclesia","Texas State",NA,"400990413"
174,2,"19:51",1191,"Nijal Pearson Defensive Rebound.",42,19,"Ecclesia","Texas State",NA,"400990413"
175,2,"19:40",1180,"Nijal Pearson made Jumper.",44,19,"Ecclesia","Texas State",NA,"400990413"
176,2,"19:18",1158,"Dequcelan Bagsby missed Three Point Jumper.",44,19,"Ecclesia","Texas State",NA,"400990413"
177,2,"19:18",1158,"Nijal Pearson Defensive Rebound.",44,19,"Ecclesia","Texas State",NA,"400990413"
178,2,"19:07",1147,"Alex Peacock missed Jumper.",44,19,"Ecclesia","Texas State",NA,"400990413"
179,2,"19:07",1147,"Immanuel King Offensive Rebound.",44,19,"Ecclesia","Texas State",NA,"400990413"
180,2,"19:04",1144,"Immanuel King missed Jumper.",44,19,"Ecclesia","Texas State",NA,"400990413"
181,2,"19:04",1144,"Immanuel King Offensive Rebound.",44,19,"Ecclesia","Texas State",NA,"400990413"
182,2,"19:01",1141,"Immanuel King missed Jumper.",44,19,"Ecclesia","Texas State",NA,"400990413"
183,2,"19:01",1141,"Cash Krueger Defensive Rebound.",44,19,"Ecclesia","Texas State",NA,"400990413"
184,2,"18:43",1123,"Foul on Alex Peacock.",44,19,"Ecclesia","Texas State",NA,"400990413"
185,2,"18:43",1123,"Noah Banks missed Free Throw.",44,19,"Ecclesia","Texas State",NA,"400990413"
186,2,"18:43",1123,"Ecclesia Deadball Team Rebound.",44,19,"Ecclesia","Texas State",NA,"400990413"
187,2,"18:43",1123,"Noah Banks made Free Throw.",44,20,"Ecclesia","Texas State",NA,"400990413"
188,2,"18:27",1107,"Immanuel King made Layup. Assisted by Nijal Pearson.",46,20,"Ecclesia","Texas State",NA,"400990413"
189,2,"18:07",1087,"Cash Krueger missed Jumper.",46,20,"Ecclesia","Texas State",NA,"400990413"
190,2,"18:07",1087,"Immanuel King Defensive Rebound.",46,20,"Ecclesia","Texas State",NA,"400990413"
191,2,"17:52",1072,"Nijal Pearson missed Three Point Jumper.",46,20,"Ecclesia","Texas State",NA,"400990413"
192,2,"17:52",1072,"Immanuel King Offensive Rebound.",46,20,"Ecclesia","Texas State",NA,"400990413"
193,2,"17:48",1068,"Foul on Cash Krueger.",46,20,"Ecclesia","Texas State",NA,"400990413"
194,2,"17:48",1068,"Immanuel King missed Free Throw.",46,20,"Ecclesia","Texas State",NA,"400990413"
195,2,"17:48",1068,"Texas State Deadball Team Rebound.",46,20,"Ecclesia","Texas State",NA,"400990413"
196,2,"17:48",1068,"Immanuel King missed Free Throw.",46,20,"Ecclesia","Texas State",NA,"400990413"
197,2,"17:48",1068,"Ecclesia Defensive Rebound.",46,20,"Ecclesia","Texas State",NA,"400990413"
198,2,"17:22",1042,"Cash Krueger missed Layup.",46,20,"Ecclesia","Texas State",NA,"400990413"
199,2,"17:22",1042,"Immanuel King Block.",46,20,"Ecclesia","Texas State",NA,"400990413"
200,2,"17:19",1039,"Immanuel King Defensive Rebound.",46,20,"Ecclesia","Texas State",NA,"400990413"
201,2,"17:13",1033,"Nijal Pearson made Jumper.",48,20,"Ecclesia","Texas State",NA,"400990413"
202,2,"16:59",1019,"Chris White missed Three Point Jumper.",48,20,"Ecclesia","Texas State",NA,"400990413"
203,2,"16:59",1019,"Alex Peacock Defensive Rebound.",48,20,"Ecclesia","Texas State",NA,"400990413"
204,2,"16:50",1010,"Reggie Miller made Layup.",50,20,"Ecclesia","Texas State",NA,"400990413"
205,2,"16:33",993,"Noah Banks missed Jumper.",50,20,"Ecclesia","Texas State",NA,"400990413"
206,2,"16:33",993,"Nijal Pearson Defensive Rebound.",50,20,"Ecclesia","Texas State",NA,"400990413"
207,2,"16:22",982,"Alex Peacock made Layup. Assisted by Immanuel King.",52,20,"Ecclesia","Texas State",NA,"400990413"
208,2,"16:07",967,"Milacio Freeland Turnover.",52,20,"Ecclesia","Texas State",NA,"400990413"
209,2,"16:05",965,"Alex Peacock Steal.",52,20,"Ecclesia","Texas State",NA,"400990413"
210,2,"16:02",962,"Alex Peacock made Layup. Assisted by Nijal Pearson.",54,20,"Ecclesia","Texas State",NA,"400990413"
211,2,"15:48",948,"Chris White missed Layup.",54,20,"Ecclesia","Texas State",NA,"400990413"
212,2,"15:48",948,"Nijal Pearson Defensive Rebound.",54,20,"Ecclesia","Texas State",NA,"400990413"
213,2,"15:41",941,"Alex Peacock missed Layup.",54,20,"Ecclesia","Texas State",NA,"400990413"
214,2,"15:41",941,"Alex Peacock Offensive Rebound.",54,20,"Ecclesia","Texas State",NA,"400990413"
215,2,"15:39",939,"Alex Peacock made Two Point Tip Shot.",56,20,"Ecclesia","Texas State",NA,"400990413"
216,2,"15:19",919,"Milacio Freeland missed Three Point Jumper.",56,20,"Ecclesia","Texas State",NA,"400990413"
217,2,"15:19",919,"Noah Banks Offensive Rebound.",56,20,"Ecclesia","Texas State",NA,"400990413"
218,2,"15:08",908,"Milacio Freeland missed Jumper.",56,20,"Ecclesia","Texas State",NA,"400990413"
219,2,"15:08",908,"Alex Peacock Defensive Rebound.",56,20,"Ecclesia","Texas State",NA,"400990413"
220,2,"14:59",899,"Nijal Pearson made Layup.",58,20,"Ecclesia","Texas State",NA,"400990413"
221,2,"14:50",890,"Ecclesia  Timeout",58,20,"Ecclesia","Texas State",NA,"400990413"
222,2,"14:50",890,"Official TV Timeout",58,20,"Ecclesia","Texas State",NA,"400990413"
223,2,"14:43",883,"Foul on Deris Duncan.",58,20,"Ecclesia","Texas State",NA,"400990413"
224,2,"14:43",883,"Official TV Timeout",58,20,"Ecclesia","Texas State",NA,"400990413"
225,2,"14:43",883,"Chris White made Free Throw.",58,21,"Ecclesia","Texas State",NA,"400990413"
226,2,"14:43",883,"Chris White made Free Throw.",58,22,"Ecclesia","Texas State",NA,"400990413"
227,2,"14:32",872,"Isaiah Gurley missed Jumper.",58,22,"Ecclesia","Texas State",NA,"400990413"
228,2,"14:32",872,"Chris White Block.",58,22,"Ecclesia","Texas State",NA,"400990413"
229,2,"14:31",871,"Isaiah Gurley Offensive Rebound.",58,22,"Ecclesia","Texas State",NA,"400990413"
230,2,"14:31",871,"Foul on Jr Ramirez.",58,22,"Ecclesia","Texas State",NA,"400990413"
231,2,"14:31",871,"Isaiah Gurley made Free Throw.",59,22,"Ecclesia","Texas State",NA,"400990413"
232,2,"14:31",871,"Isaiah Gurley made Free Throw.",60,22,"Ecclesia","Texas State",NA,"400990413"
233,2,"14:22",862,"Chris White missed Jumper.",60,22,"Ecclesia","Texas State",NA,"400990413"
234,2,"14:22",862,"Cash Krueger Offensive Rebound.",60,22,"Ecclesia","Texas State",NA,"400990413"
235,2,"14:17",857,"Chris White missed Three Point Jumper.",60,22,"Ecclesia","Texas State",NA,"400990413"
236,2,"14:17",857,"Tre'Larenz Nottingham Defensive Rebound.",60,22,"Ecclesia","Texas State",NA,"400990413"
237,2,"14:07",847,"Deris Duncan Turnover.",60,22,"Ecclesia","Texas State",NA,"400990413"
238,2,"14:06",846,"Ashton Worgu Steal.",60,22,"Ecclesia","Texas State",NA,"400990413"
239,2,"14:02",842,"Dequcelan Bagsby missed Layup.",60,22,"Ecclesia","Texas State",NA,"400990413"
240,2,"14:02",842,"Nedeljko Prijovic Defensive Rebound.",60,22,"Ecclesia","Texas State",NA,"400990413"
241,2,"13:49",829,"Nedeljko Prijovic missed Jumper.",60,22,"Ecclesia","Texas State",NA,"400990413"
242,2,"13:49",829,"Ecclesia Defensive Rebound.",60,22,"Ecclesia","Texas State",NA,"400990413"
243,2,"13:37",817,"Chris White missed Three Point Jumper.",60,22,"Ecclesia","Texas State",NA,"400990413"
244,2,"13:37",817,"Ecclesia Offensive Rebound.",60,22,"Ecclesia","Texas State",NA,"400990413"
245,2,"13:35",815,"Foul on Isaiah Gurley.",60,22,"Ecclesia","Texas State",NA,"400990413"
246,2,"13:17",797,"Chris White made Layup. Assisted by Cash Krueger.",60,24,"Ecclesia","Texas State",NA,"400990413"
247,2,"13:04",784,"Nedeljko Prijovic missed Three Point Jumper.",60,24,"Ecclesia","Texas State",NA,"400990413"
248,2,"13:04",784,"Eric Terry Offensive Rebound.",60,24,"Ecclesia","Texas State",NA,"400990413"
249,2,"13:00",780,"Eric Terry made Free Throw.",61,24,"Ecclesia","Texas State",NA,"400990413"
250,2,"13:00",780,"Eric Terry missed Free Throw.",61,24,"Ecclesia","Texas State",NA,"400990413"
251,2,"13:00",780,"Noah Banks Defensive Rebound.",61,24,"Ecclesia","Texas State",NA,"400990413"
252,2,"12:42",762,"Ashton Worgu Turnover.",61,24,"Ecclesia","Texas State",NA,"400990413"
253,2,"12:28",748,"Isaiah Gurley missed Jumper.",61,24,"Ecclesia","Texas State",NA,"400990413"
254,2,"12:28",748,"Ashton Worgu Defensive Rebound.",61,24,"Ecclesia","Texas State",NA,"400990413"
255,2,"12:11",731,"Jr Ramirez made Three Point Jumper. Assisted by Chris White.",61,27,"Ecclesia","Texas State",NA,"400990413"
256,2,"11:57",717,"Foul on Ashton Worgu.",61,27,"Ecclesia","Texas State",NA,"400990413"
257,2,"11:57",717,"Official TV Timeout",61,27,"Ecclesia","Texas State",NA,"400990413"
258,2,"11:57",717,"Nedeljko Prijovic missed Free Throw.",61,27,"Ecclesia","Texas State",NA,"400990413"
259,2,"11:57",717,"Texas State Deadball Team Rebound.",61,27,"Ecclesia","Texas State",NA,"400990413"
260,2,"11:57",717,"Nedeljko Prijovic missed Free Throw.",61,27,"Ecclesia","Texas State",NA,"400990413"
261,2,"11:57",717,"Jr Ramirez Defensive Rebound.",61,27,"Ecclesia","Texas State",NA,"400990413"
262,2,"11:50",710,"Foul on Shelby Adams.",61,27,"Ecclesia","Texas State",NA,"400990413"
263,2,"11:50",710,"Ashton Worgu made Free Throw.",61,28,"Ecclesia","Texas State",NA,"400990413"
264,2,"11:50",710,"Ashton Worgu made Free Throw.",61,29,"Ecclesia","Texas State",NA,"400990413"
265,2,"11:28",688,"Shelby Adams made Layup. Assisted by Nijal Pearson.",63,29,"Ecclesia","Texas State",NA,"400990413"
266,2,"11:08",668,"Dequcelan Bagsby missed Three Point Jumper.",63,29,"Ecclesia","Texas State",NA,"400990413"
267,2,"11:08",668,"Immanuel King Defensive Rebound.",63,29,"Ecclesia","Texas State",NA,"400990413"
268,2,"10:39",639,"Nijal Pearson missed Three Point Jumper.",63,29,"Ecclesia","Texas State",NA,"400990413"
269,2,"10:39",639,"Jr Ramirez Defensive Rebound.",63,29,"Ecclesia","Texas State",NA,"400990413"
270,2,"10:30",630,"Foul on Shelby Adams.",63,29,"Ecclesia","Texas State",NA,"400990413"
271,2,"10:19",619,"Jr Ramirez missed Three Point Jumper.",63,29,"Ecclesia","Texas State",NA,"400990413"
272,2,"10:19",619,"Nijal Pearson Defensive Rebound.",63,29,"Ecclesia","Texas State",NA,"400990413"
273,2,"10:06",606,"Alex Peacock Turnover.",63,29,"Ecclesia","Texas State",NA,"400990413"
274,2,"9:43",583,"Milacio Freeland Turnover.",63,29,"Ecclesia","Texas State",NA,"400990413"
275,2,"9:25",565,"Nijal Pearson made Jumper. Assisted by Reggie Miller.",65,29,"Ecclesia","Texas State",NA,"400990413"
276,2,"9:11",551,"Jr Ramirez missed Three Point Jumper.",65,29,"Ecclesia","Texas State",NA,"400990413"
277,2,"9:11",551,"Immanuel King Defensive Rebound.",65,29,"Ecclesia","Texas State",NA,"400990413"
278,2,"8:47",527,"Alex Peacock missed Three Point Jumper.",65,29,"Ecclesia","Texas State",NA,"400990413"
279,2,"8:47",527,"Immanuel King Offensive Rebound.",65,29,"Ecclesia","Texas State",NA,"400990413"
280,2,"8:41",521,"Immanuel King made Layup.",67,29,"Ecclesia","Texas State",NA,"400990413"
281,2,"8:20",500,"Jr Ramirez missed Jumper.",67,29,"Ecclesia","Texas State",NA,"400990413"
282,2,"8:20",500,"Shelby Adams Defensive Rebound.",67,29,"Ecclesia","Texas State",NA,"400990413"
283,2,"8:13",493,"Shelby Adams made Layup.",69,29,"Ecclesia","Texas State",NA,"400990413"
284,2,"8:13",493,"Foul on Cash Krueger.",69,29,"Ecclesia","Texas State",NA,"400990413"
285,2,"8:12",492,"Shelby Adams missed Free Throw.",69,29,"Ecclesia","Texas State",NA,"400990413"
286,2,"8:12",492,"Vlad Chira Defensive Rebound.",69,29,"Ecclesia","Texas State",NA,"400990413"
287,2,"8:07",487,"Noah Banks missed Three Point Jumper.",69,29,"Ecclesia","Texas State",NA,"400990413"
288,2,"8:07",487,"Nijal Pearson Defensive Rebound.",69,29,"Ecclesia","Texas State",NA,"400990413"
289,2,"7:57",477,"Texas State  Turnover.",69,29,"Ecclesia","Texas State",NA,"400990413"
290,2,"7:56",476,"Official TV Timeout",69,29,"Ecclesia","Texas State",NA,"400990413"
291,2,"7:48",468,"Foul on Tyler Blount.",69,29,"Ecclesia","Texas State",NA,"400990413"
292,2,"7:48",468,"Milacio Freeland missed Free Throw.",69,29,"Ecclesia","Texas State",NA,"400990413"
293,2,"7:48",468,"Ecclesia Deadball Team Rebound.",69,29,"Ecclesia","Texas State",NA,"400990413"
294,2,"7:48",468,"Milacio Freeland missed Free Throw.",69,29,"Ecclesia","Texas State",NA,"400990413"
295,2,"7:48",468,"Tyler Blount Defensive Rebound.",69,29,"Ecclesia","Texas State",NA,"400990413"
296,2,"7:36",456,"Eric Terry missed Jumper.",69,29,"Ecclesia","Texas State",NA,"400990413"
297,2,"7:36",456,"Vlad Chira Defensive Rebound.",69,29,"Ecclesia","Texas State",NA,"400990413"
298,2,"7:17",437,"Milacio Freeland made Three Point Jumper. Assisted by Reagan Babyar.",69,32,"Ecclesia","Texas State",NA,"400990413"
299,2,"6:56",416,"Eric Terry made Layup. Assisted by Tyler Blount.",71,32,"Ecclesia","Texas State",NA,"400990413"
300,2,"6:44",404,"Foul on Deris Duncan.",71,32,"Ecclesia","Texas State",NA,"400990413"
301,2,"6:43",403,"Chris White missed Free Throw.",71,32,"Ecclesia","Texas State",NA,"400990413"
302,2,"6:42",402,"Ecclesia Deadball Team Rebound.",71,32,"Ecclesia","Texas State",NA,"400990413"
