"play_id","half","time_remaining_half","secs_remaining","description","home_score","away_score","away","home","home_favored_by","game_id"
252,2,"11:00",660,"Foul on KaVaughn Scott.",56,66,"Loyola (MD)","UMass Lowell",NA,"400991572"
253,2,"10:42",642,"Ryan Jones missed Layup.",56,66,"Loyola (MD)","UMass Lowell",NA,"400991572"
254,2,"10:42",642,"Cam Gregory Block.",56,66,"Loyola (MD)","UMass Lowell",NA,"400991572"
255,2,"10:40",640,"Cam Gregory Defensive Rebound.",56,66,"Loyola (MD)","UMass Lowell",NA,"400991572"
256,2,"10:29",629,"Brent Holcombe missed Three Point Jumper.",56,66,"Loyola (MD)","UMass Lowell",NA,"400991572"
257,2,"10:29",629,"Ryan Jones Defensive Rebound.",56,66,"Loyola (MD)","UMass Lowell",NA,"400991572"
258,2,"10:27",627,"Foul on Cam Gregory.",56,66,"Loyola (MD)","UMass Lowell",NA,"400991572"
259,2,"10:14",614,"Matt Harris missed Three Point Jumper.",56,66,"Loyola (MD)","UMass Lowell",NA,"400991572"
260,2,"10:14",614,"Brent Holcombe Block.",56,66,"Loyola (MD)","UMass Lowell",NA,"400991572"
261,2,"10:11",611,"Shawn Jones Offensive Rebound.",56,66,"Loyola (MD)","UMass Lowell",NA,"400991572"
262,2,"10:06",606,"Ryan Jones made Three Point Jumper. Assisted by Shawn Jones.",59,66,"Loyola (MD)","UMass Lowell",NA,"400991572"
263,2,"9:33",573,"Brent Holcombe missed Jumper.",59,66,"Loyola (MD)","UMass Lowell",NA,"400991572"
264,2,"9:33",573,"Ryan Jones Defensive Rebound.",59,66,"Loyola (MD)","UMass Lowell",NA,"400991572"
265,2,"9:31",571,"Foul on James Fives.",59,66,"Loyola (MD)","UMass Lowell",NA,"400991572"
266,2,"9:31",571,"Ryan Jones missed Free Throw.",59,66,"Loyola (MD)","UMass Lowell",NA,"400991572"
267,2,"9:31",571,"Sam Norton Defensive Rebound.",59,66,"Loyola (MD)","UMass Lowell",NA,"400991572"
268,2,"9:14",554,"Cam Gregory Turnover.",59,66,"Loyola (MD)","UMass Lowell",NA,"400991572"
269,2,"9:14",554,"Josh Gantz Steal.",59,66,"Loyola (MD)","UMass Lowell",NA,"400991572"
270,2,"9:02",542,"Josh Gantz made Three Point Jumper. Assisted by Ryan Jones.",62,66,"Loyola (MD)","UMass Lowell",NA,"400991572"
271,2,"8:51",531,"Loyola (MD)  Timeout",62,66,"Loyola (MD)","UMass Lowell",NA,"400991572"
272,2,"8:35",515,"Isaiah Hart missed Jumper.",62,66,"Loyola (MD)","UMass Lowell",NA,"400991572"
273,2,"8:35",515,"Jahad Thomas Defensive Rebound.",62,66,"Loyola (MD)","UMass Lowell",NA,"400991572"
274,2,"8:26",506,"Foul on Shawn Jones.",62,66,"Loyola (MD)","UMass Lowell",NA,"400991572"
275,2,"8:26",506,"Shawn Jones Turnover.",62,66,"Loyola (MD)","UMass Lowell",NA,"400991572"
276,2,"8:02",482,"James Fives missed Three Point Jumper.",62,66,"Loyola (MD)","UMass Lowell",NA,"400991572"
277,2,"8:02",482,"Cam Gregory Offensive Rebound.",62,66,"Loyola (MD)","UMass Lowell",NA,"400991572"
278,2,"7:59",479,"James Fives Turnover.",62,66,"Loyola (MD)","UMass Lowell",NA,"400991572"
279,2,"7:59",479,"Official TV Timeout",62,66,"Loyola (MD)","UMass Lowell",NA,"400991572"
280,2,"7:34",454,"Jahad Thomas missed Three Point Jumper.",62,66,"Loyola (MD)","UMass Lowell",NA,"400991572"
281,2,"7:34",454,"Brent Holcombe Defensive Rebound.",62,66,"Loyola (MD)","UMass Lowell",NA,"400991572"
282,2,"7:32",452,"Foul on Ryan Jones.",62,66,"Loyola (MD)","UMass Lowell",NA,"400991572"
283,2,"7:12",432,"Foul on Rinardo Perry.",62,66,"Loyola (MD)","UMass Lowell",NA,"400991572"
284,2,"7:12",432,"James Fives missed Free Throw.",62,66,"Loyola (MD)","UMass Lowell",NA,"400991572"
285,2,"7:12",432,"Josh Gantz Defensive Rebound.",62,66,"Loyola (MD)","UMass Lowell",NA,"400991572"
286,2,"6:56",416,"Shawn Jones missed Three Point Jumper.",62,66,"Loyola (MD)","UMass Lowell",NA,"400991572"
287,2,"6:56",416,"Cam Gregory Defensive Rebound.",62,66,"Loyola (MD)","UMass Lowell",NA,"400991572"
288,2,"6:27",387,"Isaiah Hart Turnover.",62,66,"Loyola (MD)","UMass Lowell",NA,"400991572"
289,2,"6:26",386,"Jahad Thomas Steal.",62,66,"Loyola (MD)","UMass Lowell",NA,"400991572"
290,2,"6:19",379,"Josh Gantz missed Three Point Jumper.",62,66,"Loyola (MD)","UMass Lowell",NA,"400991572"
291,2,"6:19",379,"Nevell Provo Defensive Rebound.",62,66,"Loyola (MD)","UMass Lowell",NA,"400991572"
292,2,"6:00",360,"Foul on Rinardo Perry.",62,66,"Loyola (MD)","UMass Lowell",NA,"400991572"
293,2,"6:00",360,"James Fives missed Free Throw.",62,66,"Loyola (MD)","UMass Lowell",NA,"400991572"
294,2,"6:00",360,"Loyola (MD) Deadball Team Rebound.",62,66,"Loyola (MD)","UMass Lowell",NA,"400991572"
295,2,"6:00",360,"James Fives missed Free Throw.",62,66,"Loyola (MD)","UMass Lowell",NA,"400991572"
296,2,"6:00",360,"Matt Harris Defensive Rebound.",62,66,"Loyola (MD)","UMass Lowell",NA,"400991572"
297,2,"5:36",336,"Matt Harris made Three Point Jumper. Assisted by Shawn Jones.",65,66,"Loyola (MD)","UMass Lowell",NA,"400991572"
298,2,"5:11",311,"Isaiah Hart missed Layup.",65,66,"Loyola (MD)","UMass Lowell",NA,"400991572"
299,2,"5:11",311,"Jahad Thomas Defensive Rebound.",65,66,"Loyola (MD)","UMass Lowell",NA,"400991572"
300,2,"5:04",304,"Matt Harris made Three Point Jumper. Assisted by Jahad Thomas.",68,66,"Loyola (MD)","UMass Lowell",NA,"400991572"
301,2,"4:55",295,"Loyola (MD)  Timeout",68,66,"Loyola (MD)","UMass Lowell",NA,"400991572"
302,2,"4:50",290,"Cam Gregory missed Layup.",68,66,"Loyola (MD)","UMass Lowell",NA,"400991572"
303,2,"4:50",290,"Jahad Thomas Defensive Rebound.",68,66,"Loyola (MD)","UMass Lowell",NA,"400991572"
304,2,"4:20",260,"Ryan Jones made Three Point Jumper. Assisted by Jahad Thomas.",71,66,"Loyola (MD)","UMass Lowell",NA,"400991572"
305,2,"3:55",235,"KaVaughn Scott missed Layup.",71,66,"Loyola (MD)","UMass Lowell",NA,"400991572"
306,2,"3:55",235,"Josh Gantz Defensive Rebound.",71,66,"Loyola (MD)","UMass Lowell",NA,"400991572"
307,2,"3:40",220,"Foul on James Fives.",71,66,"Loyola (MD)","UMass Lowell",NA,"400991572"
308,2,"3:40",220,"Official TV Timeout",71,66,"Loyola (MD)","UMass Lowell",NA,"400991572"
309,2,"3:40",220,"Shawn Jones made Free Throw.",72,66,"Loyola (MD)","UMass Lowell",NA,"400991572"
310,2,"3:40",220,"Shawn Jones made Free Throw.",73,66,"Loyola (MD)","UMass Lowell",NA,"400991572"
311,2,"3:25",205,"Isaiah Hart Turnover.",73,66,"Loyola (MD)","UMass Lowell",NA,"400991572"
312,2,"3:24",204,"Ryan Jones Steal.",73,66,"Loyola (MD)","UMass Lowell",NA,"400991572"
313,2,"3:11",191,"Matt Harris made Three Point Jumper. Assisted by Shawn Jones.",76,66,"Loyola (MD)","UMass Lowell",NA,"400991572"
314,2,"2:46",166,"Isaiah Hart missed Three Point Jumper.",76,66,"Loyola (MD)","UMass Lowell",NA,"400991572"
315,2,"2:46",166,"Matt Harris Defensive Rebound.",76,66,"Loyola (MD)","UMass Lowell",NA,"400991572"
316,2,"2:24",144,"Jahad Thomas missed Layup.",76,66,"Loyola (MD)","UMass Lowell",NA,"400991572"
317,2,"2:24",144,"KaVaughn Scott Defensive Rebound.",76,66,"Loyola (MD)","UMass Lowell",NA,"400991572"
318,2,"2:16",136,"Foul on Josh Gantz.",76,66,"Loyola (MD)","UMass Lowell",NA,"400991572"
319,2,"2:16",136,"Cam Gregory made Free Throw.",76,67,"Loyola (MD)","UMass Lowell",NA,"400991572"
320,2,"2:16",136,"Cam Gregory made Free Throw.",76,68,"Loyola (MD)","UMass Lowell",NA,"400991572"
321,2,"2:04",124,"Foul on James Fives.",76,68,"Loyola (MD)","UMass Lowell",NA,"400991572"
322,2,"2:04",124,"Matt Harris made Free Throw.",77,68,"Loyola (MD)","UMass Lowell",NA,"400991572"
323,2,"2:04",124,"Matt Harris made Free Throw.",78,68,"Loyola (MD)","UMass Lowell",NA,"400991572"
324,2,"1:55",115,"Isaiah Hart missed Jumper.",78,68,"Loyola (MD)","UMass Lowell",NA,"400991572"
325,2,"1:55",115,"Jahad Thomas Defensive Rebound.",78,68,"Loyola (MD)","UMass Lowell",NA,"400991572"
326,2,"1:33",93,"Foul on Cam Gregory.",78,68,"Loyola (MD)","UMass Lowell",NA,"400991572"
327,2,"1:33",93,"Jahad Thomas missed Free Throw.",78,68,"Loyola (MD)","UMass Lowell",NA,"400991572"
328,2,"1:33",93,"UMass Lowell Deadball Team Rebound.",78,68,"Loyola (MD)","UMass Lowell",NA,"400991572"
329,2,"1:33",93,"Jahad Thomas made Free Throw.",79,68,"Loyola (MD)","UMass Lowell",NA,"400991572"
330,2,"1:24",84,"Nevell Provo made Three Point Jumper. Assisted by Brent Holcombe.",79,71,"Loyola (MD)","UMass Lowell",NA,"400991572"
331,2,"1:21",81,"Loyola (MD)  Timeout",79,71,"Loyola (MD)","UMass Lowell",NA,"400991572"
332,2,"1:16",76,"Foul on Nevell Provo.",79,71,"Loyola (MD)","UMass Lowell",NA,"400991572"
333,2,"1:16",76,"Jahad Thomas made Free Throw.",80,71,"Loyola (MD)","UMass Lowell",NA,"400991572"
334,2,"1:16",76,"Jahad Thomas made Free Throw.",81,71,"Loyola (MD)","UMass Lowell",NA,"400991572"
335,2,"1:11",71,"Nevell Provo missed Three Point Jumper.",81,71,"Loyola (MD)","UMass Lowell",NA,"400991572"
336,2,"1:11",71,"Jahad Thomas Defensive Rebound.",81,71,"Loyola (MD)","UMass Lowell",NA,"400991572"
337,2,"1:06",66,"Jahad Thomas Turnover.",81,71,"Loyola (MD)","UMass Lowell",NA,"400991572"
338,2,"1:02",62,"Foul on Shawn Jones.",81,71,"Loyola (MD)","UMass Lowell",NA,"400991572"
339,2,"1:02",62,"Isaiah Hart made Free Throw.",81,72,"Loyola (MD)","UMass Lowell",NA,"400991572"
340,2,"1:02",62,"Isaiah Hart made Free Throw.",81,73,"Loyola (MD)","UMass Lowell",NA,"400991572"
341,2,"0:54",54,"Foul on KaVaughn Scott.",81,73,"Loyola (MD)","UMass Lowell",NA,"400991572"
342,2,"0:54",54,"Ryan Jones missed Free Throw.",81,73,"Loyola (MD)","UMass Lowell",NA,"400991572"
343,2,"0:54",54,"UMass Lowell Deadball Team Rebound.",81,73,"Loyola (MD)","UMass Lowell",NA,"400991572"
344,2,"0:54",54,"Ryan Jones made Free Throw.",82,73,"Loyola (MD)","UMass Lowell",NA,"400991572"
345,2,"0:48",48,"Isaiah Hart missed Layup.",82,73,"Loyola (MD)","UMass Lowell",NA,"400991572"
346,2,"0:48",48,"Matt Harris Defensive Rebound.",82,73,"Loyola (MD)","UMass Lowell",NA,"400991572"
347,2,"0:41",41,"Foul on Brent Holcombe.",82,73,"Loyola (MD)","UMass Lowell",NA,"400991572"
348,2,"0:41",41,"Ryan Jones missed Free Throw.",82,73,"Loyola (MD)","UMass Lowell",NA,"400991572"
349,2,"0:41",41,"UMass Lowell Deadball Team Rebound.",82,73,"Loyola (MD)","UMass Lowell",NA,"400991572"
350,2,"0:41",41,"Ryan Jones made Free Throw.",83,73,"Loyola (MD)","UMass Lowell",NA,"400991572"
351,2,"0:38",38,"Isaiah Hart missed Three Point Jumper.",83,73,"Loyola (MD)","UMass Lowell",NA,"400991572"
352,2,"0:38",38,"Cam Gregory Offensive Rebound.",83,73,"Loyola (MD)","UMass Lowell",NA,"400991572"
353,2,"0:32",32,"Cam Gregory made Layup.",83,75,"Loyola (MD)","UMass Lowell",NA,"400991572"
354,2,"0:25",25,"Matt Harris Turnover.",83,75,"Loyola (MD)","UMass Lowell",NA,"400991572"
355,2,"0:25",25,"UMass Lowell  Timeout",83,75,"Loyola (MD)","UMass Lowell",NA,"400991572"
356,2,"0:25",25,"Nevell Provo missed Three Point Jumper.",83,75,"Loyola (MD)","UMass Lowell",NA,"400991572"
357,2,"0:24",24,"Brent Holcombe Offensive Rebound.",83,75,"Loyola (MD)","UMass Lowell",NA,"400991572"
358,2,"0:21",21,"Isaiah Hart missed Three Point Jumper.",83,75,"Loyola (MD)","UMass Lowell",NA,"400991572"
359,2,"0:20",20,"Jahad Thomas Defensive Rebound.",83,75,"Loyola (MD)","UMass Lowell",NA,"400991572"
360,2,"0:00",0,"End of Game",83,75,"Loyola (MD)","UMass Lowell",NA,"400991572"
1,1,"20:00",2400,"PLAY",0,0,"Sacred Heart","UMass Lowell",NA,"400990742"
2,1,"19:43",2383,"Mario Matasovic made Layup.",0,2,"Sacred Heart","UMass Lowell",NA,"400990742"
3,1,"19:29",2369,"Matt Harris missed Three Point Jumper.",0,2,"Sacred Heart","UMass Lowell",NA,"400990742"
4,1,"19:29",2369,"Joseph Lopez Defensive Rebound.",0,2,"Sacred Heart","UMass Lowell",NA,"400990742"
5,1,"19:14",2354,"Kinnon LaRose missed Three Point Jumper.",0,2,"Sacred Heart","UMass Lowell",NA,"400990742"
6,1,"19:14",2354,"Josh Gantz Defensive Rebound.",0,2,"Sacred Heart","UMass Lowell",NA,"400990742"
7,1,"18:52",2332,"Rinardo Perry made Layup.",2,2,"Sacred Heart","UMass Lowell",NA,"400990742"
8,1,"18:40",2320,"Charles Tucker Jr. Turnover.",2,2,"Sacred Heart","UMass Lowell",NA,"400990742"
9,1,"18:38",2318,"Jahad Thomas Steal.",2,2,"Sacred Heart","UMass Lowell",NA,"400990742"
10,1,"18:35",2315,"Josh Gantz made Layup. Assisted by Rinardo Perry.",4,2,"Sacred Heart","UMass Lowell",NA,"400990742"
11,1,"18:16",2296,"Joseph Lopez missed Jumper.",4,2,"Sacred Heart","UMass Lowell",NA,"400990742"
12,1,"18:16",2296,"Jahad Thomas Defensive Rebound.",4,2,"Sacred Heart","UMass Lowell",NA,"400990742"
13,1,"18:05",2285,"Foul on Kinnon LaRose.",4,2,"Sacred Heart","UMass Lowell",NA,"400990742"
14,1,"18:05",2285,"Jahad Thomas missed Free Throw.",4,2,"Sacred Heart","UMass Lowell",NA,"400990742"
15,1,"18:05",2285,"UMass Lowell Deadball Team Rebound.",4,2,"Sacred Heart","UMass Lowell",NA,"400990742"
16,1,"18:05",2285,"Jahad Thomas made Free Throw.",5,2,"Sacred Heart","UMass Lowell",NA,"400990742"
17,1,"17:33",2253,"Kinnon LaRose missed Three Point Jumper.",5,2,"Sacred Heart","UMass Lowell",NA,"400990742"
18,1,"17:33",2253,"Matt Harris Block.",5,2,"Sacred Heart","UMass Lowell",NA,"400990742"
19,1,"17:31",2251,"Matt Harris Defensive Rebound.",5,2,"Sacred Heart","UMass Lowell",NA,"400990742"
20,1,"17:20",2240,"Jahad Thomas made Three Point Jumper. Assisted by Matt Harris.",8,2,"Sacred Heart","UMass Lowell",NA,"400990742"
21,1,"17:05",2225,"Kinnon LaRose made Three Point Jumper. Assisted by Mario Matasovic.",8,5,"Sacred Heart","UMass Lowell",NA,"400990742"
22,1,"16:36",2196,"Matt Harris made Three Point Jumper. Assisted by Ryan Jones.",11,5,"Sacred Heart","UMass Lowell",NA,"400990742"
23,1,"16:17",2177,"Joseph Lopez missed Three Point Jumper.",11,5,"Sacred Heart","UMass Lowell",NA,"400990742"
24,1,"16:17",2177,"Jahad Thomas Defensive Rebound.",11,5,"Sacred Heart","UMass Lowell",NA,"400990742"
25,1,"16:09",2169,"Matt Harris made Three Point Jumper. Assisted by Jahad Thomas.",14,5,"Sacred Heart","UMass Lowell",NA,"400990742"
26,1,"16:03",2163,"Sacred Heart  Timeout",14,5,"Sacred Heart","UMass Lowell",NA,"400990742"
27,1,"15:55",2155,"E.J. Anosike Turnover.",14,5,"Sacred Heart","UMass Lowell",NA,"400990742"
28,1,"15:53",2153,"Ryan Jones Steal.",14,5,"Sacred Heart","UMass Lowell",NA,"400990742"
29,1,"15:51",2151,"Ryan Jones made Layup.",16,5,"Sacred Heart","UMass Lowell",NA,"400990742"
30,1,"15:27",2127,"Alex Watson Turnover.",16,5,"Sacred Heart","UMass Lowell",NA,"400990742"
31,1,"15:25",2125,"Rinardo Perry Steal.",16,5,"Sacred Heart","UMass Lowell",NA,"400990742"
32,1,"15:13",2113,"Jahad Thomas missed Three Point Jumper.",16,5,"Sacred Heart","UMass Lowell",NA,"400990742"
33,1,"15:13",2113,"Josh Gantz Offensive Rebound.",16,5,"Sacred Heart","UMass Lowell",NA,"400990742"
34,1,"15:03",2103,"Josh Gantz Turnover.",16,5,"Sacred Heart","UMass Lowell",NA,"400990742"
35,1,"15:01",2101,"Sean Hoehn Steal.",16,5,"Sacred Heart","UMass Lowell",NA,"400990742"
36,1,"14:46",2086,"Sean Hoehn made Layup.",16,7,"Sacred Heart","UMass Lowell",NA,"400990742"
37,1,"14:30",2070,"Josh Gantz Turnover.",16,7,"Sacred Heart","UMass Lowell",NA,"400990742"
38,1,"14:28",2068,"Sean Hoehn Steal.",16,7,"Sacred Heart","UMass Lowell",NA,"400990742"
39,1,"14:24",2064,"Sean Hoehn missed Three Point Jumper.",16,7,"Sacred Heart","UMass Lowell",NA,"400990742"
40,1,"14:24",2064,"Ryan Jones Defensive Rebound.",16,7,"Sacred Heart","UMass Lowell",NA,"400990742"
41,1,"14:04",2044,"Jahad Thomas missed Layup.",16,7,"Sacred Heart","UMass Lowell",NA,"400990742"
42,1,"14:04",2044,"E.J. Anosike Defensive Rebound.",16,7,"Sacred Heart","UMass Lowell",NA,"400990742"
43,1,"13:56",2036,"Sean Hoehn missed Three Point Jumper.",16,7,"Sacred Heart","UMass Lowell",NA,"400990742"
44,1,"13:56",2036,"Ryan Jones Defensive Rebound.",16,7,"Sacred Heart","UMass Lowell",NA,"400990742"
45,1,"13:46",2026,"Matt Harris missed Jumper.",16,7,"Sacred Heart","UMass Lowell",NA,"400990742"
46,1,"13:46",2026,"Mario Matasovic Defensive Rebound.",16,7,"Sacred Heart","UMass Lowell",NA,"400990742"
47,1,"13:29",2009,"Mario Matasovic Turnover.",16,7,"Sacred Heart","UMass Lowell",NA,"400990742"
48,1,"13:27",2007,"Jahad Thomas Steal.",16,7,"Sacred Heart","UMass Lowell",NA,"400990742"
49,1,"13:26",2006,"Jahad Thomas made Layup.",18,7,"Sacred Heart","UMass Lowell",NA,"400990742"
50,1,"13:13",1993,"Mario Matasovic made Three Point Jumper. Assisted by Alex Watson.",18,10,"Sacred Heart","UMass Lowell",NA,"400990742"
51,1,"12:44",1964,"Foul on E.J. Anosike.",18,10,"Sacred Heart","UMass Lowell",NA,"400990742"
52,1,"12:44",1964,"Shawn Jones made Free Throw.",19,10,"Sacred Heart","UMass Lowell",NA,"400990742"
53,1,"12:44",1964,"Shawn Jones made Free Throw.",20,10,"Sacred Heart","UMass Lowell",NA,"400990742"
54,1,"12:16",1936,"Zach Radz missed Layup.",20,10,"Sacred Heart","UMass Lowell",NA,"400990742"
55,1,"12:16",1936,"Obadiah Noel Block.",20,10,"Sacred Heart","UMass Lowell",NA,"400990742"
56,1,"12:14",1934,"Shawn Jones Defensive Rebound.",20,10,"Sacred Heart","UMass Lowell",NA,"400990742"
57,1,"12:11",1931,"Foul on Sean Hoehn.",20,10,"Sacred Heart","UMass Lowell",NA,"400990742"
58,1,"12:00",1920,"Josh Gantz Turnover.",20,10,"Sacred Heart","UMass Lowell",NA,"400990742"
59,1,"11:37",1897,"Foul on Matt Harris.",20,10,"Sacred Heart","UMass Lowell",NA,"400990742"
60,1,"11:37",1897,"Official TV Timeout",20,10,"Sacred Heart","UMass Lowell",NA,"400990742"
61,1,"11:37",1897,"Zach Radz made Free Throw.",20,11,"Sacred Heart","UMass Lowell",NA,"400990742"
62,1,"11:37",1897,"Zach Radz made Free Throw.",20,12,"Sacred Heart","UMass Lowell",NA,"400990742"
63,1,"11:13",1873,"Stefan Borovac Turnover.",20,12,"Sacred Heart","UMass Lowell",NA,"400990742"
64,1,"11:11",1871,"Joseph Lopez Steal.",20,12,"Sacred Heart","UMass Lowell",NA,"400990742"
65,1,"11:08",1868,"De'von Barnett made Layup. Assisted by Joseph Lopez.",20,14,"Sacred Heart","UMass Lowell",NA,"400990742"
66,1,"10:50",1850,"Foul on Rinardo Perry.",20,14,"Sacred Heart","UMass Lowell",NA,"400990742"
67,1,"10:50",1850,"Rinardo Perry Turnover.",20,14,"Sacred Heart","UMass Lowell",NA,"400990742"
68,1,"10:39",1839,"Joseph Lopez made Jumper.",20,16,"Sacred Heart","UMass Lowell",NA,"400990742"
69,1,"10:16",1816,"Shawn Jones Turnover.",20,16,"Sacred Heart","UMass Lowell",NA,"400990742"
70,1,"10:14",1814,"Joseph Lopez Steal.",20,16,"Sacred Heart","UMass Lowell",NA,"400990742"
71,1,"10:11",1811,"Charles Tucker Jr. missed Layup.",20,16,"Sacred Heart","UMass Lowell",NA,"400990742"
72,1,"10:11",1811,"Rinardo Perry Block.",20,16,"Sacred Heart","UMass Lowell",NA,"400990742"
73,1,"10:08",1808,"Joseph Lopez Offensive Rebound.",20,16,"Sacred Heart","UMass Lowell",NA,"400990742"
74,1,"10:03",1803,"Joseph Lopez missed Layup.",20,16,"Sacred Heart","UMass Lowell",NA,"400990742"
75,1,"10:03",1803,"Joseph Lopez Offensive Rebound.",20,16,"Sacred Heart","UMass Lowell",NA,"400990742"
76,1,"10:03",1803,"Foul on Connor Bennett.",20,16,"Sacred Heart","UMass Lowell",NA,"400990742"
77,1,"10:03",1803,"Joseph Lopez missed Free Throw.",20,16,"Sacred Heart","UMass Lowell",NA,"400990742"
78,1,"10:03",1803,"Sacred Heart Deadball Team Rebound.",20,16,"Sacred Heart","UMass Lowell",NA,"400990742"
79,1,"10:03",1803,"Joseph Lopez made Free Throw.",20,17,"Sacred Heart","UMass Lowell",NA,"400990742"
80,1,"9:50",1790,"Rinardo Perry missed Three Point Jumper.",20,17,"Sacred Heart","UMass Lowell",NA,"400990742"
81,1,"9:50",1790,"Obadiah Noel Offensive Rebound.",20,17,"Sacred Heart","UMass Lowell",NA,"400990742"
82,1,"9:42",1782,"Jahad Thomas Turnover.",20,17,"Sacred Heart","UMass Lowell",NA,"400990742"
83,1,"9:26",1766,"Joseph Lopez made Jumper.",20,19,"Sacred Heart","UMass Lowell",NA,"400990742"
84,1,"9:07",1747,"Jahad Thomas Turnover.",20,19,"Sacred Heart","UMass Lowell",NA,"400990742"
85,1,"9:00",1740,"Joseph Lopez made Layup.",20,21,"Sacred Heart","UMass Lowell",NA,"400990742"
86,1,"8:46",1726,"Jahad Thomas made Jumper. Assisted by Ryan Jones.",22,21,"Sacred Heart","UMass Lowell",NA,"400990742"
87,1,"8:30",1710,"Sean Hoehn made Three Point Jumper. Assisted by Charles Tucker Jr..",22,24,"Sacred Heart","UMass Lowell",NA,"400990742"
88,1,"8:10",1690,"Jahad Thomas missed Jumper.",22,24,"Sacred Heart","UMass Lowell",NA,"400990742"
89,1,"8:10",1690,"Sean Hoehn Defensive Rebound.",22,24,"Sacred Heart","UMass Lowell",NA,"400990742"
90,1,"8:03",1683,"Zach Radz missed Three Point Jumper.",22,24,"Sacred Heart","UMass Lowell",NA,"400990742"
91,1,"8:03",1683,"Shawn Jones Defensive Rebound.",22,24,"Sacred Heart","UMass Lowell",NA,"400990742"
92,1,"7:40",1660,"Rinardo Perry made Layup.",24,24,"Sacred Heart","UMass Lowell",NA,"400990742"
93,1,"7:31",1651,"Sean Hoehn made Layup.",24,26,"Sacred Heart","UMass Lowell",NA,"400990742"
94,1,"7:17",1637,"Foul on Charles Tucker Jr..",24,26,"Sacred Heart","UMass Lowell",NA,"400990742"
95,1,"7:17",1637,"Official TV Timeout",24,26,"Sacred Heart","UMass Lowell",NA,"400990742"
96,1,"6:58",1618,"Jahad Thomas missed Jumper.",24,26,"Sacred Heart","UMass Lowell",NA,"400990742"
97,1,"6:58",1618,"Zach Radz Defensive Rebound.",24,26,"Sacred Heart","UMass Lowell",NA,"400990742"
98,1,"6:37",1597,"Charles Tucker Jr. Turnover.",24,26,"Sacred Heart","UMass Lowell",NA,"400990742"
99,1,"6:20",1580,"Foul on Zach Radz.",24,26,"Sacred Heart","UMass Lowell",NA,"400990742"
100,1,"6:06",1566,"Ryan Jones Turnover.",24,26,"Sacred Heart","UMass Lowell",NA,"400990742"
101,1,"6:05",1565,"Charles Tucker Jr. Steal.",24,26,"Sacred Heart","UMass Lowell",NA,"400990742"
102,1,"5:54",1554,"Charles Tucker Jr. missed Jumper.",24,26,"Sacred Heart","UMass Lowell",NA,"400990742"
103,1,"5:54",1554,"Matt Harris Defensive Rebound.",24,26,"Sacred Heart","UMass Lowell",NA,"400990742"
104,1,"5:43",1543,"Rinardo Perry made Jumper.",26,26,"Sacred Heart","UMass Lowell",NA,"400990742"
105,1,"5:28",1528,"Mario Matasovic Turnover.",26,26,"Sacred Heart","UMass Lowell",NA,"400990742"
106,1,"5:28",1528,"Matt Harris Steal.",26,26,"Sacred Heart","UMass Lowell",NA,"400990742"
107,1,"5:22",1522,"Ryan Jones Turnover.",26,26,"Sacred Heart","UMass Lowell",NA,"400990742"
108,1,"5:21",1521,"Sean Hoehn Steal.",26,26,"Sacred Heart","UMass Lowell",NA,"400990742"
109,1,"5:19",1519,"Sean Hoehn made Layup.",26,28,"Sacred Heart","UMass Lowell",NA,"400990742"
110,1,"5:03",1503,"Rinardo Perry missed Three Point Jumper.",26,28,"Sacred Heart","UMass Lowell",NA,"400990742"
111,1,"5:03",1503,"Joseph Lopez Defensive Rebound.",26,28,"Sacred Heart","UMass Lowell",NA,"400990742"
112,1,"4:52",1492,"Charles Tucker Jr. Turnover.",26,28,"Sacred Heart","UMass Lowell",NA,"400990742"
113,1,"4:50",1490,"Jahad Thomas Steal.",26,28,"Sacred Heart","UMass Lowell",NA,"400990742"
114,1,"4:47",1487,"Foul on Sean Hoehn.",26,28,"Sacred Heart","UMass Lowell",NA,"400990742"
115,1,"4:37",1477,"Matt Harris made Three Point Jumper. Assisted by Rinardo Perry.",29,28,"Sacred Heart","UMass Lowell",NA,"400990742"
116,1,"4:05",1445,"Chris Robinson Turnover.",29,28,"Sacred Heart","UMass Lowell",NA,"400990742"
117,1,"4:05",1445,"Rinardo Perry Steal.",29,28,"Sacred Heart","UMass Lowell",NA,"400990742"
118,1,"4:05",1445,"Foul on Alex Watson.",29,28,"Sacred Heart","UMass Lowell",NA,"400990742"
119,1,"4:05",1445,"Official TV Timeout",29,28,"Sacred Heart","UMass Lowell",NA,"400990742"
120,1,"4:05",1445,"Jahad Thomas made Free Throw.",30,28,"Sacred Heart","UMass Lowell",NA,"400990742"
121,1,"4:05",1445,"Jahad Thomas made Free Throw.",31,28,"Sacred Heart","UMass Lowell",NA,"400990742"
122,1,"3:51",1431,"Foul on E.J. Anosike.",31,28,"Sacred Heart","UMass Lowell",NA,"400990742"
123,1,"3:51",1431,"E.J. Anosike Turnover.",31,28,"Sacred Heart","UMass Lowell",NA,"400990742"
124,1,"3:40",1420,"Jahad Thomas missed Layup.",31,28,"Sacred Heart","UMass Lowell",NA,"400990742"
125,1,"3:40",1420,"Joseph Lopez Defensive Rebound.",31,28,"Sacred Heart","UMass Lowell",NA,"400990742"
126,1,"3:30",1410,"De'von Barnett made Layup. Assisted by Kinnon LaRose.",31,30,"Sacred Heart","UMass Lowell",NA,"400990742"
127,1,"3:08",1388,"Rinardo Perry made Layup.",33,30,"Sacred Heart","UMass Lowell",NA,"400990742"
128,1,"2:53",1373,"De'von Barnett missed Layup.",33,30,"Sacred Heart","UMass Lowell",NA,"400990742"
129,1,"2:53",1373,"Josh Gantz Defensive Rebound.",33,30,"Sacred Heart","UMass Lowell",NA,"400990742"
130,1,"2:48",1368,"Foul on Charles Tucker Jr..",33,30,"Sacred Heart","UMass Lowell",NA,"400990742"
131,1,"2:48",1368,"Jahad Thomas missed Free Throw.",33,30,"Sacred Heart","UMass Lowell",NA,"400990742"
132,1,"2:48",1368,"Joseph Lopez Defensive Rebound.",33,30,"Sacred Heart","UMass Lowell",NA,"400990742"
133,1,"2:25",1345,"Chris Robinson missed Three Point Jumper.",33,30,"Sacred Heart","UMass Lowell",NA,"400990742"
134,1,"2:25",1345,"Jahad Thomas Defensive Rebound.",33,30,"Sacred Heart","UMass Lowell",NA,"400990742"
135,1,"2:16",1336,"Ryan Jones made Three Point Jumper. Assisted by Jahad Thomas.",36,30,"Sacred Heart","UMass Lowell",NA,"400990742"
136,1,"2:02",1322,"Joseph Lopez missed Layup.",36,30,"Sacred Heart","UMass Lowell",NA,"400990742"
137,1,"2:02",1322,"Jahad Thomas Defensive Rebound.",36,30,"Sacred Heart","UMass Lowell",NA,"400990742"
138,1,"1:53",1313,"Matt Harris missed Three Point Jumper.",36,30,"Sacred Heart","UMass Lowell",NA,"400990742"
139,1,"1:53",1313,"De'von Barnett Defensive Rebound.",36,30,"Sacred Heart","UMass Lowell",NA,"400990742"
140,1,"1:39",1299,"Ryan Jones missed Three Point Jumper.",36,30,"Sacred Heart","UMass Lowell",NA,"400990742"
141,1,"1:39",1299,"Ryan Jones Offensive Rebound.",36,30,"Sacred Heart","UMass Lowell",NA,"400990742"
142,1,"1:19",1279,"Foul on Josh Gantz.",36,30,"Sacred Heart","UMass Lowell",NA,"400990742"
143,1,"1:16",1276,"Charles Tucker Jr. Turnover.",36,30,"Sacred Heart","UMass Lowell",NA,"400990742"
144,1,"1:11",1271,"Foul on De'von Barnett.",36,30,"Sacred Heart","UMass Lowell",NA,"400990742"
145,1,"1:11",1271,"Josh Gantz made Free Throw.",37,30,"Sacred Heart","UMass Lowell",NA,"400990742"
146,1,"1:11",1271,"Josh Gantz missed Free Throw.",37,30,"Sacred Heart","UMass Lowell",NA,"400990742"
147,1,"1:11",1271,"Zach Radz Defensive Rebound.",37,30,"Sacred Heart","UMass Lowell",NA,"400990742"
148,1,"0:54",1254,"De'von Barnett made Layup.",37,32,"Sacred Heart","UMass Lowell",NA,"400990742"
149,1,"0:54",1254,"Foul on Matt Harris.",37,32,"Sacred Heart","UMass Lowell",NA,"400990742"
150,1,"0:54",1254,"De'von Barnett made Free Throw.",37,33,"Sacred Heart","UMass Lowell",NA,"400990742"
