"play_id","half","time_remaining_half","secs_remaining","description","home_score","away_score","away","home","home_favored_by","game_id"
238,2,"11:03",663,"Jahad Thomas Turnover.",57,55,"Marist","UMass Lowell",NA,"400991064"
239,2,"11:01",661,"Isaiah Lamb Steal.",57,55,"Marist","UMass Lowell",NA,"400991064"
240,2,"10:55",655,"Tobias Sjoberg missed Dunk.",57,55,"Marist","UMass Lowell",NA,"400991064"
241,2,"10:55",655,"Jahad Thomas Defensive Rebound.",57,55,"Marist","UMass Lowell",NA,"400991064"
242,2,"10:51",651,"Obadiah Noel Turnover.",57,55,"Marist","UMass Lowell",NA,"400991064"
243,2,"10:39",639,"Foul on Shawn Jones.",57,55,"Marist","UMass Lowell",NA,"400991064"
244,2,"10:33",633,"Brian Parker Turnover.",57,55,"Marist","UMass Lowell",NA,"400991064"
245,2,"10:32",632,"Obadiah Noel Steal.",57,55,"Marist","UMass Lowell",NA,"400991064"
246,2,"10:30",630,"Foul on David Knudsen.",57,55,"Marist","UMass Lowell",NA,"400991064"
247,2,"10:24",624,"Connor Bennett made Layup. Assisted by Jahad Thomas.",59,55,"Marist","UMass Lowell",NA,"400991064"
248,2,"10:02",602,"Aleksandar Dozic made Layup.",59,57,"Marist","UMass Lowell",NA,"400991064"
249,2,"9:49",589,"Jahad Thomas Turnover.",59,57,"Marist","UMass Lowell",NA,"400991064"
250,2,"9:29",569,"Isaiah Lamb missed Layup.",59,57,"Marist","UMass Lowell",NA,"400991064"
251,2,"9:29",569,"Jahad Thomas Defensive Rebound.",59,57,"Marist","UMass Lowell",NA,"400991064"
252,2,"9:16",556,"Shawn Jones Turnover.",59,57,"Marist","UMass Lowell",NA,"400991064"
253,2,"9:04",544,"Aleksandar Dozic missed Three Point Jumper.",59,57,"Marist","UMass Lowell",NA,"400991064"
254,2,"9:04",544,"Josh Gantz Defensive Rebound.",59,57,"Marist","UMass Lowell",NA,"400991064"
255,2,"8:52",532,"Jahad Thomas made Layup. Assisted by Shawn Jones.",61,57,"Marist","UMass Lowell",NA,"400991064"
256,2,"8:42",522,"Brian Parker Turnover.",61,57,"Marist","UMass Lowell",NA,"400991064"
257,2,"8:24",504,"Ryan Jones missed Three Point Jumper.",61,57,"Marist","UMass Lowell",NA,"400991064"
258,2,"8:24",504,"Jahad Thomas Offensive Rebound.",61,57,"Marist","UMass Lowell",NA,"400991064"
259,2,"8:11",491,"Foul on Brian Parker.",61,57,"Marist","UMass Lowell",NA,"400991064"
260,2,"8:11",491,"Obadiah Noel made Free Throw.",62,57,"Marist","UMass Lowell",NA,"400991064"
261,2,"8:11",491,"Obadiah Noel made Free Throw.",63,57,"Marist","UMass Lowell",NA,"400991064"
262,2,"8:00",480,"Aleksandar Dozic Turnover.",63,57,"Marist","UMass Lowell",NA,"400991064"
263,2,"7:58",478,"Obadiah Noel Steal.",63,57,"Marist","UMass Lowell",NA,"400991064"
264,2,"7:49",469,"Obadiah Noel missed Dunk.",63,57,"Marist","UMass Lowell",NA,"400991064"
265,2,"7:48",468,"Josh Gantz Block.",63,57,"Marist","UMass Lowell",NA,"400991064"
266,2,"7:47",467,"Jahad Thomas Offensive Rebound.",63,57,"Marist","UMass Lowell",NA,"400991064"
267,2,"7:45",465,"Jahad Thomas missed Layup.",63,57,"Marist","UMass Lowell",NA,"400991064"
268,2,"7:45",465,"Aleksandar Dozic Defensive Rebound.",63,57,"Marist","UMass Lowell",NA,"400991064"
269,2,"7:41",461,"Isaiah Lamb missed Layup.",63,57,"Marist","UMass Lowell",NA,"400991064"
270,2,"7:41",461,"Shawn Jones Defensive Rebound.",63,57,"Marist","UMass Lowell",NA,"400991064"
271,2,"7:32",452,"Jahad Thomas Turnover.",63,57,"Marist","UMass Lowell",NA,"400991064"
272,2,"7:25",445,"Andrea Bernardi Steal.",63,57,"Marist","UMass Lowell",NA,"400991064"
273,2,"7:21",441,"Ryan Funk made Dunk. Assisted by Aleksandar Dozic.",63,59,"Marist","UMass Lowell",NA,"400991064"
274,2,"6:57",417,"Foul on Isaiah Lamb.",63,59,"Marist","UMass Lowell",NA,"400991064"
275,2,"6:36",396,"Jahad Thomas missed Layup.",63,59,"Marist","UMass Lowell",NA,"400991064"
276,2,"6:36",396,"Aleksandar Dozic Defensive Rebound.",63,59,"Marist","UMass Lowell",NA,"400991064"
277,2,"6:16",376,"Aleksandar Dozic missed Layup.",63,59,"Marist","UMass Lowell",NA,"400991064"
278,2,"6:16",376,"Marist Offensive Rebound.",63,59,"Marist","UMass Lowell",NA,"400991064"
279,2,"6:13",373,"Ryan Funk missed Three Point Jumper.",63,59,"Marist","UMass Lowell",NA,"400991064"
280,2,"6:13",373,"Ryan Jones Defensive Rebound.",63,59,"Marist","UMass Lowell",NA,"400991064"
281,2,"6:03",363,"Matt Harris missed Three Point Jumper.",63,59,"Marist","UMass Lowell",NA,"400991064"
282,2,"6:03",363,"Josh Gantz Offensive Rebound.",63,59,"Marist","UMass Lowell",NA,"400991064"
283,2,"5:57",357,"Ryan Jones missed Three Point Jumper.",63,59,"Marist","UMass Lowell",NA,"400991064"
284,2,"5:57",357,"Brian Parker Defensive Rebound.",63,59,"Marist","UMass Lowell",NA,"400991064"
285,2,"5:48",348,"Marist  Timeout",63,59,"Marist","UMass Lowell",NA,"400991064"
286,2,"5:31",331,"Tobias Sjoberg made Jumper.",63,61,"Marist","UMass Lowell",NA,"400991064"
287,2,"5:08",308,"Ryan Jones missed Three Point Jumper.",63,61,"Marist","UMass Lowell",NA,"400991064"
288,2,"5:08",308,"Jahad Thomas Offensive Rebound.",63,61,"Marist","UMass Lowell",NA,"400991064"
289,2,"5:03",303,"Matt Harris made Three Point Jumper. Assisted by Jahad Thomas.",66,61,"Marist","UMass Lowell",NA,"400991064"
290,2,"4:35",275,"Tobias Sjoberg Turnover.",66,61,"Marist","UMass Lowell",NA,"400991064"
291,2,"4:24",264,"Jahad Thomas made Layup. Assisted by Josh Gantz.",68,61,"Marist","UMass Lowell",NA,"400991064"
292,2,"4:14",254,"Foul on Shawn Jones.",68,61,"Marist","UMass Lowell",NA,"400991064"
293,2,"4:14",254,"Isaiah Lamb missed Jumper.",68,61,"Marist","UMass Lowell",NA,"400991064"
294,2,"4:14",254,"Jahad Thomas Defensive Rebound.",68,61,"Marist","UMass Lowell",NA,"400991064"
295,2,"4:14",254,"Jahad Thomas missed Layup.",68,61,"Marist","UMass Lowell",NA,"400991064"
296,2,"4:14",254,"Jahad Thomas Offensive Rebound.",68,61,"Marist","UMass Lowell",NA,"400991064"
297,2,"4:14",254,"Matt Harris Turnover.",68,61,"Marist","UMass Lowell",NA,"400991064"
298,2,"4:14",254,"Aleksandar Dozic Steal.",68,61,"Marist","UMass Lowell",NA,"400991064"
299,2,"4:07",247,"Foul on Matt Harris.",68,61,"Marist","UMass Lowell",NA,"400991064"
300,2,"3:48",228,"Official TV Timeout",68,61,"Marist","UMass Lowell",NA,"400991064"
301,2,"3:33",213,"Aleksandar Dozic made Free Throw.",68,62,"Marist","UMass Lowell",NA,"400991064"
302,2,"3:33",213,"Aleksandar Dozic made Free Throw.",68,63,"Marist","UMass Lowell",NA,"400991064"
303,2,"3:10",190,"Ryan Jones missed Layup.",68,63,"Marist","UMass Lowell",NA,"400991064"
304,2,"3:10",190,"Brian Parker Defensive Rebound.",68,63,"Marist","UMass Lowell",NA,"400991064"
305,2,"3:01",181,"David Knudsen made Layup.",68,65,"Marist","UMass Lowell",NA,"400991064"
306,2,"2:40",160,"Josh Gantz made Three Point Jumper. Assisted by Jahad Thomas.",71,65,"Marist","UMass Lowell",NA,"400991064"
307,2,"2:20",140,"Foul on Ryan Jones.",71,65,"Marist","UMass Lowell",NA,"400991064"
308,2,"2:20",140,"Isaiah Lamb missed Free Throw.",71,65,"Marist","UMass Lowell",NA,"400991064"
309,2,"2:20",140,"Marist Deadball Team Rebound.",71,65,"Marist","UMass Lowell",NA,"400991064"
310,2,"2:20",140,"Isaiah Lamb made Free Throw.",71,66,"Marist","UMass Lowell",NA,"400991064"
311,2,"2:20",140,"Isaiah Lamb made Free Throw.",71,67,"Marist","UMass Lowell",NA,"400991064"
312,2,"1:53",113,"Jahad Thomas missed Jumper.",71,67,"Marist","UMass Lowell",NA,"400991064"
313,2,"1:53",113,"Jahad Thomas Offensive Rebound.",71,67,"Marist","UMass Lowell",NA,"400991064"
314,2,"1:49",109,"Ryan Jones made Three Point Jumper. Assisted by Jahad Thomas.",74,67,"Marist","UMass Lowell",NA,"400991064"
315,2,"1:33",93,"Aleksandar Dozic missed Layup.",74,67,"Marist","UMass Lowell",NA,"400991064"
316,2,"1:33",93,"Marist Offensive Rebound.",74,67,"Marist","UMass Lowell",NA,"400991064"
317,2,"1:25",85,"Ryan Funk made Jumper.",74,69,"Marist","UMass Lowell",NA,"400991064"
318,2,"0:58",58,"Ryan Jones missed Layup.",74,69,"Marist","UMass Lowell",NA,"400991064"
319,2,"0:58",58,"Kristinn Palsson Defensive Rebound.",74,69,"Marist","UMass Lowell",NA,"400991064"
320,2,"0:43",43,"Kristinn Palsson missed Three Point Jumper.",74,69,"Marist","UMass Lowell",NA,"400991064"
321,2,"0:43",43,"Jahad Thomas Defensive Rebound.",74,69,"Marist","UMass Lowell",NA,"400991064"
322,2,"0:38",38,"Foul on David Knudsen.",74,69,"Marist","UMass Lowell",NA,"400991064"
323,2,"0:38",38,"Jahad Thomas missed Free Throw.",74,69,"Marist","UMass Lowell",NA,"400991064"
324,2,"0:38",38,"Isaiah Lamb Defensive Rebound.",74,69,"Marist","UMass Lowell",NA,"400991064"
325,2,"0:26",26,"Brian Parker made Layup.",74,71,"Marist","UMass Lowell",NA,"400991064"
326,2,"0:23",23,"Marist  Timeout",74,71,"Marist","UMass Lowell",NA,"400991064"
327,2,"0:21",21,"Foul on Brian Parker.",74,71,"Marist","UMass Lowell",NA,"400991064"
328,2,"0:21",21,"Shawn Jones missed Free Throw.",74,71,"Marist","UMass Lowell",NA,"400991064"
329,2,"0:21",21,"Brian Parker Defensive Rebound.",74,71,"Marist","UMass Lowell",NA,"400991064"
330,2,"0:16",16,"Brian Parker missed Three Point Jumper.",74,71,"Marist","UMass Lowell",NA,"400991064"
331,2,"0:16",16,"Matt Harris Defensive Rebound.",74,71,"Marist","UMass Lowell",NA,"400991064"
332,2,"0:15",15,"Foul on Ryan Funk.",74,71,"Marist","UMass Lowell",NA,"400991064"
333,2,"0:15",15,"Matt Harris made Free Throw.",75,71,"Marist","UMass Lowell",NA,"400991064"
334,2,"0:15",15,"Matt Harris made Free Throw.",76,71,"Marist","UMass Lowell",NA,"400991064"
335,2,"0:15",15,"UMass Lowell  Timeout",76,71,"Marist","UMass Lowell",NA,"400991064"
336,2,"0:10",10,"Aleksandar Dozic missed Three Point Jumper.",76,71,"Marist","UMass Lowell",NA,"400991064"
337,2,"0:10",10,"Brian Parker Offensive Rebound.",76,71,"Marist","UMass Lowell",NA,"400991064"
338,2,"0:05",5,"Brian Parker missed Jumper.",76,71,"Marist","UMass Lowell",NA,"400991064"
339,2,"0:05",5,"Marist Offensive Rebound.",76,71,"Marist","UMass Lowell",NA,"400991064"
340,2,"0:03",3,"UMass Lowell  Timeout",76,71,"Marist","UMass Lowell",NA,"400991064"
341,2,"0:03",3,"Aleksandar Dozic made Layup. Assisted by Brian Parker.",76,73,"Marist","UMass Lowell",NA,"400991064"
342,2,"0:00",0,"End of Game",76,73,"Marist","UMass Lowell",NA,"400991064"
1,1,"20:00",2400,"PLAY",0,0,"Cornell","UMass Lowell",NA,"400991571"
2,1,"19:45",2385,"Matt Morgan made Three Point Jumper. Assisted by Jack Gordon.",0,3,"Cornell","UMass Lowell",NA,"400991571"
3,1,"19:37",2377,"Josh Gantz Turnover.",0,3,"Cornell","UMass Lowell",NA,"400991571"
4,1,"19:23",2363,"Josh Warren Turnover.",0,3,"Cornell","UMass Lowell",NA,"400991571"
5,1,"19:02",2342,"Rinardo Perry made Layup.",2,3,"Cornell","UMass Lowell",NA,"400991571"
6,1,"18:46",2326,"Josh Warren missed Layup.",2,3,"Cornell","UMass Lowell",NA,"400991571"
7,1,"18:46",2326,"Wil Bathurst Offensive Rebound.",2,3,"Cornell","UMass Lowell",NA,"400991571"
8,1,"18:38",2318,"Matt Morgan Turnover.",2,3,"Cornell","UMass Lowell",NA,"400991571"
9,1,"18:29",2309,"Josh Gantz Steal.",2,3,"Cornell","UMass Lowell",NA,"400991571"
10,1,"18:16",2296,"Jahad Thomas Turnover.",2,3,"Cornell","UMass Lowell",NA,"400991571"
11,1,"18:15",2295,"Steven Julian Steal.",2,3,"Cornell","UMass Lowell",NA,"400991571"
12,1,"18:12",2292,"Steven Julian missed Layup.",2,3,"Cornell","UMass Lowell",NA,"400991571"
13,1,"18:12",2292,"Jahad Thomas Defensive Rebound.",2,3,"Cornell","UMass Lowell",NA,"400991571"
14,1,"18:00",2280,"Jahad Thomas made Layup. Assisted by Josh Gantz.",4,3,"Cornell","UMass Lowell",NA,"400991571"
15,1,"17:49",2269,"Foul on Jahad Thomas.",4,3,"Cornell","UMass Lowell",NA,"400991571"
16,1,"17:33",2253,"Josh Warren Turnover.",4,3,"Cornell","UMass Lowell",NA,"400991571"
17,1,"17:32",2252,"Rinardo Perry Steal.",4,3,"Cornell","UMass Lowell",NA,"400991571"
18,1,"17:30",2250,"Rinardo Perry Turnover.",4,3,"Cornell","UMass Lowell",NA,"400991571"
19,1,"17:16",2236,"Steven Julian missed Layup.",4,3,"Cornell","UMass Lowell",NA,"400991571"
20,1,"17:16",2236,"Jahad Thomas Defensive Rebound.",4,3,"Cornell","UMass Lowell",NA,"400991571"
21,1,"17:10",2230,"Foul on Steven Julian.",4,3,"Cornell","UMass Lowell",NA,"400991571"
22,1,"17:10",2230,"Jahad Thomas made Free Throw.",5,3,"Cornell","UMass Lowell",NA,"400991571"
23,1,"17:10",2230,"Jahad Thomas made Free Throw.",6,3,"Cornell","UMass Lowell",NA,"400991571"
24,1,"17:03",2223,"Wil Bathurst missed Layup.",6,3,"Cornell","UMass Lowell",NA,"400991571"
25,1,"17:03",2223,"Rinardo Perry Defensive Rebound.",6,3,"Cornell","UMass Lowell",NA,"400991571"
26,1,"16:43",2203,"Foul on Wil Bathurst.",6,3,"Cornell","UMass Lowell",NA,"400991571"
27,1,"16:41",2201,"Rinardo Perry missed Jumper.",6,3,"Cornell","UMass Lowell",NA,"400991571"
28,1,"16:41",2201,"Josh Gantz Offensive Rebound.",6,3,"Cornell","UMass Lowell",NA,"400991571"
29,1,"16:37",2197,"Matt Harris missed Three Point Jumper.",6,3,"Cornell","UMass Lowell",NA,"400991571"
30,1,"16:37",2197,"Cornell Defensive Rebound.",6,3,"Cornell","UMass Lowell",NA,"400991571"
31,1,"16:34",2194,"Foul on Josh Gantz.",6,3,"Cornell","UMass Lowell",NA,"400991571"
32,1,"16:14",2174,"Jack Gordon Turnover.",6,3,"Cornell","UMass Lowell",NA,"400991571"
33,1,"16:03",2163,"Rinardo Perry made Three Point Jumper. Assisted by Jahad Thomas.",9,3,"Cornell","UMass Lowell",NA,"400991571"
34,1,"15:49",2149,"Jack Gordon made Layup. Assisted by Josh Warren.",9,5,"Cornell","UMass Lowell",NA,"400991571"
35,1,"15:33",2133,"Foul on Josh Warren.",9,5,"Cornell","UMass Lowell",NA,"400991571"
36,1,"15:33",2133,"Official TV Timeout",9,5,"Cornell","UMass Lowell",NA,"400991571"
37,1,"15:24",2124,"Rinardo Perry made Layup. Assisted by Jahad Thomas.",11,5,"Cornell","UMass Lowell",NA,"400991571"
38,1,"14:56",2096,"Stone Gettings made Layup.",11,7,"Cornell","UMass Lowell",NA,"400991571"
39,1,"14:43",2083,"Matt Harris missed Three Point Jumper.",11,7,"Cornell","UMass Lowell",NA,"400991571"
40,1,"14:43",2083,"Steven Julian Defensive Rebound.",11,7,"Cornell","UMass Lowell",NA,"400991571"
41,1,"14:29",2069,"Stone Gettings made Jumper.",11,9,"Cornell","UMass Lowell",NA,"400991571"
42,1,"14:09",2049,"Shawn Jones Turnover.",11,9,"Cornell","UMass Lowell",NA,"400991571"
43,1,"14:07",2047,"Steven Julian Steal.",11,9,"Cornell","UMass Lowell",NA,"400991571"
44,1,"14:02",2042,"Matt Morgan made Jumper. Assisted by Jack Gordon.",11,11,"Cornell","UMass Lowell",NA,"400991571"
45,1,"13:52",2032,"Rinardo Perry made Layup.",13,11,"Cornell","UMass Lowell",NA,"400991571"
46,1,"13:41",2021,"Matt Morgan made Three Point Jumper. Assisted by Wil Bathurst.",13,14,"Cornell","UMass Lowell",NA,"400991571"
47,1,"13:19",1999,"Matt Harris Turnover.",13,14,"Cornell","UMass Lowell",NA,"400991571"
48,1,"13:18",1998,"Stone Gettings Steal.",13,14,"Cornell","UMass Lowell",NA,"400991571"
49,1,"13:16",1996,"Steven Julian missed Layup.",13,14,"Cornell","UMass Lowell",NA,"400991571"
50,1,"13:16",1996,"Shawn Jones Defensive Rebound.",13,14,"Cornell","UMass Lowell",NA,"400991571"
51,1,"13:08",1988,"Josh Gantz made Layup. Assisted by Shawn Jones.",15,14,"Cornell","UMass Lowell",NA,"400991571"
52,1,"12:49",1969,"Jack Gordon missed Three Point Jumper.",15,14,"Cornell","UMass Lowell",NA,"400991571"
53,1,"12:49",1969,"Rinardo Perry Defensive Rebound.",15,14,"Cornell","UMass Lowell",NA,"400991571"
54,1,"12:39",1959,"Shawn Jones missed Jumper.",15,14,"Cornell","UMass Lowell",NA,"400991571"
55,1,"12:39",1959,"Jahad Thomas Offensive Rebound.",15,14,"Cornell","UMass Lowell",NA,"400991571"
56,1,"12:34",1954,"Jahad Thomas made Layup.",17,14,"Cornell","UMass Lowell",NA,"400991571"
57,1,"12:18",1938,"Stone Gettings Turnover.",17,14,"Cornell","UMass Lowell",NA,"400991571"
58,1,"12:17",1937,"Jahad Thomas Steal.",17,14,"Cornell","UMass Lowell",NA,"400991571"
59,1,"12:11",1931,"Matt Harris missed Three Point Jumper.",17,14,"Cornell","UMass Lowell",NA,"400991571"
60,1,"12:11",1931,"Matt Morgan Defensive Rebound.",17,14,"Cornell","UMass Lowell",NA,"400991571"
61,1,"11:49",1909,"Foul on Josh Gantz.",17,14,"Cornell","UMass Lowell",NA,"400991571"
62,1,"11:49",1909,"Official TV Timeout",17,14,"Cornell","UMass Lowell",NA,"400991571"
63,1,"11:49",1909,"Stone Gettings made Free Throw.",17,15,"Cornell","UMass Lowell",NA,"400991571"
64,1,"11:49",1909,"Stone Gettings made Free Throw.",17,16,"Cornell","UMass Lowell",NA,"400991571"
65,1,"11:36",1896,"Shawn Jones Turnover.",17,16,"Cornell","UMass Lowell",NA,"400991571"
66,1,"11:35",1895,"Terrance McBride Steal.",17,16,"Cornell","UMass Lowell",NA,"400991571"
67,1,"11:30",1890,"Joel Davis Turnover.",17,16,"Cornell","UMass Lowell",NA,"400991571"
68,1,"11:29",1889,"Obadiah Noel Steal.",17,16,"Cornell","UMass Lowell",NA,"400991571"
69,1,"11:14",1874,"Rinardo Perry missed Jumper.",17,16,"Cornell","UMass Lowell",NA,"400991571"
70,1,"11:14",1874,"Rinardo Perry Offensive Rebound.",17,16,"Cornell","UMass Lowell",NA,"400991571"
71,1,"11:05",1865,"Shawn Jones Turnover.",17,16,"Cornell","UMass Lowell",NA,"400991571"
72,1,"10:51",1851,"Jack Gordon made Layup.",17,18,"Cornell","UMass Lowell",NA,"400991571"
73,1,"10:29",1829,"Shawn Jones made Jumper.",19,18,"Cornell","UMass Lowell",NA,"400991571"
74,1,"10:20",1820,"Wil Bathurst made Jumper. Assisted by Terrance McBride.",19,20,"Cornell","UMass Lowell",NA,"400991571"
75,1,"9:46",1786,"Jahad Thomas made Layup.",21,20,"Cornell","UMass Lowell",NA,"400991571"
76,1,"9:31",1771,"Matt Morgan made Layup. Assisted by Stone Gettings.",21,22,"Cornell","UMass Lowell",NA,"400991571"
77,1,"9:15",1755,"Ryan Jones made Layup.",23,22,"Cornell","UMass Lowell",NA,"400991571"
78,1,"8:52",1732,"Foul on Joey Naccarato.",23,22,"Cornell","UMass Lowell",NA,"400991571"
79,1,"8:45",1725,"Matt Morgan Turnover.",23,22,"Cornell","UMass Lowell",NA,"400991571"
80,1,"8:24",1704,"Shawn Jones missed Layup.",23,22,"Cornell","UMass Lowell",NA,"400991571"
81,1,"8:24",1704,"Connor Bennett Offensive Rebound.",23,22,"Cornell","UMass Lowell",NA,"400991571"
82,1,"8:18",1698,"Connor Bennett made Jumper.",25,22,"Cornell","UMass Lowell",NA,"400991571"
83,1,"7:59",1679,"Stone Gettings made Layup.",25,24,"Cornell","UMass Lowell",NA,"400991571"
84,1,"7:41",1661,"Joey Naccarato missed Layup.",25,24,"Cornell","UMass Lowell",NA,"400991571"
85,1,"7:41",1661,"Stone Gettings Block.",25,24,"Cornell","UMass Lowell",NA,"400991571"
86,1,"7:38",1658,"Connor Bennett Offensive Rebound.",25,24,"Cornell","UMass Lowell",NA,"400991571"
87,1,"7:35",1655,"Connor Bennett made Layup.",27,24,"Cornell","UMass Lowell",NA,"400991571"
88,1,"7:24",1644,"Matt Morgan missed Three Point Jumper.",27,24,"Cornell","UMass Lowell",NA,"400991571"
89,1,"7:24",1644,"Shawn Jones Defensive Rebound.",27,24,"Cornell","UMass Lowell",NA,"400991571"
90,1,"7:22",1642,"Foul on Stone Gettings.",27,24,"Cornell","UMass Lowell",NA,"400991571"
91,1,"7:22",1642,"Official TV Timeout",27,24,"Cornell","UMass Lowell",NA,"400991571"
92,1,"7:05",1625,"Ryan Jones missed Jumper.",27,24,"Cornell","UMass Lowell",NA,"400991571"
93,1,"7:05",1625,"Connor Bennett Offensive Rebound.",27,24,"Cornell","UMass Lowell",NA,"400991571"
94,1,"7:05",1625,"Foul on Joel Davis.",27,24,"Cornell","UMass Lowell",NA,"400991571"
95,1,"7:05",1625,"Connor Bennett missed Free Throw.",27,24,"Cornell","UMass Lowell",NA,"400991571"
96,1,"7:05",1625,"UMass Lowell Deadball Team Rebound.",27,24,"Cornell","UMass Lowell",NA,"400991571"
97,1,"7:05",1625,"Connor Bennett missed Free Throw.",27,24,"Cornell","UMass Lowell",NA,"400991571"
98,1,"7:05",1625,"Ryan Jones Offensive Rebound.",27,24,"Cornell","UMass Lowell",NA,"400991571"
99,1,"6:59",1619,"Ryan Jones made Layup.",29,24,"Cornell","UMass Lowell",NA,"400991571"
100,1,"6:49",1609,"Josh Warren Turnover.",29,24,"Cornell","UMass Lowell",NA,"400991571"
101,1,"6:48",1608,"Ryan Jones Steal.",29,24,"Cornell","UMass Lowell",NA,"400991571"
102,1,"6:44",1604,"Stefan Borovac missed Layup.",29,24,"Cornell","UMass Lowell",NA,"400991571"
103,1,"6:44",1604,"Wil Bathurst Defensive Rebound.",29,24,"Cornell","UMass Lowell",NA,"400991571"
104,1,"6:38",1598,"Wil Bathurst made Layup.",29,26,"Cornell","UMass Lowell",NA,"400991571"
105,1,"6:38",1598,"Foul on Matt Harris.",29,26,"Cornell","UMass Lowell",NA,"400991571"
106,1,"6:38",1598,"Wil Bathurst made Free Throw.",29,27,"Cornell","UMass Lowell",NA,"400991571"
107,1,"6:17",1577,"Matt Harris made Jumper. Assisted by Stefan Borovac.",31,27,"Cornell","UMass Lowell",NA,"400991571"
108,1,"5:57",1557,"Josh Warren Turnover.",31,27,"Cornell","UMass Lowell",NA,"400991571"
109,1,"5:48",1548,"Matt Harris Turnover.",31,27,"Cornell","UMass Lowell",NA,"400991571"
110,1,"5:32",1532,"Matt Morgan missed Three Point Jumper.",31,27,"Cornell","UMass Lowell",NA,"400991571"
111,1,"5:32",1532,"Jahad Thomas Defensive Rebound.",31,27,"Cornell","UMass Lowell",NA,"400991571"
112,1,"5:22",1522,"Jahad Thomas missed Layup.",31,27,"Cornell","UMass Lowell",NA,"400991571"
113,1,"5:22",1522,"Wil Bathurst Block.",31,27,"Cornell","UMass Lowell",NA,"400991571"
114,1,"5:22",1522,"UMass Lowell Offensive Rebound.",31,27,"Cornell","UMass Lowell",NA,"400991571"
115,1,"5:11",1511,"Jahad Thomas made Layup.",33,27,"Cornell","UMass Lowell",NA,"400991571"
116,1,"4:48",1488,"Stone Gettings missed Layup.",33,27,"Cornell","UMass Lowell",NA,"400991571"
117,1,"4:48",1488,"Ryan Jones Defensive Rebound.",33,27,"Cornell","UMass Lowell",NA,"400991571"
118,1,"4:43",1483,"Rinardo Perry made Layup. Assisted by Ryan Jones.",35,27,"Cornell","UMass Lowell",NA,"400991571"
119,1,"4:38",1478,"Cornell  Timeout",35,27,"Cornell","UMass Lowell",NA,"400991571"
120,1,"4:29",1469,"Matt Morgan missed Layup.",35,27,"Cornell","UMass Lowell",NA,"400991571"
121,1,"4:29",1469,"Jahad Thomas Defensive Rebound.",35,27,"Cornell","UMass Lowell",NA,"400991571"
122,1,"4:02",1442,"Jahad Thomas made Three Point Jumper. Assisted by Obadiah Noel.",38,27,"Cornell","UMass Lowell",NA,"400991571"
123,1,"3:47",1427,"Stone Gettings Turnover.",38,27,"Cornell","UMass Lowell",NA,"400991571"
124,1,"3:45",1425,"Rinardo Perry Steal.",38,27,"Cornell","UMass Lowell",NA,"400991571"
125,1,"3:36",1416,"Jahad Thomas missed Layup.",38,27,"Cornell","UMass Lowell",NA,"400991571"
126,1,"3:36",1416,"Obadiah Noel Offensive Rebound.",38,27,"Cornell","UMass Lowell",NA,"400991571"
127,1,"3:31",1411,"Obadiah Noel made Two Point Tip Shot.",40,27,"Cornell","UMass Lowell",NA,"400991571"
128,1,"3:23",1403,"Stone Gettings made Three Point Jumper. Assisted by Wil Bathurst.",40,30,"Cornell","UMass Lowell",NA,"400991571"
129,1,"2:58",1378,"Jahad Thomas missed Jumper.",40,30,"Cornell","UMass Lowell",NA,"400991571"
130,1,"2:58",1378,"Steven Julian Defensive Rebound.",40,30,"Cornell","UMass Lowell",NA,"400991571"
131,1,"2:39",1359,"Matt Morgan made Three Point Jumper. Assisted by Wil Bathurst.",40,33,"Cornell","UMass Lowell",NA,"400991571"
132,1,"2:22",1342,"Rinardo Perry missed Three Point Jumper.",40,33,"Cornell","UMass Lowell",NA,"400991571"
133,1,"2:22",1342,"Cornell Defensive Rebound.",40,33,"Cornell","UMass Lowell",NA,"400991571"
134,1,"2:20",1340,"Official TV Timeout",40,33,"Cornell","UMass Lowell",NA,"400991571"
135,1,"2:19",1339,"Official TV Timeout",40,33,"Cornell","UMass Lowell",NA,"400991571"
136,1,"2:02",1322,"Foul on Wil Bathurst.",40,33,"Cornell","UMass Lowell",NA,"400991571"
137,1,"2:02",1322,"Wil Bathurst Turnover.",40,33,"Cornell","UMass Lowell",NA,"400991571"
138,1,"1:40",1300,"Connor Bennett missed Layup.",40,33,"Cornell","UMass Lowell",NA,"400991571"
139,1,"1:40",1300,"UMass Lowell Offensive Rebound.",40,33,"Cornell","UMass Lowell",NA,"400991571"
140,1,"1:35",1295,"Rinardo Perry made Three Point Jumper. Assisted by Shawn Jones.",43,33,"Cornell","UMass Lowell",NA,"400991571"
141,1,"1:16",1276,"Foul on Jahad Thomas.",43,33,"Cornell","UMass Lowell",NA,"400991571"
142,1,"1:16",1276,"Riley Voss missed Free Throw.",43,33,"Cornell","UMass Lowell",NA,"400991571"
143,1,"1:16",1276,"Cornell Deadball Team Rebound.",43,33,"Cornell","UMass Lowell",NA,"400991571"
144,1,"1:16",1276,"Riley Voss missed Free Throw.",43,33,"Cornell","UMass Lowell",NA,"400991571"
145,1,"1:16",1276,"Shawn Jones Defensive Rebound.",43,33,"Cornell","UMass Lowell",NA,"400991571"
146,1,"1:07",1267,"Rinardo Perry missed Three Point Jumper.",43,33,"Cornell","UMass Lowell",NA,"400991571"
147,1,"1:07",1267,"Steven Julian Defensive Rebound.",43,33,"Cornell","UMass Lowell",NA,"400991571"
148,1,"0:58",1258,"Matt Morgan missed Three Point Jumper.",43,33,"Cornell","UMass Lowell",NA,"400991571"
149,1,"0:58",1258,"Jahad Thomas Defensive Rebound.",43,33,"Cornell","UMass Lowell",NA,"400991571"
150,1,"0:31",1231,"Jahad Thomas missed Jumper.",43,33,"Cornell","UMass Lowell",NA,"400991571"
151,1,"0:31",1231,"Steven Julian Defensive Rebound.",43,33,"Cornell","UMass Lowell",NA,"400991571"
152,1,"0:01",1201,"Cornell  Turnover.",43,33,"Cornell","UMass Lowell",NA,"400991571"
153,1,"0:01",1201,"Jahad Thomas missed Three Point Jumper.",43,33,"Cornell","UMass Lowell",NA,"400991571"
154,1,"0:01",1201,"Matt Morgan Defensive Rebound.",43,33,"Cornell","UMass Lowell",NA,"400991571"
155,1,"0:00",1200,"End of 1st half",43,33,"Cornell","UMass Lowell",NA,"400991571"
156,2,"20:00",1200,"PLAY",43,33,"Cornell","UMass Lowell",NA,"400991571"
157,2,"19:44",1184,"Jahad Thomas missed Jumper.",43,33,"Cornell","UMass Lowell",NA,"400991571"
158,2,"19:44",1184,"Steven Julian Block.",43,33,"Cornell","UMass Lowell",NA,"400991571"
159,2,"19:42",1182,"Matt Morgan Defensive Rebound.",43,33,"Cornell","UMass Lowell",NA,"400991571"
160,2,"19:38",1178,"Wil Bathurst Turnover.",43,33,"Cornell","UMass Lowell",NA,"400991571"
161,2,"19:37",1177,"Matt Harris Steal.",43,33,"Cornell","UMass Lowell",NA,"400991571"
162,2,"19:31",1171,"Ryan Jones made Three Point Jumper. Assisted by Jahad Thomas.",46,33,"Cornell","UMass Lowell",NA,"400991571"
163,2,"19:16",1156,"Matt Morgan made Three Point Jumper. Assisted by Josh Warren.",46,36,"Cornell","UMass Lowell",NA,"400991571"
164,2,"19:01",1141,"Ryan Jones missed Jumper.",46,36,"Cornell","UMass Lowell",NA,"400991571"
165,2,"19:01",1141,"Steven Julian Defensive Rebound.",46,36,"Cornell","UMass Lowell",NA,"400991571"
166,2,"18:46",1126,"Josh Warren missed Three Point Jumper.",46,36,"Cornell","UMass Lowell",NA,"400991571"
167,2,"18:46",1126,"Josh Warren Offensive Rebound.",46,36,"Cornell","UMass Lowell",NA,"400991571"
