"play_id","half","time_remaining_half","secs_remaining","description","home_score","away_score","away","home","home_favored_by","game_id"
218,2,"13:08",788,"Brandon Anderson made Free Throw.",54,48,"UMass Lowell","Brown",NA,"400991574"
219,2,"12:44",764,"Shawn Jones Turnover.",54,48,"UMass Lowell","Brown",NA,"400991574"
220,2,"12:44",764,"Foul on Shawn Jones.",54,48,"UMass Lowell","Brown",NA,"400991574"
221,2,"12:37",757,"Brandon Anderson missed Layup.",54,48,"UMass Lowell","Brown",NA,"400991574"
222,2,"12:37",757,"Rinardo Perry Block.",54,48,"UMass Lowell","Brown",NA,"400991574"
223,2,"12:34",754,"Rinardo Perry Defensive Rebound.",54,48,"UMass Lowell","Brown",NA,"400991574"
224,2,"12:27",747,"Jahad Thomas made Layup.",54,50,"UMass Lowell","Brown",NA,"400991574"
225,2,"12:27",747,"Foul on Desmond Cambridge.",54,50,"UMass Lowell","Brown",NA,"400991574"
226,2,"12:27",747,"Jahad Thomas missed Free Throw.",54,50,"UMass Lowell","Brown",NA,"400991574"
227,2,"12:27",747,"Jason Massey Defensive Rebound.",54,50,"UMass Lowell","Brown",NA,"400991574"
228,2,"12:19",739,"Brandon Anderson Turnover.",54,50,"UMass Lowell","Brown",NA,"400991574"
229,2,"12:18",738,"Stefan Borovac Steal.",54,50,"UMass Lowell","Brown",NA,"400991574"
230,2,"12:11",731,"Foul on Tamenang Choh.",54,50,"UMass Lowell","Brown",NA,"400991574"
231,2,"12:11",731,"Jahad Thomas missed Free Throw.",54,50,"UMass Lowell","Brown",NA,"400991574"
232,2,"12:11",731,"UMass Lowell Deadball Team Rebound.",54,50,"UMass Lowell","Brown",NA,"400991574"
233,2,"12:11",731,"Jahad Thomas missed Free Throw.",54,50,"UMass Lowell","Brown",NA,"400991574"
234,2,"12:11",731,"Obi Okolie Defensive Rebound.",54,50,"UMass Lowell","Brown",NA,"400991574"
235,2,"12:02",722,"Foul on Obadiah Noel.",54,50,"UMass Lowell","Brown",NA,"400991574"
236,2,"12:02",722,"Brandon Anderson made Free Throw.",55,50,"UMass Lowell","Brown",NA,"400991574"
237,2,"12:02",722,"Brandon Anderson made Free Throw.",56,50,"UMass Lowell","Brown",NA,"400991574"
238,2,"11:40",700,"Obadiah Noel Turnover.",56,50,"UMass Lowell","Brown",NA,"400991574"
239,2,"11:40",700,"Zach Hunsaker Steal.",56,50,"UMass Lowell","Brown",NA,"400991574"
240,2,"11:36",696,"Foul on Obadiah Noel.",56,50,"UMass Lowell","Brown",NA,"400991574"
241,2,"11:36",696,"Official TV Timeout",56,50,"UMass Lowell","Brown",NA,"400991574"
242,2,"11:36",696,"Brandon Anderson made Free Throw.",57,50,"UMass Lowell","Brown",NA,"400991574"
243,2,"11:36",696,"Brandon Anderson made Free Throw.",58,50,"UMass Lowell","Brown",NA,"400991574"
244,2,"11:18",678,"Ryan Jones missed Three Point Jumper.",58,50,"UMass Lowell","Brown",NA,"400991574"
245,2,"11:18",678,"Josh Gantz Offensive Rebound.",58,50,"UMass Lowell","Brown",NA,"400991574"
246,2,"11:11",671,"Rinardo Perry Turnover.",58,50,"UMass Lowell","Brown",NA,"400991574"
247,2,"11:11",671,"Foul on Rinardo Perry.",58,50,"UMass Lowell","Brown",NA,"400991574"
248,2,"11:02",662,"Obi Okolie made Layup.",60,50,"UMass Lowell","Brown",NA,"400991574"
249,2,"10:45",645,"Josh Gantz missed Three Point Jumper.",60,50,"UMass Lowell","Brown",NA,"400991574"
250,2,"10:45",645,"Zach Hunsaker Defensive Rebound.",60,50,"UMass Lowell","Brown",NA,"400991574"
251,2,"10:35",635,"Zach Hunsaker made Layup.",62,50,"UMass Lowell","Brown",NA,"400991574"
252,2,"10:24",624,"Ryan Jones made Jumper.",62,52,"UMass Lowell","Brown",NA,"400991574"
253,2,"9:59",599,"Zach Hunsaker made Three Point Jumper. Assisted by Obi Okolie.",65,52,"UMass Lowell","Brown",NA,"400991574"
254,2,"9:42",582,"Obadiah Noel Turnover.",65,52,"UMass Lowell","Brown",NA,"400991574"
255,2,"9:41",581,"Jason Massey Steal.",65,52,"UMass Lowell","Brown",NA,"400991574"
256,2,"9:37",577,"Brandon Anderson missed Three Point Jumper.",65,52,"UMass Lowell","Brown",NA,"400991574"
257,2,"9:37",577,"Obi Okolie Offensive Rebound.",65,52,"UMass Lowell","Brown",NA,"400991574"
258,2,"9:12",552,"Zach Hunsaker made Jumper. Assisted by Brandon Anderson.",67,52,"UMass Lowell","Brown",NA,"400991574"
259,2,"8:53",533,"Ryan Jones made Three Point Jumper.",67,55,"UMass Lowell","Brown",NA,"400991574"
260,2,"8:36",516,"Foul on Josh Gantz.",67,55,"UMass Lowell","Brown",NA,"400991574"
261,2,"8:36",516,"Brandon Anderson made Free Throw.",68,55,"UMass Lowell","Brown",NA,"400991574"
262,2,"8:36",516,"Brandon Anderson made Free Throw.",69,55,"UMass Lowell","Brown",NA,"400991574"
263,2,"8:18",498,"Foul on Brandon Anderson.",69,55,"UMass Lowell","Brown",NA,"400991574"
264,2,"8:18",498,"Josh Gantz missed Free Throw.",69,55,"UMass Lowell","Brown",NA,"400991574"
265,2,"8:18",498,"Chris Sullivan Defensive Rebound.",69,55,"UMass Lowell","Brown",NA,"400991574"
266,2,"8:04",484,"Joshua Howard Turnover.",69,55,"UMass Lowell","Brown",NA,"400991574"
267,2,"8:04",484,"Foul on Joshua Howard.",69,55,"UMass Lowell","Brown",NA,"400991574"
268,2,"7:57",477,"Jahad Thomas Turnover.",69,55,"UMass Lowell","Brown",NA,"400991574"
269,2,"7:57",477,"Foul on Jahad Thomas.",69,55,"UMass Lowell","Brown",NA,"400991574"
270,2,"7:57",477,"Official TV Timeout",69,55,"UMass Lowell","Brown",NA,"400991574"
271,2,"7:54",474,"Zach Hunsaker Turnover.",69,55,"UMass Lowell","Brown",NA,"400991574"
272,2,"7:47",467,"Jahad Thomas missed Layup.",69,55,"UMass Lowell","Brown",NA,"400991574"
273,2,"7:47",467,"Joshua Howard Defensive Rebound.",69,55,"UMass Lowell","Brown",NA,"400991574"
274,2,"7:20",440,"Obi Okolie missed Three Point Jumper.",69,55,"UMass Lowell","Brown",NA,"400991574"
275,2,"7:20",440,"Josh Gantz Defensive Rebound.",69,55,"UMass Lowell","Brown",NA,"400991574"
276,2,"6:58",418,"Shawn Jones missed Layup.",69,55,"UMass Lowell","Brown",NA,"400991574"
277,2,"6:58",418,"Obi Okolie Defensive Rebound.",69,55,"UMass Lowell","Brown",NA,"400991574"
278,2,"6:41",401,"Joshua Howard made Layup.",71,55,"UMass Lowell","Brown",NA,"400991574"
279,2,"6:20",380,"Foul on Zach Hunsaker.",71,55,"UMass Lowell","Brown",NA,"400991574"
280,2,"6:20",380,"Shawn Jones made Free Throw.",71,56,"UMass Lowell","Brown",NA,"400991574"
281,2,"6:20",380,"Shawn Jones made Free Throw.",71,57,"UMass Lowell","Brown",NA,"400991574"
282,2,"6:17",377,"Foul on Shawn Jones.",71,57,"UMass Lowell","Brown",NA,"400991574"
283,2,"6:17",377,"Jason Massey missed Free Throw.",71,57,"UMass Lowell","Brown",NA,"400991574"
284,2,"6:17",377,"Brown Deadball Team Rebound.",71,57,"UMass Lowell","Brown",NA,"400991574"
285,2,"6:17",377,"Jason Massey made Free Throw.",72,57,"UMass Lowell","Brown",NA,"400991574"
286,2,"5:56",356,"Jahad Thomas missed Layup.",72,57,"UMass Lowell","Brown",NA,"400991574"
287,2,"5:56",356,"Desmond Cambridge Defensive Rebound.",72,57,"UMass Lowell","Brown",NA,"400991574"
288,2,"5:50",350,"Jason Massey made Layup. Assisted by Desmond Cambridge.",74,57,"UMass Lowell","Brown",NA,"400991574"
289,2,"5:43",343,"Ryan Jones missed Layup.",74,57,"UMass Lowell","Brown",NA,"400991574"
290,2,"5:43",343,"Tamenang Choh Defensive Rebound.",74,57,"UMass Lowell","Brown",NA,"400991574"
291,2,"5:34",334,"Brandon Anderson made Jumper.",76,57,"UMass Lowell","Brown",NA,"400991574"
292,2,"5:16",316,"Jahad Thomas made Layup. Assisted by Matt Harris.",76,59,"UMass Lowell","Brown",NA,"400991574"
293,2,"5:01",301,"Brandon Anderson Turnover.",76,59,"UMass Lowell","Brown",NA,"400991574"
294,2,"4:51",291,"Jahad Thomas made Layup. Assisted by Josh Gantz.",76,61,"UMass Lowell","Brown",NA,"400991574"
295,2,"4:31",271,"Desmond Cambridge missed Jumper.",76,61,"UMass Lowell","Brown",NA,"400991574"
296,2,"4:31",271,"Ryan Jones Defensive Rebound.",76,61,"UMass Lowell","Brown",NA,"400991574"
297,2,"4:19",259,"Ryan Jones missed Three Point Jumper.",76,61,"UMass Lowell","Brown",NA,"400991574"
298,2,"4:19",259,"Jahad Thomas Offensive Rebound.",76,61,"UMass Lowell","Brown",NA,"400991574"
299,2,"4:17",257,"Foul on Jason Massey.",76,61,"UMass Lowell","Brown",NA,"400991574"
300,2,"4:17",257,"Jahad Thomas made Free Throw.",76,62,"UMass Lowell","Brown",NA,"400991574"
301,2,"4:17",257,"Jahad Thomas made Free Throw.",76,63,"UMass Lowell","Brown",NA,"400991574"
302,2,"4:10",250,"Brandon Anderson missed Jumper.",76,63,"UMass Lowell","Brown",NA,"400991574"
303,2,"4:10",250,"Josh Gantz Defensive Rebound.",76,63,"UMass Lowell","Brown",NA,"400991574"
304,2,"4:02",242,"Ryan Jones made Three Point Jumper. Assisted by Jahad Thomas.",76,66,"UMass Lowell","Brown",NA,"400991574"
305,2,"3:59",239,"Brown  Timeout",76,66,"UMass Lowell","Brown",NA,"400991574"
306,2,"3:59",239,"Official TV Timeout",76,66,"UMass Lowell","Brown",NA,"400991574"
307,2,"3:41",221,"Obi Okolie made Layup.",78,66,"UMass Lowell","Brown",NA,"400991574"
308,2,"3:41",221,"Foul on Rinardo Perry.",78,66,"UMass Lowell","Brown",NA,"400991574"
309,2,"3:41",221,"Obi Okolie made Free Throw.",79,66,"UMass Lowell","Brown",NA,"400991574"
310,2,"3:26",206,"Ryan Jones missed Jumper.",79,66,"UMass Lowell","Brown",NA,"400991574"
311,2,"3:26",206,"Joshua Howard Block.",79,66,"UMass Lowell","Brown",NA,"400991574"
312,2,"3:24",204,"Jason Massey Defensive Rebound.",79,66,"UMass Lowell","Brown",NA,"400991574"
313,2,"3:22",202,"Foul on Josh Gantz.",79,66,"UMass Lowell","Brown",NA,"400991574"
314,2,"3:22",202,"Joshua Howard made Free Throw.",80,66,"UMass Lowell","Brown",NA,"400991574"
315,2,"3:22",202,"Joshua Howard missed Free Throw.",80,66,"UMass Lowell","Brown",NA,"400991574"
316,2,"3:22",202,"Ryan Jones Defensive Rebound.",80,66,"UMass Lowell","Brown",NA,"400991574"
317,2,"3:08",188,"Dontavious Smith Turnover.",80,66,"UMass Lowell","Brown",NA,"400991574"
318,2,"3:08",188,"Brandon Anderson Steal.",80,66,"UMass Lowell","Brown",NA,"400991574"
319,2,"3:06",186,"Brandon Anderson made Layup.",82,66,"UMass Lowell","Brown",NA,"400991574"
320,2,"2:47",167,"Foul on Jason Massey.",82,66,"UMass Lowell","Brown",NA,"400991574"
321,2,"2:47",167,"Matt Harris made Free Throw.",82,67,"UMass Lowell","Brown",NA,"400991574"
322,2,"2:47",167,"Matt Harris made Free Throw.",82,68,"UMass Lowell","Brown",NA,"400991574"
323,2,"2:24",144,"Desmond Cambridge Turnover.",82,68,"UMass Lowell","Brown",NA,"400991574"
324,2,"2:24",144,"Foul on Desmond Cambridge.",82,68,"UMass Lowell","Brown",NA,"400991574"
325,2,"2:12",132,"Matt Harris missed Jumper.",82,68,"UMass Lowell","Brown",NA,"400991574"
326,2,"2:12",132,"Jason Massey Defensive Rebound.",82,68,"UMass Lowell","Brown",NA,"400991574"
327,2,"1:41",101,"Joshua Howard made Layup.",84,68,"UMass Lowell","Brown",NA,"400991574"
328,2,"1:29",89,"Matt Harris made Layup.",84,70,"UMass Lowell","Brown",NA,"400991574"
329,2,"1:29",89,"Foul on Joshua Howard.",84,70,"UMass Lowell","Brown",NA,"400991574"
330,2,"1:29",89,"Matt Harris made Free Throw.",84,71,"UMass Lowell","Brown",NA,"400991574"
331,2,"1:17",77,"Obi Okolie missed Three Point Jumper.",84,71,"UMass Lowell","Brown",NA,"400991574"
332,2,"1:17",77,"Joshua Howard Offensive Rebound.",84,71,"UMass Lowell","Brown",NA,"400991574"
333,2,"0:53",53,"Joshua Howard made Layup.",86,71,"UMass Lowell","Brown",NA,"400991574"
334,2,"0:46",46,"Ryan Jones made Jumper.",86,73,"UMass Lowell","Brown",NA,"400991574"
335,2,"0:20",20,"Zach Hunsaker made Three Point Jumper. Assisted by Brandon Anderson.",89,73,"UMass Lowell","Brown",NA,"400991574"
336,2,"0:09",9,"Dontavious Smith made Layup. Assisted by Ryan Jones.",89,75,"UMass Lowell","Brown",NA,"400991574"
337,2,"0:00",0,"End of Game",89,75,"UMass Lowell","Brown",NA,"400991574"
1,1,"20:00",2400,"PLAY",0,0,"Boston University","UMass Lowell",NA,"400991575"
2,1,"19:34",2374,"Cedric Hankerson missed Three Point Jumper.",0,0,"Boston University","UMass Lowell",NA,"400991575"
3,1,"19:34",2374,"Matt Harris Defensive Rebound.",0,0,"Boston University","UMass Lowell",NA,"400991575"
4,1,"19:07",2347,"Ryan Jones missed Layup.",0,0,"Boston University","UMass Lowell",NA,"400991575"
5,1,"19:07",2347,"Max Mahoney Block.",0,0,"Boston University","UMass Lowell",NA,"400991575"
6,1,"19:05",2345,"Max Mahoney Defensive Rebound.",0,0,"Boston University","UMass Lowell",NA,"400991575"
7,1,"18:40",2320,"Max Mahoney made Layup. Assisted by Tyler Scanlon.",0,2,"Boston University","UMass Lowell",NA,"400991575"
8,1,"18:18",2298,"Josh Gantz missed Jumper.",0,2,"Boston University","UMass Lowell",NA,"400991575"
9,1,"18:18",2298,"Javante McCoy Defensive Rebound.",0,2,"Boston University","UMass Lowell",NA,"400991575"
10,1,"18:09",2289,"Cedric Hankerson made Layup.",0,4,"Boston University","UMass Lowell",NA,"400991575"
11,1,"17:59",2279,"Foul on Javante McCoy.",0,4,"Boston University","UMass Lowell",NA,"400991575"
12,1,"17:44",2264,"Matt Harris made Three Point Jumper. Assisted by Jahad Thomas.",3,4,"Boston University","UMass Lowell",NA,"400991575"
13,1,"17:27",2247,"Tyler Scanlon Turnover.",3,4,"Boston University","UMass Lowell",NA,"400991575"
14,1,"17:25",2245,"Rinardo Perry Steal.",3,4,"Boston University","UMass Lowell",NA,"400991575"
15,1,"17:23",2243,"Rinardo Perry Turnover.",3,4,"Boston University","UMass Lowell",NA,"400991575"
16,1,"17:03",2223,"Max Mahoney Turnover.",3,4,"Boston University","UMass Lowell",NA,"400991575"
17,1,"17:01",2221,"Ryan Jones Steal.",3,4,"Boston University","UMass Lowell",NA,"400991575"
18,1,"16:48",2208,"Rinardo Perry Turnover.",3,4,"Boston University","UMass Lowell",NA,"400991575"
19,1,"16:30",2190,"Foul on Jahad Thomas.",3,4,"Boston University","UMass Lowell",NA,"400991575"
20,1,"16:24",2184,"Cedric Hankerson missed Jumper.",3,4,"Boston University","UMass Lowell",NA,"400991575"
21,1,"16:24",2184,"Rinardo Perry Defensive Rebound.",3,4,"Boston University","UMass Lowell",NA,"400991575"
22,1,"16:06",2166,"Rinardo Perry missed Layup.",3,4,"Boston University","UMass Lowell",NA,"400991575"
23,1,"16:06",2166,"Cedric Hankerson Defensive Rebound.",3,4,"Boston University","UMass Lowell",NA,"400991575"
24,1,"16:01",2161,"Walter Whyte Turnover.",3,4,"Boston University","UMass Lowell",NA,"400991575"
25,1,"16:01",2161,"Jahad Thomas made Jumper. Assisted by Josh Gantz.",5,4,"Boston University","UMass Lowell",NA,"400991575"
26,1,"15:54",2154,"Walter Whyte made Dunk. Assisted by Cedric Hankerson.",5,6,"Boston University","UMass Lowell",NA,"400991575"
27,1,"15:30",2130,"Ryan Jones missed Three Point Jumper.",5,6,"Boston University","UMass Lowell",NA,"400991575"
28,1,"15:30",2130,"Tyler Scanlon Defensive Rebound.",5,6,"Boston University","UMass Lowell",NA,"400991575"
29,1,"15:12",2112,"Max Mahoney made Jumper.",5,8,"Boston University","UMass Lowell",NA,"400991575"
30,1,"14:55",2095,"Josh Gantz missed Layup.",5,8,"Boston University","UMass Lowell",NA,"400991575"
31,1,"14:55",2095,"Max Mahoney Block.",5,8,"Boston University","UMass Lowell",NA,"400991575"
32,1,"14:53",2093,"Rinardo Perry Offensive Rebound.",5,8,"Boston University","UMass Lowell",NA,"400991575"
33,1,"14:29",2069,"Foul on Max Mahoney.",5,8,"Boston University","UMass Lowell",NA,"400991575"
34,1,"14:29",2069,"Matt Harris made Free Throw.",6,8,"Boston University","UMass Lowell",NA,"400991575"
35,1,"14:29",2069,"Matt Harris made Free Throw.",7,8,"Boston University","UMass Lowell",NA,"400991575"
36,1,"14:03",2043,"Tyler Scanlon missed Jumper.",7,8,"Boston University","UMass Lowell",NA,"400991575"
37,1,"14:03",2043,"Tyler Scanlon Offensive Rebound.",7,8,"Boston University","UMass Lowell",NA,"400991575"
38,1,"13:59",2039,"Tyler Scanlon missed Jumper.",7,8,"Boston University","UMass Lowell",NA,"400991575"
39,1,"13:59",2039,"Jahad Thomas Defensive Rebound.",7,8,"Boston University","UMass Lowell",NA,"400991575"
40,1,"13:36",2016,"Matt Harris missed Three Point Jumper.",7,8,"Boston University","UMass Lowell",NA,"400991575"
41,1,"13:36",2016,"Nick Havener Defensive Rebound.",7,8,"Boston University","UMass Lowell",NA,"400991575"
42,1,"13:29",2009,"Will Goff made Layup.",7,10,"Boston University","UMass Lowell",NA,"400991575"
43,1,"13:08",1988,"Jahad Thomas Turnover.",7,10,"Boston University","UMass Lowell",NA,"400991575"
44,1,"13:06",1986,"Eric Johnson Steal.",7,10,"Boston University","UMass Lowell",NA,"400991575"
45,1,"13:01",1981,"Will Goff Turnover.",7,10,"Boston University","UMass Lowell",NA,"400991575"
46,1,"12:58",1978,"Jahad Thomas Steal.",7,10,"Boston University","UMass Lowell",NA,"400991575"
47,1,"12:56",1976,"Jahad Thomas made Layup.",9,10,"Boston University","UMass Lowell",NA,"400991575"
48,1,"12:43",1963,"Will Goff missed Layup.",9,10,"Boston University","UMass Lowell",NA,"400991575"
49,1,"12:43",1963,"Josh Gantz Defensive Rebound.",9,10,"Boston University","UMass Lowell",NA,"400991575"
50,1,"12:42",1962,"Foul on Will Goff.",9,10,"Boston University","UMass Lowell",NA,"400991575"
51,1,"12:23",1943,"Josh Gantz missed Three Point Jumper.",9,10,"Boston University","UMass Lowell",NA,"400991575"
52,1,"12:23",1943,"Will Goff Defensive Rebound.",9,10,"Boston University","UMass Lowell",NA,"400991575"
53,1,"12:15",1935,"Cedric Hankerson made Layup. Assisted by Will Goff.",9,12,"Boston University","UMass Lowell",NA,"400991575"
54,1,"11:56",1916,"Josh Gantz Turnover.",9,12,"Boston University","UMass Lowell",NA,"400991575"
55,1,"11:56",1916,"Official TV Timeout",9,12,"Boston University","UMass Lowell",NA,"400991575"
56,1,"11:29",1889,"Eric Johnson missed Three Point Jumper.",9,12,"Boston University","UMass Lowell",NA,"400991575"
57,1,"11:29",1889,"Andrew Petcash Offensive Rebound.",9,12,"Boston University","UMass Lowell",NA,"400991575"
58,1,"11:11",1871,"Foul on Shawn Jones.",9,12,"Boston University","UMass Lowell",NA,"400991575"
59,1,"11:11",1871,"Nick Havener missed Free Throw.",9,12,"Boston University","UMass Lowell",NA,"400991575"
60,1,"11:11",1871,"Boston University Deadball Team Rebound.",9,12,"Boston University","UMass Lowell",NA,"400991575"
61,1,"11:11",1871,"Nick Havener made Free Throw.",9,13,"Boston University","UMass Lowell",NA,"400991575"
62,1,"10:46",1846,"Matt Harris made Jumper.",11,13,"Boston University","UMass Lowell",NA,"400991575"
63,1,"10:46",1846,"Foul on Sukhmail Mathon.",11,13,"Boston University","UMass Lowell",NA,"400991575"
64,1,"10:46",1846,"Matt Harris made Free Throw.",12,13,"Boston University","UMass Lowell",NA,"400991575"
65,1,"10:35",1835,"Eric Johnson Turnover.",12,13,"Boston University","UMass Lowell",NA,"400991575"
66,1,"10:17",1817,"Shawn Jones made Layup.",14,13,"Boston University","UMass Lowell",NA,"400991575"
67,1,"10:02",1802,"Sukhmail Mathon made Jumper.",14,15,"Boston University","UMass Lowell",NA,"400991575"
68,1,"9:40",1780,"Matt Harris missed Jumper.",14,15,"Boston University","UMass Lowell",NA,"400991575"
69,1,"9:40",1780,"Nick Havener Defensive Rebound.",14,15,"Boston University","UMass Lowell",NA,"400991575"
70,1,"9:39",1779,"Foul on Stefan Borovac.",14,15,"Boston University","UMass Lowell",NA,"400991575"
71,1,"9:37",1777,"Foul on Jahad Thomas.",14,15,"Boston University","UMass Lowell",NA,"400991575"
72,1,"9:35",1775,"Tyler Scanlon missed Jumper.",14,15,"Boston University","UMass Lowell",NA,"400991575"
73,1,"9:35",1775,"Rinardo Perry Defensive Rebound.",14,15,"Boston University","UMass Lowell",NA,"400991575"
74,1,"9:15",1755,"Rinardo Perry made Three Point Jumper. Assisted by Shawn Jones.",17,15,"Boston University","UMass Lowell",NA,"400991575"
75,1,"8:48",1728,"Javante McCoy made Jumper.",17,17,"Boston University","UMass Lowell",NA,"400991575"
76,1,"8:26",1706,"Jahad Thomas missed Jumper.",17,17,"Boston University","UMass Lowell",NA,"400991575"
77,1,"8:26",1706,"Javante McCoy Defensive Rebound.",17,17,"Boston University","UMass Lowell",NA,"400991575"
78,1,"8:11",1691,"Foul on Stefan Borovac.",17,17,"Boston University","UMass Lowell",NA,"400991575"
79,1,"8:11",1691,"Max Mahoney made Free Throw.",17,18,"Boston University","UMass Lowell",NA,"400991575"
80,1,"8:11",1691,"Max Mahoney missed Free Throw.",17,18,"Boston University","UMass Lowell",NA,"400991575"
81,1,"8:11",1691,"Josh Gantz Defensive Rebound.",17,18,"Boston University","UMass Lowell",NA,"400991575"
82,1,"7:39",1659,"Shawn Jones missed Three Point Jumper.",17,18,"Boston University","UMass Lowell",NA,"400991575"
83,1,"7:39",1659,"Max Mahoney Defensive Rebound.",17,18,"Boston University","UMass Lowell",NA,"400991575"
84,1,"7:28",1648,"Cedric Hankerson missed Layup.",17,18,"Boston University","UMass Lowell",NA,"400991575"
85,1,"7:28",1648,"Rinardo Perry Block.",17,18,"Boston University","UMass Lowell",NA,"400991575"
86,1,"7:28",1648,"Boston University Offensive Rebound.",17,18,"Boston University","UMass Lowell",NA,"400991575"
87,1,"7:25",1645,"Official TV Timeout",17,18,"Boston University","UMass Lowell",NA,"400991575"
88,1,"7:14",1634,"Walter Whyte made Three Point Jumper. Assisted by Javante McCoy.",17,21,"Boston University","UMass Lowell",NA,"400991575"
89,1,"6:56",1616,"Foul on Obadiah Noel.",17,21,"Boston University","UMass Lowell",NA,"400991575"
90,1,"6:56",1616,"Obadiah Noel Turnover.",17,21,"Boston University","UMass Lowell",NA,"400991575"
91,1,"6:42",1602,"Javante McCoy Turnover.",17,21,"Boston University","UMass Lowell",NA,"400991575"
92,1,"6:31",1591,"Foul on Cedric Hankerson.",17,21,"Boston University","UMass Lowell",NA,"400991575"
93,1,"6:23",1583,"Jahad Thomas Turnover.",17,21,"Boston University","UMass Lowell",NA,"400991575"
94,1,"6:07",1567,"Max Mahoney made Layup.",17,23,"Boston University","UMass Lowell",NA,"400991575"
95,1,"5:53",1553,"Rinardo Perry missed Three Point Jumper.",17,23,"Boston University","UMass Lowell",NA,"400991575"
96,1,"5:53",1553,"Boston University Defensive Rebound.",17,23,"Boston University","UMass Lowell",NA,"400991575"
97,1,"5:33",1533,"Max Mahoney missed Jumper.",17,23,"Boston University","UMass Lowell",NA,"400991575"
98,1,"5:33",1533,"Rinardo Perry Defensive Rebound.",17,23,"Boston University","UMass Lowell",NA,"400991575"
99,1,"5:25",1525,"Rinardo Perry Turnover.",17,23,"Boston University","UMass Lowell",NA,"400991575"
100,1,"5:23",1523,"Javante McCoy Steal.",17,23,"Boston University","UMass Lowell",NA,"400991575"
101,1,"5:19",1519,"Foul on Walter Whyte.",17,23,"Boston University","UMass Lowell",NA,"400991575"
102,1,"5:19",1519,"Walter Whyte Turnover.",17,23,"Boston University","UMass Lowell",NA,"400991575"
103,1,"5:05",1505,"Jahad Thomas missed Layup.",17,23,"Boston University","UMass Lowell",NA,"400991575"
104,1,"5:05",1505,"Max Mahoney Defensive Rebound.",17,23,"Boston University","UMass Lowell",NA,"400991575"
105,1,"4:43",1483,"Max Mahoney Turnover.",17,23,"Boston University","UMass Lowell",NA,"400991575"
106,1,"4:42",1482,"Rinardo Perry Steal.",17,23,"Boston University","UMass Lowell",NA,"400991575"
107,1,"4:39",1479,"Foul on Tyler Scanlon.",17,23,"Boston University","UMass Lowell",NA,"400991575"
108,1,"4:39",1479,"Rinardo Perry made Free Throw.",18,23,"Boston University","UMass Lowell",NA,"400991575"
109,1,"4:39",1479,"Rinardo Perry missed Free Throw.",18,23,"Boston University","UMass Lowell",NA,"400991575"
110,1,"4:39",1479,"Walter Whyte Defensive Rebound.",18,23,"Boston University","UMass Lowell",NA,"400991575"
111,1,"4:16",1456,"Tyler Scanlon made Three Point Jumper. Assisted by Nick Havener.",18,26,"Boston University","UMass Lowell",NA,"400991575"
112,1,"3:52",1432,"Ryan Jones made Three Point Jumper. Assisted by Rinardo Perry.",21,26,"Boston University","UMass Lowell",NA,"400991575"
113,1,"3:32",1412,"Nick Havener made Layup. Assisted by Tyler Scanlon.",21,28,"Boston University","UMass Lowell",NA,"400991575"
114,1,"3:20",1400,"Josh Gantz made Three Point Jumper. Assisted by Ryan Jones.",24,28,"Boston University","UMass Lowell",NA,"400991575"
115,1,"3:02",1382,"Official TV Timeout",24,28,"Boston University","UMass Lowell",NA,"400991575"
116,1,"2:46",1366,"Nick Havener Turnover.",24,28,"Boston University","UMass Lowell",NA,"400991575"
117,1,"2:23",1343,"Matt Harris made Jumper.",26,28,"Boston University","UMass Lowell",NA,"400991575"
118,1,"2:01",1321,"Cedric Hankerson made Layup.",26,30,"Boston University","UMass Lowell",NA,"400991575"
119,1,"1:42",1302,"Connor Bennett made Layup. Assisted by Ryan Jones.",28,30,"Boston University","UMass Lowell",NA,"400991575"
120,1,"1:42",1302,"Foul on Sukhmail Mathon.",28,30,"Boston University","UMass Lowell",NA,"400991575"
121,1,"1:42",1302,"Connor Bennett missed Free Throw.",28,30,"Boston University","UMass Lowell",NA,"400991575"
122,1,"1:42",1302,"Rinardo Perry Offensive Rebound.",28,30,"Boston University","UMass Lowell",NA,"400991575"
123,1,"1:38",1298,"Matt Harris missed Three Point Jumper.",28,30,"Boston University","UMass Lowell",NA,"400991575"
124,1,"1:30",1290,"Connor Bennett Offensive Rebound.",28,30,"Boston University","UMass Lowell",NA,"400991575"
125,1,"1:30",1290,"Foul on Kamali Chambers.",28,30,"Boston University","UMass Lowell",NA,"400991575"
126,1,"1:30",1290,"Matt Harris made Free Throw.",29,30,"Boston University","UMass Lowell",NA,"400991575"
127,1,"1:30",1290,"Matt Harris made Free Throw.",30,30,"Boston University","UMass Lowell",NA,"400991575"
128,1,"1:30",1290,"Matt Harris made Free Throw.",31,30,"Boston University","UMass Lowell",NA,"400991575"
129,1,"1:10",1270,"Max Mahoney made Layup.",31,32,"Boston University","UMass Lowell",NA,"400991575"
130,1,"1:03",1263,"UMass Lowell  Timeout",31,32,"Boston University","UMass Lowell",NA,"400991575"
131,1,"0:42",1242,"Foul on Shawn Jones.",31,32,"Boston University","UMass Lowell",NA,"400991575"
132,1,"0:42",1242,"Shawn Jones Turnover.",31,32,"Boston University","UMass Lowell",NA,"400991575"
133,1,"0:29",1229,"Cedric Hankerson made Layup.",31,34,"Boston University","UMass Lowell",NA,"400991575"
134,1,"0:05",1205,"Rinardo Perry missed Three Point Jumper.",31,34,"Boston University","UMass Lowell",NA,"400991575"
135,1,"0:05",1205,"Tyler Scanlon Defensive Rebound.",31,34,"Boston University","UMass Lowell",NA,"400991575"
136,1,"0:00",1200,"End of 1st half",31,34,"Boston University","UMass Lowell",NA,"400991575"
137,2,"20:00",1200,"PLAY",31,34,"Boston University","UMass Lowell",NA,"400991575"
138,2,"19:52",1192,"Rinardo Perry missed Layup.",31,34,"Boston University","UMass Lowell",NA,"400991575"
139,2,"19:52",1192,"Max Mahoney Defensive Rebound.",31,34,"Boston University","UMass Lowell",NA,"400991575"
140,2,"19:40",1180,"Javante McCoy Turnover.",31,34,"Boston University","UMass Lowell",NA,"400991575"
