"play_id","half","time_remaining_half","secs_remaining","description","home_score","away_score","away","home","home_favored_by","game_id"
1,1,"20:00",2400,"PLAY",0,0,"UMass Lowell","Massachusetts",NA,"400990098"
2,1,"19:43",2383,"Unique McLean missed Three Point Jumper.",0,0,"UMass Lowell","Massachusetts",NA,"400990098"
3,1,"19:43",2383,"Matt Harris Defensive Rebound.",0,0,"UMass Lowell","Massachusetts",NA,"400990098"
4,1,"19:31",2371,"Ryan Jones Turnover.",0,0,"UMass Lowell","Massachusetts",NA,"400990098"
5,1,"19:31",2371,"Luwane Pipkins Steal.",0,0,"UMass Lowell","Massachusetts",NA,"400990098"
6,1,"19:11",2351,"Luwane Pipkins missed Jumper.",0,0,"UMass Lowell","Massachusetts",NA,"400990098"
7,1,"19:11",2351,"Matt Harris Defensive Rebound.",0,0,"UMass Lowell","Massachusetts",NA,"400990098"
8,1,"18:54",2334,"Josh Gantz missed Three Point Jumper.",0,0,"UMass Lowell","Massachusetts",NA,"400990098"
9,1,"18:54",2334,"Unique McLean Defensive Rebound.",0,0,"UMass Lowell","Massachusetts",NA,"400990098"
10,1,"18:33",2313,"Chris Baldwin missed Three Point Jumper.",0,0,"UMass Lowell","Massachusetts",NA,"400990098"
11,1,"18:33",2313,"Ryan Jones Defensive Rebound.",0,0,"UMass Lowell","Massachusetts",NA,"400990098"
12,1,"18:23",2303,"Josh Gantz missed Three Point Jumper.",0,0,"UMass Lowell","Massachusetts",NA,"400990098"
13,1,"18:23",2303,"Luwane Pipkins Defensive Rebound.",0,0,"UMass Lowell","Massachusetts",NA,"400990098"
14,1,"18:00",2280,"Luwane Pipkins missed Layup.",0,0,"UMass Lowell","Massachusetts",NA,"400990098"
15,1,"18:00",2280,"Josh Gantz Block.",0,0,"UMass Lowell","Massachusetts",NA,"400990098"
16,1,"17:58",2278,"Luwane Pipkins Offensive Rebound.",0,0,"UMass Lowell","Massachusetts",NA,"400990098"
17,1,"17:52",2272,"Chris Baldwin made Jumper. Assisted by C.J. Anderson.",2,0,"UMass Lowell","Massachusetts",NA,"400990098"
18,1,"17:39",2259,"Rinardo Perry missed Layup.",2,0,"UMass Lowell","Massachusetts",NA,"400990098"
19,1,"17:39",2259,"Malik Hines Defensive Rebound.",2,0,"UMass Lowell","Massachusetts",NA,"400990098"
20,1,"17:30",2250,"C.J. Anderson missed Jumper.",2,0,"UMass Lowell","Massachusetts",NA,"400990098"
21,1,"17:30",2250,"Josh Gantz Defensive Rebound.",2,0,"UMass Lowell","Massachusetts",NA,"400990098"
22,1,"17:19",2239,"Connor Bennett made Layup. Assisted by Matt Harris.",2,2,"UMass Lowell","Massachusetts",NA,"400990098"
23,1,"17:02",2222,"Luwane Pipkins made Layup.",4,2,"UMass Lowell","Massachusetts",NA,"400990098"
24,1,"16:53",2213,"Ryan Jones missed Layup.",4,2,"UMass Lowell","Massachusetts",NA,"400990098"
25,1,"16:53",2213,"Carl Pierre Defensive Rebound.",4,2,"UMass Lowell","Massachusetts",NA,"400990098"
26,1,"16:46",2206,"Luwane Pipkins missed Three Point Jumper.",4,2,"UMass Lowell","Massachusetts",NA,"400990098"
27,1,"16:46",2206,"Unique McLean Offensive Rebound.",4,2,"UMass Lowell","Massachusetts",NA,"400990098"
28,1,"16:40",2200,"Carl Pierre made Three Point Jumper. Assisted by Unique McLean.",7,2,"UMass Lowell","Massachusetts",NA,"400990098"
29,1,"16:08",2168,"Matt Harris made Three Point Jumper. Assisted by Ryan Jones.",7,5,"UMass Lowell","Massachusetts",NA,"400990098"
30,1,"15:49",2149,"Rashaan Holloway missed Jumper.",7,5,"UMass Lowell","Massachusetts",NA,"400990098"
31,1,"15:49",2149,"Ryan Jones Defensive Rebound.",7,5,"UMass Lowell","Massachusetts",NA,"400990098"
32,1,"15:35",2135,"Josh Gantz made Jumper.",7,7,"UMass Lowell","Massachusetts",NA,"400990098"
33,1,"15:35",2135,"Foul on Unique McLean.",7,7,"UMass Lowell","Massachusetts",NA,"400990098"
34,1,"15:35",2135,"Official TV Timeout",7,7,"UMass Lowell","Massachusetts",NA,"400990098"
35,1,"15:35",2135,"Josh Gantz made Free Throw.",7,8,"UMass Lowell","Massachusetts",NA,"400990098"
36,1,"15:12",2112,"Rashaan Holloway Turnover.",7,8,"UMass Lowell","Massachusetts",NA,"400990098"
37,1,"15:09",2109,"Shawn Jones Turnover.",7,8,"UMass Lowell","Massachusetts",NA,"400990098"
38,1,"14:29",2069,"Carl Pierre missed Three Point Jumper.",7,8,"UMass Lowell","Massachusetts",NA,"400990098"
39,1,"14:29",2069,"Matt Harris Defensive Rebound.",7,8,"UMass Lowell","Massachusetts",NA,"400990098"
40,1,"14:10",2050,"Foul on Rayshawn Miller.",7,8,"UMass Lowell","Massachusetts",NA,"400990098"
41,1,"14:03",2043,"Ryan Jones missed Jumper.",7,8,"UMass Lowell","Massachusetts",NA,"400990098"
42,1,"14:03",2043,"Luwane Pipkins Defensive Rebound.",7,8,"UMass Lowell","Massachusetts",NA,"400990098"
43,1,"13:58",2038,"Foul on Shawn Jones.",7,8,"UMass Lowell","Massachusetts",NA,"400990098"
44,1,"13:40",2020,"Malik Hines Turnover.",7,8,"UMass Lowell","Massachusetts",NA,"400990098"
45,1,"13:23",2003,"Ryan Jones Turnover.",7,8,"UMass Lowell","Massachusetts",NA,"400990098"
46,1,"13:21",2001,"Chris Baldwin Steal.",7,8,"UMass Lowell","Massachusetts",NA,"400990098"
47,1,"13:18",1998,"Foul on Connor Bennett.",7,8,"UMass Lowell","Massachusetts",NA,"400990098"
48,1,"13:18",1998,"Malik Hines made Free Throw.",8,8,"UMass Lowell","Massachusetts",NA,"400990098"
49,1,"13:18",1998,"Malik Hines made Free Throw.",9,8,"UMass Lowell","Massachusetts",NA,"400990098"
50,1,"12:55",1975,"Obadiah Noel missed Layup.",9,8,"UMass Lowell","Massachusetts",NA,"400990098"
51,1,"12:55",1975,"Chris Baldwin Defensive Rebound.",9,8,"UMass Lowell","Massachusetts",NA,"400990098"
52,1,"12:44",1964,"Rayshawn Miller made Jumper.",11,8,"UMass Lowell","Massachusetts",NA,"400990098"
53,1,"12:28",1948,"Shawn Jones made Layup. Assisted by Stefan Borovac.",11,10,"UMass Lowell","Massachusetts",NA,"400990098"
54,1,"12:12",1932,"Chris Baldwin missed Three Point Jumper.",11,10,"UMass Lowell","Massachusetts",NA,"400990098"
55,1,"12:12",1932,"Obadiah Noel Defensive Rebound.",11,10,"UMass Lowell","Massachusetts",NA,"400990098"
56,1,"11:55",1915,"Stefan Borovac made Layup. Assisted by Josh Gantz.",11,12,"UMass Lowell","Massachusetts",NA,"400990098"
57,1,"11:55",1915,"Foul on Chris Baldwin.",11,12,"UMass Lowell","Massachusetts",NA,"400990098"
58,1,"11:54",1914,"Official TV Timeout",11,12,"UMass Lowell","Massachusetts",NA,"400990098"
59,1,"11:54",1914,"Stefan Borovac made Free Throw.",11,13,"UMass Lowell","Massachusetts",NA,"400990098"
60,1,"11:39",1899,"C.J. Anderson missed Layup.",11,13,"UMass Lowell","Massachusetts",NA,"400990098"
61,1,"11:39",1899,"Stefan Borovac Defensive Rebound.",11,13,"UMass Lowell","Massachusetts",NA,"400990098"
62,1,"11:30",1890,"Shawn Jones missed Jumper.",11,13,"UMass Lowell","Massachusetts",NA,"400990098"
63,1,"11:30",1890,"Malik Hines Defensive Rebound.",11,13,"UMass Lowell","Massachusetts",NA,"400990098"
64,1,"11:24",1884,"Foul on Stefan Borovac.",11,13,"UMass Lowell","Massachusetts",NA,"400990098"
65,1,"11:24",1884,"Malik Hines missed Free Throw.",11,13,"UMass Lowell","Massachusetts",NA,"400990098"
66,1,"11:24",1884,"UMass Deadball Team Rebound.",11,13,"UMass Lowell","Massachusetts",NA,"400990098"
67,1,"11:24",1884,"Malik Hines made Free Throw.",12,13,"UMass Lowell","Massachusetts",NA,"400990098"
68,1,"11:13",1873,"Josh Gantz missed Three Point Jumper.",12,13,"UMass Lowell","Massachusetts",NA,"400990098"
69,1,"11:13",1873,"C.J. Anderson Defensive Rebound.",12,13,"UMass Lowell","Massachusetts",NA,"400990098"
70,1,"11:07",1867,"Unique McLean missed Three Point Jumper.",12,13,"UMass Lowell","Massachusetts",NA,"400990098"
71,1,"11:07",1867,"Malik Hines Offensive Rebound.",12,13,"UMass Lowell","Massachusetts",NA,"400990098"
72,1,"11:03",1863,"Malik Hines missed Jumper.",12,13,"UMass Lowell","Massachusetts",NA,"400990098"
73,1,"11:03",1863,"Rashaan Holloway Offensive Rebound.",12,13,"UMass Lowell","Massachusetts",NA,"400990098"
74,1,"10:59",1859,"Rashaan Holloway made Layup.",14,13,"UMass Lowell","Massachusetts",NA,"400990098"
75,1,"10:48",1848,"Ryan Jones missed Three Point Jumper.",14,13,"UMass Lowell","Massachusetts",NA,"400990098"
76,1,"10:48",1848,"Malik Hines Defensive Rebound.",14,13,"UMass Lowell","Massachusetts",NA,"400990098"
77,1,"10:16",1816,"Foul on Rinardo Perry.",14,13,"UMass Lowell","Massachusetts",NA,"400990098"
78,1,"10:16",1816,"C.J. Anderson made Free Throw.",15,13,"UMass Lowell","Massachusetts",NA,"400990098"
79,1,"10:16",1816,"C.J. Anderson missed Free Throw.",15,13,"UMass Lowell","Massachusetts",NA,"400990098"
80,1,"10:16",1816,"Josh Gantz Defensive Rebound.",15,13,"UMass Lowell","Massachusetts",NA,"400990098"
81,1,"10:07",1807,"Ryan Jones made Layup.",15,15,"UMass Lowell","Massachusetts",NA,"400990098"
82,1,"10:07",1807,"Foul on Rashaan Holloway.",15,15,"UMass Lowell","Massachusetts",NA,"400990098"
83,1,"10:07",1807,"Ryan Jones missed Free Throw.",15,15,"UMass Lowell","Massachusetts",NA,"400990098"
84,1,"10:07",1807,"Rashaan Holloway Defensive Rebound.",15,15,"UMass Lowell","Massachusetts",NA,"400990098"
85,1,"9:47",1787,"Luwane Pipkins made Layup. Assisted by C.J. Anderson.",17,15,"UMass Lowell","Massachusetts",NA,"400990098"
86,1,"9:26",1766,"Matt Harris missed Three Point Jumper.",17,15,"UMass Lowell","Massachusetts",NA,"400990098"
87,1,"9:26",1766,"Carl Pierre Defensive Rebound.",17,15,"UMass Lowell","Massachusetts",NA,"400990098"
88,1,"9:19",1759,"Luwane Pipkins missed Three Point Jumper.",17,15,"UMass Lowell","Massachusetts",NA,"400990098"
89,1,"9:19",1759,"C.J. Anderson Offensive Rebound.",17,15,"UMass Lowell","Massachusetts",NA,"400990098"
90,1,"9:12",1752,"Carl Pierre missed Jumper.",17,15,"UMass Lowell","Massachusetts",NA,"400990098"
91,1,"9:12",1752,"Obadiah Noel Defensive Rebound.",17,15,"UMass Lowell","Massachusetts",NA,"400990098"
92,1,"9:09",1749,"Foul on Rashaan Holloway.",17,15,"UMass Lowell","Massachusetts",NA,"400990098"
93,1,"9:01",1741,"Matt Harris missed Three Point Jumper.",17,15,"UMass Lowell","Massachusetts",NA,"400990098"
94,1,"9:01",1741,"Connor Bennett Offensive Rebound.",17,15,"UMass Lowell","Massachusetts",NA,"400990098"
95,1,"9:00",1740,"Foul on Carl Pierre.",17,15,"UMass Lowell","Massachusetts",NA,"400990098"
96,1,"9:00",1740,"Connor Bennett missed Free Throw.",17,15,"UMass Lowell","Massachusetts",NA,"400990098"
97,1,"9:00",1740,"UMass Lowell Deadball Team Rebound.",17,15,"UMass Lowell","Massachusetts",NA,"400990098"
98,1,"9:00",1740,"Connor Bennett made Free Throw.",17,16,"UMass Lowell","Massachusetts",NA,"400990098"
99,1,"9:00",1740,"UMass  Timeout",17,16,"UMass Lowell","Massachusetts",NA,"400990098"
100,1,"8:42",1722,"Luwane Pipkins missed Layup.",17,16,"UMass Lowell","Massachusetts",NA,"400990098"
101,1,"8:42",1722,"Malik Hines Offensive Rebound.",17,16,"UMass Lowell","Massachusetts",NA,"400990098"
102,1,"8:37",1717,"Malik Hines made Two Point Tip Shot.",19,16,"UMass Lowell","Massachusetts",NA,"400990098"
103,1,"8:22",1702,"Connor Bennett made Layup. Assisted by Obadiah Noel.",19,18,"UMass Lowell","Massachusetts",NA,"400990098"
104,1,"8:06",1686,"Unique McLean Turnover.",19,18,"UMass Lowell","Massachusetts",NA,"400990098"
105,1,"8:03",1683,"Josh Gantz Steal.",19,18,"UMass Lowell","Massachusetts",NA,"400990098"
106,1,"8:01",1681,"Foul on Connor Bennett.",19,18,"UMass Lowell","Massachusetts",NA,"400990098"
107,1,"8:01",1681,"Connor Bennett Turnover.",19,18,"UMass Lowell","Massachusetts",NA,"400990098"
108,1,"7:32",1652,"Rayshawn Miller missed Three Point Jumper.",19,18,"UMass Lowell","Massachusetts",NA,"400990098"
109,1,"7:32",1652,"Chris Baldwin Offensive Rebound.",19,18,"UMass Lowell","Massachusetts",NA,"400990098"
110,1,"7:30",1650,"Foul on Obadiah Noel.",19,18,"UMass Lowell","Massachusetts",NA,"400990098"
111,1,"7:30",1650,"Official TV Timeout",19,18,"UMass Lowell","Massachusetts",NA,"400990098"
112,1,"7:30",1650,"Chris Baldwin made Free Throw.",20,18,"UMass Lowell","Massachusetts",NA,"400990098"
113,1,"7:30",1650,"Chris Baldwin made Free Throw.",21,18,"UMass Lowell","Massachusetts",NA,"400990098"
114,1,"7:13",1633,"Connor Bennett missed Layup.",21,18,"UMass Lowell","Massachusetts",NA,"400990098"
115,1,"7:13",1633,"Chris Baldwin Defensive Rebound.",21,18,"UMass Lowell","Massachusetts",NA,"400990098"
116,1,"6:51",1611,"Luwane Pipkins Turnover.",21,18,"UMass Lowell","Massachusetts",NA,"400990098"
117,1,"6:49",1609,"Josh Gantz Steal.",21,18,"UMass Lowell","Massachusetts",NA,"400990098"
118,1,"6:47",1607,"Josh Gantz Turnover.",21,18,"UMass Lowell","Massachusetts",NA,"400990098"
119,1,"6:45",1605,"Carl Pierre Steal.",21,18,"UMass Lowell","Massachusetts",NA,"400990098"
120,1,"6:29",1589,"C.J. Anderson missed Three Point Jumper.",21,18,"UMass Lowell","Massachusetts",NA,"400990098"
121,1,"6:29",1589,"Matt Harris Defensive Rebound.",21,18,"UMass Lowell","Massachusetts",NA,"400990098"
122,1,"6:10",1570,"Shawn Jones missed Jumper.",21,18,"UMass Lowell","Massachusetts",NA,"400990098"
123,1,"6:10",1570,"Chris Baldwin Defensive Rebound.",21,18,"UMass Lowell","Massachusetts",NA,"400990098"
124,1,"5:56",1556,"Chris Baldwin missed Jumper.",21,18,"UMass Lowell","Massachusetts",NA,"400990098"
125,1,"5:56",1556,"Matt Harris Defensive Rebound.",21,18,"UMass Lowell","Massachusetts",NA,"400990098"
126,1,"5:45",1545,"Foul on Obadiah Noel.",21,18,"UMass Lowell","Massachusetts",NA,"400990098"
127,1,"5:45",1545,"Obadiah Noel Turnover.",21,18,"UMass Lowell","Massachusetts",NA,"400990098"
128,1,"5:21",1521,"Malik Hines made Layup. Assisted by Chris Baldwin.",23,18,"UMass Lowell","Massachusetts",NA,"400990098"
129,1,"5:07",1507,"Matt Harris Turnover.",23,18,"UMass Lowell","Massachusetts",NA,"400990098"
130,1,"5:05",1505,"Chris Baldwin Steal.",23,18,"UMass Lowell","Massachusetts",NA,"400990098"
131,1,"5:02",1502,"Carl Pierre Turnover.",23,18,"UMass Lowell","Massachusetts",NA,"400990098"
132,1,"4:59",1499,"Matt Harris Steal.",23,18,"UMass Lowell","Massachusetts",NA,"400990098"
133,1,"4:45",1485,"Josh Gantz made Three Point Jumper. Assisted by Stefan Borovac.",23,21,"UMass Lowell","Massachusetts",NA,"400990098"
134,1,"4:25",1465,"C.J. Anderson made Jumper.",25,21,"UMass Lowell","Massachusetts",NA,"400990098"
135,1,"4:11",1451,"Ryan Jones missed Layup.",25,21,"UMass Lowell","Massachusetts",NA,"400990098"
136,1,"4:11",1451,"Chris Baldwin Defensive Rebound.",25,21,"UMass Lowell","Massachusetts",NA,"400990098"
137,1,"3:50",1430,"Luwane Pipkins Turnover.",25,21,"UMass Lowell","Massachusetts",NA,"400990098"
138,1,"3:48",1428,"Shawn Jones Steal.",25,21,"UMass Lowell","Massachusetts",NA,"400990098"
139,1,"3:46",1426,"Shawn Jones made Layup.",25,23,"UMass Lowell","Massachusetts",NA,"400990098"
140,1,"3:46",1426,"Foul on Luwane Pipkins.",25,23,"UMass Lowell","Massachusetts",NA,"400990098"
141,1,"3:46",1426,"Official TV Timeout",25,23,"UMass Lowell","Massachusetts",NA,"400990098"
142,1,"3:46",1426,"Shawn Jones made Free Throw.",25,24,"UMass Lowell","Massachusetts",NA,"400990098"
143,1,"3:21",1401,"Foul on Malik Hines.",25,24,"UMass Lowell","Massachusetts",NA,"400990098"
144,1,"3:21",1401,"Malik Hines Turnover.",25,24,"UMass Lowell","Massachusetts",NA,"400990098"
145,1,"3:07",1387,"Josh Gantz made Layup. Assisted by Stefan Borovac.",25,26,"UMass Lowell","Massachusetts",NA,"400990098"
146,1,"2:58",1378,"Foul on Shawn Jones.",25,26,"UMass Lowell","Massachusetts",NA,"400990098"
147,1,"2:58",1378,"Luwane Pipkins missed Free Throw.",25,26,"UMass Lowell","Massachusetts",NA,"400990098"
148,1,"2:58",1378,"Ryan Jones Defensive Rebound.",25,26,"UMass Lowell","Massachusetts",NA,"400990098"
149,1,"2:52",1372,"Matt Harris missed Three Point Jumper.",25,26,"UMass Lowell","Massachusetts",NA,"400990098"
150,1,"2:52",1372,"Malik Hines Defensive Rebound.",25,26,"UMass Lowell","Massachusetts",NA,"400990098"
151,1,"2:28",1348,"C.J. Anderson made Jumper.",27,26,"UMass Lowell","Massachusetts",NA,"400990098"
152,1,"2:12",1332,"Stefan Borovac made Layup. Assisted by Ryan Jones.",27,28,"UMass Lowell","Massachusetts",NA,"400990098"
153,1,"2:01",1321,"Luwane Pipkins Turnover.",27,28,"UMass Lowell","Massachusetts",NA,"400990098"
154,1,"1:58",1318,"Matt Harris Steal.",27,28,"UMass Lowell","Massachusetts",NA,"400990098"
155,1,"1:56",1316,"Matt Harris missed Layup.",27,28,"UMass Lowell","Massachusetts",NA,"400990098"
156,1,"1:56",1316,"C.J. Anderson Block.",27,28,"UMass Lowell","Massachusetts",NA,"400990098"
157,1,"1:56",1316,"C.J. Anderson Defensive Rebound.",27,28,"UMass Lowell","Massachusetts",NA,"400990098"
158,1,"1:56",1316,"UMass Lowell  Timeout",27,28,"UMass Lowell","Massachusetts",NA,"400990098"
159,1,"1:29",1289,"Foul on C.J. Anderson.",27,28,"UMass Lowell","Massachusetts",NA,"400990098"
160,1,"1:29",1289,"C.J. Anderson Turnover.",27,28,"UMass Lowell","Massachusetts",NA,"400990098"
161,1,"1:12",1272,"Josh Gantz made Three Point Jumper. Assisted by Stefan Borovac.",27,31,"UMass Lowell","Massachusetts",NA,"400990098"
162,1,"0:38",1238,"Foul on Shawn Jones.",27,31,"UMass Lowell","Massachusetts",NA,"400990098"
163,1,"0:38",1238,"Luwane Pipkins made Free Throw.",28,31,"UMass Lowell","Massachusetts",NA,"400990098"
164,1,"0:38",1238,"Luwane Pipkins missed Free Throw.",28,31,"UMass Lowell","Massachusetts",NA,"400990098"
165,1,"0:38",1238,"UMass Deadball Team Rebound.",28,31,"UMass Lowell","Massachusetts",NA,"400990098"
166,1,"0:38",1238,"Luwane Pipkins made Free Throw.",29,31,"UMass Lowell","Massachusetts",NA,"400990098"
167,1,"0:12",1212,"Matt Harris made Three Point Jumper. Assisted by Stefan Borovac.",29,34,"UMass Lowell","Massachusetts",NA,"400990098"
168,1,"0:03",1203,"Luwane Pipkins missed Three Point Jumper.",29,34,"UMass Lowell","Massachusetts",NA,"400990098"
169,1,"0:03",1203,"Malik Hines Offensive Rebound.",29,34,"UMass Lowell","Massachusetts",NA,"400990098"
170,1,"0:00",1200,"Rayshawn Miller made Three Point Jumper. Assisted by C.J. Anderson.",32,34,"UMass Lowell","Massachusetts",NA,"400990098"
171,1,"0:00",1200,"End of 1st half",32,34,"UMass Lowell","Massachusetts",NA,"400990098"
172,2,"20:00",1200,"PLAY",32,34,"UMass Lowell","Massachusetts",NA,"400990098"
173,2,"19:39",1179,"Ryan Jones missed Three Point Jumper.",32,34,"UMass Lowell","Massachusetts",NA,"400990098"
174,2,"19:39",1179,"Obadiah Noel Offensive Rebound.",32,34,"UMass Lowell","Massachusetts",NA,"400990098"
175,2,"19:35",1175,"Obadiah Noel made Dunk.",32,36,"UMass Lowell","Massachusetts",NA,"400990098"
176,2,"19:19",1159,"Foul on Connor Bennett.",32,36,"UMass Lowell","Massachusetts",NA,"400990098"
177,2,"19:19",1159,"Luwane Pipkins missed Free Throw.",32,36,"UMass Lowell","Massachusetts",NA,"400990098"
178,2,"19:19",1159,"UMass Deadball Team Rebound.",32,36,"UMass Lowell","Massachusetts",NA,"400990098"
179,2,"19:18",1158,"Luwane Pipkins missed Free Throw.",32,36,"UMass Lowell","Massachusetts",NA,"400990098"
180,2,"19:18",1158,"Connor Bennett Defensive Rebound.",32,36,"UMass Lowell","Massachusetts",NA,"400990098"
181,2,"19:03",1143,"Matt Harris missed Jumper.",32,36,"UMass Lowell","Massachusetts",NA,"400990098"
182,2,"19:03",1143,"Unique McLean Defensive Rebound.",32,36,"UMass Lowell","Massachusetts",NA,"400990098"
183,2,"18:56",1136,"Unique McLean made Dunk. Assisted by Luwane Pipkins.",34,36,"UMass Lowell","Massachusetts",NA,"400990098"
184,2,"18:42",1122,"Foul on Chris Baldwin.",34,36,"UMass Lowell","Massachusetts",NA,"400990098"
185,2,"18:21",1101,"UMass Lowell  Turnover.",34,36,"UMass Lowell","Massachusetts",NA,"400990098"
186,2,"17:53",1073,"Malik Hines made Layup. Assisted by Luwane Pipkins.",36,36,"UMass Lowell","Massachusetts",NA,"400990098"
187,2,"17:28",1048,"Foul on Chris Baldwin.",36,36,"UMass Lowell","Massachusetts",NA,"400990098"
188,2,"17:28",1048,"Connor Bennett made Free Throw.",36,37,"UMass Lowell","Massachusetts",NA,"400990098"
189,2,"17:28",1048,"Connor Bennett made Free Throw.",36,38,"UMass Lowell","Massachusetts",NA,"400990098"
190,2,"17:15",1035,"Foul on Obadiah Noel.",36,38,"UMass Lowell","Massachusetts",NA,"400990098"
191,2,"17:15",1035,"Unique McLean made Free Throw.",37,38,"UMass Lowell","Massachusetts",NA,"400990098"
192,2,"17:15",1035,"Unique McLean made Free Throw.",38,38,"UMass Lowell","Massachusetts",NA,"400990098"
193,2,"16:55",1015,"Ryan Jones missed Three Point Jumper.",38,38,"UMass Lowell","Massachusetts",NA,"400990098"
194,2,"16:55",1015,"Malik Hines Defensive Rebound.",38,38,"UMass Lowell","Massachusetts",NA,"400990098"
195,2,"16:33",993,"Luwane Pipkins missed Three Point Jumper.",38,38,"UMass Lowell","Massachusetts",NA,"400990098"
196,2,"16:33",993,"Ryan Jones Defensive Rebound.",38,38,"UMass Lowell","Massachusetts",NA,"400990098"
197,2,"16:21",981,"Foul on Unique McLean.",38,38,"UMass Lowell","Massachusetts",NA,"400990098"
198,2,"16:12",972,"Ryan Jones made Jumper. Assisted by Shawn Jones.",38,40,"UMass Lowell","Massachusetts",NA,"400990098"
199,2,"16:00",960,"Rashaan Holloway missed Layup.",38,40,"UMass Lowell","Massachusetts",NA,"400990098"
200,2,"16:00",960,"Connor Bennett Block.",38,40,"UMass Lowell","Massachusetts",NA,"400990098"
201,2,"15:57",957,"Shawn Jones Defensive Rebound.",38,40,"UMass Lowell","Massachusetts",NA,"400990098"
202,2,"15:44",944,"Matt Harris made Three Point Jumper. Assisted by Connor Bennett.",38,43,"UMass Lowell","Massachusetts",NA,"400990098"
203,2,"15:14",914,"Rayshawn Miller made Layup.",40,43,"UMass Lowell","Massachusetts",NA,"400990098"
204,2,"14:58",898,"Josh Gantz made Layup. Assisted by Matt Harris.",40,45,"UMass Lowell","Massachusetts",NA,"400990098"
205,2,"14:44",884,"Official TV Timeout",40,45,"UMass Lowell","Massachusetts",NA,"400990098"
206,2,"14:25",865,"Foul on Connor Bennett.",40,45,"UMass Lowell","Massachusetts",NA,"400990098"
207,2,"14:25",865,"Rashaan Holloway made Free Throw.",41,45,"UMass Lowell","Massachusetts",NA,"400990098"
208,2,"14:25",865,"Rashaan Holloway made Free Throw.",42,45,"UMass Lowell","Massachusetts",NA,"400990098"
209,2,"13:56",836,"Matt Harris missed Three Point Jumper.",42,45,"UMass Lowell","Massachusetts",NA,"400990098"
210,2,"13:56",836,"Ryan Jones Offensive Rebound.",42,45,"UMass Lowell","Massachusetts",NA,"400990098"
211,2,"13:56",836,"Ryan Jones Turnover.",42,45,"UMass Lowell","Massachusetts",NA,"400990098"
212,2,"13:56",836,"Luwane Pipkins Steal.",42,45,"UMass Lowell","Massachusetts",NA,"400990098"
213,2,"13:56",836,"Foul on Josh Gantz.",42,45,"UMass Lowell","Massachusetts",NA,"400990098"
214,2,"13:56",836,"Unique McLean made Free Throw.",43,45,"UMass Lowell","Massachusetts",NA,"400990098"
215,2,"13:56",836,"Unique McLean made Free Throw.",44,45,"UMass Lowell","Massachusetts",NA,"400990098"
216,2,"13:48",828,"Foul on C.J. Anderson.",44,45,"UMass Lowell","Massachusetts",NA,"400990098"
217,2,"13:48",828,"Stefan Borovac made Free Throw.",44,46,"UMass Lowell","Massachusetts",NA,"400990098"
218,2,"13:48",828,"Stefan Borovac missed Free Throw.",44,46,"UMass Lowell","Massachusetts",NA,"400990098"
219,2,"13:48",828,"Rashaan Holloway Defensive Rebound.",44,46,"UMass Lowell","Massachusetts",NA,"400990098"
220,2,"13:18",798,"Unique McLean made Layup. Assisted by C.J. Anderson.",46,46,"UMass Lowell","Massachusetts",NA,"400990098"
221,2,"12:56",776,"Foul on Stefan Borovac.",46,46,"UMass Lowell","Massachusetts",NA,"400990098"
222,2,"12:56",776,"Stefan Borovac Turnover.",46,46,"UMass Lowell","Massachusetts",NA,"400990098"
223,2,"12:38",758,"Foul on Josh Gantz.",46,46,"UMass Lowell","Massachusetts",NA,"400990098"
224,2,"12:38",758,"Unique McLean missed Free Throw.",46,46,"UMass Lowell","Massachusetts",NA,"400990098"
225,2,"12:38",758,"UMass Deadball Team Rebound.",46,46,"UMass Lowell","Massachusetts",NA,"400990098"
226,2,"12:38",758,"Unique McLean made Free Throw.",47,46,"UMass Lowell","Massachusetts",NA,"400990098"
227,2,"12:05",725,"Josh Gantz missed Layup.",47,46,"UMass Lowell","Massachusetts",NA,"400990098"
228,2,"12:05",725,"Josh Gantz Offensive Rebound.",47,46,"UMass Lowell","Massachusetts",NA,"400990098"
229,2,"12:05",725,"Josh Gantz missed Layup.",47,46,"UMass Lowell","Massachusetts",NA,"400990098"
230,2,"12:05",725,"Rashaan Holloway Block.",47,46,"UMass Lowell","Massachusetts",NA,"400990098"
231,2,"12:05",725,"UMass Lowell Offensive Rebound.",47,46,"UMass Lowell","Massachusetts",NA,"400990098"
232,2,"12:01",721,"Matt Harris Turnover.",47,46,"UMass Lowell","Massachusetts",NA,"400990098"
233,2,"11:42",702,"Official TV Timeout",47,46,"UMass Lowell","Massachusetts",NA,"400990098"
234,2,"11:40",700,"Unique McLean Turnover.",47,46,"UMass Lowell","Massachusetts",NA,"400990098"
235,2,"11:38",698,"Shawn Jones Steal.",47,46,"UMass Lowell","Massachusetts",NA,"400990098"
236,2,"11:27",687,"Shawn Jones missed Layup.",47,46,"UMass Lowell","Massachusetts",NA,"400990098"
237,2,"11:27",687,"C.J. Anderson Block.",47,46,"UMass Lowell","Massachusetts",NA,"400990098"
238,2,"11:23",683,"C.J. Anderson Defensive Rebound.",47,46,"UMass Lowell","Massachusetts",NA,"400990098"
239,2,"11:15",675,"Luwane Pipkins Turnover.",47,46,"UMass Lowell","Massachusetts",NA,"400990098"
240,2,"11:04",664,"Foul on C.J. Anderson.",47,46,"UMass Lowell","Massachusetts",NA,"400990098"
241,2,"11:04",664,"Ryan Jones made Free Throw.",47,47,"UMass Lowell","Massachusetts",NA,"400990098"
242,2,"11:04",664,"Ryan Jones made Free Throw.",47,48,"UMass Lowell","Massachusetts",NA,"400990098"
243,2,"10:42",642,"Luwane Pipkins missed Layup.",47,48,"UMass Lowell","Massachusetts",NA,"400990098"
244,2,"10:42",642,"Josh Gantz Defensive Rebound.",47,48,"UMass Lowell","Massachusetts",NA,"400990098"
245,2,"10:36",636,"Shawn Jones made Jumper. Assisted by Josh Gantz.",47,50,"UMass Lowell","Massachusetts",NA,"400990098"
246,2,"10:03",603,"Luwane Pipkins missed Layup.",47,50,"UMass Lowell","Massachusetts",NA,"400990098"
247,2,"10:03",603,"Stefan Borovac Defensive Rebound.",47,50,"UMass Lowell","Massachusetts",NA,"400990098"
248,2,"9:46",586,"Stefan Borovac Turnover.",47,50,"UMass Lowell","Massachusetts",NA,"400990098"
249,2,"9:46",586,"Rashaan Holloway Steal.",47,50,"UMass Lowell","Massachusetts",NA,"400990098"
250,2,"9:33",573,"Rashaan Holloway made Layup. Assisted by Unique McLean.",49,50,"UMass Lowell","Massachusetts",NA,"400990098"
251,2,"9:17",557,"Matt Harris missed Jumper.",49,50,"UMass Lowell","Massachusetts",NA,"400990098"
252,2,"9:17",557,"Connor Bennett Offensive Rebound.",49,50,"UMass Lowell","Massachusetts",NA,"400990098"
